[I 2026-05-01 22:46:17,375] Trial 45 finished with value: 0.786 and parameters: {'lr': 0.01, 'weight_decay': 0.05, 'n_hidden': 32, 'n_layer': 2, 'dropout': 0.5458138840604686, 'knn_mode': 's', 'k': 19, 'dexp': 6.842710563760904, 'p_grd': 0.13403176766233274, 'unc_rem': 0.6033403421260102, 'unc_rel': 0.11897252006053415}. Best is trial 23 with value: 0.831.
    [CPU] Loading amazonpho...
    DEBUG 3.1: Dataset init start
    DEBUG 3.2: prepare_data start amazonpho
    ----Data statistics------'
    Name: amazonpho
    #Nodes 7650
    #Edges 119081
    #Classes 8
    #Ave_degree 31.13
    ----Split statistics------'
    #Train samples 160 (20 nodes per class)
    #Val samples 500 (specified)
    #Test samples 1000 (specified)
    ----label noise information:------
    Instance dependent noise
    #Actual noise rate 0.50
    [cuda:1] LNPCC waiting for GPU slot...
    [cuda:1] Slot acquired (waited 125.0s). Starting GCN...
    FINAL_RESULT: {'acc': {'train': 0.19753086419753085, 'valid': 0.242, 'test': 0.254}, 'wall_s': 18.28, 'cpu_s': 15.6, 'gpu_s': 2.6, 'wait_s': 125.0}
    [Time] wall=18.3s | cpu=15.6s | gpu=2.6s
    C:\Users\fbrev\Documents\Acadêmico\Simulações\Python\NoisyGL\predictor\Base_Predictor.py:114: UserWarning: expandable_segments not supported on this platform (Triggered internally at ..\c10/cuda/CUDAAllocatorConfig.h:28.)
    self.edge_index = self._cpu_edge_index.to(self.device)
    C:\Users\fbrev\Documents\Acadêmico\Simulações\Python\NoisyGL\predictor\Base_Predictor.py:144: UserWarning: Sparse CSR tensor support is in beta state. If you miss a functionality in the sparse tensor support, please submit a feature request to https://github.com/pytorch/pytorch/issues. (Triggered internally at ..\aten\src\ATen\SparseCsrTensorImpl.cpp:55.)
    self.adj_csr = self.adj.to_sparse_csr().to(self.device)
[I 2026-05-01 22:48:46,955] Trial 46 finished with value: 0.254 and parameters: {'lr': 0.1, 'weight_decay': 0.0, 'n_hidden': 64, 'n_layer': 2, 'dropout': 0.6664219781651979, 'knn_mode': 'd', 'k': 32, 'dexp': 5.99924360781792, 'p_grd': 0.054201390772192215, 'unc_rem': 0.0036704158857386975, 'unc_rel': 0.25388795694414024}. Best is trial 23 with value: 0.831.
    [CPU] Loading amazonpho...
    DEBUG 3.1: Dataset init start
    DEBUG 3.2: prepare_data start amazonpho
    ----Data statistics------'
    Name: amazonpho
    #Nodes 7650
    #Edges 119081
    #Classes 8
    #Ave_degree 31.13
    ----Split statistics------'
    #Train samples 160 (20 nodes per class)
    #Val samples 500 (specified)
    #Test samples 1000 (specified)
    ----label noise information:------
    Instance dependent noise
    #Actual noise rate 0.50
    [cuda:1] LNPCC waiting for GPU slot...
    [cuda:1] Slot acquired (waited 128.9s). Starting GCN...
    FINAL_RESULT: {'acc': {'train': 0.5850340136054422, 'valid': 0.412, 'test': 0.756}, 'wall_s': 17.91, 'cpu_s': 14.48, 'gpu_s': 3.35, 'wait_s': 128.9}
    [Time] wall=17.9s | cpu=14.5s | gpu=3.4s
    C:\Users\fbrev\Documents\Acadêmico\Simulações\Python\NoisyGL\predictor\Base_Predictor.py:114: UserWarning: expandable_segments not supported on this platform (Triggered internally at ..\c10/cuda/CUDAAllocatorConfig.h:28.)
    self.edge_index = self._cpu_edge_index.to(self.device)
    C:\Users\fbrev\Documents\Acadêmico\Simulações\Python\NoisyGL\predictor\Base_Predictor.py:144: UserWarning: Sparse CSR tensor support is in beta state. If you miss a functionality in the sparse tensor support, please submit a feature request to https://github.com/pytorch/pytorch/issues. (Triggered internally at ..\aten\src\ATen\SparseCsrTensorImpl.cpp:55.)
    self.adj_csr = self.adj.to_sparse_csr().to(self.device)
[I 2026-05-01 22:51:20,338] Trial 47 finished with value: 0.756 and parameters: {'lr': 0.005, 'weight_decay': 0.0, 'n_hidden': 128, 'n_layer': 2, 'dropout': 0.7620698993278396, 'knn_mode': 's', 'k': 16, 'dexp': 5.0415971340537356, 'p_grd': 0.2565180939828178, 'unc_rem': 0.10213377992135185, 'unc_rel': 0.19923344385790148}. Best is trial 23 with value: 0.831.
    [CPU] Loading amazonpho...
    DEBUG 3.1: Dataset init start
    DEBUG 3.2: prepare_data start amazonpho
    ----Data statistics------'
    Name: amazonpho
    #Nodes 7650
    #Edges 119081
    #Classes 8
    #Ave_degree 31.13
    ----Split statistics------'
    #Train samples 160 (20 nodes per class)
    #Val samples 500 (specified)
    #Test samples 1000 (specified)
    ----label noise information:------
    Instance dependent noise
    #Actual noise rate 0.50
    [cuda:1] LNPCC waiting for GPU slot...
    [cuda:1] Slot acquired (waited 128.8s). Starting GCN...
    FINAL_RESULT: {'acc': {'train': 0.8046875, 'valid': 0.448, 'test': 0.788}, 'wall_s': 16.06, 'cpu_s': 13.32, 'gpu_s': 2.65, 'wait_s': 128.82}
    [Time] wall=16.1s | cpu=13.3s | gpu=2.6s
    C:\Users\fbrev\Documents\Acadêmico\Simulações\Python\NoisyGL\predictor\Base_Predictor.py:114: UserWarning: expandable_segments not supported on this platform (Triggered internally at ..\c10/cuda/CUDAAllocatorConfig.h:28.)
    self.edge_index = self._cpu_edge_index.to(self.device)
    C:\Users\fbrev\Documents\Acadêmico\Simulações\Python\NoisyGL\predictor\Base_Predictor.py:144: UserWarning: Sparse CSR tensor support is in beta state. If you miss a functionality in the sparse tensor support, please submit a feature request to https://github.com/pytorch/pytorch/issues. (Triggered internally at ..\aten\src\ATen\SparseCsrTensorImpl.cpp:55.)
    self.adj_csr = self.adj.to_sparse_csr().to(self.device)
[I 2026-05-01 22:53:51,707] Trial 48 finished with value: 0.788 and parameters: {'lr': 0.005, 'weight_decay': 0.01, 'n_hidden': 64, 'n_layer': 2, 'dropout': 0.7086299648665171, 'knn_mode': 's', 'k': 39, 'dexp': 7.048204419362564, 'p_grd': 0.1297238932393194, 'unc_rem': 0.16259092614545545, 'unc_rel': 0.04492718870279683}. Best is trial 23 with value: 0.831.
    [CPU] Loading amazonpho...
    DEBUG 3.1: Dataset init start
    DEBUG 3.2: prepare_data start amazonpho
    ----Data statistics------'
    Name: amazonpho
    #Nodes 7650
    #Edges 119081
    #Classes 8
    #Ave_degree 31.13
    ----Split statistics------'
    #Train samples 160 (20 nodes per class)
    #Val samples 500 (specified)
    #Test samples 1000 (specified)
    ----label noise information:------
    Instance dependent noise
    #Actual noise rate 0.50
    [cuda:1] LNPCC waiting for GPU slot...
    [cuda:1] Slot acquired (waited 107.8s). Starting GCN...
    FINAL_RESULT: {'acc': {'train': 0.5343511450381679, 'valid': 0.382, 'test': 0.696}, 'wall_s': 43.52, 'cpu_s': 38.54, 'gpu_s': 4.92, 'wait_s': 107.79}
    [Time] wall=43.5s | cpu=38.5s | gpu=4.9s
    C:\Users\fbrev\Documents\Acadêmico\Simulações\Python\NoisyGL\predictor\Base_Predictor.py:114: UserWarning: expandable_segments not supported on this platform (Triggered internally at ..\c10/cuda/CUDAAllocatorConfig.h:28.)
    self.edge_index = self._cpu_edge_index.to(self.device)
    C:\Users\fbrev\Documents\Acadêmico\Simulações\Python\NoisyGL\predictor\Base_Predictor.py:144: UserWarning: Sparse CSR tensor support is in beta state. If you miss a functionality in the sparse tensor support, please submit a feature request to https://github.com/pytorch/pytorch/issues. (Triggered internally at ..\aten\src\ATen\SparseCsrTensorImpl.cpp:55.)
    self.adj_csr = self.adj.to_sparse_csr().to(self.device)
