[worker] START lnpcc_roman-empire_0.2 gpu=1
[HPO] Starting Phase 1 (Optuna) for lnpcc_roman-empire_instance_0.2...
[I 2026-05-10 17:23:30,629] Using an existing study with name 'lnpcc_roman-empire_instance_0.2' instead of creating a new one.
    [CPU] Loading roman-empire...
    DEBUG 3.1: Dataset init start
    DEBUG 3.2: prepare_data start roman-empire
    ----Data statistics------'
    Name: roman-empire
    #Nodes 22662
    #Edges 32927
    #Classes 18
    #Ave_degree 2.91
    ----Split statistics------'
    #Train samples 1133 (5.0 % of nodes)
    #Val samples 3399 (15.0 % of nodes)
    #Test samples 18130 (remaining)
    ----label noise information:------
    Instance dependent noise
    #Actual noise rate 0.20
    [cuda:1] LNPCC waiting for GPU slot...
    [cuda:1] Slot acquired (waited 0.0s). Starting GCN...
    FINAL_RESULT: {'acc': {'train': 0.28596646072374227, 'valid': 0.2294792586054722, 'test': 0.2621070049641478}, 'wall_s': 447.31, 'cpu_s': 444.47, 'gpu_s': 2.77, 'wait_s': 0.0}
    [Time] wall=447.3s | cpu=444.5s | gpu=2.8s
    C:\Users\fbrev\Documents\Acadêmico\Simulações\Python\NoisyGL\predictor\Base_Predictor.py:114: UserWarning: expandable_segments not supported on this platform (Triggered internally at ..\c10/cuda/CUDAAllocatorConfig.h:28.)
    self.edge_index = self._cpu_edge_index.to(self.device)
    C:\Users\fbrev\Documents\Acadêmico\Simulações\Python\NoisyGL\predictor\Base_Predictor.py:144: UserWarning: Sparse CSR tensor support is in beta state. If you miss a functionality in the sparse tensor support, please submit a feature request to https://github.com/pytorch/pytorch/issues. (Triggered internally at ..\aten\src\ATen\SparseCsrTensorImpl.cpp:55.)
    self.adj_csr = self.adj.to_sparse_csr().to(self.device)
[I 2026-05-10 17:31:05,060] Trial 51 finished with value: 0.2621070049641478 and parameters: {'lr': 0.005, 'weight_decay': 0.001, 'n_hidden': 32, 'n_layer': 3, 'dropout': 0.7550878127524653, 'knn_mode': 'd', 'k': 47, 'dexp': 9.954315537419443, 'p_grd': 0.7761116538626647, 'unc_rem': 0.25770873146909723, 'unc_rel': 0.8670194225448}. Best is trial 31 with value: 0.3947600661886376.
    [CPU] Loading roman-empire...
    DEBUG 3.1: Dataset init start
    DEBUG 3.2: prepare_data start roman-empire
    ----Data statistics------'
    Name: roman-empire
    #Nodes 22662
    #Edges 32927
    #Classes 18
    #Ave_degree 2.91
    ----Split statistics------'
    #Train samples 1133 (5.0 % of nodes)
    #Val samples 3399 (15.0 % of nodes)
    #Test samples 18130 (remaining)
    ----label noise information:------
    Instance dependent noise
    #Actual noise rate 0.20
    [cuda:1] LNPCC waiting for GPU slot...
    [cuda:1] Slot acquired (waited 0.0s). Starting GCN...
    FINAL_RESULT: {'acc': {'train': 0.42188879082082964, 'valid': 0.32215357458075905, 'test': 0.3909542195256481}, 'wall_s': 770.75, 'cpu_s': 768.34, 'gpu_s': 2.37, 'wait_s': 0.0}
    [Time] wall=770.7s | cpu=768.3s | gpu=2.4s
    C:\Users\fbrev\Documents\Acadêmico\Simulações\Python\NoisyGL\predictor\Base_Predictor.py:114: UserWarning: expandable_segments not supported on this platform (Triggered internally at ..\c10/cuda/CUDAAllocatorConfig.h:28.)
    self.edge_index = self._cpu_edge_index.to(self.device)
    C:\Users\fbrev\Documents\Acadêmico\Simulações\Python\NoisyGL\predictor\Base_Predictor.py:144: UserWarning: Sparse CSR tensor support is in beta state. If you miss a functionality in the sparse tensor support, please submit a feature request to https://github.com/pytorch/pytorch/issues. (Triggered internally at ..\aten\src\ATen\SparseCsrTensorImpl.cpp:55.)
    self.adj_csr = self.adj.to_sparse_csr().to(self.device)
[I 2026-05-10 17:44:02,023] Trial 53 finished with value: 0.3909542195256481 and parameters: {'lr': 0.1, 'weight_decay': 0.001, 'n_hidden': 32, 'n_layer': 2, 'dropout': 0.6428398126093213, 'knn_mode': 'd', 'k': 42, 'dexp': 4.152949522974718, 'p_grd': 0.9465891817648194, 'unc_rem': 0.35084784122494117, 'unc_rel': 0.7302588701825281}. Best is trial 52 with value: 0.39509100937672365.
    [CPU] Loading roman-empire...
    DEBUG 3.1: Dataset init start
    DEBUG 3.2: prepare_data start roman-empire
    ----Data statistics------'
    Name: roman-empire
    #Nodes 22662
    #Edges 32927
    #Classes 18
    #Ave_degree 2.91
    ----Split statistics------'
    #Train samples 1133 (5.0 % of nodes)
    #Val samples 3399 (15.0 % of nodes)
    #Test samples 18130 (remaining)
    ----label noise information:------
    Instance dependent noise
    #Actual noise rate 0.20
    [cuda:1] LNPCC waiting for GPU slot...
    [cuda:1] Slot acquired (waited 0.0s). Starting GCN...
    FINAL_RESULT: {'acc': {'train': 0.4535809018567639, 'valid': 0.2862606649014416, 'test': 0.3383342526199669}, 'wall_s': 560.38, 'cpu_s': 558.1, 'gpu_s': 2.24, 'wait_s': 0.0}
    [Time] wall=560.4s | cpu=558.1s | gpu=2.2s
    C:\Users\fbrev\Documents\Acadêmico\Simulações\Python\NoisyGL\predictor\Base_Predictor.py:114: UserWarning: expandable_segments not supported on this platform (Triggered internally at ..\c10/cuda/CUDAAllocatorConfig.h:28.)
    self.edge_index = self._cpu_edge_index.to(self.device)
    C:\Users\fbrev\Documents\Acadêmico\Simulações\Python\NoisyGL\predictor\Base_Predictor.py:144: UserWarning: Sparse CSR tensor support is in beta state. If you miss a functionality in the sparse tensor support, please submit a feature request to https://github.com/pytorch/pytorch/issues. (Triggered internally at ..\aten\src\ATen\SparseCsrTensorImpl.cpp:55.)
    self.adj_csr = self.adj.to_sparse_csr().to(self.device)
[I 2026-05-10 17:53:29,109] Trial 55 finished with value: 0.3383342526199669 and parameters: {'lr': 0.05, 'weight_decay': 0.0, 'n_hidden': 32, 'n_layer': 2, 'dropout': 0.7040083072201405, 'knn_mode': 'd', 'k': 43, 'dexp': 3.0138352409319054, 'p_grd': 0.8601433894320567, 'unc_rem': 0.3152187507551923, 'unc_rel': 0.745479987883808}. Best is trial 52 with value: 0.39509100937672365.
    [CPU] Loading roman-empire...
    DEBUG 3.1: Dataset init start
    DEBUG 3.2: prepare_data start roman-empire
    ----Data statistics------'
    Name: roman-empire
    #Nodes 22662
    #Edges 32927
    #Classes 18
    #Ave_degree 2.91
    ----Split statistics------'
    #Train samples 1133 (5.0 % of nodes)
    #Val samples 3399 (15.0 % of nodes)
    #Test samples 18130 (remaining)
    ----label noise information:------
    Instance dependent noise
    #Actual noise rate 0.20
    [cuda:1] LNPCC waiting for GPU slot...
    [cuda:1] Slot acquired (waited 2.2s). Starting GCN...
    FINAL_RESULT: {'acc': {'train': 0.2409532215357458, 'valid': 0.24771991762283024, 'test': 0.3039161610590182}, 'wall_s': 850.11, 'cpu_s': 847.85, 'gpu_s': 2.21, 'wait_s': 2.18}
    [Time] wall=850.1s | cpu=847.9s | gpu=2.2s
    C:\Users\fbrev\Documents\Acadêmico\Simulações\Python\NoisyGL\predictor\Base_Predictor.py:114: UserWarning: expandable_segments not supported on this platform (Triggered internally at ..\c10/cuda/CUDAAllocatorConfig.h:28.)
    self.edge_index = self._cpu_edge_index.to(self.device)
    C:\Users\fbrev\Documents\Acadêmico\Simulações\Python\NoisyGL\predictor\Base_Predictor.py:144: UserWarning: Sparse CSR tensor support is in beta state. If you miss a functionality in the sparse tensor support, please submit a feature request to https://github.com/pytorch/pytorch/issues. (Triggered internally at ..\aten\src\ATen\SparseCsrTensorImpl.cpp:55.)
    self.adj_csr = self.adj.to_sparse_csr().to(self.device)
[I 2026-05-10 18:07:47,807] Trial 57 finished with value: 0.3039161610590182 and parameters: {'lr': 0.1, 'weight_decay': 0.01, 'n_hidden': 64, 'n_layer': 2, 'dropout': 0.6405581155089676, 'knn_mode': 'd', 'k': 40, 'dexp': 4.459678167316083, 'p_grd': 0.9708759951219459, 'unc_rem': 0.22193542166300623, 'unc_rel': 0.6987907474223687}. Best is trial 52 with value: 0.39509100937672365.
    [CPU] Loading roman-empire...
    DEBUG 3.1: Dataset init start
    DEBUG 3.2: prepare_data start roman-empire
    --    ----Data statistics------'
    Name: roman-empire
    #Nodes 22662
    #Edges 32927
    #Classes 18
    #Ave_degree 2.91
    ----Split statistics------'
    #Train samples 1133 (5.0 % of nodes)
    #Val samples 3399 (15.0 % of nodes)
    #Test samples 18130 (remaining)
    ----label noise information:------
    Instance dependent noise
    #Actual noise rate 0.20
    [cuda:1] LNPCC waiting for GPU slot...
    [cuda:1] Slot acquired (waited 0.0s). Starting GCN...
    FINAL_RESULT: {'acc': {'train': 0.24424778761061947, 'valid': 0.24683730508973228, 'test': 0.30380584666298954}, 'wall_s': 491.08, 'cpu_s': 488.55, 'gpu_s': 2.48, 'wait_s': 0.0}
    [Time] wall=491.1s | cpu=488.6s | gpu=2.5s
    C:\Users\fbrev\Documents\Acadêmico\Simulações\Python\NoisyGL\predictor\Base_Predictor.py:114: UserWarning: expandable_segments not supported on this platform (Triggered internally at ..\c10/cuda/CUDAAllocatorConfig.h:28.)
    self.edge_index = self._cpu_edge_index.to(self.device)
    C:\Users\fbrev\Documents\Acadêmico\Simulações\Python\NoisyGL\predictor\Base_Predictor.py:144: UserWarning: Sparse CSR tensor support is in beta state. If you miss a functionality in the sparse tensor support, please submit a feature request to https://github.com/pytorch/pytorch/issues. (Triggered internally at ..\aten\src\ATen\SparseCsrTensorImpl.cpp:55.)
    self.adj_csr = self.adj.to_sparse_csr().to(self.device)
[I 2026-05-10 18:09:56,321] Trial 58 finished with value: 0.30380584666298954 and parameters: {'lr': 0.1, 'weight_decay': 0.01, 'n_hidden': 64, 'n_layer': 2, 'dropout': 0.59639883973002, 'knn_mode': 'd', 'k': 26, 'dexp': 3.859425651564643, 'p_grd': 0.9126500495283513, 'unc_rem': 0.196532653765612, 'unc_rel': 0.7038353457088068}. Best is trial 52 with value: 0.39509100937672365.
    [CPU] Loading roman-empire...
    DEBUG 3.1: Dataset init start
    DEBUG 3.2: prepare_data start roman    ----D    ----Data statistics------'
    Name: roman-empire
    #Nodes 22662
    #Edges 32927
    #Classes 18
    #Ave_degree 2.91
    ----Split statistics------'
    #Train samples 1133 (5.0 % of nodes)
    #Val samples 3399 (15.0 % of nodes)
    #Test samples 18130 (remaining)
    ----label noise information:------
    Instance dependent noise
    #Actual noise rate 0.20
    [cuda:1] LNPCC waiting for GPU slot...
    [cuda:1] Slot acquired (waited 0.0s). Starting GCN...
    FINAL_RESULT: {'acc': {'train': 0.11032656663724624, 'valid': 0.1426890261841718, 'test': 0.1716492002206288}, 'wall_s': 353.09, 'cpu_s': 350.79, 'gpu_s': 2.25, 'wait_s': 0.0}
    [Time] wall=353.1s | cpu=350.8s | gpu=2.3s
    C:\Users\fbrev\Documents\Acadêmico\Simulações\Python\NoisyGL\predictor\Base_Predictor.py:114: UserWarning: expandable_segments not supported on this platform (Triggered internally at ..\c10/cuda/CUDAAllocatorConfig.h:28.)
    self.edge_index = self._cpu_edge_index.to(self.device)
    C:\Users\fbrev\Documents\Acadêmico\Simulações\Python\NoisyGL\predictor\Base_Predictor.py:144: UserWarning: Sparse CSR tensor support is in beta state. If you miss a functionality in the sparse tensor support, please submit a feature request to https://github.com/pytorch/pytorch/issues. (Triggered internally at ..\aten\src\ATen\SparseCsrTensorImpl.cpp:55.)
    self.adj_csr = self.adj.to_sparse_csr().to(self.device)
[I 2026-05-10 18:15:55,650] Trial 61 finished with value: 0.1716492002206288 and parameters: {'lr': 0.1, 'weight_decay': 0.05, 'n_hidden': 32, 'n_layer': 2, 'dropout': 0.5019681284397961, 'knn_mode': 'd', 'k': 36, 'dexp': 5.9432171752999094, 'p_grd': 0.694798196035399, 'unc_rem': 0.6753494373895755, 'unc_rel': 0.9402264188252487}. Best is trial 52 with value: 0.39509100937672365.
    [CPU] Loading roman-empire...
    DEBUG 3.1: Dataset init start
    DEBUG 3.2: prepare_data start roma    ----Da    ----Data statistics------'
    Name: roman-empire
    #Nodes 22662
    #Edges 32927
    #Classes 18
    #Ave_degree 2.91
    ----Split statistics------'
    #Train samples 1133 (5.0 % of nodes)
    #Val samples 3399 (15.0 % of nodes)
    #Test samples 18130 (remaining)
    ----label noise information:------
    Instance dependent noise
    #Actual noise rate 0.20
    [cuda:1] LNPCC waiting for GPU slot...
    [cuda:1] Slot acquired (waited 0.0s). Starting GCN...
    FINAL_RESULT: {'acc': {'train': 0.39452780229479256, 'valid': 0.31715210355987056, 'test': 0.3865968008825152}, 'wall_s': 842.42, 'cpu_s': 840.17, 'gpu_s': 2.2, 'wait_s': 0.0}
    [Time] wall=842.4s | cpu=840.2s | gpu=2.2s
    C:\Users\fbrev\Documents\Acadêmico\Simulações\Python\NoisyGL\predictor\Base_Predictor.py:114: UserWarning: expandable_segments not supported on this platform (Triggered internally at ..\c10/cuda/CUDAAllocatorConfig.h:28.)
    self.edge_index = self._cpu_edge_index.to(self.device)
    C:\Users\fbrev\Documents\Acadêmico\Simulações\Python\NoisyGL\predictor\Base_Predictor.py:144: UserWarning: Sparse CSR tensor support is in beta state. If you miss a functionality in the sparse tensor support, please submit a feature request to https://github.com/pytorch/pytorch/issues. (Triggered internally at ..\aten\src\ATen\SparseCsrTensorImpl.cpp:55.)
    self.adj_csr = self.adj.to_sparse_csr().to(self.device)
[I 2026-05-10 18:30:04,193] Trial 63 finished with value: 0.3865968008825152 and parameters: {'lr': 0.1, 'weight_decay': 0.001, 'n_hidden': 32, 'n_layer': 2, 'dropout': 0.6786819868908196, 'knn_mode': 'd', 'k': 49, 'dexp': 4.755184153335552, 'p_grd': 0.9519408448622146, 'unc_rem': 0.37219554721222675, 'unc_rel': 0.54554047537754}. Best is trial 52 with value: 0.39509100937672365.
    [CPU] Loading roman-empire...
    DEBUG 3.1: Dataset init start
    DEBUG 3.2: prepare_data start rom    ----Dat    ----Data statistics------'
    Name: roman-empire
    #Nodes 22662
    #Edges 32927
    #Classes 18
    #Ave_degree 2.91
    ----Split statistics------'
    #Train samples 1133 (5.0 % of nodes)
    #Val samples 3399 (15.0 % of nodes)
    #Test samples 18130 (remaining)
    ----label noise information:------
    Instance dependent noise
    #Actual noise rate 0.20
    [cuda:1] LNPCC waiting for GPU slot...
    [cuda:1] Slot acquired (waited 0.0s). Starting GCN...
    FINAL_RESULT: {'acc': {'train': 0.465547703180212, 'valid': 0.323036187113857, 'test': 0.3880860452289024}, 'wall_s': 508.54, 'cpu_s': 506.22, 'gpu_s': 2.28, 'wait_s': 0.0}
    [Time] wall=508.5s | cpu=506.2s | gpu=2.3s
    C:\Users\fbrev\Documents\Acadêmico\Simulações\Python\NoisyGL\predictor\Base_Predictor.py:114: UserWarning: expandable_segments not supported on this platform (Triggered internally at ..\c10/cuda/CUDAAllocatorConfig.h:28.)
    self.edge_index = self._cpu_edge_index.to(self.device)
    C:\Users\fbrev\Documents\Acadêmico\Simulações\Python\NoisyGL\predictor\Base_Predictor.py:144: UserWarning: Sparse CSR tensor support is in beta state. If you miss a functionality in the sparse tensor support, please submit a feature request to https://github.com/pytorch/pytorch/issues. (Triggered internally at ..\aten\src\ATen\SparseCsrTensorImpl.cpp:55.)
    self.adj_csr = self.adj.to_sparse_csr().to(self.device)
[I 2026-05-10 18:38:38,837] Trial 65 finished with value: 0.3880860452289024 and parameters: {'lr': 0.1, 'weight_decay': 0.001, 'n_hidden': 32, 'n_layer': 2, 'dropout': 0.5649578656637038, 'knn_mode': 'd', 'k': 34, 'dexp': 5.313740345600816, 'p_grd': 0.8882842167621704, 'unc_rem': 0.5907438709524604, 'unc_rel': 0.4904702787166461}. Best is trial 52 with value: 0.39509100937672365.
    [CPU] Loading roman-empire...
    DEBUG 3.1: Dataset init start
    DEBUG 3.2: prepare_data start roman-em    --    ----Data statistics------'
    Name: roman-empire
    #Nodes 22662
    #Edges 32927
    #Classes 18
    #Ave_degree 2.91
    ----Split statistics------'
    #Train samples 1133 (5.0 % of nodes)
    #Val samples 3399 (15.0 % of nodes)
    #Test samples 18130 (remaining)
    ----label noise information:------
    Instance dependent noise
    #Actual noise rate 0.20
    [cuda:1] LNPCC waiting for GPU slot...
    [cuda:1] Slot acquired (waited 0.0s). Starting GCN...
[I 2026-05-10 18:40:12,387] Trial 67 finished with value: 0.0 and parameters: {'lr': 0.1, 'weight_decay': 0.001, 'n_hidden': 32, 'n_layer': 3, 'dropout': 0.44391368138132636, 'knn_mode': 's', 'k': 42, 'dexp': 4.281201430274927, 'p_grd': 0.9998808704101707, 'unc_rem': 0.4401855679862925, 'unc_rel': 0.6666320324546335}. Best is trial 52 with value: 0.39509100937672365.
    [CPU] Loading roman-empire...
    DEBUG 3.1: Dataset init start
    DEBUG 3.2: prepare_data start roman-empire
    ----Data statistics------'
    Name: roman-empire
    #Nodes 22662
    #Edges 32927
    #Classes 18
    #Ave_degree 2.91
    ----Split statistics------'
    #Train samples 1133 (5.0 % of nodes)
    #Val samples 3399 (15.0 % of nodes)
    #Test samples 18130 (remaining)
    ----label noise information:------
    Instance dependent noise
    #Actual noise rate 0.20
    [cuda:1] LNPCC waiting for GPU slot...
    [cuda:1] Slot acquired (waited 0.0s). Starting GCN...
    FINAL_RESULT: {'acc': {'train': 0.4439541041482789, 'valid': 0.2815533980582524, 'test': 0.35416436845008276}, 'wall_s': 536.28, 'cpu_s': 532.7, 'gpu_s': 3.53, 'wait_s': 0.0}
    [Time] wall=536.3s | cpu=532.7s | gpu=3.5s
    C:\Users\fbrev\Documents\Acadêmico\Simulações\Python\NoisyGL\predictor\Base_Predictor.py:114: UserWarning: expandable_segments not supported on this platform (Triggered internally at ..\c10/cuda/CUDAAllocatorConfig.h:28.)
    self.edge_index = self._cpu_edge_index.to(self.device)
    C:\Users\fbrev\Documents\Acadêmico\Simulações\Python\NoisyGL\predictor\Base_Predictor.py:144: UserWarning: Sparse CSR tensor support is in beta state. If you miss a functionality in the sparse tensor support, please submit a feature request to https://github.com/pytorch/pytorch/issues. (Triggered internally at ..\aten\src\ATen\SparseCsrTensorImpl.cpp:55.)
    self.adj_csr = self.adj.to_sparse_csr().to(self.device)
[I 2026-05-10 18:49:14,829] Trial 69 finished with value: 0.35416436845008276 and parameters: {'lr': 0.001, 'weight_decay': 0.001, 'n_hidden': 256, 'n_layer': 2, 'dropout': 0.5347103839052194, 'knn_mode': 'd', 'k': 46, 'dexp': 7.833824307228837, 'p_grd': 0.9340371076392704, 'unc_rem': 0.48115204720463506, 'unc_rel': 0.4050237696542547}. Best is trial 52 with value: 0.39509100937672365.
    [CPU] Loading roman-empire...
    DEBUG 3.1: Dataset init start
    DEBUG 3.2: prepare_data start roman-empire
    ----Data statistics------'
    Name: roman-empire
    #Nodes 22662
    #Edges 32927
    #Classes 18
    #Ave_degree 2.91
    ----Split statistics------'
    #Train samples 1133 (5.0 % of nodes)
    #Val samples 3399 (15.0 % of nodes)
    #Test samples 18130 (remaining)
    ----label noise information:------
    Instance dependent noise
    #Actual noise rate 0.20
    [cuda:1] LNPCC waiting for GPU slot...
    [cuda:1] Slot acquired (waited 0.0s). Starting GCN...
    FINAL_RESULT: {'acc': {'train': 0.49557522123893805, 'valid': 0.3192115328037658, 'test': 0.3875896304467733}, 'wall_s': 454.26, 'cpu_s': 451.74, 'gpu_s': 2.48, 'wait_s': 0.0}
    [Time] wall=454.3s | cpu=451.7s | gpu=2.5s
    C:\Users\fbrev\Documents\Acadêmico\Simulações\Python\NoisyGL\predictor\Base_Predictor.py:114: UserWarning: expandable_segments not supported on this platform (Triggered internally at ..\c10/cuda/CUDAAllocatorConfig.h:28.)
    self.edge_index = self._cpu_edge_index.to(self.device)
    C:\Users\fbrev\Documents\Acadêmico\Simulações\Python\NoisyGL\predictor\Base_Predictor.py:144: UserWarning: Sparse CSR tensor support is in beta state. If you miss a functionality in the sparse tensor support, please submit a feature request to https://github.com/pytorch/pytorch/issues. (Triggered internally at ..\aten\src\ATen\SparseCsrTensorImpl.cpp:55.)
    self.adj_csr = self.adj.to_sparse_csr().to(self.device)
