[worker] START lnpcc_blogcatalog_0.4 gpu=1
[HPO] Starting Phase 1 (Optuna) for lnpcc_blogcatalog_instance_0.4...
[I 2026-05-03 20:48:22,905] A new study created in RDB with name: lnpcc_blogcatalog_instance_0.4
    [CPU] Loading blogcatalog...
    DEBUG 3.1: Dataset init start
    DEBUG 3.2: prepare_data start blogcatalog
    ----Data statistics------'
    Name: blogcatalog
    #Nodes 5196
    #Edges 171743
    #Classes 6
    #Ave_degree 66.11
    ----Split statistics------'
    #Train samples 259 (5.0 % of nodes)
    #Val samples 779 (15.0 % of nodes)
    #Test samples 4158 (remaining)
    ----label noise information:------
    Instance dependent noise
    #Actual noise rate 0.40
    [cuda:1] LNPCC waiting for GPU slot...
    [cuda:1] Slot acquired (waited 55.5s). Starting GCN...
    FINAL_RESULT: {'acc': {'train': 0.444015444015444, 'valid': 0.4313222079589217, 'test': 0.639009139009139}, 'wall_s': 27.56, 'cpu_s': 16.19, 'gpu_s': 11.29, 'wait_s': 55.5}
    [Time] wall=27.6s | cpu=16.2s | gpu=11.3s
    C:\Users\fbrev\Documents\Acadêmico\Simulações\Python\NoisyGL\predictor\Base_Predictor.py:114: UserWarning: expandable_segments not supported on this platform (Triggered internally at ..\c10/cuda/CUDAAllocatorConfig.h:28.)
    self.edge_index = self._cpu_edge_index.to(self.device)
    C:\Users\fbrev\Documents\Acadêmico\Simulações\Python\NoisyGL\predictor\Base_Predictor.py:144: UserWarning: Sparse CSR tensor support is in beta state. If you miss a functionality in the sparse tensor support, please submit a feature request to https://github.com/pytorch/pytorch/issues. (Triggered internally at ..\aten\src\ATen\SparseCsrTensorImpl.cpp:55.)
    self.adj_csr = self.adj.to_sparse_csr().to(self.device)
[I 2026-05-03 20:49:50,778] Trial 0 finished with value: 0.639009139009139 and parameters: {'lr': 0.01, 'weight_decay': 0.0001, 'n_hidden': 256, 'n_layer': 3, 'dropout': 0.7423310186926412, 'knn_mode': 's', 'k': 22, 'dexp': 6.549043457768621, 'p_grd': 0.660643336056814, 'unc_rem': 0.4738128842759197, 'unc_rel': 0.5330175031465186}. Best is trial 0 with value: 0.639009139009139.
    [CPU] Loading blogcatalog...
    DEBUG 3.1: Dataset init start
    DEBUG 3.2: prepare_data start blogcatalog
    ----Data statistics------'
    Name: blogcatalog
    #Nodes 5196
    #Edges 171743
    #Classes 6
    #Ave_degree 66.11
    ----Split statistics------'
    #Train samples 259 (5.0 % of nodes)
    #Val samples 779 (15.0 % of nodes)
    #Test samples 4158 (remaining)
    ----label noise information:------
    Instance dependent noise
    #Actual noise rate 0.40
    [cuda:1] LNPCC waiting for GPU slot...
    [cuda:1] Slot acquired (waited 126.9s). Starting GCN...
    FINAL_RESULT: {'acc': {'train': 0.22007722007722008, 'valid': 0.21951219512195122, 'test': 0.24362674362674364}, 'wall_s': 20.74, 'cpu_s': 17.58, 'gpu_s': 3.07, 'wait_s': 126.87}
    [Time] wall=20.7s | cpu=17.6s | gpu=3.1s
    C:\Users\fbrev\Documents\Acadêmico\Simulações\Python\NoisyGL\predictor\Base_Predictor.py:114: UserWarning: expandable_segments not supported on this platform (Triggered internally at ..\c10/cuda/CUDAAllocatorConfig.h:28.)
    self.edge_index = self._cpu_edge_index.to(self.device)
    C:\Users\fbrev\Documents\Acadêmico\Simulações\Python\NoisyGL\predictor\Base_Predictor.py:144: UserWarning: Sparse CSR tensor support is in beta state. If you miss a functionality in the sparse tensor support, please submit a feature request to https://github.com/pytorch/pytorch/issues. (Triggered internally at ..\aten\src\ATen\SparseCsrTensorImpl.cpp:55.)
    self.adj_csr = self.adj.to_sparse_csr().to(self.device)
[I 2026-05-03 20:52:23,010] Trial 1 finished with value: 0.24362674362674364 and parameters: {'lr': 0.005, 'weight_decay': 0.05, 'n_hidden': 32, 'n_layer': 3, 'dropout': 0.07015571555985166, 'knn_mode': 'd', 'k': 8, 'dexp': 9.849369470845739, 'p_grd': 0.478806786720841, 'unc_rem': 0.3038151952343754, 'unc_rel': 0.3631246362119436}. Best is trial 0 with value: 0.639009139009139.
    [CPU] Loading blogcatalog...
    DEBUG 3.1: Dataset init start
    DEBUG 3.2: prepare_data start blogcatalog
    ----Data statistics------'
    Name: blogcatalog
    #Nodes 5196
    #Edges 171743
    #Classes 6
    #Ave_degree 66.11
    ----Split statistics------'
    #Train samples 259 (5.0 % of nodes)
    #Val samples 779 (15.0 % of nodes)
    #Test samples 4158 (remaining)
    ----label noise information:------
    Instance dependent noise
    #Actual noise rate 0.40
    [cuda:1] LNPCC waiting for GPU slot...
    [cuda:1] Slot acquired (waited 65.2s). Starting GCN...
    FINAL_RESULT: {'acc': {'train': 0.48582995951417, 'valid': 0.3119383825417201, 'test': 0.44083694083694086}, 'wall_s': 89.34, 'cpu_s': 82.9, 'gpu_s': 6.36, 'wait_s': 65.2}
    [Time] wall=89.3s | cpu=82.9s | gpu=6.4s
    C:\Users\fbrev\Documents\Acadêmico\Simulações\Python\NoisyGL\predictor\Base_Predictor.py:114: UserWarning: expandable_segments not supported on this platform (Triggered internally at ..\c10/cuda/CUDAAllocatorConfig.h:28.)
    self.edge_index = self._cpu_edge_index.to(self.device)
    C:\Users\fbrev\Documents\Acadêmico\Simulações\Python\NoisyGL\predictor\Base_Predictor.py:144: UserWarning: Sparse CSR tensor support is in beta state. If you miss a functionality in the sparse tensor support, please submit a feature request to https://github.com/pytorch/pytorch/issues. (Triggered internally at ..\aten\src\ATen\SparseCsrTensorImpl.cpp:55.)
    self.adj_csr = self.adj.to_sparse_csr().to(self.device)
[I 2026-05-03 20:55:02,435] Trial 2 finished with value: 0.44083694083694086 and parameters: {'lr': 0.05, 'weight_decay': 0.0, 'n_hidden': 128, 'n_layer': 3, 'dropout': 0.21625436690386757, 'knn_mode': 'd', 'k': 38, 'dexp': 3.874471529407347, 'p_grd': 0.9881400181698377, 'unc_rem': 0.9181621485275245, 'unc_rel': 0.9675166579372851}. Best is trial 0 with value: 0.639009139009139.
    [CPU] Loading blogcatalog...
    DEBUG 3.1: Dataset init start
    DEBUG 3.2: prepare_data start blogcatalog
    ----Data statistics------'
    Name: blogcatalog
    #Nodes 5196
    #Edges 171743
    #Classes 6
    #Ave_degree 66.11
    ----Split statistics------'
    #Train samples 259 (5.0 % of nodes)
    #Val samples 779 (15.0 % of nodes)
    #Test samples 4158 (remaining)
    ----label noise information:------
    Instance dependent noise
    #Actual noise rate 0.40
    [cuda:1] LNPCC waiting for GPU slot...
    [cuda:1] Slot acquired (waited 62.7s). Starting GCN...
    FINAL_RESULT: {'acc': {'train': 0.504, 'valid': 0.42618741976893454, 'test': 0.6320346320346321}, 'wall_s': 25.91, 'cpu_s': 14.66, 'gpu_s': 11.17, 'wait_s': 62.72}
    [Time] wall=25.9s | cpu=14.7s | gpu=11.2s
    C:\Users\fbrev\Documents\Acadêmico\Simulações\Python\NoisyGL\predictor\Base_Predictor.py:114: UserWarning: expandable_segments not supported on this platform (Triggered internally at ..\c10/cuda/CUDAAllocatorConfig.h:28.)
    self.edge_index = self._cpu_edge_index.to(self.device)
    C:\Users\fbrev\Documents\Acadêmico\Simulações\Python\NoisyGL\predictor\Base_Predictor.py:144: UserWarning: Sparse CSR tensor support is in beta state. If you miss a functionality in the sparse tensor support, please submit a feature request to https://github.com/pytorch/pytorch/issues. (Triggered internally at ..\aten\src\ATen\SparseCsrTensorImpl.cpp:55.)
    self.adj_csr = self.adj.to_sparse_csr().to(self.device)
[I 2026-05-03 20:56:35,657] Trial 3 finished with value: 0.6320346320346321 and parameters: {'lr': 0.01, 'weight_decay': 0.0, 'n_hidden': 256, 'n_layer': 3, 'dropout': 0.7679730381544515, 'knn_mode': 's', 'k': 24, 'dexp': 8.3269203648727, 'p_grd': 0.2184998850946086, 'unc_rem': 0.1269280697305547, 'unc_rel': 0.24879210037068566}. Best is trial 0 with value: 0.639009139009139.
    [CPU] Loading blogcatalog...
    DEBUG 3.1: Dataset init start
    DEBUG 3.2: prepare_data start blogcatalog
    ----Data statistics------'
    Name: blogcatalog
    #Nodes 5196
    #Edges 171743
    #Classes 6
    #Ave_degree 66.11
    ----Split statistics------'
    #Train samples 259 (5.0 % of nodes)
    #Val samples 779 (15.0 % of nodes)
    #Test samples 4158 (remaining)
    ----label noise information:------
    Instance dependent noise
    #Actual noise rate 0.40
    [cuda:1] LNPCC waiting for GPU slot...
    [cuda:1] Slot acquired (waited 201.6s). Starting GCN...
    FINAL_RESULT: {'acc': {'train': 0.41203703703703703, 'valid': 0.33889602053915274, 'test': 0.4261664261664262}, 'wall_s': 17.54, 'cpu_s': 14.14, 'gpu_s': 3.33, 'wait_s': 201.57}
    [Time] wall=17.5s | cpu=14.1s | gpu=3.3s
    C:\Users\fbrev\Documents\Acadêmico\Simulações\Python\NoisyGL\predictor\Base_Predictor.py:114: UserWarning: expandable_segments not supported on this platform (Triggered internally at ..\c10/cuda/CUDAAllocatorConfig.h:28.)
    self.edge_index = self._cpu_edge_index.to(self.device)
    C:\Users\fbrev\Documents\Acadêmico\Simulações\Python\NoisyGL\predictor\Base_Predictor.py:144: UserWarning: Sparse CSR tensor support is in beta state. If you miss a functionality in the sparse tensor support, please submit a feature request to https://github.com/pytorch/pytorch/issues. (Triggered internally at ..\aten\src\ATen\SparseCsrTensorImpl.cpp:55.)
    self.adj_csr = self.adj.to_sparse_csr().to(self.device)
[I 2026-05-03 21:00:19,525] Trial 4 finished with value: 0.4261664261664262 and parameters: {'lr': 0.001, 'weight_decay': 0.01, 'n_hidden': 32, 'n_layer': 3, 'dropout': 0.7038458031184676, 'knn_mode': 's', 'k': 9, 'dexp': 2.686398662779987, 'p_grd': 0.260480876024059, 'unc_rem': 0.11716653894410789, 'unc_rel': 0.0855185384292958}. Best is trial 0 with value: 0.639009139009139.
    [CPU] Loading blogcatalog...
    DEBUG 3.1: Dataset init start
    DEBUG 3.2: prepare_data start blogcatalog
    ----Data statistics------'
    Name: blogcatalog
    #Nodes 5196
    #Edges 171743
    #Classes 6
    #Ave_degree 66.11
    ----Split statistics------'
    #Train samples 259 (5.0 % of nodes)
    #Val samples 779 (15.0 % of nodes)
    #Test samples 4158 (remaining)
    ----label noise information:------
    Instance dependent noise
    #Actual noise rate 0.40
    [cuda:1] LNPCC waiting for GPU slot...
    [cuda:1] Slot acquired (waited 127.9s). Starting GCN...
    FINAL_RESULT: {'acc': {'train': 0.4671814671814672, 'valid': 0.43517329910141206, 'test': 0.639009139009139}, 'wall_s': 27.61, 'cpu_s': 16.2, 'gpu_s': 11.33, 'wait_s': 127.91}
    [Time] wall=27.6s | cpu=16.2s | gpu=11.3s
    C:\Users\fbrev\Documents\Acadêmico\Simulações\Python\NoisyGL\predictor\Base_Predictor.py:114: UserWarning: expandable_segments not supported on this platform (Triggered internally at ..\c10/cuda/CUDAAllocatorConfig.h:28.)
    self.edge_index = self._cpu_edge_index.to(self.device)
    C:\Users\fbrev\Documents\Acadêmico\Simulações\Python\NoisyGL\predictor\Base_Predictor.py:144: UserWarning: Sparse CSR tensor support is in beta state. If you miss a functionality in the sparse tensor support, please submit a feature request to https://github.com/pytorch/pytorch/issues. (Triggered internally at ..\aten\src\ATen\SparseCsrTensorImpl.cpp:55.)
    self.adj_csr = self.adj.to_sparse_csr().to(self.device)
[I 2026-05-03 21:03:00,682] Trial 5 finished with value: 0.639009139009139 and parameters: {'lr': 0.005, 'weight_decay': 0.001, 'n_hidden': 256, 'n_layer': 3, 'dropout': 0.5081407678113709, 'knn_mode': 's', 'k': 6, 'dexp': 8.201233283460219, 'p_grd': 0.7144216630336351, 'unc_rem': 0.6840438102211569, 'unc_rel': 0.7616068797550649}. Best is trial 0 with value: 0.639009139009139.
    [CPU] Loading blogcatalog...
    DEBUG 3.1: Dataset init start
    DEBUG 3.2: prepare_data start blogcatalog
    ----Data statistics------'
    Name: blogcatalog
    #Nodes 5196
    #Edges 171743
    #Classes 6
    #Ave_degree 66.11
    ----Split statistics------'
    #Train samples 259 (5.0 % of nodes)
    #Val samples 779 (15.0 % of nodes)
    #Test samples 4158 (remaining)
    ----label noise information:------
    Instance dependent noise
    #Actual noise rate 0.40
    [cuda:1] LNPCC waiting for GPU slot...
    [cuda:1] Slot acquired (waited 52.9s). Starting GCN...
    FINAL_RESULT: {'acc': {'train': 0.68, 'valid': 0.2682926829268293, 'test': 0.3566618566618567}, 'wall_s': 21.1, 'cpu_s': 14.74, 'gpu_s': 6.29, 'wait_s': 52.9}
    [Time] wall=21.1s | cpu=14.7s | gpu=6.3s
    C:\Users\fbrev\Documents\Acadêmico\Simulações\Python\NoisyGL\predictor\Base_Predictor.py:114: UserWarning: expandable_segments not supported on this platform (Triggered internally at ..\c10/cuda/CUDAAllocatorConfig.h:28.)
    self.edge_index = self._cpu_edge_index.to(self.device)
    C:\Users\fbrev\Documents\Acadêmico\Simulações\Python\NoisyGL\predictor\Base_Predictor.py:144: UserWarning: Sparse CSR tensor support is in beta state. If you miss a functionality in the sparse tensor support, please submit a feature request to https://github.com/pytorch/pytorch/issues. (Triggered internally at ..\aten\src\ATen\SparseCsrTensorImpl.cpp:55.)
    self.adj_csr = self.adj.to_sparse_csr().to(self.device)
[I 2026-05-03 21:04:19,677] Trial 6 finished with value: 0.3566618566618567 and parameters: {'lr': 0.05, 'weight_decay': 0.001, 'n_hidden': 128, 'n_layer': 3, 'dropout': 0.7020473327625294, 'knn_mode': 'd', 'k': 15, 'dexp': 0.5878486504011348, 'p_grd': 0.011335731587640785, 'unc_rem': 0.5858998350477302, 'unc_rel': 0.7226749298158259}. Best is trial 0 with value: 0.639009139009139.
    [CPU] Loading blogcatalog...
    DEBUG 3.1: Dataset init start
    DEBUG 3.2: prepare_data start blogcatalog
    ----Data statistics------'
    Name: blogcatalog
    #Nodes 5196
    #Edges 171743
    #Classes 6
    #Ave_degree 66.11
    ----Split statistics------'
    #Train samples 259 (5.0 % of nodes)
    #Val samples 779 (15.0 % of nodes)
    #Test samples 4158 (remaining)
    ----label noise information:------
    Instance dependent noise
    #Actual noise rate 0.40
    [cuda:1] LNPCC waiting for GPU slot...
    [cuda:1] Slot acquired (waited 124.7s). Starting GCN...
    FINAL_RESULT: {'acc': {'train': 0.5214007782101168, 'valid': 0.4621309370988447, 'test': 0.6986531986531986}, 'wall_s': 17.78, 'cpu_s': 14.44, 'gpu_s': 3.26, 'wait_s': 124.73}
    [Time] wall=17.8s | cpu=14.4s | gpu=3.3s
    C:\Users\fbrev\Documents\Acadêmico\Simulações\Python\NoisyGL\predictor\Base_Predictor.py:114: UserWarning: expandable_segments not supported on this platform (Triggered internally at ..\c10/cuda/CUDAAllocatorConfig.h:28.)
    self.edge_index = self._cpu_edge_index.to(self.device)
    C:\Users\fbrev\Documents\Acadêmico\Simulações\Python\NoisyGL\predictor\Base_Predictor.py:144: UserWarning: Sparse CSR tensor support is in beta state. If you miss a functionality in the sparse tensor support, please submit a feature request to https://github.com/pytorch/pytorch/issues. (Triggered internally at ..\aten\src\ATen\SparseCsrTensorImpl.cpp:55.)
    self.adj_csr = self.adj.to_sparse_csr().to(self.device)
[I 2026-05-03 21:06:47,161] Trial 7 finished with value: 0.6986531986531986 and parameters: {'lr': 0.005, 'weight_decay': 0.001, 'n_hidden': 64, 'n_layer': 2, 'dropout': 0.6564195734694973, 'knn_mode': 's', 'k': 7, 'dexp': 7.467726416853233, 'p_grd': 0.32445350005580476, 'unc_rem': 0.16404940716158267, 'unc_rel': 0.28013196087250636}. Best is trial 7 with value: 0.6986531986531986.
    [CPU] Loading blogcatalog...
    DEBUG 3.1: Dataset init start
    DEBUG 3.2: prepare_data start blogcatalog
    ----Data statistics------'
    Name: blogcatalog
    #Nodes 5196
    #Edges 171743
    #Classes 6
    #Ave_degree 66.11
    ----Split statistics------'
    #Train samples 259 (5.0 % of nodes)
    #Val samples 779 (15.0 % of nodes)
    #Test samples 4158 (remaining)
    ----label noise information:------
    Instance dependent noise
    #Actual noise rate 0.40
    [cuda:1] LNPCC waiting for GPU slot...
    [cuda:1] Slot acquired (waited 185.3s). Starting GCN...
    FINAL_RESULT: {'acc': {'train': 0.4864864864864865, 'valid': 0.45699614890885754, 'test': 0.7003367003367004}, 'wall_s': 40.17, 'cpu_s': 32.96, 'gpu_s': 7.13, 'wait_s': 185.32}
    [Time] wall=40.2s | cpu=33.0s | gpu=7.1s
    C:\Users\fbrev\Documents\Acadêmico\Simulações\Python\NoisyGL\predictor\Base_Predictor.py:114: UserWarning: expandable_segments not supported on this platform (Triggered internally at ..\c10/cuda/CUDAAllocatorConfig.h:28.)
    self.edge_index = self._cpu_edge_index.to(self.device)
    C:\Users\fbrev\Documents\Acadêmico\Simulações\Python\NoisyGL\predictor\Base_Predictor.py:144: UserWarning: Sparse CSR tensor support is in beta state. If you miss a functionality in the sparse tensor support, please submit a feature request to https://github.com/pytorch/pytorch/issues. (Triggered internally at ..\aten\src\ATen\SparseCsrTensorImpl.cpp:55.)
    self.adj_csr = self.adj.to_sparse_csr().to(self.device)
[I 2026-05-03 21:10:38,021] Trial 8 finished with value: 0.7003367003367004 and parameters: {'lr': 0.01, 'weight_decay': 0.001, 'n_hidden': 256, 'n_layer': 2, 'dropout': 0.3294390530051932, 'knn_mode': 'd', 'k': 49, 'dexp': 9.06038712732777, 'p_grd': 0.8773552621619033, 'unc_rem': 0.897822936218505, 'unc_rel': 0.3722181582772752}. Best is trial 8 with value: 0.7003367003367004.
    [CPU] Loading blogcatalog...
    DEBUG 3.1: Dataset init start
    DEBUG 3.2: prepare_data start blogcatalog
    ----Data statistics------'
    Name: blogcatalog
    #Nodes 5196
    #Edges 171743
    #Classes 6
    #Ave_degree 66.11
    ----Split statistics------'
    #Train samples 259 (5.0 % of nodes)
    #Val samples 779 (15.0 % of nodes)
    #Test samples 4158 (remaining)
    ----label noise information:------
    Instance dependent noise
    #Actual noise rate 0.40
    [cuda:1] LNPCC waiting for GPU slot...
    [cuda:1] Slot acquired (waited 131.6s). Starting GCN...
    FINAL_RESULT: {'acc': {'train': 0.1953125, 'valid': 0.21437740693196405, 'test': 0.24482924482924484}, 'wall_s': 22.54, 'cpu_s': 16.07, 'gpu_s': 6.39, 'wait_s': 131.65}
    [Time] wall=22.5s | cpu=16.1s | gpu=6.4s
    C:\Users\fbrev\Documents\Acadêmico\Simulações\Python\NoisyGL\predictor\Base_Predictor.py:114: UserWarning: expandable_segments not supported on this platform (Triggered internally at ..\c10/cuda/CUDAAllocatorConfig.h:28.)
    self.edge_index = self._cpu_edge_index.to(self.device)
    C:\Users\fbrev\Documents\Acadêmico\Simulações\Python\NoisyGL\predictor\Base_Predictor.py:144: UserWarning: Sparse CSR tensor support is in beta state. If you miss a functionality in the sparse tensor support, please submit a feature request to https://github.com/pytorch/pytorch/issues. (Triggered internally at ..\aten\src\ATen\SparseCsrTensorImpl.cpp:55.)
    self.adj_csr = self.adj.to_sparse_csr().to(self.device)
[I 2026-05-03 21:13:17,086] Trial 9 finished with value: 0.24482924482924484 and parameters: {'lr': 0.005, 'weight_decay': 0.05, 'n_hidden': 128, 'n_layer': 3, 'dropout': 0.773886541698701, 'knn_mode': 's', 'k': 18, 'dexp': 8.269728185343707, 'p_grd': 0.2593333173174225, 'unc_rem': 0.40038097716656995, 'unc_rel': 0.6395700032731858}. Best is trial 8 with value: 0.7003367003367004.
    [CPU] Loading blogcatalog...
    DEBUG 3.1: Dataset init start
    DEBUG 3.2: prepare_data start blogcatalog
    ----Data statistics------'
    Name: blogcatalog
    #Nodes 5196
    #Edges 171743
    #Classes 6
    #Ave_degree 66.11
    ----Split statistics------'
    #Train samples 259 (5.0 % of nodes)
    #Val samples 779 (15.0 % of nodes)
    #Test samples 4158 (remaining)
    ----label noise information:------
    Instance dependent noise
    #Actual noise rate 0.40
    [cuda:1] LNPCC waiting for GPU slot...
    [cuda:1] Slot acquired (waited 52.1s). Starting GCN...
    FINAL_RESULT: {'acc': {'train': 0.47843137254901963, 'valid': 0.4428754813863928, 'test': 0.6645021645021645}, 'wall_s': 19.74, 'cpu_s': 15.4, 'gpu_s': 4.25, 'wait_s': 52.14}
    [Time] wall=19.7s | cpu=15.4s | gpu=4.3s
    C:\Users\fbrev\Documents\Acadêmico\Simulações\Python\NoisyGL\predictor\Base_Predictor.py:114: UserWarning: expandable_segments not supported on this platform (Triggered internally at ..\c10/cuda/CUDAAllocatorConfig.h:28.)
    self.edge_index = self._cpu_edge_index.to(self.device)
    C:\Users\fbrev\Documents\Acadêmico\Simulações\Python\NoisyGL\predictor\Base_Predictor.py:144: UserWarning: Sparse CSR tensor support is in beta state. If you miss a functionality in the sparse tensor support, please submit a feature request to https://github.com/pytorch/pytorch/issues. (Triggered internally at ..\aten\src\ATen\SparseCsrTensorImpl.cpp:55.)
    self.adj_csr = self.adj.to_sparse_csr().to(self.device)
