[I 2026-05-08 03:25:18,647] Trial 49 finished with value: 0.754 and parameters: {'lr': 0.01, 'weight_decay': 0.0001, 'n_hidden': 32, 'n_layer': 2, 'dropout': 0.5040174744700376, 'knn_mode': 's', 'k': 48, 'dexp': 7.834222002597402, 'p_grd': 0.996628951157536, 'unc_rem': 0.6993986887324549, 'unc_rel': 0.673787544935903}. Best is trial 48 with value: 0.786.

[Retest] Phase 1 Finished. Validating Top 3 (10 runs each)...

  [Retest] Candidate 1/3 (Trial 48, HPO_acc=0.7860)
    [CPU] Loading cora...
    DEBUG 3.1: Dataset init start
    DEBUG 3.2: prepare_data start cora
    ----Data statistics------'
    Name: cora
    #Nodes 2708
    #Edges 5278
    #Classes 7
    #Ave_degree 3.90
    ----Split statistics------'
    #Train samples 140 (default)
    #Val samples 500 (default)
    #Test samples 1000 (default)
    ----label noise information:------
    Instance dependent noise
    #Actual noise rate 0.21
    [cuda:1] LNPCC waiting for GPU slot...
    [cuda:1] Slot acquired (waited 0.1s). Starting GCN...
    FINAL_RESULT: {'acc': {'train': 0.9, 'valid': 0.614, 'test': 0.787}, 'wall_s': 9.73, 'cpu_s': 7.61, 'gpu_s': 2.08, 'wait_s': 0.1}
    [Time] wall=9.7s | cpu=7.6s | gpu=2.1s
    C:\Users\fbrev\Documents\Acadêmico\Simulações\Python\NoisyGL\predictor\Base_Predictor.py:114: UserWarning: expandable_segments not supported on this platform (Triggered internally at ..\c10/cuda/CUDAAllocatorConfig.h:28.)
    self.edge_index = self._cpu_edge_index.to(self.device)
    C:\Users\fbrev\Documents\Acadêmico\Simulações\Python\NoisyGL\predictor\Base_Predictor.py:144: UserWarning: Sparse CSR tensor support is in beta state. If you miss a functionality in the sparse tensor support, please submit a feature request to https://github.com/pytorch/pytorch/issues. (Triggered internally at ..\aten\src\ATen\SparseCsrTensorImpl.cpp:55.)
    self.adj_csr = self.adj.to_sparse_csr().to(self.device)
    [CPU] Loading cora...
    DEBUG 3.1: Dataset init start
    DEBUG 3.2: prepare_data start cora
    ----Data statistics------'
    Name: cora
    #Nodes 2708
    #Edges 5278
    #Classes 7
    #Ave_degree 3.90
    ----Split statistics------'
    #Train samples 140 (default)
    #Val samples 500 (default)
    #Test samples 1000 (default)
    ----label noise information:------
    Instance dependent noise
    #Actual noise rate 0.20
    [cuda:1] LNPCC waiting for GPU slot...
    [cuda:1] Slot acquired (waited 0.0s). Starting GCN...
    FINAL_RESULT: {'acc': {'train': 0.8714285714285714, 'valid': 0.602, 'test': 0.789}, 'wall_s': 9.92, 'cpu_s': 8.07, 'gpu_s': 1.82, 'wait_s': 0.0}
    [Time] wall=9.9s | cpu=8.1s | gpu=1.8s
    C:\Users\fbrev\Documents\Acadêmico\Simulações\Python\NoisyGL\predictor\Base_Predictor.py:114: UserWarning: expandable_segments not supported on this platform (Triggered internally at ..\c10/cuda/CUDAAllocatorConfig.h:28.)
    self.edge_index = self._cpu_edge_index.to(self.device)
    C:\Users\fbrev\Documents\Acadêmico\Simulações\Python\NoisyGL\predictor\Base_Predictor.py:144: UserWarning: Sparse CSR tensor support is in beta state. If you miss a functionality in the sparse tensor support, please submit a feature request to https://github.com/pytorch/pytorch/issues. (Triggered internally at ..\aten\src\ATen\SparseCsrTensorImpl.cpp:55.)
    self.adj_csr = self.adj.to_sparse_csr().to(self.device)
    [CPU] Loading cora...
    DEBUG 3.1: Dataset init start
    DEBUG 3.2: prepare_data start cora
    ----Data statistics------'
    Name: cora
    #Nodes 2708
    #Edges 5278
    #Classes 7
    #Ave_degree 3.90
    ----Split statistics------'
    #Train samples 140 (default)
    #Val samples 500 (default)
    #Test samples 1000 (default)
    ----label noise information:------
    Instance dependent noise
    #Actual noise rate 0.20
    [cuda:1] LNPCC waiting for GPU slot...
    [cuda:1] Slot acquired (waited 0.2s). Starting GCN...
    FINAL_RESULT: {'acc': {'train': 0.9, 'valid': 0.618, 'test': 0.803}, 'wall_s': 9.83, 'cpu_s': 7.99, 'gpu_s': 1.8, 'wait_s': 0.15}
    [Time] wall=9.8s | cpu=8.0s | gpu=1.8s
    C:\Users\fbrev\Documents\Acadêmico\Simulações\Python\NoisyGL\predictor\Base_Predictor.py:114: UserWarning: expandable_segments not supported on this platform (Triggered internally at ..\c10/cuda/CUDAAllocatorConfig.h:28.)
    self.edge_index = self._cpu_edge_index.to(self.device)
    C:\Users\fbrev\Documents\Acadêmico\Simulações\Python\NoisyGL\predictor\Base_Predictor.py:144: UserWarning: Sparse CSR tensor support is in beta state. If you miss a functionality in the sparse tensor support, please submit a feature request to https://github.com/pytorch/pytorch/issues. (Triggered internally at ..\aten\src\ATen\SparseCsrTensorImpl.cpp:55.)
    self.adj_csr = self.adj.to_sparse_csr().to(self.device)
    [CPU] Loading cora...
    DEBUG 3.1: Dataset init start
    DEBUG 3.2: prepare_data start cora
    ----Data statistics------'
    Name: cora
    #Nodes 2708
    #Edges 5278
    #Classes 7
    #Ave_degree 3.90
    ----Split statistics------'
    #Train samples 140 (default)
    #Val samples 500 (default)
    #Test samples 1000 (default)
    ----label noise information:------
    Instance dependent noise
    #Actual noise rate 0.20
    [cuda:1] LNPCC waiting for GPU slot...
    [cuda:1] Slot acquired (waited 1.0s). Starting GCN...
    FINAL_RESULT: {'acc': {'train': 0.8642857142857143, 'valid': 0.63, 'test': 0.753}, 'wall_s': 9.81, 'cpu_s': 7.66, 'gpu_s': 2.1, 'wait_s': 1.01}
    [Time] wall=9.8s | cpu=7.7s | gpu=2.1s
    C:\Users\fbrev\Documents\Acadêmico\Simulações\Python\NoisyGL\predictor\Base_Predictor.py:114: UserWarning: expandable_segments not supported on this platform (Triggered internally at ..\c10/cuda/CUDAAllocatorConfig.h:28.)
    self.edge_index = self._cpu_edge_index.to(self.device)
    C:\Users\fbrev\Documents\Acadêmico\Simulações\Python\NoisyGL\predictor\Base_Predictor.py:144: UserWarning: Sparse CSR tensor support is in beta state. If you miss a functionality in the sparse tensor support, please submit a feature request to https://github.com/pytorch/pytorch/issues. (Triggered internally at ..\aten\src\ATen\SparseCsrTensorImpl.cpp:55.)
    self.adj_csr = self.adj.to_sparse_csr().to(self.device)
    [CPU] Loading cora...
    DEBUG 3.1: Dataset init start
    DEBUG 3.2: prepare_data start cora
    ----Data statistics------'
    Name: cora
    #Nodes 2708
    #Edges 5278
    #Classes 7
    #Ave_degree 3.90
    ----Split statistics------'
    #Train samples 140 (default)
    #Val samples 500 (default)
    #Test samples 1000 (default)
    ----label noise information:------
    Instance dependent noise
    #Actual noise rate 0.21
    [cuda:1] LNPCC waiting for GPU slot...
    [cuda:1] Slot acquired (waited 0.4s). Starting GCN...
    FINAL_RESULT: {'acc': {'train': 0.8357142857142857, 'valid': 0.636, 'test': 0.8}, 'wall_s': 10.1, 'cpu_s': 7.93, 'gpu_s': 2.12, 'wait_s': 0.41}
    [Time] wall=10.1s | cpu=7.9s | gpu=2.1s
    C:\Users\fbrev\Documents\Acadêmico\Simulações\Python\NoisyGL\predictor\Base_Predictor.py:114: UserWarning: expandable_segments not supported on this platform (Triggered internally at ..\c10/cuda/CUDAAllocatorConfig.h:28.)
    self.edge_index = self._cpu_edge_index.to(self.device)
    C:\Users\fbrev\Documents\Acadêmico\Simulações\Python\NoisyGL\predictor\Base_Predictor.py:144: UserWarning: Sparse CSR tensor support is in beta state. If you miss a functionality in the sparse tensor support, please submit a feature request to https://github.com/pytorch/pytorch/issues. (Triggered internally at ..\aten\src\ATen\SparseCsrTensorImpl.cpp:55.)
    self.adj_csr = self.adj.to_sparse_csr().to(self.device)
    [CPU] Loading cora...
    DEBUG 3.1: Dataset init start
    DEBUG 3.2: prepare_data start cora
    ----Data statistics------'
    Name: cora
    #Nodes 2708
    #Edges 5278
    #Classes 7
    #Ave_degree 3.90
    ----Split statistics------'
    #Train samples 140 (default)
    #Val samples 500 (default)
    #Test samples 1000 (default)
    ----label noise information:------
    Instance dependent noise
    #Actual noise rate 0.22
    [cuda:1] LNPCC waiting for GPU slot...
    [cuda:1] Slot acquired (waited 0.2s). Starting GCN...
    FINAL_RESULT: {'acc': {'train': 0.85, 'valid': 0.594, 'test': 0.762}, 'wall_s': 9.71, 'cpu_s': 7.68, 'gpu_s': 1.99, 'wait_s': 0.2}
    [Time] wall=9.7s | cpu=7.7s | gpu=2.0s
    C:\Users\fbrev\Documents\Acadêmico\Simulações\Python\NoisyGL\predictor\Base_Predictor.py:114: UserWarning: expandable_segments not supported on this platform (Triggered internally at ..\c10/cuda/CUDAAllocatorConfig.h:28.)
    self.edge_index = self._cpu_edge_index.to(self.device)
    C:\Users\fbrev\Documents\Acadêmico\Simulações\Python\NoisyGL\predictor\Base_Predictor.py:144: UserWarning: Sparse CSR tensor support is in beta state. If you miss a functionality in the sparse tensor support, please submit a feature request to https://github.com/pytorch/pytorch/issues. (Triggered internally at ..\aten\src\ATen\SparseCsrTensorImpl.cpp:55.)
    self.adj_csr = self.adj.to_sparse_csr().to(self.device)
    [CPU] Loading cora...
    DEBUG 3.1: Dataset init start
    DEBUG 3.2: prepare_data start cora
    ----Data statistics------'
    Name: cora
    #Nodes 2708
    #Edges 5278
    #Classes 7
    #Ave_degree 3.90
    ----Split statistics------'
    #Train samples 140 (default)
    #Val samples 500 (default)
    #Test samples 1000 (default)
    ----label noise information:------
    Instance dependent noise
    #Actual noise rate 0.21
    [cuda:1] LNPCC waiting for GPU slot...
    [cuda:1] Slot acquired (waited 0.0s). Starting GCN...
    FINAL_RESULT: {'acc': {'train': 0.9071428571428571, 'valid': 0.536, 'test': 0.733}, 'wall_s': 9.32, 'cpu_s': 7.42, 'gpu_s': 1.87, 'wait_s': 0.0}
    [Time] wall=9.3s | cpu=7.4s | gpu=1.9s
    C:\Users\fbrev\Documents\Acadêmico\Simulações\Python\NoisyGL\predictor\Base_Predictor.py:114: UserWarning: expandable_segments not supported on this platform (Triggered internally at ..\c10/cuda/CUDAAllocatorConfig.h:28.)
    self.edge_index = self._cpu_edge_index.to(self.device)
    C:\Users\fbrev\Documents\Acadêmico\Simulações\Python\NoisyGL\predictor\Base_Predictor.py:144: UserWarning: Sparse CSR tensor support is in beta state. If you miss a functionality in the sparse tensor support, please submit a feature request to https://github.com/pytorch/pytorch/issues. (Triggered internally at ..\aten\src\ATen\SparseCsrTensorImpl.cpp:55.)
    self.adj_csr = self.adj.to_sparse_csr().to(self.device)
    [CPU] Loading cora...
    DEBUG 3.1: Dataset init start
    DEBUG 3.2: prepare_data start cora
    ----Data statistics------'
    Name: cora
    #Nodes 2708
    #Edges 5278
    #Classes 7
    #Ave_degree 3.90
    ----Split statistics------'
    #Train samples 140 (default)
    #Val samples 500 (default)
    #Test samples 1000 (default)
    ----label noise information:------
    Instance dependent noise
    #Actual noise rate 0.21
    [cuda:1] LNPCC waiting for GPU slot...
    [cuda:1] Slot acquired (waited 0.0s). Starting GCN...
    FINAL_RESULT: {'acc': {'train': 0.9, 'valid': 0.566, 'test': 0.71}, 'wall_s': 10.04, 'cpu_s': 8.01, 'gpu_s': 2.0, 'wait_s': 0.0}
    [Time] wall=10.0s | cpu=8.0s | gpu=2.0s
    C:\Users\fbrev\Documents\Acadêmico\Simulações\Python\NoisyGL\predictor\Base_Predictor.py:114: UserWarning: expandable_segments not supported on this platform (Triggered internally at ..\c10/cuda/CUDAAllocatorConfig.h:28.)
    self.edge_index = self._cpu_edge_index.to(self.device)
    C:\Users\fbrev\Documents\Acadêmico\Simulações\Python\NoisyGL\predictor\Base_Predictor.py:144: UserWarning: Sparse CSR tensor support is in beta state. If you miss a functionality in the sparse tensor support, please submit a feature request to https://github.com/pytorch/pytorch/issues. (Triggered internally at ..\aten\src\ATen\SparseCsrTensorImpl.cpp:55.)
    self.adj_csr = self.adj.to_sparse_csr().to(self.device)
    [CPU] Loading cora...
    DEBUG 3.1: Dataset init start
    DEBUG 3.2: prepare_data start cora
    ----Data statistics------'
    Name: cora
    #Nodes 2708
    #Edges 5278
    #Classes 7
    #Ave_degree 3.90
    ----Split statistics------'
    #Train samples 140 (default)
    #Val samples 500 (default)
    #Test samples 1000 (default)
    ----label noise information:------
    Instance dependent noise
    #Actual noise rate 0.22
    [cuda:1] LNPCC waiting for GPU slot...
    [cuda:1] Slot acquired (waited 0.0s). Starting GCN...
    FINAL_RESULT: {'acc': {'train': 0.8357142857142857, 'valid': 0.59, 'test': 0.75}, 'wall_s': 9.38, 'cpu_s': 7.5, 'gpu_s': 1.85, 'wait_s': 0.0}
    [Time] wall=9.4s | cpu=7.5s | gpu=1.8s
    C:\Users\fbrev\Documents\Acadêmico\Simulações\Python\NoisyGL\predictor\Base_Predictor.py:114: UserWarning: expandable_segments not supported on this platform (Triggered internally at ..\c10/cuda/CUDAAllocatorConfig.h:28.)
    self.edge_index = self._cpu_edge_index.to(self.device)
    C:\Users\fbrev\Documents\Acadêmico\Simulações\Python\NoisyGL\predictor\Base_Predictor.py:144: UserWarning: Sparse CSR tensor support is in beta state. If you miss a functionality in the sparse tensor support, please submit a feature request to https://github.com/pytorch/pytorch/issues. (Triggered internally at ..\aten\src\ATen\SparseCsrTensorImpl.cpp:55.)
    self.adj_csr = self.adj.to_sparse_csr().to(self.device)
    [CPU] Loading cora...
    DEBUG 3.1: Dataset init start
    DEBUG 3.2: prepare_data start cora
    ----Data statistics------'
    Name: cora
    #Nodes 2708
    #Edges 5278
    #Classes 7
    #Ave_degree 3.90
    ----Split statistics------'
    #Train samples 140 (default)
    #Val samples 500 (default)
    #Test samples 1000 (default)
    ----label noise information:------
    Instance dependent noise
    #Actual noise rate 0.19
    [cuda:1] LNPCC waiting for GPU slot...
    [cuda:1] Slot acquired (waited 0.0s). Starting GCN...
    FINAL_RESULT: {'acc': {'train': 0.9, 'valid': 0.592, 'test': 0.773}, 'wall_s': 9.51, 'cpu_s': 7.38, 'gpu_s': 2.1, 'wait_s': 0.0}
    [Time] wall=9.5s | cpu=7.4s | gpu=2.1s
    C:\Users\fbrev\Documents\Acadêmico\Simulações\Python\NoisyGL\predictor\Base_Predictor.py:114: UserWarning: expandable_segments not supported on this platform (Triggered internally at ..\c10/cuda/CUDAAllocatorConfig.h:28.)
    self.edge_index = self._cpu_edge_index.to(self.device)
    C:\Users\fbrev\Documents\Acadêmico\Simulações\Python\NoisyGL\predictor\Base_Predictor.py:144: UserWarning: Sparse CSR tensor support is in beta state. If you miss a functionality in the sparse tensor support, please submit a feature request to https://github.com/pytorch/pytorch/issues. (Triggered internally at ..\aten\src\ATen\SparseCsrTensorImpl.cpp:55.)
    self.adj_csr = self.adj.to_sparse_csr().to(self.device)
  [Retest] Candidate 1 Avg: 0.7660

  [Retest] Candidate 2/3 (Trial 20, HPO_acc=0.7840)
    [CPU] Loading cora...
    DEBUG 3.1: Dataset init start
    DEBUG 3.2: prepare_data start cora
    ----Data statistics------'
    Name: cora
    #Nodes 2708
    #Edges 5278
    #Classes 7
    #Ave_degree 3.90
    ----Split statistics------'
    #Train samples 140 (default)
    #Val samples 500 (default)
    #Test samples 1000 (default)
    ----label noise information:------
    Instance dependent noise
    #Actual noise rate 0.21
    [cuda:1] LNPCC waiting for GPU slot...
    [cuda:1] Slot acquired (waited 2.5s). Starting GCN...
    FINAL_RESULT: {'acc': {'train': 0.920863309352518, 'valid': 0.614, 'test': 0.778}, 'wall_s': 14.08, 'cpu_s': 12.23, 'gpu_s': 1.83, 'wait_s': 2.53}
    [Time] wall=14.1s | cpu=12.2s | gpu=1.8s
    C:\Users\fbrev\Documents\Acadêmico\Simulações\Python\NoisyGL\predictor\Base_Predictor.py:114: UserWarning: expandable_segments not supported on this platform (Triggered internally at ..\c10/cuda/CUDAAllocatorConfig.h:28.)
    self.edge_index = self._cpu_edge_index.to(self.device)
    C:\Users\fbrev\Documents\Acadêmico\Simulações\Python\NoisyGL\predictor\Base_Predictor.py:144: UserWarning: Sparse CSR tensor support is in beta state. If you miss a functionality in the sparse tensor support, please submit a feature request to https://github.com/pytorch/pytorch/issues. (Triggered internally at ..\aten\src\ATen\SparseCsrTensorImpl.cpp:55.)
    self.adj_csr = self.adj.to_sparse_csr().to(self.device)
    [CPU] Loading cora...
    DEBUG 3.1: Dataset init start
    DEBUG 3.2: prepare_data start cora
    ----Data statistics------'
    Name: cora
    #Nodes 2708
    #Edges 5278
    #Classes 7
    #Ave_degree 3.90
    ----Split statistics------'
    #Train samples 140 (default)
    #Val samples 500 (default)
    #Test samples 1000 (default)
    ----label noise information:------
    Instance dependent noise
    #Actual noise rate 0.20
    [cuda:1] LNPCC waiting for GPU slot...
    [cuda:1] Slot acquired (waited 0.0s). Starting GCN...
    FINAL_RESULT: {'acc': {'train': 0.8928571428571429, 'valid': 0.596, 'test': 0.784}, 'wall_s': 15.33, 'cpu_s': 13.41, 'gpu_s': 1.88, 'wait_s': 0.0}
    [Time] wall=15.3s | cpu=13.4s | gpu=1.9s
    C:\Users\fbrev\Documents\Acadêmico\Simulações\Python\NoisyGL\predictor\Base_Predictor.py:114: UserWarning: expandable_segments not supported on this platform (Triggered internally at ..\c10/cuda/CUDAAllocatorConfig.h:28.)
    self.edge_index = self._cpu_edge_index.to(self.device)
    C:\Users\fbrev\Documents\Acadêmico\Simulações\Python\NoisyGL\predictor\Base_Predictor.py:144: UserWarning: Sparse CSR tensor support is in beta state. If you miss a functionality in the sparse tensor support, please submit a feature request to https://github.com/pytorch/pytorch/issues. (Triggered internally at ..\aten\src\ATen\SparseCsrTensorImpl.cpp:55.)
    self.adj_csr = self.adj.to_sparse_csr().to(self.device)
    [CPU] Loading cora...
    DEBUG 3.1: Dataset init start
    DEBUG 3.2: prepare_data start cora
    ----Data statistics------'
    Name: cora
    #Nodes 2708
    #Edges 5278
    #Classes 7
    #Ave_degree 3.90
    ----Split statistics------'
    #Train samples 140 (default)
    #Val samples 500 (default)
    #Test samples 1000 (default)
    ----label noise information:------
    Instance dependent noise
    #Actual noise rate 0.20
    [cuda:1] LNPCC waiting for GPU slot...
    [cuda:1] Slot acquired (waited 0.0s). Starting GCN...
    FINAL_RESULT: {'acc': {'train': 0.9, 'valid': 0.616, 'test': 0.789}, 'wall_s': 19.56, 'cpu_s': 17.15, 'gpu_s': 2.37, 'wait_s': 0.0}
    [Time] wall=19.6s | cpu=17.2s | gpu=2.4s
    C:\Users\fbrev\Documents\Acadêmico\Simulações\Python\NoisyGL\predictor\Base_Predictor.py:114: UserWarning: expandable_segments not supported on this platform (Triggered internally at ..\c10/cuda/CUDAAllocatorConfig.h:28.)
    self.edge_index = self._cpu_edge_index.to(self.device)
    C:\Users\fbrev\Documents\Acadêmico\Simulações\Python\NoisyGL\predictor\Base_Predictor.py:144: UserWarning: Sparse CSR tensor support is in beta state. If you miss a functionality in the sparse tensor support, please submit a feature request to https://github.com/pytorch/pytorch/issues. (Triggered internally at ..\aten\src\ATen\SparseCsrTensorImpl.cpp:55.)
    self.adj_csr = self.adj.to_sparse_csr().to(self.device)
    [CPU] Loading cora...
    DEBUG 3.1: Dataset init start
    DEBUG 3.2: prepare_data start cora
    ----Data statistics------'
    Name: cora
    #Nodes 2708
    #Edges 5278
    #Classes 7
    #Ave_degree 3.90
    ----Split statistics------'
    #Train samples 140 (default)
    #Val samples 500 (default)
    #Test samples 1000 (default)
    ----label noise information:------
    Instance dependent noise
    #Actual noise rate 0.20
    [cuda:1] LNPCC waiting for GPU slot...
    [cuda:1] Slot acquired (waited 1.5s). Starting GCN...
    FINAL_RESULT: {'acc': {'train': 0.8642857142857143, 'valid': 0.626, 'test': 0.742}, 'wall_s': 20.38, 'cpu_s': 18.42, 'gpu_s': 1.93, 'wait_s': 1.47}
    [Time] wall=20.4s | cpu=18.4s | gpu=1.9s
    C:\Users\fbrev\Documents\Acadêmico\Simulações\Python\NoisyGL\predictor\Base_Predictor.py:114: UserWarning: expandable_segments not supported on this platform (Triggered internally at ..\c10/cuda/CUDAAllocatorConfig.h:28.)
    self.edge_index = self._cpu_edge_index.to(self.device)
    C:\Users\fbrev\Documents\Acadêmico\Simulações\Python\NoisyGL\predictor\Base_Predictor.py:144: UserWarning: Sparse CSR tensor support is in beta state. If you miss a functionality in the sparse tensor support, please submit a feature request to https://github.com/pytorch/pytorch/issues. (Triggered internally at ..\aten\src\ATen\SparseCsrTensorImpl.cpp:55.)
    self.adj_csr = self.adj.to_sparse_csr().to(self.device)
    [CPU] Loading cora...
    DEBUG 3.1: Dataset init start
    DEBUG 3.2: prepare_data start cora
    ----Data statistics------'
    Name: cora
    #Nodes 2708
    #Edges 5278
    #Classes 7
    #Ave_degree 3.90
    ----Split statistics------'
    #Train samples 140 (default)
    #Val samples 500 (default)
    #Test samples 1000 (default)
    ----label noise information:------
    Instance dependent noise
    #Actual noise rate 0.21
    [cuda:1] LNPCC waiting for GPU slot...
    [cuda:1] Slot acquired (waited 1.3s). Starting GCN...
    FINAL_RESULT: {'acc': {'train': 0.8714285714285714, 'valid': 0.622, 'test': 0.798}, 'wall_s': 16.4, 'cpu_s': 14.5, 'gpu_s': 1.87, 'wait_s': 1.32}
    [Time] wall=16.4s | cpu=14.5s | gpu=1.9s
    C:\Users\fbrev\Documents\Acadêmico\Simulações\Python\NoisyGL\predictor\Base_Predictor.py:114: UserWarning: expandable_segments not supported on this platform (Triggered internally at ..\c10/cuda/CUDAAllocatorConfig.h:28.)
    self.edge_index = self._cpu_edge_index.to(self.device)
    C:\Users\fbrev\Documents\Acadêmico\Simulações\Python\NoisyGL\predictor\Base_Predictor.py:144: UserWarning: Sparse CSR tensor support is in beta state. If you miss a functionality in the sparse tensor support, please submit a feature request to https://github.com/pytorch/pytorch/issues. (Triggered internally at ..\aten\src\ATen\SparseCsrTensorImpl.cpp:55.)
   