[I 2026-05-04 12:00:13,116] Trial 21 finished with value: 0.7633382609864265 and parameters: {'lr': 0.005, 'weight_decay': 0.0001, 'n_hidden': 256, 'n_layer': 3, 'dropout': 0.5802071888450883, 'knn_mode': 's', 'k': 32, 'dexp': 5.484217528582303, 'p_grd': 0.6421169646078358, 'unc_rem': 0.5389447890162862, 'unc_rel': 0.8403250478907995}. Best is trial 21 with value: 0.7633382609864265.
    [CPU] Loading dblp...
    DEBUG 3.1: Dataset init start
    DEBUG 3.2: prepare_data start dblp
    ----Data statistics------'
    Name: dblp
    #Nodes 17716
    #Edges 52867
    #Classes 4
    #Ave_degree 5.97
    ----Split statistics------'
    #Train samples 177 (1.0 % of nodes)
    #Val samples 2657 (15.0 % of nodes)
    #Test samples 14882 (remaining)
    ----label noise information:------
    Instance dependent noise
    #Actual noise rate 0.20
    [cuda:0] LNPCC waiting for GPU slot...
    [cuda:0] Slot acquired (waited 122.7s). Starting GCN...
    FINAL_RESULT: {'acc': {'train': 0.7909604519774012, 'valid': 0.622882950696274, 'test': 0.7636070420642387}, 'wall_s': 43.04, 'cpu_s': 37.0, 'gpu_s': 6.0, 'wait_s': 122.7}
    [Time] wall=43.0s | cpu=37.0s | gpu=6.0s
    C:\Users\fbrev\Documents\Acadêmico\Simulações\Python\NoisyGL\predictor\Base_Predictor.py:114: UserWarning: expandable_segments not supported on this platform (Triggered internally at ..\c10/cuda/CUDAAllocatorConfig.h:28.)
    self.edge_index = self._cpu_edge_index.to(self.device)
    C:\Users\fbrev\Documents\Acadêmico\Simulações\Python\NoisyGL\predictor\Base_Predictor.py:144: UserWarning: Sparse CSR tensor support is in beta state. If you miss a functionality in the sparse tensor support, please submit a feature request to https://github.com/pytorch/pytorch/issues. (Triggered internally at ..\aten\src\ATen\SparseCsrTensorImpl.cpp:55.)
    self.adj_csr = self.adj.to_sparse_csr().to(self.device)
[I 2026-05-04 12:03:04,046] Trial 22 finished with value: 0.7636070420642387 and parameters: {'lr': 0.005, 'weight_decay': 0.0001, 'n_hidden': 256, 'n_layer': 3, 'dropout': 0.5820403425592777, 'knn_mode': 's', 'k': 32, 'dexp': 6.016144846352351, 'p_grd': 0.6857935084750467, 'unc_rem': 0.5891591632606488, 'unc_rel': 0.8438220409125181}. Best is trial 22 with value: 0.7636070420642387.
    [CPU] Loading dblp...
    DEBUG 3.1: Dataset init start
    DEBUG 3.2: prepare_data start dblp
    ----Data statistics------'
    Name: dblp
    #Nodes 17716
    #Edges 52867
    #Classes 4
    #Ave_degree 5.97
    ----Split statistics------'
    #Train samples 177 (1.0 % of nodes)
    #Val samples 2657 (15.0 % of nodes)
    #Test samples 14882 (remaining)
    ----label noise information:------
    Instance dependent noise
    #Actual noise rate 0.20
    [cuda:0] LNPCC waiting for GPU slot...
    [cuda:0] Slot acquired (waited 73.4s). Starting GCN...
    FINAL_RESULT: {'acc': {'train': 0.8418079096045198, 'valid': 0.6240120436582612, 'test': 0.7539981185324554}, 'wall_s': 37.58, 'cpu_s': 31.51, 'gpu_s': 6.02, 'wait_s': 73.37}
    [Time] wall=37.6s | cpu=31.5s | gpu=6.0s
    C:\Users\fbrev\Documents\Acadêmico\Simulações\Python\NoisyGL\predictor\Base_Predictor.py:114: UserWarning: expandable_segments not supported on this platform (Triggered internally at ..\c10/cuda/CUDAAllocatorConfig.h:28.)
    self.edge_index = self._cpu_edge_index.to(self.device)
    C:\Users\fbrev\Documents\Acadêmico\Simulações\Python\NoisyGL\predictor\Base_Predictor.py:144: UserWarning: Sparse CSR tensor support is in beta state. If you miss a functionality in the sparse tensor support, please submit a feature request to https://github.com/pytorch/pytorch/issues. (Triggered internally at ..\aten\src\ATen\SparseCsrTensorImpl.cpp:55.)
    self.adj_csr = self.adj.to_sparse_csr().to(self.device)
[I 2026-05-04 12:04:59,835] Trial 23 finished with value: 0.7539981185324554 and parameters: {'lr': 0.005, 'weight_decay': 0.0001, 'n_hidden': 256, 'n_layer': 3, 'dropout': 0.604222233727548, 'knn_mode': 's', 'k': 32, 'dexp': 5.887070731097228, 'p_grd': 0.5817382900065222, 'unc_rem': 0.5771736847558726, 'unc_rel': 0.8578911262049675}. Best is trial 22 with value: 0.7636070420642387.
    [CPU] Loading dblp...
    DEBUG 3.1: Dataset init start
    DEBUG 3.2: prepare_data start dblp
    ----Data statistics------'
    Name: dblp
    #Nodes 17716
    #Edges 52867
    #Classes 4
    #Ave_degree 5.97
    ----Split statistics------'
    #Train samples 177 (1.0 % of nodes)
    #Val samples 2657 (15.0 % of nodes)
    #Test samples 14882 (remaining)
    ----label noise information:------
    Instance dependent noise
    #Actual noise rate 0.20
    [cuda:0] LNPCC waiting for GPU slot...
    [cuda:0] Slot acquired (waited 15.1s). Starting GCN...
    FINAL_RESULT: {'acc': {'train': 0.7966101694915254, 'valid': 0.6243884079789236, 'test': 0.7636070420642387}, 'wall_s': 41.32, 'cpu_s': 35.35, 'gpu_s': 5.92, 'wait_s': 15.1}
    [Time] wall=41.3s | cpu=35.4s | gpu=5.9s
    C:\Users\fbrev\Documents\Acadêmico\Simulações\Python\NoisyGL\predictor\Base_Predictor.py:114: UserWarning: expandable_segments not supported on this platform (Triggered internally at ..\c10/cuda/CUDAAllocatorConfig.h:28.)
    self.edge_index = self._cpu_edge_index.to(self.device)
    C:\Users\fbrev\Documents\Acadêmico\Simulações\Python\NoisyGL\predictor\Base_Predictor.py:144: UserWarning: Sparse CSR tensor support is in beta state. If you miss a functionality in the sparse tensor support, please submit a feature request to https://github.com/pytorch/pytorch/issues. (Triggered internally at ..\aten\src\ATen\SparseCsrTensorImpl.cpp:55.)
    self.adj_csr = self.adj.to_sparse_csr().to(self.device)
[I 2026-05-04 12:06:01,203] Trial 24 finished with value: 0.7636070420642387 and parameters: {'lr': 0.005, 'weight_decay': 0.0001, 'n_hidden': 256, 'n_layer': 3, 'dropout': 0.5756514655734029, 'knn_mode': 's', 'k': 31, 'dexp': 5.712633739113498, 'p_grd': 0.7603771327321533, 'unc_rem': 0.5897301418935514, 'unc_rel': 0.8779820867953817}. Best is trial 22 with value: 0.7636070420642387.
    [CPU] Loading dblp...
    DEBUG 3.1: Dataset init start
    DEBUG 3.2: prepare_data start dblp
    ----Data statistics------'
    Name: dblp
    #Nodes 17716
    #Edges 52867
    #Classes 4
    #Ave_degree 5.97
    ----Split statistics------'
    #Train samples 177 (1.0 % of nodes)
    #Val samples 2657 (15.0 % of nodes)
    #Test samples 14882 (remaining)
    ----label noise information:------
    Instance dependent noise
    #Actual noise rate 0.20
    [cuda:0] LNPCC waiting for GPU slot...
    [cuda:0] Slot acquired (waited 173.9s). Starting GCN...
    FINAL_RESULT: {'acc': {'train': 0.847457627118644, 'valid': 0.6232593150169364, 'test': 0.7536621421851901}, 'wall_s': 40.93, 'cpu_s': 35.03, 'gpu_s': 5.85, 'wait_s': 173.89}
    [Time] wall=40.9s | cpu=35.0s | gpu=5.9s
    C:\Users\fbrev\Documents\Acadêmico\Simulações\Python\NoisyGL\predictor\Base_Predictor.py:114: UserWarning: expandable_segments not supported on this platform (Triggered internally at ..\c10/cuda/CUDAAllocatorConfig.h:28.)
    self.edge_index = self._cpu_edge_index.to(self.device)
    C:\Users\fbrev\Documents\Acadêmico\Simulações\Python\NoisyGL\predictor\Base_Predictor.py:144: UserWarning: Sparse CSR tensor support is in beta state. If you miss a functionality in the sparse tensor support, please submit a feature request to https://github.com/pytorch/pytorch/issues. (Triggered internally at ..\aten\src\ATen\SparseCsrTensorImpl.cpp:55.)
    self.adj_csr = self.adj.to_sparse_csr().to(self.device)
[I 2026-05-04 12:09:41,397] Trial 25 finished with value: 0.7536621421851901 and parameters: {'lr': 0.005, 'weight_decay': 0.0001, 'n_hidden': 256, 'n_layer': 3, 'dropout': 0.6050937062025971, 'knn_mode': 's', 'k': 35, 'dexp': 5.488782008005435, 'p_grd': 0.7549043171086219, 'unc_rem': 0.47454466095885184, 'unc_rel': 0.8826340051802258}. Best is trial 22 with value: 0.7636070420642387.
    [CPU] Loading dblp...
    DEBUG 3.1: Dataset init start
    DEBUG 3.2: prepare_data start dblp
    ----Data statistics------'
    Name: dblp
    #Nodes 17716
    #Edges 52867
    #Classes 4
    #Ave_degree 5.97
    ----Split statistics------'
    #Train samples 177 (1.0 % of nodes)
    #Val samples 2657 (15.0 % of nodes)
    #Test samples 14882 (remaining)
    ----label noise information:------
    Instance dependent noise
    #Actual noise rate 0.20
    [cuda:0] LNPCC waiting for GPU slot...
    [cuda:0] Slot acquired (waited 66.7s). Starting GCN...
    FINAL_RESULT: {'acc': {'train': 0.847457627118644, 'valid': 0.6232593150169364, 'test': 0.7561483671549523}, 'wall_s': 39.55, 'cpu_s': 33.47, 'gpu_s': 6.03, 'wait_s': 66.7}
    [Time] wall=39.5s | cpu=33.5s | gpu=6.0s
    C:\Users\fbrev\Documents\Acadêmico\Simulações\Python\NoisyGL\predictor\Base_Predictor.py:114: UserWarning: expandable_segments not supported on this platform (Triggered internally at ..\c10/cuda/CUDAAllocatorConfig.h:28.)
    self.edge_index = self._cpu_edge_index.to(self.device)
    C:\Users\fbrev\Documents\Acadêmico\Simulações\Python\NoisyGL\predictor\Base_Predictor.py:144: UserWarning: Sparse CSR tensor support is in beta state. If you miss a functionality in the sparse tensor support, please submit a feature request to https://github.com/pytorch/pytorch/issues. (Triggered internally at ..\aten\src\ATen\SparseCsrTensorImpl.cpp:55.)
    self.adj_csr = self.adj.to_sparse_csr().to(self.device)
[I 2026-05-04 12:11:32,500] Trial 26 finished with value: 0.7561483671549523 and parameters: {'lr': 0.005, 'weight_decay': 0.0001, 'n_hidden': 256, 'n_layer': 3, 'dropout': 0.4424198466004894, 'knn_mode': 's', 'k': 29, 'dexp': 4.922047830436639, 'p_grd': 0.7994645221651726, 'unc_rem': 0.5362957832622518, 'unc_rel': 0.9194022742541109}. Best is trial 22 with value: 0.7636070420642387.
    [CPU] Loading dblp...
    DEBUG 3.1: Dataset init start
    DEBUG 3.2: prepare_data start dblp
    ----Data statistics------'
    Name: dblp
    #Nodes 17716
    #Edges 52867
    #Classes 4
    #Ave_degree 5.97
    ----Split statistics------'
    #Train samples 177 (1.0 % of nodes)
    #Val samples 2657 (15.0 % of nodes)
    #Test samples 14882 (remaining)
    ----label noise information:------
    Instance dependent noise
    #Actual noise rate 0.20
    [cuda:0] LNPCC waiting for GPU slot...
    [cuda:0] Slot acquired (waited 122.0s). Starting GCN...
    FINAL_RESULT: {'acc': {'train': 0.8531073446327684, 'valid': 0.6236356793375988, 'test': 0.7565515387716705}, 'wall_s': 36.79, 'cpu_s': 30.94, 'gpu_s': 5.8, 'wait_s': 121.99}
    [Time] wall=36.8s | cpu=30.9s | gpu=5.8s
    C:\Users\fbrev\Documents\Acadêmico\Simulações\Python\NoisyGL\predictor\Base_Predictor.py:114: UserWarning: expandable_segments not supported on this platform (Triggered internally at ..\c10/cuda/CUDAAllocatorConfig.h:28.)
    self.edge_index = self._cpu_edge_index.to(self.device)
    C:\Users\fbrev\Documents\Acadêmico\Simulações\Python\NoisyGL\predictor\Base_Predictor.py:144: UserWarning: Sparse CSR tensor support is in beta state. If you miss a functionality in the sparse tensor support, please submit a feature request to https://github.com/pytorch/pytorch/issues. (Triggered internally at ..\aten\src\ATen\SparseCsrTensorImpl.cpp:55.)
    self.adj_csr = self.adj.to_sparse_csr().to(self.device)
[I 2026-05-04 12:14:16,317] Trial 27 finished with value: 0.7565515387716705 and parameters: {'lr': 0.005, 'weight_decay': 0.0001, 'n_hidden': 256, 'n_layer': 3, 'dropout': 0.4301459301217825, 'knn_mode': 's', 'k': 36, 'dexp': 6.585610755166462, 'p_grd': 0.9904928215608506, 'unc_rem': 0.3763398913197116, 'unc_rel': 0.9964488149956476}. Best is trial 22 with value: 0.7636070420642387.
    [CPU] Loading dblp...
    DEBUG 3.1: Dataset init start
    DEBUG 3.2: prepare_data start dblp
    ----Data statistics------'
    Name: dblp
    #Nodes 17716
    #Edges 52867
    #Classes 4
    #Ave_degree 5.97
    ----Split statistics------'
    #Train samples 177 (1.0 % of nodes)
    #Val samples 2657 (15.0 % of nodes)
    #Test samples 14882 (remaining)
    ----label noise information:------
    Instance dependent noise
    #Actual noise rate 0.20
    [cuda:0] LNPCC waiting for GPU slot...
    [cuda:0] Slot acquired (waited 16.2s). Starting GCN...
    FINAL_RESULT: {'acc': {'train': 0.7909604519774012, 'valid': 0.6236356793375988, 'test': 0.7628006988308023}, 'wall_s': 40.12, 'cpu_s': 33.92, 'gpu_s': 6.14, 'wait_s': 16.17}
    [Time] wall=40.1s | cpu=33.9s | gpu=6.1s
    C:\Users\fbrev\Documents\Acadêmico\Simulações\Python\NoisyGL\predictor\Base_Predictor.py:114: UserWarning: expandable_segments not supported on this platform (Triggered internally at ..\c10/cuda/CUDAAllocatorConfig.h:28.)
    self.edge_index = self._cpu_edge_index.to(self.device)
    C:\Users\fbrev\Documents\Acadêmico\Simulações\Python\NoisyGL\predictor\Base_Predictor.py:144: UserWarning: Sparse CSR tensor support is in beta state. If you miss a functionality in the sparse tensor support, please submit a feature request to https://github.com/pytorch/pytorch/issues. (Triggered internally at ..\aten\src\ATen\SparseCsrTensorImpl.cpp:55.)
    self.adj_csr = self.adj.to_sparse_csr().to(self.device)
[I 2026-05-04 12:15:17,367] Trial 28 finished with value: 0.7628006988308023 and parameters: {'lr': 0.005, 'weight_decay': 0.0001, 'n_hidden': 256, 'n_layer': 3, 'dropout': 0.5815109297957902, 'knn_mode': 's', 'k': 41, 'dexp': 4.552621680683335, 'p_grd': 0.7076373951049972, 'unc_rem': 0.6368760917909442, 'unc_rel': 0.6756690950919642}. Best is trial 22 with value: 0.7636070420642387.
    [CPU] Loading dblp...
    DEBUG 3.1: Dataset init start
    DEBUG 3.2: prepare_data start dblp
    ----Data statistics------'
    Name: dblp
    #Nodes 17716
    #Edges 52867
    #Classes 4
    #Ave_degree 5.97
    ----Split statistics------'
    #Train samples 177 (1.0 % of nodes)
    #Val samples 2657 (15.0 % of nodes)
    #Test samples 14882 (remaining)
    ----label noise information:------
    Instance dependent noise
    #Actual noise rate 0.20
    [cuda:0] LNPCC waiting for GPU slot...
    [cuda:0] Slot acquired (waited 16.1s). Starting GCN...
    FINAL_RESULT: {'acc': {'train': 0.8700564971751412, 'valid': 0.6112156567557395, 'test': 0.7339739282354523}, 'wall_s': 39.91, 'cpu_s': 34.05, 'gpu_s': 5.81, 'wait_s': 16.09}
    [Time] wall=39.9s | cpu=34.1s | gpu=5.8s
    C:\Users\fbrev\Documents\Acadêmico\Simulações\Python\NoisyGL\predictor\Base_Predictor.py:114: UserWarning: expandable_segments not supported on this platform (Triggered internally at ..\c10/cuda/CUDAAllocatorConfig.h:28.)
    self.edge_index = self._cpu_edge_index.to(self.device)
    C:\Users\fbrev\Documents\Acadêmico\Simulações\Python\NoisyGL\predictor\Base_Predictor.py:144: UserWarning: Sparse CSR tensor support is in beta state. If you miss a functionality in the sparse tensor support, please submit a feature request to https://github.com/pytorch/pytorch/issues. (Triggered internally at ..\aten\src\ATen\SparseCsrTensorImpl.cpp:55.)
    self.adj_csr = self.adj.to_sparse_csr().to(self.device)
[I 2026-05-04 12:16:18,035] Trial 29 finished with value: 0.7339739282354523 and parameters: {'lr': 0.1, 'weight_decay': 0.0001, 'n_hidden': 256, 'n_layer': 3, 'dropout': 0.6568335718195739, 'knn_mode': 's', 'k': 33, 'dexp': 6.448901515689685, 'p_grd': 0.5684858535950066, 'unc_rem': 0.4500044944664352, 'unc_rel': 0.7475621430213315}. Best is trial 22 with value: 0.7636070420642387.
    [CPU] Loading dblp...
    DEBUG 3.1: Dataset init start
    DEBUG 3.2: prepare_data start dblp
    ----Data statistics------'
    Name: dblp
    #Nodes 17716
    #Edges 52867
    #Classes 4
    #Ave_degree 5.97
    ----Split statistics------'
    #Train samples 177 (1.0 % of nodes)
    #Val samples 2657 (15.0 % of nodes)
    #Test samples 14882 (remaining)
    ----label noise information:------
    Instance dependent noise
    #Actual noise rate 0.20
    [cuda:0] LNPCC waiting for GPU slot...
    [cuda:0] Slot acquired (waited 176.7s). Starting GCN...
    FINAL_RESULT: {'acc': {'train': 0.8022598870056498, 'valid': 0.6232593150169364, 'test': 0.7607848407472114}, 'wall_s': 36.9, 'cpu_s': 30.95, 'gpu_s': 5.91, 'wait_s': 176.66}
    [Time] wall=36.9s | cpu=30.9s | gpu=5.9s
    C:\Users\fbrev\Documents\Acadêmico\Simulações\Python\NoisyGL\predictor\Base_Predictor.py:114: UserWarning: expandable_segments not supported on this platform (Triggered internally at ..\c10/cuda/CUDAAllocatorConfig.h:28.)
    self.edge_index = self._cpu_edge_index.to(self.device)
    C:\Users\fbrev\Documents\Acadêmico\Simulações\Python\NoisyGL\predictor\Base_Predictor.py:144: UserWarning: Sparse CSR tensor support is in beta state. If you miss a functionality in the sparse tensor support, please submit a feature request to https://github.com/pytorch/pytorch/issues. (Triggered internally at ..\aten\src\ATen\SparseCsrTensorImpl.cpp:55.)
    self.adj_csr = self.adj.to_sparse_csr().to(self.device)
[I 2026-05-04 12:19:56,170] Trial 30 finished with value: 0.7607848407472114 and parameters: {'lr': 0.005, 'weight_decay': 0.0001, 'n_hidden': 256, 'n_layer': 3, 'dropout': 0.5424304614095662, 'knn_mode': 's', 'k': 27, 'dexp': 6.383003578203474, 'p_grd': 0.8743406551494755, 'unc_rem': 0.529459618136372, 'unc_rel': 0.5204188764819524}. Best is trial 22 with value: 0.7636070420642387.
    [CPU] Loading dblp...
    DEBUG 3.1: Dataset init start
    DEBUG 3.2: prepare_data start dblp
    ----Data statistics------'
    Name: dblp
    #Nodes 17716
    #Edges 52867
    #Classes 4
    #Ave_degree 5.97
    ----Split statistics------'
    #Train samples 177 (1.0 % of nodes)
    #Val samples 2657 (15.0 % of nodes)
    #Test samples 14882 (remaining)
    ----label noise information:------
    Instance dependent noise
    #Actual noise rate 0.20
    [cuda:0] LNPCC waiting for GPU slot...
    [cuda:0] Slot acquired (waited 120.2s). Starting GCN...
    FINAL_RESULT: {'acc': {'train': 0.847457627118644, 'valid': 0.6243884079789236, 'test': 0.7541997043408144}, 'wall_s': 39.66, 'cpu_s': 33.81, 'gpu_s': 5.81, 'wait_s': 120.17}
    [Time] wall=39.7s | cpu=33.8s | gpu=5.8s
    C:\Users\fbrev\Documents\Acadêmico\Simulações\Python\NoisyGL\predictor\Base_Predictor.py:114: UserWarning: expandable_segments not supported on this platform (Triggered internally at ..\c10/cuda/CUDAAllocatorConfig.h:28.)
    self.edge_index = self._cpu_edge_index.to(self.device)
    C:\Users\fbrev\Documents\Acadêmico\Simulações\Python\NoisyGL\predictor\Base_Predictor.py:144: UserWarning: Sparse CSR tensor support is in beta state. If you miss a functionality in the sparse tensor support, please submit a feature request to https://github.com/pytorch/pytorch/issues. (Triggered internally at ..\aten\src\ATen\SparseCsrTensorImpl.cpp:55.)
    self.adj_csr = self.adj.to_sparse_csr().to(self.device)
[I 2026-05-04 12:22:41,013] Trial 31 finished with value: 0.7541997043408144 and parameters: {'lr': 0.005, 'weight_decay': 0.0001, 'n_hidden': 256, 'n_layer': 3, 'dropout': 0.6144056000218239, 'knn_mode': 's', 'k': 39, 'dexp': 4.483087794497022, 'p_grd': 0.7055187391703694, 'unc_rem': 0.6421994470370533, 'unc_rel': 0.6632383875858924}. Best is trial 22 with value: 0.7636070420642387.
    [CPU] Loading dblp...
    DEBUG 3.1: Dataset init start
    DEBUG 3.2: prepare_data start dblp
    ----Data statistics------'
    Name: dblp
    #Nodes 17716
    #Edges 52867
    #Classes 4
    #Ave_degree 5.97
    ----Split statistics------'
    #Train samples 177 (1.0 % of nodes)
    #Val samples 2657 (15.0 % of nodes)
    #Test samples 14882 (remaining)
    ----label noise information:------
    Instance dependent noise
    #Actual noise rate 0.20
    [cuda:0] LNPCC waiting for GPU slot...
    [cuda:0] Slot acquired (waited 9.9s). Starting GCN...
    FINAL_RESULT: {'acc': {'train': 0.7966101694915254, 'valid': 0.6221302220549492, 'test': 0.7634726515253326}, 'wall_s': 45.21, 'cpu_s': 38.9, 'gpu_s': 6.25, 'wait_s': 9.93}
    [Time] wall=45.2s | cpu=38.9s | gpu=6.2s
    C:\Users\fbrev\Documents\Acadêmico\Simulações\Python\NoisyGL\predictor\Base_Predictor.py:114: UserWarning: expandable_segments not supported on this platform (Triggered internally at ..\c10/cuda/CUDAAllocatorConfig.h:28.)
    self.edge_index = self._cpu_edge_index.to(self.device)
    C:\Users\fbrev\Documents\Acadêmico\Simulações\Python\NoisyGL\predictor\Base_Predictor.py:144: UserWarning: Sparse CSR tensor support is in beta state. If you miss a functionality in the sparse tensor support, please submit a feature request to https://github.com/pytorch/pytorch/issues. (Triggered internally at ..\aten\src\ATen\SparseCsrTensorImpl.cpp:55.)
    self.adj_csr = self.adj.to_sparse_csr().to(self.device)
