[I 2026-04-27 01:56:03,253] Trial 48 finished with value: 0.36851237560602196 and parameters: {'lr': 0.005, 'weight_decay': 0.01, 'n_hidden': 256, 'n_layer': 3, 'dropout': 0.22748588572630216, 'knn_mode': 's', 'k': 44, 'dexp': 6.941222429955537, 'p_grd': 0.41698624053002553, 'unc_rem': 0.41404113105659296, 'unc_rel': 0.833432161196342}. Best is trial 32 with value: 0.3997448328655269.
    [CPU] Loading amazon-ratings...
    DEBUG 3.1: Dataset init start
    DEBUG 3.2: prepare_data start amazon-ratings
    ----Data statistics------'
    Name: amazon-ratings
    #Nodes 24492
    #Edges 93050
    #Classes 5
    #Ave_degree 7.60
    ----Split statistics------'
    #Train samples 1224 (5.0 % of nodes)
    #Val samples 3673 (15.0 % of nodes)
    #Test samples 19595 (remaining)
    ----label noise information:------
    Instance dependent noise
    #Actual noise rate 0.21
    [cuda:1] LNPCC waiting for GPU slot...
    [cuda:1] Slot acquired (waited 0.0s). Starting GCN...
    FINAL_RESULT: {'acc': {'train': 0.4133986928104575, 'valid': 0.34004900626191126, 'test': 0.389895381474866}, 'wall_s': 67.81, 'cpu_s': 63.09, 'gpu_s': 4.67, 'wait_s': 0.0}
    [Time] wall=67.8s | cpu=63.1s | gpu=4.7s
    C:\Users\fbrev\Documents\Acadêmico\Simulações\Python\NoisyGL\predictor\Base_Predictor.py:144: UserWarning: Sparse CSR tensor support is in beta state. If you miss a functionality in the sparse tensor support, please submit a feature request to https://github.com/pytorch/pytorch/issues. (Triggered internally at ..\aten\src\ATen\SparseCsrTensorImpl.cpp:55.)
    self.adj_csr = self.adj.to_sparse_csr().to(self.device)
[I 2026-04-27 01:57:18,029] Trial 49 finished with value: 0.389895381474866 and parameters: {'lr': 0.001, 'weight_decay': 0.001, 'n_hidden': 256, 'n_layer': 2, 'dropout': 0.7943209570239557, 'knn_mode': 's', 'k': 32, 'dexp': 8.430061538939567, 'p_grd': 0.6966380421830991, 'unc_rem': 0.2052509763043403, 'unc_rel': 0.7720119488453699}. Best is trial 32 with value: 0.3997448328655269.
    [CPU] Loading amazon-ratings...
    DEBUG 3.1: Dataset init start
    DEBUG 3.2: prepare_data start amazon-ratings
    ----Data statistics------'
    Name: amazon-ratings
    #Nodes 24492
    #Edges 93050
    #Classes 5
    #Ave_degree 7.60
    ----Split statistics------'
    #Train samples 1224 (5.0 % of nodes)
    #Val samples 3673 (15.0 % of nodes)
    #Test samples 19595 (remaining)
    ----label noise information:------
    Instance dependent noise
    #Actual noise rate 0.21
    [cuda:1] LNPCC waiting for GPU slot...
    [cuda:1] Slot acquired (waited 0.0s). Starting GCN...
    FINAL_RESULT: {'acc': {'train': 0.411957411957412, 'valid': 0.3495780016335421, 'test': 0.39698902781321765}, 'wall_s': 39.56, 'cpu_s': 36.97, 'gpu_s': 2.53, 'wait_s': 0.0}
    [Time] wall=39.6s | cpu=37.0s | gpu=2.5s
    C:\Users\fbrev\Documents\Acadêmico\Simulações\Python\NoisyGL\predictor\Base_Predictor.py:144: UserWarning: Sparse CSR tensor support is in beta state. If you miss a functionality in the sparse tensor support, please submit a feature request to https://github.com/pytorch/pytorch/issues. (Triggered internally at ..\aten\src\ATen\SparseCsrTensorImpl.cpp:55.)
    self.adj_csr = self.adj.to_sparse_csr().to(self.device)
[I 2026-04-27 01:58:03,264] Trial 50 finished with value: 0.39698902781321765 and parameters: {'lr': 0.005, 'weight_decay': 0.001, 'n_hidden': 32, 'n_layer': 3, 'dropout': 0.3365147290863917, 'knn_mode': 's', 'k': 47, 'dexp': 4.055624069511726, 'p_grd': 0.4814617586976351, 'unc_rem': 0.6693354912071838, 'unc_rel': 0.6213616577364958}. Best is trial 32 with value: 0.3997448328655269.
    [CPU] Loading amazon-ratings...
    DEBUG 3.1: Dataset init start
    DEBUG 3.2: prepare_data start amazon-ratings
    ----Data statistics------'
    Name: amazon-ratings
    #Nodes 24492
    #Edges 93050
    #Classes 5
    #Ave_degree 7.60
    ----Split statistics------'
    #Train samples 1224 (5.0 % of nodes)
    #Val samples 3673 (15.0 % of nodes)
    #Test samples 19595 (remaining)
    ----label noise information:------
    Instance dependent noise
    #Actual noise rate 0.21
    [cuda:1] LNPCC waiting for GPU slot...
    [cuda:1] Slot acquired (waited 0.0s). Starting GCN...
    FINAL_RESULT: {'acc': {'train': 0.2900326797385621, 'valid': 0.3117342771576368, 'test': 0.36851237560602196}, 'wall_s': 49.95, 'cpu_s': 44.83, 'gpu_s': 5.06, 'wait_s': 0.0}
    [Time] wall=50.0s | cpu=44.8s | gpu=5.1s
    C:\Users\fbrev\Documents\Acadêmico\Simulações\Python\NoisyGL\predictor\Base_Predictor.py:144: UserWarning: Sparse CSR tensor support is in beta state. If you miss a functionality in the sparse tensor support, please submit a feature request to https://github.com/pytorch/pytorch/issues. (Triggered internally at ..\aten\src\ATen\SparseCsrTensorImpl.cpp:55.)
    self.adj_csr = self.adj.to_sparse_csr().to(self.device)
[I 2026-04-27 01:58:58,956] Trial 51 finished with value: 0.36851237560602196 and parameters: {'lr': 0.05, 'weight_decay': 0.05, 'n_hidden': 128, 'n_layer': 3, 'dropout': 0.3083904673791376, 'knn_mode': 'd', 'k': 19, 'dexp': 6.240417472561957, 'p_grd': 0.5692869670127126, 'unc_rem': 0.7896513870576141, 'unc_rel': 0.7260621179821637}. Best is trial 32 with value: 0.3997448328655269.
    [CPU] Loading amazon-ratings...
    DEBUG 3.1: Dataset init start
    DEBUG 3.2: prepare_data start amazon-ratings
    ----Data statistics------'
    Name: amazon-ratings
    #Nodes 24492
    #Edges 93050
    #Classes 5
    #Ave_degree 7.60
    ----Split statistics------'
    #Train samples 1224 (5.0 % of nodes)
    #Val samples 3673 (15.0 % of nodes)
    #Test samples 19595 (remaining)
    ----label noise information:------
    Instance dependent noise
    #Actual noise rate 0.21
    [cuda:1] LNPCC waiting for GPU slot...
    [cuda:1] Slot acquired (waited 1.4s). Starting GCN...
    FINAL_RESULT: {'acc': {'train': 0.4125816993464052, 'valid': 0.3501225156547781, 'test': 0.3952028578719061}, 'wall_s': 60.7, 'cpu_s': 52.36, 'gpu_s': 8.29, 'wait_s': 1.37}
    [Time] wall=60.7s | cpu=52.4s | gpu=8.3s
    C:\Users\fbrev\Documents\Acadêmico\Simulações\Python\NoisyGL\predictor\Base_Predictor.py:144: UserWarning: Sparse CSR tensor support is in beta state. If you miss a functionality in the sparse tensor support, please submit a feature request to https://github.com/pytorch/pytorch/issues. (Triggered internally at ..\aten\src\ATen\SparseCsrTensorImpl.cpp:55.)
    self.adj_csr = self.adj.to_sparse_csr().to(self.device)
[I 2026-04-27 02:00:06,743] Trial 52 finished with value: 0.3952028578719061 and parameters: {'lr': 0.005, 'weight_decay': 0.001, 'n_hidden': 256, 'n_layer': 3, 'dropout': 0.3874050244448081, 'knn_mode': 's', 'k': 36, 'dexp': 8.812833803923361, 'p_grd': 0.6661288423756936, 'unc_rem': 0.38782699761294587, 'unc_rel': 0.9845604874437777}. Best is trial 32 with value: 0.3997448328655269.
    [CPU] Loading amazon-ratings...
    DEBUG 3.1: Dataset init start
    DEBUG 3.2: prepare_data start amazon-ratings
    ----Data statistics------'
    Name: amazon-ratings
    #Nodes 24492
    #Edges 93050
    #Classes 5
    #Ave_degree 7.60
    ----Split statistics------'
    #Train samples 1224 (5.0 % of nodes)
    #Val samples 3673 (15.0 % of nodes)
    #Test samples 19595 (remaining)
    ----label noise information:------
    Instance dependent noise
    #Actual noise rate 0.21
    [cuda:1] LNPCC waiting for GPU slot...
    [cuda:1] Slot acquired (waited 0.0s). Starting GCN...
    FINAL_RESULT: {'acc': {'train': 0.4207516339869281, 'valid': 0.349033487612306, 'test': 0.39877519775452924}, 'wall_s': 65.61, 'cpu_s': 57.5, 'gpu_s': 8.06, 'wait_s': 0.0}
    [Time] wall=65.6s | cpu=57.5s | gpu=8.1s
    C:\Users\fbrev\Documents\Acadêmico\Simulações\Python\NoisyGL\predictor\Base_Predictor.py:144: UserWarning: Sparse CSR tensor support is in beta state. If you miss a functionality in the sparse tensor support, please submit a feature request to https://github.com/pytorch/pytorch/issues. (Triggered internally at ..\aten\src\ATen\SparseCsrTensorImpl.cpp:55.)
    self.adj_csr = self.adj.to_sparse_csr().to(self.device)
[I 2026-04-27 02:01:18,853] Trial 53 finished with value: 0.39877519775452924 and parameters: {'lr': 0.005, 'weight_decay': 0.001, 'n_hidden': 256, 'n_layer': 3, 'dropout': 0.40308559697666696, 'knn_mode': 's', 'k': 36, 'dexp': 8.702308049239026, 'p_grd': 0.6413083205683328, 'unc_rem': 0.46941913626387316, 'unc_rel': 0.9196487916639479}. Best is trial 32 with value: 0.3997448328655269.
    [CPU] Loading amazon-ratings...
    DEBUG 3.1: Dataset init start
    DEBUG 3.2: prepare_data start amazon-ratings
    ----Data statistics------'
    Name: amazon-ratings
    #Nodes 24492
    #Edges 93050
    #Classes 5
    #Ave_degree 7.60
    ----Split statistics------'
    #Train samples 1224 (5.0 % of nodes)
    #Val samples 3673 (15.0 % of nodes)
    #Test samples 19595 (remaining)
    ----label noise information:------
    Instance dependent noise
    #Actual noise rate 0.21
    [cuda:1] LNPCC waiting for GPU slot...
    [cuda:1] Slot acquired (waited 0.0s). Starting GCN...
    FINAL_RESULT: {'acc': {'train': 0.4035947712418301, 'valid': 0.35066702967601415, 'test': 0.3958152589946415}, 'wall_s': 43.3, 'cpu_s': 35.11, 'gpu_s': 8.13, 'wait_s': 0.0}
    [Time] wall=43.3s | cpu=35.1s | gpu=8.1s
    C:\Users\fbrev\Documents\Acadêmico\Simulações\Python\NoisyGL\predictor\Base_Predictor.py:144: UserWarning: Sparse CSR tensor support is in beta state. If you miss a functionality in the sparse tensor support, please submit a feature request to https://github.com/pytorch/pytorch/issues. (Triggered internally at ..\aten\src\ATen\SparseCsrTensorImpl.cpp:55.)
    self.adj_csr = self.adj.to_sparse_csr().to(self.device)
[I 2026-04-27 02:02:07,551] Trial 54 finished with value: 0.3958152589946415 and parameters: {'lr': 0.005, 'weight_decay': 0.001, 'n_hidden': 256, 'n_layer': 3, 'dropout': 0.7309476721222037, 'knn_mode': 's', 'k': 29, 'dexp': 9.44673787247675, 'p_grd': 0.5412530948659222, 'unc_rem': 0.4728873881131055, 'unc_rel': 0.9285946193628972}. Best is trial 32 with value: 0.3997448328655269.
    [CPU] Loading amazon-ratings...
    DEBUG 3.1: Dataset init start
    DEBUG 3.2: prepare_data start amazon-ratings
    ----Data statistics------'
    Name: amazon-ratings
    #Nodes 24492
    #Edges 93050
    #Classes 5
    #Ave_degree 7.60
    ----Split statistics------'
    #Train samples 1224 (5.0 % of nodes)
    #Val samples 3673 (15.0 % of nodes)
    #Test samples 19595 (remaining)
    ----label noise information:------
    Instance dependent noise
    #Actual noise rate 0.21
    [cuda:1] LNPCC waiting for GPU slot...
    [cuda:1] Slot acquired (waited 0.0s). Starting GCN...
    FINAL_RESULT: {'acc': {'train': 0.41094771241830064, 'valid': 0.35039477266539615, 'test': 0.3965807603980607}, 'wall_s': 43.23, 'cpu_s': 39.66, 'gpu_s': 3.51, 'wait_s': 0.0}
    [Time] wall=43.2s | cpu=39.7s | gpu=3.5s
    C:\Users\fbrev\Documents\Acadêmico\Simulações\Python\NoisyGL\predictor\Base_Predictor.py:144: UserWarning: Sparse CSR tensor support is in beta state. If you miss a functionality in the sparse tensor support, please submit a feature request to https://github.com/pytorch/pytorch/issues. (Triggered internally at ..\aten\src\ATen\SparseCsrTensorImpl.cpp:55.)
    self.adj_csr = self.adj.to_sparse_csr().to(self.device)
[I 2026-04-27 02:02:56,338] Trial 55 finished with value: 0.3965807603980607 and parameters: {'lr': 0.005, 'weight_decay': 0.001, 'n_hidden': 64, 'n_layer': 3, 'dropout': 0.256088153076466, 'knn_mode': 's', 'k': 38, 'dexp': 7.93211942815833, 'p_grd': 0.5809707727649208, 'unc_rem': 0.5907717250178932, 'unc_rel': 0.8754686258290896}. Best is trial 32 with value: 0.3997448328655269.
    [CPU] Loading amazon-ratings...
    DEBUG 3.1: Dataset init start
    DEBUG 3.2: prepare_data start amazon-ratings
    ----Data statistics------'
    Name: amazon-ratings
    #Nodes 24492
    #Edges 93050
    #Classes 5
    #Ave_degree 7.60
    ----Split statistics------'
    #Train samples 1224 (5.0 % of nodes)
    #Val samples 3673 (15.0 % of nodes)
    #Test samples 19595 (remaining)
    ----label noise information:------
    Instance dependent noise
    #Actual noise rate 0.21
    [cuda:1] LNPCC waiting for GPU slot...
    [cuda:1] Slot acquired (waited 3.4s). Starting GCN...
    FINAL_RESULT: {'acc': {'train': 0.40441176470588236, 'valid': 0.349033487612306, 'test': 0.39280428680785917}, 'wall_s': 66.72, 'cpu_s': 58.34, 'gpu_s': 8.32, 'wait_s': 3.42}
    [Time] wall=66.7s | cpu=58.3s | gpu=8.3s
    C:\Users\fbrev\Documents\Acadêmico\Simulações\Python\NoisyGL\predictor\Base_Predictor.py:144: UserWarning: Sparse CSR tensor support is in beta state. If you miss a functionality in the sparse tensor support, please submit a feature request to https://github.com/pytorch/pytorch/issues. (Triggered internally at ..\aten\src\ATen\SparseCsrTensorImpl.cpp:55.)
    self.adj_csr = self.adj.to_sparse_csr().to(self.device)
[I 2026-04-27 02:04:12,120] Trial 56 finished with value: 0.39280428680785917 and parameters: {'lr': 0.01, 'weight_decay': 0.0001, 'n_hidden': 256, 'n_layer': 3, 'dropout': 0.649913656163475, 'knn_mode': 's', 'k': 35, 'dexp': 7.311729772500068, 'p_grd': 0.8591746674952669, 'unc_rem': 0.5562137255648919, 'unc_rel': 0.9477021210278698}. Best is trial 32 with value: 0.3997448328655269.
    [CPU] Loading amazon-ratings...
    DEBUG 3.1: Dataset init start
    DEBUG 3.2: prepare_data start amazon-ratings
    ----Data statistics------'
    Name: amazon-ratings
    #Nodes 24492
    #Edges 93050
    #Classes 5
    #Ave_degree 7.60
    ----Split statistics------'
    #Train samples 1224 (5.0 % of nodes)
    #Val samples 3673 (15.0 % of nodes)
    #Test samples 19595 (remaining)
    ----label noise information:------
    Instance dependent noise
    #Actual noise rate 0.21
    [cuda:1] LNPCC waiting for GPU slot...
    [cuda:1] Slot acquired (waited 0.0s). Starting GCN...
    FINAL_RESULT: {'acc': {'train': 0.48284313725490197, 'valid': 0.34576640348488974, 'test': 0.38897677979076295}, 'wall_s': 48.68, 'cpu_s': 43.99, 'gpu_s': 4.64, 'wait_s': 0.0}
    [Time] wall=48.7s | cpu=44.0s | gpu=4.6s
    C:\Users\fbrev\Documents\Acadêmico\Simulações\Python\NoisyGL\predictor\Base_Predictor.py:144: UserWarning: Sparse CSR tensor support is in beta state. If you miss a functionality in the sparse tensor support, please submit a feature request to https://github.com/pytorch/pytorch/issues. (Triggered internally at ..\aten\src\ATen\SparseCsrTensorImpl.cpp:55.)
    self.adj_csr = self.adj.to_sparse_csr().to(self.device)
[I 2026-04-27 02:05:07,083] Trial 57 finished with value: 0.38897677979076295 and parameters: {'lr': 0.1, 'weight_decay': 0.001, 'n_hidden': 256, 'n_layer': 2, 'dropout': 0.478676793333656, 'knn_mode': 's', 'k': 25, 'dexp': 6.5562499885221905, 'p_grd': 0.6312714344914221, 'unc_rem': 0.47469395944188136, 'unc_rel': 0.8051796199683483}. Best is trial 32 with value: 0.3997448328655269.
    [CPU] Loading amazon-ratings...
    DEBUG 3.1: Dataset init start
    DEBUG 3.2: prepare_data start amazon-ratings
    ----Data statistics------'
    Name: amazon-ratings
    #Nodes 24492
    #Edges 93050
    #Classes 5
    #Ave_degree 7.60
    ----Split statistics------'
    #Train samples 1224 (5.0 % of nodes)
    #Val samples 3673 (15.0 % of nodes)
    #Test samples 19595 (remaining)
    ----label noise information:------
    Instance dependent noise
    #Actual noise rate 0.21
    [cuda:1] LNPCC waiting for GPU slot...
    [cuda:1] Slot acquired (waited 0.0s). Starting GCN...
    FINAL_RESULT: {'acc': {'train': 0.42810457516339867, 'valid': 0.34549414647427173, 'test': 0.39566215871395766}, 'wall_s': 55.53, 'cpu_s': 47.44, 'gpu_s': 8.04, 'wait_s': 0.0}
    [Time] wall=55.5s | cpu=47.4s | gpu=8.0s
    C:\Users\fbrev\Documents\Acadêmico\Simulações\Python\NoisyGL\predictor\Base_Predictor.py:144: UserWarning: Sparse CSR tensor support is in beta state. If you miss a functionality in the sparse tensor support, please submit a feature request to https://github.com/pytorch/pytorch/issues. (Triggered internally at ..\aten\src\ATen\SparseCsrTensorImpl.cpp:55.)
    self.adj_csr = self.adj.to_sparse_csr().to(self.device)
[I 2026-04-27 02:06:08,071] Trial 58 finished with value: 0.39566215871395766 and parameters: {'lr': 0.005, 'weight_decay': 0.0, 'n_hidden': 256, 'n_layer': 3, 'dropout': 0.21148209010572835, 'knn_mode': 's', 'k': 13, 'dexp': 8.396646920454096, 'p_grd': 0.7354283581094221, 'unc_rem': 0.53505209670977, 'unc_rel': 0.8984873314153683}. Best is trial 32 with value: 0.3997448328655269.
    [CPU] Loading amazon-ratings...
    DEBUG 3.1: Dataset init start
    DEBUG 3.2: prepare_data start amazon-ratings
    ----Data statistics------'
    Name: amazon-ratings
    #Nodes 24492
    #Edges 93050
    #Classes 5
    #Ave_degree 7.60
    ----Split statistics------'
    #Train samples 1224 (5.0 % of nodes)
    #Val samples 3673 (15.0 % of nodes)
    #Test samples 19595 (remaining)
    ----label noise information:------
    Instance dependent noise
    #Actual noise rate 0.21
    [cuda:1] LNPCC waiting for GPU slot...
    [cuda:1] Slot acquired (waited 0.1s). Starting GCN...
    FINAL_RESULT: {'acc': {'train': 0.4632352941176471, 'valid': 0.34576640348488974, 'test': 0.3834141362592498}, 'wall_s': 51.64, 'cpu_s': 43.42, 'gpu_s': 8.15, 'wait_s': 0.05}
    [Time] wall=51.6s | cpu=43.4s | gpu=8.2s
    C:\Users\fbrev\Documents\Acadêmico\Simulações\Python\NoisyGL\predictor\Base_Predictor.py:144: UserWarning: Sparse CSR tensor support is in beta state. If you miss a functionality in the sparse tensor support, please submit a feature request to https://github.com/pytorch/pytorch/issues. (Triggered internally at ..\aten\src\ATen\SparseCsrTensorImpl.cpp:55.)
    self.adj_csr = self.adj.to_sparse_csr().to(self.device)
[I 2026-04-27 02:07:05,354] Trial 59 finished with value: 0.3834141362592498 and parameters: {'lr': 0.001, 'weight_decay': 0.001, 'n_hidden': 256, 'n_layer': 3, 'dropout': 0.12128243655773607, 'knn_mode': 's', 'k': 40, 'dexp': 9.1208070015125, 'p_grd': 0.6287936499170004, 'unc_rem': 0.26563051684488753, 'unc_rel': 0.8263561791249304}. Best is trial 32 with value: 0.3997448328655269.
    [CPU] Loading amazon-ratings...
    DEBUG 3.1: Dataset init start
    DEBUG 3.2: prepare_data start amazon-ratings
    ----Data statistics------'
    Name: amazon-ratings
    #Nodes 24492
    #Edges 93050
    #Classes 5
    #Ave_degree 7.60
    ----Split statistics------'
    #Train samples 1224 (5.0 % of nodes)
    #Val samples 3673 (15.0 % of nodes)
    #Test samples 19595 (remaining)
    ----label noise information:------
    Instance dependent noise
    #Actual noise rate 0.21
    [cuda:1] LNPCC waiting for GPU slot...
    [cuda:1] Slot acquired (waited 1.2s). Starting GCN...
    FINAL_RESULT: {'acc': {'train': 0.4071954210956664, 'valid': 0.34331609038932753, 'test': 0.3917836182699668}, 'wall_s': 67.27, 'cpu_s': 63.66, 'gpu_s': 3.55, 'wait_s': 1.22}
    [Time] wall=67.3s | cpu=63.7s | gpu=3.6s
    C:\Users\fbrev\Documents\Acadêmico\Simulações\Python\NoisyGL\predictor\Base_Predictor.py:144: UserWarning: Sparse CSR tensor support is in beta state. If you miss a functionality in the sparse tensor support, please submit a feature request to https://github.com/pytorch/pytorch/issues. (Triggered internally at ..\aten\src\ATen\SparseCsrTensorImpl.cpp:55.)
    self.adj_csr = self.adj.to_sparse_csr().to(self.device)
[I 2026-04-27 02:08:19,923] Trial 60 finished with value: 0.3917836182699668 and parameters: {'lr': 0.05, 'weight_decay': 0.0001, 'n_hidden': 64, 'n_layer': 3, 'dropout': 0.03912150578821422, 'knn_mode': 's', 'k': 20, 'dexp': 4.958636006272867, 'p_grd': 0.7769152241771022, 'unc_rem': 0.4231958489210191, 'unc_rel': 0.8553487728288411}. Best is trial 32 with value: 0.3997448328655269.
    [CPU] Loading amazon-ratings...
    DEBUG 3.1: Dataset init start
    DEBUG 3.2: prepare_data start amazon-ratings
    ----Data statistics------'
    Name: amazon-ratings
    #Nodes 24492
    #Edges 93050
    #Classes 5
    #Ave_degree 7.60
    ----Split statistics------'
    #Train samples 1224 (5.0 % of nodes)
    #Val samples 3673 (15.0 % of nodes)
    #Test samples 19595 (remaining)
    ----label noise information:------
    Instance dependent noise
    #Actual noise rate 0.21
    [cuda:1] LNPCC waiting for GPU slot...
    [cuda:1] Slot acquired (waited 4.9s). Starting GCN...
    FINAL_RESULT: {'acc': {'train': 0.22076860179885527, 'valid': 0.3117342771576368, 'test': 0.36851237560602196}, 'wall_s': 43.23, 'cpu_s': 35.07, 'gpu_s': 8.12, 'wait_s': 4.92}
    [Time] wall=43.2s | cpu=35.1s | gpu=8.1s
    C:\Users\fbrev\Documents\Acadêmico\Simulações\Python\NoisyGL\predictor\Base_Predictor.py:144: UserWarning: Sparse CSR tensor support is in beta state. If you miss a functionality in the sparse tensor support, please submit a feature request to https://github.com/pytorch/pytorch/issues. (Triggered internally at ..\aten\src\ATen\SparseCsrTensorImpl.cpp:55.)
    self.adj_csr = self.adj.to_sparse_csr().to(self.device)
