[I 2026-05-04 13:32:02,543] Trial 43 finished with value: 0.7087757021905657 and parameters: {'lr': 0.05, 'weight_decay': 0.0, 'n_hidden': 64, 'n_layer': 3, 'dropout': 0.6089357551052204, 'knn_mode': 's', 'k': 43, 'dexp': 7.89912280201982, 'p_grd': 0.20825765210813368, 'unc_rem': 0.6120603784552622, 'unc_rel': 0.004945881423253196}. Best is trial 26 with value: 0.7100524123101734.
    [CPU] Loading dblp...
    DEBUG 3.1: Dataset init start
    DEBUG 3.2: prepare_data start dblp
    ----Data statistics------'
    Name: dblp
    #Nodes 17716
    #Edges 52867
    #Classes 4
    #Ave_degree 5.97
    ----Split statistics------'
    #Train samples 177 (1.0 % of nodes)
    #Val samples 2657 (15.0 % of nodes)
    #Test samples 14882 (remaining)
    ----label noise information:------
    Instance dependent noise
    #Actual noise rate 0.40
    [cuda:0] LNPCC waiting for GPU slot...
    [cuda:0] Slot acquired (waited 3.1s). Starting GCN...
    FINAL_RESULT: {'acc': {'train': 0.5113636363636364, 'valid': 0.45238991343620627, 'test': 0.6752452627335036}, 'wall_s': 31.24, 'cpu_s': 28.56, 'gpu_s': 2.63, 'wait_s': 3.09}
    [Time] wall=31.2s | cpu=28.6s | gpu=2.6s
    C:\Users\fbrev\Documents\Acadêmico\Simulações\Python\NoisyGL\predictor\Base_Predictor.py:114: UserWarning: expandable_segments not supported on this platform (Triggered internally at ..\c10/cuda/CUDAAllocatorConfig.h:28.)
    self.edge_index = self._cpu_edge_index.to(self.device)
    C:\Users\fbrev\Documents\Acadêmico\Simulações\Python\NoisyGL\predictor\Base_Predictor.py:144: UserWarning: Sparse CSR tensor support is in beta state. If you miss a functionality in the sparse tensor support, please submit a feature request to https://github.com/pytorch/pytorch/issues. (Triggered internally at ..\aten\src\ATen\SparseCsrTensorImpl.cpp:55.)
    self.adj_csr = self.adj.to_sparse_csr().to(self.device)
[I 2026-05-04 13:32:41,512] Trial 44 finished with value: 0.6752452627335036 and parameters: {'lr': 0.05, 'weight_decay': 0.0, 'n_hidden': 64, 'n_layer': 3, 'dropout': 0.7996896262412847, 'knn_mode': 's', 'k': 50, 'dexp': 9.191872424146556, 'p_grd': 0.3002589194158753, 'unc_rem': 0.610033927412853, 'unc_rel': 0.02345627812225462}. Best is trial 26 with value: 0.7100524123101734.
    [CPU] Loading dblp...
    DEBUG 3.1: Dataset init start
    DEBUG 3.2: prepare_data start dblp
    ----Data statistics------'
    Name: dblp
    #Nodes 17716
    #Edges 52867
    #Classes 4
    #Ave_degree 5.97
    ----Split statistics------'
    #Train samples 177 (1.0 % of nodes)
    #Val samples 2657 (15.0 % of nodes)
    #Test samples 14882 (remaining)
    ----label noise information:------
    Instance dependent noise
    #Actual noise rate 0.40
    [cuda:0] LNPCC waiting for GPU slot...
    [cuda:0] Slot acquired (waited 0.0s). Starting GCN...
    FINAL_RESULT: {'acc': {'train': 0.7484662576687117, 'valid': 0.4606699284907791, 'test': 0.7027953232092461}, 'wall_s': 30.11, 'cpu_s': 26.69, 'gpu_s': 3.38, 'wait_s': 0.0}
    [Time] wall=30.1s | cpu=26.7s | gpu=3.4s
    C:\Users\fbrev\Documents\Acadêmico\Simulações\Python\NoisyGL\predictor\Base_Predictor.py:114: UserWarning: expandable_segments not supported on this platform (Triggered internally at ..\c10/cuda/CUDAAllocatorConfig.h:28.)
    self.edge_index = self._cpu_edge_index.to(self.device)
    C:\Users\fbrev\Documents\Acadêmico\Simulações\Python\NoisyGL\predictor\Base_Predictor.py:144: UserWarning: Sparse CSR tensor support is in beta state. If you miss a functionality in the sparse tensor support, please submit a feature request to https://github.com/pytorch/pytorch/issues. (Triggered internally at ..\aten\src\ATen\SparseCsrTensorImpl.cpp:55.)
    self.adj_csr = self.adj.to_sparse_csr().to(self.device)
[I 2026-05-04 13:33:16,530] Trial 45 finished with value: 0.7027953232092461 and parameters: {'lr': 0.05, 'weight_decay': 0.0, 'n_hidden': 128, 'n_layer': 3, 'dropout': 0.6161082131236824, 'knn_mode': 's', 'k': 43, 'dexp': 7.854832881636874, 'p_grd': 0.23304122419310763, 'unc_rem': 0.8222309569671897, 'unc_rel': 0.0059708013022680695}. Best is trial 26 with value: 0.7100524123101734.
    [CPU] Loading dblp...
    DEBUG 3.1: Dataset init start
    DEBUG 3.2: prepare_data start dblp
    ----Data statistics------'
    Name: dblp
    #Nodes 17716
    #Edges 52867
    #Classes 4
    #Ave_degree 5.97
    ----Split statistics------'
    #Train samples 177 (1.0 % of nodes)
    #Val samples 2657 (15.0 % of nodes)
    #Test samples 14882 (remaining)
    ----label noise information:------
    Instance dependent noise
    #Actual noise rate 0.40
    [cuda:0] LNPCC waiting for GPU slot...
    [cuda:0] Slot acquired (waited 5.4s). Starting GCN...
    FINAL_RESULT: {'acc': {'train': 0.7588652482269503, 'valid': 0.45577719232216785, 'test': 0.6794113694395915}, 'wall_s': 30.54, 'cpu_s': 27.2, 'gpu_s': 3.29, 'wait_s': 5.37}
    [Time] wall=30.5s | cpu=27.2s | gpu=3.3s
    C:\Users\fbrev\Documents\Acadêmico\Simulações\Python\NoisyGL\predictor\Base_Predictor.py:114: UserWarning: expandable_segments not supported on this platform (Triggered internally at ..\c10/cuda/CUDAAllocatorConfig.h:28.)
    self.edge_index = self._cpu_edge_index.to(self.device)
    C:\Users\fbrev\Documents\Acadêmico\Simulações\Python\NoisyGL\predictor\Base_Predictor.py:144: UserWarning: Sparse CSR tensor support is in beta state. If you miss a functionality in the sparse tensor support, please submit a feature request to https://github.com/pytorch/pytorch/issues. (Triggered internally at ..\aten\src\ATen\SparseCsrTensorImpl.cpp:55.)
    self.adj_csr = self.adj.to_sparse_csr().to(self.device)
[I 2026-05-04 13:33:57,302] Trial 46 finished with value: 0.6794113694395915 and parameters: {'lr': 0.05, 'weight_decay': 0.0, 'n_hidden': 128, 'n_layer': 3, 'dropout': 0.7378316859636936, 'knn_mode': 's', 'k': 43, 'dexp': 0.30168301608069026, 'p_grd': 0.2551875517031475, 'unc_rem': 0.8422660920294731, 'unc_rel': 0.005250807457141585}. Best is trial 26 with value: 0.7100524123101734.
    [CPU] Loading dblp...
    DEBUG 3.1: Dataset init start
    DEBUG 3.2: prepare_data start dblp
    ----Data statistics------'
    Name: dblp
    #Nodes 17716
    #Edges 52867
    #Classes 4
    #Ave_degree 5.97
    ----Split statistics------'
    #Train samples 177 (1.0 % of nodes)
    #Val samples 2657 (15.0 % of nodes)
    #Test samples 14882 (remaining)
    ----label noise information:------
    Instance dependent noise
    #Actual noise rate 0.40
    [cuda:0] LNPCC waiting for GPU slot...
    [cuda:0] Slot acquired (waited 4.0s). Starting GCN...
    FINAL_RESULT: {'acc': {'train': 0.655367231638418, 'valid': 0.4678208505833647, 'test': 0.7002419029700309}, 'wall_s': 34.2, 'cpu_s': 30.34, 'gpu_s': 3.81, 'wait_s': 4.01}
    [Time] wall=34.2s | cpu=30.3s | gpu=3.8s
    C:\Users\fbrev\Documents\Acadêmico\Simulações\Python\NoisyGL\predictor\Base_Predictor.py:114: UserWarning: expandable_segments not supported on this platform (Triggered internally at ..\c10/cuda/CUDAAllocatorConfig.h:28.)
    self.edge_index = self._cpu_edge_index.to(self.device)
    C:\Users\fbrev\Documents\Acadêmico\Simulações\Python\NoisyGL\predictor\Base_Predictor.py:144: UserWarning: Sparse CSR tensor support is in beta state. If you miss a functionality in the sparse tensor support, please submit a feature request to https://github.com/pytorch/pytorch/issues. (Triggered internally at ..\aten\src\ATen\SparseCsrTensorImpl.cpp:55.)
    self.adj_csr = self.adj.to_sparse_csr().to(self.device)
[I 2026-05-04 13:34:40,192] Trial 47 finished with value: 0.7002419029700309 and parameters: {'lr': 0.05, 'weight_decay': 0.0, 'n_hidden': 128, 'n_layer': 3, 'dropout': 0.6152803731086955, 'knn_mode': 's', 'k': 47, 'dexp': 7.908407769746605, 'p_grd': 0.5539175103751297, 'unc_rem': 0.6901201894439833, 'unc_rel': 0.08716123012046247}. Best is trial 26 with value: 0.7100524123101734.
    [CPU] Loading dblp...
    DEBUG 3.1: Dataset init start
    DEBUG 3.2: prepare_data start dblp
    ----Data statistics------'
    Name: dblp
    #Nodes 17716
    #Edges 52867
    #Classes 4
    #Ave_degree 5.97
    ----Split statistics------'
    #Train samples 177 (1.0 % of nodes)
    #Val samples 2657 (15.0 % of nodes)
    #Test samples 14882 (remaining)
    ----label noise information:------
    Instance dependent noise
    #Actual noise rate 0.40
    [cuda:0] LNPCC waiting for GPU slot...
    [cuda:0] Slot acquired (waited 0.0s). Starting GCN...
    FINAL_RESULT: {'acc': {'train': 0.6432748538011696, 'valid': 0.44975536319156945, 'test': 0.6677193925547641}, 'wall_s': 150.47, 'cpu_s': 146.93, 'gpu_s': 3.5, 'wait_s': 0.0}
    [Time] wall=150.5s | cpu=146.9s | gpu=3.5s
    C:\Users\fbrev\Documents\Acadêmico\Simulações\Python\NoisyGL\predictor\Base_Predictor.py:114: UserWarning: expandable_segments not supported on this platform (Triggered internally at ..\c10/cuda/CUDAAllocatorConfig.h:28.)
    self.edge_index = self._cpu_edge_index.to(self.device)
    C:\Users\fbrev\Documents\Acadêmico\Simulações\Python\NoisyGL\predictor\Base_Predictor.py:144: UserWarning: Sparse CSR tensor support is in beta state. If you miss a functionality in the sparse tensor support, please submit a feature request to https://github.com/pytorch/pytorch/issues. (Triggered internally at ..\aten\src\ATen\SparseCsrTensorImpl.cpp:55.)
    self.adj_csr = self.adj.to_sparse_csr().to(self.device)
[I 2026-05-04 13:37:16,038] Trial 48 finished with value: 0.6677193925547641 and parameters: {'lr': 0.05, 'weight_decay': 0.0, 'n_hidden': 128, 'n_layer': 3, 'dropout': 0.6915293080192849, 'knn_mode': 'd', 'k': 45, 'dexp': 1.7535101274368499, 'p_grd': 0.44945816907617797, 'unc_rem': 0.9273680145459386, 'unc_rel': 0.1328770909416717}. Best is trial 26 with value: 0.7100524123101734.
    [CPU] Loading dblp...
    DEBUG 3.1: Dataset init start
    DEBUG 3.2: prepare_data start dblp
    ----Data statistics------'
    Name: dblp
    #Nodes 17716
    #Edges 52867
    #Classes 4
    #Ave_degree 5.97
    ----Split statistics------'
    #Train samples 177 (1.0 % of nodes)
    #Val samples 2657 (15.0 % of nodes)
    #Test samples 14882 (remaining)
    ----label noise information:------
    Instance dependent noise
    #Actual noise rate 0.40
    [cuda:0] LNPCC waiting for GPU slot...
    [cuda:0] Slot acquired (waited 3.0s). Starting GCN...
    FINAL_RESULT: {'acc': {'train': 0.6704545454545454, 'valid': 0.436206247647723, 'test': 0.6363392017201989}, 'wall_s': 33.56, 'cpu_s': 30.0, 'gpu_s': 3.51, 'wait_s': 3.04}
    [Time] wall=33.6s | cpu=30.0s | gpu=3.5s
    C:\Users\fbrev\Documents\Acadêmico\Simulações\Python\NoisyGL\predictor\Base_Predictor.py:114: UserWarning: expandable_segments not supported on this platform (Triggered internally at ..\c10/cuda/CUDAAllocatorConfig.h:28.)
    self.edge_index = self._cpu_edge_index.to(self.device)
    C:\Users\fbrev\Documents\Acadêmico\Simulações\Python\NoisyGL\predictor\Base_Predictor.py:144: UserWarning: Sparse CSR tensor support is in beta state. If you miss a functionality in the sparse tensor support, please submit a feature request to https://github.com/pytorch/pytorch/issues. (Triggered internally at ..\aten\src\ATen\SparseCsrTensorImpl.cpp:55.)
    self.adj_csr = self.adj.to_sparse_csr().to(self.device)
