[I 2026-04-30 11:39:36,498] Trial 41 finished with value: 0.825 and parameters: {'lr': 0.005, 'weight_decay': 0.001, 'n_hidden': 64, 'n_layer': 2, 'dropout': 0.7957961850301916, 'knn_mode': 'd', 'k': 21, 'dexp': 6.703309628608082, 'p_grd': 0.82015395489235, 'unc_rem': 0.9253593500861123, 'unc_rel': 0.31913495592060676}. Best is trial 38 with value: 0.828.
    [CPU] Loading amazoncom...
    DEBUG 3.1: Dataset init start
    DEBUG 3.2: prepare_data start amazoncom
    ----Data statistics------'
    Name: amazoncom
    #Nodes 13752
    #Edges 245861
    #Classes 10
    #Ave_degree 35.76
    ----Split statistics------'
    #Train samples 200 (20 nodes per class)
    #Val samples 500 (specified)
    #Test samples 1000 (specified)
    ----label noise information:------
    Instance dependent noise
    #Actual noise rate 0.13
    [cuda:0] LNPCC waiting for GPU slot...
    [cuda:0] Slot acquired (waited 160.2s). Starting GCN...
    FINAL_RESULT: {'acc': {'train': 0.79, 'valid': 0.724, 'test': 0.812}, 'wall_s': 41.4, 'cpu_s': 38.26, 'gpu_s': 3.08, 'wait_s': 160.21}
    [Time] wall=41.4s | cpu=38.3s | gpu=3.1s
    C:\Users\fbrev\Documents\Acadêmico\Simulações\Python\NoisyGL\predictor\Base_Predictor.py:144: UserWarning: Sparse CSR tensor support is in beta state. If you miss a functionality in the sparse tensor support, please submit a feature request to https://github.com/pytorch/pytorch/issues. (Triggered internally at ..\aten\src\ATen\SparseCsrTensorImpl.cpp:55.)
    self.adj_csr = self.adj.to_sparse_csr().to(self.device)
[I 2026-04-30 11:43:03,605] Trial 42 finished with value: 0.812 and parameters: {'lr': 0.005, 'weight_decay': 0.001, 'n_hidden': 64, 'n_layer': 2, 'dropout': 0.7312547550617794, 'knn_mode': 'd', 'k': 19, 'dexp': 8.946334369491293, 'p_grd': 0.7008088589412148, 'unc_rem': 0.8143487899206358, 'unc_rel': 0.23352646727458434}. Best is trial 38 with value: 0.828.
    [CPU] Loading amazoncom...
    DEBUG 3.1: Dataset init start
    DEBUG 3.2: prepare_data start amazoncom
    ----Data statistics------'
    Name: amazoncom
    #Nodes 13752
    #Edges 245861
    #Classes 10
    #Ave_degree 35.76
    ----Split statistics------'
    #Train samples 200 (20 nodes per class)
    #Val samples 500 (specified)
    #Test samples 1000 (specified)
    ----label noise information:------
    Instance dependent noise
    #Actual noise rate 0.13
    [cuda:0] LNPCC waiting for GPU slot...
    [cuda:0] Slot acquired (waited 319.6s). Starting GCN...
    FINAL_RESULT: {'acc': {'train': 0.8, 'valid': 0.714, 'test': 0.814}, 'wall_s': 51.28, 'cpu_s': 48.03, 'gpu_s': 3.18, 'wait_s': 319.57}
    [Time] wall=51.3s | cpu=48.0s | gpu=3.2s
    C:\Users\fbrev\Documents\Acadêmico\Simulações\Python\NoisyGL\predictor\Base_Predictor.py:144: UserWarning: Sparse CSR tensor support is in beta state. If you miss a functionality in the sparse tensor support, please submit a feature request to https://github.com/pytorch/pytorch/issues. (Triggered internally at ..\aten\src\ATen\SparseCsrTensorImpl.cpp:55.)
    self.adj_csr = self.adj.to_sparse_csr().to(self.device)
[I 2026-04-30 11:49:19,994] Trial 43 finished with value: 0.814 and parameters: {'lr': 0.005, 'weight_decay': 0.001, 'n_hidden': 64, 'n_layer': 2, 'dropout': 0.744050785152904, 'knn_mode': 'd', 'k': 26, 'dexp': 5.556722423032036, 'p_grd': 0.6185081992205296, 'unc_rem': 0.8563737264506429, 'unc_rel': 0.5047978094082098}. Best is trial 38 with value: 0.828.
    [CPU] Loading amazoncom...
    DEBUG 3.1: Dataset init start
    DEBUG 3.2: prepare_data start amazoncom
    ----Data statistics------'
    Name: amazoncom
    #Nodes 13752
    #Edges 245861
    #Classes 10
    #Ave_degree 35.76
    ----Split statistics------'
    #Train samples 200 (20 nodes per class)
    #Val samples 500 (specified)
    #Test samples 1000 (specified)
    ----label noise information:------
    Instance dependent noise
    #Actual noise rate 0.13
    [cuda:0] LNPCC waiting for GPU slot...
    [cuda:0] Slot acquired (waited 913.5s). Starting GCN...
    FINAL_RESULT: {'acc': {'train': 0.785, 'valid': 0.714, 'test': 0.816}, 'wall_s': 52.9, 'cpu_s': 49.07, 'gpu_s': 3.75, 'wait_s': 913.47}
    [Time] wall=52.9s | cpu=49.1s | gpu=3.7s
    C:\Users\fbrev\Documents\Acadêmico\Simulações\Python\NoisyGL\predictor\Base_Predictor.py:144: UserWarning: Sparse CSR tensor support is in beta state. If you miss a functionality in the sparse tensor support, please submit a feature request to https://github.com/pytorch/pytorch/issues. (Triggered internally at ..\aten\src\ATen\SparseCsrTensorImpl.cpp:55.)
    self.adj_csr = self.adj.to_sparse_csr().to(self.device)
[I 2026-04-30 12:05:32,325] Trial 44 finished with value: 0.816 and parameters: {'lr': 0.005, 'weight_decay': 0.001, 'n_hidden': 64, 'n_layer': 2, 'dropout': 0.6787921991611059, 'knn_mode': 'd', 'k': 23, 'dexp': 6.343443820065586, 'p_grd': 0.8663353850168596, 'unc_rem': 0.7769110524680671, 'unc_rel': 0.3974915716109505}. Best is trial 38 with value: 0.828.
    [CPU] Loading amazoncom...
    DEBUG 3.1: Dataset init start
    DEBUG 3.2: prepare_data start amazoncom
    ----Data statistics------'
    Name: amazoncom
    #Nodes 13752
    #Edges 245861
    #Classes 10
    #Ave_degree 35.76
    ----Split statistics------'
    #Train samples 200 (20 nodes per class)
    #Val samples 500 (specified)
    #Test samples 1000 (specified)
    ----label noise information:------
    Instance dependent noise
    #Actual noise rate 0.13
    [cuda:0] LNPCC waiting for GPU slot...
    [cuda:0] Slot acquired (waited 351.9s). Starting GCN...
    FINAL_RESULT: {'acc': {'train': 0.85, 'valid': 0.712, 'test': 0.827}, 'wall_s': 47.87, 'cpu_s': 42.83, 'gpu_s': 4.96, 'wait_s': 351.93}
    [Time] wall=47.9s | cpu=42.8s | gpu=5.0s
    C:\Users\fbrev\Documents\Acadêmico\Simulações\Python\NoisyGL\predictor\Base_Predictor.py:144: UserWarning: Sparse CSR tensor support is in beta state. If you miss a functionality in the sparse tensor support, please submit a feature request to https://github.com/pytorch/pytorch/issues. (Triggered internally at ..\aten\src\ATen\SparseCsrTensorImpl.cpp:55.)
    self.adj_csr = self.adj.to_sparse_csr().to(self.device)
[I 2026-04-30 12:12:18,303] Trial 45 finished with value: 0.827 and parameters: {'lr': 0.01, 'weight_decay': 0.001, 'n_hidden': 128, 'n_layer': 2, 'dropout': 0.7615111103519276, 'knn_mode': 'd', 'k': 8, 'dexp': 7.921564690942177, 'p_grd': 0.7393418704482855, 'unc_rem': 0.9300759232219615, 'unc_rel': 0.33869308921112884}. Best is trial 38 with value: 0.828.
    [CPU] Loading amazoncom...
    DEBUG 3.1: Dataset init start
    DEBUG 3.2: prepare_data start amazoncom
    ----Data statistics------'
    Name: amazoncom
    #Nodes 13752
    #Edges 245861
    #Classes 10
    #Ave_degree 35.76
    ----Split statistics------'
    #Train samples 200 (20 nodes per class)
    #Val samples 500 (specified)
    #Test samples 1000 (specified)
    ----label noise information:------
    Instance dependent noise
    #Actual noise rate 0.13
    [cuda:0] LNPCC waiting for GPU slot...
    [cuda:0] Slot acquired (waited 180.1s). Starting GCN...
    FINAL_RESULT: {'acc': {'train': 0.8385416666666666, 'valid': 0.7, 'test': 0.829}, 'wall_s': 32.94, 'cpu_s': 28.03, 'gpu_s': 4.83, 'wait_s': 180.12}
    [Time] wall=32.9s | cpu=28.0s | gpu=4.8s
    C:\Users\fbrev\Documents\Acadêmico\Simulações\Python\NoisyGL\predictor\Base_Predictor.py:144: UserWarning: Sparse CSR tensor support is in beta state. If you miss a functionality in the sparse tensor support, please submit a feature request to https://github.com/pytorch/pytorch/issues. (Triggered internally at ..\aten\src\ATen\SparseCsrTensorImpl.cpp:55.)
    self.adj_csr = self.adj.to_sparse_csr().to(self.device)
[I 2026-04-30 12:15:56,808] Trial 46 finished with value: 0.829 and parameters: {'lr': 0.01, 'weight_decay': 0.0, 'n_hidden': 128, 'n_layer': 2, 'dropout': 0.5324957157385524, 'knn_mode': 's', 'k': 7, 'dexp': 9.96846054414452, 'p_grd': 0.9937498876499646, 'unc_rem': 0.938981554609269, 'unc_rel': 0.2077138338328861}. Best is trial 46 with value: 0.829.
    [CPU] Loading amazoncom...
    DEBUG 3.1: Dataset init start
    DEBUG 3.2: prepare_data start amazoncom
    ----Data statistics------'
    Name: amazoncom
    #Nodes 13752
    #Edges 245861
    #Classes 10
    #Ave_degree 35.76
    ----Split statistics------'
    #Train samples 200 (20 nodes per class)
    #Val samples 500 (specified)
    #Test samples 1000 (specified)
    ----label noise information:------
    Instance dependent noise
    #Actual noise rate 0.13
    [cuda:0] LNPCC waiting for GPU slot...
    [cuda:0] Slot acquired (waited 116.0s). Starting GCN...
    FINAL_RESULT: {'acc': {'train': 0.7918781725888325, 'valid': 0.706, 'test': 0.81}, 'wall_s': 42.76, 'cpu_s': 37.85, 'gpu_s': 4.84, 'wait_s': 116.04}
    [Time] wall=42.8s | cpu=37.9s | gpu=4.8s
    C:\Users\fbrev\Documents\Acadêmico\Simulações\Python\NoisyGL\predictor\Base_Predictor.py:144: UserWarning: Sparse CSR tensor support is in beta state. If you miss a functionality in the sparse tensor support, please submit a feature request to https://github.com/pytorch/pytorch/issues. (Triggered internally at ..\aten\src\ATen\SparseCsrTensorImpl.cpp:55.)
    self.adj_csr = self.adj.to_sparse_csr().to(self.device)
[I 2026-04-30 12:18:41,399] Trial 47 finished with value: 0.81 and parameters: {'lr': 0.01, 'weight_decay': 0.0, 'n_hidden': 128, 'n_layer': 2, 'dropout': 0.5420789048150756, 'knn_mode': 's', 'k': 7, 'dexp': 8.56351007501015, 'p_grd': 0.9849224917637597, 'unc_rem': 0.9349410688402221, 'unc_rel': 0.35368526049061777}. Best is trial 46 with value: 0.829.
    [CPU] Loading amazoncom...
    DEBUG 3.1: Dataset init start
    DEBUG 3.2: prepare_data start amazoncom
    ----Data statistics------'
    Name: amazoncom
    #Nodes 13752
    #Edges 245861
    #Classes 10
    #Ave_degree 35.76
    ----Split statistics------'
    #Train samples 200 (20 nodes per class)
    #Val samples 500 (specified)
    #Test samples 1000 (specified)
    ----label noise information:------
    Instance dependent noise
    #Actual noise rate 0.13
    [cuda:0] LNPCC waiting for GPU slot...
    [cuda:0] Slot acquired (waited 326.9s). Starting GCN...
    FINAL_RESULT: {'acc': {'train': 0.7969543147208121, 'valid': 0.706, 'test': 0.779}, 'wall_s': 40.0, 'cpu_s': 35.24, 'gpu_s': 4.69, 'wait_s': 326.87}
    [Time] wall=40.0s | cpu=35.2s | gpu=4.7s
    C:\Users\fbrev\Documents\Acadêmico\Simulações\Python\NoisyGL\predictor\Base_Predictor.py:144: UserWarning: Sparse CSR tensor support is in beta state. If you miss a functionality in the sparse tensor support, please submit a feature request to https://github.com/pytorch/pytorch/issues. (Triggered internally at ..\aten\src\ATen\SparseCsrTensorImpl.cpp:55.)
    self.adj_csr = self.adj.to_sparse_csr().to(self.device)
[I 2026-04-30 12:24:53,798] Trial 48 finished with value: 0.779 and parameters: {'lr': 0.01, 'weight_decay': 0.0, 'n_hidden': 128, 'n_layer': 2, 'dropout': 0.6450629947779066, 'knn_mode': 's', 'k': 10, 'dexp': 9.798579025662702, 'p_grd': 0.9484099237163919, 'unc_rem': 0.8721702379306852, 'unc_rel': 0.2135565128425541}. Best is trial 46 with value: 0.829.
    [CPU] Loading amazoncom...
    DEBUG 3.1: Dataset init start
    DEBUG 3.2: prepare_data start amazoncom
    ----Data statistics------'
    Name: amazoncom
    #Nodes 13752
    #Edges 245861
    #Classes 10
    #Ave_degree 35.76
    ----Split statistics------'
    #Train samples 200 (20 nodes per class)
    #Val samples 500 (specified)
    #Test samples 1000 (specified)
    ----label noise information:------
    Instance dependent noise
    #Actual noise rate 0.13
    [cuda:0] LNPCC waiting for GPU slot...
    [cuda:0] Slot acquired (waited 160.6s). Starting GCN...
    FINAL_RESULT: {'acc': {'train': 0.700507614213198, 'valid': 0.72, 'test': 0.815}, 'wall_s': 43.08, 'cpu_s': 38.4, 'gpu_s': 4.61, 'wait_s': 160.58}
    [Time] wall=43.1s | cpu=38.4s | gpu=4.6s
    C:\Users\fbrev\Documents\Acadêmico\Simulações\Python\NoisyGL\predictor\Base_Predictor.py:144: UserWarning: Sparse CSR tensor support is in beta state. If you miss a functionality in the sparse tensor support, please submit a feature request to https://github.com/pytorch/pytorch/issues. (Triggered internally at ..\aten\src\ATen\SparseCsrTensorImpl.cpp:55.)
    self.adj_csr = self.adj.to_sparse_csr().to(self.device)
