[worker] START lnpcc_pubmed_0.5 gpu=0
[HPO] Starting Phase 1 (Optuna) for lnpcc_pubmed_instance_0.5...
[I 2026-05-06 15:36:51,174] A new study created in RDB with name: lnpcc_pubmed_instance_0.5
    [CPU] Loading pubmed...
    DEBUG 3.1: Dataset init start
    DEBUG 3.2: prepare_data start pubmed
    ----Data statistics------'
    Name: pubmed
    #Nodes 19717
    #Edges 44324
    #Classes 3
    #Ave_degree 4.50
    ----Split statistics------'
    #Train samples 60 (default)
    #Val samples 500 (default)
    #Test samples 1000 (default)
    ----label noise information:------
    Instance dependent noise
    #Actual noise rate 0.50
    [cuda:0] LNPCC waiting for GPU slot...
    [cuda:0] Slot acquired (waited 0.0s). Starting GCN...
[I 2026-05-06 15:37:29,816] Trial 0 finished with value: 0.0 and parameters: {'lr': 0.01, 'weight_decay': 0.0001, 'n_hidden': 256, 'n_layer': 3, 'dropout': 0.7423310186926412, 'knn_mode': 's', 'k': 22, 'dexp': 6.549043457768621, 'p_grd': 0.660643336056814, 'unc_rem': 0.4738128842759197, 'unc_rel': 0.5330175031465186}. Best is trial 0 with value: 0.0.
    [CPU] Loading pubmed...
    DEBUG 3.1: Dataset init start
    DEBUG 3.2: prepare_data start pubmed
    ----Data statistics------'
    Name: pubmed
    #Nodes 19717
    #Edges 44324
    #Classes 3
    #Ave_degree 4.50
    ----Split statistics------'
    #Train samples 60 (default)
    #Val samples 500 (default)
    #Test samples 1000 (default)
    ----label noise information:------
    Instance dependent noise
    #Actual noise rate 0.50
    [cuda:0] LNPCC waiting for GPU slot...
    [cuda:0] Slot acquired (waited 0.0s). Starting GCN...
    FINAL_RESULT: {'acc': {'train': 0.21666666666666667, 'valid': 0.31, 'test': 0.413}, 'wall_s': 30.37, 'cpu_s': 27.74, 'gpu_s': 2.6, 'wait_s': 0.0}
    [Time] wall=30.4s | cpu=27.7s | gpu=2.6s
    C:\Users\fbrev\Documents\Acadêmico\Simulações\Python\NoisyGL\predictor\Base_Predictor.py:114: UserWarning: expandable_segments not supported on this platform (Triggered internally at ..\c10/cuda/CUDAAllocatorConfig.h:28.)
    self.edge_index = self._cpu_edge_index.to(self.device)
    C:\Users\fbrev\Documents\Acadêmico\Simulações\Python\NoisyGL\predictor\Base_Predictor.py:144: UserWarning: Sparse CSR tensor support is in beta state. If you miss a functionality in the sparse tensor support, please submit a feature request to https://github.com/pytorch/pytorch/issues. (Triggered internally at ..\aten\src\ATen\SparseCsrTensorImpl.cpp:55.)
    self.adj_csr = self.adj.to_sparse_csr().to(self.device)
[I 2026-05-06 15:38:06,679] Trial 1 finished with value: 0.413 and parameters: {'lr': 0.005, 'weight_decay': 0.05, 'n_hidden': 32, 'n_layer': 3, 'dropout': 0.07015571555985166, 'knn_mode': 'd', 'k': 8, 'dexp': 9.849369470845739, 'p_grd': 0.478806786720841, 'unc_rem': 0.3038151952343754, 'unc_rel': 0.3631246362119436}. Best is trial 1 with value: 0.413.
    [CPU] Loading pubmed...
    DEBUG 3.1: Dataset init start
    DEBUG 3.2: prepare_data start pubmed
    ----Data statistics------'
    Name: pubmed
    #Nodes 19717
    #Edges 44324
    #Classes 3
    #Ave_degree 4.50
    ----Split statistics------'
    #Train samples 60 (default)
    #Val samples 500 (default)
    #Test samples 1000 (default)
    ----label noise information:------
    Instance dependent noise
    #Actual noise rate 0.50
    [cuda:0] LNPCC waiting for GPU slot...
    [cuda:0] Slot acquired (waited 6.6s). Starting GCN...
    FINAL_RESULT: {'acc': {'train': 0.65, 'valid': 0.356, 'test': 0.542}, 'wall_s': 46.03, 'cpu_s': 42.4, 'gpu_s': 3.59, 'wait_s': 6.55}
    [Time] wall=46.0s | cpu=42.4s | gpu=3.6s
    C:\Users\fbrev\Documents\Acadêmico\Simulações\Python\NoisyGL\predictor\Base_Predictor.py:114: UserWarning: expandable_segments not supported on this platform (Triggered internally at ..\c10/cuda/CUDAAllocatorConfig.h:28.)
    self.edge_index = self._cpu_edge_index.to(self.device)
    C:\Users\fbrev\Documents\Acadêmico\Simulações\Python\NoisyGL\predictor\Base_Predictor.py:144: UserWarning: Sparse CSR tensor support is in beta state. If you miss a functionality in the sparse tensor support, please submit a feature request to https://github.com/pytorch/pytorch/issues. (Triggered internally at ..\aten\src\ATen\SparseCsrTensorImpl.cpp:55.)
    self.adj_csr = self.adj.to_sparse_csr().to(self.device)
[I 2026-05-06 15:39:05,563] Trial 2 finished with value: 0.542 and parameters: {'lr': 0.05, 'weight_decay': 0.0, 'n_hidden': 128, 'n_layer': 3, 'dropout': 0.21625436690386757, 'knn_mode': 'd', 'k': 38, 'dexp': 3.874471529407347, 'p_grd': 0.9881400181698377, 'unc_rem': 0.9181621485275245, 'unc_rel': 0.9675166579372851}. Best is trial 2 with value: 0.542.
    [CPU] Loading pubmed...
    DEBUG 3.1: Dataset init start
    DEBUG 3.2: prepare_data start pubmed
    ----Data statistics------'
    Name: pubmed
    #Nodes 19717
    #Edges 44324
    #Classes 3
    #Ave_degree 4.50
    ----Split statistics------'
    #Train samples 60 (default)
    #Val samples 500 (default)
    #Test samples 1000 (default)
    ----label noise information:------
    Instance dependent noise
    #Actual noise rate 0.50
    [cuda:0] LNPCC waiting for GPU slot...
    [cuda:0] Slot acquired (waited 1.7s). Starting GCN...
    FINAL_RESULT: {'acc': {'train': 0.711864406779661, 'valid': 0.342, 'test': 0.494}, 'wall_s': 33.07, 'cpu_s': 27.04, 'gpu_s': 6.0, 'wait_s': 1.73}
    [Time] wall=33.1s | cpu=27.0s | gpu=6.0s
    C:\Users\fbrev\Documents\Acadêmico\Simulações\Python\NoisyGL\predictor\Base_Predictor.py:114: UserWarning: expandable_segments not supported on this platform (Triggered internally at ..\c10/cuda/CUDAAllocatorConfig.h:28.)
    self.edge_index = self._cpu_edge_index.to(self.device)
    C:\Users\fbrev\Documents\Acadêmico\Simulações\Python\NoisyGL\predictor\Base_Predictor.py:144: UserWarning: Sparse CSR tensor support is in beta state. If you miss a functionality in the sparse tensor support, please submit a feature request to https://github.com/pytorch/pytorch/issues. (Triggered internally at ..\aten\src\ATen\SparseCsrTensorImpl.cpp:55.)
    self.adj_csr = self.adj.to_sparse_csr().to(self.device)
[I 2026-05-06 15:39:46,647] Trial 3 finished with value: 0.494 and parameters: {'lr': 0.01, 'weight_decay': 0.0, 'n_hidden': 256, 'n_layer': 3, 'dropout': 0.7679730381544515, 'knn_mode': 's', 'k': 24, 'dexp': 8.3269203648727, 'p_grd': 0.2184998850946086, 'unc_rem': 0.1269280697305547, 'unc_rel': 0.24879210037068566}. Best is trial 2 with value: 0.542.
    [CPU] Loading pubmed...
    DEBUG 3.1: Dataset init start
    DEBUG 3.2: prepare_data start pubmed
    ----Data statistics------'
    Name: pubmed
    #Nodes 19717
    #Edges 44324
    #Classes 3
    #Ave_degree 4.50
    ----Split statistics------'
    #Train samples 60 (default)
    #Val samples 500 (default)
    #Test samples 1000 (default)
    ----label noise information:------
    Instance dependent noise
    #Actual noise rate 0.50
    [cuda:0] LNPCC waiting for GPU slot...
    [cuda:0] Slot acquired (waited 0.0s). Starting GCN...
    FINAL_RESULT: {'acc': {'train': 0.20754716981132076, 'valid': 0.392, 'test': 0.518}, 'wall_s': 29.86, 'cpu_s': 27.1, 'gpu_s': 2.71, 'wait_s': 0.0}
    [Time] wall=29.9s | cpu=27.1s | gpu=2.7s
    C:\Users\fbrev\Documents\Acadêmico\Simulações\Python\NoisyGL\predictor\Base_Predictor.py:114: UserWarning: expandable_segments not supported on this platform (Triggered internally at ..\c10/cuda/CUDAAllocatorConfig.h:28.)
    self.edge_index = self._cpu_edge_index.to(self.device)
    C:\Users\fbrev\Documents\Acadêmico\Simulações\Python\NoisyGL\predictor\Base_Predictor.py:144: UserWarning: Sparse CSR tensor support is in beta state. If you miss a functionality in the sparse tensor support, please submit a feature request to https://github.com/pytorch/pytorch/issues. (Triggered internally at ..\aten\src\ATen\SparseCsrTensorImpl.cpp:55.)
    self.adj_csr = self.adj.to_sparse_csr().to(self.device)
[I 2026-05-06 15:40:23,097] Trial 4 finished with value: 0.518 and parameters: {'lr': 0.001, 'weight_decay': 0.01, 'n_hidden': 32, 'n_layer': 3, 'dropout': 0.7038458031184676, 'knn_mode': 's', 'k': 9, 'dexp': 2.686398662779987, 'p_grd': 0.260480876024059, 'unc_rem': 0.11716653894410789, 'unc_rel': 0.0855185384292958}. Best is trial 2 with value: 0.542.
    [CPU] Loading pubmed...
    DEBUG 3.1: Dataset init start
    DEBUG 3.2: prepare_data start pubmed
    ----Data statistics------'
    Name: pubmed
    #Nodes 19717
    #Edges 44324
    #Classes 3
    #Ave_degree 4.50
    ----Split statistics------'
    #Train samples 60 (default)
    #Val samples 500 (default)
    #Test samples 1000 (default)
    ----label noise information:------
    Instance dependent noise
    #Actual noise rate 0.50
    [cuda:0] LNPCC waiting for GPU slot...
    [cuda:0] Slot acquired (waited 0.0s). Starting GCN...
    FINAL_RESULT: {'acc': {'train': 0.8333333333333334, 'valid': 0.338, 'test': 0.46}, 'wall_s': 31.07, 'cpu_s': 25.28, 'gpu_s': 5.75, 'wait_s': 0.0}
    [Time] wall=31.1s | cpu=25.3s | gpu=5.8s
    C:\Users\fbrev\Documents\Acadêmico\Simulações\Python\NoisyGL\predictor\Base_Predictor.py:114: UserWarning: expandable_segments not supported on this platform (Triggered internally at ..\c10/cuda/CUDAAllocatorConfig.h:28.)
    self.edge_index = self._cpu_edge_index.to(self.device)
    C:\Users\fbrev\Documents\Acadêmico\Simulações\Python\NoisyGL\predictor\Base_Predictor.py:144: UserWarning: Sparse CSR tensor support is in beta state. If you miss a functionality in the sparse tensor support, please submit a feature request to https://github.com/pytorch/pytorch/issues. (Triggered internally at ..\aten\src\ATen\SparseCsrTensorImpl.cpp:55.)
    self.adj_csr = self.adj.to_sparse_csr().to(self.device)
[I 2026-05-06 15:41:00,912] Trial 5 finished with value: 0.46 and parameters: {'lr': 0.005, 'weight_decay': 0.001, 'n_hidden': 256, 'n_layer': 3, 'dropout': 0.5081407678113709, 'knn_mode': 's', 'k': 6, 'dexp': 8.201233283460219, 'p_grd': 0.7144216630336351, 'unc_rem': 0.6840438102211569, 'unc_rel': 0.7616068797550649}. Best is trial 2 with value: 0.542.
    [CPU] Loading pubmed...
    DEBUG 3.1: Dataset init start
    DEBUG 3.2: prepare_data start pubmed
    ----Data statistics------'
    Name: pubmed
    #Nodes 19717
    #Edges 44324
    #Classes 3
    #Ave_degree 4.50
    ----Split statistics------'
    #Train samples 60 (default)
    #Val samples 500 (default)
    #Test samples 1000 (default)
    ----label noise information:------
    Instance dependent noise
    #Actual noise rate 0.50
    [cuda:0] LNPCC waiting for GPU slot...
    [cuda:0] Slot acquired (waited 3.7s). Starting GCN...
    FINAL_RESULT: {'acc': {'train': 0.94, 'valid': 0.35, 'test': 0.465}, 'wall_s': 24.46, 'cpu_s': 20.57, 'gpu_s': 3.86, 'wait_s': 3.7}
    [Time] wall=24.5s | cpu=20.6s | gpu=3.9s
    C:\Users\fbrev\Documents\Acadêmico\Simulações\Python\NoisyGL\predictor\Base_Predictor.py:114: UserWarning: expandable_segments not supported on this platform (Triggered internally at ..\c10/cuda/CUDAAllocatorConfig.h:28.)
    self.edge_index = self._cpu_edge_index.to(self.device)
    C:\Users\fbrev\Documents\Acadêmico\Simulações\Python\NoisyGL\predictor\Base_Predictor.py:144: UserWarning: Sparse CSR tensor support is in beta state. If you miss a functionality in the sparse tensor support, please submit a feature request to https://github.com/pytorch/pytorch/issues. (Triggered internally at ..\aten\src\ATen\SparseCsrTensorImpl.cpp:55.)
    self.adj_csr = self.adj.to_sparse_csr().to(self.device)
[I 2026-05-06 15:41:35,261] Trial 6 finished with value: 0.465 and parameters: {'lr': 0.05, 'weight_decay': 0.001, 'n_hidden': 128, 'n_layer': 3, 'dropout': 0.7020473327625294, 'knn_mode': 'd', 'k': 15, 'dexp': 0.5878486504011348, 'p_grd': 0.011335731587640785, 'unc_rem': 0.5858998350477302, 'unc_rel': 0.7226749298158259}. Best is trial 2 with value: 0.542.
    [CPU] Loading pubmed...
    DEBUG 3.1: Dataset init start
    DEBUG 3.2: prepare_data start pubmed
    ----Data statistics------'
    Name: pubmed
    #Nodes 19717
    #Edges 44324
    #Classes 3
    #Ave_degree 4.50
    ----Split statistics------'
    #Train samples 60 (default)
    #Val samples 500 (default)
    #Test samples 1000 (default)
    ----label noise information:------
    Instance dependent noise
    #Actual noise rate 0.50
    [cuda:0] LNPCC waiting for GPU slot...
    [cuda:0] Slot acquired (waited 0.0s). Starting GCN...
    FINAL_RESULT: {'acc': {'train': 1.0, 'valid': 0.336, 'test': 0.425}, 'wall_s': 29.59, 'cpu_s': 27.19, 'gpu_s': 2.37, 'wait_s': 0.0}
    [Time] wall=29.6s | cpu=27.2s | gpu=2.4s
    C:\Users\fbrev\Documents\Acadêmico\Simulações\Python\NoisyGL\predictor\Base_Predictor.py:114: UserWarning: expandable_segments not supported on this platform (Triggered internally at ..\c10/cuda/CUDAAllocatorConfig.h:28.)
    self.edge_index = self._cpu_edge_index.to(self.device)
    C:\Users\fbrev\Documents\Acadêmico\Simulações\Python\NoisyGL\predictor\Base_Predictor.py:144: UserWarning: Sparse CSR tensor support is in beta state. If you miss a functionality in the sparse tensor support, please submit a feature request to https://github.com/pytorch/pytorch/issues. (Triggered internally at ..\aten\src\ATen\SparseCsrTensorImpl.cpp:55.)
    self.adj_csr = self.adj.to_sparse_csr().to(self.device)
[I 2026-05-06 15:42:11,367] Trial 7 finished with value: 0.425 and parameters: {'lr': 0.005, 'weight_decay': 0.001, 'n_hidden': 64, 'n_layer': 2, 'dropout': 0.6564195734694973, 'knn_mode': 's', 'k': 7, 'dexp': 7.467726416853233, 'p_grd': 0.32445350005580476, 'unc_rem': 0.16404940716158267, 'unc_rel': 0.28013196087250636}. Best is trial 2 with value: 0.542.
    [CPU] Loading pubmed...
    DEBUG 3.1: Dataset init start
    DEBUG 3.2: prepare_data start pubmed
    ----Data statistics------'
    Name: pubmed
    #Nodes 19717
    #Edges 44324
    #Classes 3
    #Ave_degree 4.50
    ----Split statistics------'
    #Train samples 60 (default)
    #Val samples 500 (default)
    #Test samples 1000 (default)
    ----label noise information:------
    Instance dependent noise
    #Actual noise rate 0.50
    [cuda:0] LNPCC waiting for GPU slot...
    [cuda:0] Slot acquired (waited 0.0s). Starting GCN...
    FINAL_RESULT: {'acc': {'train': 1.0, 'valid': 0.35, 'test': 0.458}, 'wall_s': 42.36, 'cpu_s': 38.58, 'gpu_s': 3.73, 'wait_s': 0.0}
    [Time] wall=42.4s | cpu=38.6s | gpu=3.7s
    C:\Users\fbrev\Documents\Acadêmico\Simulações\Python\NoisyGL\predictor\Base_Predictor.py:114: UserWarning: expandable_segments not supported on this platform (Triggered internally at ..\c10/cuda/CUDAAllocatorConfig.h:28.)
    self.edge_index = self._cpu_edge_index.to(self.device)
    C:\Users\fbrev\Documents\Acadêmico\Simulações\Python\NoisyGL\predictor\Base_Predictor.py:144: UserWarning: Sparse CSR tensor support is in beta state. If you miss a functionality in the sparse tensor support, please submit a feature request to https://github.com/pytorch/pytorch/issues. (Triggered internally at ..\aten\src\ATen\SparseCsrTensorImpl.cpp:55.)
    self.adj_csr = self.adj.to_sparse_csr().to(self.device)
[I 2026-05-06 15:43:00,176] Trial 8 finished with value: 0.458 and parameters: {'lr': 0.01, 'weight_decay': 0.001, 'n_hidden': 256, 'n_layer': 2, 'dropout': 0.3294390530051932, 'knn_mode': 'd', 'k': 49, 'dexp': 9.06038712732777, 'p_grd': 0.8773552621619033, 'unc_rem': 0.897822936218505, 'unc_rel': 0.3722181582772752}. Best is trial 2 with value: 0.542.
    [CPU] Loading pubmed...
    DEBUG 3.1: Dataset init start
    DEBUG 3.2: prepare_data start pubmed
    ----Data statistics------'
    Name: pubmed
    #Nodes 19717
    #Edges 44324
    #Classes 3
    #Ave_degree 4.50
    ----Split statistics------'
    #Train samples 60 (default)
    #Val samples 500 (default)
    #Test samples 1000 (default)
    ----label noise information:------
    Instance dependent noise
    #Actual noise rate 0.50
    [cuda:0] LNPCC waiting for GPU slot...
    [cuda:0] Slot acquired (waited 0.0s). Starting GCN...
    FINAL_RESULT: {'acc': {'train': 0.26666666666666666, 'valid': 0.3, 'test': 0.413}, 'wall_s': 30.0, 'cpu_s': 26.07, 'gpu_s': 3.89, 'wait_s': 0.0}
    [Time] wall=30.0s | cpu=26.1s | gpu=3.9s
    C:\Users\fbrev\Documents\Acadêmico\Simulações\Python\NoisyGL\predictor\Base_Predictor.py:114: UserWarning: expandable_segments not supported on this platform (Triggered internally at ..\c10/cuda/CUDAAllocatorConfig.h:28.)
    self.edge_index = self._cpu_edge_index.to(self.device)
    C:\Users\fbrev\Documents\Acadêmico\Simulações\Python\NoisyGL\predictor\Base_Predictor.py:144: UserWarning: Sparse CSR tensor support is in beta state. If you miss a functionality in the sparse tensor support, please submit a feature request to https://github.com/pytorch/pytorch/issues. (Triggered internally at ..\aten\src\ATen\SparseCsrTensorImpl.cpp:55.)
    self.adj_csr = self.adj.to_sparse_csr().to(self.device)
[I 2026-05-06 15:43:37,044] Trial 9 finished with value: 0.413 and parameters: {'lr': 0.005, 'weight_decay': 0.05, 'n_hidden': 128, 'n_layer': 3, 'dropout': 0.773886541698701, 'knn_mode': 's', 'k': 18, 'dexp': 8.269728185343707, 'p_grd': 0.2593333173174225, 'unc_rem': 0.40038097716656995, 'unc_rel': 0.6395700032731858}. Best is trial 2 with value: 0.542.
    [CPU] Loading pubmed...
    DEBUG 3.1: Dataset init start
    DEBUG 3.2: prepare_data start pubmed
    ----Data statistics------'
    Name: pubmed
    #Nodes 19717
    #Edges 44324
    #Classes 3
    #Ave_degree 4.50
    ----Split statistics------'
    #Train samples 60 (default)
    #Val samples 500 (default)
    #Test samples 1000 (default)
    ----label noise information:------
    Instance dependent noise
    #Actual noise rate 0.50
    [cuda:0] LNPCC waiting for GPU slot...
    [cuda:0] Slot acquired (waited 0.0s). Starting GCN...
    FINAL_RESULT: {'acc': {'train': 0.9833333333333333, 'valid': 0.332, 'test': 0.424}, 'wall_s': 29.98, 'cpu_s': 26.7, 'gpu_s': 3.24, 'wait_s': 0.0}
    [Time] wall=30.0s | cpu=26.7s | gpu=3.2s
    C:\Users\fbrev\Documents\Acadêmico\Simulações\Python\NoisyGL\predictor\Base_Predictor.py:114: UserWarning: expandable_segments not supported on this platform (Triggered internally at ..\c10/cuda/CUDAAllocatorConfig.h:28.)
    self.edge_index = self._cpu_edge_index.to(self.device)
    C:\Users\fbrev\Documents\Acadêmico\Simulações\Python\NoisyGL\predictor\Base_Predictor.py:144: UserWarning: Sparse CSR tensor support is in beta state. If you miss a functionality in the sparse tensor support, please submit a feature request to https://github.com/pytorch/pytorch/issues. (Triggered internally at ..\aten\src\ATen\SparseCsrTensorImpl.cpp:55.)
    self.adj_csr = self.adj.to_sparse_csr().to(self.device)
[I 2026-05-06 15:44:13,628] Trial 10 finished with value: 0.424 and parameters: {'lr': 0.001, 'weight_decay': 0.0001, 'n_hidden': 64, 'n_layer': 3, 'dropout': 0.5010717996397103, 'knn_mode': 's', 'k': 31, 'dexp': 8.74303814548153, 'p_grd': 0.20174722186804284, 'unc_rem': 0.7503910147836939, 'unc_rel': 0.2507056072345083}. Best is trial 2 with value: 0.542.
    [CPU] Loading pubmed...
    DEBUG 3.1: Dataset init start
    DEBUG 3.2: prepare_data start pubmed
    ----Data statistics------'
    Name: pubmed
    #Nodes 19717
    #Edges 44324
    #Classes 3
    #Ave_degree 4.50
    ----Split statistics------'
    #Train samples 60 (default)
    #Val samples 500 (default)
    #Test samples 1000 (default)
    ----label noise information:------
    Instance dependent noise
    #Actual noise rate 0.50
    [cuda:0] LNPCC waiting for GPU slot...
    [cuda:0] Slot acquired (waited 0.0s). Starting GCN...
    FINAL_RESULT: {'acc': {'train': 0.36666666666666664, 'valid': 0.368, 'test': 0.366}, 'wall_s': 36.55, 'cpu_s': 34.25, 'gpu_s': 2.25, 'wait_s': 0.0}
    [Time] wall=36.5s | cpu=34.3s | gpu=2.3s
    C:\Users\fbrev\Documents\Acadêmico\Simulações\Python\NoisyGL\predictor\Base_Predictor.py:114: UserWarning: expandable_segments not supported on this platform (Triggered internally at ..\c10/cuda/CUDAAllocatorConfig.h:28.)
    self.edge_index = self._cpu_edge_index.to(self.device)
    C:\Users\fbrev\Documents\Acadêmico\Simulações\Python\NoisyGL\predictor\Base_Predictor.py:144: UserWarning: Sparse CSR tensor support is in beta state. If you miss a functionality in the sparse tensor support, please submit a feature request to https://github.com/pytorch/pytorch/issues. (Triggered internally at ..\aten\src\ATen\SparseCsrTensorImpl.cpp:55.)
    self.adj_csr = self.adj.to_sparse_csr().to(self.device)
