[I 2026-05-01 01:22:44,078] Trial 84 finished with value: 0.826 and parameters: {'lr': 0.005, 'weight_decay': 0.01, 'n_hidden': 256, 'n_layer': 2, 'dropout': 0.6653022438344515, 'knn_mode': 's', 'k': 44, 'dexp': 6.608469456544409, 'p_grd': 0.49741319481311, 'unc_rem': 0.8802182011522663, 'unc_rel': 0.4456087979813819}. Best is trial 74 with value: 0.838.
    [CPU] Loading amazoncom...
    DEBUG 3.1: Dataset init start
    DEBUG 3.2: prepare_data start amazoncom
    ----Data statistics------'
    Name: amazoncom
    #Nodes 13752
    #Edges 245861
    #Classes 10
    #Ave_degree 35.76
    ----Split statistics------'
    #Train samples 200 (20 nodes per class)
    #Val samples 500 (specified)
    #Test samples 1000 (specified)
    ----label noise information:------
    Instance dependent noise
    #Actual noise rate 0.20
    [cuda:0] LNPCC waiting for GPU slot...
    [cuda:0] Slot acquired (waited 401.0s). Starting GCN...
    FINAL_RESULT: {'acc': {'train': 0.7878787878787878, 'valid': 0.662, 'test': 0.803}, 'wall_s': 50.14, 'cpu_s': 41.6, 'gpu_s': 8.48, 'wait_s': 401.02}
    [Time] wall=50.1s | cpu=41.6s | gpu=8.5s
    C:\Users\fbrev\Documents\Acadêmico\Simulações\Python\NoisyGL\predictor\Base_Predictor.py:144: UserWarning: Sparse CSR tensor support is in beta state. If you miss a functionality in the sparse tensor support, please submit a feature request to https://github.com/pytorch/pytorch/issues. (Triggered internally at ..\aten\src\ATen\SparseCsrTensorImpl.cpp:55.)
    self.adj_csr = self.adj.to_sparse_csr().to(self.device)
[I 2026-05-01 01:30:20,753] Trial 85 finished with value: 0.803 and parameters: {'lr': 0.005, 'weight_decay': 0.01, 'n_hidden': 256, 'n_layer': 2, 'dropout': 0.19314335489404508, 'knn_mode': 's', 'k': 48, 'dexp': 7.174060418420246, 'p_grd': 0.6212696848368555, 'unc_rem': 0.9153455588194823, 'unc_rel': 0.3349275822169827}. Best is trial 74 with value: 0.838.
    [CPU] Loading amazoncom...
    DEBUG 3.1: Dataset init start
    DEBUG 3.2: prepare_data start amazoncom
    ----Data statistics------'
    Name: amazoncom
    #Nodes 13752
    #Edges 245861
    #Classes 10
    #Ave_degree 35.76
    ----Split statistics------'
    #Train samples 200 (20 nodes per class)
    #Val samples 500 (specified)
    #Test samples 1000 (specified)
    ----label noise information:------
    Instance dependent noise
    #Actual noise rate 0.20
    [cuda:0] LNPCC waiting for GPU slot...
    [cuda:0] Slot acquired (waited 542.2s). Starting GCN...
    FINAL_RESULT: {'acc': {'train': 0.6767676767676768, 'valid': 0.622, 'test': 0.786}, 'wall_s': 45.82, 'cpu_s': 37.33, 'gpu_s': 8.4, 'wait_s': 542.18}
    [Time] wall=45.8s | cpu=37.3s | gpu=8.4s
    C:\Users\fbrev\Documents\Acadêmico\Simulações\Python\NoisyGL\predictor\Base_Predictor.py:144: UserWarning: Sparse CSR tensor support is in beta state. If you miss a functionality in the sparse tensor support, please submit a feature request to https://github.com/pytorch/pytorch/issues. (Triggered internally at ..\aten\src\ATen\SparseCsrTensorImpl.cpp:55.)
    self.adj_csr = self.adj.to_sparse_csr().to(self.device)
[I 2026-05-01 01:40:14,534] Trial 86 finished with value: 0.786 and parameters: {'lr': 0.005, 'weight_decay': 0.05, 'n_hidden': 256, 'n_layer': 2, 'dropout': 0.777563931234518, 'knn_mode': 's', 'k': 46, 'dexp': 8.04098240872379, 'p_grd': 0.5272962913468621, 'unc_rem': 0.9602911689371244, 'unc_rel': 0.3765672095357675}. Best is trial 74 with value: 0.838.
    [CPU] Loading amazoncom...
    DEBUG 3.1: Dataset init start
    DEBUG 3.2: prepare_data start amazoncom
    ----Data statistics------'
    Name: amazoncom
    #Nodes 13752
    #Edges 245861
    #Classes 10
    #Ave_degree 35.76
    ----Split statistics------'
    #Train samples 200 (20 nodes per class)
    #Val samples 500 (specified)
    #Test samples 1000 (specified)
    ----label noise information:------
    Instance dependent noise
    #Actual noise rate 0.20
    [cuda:0] LNPCC waiting for GPU slot...
    [cuda:0] Slot acquired (waited 111.7s). Starting GCN...
    FINAL_RESULT: {'acc': {'train': 0.7171717171717171, 'valid': 0.656, 'test': 0.806}, 'wall_s': 46.91, 'cpu_s': 38.32, 'gpu_s': 8.53, 'wait_s': 111.71}
    [Time] wall=46.9s | cpu=38.3s | gpu=8.5s
    C:\Users\fbrev\Documents\Acadêmico\Simulações\Python\NoisyGL\predictor\Base_Predictor.py:144: UserWarning: Sparse CSR tensor support is in beta state. If you miss a functionality in the sparse tensor support, please submit a feature request to https://github.com/pytorch/pytorch/issues. (Triggered internally at ..\aten\src\ATen\SparseCsrTensorImpl.cpp:55.)
    self.adj_csr = self.adj.to_sparse_csr().to(self.device)
[I 2026-05-01 01:42:58,797] Trial 87 finished with value: 0.806 and parameters: {'lr': 0.005, 'weight_decay': 0.01, 'n_hidden': 256, 'n_layer': 2, 'dropout': 0.7979073002220617, 'knn_mode': 's', 'k': 50, 'dexp': 5.505099104497912, 'p_grd': 0.5624134411230498, 'unc_rem': 0.8453376061286606, 'unc_rel': 0.41348474417357456}. Best is trial 74 with value: 0.838.
    [CPU] Loading amazoncom...
    DEBUG 3.1: Dataset init start
    DEBUG 3.2: prepare_data start amazoncom
    ----Data statistics------'
    Name: amazoncom
    #Nodes 13752
    #Edges 245861
    #Classes 10
    #Ave_degree 35.76
    ----Split statistics------'
    #Train samples 200 (20 nodes per class)
    #Val samples 500 (specified)
    #Test samples 1000 (specified)
    ----label noise information:------
    Instance dependent noise
    #Actual noise rate 0.20
    [cuda:0] LNPCC waiting for GPU slot...
    [cuda:0] Slot acquired (waited 93.6s). Starting GCN...
    FINAL_RESULT: {'acc': {'train': 0.8, 'valid': 0.662, 'test': 0.817}, 'wall_s': 50.16, 'cpu_s': 41.64, 'gpu_s': 8.46, 'wait_s': 93.62}
    [Time] wall=50.2s | cpu=41.6s | gpu=8.5s
    C:\Users\fbrev\Documents\Acadêmico\Simulações\Python\NoisyGL\predictor\Base_Predictor.py:144: UserWarning: Sparse CSR tensor support is in beta state. If you miss a functionality in the sparse tensor support, please submit a feature request to https://github.com/pytorch/pytorch/issues. (Triggered internally at ..\aten\src\ATen\SparseCsrTensorImpl.cpp:55.)
    self.adj_csr = self.adj.to_sparse_csr().to(self.device)
[I 2026-05-01 01:45:28,089] Trial 88 finished with value: 0.817 and parameters: {'lr': 0.005, 'weight_decay': 0.01, 'n_hidden': 256, 'n_layer': 2, 'dropout': 0.6035648877905937, 'knn_mode': 'd', 'k': 44, 'dexp': 7.427627817831581, 'p_grd': 0.4339402013228033, 'unc_rem': 0.971249307096193, 'unc_rel': 0.4706813762080518}. Best is trial 74 with value: 0.838.
    [CPU] Loading amazoncom...
    DEBUG 3.1: Dataset init start
    DEBUG 3.2: prepare_data start amazoncom
    ----Data statistics------'
    Name: amazoncom
    #Nodes 13752
    #Edges 245861
    #Classes 10
    #Ave_degree 35.76
    ----Split statistics------'
    #Train samples 200 (20 nodes per class)
    #Val samples 500 (specified)
    #Test samples 1000 (specified)
    ----label noise information:------
    Instance dependent noise
    #Actual noise rate 0.20
    [cuda:0] LNPCC waiting for GPU slot...
    [cuda:0] Slot acquired (waited 236.3s). Starting GCN...
    FINAL_RESULT: {'acc': {'train': 0.8134715025906736, 'valid': 0.642, 'test': 0.805}, 'wall_s': 55.77, 'cpu_s': 47.1, 'gpu_s': 8.58, 'wait_s': 236.28}
    [Time] wall=55.8s | cpu=47.1s | gpu=8.6s
    C:\Users\fbrev\Documents\Acadêmico\Simulações\Python\NoisyGL\predictor\Base_Predictor.py:144: UserWarning: Sparse CSR tensor support is in beta state. If you miss a functionality in the sparse tensor support, please submit a feature request to https://github.com/pytorch/pytorch/issues. (Triggered internally at ..\aten\src\ATen\SparseCsrTensorImpl.cpp:55.)
    self.adj_csr = self.adj.to_sparse_csr().to(self.device)
[I 2026-05-01 01:50:26,223] Trial 89 finished with value: 0.805 and parameters: {'lr': 0.01, 'weight_decay': 0.01, 'n_hidden': 256, 'n_layer': 2, 'dropout': 0.08868292598332286, 'knn_mode': 's', 'k': 47, 'dexp': 1.2012981931758677, 'p_grd': 0.7117828432227866, 'unc_rem': 0.8842480906635816, 'unc_rel': 0.2987869557258031}. Best is trial 74 with value: 0.838.
    [CPU] Loading amazoncom...
    DEBUG 3.1: Dataset init start
    DEBUG 3.2: prepare_data start amazoncom
    ----Data statistics------'
    Name: amazoncom
    #Nodes 13752
    #Edges 245861
    #Classes 10
    #Ave_degree 35.76
    ----Split statistics------'
    #Train samples 200 (20 nodes per class)
    #Val samples 500 (specified)
    #Test samples 1000 (specified)
    ----label noise information:------
    Instance dependent noise
    #Actual noise rate 0.20
    [cuda:0] LNPCC waiting for GPU slot...
    [cuda:0] Slot acquired (waited 102.2s). Starting GCN...
    FINAL_RESULT: {'acc': {'train': 0.7171717171717171, 'valid': 0.644, 'test': 0.806}, 'wall_s': 43.17, 'cpu_s': 34.14, 'gpu_s': 8.94, 'wait_s': 102.15}
    [Time] wall=43.2s | cpu=34.1s | gpu=8.9s
    C:\Users\fbrev\Documents\Acadêmico\Simulações\Python\NoisyGL\predictor\Base_Predictor.py:144: UserWarning: Sparse CSR tensor support is in beta state. If you miss a functionality in the sparse tensor support, please submit a feature request to https://github.com/pytorch/pytorch/issues. (Triggered internally at ..\aten\src\ATen\SparseCsrTensorImpl.cpp:55.)
    self.adj_csr = self.adj.to_sparse_csr().to(self.device)
[I 2026-05-01 01:52:59,981] Trial 90 finished with value: 0.806 and parameters: {'lr': 0.005, 'weight_decay': 0.0, 'n_hidden': 256, 'n_layer': 2, 'dropout': 0.6228839851129571, 'knn_mode': 's', 'k': 49, 'dexp': 6.931928891912165, 'p_grd': 0.5885097188705211, 'unc_rem': 0.8124697821432407, 'unc_rel': 0.35408345626366455}. Best is trial 74 with value: 0.838.
    [CPU] Loading amazoncom...
    DEBUG 3.1: Dataset init start
    DEBUG 3.2: prepare_data start amazoncom
    ----Data statistics------'
    Name: amazoncom
    #Nodes 13752
    #Edges 245861
    #Classes 10
    #Ave_degree 35.76
    ----Split statistics------'
    #Train samples 200 (20 nodes per class)
    #Val samples 500 (specified)
    #Test samples 1000 (specified)
    ----label noise information:------
    Instance dependent noise
    #Actual noise rate 0.20
    [cuda:0] LNPCC waiting for GPU slot...
    [cuda:0] Slot acquired (waited 102.9s). Starting GCN...
    FINAL_RESULT: {'acc': {'train': 0.3081081081081081, 'valid': 0.344, 'test': 0.4}, 'wall_s': 47.06, 'cpu_s': 38.83, 'gpu_s': 8.15, 'wait_s': 102.89}
    [Time] wall=47.1s | cpu=38.8s | gpu=8.1s
    C:\Users\fbrev\Documents\Acadêmico\Simulações\Python\NoisyGL\predictor\Base_Predictor.py:144: UserWarning: Sparse CSR tensor support is in beta state. If you miss a functionality in the sparse tensor support, please submit a feature request to https://github.com/pytorch/pytorch/issues. (Triggered internally at ..\aten\src\ATen\SparseCsrTensorImpl.cpp:55.)
    self.adj_csr = self.adj.to_sparse_csr().to(self.device)
[I 2026-05-01 01:55:36,205] Trial 91 finished with value: 0.4 and parameters: {'lr': 0.05, 'weight_decay': 0.0001, 'n_hidden': 256, 'n_layer': 2, 'dropout': 0.5600468347384172, 'knn_mode': 's', 'k': 43, 'dexp': 3.336020069520745, 'p_grd': 0.6619300925874176, 'unc_rem': 0.012074375402534254, 'unc_rel': 0.3982405008650868}. Best is trial 74 with value: 0.838.
    [CPU] Loading amazoncom...
    DEBUG 3.1: Dataset init start
    DEBUG 3.2: prepare_data start amazoncom
    ----Data statistics------'
    Name: amazoncom
    #Nodes 13752
    #Edges 245861
    #Classes 10
    #Ave_degree 35.76
    ----Split statistics------'
    #Train samples 200 (20 nodes per class)
    #Val samples 500 (specified)
    #Test samples 1000 (specified)
    ----label noise information:------
    Instance dependent noise
    #Actual noise rate 0.20
    [cuda:0] LNPCC waiting for GPU slot...
    [cuda:0] Slot acquired (waited 106.9s). Starting GCN...
    FINAL_RESULT: {'acc': {'train': 0.7525252525252525, 'valid': 0.662, 'test': 0.811}, 'wall_s': 39.96, 'cpu_s': 31.37, 'gpu_s': 8.51, 'wait_s': 106.94}
    [Time] wall=40.0s | cpu=31.4s | gpu=8.5s
    C:\Users\fbrev\Documents\Acadêmico\Simulações\Python\NoisyGL\predictor\Base_Predictor.py:144: UserWarning: Sparse CSR tensor support is in beta state. If you miss a functionality in the sparse tensor support, please submit a feature request to https://github.com/pytorch/pytorch/issues. (Triggered internally at ..\aten\src\ATen\SparseCsrTensorImpl.cpp:55.)
    self.adj_csr = self.adj.to_sparse_csr().to(self.device)
