[I 2026-04-27 02:01:44,065] Trial 61 finished with value: 0.36851237560602196 and parameters: {'lr': 0.005, 'weight_decay': 0.01, 'n_hidden': 128, 'n_layer': 3, 'dropout': 0.34955717290305266, 'knn_mode': 's', 'k': 31, 'dexp': 9.735181955428635, 'p_grd': 0.43987631718200554, 'unc_rem': 0.8897331894462761, 'unc_rel': 0.30891887571794974}. Best is trial 44 with value: 0.3977034957897423.
    [CPU] Loading amazon-ratings...
    DEBUG 3.1: Dataset init start
    DEBUG 3.2: prepare_data start amazon-ratings
    ----Data statistics------'
    Name: amazon-ratings
    #Nodes 24492
    #Edges 93050
    #Classes 5
    #Ave_degree 7.60
    ----Split statistics------'
    #Train samples 1224 (5.0 % of nodes)
    #Val samples 3673 (15.0 % of nodes)
    #Test samples 19595 (remaining)
    ----label noise information:------
    Instance dependent noise
    #Actual noise rate 0.40
    [cuda:1] LNPCC waiting for GPU slot...
    [cuda:1] Slot acquired (waited 2.2s). Starting GCN...
    FINAL_RESULT: {'acc': {'train': 0.36356209150326796, 'valid': 0.28233052001089026, 'test': 0.393620821638173}, 'wall_s': 33.64, 'cpu_s': 30.28, 'gpu_s': 3.31, 'wait_s': 2.24}
    [Time] wall=33.6s | cpu=30.3s | gpu=3.3s
    C:\Users\fbrev\Documents\Acadêmico\Simulações\Python\NoisyGL\predictor\Base_Predictor.py:144: UserWarning: Sparse CSR tensor support is in beta state. If you miss a functionality in the sparse tensor support, please submit a feature request to https://github.com/pytorch/pytorch/issues. (Triggered internally at ..\aten\src\ATen\SparseCsrTensorImpl.cpp:55.)
    self.adj_csr = self.adj.to_sparse_csr().to(self.device)
[I 2026-04-27 02:02:25,592] Trial 62 finished with value: 0.393620821638173 and parameters: {'lr': 0.005, 'weight_decay': 0.001, 'n_hidden': 64, 'n_layer': 3, 'dropout': 0.2208020642595232, 'knn_mode': 's', 'k': 37, 'dexp': 8.833659647460381, 'p_grd': 0.31510011989055253, 'unc_rem': 0.7745058085923467, 'unc_rel': 0.6933412643625182}. Best is trial 44 with value: 0.3977034957897423.
    [CPU] Loading amazon-ratings...
    DEBUG 3.1: Dataset init start
    DEBUG 3.2: prepare_data start amazon-ratings
    ----Data statistics------'
    Name: amazon-ratings
    #Nodes 24492
    #Edges 93050
    #Classes 5
    #Ave_degree 7.60
    ----Split statistics------'
    #Train samples 1224 (5.0 % of nodes)
    #Val samples 3673 (15.0 % of nodes)
    #Test samples 19595 (remaining)
    ----label noise information:------
    Instance dependent noise
    #Actual noise rate 0.40
    [cuda:1] LNPCC waiting for GPU slot...
    [cuda:1] Slot acquired (waited 0.0s). Starting GCN...
    FINAL_RESULT: {'acc': {'train': 0.36333878887070375, 'valid': 0.28178600598965425, 'test': 0.39208981883133454}, 'wall_s': 40.43, 'cpu_s': 32.32, 'gpu_s': 8.05, 'wait_s': 0.0}
    [Time] wall=40.4s | cpu=32.3s | gpu=8.1s
    C:\Users\fbrev\Documents\Acadêmico\Simulações\Python\NoisyGL\predictor\Base_Predictor.py:144: UserWarning: Sparse CSR tensor support is in beta state. If you miss a functionality in the sparse tensor support, please submit a feature request to https://github.com/pytorch/pytorch/issues. (Triggered internally at ..\aten\src\ATen\SparseCsrTensorImpl.cpp:55.)
    self.adj_csr = self.adj.to_sparse_csr().to(self.device)
[I 2026-04-27 02:03:11,779] Trial 63 finished with value: 0.39208981883133454 and parameters: {'lr': 0.005, 'weight_decay': 0.001, 'n_hidden': 256, 'n_layer': 3, 'dropout': 0.1792077810178037, 'knn_mode': 's', 'k': 37, 'dexp': 8.942672122839058, 'p_grd': 0.30038511048603106, 'unc_rem': 0.7565290943677137, 'unc_rel': 0.7006514755115663}. Best is trial 44 with value: 0.3977034957897423.
    [CPU] Loading amazon-ratings...
    DEBUG 3.1: Dataset init start
    DEBUG 3.2: prepare_data start amazon-ratings
    ----Data statistics------'
    Name: amazon-ratings
    #Nodes 24492
    #Edges 93050
    #Classes 5
    #Ave_degree 7.60
    ----Split statistics------'
    #Train samples 1224 (5.0 % of nodes)
    #Val samples 3673 (15.0 % of nodes)
    #Test samples 19595 (remaining)
    ----label noise information:------
    Instance dependent noise
    #Actual noise rate 0.40
    [cuda:1] LNPCC waiting for GPU slot...
    [cuda:1] Slot acquired (waited 0.0s). Starting GCN...
    FINAL_RESULT: {'acc': {'train': 0.3862520458265139, 'valid': 0.2858698611489246, 'test': 0.3927532533809645}, 'wall_s': 30.52, 'cpu_s': 26.85, 'gpu_s': 3.61, 'wait_s': 0.0}
    [Time] wall=30.5s | cpu=26.8s | gpu=3.6s
    C:\Users\fbrev\Documents\Acadêmico\Simulações\Python\NoisyGL\predictor\Base_Predictor.py:144: UserWarning: Sparse CSR tensor support is in beta state. If you miss a functionality in the sparse tensor support, please submit a feature request to https://github.com/pytorch/pytorch/issues. (Triggered internally at ..\aten\src\ATen\SparseCsrTensorImpl.cpp:55.)
    self.adj_csr = self.adj.to_sparse_csr().to(self.device)
[I 2026-04-27 02:03:48,327] Trial 64 finished with value: 0.3927532533809645 and parameters: {'lr': 0.005, 'weight_decay': 0.001, 'n_hidden': 64, 'n_layer': 3, 'dropout': 0.2282764101418198, 'knn_mode': 's', 'k': 29, 'dexp': 7.973356033115325, 'p_grd': 0.25619692163896657, 'unc_rem': 0.8374233090323181, 'unc_rel': 0.7770323381331604}. Best is trial 44 with value: 0.3977034957897423.
    [CPU] Loading amazon-ratings...
    DEBUG 3.1: Dataset init start
    DEBUG 3.2: prepare_data start amazon-ratings
    ----Data statistics------'
    Name: amazon-ratings
    #Nodes 24492
    #Edges 93050
    #Classes 5
    #Ave_degree 7.60
    ----Split statistics------'
    #Train samples 1224 (5.0 % of nodes)
    #Val samples 3673 (15.0 % of nodes)
    #Test samples 19595 (remaining)
    ----label noise information:------
    Instance dependent noise
    #Actual noise rate 0.40
    [cuda:1] LNPCC waiting for GPU slot...
    [cuda:1] Slot acquired (waited 0.0s). Starting GCN...
    FINAL_RESULT: {'acc': {'train': 0.3608837970540098, 'valid': 0.28559760413830654, 'test': 0.39499872416432763}, 'wall_s': 41.04, 'cpu_s': 37.39, 'gpu_s': 3.59, 'wait_s': 0.0}
    [Time] wall=41.0s | cpu=37.4s | gpu=3.6s
    C:\Users\fbrev\Documents\Acadêmico\Simulações\Python\NoisyGL\predictor\Base_Predictor.py:144: UserWarning: Sparse CSR tensor support is in beta state. If you miss a functionality in the sparse tensor support, please submit a feature request to https://github.com/pytorch/pytorch/issues. (Triggered internally at ..\aten\src\ATen\SparseCsrTensorImpl.cpp:55.)
    self.adj_csr = self.adj.to_sparse_csr().to(self.device)
[I 2026-04-27 02:04:35,630] Trial 65 finished with value: 0.39499872416432763 and parameters: {'lr': 0.005, 'weight_decay': 0.001, 'n_hidden': 64, 'n_layer': 3, 'dropout': 0.2670468722419718, 'knn_mode': 's', 'k': 35, 'dexp': 8.676998724368786, 'p_grd': 0.3887301023020499, 'unc_rem': 0.8090839449883483, 'unc_rel': 0.6198234221834722}. Best is trial 44 with value: 0.3977034957897423.
    [CPU] Loading amazon-ratings...
    DEBUG 3.1: Dataset init start
    DEBUG 3.2: prepare_data start amazon-ratings
    ----Data statistics------'
    Name: amazon-ratings
    #Nodes 24492
    #Edges 93050
    #Classes 5
    #Ave_degree 7.60
    ----Split statistics------'
    #Train samples 1224 (5.0 % of nodes)
    #Val samples 3673 (15.0 % of nodes)
    #Test samples 19595 (remaining)
    ----label noise information:------
    Instance dependent noise
    #Actual noise rate 0.40
    [cuda:1] LNPCC waiting for GPU slot...
    [cuda:1] Slot acquired (waited 0.0s). Starting GCN...
    FINAL_RESULT: {'acc': {'train': 0.40065412919051513, 'valid': 0.2861421181595426, 'test': 0.3850472059198775}, 'wall_s': 37.6, 'cpu_s': 34.96, 'gpu_s': 2.59, 'wait_s': 0.0}
    [Time] wall=37.6s | cpu=35.0s | gpu=2.6s
    C:\Users\fbrev\Documents\Acadêmico\Simulações\Python\NoisyGL\predictor\Base_Predictor.py:144: UserWarning: Sparse CSR tensor support is in beta state. If you miss a functionality in the sparse tensor support, please submit a feature request to https://github.com/pytorch/pytorch/issues. (Triggered internally at ..\aten\src\ATen\SparseCsrTensorImpl.cpp:55.)
    self.adj_csr = self.adj.to_sparse_csr().to(self.device)
[I 2026-04-27 02:05:19,148] Trial 66 finished with value: 0.3850472059198775 and parameters: {'lr': 0.001, 'weight_decay': 0.001, 'n_hidden': 32, 'n_layer': 3, 'dropout': 0.2670822608802534, 'knn_mode': 's', 'k': 34, 'dexp': 9.296153692626245, 'p_grd': 0.3890088275118908, 'unc_rem': 0.8089440165846933, 'unc_rel': 0.6250696827981039}. Best is trial 44 with value: 0.3977034957897423.
    [CPU] Loading amazon-ratings...
    DEBUG 3.1: Dataset init start
    DEBUG 3.2: prepare_data start amazon-ratings
    ----Data statistics------'
    Name: amazon-ratings
    #Nodes 24492
    #Edges 93050
    #Classes 5
    #Ave_degree 7.60
    ----Split statistics------'
    #Train samples 1224 (5.0 % of nodes)
    #Val samples 3673 (15.0 % of nodes)
    #Test samples 19595 (remaining)
    ----label noise information:------
    Instance dependent noise
    #Actual noise rate 0.40
    [cuda:1] LNPCC waiting for GPU slot...
    [cuda:1] Slot acquired (waited 5.5s). Starting GCN...
    FINAL_RESULT: {'acc': {'train': 0.3880718954248366, 'valid': 0.2828750340321263, 'test': 0.3843837713702475}, 'wall_s': 41.17, 'cpu_s': 37.84, 'gpu_s': 3.28, 'wait_s': 5.48}
    [Time] wall=41.2s | cpu=37.8s | gpu=3.3s
    C:\Users\fbrev\Documents\Acadêmico\Simulações\Python\NoisyGL\predictor\Base_Predictor.py:144: UserWarning: Sparse CSR tensor support is in beta state. If you miss a functionality in the sparse tensor support, please submit a feature request to https://github.com/pytorch/pytorch/issues. (Triggered internally at ..\aten\src\ATen\SparseCsrTensorImpl.cpp:55.)
    self.adj_csr = self.adj.to_sparse_csr().to(self.device)
[I 2026-04-27 02:06:11,436] Trial 67 finished with value: 0.3843837713702475 and parameters: {'lr': 0.005, 'weight_decay': 0.0001, 'n_hidden': 64, 'n_layer': 3, 'dropout': 0.1340352532149111, 'knn_mode': 's', 'k': 32, 'dexp': 6.5638349797762, 'p_grd': 0.4774011450012617, 'unc_rem': 0.7302589127084668, 'unc_rel': 0.5110409100742028}. Best is trial 44 with value: 0.3977034957897423.
    [CPU] Loading amazon-ratings...
    DEBUG 3.1: Dataset init start
    DEBUG 3.2: prepare_data start amazon-ratings
    ----Data statistics------'
    Name: amazon-ratings
    #Nodes 24492
    #Edges 93050
    #Classes 5
    #Ave_degree 7.60
    ----Split statistics------'
    #Train samples 1224 (5.0 % of nodes)
    #Val samples 3673 (15.0 % of nodes)
    #Test samples 19595 (remaining)
    ----label noise information:------
    Instance dependent noise
    #Actual noise rate 0.40
    [cuda:1] LNPCC waiting for GPU slot...
    [cuda:1] Slot acquired (waited 10.3s). Starting GCN...
    FINAL_RESULT: {'acc': {'train': 0.4243663123466885, 'valid': 0.2801524639259461, 'test': 0.36810410819086503}, 'wall_s': 45.06, 'cpu_s': 42.59, 'gpu_s': 2.43, 'wait_s': 10.3}
    [Time] wall=45.1s | cpu=42.6s | gpu=2.4s
    C:\Users\fbrev\Documents\Acadêmico\Simulações\Python\NoisyGL\predictor\Base_Predictor.py:144: UserWarning: Sparse CSR tensor support is in beta state. If you miss a functionality in the sparse tensor support, please submit a feature request to https://github.com/pytorch/pytorch/issues. (Triggered internally at ..\aten\src\ATen\SparseCsrTensorImpl.cpp:55.)
    self.adj_csr = self.adj.to_sparse_csr().to(self.device)
[I 2026-04-27 02:07:12,426] Trial 68 finished with value: 0.36810410819086503 and parameters: {'lr': 0.01, 'weight_decay': 0.001, 'n_hidden': 64, 'n_layer': 2, 'dropout': 0.30623025125909553, 'knn_mode': 's', 'k': 40, 'dexp': 8.3380640273954, 'p_grd': 0.424076796365619, 'unc_rem': 0.22007007392808087, 'unc_rel': 0.6104021578111738}. Best is trial 44 with value: 0.3977034957897423.
    [CPU] Loading amazon-ratings...
    DEBUG 3.1: Dataset init start
    DEBUG 3.2: prepare_data start amazon-ratings
    ----Data statistics------'
    Name: amazon-ratings
    #Nodes 24492
    #Edges 93050
    #Classes 5
    #Ave_degree 7.60
    ----Split statistics------'
    #Train samples 1224 (5.0 % of nodes)
    #Val samples 3673 (15.0 % of nodes)
    #Test samples 19595 (remaining)
    ----label noise information:------
    Instance dependent noise
    #Actual noise rate 0.40
    [cuda:1] LNPCC waiting for GPU slot...
    [cuda:1] Slot acquired (waited 3.4s). Starting GCN...
    FINAL_RESULT: {'acc': {'train': 0.38860544217687076, 'valid': 0.2834195480533624, 'test': 0.39188568512375604}, 'wall_s': 35.99, 'cpu_s': 32.43, 'gpu_s': 3.51, 'wait_s': 3.41}
    [Time] wall=36.0s | cpu=32.4s | gpu=3.5s
    C:\Users\fbrev\Documents\Acadêmico\Simulações\Python\NoisyGL\predictor\Base_Predictor.py:144: UserWarning: Sparse CSR tensor support is in beta state. If you miss a functionality in the sparse tensor support, please submit a feature request to https://github.com/pytorch/pytorch/issues. (Triggered internally at ..\aten\src\ATen\SparseCsrTensorImpl.cpp:55.)
    self.adj_csr = self.adj.to_sparse_csr().to(self.device)
[I 2026-04-27 02:07:57,912] Trial 69 finished with value: 0.39188568512375604 and parameters: {'lr': 0.005, 'weight_decay': 0.001, 'n_hidden': 64, 'n_layer': 3, 'dropout': 0.16313871425773413, 'knn_mode': 's', 'k': 27, 'dexp': 7.520593654907277, 'p_grd': 0.2526627579411581, 'unc_rem': 0.9474593658569215, 'unc_rel': 0.04519754515632854}. Best is trial 44 with value: 0.3977034957897423.
    [CPU] Loading amazon-ratings...
    DEBUG 3.1: Dataset init start
    DEBUG 3.2: prepare_data start amazon-ratings
    ----Data statistics------'
    Name: amazon-ratings
    #Nodes 24492
    #Edges 93050
    #Classes 5
    #Ave_degree 7.60
    ----Split statistics------'
    #Train samples 1224 (5.0 % of nodes)
    #Val samples 3673 (15.0 % of nodes)
    #Test samples 19595 (remaining)
    ----label noise information:------
    Instance dependent noise
    #Actual noise rate 0.40
    [cuda:1] LNPCC waiting for GPU slot...
    [cuda:1] Slot acquired (waited 0.0s). Starting GCN...
    FINAL_RESULT: {'acc': {'train': 0.42751235584843494, 'valid': 0.28423631908521646, 'test': 0.3789742281194182}, 'wall_s': 57.04, 'cpu_s': 48.89, 'gpu_s': 8.1, 'wait_s': 0.0}
    [Time] wall=57.0s | cpu=48.9s | gpu=8.1s
    C:\Users\fbrev\Documents\Acadêmico\Simulações\Python\NoisyGL\predictor\Base_Predictor.py:144: UserWarning: Sparse CSR tensor support is in beta state. If you miss a functionality in the sparse tensor support, please submit a feature request to https://github.com/pytorch/pytorch/issues. (Triggered internally at ..\aten\src\ATen\SparseCsrTensorImpl.cpp:55.)
    self.adj_csr = self.adj.to_sparse_csr().to(self.device)
[I 2026-04-27 02:09:01,005] Trial 70 finished with value: 0.3789742281194182 and parameters: {'lr': 0.005, 'weight_decay': 0.001, 'n_hidden': 256, 'n_layer': 3, 'dropout': 0.2504371666354296, 'knn_mode': 'd', 'k': 30, 'dexp': 8.644557568622696, 'p_grd': 0.36078329370569245, 'unc_rem': 0.701972761775524, 'unc_rel': 0.1102589726647444}. Best is trial 44 with value: 0.3977034957897423.
    [CPU] Loading amazon-ratings...
    DEBUG 3.1: Dataset init start
    DEBUG 3.2: prepare_data start amazon-ratings
    ----Data statistics------'
    Name: amazon-ratings
    #Nodes 24492
    #Edges 93050
    #Classes 5
    #Ave_degree 7.60
    ----Split statistics------'
    #Train samples 1224 (5.0 % of nodes)
    #Val samples 3673 (15.0 % of nodes)
    #Test samples 19595 (remaining)
    ----label noise information:------
    Instance dependent noise
    #Actual noise rate 0.40
    [cuda:1] LNPCC waiting for GPU slot...
    [cuda:1] Slot acquired (waited 0.0s). Starting GCN...
    FINAL_RESULT: {'acc': {'train': 0.3570261437908497, 'valid': 0.28450857609583446, 'test': 0.39356978821127836}, 'wall_s': 39.61, 'cpu_s': 35.75, 'gpu_s': 3.8, 'wait_s': 0.0}
    [Time] wall=39.6s | cpu=35.8s | gpu=3.8s
    C:\Users\fbrev\Documents\Acadêmico\Simulações\Python\NoisyGL\predictor\Base_Predictor.py:144: UserWarning: Sparse CSR tensor support is in beta state. If you miss a functionality in the sparse tensor support, please submit a feature request to https://github.com/pytorch/pytorch/issues. (Triggered internally at ..\aten\src\ATen\SparseCsrTensorImpl.cpp:55.)
    self.adj_csr = self.adj.to_sparse_csr().to(self.device)
[I 2026-04-27 02:09:46,340] Trial 71 finished with value: 0.39356978821127836 and parameters: {'lr': 0.005, 'weight_decay': 0.001, 'n_hidden': 64, 'n_layer': 3, 'dropout': 0.29562926979298765, 'knn_mode': 's', 'k': 23, 'dexp': 8.092351565298106, 'p_grd': 0.5396176338322556, 'unc_rem': 0.8507718225862683, 'unc_rel': 0.6555213170771704}. Best is trial 44 with value: 0.3977034957897423.
    [CPU] Loading amazon-ratings...
    DEBUG 3.1: Dataset init start
    DEBUG 3.2: prepare_data start amazon-ratings
    ----Data statistics------'
    Name: amazon-ratings
    #Nodes 24492
    #Edges 93050
    #Classes 5
    #Ave_degree 7.60
    ----Split statistics------'
    #Train samples 1224 (5.0 % of nodes)
    #Val samples 3673 (15.0 % of nodes)
    #Test samples 19595 (remaining)
    ----label noise information:------
    Instance dependent noise
    #Actual noise rate 0.40
    [cuda:1] LNPCC waiting for GPU slot...
    [cuda:1] Slot acquired (waited 378.5s). Starting GCN...
    FINAL_RESULT: {'acc': {'train': 0.375, 'valid': 0.28450857609583446, 'test': 0.39474355702985453}, 'wall_s': 32.93, 'cpu_s': 29.67, 'gpu_s': 3.21, 'wait_s': 378.52}
    [Time] wall=32.9s | cpu=29.7s | gpu=3.2s
    C:\Users\fbrev\Documents\Acadêmico\Simulações\Python\NoisyGL\predictor\Base_Predictor.py:144: UserWarning: Sparse CSR tensor support is in beta state. If you miss a functionality in the sparse tensor support, please submit a feature request to https://github.com/pytorch/pytorch/issues. (Triggered internally at ..\aten\src\ATen\SparseCsrTensorImpl.cpp:55.)
    self.adj_csr = self.adj.to_sparse_csr().to(self.device)
[I 2026-04-27 02:16:43,449] Trial 72 finished with value: 0.39474355702985453 and parameters: {'lr': 0.005, 'weight_decay': 0.001, 'n_hidden': 64, 'n_layer': 3, 'dropout': 0.21050870802641491, 'knn_mode': 's', 'k': 36, 'dexp': 8.854684017293998, 'p_grd': 0.318434508534222, 'unc_rem': 0.7663789550261928, 'unc_rel': 0.7222654441469516}. Best is trial 44 with value: 0.3977034957897423.
    [CPU] Loading amazon-ratings...
    DEBUG 3.1: Dataset init start
    DEBUG 3.2: prepare_data start amazon-ratings
    ----Data statistics------'
    Name: amazon-ratings
    #Nodes 24492
    #Edges 93050
    #Classes 5
    #Ave_degree 7.60
    ----Split statistics------'
    #Train samples 1224 (5.0 % of nodes)
    #Val samples 3673 (15.0 % of nodes)
    #Test samples 19595 (remaining)
    ----label noise information:------
    Instance dependent noise
    #Actual noise rate 0.40
    [cuda:1] LNPCC waiting for GPU slot...
    [cuda:1] Slot acquired (waited 166.6s). Starting GCN...
    FINAL_RESULT: {'acc': {'train': 0.3783783783783784, 'valid': 0.28314729104274433, 'test': 0.38770094411839756}, 'wall_s': 38.83, 'cpu_s': 35.57, 'gpu_s': 3.21, 'wait_s': 166.61}
    [Time] wall=38.8s | cpu=35.6s | gpu=3.2s
    C:\Users\fbrev\Documents\Acadêmico\Simulações\Python\NoisyGL\predictor\Base_Predictor.py:144: UserWarning: Sparse CSR tensor support is in beta state. If you miss a functionality in the sparse tensor support, please submit a feature request to https://github.com/pytorch/pytorch/issues. (Triggered internally at ..\aten\src\ATen\SparseCsrTensorImpl.cpp:55.)
    self.adj_csr = self.adj.to_sparse_csr().to(self.device)
[I 2026-04-27 02:20:14,159] Trial 73 finished with value: 0.38770094411839756 and parameters: {'lr': 0.005, 'weight_decay': 0.001, 'n_hidden': 64, 'n_layer': 3, 'dropout': 0.20524436722013154, 'knn_mode': 's', 'k': 35, 'dexp': 9.573381125115954, 'p_grd': 0.38644754668839065, 'unc_rem': 0.6420514068552314, 'unc_rel': 0.7162063245723688}. Best is trial 44 with value: 0.3977034957897423.
    [CPU] Loading amazon-ratings...
    DEBUG 3.1: Dataset init start
    DEBUG 3.2: prepare_data start amazon-ratings
    ----Data statistics------'
    Name: amazon-ratings
    #Nodes 24492
    #Edges 93050
    #Classes 5
    #Ave_degree 7.60
    ----Split statistics------'
    #Train samples 1224 (5.0 % of nodes)
    #Val samples 3673 (15.0 % of nodes)
    #Test samples 19595 (remaining)
    ----label noise information:------
    Instance dependent noise
    #Actual noise rate 0.40
    [cuda:1] LNPCC waiting for GPU slot...
    [cuda:1] Slot acquired (waited 169.3s). Starting GCN...
    FINAL_RESULT: {'acc': {'train': 0.3605887162714636, 'valid': 0.28505309011707053, 'test': 0.3961724929829038}, 'wall_s': 32.62, 'cpu_s': 29.36, 'gpu_s': 3.21, 'wait_s': 169.32}
    [Time] wall=32.6s | cpu=29.4s | gpu=3.2s
    C:\Users\fbrev\Documents\Acadêmico\Simulações\Python\NoisyGL\predictor\Base_Predictor.py:144: UserWarning: Sparse CSR tensor support is in beta state. If you miss a functionality in the sparse tensor support, please submit a feature request to https://github.com/pytorch/pytorch/issues. (Triggered internally at ..\aten\src\ATen\SparseCsrTensorImpl.cpp:55.)
    self.adj_csr = self.adj.to_sparse_csr().to(self.device)
