[worker] START lnpcc_amazoncom_0.4 gpu=1
[HPO] Starting Phase 1 (Optuna) for lnpcc_amazoncom_instance_0.4...
[I 2026-04-30 23:18:05,465] Using an existing study with name 'lnpcc_amazoncom_instance_0.4' instead of creating a new one.
    [CPU] Loading amazoncom...
    DEBUG 3.1: Dataset init start
    DEBUG 3.2: prepare_data start amazoncom
    ----Data statistics------'
    Name: amazoncom
    #Nodes 13752
    #Edges 245861
    #Classes 10
    #Ave_degree 35.76
    ----Split statistics------'
    #Train samples 200 (20 nodes per class)
    #Val samples 500 (specified)
    #Test samples 1000 (specified)
    ----label noise information:------
    Instance dependent noise
    #Actual noise rate 0.40
    [cuda:1] LNPCC waiting for GPU slot...
    [cuda:1] Slot acquired (waited 525.1s). Starting GCN...
    FINAL_RESULT: {'acc': {'train': 0.685, 'valid': 0.5, 'test': 0.772}, 'wall_s': 54.22, 'cpu_s': 48.93, 'gpu_s': 5.16, 'wait_s': 525.05}
    [Time] wall=54.2s | cpu=48.9s | gpu=5.2s
    C:\Users\fbrev\Documents\Acadêmico\Simulações\Python\NoisyGL\predictor\Base_Predictor.py:144: UserWarning: Sparse CSR tensor support is in beta state. If you miss a functionality in the sparse tensor support, please submit a feature request to https://github.com/pytorch/pytorch/issues. (Triggered internally at ..\aten\src\ATen\SparseCsrTensorImpl.cpp:55.)
    self.adj_csr = self.adj.to_sparse_csr().to(self.device)
[I 2026-04-30 23:27:54,180] Trial 42 finished with value: 0.772 and parameters: {'lr': 0.001, 'weight_decay': 0.001, 'n_hidden': 128, 'n_layer': 2, 'dropout': 0.4718381323352564, 'knn_mode': 'd', 'k': 39, 'dexp': 4.280018336956683, 'p_grd': 0.5649108985527587, 'unc_rem': 0.6059678015024144, 'unc_rel': 0.2092566576154731}. Best is trial 37 with value: 0.786.
    [CPU] Loading amazoncom...
    DEBUG 3.1: Dataset init start
    DEBUG 3.2: prepare_data start amazoncom
    ----Data statistics------'
    Name: amazoncom
    #Nodes 13752
    #Edges 245861
    #Classes 10
    #Ave_degree 35.76
    ----Split statistics------'
    #Train samples 200 (20 nodes per class)
    #Val samples 500 (specified)
    #Test samples 1000 (specified)
    ----label noise information:------
    Instance dependent noise
    #Actual noise rate 0.40
    [cuda:1] LNPCC waiting for GPU slot...
    [cuda:1] Slot acquired (waited 318.4s). Starting GCN...
    FINAL_RESULT: {'acc': {'train': 0.65, 'valid': 0.498, 'test': 0.749}, 'wall_s': 67.89, 'cpu_s': 62.75, 'gpu_s': 5.03, 'wait_s': 318.44}
    [Time] wall=67.9s | cpu=62.7s | gpu=5.0s
    C:\Users\fbrev\Documents\Acadêmico\Simulações\Python\NoisyGL\predictor\Base_Predictor.py:144: UserWarning: Sparse CSR tensor support is in beta state. If you miss a functionality in the sparse tensor support, please submit a feature request to https://github.com/pytorch/pytorch/issues. (Triggered internally at ..\aten\src\ATen\SparseCsrTensorImpl.cpp:55.)
    self.adj_csr = self.adj.to_sparse_csr().to(self.device)
[I 2026-04-30 23:34:26,766] Trial 43 finished with value: 0.749 and parameters: {'lr': 0.001, 'weight_decay': 0.001, 'n_hidden': 128, 'n_layer': 2, 'dropout': 0.49301496444745063, 'knn_mode': 'd', 'k': 48, 'dexp': 4.152949522974718, 'p_grd': 0.5546156807746107, 'unc_rem': 0.3462922170608561, 'unc_rel': 0.3328545057197859}. Best is trial 37 with value: 0.786.
    [CPU] Loading amazoncom...
    DEBUG 3.1: Dataset init start
    DEBUG 3.2: prepare_data start amazoncom
    ----Data statistics------'
    Name: amazoncom
    #Nodes 13752
    #Edges 245861
    #Classes 10
    #Ave_degree 35.76
    ----Split statistics------'
    #Train samples 200 (20 nodes per class)
    #Val samples 500 (specified)
    #Test samples 1000 (specified)
    ----label noise information:------
    Instance dependent noise
    #Actual noise rate 0.40
    [cuda:1] LNPCC waiting for GPU slot...
    [cuda:1] Slot acquired (waited 1057.1s). Starting GCN...
    FINAL_RESULT: {'acc': {'train': 0.7790697674418605, 'valid': 0.492, 'test': 0.756}, 'wall_s': 62.7, 'cpu_s': 57.57, 'gpu_s': 5.04, 'wait_s': 1057.07}
    [Time] wall=62.7s | cpu=57.6s | gpu=5.0s
    C:\Users\fbrev\Documents\Acadêmico\Simulações\Python\NoisyGL\predictor\Base_Predictor.py:144: UserWarning: Sparse CSR tensor support is in beta state. If you miss a functionality in the sparse tensor support, please submit a feature request to https://github.com/pytorch/pytorch/issues. (Triggered internally at ..\aten\src\ATen\SparseCsrTensorImpl.cpp:55.)
    self.adj_csr = self.adj.to_sparse_csr().to(self.device)
[I 2026-04-30 23:53:13,244] Trial 44 finished with value: 0.756 and parameters: {'lr': 0.001, 'weight_decay': 0.001, 'n_hidden': 128, 'n_layer': 2, 'dropout': 0.6180621222378676, 'knn_mode': 'd', 'k': 43, 'dexp': 1.8535806476606007, 'p_grd': 0.4521359926500585, 'unc_rem': 0.49661152615593673, 'unc_rel': 0.1116588334466104}. Best is trial 37 with value: 0.786.
    [CPU] Loading amazoncom...
    DEBUG 3.1: Dataset init start
    DEBUG 3.2: prepare_data start amazoncom
    ----Data statistics------'
    Name: amazoncom
    #Nodes 13752
    #Edges 245861
    #Classes 10
    #Ave_degree 35.76
    ----Split statistics------'
    #Train samples 200 (20 nodes per class)
    #Val samples 500 (specified)
    #Test samples 1000 (specified)
    ----label noise information:------
    Instance dependent noise
    #Actual noise rate 0.40
    [cuda:1] LNPCC waiting for GPU slot...
    [cuda:1] Slot acquired (waited 65.0s). Starting GCN...
    FINAL_RESULT: {'acc': {'train': 0.665, 'valid': 0.498, 'test': 0.769}, 'wall_s': 74.36, 'cpu_s': 69.19, 'gpu_s': 5.07, 'wait_s': 65.02}
    [Time] wall=74.4s | cpu=69.2s | gpu=5.1s
    C:\Users\fbrev\Documents\Acadêmico\Simulações\Python\NoisyGL\predictor\Base_Predictor.py:144: UserWarning: Sparse CSR tensor support is in beta state. If you miss a functionality in the sparse tensor support, please submit a feature request to https://github.com/pytorch/pytorch/issues. (Triggered internally at ..\aten\src\ATen\SparseCsrTensorImpl.cpp:55.)
    self.adj_csr = self.adj.to_sparse_csr().to(self.device)
[I 2026-04-30 23:55:38,315] Trial 45 finished with value: 0.769 and parameters: {'lr': 0.005, 'weight_decay': 0.001, 'n_hidden': 128, 'n_layer': 2, 'dropout': 0.6905095902002759, 'knn_mode': 'd', 'k': 40, 'dexp': 3.800725201692644, 'p_grd': 0.686546137103134, 'unc_rem': 0.966447636012873, 'unc_rel': 0.009962674361679413}. Best is trial 37 with value: 0.786.
    [CPU] Loading amazoncom...
    DEBUG 3.1: Dataset init start
    DEBUG 3.2: prepare_data start amazoncom
    ----Data statistics------'
    Name: amazoncom
    #Nodes 13752
    #Edges 245861
    #Classes 10
    #Ave_degree 35.76
    ----Split statistics------'
    #Train samples 200 (20 nodes per class)
    #Val samples 500 (specified)
    #Test samples 1000 (specified)
    ----label noise information:------
    Instance dependent noise
    #Actual noise rate 0.40
    [cuda:1] LNPCC waiting for GPU slot...
    [cuda:1] Slot acquired (waited 92.0s). Starting GCN...
    FINAL_RESULT: {'acc': {'train': 0.7484662576687117, 'valid': 0.462, 'test': 0.729}, 'wall_s': 49.99, 'cpu_s': 44.65, 'gpu_s': 5.25, 'wait_s': 92.04}
    [Time] wall=50.0s | cpu=44.6s | gpu=5.2s
    C:\Users\fbrev\Documents\Acadêmico\Simulações\Python\NoisyGL\predictor\Base_Predictor.py:144: UserWarning: Sparse CSR tensor support is in beta state. If you miss a functionality in the sparse tensor support, please submit a feature request to https://github.com/pytorch/pytorch/issues. (Triggered internally at ..\aten\src\ATen\SparseCsrTensorImpl.cpp:55.)
    self.adj_csr = self.adj.to_sparse_csr().to(self.device)
[I 2026-04-30 23:58:06,441] Trial 46 finished with value: 0.729 and parameters: {'lr': 0.001, 'weight_decay': 0.05, 'n_hidden': 128, 'n_layer': 2, 'dropout': 0.5277673173451513, 'knn_mode': 'd', 'k': 50, 'dexp': 4.118805452135703, 'p_grd': 0.13185070163288254, 'unc_rem': 0.42934140881211585, 'unc_rel': 0.21399556813958637}. Best is trial 37 with value: 0.786.
    [CPU] Loading amazoncom...
    DEBUG 3.1: Dataset init start
    DEBUG 3.2: prepare_data start amazoncom
    ----Data statistics------'
    Name: amazoncom
    #Nodes 13752
    #Edges 245861
    #Classes 10
    #Ave_degree 35.76
    ----Split statistics------'
    #Train samples 200 (20 nodes per class)
    #Val samples 500 (specified)
    #Test samples 1000 (specified)
    ----label noise information:------
    Instance dependent noise
    #Actual noise rate 0.40
    [cuda:1] LNPCC waiting for GPU slot...
    [cuda:1] Slot acquired (waited 97.2s). Starting GCN...
    FINAL_RESULT: {'acc': {'train': 0.065, 'valid': 0.262, 'test': 0.417}, 'wall_s': 52.83, 'cpu_s': 47.61, 'gpu_s': 5.12, 'wait_s': 97.19}
    [Time] wall=52.8s | cpu=47.6s | gpu=5.1s
    C:\Users\fbrev\Documents\Acadêmico\Simulações\Python\NoisyGL\predictor\Base_Predictor.py:144: UserWarning: Sparse CSR tensor support is in beta state. If you miss a functionality in the sparse tensor support, please submit a feature request to https://github.com/pytorch/pytorch/issues. (Triggered internally at ..\aten\src\ATen\SparseCsrTensorImpl.cpp:55.)
    self.adj_csr = self.adj.to_sparse_csr().to(self.device)
[I 2026-05-01 00:00:42,552] Trial 47 finished with value: 0.417 and parameters: {'lr': 0.1, 'weight_decay': 0.001, 'n_hidden': 128, 'n_layer': 2, 'dropout': 0.5638399857404995, 'knn_mode': 'd', 'k': 39, 'dexp': 5.7946323769085115, 'p_grd': 0.37771195887557385, 'unc_rem': 0.5723628619139237, 'unc_rel': 0.24493305978188015}. Best is trial 37 with value: 0.786.
    [CPU] Loading amazoncom...
    DEBUG 3.1: Dataset init start
    DEBUG 3.2: prepare_data start amazoncom
    ----Data statistics------'
    Name: amazoncom
    #Nodes 13752
    #Edges 245861
    #Classes 10
    #Ave_degree 35.76
    ----Split statistics------'
    #Train samples 200 (20 nodes per class)
    #Val samples 500 (specified)
    #Test samples 1000 (specified)
    ----label noise information:------
    Instance dependent noise
    #Actual noise rate 0.40
    [cuda:1] LNPCC waiting for GPU slot...
    [cuda:1] Slot acquired (waited 225.9s). Starting GCN...
    FINAL_RESULT: {'acc': {'train': 0.58, 'valid': 0.486, 'test': 0.769}, 'wall_s': 55.94, 'cpu_s': 52.95, 'gpu_s': 2.9, 'wait_s': 225.86}
    [Time] wall=55.9s | cpu=52.9s | gpu=2.9s
    C:\Users\fbrev\Documents\Acadêmico\Simulações\Python\NoisyGL\predictor\Base_Predictor.py:144: UserWarning: Sparse CSR tensor support is in beta state. If you miss a functionality in the sparse tensor support, please submit a feature request to https://github.com/pytorch/pytorch/issues. (Triggered internally at ..\aten\src\ATen\SparseCsrTensorImpl.cpp:55.)
    self.adj_csr = self.adj.to_sparse_csr().to(self.device)
[I 2026-05-01 00:05:30,526] Trial 48 finished with value: 0.769 and parameters: {'lr': 0.001, 'weight_decay': 0.01, 'n_hidden': 32, 'n_layer': 2, 'dropout': 0.7221516149935345, 'knn_mode': 'd', 'k': 47, 'dexp': 4.772664236002436, 'p_grd': 0.5435376445826278, 'unc_rem': 0.5077083065742911, 'unc_rel': 0.3789662753661541}. Best is trial 37 with value: 0.786.
    [CPU] Loading amazoncom...
    DEBUG 3.1: Dataset init start
    DEBUG 3.2: prepare_data start amazoncom
    ----Data statistics------'
    Name: amazoncom
    #Nodes 13752
    #Edges 245861
    #Classes 10
    #Ave_degree 35.76
    ----Split statistics------'
    #Train samples 200 (20 nodes per class)
    #Val samples 500 (specified)
    #Test samples 1000 (specified)
    ----label noise information:------
    Instance dependent noise
    #Actual noise rate 0.40
    [cuda:1] LNPCC waiting for GPU slot...
    [cuda:1] Slot acquired (waited 500.4s). Starting GCN...
    FINAL_RESULT: {'acc': {'train': 0.6633165829145728, 'valid': 0.474, 'test': 0.738}, 'wall_s': 63.54, 'cpu_s': 58.22, 'gpu_s': 5.23, 'wait_s': 500.38}
    [Time] wall=63.5s | cpu=58.2s | gpu=5.2s
    C:\Users\fbrev\Documents\Acadêmico\Simulações\Python\NoisyGL\predictor\Base_Predictor.py:144: UserWarning: Sparse CSR tensor support is in beta state. If you miss a functionality in the sparse tensor support, please submit a feature request to https://github.com/pytorch/pytorch/issues. (Triggered internally at ..\aten\src\ATen\SparseCsrTensorImpl.cpp:55.)
    self.adj_csr = self.adj.to_sparse_csr().to(self.device)
[I 2026-05-01 00:15:00,615] Trial 49 finished with value: 0.738 and parameters: {'lr': 0.01, 'weight_decay': 0.0001, 'n_hidden': 128, 'n_layer': 2, 'dropout': 0.4793007830924187, 'knn_mode': 'd', 'k': 36, 'dexp': 4.2733911046344435, 'p_grd': 0.45123710514362847, 'unc_rem': 0.34498583193066096, 'unc_rel': 0.28731993527096106}. Best is trial 37 with value: 0.786.
    [CPU] Loading amazoncom...
    DEBUG 3.1: Dataset init start
    DEBUG 3.2: prepare_data start amazoncom
    ----Data statistics------'
    Name: amazoncom
    #Nodes 13752
    #Edges 245861
    #Classes 10
    #Ave_degree 35.76
    ----Split statistics------'
    #Train samples 200 (20 nodes per class)
    #Val samples 500 (specified)
    #Test samples 1000 (specified)
    ----label noise information:------
    Instance dependent noise
    #Actual noise rate 0.40
    [cuda:1] LNPCC waiting for GPU slot...
    [cuda:1] Slot acquired (waited 226.3s). Starting GCN...
    FINAL_RESULT: {'acc': {'train': 0.655, 'valid': 0.506, 'test': 0.754}, 'wall_s': 52.19, 'cpu_s': 43.77, 'gpu_s': 8.3, 'wait_s': 226.33}
    [Time] wall=52.2s | cpu=43.8s | gpu=8.3s
    C:\Users\fbrev\Documents\Acadêmico\Simulações\Python\NoisyGL\predictor\Base_Predictor.py:144: UserWarning: Sparse CSR tensor support is in beta state. If you miss a functionality in the sparse tensor support, please submit a feature request to https://github.com/pytorch/pytorch/issues. (Triggered internally at ..\aten\src\ATen\SparseCsrTensorImpl.cpp:55.)
    self.adj_csr = self.adj.to_sparse_csr().to(self.device)
[I 2026-05-01 00:19:44,719] Trial 50 finished with value: 0.754 and parameters: {'lr': 0.001, 'weight_decay': 0.001, 'n_hidden': 256, 'n_layer': 2, 'dropout': 0.7844414649414124, 'knn_mode': 'd', 'k': 43, 'dexp': 7.5893747098191495, 'p_grd': 0.7191271411137955, 'unc_rem': 0.6667245339763813, 'unc_rel': 0.8074125172136023}. Best is trial 37 with value: 0.786.
    [CPU] Loading amazoncom...
    DEBUG 3.1: Dataset init start
    DEBUG 3.2: prepare_data start amazoncom
    ----Data statistics------'
    Name: amazoncom
    #Nodes 13752
    #Edges 245861
    #Classes 10
    #Ave_degree 35.76
    ----Split statistics------'
    #Train samples 200 (20 nodes per class)
    #Val samples 500 (specified)
    #Test samples 1000 (specified)
    ----label noise information:------
    Instance dependent noise
    #Actual noise rate 0.40
    [cuda:1] LNPCC waiting for GPU slot...
    [cuda:1] Slot acquired (waited 222.8s). Starting GCN...
    FINAL_RESULT: {'acc': {'train': 0.18592964824120603, 'valid': 0.262, 'test': 0.255}, 'wall_s': 62.84, 'cpu_s': 54.37, 'gpu_s': 8.38, 'wait_s': 222.77}
    [Time] wall=62.8s | cpu=54.4s | gpu=8.4s
    C:\Users\fbrev\Documents\Acadêmico\Simulações\Python\NoisyGL\predictor\Base_Predictor.py:144: UserWarning: Sparse CSR tensor support is in beta state. If you miss a functionality in the sparse tensor support, please submit a feature request to https://github.com/pytorch/pytorch/issues. (Triggered internally at ..\aten\src\ATen\SparseCsrTensorImpl.cpp:55.)
    self.adj_csr = self.adj.to_sparse_csr().to(self.device)
[I 2026-05-01 00:24:35,768] Trial 51 finished with value: 0.255 and parameters: {'lr': 0.05, 'weight_decay': 0.0, 'n_hidden': 128, 'n_layer': 3, 'dropout': 0.7465673304081596, 'knn_mode': 'd', 'k': 33, 'dexp': 3.114481422573198, 'p_grd': 0.6598191809382503, 'unc_rem': 0.6056451370326315, 'unc_rel': 0.20122551934599278}. Best is trial 37 with value: 0.786.
    [CPU] Loading amazoncom...
    DEBUG 3.1: Dataset init start
    DEBUG 3.2: prepare_data start amazoncom
    ----Data statistics------'
    Name: amazoncom
    #Nodes 13752
    #Edges 245861
    #Classes 10
    #Ave_degree 35.76
    ----Split statistics------'
    #Train samples 200 (20 nodes per class)
    #Val samples 500 (specified)
    #Test samples 1000 (specified)
    ----label noise information:------
    Instance dependent noise
    #Actual noise rate 0.40
    [cuda:1] LNPCC waiting for GPU slot...
    [cuda:1] Slot acquired (waited 205.1s). Starting GCN...
    FINAL_RESULT: {'acc': {'train': 0.645, 'valid': 0.492, 'test': 0.748}, 'wall_s': 82.78, 'cpu_s': 77.5, 'gpu_s': 5.19, 'wait_s': 205.1}
    [Time] wall=82.8s | cpu=77.5s | gpu=5.2s
    C:\Users\fbrev\Documents\Acadêmico\Simulações\Python\NoisyGL\predictor\Base_Predictor.py:144: UserWarning: Sparse CSR tensor support is in beta state. If you miss a functionality in the sparse tensor support, please submit a feature request to https://github.com/pytorch/pytorch/issues. (Triggered internally at ..\aten\src\ATen\SparseCsrTensorImpl.cpp:55.)
    self.adj_csr = self.adj.to_sparse_csr().to(self.device)
[I 2026-05-01 00:29:29,022] Trial 52 finished with value: 0.748 and parameters: {'lr': 0.005, 'weight_decay': 0.001, 'n_hidden': 128, 'n_layer': 2, 'dropout': 0.6820135108997504, 'knn_mode': 'd', 'k': 39, 'dexp': 3.657550685053476, 'p_grd': 0.8268707098446737, 'unc_rem': 0.992436511341922, 'unc_rel': 0.05460883313100501}. Best is trial 37 with value: 0.786.
    [CPU] Loading amazoncom...
    DEBUG 3.1: Dataset init start
    DEBUG 3.2: prepare_data start amazoncom
    ----Data statistics------'
    Name: amazoncom
    #Nodes 13752
    #Edges 245861
    #Classes 10
    #Ave_degree 35.76
    ----Split statistics------'
    #Train samples 200 (20 nodes per class)
    #Val samples 500 (specified)
    #Test samples 1000 (specified)
    ----label noise information:------
    Instance dependent noise
    #Actual noise rate 0.40
    [cuda:1] LNPCC waiting for GPU slot...
    [cuda:1] Slot acquired (waited 335.4s). Starting GCN...
    FINAL_RESULT: {'acc': {'train': 0.66, 'valid': 0.498, 'test': 0.742}, 'wall_s': 88.85, 'cpu_s': 83.61, 'gpu_s': 5.13, 'wait_s': 335.39}
    [Time] wall=88.9s | cpu=83.6s | gpu=5.1s
    C:\Users\fbrev\Documents\Acadêmico\Simulações\Python\NoisyGL\predictor\Base_Predictor.py:144: UserWarning: Sparse CSR tensor support is in beta state. If you miss a functionality in the sparse tensor support, please submit a feature request to https://github.com/pytorch/pytorch/issues. (Triggered internally at ..\aten\src\ATen\SparseCsrTensorImpl.cpp:55.)
    self.adj_csr = self.adj.to_sparse_csr().to(self.device)
[I 2026-05-01 00:36:39,433] Trial 53 finished with value: 0.742 and parameters: {'lr': 0.005, 'weight_decay': 0.001, 'n_hidden': 128, 'n_layer': 2, 'dropout': 0.6793107885783368, 'knn_mode': 'd', 'k': 45, 'dexp': 3.745930770457988, 'p_grd': 0.6776895864023704, 'unc_rem': 0.924365586908777, 'unc_rel': 0.005243293497036644}. Best is trial 37 with value: 0.786.
    [CPU] Loading amazoncom...
    DEBUG 3.1: Dataset init start
    DEBUG 3.2: prepare_data start amazoncom
    ----Data statistics------'
    Name: amazoncom
    #Nodes 13752
    #Edges 245861
    #Classes 10
    #Ave_degree 35.76
    ----Split statistics------'
    #Train samples 200 (20 nodes per class)
    #Val samples 500 (specified)
    #Test samples 1000 (specified)
    ----label noise information:------
    Instance dependent noise
    #Actual noise rate 0.40
    [cuda:1] LNPCC waiting for GPU slot...
    [cuda:1] Slot acquired (waited 69.2s). Starting GCN...
    FINAL_RESULT: {'acc': {'train': 0.615, 'valid': 0.49, 'test': 0.745}, 'wall_s': 69.15, 'cpu_s': 63.87, 'gpu_s': 5.19, 'wait_s': 69.2}
    [Time] wall=69.2s | cpu=63.9s | gpu=5.2s
    C:\Users\fbrev\Documents\Acadêmico\Simulações\Python\NoisyGL\predictor\Base_Predictor.py:144: UserWarning: Sparse CSR tensor support is in beta state. If you miss a functionality in the sparse tensor support, please submit a feature request to https://github.com/pytorch/pytorch/issues. (Triggered internally at ..\aten\src\ATen\SparseCsrTensorImpl.cpp:55.)
    self.adj_csr = self.adj.to_sparse_csr().to(self.device)
[I 2026-05-01 00:39:03,640] Trial 54 finished with value: 0.745 and parameters: {'lr': 0.005, 'weight_decay': 0.001, 'n_hidden': 128, 'n_layer': 2, 'dropout': 0.6290425069331146, 'knn_mode': 'd', 'k': 27, 'dexp': 5.0131963699279805, 'p_grd': 0.7897876049794978, 'unc_rem': 0.9272123575975457, 'unc_rel': 0.09597057843950536}. Best is trial 37 with value: 0.786.
    [CPU] Loading amazoncom...
    DEBUG 3.1: Dataset init start
    DEBUG 3.2: prepare_data start amazoncom
    ----Data statistics------'
    Name: amazoncom
    #Nodes 13752
    #Edges 245861
    #Classes 10
    #Ave_degree 35.76
    ----Split statistics------'
    #Train samples 200 (20 nodes per class)
    #Val samples 500 (specified)
    #Test samples 1000 (specified)
    ----label noise information:------
    Instance dependent noise
    #Actual noise rate 0.40
    [cuda:1] LNPCC waiting for GPU slot...
    [cuda:1] Slot acquired (waited 447.6s). Starting GCN...
    FINAL_RESULT: {'acc': {'train': 0.7, 'valid': 0.482, 'test': 0.729}, 'wall_s': 97.7, 'cpu_s': 92.38, 'gpu_s': 5.23, 'wait_s': 447.58}
    [Time] wall=97.7s | cpu=92.4s | gpu=5.2s
    C:\Users\fbrev\Documents\Acadêmico\Simulações\Python\NoisyGL\predictor\Base_Predictor.py:144: UserWarning: Sparse CSR tensor support is in beta state. If you miss a functionality in the sparse tensor support, please submit a feature request to https://github.com/pytorch/pytorch/issues. (Triggered internally at ..\aten\src\ATen\SparseCsrTensorImpl.cpp:55.)
    self.adj_csr = self.adj.to_sparse_csr().to(self.device)
