[I 2026-05-01 00:48:14,708] Trial 55 finished with value: 0.729 and parameters: {'lr': 0.005, 'weight_decay': 0.001, 'n_hidden': 128, 'n_layer': 2, 'dropout': 0.7525118197688553, 'knn_mode': 'd', 'k': 41, 'dexp': 4.489758746667414, 'p_grd': 0.8478316031745753, 'unc_rem': 0.82266709403217, 'unc_rel': 0.02927910715286382}. Best is trial 37 with value: 0.786.
    [CPU] Loading amazoncom...
    DEBUG 3.1: Dataset init start
    DEBUG 3.2: prepare_data start amazoncom
    ----Data statistics------'
    Name: amazoncom
    #Nodes 13752
    #Edges 245861
    #Classes 10
    #Ave_degree 35.76
    ----Split statistics------'
    #Train samples 200 (20 nodes per class)
    #Val samples 500 (specified)
    #Test samples 1000 (specified)
    ----label noise information:------
    Instance dependent noise
    #Actual noise rate 0.40
    [cuda:1] LNPCC waiting for GPU slot...
    [cuda:1] Slot acquired (waited 55.9s). Starting GCN...
    FINAL_RESULT: {'acc': {'train': 0.7061855670103093, 'valid': 0.478, 'test': 0.755}, 'wall_s': 82.12, 'cpu_s': 78.99, 'gpu_s': 3.02, 'wait_s': 55.89}
    [Time] wall=82.1s | cpu=79.0s | gpu=3.0s
    C:\Users\fbrev\Documents\Acadêmico\Simulações\Python\NoisyGL\predictor\Base_Predictor.py:144: UserWarning: Sparse CSR tensor support is in beta state. If you miss a functionality in the sparse tensor support, please submit a feature request to https://github.com/pytorch/pytorch/issues. (Triggered internally at ..\aten\src\ATen\SparseCsrTensorImpl.cpp:55.)
    self.adj_csr = self.adj.to_sparse_csr().to(self.device)
[I 2026-05-01 00:50:38,249] Trial 56 finished with value: 0.755 and parameters: {'lr': 0.005, 'weight_decay': 0.001, 'n_hidden': 32, 'n_layer': 2, 'dropout': 0.35305803454117973, 'knn_mode': 'd', 'k': 48, 'dexp': 2.117696954433422, 'p_grd': 0.529645585462234, 'unc_rem': 0.9447885065283262, 'unc_rel': 0.13067911542910915}. Best is trial 37 with value: 0.786.
    [CPU] Loading amazoncom...
    DEBUG 3.1: Dataset init start
    DEBUG 3.2: prepare_data start amazoncom
    ----Data statistics------'
    Name: amazoncom
    #Nodes 13752
    #Edges 245861
    #Classes 10
    #Ave_degree 35.76
    ----Split statistics------'
    #Train samples 200 (20 nodes per class)
    #Val samples 500 (specified)
    #Test samples 1000 (specified)
    ----label noise information:------
    Instance dependent noise
    #Actual noise rate 0.40
    [cuda:1] LNPCC waiting for GPU slot...
    [cuda:1] Slot acquired (waited 467.5s). Starting GCN...
    FINAL_RESULT: {'acc': {'train': 0.155, 'valid': 0.256, 'test': 0.352}, 'wall_s': 83.87, 'cpu_s': 75.32, 'gpu_s': 8.47, 'wait_s': 467.55}
    [Time] wall=83.9s | cpu=75.3s | gpu=8.5s
    C:\Users\fbrev\Documents\Acadêmico\Simulações\Python\NoisyGL\predictor\Base_Predictor.py:144: UserWarning: Sparse CSR tensor support is in beta state. If you miss a functionality in the sparse tensor support, please submit a feature request to https://github.com/pytorch/pytorch/issues. (Triggered internally at ..\aten\src\ATen\SparseCsrTensorImpl.cpp:55.)
    self.adj_csr = self.adj.to_sparse_csr().to(self.device)
[I 2026-05-01 00:59:55,423] Trial 57 finished with value: 0.352 and parameters: {'lr': 0.1, 'weight_decay': 0.05, 'n_hidden': 128, 'n_layer': 3, 'dropout': 0.5867331623452814, 'knn_mode': 'd', 'k': 44, 'dexp': 3.9900687264534516, 'p_grd': 0.7076541980752968, 'unc_rem': 0.7136823844208354, 'unc_rel': 0.1784750697836531}. Best is trial 37 with value: 0.786.
    [CPU] Loading amazoncom...
    DEBUG 3.1: Dataset init start
    DEBUG 3.2: prepare_data start amazoncom
    ----Data statistics------'
    Name: amazoncom
    #Nodes 13752
    #Edges 245861
    #Classes 10
    #Ave_degree 35.76
    ----Split statistics------'
    #Train samples 200 (20 nodes per class)
    #Val samples 500 (specified)
    #Test samples 1000 (specified)
    ----label noise information:------
    Instance dependent noise
    #Actual noise rate 0.40
    [cuda:1] LNPCC waiting for GPU slot...
    [cuda:1] Slot acquired (waited 104.1s). Starting GCN...
    FINAL_RESULT: {'acc': {'train': 0.6313131313131313, 'valid': 0.506, 'test': 0.757}, 'wall_s': 42.77, 'cpu_s': 34.34, 'gpu_s': 8.34, 'wait_s': 104.07}
    [Time] wall=42.8s | cpu=34.3s | gpu=8.3s
    C:\Users\fbrev\Documents\Acadêmico\Simulações\Python\NoisyGL\predictor\Base_Predictor.py:144: UserWarning: Sparse CSR tensor support is in beta state. If you miss a functionality in the sparse tensor support, please submit a feature request to https://github.com/pytorch/pytorch/issues. (Triggered internally at ..\aten\src\ATen\SparseCsrTensorImpl.cpp:55.)
    self.adj_csr = self.adj.to_sparse_csr().to(self.device)
[I 2026-05-01 01:02:27,955] Trial 58 finished with value: 0.757 and parameters: {'lr': 0.001, 'weight_decay': 0.001, 'n_hidden': 256, 'n_layer': 2, 'dropout': 0.672150831764305, 'knn_mode': 's', 'k': 39, 'dexp': 8.701827584762254, 'p_grd': 0.6453400541888641, 'unc_rem': 0.8724876458492216, 'unc_rel': 0.24466616185011145}. Best is trial 37 with value: 0.786.
    [CPU] Loading amazoncom...
    DEBUG 3.1: Dataset init start
    DEBUG 3.2: prepare_data start amazoncom
    ----Data statistics------'
    Name: amazoncom
    #Nodes 13752
    #Edges 245861
    #Classes 10
    #Ave_degree 35.76
    ----Split statistics------'
    #Train samples 200 (20 nodes per class)
    #Val samples 500 (specified)
    #Test samples 1000 (specified)
    ----label noise information:------
    Instance dependent noise
    #Actual noise rate 0.40
    [cuda:1] LNPCC waiting for GPU slot...
    [cuda:1] Slot acquired (waited 351.5s). Starting GCN...
    FINAL_RESULT: {'acc': {'train': 0.495, 'valid': 0.434, 'test': 0.692}, 'wall_s': 60.88, 'cpu_s': 57.15, 'gpu_s': 3.64, 'wait_s': 351.47}
    [Time] wall=60.9s | cpu=57.2s | gpu=3.6s
    C:\Users\fbrev\Documents\Acadêmico\Simulações\Python\NoisyGL\predictor\Base_Predictor.py:144: UserWarning: Sparse CSR tensor support is in beta state. If you miss a functionality in the sparse tensor support, please submit a feature request to https://github.com/pytorch/pytorch/issues. (Triggered internally at ..\aten\src\ATen\SparseCsrTensorImpl.cpp:55.)
    self.adj_csr = self.adj.to_sparse_csr().to(self.device)
[I 2026-05-01 01:09:25,875] Trial 59 finished with value: 0.692 and parameters: {'lr': 0.01, 'weight_decay': 0.0, 'n_hidden': 64, 'n_layer': 2, 'dropout': 0.4043031154034108, 'knn_mode': 'd', 'k': 50, 'dexp': 5.575484178993675, 'p_grd': 0.47825707491750175, 'unc_rem': 0.798849936987937, 'unc_rel': 0.07426205462588535}. Best is trial 37 with value: 0.786.
    [CPU] Loading amazoncom...
    DEBUG 3.1: Dataset init start
    DEBUG 3.2: prepare_data start amazoncom
    ----Data statistics------'
    Name: amazoncom
    #Nodes 13752
    #Edges 245861
    #Classes 10
    #Ave_degree 35.76
    ----Split statistics------'
    #Train samples 200 (20 nodes per class)
    #Val samples 500 (specified)
    #Test samples 1000 (specified)
    ----label noise information:------
    Instance dependent noise
    #Actual noise rate 0.40
    [cuda:1] LNPCC waiting for GPU slot...
    [cuda:1] Slot acquired (waited 81.4s). Starting GCN...
    FINAL_RESULT: {'acc': {'train': 0.6, 'valid': 0.502, 'test': 0.776}, 'wall_s': 59.2, 'cpu_s': 53.95, 'gpu_s': 5.16, 'wait_s': 81.42}
    [Time] wall=59.2s | cpu=53.9s | gpu=5.2s
    C:\Users\fbrev\Documents\Acadêmico\Simulações\Python\NoisyGL\predictor\Base_Predictor.py:144: UserWarning: Sparse CSR tensor support is in beta state. If you miss a functionality in the sparse tensor support, please submit a feature request to https://github.com/pytorch/pytorch/issues. (Triggered internally at ..\aten\src\ATen\SparseCsrTensorImpl.cpp:55.)
    self.adj_csr = self.adj.to_sparse_csr().to(self.device)
[I 2026-05-01 01:11:52,371] Trial 60 finished with value: 0.776 and parameters: {'lr': 0.005, 'weight_decay': 0.01, 'n_hidden': 128, 'n_layer': 2, 'dropout': 0.5153436558714158, 'knn_mode': 'd', 'k': 42, 'dexp': 6.06489099904292, 'p_grd': 0.588872468468334, 'unc_rem': 0.5211997653706884, 'unc_rel': 0.6211722346710655}. Best is trial 37 with value: 0.786.
    [CPU] Loading amazoncom...
    DEBUG 3.1: Dataset init start
    DEBUG 3.2: prepare_data start amazoncom
    ----Data statistics------'
    Name: amazoncom
    #Nodes 13752
    #Edges 245861
    #Classes 10
    #Ave_degree 35.76
    ----Split statistics------'
    #Train samples 200 (20 nodes per class)
    #Val samples 500 (specified)
    #Test samples 1000 (specified)
    ----label noise information:------
    Instance dependent noise
    #Actual noise rate 0.40
    [cuda:1] LNPCC waiting for GPU slot...
    [cuda:1] Slot acquired (waited 99.5s). Starting GCN...
    FINAL_RESULT: {'acc': {'train': 0.6414141414141414, 'valid': 0.488, 'test': 0.77}, 'wall_s': 39.19, 'cpu_s': 35.45, 'gpu_s': 3.61, 'wait_s': 99.53}
    [Time] wall=39.2s | cpu=35.5s | gpu=3.6s
    C:\Users\fbrev\Documents\Acadêmico\Simulações\Python\NoisyGL\predictor\Base_Predictor.py:144: UserWarning: Sparse CSR tensor support is in beta state. If you miss a functionality in the sparse tensor support, please submit a feature request to https://github.com/pytorch/pytorch/issues. (Triggered internally at ..\aten\src\ATen\SparseCsrTensorImpl.cpp:55.)
    self.adj_csr = self.adj.to_sparse_csr().to(self.device)
[I 2026-05-01 01:14:16,912] Trial 61 finished with value: 0.77 and parameters: {'lr': 0.001, 'weight_decay': 0.01, 'n_hidden': 64, 'n_layer': 2, 'dropout': 0.5062885047331752, 'knn_mode': 's', 'k': 42, 'dexp': 6.562311519735176, 'p_grd': 0.41679442304767417, 'unc_rem': 0.42233277795360236, 'unc_rel': 0.6561621044348489}. Best is trial 37 with value: 0.786.
    [CPU] Loading amazoncom...
    DEBUG 3.1: Dataset init start
    DEBUG 3.2: prepare_data start amazoncom
    ----Data statistics------'
    Name: amazoncom
    #Nodes 13752
    #Edges 245861
    #Classes 10
    #Ave_degree 35.76
    ----Split statistics------'
    #Train samples 200 (20 nodes per class)
    #Val samples 500 (specified)
    #Test samples 1000 (specified)
    ----label noise information:------
    Instance dependent noise
    #Actual noise rate 0.40
    [cuda:1] LNPCC waiting for GPU slot...
    [cuda:1] Slot acquired (waited 94.9s). Starting GCN...
    FINAL_RESULT: {'acc': {'train': 0.6275510204081632, 'valid': 0.488, 'test': 0.775}, 'wall_s': 39.07, 'cpu_s': 35.15, 'gpu_s': 3.82, 'wait_s': 94.9}
    [Time] wall=39.1s | cpu=35.1s | gpu=3.8s
    C:\Users\fbrev\Documents\Acadêmico\Simulações\Python\NoisyGL\predictor\Base_Predictor.py:144: UserWarning: Sparse CSR tensor support is in beta state. If you miss a functionality in the sparse tensor support, please submit a feature request to https://github.com/pytorch/pytorch/issues. (Triggered internally at ..\aten\src\ATen\SparseCsrTensorImpl.cpp:55.)
    self.adj_csr = self.adj.to_sparse_csr().to(self.device)
[I 2026-05-01 01:16:36,791] Trial 62 finished with value: 0.775 and parameters: {'lr': 0.001, 'weight_decay': 0.01, 'n_hidden': 64, 'n_layer': 2, 'dropout': 0.5117862864951584, 'knn_mode': 's', 'k': 46, 'dexp': 6.078516443446017, 'p_grd': 0.3304433847219235, 'unc_rem': 0.4265489527491512, 'unc_rel': 0.6107043796342625}. Best is trial 37 with value: 0.786.
    [CPU] Loading amazoncom...
    DEBUG 3.1: Dataset init start
    DEBUG 3.2: prepare_data start amazoncom
    ----Data statistics------'
    Name: amazoncom
    #Nodes 13752
    #Edges 245861
    #Classes 10
    #Ave_degree 35.76
    ----Split statistics------'
    #Train samples 200 (20 nodes per class)
    #Val samples 500 (specified)
    #Test samples 1000 (specified)
    ----label noise information:------
    Instance dependent noise
    #Actual noise rate 0.40
    [cuda:1] LNPCC waiting for GPU slot...
    [cuda:1] Slot acquired (waited 104.5s). Starting GCN...
    FINAL_RESULT: {'acc': {'train': 0.6767676767676768, 'valid': 0.49, 'test': 0.746}, 'wall_s': 34.18, 'cpu_s': 30.3, 'gpu_s': 3.8, 'wait_s': 104.47}
    [Time] wall=34.2s | cpu=30.3s | gpu=3.8s
    C:\Users\fbrev\Documents\Acadêmico\Simulações\Python\NoisyGL\predictor\Base_Predictor.py:144: UserWarning: Sparse CSR tensor support is in beta state. If you miss a functionality in the sparse tensor support, please submit a feature request to https://github.com/pytorch/pytorch/issues. (Triggered internally at ..\aten\src\ATen\SparseCsrTensorImpl.cpp:55.)
    self.adj_csr = self.adj.to_sparse_csr().to(self.device)
[I 2026-05-01 01:19:01,112] Trial 63 finished with value: 0.746 and parameters: {'lr': 0.001, 'weight_decay': 0.01, 'n_hidden': 64, 'n_layer': 2, 'dropout': 0.5059371314443845, 'knn_mode': 's', 'k': 48, 'dexp': 6.591213343198813, 'p_grd': 0.32764108715686246, 'unc_rem': 0.26022919342465956, 'unc_rel': 0.6569146124108598}. Best is trial 37 with value: 0.786.
    [CPU] Loading amazoncom...
    DEBUG 3.1: Dataset init start
    DEBUG 3.2: prepare_data start amazoncom
    ----Data statistics------'
    Name: amazoncom
    #Nodes 13752
    #Edges 245861
    #Classes 10
    #Ave_degree 35.76
    ----Split statistics------'
    #Train samples 200 (20 nodes per class)
    #Val samples 500 (specified)
    #Test samples 1000 (specified)
    ----label noise information:------
    Instance dependent noise
    #Actual noise rate 0.40
    [cuda:1] LNPCC waiting for GPU slot...
    [cuda:1] Slot acquired (waited 104.5s). Starting GCN...
    FINAL_RESULT: {'acc': {'train': 0.6767676767676768, 'valid': 0.492, 'test': 0.768}, 'wall_s': 37.76, 'cpu_s': 33.97, 'gpu_s': 3.7, 'wait_s': 104.53}
    [Time] wall=37.8s | cpu=34.0s | gpu=3.7s
    C:\Users\fbrev\Documents\Acadêmico\Simulações\Python\NoisyGL\predictor\Base_Predictor.py:144: UserWarning: Sparse CSR tensor support is in beta state. If you miss a functionality in the sparse tensor support, please submit a feature request to https://github.com/pytorch/pytorch/issues. (Triggered internally at ..\aten\src\ATen\SparseCsrTensorImpl.cpp:55.)
    self.adj_csr = self.adj.to_sparse_csr().to(self.device)
[I 2026-05-01 01:21:29,861] Trial 64 finished with value: 0.768 and parameters: {'lr': 0.001, 'weight_decay': 0.01, 'n_hidden': 64, 'n_layer': 2, 'dropout': 0.46761712319139975, 'knn_mode': 's', 'k': 46, 'dexp': 7.412150440073253, 'p_grd': 0.3833601832288541, 'unc_rem': 0.4185669667513259, 'unc_rel': 0.6114566802592946}. Best is trial 37 with value: 0.786.
    [CPU] Loading amazoncom...
    DEBUG 3.1: Dataset init start
    DEBUG 3.2: prepare_data start amazoncom
    ----Data statistics------'
    Name: amazoncom
    #Nodes 13752
    #Edges 245861
    #Classes 10
    #Ave_degree 35.76
    ----Split statistics------'
    #Train samples 200 (20 nodes per class)
    #Val samples 500 (specified)
    #Test samples 1000 (specified)
    ----label noise information:------
    Instance dependent noise
    #Actual noise rate 0.40
    [cuda:1] LNPCC waiting for GPU slot...
    [cuda:1] Slot acquired (waited 94.7s). Starting GCN...
    FINAL_RESULT: {'acc': {'train': 0.6262626262626263, 'valid': 0.49, 'test': 0.77}, 'wall_s': 39.28, 'cpu_s': 35.68, 'gpu_s': 3.5, 'wait_s': 94.71}
    [Time] wall=39.3s | cpu=35.7s | gpu=3.5s
    C:\Users\fbrev\Documents\Acadêmico\Simulações\Python\NoisyGL\predictor\Base_Predictor.py:144: UserWarning: Sparse CSR tensor support is in beta state. If you miss a functionality in the sparse tensor support, please submit a feature request to https://github.com/pytorch/pytorch/issues. (Triggered internally at ..\aten\src\ATen\SparseCsrTensorImpl.cpp:55.)
    self.adj_csr = self.adj.to_sparse_csr().to(self.device)
[I 2026-05-01 01:23:49,519] Trial 65 finished with value: 0.77 and parameters: {'lr': 0.001, 'weight_decay': 0.01, 'n_hidden': 64, 'n_layer': 2, 'dropout': 0.536769094214181, 'knn_mode': 's', 'k': 43, 'dexp': 5.927279603560402, 'p_grd': 0.4108080741375855, 'unc_rem': 0.5305525026237804, 'unc_rel': 0.5264029543896337}. Best is trial 37 with value: 0.786.
    [CPU] Loading amazoncom...
    DEBUG 3.1: Dataset init start
    DEBUG 3.2: prepare_data start amazoncom
    ----Data statistics------'
    Name: amazoncom
    #Nodes 13752
    #Edges 245861
    #Classes 10
    #Ave_degree 35.76
    ----Split statistics------'
    #Train samples 200 (20 nodes per class)
    #Val samples 500 (specified)
    #Test samples 1000 (specified)
    ----label noise information:------
    Instance dependent noise
    #Actual noise rate 0.40
    [cuda:1] LNPCC waiting for GPU slot...
    [cuda:1] Slot acquired (waited 104.2s). Starting GCN...
    FINAL_RESULT: {'acc': {'train': 0.6040609137055838, 'valid': 0.482, 'test': 0.733}, 'wall_s': 35.76, 'cpu_s': 30.03, 'gpu_s': 5.64, 'wait_s': 104.24}
    [Time] wall=35.8s | cpu=30.0s | gpu=5.6s
    C:\Users\fbrev\Documents\Acadêmico\Simulações\Python\NoisyGL\predictor\Base_Predictor.py:144: UserWarning: Sparse CSR tensor support is in beta state. If you miss a functionality in the sparse tensor support, please submit a feature request to https://github.com/pytorch/pytorch/issues. (Triggered internally at ..\aten\src\ATen\SparseCsrTensorImpl.cpp:55.)
    self.adj_csr = self.adj.to_sparse_csr().to(self.device)
[I 2026-05-01 01:26:15,465] Trial 66 finished with value: 0.733 and parameters: {'lr': 0.001, 'weight_decay': 0.01, 'n_hidden': 64, 'n_layer': 3, 'dropout': 0.5731322427313286, 'knn_mode': 's', 'k': 45, 'dexp': 7.857785935924827, 'p_grd': 0.34945718346874705, 'unc_rem': 0.3331300091578118, 'unc_rel': 0.7082041479820608}. Best is trial 37 with value: 0.786.
    [CPU] Loading amazoncom...
    DEBUG 3.1: Dataset init start
    DEBUG 3.2: prepare_data start amazoncom
    ----Data statistics------'
    Name: amazoncom
    #Nodes 13752
    #Edges 245861
    #Classes 10
    #Ave_degree 35.76
    ----Split statistics------'
    #Train samples 200 (20 nodes per class)
    #Val samples 500 (specified)
    #Test samples 1000 (specified)
    ----label noise information:------
    Instance dependent noise
    #Actual noise rate 0.40
    [cuda:1] LNPCC waiting for GPU slot...
    [cuda:1] Slot acquired (waited 102.5s). Starting GCN...
    FINAL_RESULT: {'acc': {'train': 0.6515151515151515, 'valid': 0.496, 'test': 0.77}, 'wall_s': 37.69, 'cpu_s': 33.74, 'gpu_s': 3.83, 'wait_s': 102.48}
    [Time] wall=37.7s | cpu=33.7s | gpu=3.8s
    C:\Users\fbrev\Documents\Acadêmico\Simulações\Python\NoisyGL\predictor\Base_Predictor.py:144: UserWarning: Sparse CSR tensor support is in beta state. If you miss a functionality in the sparse tensor support, please submit a feature request to https://github.com/pytorch/pytorch/issues. (Triggered internally at ..\aten\src\ATen\SparseCsrTensorImpl.cpp:55.)
    self.adj_csr = self.adj.to_sparse_csr().to(self.device)
[I 2026-05-01 01:28:41,362] Trial 67 finished with value: 0.77 and parameters: {'lr': 0.001, 'weight_decay': 0.01, 'n_hidden': 64, 'n_layer': 2, 'dropout': 0.6004958278618119, 'knn_mode': 's', 'k': 42, 'dexp': 6.31473542601582, 'p_grd': 0.47490624205261744, 'unc_rem': 0.5617023926397813, 'unc_rel': 0.6149102870151588}. Best is trial 37 with value: 0.786.
    [CPU] Loading amazoncom...
    DEBUG 3.1: Dataset init start
    DEBUG 3.2: prepare_data start amazoncom
    ----Data statistics------'
    Name: amazoncom
    #Nodes 13752
    #Edges 245861
    #Classes 10
    #Ave_degree 35.76
    ----Split statistics------'
    #Train samples 200 (20 nodes per class)
    #Val samples 500 (specified)
    #Test samples 1000 (specified)
    ----label noise information:------
    Instance dependent noise
    #Actual noise rate 0.40
    [cuda:1] LNPCC waiting for GPU slot...
    [cuda:1] Slot acquired (waited 104.5s). Starting GCN...
    FINAL_RESULT: {'acc': {'train': 0.47959183673469385, 'valid': 0.422, 'test': 0.62}, 'wall_s': 35.53, 'cpu_s': 31.7, 'gpu_s': 3.74, 'wait_s': 104.48}
    [Time] wall=35.5s | cpu=31.7s | gpu=3.7s
    C:\Users\fbrev\Documents\Acadêmico\Simulações\Python\NoisyGL\predictor\Base_Predictor.py:144: UserWarning: Sparse CSR tensor support is in beta state. If you miss a functionality in the sparse tensor support, please submit a feature request to https://github.com/pytorch/pytorch/issues. (Triggered internally at ..\aten\src\ATen\SparseCsrTensorImpl.cpp:55.)
    self.adj_csr = self.adj.to_sparse_csr().to(self.device)
[I 2026-05-01 01:31:07,388] Trial 68 finished with value: 0.62 and parameters: {'lr': 0.05, 'weight_decay': 0.01, 'n_hidden': 64, 'n_layer': 2, 'dropout': 0.4905275993387222, 'knn_mode': 's', 'k': 49, 'dexp': 7.087724732319388, 'p_grd': 0.2550022206222458, 'unc_rem': 0.4841302466273475, 'unc_rel': 0.7678090182353088}. Best is trial 37 with value: 0.786.
    [CPU] Loading amazoncom...
    DEBUG 3.1: Dataset init start
    DEBUG 3.2: prepare_data start amazoncom
    ----Data statistics------'
    Name: amazoncom
    #Nodes 13752
    #Edges 245861
    #Classes 10
    #Ave_degree 35.76
    ----Split statistics------'
    #Train samples 200 (20 nodes per class)
    #Val samples 500 (specified)
    #Test samples 1000 (specified)
    ----label noise information:------
    Instance dependent noise
    #Actual noise rate 0.40
    [cuda:1] LNPCC waiting for GPU slot...
    [cuda:1] Slot acquired (waited 108.3s). Starting GCN...
    FINAL_RESULT: {'acc': {'train': 0.7692307692307693, 'valid': 0.476, 'test': 0.722}, 'wall_s': 41.94, 'cpu_s': 33.46, 'gpu_s': 8.4, 'wait_s': 108.28}
    [Time] wall=41.9s | cpu=33.5s | gpu=8.4s
    C:\Users\fbrev\Documents\Acadêmico\Simulações\Python\NoisyGL\predictor\Base_Predictor.py:144: UserWarning: Sparse CSR tensor support is in beta state. If you miss a functionality in the sparse tensor support, please submit a feature request to https://github.com/pytorch/pytorch/issues. (Triggered internally at ..\aten\src\ATen\SparseCsrTensorImpl.cpp:55.)
    self.adj_csr = self.adj.to_sparse_csr().to(self.device)
