[I 2026-04-27 01:50:29,866] Trial 48 finished with value: 0.36157182954835415 and parameters: {'lr': 0.005, 'weight_decay': 0.0, 'n_hidden': 64, 'n_layer': 3, 'dropout': 0.12123001765688246, 'knn_mode': 's', 'k': 26, 'dexp': 8.66837561428278, 'p_grd': 0.1559393972862156, 'unc_rem': 0.6782747827317643, 'unc_rel': 0.5895248458442071}. Best is trial 44 with value: 0.3977034957897423.
    [CPU] Loading amazon-ratings...
    DEBUG 3.1: Dataset init start
    DEBUG 3.2: prepare_data start amazon-ratings
    ----Data statistics------'
    Name: amazon-ratings
    #Nodes 24492
    #Edges 93050
    #Classes 5
    #Ave_degree 7.60
    ----Split statistics------'
    #Train samples 1224 (5.0 % of nodes)
    #Val samples 3673 (15.0 % of nodes)
    #Test samples 19595 (remaining)
    ----label noise information:------
    Instance dependent noise
    #Actual noise rate 0.40
    [cuda:1] LNPCC waiting for GPU slot...
    [cuda:1] Slot acquired (waited 4.0s). Starting GCN...
    FINAL_RESULT: {'acc': {'train': 0.2616899097621001, 'valid': 0.2659950993738089, 'test': 0.34141362592498087}, 'wall_s': 77.09, 'cpu_s': 73.38, 'gpu_s': 3.63, 'wait_s': 4.01}
    [Time] wall=77.1s | cpu=73.4s | gpu=3.6s
    C:\Users\fbrev\Documents\Acadêmico\Simulações\Python\NoisyGL\predictor\Base_Predictor.py:144: UserWarning: Sparse CSR tensor support is in beta state. If you miss a functionality in the sparse tensor support, please submit a feature request to https://github.com/pytorch/pytorch/issues. (Triggered internally at ..\aten\src\ATen\SparseCsrTensorImpl.cpp:55.)
    self.adj_csr = self.adj.to_sparse_csr().to(self.device)
[I 2026-04-27 01:51:58,529] Trial 49 finished with value: 0.34141362592498087 and parameters: {'lr': 0.005, 'weight_decay': 0.01, 'n_hidden': 64, 'n_layer': 3, 'dropout': 0.17486370017023128, 'knn_mode': 'd', 'k': 33, 'dexp': 9.467545715491479, 'p_grd': 0.2921048903591624, 'unc_rem': 0.8540713696089359, 'unc_rel': 0.7187980264914995}. Best is trial 44 with value: 0.3977034957897423.
    [CPU] Loading amazon-ratings...
    DEBUG 3.1: Dataset init start
    DEBUG 3.2: prepare_data start amazon-ratings
    ----Data statistics------'
    Name: amazon-ratings
    #Nodes 24492
    #Edges 93050
    #Classes 5
    #Ave_degree 7.60
    ----Split statistics------'
    #Train samples 1224 (5.0 % of nodes)
    #Val samples 3673 (15.0 % of nodes)
    #Test samples 19595 (remaining)
    ----label noise information:------
    Instance dependent noise
    #Actual noise rate 0.40
    [cuda:1] LNPCC waiting for GPU slot...
    [cuda:1] Slot acquired (waited 1.8s). Starting GCN...
    FINAL_RESULT: {'acc': {'train': 0.4241348713398403, 'valid': 0.27470732371358564, 'test': 0.36631793824955344}, 'wall_s': 43.82, 'cpu_s': 38.75, 'gpu_s': 5.01, 'wait_s': 1.83}
    [Time] wall=43.8s | cpu=38.8s | gpu=5.0s
    C:\Users\fbrev\Documents\Acadêmico\Simulações\Python\NoisyGL\predictor\Base_Predictor.py:144: UserWarning: Sparse CSR tensor support is in beta state. If you miss a functionality in the sparse tensor support, please submit a feature request to https://github.com/pytorch/pytorch/issues. (Triggered internally at ..\aten\src\ATen\SparseCsrTensorImpl.cpp:55.)
    self.adj_csr = self.adj.to_sparse_csr().to(self.device)
[I 2026-04-27 01:52:51,405] Trial 50 finished with value: 0.36631793824955344 and parameters: {'lr': 0.005, 'weight_decay': 0.0001, 'n_hidden': 256, 'n_layer': 2, 'dropout': 0.05755138100825208, 'knn_mode': 's', 'k': 31, 'dexp': 1.3249133484591202, 'p_grd': 0.4567405148047877, 'unc_rem': 0.9096260799453101, 'unc_rel': 0.06218939269810303}. Best is trial 44 with value: 0.3977034957897423.
    [CPU] Loading amazon-ratings...
    DEBUG 3.1: Dataset init start
    DEBUG 3.2: prepare_data start amazon-ratings
    ----Data statistics------'
    Name: amazon-ratings
    #Nodes 24492
    #Edges 93050
    #Classes 5
    #Ave_degree 7.60
    ----Split statistics------'
    #Train samples 1224 (5.0 % of nodes)
    #Val samples 3673 (15.0 % of nodes)
    #Test samples 19595 (remaining)
    ----label noise information:------
    Instance dependent noise
    #Actual noise rate 0.40
    [cuda:1] LNPCC waiting for GPU slot...
    [cuda:1] Slot acquired (waited 0.0s). Starting GCN...
    FINAL_RESULT: {'acc': {'train': 0.3704620462046205, 'valid': 0.2880479172338688, 'test': 0.39372288849196224}, 'wall_s': 46.37, 'cpu_s': 43.15, 'gpu_s': 3.16, 'wait_s': 0.0}
    [Time] wall=46.4s | cpu=43.2s | gpu=3.2s
    C:\Users\fbrev\Documents\Acadêmico\Simulações\Python\NoisyGL\predictor\Base_Predictor.py:144: UserWarning: Sparse CSR tensor support is in beta state. If you miss a functionality in the sparse tensor support, please submit a feature request to https://github.com/pytorch/pytorch/issues. (Triggered internally at ..\aten\src\ATen\SparseCsrTensorImpl.cpp:55.)
    self.adj_csr = self.adj.to_sparse_csr().to(self.device)
[I 2026-04-27 01:53:44,870] Trial 51 finished with value: 0.39372288849196224 and parameters: {'lr': 0.005, 'weight_decay': 0.001, 'n_hidden': 32, 'n_layer': 3, 'dropout': 0.2288001796431819, 'knn_mode': 's', 'k': 24, 'dexp': 8.859096430545508, 'p_grd': 0.36418812398134515, 'unc_rem': 0.7412133859103026, 'unc_rel': 0.004250359278405558}. Best is trial 44 with value: 0.3977034957897423.
    [CPU] Loading amazon-ratings...
    DEBUG 3.1: Dataset init start
    DEBUG 3.2: prepare_data start amazon-ratings
    ----Data statistics------'
    Name: amazon-ratings
    #Nodes 24492
    #Edges 93050
    #Classes 5
    #Ave_degree 7.60
    ----Split statistics------'
    #Train samples 1224 (5.0 % of nodes)
    #Val samples 3673 (15.0 % of nodes)
    #Test samples 19595 (remaining)
    ----label noise information:------
    Instance dependent noise
    #Actual noise rate 0.40
    [cuda:1] LNPCC waiting for GPU slot...
    [cuda:1] Slot acquired (waited 17.6s). Starting GCN...
    FINAL_RESULT: {'acc': {'train': 0.37520525451559933, 'valid': 0.28777566022325074, 'test': 0.3958152589946415}, 'wall_s': 54.66, 'cpu_s': 51.39, 'gpu_s': 3.18, 'wait_s': 17.63}
    [Time] wall=54.7s | cpu=51.4s | gpu=3.2s
    C:\Users\fbrev\Documents\Acadêmico\Simulações\Python\NoisyGL\predictor\Base_Predictor.py:144: UserWarning: Sparse CSR tensor support is in beta state. If you miss a functionality in the sparse tensor support, please submit a feature request to https://github.com/pytorch/pytorch/issues. (Triggered internally at ..\aten\src\ATen\SparseCsrTensorImpl.cpp:55.)
    self.adj_csr = self.adj.to_sparse_csr().to(self.device)
[I 2026-04-27 01:55:03,823] Trial 52 finished with value: 0.3958152589946415 and parameters: {'lr': 0.005, 'weight_decay': 0.001, 'n_hidden': 32, 'n_layer': 3, 'dropout': 0.20971682135501865, 'knn_mode': 's', 'k': 24, 'dexp': 9.129042926262288, 'p_grd': 0.357760704654049, 'unc_rem': 0.8091852673523809, 'unc_rel': 0.10406063089513318}. Best is trial 44 with value: 0.3977034957897423.
    [CPU] Loading amazon-ratings...
    DEBUG 3.1: Dataset init start
    DEBUG 3.2: prepare_data start amazon-ratings
    ----Data statistics------'
    Name: amazon-ratings
    #Nodes 24492
    #Edges 93050
    #Classes 5
    #Ave_degree 7.60
    ----Split statistics------'
    #Train samples 1224 (5.0 % of nodes)
    #Val samples 3673 (15.0 % of nodes)
    #Test samples 19595 (remaining)
    ----label noise information:------
    Instance dependent noise
    #Actual noise rate 0.40
    [cuda:1] LNPCC waiting for GPU slot...
    [cuda:1] Slot acquired (waited 9.7s). Starting GCN...
    FINAL_RESULT: {'acc': {'train': 0.4132231404958678, 'valid': 0.28668663218077867, 'test': 0.376881857616739}, 'wall_s': 53.87, 'cpu_s': 50.76, 'gpu_s': 3.03, 'wait_s': 9.71}
    [Time] wall=53.9s | cpu=50.8s | gpu=3.0s
    C:\Users\fbrev\Documents\Acadêmico\Simulações\Python\NoisyGL\predictor\Base_Predictor.py:144: UserWarning: Sparse CSR tensor support is in beta state. If you miss a functionality in the sparse tensor support, please submit a feature request to https://github.com/pytorch/pytorch/issues. (Triggered internally at ..\aten\src\ATen\SparseCsrTensorImpl.cpp:55.)
    self.adj_csr = self.adj.to_sparse_csr().to(self.device)
[I 2026-04-27 01:56:14,990] Trial 53 finished with value: 0.376881857616739 and parameters: {'lr': 0.005, 'weight_decay': 0.001, 'n_hidden': 32, 'n_layer': 3, 'dropout': 0.15939199335542645, 'knn_mode': 's', 'k': 23, 'dexp': 9.173364925690668, 'p_grd': 0.35919012954355184, 'unc_rem': 0.7266468819702299, 'unc_rel': 0.011851960153799829}. Best is trial 44 with value: 0.3977034957897423.
    [CPU] Loading amazon-ratings...
    DEBUG 3.1: Dataset init start
    DEBUG 3.2: prepare_data start amazon-ratings
    ----Data statistics------'
    Name: amazon-ratings
    #Nodes 24492
    #Edges 93050
    #Classes 5
    #Ave_degree 7.60
    ----Split statistics------'
    #Train samples 1224 (5.0 % of nodes)
    #Val samples 3673 (15.0 % of nodes)
    #Test samples 19595 (remaining)
    ----label noise information:------
    Instance dependent noise
    #Actual noise rate 0.40
    [cuda:1] LNPCC waiting for GPU slot...
    [cuda:1] Slot acquired (waited 0.0s). Starting GCN...
    FINAL_RESULT: {'acc': {'train': 0.38051623646960864, 'valid': 0.28995371630819494, 'test': 0.38565960704261293}, 'wall_s': 36.28, 'cpu_s': 33.51, 'gpu_s': 2.72, 'wait_s': 0.0}
    [Time] wall=36.3s | cpu=33.5s | gpu=2.7s
    C:\Users\fbrev\Documents\Acadêmico\Simulações\Python\NoisyGL\predictor\Base_Predictor.py:144: UserWarning: Sparse CSR tensor support is in beta state. If you miss a functionality in the sparse tensor support, please submit a feature request to https://github.com/pytorch/pytorch/issues. (Triggered internally at ..\aten\src\ATen\SparseCsrTensorImpl.cpp:55.)
    self.adj_csr = self.adj.to_sparse_csr().to(self.device)
[I 2026-04-27 01:56:58,319] Trial 54 finished with value: 0.38565960704261293 and parameters: {'lr': 0.005, 'weight_decay': 0.001, 'n_hidden': 32, 'n_layer': 3, 'dropout': 0.1941965689917521, 'knn_mode': 's', 'k': 25, 'dexp': 9.684421776674704, 'p_grd': 0.2686386670821769, 'unc_rem': 0.8352711077321815, 'unc_rel': 0.06678507244246162}. Best is trial 44 with value: 0.3977034957897423.
    [CPU] Loading amazon-ratings...
    DEBUG 3.1: Dataset init start
    DEBUG 3.2: prepare_data start amazon-ratings
    ----Data statistics------'
    Name: amazon-ratings
    #Nodes 24492
    #Edges 93050
    #Classes 5
    #Ave_degree 7.60
    ----Split statistics------'
    #Train samples 1224 (5.0 % of nodes)
    #Val samples 3673 (15.0 % of nodes)
    #Test samples 19595 (remaining)
    ----label noise information:------
    Instance dependent noise
    #Actual noise rate 0.40
    [cuda:1] LNPCC waiting for GPU slot...
    [cuda:1] Slot acquired (waited 0.9s). Starting GCN...
    FINAL_RESULT: {'acc': {'train': 0.3837882547559967, 'valid': 0.28886468826572287, 'test': 0.3814748660372544}, 'wall_s': 32.45, 'cpu_s': 29.69, 'gpu_s': 2.7, 'wait_s': 0.91}
    [Time] wall=32.4s | cpu=29.7s | gpu=2.7s
    C:\Users\fbrev\Documents\Acadêmico\Simulações\Python\NoisyGL\predictor\Base_Predictor.py:144: UserWarning: Sparse CSR tensor support is in beta state. If you miss a functionality in the sparse tensor support, please submit a feature request to https://github.com/pytorch/pytorch/issues. (Triggered internally at ..\aten\src\ATen\SparseCsrTensorImpl.cpp:55.)
    self.adj_csr = self.adj.to_sparse_csr().to(self.device)
[I 2026-04-27 01:57:37,485] Trial 55 finished with value: 0.3814748660372544 and parameters: {'lr': 0.005, 'weight_decay': 0.001, 'n_hidden': 32, 'n_layer': 3, 'dropout': 0.2378393973497886, 'knn_mode': 's', 'k': 19, 'dexp': 8.380293672567293, 'p_grd': 0.29871823769766354, 'unc_rem': 0.8807101704786654, 'unc_rel': 0.15121515006171551}. Best is trial 44 with value: 0.3977034957897423.
    [CPU] Loading amazon-ratings...
    DEBUG 3.1: Dataset init start
    DEBUG 3.2: prepare_data start amazon-ratings
    ----Data statistics------'
    Name: amazon-ratings
    #Nodes 24492
    #Edges 93050
    #Classes 5
    #Ave_degree 7.60
    ----Split statistics------'
    #Train samples 1224 (5.0 % of nodes)
    #Val samples 3673 (15.0 % of nodes)
    #Test samples 19595 (remaining)
    ----label noise information:------
    Instance dependent noise
    #Actual noise rate 0.40
    [cuda:1] LNPCC waiting for GPU slot...
    [cuda:1] Slot acquired (waited 0.0s). Starting GCN...
    FINAL_RESULT: {'acc': {'train': 0.26475548060708265, 'valid': 0.26245575823577455, 'test': 0.3690737433018627}, 'wall_s': 29.8, 'cpu_s': 27.22, 'gpu_s': 2.53, 'wait_s': 0.0}
    [Time] wall=29.8s | cpu=27.2s | gpu=2.5s
    C:\Users\fbrev\Documents\Acadêmico\Simulações\Python\NoisyGL\predictor\Base_Predictor.py:144: UserWarning: Sparse CSR tensor support is in beta state. If you miss a functionality in the sparse tensor support, please submit a feature request to https://github.com/pytorch/pytorch/issues. (Triggered internally at ..\aten\src\ATen\SparseCsrTensorImpl.cpp:55.)
    self.adj_csr = self.adj.to_sparse_csr().to(self.device)
[I 2026-04-27 01:58:12,874] Trial 56 finished with value: 0.3690737433018627 and parameters: {'lr': 0.005, 'weight_decay': 0.05, 'n_hidden': 32, 'n_layer': 3, 'dropout': 0.14610515827848203, 'knn_mode': 's', 'k': 28, 'dexp': 8.906685900795186, 'p_grd': 0.2185613546876384, 'unc_rem': 0.706332794843898, 'unc_rel': 0.12307042732358411}. Best is trial 44 with value: 0.3977034957897423.
    [CPU] Loading amazon-ratings...
    DEBUG 3.1: Dataset init start
    DEBUG 3.2: prepare_data start amazon-ratings
    ----Data statistics------'
    Name: amazon-ratings
    #Nodes 24492
    #Edges 93050
    #Classes 5
    #Ave_degree 7.60
    ----Split statistics------'
    #Train samples 1224 (5.0 % of nodes)
    #Val samples 3673 (15.0 % of nodes)
    #Test samples 19595 (remaining)
    ----label noise information:------
    Instance dependent noise
    #Actual noise rate 0.40
    [cuda:1] LNPCC waiting for GPU slot...
    [cuda:1] Slot acquired (waited 1.8s). Starting GCN...
    FINAL_RESULT: {'acc': {'train': 0.400329489291598, 'valid': 0.2883201742444868, 'test': 0.37815769328910437}, 'wall_s': 46.2, 'cpu_s': 43.57, 'gpu_s': 2.58, 'wait_s': 1.78}
    [Time] wall=46.2s | cpu=43.6s | gpu=2.6s
    C:\Users\fbrev\Documents\Acadêmico\Simulações\Python\NoisyGL\predictor\Base_Predictor.py:144: UserWarning: Sparse CSR tensor support is in beta state. If you miss a functionality in the sparse tensor support, please submit a feature request to https://github.com/pytorch/pytorch/issues. (Triggered internally at ..\aten\src\ATen\SparseCsrTensorImpl.cpp:55.)
    self.adj_csr = self.adj.to_sparse_csr().to(self.device)
[I 2026-04-27 01:59:06,250] Trial 57 finished with value: 0.37815769328910437 and parameters: {'lr': 0.005, 'weight_decay': 0.001, 'n_hidden': 32, 'n_layer': 3, 'dropout': 0.09580352913726084, 'knn_mode': 'd', 'k': 22, 'dexp': 8.140923207139313, 'p_grd': 0.39954476431900754, 'unc_rem': 0.8051134082191147, 'unc_rel': 0.013339974969546826}. Best is trial 44 with value: 0.3977034957897423.
    [CPU] Loading amazon-ratings...
    DEBUG 3.1: Dataset init start
    DEBUG 3.2: prepare_data start amazon-ratings
    ----Data statistics------'
    Name: amazon-ratings
    #Nodes 24492
    #Edges 93050
    #Classes 5
    #Ave_degree 7.60
    ----Split statistics------'
    #Train samples 1224 (5.0 % of nodes)
    #Val samples 3673 (15.0 % of nodes)
    #Test samples 19595 (remaining)
    ----label noise information:------
    Instance dependent noise
    #Actual noise rate 0.40
    [cuda:1] LNPCC waiting for GPU slot...
    [cuda:1] Slot acquired (waited 0.0s). Starting GCN...
    FINAL_RESULT: {'acc': {'train': 0.45118949958982774, 'valid': 0.2782466648516199, 'test': 0.3692268435825466}, 'wall_s': 33.05, 'cpu_s': 31.06, 'gpu_s': 1.94, 'wait_s': 0.0}
    [Time] wall=33.1s | cpu=31.1s | gpu=1.9s
    C:\Users\fbrev\Documents\Acadêmico\Simulações\Python\NoisyGL\predictor\Base_Predictor.py:144: UserWarning: Sparse CSR tensor support is in beta state. If you miss a functionality in the sparse tensor support, please submit a feature request to https://github.com/pytorch/pytorch/issues. (Triggered internally at ..\aten\src\ATen\SparseCsrTensorImpl.cpp:55.)
    self.adj_csr = self.adj.to_sparse_csr().to(self.device)
[I 2026-04-27 01:59:44,834] Trial 58 finished with value: 0.3692268435825466 and parameters: {'lr': 0.005, 'weight_decay': 0.001, 'n_hidden': 32, 'n_layer': 2, 'dropout': 0.19974305949188453, 'knn_mode': 's', 'k': 29, 'dexp': 7.273498504772699, 'p_grd': 0.35068176199710754, 'unc_rem': 0.7508825538578804, 'unc_rel': 0.42801386212455983}. Best is trial 44 with value: 0.3977034957897423.
    [CPU] Loading amazon-ratings...
    DEBUG 3.1: Dataset init start
    DEBUG 3.2: prepare_data start amazon-ratings
    ----Data statistics------'
    Name: amazon-ratings
    #Nodes 24492
    #Edges 93050
    #Classes 5
    #Ave_degree 7.60
    ----Split statistics------'
    #Train samples 1224 (5.0 % of nodes)
    #Val samples 3673 (15.0 % of nodes)
    #Test samples 19595 (remaining)
    ----label noise information:------
    Instance dependent noise
    #Actual noise rate 0.40
    [cuda:1] LNPCC waiting for GPU slot...
    [cuda:1] Slot acquired (waited 4.8s). Starting GCN...
    FINAL_RESULT: {'acc': {'train': 0.4428923582580115, 'valid': 0.28314729104274433, 'test': 0.3655014034192396}, 'wall_s': 27.99, 'cpu_s': 25.07, 'gpu_s': 2.87, 'wait_s': 4.77}
    [Time] wall=28.0s | cpu=25.1s | gpu=2.9s
    C:\Users\fbrev\Documents\Acadêmico\Simulações\Python\NoisyGL\predictor\Base_Predictor.py:144: UserWarning: Sparse CSR tensor support is in beta state. If you miss a functionality in the sparse tensor support, please submit a feature request to https://github.com/pytorch/pytorch/issues. (Triggered internally at ..\aten\src\ATen\SparseCsrTensorImpl.cpp:55.)
    self.adj_csr = self.adj.to_sparse_csr().to(self.device)
[I 2026-04-27 02:00:23,514] Trial 59 finished with value: 0.3655014034192396 and parameters: {'lr': 0.01, 'weight_decay': 0.001, 'n_hidden': 32, 'n_layer': 3, 'dropout': 0.303085094154273, 'knn_mode': 's', 'k': 26, 'dexp': 9.253548062623823, 'p_grd': 0.15705877446178085, 'unc_rem': 0.9470092112222457, 'unc_rel': 0.7853218358262488}. Best is trial 44 with value: 0.3977034957897423.
    [CPU] Loading amazon-ratings...
    DEBUG 3.1: Dataset init start
    DEBUG 3.2: prepare_data start amazon-ratings
    ----Data statistics------'
    Name: amazon-ratings
    #Nodes 24492
    #Edges 93050
    #Classes 5
    #Ave_degree 7.60
    ----Split statistics------'
    #Train samples 1224 (5.0 % of nodes)
    #Val samples 3673 (15.0 % of nodes)
    #Test samples 19595 (remaining)
    ----label noise information:------
    Instance dependent noise
    #Actual noise rate 0.40
    [cuda:1] LNPCC waiting for GPU slot...
    [cuda:1] Slot acquired (waited 1.9s). Starting GCN...
    FINAL_RESULT: {'acc': {'train': 0.4005305039787798, 'valid': 0.2828750340321263, 'test': 0.38576167389640215}, 'wall_s': 25.86, 'cpu_s': 22.83, 'gpu_s': 2.98, 'wait_s': 1.94}
    [Time] wall=25.9s | cpu=22.8s | gpu=3.0s
    C:\Users\fbrev\Documents\Acadêmico\Simulações\Python\NoisyGL\predictor\Base_Predictor.py:144: UserWarning: Sparse CSR tensor support is in beta state. If you miss a functionality in the sparse tensor support, please submit a feature request to https://github.com/pytorch/pytorch/issues. (Triggered internally at ..\aten\src\ATen\SparseCsrTensorImpl.cpp:55.)
    self.adj_csr = self.adj.to_sparse_csr().to(self.device)
[I 2026-04-27 02:00:57,808] Trial 60 finished with value: 0.38576167389640215 and parameters: {'lr': 0.005, 'weight_decay': 0.0, 'n_hidden': 32, 'n_layer': 3, 'dropout': 0.25337405817297126, 'knn_mode': 's', 'k': 15, 'dexp': 8.50928943469751, 'p_grd': 0.025133940245452402, 'unc_rem': 0.6723451592530857, 'unc_rel': 0.18275570822927167}. Best is trial 44 with value: 0.3977034957897423.
    [CPU] Loading amazon-ratings...
    DEBUG 3.1: Dataset init start
    DEBUG 3.2: prepare_data start amazon-ratings
    ----Data statistics------'
    Name: amazon-ratings
    #Nodes 24492
    #Edges 93050
    #Classes 5
    #Ave_degree 7.60
    ----Split statistics------'
    #Train samples 1224 (5.0 % of nodes)
    #Val samples 3673 (15.0 % of nodes)
    #Test samples 19595 (remaining)
    ----label noise information:------
    Instance dependent noise
    #Actual noise rate 0.40
    [cuda:1] LNPCC waiting for GPU slot...
    [cuda:1] Slot acquired (waited 0.0s). Starting GCN...
    FINAL_RESULT: {'acc': {'train': 0.25, 'valid': 0.26218350122515655, 'test': 0.36851237560602196}, 'wall_s': 39.72, 'cpu_s': 34.67, 'gpu_s': 4.99, 'wait_s': 0.0}
    [Time] wall=39.7s | cpu=34.7s | gpu=5.0s
    C:\Users\fbrev\Documents\Acadêmico\Simulações\Python\NoisyGL\predictor\Base_Predictor.py:144: UserWarning: Sparse CSR tensor support is in beta state. If you miss a functionality in the sparse tensor support, please submit a feature request to https://github.com/pytorch/pytorch/issues. (Triggered internally at ..\aten\src\ATen\SparseCsrTensorImpl.cpp:55.)
    self.adj_csr = self.adj.to_sparse_csr().to(self.device)
