[I 2026-05-01 23:02:38,172] Trial 35 finished with value: 0.901 and parameters: {'lr': 0.005, 'weight_decay': 0.01, 'n_hidden': 32, 'n_layer': 2, 'dropout': 0.6212872698129447, 'knn_mode': 'd', 'k': 34, 'dexp': 6.171810766810831, 'p_grd': 0.6468681776672844, 'unc_rem': 0.7854154330374862, 'unc_rel': 0.6963475751809337}. Best is trial 20 with value: 0.911.
    [CPU] Loading amazonpho...
    DEBUG 3.1: Dataset init start
    DEBUG 3.2: prepare_data start amazonpho
    ----Data statistics------'
    Name: amazonpho
    #Nodes 7650
    #Edges 119081
    #Classes 8
    #Ave_degree 31.13
    ----Split statistics------'
    #Train samples 160 (20 nodes per class)
    #Val samples 500 (specified)
    #Test samples 1000 (specified)
    ----label noise information:------
    Instance dependent noise
    #Actual noise rate 0.21
    [cuda:0] LNPCC waiting for GPU slot...
    [cuda:0] Slot acquired (waited 132.3s). Starting GCN...
    FINAL_RESULT: {'acc': {'train': 0.76875, 'valid': 0.722, 'test': 0.881}, 'wall_s': 29.35, 'cpu_s': 24.46, 'gpu_s': 4.85, 'wait_s': 132.33}
    [Time] wall=29.4s | cpu=24.5s | gpu=4.8s
    C:\Users\fbrev\Documents\Acadêmico\Simulações\Python\NoisyGL\predictor\Base_Predictor.py:114: UserWarning: expandable_segments not supported on this platform (Triggered internally at ..\c10/cuda/CUDAAllocatorConfig.h:28.)
    self.edge_index = self._cpu_edge_index.to(self.device)
    C:\Users\fbrev\Documents\Acadêmico\Simulações\Python\NoisyGL\predictor\Base_Predictor.py:144: UserWarning: Sparse CSR tensor support is in beta state. If you miss a functionality in the sparse tensor support, please submit a feature request to https://github.com/pytorch/pytorch/issues. (Triggered internally at ..\aten\src\ATen\SparseCsrTensorImpl.cpp:55.)
    self.adj_csr = self.adj.to_sparse_csr().to(self.device)
[I 2026-05-01 23:05:34,077] Trial 36 finished with value: 0.881 and parameters: {'lr': 0.01, 'weight_decay': 0.001, 'n_hidden': 256, 'n_layer': 2, 'dropout': 0.5498251610332495, 'knn_mode': 'd', 'k': 40, 'dexp': 4.415264127870119, 'p_grd': 0.5760747309468172, 'unc_rem': 0.9012996574095427, 'unc_rel': 0.9226868405173578}. Best is trial 20 with value: 0.911.
    [CPU] Loading amazonpho...
    DEBUG 3.1: Dataset init start
    DEBUG 3.2: prepare_data start amazonpho
    ----Data statistics------'
    Name: amazonpho
    #Nodes 7650
    #Edges 119081
    #Classes 8
    #Ave_degree 31.13
    ----Split statistics------'
    #Train samples 160 (20 nodes per class)
    #Val samples 500 (specified)
    #Test samples 1000 (specified)
    ----label noise information:------
    Instance dependent noise
    #Actual noise rate 0.21
    [cuda:0] LNPCC waiting for GPU slot...
    [cuda:0] Slot acquired (waited 274.9s). Starting GCN...
    FINAL_RESULT: {'acc': {'train': 0.7875, 'valid': 0.728, 'test': 0.894}, 'wall_s': 27.27, 'cpu_s': 23.97, 'gpu_s': 3.26, 'wait_s': 274.87}
    [Time] wall=27.3s | cpu=24.0s | gpu=3.3s
    C:\Users\fbrev\Documents\Acadêmico\Simulações\Python\NoisyGL\predictor\Base_Predictor.py:114: UserWarning: expandable_segments not supported on this platform (Triggered internally at ..\c10/cuda/CUDAAllocatorConfig.h:28.)
    self.edge_index = self._cpu_edge_index.to(self.device)
    C:\Users\fbrev\Documents\Acadêmico\Simulações\Python\NoisyGL\predictor\Base_Predictor.py:144: UserWarning: Sparse CSR tensor support is in beta state. If you miss a functionality in the sparse tensor support, please submit a feature request to https://github.com/pytorch/pytorch/issues. (Triggered internally at ..\aten\src\ATen\SparseCsrTensorImpl.cpp:55.)
    self.adj_csr = self.adj.to_sparse_csr().to(self.device)
[I 2026-05-01 23:10:42,970] Trial 37 finished with value: 0.894 and parameters: {'lr': 0.005, 'weight_decay': 0.0, 'n_hidden': 128, 'n_layer': 2, 'dropout': 0.7154266584420715, 'knn_mode': 'd', 'k': 27, 'dexp': 6.8758192107320015, 'p_grd': 0.9395387208977648, 'unc_rem': 0.6566676125593411, 'unc_rel': 0.3818880454233285}. Best is trial 20 with value: 0.911.
    [CPU] Loading amazonpho...
    DEBUG 3.1: Dataset init start
    DEBUG 3.2: prepare_data start amazonpho
    ----Data statistics------'
    Name: amazonpho
    #Nodes 7650
    #Edges 119081
    #Classes 8
    #Ave_degree 31.13
    ----Split statistics------'
    #Train samples 160 (20 nodes per class)
    #Val samples 500 (specified)
    #Test samples 1000 (specified)
    ----label noise information:------
    Instance dependent noise
    #Actual noise rate 0.21
    [cuda:0] LNPCC waiting for GPU slot...
    [cuda:0] Slot acquired (waited 133.4s). Starting GCN...
    FINAL_RESULT: {'acc': {'train': 0.78125, 'valid': 0.728, 'test': 0.9}, 'wall_s': 28.88, 'cpu_s': 23.98, 'gpu_s': 4.86, 'wait_s': 133.45}
    [Time] wall=28.9s | cpu=24.0s | gpu=4.9s
    C:\Users\fbrev\Documents\Acadêmico\Simulações\Python\NoisyGL\predictor\Base_Predictor.py:114: UserWarning: expandable_segments not supported on this platform (Triggered internally at ..\c10/cuda/CUDAAllocatorConfig.h:28.)
    self.edge_index = self._cpu_edge_index.to(self.device)
    C:\Users\fbrev\Documents\Acadêmico\Simulações\Python\NoisyGL\predictor\Base_Predictor.py:144: UserWarning: Sparse CSR tensor support is in beta state. If you miss a functionality in the sparse tensor support, please submit a feature request to https://github.com/pytorch/pytorch/issues. (Triggered internally at ..\aten\src\ATen\SparseCsrTensorImpl.cpp:55.)
    self.adj_csr = self.adj.to_sparse_csr().to(self.device)
[I 2026-05-01 23:13:31,377] Trial 38 finished with value: 0.9 and parameters: {'lr': 0.005, 'weight_decay': 0.001, 'n_hidden': 256, 'n_layer': 2, 'dropout': 0.45810371066851463, 'knn_mode': 'd', 'k': 34, 'dexp': 4.108316133550778, 'p_grd': 0.8394208502599598, 'unc_rem': 0.8331804145379673, 'unc_rel': 0.8187673062151831}. Best is trial 20 with value: 0.911.
    [CPU] Loading amazonpho...
    DEBUG 3.1: Dataset init start
    DEBUG 3.2: prepare_data start amazonpho
    ----Data statistics------'
    Name: amazonpho
    #Nodes 7650
    #Edges 119081
    #Classes 8
    #Ave_degree 31.13
    ----Split statistics------'
    #Train samples 160 (20 nodes per class)
    #Val samples 500 (specified)
    #Test samples 1000 (specified)
    ----label noise information:------
    Instance dependent noise
    #Actual noise rate 0.21
    [cuda:0] LNPCC waiting for GPU slot...
    [cuda:0] Slot acquired (waited 126.3s). Starting GCN...
    FINAL_RESULT: {'acc': {'train': 0.1375, 'valid': 0.434, 'test': 0.533}, 'wall_s': 26.12, 'cpu_s': 21.29, 'gpu_s': 4.79, 'wait_s': 126.33}
    [Time] wall=26.1s | cpu=21.3s | gpu=4.8s
    C:\Users\fbrev\Documents\Acadêmico\Simulações\Python\NoisyGL\predictor\Base_Predictor.py:114: UserWarning: expandable_segments not supported on this platform (Triggered internally at ..\c10/cuda/CUDAAllocatorConfig.h:28.)
    self.edge_index = self._cpu_edge_index.to(self.device)
    C:\Users\fbrev\Documents\Acadêmico\Simulações\Python\NoisyGL\predictor\Base_Predictor.py:144: UserWarning: Sparse CSR tensor support is in beta state. If you miss a functionality in the sparse tensor support, please submit a feature request to https://github.com/pytorch/pytorch/issues. (Triggered internally at ..\aten\src\ATen\SparseCsrTensorImpl.cpp:55.)
    self.adj_csr = self.adj.to_sparse_csr().to(self.device)
[I 2026-05-01 23:16:09,754] Trial 39 finished with value: 0.533 and parameters: {'lr': 0.05, 'weight_decay': 0.05, 'n_hidden': 256, 'n_layer': 2, 'dropout': 0.37936995601459145, 'knn_mode': 'd', 'k': 39, 'dexp': 2.923342904790678, 'p_grd': 0.6773541946901105, 'unc_rem': 0.5465792253417391, 'unc_rel': 0.1574384265159626}. Best is trial 20 with value: 0.911.
    [CPU] Loading amazonpho...
    DEBUG 3.1: Dataset init start
    DEBUG 3.2: prepare_data start amazonpho
    ----Data statistics------'
    Name: amazonpho
    #Nodes 7650
    #Edges 119081
    #Classes 8
    #Ave_degree 31.13
    ----Split statistics------'
    #Train samples 160 (20 nodes per class)
    #Val samples 500 (specified)
    #Test samples 1000 (specified)
    ----label noise information:------
    Instance dependent noise
    #Actual noise rate 0.21
    [cuda:0] LNPCC waiting for GPU slot...
    [cuda:0] Slot acquired (waited 126.5s). Starting GCN...
    FINAL_RESULT: {'acc': {'train': 0.7125, 'valid': 0.708, 'test': 0.859}, 'wall_s': 22.35, 'cpu_s': 19.87, 'gpu_s': 2.44, 'wait_s': 126.51}
    [Time] wall=22.3s | cpu=19.9s | gpu=2.4s
    C:\Users\fbrev\Documents\Acadêmico\Simulações\Python\NoisyGL\predictor\Base_Predictor.py:114: UserWarning: expandable_segments not supported on this platform (Triggered internally at ..\c10/cuda/CUDAAllocatorConfig.h:28.)
    self.edge_index = self._cpu_edge_index.to(self.device)
    C:\Users\fbrev\Documents\Acadêmico\Simulações\Python\NoisyGL\predictor\Base_Predictor.py:144: UserWarning: Sparse CSR tensor support is in beta state. If you miss a functionality in the sparse tensor support, please submit a feature request to https://github.com/pytorch/pytorch/issues. (Triggered internally at ..\aten\src\ATen\SparseCsrTensorImpl.cpp:55.)
    self.adj_csr = self.adj.to_sparse_csr().to(self.device)
[I 2026-05-01 23:18:44,733] Trial 40 finished with value: 0.859 and parameters: {'lr': 0.01, 'weight_decay': 0.0001, 'n_hidden': 32, 'n_layer': 2, 'dropout': 0.6569523405580188, 'knn_mode': 'd', 'k': 45, 'dexp': 5.227014804407707, 'p_grd': 0.5355168909444354, 'unc_rem': 0.9277319268895493, 'unc_rel': 0.9334871754952018}. Best is trial 20 with value: 0.911.
    [CPU] Loading amazonpho...
    DEBUG 3.1: Dataset init start
    DEBUG 3.2: prepare_data start amazonpho
    ----Data statistics------'
    Name: amazonpho
    #Nodes 7650
    #Edges 119081
    #Classes 8
    #Ave_degree 31.13
    ----Split statistics------'
    #Train samples 160 (20 nodes per class)
    #Val samples 500 (specified)
    #Test samples 1000 (specified)
    ----label noise information:------
    Instance dependent noise
    #Actual noise rate 0.21
    [cuda:0] LNPCC waiting for GPU slot...
    [cuda:0] Slot acquired (waited 127.7s). Starting GCN...
    FINAL_RESULT: {'acc': {'train': 0.7261146496815286, 'valid': 0.728, 'test': 0.889}, 'wall_s': 23.75, 'cpu_s': 15.71, 'gpu_s': 7.99, 'wait_s': 127.71}
    [Time] wall=23.7s | cpu=15.7s | gpu=8.0s
    C:\Users\fbrev\Documents\Acadêmico\Simulações\Python\NoisyGL\predictor\Base_Predictor.py:114: UserWarning: expandable_segments not supported on this platform (Triggered internally at ..\c10/cuda/CUDAAllocatorConfig.h:28.)
    self.edge_index = self._cpu_edge_index.to(self.device)
    C:\Users\fbrev\Documents\Acadêmico\Simulações\Python\NoisyGL\predictor\Base_Predictor.py:144: UserWarning: Sparse CSR tensor support is in beta state. If you miss a functionality in the sparse tensor support, please submit a feature request to https://github.com/pytorch/pytorch/issues. (Triggered internally at ..\aten\src\ATen\SparseCsrTensorImpl.cpp:55.)
    self.adj_csr = self.adj.to_sparse_csr().to(self.device)
[I 2026-05-01 23:21:22,420] Trial 41 finished with value: 0.889 and parameters: {'lr': 0.005, 'weight_decay': 0.001, 'n_hidden': 256, 'n_layer': 3, 'dropout': 0.5343596476591304, 'knn_mode': 's', 'k': 29, 'dexp': 7.664127964171268, 'p_grd': 0.7691354713801614, 'unc_rem': 0.6700625289988753, 'unc_rel': 0.7528802812799816}. Best is trial 20 with value: 0.911.
    [CPU] Loading amazonpho...
    DEBUG 3.1: Dataset init start
    DEBUG 3.2: prepare_data start amazonpho
    ----Data statistics------'
    Name: amazonpho
    #Nodes 7650
    #Edges 119081
    #Classes 8
    #Ave_degree 31.13
    ----Split statistics------'
    #Train samples 160 (20 nodes per class)
    #Val samples 500 (specified)
    #Test samples 1000 (specified)
    ----label noise information:------
    Instance dependent noise
    #Actual noise rate 0.21
    [cuda:0] LNPCC waiting for GPU slot...
    [cuda:0] Slot acquired (waited 290.7s). Starting GCN...
    FINAL_RESULT: {'acc': {'train': 0.76875, 'valid': 0.726, 'test': 0.894}, 'wall_s': 23.32, 'cpu_s': 15.11, 'gpu_s': 8.16, 'wait_s': 290.73}
    [Time] wall=23.3s | cpu=15.1s | gpu=8.2s
    C:\Users\fbrev\Documents\Acadêmico\Simulações\Python\NoisyGL\predictor\Base_Predictor.py:114: UserWarning: expandable_segments not supported on this platform (Triggered internally at ..\c10/cuda/CUDAAllocatorConfig.h:28.)
    self.edge_index = self._cpu_edge_index.to(self.device)
    C:\Users\fbrev\Documents\Acadêmico\Simulações\Python\NoisyGL\predictor\Base_Predictor.py:144: UserWarning: Sparse CSR tensor support is in beta state. If you miss a functionality in the sparse tensor support, please submit a feature request to https://github.com/pytorch/pytorch/issues. (Triggered internally at ..\aten\src\ATen\SparseCsrTensorImpl.cpp:55.)
    self.adj_csr = self.adj.to_sparse_csr().to(self.device)
[I 2026-05-01 23:26:42,326] Trial 42 finished with value: 0.894 and parameters: {'lr': 0.005, 'weight_decay': 0.001, 'n_hidden': 256, 'n_layer': 3, 'dropout': 0.48651846036790675, 'knn_mode': 'd', 'k': 25, 'dexp': 8.924681536275946, 'p_grd': 0.7100004473461993, 'unc_rem': 0.7633312076415991, 'unc_rel': 0.6362893849790311}. Best is trial 20 with value: 0.911.
    [CPU] Loading amazonpho...
    DEBUG 3.1: Dataset init start
    DEBUG 3.2: prepare_data start amazonpho
    ----Data statistics------'
    Name: amazonpho
    #Nodes 7650
    #Edges 119081
    #Classes 8
    #Ave_degree 31.13
    ----Split statistics------'
    #Train samples 160 (20 nodes per class)
    #Val samples 500 (specified)
    #Test samples 1000 (specified)
    ----label noise information:------
    Instance dependent noise
    #Actual noise rate 0.21
    [cuda:0] LNPCC waiting for GPU slot...
    [cuda:0] Slot acquired (waited 131.7s). Starting GCN...
    FINAL_RESULT: {'acc': {'train': 0.7388535031847133, 'valid': 0.73, 'test': 0.889}, 'wall_s': 28.37, 'cpu_s': 19.96, 'gpu_s': 8.36, 'wait_s': 131.66}
    [Time] wall=28.4s | cpu=20.0s | gpu=8.4s
    C:\Users\fbrev\Documents\Acadêmico\Simulações\Python\NoisyGL\predictor\Base_Predictor.py:114: UserWarning: expandable_segments not supported on this platform (Triggered internally at ..\c10/cuda/CUDAAllocatorConfig.h:28.)
    self.edge_index = self._cpu_edge_index.to(self.device)
    C:\Users\fbrev\Documents\Acadêmico\Simulações\Python\NoisyGL\predictor\Base_Predictor.py:144: UserWarning: Sparse CSR tensor support is in beta state. If you miss a functionality in the sparse tensor support, please submit a feature request to https://github.com/pytorch/pytorch/issues. (Triggered internally at ..\aten\src\ATen\SparseCsrTensorImpl.cpp:55.)
    self.adj_csr = self.adj.to_sparse_csr().to(self.device)
[I 2026-05-01 23:29:28,868] Trial 43 finished with value: 0.889 and parameters: {'lr': 0.005, 'weight_decay': 0.001, 'n_hidden': 256, 'n_layer': 3, 'dropout': 0.6795372663104614, 'knn_mode': 's', 'k': 35, 'dexp': 6.845061848651924, 'p_grd': 0.6917821765064841, 'unc_rem': 0.7049287216071246, 'unc_rel': 0.41501199945759615}. Best is trial 20 with value: 0.911.
    [CPU] Loading amazonpho...
    DEBUG 3.1: Dataset init start
    DEBUG 3.2: prepare_data start amazonpho
    ----Data statistics------'
    Name: amazonpho
    #Nodes 7650
    #Edges 119081
    #Classes 8
    #Ave_degree 31.13
    ----Split statistics------'
    #Train samples 160 (20 nodes per class)
    #Val samples 500 (specified)
    #Test samples 1000 (specified)
    ----label noise information:------
    Instance dependent noise
    #Actual noise rate 0.21
    [cuda:0] LNPCC waiting for GPU slot...
    [cuda:0] Slot acquired (waited 125.2s). Starting GCN...
    FINAL_RESULT: {'acc': {'train': 0.78125, 'valid': 0.728, 'test': 0.888}, 'wall_s': 23.07, 'cpu_s': 17.85, 'gpu_s': 5.17, 'wait_s': 125.21}
    [Time] wall=23.1s | cpu=17.9s | gpu=5.2s
    C:\Users\fbrev\Documents\Acadêmico\Simulações\Python\NoisyGL\predictor\Base_Predictor.py:114: UserWarning: expandable_segments not supported on this platform (Triggered internally at ..\c10/cuda/CUDAAllocatorConfig.h:28.)
    self.edge_index = self._cpu_edge_index.to(self.device)
    C:\Users\fbrev\Documents\Acadêmico\Simulações\Python\NoisyGL\predictor\Base_Predictor.py:144: UserWarning: Sparse CSR tensor support is in beta state. If you miss a functionality in the sparse tensor support, please submit a feature request to https://github.com/pytorch/pytorch/issues. (Triggered internally at ..\aten\src\ATen\SparseCsrTensorImpl.cpp:55.)
    self.adj_csr = self.adj.to_sparse_csr().to(self.device)
[I 2026-05-01 23:32:03,526] Trial 44 finished with value: 0.888 and parameters: {'lr': 0.005, 'weight_decay': 0.001, 'n_hidden': 128, 'n_layer': 3, 'dropout': 0.6047113706912022, 'knn_mode': 'd', 'k': 13, 'dexp': 8.023660129512706, 'p_grd': 0.9395639868675127, 'unc_rem': 0.5436057915808176, 'unc_rel': 0.7463294788961949}. Best is trial 20 with value: 0.911.
    [CPU] Loading amazonpho...
    DEBUG 3.1: Dataset init start
    DEBUG 3.2: prepare_data start amazonpho
    ----Data statistics------'
    Name: amazonpho
    #Nodes 7650
    #Edges 119081
    #Classes 8
    #Ave_degree 31.13
    ----Split statistics------'
    #Train samples 160 (20 nodes per class)
    #Val samples 500 (specified)
    #Test samples 1000 (specified)
    ----label noise information:------
    Instance dependent noise
    #Actual noise rate 0.21
    [cuda:0] LNPCC waiting for GPU slot...
    [cuda:0] Slot acquired (waited 142.6s). Starting GCN...
    FINAL_RESULT: {'acc': {'train': 0.25, 'valid': 0.394, 'test': 0.453}, 'wall_s': 28.31, 'cpu_s': 23.22, 'gpu_s': 5.04, 'wait_s': 142.58}
    [Time] wall=28.3s | cpu=23.2s | gpu=5.0s
    C:\Users\fbrev\Documents\Acadêmico\Simulações\Python\NoisyGL\predictor\Base_Predictor.py:114: UserWarning: expandable_segments not supported on this platform (Triggered internally at ..\c10/cuda/CUDAAllocatorConfig.h:28.)
    self.edge_index = self._cpu_edge_index.to(self.device)
    C:\Users\fbrev\Documents\Acadêmico\Simulações\Python\NoisyGL\predictor\Base_Predictor.py:144: UserWarning: Sparse CSR tensor support is in beta state. If you miss a functionality in the sparse tensor support, please submit a feature request to https://github.com/pytorch/pytorch/issues. (Triggered internally at ..\aten\src\ATen\SparseCsrTensorImpl.cpp:55.)
    self.adj_csr = self.adj.to_sparse_csr().to(self.device)
[I 2026-05-01 23:35:00,686] Trial 45 finished with value: 0.453 and parameters: {'lr': 0.1, 'weight_decay': 0.001, 'n_hidden': 256, 'n_layer': 2, 'dropout': 0.5213684113268084, 'knn_mode': 'd', 'k': 31, 'dexp': 6.011606765706748, 'p_grd': 0.8399207833986326, 'unc_rem': 0.7872243732265879, 'unc_rel': 0.6974520338880743}. Best is trial 20 with value: 0.911.
    [CPU] Loading amazonpho...
    DEBUG 3.1: Dataset init start
    DEBUG 3.2: prepare_data start amazonpho
    ----Data statistics------'
    Name: amazonpho
    #Nodes 7650
    #Edges 119081
    #Classes 8
    #Ave_degree 31.13
    ----Split statistics------'
    #Train samples 160 (20 nodes per class)
    #Val samples 500 (specified)
    #Test samples 1000 (specified)
    ----label noise information:------
    Instance dependent noise
    #Actual noise rate 0.21
    [cuda:0] LNPCC waiting for GPU slot...
    [cuda:0] Slot acquired (waited 478.8s). Starting GCN...
    FINAL_RESULT: {'acc': {'train': 0.9407894736842105, 'valid': 0.708, 'test': 0.863}, 'wall_s': 16.78, 'cpu_s': 13.8, 'gpu_s': 2.93, 'wait_s': 478.76}
    [Time] wall=16.8s | cpu=13.8s | gpu=2.9s
    C:\Users\fbrev\Documents\Acadêmico\Simulações\Python\NoisyGL\predictor\Base_Predictor.py:114: UserWarning: expandable_segments not supported on this platform (Triggered internally at ..\c10/cuda/CUDAAllocatorConfig.h:28.)
    self.edge_index = self._cpu_edge_index.to(self.device)
    C:\Users\fbrev\Documents\Acadêmico\Simulações\Python\NoisyGL\predictor\Base_Predictor.py:144: UserWarning: Sparse CSR tensor support is in beta state. If you miss a functionality in the sparse tensor support, please submit a feature request to https://github.com/pytorch/pytorch/issues. (Triggered internally at ..\aten\src\ATen\SparseCsrTensorImpl.cpp:55.)
    self.adj_csr = self.adj.to_sparse_csr().to(self.device)
[I 2026-05-01 23:43:23,657] Trial 46 finished with value: 0.863 and parameters: {'lr': 0.005, 'weight_decay': 0.0, 'n_hidden': 64, 'n_layer': 2, 'dropout': 0.25513615153024904, 'knn_mode': 's', 'k': 20, 'dexp': 8.558258262247602, 'p_grd': 0.054201390772192215, 'unc_rem': 0.4691977192443529, 'unc_rel': 0.5214296384149565}. Best is trial 20 with value: 0.911.
    [CPU] Loading amazonpho...
    DEBUG 3.1: Dataset init start
    DEBUG 3.2: prepare_data start amazonpho
    ----Data statistics------'
    Name: amazonpho
    #Nodes 7650
    #Edges 119081
    #Classes 8
    #Ave_degree 31.13
    ----Split statistics------'
    #Train samples 160 (20 nodes per class)
    #Val samples 500 (specified)
    #Test samples 1000 (specified)
    ----label noise information:------
    Instance dependent noise
    #Actual noise rate 0.21
    [cuda:0] LNPCC waiting for GPU slot...
    [cuda:0] Slot acquired (waited 448.0s). Starting GCN...
    FINAL_RESULT: {'acc': {'train': 0.7625, 'valid': 0.732, 'test': 0.896}, 'wall_s': 34.05, 'cpu_s': 25.96, 'gpu_s': 8.03, 'wait_s': 447.96}
    [Time] wall=34.0s | cpu=26.0s | gpu=8.0s
    C:\Users\fbrev\Documents\Acadêmico\Simulações\Python\NoisyGL\predictor\Base_Predictor.py:114: UserWarning: expandable_segments not supported on this platform (Triggered internally at ..\c10/cuda/CUDAAllocatorConfig.h:28.)
    self.edge_index = self._cpu_edge_index.to(self.device)
    C:\Users\fbrev\Documents\Acadêmico\Simulações\Python\NoisyGL\predictor\Base_Predictor.py:144: UserWarning: Sparse CSR tensor support is in beta state. If you miss a functionality in the sparse tensor support, please submit a feature request to https://github.com/pytorch/pytorch/issues. (Triggered internally at ..\aten\src\ATen\SparseCsrTensorImpl.cpp:55.)
    self.adj_csr = self.adj.to_sparse_csr().to(self.device)
