[I 2026-04-27 18:34:10,163] Trial 149 finished with value: 0.39719316152079615 and parameters: {'lr': 0.1, 'weight_decay': 0.001, 'n_hidden': 64, 'n_layer': 3, 'dropout': 0.7264866262600113, 'knn_mode': 's', 'k': 42, 'dexp': 3.619920073658279, 'p_grd': 0.44161728158033053, 'unc_rem': 0.5415452488662263, 'unc_rel': 0.8518303457380481}. Best is trial 29 with value: 0.40505230926256697.
    [CPU] Loading amazon-ratings...
    DEBUG 3.1: Dataset init start
    DEBUG 3.2: prepare_data start amazon-ratings
    ----Data statistics------'
    Name: amazon-ratings
    #Nodes 24492
    #Edges 93050
    #Classes 5
    #Ave_degree 7.60
    ----Split statistics------'
    #Train samples 1224 (5.0 % of nodes)
    #Val samples 3673 (15.0 % of nodes)
    #Test samples 19595 (remaining)
    ----label noise information:------
    Instance dependent noise
    #Actual noise rate 0.13
    [cuda:0] LNPCC waiting for GPU slot...
    [cuda:0] Slot acquired (waited 195.0s). Starting GCN...
    FINAL_RESULT: {'acc': {'train': 0.45870809484873265, 'valid': 0.36536890824938745, 'test': 0.39408012248022456}, 'wall_s': 53.0, 'cpu_s': 49.11, 'gpu_s': 3.83, 'wait_s': 194.96}
    [Time] wall=53.0s | cpu=49.1s | gpu=3.8s
    C:\Users\fbrev\Documents\Acadêmico\Simulações\Python\NoisyGL\predictor\Base_Predictor.py:144: UserWarning: Sparse CSR tensor support is in beta state. If you miss a functionality in the sparse tensor support, please submit a feature request to https://github.com/pytorch/pytorch/issues. (Triggered internally at ..\aten\src\ATen\SparseCsrTensorImpl.cpp:55.)
    self.adj_csr = self.adj.to_sparse_csr().to(self.device)
[I 2026-04-27 18:38:25,243] Trial 150 finished with value: 0.39408012248022456 and parameters: {'lr': 0.01, 'weight_decay': 0.001, 'n_hidden': 64, 'n_layer': 3, 'dropout': 0.69838561308501, 'knn_mode': 's', 'k': 44, 'dexp': 5.4470012402409935, 'p_grd': 0.4694676773106451, 'unc_rem': 0.7596092890735127, 'unc_rel': 0.8322700323990195}. Best is trial 29 with value: 0.40505230926256697.
    [CPU] Loading amazon-ratings...
    DEBUG 3.1: Dataset init start
    DEBUG 3.2: prepare_data start amazon-ratings
    ----Data statistics------'
    Name: amazon-ratings
    #Nodes 24492
    #Edges 93050
    #Classes 5
    #Ave_degree 7.60
    ----Split statistics------'
    #Train samples 1224 (5.0 % of nodes)
    #Val samples 3673 (15.0 % of nodes)
    #Test samples 19595 (remaining)
    ----label noise information:------
    Instance dependent noise
    #Actual noise rate 0.13
    [cuda:0] LNPCC waiting for GPU slot...
    [cuda:0] Slot acquired (waited 176.6s). Starting GCN...
    FINAL_RESULT: {'acc': {'train': 0.22140522875816993, 'valid': 0.32752518377348216, 'test': 0.36851237560602196}, 'wall_s': 72.01, 'cpu_s': 62.73, 'gpu_s': 9.24, 'wait_s': 176.62}
    [Time] wall=72.0s | cpu=62.7s | gpu=9.2s
    C:\Users\fbrev\Documents\Acadêmico\Simulações\Python\NoisyGL\predictor\Base_Predictor.py:144: UserWarning: Sparse CSR tensor support is in beta state. If you miss a functionality in the sparse tensor support, please submit a feature request to https://github.com/pytorch/pytorch/issues. (Triggered internally at ..\aten\src\ATen\SparseCsrTensorImpl.cpp:55.)
    self.adj_csr = self.adj.to_sparse_csr().to(self.device)
[I 2026-04-27 18:42:40,669] Trial 151 finished with value: 0.36851237560602196 and parameters: {'lr': 0.1, 'weight_decay': 0.05, 'n_hidden': 256, 'n_layer': 3, 'dropout': 0.7719747732547153, 'knn_mode': 's', 'k': 38, 'dexp': 3.734084712036477, 'p_grd': 0.6006830728340252, 'unc_rem': 0.8462391205349934, 'unc_rel': 0.7371613367151174}. Best is trial 29 with value: 0.40505230926256697.
    [CPU] Loading amazon-ratings...
    DEBUG 3.1: Dataset init start
    DEBUG 3.2: prepare_data start amazon-ratings
    ----Data statistics------'
    Name: amazon-ratings
    #Nodes 24492
    #Edges 93050
    #Classes 5
    #Ave_degree 7.60
    ----Split statistics------'
    #Train samples 1224 (5.0 % of nodes)
    #Val samples 3673 (15.0 % of nodes)
    #Test samples 19595 (remaining)
    ----label noise information:------
    Instance dependent noise
    #Actual noise rate 0.13
    [cuda:0] LNPCC waiting for GPU slot...
    [cuda:0] Slot acquired (waited 92.7s). Starting GCN...
    FINAL_RESULT: {'acc': {'train': 0.37254901960784315, 'valid': 0.35883473999455484, 'test': 0.3894360806328145}, 'wall_s': 152.22, 'cpu_s': 148.3, 'gpu_s': 3.88, 'wait_s': 92.66}
    [Time] wall=152.2s | cpu=148.3s | gpu=3.9s
    C:\Users\fbrev\Documents\Acadêmico\Simulações\Python\NoisyGL\predictor\Base_Predictor.py:144: UserWarning: Sparse CSR tensor support is in beta state. If you miss a functionality in the sparse tensor support, please submit a feature request to https://github.com/pytorch/pytorch/issues. (Triggered internally at ..\aten\src\ATen\SparseCsrTensorImpl.cpp:55.)
    self.adj_csr = self.adj.to_sparse_csr().to(self.device)
[I 2026-04-27 18:46:51,768] Trial 152 finished with value: 0.3894360806328145 and parameters: {'lr': 0.1, 'weight_decay': 0.001, 'n_hidden': 64, 'n_layer': 3, 'dropout': 0.7455464858663002, 'knn_mode': 's', 'k': 40, 'dexp': 2.9121087178252756, 'p_grd': 0.9594730984207525, 'unc_rem': 0.4580763576314432, 'unc_rel': 0.7067002415223522}. Best is trial 29 with value: 0.40505230926256697.
    [CPU] Loading amazon-ratings...
    DEBUG 3.1: Dataset init start
    DEBUG 3.2: prepare_data start amazon-ratings
    ----Data statistics------'
    Name: amazon-ratings
    #Nodes 24492
    #Edges 93050
    #Classes 5
    #Ave_degree 7.60
    ----Split statistics------'
    #Train samples 1224 (5.0 % of nodes)
    #Val samples 3673 (15.0 % of nodes)
    #Test samples 19595 (remaining)
    ----label noise information:------
    Instance dependent noise
    #Actual noise rate 0.13
    [cuda:0] LNPCC waiting for GPU slot...
    [cuda:0] Slot acquired (waited 2123.9s). Starting GCN...
    FINAL_RESULT: {'acc': {'train': 0.39084219133278825, 'valid': 0.3751701606316363, 'test': 0.4026027047716254}, 'wall_s': 51.09, 'cpu_s': 47.07, 'gpu_s': 3.97, 'wait_s': 2123.91}
    [Time] wall=51.1s | cpu=47.1s | gpu=4.0s
    C:\Users\fbrev\Documents\Acadêmico\Simulações\Python\NoisyGL\predictor\Base_Predictor.py:144: UserWarning: Sparse CSR tensor support is in beta state. If you miss a functionality in the sparse tensor support, please submit a feature request to https://github.com/pytorch/pytorch/issues. (Triggered internally at ..\aten\src\ATen\SparseCsrTensorImpl.cpp:55.)
    self.adj_csr = self.adj.to_sparse_csr().to(self.device)
[I 2026-04-27 19:23:13,147] Trial 153 finished with value: 0.4026027047716254 and parameters: {'lr': 0.1, 'weight_decay': 0.001, 'n_hidden': 64, 'n_layer': 3, 'dropout': 0.7617573589771802, 'knn_mode': 's', 'k': 43, 'dexp': 3.9533163722881297, 'p_grd': 0.5037544803976594, 'unc_rem': 0.2230924482525376, 'unc_rel': 0.7653947174135075}. Best is trial 29 with value: 0.40505230926256697.
    [CPU] Loading amazon-ratings...
    DEBUG 3.1: Dataset init start
    DEBUG 3.2: prepare_data start amazon-ratings
    ----Data statistics------'
    Name: amazon-ratings
    #Nodes 24492
    #Edges 93050
    #Classes 5
    #Ave_degree 7.60
    ----Split statistics------'
    #Train samples 1224 (5.0 % of nodes)
    #Val samples 3673 (15.0 % of nodes)
    #Test samples 19595 (remaining)
    ----label noise information:------
    Instance dependent noise
    #Actual noise rate 0.13
    [cuda:0] LNPCC waiting for GPU slot...
    [cuda:0] Slot acquired (waited 191.5s). Starting GCN...
    FINAL_RESULT: {'acc': {'train': 0.38984438984438985, 'valid': 0.3591069970051729, 'test': 0.39397805562643534}, 'wall_s': 52.55, 'cpu_s': 49.2, 'gpu_s': 3.29, 'wait_s': 191.54}
    [Time] wall=52.5s | cpu=49.2s | gpu=3.3s
    C:\Users\fbrev\Documents\Acadêmico\Simulações\Python\NoisyGL\predictor\Base_Predictor.py:144: UserWarning: Sparse CSR tensor support is in beta state. If you miss a functionality in the sparse tensor support, please submit a feature request to https://github.com/pytorch/pytorch/issues. (Triggered internally at ..\aten\src\ATen\SparseCsrTensorImpl.cpp:55.)
    self.adj_csr = self.adj.to_sparse_csr().to(self.device)
[I 2026-04-27 19:27:23,893] Trial 154 finished with value: 0.39397805562643534 and parameters: {'lr': 0.1, 'weight_decay': 0.001, 'n_hidden': 64, 'n_layer': 3, 'dropout': 0.7967385701285626, 'knn_mode': 's', 'k': 43, 'dexp': 4.309651284095634, 'p_grd': 0.48920627591478955, 'unc_rem': 0.24299090104438786, 'unc_rel': 0.7596845455637515}. Best is trial 29 with value: 0.40505230926256697.
    [CPU] Loading amazon-ratings...
    DEBUG 3.1: Dataset init start
    DEBUG 3.2: prepare_data start amazon-ratings
    ----Data statistics------'
    Name: amazon-ratings
    #Nodes 24492
    #Edges 93050
    #Classes 5
    #Ave_degree 7.60
    ----Split statistics------'
    #Train samples 1224 (5.0 % of nodes)
    #Val samples 3673 (15.0 % of nodes)
    #Test samples 19595 (remaining)
    ----label noise information:------
    Instance dependent noise
    #Actual noise rate 0.13
    [cuda:0] LNPCC waiting for GPU slot...
    [cuda:0] Slot acquired (waited 178.4s). Starting GCN...
    FINAL_RESULT: {'acc': {'train': 0.37367130008176613, 'valid': 0.3689082493874217, 'test': 0.39663179382495534}, 'wall_s': 62.19, 'cpu_s': 58.25, 'gpu_s': 3.88, 'wait_s': 178.43}
    [Time] wall=62.2s | cpu=58.3s | gpu=3.9s
    C:\Users\fbrev\Documents\Acadêmico\Simulações\Python\NoisyGL\predictor\Base_Predictor.py:144: UserWarning: Sparse CSR tensor support is in beta state. If you miss a functionality in the sparse tensor support, please submit a feature request to https://github.com/pytorch/pytorch/issues. (Triggered internally at ..\aten\src\ATen\SparseCsrTensorImpl.cpp:55.)
    self.adj_csr = self.adj.to_sparse_csr().to(self.device)
[I 2026-04-27 19:31:31,178] Trial 155 finished with value: 0.39663179382495534 and parameters: {'lr': 0.1, 'weight_decay': 0.001, 'n_hidden': 64, 'n_layer': 3, 'dropout': 0.7545853693877036, 'knn_mode': 's', 'k': 42, 'dexp': 7.635972274985145, 'p_grd': 0.5508976127110303, 'unc_rem': 0.2080356368952528, 'unc_rel': 0.8124294260988099}. Best is trial 29 with value: 0.40505230926256697.
    [CPU] Loading amazon-ratings...
    DEBUG 3.1: Dataset init start
    DEBUG 3.2: prepare_data start amazon-ratings
    ----Data statistics------'
    Name: amazon-ratings
    #Nodes 24492
    #Edges 93050
    #Classes 5
    #Ave_degree 7.60
    ----Split statistics------'
    #Train samples 1224 (5.0 % of nodes)
    #Val samples 3673 (15.0 % of nodes)
    #Test samples 19595 (remaining)
    ----label noise information:------
    Instance dependent noise
    #Actual noise rate 0.13
    [cuda:0] LNPCC waiting for GPU slot...
    [cuda:0] Slot acquired (waited 379.0s). Starting GCN...
    FINAL_RESULT: {'acc': {'train': 0.4236453201970443, 'valid': 0.3640076231962973, 'test': 0.3961724929829038}, 'wall_s': 56.29, 'cpu_s': 52.31, 'gpu_s': 3.93, 'wait_s': 379.03}
    [Time] wall=56.3s | cpu=52.3s | gpu=3.9s
    C:\Users\fbrev\Documents\Acadêmico\Simulações\Python\NoisyGL\predictor\Base_Predictor.py:144: UserWarning: Sparse CSR tensor support is in beta state. If you miss a functionality in the sparse tensor support, please submit a feature request to https://github.com/pytorch/pytorch/issues. (Triggered internally at ..\aten\src\ATen\SparseCsrTensorImpl.cpp:55.)
    self.adj_csr = self.adj.to_sparse_csr().to(self.device)
[I 2026-04-27 19:38:53,162] Trial 156 finished with value: 0.3961724929829038 and parameters: {'lr': 0.1, 'weight_decay': 0.001, 'n_hidden': 64, 'n_layer': 3, 'dropout': 0.714768951282316, 'knn_mode': 's', 'k': 43, 'dexp': 3.818883373189572, 'p_grd': 0.51683440167404, 'unc_rem': 0.1724081269252412, 'unc_rel': 0.7328831305896539}. Best is trial 29 with value: 0.40505230926256697.
    [CPU] Loading amazon-ratings...
    DEBUG 3.1: Dataset init start
    DEBUG 3.2: prepare_data start amazon-ratings
    ----Data statistics------'
    Name: amazon-ratings
    #Nodes 24492
    #Edges 93050
    #Classes 5
    #Ave_degree 7.60
    ----Split statistics------'
    #Train samples 1224 (5.0 % of nodes)
    #Val samples 3673 (15.0 % of nodes)
    #Test samples 19595 (remaining)
    ----label noise information:------
    Instance dependent noise
    #Actual noise rate 0.13
    [cuda:0] LNPCC waiting for GPU slot...
    [cuda:0] Slot acquired (waited 1114.2s). Starting GCN...
    FINAL_RESULT: {'acc': {'train': 0.40098199672667756, 'valid': 0.3650966512387694, 'test': 0.3964786935442715}, 'wall_s': 52.67, 'cpu_s': 48.31, 'gpu_s': 4.31, 'wait_s': 1114.23}
    [Time] wall=52.7s | cpu=48.3s | gpu=4.3s
    C:\Users\fbrev\Documents\Acadêmico\Simulações\Python\NoisyGL\predictor\Base_Predictor.py:144: UserWarning: Sparse CSR tensor support is in beta state. If you miss a functionality in the sparse tensor support, please submit a feature request to https://github.com/pytorch/pytorch/issues. (Triggered internally at ..\aten\src\ATen\SparseCsrTensorImpl.cpp:55.)
    self.adj_csr = self.adj.to_sparse_csr().to(self.device)
[I 2026-04-27 19:58:26,871] Trial 157 finished with value: 0.3964786935442715 and parameters: {'lr': 0.05, 'weight_decay': 0.001, 'n_hidden': 64, 'n_layer': 3, 'dropout': 0.7774387722295826, 'knn_mode': 's', 'k': 45, 'dexp': 8.377615002280503, 'p_grd': 0.48389916310163844, 'unc_rem': 0.2910174728943591, 'unc_rel': 0.7897311461608848}. Best is trial 29 with value: 0.40505230926256697.
    [CPU] Loading amazon-ratings...
    DEBUG 3.1: Dataset init start
    DEBUG 3.2: prepare_data start amazon-ratings
    ----Data statistics------'
    Name: amazon-ratings
    #Nodes 24492
    #Edges 93050
    #Classes 5
    #Ave_degree 7.60
    ----Split statistics------'
    #Train samples 1224 (5.0 % of nodes)
    #Val samples 3673 (15.0 % of nodes)
    #Test samples 19595 (remaining)
    ----label noise information:------
    Instance dependent noise
    #Actual noise rate 0.13
    [cuda:0] LNPCC waiting for GPU slot...
    [cuda:0] Slot acquired (waited 1351.2s). Starting GCN...
    FINAL_RESULT: {'acc': {'train': 0.401471790678659, 'valid': 0.37135856248298393, 'test': 0.39724419494769075}, 'wall_s': 68.51, 'cpu_s': 64.35, 'gpu_s': 4.12, 'wait_s': 1351.2}
    [Time] wall=68.5s | cpu=64.3s | gpu=4.1s
    C:\Users\fbrev\Documents\Acadêmico\Simulações\Python\NoisyGL\predictor\Base_Predictor.py:144: UserWarning: Sparse CSR tensor support is in beta state. If you miss a functionality in the sparse tensor support, please submit a feature request to https://github.com/pytorch/pytorch/issues. (Triggered internally at ..\aten\src\ATen\SparseCsrTensorImpl.cpp:55.)
    self.adj_csr = self.adj.to_sparse_csr().to(self.device)
[I 2026-04-27 20:22:13,174] Trial 158 finished with value: 0.39724419494769075 and parameters: {'lr': 0.1, 'weight_decay': 0.001, 'n_hidden': 64, 'n_layer': 3, 'dropout': 0.7361144735335033, 'knn_mode': 's', 'k': 39, 'dexp': 4.193891179897211, 'p_grd': 0.6675648494748372, 'unc_rem': 0.14330001919659335, 'unc_rel': 0.7118028397968786}. Best is trial 29 with value: 0.40505230926256697.
    [CPU] Loading amazon-ratings...
    DEBUG 3.1: Dataset init start
    DEBUG 3.2: prepare_data start amazon-ratings
    ----Data statistics------'
    Name: amazon-ratings
    #Nodes 24492
    #Edges 93050
    #Classes 5
    #Ave_degree 7.60
    ----Split statistics------'
    #Train samples 1224 (5.0 % of nodes)
    #Val samples 3673 (15.0 % of nodes)
    #Test samples 19595 (remaining)
    ----label noise information:------
    Instance dependent noise
    #Actual noise rate 0.13
    [cuda:0] LNPCC waiting for GPU slot...
    [cuda:0] Slot acquired (waited 610.3s). Starting GCN...
    FINAL_RESULT: {'acc': {'train': 0.37180616740088107, 'valid': 0.37299210454669207, 'test': 0.40209237050267926}, 'wall_s': 55.58, 'cpu_s': 51.02, 'gpu_s': 4.51, 'wait_s': 610.34}
    [Time] wall=55.6s | cpu=51.0s | gpu=4.5s
    C:\Users\fbrev\Documents\Acadêmico\Simulações\Python\NoisyGL\predictor\Base_Predictor.py:144: UserWarning: Sparse CSR tensor support is in beta state. If you miss a functionality in the sparse tensor support, please submit a feature request to https://github.com/pytorch/pytorch/issues. (Triggered internally at ..\aten\src\ATen\SparseCsrTensorImpl.cpp:55.)
    self.adj_csr = self.adj.to_sparse_csr().to(self.device)
[I 2026-04-27 20:33:25,951] Trial 159 finished with value: 0.40209237050267926 and parameters: {'lr': 0.1, 'weight_decay': 0.001, 'n_hidden': 64, 'n_layer': 3, 'dropout': 0.7646828576473683, 'knn_mode': 's', 'k': 41, 'dexp': 8.674457389299391, 'p_grd': 0.46009750683927697, 'unc_rem': 0.020038876511805165, 'unc_rel': 0.7756213628660752}. Best is trial 29 with value: 0.40505230926256697.
    [CPU] Loading amazon-ratings...
    DEBUG 3.1: Dataset init start
    DEBUG 3.2: prepare_data start amazon-ratings
    ----Data statistics------'
    Name: amazon-ratings
    #Nodes 24492
    #Edges 93050
    #Classes 5
    #Ave_degree 7.60
    ----Split statistics------'
    #Train samples 1224 (5.0 % of nodes)
    #Val samples 3673 (15.0 % of nodes)
    #Test samples 19595 (remaining)
    ----label noise information:------
    Instance dependent noise
    #Actual noise rate 0.13
    [cuda:0] LNPCC waiting for GPU slot...
    [cuda:0] Slot acquired (waited 184.7s). Starting GCN...
    FINAL_RESULT: {'acc': {'train': 0.39634146341463417, 'valid': 0.35502314184590256, 'test': 0.3914774177085991}, 'wall_s': 80.0, 'cpu_s': 76.14, 'gpu_s': 3.82, 'wait_s': 184.65}
    [Time] wall=80.0s | cpu=76.1s | gpu=3.8s
    C:\Users\fbrev\Documents\Acadêmico\Simulações\Python\NoisyGL\predictor\Base_Predictor.py:144: UserWarning: Sparse CSR tensor support is in beta state. If you miss a functionality in the sparse tensor support, please submit a feature request to https://github.com/pytorch/pytorch/issues. (Triggered internally at ..\aten\src\ATen\SparseCsrTensorImpl.cpp:55.)
    self.adj_csr = self.adj.to_sparse_csr().to(self.device)
