[I 2026-05-03 02:42:56,544] Trial 43 finished with value: 0.37947533410328327 and parameters: {'lr': 0.01, 'weight_decay': 0.0001, 'n_hidden': 32, 'n_layer': 2, 'dropout': 0.22541461767605503, 'knn_mode': 's', 'k': 24, 'dexp': 2.5117157251070914, 'p_grd': 0.9858826079445534, 'unc_rem': 0.4294019644466853, 'unc_rel': 0.32499919155276497}. Best is trial 31 with value: 0.3982841115327504.
    [CPU] Loading flickr...
    DEBUG 3.1: Dataset init start
    DEBUG 3.2: prepare_data start flickr
    ----Data statistics------'
    Name: flickr
    #Nodes 7575
    #Edges 239738
    #Classes 9
    #Ave_degree 63.30
    ----Split statistics------'
    #Train samples 378 (5.0 % of nodes)
    #Val samples 1136 (15.0 % of nodes)
    #Test samples 6061 (remaining)
    ----label noise information:------
    Instance dependent noise
    #Actual noise rate 0.50
    [cuda:1] LNPCC waiting for GPU slot...
    [cuda:1] Slot acquired (waited 1.6s). Starting GCN...
    FINAL_RESULT: {'acc': {'train': 0.15281501340482573, 'valid': 0.13380281690140844, 'test': 0.11664741791783534}, 'wall_s': 108.86, 'cpu_s': 104.75, 'gpu_s': 3.82, 'wait_s': 1.57}
    [Time] wall=108.9s | cpu=104.8s | gpu=3.8s
    C:\Users\fbrev\anaconda3\envs\noisygl\Lib\site-packages\torch\_utils.py:315: UserWarning: Sparse CSR tensor support is in beta state. If you miss a functionality in the sparse tensor support, please submit a feature request to https://github.com/pytorch/pytorch/issues. (Triggered internally at ..\aten\src\ATen\SparseCsrTensorImpl.cpp:55.)
    result = torch.sparse_compressed_tensor(
    C:\Users\fbrev\Documents\Acadêmico\Simulações\Python\NoisyGL\predictor\Base_Predictor.py:114: UserWarning: expandable_segments not supported on this platform (Triggered internally at ..\c10/cuda/CUDAAllocatorConfig.h:28.)
    self.edge_index = self._cpu_edge_index.to(self.device)
[I 2026-05-03 02:44:52,670] Trial 44 finished with value: 0.11664741791783534 and parameters: {'lr': 0.01, 'weight_decay': 0.05, 'n_hidden': 32, 'n_layer': 2, 'dropout': 0.07271829306705214, 'knn_mode': 's', 'k': 16, 'dexp': 4.185640709906764, 'p_grd': 0.9480160571900984, 'unc_rem': 0.346941884974586, 'unc_rel': 0.4961097234256636}. Best is trial 31 with value: 0.3982841115327504.
    [CPU] Loading flickr...
    DEBUG 3.1: Dataset init start
    DEBUG 3.2: prepare_data start flickr
    ----Data statistics------'
    Name: flickr
    #Nodes 7575
    #Edges 239738
    #Classes 9
    #Ave_degree 63.30
    ----Split statistics------'
    #Train samples 378 (5.0 % of nodes)
    #Val samples 1136 (15.0 % of nodes)
    #Test samples 6061 (remaining)
    ----label noise information:------
    Instance dependent noise
    #Actual noise rate 0.50
    [cuda:1] LNPCC waiting for GPU slot...
    [cuda:1] Slot acquired (waited 1.1s). Starting GCN...
    FINAL_RESULT: {'acc': {'train': 0.6533333333333333, 'valid': 0.23415492957746478, 'test': 0.37155584886982346}, 'wall_s': 68.97, 'cpu_s': 62.14, 'gpu_s': 6.56, 'wait_s': 1.12}
    [Time] wall=69.0s | cpu=62.1s | gpu=6.6s
    C:\Users\fbrev\anaconda3\envs\noisygl\Lib\site-packages\torch\_utils.py:315: UserWarning: Sparse CSR tensor support is in beta state. If you miss a functionality in the sparse tensor support, please submit a feature request to https://github.com/pytorch/pytorch/issues. (Triggered internally at ..\aten\src\ATen\SparseCsrTensorImpl.cpp:55.)
    result = torch.sparse_compressed_tensor(
    C:\Users\fbrev\Documents\Acadêmico\Simulações\Python\NoisyGL\predictor\Base_Predictor.py:114: UserWarning: expandable_segments not supported on this platform (Triggered internally at ..\c10/cuda/CUDAAllocatorConfig.h:28.)
    self.edge_index = self._cpu_edge_index.to(self.device)
[I 2026-05-03 02:46:08,286] Trial 45 finished with value: 0.37155584886982346 and parameters: {'lr': 0.01, 'weight_decay': 0.0001, 'n_hidden': 128, 'n_layer': 2, 'dropout': 0.13553917931288617, 'knn_mode': 's', 'k': 34, 'dexp': 3.2404687687168634, 'p_grd': 0.6898369229778584, 'unc_rem': 0.6033403421260101, 'unc_rel': 0.25083570000463673}. Best is trial 31 with value: 0.3982841115327504.
    [CPU] Loading flickr...
    DEBUG 3.1: Dataset init start
    DEBUG 3.2: prepare_data start flickr
    ----Data statistics------'
    Name: flickr
    #Nodes 7575
    #Edges 239738
    #Classes 9
    #Ave_degree 63.30
    ----Split statistics------'
    #Train samples 378 (5.0 % of nodes)
    #Val samples 1136 (15.0 % of nodes)
    #Test samples 6061 (remaining)
    ----label noise information:------
    Instance dependent noise
    #Actual noise rate 0.50
    [cuda:1] LNPCC waiting for GPU slot...
    [cuda:1] Slot acquired (waited 0.0s). Starting GCN...
    FINAL_RESULT: {'acc': {'train': 0.41853932584269665, 'valid': 0.2517605633802817, 'test': 0.3641313314634549}, 'wall_s': 73.45, 'cpu_s': 69.21, 'gpu_s': 3.96, 'wait_s': 0.0}
    [Time] wall=73.4s | cpu=69.2s | gpu=4.0s
    C:\Users\fbrev\anaconda3\envs\noisygl\Lib\site-packages\torch\_utils.py:315: UserWarning: Sparse CSR tensor support is in beta state. If you miss a functionality in the sparse tensor support, please submit a feature request to https://github.com/pytorch/pytorch/issues. (Triggered internally at ..\aten\src\ATen\SparseCsrTensorImpl.cpp:55.)
    result = torch.sparse_compressed_tensor(
    C:\Users\fbrev\Documents\Acadêmico\Simulações\Python\NoisyGL\predictor\Base_Predictor.py:114: UserWarning: expandable_segments not supported on this platform (Triggered internally at ..\c10/cuda/CUDAAllocatorConfig.h:28.)
    self.edge_index = self._cpu_edge_index.to(self.device)
[I 2026-05-03 02:47:27,689] Trial 46 finished with value: 0.3641313314634549 and parameters: {'lr': 0.05, 'weight_decay': 0.0001, 'n_hidden': 32, 'n_layer': 2, 'dropout': 0.3073985268743259, 'knn_mode': 's', 'k': 28, 'dexp': 0.6764750829599171, 'p_grd': 0.7654487349481269, 'unc_rem': 0.4559118446294691, 'unc_rel': 0.39696993346670445}. Best is trial 31 with value: 0.3982841115327504.
    [CPU] Loading flickr...
    DEBUG 3.1: Dataset init start
    DEBUG 3.2: prepare_data start flickr
    ----Data statistics------'
    Name: flickr
    #Nodes 7575
    #Edges 239738
    #Classes 9
    #Ave_degree 63.30
    ----Split statistics------'
    #Train samples 378 (5.0 % of nodes)
    #Val samples 1136 (15.0 % of nodes)
    #Test samples 6061 (remaining)
    ----label noise information:------
    Instance dependent noise
    #Actual noise rate 0.50
    [cuda:1] LNPCC waiting for GPU slot...
    [cuda:1] Slot acquired (waited 1.6s). Starting GCN...
    FINAL_RESULT: {'acc': {'train': 0.1356382978723404, 'valid': 0.13028169014084506, 'test': 0.10361326513776604}, 'wall_s': 137.95, 'cpu_s': 132.98, 'gpu_s': 4.65, 'wait_s': 1.57}
    [Time] wall=137.9s | cpu=133.0s | gpu=4.7s
    C:\Users\fbrev\anaconda3\envs\noisygl\Lib\site-packages\torch\_utils.py:315: UserWarning: Sparse CSR tensor support is in beta state. If you miss a functionality in the sparse tensor support, please submit a feature request to https://github.com/pytorch/pytorch/issues. (Triggered internally at ..\aten\src\ATen\SparseCsrTensorImpl.cpp:55.)
    result = torch.sparse_compressed_tensor(
    C:\Users\fbrev\Documents\Acadêmico\Simulações\Python\NoisyGL\predictor\Base_Predictor.py:114: UserWarning: expandable_segments not supported on this platform (Triggered internally at ..\c10/cuda/CUDAAllocatorConfig.h:28.)
    self.edge_index = self._cpu_edge_index.to(self.device)
[I 2026-05-03 02:49:53,223] Trial 47 finished with value: 0.10361326513776604 and parameters: {'lr': 0.01, 'weight_decay': 0.01, 'n_hidden': 64, 'n_layer': 2, 'dropout': 0.17022111936908393, 'knn_mode': 'd', 'k': 21, 'dexp': 1.5865409402358899, 'p_grd': 0.5978887358159563, 'unc_rem': 0.3538196886895979, 'unc_rel': 0.4645469262069211}. Best is trial 31 with value: 0.3982841115327504.
    [CPU] Loading flickr...
    DEBUG 3.1: Dataset init start
    DEBUG 3.2: prepare_data start flickr
    ----Data statistics------'
    Name: flickr
    #Nodes 7575
    #Edges 239738
    #Classes 9
    #Ave_degree 63.30
    ----Split statistics------'
    #Train samples 378 (5.0 % of nodes)
    #Val samples 1136 (15.0 % of nodes)
    #Test samples 6061 (remaining)
    ----label noise information:------
    Instance dependent noise
    #Actual noise rate 0.50
    [cuda:1] LNPCC waiting for GPU slot...
    [cuda:1] Slot acquired (waited 3.6s). Starting GCN...
    FINAL_RESULT: {'acc': {'train': 0.7642276422764228, 'valid': 0.20598591549295775, 'test': 0.28180168289061214}, 'wall_s': 96.01, 'cpu_s': 91.9, 'gpu_s': 3.85, 'wait_s': 3.65}
    [Time] wall=96.0s | cpu=91.9s | gpu=3.8s
    C:\Users\fbrev\anaconda3\envs\noisygl\Lib\site-packages\torch\_utils.py:315: UserWarning: Sparse CSR tensor support is in beta state. If you miss a functionality in the sparse tensor support, please submit a feature request to https://github.com/pytorch/pytorch/issues. (Triggered internally at ..\aten\src\ATen\SparseCsrTensorImpl.cpp:55.)
    result = torch.sparse_compressed_tensor(
    C:\Users\fbrev\Documents\Acadêmico\Simulações\Python\NoisyGL\predictor\Base_Predictor.py:114: UserWarning: expandable_segments not supported on this platform (Triggered internally at ..\c10/cuda/CUDAAllocatorConfig.h:28.)
    self.edge_index = self._cpu_edge_index.to(self.device)
[I 2026-05-03 02:51:38,863] Trial 48 finished with value: 0.28180168289061214 and parameters: {'lr': 0.1, 'weight_decay': 0.0, 'n_hidden': 32, 'n_layer': 2, 'dropout': 0.36079262214869995, 'knn_mode': 's', 'k': 39, 'dexp': 1.05454010638423, 'p_grd': 0.8739876518134989, 'unc_rem': 0.5132076526323299, 'unc_rel': 0.21231116464661087}. Best is trial 31 with value: 0.3982841115327504.
    [CPU] Loading flickr...
    DEBUG 3.1: Dataset init start
    DEBUG 3.2: prepare_data start flickr
    ----Data statistics------'
    Name: flickr
    #Nodes 7575
    #Edges 239738
    #Classes 9
    #Ave_degree 63.30
    ----Split statistics------'
    #Train samples 378 (5.0 % of nodes)
    #Val samples 1136 (15.0 % of nodes)
    #Test samples 6061 (remaining)
    ----label noise information:------
    Instance dependent noise
    #Actual noise rate 0.50
    [cuda:1] LNPCC waiting for GPU slot...
    [cuda:1] Slot acquired (waited 0.0s). Starting GCN...
    FINAL_RESULT: {'acc': {'train': 0.8041543026706232, 'valid': 0.22183098591549297, 'test': 0.3600065995710279}, 'wall_s': 68.78, 'cpu_s': 57.44, 'gpu_s': 11.07, 'wait_s': 0.0}
    [Time] wall=68.8s | cpu=57.4s | gpu=11.1s
    C:\Users\fbrev\anaconda3\envs\noisygl\Lib\site-packages\torch\_utils.py:315: UserWarning: Sparse CSR tensor support is in beta state. If you miss a functionality in the sparse tensor support, please submit a feature request to https://github.com/pytorch/pytorch/issues. (Triggered internally at ..\aten\src\ATen\SparseCsrTensorImpl.cpp:55.)
    result = torch.sparse_compressed_tensor(
    C:\Users\fbrev\Documents\Acadêmico\Simulações\Python\NoisyGL\predictor\Base_Predictor.py:114: UserWarning: expandable_segments not supported on this platform (Triggered internally at ..\c10/cuda/CUDAAllocatorConfig.h:28.)
    self.edge_index = self._cpu_edge_index.to(self.device)
