[I 2026-05-01 23:13:18,426] Trial 33 finished with value: 0.845 and parameters: {'lr': 0.005, 'weight_decay': 0.01, 'n_hidden': 64, 'n_layer': 2, 'dropout': 0.7963262455080565, 'knn_mode': 's', 'k': 8, 'dexp': 2.285913742356153, 'p_grd': 0.07504949348382944, 'unc_rem': 0.34935393513306934, 'unc_rel': 0.29695621925966176}. Best is trial 4 with value: 0.87.
    [CPU] Loading amazonpho...
    DEBUG 3.1: Dataset init start
    DEBUG 3.2: prepare_data start amazonpho
    ----Data statistics------'
    Name: amazonpho
    #Nodes 7650
    #Edges 119081
    #Classes 8
    #Ave_degree 31.13
    ----Split statistics------'
    #Train samples 160 (20 nodes per class)
    #Val samples 500 (specified)
    #Test samples 1000 (specified)
    ----label noise information:------
    Instance dependent noise
    #Actual noise rate 0.40
    [cuda:0] LNPCC waiting for GPU slot...
    [cuda:0] Slot acquired (waited 153.6s). Starting GCN...
    FINAL_RESULT: {'acc': {'train': 0.8345864661654135, 'valid': 0.498, 'test': 0.762}, 'wall_s': 14.48, 'cpu_s': 11.81, 'gpu_s': 2.62, 'wait_s': 153.57}
    [Time] wall=14.5s | cpu=11.8s | gpu=2.6s
    C:\Users\fbrev\Documents\Acadêmico\Simulações\Python\NoisyGL\predictor\Base_Predictor.py:114: UserWarning: expandable_segments not supported on this platform (Triggered internally at ..\c10/cuda/CUDAAllocatorConfig.h:28.)
    self.edge_index = self._cpu_edge_index.to(self.device)
    C:\Users\fbrev\Documents\Acadêmico\Simulações\Python\NoisyGL\predictor\Base_Predictor.py:144: UserWarning: Sparse CSR tensor support is in beta state. If you miss a functionality in the sparse tensor support, please submit a feature request to https://github.com/pytorch/pytorch/issues. (Triggered internally at ..\aten\src\ATen\SparseCsrTensorImpl.cpp:55.)
    self.adj_csr = self.adj.to_sparse_csr().to(self.device)
[I 2026-05-01 23:16:12,229] Trial 34 finished with value: 0.762 and parameters: {'lr': 0.005, 'weight_decay': 0.05, 'n_hidden': 64, 'n_layer': 2, 'dropout': 0.5774425492860276, 'knn_mode': 's', 'k': 5, 'dexp': 3.04641442121084, 'p_grd': 0.18053973125777723, 'unc_rem': 0.16155642608514956, 'unc_rel': 0.12566344259961493}. Best is trial 4 with value: 0.87.
    [CPU] Loading amazonpho...
    DEBUG 3.1: Dataset init start
    DEBUG 3.2: prepare_data start amazonpho
    ----Data statistics------'
    Name: amazonpho
    #Nodes 7650
    #Edges 119081
    #Classes 8
    #Ave_degree 31.13
    ----Split statistics------'
    #Train samples 160 (20 nodes per class)
    #Val samples 500 (specified)
    #Test samples 1000 (specified)
    ----label noise information:------
    Instance dependent noise
    #Actual noise rate 0.40
    [cuda:0] LNPCC waiting for GPU slot...
    [cuda:0] Slot acquired (waited 132.7s). Starting GCN...
    FINAL_RESULT: {'acc': {'train': 0.5796178343949044, 'valid': 0.504, 'test': 0.811}, 'wall_s': 17.01, 'cpu_s': 13.94, 'gpu_s': 3.02, 'wait_s': 132.67}
    [Time] wall=17.0s | cpu=13.9s | gpu=3.0s
    C:\Users\fbrev\Documents\Acadêmico\Simulações\Python\NoisyGL\predictor\Base_Predictor.py:114: UserWarning: expandable_segments not supported on this platform (Triggered internally at ..\c10/cuda/CUDAAllocatorConfig.h:28.)
    self.edge_index = self._cpu_edge_index.to(self.device)
    C:\Users\fbrev\Documents\Acadêmico\Simulações\Python\NoisyGL\predictor\Base_Predictor.py:144: UserWarning: Sparse CSR tensor support is in beta state. If you miss a functionality in the sparse tensor support, please submit a feature request to https://github.com/pytorch/pytorch/issues. (Triggered internally at ..\aten\src\ATen\SparseCsrTensorImpl.cpp:55.)
    self.adj_csr = self.adj.to_sparse_csr().to(self.device)
[I 2026-05-01 23:18:47,794] Trial 35 finished with value: 0.811 and parameters: {'lr': 0.005, 'weight_decay': 0.01, 'n_hidden': 32, 'n_layer': 3, 'dropout': 0.44958950177029094, 'knn_mode': 's', 'k': 29, 'dexp': 4.0104947504565445, 'p_grd': 0.3778118313800829, 'unc_rem': 0.49437798115135034, 'unc_rel': 0.16467990594572599}. Best is trial 4 with value: 0.87.
    [CPU] Loading amazonpho...
    DEBUG 3.1: Dataset init start
    DEBUG 3.2: prepare_data start amazonpho
    ----Data statistics------'
    Name: amazonpho
    #Nodes 7650
    #Edges 119081
    #Classes 8
    #Ave_degree 31.13
    ----Split statistics------'
    #Train samples 160 (20 nodes per class)
    #Val samples 500 (specified)
    #Test samples 1000 (specified)
    ----label noise information:------
    Instance dependent noise
    #Actual noise rate 0.40
    [cuda:0] LNPCC waiting for GPU slot...
    [cuda:0] Slot acquired (waited 294.4s). Starting GCN...
    FINAL_RESULT: {'acc': {'train': 0.8648648648648649, 'valid': 0.47, 'test': 0.712}, 'wall_s': 15.19, 'cpu_s': 11.35, 'gpu_s': 3.8, 'wait_s': 294.37}
    [Time] wall=15.2s | cpu=11.4s | gpu=3.8s
    C:\Users\fbrev\Documents\Acadêmico\Simulações\Python\NoisyGL\predictor\Base_Predictor.py:114: UserWarning: expandable_segments not supported on this platform (Triggered internally at ..\c10/cuda/CUDAAllocatorConfig.h:28.)
    self.edge_index = self._cpu_edge_index.to(self.device)
    C:\Users\fbrev\Documents\Acadêmico\Simulações\Python\NoisyGL\predictor\Base_Predictor.py:144: UserWarning: Sparse CSR tensor support is in beta state. If you miss a functionality in the sparse tensor support, please submit a feature request to https://github.com/pytorch/pytorch/issues. (Triggered internally at ..\aten\src\ATen\SparseCsrTensorImpl.cpp:55.)
    self.adj_csr = self.adj.to_sparse_csr().to(self.device)
[I 2026-05-01 23:24:03,287] Trial 36 finished with value: 0.712 and parameters: {'lr': 0.001, 'weight_decay': 0.0, 'n_hidden': 64, 'n_layer': 3, 'dropout': 0.6510654559427512, 'knn_mode': 's', 'k': 12, 'dexp': 1.7318326746371504, 'p_grd': 0.0013949531277307192, 'unc_rem': 0.07403603346085277, 'unc_rel': 0.06724146089624783}. Best is trial 4 with value: 0.87.
    [CPU] Loading amazonpho...
    DEBUG 3.1: Dataset init start
    DEBUG 3.2: prepare_data start amazonpho
    ----Data statistics------'
    Name: amazonpho
    #Nodes 7650
    #Edges 119081
    #Classes 8
    #Ave_degree 31.13
    ----Split statistics------'
    #Train samples 160 (20 nodes per class)
    #Val samples 500 (specified)
    #Test samples 1000 (specified)
    ----label noise information:------
    Instance dependent noise
    #Actual noise rate 0.40
    [cuda:0] LNPCC waiting for GPU slot...
    [cuda:0] Slot acquired (waited 124.5s). Starting GCN...
    FINAL_RESULT: {'acc': {'train': 0.9428571428571428, 'valid': 0.53, 'test': 0.852}, 'wall_s': 19.88, 'cpu_s': 16.43, 'gpu_s': 3.41, 'wait_s': 124.51}
    [Time] wall=19.9s | cpu=16.4s | gpu=3.4s
    C:\Users\fbrev\Documents\Acadêmico\Simulações\Python\NoisyGL\predictor\Base_Predictor.py:114: UserWarning: expandable_segments not supported on this platform (Triggered internally at ..\c10/cuda/CUDAAllocatorConfig.h:28.)
    self.edge_index = self._cpu_edge_index.to(self.device)
    C:\Users\fbrev\Documents\Acadêmico\Simulações\Python\NoisyGL\predictor\Base_Predictor.py:144: UserWarning: Sparse CSR tensor support is in beta state. If you miss a functionality in the sparse tensor support, please submit a feature request to https://github.com/pytorch/pytorch/issues. (Triggered internally at ..\aten\src\ATen\SparseCsrTensorImpl.cpp:55.)
    self.adj_csr = self.adj.to_sparse_csr().to(self.device)
[I 2026-05-01 23:26:34,112] Trial 37 finished with value: 0.852 and parameters: {'lr': 0.005, 'weight_decay': 0.001, 'n_hidden': 128, 'n_layer': 2, 'dropout': 0.7367622178277227, 'knn_mode': 'd', 'k': 8, 'dexp': 0.6433493121947018, 'p_grd': 0.4496292069632608, 'unc_rem': 0.13881526441444997, 'unc_rel': 0.2971232457726908}. Best is trial 4 with value: 0.87.
    [CPU] Loading amazonpho...
    DEBUG 3.1: Dataset init start
    DEBUG 3.2: prepare_data start amazonpho
    ----Data statistics------'
    Name: amazonpho
    #Nodes 7650
    #Edges 119081
    #Classes 8
    #Ave_degree 31.13
    ----Split statistics------'
    #Train samples 160 (20 nodes per class)
    #Val samples 500 (specified)
    #Test samples 1000 (specified)
    ----label noise information:------
    Instance dependent noise
    #Actual noise rate 0.40
    [cuda:0] LNPCC waiting for GPU slot...
    [cuda:0] Slot acquired (waited 308.2s). Starting GCN...
    FINAL_RESULT: {'acc': {'train': 0.6382978723404256, 'valid': 0.454, 'test': 0.74}, 'wall_s': 24.84, 'cpu_s': 19.7, 'gpu_s': 5.1, 'wait_s': 308.19}
    [Time] wall=24.8s | cpu=19.7s | gpu=5.1s
    C:\Users\fbrev\Documents\Acadêmico\Simulações\Python\NoisyGL\predictor\Base_Predictor.py:114: UserWarning: expandable_segments not supported on this platform (Triggered internally at ..\c10/cuda/CUDAAllocatorConfig.h:28.)
    self.edge_index = self._cpu_edge_index.to(self.device)
    C:\Users\fbrev\Documents\Acadêmico\Simulações\Python\NoisyGL\predictor\Base_Predictor.py:144: UserWarning: Sparse CSR tensor support is in beta state. If you miss a functionality in the sparse tensor support, please submit a feature request to https://github.com/pytorch/pytorch/issues. (Triggered internally at ..\aten\src\ATen\SparseCsrTensorImpl.cpp:55.)
    self.adj_csr = self.adj.to_sparse_csr().to(self.device)
[I 2026-05-01 23:32:13,616] Trial 38 finished with value: 0.74 and parameters: {'lr': 0.05, 'weight_decay': 0.001, 'n_hidden': 128, 'n_layer': 3, 'dropout': 0.7502034382844641, 'knn_mode': 'd', 'k': 7, 'dexp': 0.1664885796217075, 'p_grd': 0.5653694022304386, 'unc_rem': 0.330188895138544, 'unc_rel': 0.3135095120002133}. Best is trial 4 with value: 0.87.
    [CPU] Loading amazonpho...
    DEBUG 3.1: Dataset init start
    DEBUG 3.2: prepare_data start amazonpho
    ----Data statistics------'
    Name: amazonpho
    #Nodes 7650
    #Edges 119081
    #Classes 8
    #Ave_degree 31.13
    ----Split statistics------'
    #Train samples 160 (20 nodes per class)
    #Val samples 500 (specified)
    #Test samples 1000 (specified)
    ----label noise information:------
    Instance dependent noise
    #Actual noise rate 0.40
    [cuda:0] LNPCC waiting for GPU slot...
    [cuda:0] Slot acquired (waited 143.6s). Starting GCN...
    FINAL_RESULT: {'acc': {'train': 0.07534246575342465, 'valid': 0.288, 'test': 0.315}, 'wall_s': 20.64, 'cpu_s': 17.08, 'gpu_s': 3.51, 'wait_s': 143.58}
    [Time] wall=20.6s | cpu=17.1s | gpu=3.5s
    C:\Users\fbrev\Documents\Acadêmico\Simulações\Python\NoisyGL\predictor\Base_Predictor.py:114: UserWarning: expandable_segments not supported on this platform (Triggered internally at ..\c10/cuda/CUDAAllocatorConfig.h:28.)
    self.edge_index = self._cpu_edge_index.to(self.device)
    C:\Users\fbrev\Documents\Acadêmico\Simulações\Python\NoisyGL\predictor\Base_Predictor.py:144: UserWarning: Sparse CSR tensor support is in beta state. If you miss a functionality in the sparse tensor support, please submit a feature request to https://github.com/pytorch/pytorch/issues. (Triggered internally at ..\aten\src\ATen\SparseCsrTensorImpl.cpp:55.)
    self.adj_csr = self.adj.to_sparse_csr().to(self.device)
[I 2026-05-01 23:35:04,204] Trial 39 finished with value: 0.315 and parameters: {'lr': 0.1, 'weight_decay': 0.001, 'n_hidden': 128, 'n_layer': 2, 'dropout': 0.7955592482822346, 'knn_mode': 'd', 'k': 16, 'dexp': 0.5482329260883654, 'p_grd': 0.4495020827816887, 'unc_rem': 0.12107097401840514, 'unc_rel': 0.4305287744275963}. Best is trial 4 with value: 0.87.
    [CPU] Loading amazonpho...
    DEBUG 3.1: Dataset init start
    DEBUG 3.2: prepare_data start amazonpho
    ----Data statistics------'
    Name: amazonpho
    #Nodes 7650
    #Edges 119081
    #Classes 8
    #Ave_degree 31.13
    ----Split statistics------'
    #Train samples 160 (20 nodes per class)
    #Val samples 500 (specified)
    #Test samples 1000 (specified)
    ----label noise information:------
    Instance dependent noise
    #Actual noise rate 0.40
    [cuda:0] LNPCC waiting for GPU slot...
    [cuda:0] Slot acquired (waited 291.7s). Starting GCN...
    FINAL_RESULT: {'acc': {'train': 0.6, 'valid': 0.518, 'test': 0.832}, 'wall_s': 27.57, 'cpu_s': 21.56, 'gpu_s': 5.96, 'wait_s': 291.66}
    [Time] wall=27.6s | cpu=21.6s | gpu=6.0s
    C:\Users\fbrev\Documents\Acadêmico\Simulações\Python\NoisyGL\predictor\Base_Predictor.py:114: UserWarning: expandable_segments not supported on this platform (Triggered internally at ..\c10/cuda/CUDAAllocatorConfig.h:28.)
    self.edge_index = self._cpu_edge_index.to(self.device)
    C:\Users\fbrev\Documents\Acadêmico\Simulações\Python\NoisyGL\predictor\Base_Predictor.py:144: UserWarning: Sparse CSR tensor support is in beta state. If you miss a functionality in the sparse tensor support, please submit a feature request to https://github.com/pytorch/pytorch/issues. (Triggered internally at ..\aten\src\ATen\SparseCsrTensorImpl.cpp:55.)
    self.adj_csr = self.adj.to_sparse_csr().to(self.device)
[I 2026-05-01 23:40:30,542] Trial 40 finished with value: 0.832 and parameters: {'lr': 0.01, 'weight_decay': 0.001, 'n_hidden': 128, 'n_layer': 3, 'dropout': 0.7046373916629427, 'knn_mode': 'd', 'k': 20, 'dexp': 5.6807732991894655, 'p_grd': 0.7321254874060438, 'unc_rem': 0.2593489878796307, 'unc_rel': 0.2714249933075703}. Best is trial 4 with value: 0.87.
    [CPU] Loading amazonpho...
    DEBUG 3.1: Dataset init start
    DEBUG 3.2: prepare_data start amazonpho
    ----Data statistics------'
    Name: amazonpho
    #Nodes 7650
    #Edges 119081
    #Classes 8
    #Ave_degree 31.13
    ----Split statistics------'
    #Train samples 160 (20 nodes per class)
    #Val samples 500 (specified)
    #Test samples 1000 (specified)
    ----label noise information:------
    Instance dependent noise
    #Actual noise rate 0.40
    [cuda:0] LNPCC waiting for GPU slot...
    [cuda:0] Slot acquired (waited 139.3s). Starting GCN...
    FINAL_RESULT: {'acc': {'train': 0.9612403100775194, 'valid': 0.538, 'test': 0.833}, 'wall_s': 21.95, 'cpu_s': 18.08, 'gpu_s': 3.81, 'wait_s': 139.28}
    [Time] wall=21.9s | cpu=18.1s | gpu=3.8s
    C:\Users\fbrev\Documents\Acadêmico\Simulações\Python\NoisyGL\predictor\Base_Predictor.py:114: UserWarning: expandable_segments not supported on this platform (Triggered internally at ..\c10/cuda/CUDAAllocatorConfig.h:28.)
    self.edge_index = self._cpu_edge_index.to(self.device)
    C:\Users\fbrev\Documents\Acadêmico\Simulações\Python\NoisyGL\predictor\Base_Predictor.py:144: UserWarning: Sparse CSR tensor support is in beta state. If you miss a functionality in the sparse tensor support, please submit a feature request to https://github.com/pytorch/pytorch/issues. (Triggered internally at ..\aten\src\ATen\SparseCsrTensorImpl.cpp:55.)
    self.adj_csr = self.adj.to_sparse_csr().to(self.device)
[I 2026-05-01 23:43:20,720] Trial 41 finished with value: 0.833 and parameters: {'lr': 0.005, 'weight_decay': 0.001, 'n_hidden': 128, 'n_layer': 2, 'dropout': 0.6144578148433999, 'knn_mode': 'd', 'k': 8, 'dexp': 1.1433101552169804, 'p_grd': 0.23053999180649629, 'unc_rem': 0.18467114041772617, 'unc_rel': 0.20034736418932148}. Best is trial 4 with value: 0.87.
    [CPU] Loading amazonpho...
    DEBUG 3.1: Dataset init start
    DEBUG 3.2: prepare_data start amazonpho
    ----Data statistics------'
    Name: amazonpho
    #Nodes 7650
    #Edges 119081
    #Classes 8
    #Ave_degree 31.13
    ----Split statistics------'
    #Train samples 160 (20 nodes per class)
    #Val samples 500 (specified)
    #Test samples 1000 (specified)
    ----label noise information:------
    Instance dependent noise
    #Actual noise rate 0.40
    [cuda:0] LNPCC waiting for GPU slot...
    [cuda:0] Slot acquired (waited 139.6s). Starting GCN...
    FINAL_RESULT: {'acc': {'train': 0.8888888888888888, 'valid': 0.466, 'test': 0.73}, 'wall_s': 21.34, 'cpu_s': 17.96, 'gpu_s': 3.32, 'wait_s': 139.58}
    [Time] wall=21.3s | cpu=18.0s | gpu=3.3s
    C:\Users\fbrev\Documents\Acadêmico\Simulações\Python\NoisyGL\predictor\Base_Predictor.py:114: UserWarning: expandable_segments not supported on this platform (Triggered internally at ..\c10/cuda/CUDAAllocatorConfig.h:28.)
    self.edge_index = self._cpu_edge_index.to(self.device)
    C:\Users\fbrev\Documents\Acadêmico\Simulações\Python\NoisyGL\predictor\Base_Predictor.py:144: UserWarning: Sparse CSR tensor support is in beta state. If you miss a functionality in the sparse tensor support, please submit a feature request to https://github.com/pytorch/pytorch/issues. (Triggered internally at ..\aten\src\ATen\SparseCsrTensorImpl.cpp:55.)
    self.adj_csr = self.adj.to_sparse_csr().to(self.device)
[I 2026-05-01 23:46:09,467] Trial 42 finished with value: 0.73 and parameters: {'lr': 0.005, 'weight_decay': 0.0001, 'n_hidden': 128, 'n_layer': 2, 'dropout': 0.6727170805654754, 'knn_mode': 'd', 'k': 14, 'dexp': 0.7322725693984169, 'p_grd': 0.27493015050734154, 'unc_rem': 0.044807127048938286, 'unc_rel': 0.10817224171262807}. Best is trial 4 with value: 0.87.
    [CPU] Loading amazonpho...
    DEBUG 3.1: Dataset init start
    DEBUG 3.2: prepare_data start amazonpho
    ----Data statistics------'
    Name: amazonpho
    #Nodes 7650
    #Edges 119081
    #Classes 8
    #Ave_degree 31.13
    ----Split statistics------'
    #Train samples 160 (20 nodes per class)
    #Val samples 500 (specified)
    #Test samples 1000 (specified)
    ----label noise information:------
    Instance dependent noise
    #Actual noise rate 0.40
    [cuda:0] LNPCC waiting for GPU slot...
    [cuda:0] Slot acquired (waited 138.3s). Starting GCN...
    FINAL_RESULT: {'acc': {'train': 0.9576271186440678, 'valid': 0.516, 'test': 0.836}, 'wall_s': 17.88, 'cpu_s': 15.31, 'gpu_s': 2.51, 'wait_s': 138.29}
    [Time] wall=17.9s | cpu=15.3s | gpu=2.5s
    C:\Users\fbrev\Documents\Acadêmico\Simulações\Python\NoisyGL\predictor\Base_Predictor.py:114: UserWarning: expandable_segments not supported on this platform (Triggered internally at ..\c10/cuda/CUDAAllocatorConfig.h:28.)
    self.edge_index = self._cpu_edge_index.to(self.device)
    C:\Users\fbrev\Documents\Acadêmico\Simulações\Python\NoisyGL\predictor\Base_Predictor.py:144: UserWarning: Sparse CSR tensor support is in beta state. If you miss a functionality in the sparse tensor support, please submit a feature request to https://github.com/pytorch/pytorch/issues. (Triggered internally at ..\aten\src\ATen\SparseCsrTensorImpl.cpp:55.)
    self.adj_csr = self.adj.to_sparse_csr().to(self.device)
[I 2026-05-01 23:48:52,386] Trial 43 finished with value: 0.836 and parameters: {'lr': 0.005, 'weight_decay': 0.05, 'n_hidden': 64, 'n_layer': 2, 'dropout': 0.5378898059986502, 'knn_mode': 'd', 'k': 10, 'dexp': 1.623960489626317, 'p_grd': 0.16399834304221395, 'unc_rem': 0.1252719974931804, 'unc_rel': 0.04140071061970027}. Best is trial 4 with value: 0.87.
    [CPU] Loading amazonpho...
    DEBUG 3.1: Dataset init start
    DEBUG 3.2: prepare_data start amazonpho
    ----Data statistics------'
    Name: amazonpho
    #Nodes 7650
    #Edges 119081
    #Classes 8
    #Ave_degree 31.13
    ----Split statistics------'
    #Train samples 160 (20 nodes per class)
    #Val samples 500 (specified)
    #Test samples 1000 (specified)
    ----label noise information:------
    Instance dependent noise
    #Actual noise rate 0.40
    [cuda:0] LNPCC waiting for GPU slot...
    [cuda:0] Slot acquired (waited 123.4s). Starting GCN...
    FINAL_RESULT: {'acc': {'train': 0.6666666666666666, 'valid': 0.482, 'test': 0.735}, 'wall_s': 17.1, 'cpu_s': 14.68, 'gpu_s': 2.37, 'wait_s': 123.37}
    [Time] wall=17.1s | cpu=14.7s | gpu=2.4s
    C:\Users\fbrev\Documents\Acadêmico\Simulações\Python\NoisyGL\predictor\Base_Predictor.py:114: UserWarning: expandable_segments not supported on this platform (Triggered internally at ..\c10/cuda/CUDAAllocatorConfig.h:28.)
    self.edge_index = self._cpu_edge_index.to(self.device)
    C:\Users\fbrev\Documents\Acadêmico\Simulações\Python\NoisyGL\predictor\Base_Predictor.py:144: UserWarning: Sparse CSR tensor support is in beta state. If you miss a functionality in the sparse tensor support, please submit a feature request to https://github.com/pytorch/pytorch/issues. (Triggered internally at ..\aten\src\ATen\SparseCsrTensorImpl.cpp:55.)
    self.adj_csr = self.adj.to_sparse_csr().to(self.device)
