[I 2026-05-05 18:49:13,399] Trial 127 finished with value: 0.70487837656229 and parameters: {'lr': 0.001, 'weight_decay': 0.0001, 'n_hidden': 64, 'n_layer': 3, 'dropout': 0.1132104366605606, 'knn_mode': 's', 'k': 35, 'dexp': 3.2403975821814286, 'p_grd': 0.20598338390809218, 'unc_rem': 0.7563919200496872, 'unc_rel': 0.10660767446363358}. Best is trial 95 with value: 0.7595081306276038.
    [CPU] Loading dblp...
    DEBUG 3.1: Dataset init start
    DEBUG 3.2: prepare_data start dblp
    ----Data statistics------'
    Name: dblp
    #Nodes 17716
    #Edges 52867
    #Classes 4
    #Ave_degree 5.97
    ----Split statistics------'
    #Train samples 177 (1.0 % of nodes)
    #Val samples 2657 (15.0 % of nodes)
    #Test samples 14882 (remaining)
    ----label noise information:------
    Instance dependent noise
    #Actual noise rate 0.30
    [cuda:1] LNPCC waiting for GPU slot...
    [cuda:1] Slot acquired (waited 307.0s). Starting GCN...
    FINAL_RESULT: {'acc': {'train': 0.9047619047619048, 'valid': 0.5445991719984945, 'test': 0.7374008869775568}, 'wall_s': 44.84, 'cpu_s': 41.09, 'gpu_s': 3.68, 'wait_s': 307.0}
    [Time] wall=44.8s | cpu=41.1s | gpu=3.7s
    C:\Users\fbrev\Documents\Acadêmico\Simulações\Python\NoisyGL\predictor\Base_Predictor.py:114: UserWarning: expandable_segments not supported on this platform (Triggered internally at ..\c10/cuda/CUDAAllocatorConfig.h:28.)
    self.edge_index = self._cpu_edge_index.to(self.device)
    C:\Users\fbrev\Documents\Acadêmico\Simulações\Python\NoisyGL\predictor\Base_Predictor.py:144: UserWarning: Sparse CSR tensor support is in beta state. If you miss a functionality in the sparse tensor support, please submit a feature request to https://github.com/pytorch/pytorch/issues. (Triggered internally at ..\aten\src\ATen\SparseCsrTensorImpl.cpp:55.)
    self.adj_csr = self.adj.to_sparse_csr().to(self.device)
[I 2026-05-05 18:55:11,721] Trial 128 finished with value: 0.7374008869775568 and parameters: {'lr': 0.001, 'weight_decay': 0.0001, 'n_hidden': 64, 'n_layer': 3, 'dropout': 0.5495285931113876, 'knn_mode': 's', 'k': 39, 'dexp': 2.3989195857447396, 'p_grd': 0.38611491719781177, 'unc_rem': 0.22355060002484053, 'unc_rel': 0.15298657570142346}. Best is trial 95 with value: 0.7595081306276038.
    [CPU] Loading dblp...
    DEBUG 3.1: Dataset init start
    DEBUG 3.2: prepare_data start dblp
    ----Data statistics------'
    Name: dblp
    #Nodes 17716
    #Edges 52867
    #Classes 4
    #Ave_degree 5.97
    ----Split statistics------'
    #Train samples 177 (1.0 % of nodes)
    #Val samples 2657 (15.0 % of nodes)
    #Test samples 14882 (remaining)
    ----label noise information:------
    Instance dependent noise
    #Actual noise rate 0.30
    [cuda:1] LNPCC waiting for GPU slot...
    [cuda:1] Slot acquired (waited 130.1s). Starting GCN...
    FINAL_RESULT: {'acc': {'train': 0.834319526627219, 'valid': 0.5423409860745201, 'test': 0.7146216906329794}, 'wall_s': 49.47, 'cpu_s': 42.47, 'gpu_s': 6.93, 'wait_s': 130.12}
    [Time] wall=49.5s | cpu=42.5s | gpu=6.9s
    C:\Users\fbrev\Documents\Acadêmico\Simulações\Python\NoisyGL\predictor\Base_Predictor.py:114: UserWarning: expandable_segments not supported on this platform (Triggered internally at ..\c10/cuda/CUDAAllocatorConfig.h:28.)
    self.edge_index = self._cpu_edge_index.to(self.device)
    C:\Users\fbrev\Documents\Acadêmico\Simulações\Python\NoisyGL\predictor\Base_Predictor.py:144: UserWarning: Sparse CSR tensor support is in beta state. If you miss a functionality in the sparse tensor support, please submit a feature request to https://github.com/pytorch/pytorch/issues. (Triggered internally at ..\aten\src\ATen\SparseCsrTensorImpl.cpp:55.)
    self.adj_csr = self.adj.to_sparse_csr().to(self.device)
[I 2026-05-05 18:58:17,540] Trial 129 finished with value: 0.7146216906329794 and parameters: {'lr': 0.005, 'weight_decay': 0.0001, 'n_hidden': 256, 'n_layer': 3, 'dropout': 0.6500168485022915, 'knn_mode': 's', 'k': 36, 'dexp': 2.8304825205945545, 'p_grd': 0.2743401714485249, 'unc_rem': 0.5244463974264411, 'unc_rel': 0.2544833108644153}. Best is trial 95 with value: 0.7595081306276038.
    [CPU] Loading dblp...
    DEBUG 3.1: Dataset init start
    DEBUG 3.2: prepare_data start dblp
    ----Data statistics------'
    Name: dblp
    #Nodes 17716
    #Edges 52867
    #Classes 4
    #Ave_degree 5.97
    ----Split statistics------'
    #Train samples 177 (1.0 % of nodes)
    #Val samples 2657 (15.0 % of nodes)
    #Test samples 14882 (remaining)
    ----label noise information:------
    Instance dependent noise
    #Actual noise rate 0.30
    [cuda:1] LNPCC waiting for GPU slot...
    [cuda:1] Slot acquired (waited 484.1s). Starting GCN...
    FINAL_RESULT: {'acc': {'train': 0.83125, 'valid': 0.5340609710199473, 'test': 0.7260448864399947}, 'wall_s': 43.03, 'cpu_s': 39.35, 'gpu_s': 3.58, 'wait_s': 484.11}
    [Time] wall=43.0s | cpu=39.3s | gpu=3.6s
    C:\Users\fbrev\Documents\Acadêmico\Simulações\Python\NoisyGL\predictor\Base_Predictor.py:114: UserWarning: expandable_segments not supported on this platform (Triggered internally at ..\c10/cuda/CUDAAllocatorConfig.h:28.)
    self.edge_index = self._cpu_edge_index.to(self.device)
    C:\Users\fbrev\Documents\Acadêmico\Simulações\Python\NoisyGL\predictor\Base_Predictor.py:144: UserWarning: Sparse CSR tensor support is in beta state. If you miss a functionality in the sparse tensor support, please submit a feature request to https://github.com/pytorch/pytorch/issues. (Triggered internally at ..\aten\src\ATen\SparseCsrTensorImpl.cpp:55.)
    self.adj_csr = self.adj.to_sparse_csr().to(self.device)
[I 2026-05-05 19:07:10,507] Trial 130 finished with value: 0.7260448864399947 and parameters: {'lr': 0.001, 'weight_decay': 0.0, 'n_hidden': 64, 'n_layer': 3, 'dropout': 0.4751513983598126, 'knn_mode': 's', 'k': 34, 'dexp': 1.5636985544559958, 'p_grd': 0.2329258915964457, 'unc_rem': 0.8793658688711081, 'unc_rel': 0.05144443310190623}. Best is trial 95 with value: 0.7595081306276038.
    [CPU] Loading dblp...
    DEBUG 3.1: Dataset init start
    DEBUG 3.2: prepare_data start dblp
    ----Data statistics------'
    Name: dblp
    #Nodes 17716
    #Edges 52867
    #Classes 4
    #Ave_degree 5.97
    ----Split statistics------'
    #Train samples 177 (1.0 % of nodes)
    #Val samples 2657 (15.0 % of nodes)
    #Test samples 14882 (remaining)
    ----label noise information:------
    Instance dependent noise
    #Actual noise rate 0.30
    [cuda:1] LNPCC waiting for GPU slot...
    [cuda:1] Slot acquired (waited 1322.4s). Starting GCN...
    FINAL_RESULT: {'acc': {'train': 0.6022727272727273, 'valid': 0.5287918705306737, 'test': 0.7175110872194598}, 'wall_s': 57.27, 'cpu_s': 53.77, 'gpu_s': 3.41, 'wait_s': 1322.43}
    [Time] wall=57.3s | cpu=53.8s | gpu=3.4s
    C:\Users\fbrev\Documents\Acadêmico\Simulações\Python\NoisyGL\predictor\Base_Predictor.py:114: UserWarning: expandable_segments not supported on this platform (Triggered internally at ..\c10/cuda/CUDAAllocatorConfig.h:28.)
    self.edge_index = self._cpu_edge_index.to(self.device)
    C:\Users\fbrev\Documents\Acadêmico\Simulações\Python\NoisyGL\predictor\Base_Predictor.py:144: UserWarning: Sparse CSR tensor support is in beta state. If you miss a functionality in the sparse tensor support, please submit a feature request to https://github.com/pytorch/pytorch/issues. (Triggered internally at ..\aten\src\ATen\SparseCsrTensorImpl.cpp:55.)
    self.adj_csr = self.adj.to_sparse_csr().to(self.device)
[I 2026-05-05 19:30:15,989] Trial 131 finished with value: 0.7175110872194598 and parameters: {'lr': 0.05, 'weight_decay': 0.0001, 'n_hidden': 32, 'n_layer': 3, 'dropout': 0.4335105157829632, 'knn_mode': 'd', 'k': 27, 'dexp': 5.099939890747826, 'p_grd': 0.3006730171499165, 'unc_rem': 0.3912573291812516, 'unc_rel': 0.012607101664150223}. Best is trial 95 with value: 0.7595081306276038.
    [CPU] Loading dblp...
    DEBUG 3.1: Dataset init start
    DEBUG 3.2: prepare_data start dblp
    ----Data statistics------'
    Name: dblp
    #Nodes 17716
    #Edges 52867
    #Classes 4
    #Ave_degree 5.97
    ----Split statistics------'
    #Train samples 177 (1.0 % of nodes)
    #Val samples 2657 (15.0 % of nodes)
    #Test samples 14882 (remaining)
    ----label noise information:------
    Instance dependent noise
    #Actual noise rate 0.30
    [cuda:1] LNPCC waiting for GPU slot...
    [cuda:1] Slot acquired (waited 977.8s). Starting GCN...
    FINAL_RESULT: {'acc': {'train': 0.6956521739130435, 'valid': 0.5205118554761009, 'test': 0.6890202929713748}, 'wall_s': 37.86, 'cpu_s': 34.26, 'gpu_s': 3.52, 'wait_s': 977.79}
    [Time] wall=37.9s | cpu=34.3s | gpu=3.5s
    C:\Users\fbrev\Documents\Acadêmico\Simulações\Python\NoisyGL\predictor\Base_Predictor.py:114: UserWarning: expandable_segments not supported on this platform (Triggered internally at ..\c10/cuda/CUDAAllocatorConfig.h:28.)
    self.edge_index = self._cpu_edge_index.to(self.device)
    C:\Users\fbrev\Documents\Acadêmico\Simulações\Python\NoisyGL\predictor\Base_Predictor.py:144: UserWarning: Sparse CSR tensor support is in beta state. If you miss a functionality in the sparse tensor support, please submit a feature request to https://github.com/pytorch/pytorch/issues. (Triggered internally at ..\aten\src\ATen\SparseCsrTensorImpl.cpp:55.)
    self.adj_csr = self.adj.to_sparse_csr().to(self.device)
[I 2026-05-05 19:47:17,378] Trial 132 finished with value: 0.6890202929713748 and parameters: {'lr': 0.001, 'weight_decay': 0.01, 'n_hidden': 64, 'n_layer': 3, 'dropout': 0.6009354920441606, 'knn_mode': 's', 'k': 25, 'dexp': 4.608507013043214, 'p_grd': 0.06599500988298564, 'unc_rem': 0.4113472829505963, 'unc_rel': 0.18782086481413704}. Best is trial 95 with value: 0.7595081306276038.
    [CPU] Loading dblp...
    DEBUG 3.1: Dataset init start
    DEBUG 3.2: prepare_data start dblp
    ----Data statistics------'
    Name: dblp
    #Nodes 17716
    #Edges 52867
    #Classes 4
    #Ave_degree 5.97
    ----Split statistics------'
    #Train samples 177 (1.0 % of nodes)
    #Val samples 2657 (15.0 % of nodes)
    #Test samples 14882 (remaining)
    ----label noise information:------
    Instance dependent noise
    #Actual noise rate 0.30
    [cuda:1] LNPCC waiting for GPU slot...
    [cuda:1] Slot acquired (waited 477.6s). Starting GCN...
    FINAL_RESULT: {'acc': {'train': 0.9642857142857143, 'valid': 0.5491155438464433, 'test': 0.737804058594275}, 'wall_s': 41.34, 'cpu_s': 37.7, 'gpu_s': 3.55, 'wait_s': 477.55}
    [Time] wall=41.3s | cpu=37.7s | gpu=3.5s
    C:\Users\fbrev\Documents\Acadêmico\Simulações\Python\NoisyGL\predictor\Base_Predictor.py:114: UserWarning: expandable_segments not supported on this platform (Triggered internally at ..\c10/cuda/CUDAAllocatorConfig.h:28.)
    self.edge_index = self._cpu_edge_index.to(self.device)
    C:\Users\fbrev\Documents\Acadêmico\Simulações\Python\NoisyGL\predictor\Base_Predictor.py:144: UserWarning: Sparse CSR tensor support is in beta state. If you miss a functionality in the sparse tensor support, please submit a feature request to https://github.com/pytorch/pytorch/issues. (Triggered internally at ..\aten\src\ATen\SparseCsrTensorImpl.cpp:55.)
    self.adj_csr = self.adj.to_sparse_csr().to(self.device)
