[I 2026-05-07 19:41:23,802] Trial 23 finished with value: 0.327 and parameters: {'lr': 0.005, 'weight_decay': 0.01, 'n_hidden': 128, 'n_layer': 3, 'dropout': 0.7991945755347166, 'knn_mode': 'd', 'k': 13, 'dexp': 2.4271308047476703, 'p_grd': 0.11408577968829464, 'unc_rem': 0.3686082897742605, 'unc_rel': 0.12031806137200671}. Best is trial 9 with value: 0.678.
    [CPU] Loading citeseer...
    DEBUG 3.1: Dataset init start
    DEBUG 3.2: prepare_data start citeseer
    ----Data statistics------'
    Name: citeseer
    #Nodes 3327
    #Edges 4552
    #Classes 6
    #Ave_degree 2.74
    ----Split statistics------'
    #Train samples 120 (default)
    #Val samples 500 (default)
    #Test samples 1000 (default)
    ----label noise information:------
    Instance dependent noise
    #Actual noise rate 0.20
    [cuda:0] LNPCC waiting for GPU slot...
    [cuda:0] Slot acquired (waited 170.8s). Starting GCN...
    FINAL_RESULT: {'acc': {'train': 0.85, 'valid': 0.522, 'test': 0.627}, 'wall_s': 10.27, 'cpu_s': 7.54, 'gpu_s': 2.7, 'wait_s': 170.78}
    [Time] wall=10.3s | cpu=7.5s | gpu=2.7s
    C:\Users\fbrev\Documents\Acadêmico\Simulações\Python\NoisyGL\predictor\Base_Predictor.py:114: UserWarning: expandable_segments not supported on this platform (Triggered internally at ..\c10/cuda/CUDAAllocatorConfig.h:28.)
    self.edge_index = self._cpu_edge_index.to(self.device)
    C:\Users\fbrev\Documents\Acadêmico\Simulações\Python\NoisyGL\predictor\Base_Predictor.py:144: UserWarning: Sparse CSR tensor support is in beta state. If you miss a functionality in the sparse tensor support, please submit a feature request to https://github.com/pytorch/pytorch/issues. (Triggered internally at ..\aten\src\ATen\SparseCsrTensorImpl.cpp:55.)
    self.adj_csr = self.adj.to_sparse_csr().to(self.device)
[I 2026-05-07 19:44:30,311] Trial 24 finished with value: 0.627 and parameters: {'lr': 0.005, 'weight_decay': 0.05, 'n_hidden': 32, 'n_layer': 3, 'dropout': 0.6741784341015823, 'knn_mode': 's', 'k': 31, 'dexp': 9.900158571057114, 'p_grd': 0.32591988573908875, 'unc_rem': 0.5784290231146281, 'unc_rel': 0.436332880727947}. Best is trial 9 with value: 0.678.
    [CPU] Loading citeseer...
    DEBUG 3.1: Dataset init start
    DEBUG 3.2: prepare_data start citeseer
    ----Data statistics------'
    Name: citeseer
    #Nodes 3327
    #Edges 4552
    #Classes 6
    #Ave_degree 2.74
    ----Split statistics------'
    #Train samples 120 (default)
    #Val samples 500 (default)
    #Test samples 1000 (default)
    ----label noise information:------
    Instance dependent noise
    #Actual noise rate 0.20
    [cuda:0] LNPCC waiting for GPU slot...
    [cuda:0] Slot acquired (waited 174.6s). Starting GCN...
    FINAL_RESULT: {'acc': {'train': 0.847457627118644, 'valid': 0.536, 'test': 0.647}, 'wall_s': 11.52, 'cpu_s': 9.26, 'gpu_s': 2.23, 'wait_s': 174.62}
    [Time] wall=11.5s | cpu=9.3s | gpu=2.2s
    C:\Users\fbrev\Documents\Acadêmico\Simulações\Python\NoisyGL\predictor\Base_Predictor.py:114: UserWarning: expandable_segments not supported on this platform (Triggered internally at ..\c10/cuda/CUDAAllocatorConfig.h:28.)
    self.edge_index = self._cpu_edge_index.to(self.device)
    C:\Users\fbrev\Documents\Acadêmico\Simulações\Python\NoisyGL\predictor\Base_Predictor.py:144: UserWarning: Sparse CSR tensor support is in beta state. If you miss a functionality in the sparse tensor support, please submit a feature request to https://github.com/pytorch/pytorch/issues. (Triggered internally at ..\aten\src\ATen\SparseCsrTensorImpl.cpp:55.)
    self.adj_csr = self.adj.to_sparse_csr().to(self.device)
[I 2026-05-07 19:47:42,677] Trial 25 finished with value: 0.647 and parameters: {'lr': 0.001, 'weight_decay': 0.01, 'n_hidden': 32, 'n_layer': 3, 'dropout': 0.5757655411229008, 'knn_mode': 's', 'k': 18, 'dexp': 4.944816110088705, 'p_grd': 0.27748586852669604, 'unc_rem': 0.16555096941695877, 'unc_rel': 0.15303149946029165}. Best is trial 9 with value: 0.678.
    [CPU] Loading citeseer...
    DEBUG 3.1: Dataset init start
    DEBUG 3.2: prepare_data start citeseer
    ----Data statistics------'
    Name: citeseer
    #Nodes 3327
    #Edges 4552
    #Classes 6
    #Ave_degree 2.74
    ----Split statistics------'
    #Train samples 120 (default)
    #Val samples 500 (default)
    #Test samples 1000 (default)
    ----label noise information:------
    Instance dependent noise
    #Actual noise rate 0.20
    [cuda:0] LNPCC waiting for GPU slot...
    [cuda:0] Slot acquired (waited 165.5s). Starting GCN...
    FINAL_RESULT: {'acc': {'train': 0.9491525423728814, 'valid': 0.548, 'test': 0.676}, 'wall_s': 16.73, 'cpu_s': 14.19, 'gpu_s': 2.51, 'wait_s': 165.49}
    [Time] wall=16.7s | cpu=14.2s | gpu=2.5s
    C:\Users\fbrev\Documents\Acadêmico\Simulações\Python\NoisyGL\predictor\Base_Predictor.py:114: UserWarning: expandable_segments not supported on this platform (Triggered internally at ..\c10/cuda/CUDAAllocatorConfig.h:28.)
    self.edge_index = self._cpu_edge_index.to(self.device)
    C:\Users\fbrev\Documents\Acadêmico\Simulações\Python\NoisyGL\predictor\Base_Predictor.py:144: UserWarning: Sparse CSR tensor support is in beta state. If you miss a functionality in the sparse tensor support, please submit a feature request to https://github.com/pytorch/pytorch/issues. (Triggered internally at ..\aten\src\ATen\SparseCsrTensorImpl.cpp:55.)
    self.adj_csr = self.adj.to_sparse_csr().to(self.device)
[I 2026-05-07 19:50:50,816] Trial 26 finished with value: 0.676 and parameters: {'lr': 0.005, 'weight_decay': 0.05, 'n_hidden': 128, 'n_layer': 3, 'dropout': 0.43308948278245846, 'knn_mode': 'd', 'k': 9, 'dexp': 1.9683308150549816, 'p_grd': 0.42530414965071517, 'unc_rem': 0.2244932817677321, 'unc_rel': 0.8885989309900345}. Best is trial 9 with value: 0.678.
    [CPU] Loading citeseer...
    DEBUG 3.1: Dataset init start
    DEBUG 3.2: prepare_data start citeseer
    ----Data statistics------'
    Name: citeseer
    #Nodes 3327
    #Edges 4552
    #Classes 6
    #Ave_degree 2.74
    ----Split statistics------'
    #Train samples 120 (default)
    #Val samples 500 (default)
    #Test samples 1000 (default)
    ----label noise information:------
    Instance dependent noise
    #Actual noise rate 0.20
    [cuda:0] LNPCC waiting for GPU slot...
    [cuda:0] Slot acquired (waited 337.3s). Starting GCN...
    FINAL_RESULT: {'acc': {'train': 0.9333333333333333, 'valid': 0.544, 'test': 0.647}, 'wall_s': 21.35, 'cpu_s': 19.12, 'gpu_s': 2.2, 'wait_s': 337.26}
    [Time] wall=21.3s | cpu=19.1s | gpu=2.2s
    C:\Users\fbrev\Documents\Acadêmico\Simulações\Python\NoisyGL\predictor\Base_Predictor.py:114: UserWarning: expandable_segments not supported on this platform (Triggered internally at ..\c10/cuda/CUDAAllocatorConfig.h:28.)
    self.edge_index = self._cpu_edge_index.to(self.device)
    C:\Users\fbrev\Documents\Acadêmico\Simulações\Python\NoisyGL\predictor\Base_Predictor.py:144: UserWarning: Sparse CSR tensor support is in beta state. If you miss a functionality in the sparse tensor support, please submit a feature request to https://github.com/pytorch/pytorch/issues. (Triggered internally at ..\aten\src\ATen\SparseCsrTensorImpl.cpp:55.)
    self.adj_csr = self.adj.to_sparse_csr().to(self.device)
[I 2026-05-07 19:56:55,029] Trial 27 finished with value: 0.647 and parameters: {'lr': 0.005, 'weight_decay': 0.05, 'n_hidden': 128, 'n_layer': 3, 'dropout': 0.4301459301217825, 'knn_mode': 'd', 'k': 29, 'dexp': 1.399856044201651, 'p_grd': 0.5706901686622932, 'unc_rem': 0.25362959478231445, 'unc_rel': 0.8729718213261802}. Best is trial 9 with value: 0.678.
    [CPU] Loading citeseer...
    DEBUG 3.1: Dataset init start
    DEBUG 3.2: prepare_data start citeseer
    ----Data statistics------'
    Name: citeseer
    #Nodes 3327
    #Edges 4552
    #Classes 6
    #Ave_degree 2.74
    ----Split statistics------'
    #Train samples 120 (default)
    #Val samples 500 (default)
    #Test samples 1000 (default)
    ----label noise information:------
    Instance dependent noise
    #Actual noise rate 0.20
    [cuda:0] LNPCC waiting for GPU slot...
    [cuda:0] Slot acquired (waited 163.0s). Starting GCN...
    FINAL_RESULT: {'acc': {'train': 0.9416666666666667, 'valid': 0.556, 'test': 0.663}, 'wall_s': 13.65, 'cpu_s': 11.52, 'gpu_s': 2.1, 'wait_s': 163.0}
    [Time] wall=13.7s | cpu=11.5s | gpu=2.1s
    C:\Users\fbrev\Documents\Acadêmico\Simulações\Python\NoisyGL\predictor\Base_Predictor.py:114: UserWarning: expandable_segments not supported on this platform (Triggered internally at ..\c10/cuda/CUDAAllocatorConfig.h:28.)
    self.edge_index = self._cpu_edge_index.to(self.device)
    C:\Users\fbrev\Documents\Acadêmico\Simulações\Python\NoisyGL\predictor\Base_Predictor.py:144: UserWarning: Sparse CSR tensor support is in beta state. If you miss a functionality in the sparse tensor support, please submit a feature request to https://github.com/pytorch/pytorch/issues. (Triggered internally at ..\aten\src\ATen\SparseCsrTensorImpl.cpp:55.)
    self.adj_csr = self.adj.to_sparse_csr().to(self.device)
[I 2026-05-07 19:59:56,858] Trial 28 finished with value: 0.663 and parameters: {'lr': 0.005, 'weight_decay': 0.05, 'n_hidden': 128, 'n_layer': 3, 'dropout': 0.27186949183303066, 'knn_mode': 'd', 'k': 18, 'dexp': 6.654829426151964, 'p_grd': 0.44635184318910076, 'unc_rem': 0.3850595167663156, 'unc_rel': 0.8450962417757117}. Best is trial 9 with value: 0.678.
    [CPU] Loading citeseer...
    DEBUG 3.1: Dataset init start
    DEBUG 3.2: prepare_data start citeseer
    ----Data statistics------'
    Name: citeseer
    #Nodes 3327
    #Edges 4552
    #Classes 6
    #Ave_degree 2.74
    ----Split statistics------'
    #Train samples 120 (default)
    #Val samples 500 (default)
    #Test samples 1000 (default)
    ----label noise information:------
    Instance dependent noise
    #Actual noise rate 0.20
    [cuda:0] LNPCC waiting for GPU slot...
    [cuda:0] Slot acquired (waited 334.4s). Starting GCN...
    FINAL_RESULT: {'acc': {'train': 0.9166666666666666, 'valid': 0.538, 'test': 0.643}, 'wall_s': 23.1, 'cpu_s': 21.05, 'gpu_s': 2.02, 'wait_s': 334.41}
    [Time] wall=23.1s | cpu=21.1s | gpu=2.0s
    C:\Users\fbrev\Documents\Acadêmico\Simulações\Python\NoisyGL\predictor\Base_Predictor.py:114: UserWarning: expandable_segments not supported on this platform (Triggered internally at ..\c10/cuda/CUDAAllocatorConfig.h:28.)
    self.edge_index = self._cpu_edge_index.to(self.device)
    C:\Users\fbrev\Documents\Acadêmico\Simulações\Python\NoisyGL\predictor\Base_Predictor.py:144: UserWarning: Sparse CSR tensor support is in beta state. If you miss a functionality in the sparse tensor support, please submit a feature request to https://github.com/pytorch/pytorch/issues. (Triggered internally at ..\aten\src\ATen\SparseCsrTensorImpl.cpp:55.)
    self.adj_csr = self.adj.to_sparse_csr().to(self.device)
[I 2026-05-07 20:05:59,602] Trial 29 finished with value: 0.643 and parameters: {'lr': 0.005, 'weight_decay': 0.05, 'n_hidden': 128, 'n_layer': 3, 'dropout': 0.44093862214863416, 'knn_mode': 'd', 'k': 10, 'dexp': 6.029206128029936, 'p_grd': 0.6838133510998734, 'unc_rem': 0.46998659904580387, 'unc_rel': 0.5608751936957294}. Best is trial 9 with value: 0.678.
    [CPU] Loading citeseer...
    DEBUG 3.1: Dataset init start
    DEBUG 3.2: prepare_data start citeseer
    ----Data statistics------'
    Name: citeseer
    #Nodes 3327
    #Edges 4552
    #Classes 6
    #Ave_degree 2.74
    ----Split statistics------'
    #Train samples 120 (default)
    #Val samples 500 (default)
    #Test samples 1000 (default)
    ----label noise information:------
    Instance dependent noise
    #Actual noise rate 0.20
    [cuda:0] LNPCC waiting for GPU slot...
    [cuda:0] Slot acquired (waited 162.5s). Starting GCN...
    FINAL_RESULT: {'acc': {'train': 0.75, 'valid': 0.532, 'test': 0.645}, 'wall_s': 15.23, 'cpu_s': 12.98, 'gpu_s': 2.22, 'wait_s': 162.51}
    [Time] wall=15.2s | cpu=13.0s | gpu=2.2s
    C:\Users\fbrev\Documents\Acadêmico\Simulações\Python\NoisyGL\predictor\Base_Predictor.py:114: UserWarning: expandable_segments not supported on this platform (Triggered internally at ..\c10/cuda/CUDAAllocatorConfig.h:28.)
    self.edge_index = self._cpu_edge_index.to(self.device)
    C:\Users\fbrev\Documents\Acadêmico\Simulações\Python\NoisyGL\predictor\Base_Predictor.py:144: UserWarning: Sparse CSR tensor support is in beta state. If you miss a functionality in the sparse tensor support, please submit a feature request to https://github.com/pytorch/pytorch/issues. (Triggered internally at ..\aten\src\ATen\SparseCsrTensorImpl.cpp:55.)
    self.adj_csr = self.adj.to_sparse_csr().to(self.device)
[I 2026-05-07 20:09:02,220] Trial 30 finished with value: 0.645 and parameters: {'lr': 0.1, 'weight_decay': 0.05, 'n_hidden': 128, 'n_layer': 3, 'dropout': 0.07334754037006874, 'knn_mode': 'd', 'k': 14, 'dexp': 7.513501876733723, 'p_grd': 0.6012698262385736, 'unc_rem': 0.5366335712021775, 'unc_rel': 0.5121987207220015}. Best is trial 9 with value: 0.678.
    [CPU] Loading citeseer...
    DEBUG 3.1: Dataset init start
    DEBUG 3.2: prepare_data start citeseer
    ----Data statistics------'
    Name: citeseer
    #Nodes 3327
    #Edges 4552
    #Classes 6
    #Ave_degree 2.74
    ----Split statistics------'
    #Train samples 120 (default)
    #Val samples 500 (default)
    #Test samples 1000 (default)
    ----label noise information:------
    Instance dependent noise
    #Actual noise rate 0.20
    [cuda:0] LNPCC waiting for GPU slot...
    [cuda:0] Slot acquired (waited 527.9s). Starting GCN...
    FINAL_RESULT: {'acc': {'train': 0.9523809523809523, 'valid': 0.492, 'test': 0.599}, 'wall_s': 15.68, 'cpu_s': 13.11, 'gpu_s': 2.53, 'wait_s': 527.92}
    [Time] wall=15.7s | cpu=13.1s | gpu=2.5s
    C:\Users\fbrev\Documents\Acadêmico\Simulações\Python\NoisyGL\predictor\Base_Predictor.py:114: UserWarning: expandable_segments not supported on this platform (Triggered internally at ..\c10/cuda/CUDAAllocatorConfig.h:28.)
    self.edge_index = self._cpu_edge_index.to(self.device)
    C:\Users\fbrev\Documents\Acadêmico\Simulações\Python\NoisyGL\predictor\Base_Predictor.py:144: UserWarning: Sparse CSR tensor support is in beta state. If you miss a functionality in the sparse tensor support, please submit a feature request to https://github.com/pytorch/pytorch/issues. (Triggered internally at ..\aten\src\ATen\SparseCsrTensorImpl.cpp:55.)
    self.adj_csr = self.adj.to_sparse_csr().to(self.device)
[I 2026-05-07 20:18:10,876] Trial 31 finished with value: 0.599 and parameters: {'lr': 0.005, 'weight_decay': 0.01, 'n_hidden': 32, 'n_layer': 3, 'dropout': 0.7359513489422146, 'knn_mode': 'd', 'k': 8, 'dexp': 2.168839117861135, 'p_grd': 0.37816316026237273, 'unc_rem': 0.024554067333057372, 'unc_rel': 0.9062251328298077}. Best is trial 9 with value: 0.678.
    [CPU] Loading citeseer...
    DEBUG 3.1: Dataset init start
    DEBUG 3.2: prepare_data start citeseer
    ----Data statistics------'
    Name: citeseer
    #Nodes 3327
    #Edges 4552
    #Classes 6
    #Ave_degree 2.74
    ----Split statistics------'
    #Train samples 120 (default)
    #Val samples 500 (default)
    #Test samples 1000 (default)
    ----label noise information:------
    Instance dependent noise
    #Actual noise rate 0.20
    [cuda:0] LNPCC waiting for GPU slot...
    [cuda:0] Slot acquired (waited 714.5s). Starting GCN...
    FINAL_RESULT: {'acc': {'train': 0.9310344827586207, 'valid': 0.544, 'test': 0.663}, 'wall_s': 10.15, 'cpu_s': 7.59, 'gpu_s': 2.52, 'wait_s': 714.5}
    [Time] wall=10.1s | cpu=7.6s | gpu=2.5s
    C:\Users\fbrev\Documents\Acadêmico\Simulações\Python\NoisyGL\predictor\Base_Predictor.py:114: UserWarning: expandable_segments not supported on this platform (Triggered internally at ..\c10/cuda/CUDAAllocatorConfig.h:28.)
    self.edge_index = self._cpu_edge_index.to(self.device)
    C:\Users\fbrev\Documents\Acadêmico\Simulações\Python\NoisyGL\predictor\Base_Predictor.py:144: UserWarning: Sparse CSR tensor support is in beta state. If you miss a functionality in the sparse tensor support, please submit a feature request to https://github.com/pytorch/pytorch/issues. (Triggered internally at ..\aten\src\ATen\SparseCsrTensorImpl.cpp:55.)
    self.adj_csr = self.adj.to_sparse_csr().to(self.device)
[I 2026-05-07 20:30:21,445] Trial 32 finished with value: 0.663 and parameters: {'lr': 0.001, 'weight_decay': 0.05, 'n_hidden': 128, 'n_layer': 3, 'dropout': 0.7080898824763545, 'knn_mode': 's', 'k': 5, 'dexp': 0.5547004973338101, 'p_grd': 0.28121372412294987, 'unc_rem': 0.21622536053458363, 'unc_rel': 0.6288750917931367}. Best is trial 9 with value: 0.678.
    [CPU] Loading citeseer...
    DEBUG 3.1: Dataset init start
    DEBUG 3.2: prepare_data start citeseer
    ----Data statistics------'
    Name: citeseer
    #Nodes 3327
    #Edges 4552
    #Classes 6
    #Ave_degree 2.74
    ----Split statistics------'
    #Train samples 120 (default)
    #Val samples 500 (default)
    #Test samples 1000 (default)
    ----label noise information:------
    Instance dependent noise
    #Actual noise rate 0.20
    [cuda:0] LNPCC waiting for GPU slot...
    [cuda:0] Slot acquired (waited 345.2s). Starting GCN...
    FINAL_RESULT: {'acc': {'train': 0.8157894736842105, 'valid': 0.21, 'test': 0.183}, 'wall_s': 10.13, 'cpu_s': 7.98, 'gpu_s': 2.13, 'wait_s': 345.15}
    [Time] wall=10.1s | cpu=8.0s | gpu=2.1s
    C:\Users\fbrev\Documents\Acadêmico\Simulações\Python\NoisyGL\predictor\Base_Predictor.py:114: UserWarning: expandable_segments not supported on this platform (Triggered internally at ..\c10/cuda/CUDAAllocatorConfig.h:28.)
    self.edge_index = self._cpu_edge_index.to(self.device)
    C:\Users\fbrev\Documents\Acadêmico\Simulações\Python\NoisyGL\predictor\Base_Predictor.py:144: UserWarning: Sparse CSR tensor support is in beta state. If you miss a functionality in the sparse tensor support, please submit a feature request to https://github.com/pytorch/pytorch/issues. (Triggered internally at ..\aten\src\ATen\SparseCsrTensorImpl.cpp:55.)
    self.adj_csr = self.adj.to_sparse_csr().to(self.device)
[I 2026-05-07 20:36:22,188] Trial 33 finished with value: 0.183 and parameters: {'lr': 0.005, 'weight_decay': 0.05, 'n_hidden': 32, 'n_layer': 3, 'dropout': 0.5442347690789171, 'knn_mode': 'd', 'k': 19, 'dexp': 2.8556339971239586, 'p_grd': 0.10271607250801701, 'unc_rem': 0.21795338454060903, 'unc_rel': 0.9928170373068292}. Best is trial 9 with value: 0.678.
    [CPU] Loading citeseer...
    DEBUG 3.1: Dataset init start
    DEBUG 3.2: prepare_data start citeseer
    ----Data statistics------'
    Name: citeseer
    #Nodes 3327
    #Edges 4552
    #Classes 6
    #Ave_degree 2.74
    ----Split statistics------'
    #Train samples 120 (default)
    #Val samples 500 (default)
    #Test samples 1000 (default)
    ----label noise information:------
    Instance dependent noise
    #Actual noise rate 0.20
    [cuda:0] LNPCC waiting for GPU slot...
    [cuda:0] Slot acquired (waited 169.2s). Starting GCN...
    FINAL_RESULT: {'acc': {'train': 0.911504424778761, 'valid': 0.528, 'test': 0.658}, 'wall_s': 9.2, 'cpu_s': 6.87, 'gpu_s': 2.3, 'wait_s': 169.16}
    [Time] wall=9.2s | cpu=6.9s | gpu=2.3s
    C:\Users\fbrev\Documents\Acadêmico\Simulações\Python\NoisyGL\predictor\Base_Predictor.py:114: UserWarning: expandable_segments not supported on this platform (Triggered internally at ..\c10/cuda/CUDAAllocatorConfig.h:28.)
    self.edge_index = self._cpu_edge_index.to(self.device)
    C:\Users\fbrev\Documents\Acadêmico\Simulações\Python\NoisyGL\predictor\Base_Predictor.py:144: UserWarning: Sparse CSR tensor support is in beta state. If you miss a functionality in the sparse tensor support, please submit a feature request to https://github.com/pytorch/pytorch/issues. (Triggered internally at ..\aten\src\ATen\SparseCsrTensorImpl.cpp:55.)
    self.adj_csr = self.adj.to_sparse_csr().to(self.device)
[I 2026-05-07 20:39:25,783] Trial 34 finished with value: 0.658 and parameters: {'lr': 0.005, 'weight_decay': 0.01, 'n_hidden': 128, 'n_layer': 3, 'dropout': 0.6622195827111343, 'knn_mode': 's', 'k': 10, 'dexp': 1.6614435504384648, 'p_grd': 0.44155922834931355, 'unc_rem': 0.06698303911674303, 'unc_rel': 0.11038411790003322}. Best is trial 9 with value: 0.678.
    [CPU] Loading citeseer...
    DEBUG 3.1: Dataset init start
    DEBUG 3.2: prepare_data start citeseer
    ----Data statistics------'
    Name: citeseer
    #Nodes 3327
    #Edges 4552
    #Classes 6
    #Ave_degree 2.74
    ----Split statistics------'
    #Train samples 120 (default)
    #Val samples 500 (default)
    #Test samples 1000 (default)
    ----label noise information:------
    Instance dependent noise
    #Actual noise rate 0.20
    [cuda:0] LNPCC waiting for GPU slot...
    [cuda:0] Slot acquired (waited 168.2s). Starting GCN...
    FINAL_RESULT: {'acc': {'train': 0.9152542372881356, 'valid': 0.512, 'test': 0.638}, 'wall_s': 11.64, 'cpu_s': 9.61, 'gpu_s': 1.99, 'wait_s': 168.17}
    [Time] wall=11.6s | cpu=9.6s | gpu=2.0s
    C:\Users\fbrev\Documents\Acadêmico\Simulações\Python\NoisyGL\predictor\Base_Predictor.py:114: UserWarning: expandable_segments not supported on this platform (Triggered internally at ..\c10/cuda/CUDAAllocatorConfig.h:28.)
    self.edge_index = self._cpu_edge_index.to(self.device)
    C:\Users\fbrev\Documents\Acadêmico\Simulações\Python\NoisyGL\predictor\Base_Predictor.py:144: UserWarning: Sparse CSR tensor support is in beta state. If you miss a functionality in the sparse tensor support, please submit a feature request to https://github.com/pytorch/pytorch/issues. (Triggered internally at ..\aten\src\ATen\SparseCsrTensorImpl.cpp:55.)
    self.adj_csr = self.adj.to_sparse_csr().to(self.device)
