[I 2026-05-04 12:46:14,038] Trial 49 finished with value: 0.7320252654213143 and parameters: {'lr': 0.01, 'weight_decay': 0.0001, 'n_hidden': 256, 'n_layer': 2, 'dropout': 0.278585158135459, 'knn_mode': 's', 'k': 19, 'dexp': 6.244983492525457, 'p_grd': 0.6494581778216783, 'unc_rem': 0.48317726818410833, 'unc_rel': 0.8939708391876997}. Best is trial 22 with value: 0.7636070420642387.

[Retest] Phase 1 Finished. Validating Top 3 (10 runs each)...

  [Retest] Candidate 1/3 (Trial 22, HPO_acc=0.7636)
    [CPU] Loading dblp...
    DEBUG 3.1: Dataset init start
    DEBUG 3.2: prepare_data start dblp
    ----Data statistics------'
    Name: dblp
    #Nodes 17716
    #Edges 52867
    #Classes 4
    #Ave_degree 5.97
    ----Split statistics------'
    #Train samples 177 (1.0 % of nodes)
    #Val samples 2657 (15.0 % of nodes)
    #Test samples 14882 (remaining)
    ----label noise information:------
    Instance dependent noise
    #Actual noise rate 0.20
    [cuda:0] LNPCC waiting for GPU slot...
    [cuda:0] Slot acquired (waited 14.1s). Starting GCN...
    FINAL_RESULT: {'acc': {'train': 0.8022598870056498, 'valid': 0.6432066240120436, 'test': 0.7769789006853918}, 'wall_s': 40.82, 'cpu_s': 34.93, 'gpu_s': 5.83, 'wait_s': 14.14}
    [Time] wall=40.8s | cpu=34.9s | gpu=5.8s
    C:\Users\fbrev\Documents\Acadêmico\Simulações\Python\NoisyGL\predictor\Base_Predictor.py:114: UserWarning: expandable_segments not supported on this platform (Triggered internally at ..\c10/cuda/CUDAAllocatorConfig.h:28.)
    self.edge_index = self._cpu_edge_index.to(self.device)
    C:\Users\fbrev\Documents\Acadêmico\Simulações\Python\NoisyGL\predictor\Base_Predictor.py:144: UserWarning: Sparse CSR tensor support is in beta state. If you miss a functionality in the sparse tensor support, please submit a feature request to https://github.com/pytorch/pytorch/issues. (Triggered internally at ..\aten\src\ATen\SparseCsrTensorImpl.cpp:55.)
    self.adj_csr = self.adj.to_sparse_csr().to(self.device)
    [CPU] Loading dblp...
    DEBUG 3.1: Dataset init start
    DEBUG 3.2: prepare_data start dblp
    ----Data statistics------'
    Name: dblp
    #Nodes 17716
    #Edges 52867
    #Classes 4
    #Ave_degree 5.97
    ----Split statistics------'
    #Train samples 177 (1.0 % of nodes)
    #Val samples 2657 (15.0 % of nodes)
    #Test samples 14882 (remaining)
    ----label noise information:------
    Instance dependent noise
    #Actual noise rate 0.21
    [cuda:0] LNPCC waiting for GPU slot...
    [cuda:0] Slot acquired (waited 19.4s). Starting GCN...
    [CPU] Loading dblp...
    DEBUG 3.1: Dataset init start
    DEBUG 3.2: prepare_data start dblp
    ----Data statistics------'
    Name: dblp
    #Nodes 17716
    #Edges 52867
    #Classes 4
    #Ave_degree 5.97
    ----Split statistics------'
    #Train samples 177 (1.0 % of nodes)
    #Val samples 2657 (15.0 % of nodes)
    #Test samples 14882 (remaining)
    ----label noise information:------
    Instance dependent noise
    #Actual noise rate 0.20
    [cuda:0] LNPCC waiting for GPU slot...
    [cuda:0] Slot acquired (waited 81.0s). Starting GCN...
    FINAL_RESULT: {'acc': {'train': 0.9378531073446328, 'valid': 0.6206247647722996, 'test': 0.7420373605698158}, 'wall_s': 42.9, 'cpu_s': 36.52, 'gpu_s': 6.33, 'wait_s': 81.0}
    [Time] wall=42.9s | cpu=36.5s | gpu=6.3s
    C:\Users\fbrev\Documents\Acadêmico\Simulações\Python\NoisyGL\predictor\Base_Predictor.py:114: UserWarning: expandable_segments not supported on this platform (Triggered internally at ..\c10/cuda/CUDAAllocatorConfig.h:28.)
    self.edge_index = self._cpu_edge_index.to(self.device)
    C:\Users\fbrev\Documents\Acadêmico\Simulações\Python\NoisyGL\predictor\Base_Predictor.py:144: UserWarning: Sparse CSR tensor support is in beta state. If you miss a functionality in the sparse tensor support, please submit a feature request to https://github.com/pytorch/pytorch/issues. (Triggered internally at ..\aten\src\ATen\SparseCsrTensorImpl.cpp:55.)
    self.adj_csr = self.adj.to_sparse_csr().to(self.device)
    [CPU] Loading dblp...
    DEBUG 3.1: Dataset init start
    DEBUG 3.2: prepare_data start dblp
    ----Data statistics------'
    Name: dblp
    #Nodes 17716
    #Edges 52867
    #Classes 4
    #Ave_degree 5.97
    ----Split statistics------'
    #Train samples 177 (1.0 % of nodes)
    #Val samples 2657 (15.0 % of nodes)
    #Test samples 14882 (remaining)
    ----label noise information:------
    Instance dependent noise
    #Actual noise rate 0.21
    [cuda:0] LNPCC waiting for GPU slot...
    [cuda:0] Slot acquired (waited 17.7s). Starting GCN...
    FINAL_RESULT: {'acc': {'train': 0.9152542372881356, 'valid': 0.6074520135491156, 'test': 0.7277919634457735}, 'wall_s': 38.87, 'cpu_s': 32.69, 'gpu_s': 6.13, 'wait_s': 17.7}
    [Time] wall=38.9s | cpu=32.7s | gpu=6.1s
    C:\Users\fbrev\Documents\Acadêmico\Simulações\Python\NoisyGL\predictor\Base_Predictor.py:114: UserWarning: expandable_segments not supported on this platform (Triggered internally at ..\c10/cuda/CUDAAllocatorConfig.h:28.)
    self.edge_index = self._cpu_edge_index.to(self.device)
    C:\Users\fbrev\Documents\Acadêmico\Simulações\Python\NoisyGL\predictor\Base_Predictor.py:144: UserWarning: Sparse CSR tensor support is in beta state. If you miss a functionality in the sparse tensor support, please submit a feature request to https://github.com/pytorch/pytorch/issues. (Triggered internally at ..\aten\src\ATen\SparseCsrTensorImpl.cpp:55.)
    self.adj_csr = self.adj.to_sparse_csr().to(self.device)
    [CPU] Loading dblp...
    DEBUG 3.1: Dataset init start
    DEBUG 3.2: prepare_data start dblp
    ----Data statistics------'
    Name: dblp
    #Nodes 17716
    #Edges 52867
    #Classes 4
    #Ave_degree 5.97
    ----Split statistics------'
    #Train samples 177 (1.0 % of nodes)
    #Val samples 2657 (15.0 % of nodes)
    #Test samples 14882 (remaining)
    ----label noise information:------
    Instance dependent noise
    #Actual noise rate 0.20
    [cuda:0] LNPCC waiting for GPU slot...
    [cuda:0] Slot acquired (waited 11.1s). Starting GCN...
    FINAL_RESULT: {'acc': {'train': 0.8813559322033898, 'valid': 0.6161083929243508, 'test': 0.7624647224835371}, 'wall_s': 45.0, 'cpu_s': 38.56, 'gpu_s': 6.37, 'wait_s': 11.11}
    [Time] wall=45.0s | cpu=38.6s | gpu=6.4s
    C:\Users\fbrev\Documents\Acadêmico\Simulações\Python\NoisyGL\predictor\Base_Predictor.py:114: UserWarning: expandable_segments not supported on this platform (Triggered internally at ..\c10/cuda/CUDAAllocatorConfig.h:28.)
    self.edge_index = self._cpu_edge_index.to(self.device)
    C:\Users\fbrev\Documents\Acadêmico\Simulações\Python\NoisyGL\predictor\Base_Predictor.py:144: UserWarning: Sparse CSR tensor support is in beta state. If you miss a functionality in the sparse tensor support, please submit a feature request to https://github.com/pytorch/pytorch/issues. (Triggered internally at ..\aten\src\ATen\SparseCsrTensorImpl.cpp:55.)
    self.adj_csr = self.adj.to_sparse_csr().to(self.device)
    [CPU] Loading dblp...
    DEBUG 3.1: Dataset init start
    DEBUG 3.2: prepare_data start dblp
    ----Data statistics------'
    Name: dblp
    #Nodes 17716
    #Edges 52867
    #Classes 4
    #Ave_degree 5.97
    ----Split statistics------'
    #Train samples 177 (1.0 % of nodes)
    #Val samples 2657 (15.0 % of nodes)
    #Test samples 14882 (remaining)
    ----label noise information:------
    Instance dependent noise
    #Actual noise rate 0.21
    [cuda:0] LNPCC waiting for GPU slot...
    [cuda:0] Slot acquired (waited 9.0s). Starting GCN...
    [CPU] Loading dblp...
    DEBUG 3.1: Dataset init start
    DEBUG 3.2: prepare_data start dblp
    ----Data statistics------'
    Name: dblp
    #Nodes 17716
    #Edges 52867
    #Classes 4
    #Ave_degree 5.97
    ----Split statistics------'
    #Train samples 177 (1.0 % of nodes)
    #Val samples 2657 (15.0 % of nodes)
    #Test samples 14882 (remaining)
    ----label noise information:------
    Instance dependent noise
    #Actual noise rate 0.20
    [cuda:0] LNPCC waiting for GPU slot...
    [cuda:0] Slot acquired (waited 15.8s). Starting GCN...
    FINAL_RESULT: {'acc': {'train': 0.8983050847457628, 'valid': 0.6307866014301844, 'test': 0.7718048649375084}, 'wall_s': 47.19, 'cpu_s': 40.73, 'gpu_s': 6.39, 'wait_s': 15.78}
    [Time] wall=47.2s | cpu=40.7s | gpu=6.4s
    C:\Users\fbrev\Documents\Acadêmico\Simulações\Python\NoisyGL\predictor\Base_Predictor.py:114: UserWarning: expandable_segments not supported on this platform (Triggered internally at ..\c10/cuda/CUDAAllocatorConfig.h:28.)
    self.edge_index = self._cpu_edge_index.to(self.device)
    C:\Users\fbrev\Documents\Acadêmico\Simulações\Python\NoisyGL\predictor\Base_Predictor.py:144: UserWarning: Sparse CSR tensor support is in beta state. If you miss a functionality in the sparse tensor support, please submit a feature request to https://github.com/pytorch/pytorch/issues. (Triggered internally at ..\aten\src\ATen\SparseCsrTensorImpl.cpp:55.)
    self.adj_csr = self.adj.to_sparse_csr().to(self.device)
    [CPU] Loading dblp...
    DEBUG 3.1: Dataset init start
    DEBUG 3.2: prepare_data start dblp
    ----Data statistics------'
    Name: dblp
    #Nodes 17716
    #Edges 52867
    #Classes 4
    #Ave_degree 5.97
    ----Split statistics------'
    #Train samples 177 (1.0 % of nodes)
    #Val samples 2657 (15.0 % of nodes)
    #Test samples 14882 (remaining)
    ----label noise information:------
    Instance dependent noise
    #Actual noise rate 0.20
    [cuda:0] LNPCC waiting for GPU slot...
    [cuda:0] Slot acquired (waited 12.7s). Starting GCN...
    FINAL_RESULT: {'acc': {'train': 0.9322033898305084, 'valid': 0.6055701919458035, 'test': 0.7316892890740492}, 'wall_s': 48.69, 'cpu_s': 42.38, 'gpu_s': 6.24, 'wait_s': 12.73}
    [Time] wall=48.7s | cpu=42.4s | gpu=6.2s
    C:\Users\fbrev\Documents\Acadêmico\Simulações\Python\NoisyGL\predictor\Base_Predictor.py:114: UserWarning: expandable_segments not supported on this platform (Triggered internally at ..\c10/cuda/CUDAAllocatorConfig.h:28.)
    self.edge_index = self._cpu_edge_index.to(self.device)
    C:\Users\fbrev\Documents\Acadêmico\Simulações\Python\NoisyGL\predictor\Base_Predictor.py:144: UserWarning: Sparse CSR tensor support is in beta state. If you miss a functionality in the sparse tensor support, please submit a feature request to https://github.com/pytorch/pytorch/issues. (Triggered internally at ..\aten\src\ATen\SparseCsrTensorImpl.cpp:55.)
    self.adj_csr = self.adj.to_sparse_csr().to(self.device)
    [CPU] Loading dblp...
    DEBUG 3.1: Dataset init start
    DEBUG 3.2: prepare_data start dblp
    ----Data statistics------'
    Name: dblp
    #Nodes 17716
    #Edges 52867
    #Classes 4
    #Ave_degree 5.97
    ----Split statistics------'
    #Train samples 177 (1.0 % of nodes)
    #Val samples 2657 (15.0 % of nodes)
    #Test samples 14882 (remaining)
    ----label noise information:------
    Instance dependent noise
    #Actual noise rate 0.21
    [cuda:0] LNPCC waiting for GPU slot...
    [cuda:0] Slot acquired (waited 9.0s). Starting GCN...
    FINAL_RESULT: {'acc': {'train': 0.8418079096045198, 'valid': 0.6183665788483251, 'test': 0.7655557048783765}, 'wall_s': 47.18, 'cpu_s': 40.98, 'gpu_s': 6.14, 'wait_s': 9.02}
    [Time] wall=47.2s | cpu=41.0s | gpu=6.1s
    C:\Users\fbrev\Documents\Acadêmico\Simulações\Python\NoisyGL\predictor\Base_Predictor.py:114: UserWarning: expandable_segments not supported on this platform (Triggered internally at ..\c10/cuda/CUDAAllocatorConfig.h:28.)
    self.edge_index = self._cpu_edge_index.to(self.device)
    C:\Users\fbrev\Documents\Acadêmico\Simulações\Python\NoisyGL\predictor\Base_Predictor.py:144: UserWarning: Sparse CSR tensor support is in beta state. If you miss a functionality in the sparse tensor support, please submit a feature request to https://github.com/pytorch/pytorch/issues. (Triggered internally at ..\aten\src\ATen\SparseCsrTensorImpl.cpp:55.)
    self.adj_csr = self.adj.to_sparse_csr().to(self.device)
    [CPU] Loading dblp...
    DEBUG 3.1: Dataset init start
    DEBUG 3.2: prepare_data start dblp
    ----Data statistics------'
    Name: dblp
    #Nodes 17716
    #Edges 52867
    #Classes 4
    #Ave_degree 5.97
    ----Split statistics------'
    #Train samples 177 (1.0 % of nodes)
    #Val samples 2657 (15.0 % of nodes)
    #Test samples 14882 (remaining)
    ----label noise information:------
    Instance dependent noise
    #Actual noise rate 0.21
    [cuda:0] LNPCC waiting for GPU slot...
    [cuda:0] Slot acquired (waited 16.1s). Starting GCN...
    FINAL_RESULT: {'acc': {'train': 0.9152542372881356, 'valid': 0.6134738426797139, 'test': 0.7630022846391614}, 'wall_s': 45.04, 'cpu_s': 37.98, 'gpu_s': 6.99, 'wait_s': 16.14}
    [Time] wall=45.0s | cpu=38.0s | gpu=7.0s
    C:\Users\fbrev\Documents\Acadêmico\Simulações\Python\NoisyGL\predictor\Base_Predictor.py:114: UserWarning: expandable_segments not supported on this platform (Triggered internally at ..\c10/cuda/CUDAAllocatorConfig.h:28.)
    self.edge_index = self._cpu_edge_index.to(self.device)
    C:\Users\fbrev\Documents\Acadêmico\Simulações\Python\NoisyGL\predictor\Base_Predictor.py:144: UserWarning: Sparse CSR tensor support is in beta state. If you miss a functionality in the sparse tensor support, please submit a feature request to https://github.com/pytorch/pytorch/issues. (Triggered internally at ..\aten\src\ATen\SparseCsrTensorImpl.cpp:55.)
    self.adj_csr = self.adj.to_sparse_csr().to(self.device)
  [Retest] Candidate 1 Avg: 0.7552

  [Retest] Candidate 2/3 (Trial 24, HPO_acc=0.7636)
    [CPU] Loading dblp...
    DEBUG 3.1: Dataset init start
    DEBUG 3.2: prepare_data start dblp
    ----Data statistics------'
    Name: dblp
    #Nodes 17716
    #Edges 52867
    #Classes 4
    #Ave_degree 5.97
    ----Split statistics------'
    #Train samples 177 (1.0 % of nodes)
    #Val samples 2657 (15.0 % of nodes)
    #Test samples 14882 (remaining)
    ----label noise information:------
    Instance dependent noise
    #Actual noise rate 0.20
    [cuda:0] LNPCC waiting for GPU slot...
    [cuda:0] Slot acquired (waited 62.0s). Starting GCN...
    FINAL_RESULT: {'acc': {'train': 0.807909604519774, 'valid': 0.6364320662401204, 'test': 0.7713344980513371}, 'wall_s': 72.8, 'cpu_s': 66.04, 'gpu_s': 6.69, 'wait_s': 61.96}
    [Time] wall=72.8s | cpu=66.0s | gpu=6.7s
    C:\Users\fbrev\Documents\Acadêmico\Simulações\Python\NoisyGL\predictor\Base_Predictor.py:114: UserWarning: expandable_segments not supported on this platform (Triggered internally at ..\c10/cuda/CUDAAllocatorConfig.h:28.)
    self.edge_index = self._cpu_edge_index.to(self.device)
    C:\Users\fbrev\Documents\Acadêmico\Simulações\Python\NoisyGL\predictor\Base_Predictor.py:144: UserWarning: Sparse CSR tensor support is in beta state. If you miss a functionality in the sparse tensor support, please submit a feature request to https://github.com/pytorch/pytorch/issues. (Triggered internally at ..\aten\src\ATen\SparseCsrTensorImpl.cpp:55.)
    self.adj_csr = self.adj.to_sparse_csr().to(self.device)
    [CPU] Loading dblp...
    DEBUG 3.1: Dataset init start
    DEBUG 3.2: prepare_data start dblp
    ----Data statistics------'
    Name: dblp
    #Nodes 17716
    #Edges 52867
    #Classes 4
    #Ave_degree 5.97
    ----Split statistics------'
    #Train samples 177 (1.0 % of nodes)
    #Val samples 2657 (15.0 % of nodes)
    #Test samples 14882 (remaining)
    ----label noise information:------
    Instance dependent noise
    #Actual noise rate 0.21
    [cuda:0] LNPCC waiting for GPU slot...
    [cuda:0] Slot acquired (waited 56.1s). Starting GCN...
    FINAL_RESULT: {'acc': {'train': 0.8135593220338984, 'valid': 0.6409484380880692, 'test': 0.7628006988308023}, 'wall_s': 69.69, 'cpu_s': 63.32, 'gpu_s': 6.31, 'wait_s': 56.12}
    [Time] wall=69.7s | cpu=63.3s | gpu=6.3s
    C:\Users\fbrev\Documents\Acadêmico\Simulações\Python\NoisyGL\predictor\Base_Predictor.py:114: UserWarning: expandable_segments not supported on this platform (Triggered internally at ..\c10/cuda/CUDAAllocatorConfig.h:28.)
    self.edge_index = self._cpu_edge_index.to(self.device)
    C:\Users\fbrev\Documents\Acadêmico\Simulações\Python\NoisyGL\predictor\Base_Predictor.py:144: UserWarning: Sparse CSR tensor support is in beta state. If you miss a functionality in the sparse tensor support, please submit a feature request to https://github.com/pytorch/pytorch/issues. (Triggered internally at ..\aten\src\ATen\SparseCsrTensorImpl.cpp:55.)
    self.adj_csr = self.adj.to_sparse_csr().to(self.device)
    [CPU] Loading dblp...
    DEBUG 3.1: Dataset init start
    DEBUG 3.2: prepare_data start dblp
    ----Data statistics------'
    Name: dblp
    #Nodes 17716
    #Edges 52867
    #Classes 4
    #Ave_degree 5.97
    ----Split statistics------'
    #Train samples 177 (1.0 % of nodes)
    #Val samples 2657 (15.0 % of nodes)
    #Test samples 14882 (remaining)
    ----label noise information:------
    Instance dependent noise
    #Actual noise rate 0.20
    [cuda:0] LNPCC waiting for GPU slot...
    [cuda:0] Slot acquired (waited 12.4s). Starting GCN...
    FINAL_RESULT: {'acc': {'train': 0.9096045197740112, 'valid': 0.6206247647722996, 'test': 0.746472248353716}, 'wall_s': 43.41, 'cpu_s': 36.79, 'gpu_s': 6.56, 'wait_s': 12.39}
    [Time] wall=43.4s | cpu=36.8s | gpu=6.6s
    C:\Users\fbrev\Documents\Acadêmico\Simulações\Python\NoisyGL\predictor\Base_Predictor.py:114: UserWarning: expandable_segments not supported on this platform (Triggered internally at ..\c10/cuda/CUDAAllocatorConfig.h:28.)
    self.edge_index = self._cpu_edge_index.to(self.device)
    C:\Users\fbrev\Documents\Acadêmico\Simulações\Python\NoisyGL\predictor\Base_Predictor.py:144: UserWarning: Sparse CSR tensor support is in beta state. If you miss a functionality in the sparse tensor support, please submit a feature request to https://github.com/pytorch/pytorch/issues. (Triggered internally at ..\aten\src\ATen\SparseCsrTensorImpl.cpp:55.)
    self.adj_csr = self.adj.to_sparse_csr().to(self.device)
    [CPU] Loading dblp...
    DEBUG 3.1: Dataset init start
    DEBUG 3.2: prepare_data start dblp
    ----Data statistics------'
    Name: dblp
    #Nodes 17716
    #Edges 52867
    #Classes 4
    #Ave_degree 5.97
    ----Split statistics------'
    #Train samples 177 (1.0 % of nodes)
    #Val samples 2657 (15.0 % of nodes)
    #Test samples 14882 (remaining)
    ----label noise information:------
    Instance dependent noise
    #Actual noise rate 0.21
    [cuda:0] LNPCC waiting for GPU slot...
    [cuda:0] Slot acquired (waited 14.9s). Starting GCN...
    FINAL_RESULT: {'acc': {'train': 0.9209039548022598, 'valid': 0.6070756492284531, 'test': 0.7274559870985082}, 'wall_s': 42.04, 'cpu_s': 35.73, 'gpu_s': 6.24, 'wait_s': 14.91}
    [Time] wall=42.0s | cpu=35.7s | gpu=6.2s
    C:\Users\fbrev\Documents\Acadêmico\Simulações\Python\NoisyGL\predictor\Base_Predictor.py:114: UserWarning: expandable_segments not supported on this platform (Triggered internally at ..\c10/cuda/CUDAAllocatorConfig.h:28.)
    self.edge_index = self._cpu_edge_index.to(self.device)
    C:\Users\fbrev\Documents\Acadêmico\Simulações\Python\NoisyGL\predictor\Base_Predictor.py:144: UserWarning: Sparse CSR tensor support is in beta state. If you miss a functionality in the sparse tensor support, please submit a feature request to https://github.com/pytorch/pytorch/issues. (Triggered internally at ..\aten\src\ATen\SparseCsrTensorImpl.cpp:55.)
    self.adj_csr = self.adj.to_sparse_csr().to(self.device)
    [CPU] Loading dblp...
    DEBUG 3.1: Dataset init start
    DEBUG 3.2: prepare_data start dblp
    ----Data statistics------'
    Name: dblp
    #Nodes 17716
    #Edges 52867
    #Classes 4
    #Ave_degree 5.97
    ----Split statistics------'
    #Train samples 177 (1.0 % of nodes)
    #Val samples 2657 (15.0 % of nodes)
    #Test samples 14882 (remaining)
    ----label noise information:------
    Instance dependent noise
    #Actual noise rate 0.20
    [cuda:0] LNPCC waiting for GPU slot...
    [cuda:0] Slot acquired (waited 11.2s). Starting GCN...
    FINAL_RESULT: {'acc': {'train': 0.9096045197740112, 'valid': 0.6093338351524276, 'test': 0.7432468754199705}, 'wall_s': 44.97, 'cpu_s': 39.0, 'gpu_s': 5.9, 'wait_s': 11.21}
    [Time] wall=45.0s | cpu=39.0s | gpu=5.9s
    C:\Users\fbrev\Documents\Acadêmico\Simulações\Python\NoisyGL\predictor\Base_Predictor.py:114: UserWarning: expandable_segments not supported on this platform (Triggered internally at ..\c10/cuda/CUDAAllocatorConfig.h:28.)
    self.edge_index = self._cpu_edge_index.to(self.device)
    C:\Users\fbrev\Documents\Acadêmico\Simulações\Python\NoisyGL\predictor\Base_Predictor.py:144: UserWarning: Sparse CSR tensor support is in beta state. If you miss a functionality in the sparse tensor support, please submit a feature request to https://github.com/pytorch/pytorch/issues. (Triggered internally at ..\aten\src\ATen\SparseCsrTensorImpl.cpp:55.)
    self.adj_csr = self.adj.to_sparse_csr().to(self.device)
    [CPU] Loading dblp...
    DEBUG 3.1: Dataset init start
    DEBUG 3.2: prepare_data start dblp
    ----Data statistics------'
    Name: dblp
    #Nodes 17716
    #Edges 52867
    #Classes 4
    #Ave_degree 5.97
    ----Split statistics------'
    #Train samples 177 (1.0 % of nodes)
    #Val samples 2657 (15.0 % of nodes)
    #Test samples 14882 (remaining)
    ----label noise information:------
    Instance dependent noise
    #Actual noise rate 0.21
    [cuda:0] LNPCC waiting for GPU slot...
    [cuda:0] Slot acquired (waited 13.8s). Starting GCN...
    FINAL_RESULT: {'acc': {'train': 0.8813559322033898, 'valid': 0.6146029356417012, 'test': 0.7279263539846795}, 'wall_s': 40.4, 'cpu_s': 34.57, 'gpu_s': 5.78, 'wait_s': 13.78}
    [Time] wall=40.4s | cpu=34.6s | gpu=5.8s
    C:\Users\fbrev\Documents\Acadêmico\Simulações\Python\NoisyGL\predictor\Base_Predictor.py:114: UserWarning: expandabl