[I 2026-05-03 21:21:00,856] Trial 32 finished with value: 0.7147667147667147 and parameters: {'lr': 0.005, 'weight_decay': 0.001, 'n_hidden': 64, 'n_layer': 2, 'dropout': 0.46871086972392, 'knn_mode': 'd', 'k': 27, 'dexp': 1.3597161508299846, 'p_grd': 0.2846222950198227, 'unc_rem': 0.37860206126107365, 'unc_rel': 0.02056942135257244}. Best is trial 30 with value: 0.7265512265512265.
    [CPU] Loading blogcatalog...
    DEBUG 3.1: Dataset init start
    DEBUG 3.2: prepare_data start blogcatalog
    ----Data statistics------'
    Name: blogcatalog
    #Nodes 5196
    #Edges 171743
    #Classes 6
    #Ave_degree 66.11
    ----Split statistics------'
    #Train samples 259 (5.0 % of nodes)
    #Val samples 779 (15.0 % of nodes)
    #Test samples 4158 (remaining)
    ----label noise information:------
    Instance dependent noise
    #Actual noise rate 0.20
    [cuda:1] LNPCC waiting for GPU slot...
    [cuda:1] Slot acquired (waited 43.8s). Starting GCN...
    FINAL_RESULT: {'acc': {'train': 0.3695652173913043, 'valid': 0.3427471116816431, 'test': 0.354016354016354}, 'wall_s': 26.36, 'cpu_s': 23.22, 'gpu_s': 3.05, 'wait_s': 43.76}
    [Time] wall=26.4s | cpu=23.2s | gpu=3.1s
    C:\Users\fbrev\Documents\Acadêmico\Simulações\Python\NoisyGL\predictor\Base_Predictor.py:114: UserWarning: expandable_segments not supported on this platform (Triggered internally at ..\c10/cuda/CUDAAllocatorConfig.h:28.)
    self.edge_index = self._cpu_edge_index.to(self.device)
    C:\Users\fbrev\Documents\Acadêmico\Simulações\Python\NoisyGL\predictor\Base_Predictor.py:144: UserWarning: Sparse CSR tensor support is in beta state. If you miss a functionality in the sparse tensor support, please submit a feature request to https://github.com/pytorch/pytorch/issues. (Triggered internally at ..\aten\src\ATen\SparseCsrTensorImpl.cpp:55.)
    self.adj_csr = self.adj.to_sparse_csr().to(self.device)
[I 2026-05-03 21:22:15,945] Trial 33 finished with value: 0.354016354016354 and parameters: {'lr': 0.005, 'weight_decay': 0.05, 'n_hidden': 64, 'n_layer': 2, 'dropout': 0.4249624614405175, 'knn_mode': 'd', 'k': 35, 'dexp': 2.22737764621525, 'p_grd': 0.171268972948926, 'unc_rem': 0.23845365546762423, 'unc_rel': 0.4106515018305737}. Best is trial 30 with value: 0.7265512265512265.
    [CPU] Loading blogcatalog...
    DEBUG 3.1: Dataset init start
    DEBUG 3.2: prepare_data start blogcatalog
    ----Data statistics------'
    Name: blogcatalog
    #Nodes 5196
    #Edges 171743
    #Classes 6
    #Ave_degree 66.11
    ----Split statistics------'
    #Train samples 259 (5.0 % of nodes)
    #Val samples 779 (15.0 % of nodes)
    #Test samples 4158 (remaining)
    ----label noise information:------
    Instance dependent noise
    #Actual noise rate 0.20
    [cuda:1] LNPCC waiting for GPU slot...
    [cuda:1] Slot acquired (waited 339.9s). Starting GCN...
    FINAL_RESULT: {'acc': {'train': 0.8097345132743363, 'valid': 0.6071887034659821, 'test': 0.7094757094757095}, 'wall_s': 20.34, 'cpu_s': 17.16, 'gpu_s': 3.09, 'wait_s': 339.95}
    [Time] wall=20.3s | cpu=17.2s | gpu=3.1s
    C:\Users\fbrev\Documents\Acadêmico\Simulações\Python\NoisyGL\predictor\Base_Predictor.py:114: UserWarning: expandable_segments not supported on this platform (Triggered internally at ..\c10/cuda/CUDAAllocatorConfig.h:28.)
    self.edge_index = self._cpu_edge_index.to(self.device)
    C:\Users\fbrev\Documents\Acadêmico\Simulações\Python\NoisyGL\predictor\Base_Predictor.py:144: UserWarning: Sparse CSR tensor support is in beta state. If you miss a functionality in the sparse tensor support, please submit a feature request to https://github.com/pytorch/pytorch/issues. (Triggered internally at ..\aten\src\ATen\SparseCsrTensorImpl.cpp:55.)
    self.adj_csr = self.adj.to_sparse_csr().to(self.device)
[I 2026-05-03 21:28:21,353] Trial 34 finished with value: 0.7094757094757095 and parameters: {'lr': 0.005, 'weight_decay': 0.001, 'n_hidden': 64, 'n_layer': 2, 'dropout': 0.5463045806202089, 'knn_mode': 'd', 'k': 40, 'dexp': 4.299991091539916, 'p_grd': 0.07331789185635913, 'unc_rem': 0.49563714890364574, 'unc_rel': 0.5510834972436276}. Best is trial 30 with value: 0.7265512265512265.
    [CPU] Loading blogcatalog...
    DEBUG 3.1: Dataset init start
    DEBUG 3.2: prepare_data start blogcatalog
    ----Data statistics------'
    Name: blogcatalog
    #Nodes 5196
    #Edges 171743
    #Classes 6
    #Ave_degree 66.11
    ----Split statistics------'
    #Train samples 259 (5.0 % of nodes)
    #Val samples 779 (15.0 % of nodes)
    #Test samples 4158 (remaining)
    ----label noise information:------
    Instance dependent noise
    #Actual noise rate 0.20
    [cuda:1] LNPCC waiting for GPU slot...
    [cuda:1] Slot acquired (waited 118.8s). Starting GCN...
    FINAL_RESULT: {'acc': {'train': 0.6293436293436293, 'valid': 0.5956354300385109, 'test': 0.6924001924001923}, 'wall_s': 23.03, 'cpu_s': 19.81, 'gpu_s': 3.13, 'wait_s': 118.77}
    [Time] wall=23.0s | cpu=19.8s | gpu=3.1s
    C:\Users\fbrev\Documents\Acadêmico\Simulações\Python\NoisyGL\predictor\Base_Predictor.py:114: UserWarning: expandable_segments not supported on this platform (Triggered internally at ..\c10/cuda/CUDAAllocatorConfig.h:28.)
    self.edge_index = self._cpu_edge_index.to(self.device)
    C:\Users\fbrev\Documents\Acadêmico\Simulações\Python\NoisyGL\predictor\Base_Predictor.py:144: UserWarning: Sparse CSR tensor support is in beta state. If you miss a functionality in the sparse tensor support, please submit a feature request to https://github.com/pytorch/pytorch/issues. (Triggered internally at ..\aten\src\ATen\SparseCsrTensorImpl.cpp:55.)
    self.adj_csr = self.adj.to_sparse_csr().to(self.device)
[I 2026-05-03 21:30:48,314] Trial 35 finished with value: 0.6924001924001923 and parameters: {'lr': 0.005, 'weight_decay': 0.01, 'n_hidden': 64, 'n_layer': 2, 'dropout': 0.3767454648667569, 'knn_mode': 'd', 'k': 19, 'dexp': 6.171810766810831, 'p_grd': 0.4273113145874272, 'unc_rem': 0.34413060461271044, 'unc_rel': 0.1726371100528697}. Best is trial 30 with value: 0.7265512265512265.
    [CPU] Loading blogcatalog...
    DEBUG 3.1: Dataset init start
    DEBUG 3.2: prepare_data start blogcatalog
    ----Data statistics------'
    Name: blogcatalog
    #Nodes 5196
    #Edges 171743
    #Classes 6
    #Ave_degree 66.11
    ----Split statistics------'
    #Train samples 259 (5.0 % of nodes)
    #Val samples 779 (15.0 % of nodes)
    #Test samples 4158 (remaining)
    ----label noise information:------
    Instance dependent noise
    #Actual noise rate 0.20
    [cuda:1] LNPCC waiting for GPU slot...
    [cuda:1] Slot acquired (waited 40.7s). Starting GCN...
    FINAL_RESULT: {'acc': {'train': 0.803088803088803, 'valid': 0.6097560975609756, 'test': 0.714045214045214}, 'wall_s': 29.18, 'cpu_s': 26.54, 'gpu_s': 2.53, 'wait_s': 40.68}
    [Time] wall=29.2s | cpu=26.5s | gpu=2.5s
    C:\Users\fbrev\Documents\Acadêmico\Simulações\Python\NoisyGL\predictor\Base_Predictor.py:114: UserWarning: expandable_segments not supported on this platform (Triggered internally at ..\c10/cuda/CUDAAllocatorConfig.h:28.)
    self.edge_index = self._cpu_edge_index.to(self.device)
    C:\Users\fbrev\Documents\Acadêmico\Simulações\Python\NoisyGL\predictor\Base_Predictor.py:144: UserWarning: Sparse CSR tensor support is in beta state. If you miss a functionality in the sparse tensor support, please submit a feature request to https://github.com/pytorch/pytorch/issues. (Triggered internally at ..\aten\src\ATen\SparseCsrTensorImpl.cpp:55.)
    self.adj_csr = self.adj.to_sparse_csr().to(self.device)
[I 2026-05-03 21:32:03,690] Trial 36 finished with value: 0.714045214045214 and parameters: {'lr': 0.005, 'weight_decay': 0.001, 'n_hidden': 32, 'n_layer': 2, 'dropout': 0.5391272769353646, 'knn_mode': 'd', 'k': 25, 'dexp': 3.1113513174151155, 'p_grd': 0.5611583770271386, 'unc_rem': 0.4285723694326029, 'unc_rel': 0.042514540363086495}. Best is trial 30 with value: 0.7265512265512265.
    [CPU] Loading blogcatalog...
    DEBUG 3.1: Dataset init start
    DEBUG 3.2: prepare_data start blogcatalog
    ----Data statistics------'
    Name: blogcatalog
    #Nodes 5196
    #Edges 171743
    #Classes 6
    #Ave_degree 66.11
    ----Split statistics------'
    #Train samples 259 (5.0 % of nodes)
    #Val samples 779 (15.0 % of nodes)
    #Test samples 4158 (remaining)
    ----label noise information:------
    Instance dependent noise
    #Actual noise rate 0.20
    [cuda:1] LNPCC waiting for GPU slot...
    [cuda:1] Slot acquired (waited 63.2s). Starting GCN...
    FINAL_RESULT: {'acc': {'train': 0.993421052631579, 'valid': 0.3632862644415918, 'test': 0.4004329004329004}, 'wall_s': 19.81, 'cpu_s': 15.51, 'gpu_s': 4.2, 'wait_s': 63.19}
    [Time] wall=19.8s | cpu=15.5s | gpu=4.2s
    C:\Users\fbrev\Documents\Acadêmico\Simulações\Python\NoisyGL\predictor\Base_Predictor.py:114: UserWarning: expandable_segments not supported on this platform (Triggered internally at ..\c10/cuda/CUDAAllocatorConfig.h:28.)
    self.edge_index = self._cpu_edge_index.to(self.device)
    C:\Users\fbrev\Documents\Acadêmico\Simulações\Python\NoisyGL\predictor\Base_Predictor.py:144: UserWarning: Sparse CSR tensor support is in beta state. If you miss a functionality in the sparse tensor support, please submit a feature request to https://github.com/pytorch/pytorch/issues. (Triggered internally at ..\aten\src\ATen\SparseCsrTensorImpl.cpp:55.)
    self.adj_csr = self.adj.to_sparse_csr().to(self.device)
[I 2026-05-03 21:33:32,166] Trial 37 finished with value: 0.4004329004329004 and parameters: {'lr': 0.005, 'weight_decay': 0.0, 'n_hidden': 128, 'n_layer': 2, 'dropout': 0.2666363185178666, 'knn_mode': 'd', 'k': 30, 'dexp': 4.225678470678361, 'p_grd': 0.0010804438936737881, 'unc_rem': 0.2332704147134545, 'unc_rel': 0.3104573612528318}. Best is trial 30 with value: 0.7265512265512265.
    [CPU] Loading blogcatalog...
    DEBUG 3.1: Dataset init start
    DEBUG 3.2: prepare_data start blogcatalog
    ----Data statistics------'
    Name: blogcatalog
    #Nodes 5196
    #Edges 171743
    #Classes 6
    #Ave_degree 66.11
    ----Split statistics------'
    #Train samples 259 (5.0 % of nodes)
    #Val samples 779 (15.0 % of nodes)
    #Test samples 4158 (remaining)
    ----label noise information:------
    Instance dependent noise
    #Actual noise rate 0.20
    [cuda:1] LNPCC waiting for GPU slot...
    [cuda:1] Slot acquired (waited 468.7s). Starting GCN...
    FINAL_RESULT: {'acc': {'train': 0.754863813229572, 'valid': 0.6161745827984596, 'test': 0.72991822991823}, 'wall_s': 30.11, 'cpu_s': 26.88, 'gpu_s': 3.14, 'wait_s': 468.67}
    [Time] wall=30.1s | cpu=26.9s | gpu=3.1s
    C:\Users\fbrev\Documents\Acadêmico\Simulações\Python\NoisyGL\predictor\Base_Predictor.py:114: UserWarning: expandable_segments not supported on this platform (Triggered internally at ..\c10/cuda/CUDAAllocatorConfig.h:28.)
    self.edge_index = self._cpu_edge_index.to(self.device)
    C:\Users\fbrev\Documents\Acadêmico\Simulações\Python\NoisyGL\predictor\Base_Predictor.py:144: UserWarning: Sparse CSR tensor support is in beta state. If you miss a functionality in the sparse tensor support, please submit a feature request to https://github.com/pytorch/pytorch/issues. (Triggered internally at ..\aten\src\ATen\SparseCsrTensorImpl.cpp:55.)
    self.adj_csr = self.adj.to_sparse_csr().to(self.device)
[I 2026-05-03 21:41:56,044] Trial 38 finished with value: 0.72991822991823 and parameters: {'lr': 0.005, 'weight_decay': 0.001, 'n_hidden': 64, 'n_layer': 2, 'dropout': 0.6782755120909605, 'knn_mode': 'd', 'k': 40, 'dexp': 1.8203363220389508, 'p_grd': 0.2795007523555056, 'unc_rem': 0.6459368444496091, 'unc_rel': 0.8841941782429936}. Best is trial 38 with value: 0.72991822991823.
    [CPU] Loading blogcatalog...
    DEBUG 3.1: Dataset init start
    DEBUG 3.2: prepare_data start blogcatalog
    ----Data statistics------'
    Name: blogcatalog
    #Nodes 5196
    #Edges 171743
    #Classes 6
    #Ave_degree 66.11
    ----Split statistics------'
    #Train samples 259 (5.0 % of nodes)
    #Val samples 779 (15.0 % of nodes)
    #Test samples 4158 (remaining)
    ----label noise information:------
    Instance dependent noise
    #Actual noise rate 0.20
    [cuda:1] LNPCC waiting for GPU slot...
    [cuda:1] Slot acquired (waited 125.4s). Starting GCN...
    FINAL_RESULT: {'acc': {'train': 0.6264591439688716, 'valid': 0.5815147625160462, 'test': 0.6794131794131794}, 'wall_s': 28.81, 'cpu_s': 25.59, 'gpu_s': 3.12, 'wait_s': 125.41}
    [Time] wall=28.8s | cpu=25.6s | gpu=3.1s
    C:\Users\fbrev\Documents\Acadêmico\Simulações\Python\NoisyGL\predictor\Base_Predictor.py:114: UserWarning: expandable_segments not supported on this platform (Triggered internally at ..\c10/cuda/CUDAAllocatorConfig.h:28.)
    self.edge_index = self._cpu_edge_index.to(self.device)
    C:\Users\fbrev\Documents\Acadêmico\Simulações\Python\NoisyGL\predictor\Base_Predictor.py:144: UserWarning: Sparse CSR tensor support is in beta state. If you miss a functionality in the sparse tensor support, please submit a feature request to https://github.com/pytorch/pytorch/issues. (Triggered internally at ..\aten\src\ATen\SparseCsrTensorImpl.cpp:55.)
    self.adj_csr = self.adj.to_sparse_csr().to(self.device)
[I 2026-05-03 21:44:35,579] Trial 39 finished with value: 0.6794131794131794 and parameters: {'lr': 0.05, 'weight_decay': 0.0001, 'n_hidden': 64, 'n_layer': 2, 'dropout': 0.7032211453397249, 'knn_mode': 'd', 'k': 43, 'dexp': 1.4130898603052193, 'p_grd': 0.29214178975420263, 'unc_rem': 0.6597175430394201, 'unc_rel': 0.8616608057002475}. Best is trial 38 with value: 0.72991822991823.
    [CPU] Loading blogcatalog...
    DEBUG 3.1: Dataset init start
    DEBUG 3.2: prepare_data start blogcatalog
    ----Data statistics------'
    Name: blogcatalog
    #Nodes 5196
    #Edges 171743
    #Classes 6
    #Ave_degree 66.11
    ----Split statistics------'
    #Train samples 259 (5.0 % of nodes)
    #Val samples 779 (15.0 % of nodes)
    #Test samples 4158 (remaining)
    ----label noise information:------
    Instance dependent noise
    #Actual noise rate 0.20
    [cuda:1] LNPCC waiting for GPU slot...
    [cuda:1] Slot acquired (waited 43.0s). Starting GCN...
    FINAL_RESULT: {'acc': {'train': 0.3492063492063492, 'valid': 0.32220795892169446, 'test': 0.34463684463684463}, 'wall_s': 27.33, 'cpu_s': 24.77, 'gpu_s': 2.48, 'wait_s': 43.03}
    [Time] wall=27.3s | cpu=24.8s | gpu=2.5s
    C:\Users\fbrev\Documents\Acadêmico\Simulações\Python\NoisyGL\predictor\Base_Predictor.py:114: UserWarning: expandable_segments not supported on this platform (Triggered internally at ..\c10/cuda/CUDAAllocatorConfig.h:28.)
    self.edge_index = self._cpu_edge_index.to(self.device)
    C:\Users\fbrev\Documents\Acadêmico\Simulações\Python\NoisyGL\predictor\Base_Predictor.py:144: UserWarning: Sparse CSR tensor support is in beta state. If you miss a functionality in the sparse tensor support, please submit a feature request to https://github.com/pytorch/pytorch/issues. (Triggered internally at ..\aten\src\ATen\SparseCsrTensorImpl.cpp:55.)
    self.adj_csr = self.adj.to_sparse_csr().to(self.device)
[I 2026-05-03 21:45:50,924] Trial 40 finished with value: 0.34463684463684463 and parameters: {'lr': 0.005, 'weight_decay': 0.05, 'n_hidden': 32, 'n_layer': 2, 'dropout': 0.6560580201699288, 'knn_mode': 'd', 'k': 39, 'dexp': 1.528545314410615, 'p_grd': 0.23161024960546162, 'unc_rem': 0.5181659825759579, 'unc_rel': 0.9966479725184461}. Best is trial 38 with value: 0.72991822991823.
    [CPU] Loading blogcatalog...
    DEBUG 3.1: Dataset init start
    DEBUG 3.2: prepare_data start blogcatalog
    ----Data statistics------'
    Name: blogcatalog
    #Nodes 5196
    #Edges 171743
    #Classes 6
    #Ave_degree 66.11
    ----Split statistics------'
    #Train samples 259 (5.0 % of nodes)
    #Val samples 779 (15.0 % of nodes)
    #Test samples 4158 (remaining)
    ----label noise information:------
    Instance dependent noise
    #Actual noise rate 0.20
    [cuda:1] LNPCC waiting for GPU slot...
    [cuda:1] Slot acquired (waited 221.8s). Starting GCN...
    FINAL_RESULT: {'acc': {'train': 0.8755186721991701, 'valid': 0.5532734274711169, 'test': 0.645021645021645}, 'wall_s': 23.31, 'cpu_s': 19.97, 'gpu_s': 3.24, 'wait_s': 221.83}
    [Time] wall=23.3s | cpu=20.0s | gpu=3.2s
    C:\Users\fbrev\Documents\Acadêmico\Simulações\Python\NoisyGL\predictor\Base_Predictor.py:114: UserWarning: expandable_segments not supported on this platform (Triggered internally at ..\c10/cuda/CUDAAllocatorConfig.h:28.)
    self.edge_index = self._cpu_edge_index.to(self.device)
    C:\Users\fbrev\Documents\Acadêmico\Simulações\Python\NoisyGL\predictor\Base_Predictor.py:144: UserWarning: Sparse CSR tensor support is in beta state. If you miss a functionality in the sparse tensor support, please submit a feature request to https://github.com/pytorch/pytorch/issues. (Triggered internally at ..\aten\src\ATen\SparseCsrTensorImpl.cpp:55.)
    self.adj_csr = self.adj.to_sparse_csr().to(self.device)
[I 2026-05-03 21:50:01,098] Trial 41 finished with value: 0.645021645021645 and parameters: {'lr': 0.005, 'weight_decay': 0.001, 'n_hidden': 64, 'n_layer': 2, 'dropout': 0.4571333056480905, 'knn_mode': 'd', 'k': 34, 'dexp': 0.2361355187742069, 'p_grd': 0.18237254262974945, 'unc_rem': 0.6321184876229644, 'unc_rel': 0.9099531799025289}. Best is trial 38 with value: 0.72991822991823.
    [CPU] Loading blogcatalog...
    DEBUG 3.1: Dataset init start
    DEBUG 3.2: prepare_data start blogcatalog
    ----Data statistics------'
    Name: blogcatalog
    #Nodes 5196
    #Edges 171743
    #Classes 6
    #Ave_degree 66.11
    ----Split statistics------'
    #Train samples 259 (5.0 % of nodes)
    #Val samples 779 (15.0 % of nodes)
    #Test samples 4158 (remaining)
    ----label noise information:------
    Instance dependent noise
    #Actual noise rate 0.20
    [cuda:1] LNPCC waiting for GPU slot...
    [cuda:1] Slot acquired (waited 59.1s). Starting GCN...
    FINAL_RESULT: {'acc': {'train': 0.8340807174887892, 'valid': 0.6187419768934531, 'test': 0.7202982202982203}, 'wall_s': 26.91, 'cpu_s': 23.59, 'gpu_s': 3.22, 'wait_s': 59.06}
    [Time] wall=26.9s | cpu=23.6s | gpu=3.2s
    C:\Users\fbrev\Documents\Acadêmico\Simulações\Python\NoisyGL\predictor\Base_Predictor.py:114: UserWarning: expandable_segments not supported on this platform (Triggered internally at ..\c10/cuda/CUDAAllocatorConfig.h:28.)
    self.edge_index = self._cpu_edge_index.to(self.device)
    C:\Users\fbrev\Documents\Acadêmico\Simulações\Python\NoisyGL\predictor\Base_Predictor.py:144: UserWarning: Sparse CSR tensor support is in beta state. If you miss a functionality in the sparse tensor support, please submit a feature request to https://github.com/pytorch/pytorch/issues. (Triggered internally at ..\aten\src\ATen\SparseCsrTensorImpl.cpp:55.)
    self.adj_csr = self.adj.to_sparse_csr().to(self.device)
[I 2026-05-03 21:51:32,614] Trial 42 finished with value: 0.7202982202982203 and parameters: {'lr': 0.005, 'weight_decay': 0.001, 'n_hidden': 64, 'n_layer': 2, 'dropout': 0.7273420002101403, 'knn_mode': 'd', 'k': 23, 'dexp': 2.358655243995085, 'p_grd': 0.15667878727789628, 'unc_rem': 0.35303986946724686, 'unc_rel': 0.07027569616271956}. Best is trial 38 with value: 0.72991822991823.
    [CPU] Loading blogcatalog...
    DEBUG 3.1: Dataset init start
    DEBUG 3.2: prepare_data start blogcatalog
    ----Data statistics------'
    Name: blogcatalog
    #Nodes 5196
    #Edges 171743
    #Classes 6
    #Ave_degree 66.11
    ----Split statistics------'
    #Train samples 259 (5.0 % of nodes)
    #Val samples 779 (15.0 % of nodes)
    #Test samples 4158 (remaining)
    ----label noise information:------
    Instance dependent noise
    #Actual noise rate 0.20
    [cuda:1] LNPCC waiting for GPU slot...
    [cuda:1] Slot acquired (waited 115.8s). Starting GCN...
    FINAL_RESULT: {'acc': {'train': 0.8514056224899599, 'valid': 0.6187419768934531, 'test': 0.7190957190957191}, 'wall_s': 29.43, 'cpu_s': 26.3, 'gpu_s': 3.04, 'wait_s': 115.84}
    [Time] wall=29.4s | cpu=26.3s | gpu=3.0s
    C:\Users\fbrev\Documents\Acadêmico\Simulações\Python\NoisyGL\predictor\Base_Predictor.py:114: UserWarning: expandable_segments not supported on this platform (Triggered internally at ..\c10/cuda/CUDAAllocatorConfig.h:28.)
    self.edge_index = self._cpu_edge_index.to(self.device)
    C:\Users\fbrev\Documents\Acadêmico\Simulações\Python\NoisyGL\predictor\Base_Predictor.py:144: UserWarning: Sparse CSR tensor support is in beta state. If you miss a functionality in the sparse tensor support, please submit a feature request to https://github.com/pytorch/pytorch/issues. (Triggered internally at ..\aten\src\ATen\SparseCsrTensorImpl.cpp:55.)
    self.adj_csr = self.adj.to_sparse_csr().to(self.device)
