[I 2026-05-06 18:37:05,040] Trial 35 finished with value: 0.706 and parameters: {'lr': 0.01, 'weight_decay': 0.0001, 'n_hidden': 32, 'n_layer': 2, 'dropout': 0.11460110909224758, 'knn_mode': 'd', 'k': 34, 'dexp': 5.551103967824561, 'p_grd': 0.6929209644627523, 'unc_rem': 0.4676592209398973, 'unc_rel': 0.27705940796065515}. Best is trial 3 with value: 0.731.
    [CPU] Loading pubmed...
    DEBUG 3.1: Dataset init start
    DEBUG 3.2: prepare_data start pubmed
    ----Data statistics------'
    Name: pubmed
    #Nodes 19717
    #Edges 44324
    #Classes 3
    #Ave_degree 4.50
    ----Split statistics------'
    #Train samples 60 (default)
    #Val samples 500 (default)
    #Test samples 1000 (default)
    ----label noise information:------
    Instance dependent noise
    #Actual noise rate 0.21
    [cuda:1] LNPCC waiting for GPU slot...
    [cuda:1] Slot acquired (waited 132.1s). Starting GCN...
    FINAL_RESULT: {'acc': {'train': 0.75, 'valid': 0.614, 'test': 0.709}, 'wall_s': 35.44, 'cpu_s': 29.49, 'gpu_s': 5.91, 'wait_s': 132.08}
    [Time] wall=35.4s | cpu=29.5s | gpu=5.9s
    C:\Users\fbrev\Documents\Acadêmico\Simulações\Python\NoisyGL\predictor\Base_Predictor.py:114: UserWarning: expandable_segments not supported on this platform (Triggered internally at ..\c10/cuda/CUDAAllocatorConfig.h:28.)
    self.edge_index = self._cpu_edge_index.to(self.device)
    C:\Users\fbrev\Documents\Acadêmico\Simulações\Python\NoisyGL\predictor\Base_Predictor.py:144: UserWarning: Sparse CSR tensor support is in beta state. If you miss a functionality in the sparse tensor support, please submit a feature request to https://github.com/pytorch/pytorch/issues. (Triggered internally at ..\aten\src\ATen\SparseCsrTensorImpl.cpp:55.)
    self.adj_csr = self.adj.to_sparse_csr().to(self.device)
[I 2026-05-06 18:39:58,691] Trial 36 finished with value: 0.709 and parameters: {'lr': 0.01, 'weight_decay': 0.0, 'n_hidden': 256, 'n_layer': 3, 'dropout': 0.37344093770242454, 'knn_mode': 'd', 'k': 37, 'dexp': 6.4864269984961425, 'p_grd': 0.571401458432872, 'unc_rem': 0.6524306099233963, 'unc_rel': 0.06439837418036945}. Best is trial 3 with value: 0.731.
    [CPU] Loading pubmed...
    DEBUG 3.1: Dataset init start
    DEBUG 3.2: prepare_data start pubmed
    ----Data statistics------'
    Name: pubmed
    #Nodes 19717
    #Edges 44324
    #Classes 3
    #Ave_degree 4.50
    ----Split statistics------'
    #Train samples 60 (default)
    #Val samples 500 (default)
    #Test samples 1000 (default)
    ----label noise information:------
    Instance dependent noise
    #Actual noise rate 0.21
    [cuda:1] LNPCC waiting for GPU slot...
    [cuda:1] Slot acquired (waited 156.7s). Starting GCN...
    FINAL_RESULT: {'acc': {'train': 0.8, 'valid': 0.596, 'test': 0.668}, 'wall_s': 30.25, 'cpu_s': 27.43, 'gpu_s': 2.76, 'wait_s': 156.66}
    [Time] wall=30.3s | cpu=27.4s | gpu=2.8s
    C:\Users\fbrev\Documents\Acadêmico\Simulações\Python\NoisyGL\predictor\Base_Predictor.py:114: UserWarning: expandable_segments not supported on this platform (Triggered internally at ..\c10/cuda/CUDAAllocatorConfig.h:28.)
    self.edge_index = self._cpu_edge_index.to(self.device)
    C:\Users\fbrev\Documents\Acadêmico\Simulações\Python\NoisyGL\predictor\Base_Predictor.py:144: UserWarning: Sparse CSR tensor support is in beta state. If you miss a functionality in the sparse tensor support, please submit a feature request to https://github.com/pytorch/pytorch/issues. (Triggered internally at ..\aten\src\ATen\SparseCsrTensorImpl.cpp:55.)
    self.adj_csr = self.adj.to_sparse_csr().to(self.device)
[I 2026-05-06 18:43:11,865] Trial 37 finished with value: 0.668 and parameters: {'lr': 0.005, 'weight_decay': 0.01, 'n_hidden': 128, 'n_layer': 2, 'dropout': 0.7241782970616765, 'knn_mode': 'd', 'k': 45, 'dexp': 4.2274690161373725, 'p_grd': 0.4401003672264029, 'unc_rem': 0.24445117654421933, 'unc_rel': 0.33694893546494453}. Best is trial 3 with value: 0.731.
    [CPU] Loading pubmed...
    DEBUG 3.1: Dataset init start
    DEBUG 3.2: prepare_data start pubmed
    ----Data statistics------'
    Name: pubmed
    #Nodes 19717
    #Edges 44324
    #Classes 3
    #Ave_degree 4.50
    ----Split statistics------'
    #Train samples 60 (default)
    #Val samples 500 (default)
    #Test samples 1000 (default)
    ----label noise information:------
    Instance dependent noise
    #Actual noise rate 0.21
    [cuda:1] LNPCC waiting for GPU slot...
    [cuda:1] Slot acquired (waited 889.7s). Starting GCN...
    FINAL_RESULT: {'acc': {'train': 0.7666666666666667, 'valid': 0.618, 'test': 0.71}, 'wall_s': 30.68, 'cpu_s': 24.5, 'gpu_s': 6.13, 'wait_s': 889.69}
    [Time] wall=30.7s | cpu=24.5s | gpu=6.1s
    C:\Users\fbrev\Documents\Acadêmico\Simulações\Python\NoisyGL\predictor\Base_Predictor.py:114: UserWarning: expandable_segments not supported on this platform (Triggered internally at ..\c10/cuda/CUDAAllocatorConfig.h:28.)
    self.edge_index = self._cpu_edge_index.to(self.device)
    C:\Users\fbrev\Documents\Acadêmico\Simulações\Python\NoisyGL\predictor\Base_Predictor.py:144: UserWarning: Sparse CSR tensor support is in beta state. If you miss a functionality in the sparse tensor support, please submit a feature request to https://github.com/pytorch/pytorch/issues. (Triggered internally at ..\aten\src\ATen\SparseCsrTensorImpl.cpp:55.)
    self.adj_csr = self.adj.to_sparse_csr().to(self.device)
[I 2026-05-06 18:58:38,266] Trial 38 finished with value: 0.71 and parameters: {'lr': 0.01, 'weight_decay': 0.0001, 'n_hidden': 256, 'n_layer': 3, 'dropout': 0.5647519821279081, 'knn_mode': 'd', 'k': 30, 'dexp': 7.793234362860799, 'p_grd': 0.2660177823662344, 'unc_rem': 0.35006840150600343, 'unc_rel': 0.1862095242810434}. Best is trial 3 with value: 0.731.
    [CPU] Loading pubmed...
    DEBUG 3.1: Dataset init start
    DEBUG 3.2: prepare_data start pubmed
    ----Data statistics------'
    Name: pubmed
    #Nodes 19717
    #Edges 44324
    #Classes 3
    #Ave_degree 4.50
    ----Split statistics------'
    #Train samples 60 (default)
    #Val samples 500 (default)
    #Test samples 1000 (default)
    ----label noise information:------
    Instance dependent noise
    #Actual noise rate 0.21
    [cuda:1] LNPCC waiting for GPU slot...
    [cuda:1] Slot acquired (waited 325.9s). Starting GCN...
    FINAL_RESULT: {'acc': {'train': 0.8867924528301887, 'valid': 0.612, 'test': 0.699}, 'wall_s': 30.58, 'cpu_s': 28.41, 'gpu_s': 2.12, 'wait_s': 325.89}
    [Time] wall=30.6s | cpu=28.4s | gpu=2.1s
    C:\Users\fbrev\Documents\Acadêmico\Simulações\Python\NoisyGL\predictor\Base_Predictor.py:114: UserWarning: expandable_segments not supported on this platform (Triggered internally at ..\c10/cuda/CUDAAllocatorConfig.h:28.)
    self.edge_index = self._cpu_edge_index.to(self.device)
    C:\Users\fbrev\Documents\Acadêmico\Simulações\Python\NoisyGL\predictor\Base_Predictor.py:144: UserWarning: Sparse CSR tensor support is in beta state. If you miss a functionality in the sparse tensor support, please submit a feature request to https://github.com/pytorch/pytorch/issues. (Triggered internally at ..\aten\src\ATen\SparseCsrTensorImpl.cpp:55.)
    self.adj_csr = self.adj.to_sparse_csr().to(self.device)
[I 2026-05-06 19:04:41,642] Trial 39 finished with value: 0.699 and parameters: {'lr': 0.05, 'weight_decay': 0.0, 'n_hidden': 32, 'n_layer': 2, 'dropout': 0.40111732789216603, 'knn_mode': 'd', 'k': 34, 'dexp': 1.2160652684997086, 'p_grd': 0.5582088189632944, 'unc_rem': 0.18354683896079368, 'unc_rel': 0.11563768472812212}. Best is trial 3 with value: 0.731.
    [CPU] Loading pubmed...
    DEBUG 3.1: Dataset init start
    DEBUG 3.2: prepare_data start pubmed
    ----Data statistics------'
    Name: pubmed
    #Nodes 19717
    #Edges 44324
    #Classes 3
    #Ave_degree 4.50
    ----Split statistics------'
    #Train samples 60 (default)
    #Val samples 500 (default)
    #Test samples 1000 (default)
    ----label noise information:------
    Instance dependent noise
    #Actual noise rate 0.21
    [cuda:1] LNPCC waiting for GPU slot...
    [cuda:1] Slot acquired (waited 162.0s). Starting GCN...
    FINAL_RESULT: {'acc': {'train': 0.41818181818181815, 'valid': 0.364, 'test': 0.413}, 'wall_s': 31.59, 'cpu_s': 25.43, 'gpu_s': 6.09, 'wait_s': 162.01}
    [Time] wall=31.6s | cpu=25.4s | gpu=6.1s
    C:\Users\fbrev\Documents\Acadêmico\Simulações\Python\NoisyGL\predictor\Base_Predictor.py:114: UserWarning: expandable_segments not supported on this platform (Triggered internally at ..\c10/cuda/CUDAAllocatorConfig.h:28.)
    self.edge_index = self._cpu_edge_index.to(self.device)
    C:\Users\fbrev\Documents\Acadêmico\Simulações\Python\NoisyGL\predictor\Base_Predictor.py:144: UserWarning: Sparse CSR tensor support is in beta state. If you miss a functionality in the sparse tensor support, please submit a feature request to https://github.com/pytorch/pytorch/issues. (Triggered internally at ..\aten\src\ATen\SparseCsrTensorImpl.cpp:55.)
    self.adj_csr = self.adj.to_sparse_csr().to(self.device)
[I 2026-05-06 19:08:01,680] Trial 40 finished with value: 0.413 and parameters: {'lr': 0.01, 'weight_decay': 0.05, 'n_hidden': 256, 'n_layer': 3, 'dropout': 0.6492907334909939, 'knn_mode': 's', 'k': 19, 'dexp': 3.28036753050025, 'p_grd': 0.038740667660085215, 'unc_rem': 0.5144938382975033, 'unc_rel': 0.39414649694568094}. Best is trial 3 with value: 0.731.
    [CPU] Loading pubmed...
    DEBUG 3.1: Dataset init start
    DEBUG 3.2: prepare_data start pubmed
    ----Data statistics------'
    Name: pubmed
    #Nodes 19717
    #Edges 44324
    #Classes 3
    #Ave_degree 4.50
    ----Split statistics------'
    #Train samples 60 (default)
    #Val samples 500 (default)
    #Test samples 1000 (default)
    ----label noise information:------
    Instance dependent noise
    #Actual noise rate 0.21
    [cuda:1] LNPCC waiting for GPU slot...
    [cuda:1] Slot acquired (waited 168.2s). Starting GCN...
    FINAL_RESULT: {'acc': {'train': 0.8333333333333334, 'valid': 0.634, 'test': 0.722}, 'wall_s': 31.6, 'cpu_s': 27.61, 'gpu_s': 3.93, 'wait_s': 168.24}
    [Time] wall=31.6s | cpu=27.6s | gpu=3.9s
    C:\Users\fbrev\Documents\Acadêmico\Simulações\Python\NoisyGL\predictor\Base_Predictor.py:114: UserWarning: expandable_segments not supported on this platform (Triggered internally at ..\c10/cuda/CUDAAllocatorConfig.h:28.)
    self.edge_index = self._cpu_edge_index.to(self.device)
    C:\Users\fbrev\Documents\Acadêmico\Simulações\Python\NoisyGL\predictor\Base_Predictor.py:144: UserWarning: Sparse CSR tensor support is in beta state. If you miss a functionality in the sparse tensor support, please submit a feature request to https://github.com/pytorch/pytorch/issues. (Triggered internally at ..\aten\src\ATen\SparseCsrTensorImpl.cpp:55.)
    self.adj_csr = self.adj.to_sparse_csr().to(self.device)
[I 2026-05-06 19:11:28,067] Trial 41 finished with value: 0.722 and parameters: {'lr': 0.01, 'weight_decay': 0.0001, 'n_hidden': 256, 'n_layer': 2, 'dropout': 0.266533796220631, 'knn_mode': 'd', 'k': 37, 'dexp': 5.009160278274089, 'p_grd': 0.3613995779595187, 'unc_rem': 0.4985658564054757, 'unc_rel': 0.03075920185417441}. Best is trial 3 with value: 0.731.
    [CPU] Loading pubmed...
    DEBUG 3.1: Dataset init start
    DEBUG 3.2: prepare_data start pubmed
    ----Data statistics------'
    Name: pubmed
    #Nodes 19717
    #Edges 44324
    #Classes 3
    #Ave_degree 4.50
    ----Split statistics------'
    #Train samples 60 (default)
    #Val samples 500 (default)
    #Test samples 1000 (default)
    ----label noise information:------
    Instance dependent noise
    #Actual noise rate 0.21
    [cuda:1] LNPCC waiting for GPU slot...
    [cuda:1] Slot acquired (waited 140.8s). Starting GCN...
    FINAL_RESULT: {'acc': {'train': 0.8333333333333334, 'valid': 0.632, 'test': 0.72}, 'wall_s': 28.15, 'cpu_s': 24.34, 'gpu_s': 3.77, 'wait_s': 140.79}
    [Time] wall=28.1s | cpu=24.3s | gpu=3.8s
    C:\Users\fbrev\Documents\Acadêmico\Simulações\Python\NoisyGL\predictor\Base_Predictor.py:114: UserWarning: expandable_segments not supported on this platform (Triggered internally at ..\c10/cuda/CUDAAllocatorConfig.h:28.)
    self.edge_index = self._cpu_edge_index.to(self.device)
    C:\Users\fbrev\Documents\Acadêmico\Simulações\Python\NoisyGL\predictor\Base_Predictor.py:144: UserWarning: Sparse CSR tensor support is in beta state. If you miss a functionality in the sparse tensor support, please submit a feature request to https://github.com/pytorch/pytorch/issues. (Triggered internally at ..\aten\src\ATen\SparseCsrTensorImpl.cpp:55.)
    self.adj_csr = self.adj.to_sparse_csr().to(self.device)
[I 2026-05-06 19:14:23,836] Trial 42 finished with value: 0.72 and parameters: {'lr': 0.01, 'weight_decay': 0.0001, 'n_hidden': 256, 'n_layer': 2, 'dropout': 0.2207881424576132, 'knn_mode': 'd', 'k': 39, 'dexp': 5.125085495945148, 'p_grd': 0.23480165129231495, 'unc_rem': 0.5548873326220767, 'unc_rel': 0.053071228218273904}. Best is trial 3 with value: 0.731.
    [CPU] Loading pubmed...
    DEBUG 3.1: Dataset init start
    DEBUG 3.2: prepare_data start pubmed
    ----Data statistics------'
    Name: pubmed
    #Nodes 19717
    #Edges 44324
    #Classes 3
    #Ave_degree 4.50
    ----Split statistics------'
    #Train samples 60 (default)
    #Val samples 500 (default)
    #Test samples 1000 (default)
    ----label noise information:------
    Instance dependent noise
    #Actual noise rate 0.21
    [cuda:1] LNPCC waiting for GPU slot...
    [cuda:1] Slot acquired (waited 155.0s). Starting GCN...
    FINAL_RESULT: {'acc': {'train': 0.8333333333333334, 'valid': 0.632, 'test': 0.725}, 'wall_s': 29.31, 'cpu_s': 25.41, 'gpu_s': 3.85, 'wait_s': 155.01}
    [Time] wall=29.3s | cpu=25.4s | gpu=3.8s
    C:\Users\fbrev\Documents\Acadêmico\Simulações\Python\NoisyGL\predictor\Base_Predictor.py:114: UserWarning: expandable_segments not supported on this platform (Triggered internally at ..\c10/cuda/CUDAAllocatorConfig.h:28.)
    self.edge_index = self._cpu_edge_index.to(self.device)
    C:\Users\fbrev\Documents\Acadêmico\Simulações\Python\NoisyGL\predictor\Base_Predictor.py:144: UserWarning: Sparse CSR tensor support is in beta state. If you miss a functionality in the sparse tensor support, please submit a feature request to https://github.com/pytorch/pytorch/issues. (Triggered internally at ..\aten\src\ATen\SparseCsrTensorImpl.cpp:55.)
    self.adj_csr = self.adj.to_sparse_csr().to(self.device)
[I 2026-05-06 19:17:34,573] Trial 43 finished with value: 0.725 and parameters: {'lr': 0.01, 'weight_decay': 0.0001, 'n_hidden': 256, 'n_layer': 2, 'dropout': 0.2762959926013472, 'knn_mode': 'd', 'k': 34, 'dexp': 4.064083837613147, 'p_grd': 0.2979693449822105, 'unc_rem': 0.4345687152360418, 'unc_rel': 0.001532265164131587}. Best is trial 3 with value: 0.731.
    [CPU] Loading pubmed...
    DEBUG 3.1: Dataset init start
    DEBUG 3.2: prepare_data start pubmed
    ----Data statistics------'
    Name: pubmed
    #Nodes 19717
    #Edges 44324
    #Classes 3
    #Ave_degree 4.50
    ----Split statistics------'
    #Train samples 60 (default)
    #Val samples 500 (default)
    #Test samples 1000 (default)
    ----label noise information:------
    Instance dependent noise
    #Actual noise rate 0.21
    [cuda:1] LNPCC waiting for GPU slot...
    [cuda:1] Slot acquired (waited 485.7s). Starting GCN...
    FINAL_RESULT: {'acc': {'train': 0.85, 'valid': 0.618, 'test': 0.716}, 'wall_s': 28.46, 'cpu_s': 25.67, 'gpu_s': 2.72, 'wait_s': 485.68}
    [Time] wall=28.5s | cpu=25.7s | gpu=2.7s
    C:\Users\fbrev\Documents\Acadêmico\Simulações\Python\NoisyGL\predictor\Base_Predictor.py:114: UserWarning: expandable_segments not supported on this platform (Triggered internally at ..\c10/cuda/CUDAAllocatorConfig.h:28.)
    self.edge_index = self._cpu_edge_index.to(self.device)
    C:\Users\fbrev\Documents\Acadêmico\Simulações\Python\NoisyGL\predictor\Base_Predictor.py:144: UserWarning: Sparse CSR tensor support is in beta state. If you miss a functionality in the sparse tensor support, please submit a feature request to https://github.com/pytorch/pytorch/issues. (Triggered internally at ..\aten\src\ATen\SparseCsrTensorImpl.cpp:55.)
    self.adj_csr = self.adj.to_sparse_csr().to(self.device)
[I 2026-05-06 19:26:14,789] Trial 44 finished with value: 0.716 and parameters: {'lr': 0.005, 'weight_decay': 0.0001, 'n_hidden': 128, 'n_layer': 2, 'dropout': 0.301277679858734, 'knn_mode': 'd', 'k': 33, 'dexp': 2.941903208469352, 'p_grd': 0.2970214038064244, 'unc_rem': 0.4222860517324001, 'unc_rel': 0.11909418438996792}. Best is trial 3 with value: 0.731.
    [CPU] Loading pubmed...
    DEBUG 3.1: Dataset init start
    DEBUG 3.2: prepare_data start pubmed
    ----Data statistics------'
    Name: pubmed
    #Nodes 19717
    #Edges 44324
    #Classes 3
    #Ave_degree 4.50
    ----Split statistics------'
    #Train samples 60 (default)
    #Val samples 500 (default)
    #Test samples 1000 (default)
    ----label noise information:------
    Instance dependent noise
    #Actual noise rate 0.21
    [cuda:1] LNPCC waiting for GPU slot...
    [cuda:1] Slot acquired (waited 1176.4s). Starting GCN...
    FINAL_RESULT: {'acc': {'train': 0.8888888888888888, 'valid': 0.59, 'test': 0.716}, 'wall_s': 26.55, 'cpu_s': 22.7, 'gpu_s': 3.8, 'wait_s': 1176.36}
    [Time] wall=26.5s | cpu=22.7s | gpu=3.8s
    C:\Users\fbrev\Documents\Acadêmico\Simulações\Python\NoisyGL\predictor\Base_Predictor.py:114: UserWarning: expandable_segments not supported on this platform (Triggered internally at ..\c10/cuda/CUDAAllocatorConfig.h:28.)
    self.edge_index = self._cpu_edge_index.to(self.device)
    C:\Users\fbrev\Documents\Acadêmico\Simulações\Python\NoisyGL\predictor\Base_Predictor.py:144: UserWarning: Sparse CSR tensor support is in beta state. If you miss a functionality in the sparse tensor support, please submit a feature request to https://github.com/pytorch/pytorch/issues. (Triggered internally at ..\aten\src\ATen\SparseCsrTensorImpl.cpp:55.)
    self.adj_csr = self.adj.to_sparse_csr().to(self.device)
[I 2026-05-06 19:46:23,901] Trial 45 finished with value: 0.716 and parameters: {'lr': 0.01, 'weight_decay': 0.0001, 'n_hidden': 256, 'n_layer': 2, 'dropout': 0.4661912635646737, 'knn_mode': 'd', 'k': 30, 'dexp': 8.864109898260937, 'p_grd': 0.10521942676070872, 'unc_rem': 0.08024418047859677, 'unc_rel': 0.25562861222796396}. Best is trial 3 with value: 0.731.
    [CPU] Loading pubmed...
    DEBUG 3.1: Dataset init start
    DEBUG 3.2: prepare_data start pubmed
    ----Data statistics------'
    Name: pubmed
    #Nodes 19717
    #Edges 44324
    #Classes 3
    #Ave_degree 4.50
    ----Split statistics------'
    #Train samples 60 (default)
    #Val samples 500 (default)
    #Test samples 1000 (default)
    ----label noise information:------
    Instance dependent noise
    #Actual noise rate 0.21
    [cuda:1] LNPCC waiting for GPU slot...
    [cuda:1] Slot acquired (waited 327.0s). Starting GCN...
    FINAL_RESULT: {'acc': {'train': 0.7833333333333333, 'valid': 0.598, 'test': 0.67}, 'wall_s': 32.1, 'cpu_s': 28.37, 'gpu_s': 3.67, 'wait_s': 327.02}
    [Time] wall=32.1s | cpu=28.4s | gpu=3.7s
    C:\Users\fbrev\Documents\Acadêmico\Simulações\Python\NoisyGL\predictor\Base_Predictor.py:114: UserWarning: expandable_segments not supported on this platform (Triggered internally at ..\c10/cuda/CUDAAllocatorConfig.h:28.)
    self.edge_index = self._cpu_edge_index.to(self.device)
    C:\Users\fbrev\Documents\Acadêmico\Simulações\Python\NoisyGL\predictor\Base_Predictor.py:144: UserWarning: Sparse CSR tensor support is in beta state. If you miss a functionality in the sparse tensor support, please submit a feature request to https://github.com/pytorch/pytorch/issues. (Triggered internally at ..\aten\src\ATen\SparseCsrTensorImpl.cpp:55.)
    self.adj_csr = self.adj.to_sparse_csr().to(self.device)
[I 2026-05-06 19:52:29,598] Trial 46 finished with value: 0.67 and parameters: {'lr': 0.1, 'weight_decay': 0.0001, 'n_hidden': 256, 'n_layer': 2, 'dropout': 0.20968958688095551, 'knn_mode': 's', 'k': 25, 'dexp': 9.96846054414452, 'p_grd': 0.4541468279848052, 'unc_rem': 0.8005921940276884, 'unc_rel': 0.2005476106109863}. Best is trial 3 with value: 0.731.
    [CPU] Loading pubmed...
    DEBUG 3.1: Dataset init start
    DEBUG 3.2: prepare_data start pubmed
    ----Data statistics------'
    Name: pubmed
    #Nodes 19717
    #Edges 44324
    #Classes 3
    #Ave_degree 4.50
    ----Split statistics------'
    #Train samples 60 (default)
    #Val samples 500 (default)
    #Test samples 1000 (default)
    ----label noise information:------
    Instance dependent noise
    #Actual noise rate 0.21
    [cuda:1] LNPCC waiting for GPU slot...
    [cuda:1] Slot acquired (waited 487.1s). Starting GCN...
    FINAL_RESULT: {'acc': {'train': 0.8166666666666667, 'valid': 0.604, 'test': 0.649}, 'wall_s': 30.39, 'cpu_s': 27.21, 'gpu_s': 3.12, 'wait_s': 487.14}
    [Time] wall=30.4s | cpu=27.2s | gpu=3.1s
    C:\Users\fbrev\Documents\Acadêmico\Simulações\Python\NoisyGL\predictor\Base_Predictor.py:114: UserWarning: expandable_segments not supported on this platform (Triggered internally at ..\c10/cuda/CUDAAllocatorConfig.h:28.)
    self.edge_index = self._cpu_edge_index.to(self.device)
    C:\Users\fbrev\Documents\Acadêmico\Simulações\Python\NoisyGL\predictor\Base_Predictor.py:144: UserWarning: Sparse CSR tensor support is in beta state. If you miss a functionality in the sparse tensor support, please submit a feature request to https://github.com/pytorch/pytorch/issues. (Triggered internally at ..\aten\src\ATen\SparseCsrTensorImpl.cpp:55.)
    self.adj_csr = self.adj.to_sparse_csr().to(self.device)
