[I 2026-04-27 02:09:13,753] Trial 61 finished with value: 0.36851237560602196 and parameters: {'lr': 0.005, 'weight_decay': 0.01, 'n_hidden': 256, 'n_layer': 3, 'dropout': 0.3478787802279837, 'knn_mode': 's', 'k': 32, 'dexp': 5.868939597058801, 'p_grd': 0.5063762113536777, 'unc_rem': 0.6068386238313787, 'unc_rel': 0.5282530684912701}. Best is trial 32 with value: 0.3997448328655269.
    [CPU] Loading amazon-ratings...
    DEBUG 3.1: Dataset init start
    DEBUG 3.2: prepare_data start amazon-ratings
    ----Data statistics------'
    Name: amazon-ratings
    #Nodes 24492
    #Edges 93050
    #Classes 5
    #Ave_degree 7.60
    ----Split statistics------'
    #Train samples 1224 (5.0 % of nodes)
    #Val samples 3673 (15.0 % of nodes)
    #Test samples 19595 (remaining)
    ----label noise information:------
    Instance dependent noise
    #Actual noise rate 0.21
    [cuda:1] LNPCC waiting for GPU slot...
    [cuda:1] Slot acquired (waited 187.9s). Starting GCN...
    FINAL_RESULT: {'acc': {'train': 0.4150326797385621, 'valid': 0.34821671658045195, 'test': 0.39698902781321765}, 'wall_s': 62.38, 'cpu_s': 54.29, 'gpu_s': 8.04, 'wait_s': 187.87}
    [Time] wall=62.4s | cpu=54.3s | gpu=8.0s
    C:\Users\fbrev\Documents\Acadêmico\Simulações\Python\NoisyGL\predictor\Base_Predictor.py:144: UserWarning: Sparse CSR tensor support is in beta state. If you miss a functionality in the sparse tensor support, please submit a feature request to https://github.com/pytorch/pytorch/issues. (Triggered internally at ..\aten\src\ATen\SparseCsrTensorImpl.cpp:55.)
    self.adj_csr = self.adj.to_sparse_csr().to(self.device)
[I 2026-04-27 02:13:29,616] Trial 62 finished with value: 0.39698902781321765 and parameters: {'lr': 0.005, 'weight_decay': 0.001, 'n_hidden': 256, 'n_layer': 3, 'dropout': 0.40980640427920934, 'knn_mode': 's', 'k': 37, 'dexp': 8.569061466111576, 'p_grd': 0.6649941905479035, 'unc_rem': 0.3487077710459462, 'unc_rel': 0.9803766902479644}. Best is trial 32 with value: 0.3997448328655269.
    [CPU] Loading amazon-ratings...
    DEBUG 3.1: Dataset init start
    DEBUG 3.2: prepare_data start amazon-ratings
    ----Data statistics------'
    Name: amazon-ratings
    #Nodes 24492
    #Edges 93050
    #Classes 5
    #Ave_degree 7.60
    ----Split statistics------'
    #Train samples 1224 (5.0 % of nodes)
    #Val samples 3673 (15.0 % of nodes)
    #Test samples 19595 (remaining)
    ----label noise information:------
    Instance dependent noise
    #Actual noise rate 0.21
    [cuda:1] LNPCC waiting for GPU slot...
    [cuda:1] Slot acquired (waited 135.1s). Starting GCN...
    FINAL_RESULT: {'acc': {'train': 0.4068627450980392, 'valid': 0.3498502586441601, 'test': 0.39734626180147997}, 'wall_s': 61.02, 'cpu_s': 52.92, 'gpu_s': 8.04, 'wait_s': 135.11}
    [Time] wall=61.0s | cpu=52.9s | gpu=8.0s
    C:\Users\fbrev\Documents\Acadêmico\Simulações\Python\NoisyGL\predictor\Base_Predictor.py:144: UserWarning: Sparse CSR tensor support is in beta state. If you miss a functionality in the sparse tensor support, please submit a feature request to https://github.com/pytorch/pytorch/issues. (Triggered internally at ..\aten\src\ATen\SparseCsrTensorImpl.cpp:55.)
    self.adj_csr = self.adj.to_sparse_csr().to(self.device)
[I 2026-04-27 02:16:51,575] Trial 63 finished with value: 0.39734626180147997 and parameters: {'lr': 0.005, 'weight_decay': 0.001, 'n_hidden': 256, 'n_layer': 3, 'dropout': 0.27563465643669893, 'knn_mode': 's', 'k': 35, 'dexp': 8.78671533435958, 'p_grd': 0.6933594372859404, 'unc_rem': 0.39812395104931464, 'unc_rel': 0.964025241068165}. Best is trial 32 with value: 0.3997448328655269.
    [CPU] Loading amazon-ratings...
    DEBUG 3.1: Dataset init start
    DEBUG 3.2: prepare_data start amazon-ratings
    ----Data statistics------'
    Name: amazon-ratings
    #Nodes 24492
    #Edges 93050
    #Classes 5
    #Ave_degree 7.60
    ----Split statistics------'
    #Train samples 1224 (5.0 % of nodes)
    #Val samples 3673 (15.0 % of nodes)
    #Test samples 19595 (remaining)
    ----label noise information:------
    Instance dependent noise
    #Actual noise rate 0.21
    [cuda:1] LNPCC waiting for GPU slot...
    [cuda:1] Slot acquired (waited 153.4s). Starting GCN...
    FINAL_RESULT: {'acc': {'train': 0.4150326797385621, 'valid': 0.34848897359106995, 'test': 0.3959173258484307}, 'wall_s': 51.59, 'cpu_s': 43.63, 'gpu_s': 7.9, 'wait_s': 153.36}
    [Time] wall=51.6s | cpu=43.6s | gpu=7.9s
    C:\Users\fbrev\Documents\Acadêmico\Simulações\Python\NoisyGL\predictor\Base_Predictor.py:144: UserWarning: Sparse CSR tensor support is in beta state. If you miss a functionality in the sparse tensor support, please submit a feature request to https://github.com/pytorch/pytorch/issues. (Triggered internally at ..\aten\src\ATen\SparseCsrTensorImpl.cpp:55.)
    self.adj_csr = self.adj.to_sparse_csr().to(self.device)
[I 2026-04-27 02:20:22,175] Trial 64 finished with value: 0.3959173258484307 and parameters: {'lr': 0.005, 'weight_decay': 0.001, 'n_hidden': 256, 'n_layer': 3, 'dropout': 0.4571523516862355, 'knn_mode': 's', 'k': 36, 'dexp': 7.869156567738017, 'p_grd': 0.6076604545202664, 'unc_rem': 0.4840165297185059, 'unc_rel': 0.42035627641173917}. Best is trial 32 with value: 0.3997448328655269.
    [CPU] Loading amazon-ratings...
    DEBUG 3.1: Dataset init start
    DEBUG 3.2: prepare_data start amazon-ratings
    ----Data statistics------'
    Name: amazon-ratings
    #Nodes 24492
    #Edges 93050
    #Classes 5
    #Ave_degree 7.60
    ----Split statistics------'
    #Train samples 1224 (5.0 % of nodes)
    #Val samples 3673 (15.0 % of nodes)
    #Test samples 19595 (remaining)
    ----label noise information:------
    Instance dependent noise
    #Actual noise rate 0.21
    [cuda:1] LNPCC waiting for GPU slot...
    [cuda:1] Slot acquired (waited 136.0s). Starting GCN...
    FINAL_RESULT: {'acc': {'train': 0.41013071895424835, 'valid': 0.3501225156547781, 'test': 0.3977545292166369}, 'wall_s': 54.44, 'cpu_s': 46.5, 'gpu_s': 7.89, 'wait_s': 136.0}
    [Time] wall=54.4s | cpu=46.5s | gpu=7.9s
    C:\Users\fbrev\Documents\Acadêmico\Simulações\Python\NoisyGL\predictor\Base_Predictor.py:144: UserWarning: Sparse CSR tensor support is in beta state. If you miss a functionality in the sparse tensor support, please submit a feature request to https://github.com/pytorch/pytorch/issues. (Triggered internally at ..\aten\src\ATen\SparseCsrTensorImpl.cpp:55.)
    self.adj_csr = self.adj.to_sparse_csr().to(self.device)
[I 2026-04-27 02:23:38,064] Trial 65 finished with value: 0.3977545292166369 and parameters: {'lr': 0.005, 'weight_decay': 0.001, 'n_hidden': 256, 'n_layer': 3, 'dropout': 0.5248035524833233, 'knn_mode': 's', 'k': 33, 'dexp': 9.749648789883597, 'p_grd': 0.6522317832128338, 'unc_rem': 0.5225925063431629, 'unc_rel': 0.9945096059903258}. Best is trial 32 with value: 0.3997448328655269.
    [CPU] Loading amazon-ratings...
    DEBUG 3.1: Dataset init start
    DEBUG 3.2: prepare_data start amazon-ratings
    ----Data statistics------'
    Name: amazon-ratings
    #Nodes 24492
    #Edges 93050
    #Classes 5
    #Ave_degree 7.60
    ----Split statistics------'
    #Train samples 1224 (5.0 % of nodes)
    #Val samples 3673 (15.0 % of nodes)
    #Test samples 19595 (remaining)
    ----label noise information:------
    Instance dependent noise
    #Actual noise rate 0.21
    [cuda:1] LNPCC waiting for GPU slot...
    [cuda:1] Slot acquired (waited 137.5s). Starting GCN...
    FINAL_RESULT: {'acc': {'train': 0.3700980392156863, 'valid': 0.34603866049550774, 'test': 0.3960704261291146}, 'wall_s': 59.54, 'cpu_s': 51.49, 'gpu_s': 7.99, 'wait_s': 137.54}
    [Time] wall=59.5s | cpu=51.5s | gpu=8.0s
    C:\Users\fbrev\Documents\Acadêmico\Simulações\Python\NoisyGL\predictor\Base_Predictor.py:144: UserWarning: Sparse CSR tensor support is in beta state. If you miss a functionality in the sparse tensor support, please submit a feature request to https://github.com/pytorch/pytorch/issues. (Triggered internally at ..\aten\src\ATen\SparseCsrTensorImpl.cpp:55.)
    self.adj_csr = self.adj.to_sparse_csr().to(self.device)
[I 2026-04-27 02:27:00,526] Trial 66 finished with value: 0.3960704261291146 and parameters: {'lr': 0.01, 'weight_decay': 0.001, 'n_hidden': 256, 'n_layer': 3, 'dropout': 0.3789668850828822, 'knn_mode': 's', 'k': 41, 'dexp': 9.052311547906726, 'p_grd': 0.7104210064680689, 'unc_rem': 0.3170207529860386, 'unc_rel': 0.9074561383061281}. Best is trial 32 with value: 0.3997448328655269.
    [CPU] Loading amazon-ratings...
    DEBUG 3.1: Dataset init start
    DEBUG 3.2: prepare_data start amazon-ratings
    ----Data statistics------'
    Name: amazon-ratings
    #Nodes 24492
    #Edges 93050
    #Classes 5
    #Ave_degree 7.60
    ----Split statistics------'
    #Train samples 1224 (5.0 % of nodes)
    #Val samples 3673 (15.0 % of nodes)
    #Test samples 19595 (remaining)
    ----label noise information:------
    Instance dependent noise
    #Actual noise rate 0.21
    [cuda:1] LNPCC waiting for GPU slot...
    [cuda:1] Slot acquired (waited 141.3s). Starting GCN...
    FINAL_RESULT: {'acc': {'train': 0.4186426819296811, 'valid': 0.3419548053362374, 'test': 0.3898443480479714}, 'wall_s': 41.55, 'cpu_s': 39.74, 'gpu_s': 1.76, 'wait_s': 141.32}
    [Time] wall=41.6s | cpu=39.7s | gpu=1.8s
    C:\Users\fbrev\Documents\Acadêmico\Simulações\Python\NoisyGL\predictor\Base_Predictor.py:144: UserWarning: Sparse CSR tensor support is in beta state. If you miss a functionality in the sparse tensor support, please submit a feature request to https://github.com/pytorch/pytorch/issues. (Triggered internally at ..\aten\src\ATen\SparseCsrTensorImpl.cpp:55.)
    self.adj_csr = self.adj.to_sparse_csr().to(self.device)
[I 2026-04-27 02:30:08,712] Trial 67 finished with value: 0.3898443480479714 and parameters: {'lr': 0.005, 'weight_decay': 0.001, 'n_hidden': 32, 'n_layer': 2, 'dropout': 0.32619417586438587, 'knn_mode': 's', 'k': 29, 'dexp': 7.437720177320277, 'p_grd': 0.529871681250615, 'unc_rem': 0.44848628662447604, 'unc_rel': 0.9344757592355866}. Best is trial 32 with value: 0.3997448328655269.
    [CPU] Loading amazon-ratings...
    DEBUG 3.1: Dataset init start
    DEBUG 3.2: prepare_data start amazon-ratings
    ----Data statistics------'
    Name: amazon-ratings
    #Nodes 24492
    #Edges 93050
    #Classes 5
    #Ave_degree 7.60
    ----Split statistics------'
    #Train samples 1224 (5.0 % of nodes)
    #Val samples 3673 (15.0 % of nodes)
    #Test samples 19595 (remaining)
    ----label noise information:------
    Instance dependent noise
    #Actual noise rate 0.21
    [cuda:1] LNPCC waiting for GPU slot...
    [cuda:1] Slot acquired (waited 135.0s). Starting GCN...
    FINAL_RESULT: {'acc': {'train': 0.47583947583947583, 'valid': 0.34603866049550774, 'test': 0.3814238326103598}, 'wall_s': 58.43, 'cpu_s': 50.54, 'gpu_s': 7.84, 'wait_s': 135.0}
    [Time] wall=58.4s | cpu=50.5s | gpu=7.8s
    C:\Users\fbrev\Documents\Acadêmico\Simulações\Python\NoisyGL\predictor\Base_Predictor.py:144: UserWarning: Sparse CSR tensor support is in beta state. If you miss a functionality in the sparse tensor support, please submit a feature request to https://github.com/pytorch/pytorch/issues. (Triggered internally at ..\aten\src\ATen\SparseCsrTensorImpl.cpp:55.)
    self.adj_csr = self.adj.to_sparse_csr().to(self.device)
[I 2026-04-27 02:33:27,345] Trial 68 finished with value: 0.3814238326103598 and parameters: {'lr': 0.005, 'weight_decay': 0.0001, 'n_hidden': 256, 'n_layer': 3, 'dropout': 0.30258065416468694, 'knn_mode': 'd', 'k': 38, 'dexp': 6.767200156061221, 'p_grd': 0.455340947712802, 'unc_rem': 0.41435842203075546, 'unc_rel': 0.2926468841968068}. Best is trial 32 with value: 0.3997448328655269.
    [CPU] Loading amazon-ratings...
    DEBUG 3.1: Dataset init start
    DEBUG 3.2: prepare_data start amazon-ratings
    ----Data statistics------'
    Name: amazon-ratings
    #Nodes 24492
    #Edges 93050
    #Classes 5
    #Ave_degree 7.60
    ----Split statistics------'
    #Train samples 1224 (5.0 % of nodes)
    #Val samples 3673 (15.0 % of nodes)
    #Test samples 19595 (remaining)
    ----label noise information:------
    Instance dependent noise
    #Actual noise rate 0.21
    [cuda:1] LNPCC waiting for GPU slot...
    [cuda:1] Slot acquired (waited 136.9s). Starting GCN...
    FINAL_RESULT: {'acc': {'train': 0.40931372549019607, 'valid': 0.35039477266539615, 'test': 0.39561112528706305}, 'wall_s': 51.41, 'cpu_s': 43.48, 'gpu_s': 7.88, 'wait_s': 136.89}
    [Time] wall=51.4s | cpu=43.5s | gpu=7.9s
    C:\Users\fbrev\Documents\Acadêmico\Simulações\Python\NoisyGL\predictor\Base_Predictor.py:144: UserWarning: Sparse CSR tensor support is in beta state. If you miss a functionality in the sparse tensor support, please submit a feature request to https://github.com/pytorch/pytorch/issues. (Triggered internally at ..\aten\src\ATen\SparseCsrTensorImpl.cpp:55.)
    self.adj_csr = self.adj.to_sparse_csr().to(self.device)
[I 2026-04-27 02:36:40,891] Trial 69 finished with value: 0.39561112528706305 and parameters: {'lr': 0.005, 'weight_decay': 0.001, 'n_hidden': 256, 'n_layer': 3, 'dropout': 0.39882338236768605, 'knn_mode': 's', 'k': 26, 'dexp': 8.104792552841097, 'p_grd': 0.5912303778592958, 'unc_rem': 0.5663143292228723, 'unc_rel': 0.7833642640084191}. Best is trial 32 with value: 0.3997448328655269.
    [CPU] Loading amazon-ratings...
    DEBUG 3.1: Dataset init start
    DEBUG 3.2: prepare_data start amazon-ratings
    ----Data statistics------'
    Name: amazon-ratings
    #Nodes 24492
    #Edges 93050
    #Classes 5
    #Ave_degree 7.60
    ----Split statistics------'
    #Train samples 1224 (5.0 % of nodes)
    #Val samples 3673 (15.0 % of nodes)
    #Test samples 19595 (remaining)
    ----label noise information:------
    Instance dependent noise
    #Actual noise rate 0.21
    [cuda:1] LNPCC waiting for GPU slot...
    [cuda:1] Slot acquired (waited 139.8s). Starting GCN...
    FINAL_RESULT: {'acc': {'train': 0.2949346405228758, 'valid': 0.3117342771576368, 'test': 0.36851237560602196}, 'wall_s': 47.52, 'cpu_s': 42.78, 'gpu_s': 4.7, 'wait_s': 139.83}
    [Time] wall=47.5s | cpu=42.8s | gpu=4.7s
    C:\Users\fbrev\Documents\Acadêmico\Simulações\Python\NoisyGL\predictor\Base_Predictor.py:144: UserWarning: Sparse CSR tensor support is in beta state. If you miss a functionality in the sparse tensor support, please submit a feature request to https://github.com/pytorch/pytorch/issues. (Triggered internally at ..\aten\src\ATen\SparseCsrTensorImpl.cpp:55.)
    self.adj_csr = self.adj.to_sparse_csr().to(self.device)
[I 2026-04-27 02:39:53,666] Trial 70 finished with value: 0.36851237560602196 and parameters: {'lr': 0.1, 'weight_decay': 0.05, 'n_hidden': 128, 'n_layer': 3, 'dropout': 0.25176261369581054, 'knn_mode': 's', 'k': 23, 'dexp': 6.418140800798314, 'p_grd': 0.6244612363386217, 'unc_rem': 0.3743550404491587, 'unc_rel': 0.8599678073120739}. Best is trial 32 with value: 0.3997448328655269.
    [CPU] Loading amazon-ratings...
    DEBUG 3.1: Dataset init start
    DEBUG 3.2: prepare_data start amazon-ratings
    ----Data statistics------'
    Name: amazon-ratings
    #Nodes 24492
    #Edges 93050
    #Classes 5
    #Ave_degree 7.60
    ----Split statistics------'
    #Train samples 1224 (5.0 % of nodes)
    #Val samples 3673 (15.0 % of nodes)
    #Test samples 19595 (remaining)
    ----label noise information:------
    Instance dependent noise
    #Actual noise rate 0.21
    [cuda:1] LNPCC waiting for GPU slot...
    [cuda:1] Slot acquired (waited 127.8s). Starting GCN...
    FINAL_RESULT: {'acc': {'train': 0.375, 'valid': 0.3468554315273618, 'test': 0.39693799438632305}, 'wall_s': 61.94, 'cpu_s': 54.0, 'gpu_s': 7.9, 'wait_s': 127.83}
    [Time] wall=61.9s | cpu=54.0s | gpu=7.9s
    C:\Users\fbrev\Documents\Acadêmico\Simulações\Python\NoisyGL\predictor\Base_Predictor.py:144: UserWarning: Sparse CSR tensor support is in beta state. If you miss a functionality in the sparse tensor support, please submit a feature request to https://github.com/pytorch/pytorch/issues. (Triggered internally at ..\aten\src\ATen\SparseCsrTensorImpl.cpp:55.)
    self.adj_csr = self.adj.to_sparse_csr().to(self.device)
[I 2026-04-27 02:43:08,842] Trial 71 finished with value: 0.39693799438632305 and parameters: {'lr': 0.01, 'weight_decay': 0.001, 'n_hidden': 256, 'n_layer': 3, 'dropout': 0.3629723332318367, 'knn_mode': 's', 'k': 33, 'dexp': 5.286721502512041, 'p_grd': 0.8478955132287975, 'unc_rem': 0.2978325827173624, 'unc_rel': 0.6760290579383893}. Best is trial 32 with value: 0.3997448328655269.
    [CPU] Loading amazon-ratings...
    DEBUG 3.1: Dataset init start
    DEBUG 3.2: prepare_data start amazon-ratings
    ----Data statistics------'
    Name: amazon-ratings
    #Nodes 24492
    #Edges 93050
    #Classes 5
    #Ave_degree 7.60
    ----Split statistics------'
    #Train samples 1224 (5.0 % of nodes)
    #Val samples 3673 (15.0 % of nodes)
    #Test samples 19595 (remaining)
    ----label noise information:------
    Instance dependent noise
    #Actual noise rate 0.21
    [cuda:1] LNPCC waiting for GPU slot...
    [cuda:1] Slot acquired (waited 141.9s). Starting GCN...
    FINAL_RESULT: {'acc': {'train': 0.40931372549019607, 'valid': 0.3495780016335421, 'test': 0.39709109466700687}, 'wall_s': 53.2, 'cpu_s': 45.24, 'gpu_s': 7.9, 'wait_s': 141.88}
    [Time] wall=53.2s | cpu=45.2s | gpu=7.9s
    C:\Users\fbrev\Documents\Acadêmico\Simulações\Python\NoisyGL\predictor\Base_Predictor.py:144: UserWarning: Sparse CSR tensor support is in beta state. If you miss a functionality in the sparse tensor support, please submit a feature request to https://github.com/pytorch/pytorch/issues. (Triggered internally at ..\aten\src\ATen\SparseCsrTensorImpl.cpp:55.)
    self.adj_csr = self.adj.to_sparse_csr().to(self.device)
[I 2026-04-27 02:46:29,370] Trial 72 finished with value: 0.39709109466700687 and parameters: {'lr': 0.005, 'weight_decay': 0.001, 'n_hidden': 256, 'n_layer': 3, 'dropout': 0.5301673746271789, 'knn_mode': 's', 'k': 34, 'dexp': 9.557414979704994, 'p_grd': 0.6518279992639787, 'unc_rem': 0.5227357253720949, 'unc_rel': 0.9980079490867297}. Best is trial 32 with value: 0.3997448328655269.
    [CPU] Loading amazon-ratings...
    DEBUG 3.1: Dataset init start
    DEBUG 3.2: prepare_data start amazon-ratings
    ----Data statistics------'
    Name: amazon-ratings
    #Nodes 24492
    #Edges 93050
    #Classes 5
    #Ave_degree 7.60
    ----Split statistics------'
    #Train samples 1224 (5.0 % of nodes)
    #Val samples 3673 (15.0 % of nodes)
    #Test samples 19595 (remaining)
    ----label noise information:------
    Instance dependent noise
    #Actual noise rate 0.21
    [cuda:1] LNPCC waiting for GPU slot...
    [cuda:1] Slot acquired (waited 152.1s). Starting GCN...
    FINAL_RESULT: {'acc': {'train': 0.44199346405228757, 'valid': 0.3471276885379799, 'test': 0.39050778259760144}, 'wall_s': 37.87, 'cpu_s': 29.93, 'gpu_s': 7.9, 'wait_s': 152.08}
    [Time] wall=37.9s | cpu=29.9s | gpu=7.9s
    C:\Users\fbrev\Documents\Acadêmico\Simulações\Python\NoisyGL\predictor\Base_Predictor.py:144: UserWarning: Sparse CSR tensor support is in beta state. If you miss a functionality in the sparse tensor support, please submit a feature request to https://github.com/pytorch/pytorch/issues. (Triggered internally at ..\aten\src\ATen\SparseCsrTensorImpl.cpp:55.)
    self.adj_csr = self.adj.to_sparse_csr().to(self.device)
[I 2026-04-27 02:49:44,570] Trial 73 finished with value: 0.39050778259760144 and parameters: {'lr': 0.005, 'weight_decay': 0.001, 'n_hidden': 256, 'n_layer': 3, 'dropout': 0.46366128188687805, 'knn_mode': 's', 'k': 33, 'dexp': 9.768654297101126, 'p_grd': 0.6712724595066905, 'unc_rem': 0.5053631779829983, 'unc_rel': 0.9709760326622768}. Best is trial 32 with value: 0.3997448328655269.
    [CPU] Loading amazon-ratings...
    DEBUG 3.1: Dataset init start
    DEBUG 3.2: prepare_data start amazon-ratings
    ----Data statistics------'
    Name: amazon-ratings
    #Nodes 24492
    #Edges 93050
    #Classes 5
    #Ave_degree 7.60
    ----Split statistics------'
    #Train samples 1224 (5.0 % of nodes)
    #Val samples 3673 (15.0 % of nodes)
    #Test samples 19595 (remaining)
    ----label noise information:------
    Instance dependent noise
    #Actual noise rate 0.21
    [cuda:1] LNPCC waiting for GPU slot...
    [cuda:1] Slot acquired (waited 140.6s). Starting GCN...
    FINAL_RESULT: {'acc': {'train': 0.4223856209150327, 'valid': 0.34821671658045195, 'test': 0.39530492472569534}, 'wall_s': 47.87, 'cpu_s': 39.95, 'gpu_s': 7.87, 'wait_s': 140.62}
    [Time] wall=47.9s | cpu=39.9s | gpu=7.9s
    C:\Users\fbrev\Documents\Acadêmico\Simulações\Python\NoisyGL\predictor\Base_Predictor.py:144: UserWarning: Sparse CSR tensor support is in beta state. If you miss a functionality in the sparse tensor support, please submit a feature request to https://github.com/pytorch/pytorch/issues. (Triggered internally at ..\aten\src\ATen\SparseCsrTensorImpl.cpp:55.)
    self.adj_csr = self.adj.to_sparse_csr().to(self.device)
