[I 2026-05-03 23:03:34,586] Trial 43 finished with value: 0.32395382395382394 and parameters: {'lr': 0.005, 'weight_decay': 0.001, 'n_hidden': 64, 'n_layer': 2, 'dropout': 0.548009480260564, 'knn_mode': 'd', 'k': 43, 'dexp': 6.28333527206699, 'p_grd': 0.9578438613745442, 'unc_rem': 0.0046355881439061886, 'unc_rel': 0.4004313628402819}. Best is trial 23 with value: 0.7061087061087061.
    [CPU] Loading blogcatalog...
    DEBUG 3.1: Dataset init start
    DEBUG 3.2: prepare_data start blogcatalog
    ----Data statistics------'
    Name: blogcatalog
    #Nodes 5196
    #Edges 171743
    #Classes 6
    #Ave_degree 66.11
    ----Split statistics------'
    #Train samples 259 (5.0 % of nodes)
    #Val samples 779 (15.0 % of nodes)
    #Test samples 4158 (remaining)
    ----label noise information:------
    Instance dependent noise
    #Actual noise rate 0.40
    [cuda:1] LNPCC waiting for GPU slot...
    [cuda:1] Slot acquired (waited 24.8s). Starting GCN...
    FINAL_RESULT: {'acc': {'train': 0.5298804780876494, 'valid': 0.4557124518613607, 'test': 0.6741221741221741}, 'wall_s': 58.2, 'cpu_s': 54.9, 'gpu_s': 3.2, 'wait_s': 24.84}
    [Time] wall=58.2s | cpu=54.9s | gpu=3.2s
    C:\Users\fbrev\Documents\Acadêmico\Simulações\Python\NoisyGL\predictor\Base_Predictor.py:114: UserWarning: expandable_segments not supported on this platform (Triggered internally at ..\c10/cuda/CUDAAllocatorConfig.h:28.)
    self.edge_index = self._cpu_edge_index.to(self.device)
    C:\Users\fbrev\Documents\Acadêmico\Simulações\Python\NoisyGL\predictor\Base_Predictor.py:144: UserWarning: Sparse CSR tensor support is in beta state. If you miss a functionality in the sparse tensor support, please submit a feature request to https://github.com/pytorch/pytorch/issues. (Triggered internally at ..\aten\src\ATen\SparseCsrTensorImpl.cpp:55.)
    self.adj_csr = self.adj.to_sparse_csr().to(self.device)
[I 2026-05-03 23:05:04,709] Trial 44 finished with value: 0.6741221741221741 and parameters: {'lr': 0.005, 'weight_decay': 0.001, 'n_hidden': 64, 'n_layer': 2, 'dropout': 0.4720313844945254, 'knn_mode': 'd', 'k': 48, 'dexp': 4.585819509417051, 'p_grd': 0.9227060339520463, 'unc_rem': 0.0973965105264179, 'unc_rel': 0.2385602922793125}. Best is trial 23 with value: 0.7061087061087061.
    [CPU] Loading blogcatalog...
    DEBUG 3.1: Dataset init start
    DEBUG 3.2: prepare_data start blogcatalog
    ----Data statistics------'
    Name: blogcatalog
    #Nodes 5196
    #Edges 171743
    #Classes 6
    #Ave_degree 66.11
    ----Split statistics------'
    #Train samples 259 (5.0 % of nodes)
    #Val samples 779 (15.0 % of nodes)
    #Test samples 4158 (remaining)
    ----label noise information:------
    Instance dependent noise
    #Actual noise rate 0.40
    [cuda:1] LNPCC waiting for GPU slot...
    [cuda:1] Slot acquired (waited 121.8s). Starting GCN...
    FINAL_RESULT: {'acc': {'train': 0.6023166023166023, 'valid': 0.45699614890885754, 'test': 0.6832611832611832}, 'wall_s': 33.72, 'cpu_s': 29.11, 'gpu_s': 4.52, 'wait_s': 121.82}
    [Time] wall=33.7s | cpu=29.1s | gpu=4.5s
    C:\Users\fbrev\Documents\Acadêmico\Simulações\Python\NoisyGL\predictor\Base_Predictor.py:114: UserWarning: expandable_segments not supported on this platform (Triggered internally at ..\c10/cuda/CUDAAllocatorConfig.h:28.)
    self.edge_index = self._cpu_edge_index.to(self.device)
    C:\Users\fbrev\Documents\Acadêmico\Simulações\Python\NoisyGL\predictor\Base_Predictor.py:144: UserWarning: Sparse CSR tensor support is in beta state. If you miss a functionality in the sparse tensor support, please submit a feature request to https://github.com/pytorch/pytorch/issues. (Triggered internally at ..\aten\src\ATen\SparseCsrTensorImpl.cpp:55.)
    self.adj_csr = self.adj.to_sparse_csr().to(self.device)
[I 2026-05-03 23:07:46,072] Trial 45 finished with value: 0.6832611832611832 and parameters: {'lr': 0.005, 'weight_decay': 0.001, 'n_hidden': 128, 'n_layer': 2, 'dropout': 0.34601938559844964, 'knn_mode': 'd', 'k': 39, 'dexp': 6.982349519033988, 'p_grd': 0.8336184720085613, 'unc_rem': 0.33197759716420794, 'unc_rel': 0.32347429486591955}. Best is trial 23 with value: 0.7061087061087061.
    [CPU] Loading blogcatalog...
    DEBUG 3.1: Dataset init start
    DEBUG 3.2: prepare_data start blogcatalog
    ----Data statistics------'
    Name: blogcatalog
    #Nodes 5196
    #Edges 171743
    #Classes 6
    #Ave_degree 66.11
    ----Split statistics------'
    #Train samples 259 (5.0 % of nodes)
    #Val samples 779 (15.0 % of nodes)
    #Test samples 4158 (remaining)
    ----label noise information:------
    Instance dependent noise
    #Actual noise rate 0.40
    [cuda:1] LNPCC waiting for GPU slot...
    [cuda:1] Slot acquired (waited 33.3s). Starting GCN...
    FINAL_RESULT: {'acc': {'train': 0.625, 'valid': 0.2811296534017972, 'test': 0.3602693602693603}, 'wall_s': 39.3, 'cpu_s': 35.97, 'gpu_s': 3.23, 'wait_s': 33.3}
    [Time] wall=39.3s | cpu=36.0s | gpu=3.2s
    C:\Users\fbrev\Documents\Acadêmico\Simulações\Python\NoisyGL\predictor\Base_Predictor.py:114: UserWarning: expandable_segments not supported on this platform (Triggered internally at ..\c10/cuda/CUDAAllocatorConfig.h:28.)
    self.edge_index = self._cpu_edge_index.to(self.device)
    C:\Users\fbrev\Documents\Acadêmico\Simulações\Python\NoisyGL\predictor\Base_Predictor.py:144: UserWarning: Sparse CSR tensor support is in beta state. If you miss a functionality in the sparse tensor support, please submit a feature request to https://github.com/pytorch/pytorch/issues. (Triggered internally at ..\aten\src\ATen\SparseCsrTensorImpl.cpp:55.)
    self.adj_csr = self.adj.to_sparse_csr().to(self.device)
[I 2026-05-03 23:09:04,725] Trial 46 finished with value: 0.3602693602693603 and parameters: {'lr': 0.1, 'weight_decay': 0.0, 'n_hidden': 64, 'n_layer': 2, 'dropout': 0.39524108219763987, 'knn_mode': 'd', 'k': 33, 'dexp': 0.30168301608069026, 'p_grd': 0.6822898170875535, 'unc_rem': 0.8005921940276884, 'unc_rel': 0.03435733092812257}. Best is trial 23 with value: 0.7061087061087061.
    [CPU] Loading blogcatalog...
    DEBUG 3.1: Dataset init start
    DEBUG 3.2: prepare_data start blogcatalog
    ----Data statistics------'
    Name: blogcatalog
    #Nodes 5196
    #Edges 171743
    #Classes 6
    #Ave_degree 66.11
    ----Split statistics------'
    #Train samples 259 (5.0 % of nodes)
    #Val samples 779 (15.0 % of nodes)
    #Test samples 4158 (remaining)
    ----label noise information:------
    Instance dependent noise
    #Actual noise rate 0.40
    [cuda:1] LNPCC waiting for GPU slot...
    [cuda:1] Slot acquired (waited 31.5s). Starting GCN...
    FINAL_RESULT: {'acc': {'train': 0.4779116465863454, 'valid': 0.42362002567394097, 'test': 0.6087061087061088}, 'wall_s': 35.09, 'cpu_s': 31.51, 'gpu_s': 3.48, 'wait_s': 31.54}
    [Time] wall=35.1s | cpu=31.5s | gpu=3.5s
    C:\Users\fbrev\Documents\Acadêmico\Simulações\Python\NoisyGL\predictor\Base_Predictor.py:114: UserWarning: expandable_segments not supported on this platform (Triggered internally at ..\c10/cuda/CUDAAllocatorConfig.h:28.)
    self.edge_index = self._cpu_edge_index.to(self.device)
    C:\Users\fbrev\Documents\Acadêmico\Simulações\Python\NoisyGL\predictor\Base_Predictor.py:144: UserWarning: Sparse CSR tensor support is in beta state. If you miss a functionality in the sparse tensor support, please submit a feature request to https://github.com/pytorch/pytorch/issues. (Triggered internally at ..\aten\src\ATen\SparseCsrTensorImpl.cpp:55.)
    self.adj_csr = self.adj.to_sparse_csr().to(self.device)
[I 2026-05-03 23:10:16,895] Trial 47 finished with value: 0.6087061087061088 and parameters: {'lr': 0.01, 'weight_decay': 0.01, 'n_hidden': 64, 'n_layer': 2, 'dropout': 0.5906899959040286, 'knn_mode': 'd', 'k': 25, 'dexp': 1.250520031882763, 'p_grd': 0.5544796725543416, 'unc_rem': 0.2186858087650005, 'unc_rel': 0.1956216642296179}. Best is trial 23 with value: 0.7061087061087061.
    [CPU] Loading blogcatalog...
    DEBUG 3.1: Dataset init start
    DEBUG 3.2: prepare_data start blogcatalog
    ----Data statistics------'
    Name: blogcatalog
    #Nodes 5196
    #Edges 171743
    #Classes 6
    #Ave_degree 66.11
    ----Split statistics------'
    #Train samples 259 (5.0 % of nodes)
    #Val samples 779 (15.0 % of nodes)
    #Test samples 4158 (remaining)
    ----label noise information:------
    Instance dependent noise
    #Actual noise rate 0.40
    [cuda:1] LNPCC waiting for GPU slot...
    [cuda:1] Slot acquired (waited 39.4s). Starting GCN...
    FINAL_RESULT: {'acc': {'train': 0.49609375, 'valid': 0.4595635430038511, 'test': 0.6765271765271765}, 'wall_s': 37.53, 'cpu_s': 30.25, 'gpu_s': 7.18, 'wait_s': 39.41}
    [Time] wall=37.5s | cpu=30.2s | gpu=7.2s
    C:\Users\fbrev\Documents\Acadêmico\Simulações\Python\NoisyGL\predictor\Base_Predictor.py:114: UserWarning: expandable_segments not supported on this platform (Triggered internally at ..\c10/cuda/CUDAAllocatorConfig.h:28.)
    self.edge_index = self._cpu_edge_index.to(self.device)
    C:\Users\fbrev\Documents\Acadêmico\Simulações\Python\NoisyGL\predictor\Base_Predictor.py:144: UserWarning: Sparse CSR tensor support is in beta state. If you miss a functionality in the sparse tensor support, please submit a feature request to https://github.com/pytorch/pytorch/issues. (Triggered internally at ..\aten\src\ATen\SparseCsrTensorImpl.cpp:55.)
    self.adj_csr = self.adj.to_sparse_csr().to(self.device)
[I 2026-05-03 23:11:39,473] Trial 48 finished with value: 0.6765271765271765 and parameters: {'lr': 0.005, 'weight_decay': 0.001, 'n_hidden': 256, 'n_layer': 2, 'dropout': 0.5201683322724233, 'knn_mode': 'd', 'k': 44, 'dexp': 8.52943853110955, 'p_grd': 0.7890324936043176, 'unc_rem': 0.12877573120856337, 'unc_rel': 0.25962732778244135}. Best is trial 23 with value: 0.7061087061087061.
    [CPU] Loading blogcatalog...
    DEBUG 3.1: Dataset init start
    DEBUG 3.2: prepare_data start blogcatalog
    ----Data statistics------'
    Name: blogcatalog
    #Nodes 5196
    #Edges 171743
    #Classes 6
    #Ave_degree 66.11
    ----Split statistics------'
    #Train samples 259 (5.0 % of nodes)
    #Val samples 779 (15.0 % of nodes)
    #Test samples 4158 (remaining)
    ----label noise information:------
    Instance dependent noise
    #Actual noise rate 0.40
    [cuda:1] LNPCC waiting for GPU slot...
    [cuda:1] Slot acquired (waited 42.2s). Starting GCN...
    FINAL_RESULT: {'acc': {'train': 0.5679012345679012, 'valid': 0.45699614890885754, 'test': 0.6861471861471862}, 'wall_s': 33.26, 'cpu_s': 30.58, 'gpu_s': 2.58, 'wait_s': 42.16}
    [Time] wall=33.3s | cpu=30.6s | gpu=2.6s
    C:\Users\fbrev\Documents\Acadêmico\Simulações\Python\NoisyGL\predictor\Base_Predictor.py:114: UserWarning: expandable_segments not supported on this platform (Triggered internally at ..\c10/cuda/CUDAAllocatorConfig.h:28.)
    self.edge_index = self._cpu_edge_index.to(self.device)
    C:\Users\fbrev\Documents\Acadêmico\Simulações\Python\NoisyGL\predictor\Base_Predictor.py:144: UserWarning: Sparse CSR tensor support is in beta state. If you miss a functionality in the sparse tensor support, please submit a feature request to https://github.com/pytorch/pytorch/issues. (Triggered internally at ..\aten\src\ATen\SparseCsrTensorImpl.cpp:55.)
    self.adj_csr = self.adj.to_sparse_csr().to(self.device)
