[I 2026-05-05 17:02:53,715] Trial 105 finished with value: 0.7109931460825157 and parameters: {'lr': 0.001, 'weight_decay': 0.0001, 'n_hidden': 64, 'n_layer': 3, 'dropout': 0.7280169850978089, 'knn_mode': 's', 'k': 27, 'dexp': 2.6989487343212772, 'p_grd': 0.08413288732637102, 'unc_rem': 0.6126161442760574, 'unc_rel': 0.05698715074746014}. Best is trial 95 with value: 0.7595081306276038.
    [CPU] Loading dblp...
    DEBUG 3.1: Dataset init start
    DEBUG 3.2: prepare_data start dblp
    ----Data statistics------'
    Name: dblp
    #Nodes 17716
    #Edges 52867
    #Classes 4
    #Ave_degree 5.97
    ----Split statistics------'
    #Train samples 177 (1.0 % of nodes)
    #Val samples 2657 (15.0 % of nodes)
    #Test samples 14882 (remaining)
    ----label noise information:------
    Instance dependent noise
    #Actual noise rate 0.30
    [cuda:1] LNPCC waiting for GPU slot...
    [cuda:1] Slot acquired (waited 334.6s). Starting GCN...
    FINAL_RESULT: {'acc': {'train': 0.7965116279069767, 'valid': 0.5333082423786225, 'test': 0.7197285311114098}, 'wall_s': 44.75, 'cpu_s': 41.1, 'gpu_s': 3.55, 'wait_s': 334.57}
    [Time] wall=44.7s | cpu=41.1s | gpu=3.5s
    C:\Users\fbrev\Documents\Acadêmico\Simulações\Python\NoisyGL\predictor\Base_Predictor.py:114: UserWarning: expandable_segments not supported on this platform (Triggered internally at ..\c10/cuda/CUDAAllocatorConfig.h:28.)
    self.edge_index = self._cpu_edge_index.to(self.device)
    C:\Users\fbrev\Documents\Acadêmico\Simulações\Python\NoisyGL\predictor\Base_Predictor.py:144: UserWarning: Sparse CSR tensor support is in beta state. If you miss a functionality in the sparse tensor support, please submit a feature request to https://github.com/pytorch/pytorch/issues. (Triggered internally at ..\aten\src\ATen\SparseCsrTensorImpl.cpp:55.)
    self.adj_csr = self.adj.to_sparse_csr().to(self.device)
[I 2026-05-05 17:09:19,454] Trial 106 finished with value: 0.7197285311114098 and parameters: {'lr': 0.001, 'weight_decay': 0.0001, 'n_hidden': 64, 'n_layer': 3, 'dropout': 0.6588366657220377, 'knn_mode': 's', 'k': 29, 'dexp': 3.3743227275726864, 'p_grd': 0.2648287481151337, 'unc_rem': 0.20505790991024891, 'unc_rel': 0.5597518171297509}. Best is trial 95 with value: 0.7595081306276038.
    [CPU] Loading dblp...
    DEBUG 3.1: Dataset init start
    DEBUG 3.2: prepare_data start dblp
    ----Data statistics------'
    Name: dblp
    #Nodes 17716
    #Edges 52867
    #Classes 4
    #Ave_degree 5.97
    ----Split statistics------'
    #Train samples 177 (1.0 % of nodes)
    #Val samples 2657 (15.0 % of nodes)
    #Test samples 14882 (remaining)
    ----label noise information:------
    Instance dependent noise
    #Actual noise rate 0.30
    [cuda:1] LNPCC waiting for GPU slot...
    [cuda:1] Slot acquired (waited 515.6s). Starting GCN...
    FINAL_RESULT: {'acc': {'train': 0.924812030075188, 'valid': 0.5314264207753105, 'test': 0.7224835371589841}, 'wall_s': 41.1, 'cpu_s': 37.65, 'gpu_s': 3.29, 'wait_s': 515.57}
    [Time] wall=41.1s | cpu=37.7s | gpu=3.3s
    C:\Users\fbrev\Documents\Acadêmico\Simulações\Python\NoisyGL\predictor\Base_Predictor.py:114: UserWarning: expandable_segments not supported on this platform (Triggered internally at ..\c10/cuda/CUDAAllocatorConfig.h:28.)
    self.edge_index = self._cpu_edge_index.to(self.device)
    C:\Users\fbrev\Documents\Acadêmico\Simulações\Python\NoisyGL\predictor\Base_Predictor.py:144: UserWarning: Sparse CSR tensor support is in beta state. If you miss a functionality in the sparse tensor support, please submit a feature request to https://github.com/pytorch/pytorch/issues. (Triggered internally at ..\aten\src\ATen\SparseCsrTensorImpl.cpp:55.)
    self.adj_csr = self.adj.to_sparse_csr().to(self.device)
[I 2026-05-05 17:18:42,740] Trial 107 finished with value: 0.7224835371589841 and parameters: {'lr': 0.001, 'weight_decay': 0.0001, 'n_hidden': 64, 'n_layer': 3, 'dropout': 0.6234085396556226, 'knn_mode': 's', 'k': 36, 'dexp': 1.4268638147769686, 'p_grd': 0.04212110132419908, 'unc_rem': 0.27982430509872874, 'unc_rel': 0.0013850170864135036}. Best is trial 95 with value: 0.7595081306276038.
    [CPU] Loading dblp...
    DEBUG 3.1: Dataset init start
    DEBUG 3.2: prepare_data start dblp
    ----Data statistics------'
    Name: dblp
    #Nodes 17716
    #Edges 52867
    #Classes 4
    #Ave_degree 5.97
    ----Split statistics------'
    #Train samples 177 (1.0 % of nodes)
    #Val samples 2657 (15.0 % of nodes)
    #Test samples 14882 (remaining)
    ----label noise information:------
    Instance dependent noise
    #Actual noise rate 0.30
    [cuda:1] LNPCC waiting for GPU slot...
    [cuda:1] Slot acquired (waited 153.1s). Starting GCN...
    FINAL_RESULT: {'acc': {'train': 0.8451612903225807, 'valid': 0.5513737297704178, 'test': 0.7520494557183174}, 'wall_s': 36.92, 'cpu_s': 33.4, 'gpu_s': 3.43, 'wait_s': 153.11}
    [Time] wall=36.9s | cpu=33.4s | gpu=3.4s
    C:\Users\fbrev\Documents\Acadêmico\Simulações\Python\NoisyGL\predictor\Base_Predictor.py:114: UserWarning: expandable_segments not supported on this platform (Triggered internally at ..\c10/cuda/CUDAAllocatorConfig.h:28.)
    self.edge_index = self._cpu_edge_index.to(self.device)
    C:\Users\fbrev\Documents\Acadêmico\Simulações\Python\NoisyGL\predictor\Base_Predictor.py:144: UserWarning: Sparse CSR tensor support is in beta state. If you miss a functionality in the sparse tensor support, please submit a feature request to https://github.com/pytorch/pytorch/issues. (Triggered internally at ..\aten\src\ATen\SparseCsrTensorImpl.cpp:55.)
    self.adj_csr = self.adj.to_sparse_csr().to(self.device)
[I 2026-05-05 17:21:58,839] Trial 108 finished with value: 0.7520494557183174 and parameters: {'lr': 0.005, 'weight_decay': 0.0001, 'n_hidden': 64, 'n_layer': 3, 'dropout': 0.6363016942456834, 'knn_mode': 's', 'k': 31, 'dexp': 2.396968411183957, 'p_grd': 0.22473073251310216, 'unc_rem': 0.127033720410877, 'unc_rel': 0.07898184305232832}. Best is trial 95 with value: 0.7595081306276038.
    [CPU] Loading dblp...
    DEBUG 3.1: Dataset init start
    DEBUG 3.2: prepare_data start dblp
    ----Data statistics------'
    Name: dblp
    #Nodes 17716
    #Edges 52867
    #Classes 4
    #Ave_degree 5.97
    ----Split statistics------'
    #Train samples 177 (1.0 % of nodes)
    #Val samples 2657 (15.0 % of nodes)
    #Test samples 14882 (remaining)
    ----label noise information:------
    Instance dependent noise
    #Actual noise rate 0.30
    [cuda:1] LNPCC waiting for GPU slot...
    [cuda:1] Slot acquired (waited 300.2s). Starting GCN...
    FINAL_RESULT: {'acc': {'train': 0.7005649717514124, 'valid': 0.5325555137372977, 'test': 0.7072974062625991}, 'wall_s': 61.77, 'cpu_s': 58.13, 'gpu_s': 3.55, 'wait_s': 300.21}
    [Time] wall=61.8s | cpu=58.1s | gpu=3.6s
    C:\Users\fbrev\Documents\Acadêmico\Simulações\Python\NoisyGL\predictor\Base_Predictor.py:114: UserWarning: expandable_segments not supported on this platform (Triggered internally at ..\c10/cuda/CUDAAllocatorConfig.h:28.)
    self.edge_index = self._cpu_edge_index.to(self.device)
    C:\Users\fbrev\Documents\Acadêmico\Simulações\Python\NoisyGL\predictor\Base_Predictor.py:144: UserWarning: Sparse CSR tensor support is in beta state. If you miss a functionality in the sparse tensor support, please submit a feature request to https://github.com/pytorch/pytorch/issues. (Triggered internally at ..\aten\src\ATen\SparseCsrTensorImpl.cpp:55.)
    self.adj_csr = self.adj.to_sparse_csr().to(self.device)
[I 2026-05-05 17:28:07,122] Trial 109 finished with value: 0.7072974062625991 and parameters: {'lr': 0.005, 'weight_decay': 0.01, 'n_hidden': 64, 'n_layer': 3, 'dropout': 0.5762200299231579, 'knn_mode': 'd', 'k': 25, 'dexp': 5.870215239786562, 'p_grd': 0.3507842649935572, 'unc_rem': 0.0644384933239653, 'unc_rel': 0.12278074908875374}. Best is trial 95 with value: 0.7595081306276038.
    [CPU] Loading dblp...
    DEBUG 3.1: Dataset init start
    DEBUG 3.2: prepare_data start dblp
    ----Data statistics------'
    Name: dblp
    #Nodes 17716
    #Edges 52867
    #Classes 4
    #Ave_degree 5.97
    ----Split statistics------'
    #Train samples 177 (1.0 % of nodes)
    #Val samples 2657 (15.0 % of nodes)
    #Test samples 14882 (remaining)
    ----label noise information:------
    Instance dependent noise
    #Actual noise rate 0.30
    [cuda:1] LNPCC waiting for GPU slot...
    [cuda:1] Slot acquired (waited 142.6s). Starting GCN...
    FINAL_RESULT: {'acc': {'train': 0.8, 'valid': 0.5370718855852465, 'test': 0.731286117457331}, 'wall_s': 41.21, 'cpu_s': 37.56, 'gpu_s': 3.56, 'wait_s': 142.57}
    [Time] wall=41.2s | cpu=37.6s | gpu=3.6s
    C:\Users\fbrev\Documents\Acadêmico\Simulações\Python\NoisyGL\predictor\Base_Predictor.py:114: UserWarning: expandable_segments not supported on this platform (Triggered internally at ..\c10/cuda/CUDAAllocatorConfig.h:28.)
    self.edge_index = self._cpu_edge_index.to(self.device)
    C:\Users\fbrev\Documents\Acadêmico\Simulações\Python\NoisyGL\predictor\Base_Predictor.py:144: UserWarning: Sparse CSR tensor support is in beta state. If you miss a functionality in the sparse tensor support, please submit a feature request to https://github.com/pytorch/pytorch/issues. (Triggered internally at ..\aten\src\ATen\SparseCsrTensorImpl.cpp:55.)
    self.adj_csr = self.adj.to_sparse_csr().to(self.device)
[I 2026-05-05 17:31:17,176] Trial 110 finished with value: 0.731286117457331 and parameters: {'lr': 0.005, 'weight_decay': 0.0001, 'n_hidden': 64, 'n_layer': 3, 'dropout': 0.6059885498240246, 'knn_mode': 's', 'k': 24, 'dexp': 0.8342206632332712, 'p_grd': 0.2261670238895252, 'unc_rem': 0.12191365530217349, 'unc_rel': 0.07733563895876712}. Best is trial 95 with value: 0.7595081306276038.
    [CPU] Loading dblp...
    DEBUG 3.1: Dataset init start
    DEBUG 3.2: prepare_data start dblp
    ----Data statistics------'
    Name: dblp
    #Nodes 17716
    #Edges 52867
    #Classes 4
    #Ave_degree 5.97
    ----Split statistics------'
    #Train samples 177 (1.0 % of nodes)
    #Val samples 2657 (15.0 % of nodes)
    #Test samples 14882 (remaining)
    ----label noise information:------
    Instance dependent noise
    #Actual noise rate 0.30
    [cuda:1] LNPCC waiting for GPU slot...
    [cuda:1] Slot acquired (waited 503.6s). Starting GCN...
    FINAL_RESULT: {'acc': {'train': 0.813953488372093, 'valid': 0.5453519006398193, 'test': 0.7343770998521704}, 'wall_s': 48.07, 'cpu_s': 40.96, 'gpu_s': 7.03, 'wait_s': 503.59}
    [Time] wall=48.1s | cpu=41.0s | gpu=7.0s
    C:\Users\fbrev\Documents\Acadêmico\Simulações\Python\NoisyGL\predictor\Base_Predictor.py:114: UserWarning: expandable_segments not supported on this platform (Triggered internally at ..\c10/cuda/CUDAAllocatorConfig.h:28.)
    self.edge_index = self._cpu_edge_index.to(self.device)
    C:\Users\fbrev\Documents\Acadêmico\Simulações\Python\NoisyGL\predictor\Base_Predictor.py:144: UserWarning: Sparse CSR tensor support is in beta state. If you miss a functionality in the sparse tensor support, please submit a feature request to https://github.com/pytorch/pytorch/issues. (Triggered internally at ..\aten\src\ATen\SparseCsrTensorImpl.cpp:55.)
    self.adj_csr = self.adj.to_sparse_csr().to(self.device)
[I 2026-05-05 17:40:34,834] Trial 111 finished with value: 0.7343770998521704 and parameters: {'lr': 0.005, 'weight_decay': 0.0001, 'n_hidden': 256, 'n_layer': 3, 'dropout': 0.6376810791011541, 'knn_mode': 's', 'k': 28, 'dexp': 4.046337928039897, 'p_grd': 0.37552042664784097, 'unc_rem': 0.023708410826317704, 'unc_rel': 0.20549308920281323}. Best is trial 95 with value: 0.7595081306276038.
    [CPU] Loading dblp...
    DEBUG 3.1: Dataset init start
    DEBUG 3.2: prepare_data start dblp
    ----Data statistics------'
    Name: dblp
    #Nodes 17716
    #Edges 52867
    #Classes 4
    #Ave_degree 5.97
    ----Split statistics------'
    #Train samples 177 (1.0 % of nodes)
    #Val samples 2657 (15.0 % of nodes)
    #Test samples 14882 (remaining)
    ----label noise information:------
    Instance dependent noise
    #Actual noise rate 0.30
    [cuda:1] LNPCC waiting for GPU slot...
    [cuda:1] Slot acquired (waited 151.2s). Starting GCN...
    FINAL_RESULT: {'acc': {'train': 0.8363636363636363, 'valid': 0.5502446368084306, 'test': 0.7423733369170811}, 'wall_s': 44.25, 'cpu_s': 39.57, 'gpu_s': 4.59, 'wait_s': 151.24}
    [Time] wall=44.2s | cpu=39.6s | gpu=4.6s
    C:\Users\fbrev\Documents\Acadêmico\Simulações\Python\NoisyGL\predictor\Base_Predictor.py:114: UserWarning: expandable_segments not supported on this platform (Triggered internally at ..\c10/cuda/CUDAAllocatorConfig.h:28.)
    self.edge_index = self._cpu_edge_index.to(self.device)
    C:\Users\fbrev\Documents\Acadêmico\Simulações\Python\NoisyGL\predictor\Base_Predictor.py:144: UserWarning: Sparse CSR tensor support is in beta state. If you miss a functionality in the sparse tensor support, please submit a feature request to https://github.com/pytorch/pytorch/issues. (Triggered internally at ..\aten\src\ATen\SparseCsrTensorImpl.cpp:55.)
    self.adj_csr = self.adj.to_sparse_csr().to(self.device)
[I 2026-05-05 17:43:56,553] Trial 112 finished with value: 0.7423733369170811 and parameters: {'lr': 0.005, 'weight_decay': 0.0001, 'n_hidden': 128, 'n_layer': 3, 'dropout': 0.5623536644841249, 'knn_mode': 's', 'k': 19, 'dexp': 2.8145017749144783, 'p_grd': 0.2539122631925995, 'unc_rem': 0.4806737632042471, 'unc_rel': 0.1457591152175328}. Best is trial 95 with value: 0.7595081306276038.
    [CPU] Loading dblp...
    DEBUG 3.1: Dataset init start
    DEBUG 3.2: prepare_data start dblp
    ----Data statistics------'
    Name: dblp
    #Nodes 17716
    #Edges 52867
    #Classes 4
    #Ave_degree 5.97
    ----Split statistics------'
    #Train samples 177 (1.0 % of nodes)
    #Val samples 2657 (15.0 % of nodes)
    #Test samples 14882 (remaining)
    ----label noise information:------
    Instance dependent noise
    #Actual noise rate 0.30
    [cuda:1] LNPCC waiting for GPU slot...
    [cuda:1] Slot acquired (waited 144.6s). Starting GCN...
    FINAL_RESULT: {'acc': {'train': 0.7901234567901234, 'valid': 0.53293187805796, 'test': 0.7240962236258568}, 'wall_s': 42.88, 'cpu_s': 37.75, 'gpu_s': 5.03, 'wait_s': 144.56}
    [Time] wall=42.9s | cpu=37.8s | gpu=5.0s
    C:\Users\fbrev\Documents\Acadêmico\Simulações\Python\NoisyGL\predictor\Base_Predictor.py:114: UserWarning: expandable_segments not supported on this platform (Triggered internally at ..\c10/cuda/CUDAAllocatorConfig.h:28.)
    self.edge_index = self._cpu_edge_index.to(self.device)
    C:\Users\fbrev\Documents\Acadêmico\Simulações\Python\NoisyGL\predictor\Base_Predictor.py:144: UserWarning: Sparse CSR tensor support is in beta state. If you miss a functionality in the sparse tensor support, please submit a feature request to https://github.com/pytorch/pytorch/issues. (Triggered internally at ..\aten\src\ATen\SparseCsrTensorImpl.cpp:55.)
    self.adj_csr = self.adj.to_sparse_csr().to(self.device)
[I 2026-05-05 17:47:10,195] Trial 113 finished with value: 0.7240962236258568 and parameters: {'lr': 0.005, 'weight_decay': 0.0001, 'n_hidden': 128, 'n_layer': 3, 'dropout': 0.5111540978617158, 'knn_mode': 's', 'k': 15, 'dexp': 3.058198344138634, 'p_grd': 0.24931593305185393, 'unc_rem': 0.48317726818410833, 'unc_rel': 0.14262954202538214}. Best is trial 95 with value: 0.7595081306276038.
    [CPU] Loading dblp...
    DEBUG 3.1: Dataset init start
    DEBUG 3.2: prepare_data start dblp
    ----Data statistics------'
    Name: dblp
    #Nodes 17716
    #Edges 52867
    #Classes 4
    #Ave_degree 5.97
    ----Split statistics------'
    #Train samples 177 (1.0 % of nodes)
    #Val samples 2657 (15.0 % of nodes)
    #Test samples 14882 (remaining)
    ----label noise information:------
    Instance dependent noise
    #Actual noise rate 0.30
    [cuda:1] LNPCC waiting for GPU slot...
    [cuda:1] Slot acquired (waited 136.2s). Starting GCN...
    FINAL_RESULT: {'acc': {'train': 0.9038461538461539, 'valid': 0.5389537071885585, 'test': 0.722416341889531}, 'wall_s': 57.94, 'cpu_s': 52.83, 'gpu_s': 5.01, 'wait_s': 136.18}
    [Time] wall=57.9s | cpu=52.8s | gpu=5.0s
    C:\Users\fbrev\Documents\Acadêmico\Simulações\Python\NoisyGL\predictor\Base_Predictor.py:114: UserWarning: expandable_segments not supported on this platform (Triggered internally at ..\c10/cuda/CUDAAllocatorConfig.h:28.)
    self.edge_index = self._cpu_edge_index.to(self.device)
    C:\Users\fbrev\Documents\Acadêmico\Simulações\Python\NoisyGL\predictor\Base_Predictor.py:144: UserWarning: Sparse CSR tensor support is in beta state. If you miss a functionality in the sparse tensor support, please submit a feature request to https://github.com/pytorch/pytorch/issues. (Triggered internally at ..\aten\src\ATen\SparseCsrTensorImpl.cpp:55.)
    self.adj_csr = self.adj.to_sparse_csr().to(self.device)
[I 2026-05-05 17:50:32,344] Trial 114 finished with value: 0.722416341889531 and parameters: {'lr': 0.005, 'weight_decay': 0.0001, 'n_hidden': 128, 'n_layer': 3, 'dropout': 0.5934934558000041, 'knn_mode': 's', 'k': 32, 'dexp': 2.4413718881856363, 'p_grd': 0.31326511565763104, 'unc_rem': 0.4305995585892063, 'unc_rel': 0.0950876317188045}. Best is trial 95 with value: 0.7595081306276038.
    [CPU] Loading dblp...
    DEBUG 3.1: Dataset init start
    DEBUG 3.2: prepare_data start dblp
    ----Data statistics------'
    Name: dblp
    #Nodes 17716
    #Edges 52867
    #Classes 4
    #Ave_degree 5.97
    ----Split statistics------'
    #Train samples 177 (1.0 % of nodes)
    #Val samples 2657 (15.0 % of nodes)
    #Test samples 14882 (remaining)
    ----label noise information:------
    Instance dependent noise
    #Actual noise rate 0.30
    [cuda:1] LNPCC waiting for GPU slot...
    [cuda:1] Slot acquired (waited 1015.2s). Starting GCN...
    FINAL_RESULT: {'acc': {'train': 0.8072289156626506, 'valid': 0.5461046292811441, 'test': 0.7328988039242037}, 'wall_s': 47.68, 'cpu_s': 42.73, 'gpu_s': 4.86, 'wait_s': 1015.15}
    [Time] wall=47.7s | cpu=42.7s | gpu=4.9s
    C:\Users\fbrev\Documents\Acadêmico\Simulações\Python\NoisyGL\predictor\Base_Predictor.py:114: UserWarning: expandable_segments not supported on this platform (Triggered internally at ..\c10/cuda/CUDAAllocatorConfig.h:28.)
    self.edge_index = self._cpu_edge_index.to(self.device)
    C:\Users\fbrev\Documents\Acadêmico\Simulações\Python\NoisyGL\predictor\Base_Predictor.py:144: UserWarning: Sparse CSR tensor support is in beta state. If you miss a functionality in the sparse tensor support, please submit a feature request to https://github.com/pytorch/pytorch/issues. (Triggered internally at ..\aten\src\ATen\SparseCsrTensorImpl.cpp:55.)
    self.adj_csr = self.adj.to_sparse_csr().to(self.device)
[I 2026-05-05 18:08:23,405] Trial 115 finished with value: 0.7328988039242037 and parameters: {'lr': 0.005, 'weight_decay': 0.0001, 'n_hidden': 128, 'n_layer': 3, 'dropout': 0.5605330380156383, 'knn_mode': 's', 'k': 30, 'dexp': 2.779993486919378, 'p_grd': 0.2863016631609492, 'unc_rem': 0.5646764873626873, 'unc_rel': 0.15281833251321175}. Best is trial 95 with value: 0.7595081306276038.
    [CPU] Loading dblp...
    DEBUG 3.1: Dataset init start
    DEBUG 3.2: prepare_data start dblp
    ----Data statistics------'
    Name: dblp
    #Nodes 17716
    #Edges 52867
    #Classes 4
    #Ave_degree 5.97
    ----Split statistics------'
    #Train samples 177 (1.0 % of nodes)
    #Val samples 2657 (15.0 % of nodes)
    #Test samples 14882 (remaining)
    ----label noise information:------
    Instance dependent noise
    #Actual noise rate 0.30
    [cuda:1] LNPCC waiting for GPU slot...
    [cuda:1] Slot acquired (waited 132.6s). Starting GCN...
    FINAL_RESULT: {'acc': {'train': 0.8012422360248447, 'valid': 0.5434700790365073, 'test': 0.7323612417685795}, 'wall_s': 42.71, 'cpu_s': 38.1, 'gpu_s': 4.53, 'wait_s': 132.64}
    [Time] wall=42.7s | cpu=38.1s | gpu=4.5s
    C:\Users\fbrev\Documents\Acadêmico\Simulações\Python\NoisyGL\predictor\Base_Predictor.py:114: UserWarning: expandable_segments not supported on this platform (Triggered internally at ..\c10/cuda/CUDAAllocatorConfig.h:28.)
    self.edge_index = self._cpu_edge_index.to(self.device)
    C:\Users\fbrev\Documents\Acadêmico\Simulações\Python\NoisyGL\predictor\Base_Predictor.py:144: UserWarning: Sparse CSR tensor support is in beta state. If you miss a functionality in the sparse tensor support, please submit a feature request to https://github.com/pytorch/pytorch/issues. (Triggered internally at ..\aten\src\ATen\SparseCsrTensorImpl.cpp:55.)
    self.adj_csr = self.adj.to_sparse_csr().to(self.device)
