[I 2026-05-07 19:47:20,358] Trial 47 finished with value: 0.662 and parameters: {'lr': 0.1, 'weight_decay': 0.01, 'n_hidden': 256, 'n_layer': 3, 'dropout': 0.23302317474777717, 'knn_mode': 's', 'k': 8, 'dexp': 1.3107477551936872, 'p_grd': 0.7759400164397747, 'unc_rem': 0.2959465737662874, 'unc_rel': 0.5606919978208932}. Best is trial 1 with value: 0.71.
    [CPU] Loading citeseer...
    DEBUG 3.1: Dataset init start
    DEBUG 3.2: prepare_data start citeseer
    ----Data statistics------'
    Name: citeseer
    #Nodes 3327
    #Edges 4552
    #Classes 6
    #Ave_degree 2.74
    ----Split statistics------'
    #Train samples 120 (default)
    #Val samples 500 (default)
    #Test samples 1000 (default)
    ----label noise information:------
    Instance dependent noise
    #Actual noise rate 0.12
    [cuda:1] LNPCC waiting for GPU slot...
    [cuda:1] Slot acquired (waited 145.5s). Starting GCN...
    FINAL_RESULT: {'acc': {'train': 0.7833333333333333, 'valid': 0.584, 'test': 0.634}, 'wall_s': 17.44, 'cpu_s': 15.23, 'gpu_s': 2.16, 'wait_s': 145.54}
    [Time] wall=17.4s | cpu=15.2s | gpu=2.2s
    C:\Users\fbrev\Documents\Acadêmico\Simulações\Python\NoisyGL\predictor\Base_Predictor.py:114: UserWarning: expandable_segments not supported on this platform (Triggered internally at ..\c10/cuda/CUDAAllocatorConfig.h:28.)
    self.edge_index = self._cpu_edge_index.to(self.device)
    C:\Users\fbrev\Documents\Acadêmico\Simulações\Python\NoisyGL\predictor\Base_Predictor.py:144: UserWarning: Sparse CSR tensor support is in beta state. If you miss a functionality in the sparse tensor support, please submit a feature request to https://github.com/pytorch/pytorch/issues. (Triggered internally at ..\aten\src\ATen\SparseCsrTensorImpl.cpp:55.)
    self.adj_csr = self.adj.to_sparse_csr().to(self.device)
[I 2026-05-07 19:50:08,985] Trial 48 finished with value: 0.634 and parameters: {'lr': 0.005, 'weight_decay': 0.001, 'n_hidden': 32, 'n_layer': 3, 'dropout': 0.6643459184801829, 'knn_mode': 'd', 'k': 6, 'dexp': 2.0979418667541108, 'p_grd': 0.4893010879933052, 'unc_rem': 0.17822970201588792, 'unc_rel': 0.2754582519376691}. Best is trial 1 with value: 0.71.
    [CPU] Loading citeseer...
    DEBUG 3.1: Dataset init start
    DEBUG 3.2: prepare_data start citeseer
    ----Data statistics------'
    Name: citeseer
    #Nodes 3327
    #Edges 4552
    #Classes 6
    #Ave_degree 2.74
    ----Split statistics------'
    #Train samples 120 (default)
    #Val samples 500 (default)
    #Test samples 1000 (default)
    ----label noise information:------
    Instance dependent noise
    #Actual noise rate 0.12
    [cuda:1] LNPCC waiting for GPU slot...
    [cuda:1] Slot acquired (waited 156.9s). Starting GCN...
    FINAL_RESULT: {'acc': {'train': 0.9416666666666667, 'valid': 0.588, 'test': 0.655}, 'wall_s': 10.39, 'cpu_s': 7.77, 'gpu_s': 2.57, 'wait_s': 156.92}
    [Time] wall=10.4s | cpu=7.8s | gpu=2.6s
    C:\Users\fbrev\Documents\Acadêmico\Simulações\Python\NoisyGL\predictor\Base_Predictor.py:114: UserWarning: expandable_segments not supported on this platform (Triggered internally at ..\c10/cuda/CUDAAllocatorConfig.h:28.)
    self.edge_index = self._cpu_edge_index.to(self.device)
    C:\Users\fbrev\Documents\Acadêmico\Simulações\Python\NoisyGL\predictor\Base_Predictor.py:144: UserWarning: Sparse CSR tensor support is in beta state. If you miss a functionality in the sparse tensor support, please submit a feature request to https://github.com/pytorch/pytorch/issues. (Triggered internally at ..\aten\src\ATen\SparseCsrTensorImpl.cpp:55.)
    self.adj_csr = self.adj.to_sparse_csr().to(self.device)
