[I 2026-05-08 03:11:11,657] Trial 23 finished with value: 0.723 and parameters: {'lr': 0.005, 'weight_decay': 0.001, 'n_hidden': 256, 'n_layer': 2, 'dropout': 0.42830263476793856, 'knn_mode': 'd', 'k': 29, 'dexp': 6.4825189867303585, 'p_grd': 0.993933979399233, 'unc_rem': 0.5798331615855679, 'unc_rel': 0.7364516474012132}. Best is trial 20 with value: 0.784.
    [CPU] Loading cora...
    DEBUG 3.1: Dataset init start
    DEBUG 3.2: prepare_data start cora
    ----Data statistics------'
    Name: cora
    #Nodes 2708
    #Edges 5278
    #Classes 7
    #Ave_degree 3.90
    ----Split statistics------'
    #Train samples 140 (default)
    #Val samples 500 (default)
    #Test samples 1000 (default)
    ----label noise information:------
    Instance dependent noise
    #Actual noise rate 0.21
    [cuda:1] LNPCC waiting for GPU slot...
    [cuda:1] Slot acquired (waited 12.7s). Starting GCN...
    FINAL_RESULT: {'acc': {'train': 0.9, 'valid': 0.584, 'test': 0.774}, 'wall_s': 13.5, 'cpu_s': 11.47, 'gpu_s': 1.99, 'wait_s': 12.67}
    [Time] wall=13.5s | cpu=11.5s | gpu=2.0s
    C:\Users\fbrev\Documents\Acadêmico\Simulações\Python\NoisyGL\predictor\Base_Predictor.py:114: UserWarning: expandable_segments not supported on this platform (Triggered internally at ..\c10/cuda/CUDAAllocatorConfig.h:28.)
    self.edge_index = self._cpu_edge_index.to(self.device)
    C:\Users\fbrev\Documents\Acadêmico\Simulações\Python\NoisyGL\predictor\Base_Predictor.py:144: UserWarning: Sparse CSR tensor support is in beta state. If you miss a functionality in the sparse tensor support, please submit a feature request to https://github.com/pytorch/pytorch/issues. (Triggered internally at ..\aten\src\ATen\SparseCsrTensorImpl.cpp:55.)
    self.adj_csr = self.adj.to_sparse_csr().to(self.device)
[I 2026-05-08 03:11:43,318] Trial 24 finished with value: 0.774 and parameters: {'lr': 0.005, 'weight_decay': 0.001, 'n_hidden': 256, 'n_layer': 2, 'dropout': 0.3068207958546729, 'knn_mode': 'd', 'k': 50, 'dexp': 7.30636396597662, 'p_grd': 0.7549256832179833, 'unc_rem': 0.8328779551038799, 'unc_rel': 0.44856006285661293}. Best is trial 20 with value: 0.784.
    [CPU] Loading cora...
    DEBUG 3.1: Dataset init start
    DEBUG 3.2: prepare_data start cora
    ----Data statistics------'
    Name: cora
    #Nodes 2708
    #Edges 5278
    #Classes 7
    #Ave_degree 3.90
    ----Split statistics------'
    #Train samples 140 (default)
    #Val samples 500 (default)
    #Test samples 1000 (default)
    ----label noise information:------
    Instance dependent noise
    #Actual noise rate 0.21
    [cuda:1] LNPCC waiting for GPU slot...
    [cuda:1] Slot acquired (waited 15.4s). Starting GCN...
    FINAL_RESULT: {'acc': {'train': 0.8928571428571429, 'valid': 0.59, 'test': 0.776}, 'wall_s': 11.49, 'cpu_s': 9.53, 'gpu_s': 1.94, 'wait_s': 15.38}
    [Time] wall=11.5s | cpu=9.5s | gpu=1.9s
    C:\Users\fbrev\Documents\Acadêmico\Simulações\Python\NoisyGL\predictor\Base_Predictor.py:114: UserWarning: expandable_segments not supported on this platform (Triggered internally at ..\c10/cuda/CUDAAllocatorConfig.h:28.)
    self.edge_index = self._cpu_edge_index.to(self.device)
    C:\Users\fbrev\Documents\Acadêmico\Simulações\Python\NoisyGL\predictor\Base_Predictor.py:144: UserWarning: Sparse CSR tensor support is in beta state. If you miss a functionality in the sparse tensor support, please submit a feature request to https://github.com/pytorch/pytorch/issues. (Triggered internally at ..\aten\src\ATen\SparseCsrTensorImpl.cpp:55.)
    self.adj_csr = self.adj.to_sparse_csr().to(self.device)
[I 2026-05-08 03:12:15,880] Trial 25 finished with value: 0.776 and parameters: {'lr': 0.01, 'weight_decay': 0.001, 'n_hidden': 256, 'n_layer': 2, 'dropout': 0.42813667039498277, 'knn_mode': 'd', 'k': 35, 'dexp': 8.976567016728046, 'p_grd': 0.6458956510585115, 'unc_rem': 0.47726535647404844, 'unc_rel': 0.8992857881797629}. Best is trial 20 with value: 0.784.
    [CPU] Loading cora...
    DEBUG 3.1: Dataset init start
    DEBUG 3.2: prepare_data start cora
    ----Data statistics------'
    Name: cora
    #Nodes 2708
    #Edges 5278
    #Classes 7
    #Ave_degree 3.90
    ----Split statistics------'
    #Train samples 140 (default)
    #Val samples 500 (default)
    #Test samples 1000 (default)
    ----label noise information:------
    Instance dependent noise
    #Actual noise rate 0.21
    [cuda:1] LNPCC waiting for GPU slot...
    [cuda:1] Slot acquired (waited 25.1s). Starting GCN...
    FINAL_RESULT: {'acc': {'train': 0.8928571428571429, 'valid': 0.588, 'test': 0.779}, 'wall_s': 32.55, 'cpu_s': 30.9, 'gpu_s': 1.62, 'wait_s': 25.1}
    [Time] wall=32.6s | cpu=30.9s | gpu=1.6s
    C:\Users\fbrev\Documents\Acadêmico\Simulações\Python\NoisyGL\predictor\Base_Predictor.py:114: UserWarning: expandable_segments not supported on this platform (Triggered internally at ..\c10/cuda/CUDAAllocatorConfig.h:28.)
    self.edge_index = self._cpu_edge_index.to(self.device)
    C:\Users\fbrev\Documents\Acadêmico\Simulações\Python\NoisyGL\predictor\Base_Predictor.py:144: UserWarning: Sparse CSR tensor support is in beta state. If you miss a functionality in the sparse tensor support, please submit a feature request to https://github.com/pytorch/pytorch/issues. (Triggered internally at ..\aten\src\ATen\SparseCsrTensorImpl.cpp:55.)
    self.adj_csr = self.adj.to_sparse_csr().to(self.device)
[I 2026-05-08 03:13:19,037] Trial 26 finished with value: 0.779 and parameters: {'lr': 0.005, 'weight_decay': 0.001, 'n_hidden': 256, 'n_layer': 2, 'dropout': 0.6206913211518087, 'knn_mode': 'd', 'k': 45, 'dexp': 4.909427938843387, 'p_grd': 0.9046448073655546, 'unc_rem': 0.9799999989703394, 'unc_rel': 0.6035295848476512}. Best is trial 20 with value: 0.784.
    [CPU] Loading cora...
    DEBUG 3.1: Dataset init start
    DEBUG 3.2: prepare_data start cora
    ----Data statistics------'
    Name: cora
    #Nodes 2708
    #Edges 5278
    #Classes 7
    #Ave_degree 3.90
    ----Split statistics------'
    #Train samples 140 (default)
    #Val samples 500 (default)
    #Test samples 1000 (default)
    ----label noise information:------
    Instance dependent noise
    #Actual noise rate 0.21
    [cuda:1] LNPCC waiting for GPU slot...
    [cuda:1] Slot acquired (waited 8.7s). Starting GCN...
    FINAL_RESULT: {'acc': {'train': 0.8714285714285714, 'valid': 0.584, 'test': 0.762}, 'wall_s': 18.19, 'cpu_s': 16.45, 'gpu_s': 1.72, 'wait_s': 8.66}
    [Time] wall=18.2s | cpu=16.4s | gpu=1.7s
    C:\Users\fbrev\Documents\Acadêmico\Simulações\Python\NoisyGL\predictor\Base_Predictor.py:114: UserWarning: expandable_segments not supported on this platform (Triggered internally at ..\c10/cuda/CUDAAllocatorConfig.h:28.)
    self.edge_index = self._cpu_edge_index.to(self.device)
    C:\Users\fbrev\Documents\Acadêmico\Simulações\Python\NoisyGL\predictor\Base_Predictor.py:144: UserWarning: Sparse CSR tensor support is in beta state. If you miss a functionality in the sparse tensor support, please submit a feature request to https://github.com/pytorch/pytorch/issues. (Triggered internally at ..\aten\src\ATen\SparseCsrTensorImpl.cpp:55.)
    self.adj_csr = self.adj.to_sparse_csr().to(self.device)
[I 2026-05-08 03:13:50,782] Trial 27 finished with value: 0.762 and parameters: {'lr': 0.005, 'weight_decay': 0.001, 'n_hidden': 256, 'n_layer': 2, 'dropout': 0.6320400826648294, 'knn_mode': 'd', 'k': 43, 'dexp': 4.836732742235806, 'p_grd': 0.5733566503674872, 'unc_rem': 0.9858077107569433, 'unc_rel': 0.6315191700390799}. Best is trial 20 with value: 0.784.
    [CPU] Loading cora...
    DEBUG 3.1: Dataset init start
    DEBUG 3.2: prepare_data start cora
    ----Data statistics------'
    Name: cora
    #Nodes 2708
    #Edges 5278
    #Classes 7
    #Ave_degree 3.90
    ----Split statistics------'
    #Train samples 140 (default)
    #Val samples 500 (default)
    #Test samples 1000 (default)
    ----label noise information:------
    Instance dependent noise
    #Actual noise rate 0.21
    [cuda:1] LNPCC waiting for GPU slot...
    [cuda:1] Slot acquired (waited 12.5s). Starting GCN...
    FINAL_RESULT: {'acc': {'train': 0.8928571428571429, 'valid': 0.586, 'test': 0.781}, 'wall_s': 14.11, 'cpu_s': 12.36, 'gpu_s': 1.72, 'wait_s': 12.51}
    [Time] wall=14.1s | cpu=12.4s | gpu=1.7s
    C:\Users\fbrev\Documents\Acadêmico\Simulações\Python\NoisyGL\predictor\Base_Predictor.py:114: UserWarning: expandable_segments not supported on this platform (Triggered internally at ..\c10/cuda/CUDAAllocatorConfig.h:28.)
    self.edge_index = self._cpu_edge_index.to(self.device)
    C:\Users\fbrev\Documents\Acadêmico\Simulações\Python\NoisyGL\predictor\Base_Predictor.py:144: UserWarning: Sparse CSR tensor support is in beta state. If you miss a functionality in the sparse tensor support, please submit a feature request to https://github.com/pytorch/pytorch/issues. (Triggered internally at ..\aten\src\ATen\SparseCsrTensorImpl.cpp:55.)
    self.adj_csr = self.adj.to_sparse_csr().to(self.device)
[I 2026-05-08 03:14:22,447] Trial 28 finished with value: 0.781 and parameters: {'lr': 0.005, 'weight_decay': 0.001, 'n_hidden': 256, 'n_layer': 2, 'dropout': 0.5207456555046343, 'knn_mode': 'd', 'k': 27, 'dexp': 6.132912077821921, 'p_grd': 0.74867400485211, 'unc_rem': 0.6507607260288589, 'unc_rel': 0.7954216528860535}. Best is trial 20 with value: 0.784.
    [CPU] Loading cora...
    DEBUG 3.1: Dataset init start
    DEBUG 3.2: prepare_data start cora
    ----Data statistics------'
    Name: cora
    #Nodes 2708
    #Edges 5278
    #Classes 7
    #Ave_degree 3.90
    ----Split statistics------'
    #Train samples 140 (default)
    #Val samples 500 (default)
    #Test samples 1000 (default)
    ----label noise information:------
    Instance dependent noise
    #Actual noise rate 0.21
    [cuda:1] LNPCC waiting for GPU slot...
    [cuda:1] Slot acquired (waited 13.6s). Starting GCN...
    FINAL_RESULT: {'acc': {'train': 0.8928571428571429, 'valid': 0.586, 'test': 0.779}, 'wall_s': 13.31, 'cpu_s': 11.58, 'gpu_s': 1.71, 'wait_s': 13.62}
    [Time] wall=13.3s | cpu=11.6s | gpu=1.7s
    C:\Users\fbrev\Documents\Acadêmico\Simulações\Python\NoisyGL\predictor\Base_Predictor.py:114: UserWarning: expandable_segments not supported on this platform (Triggered internally at ..\c10/cuda/CUDAAllocatorConfig.h:28.)
    self.edge_index = self._cpu_edge_index.to(self.device)
    C:\Users\fbrev\Documents\Acadêmico\Simulações\Python\NoisyGL\predictor\Base_Predictor.py:144: UserWarning: Sparse CSR tensor support is in beta state. If you miss a functionality in the sparse tensor support, please submit a feature request to https://github.com/pytorch/pytorch/issues. (Triggered internally at ..\aten\src\ATen\SparseCsrTensorImpl.cpp:55.)
    self.adj_csr = self.adj.to_sparse_csr().to(self.device)
[I 2026-05-08 03:14:54,331] Trial 29 finished with value: 0.779 and parameters: {'lr': 0.005, 'weight_decay': 0.001, 'n_hidden': 256, 'n_layer': 2, 'dropout': 0.5026566506050296, 'knn_mode': 'd', 'k': 26, 'dexp': 6.165520487112686, 'p_grd': 0.7283638099388225, 'unc_rem': 0.41867005890415687, 'unc_rel': 0.7589305020358194}. Best is trial 20 with value: 0.784.
    [CPU] Loading cora...
    DEBUG 3.1: Dataset init start
    DEBUG 3.2: prepare_data start cora
    ----Data statistics------'
    Name: cora
    #Nodes 2708
    #Edges 5278
    #Classes 7
    #Ave_degree 3.90
    ----Split statistics------'
    #Train samples 140 (default)
    #Val samples 500 (default)
    #Test samples 1000 (default)
    ----label noise information:------
    Instance dependent noise
    #Actual noise rate 0.21
    [cuda:1] LNPCC waiting for GPU slot...
    [cuda:1] Slot acquired (waited 15.7s). Starting GCN...
    FINAL_RESULT: {'acc': {'train': 0.9571428571428572, 'valid': 0.574, 'test': 0.744}, 'wall_s': 10.72, 'cpu_s': 8.93, 'gpu_s': 1.75, 'wait_s': 15.7}
    [Time] wall=10.7s | cpu=8.9s | gpu=1.7s
    C:\Users\fbrev\Documents\Acadêmico\Simulações\Python\NoisyGL\predictor\Base_Predictor.py:114: UserWarning: expandable_segments not supported on this platform (Triggered internally at ..\c10/cuda/CUDAAllocatorConfig.h:28.)
    self.edge_index = self._cpu_edge_index.to(self.device)
    C:\Users\fbrev\Documents\Acadêmico\Simulações\Python\NoisyGL\predictor\Base_Predictor.py:144: UserWarning: Sparse CSR tensor support is in beta state. If you miss a functionality in the sparse tensor support, please submit a feature request to https://github.com/pytorch/pytorch/issues. (Triggered internally at ..\aten\src\ATen\SparseCsrTensorImpl.cpp:55.)
    self.adj_csr = self.adj.to_sparse_csr().to(self.device)
[I 2026-05-08 03:15:26,323] Trial 30 finished with value: 0.744 and parameters: {'lr': 0.1, 'weight_decay': 0.001, 'n_hidden': 256, 'n_layer': 2, 'dropout': 0.5751831992381068, 'knn_mode': 'd', 'k': 18, 'dexp': 6.859889298367773, 'p_grd': 0.5943853978661156, 'unc_rem': 0.6303289479470116, 'unc_rel': 0.9080828745293645}. Best is trial 20 with value: 0.784.
    [CPU] Loading cora...
    DEBUG 3.1: Dataset init start
    DEBUG 3.2: prepare_data start cora
    ----Data statistics------'
    Name: cora
    #Nodes 2708
    #Edges 5278
    #Classes 7
    #Ave_degree 3.90
    ----Split statistics------'
    #Train samples 140 (default)
    #Val samples 500 (default)
    #Test samples 1000 (default)
    ----label noise information:------
    Instance dependent noise
    #Actual noise rate 0.21
    [cuda:1] LNPCC waiting for GPU slot...
    [cuda:1] Slot acquired (waited 7.0s). Starting GCN...
    FINAL_RESULT: {'acc': {'train': 0.9071428571428571, 'valid': 0.584, 'test': 0.776}, 'wall_s': 19.72, 'cpu_s': 17.9, 'gpu_s': 1.79, 'wait_s': 7.04}
    [Time] wall=19.7s | cpu=17.9s | gpu=1.8s
    C:\Users\fbrev\Documents\Acadêmico\Simulações\Python\NoisyGL\predictor\Base_Predictor.py:114: UserWarning: expandable_segments not supported on this platform (Triggered internally at ..\c10/cuda/CUDAAllocatorConfig.h:28.)
    self.edge_index = self._cpu_edge_index.to(self.device)
    C:\Users\fbrev\Documents\Acadêmico\Simulações\Python\NoisyGL\predictor\Base_Predictor.py:144: UserWarning: Sparse CSR tensor support is in beta state. If you miss a functionality in the sparse tensor support, please submit a feature request to https://github.com/pytorch/pytorch/issues. (Triggered internally at ..\aten\src\ATen\SparseCsrTensorImpl.cpp:55.)
    self.adj_csr = self.adj.to_sparse_csr().to(self.device)
[I 2026-05-08 03:15:58,126] Trial 31 finished with value: 0.776 and parameters: {'lr': 0.005, 'weight_decay': 0.001, 'n_hidden': 256, 'n_layer': 2, 'dropout': 0.46678851494205986, 'knn_mode': 'd', 'k': 38, 'dexp': 5.380675128651253, 'p_grd': 0.7900475524834444, 'unc_rem': 0.4998219281810111, 'unc_rel': 0.5340060472699476}. Best is trial 20 with value: 0.784.
    [CPU] Loading cora...
    DEBUG 3.1: Dataset init start
    DEBUG 3.2: prepare_data start cora
    ----Data statistics------'
    Name: cora
    #Nodes 2708
    #Edges 5278
    #Classes 7
    #Ave_degree 3.90
    ----Split statistics------'
    #Train samples 140 (default)
    #Val samples 500 (default)
    #Test samples 1000 (default)
    ----label noise information:------
    Instance dependent noise
    #Actual noise rate 0.21
    [cuda:1] LNPCC waiting for GPU slot...
    [cuda:1] Slot acquired (waited 0.0s). Starting GCN...
    FINAL_RESULT: {'acc': {'train': 0.8857142857142857, 'valid': 0.586, 'test': 0.769}, 'wall_s': 26.98, 'cpu_s': 25.18, 'gpu_s': 1.77, 'wait_s': 0.0}
    [Time] wall=27.0s | cpu=25.2s | gpu=1.8s
    C:\Users\fbrev\Documents\Acadêmico\Simulações\Python\NoisyGL\predictor\Base_Predictor.py:114: UserWarning: expandable_segments not supported on this platform (Triggered internally at ..\c10/cuda/CUDAAllocatorConfig.h:28.)
    self.edge_index = self._cpu_edge_index.to(self.device)
    C:\Users\fbrev\Documents\Acadêmico\Simulações\Python\NoisyGL\predictor\Base_Predictor.py:144: UserWarning: Sparse CSR tensor support is in beta state. If you miss a functionality in the sparse tensor support, please submit a feature request to https://github.com/pytorch/pytorch/issues. (Triggered internally at ..\aten\src\ATen\SparseCsrTensorImpl.cpp:55.)
    self.adj_csr = self.adj.to_sparse_csr().to(self.device)
[I 2026-05-08 03:16:30,060] Trial 32 finished with value: 0.769 and parameters: {'lr': 0.005, 'weight_decay': 0.001, 'n_hidden': 256, 'n_layer': 2, 'dropout': 0.5478675629871066, 'knn_mode': 'd', 'k': 28, 'dexp': 4.4148928256930935, 'p_grd': 0.9474833713868647, 'unc_rem': 0.7916354788853955, 'unc_rel': 0.6857753077254205}. Best is trial 20 with value: 0.784.
    [CPU] Loading cora...
    DEBUG 3.1: Dataset init start
    DEBUG 3.2: prepare_data start cora
    ----Data statistics------'
    Name: cora
    #Nodes 2708
    #Edges 5278
    #Classes 7
    #Ave_degree 3.90
    ----Split statistics------'
    #Train samples 140 (default)
    #Val samples 500 (default)
    #Test samples 1000 (default)
    ----label noise information:------
    Instance dependent noise
    #Actual noise rate 0.21
    [cuda:1] LNPCC waiting for GPU slot...
    [cuda:1] Slot acquired (waited 9.9s). Starting GCN...
    FINAL_RESULT: {'acc': {'train': 0.85, 'valid': 0.574, 'test': 0.745}, 'wall_s': 17.07, 'cpu_s': 15.36, 'gpu_s': 1.68, 'wait_s': 9.92}
    [Time] wall=17.1s | cpu=15.4s | gpu=1.7s
    C:\Users\fbrev\Documents\Acadêmico\Simulações\Python\NoisyGL\predictor\Base_Predictor.py:114: UserWarning: expandable_segments not supported on this platform (Triggered internally at ..\c10/cuda/CUDAAllocatorConfig.h:28.)
    self.edge_index = self._cpu_edge_index.to(self.device)
    C:\Users\fbrev\Documents\Acadêmico\Simulações\Python\NoisyGL\predictor\Base_Predictor.py:144: UserWarning: Sparse CSR tensor support is in beta state. If you miss a functionality in the sparse tensor support, please submit a feature request to https://github.com/pytorch/pytorch/issues. (Triggered internally at ..\aten\src\ATen\SparseCsrTensorImpl.cpp:55.)
    self.adj_csr = self.adj.to_sparse_csr().to(self.device)
[I 2026-05-08 03:17:02,302] Trial 33 finished with value: 0.745 and parameters: {'lr': 0.005, 'weight_decay': 0.05, 'n_hidden': 256, 'n_layer': 2, 'dropout': 0.6708718006067405, 'knn_mode': 'd', 'k': 34, 'dexp': 6.0052335908448535, 'p_grd': 0.7116145932522884, 'unc_rem': 0.6516021346250741, 'unc_rel': 0.5851856159507404}. Best is trial 20 with value: 0.784.
    [CPU] Loading cora...
    DEBUG 3.1: Dataset init start
    DEBUG 3.2: prepare_data start cora
    ----Data statistics------'
    Name: cora
    #Nodes 2708
    #Edges 5278
    #Classes 7
    #Ave_degree 3.90
    ----Split statistics------'
    #Train samples 140 (default)
    #Val samples 500 (default)
    #Test samples 1000 (default)
    ----label noise information:------
    Instance dependent noise
    #Actual noise rate 0.21
    [cuda:1] LNPCC waiting for GPU slot...
    [cuda:1] Slot acquired (waited 0.0s). Starting GCN...
    FINAL_RESULT: {'acc': {'train': 0.8857142857142857, 'valid': 0.584, 'test': 0.78}, 'wall_s': 33.59, 'cpu_s': 31.55, 'gpu_s': 2.02, 'wait_s': 0.0}
    [Time] wall=33.6s | cpu=31.5s | gpu=2.0s
    C:\Users\fbrev\Documents\Acadêmico\Simulações\Python\NoisyGL\predictor\Base_Predictor.py:114: UserWarning: expandable_segments not supported on this platform (Triggered internally at ..\c10/cuda/CUDAAllocatorConfig.h:28.)
    self.edge_index = self._cpu_edge_index.to(self.device)
    C:\Users\fbrev\Documents\Acadêmico\Simulações\Python\NoisyGL\predictor\Base_Predictor.py:144: UserWarning: Sparse CSR tensor support is in beta state. If you miss a functionality in the sparse tensor support, please submit a feature request to https://github.com/pytorch/pytorch/issues. (Triggered internally at ..\aten\src\ATen\SparseCsrTensorImpl.cpp:55.)
    self.adj_csr = self.adj.to_sparse_csr().to(self.device)
[I 2026-05-08 03:17:41,117] Trial 34 finished with value: 0.78 and parameters: {'lr': 0.005, 'weight_decay': 0.001, 'n_hidden': 256, 'n_layer': 2, 'dropout': 0.6099520528952113, 'knn_mode': 'd', 'k': 41, 'dexp': 5.086387157193387, 'p_grd': 0.9238633806273495, 'unc_rem': 0.5462809903017584, 'unc_rel': 0.793148519870315}. Best is trial 20 with value: 0.784.
    [CPU] Loading cora...
    DEBUG 3.1: Dataset init start
    DEBUG 3.2: prepare_data start cora
    ----Data statistics------'
    Name: cora
    #Nodes 2708
    #Edges 5278
    #Classes 7
    #Ave_degree 3.90
    ----Split statistics------'
    #Train samples 140 (default)
    #Val samples 500 (default)
    #Test samples 1000 (default)
    ----label noise information:------
    Instance dependent noise
    #Actual noise rate 0.21
    [cuda:1] LNPCC waiting for GPU slot...
    [cuda:1] Slot acquired (waited 11.0s). Starting GCN...
    FINAL_RESULT: {'acc': {'train': 0.9705882352941176, 'valid': 0.534, 'test': 0.677}, 'wall_s': 13.36, 'cpu_s': 10.99, 'gpu_s': 2.34, 'wait_s': 10.96}
    [Time] wall=13.4s | cpu=11.0s | gpu=2.3s
    C:\Users\fbrev\Documents\Acadêmico\Simulações\Python\NoisyGL\predictor\Base_Predictor.py:114: UserWarning: expandable_segments not supported on this platform (Triggered internally at ..\c10/cuda/CUDAAllocatorConfig.h:28.)
    self.edge_index = self._cpu_edge_index.to(self.device)
    C:\Users\fbrev\Documents\Acadêmico\Simulações\Python\NoisyGL\predictor\Base_Predictor.py:144: UserWarning: Sparse CSR tensor support is in beta state. If you miss a functionality in the sparse tensor support, please submit a feature request to https://github.com/pytorch/pytorch/issues. (Triggered internally at ..\aten\src\ATen\SparseCsrTensorImpl.cpp:55.)
    self.adj_csr = self.adj.to_sparse_csr().to(self.device)
