[I 2026-05-01 01:33:43,599] Trial 69 finished with value: 0.722 and parameters: {'lr': 0.001, 'weight_decay': 0.01, 'n_hidden': 256, 'n_layer': 2, 'dropout': 0.5207699002386137, 'knn_mode': 's', 'k': 47, 'dexp': 6.701176081918098, 'p_grd': 0.28107679929646495, 'unc_rem': 0.38040674792003876, 'unc_rel': 0.5544677719209997}. Best is trial 37 with value: 0.786.
    [CPU] Loading amazoncom...
    DEBUG 3.1: Dataset init start
    DEBUG 3.2: prepare_data start amazoncom
    ----Data statistics------'
    Name: amazoncom
    #Nodes 13752
    #Edges 245861
    #Classes 10
    #Ave_degree 35.76
    ----Split statistics------'
    #Train samples 200 (20 nodes per class)
    #Val samples 500 (specified)
    #Test samples 1000 (specified)
    ----label noise information:------
    Instance dependent noise
    #Actual noise rate 0.40
    [cuda:1] LNPCC waiting for GPU slot...
    [cuda:1] Slot acquired (waited 368.9s). Starting GCN...
    FINAL_RESULT: {'acc': {'train': 0.5959595959595959, 'valid': 0.496, 'test': 0.786}, 'wall_s': 50.02, 'cpu_s': 46.9, 'gpu_s': 3.03, 'wait_s': 368.93}
    [Time] wall=50.0s | cpu=46.9s | gpu=3.0s
    C:\Users\fbrev\Documents\Acadêmico\Simulações\Python\NoisyGL\predictor\Base_Predictor.py:144: UserWarning: Sparse CSR tensor support is in beta state. If you miss a functionality in the sparse tensor support, please submit a feature request to https://github.com/pytorch/pytorch/issues. (Triggered internally at ..\aten\src\ATen\SparseCsrTensorImpl.cpp:55.)
    self.adj_csr = self.adj.to_sparse_csr().to(self.device)
[I 2026-05-01 01:40:48,472] Trial 70 finished with value: 0.786 and parameters: {'lr': 0.001, 'weight_decay': 0.01, 'n_hidden': 32, 'n_layer': 2, 'dropout': 0.45544342540536353, 'knn_mode': 's', 'k': 45, 'dexp': 6.145329837977266, 'p_grd': 0.9576020628369857, 'unc_rem': 0.433006238996765, 'unc_rel': 0.5151737304354804}. Best is trial 37 with value: 0.786.
    [CPU] Loading amazoncom...
    DEBUG 3.1: Dataset init start
    DEBUG 3.2: prepare_data start amazoncom
    ----Data statistics------'
    Name: amazoncom
    #Nodes 13752
    #Edges 245861
    #Classes 10
    #Ave_degree 35.76
    ----Split statistics------'
    #Train samples 200 (20 nodes per class)
    #Val samples 500 (specified)
    #Test samples 1000 (specified)
    ----label noise information:------
    Instance dependent noise
    #Actual noise rate 0.40
    [cuda:1] LNPCC waiting for GPU slot...
    [cuda:1] Slot acquired (waited 82.1s). Starting GCN...
    FINAL_RESULT: {'acc': {'train': 0.10152284263959391, 'valid': 0.252, 'test': 0.376}, 'wall_s': 55.54, 'cpu_s': 52.52, 'gpu_s': 2.91, 'wait_s': 82.14}
    [Time] wall=55.5s | cpu=52.5s | gpu=2.9s
    C:\Users\fbrev\Documents\Acadêmico\Simulações\Python\NoisyGL\predictor\Base_Predictor.py:144: UserWarning: Sparse CSR tensor support is in beta state. If you miss a functionality in the sparse tensor support, please submit a feature request to https://github.com/pytorch/pytorch/issues. (Triggered internally at ..\aten\src\ATen\SparseCsrTensorImpl.cpp:55.)
    self.adj_csr = self.adj.to_sparse_csr().to(self.device)
[I 2026-05-01 01:43:12,265] Trial 71 finished with value: 0.376 and parameters: {'lr': 0.1, 'weight_decay': 0.01, 'n_hidden': 32, 'n_layer': 2, 'dropout': 0.45342402236579266, 'knn_mode': 's', 'k': 16, 'dexp': 5.350446512204523, 'p_grd': 0.9483139707150464, 'unc_rem': 0.5941733338583, 'unc_rel': 0.6034111272665986}. Best is trial 37 with value: 0.786.
    [CPU] Loading amazoncom...
    DEBUG 3.1: Dataset init start
    DEBUG 3.2: prepare_data start amazoncom
    ----Data statistics------'
    Name: amazoncom
    #Nodes 13752
    #Edges 245861
    #Classes 10
    #Ave_degree 35.76
    ----Split statistics------'
    #Train samples 200 (20 nodes per class)
    #Val samples 500 (specified)
    #Test samples 1000 (specified)
    ----label noise information:------
    Instance dependent noise
    #Actual noise rate 0.40
    [cuda:1] LNPCC waiting for GPU slot...
    [cuda:1] Slot acquired (waited 83.1s). Starting GCN...
    FINAL_RESULT: {'acc': {'train': 0.6363636363636364, 'valid': 0.496, 'test': 0.788}, 'wall_s': 50.56, 'cpu_s': 47.53, 'gpu_s': 2.92, 'wait_s': 83.14}
    [Time] wall=50.6s | cpu=47.5s | gpu=2.9s
    C:\Users\fbrev\Documents\Acadêmico\Simulações\Python\NoisyGL\predictor\Base_Predictor.py:144: UserWarning: Sparse CSR tensor support is in beta state. If you miss a functionality in the sparse tensor support, please submit a feature request to https://github.com/pytorch/pytorch/issues. (Triggered internally at ..\aten\src\ATen\SparseCsrTensorImpl.cpp:55.)
    self.adj_csr = self.adj.to_sparse_csr().to(self.device)
[I 2026-05-01 01:45:32,141] Trial 72 finished with value: 0.788 and parameters: {'lr': 0.001, 'weight_decay': 0.01, 'n_hidden': 32, 'n_layer': 2, 'dropout': 0.544909916139209, 'knn_mode': 's', 'k': 44, 'dexp': 6.145861936924412, 'p_grd': 0.954743567913316, 'unc_rem': 0.4326558713014469, 'unc_rel': 0.5030054652713031}. Best is trial 72 with value: 0.788.
    [CPU] Loading amazoncom...
    DEBUG 3.1: Dataset init start
    DEBUG 3.2: prepare_data start amazoncom
    ----Data statistics------'
    Name: amazoncom
    #Nodes 13752
    #Edges 245861
    #Classes 10
    #Ave_degree 35.76
    ----Split statistics------'
    #Train samples 200 (20 nodes per class)
    #Val samples 500 (specified)
    #Test samples 1000 (specified)
    ----label noise information:------
    Instance dependent noise
    #Actual noise rate 0.40
    [cuda:1] LNPCC waiting for GPU slot...
    [cuda:1] Slot acquired (waited 79.7s). Starting GCN...
    FINAL_RESULT: {'acc': {'train': 0.6161616161616161, 'valid': 0.492, 'test': 0.761}, 'wall_s': 52.32, 'cpu_s': 49.18, 'gpu_s': 3.05, 'wait_s': 79.67}
    [Time] wall=52.3s | cpu=49.2s | gpu=3.0s
    C:\Users\fbrev\Documents\Acadêmico\Simulações\Python\NoisyGL\predictor\Base_Predictor.py:144: UserWarning: Sparse CSR tensor support is in beta state. If you miss a functionality in the sparse tensor support, please submit a feature request to https://github.com/pytorch/pytorch/issues. (Triggered internally at ..\aten\src\ATen\SparseCsrTensorImpl.cpp:55.)
    self.adj_csr = self.adj.to_sparse_csr().to(self.device)
[I 2026-05-01 01:47:50,406] Trial 73 finished with value: 0.761 and parameters: {'lr': 0.001, 'weight_decay': 0.01, 'n_hidden': 32, 'n_layer': 2, 'dropout': 0.5580112262783004, 'knn_mode': 's', 'k': 45, 'dexp': 6.133789099332827, 'p_grd': 0.9017265490258206, 'unc_rem': 0.46510745420788707, 'unc_rel': 0.5083374480138205}. Best is trial 72 with value: 0.788.
    [CPU] Loading amazoncom...
    DEBUG 3.1: Dataset init start
    DEBUG 3.2: prepare_data start amazoncom
    ----Data statistics------'
    Name: amazoncom
    #Nodes 13752
    #Edges 245861
    #Classes 10
    #Ave_degree 35.76
    ----Split statistics------'
    #Train samples 200 (20 nodes per class)
    #Val samples 500 (specified)
    #Test samples 1000 (specified)
    ----label noise information:------
    Instance dependent noise
    #Actual noise rate 0.40
    [cuda:1] LNPCC waiting for GPU slot...
    [cuda:1] Slot acquired (waited 80.6s). Starting GCN...
    FINAL_RESULT: {'acc': {'train': 0.6464646464646465, 'valid': 0.488, 'test': 0.797}, 'wall_s': 53.49, 'cpu_s': 50.47, 'gpu_s': 2.92, 'wait_s': 80.63}
    [Time] wall=53.5s | cpu=50.5s | gpu=2.9s
    C:\Users\fbrev\Documents\Acadêmico\Simulações\Python\NoisyGL\predictor\Base_Predictor.py:144: UserWarning: Sparse CSR tensor support is in beta state. If you miss a functionality in the sparse tensor support, please submit a feature request to https://github.com/pytorch/pytorch/issues. (Triggered internally at ..\aten\src\ATen\SparseCsrTensorImpl.cpp:55.)
    self.adj_csr = self.adj.to_sparse_csr().to(self.device)
[I 2026-05-01 01:50:10,259] Trial 74 finished with value: 0.797 and parameters: {'lr': 0.001, 'weight_decay': 0.01, 'n_hidden': 32, 'n_layer': 2, 'dropout': 0.6147883511107288, 'knn_mode': 's', 'k': 44, 'dexp': 5.926249721167936, 'p_grd': 0.943723226812974, 'unc_rem': 0.6855014433493036, 'unc_rel': 0.46401436716932565}. Best is trial 74 with value: 0.797.
    [CPU] Loading amazoncom...
    DEBUG 3.1: Dataset init start
    DEBUG 3.2: prepare_data start amazoncom
    ----Data statistics------'
    Name: amazoncom
    #Nodes 13752
    #Edges 245861
    #Classes 10
    #Ave_degree 35.76
    ----Split statistics------'
    #Train samples 200 (20 nodes per class)
    #Val samples 500 (specified)
    #Test samples 1000 (specified)
    ----label noise information:------
    Instance dependent noise
    #Actual noise rate 0.40
    [cuda:1] LNPCC waiting for GPU slot...
    [cuda:1] Slot acquired (waited 361.8s). Starting GCN...
    FINAL_RESULT: {'acc': {'train': 0.6464646464646465, 'valid': 0.494, 'test': 0.768}, 'wall_s': 58.12, 'cpu_s': 55.28, 'gpu_s': 2.74, 'wait_s': 361.82}
    [Time] wall=58.1s | cpu=55.3s | gpu=2.7s
    C:\Users\fbrev\Documents\Acadêmico\Simulações\Python\NoisyGL\predictor\Base_Predictor.py:144: UserWarning: Sparse CSR tensor support is in beta state. If you miss a functionality in the sparse tensor support, please submit a feature request to https://github.com/pytorch/pytorch/issues. (Triggered internally at ..\aten\src\ATen\SparseCsrTensorImpl.cpp:55.)
    self.adj_csr = self.adj.to_sparse_csr().to(self.device)
[I 2026-05-01 01:57:16,375] Trial 75 finished with value: 0.768 and parameters: {'lr': 0.001, 'weight_decay': 0.01, 'n_hidden': 32, 'n_layer': 2, 'dropout': 0.6055310358848032, 'knn_mode': 's', 'k': 48, 'dexp': 5.718931488008175, 'p_grd': 0.9657750404050298, 'unc_rem': 0.6874503949474982, 'unc_rel': 0.46535454656021535}. Best is trial 74 with value: 0.797.
    [CPU] Loading amazoncom...
    DEBUG 3.1: Dataset init start
    DEBUG 3.2: prepare_data start amazoncom
    ----Data statistics------'
    Name: amazoncom
    #Nodes 13752
    #Edges 245861
    #Classes 10
    #Ave_degree 35.76
    ----Split statistics------'
    #Train samples 200 (20 nodes per class)
    #Val samples 500 (specified)
    #Test samples 1000 (specified)
    ----label noise information:------
    Instance dependent noise
    #Actual noise rate 0.40
    [cuda:1] LNPCC waiting for GPU slot...
    [cuda:1] Slot acquired (waited 96.9s). Starting GCN...
    FINAL_RESULT: {'acc': {'train': 0.5858585858585859, 'valid': 0.492, 'test': 0.75}, 'wall_s': 46.62, 'cpu_s': 43.84, 'gpu_s': 2.69, 'wait_s': 96.95}
    [Time] wall=46.6s | cpu=43.8s | gpu=2.7s
    C:\Users\fbrev\Documents\Acadêmico\Simulações\Python\NoisyGL\predictor\Base_Predictor.py:144: UserWarning: Sparse CSR tensor support is in beta state. If you miss a functionality in the sparse tensor support, please submit a feature request to https://github.com/pytorch/pytorch/issues. (Triggered internally at ..\aten\src\ATen\SparseCsrTensorImpl.cpp:55.)
    self.adj_csr = self.adj.to_sparse_csr().to(self.device)
[I 2026-05-01 01:59:45,604] Trial 76 finished with value: 0.75 and parameters: {'lr': 0.001, 'weight_decay': 0.01, 'n_hidden': 32, 'n_layer': 2, 'dropout': 0.6414208865507475, 'knn_mode': 's', 'k': 46, 'dexp': 7.164446450028068, 'p_grd': 0.925780303207818, 'unc_rem': 0.5431254797256442, 'unc_rel': 0.4989450150405559}. Best is trial 74 with value: 0.797.
    [CPU] Loading amazoncom...
    DEBUG 3.1: Dataset init start
    DEBUG 3.2: prepare_data start amazoncom
    ----Data statistics------'
    Name: amazoncom
    #Nodes 13752
    #Edges 245861
    #Classes 10
    #Ave_degree 35.76
    ----Split statistics------'
    #Train samples 200 (20 nodes per class)
    #Val samples 500 (specified)
    #Test samples 1000 (specified)
    ----label noise information:------
    Instance dependent noise
    #Actual noise rate 0.40
    [cuda:1] LNPCC waiting for GPU slot...
    [cuda:1] Slot acquired (waited 231.6s). Starting GCN...
    FINAL_RESULT: {'acc': {'train': 0.5606060606060606, 'valid': 0.484, 'test': 0.723}, 'wall_s': 52.41, 'cpu_s': 49.41, 'gpu_s': 2.92, 'wait_s': 231.65}
    [Time] wall=52.4s | cpu=49.4s | gpu=2.9s
    C:\Users\fbrev\Documents\Acadêmico\Simulações\Python\NoisyGL\predictor\Base_Predictor.py:144: UserWarning: Sparse CSR tensor support is in beta state. If you miss a functionality in the sparse tensor support, please submit a feature request to https://github.com/pytorch/pytorch/issues. (Triggered internally at ..\aten\src\ATen\SparseCsrTensorImpl.cpp:55.)
    self.adj_csr = self.adj.to_sparse_csr().to(self.device)
[I 2026-05-01 02:04:35,868] Trial 77 finished with value: 0.723 and parameters: {'lr': 0.01, 'weight_decay': 0.01, 'n_hidden': 32, 'n_layer': 2, 'dropout': 0.541218284708539, 'knn_mode': 's', 'k': 44, 'dexp': 6.032782490867259, 'p_grd': 0.976742754446075, 'unc_rem': 0.7583448636987392, 'unc_rel': 0.41793633861873225}. Best is trial 74 with value: 0.797.
    [CPU] Loading amazoncom...
    DEBUG 3.1: Dataset init start
    DEBUG 3.2: prepare_data start amazoncom
    ----Data statistics------'
    Name: amazoncom
    #Nodes 13752
    #Edges 245861
    #Classes 10
    #Ave_degree 35.76
    ----Split statistics------'
    #Train samples 200 (20 nodes per class)
    #Val samples 500 (specified)
    #Test samples 1000 (specified)
    ----label noise information:------
    Instance dependent noise
    #Actual noise rate 0.40
    [cuda:1] LNPCC waiting for GPU slot...
    [cuda:1] Slot acquired (waited 209.2s). Starting GCN...
    FINAL_RESULT: {'acc': {'train': 0.5656565656565656, 'valid': 0.464, 'test': 0.747}, 'wall_s': 44.46, 'cpu_s': 40.97, 'gpu_s': 3.4, 'wait_s': 209.22}
    [Time] wall=44.5s | cpu=41.0s | gpu=3.4s
    C:\Users\fbrev\Documents\Acadêmico\Simulações\Python\NoisyGL\predictor\Base_Predictor.py:144: UserWarning: Sparse CSR tensor support is in beta state. If you miss a functionality in the sparse tensor support, please submit a feature request to https://github.com/pytorch/pytorch/issues. (Triggered internally at ..\aten\src\ATen\SparseCsrTensorImpl.cpp:55.)
    self.adj_csr = self.adj.to_sparse_csr().to(self.device)
[I 2026-05-01 02:08:55,126] Trial 78 finished with value: 0.747 and parameters: {'lr': 0.001, 'weight_decay': 0.01, 'n_hidden': 32, 'n_layer': 3, 'dropout': 0.589012059924635, 'knn_mode': 's', 'k': 49, 'dexp': 6.3516835507446, 'p_grd': 0.875790709803498, 'unc_rem': 0.4417353067952374, 'unc_rel': 0.5867400953701952}. Best is trial 74 with value: 0.797.
    [CPU] Loading amazoncom...
    DEBUG 3.1: Dataset init start
    DEBUG 3.2: prepare_data start amazoncom
    ----Data statistics------'
    Name: amazoncom
    #Nodes 13752
    #Edges 245861
    #Classes 10
    #Ave_degree 35.76
    ----Split statistics------'
    #Train samples 200 (20 nodes per class)
    #Val samples 500 (specified)
    #Test samples 1000 (specified)
    ----label noise information:------
    Instance dependent noise
    #Actual noise rate 0.40
    [cuda:1] LNPCC waiting for GPU slot...
    [cuda:1] Slot acquired (waited 735.4s). Starting GCN...
    FINAL_RESULT: {'acc': {'train': 0.6212121212121212, 'valid': 0.486, 'test': 0.765}, 'wall_s': 42.11, 'cpu_s': 39.21, 'gpu_s': 2.83, 'wait_s': 735.43}
    [Time] wall=42.1s | cpu=39.2s | gpu=2.8s
    C:\Users\fbrev\Documents\Acadêmico\Simulações\Python\NoisyGL\predictor\Base_Predictor.py:144: UserWarning: Sparse CSR tensor support is in beta state. If you miss a functionality in the sparse tensor support, please submit a feature request to https://github.com/pytorch/pytorch/issues. (Triggered internally at ..\aten\src\ATen\SparseCsrTensorImpl.cpp:55.)
    self.adj_csr = self.adj.to_sparse_csr().to(self.device)
[I 2026-05-01 02:21:58,174] Trial 79 finished with value: 0.765 and parameters: {'lr': 0.005, 'weight_decay': 0.01, 'n_hidden': 32, 'n_layer': 2, 'dropout': 0.6264408468210781, 'knn_mode': 's', 'k': 50, 'dexp': 5.178669460154122, 'p_grd': 0.8583004485087198, 'unc_rem': 0.39939005160773067, 'unc_rel': 0.5451293386249919}. Best is trial 74 with value: 0.797.
    [CPU] Loading amazoncom...
    DEBUG 3.1: Dataset init start
    DEBUG 3.2: prepare_data start amazoncom
    ----Data statistics------'
    Name: amazoncom
    #Nodes 13752
    #Edges 245861
    #Classes 10
    #Ave_degree 35.76
    ----Split statistics------'
    #Train samples 200 (20 nodes per class)
    #Val samples 500 (specified)
    #Test samples 1000 (specified)
    ----label noise information:------
    Instance dependent noise
    #Actual noise rate 0.40
    [cuda:1] LNPCC waiting for GPU slot...
    [cuda:1] Slot acquired (waited 234.0s). Starting GCN...
    FINAL_RESULT: {'acc': {'train': 0.84375, 'valid': 0.468, 'test': 0.718}, 'wall_s': 32.35, 'cpu_s': 29.45, 'gpu_s': 2.82, 'wait_s': 233.99}
    [Time] wall=32.3s | cpu=29.4s | gpu=2.8s
    C:\Users\fbrev\Documents\Acadêmico\Simulações\Python\NoisyGL\predictor\Base_Predictor.py:144: UserWarning: Sparse CSR tensor support is in beta state. If you miss a functionality in the sparse tensor support, please submit a feature request to https://github.com/pytorch/pytorch/issues. (Triggered internally at ..\aten\src\ATen\SparseCsrTensorImpl.cpp:55.)
    self.adj_csr = self.adj.to_sparse_csr().to(self.device)
[I 2026-05-01 02:26:30,309] Trial 80 finished with value: 0.718 and parameters: {'lr': 0.001, 'weight_decay': 0.0001, 'n_hidden': 32, 'n_layer': 2, 'dropout': 0.3828290895774844, 'knn_mode': 's', 'k': 47, 'dexp': 6.837038381150915, 'p_grd': 0.15123345613026473, 'unc_rem': 0.5099575527862233, 'unc_rel': 0.3934195401109829}. Best is trial 74 with value: 0.797.
    [CPU] Loading amazoncom...
    DEBUG 3.1: Dataset init start
    DEBUG 3.2: prepare_data start amazoncom
    ----Data statistics------'
    Name: amazoncom
    #Nodes 13752
    #Edges 245861
    #Classes 10
    #Ave_degree 35.76
    ----Split statistics------'
    #Train samples 200 (20 nodes per class)
    #Val samples 500 (specified)
    #Test samples 1000 (specified)
    ----label noise information:------
    Instance dependent noise
    #Actual noise rate 0.40
    [cuda:1] LNPCC waiting for GPU slot...
    [cuda:1] Slot acquired (waited 750.6s). Starting GCN...
    FINAL_RESULT: {'acc': {'train': 0.6616161616161617, 'valid': 0.494, 'test': 0.792}, 'wall_s': 48.32, 'cpu_s': 45.46, 'gpu_s': 2.75, 'wait_s': 750.57}
    [Time] wall=48.3s | cpu=45.5s | gpu=2.8s
    C:\Users\fbrev\Documents\Acadêmico\Simulações\Python\NoisyGL\predictor\Base_Predictor.py:144: UserWarning: Sparse CSR tensor support is in beta state. If you miss a functionality in the sparse tensor support, please submit a feature request to https://github.com/pytorch/pytorch/issues. (Triggered internally at ..\aten\src\ATen\SparseCsrTensorImpl.cpp:55.)
    self.adj_csr = self.adj.to_sparse_csr().to(self.device)
[I 2026-05-01 02:39:54,718] Trial 81 finished with value: 0.792 and parameters: {'lr': 0.001, 'weight_decay': 0.01, 'n_hidden': 32, 'n_layer': 2, 'dropout': 0.6541222945351162, 'knn_mode': 's', 'k': 41, 'dexp': 5.626706910836695, 'p_grd': 0.9396741353820034, 'unc_rem': 0.6501254660285466, 'unc_rel': 0.701299632482091}. Best is trial 74 with value: 0.797.
    [CPU] Loading amazoncom...
    DEBUG 3.1: Dataset init start
    DEBUG 3.2: prepare_data start amazoncom
    ----Data statistics------'
    Name: amazoncom
    #Nodes 13752
    #Edges 245861
    #Classes 10
    #Ave_degree 35.76
    ----Split statistics------'
    #Train samples 200 (20 nodes per class)
    #Val samples 500 (specified)
    #Test samples 1000 (specified)
    ----label noise information:------
    Instance dependent noise
    #Actual noise rate 0.40
    [cuda:1] LNPCC waiting for GPU slot...
    [cuda:1] Slot acquired (waited 611.5s). Starting GCN...
[I 2026-05-01 02:51:08,387] Trial 82 finished with value: 0.0 and parameters: {'lr': 0.001, 'weight_decay': 0.01, 'n_hidden': 32, 'n_layer': 2, 'dropout': 0.6556308811624911, 'knn_mode': 's', 'k': 41, 'dexp': 5.486586981646495, 'p_grd': 0.9945261755079275, 'unc_rem': 0.640529054685187, 'unc_rel': 0.6933896129700573}. Best is trial 74 with value: 0.797.
    [CPU] Loading amazoncom...
    DEBUG 3.1: Dataset init start
    DEBUG 3.2: prepare_data start amazoncom
    ----Data statistics------'
    Name: amazoncom
    #Nodes 13752
    #Edges 245861
    #Classes 10
    #Ave_degree 35.76
    ----Split statistics------'
    #Train samples 200 (20 nodes per class)
    #Val samples 500 (specified)
    #Test samples 1000 (specified)
    ----label noise information:------
    Instance dependent noise
    #Actual noise rate 0.40
    [cuda:1] LNPCC waiting for GPU slot...
    [cuda:1] Slot acquired (waited 99.2s). Starting GCN...
    FINAL_RESULT: {'acc': {'train': 0.6565656565656566, 'valid': 0.494, 'test': 0.785}, 'wall_s': 51.31, 'cpu_s': 48.32, 'gpu_s': 2.88, 'wait_s': 99.25}
    [Time] wall=51.3s | cpu=48.3s | gpu=2.9s
    C:\Users\fbrev\Documents\Acadêmico\Simulações\Python\NoisyGL\predictor\Base_Predictor.py:144: UserWarning: Sparse CSR tensor support is in beta state. If you miss a functionality in the sparse tensor support, please submit a feature request to https://github.com/pytorch/pytorch/issues. (Triggered internally at ..\aten\src\ATen\SparseCsrTensorImpl.cpp:55.)
    self.adj_csr = self.adj.to_sparse_csr().to(self.device)
