[I 2026-05-03 01:07:31,125] Trial 10 finished with value: 0.4098333608315459 and parameters: {'lr': 0.001, 'weight_decay': 0.0001, 'n_hidden': 64, 'n_layer': 3, 'dropout': 0.5010717996397103, 'knn_mode': 's', 'k': 31, 'dexp': 8.74303814548153, 'p_grd': 0.20174722186804284, 'unc_rem': 0.7503910147836939, 'unc_rel': 0.2507056072345083}. Best is trial 8 with value: 0.5269757465764725.
    [CPU] Loading flickr...
    DEBUG 3.1: Dataset init start
    DEBUG 3.2: prepare_data start flickr
    ----Data statistics------'
    Name: flickr
    #Nodes 7575
    #Edges 239738
    #Classes 9
    #Ave_degree 63.30
    ----Split statistics------'
    #Train samples 378 (5.0 % of nodes)
    #Val samples 1136 (15.0 % of nodes)
    #Test samples 6061 (remaining)
    ----label noise information:------
    Instance dependent noise
    #Actual noise rate 0.13
    [cuda:1] LNPCC waiting for GPU slot...
    [cuda:1] Slot acquired (waited 149.7s). Starting GCN...
    FINAL_RESULT: {'acc': {'train': 0.843915343915344, 'valid': 0.49735915492957744, 'test': 0.5604685695429797}, 'wall_s': 120.08, 'cpu_s': 115.36, 'gpu_s': 4.49, 'wait_s': 149.73}
    [Time] wall=120.1s | cpu=115.4s | gpu=4.5s
    C:\Users\fbrev\anaconda3\envs\noisygl\Lib\site-packages\torch\_utils.py:315: UserWarning: Sparse CSR tensor support is in beta state. If you miss a functionality in the sparse tensor support, please submit a feature request to https://github.com/pytorch/pytorch/issues. (Triggered internally at ..\aten\src\ATen\SparseCsrTensorImpl.cpp:55.)
    result = torch.sparse_compressed_tensor(
    C:\Users\fbrev\Documents\Acadêmico\Simulações\Python\NoisyGL\predictor\Base_Predictor.py:114: UserWarning: expandable_segments not supported on this platform (Triggered internally at ..\c10/cuda/CUDAAllocatorConfig.h:28.)
    self.edge_index = self._cpu_edge_index.to(self.device)
[I 2026-05-03 01:12:05,631] Trial 11 finished with value: 0.5604685695429797 and parameters: {'lr': 0.001, 'weight_decay': 0.0, 'n_hidden': 64, 'n_layer': 2, 'dropout': 0.494065325686168, 'knn_mode': 'd', 'k': 42, 'dexp': 7.078978279425739, 'p_grd': 0.8093090331933839, 'unc_rem': 0.8175565956907389, 'unc_rel': 0.2011242639539048}. Best is trial 11 with value: 0.5604685695429797.
    [CPU] Loading flickr...
    DEBUG 3.1: Dataset init start
    DEBUG 3.2: prepare_data start flickr
    ----Data statistics------'
    Name: flickr
    #Nodes 7575
    #Edges 239738
    #Classes 9
    #Ave_degree 63.30
    ----Split statistics------'
    #Train samples 378 (5.0 % of nodes)
    #Val samples 1136 (15.0 % of nodes)
    #Test samples 6061 (remaining)
    ----label noise information:------
    Instance dependent noise
    #Actual noise rate 0.13
    [cuda:1] LNPCC waiting for GPU slot...
    [cuda:1] Slot acquired (waited 160.8s). Starting GCN...
    FINAL_RESULT: {'acc': {'train': 0.9228723404255319, 'valid': 0.5061619718309859, 'test': 0.5695429797063191}, 'wall_s': 50.94, 'cpu_s': 47.14, 'gpu_s': 3.57, 'wait_s': 160.82}
    [Time] wall=50.9s | cpu=47.1s | gpu=3.6s
    C:\Users\fbrev\anaconda3\envs\noisygl\Lib\site-packages\torch\_utils.py:315: UserWarning: Sparse CSR tensor support is in beta state. If you miss a functionality in the sparse tensor support, please submit a feature request to https://github.com/pytorch/pytorch/issues. (Triggered internally at ..\aten\src\ATen\SparseCsrTensorImpl.cpp:55.)
    result = torch.sparse_compressed_tensor(
    C:\Users\fbrev\Documents\Acadêmico\Simulações\Python\NoisyGL\predictor\Base_Predictor.py:114: UserWarning: expandable_segments not supported on this platform (Triggered internally at ..\c10/cuda/CUDAAllocatorConfig.h:28.)
    self.edge_index = self._cpu_edge_index.to(self.device)
[I 2026-05-03 01:15:41,799] Trial 12 finished with value: 0.5695429797063191 and parameters: {'lr': 0.01, 'weight_decay': 0.0001, 'n_hidden': 32, 'n_layer': 2, 'dropout': 0.2122528355439598, 'knn_mode': 's', 'k': 5, 'dexp': 3.415604653326267, 'p_grd': 0.48484851513627636, 'unc_rem': 0.1202648011676728, 'unc_rel': 0.22897144679153436}. Best is trial 12 with value: 0.5695429797063191.
    [CPU] Loading flickr...
    DEBUG 3.1: Dataset init start
    DEBUG 3.2: prepare_data start flickr
    ----Data statistics------'
    Name: flickr
    #Nodes 7575
    #Edges 239738
    #Classes 9
    #Ave_degree 63.30
    ----Split statistics------'
    #Train samples 378 (5.0 % of nodes)
    #Val samples 1136 (15.0 % of nodes)
    #Test samples 6061 (remaining)
    ----label noise information:------
    Instance dependent noise
    #Actual noise rate 0.13
    [cuda:1] LNPCC waiting for GPU slot...
    [cuda:1] Slot acquired (waited 318.0s). Starting GCN...
    FINAL_RESULT: {'acc': {'train': 0.12169312169312169, 'valid': 0.12852112676056338, 'test': 0.11466754660947039}, 'wall_s': 82.82, 'cpu_s': 78.14, 'gpu_s': 4.46, 'wait_s': 318.04}
    [Time] wall=82.8s | cpu=78.1s | gpu=4.5s
    C:\Users\fbrev\anaconda3\envs\noisygl\Lib\site-packages\torch\_utils.py:315: UserWarning: Sparse CSR tensor support is in beta state. If you miss a functionality in the sparse tensor support, please submit a feature request to https://github.com/pytorch/pytorch/issues. (Triggered internally at ..\aten\src\ATen\SparseCsrTensorImpl.cpp:55.)
    result = torch.sparse_compressed_tensor(
    C:\Users\fbrev\Documents\Acadêmico\Simulações\Python\NoisyGL\predictor\Base_Predictor.py:114: UserWarning: expandable_segments not supported on this platform (Triggered internally at ..\c10/cuda/CUDAAllocatorConfig.h:28.)
    self.edge_index = self._cpu_edge_index.to(self.device)
[I 2026-05-03 01:22:27,319] Trial 13 finished with value: 0.11466754660947039 and parameters: {'lr': 0.1, 'weight_decay': 0.01, 'n_hidden': 64, 'n_layer': 2, 'dropout': 0.14062982503090202, 'knn_mode': 'd', 'k': 21, 'dexp': 2.6455009303886685, 'p_grd': 0.3877144538888293, 'unc_rem': 0.27211818926590114, 'unc_rel': 0.3678477824590435}. Best is trial 12 with value: 0.5695429797063191.
    [CPU] Loading flickr...
    DEBUG 3.1: Dataset init start
    DEBUG 3.2: prepare_data start flickr
    ----Data statistics------'
    Name: flickr
    #Nodes 7575
    #Edges 239738
    #Classes 9
    #Ave_degree 63.30
    ----Split statistics------'
    #Train samples 378 (5.0 % of nodes)
    #Val samples 1136 (15.0 % of nodes)
    #Test samples 6061 (remaining)
    ----label noise information:------
    Instance dependent noise
    #Actual noise rate 0.13
    [cuda:1] LNPCC waiting for GPU slot...
    [cuda:1] Slot acquired (waited 18.2s). Starting GCN...
    FINAL_RESULT: {'acc': {'train': 0.1349206349206349, 'valid': 0.13908450704225353, 'test': 0.14321069130506517}, 'wall_s': 121.19, 'cpu_s': 117.32, 'gpu_s': 3.63, 'wait_s': 18.23}
    [Time] wall=121.2s | cpu=117.3s | gpu=3.6s
    C:\Users\fbrev\anaconda3\envs\noisygl\Lib\site-packages\torch\_utils.py:315: UserWarning: Sparse CSR tensor support is in beta state. If you miss a functionality in the sparse tensor support, please submit a feature request to https://github.com/pytorch/pytorch/issues. (Triggered internally at ..\aten\src\ATen\SparseCsrTensorImpl.cpp:55.)
    result = torch.sparse_compressed_tensor(
    C:\Users\fbrev\Documents\Acadêmico\Simulações\Python\NoisyGL\predictor\Base_Predictor.py:114: UserWarning: expandable_segments not supported on this platform (Triggered internally at ..\c10/cuda/CUDAAllocatorConfig.h:28.)
    self.edge_index = self._cpu_edge_index.to(self.device)
[I 2026-05-03 01:24:52,004] Trial 14 finished with value: 0.14321069130506517 and parameters: {'lr': 0.01, 'weight_decay': 0.05, 'n_hidden': 32, 'n_layer': 2, 'dropout': 0.015305141591561267, 'knn_mode': 'd', 'k': 45, 'dexp': 9.576049467794768, 'p_grd': 0.8745776507907911, 'unc_rem': 0.70189039053817, 'unc_rel': 0.9645685504300959}. Best is trial 12 with value: 0.5695429797063191.
    [CPU] Loading flickr...
    DEBUG 3.1: Dataset init start
    DEBUG 3.2: prepare_data start flickr
    ----Data statistics------'
    Name: flickr
    #Nodes 7575
    #Edges 239738
    #Classes 9
    #Ave_degree 63.30
    ----Split statistics------'
    #Train samples 378 (5.0 % of nodes)
    #Val samples 1136 (15.0 % of nodes)
    #Test samples 6061 (remaining)
    ----label noise information:------
    Instance dependent noise
    #Actual noise rate 0.13
    [cuda:1] LNPCC waiting for GPU slot...
    [cuda:1] Slot acquired (waited 161.3s). Starting GCN...
    FINAL_RESULT: {'acc': {'train': 0.6382978723404256, 'valid': 0.4225352112676056, 'test': 0.44992575482593633}, 'wall_s': 64.69, 'cpu_s': 47.75, 'gpu_s': 16.7, 'wait_s': 161.33}
    [Time] wall=64.7s | cpu=47.8s | gpu=16.7s
    C:\Users\fbrev\anaconda3\envs\noisygl\Lib\site-packages\torch\_utils.py:315: UserWarning: Sparse CSR tensor support is in beta state. If you miss a functionality in the sparse tensor support, please submit a feature request to https://github.com/pytorch/pytorch/issues. (Triggered internally at ..\aten\src\ATen\SparseCsrTensorImpl.cpp:55.)
    result = torch.sparse_compressed_tensor(
    C:\Users\fbrev\Documents\Acadêmico\Simulações\Python\NoisyGL\predictor\Base_Predictor.py:114: UserWarning: expandable_segments not supported on this platform (Triggered internally at ..\c10/cuda/CUDAAllocatorConfig.h:28.)
    self.edge_index = self._cpu_edge_index.to(self.device)
[I 2026-05-03 01:28:42,790] Trial 15 finished with value: 0.44992575482593633 and parameters: {'lr': 0.001, 'weight_decay': 0.0001, 'n_hidden': 256, 'n_layer': 3, 'dropout': 0.1413949432925266, 'knn_mode': 's', 'k': 24, 'dexp': 4.516243024639353, 'p_grd': 0.32708225210193276, 'unc_rem': 0.7231122828216123, 'unc_rel': 0.46595637793214884}. Best is trial 12 with value: 0.5695429797063191.
    [CPU] Loading flickr...
    DEBUG 3.1: Dataset init start
    DEBUG 3.2: prepare_data start flickr
    ----Data statistics------'
    Name: flickr
    #Nodes 7575
    #Edges 239738
    #Classes 9
    #Ave_degree 63.30
    ----Split statistics------'
    #Train samples 378 (5.0 % of nodes)
    #Val samples 1136 (15.0 % of nodes)
    #Test samples 6061 (remaining)
    ----label noise information:------
    Instance dependent noise
    #Actual noise rate 0.13
    [cuda:1] LNPCC waiting for GPU slot...
    [cuda:1] Slot acquired (waited 85.1s). Starting GCN...
    FINAL_RESULT: {'acc': {'train': 0.15343915343915343, 'valid': 0.19454225352112675, 'test': 0.21745586536875103}, 'wall_s': 59.66, 'cpu_s': 42.93, 'gpu_s': 16.47, 'wait_s': 85.14}
    [Time] wall=59.7s | cpu=42.9s | gpu=16.5s
    C:\Users\fbrev\anaconda3\envs\noisygl\Lib\site-packages\torch\_utils.py:315: UserWarning: Sparse CSR tensor support is in beta state. If you miss a functionality in the sparse tensor support, please submit a feature request to https://github.com/pytorch/pytorch/issues. (Triggered internally at ..\aten\src\ATen\SparseCsrTensorImpl.cpp:55.)
    result = torch.sparse_compressed_tensor(
    C:\Users\fbrev\Documents\Acadêmico\Simulações\Python\NoisyGL\predictor\Base_Predictor.py:114: UserWarning: expandable_segments not supported on this platform (Triggered internally at ..\c10/cuda/CUDAAllocatorConfig.h:28.)
    self.edge_index = self._cpu_edge_index.to(self.device)
[I 2026-05-03 01:31:12,463] Trial 16 finished with value: 0.21745586536875103 and parameters: {'lr': 0.1, 'weight_decay': 0.001, 'n_hidden': 256, 'n_layer': 3, 'dropout': 0.18354570559166064, 'knn_mode': 's', 'k': 9, 'dexp': 8.051723414079143, 'p_grd': 0.6333930865364665, 'unc_rem': 0.7421993538209207, 'unc_rel': 0.802445782297044}. Best is trial 12 with value: 0.5695429797063191.
    [CPU] Loading flickr...
    DEBUG 3.1: Dataset init start
    DEBUG 3.2: prepare_data start flickr
    ----Data statistics------'
    Name: flickr
    #Nodes 7575
    #Edges 239738
    #Classes 9
    #Ave_degree 63.30
    ----Split statistics------'
    #Train samples 378 (5.0 % of nodes)
    #Val samples 1136 (15.0 % of nodes)
    #Test samples 6061 (remaining)
    ----label noise information:------
    Instance dependent noise
    #Actual noise rate 0.13
    [cuda:1] LNPCC waiting for GPU slot...
    [cuda:1] Slot acquired (waited 373.5s). Starting GCN...
[I 2026-05-03 01:38:18,071] Trial 17 finished with value: 0.0 and parameters: {'lr': 0.05, 'weight_decay': 0.0, 'n_hidden': 256, 'n_layer': 3, 'dropout': 0.3641807986019758, 'knn_mode': 's', 'k': 49, 'dexp': 9.328383348297663, 'p_grd': 0.4182111015332727, 'unc_rem': 0.8642837879141492, 'unc_rel': 0.5757757652553932}. Best is trial 12 with value: 0.5695429797063191.
    [CPU] Loading flickr...
    DEBUG 3.1: Dataset init start
    DEBUG 3.2: prepare_data start flickr
    ----Data statistics------'
    Name: flickr
    #Nodes 7575
    #Edges 239738
    #Classes 9
    #Ave_degree 63.30
    ----Split statistics------'
    #Train samples 378 (5.0 % of nodes)
    #Val samples 1136 (15.0 % of nodes)
    #Test samples 6061 (remaining)
    ----label noise information:------
    Instance dependent noise
    #Actual noise rate 0.13
    [cuda:1] LNPCC waiting for GPU slot...
    [cuda:1] Slot acquired (waited 16.6s). Starting GCN...
[I 2026-05-03 01:39:31,852] Trial 18 finished with value: 0.0 and parameters: {'lr': 0.05, 'weight_decay': 0.001, 'n_hidden': 64, 'n_layer': 3, 'dropout': 0.3219522623358499, 'knn_mode': 's', 'k': 22, 'dexp': 8.185841291407987, 'p_grd': 0.5114974534354224, 'unc_rem': 0.9861340676429743, 'unc_rel': 0.6712317219587044}. Best is trial 12 with value: 0.5695429797063191.
    [CPU] Loading flickr...
    DEBUG 3.1: Dataset init start
    DEBUG 3.2: prepare_data start flickr
    ----Data statistics------'
    Name: flickr
    #Nodes 7575
    #Edges 239738
    #Classes 9
    #Ave_degree 63.30
    ----Split statistics------'
    #Train samples 378 (5.0 % of nodes)
    #Val samples 1136 (15.0 % of nodes)
    #Test samples 6061 (remaining)
    ----label noise information:------
    Instance dependent noise
    #Actual noise rate 0.13
    [cuda:1] LNPCC waiting for GPU slot...
    [cuda:1] Slot acquired (waited 43.3s). Starting GCN...
    FINAL_RESULT: {'acc': {'train': 0.09973045822102426, 'valid': 0.18309859154929578, 'test': 0.20128691635043722}, 'wall_s': 45.4, 'cpu_s': 38.88, 'gpu_s': 6.29, 'wait_s': 43.34}
    [Time] wall=45.4s | cpu=38.9s | gpu=6.3s
    C:\Users\fbrev\anaconda3\envs\noisygl\Lib\site-packages\torch\_utils.py:315: UserWarning: Sparse CSR tensor support is in beta state. If you miss a functionality in the sparse tensor support, please submit a feature request to https://github.com/pytorch/pytorch/issues. (Triggered internally at ..\aten\src\ATen\SparseCsrTensorImpl.cpp:55.)
    result = torch.sparse_compressed_tensor(
    C:\Users\fbrev\Documents\Acadêmico\Simulações\Python\NoisyGL\predictor\Base_Predictor.py:114: UserWarning: expandable_segments not supported on this platform (Triggered internally at ..\c10/cuda/CUDAAllocatorConfig.h:28.)
    self.edge_index = self._cpu_edge_index.to(self.device)
[I 2026-05-03 01:41:05,268] Trial 19 finished with value: 0.20128691635043722 and parameters: {'lr': 0.001, 'weight_decay': 0.01, 'n_hidden': 128, 'n_layer': 2, 'dropout': 0.01692334190834286, 'knn_mode': 's', 'k': 12, 'dexp': 3.6597216058079924, 'p_grd': 0.22569094730999384, 'unc_rem': 0.29670909959681613, 'unc_rel': 0.3212860590798803}. Best is trial 12 with value: 0.5695429797063191.
    [CPU] Loading flickr...
    DEBUG 3.1: Dataset init start
    DEBUG 3.2: prepare_data start flickr
    ----Data statistics------'
    Name: flickr
    #Nodes 7575
    #Edges 239738
    #Classes 9
    #Ave_degree 63.30
    ----Split statistics------'
    #Train samples 378 (5.0 % of nodes)
    #Val samples 1136 (15.0 % of nodes)
    #Test samples 6061 (remaining)
    ----label noise information:------
    Instance dependent noise
    #Actual noise rate 0.13
    [cuda:1] LNPCC waiting for GPU slot...
    [cuda:1] Slot acquired (waited 9.4s). Starting GCN...
    FINAL_RESULT: {'acc': {'train': 0.8417910447761194, 'valid': 0.4964788732394366, 'test': 0.5636033657812243}, 'wall_s': 74.23, 'cpu_s': 70.25, 'gpu_s': 3.71, 'wait_s': 9.42}
    [Time] wall=74.2s | cpu=70.3s | gpu=3.7s
    C:\Users\fbrev\anaconda3\envs\noisygl\Lib\site-packages\torch\_utils.py:315: UserWarning: Sparse CSR tensor support is in beta state. If you miss a functionality in the sparse tensor support, please submit a feature request to https://github.com/pytorch/pytorch/issues. (Triggered internally at ..\aten\src\ATen\SparseCsrTensorImpl.cpp:55.)
    result = torch.sparse_compressed_tensor(
    C:\Users\fbrev\Documents\Acadêmico\Simulações\Python\NoisyGL\predictor\Base_Predictor.py:114: UserWarning: expandable_segments not supported on this platform (Triggered internally at ..\c10/cuda/CUDAAllocatorConfig.h:28.)
    self.edge_index = self._cpu_edge_index.to(self.device)
[I 2026-05-03 01:42:33,848] Trial 20 finished with value: 0.5636033657812243 and parameters: {'lr': 0.01, 'weight_decay': 0.0001, 'n_hidden': 32, 'n_layer': 2, 'dropout': 0.5540269865489365, 'knn_mode': 'd', 'k': 32, 'dexp': 6.0026336847994255, 'p_grd': 0.572797648879118, 'unc_rem': 0.012931860469679174, 'unc_rel': 0.06384964030897206}. Best is trial 12 with value: 0.5695429797063191.
    [CPU] Loading flickr...
    DEBUG 3.1: Dataset init start
    DEBUG 3.2: prepare_data start flickr
    ----Data statistics------'
    Name: flickr
    #Nodes 7575
    #Edges 239738
    #Classes 9
    #Ave_degree 63.30
    ----Split statistics------'
    #Train samples 378 (5.0 % of nodes)
    #Val samples 1136 (15.0 % of nodes)
    #Test samples 6061 (remaining)
    ----label noise information:------
    Instance dependent noise
    #Actual noise rate 0.13
    [cuda:1] LNPCC waiting for GPU slot...
    [cuda:1] Slot acquired (waited 44.5s). Starting GCN...
    FINAL_RESULT: {'acc': {'train': 0.8492063492063492, 'valid': 0.5061619718309859, 'test': 0.5596436231644943}, 'wall_s': 106.61, 'cpu_s': 102.69, 'gpu_s': 3.68, 'wait_s': 44.49}
    [Time] wall=106.6s | cpu=102.7s | gpu=3.7s
    C:\Users\fbrev\anaconda3\envs\noisygl\Lib\site-packages\torch\_utils.py:315: UserWarning: Sparse CSR tensor support is in beta state. If you miss a functionality in the sparse tensor support, please submit a feature request to https://github.com/pytorch/pytorch/issues. (Triggered internally at ..\aten\src\ATen\SparseCsrTensorImpl.cpp:55.)
    result = torch.sparse_compressed_tensor(
    C:\Users\fbrev\Documents\Acadêmico\Simulações\Python\NoisyGL\predictor\Base_Predictor.py:114: UserWarning: expandable_segments not supported on this platform (Triggered internally at ..\c10/cuda/CUDAAllocatorConfig.h:28.)
    self.edge_index = self._cpu_edge_index.to(self.device)
[I 2026-05-03 01:45:09,852] Trial 21 finished with value: 0.5596436231644943 and parameters: {'lr': 0.01, 'weight_decay': 0.0001, 'n_hidden': 32, 'n_layer': 2, 'dropout': 0.5443012893364925, 'knn_mode': 'd', 'k': 33, 'dexp': 6.59850214880725, 'p_grd': 0.5713376095963408, 'unc_rem': 0.043444563402753406, 'unc_rel': 0.02687254627666802}. Best is trial 12 with value: 0.5695429797063191.
    [CPU] Loading flickr...
    DEBUG 3.1: Dataset init start
    DEBUG 3.2: prepare_data start flickr
    ----Data statistics------'
    Name: flickr
    #Nodes 7575
    #Edges 239738
    #Classes 9
    #Ave_degree 63.30
    ----Split statistics------'
    #Train samples 378 (5.0 % of nodes)
    #Val samples 1136 (15.0 % of nodes)
    #Test samples 6061 (remaining)
    ----label noise information:------
    Instance dependent noise
    #Actual noise rate 0.13
    [cuda:1] LNPCC waiting for GPU slot...
    [cuda:1] Slot acquired (waited 144.6s). Starting GCN...
    FINAL_RESULT: {'acc': {'train': 1.0, 'valid': 0.3908450704225352, 'test': 0.4088434251773635}, 'wall_s': 201.69, 'cpu_s': 197.81, 'gpu_s': 3.64, 'wait_s': 144.64}
    [Time] wall=201.7s | cpu=197.8s | gpu=3.6s
    C:\Users\fbrev\anaconda3\envs\noisygl\Lib\site-packages\torch\_utils.py:315: UserWarning: Sparse CSR tensor support is in beta state. If you miss a functionality in the sparse tensor support, please submit a feature request to https://github.com/pytorch/pytorch/issues. (Triggered internally at ..\aten\src\ATen\SparseCsrTensorImpl.cpp:55.)
    result = torch.sparse_compressed_tensor(
    C:\Users\fbrev\Documents\Acadêmico\Simulações\Python\NoisyGL\predictor\Base_Predictor.py:114: UserWarning: expandable_segments not supported on this platform (Triggered internally at ..\c10/cuda/CUDAAllocatorConfig.h:28.)
    self.edge_index = self._cpu_edge_index.to(self.device)
