[I 2026-05-06 20:28:29,608] Trial 35 finished with value: 0.608 and parameters: {'lr': 0.01, 'weight_decay': 0.0, 'n_hidden': 32, 'n_layer': 3, 'dropout': 0.3667571860221887, 'knn_mode': 's', 'k': 18, 'dexp': 8.489934997321566, 'p_grd': 0.6929209644627523, 'unc_rem': 0.8556577230211342, 'unc_rel': 0.4953035573361796}. Best is trial 18 with value: 0.625.
    [CPU] Loading pubmed...
    DEBUG 3.1: Dataset init start
    DEBUG 3.2: prepare_data start pubmed
    ----Data statistics------'
    Name: pubmed
    #Nodes 19717
    #Edges 44324
    #Classes 3
    #Ave_degree 4.50
    ----Split statistics------'
    #Train samples 60 (default)
    #Val samples 500 (default)
    #Test samples 1000 (default)
    ----label noise information:------
    Instance dependent noise
    #Actual noise rate 0.40
    [cuda:1] LNPCC waiting for GPU slot...
    [cuda:1] Slot acquired (waited 139.5s). Starting GCN...
    FINAL_RESULT: {'acc': {'train': 0.6166666666666667, 'valid': 0.42, 'test': 0.6}, 'wall_s': 32.92, 'cpu_s': 28.8, 'gpu_s': 4.07, 'wait_s': 139.53}
    [Time] wall=32.9s | cpu=28.8s | gpu=4.1s
    C:\Users\fbrev\Documents\Acadêmico\Simulações\Python\NoisyGL\predictor\Base_Predictor.py:114: UserWarning: expandable_segments not supported on this platform (Triggered internally at ..\c10/cuda/CUDAAllocatorConfig.h:28.)
    self.edge_index = self._cpu_edge_index.to(self.device)
    C:\Users\fbrev\Documents\Acadêmico\Simulações\Python\NoisyGL\predictor\Base_Predictor.py:144: UserWarning: Sparse CSR tensor support is in beta state. If you miss a functionality in the sparse tensor support, please submit a feature request to https://github.com/pytorch/pytorch/issues. (Triggered internally at ..\aten\src\ATen\SparseCsrTensorImpl.cpp:55.)
    self.adj_csr = self.adj.to_sparse_csr().to(self.device)
[I 2026-05-06 20:31:28,328] Trial 36 finished with value: 0.6 and parameters: {'lr': 0.05, 'weight_decay': 0.01, 'n_hidden': 128, 'n_layer': 3, 'dropout': 0.20762845921740997, 'knn_mode': 's', 'k': 14, 'dexp': 7.737300473658772, 'p_grd': 0.27714752573799917, 'unc_rem': 0.9341579584433761, 'unc_rel': 0.41061994621950926}. Best is trial 18 with value: 0.625.
    [CPU] Loading pubmed...
    DEBUG 3.1: Dataset init start
    DEBUG 3.2: prepare_data start pubmed
    ----Data statistics------'
    Name: pubmed
    #Nodes 19717
    #Edges 44324
    #Classes 3
    #Ave_degree 4.50
    ----Split statistics------'
    #Train samples 60 (default)
    #Val samples 500 (default)
    #Test samples 1000 (default)
    ----label noise information:------
    Instance dependent noise
    #Actual noise rate 0.40
    [cuda:1] LNPCC waiting for GPU slot...
    [cuda:1] Slot acquired (waited 1082.8s). Starting GCN...
    FINAL_RESULT: {'acc': {'train': 0.65, 'valid': 0.426, 'test': 0.605}, 'wall_s': 30.94, 'cpu_s': 24.83, 'gpu_s': 6.06, 'wait_s': 1082.78}
    [Time] wall=30.9s | cpu=24.8s | gpu=6.1s
    C:\Users\fbrev\Documents\Acadêmico\Simulações\Python\NoisyGL\predictor\Base_Predictor.py:114: UserWarning: expandable_segments not supported on this platform (Triggered internally at ..\c10/cuda/CUDAAllocatorConfig.h:28.)
    self.edge_index = self._cpu_edge_index.to(self.device)
    C:\Users\fbrev\Documents\Acadêmico\Simulações\Python\NoisyGL\predictor\Base_Predictor.py:144: UserWarning: Sparse CSR tensor support is in beta state. If you miss a functionality in the sparse tensor support, please submit a feature request to https://github.com/pytorch/pytorch/issues. (Triggered internally at ..\aten\src\ATen\SparseCsrTensorImpl.cpp:55.)
    self.adj_csr = self.adj.to_sparse_csr().to(self.device)
[I 2026-05-06 20:50:08,469] Trial 37 finished with value: 0.605 and parameters: {'lr': 0.005, 'weight_decay': 0.0, 'n_hidden': 256, 'n_layer': 3, 'dropout': 0.5601856443688655, 'knn_mode': 'd', 'k': 28, 'dexp': 7.083796251360752, 'p_grd': 0.18351947784067923, 'unc_rem': 0.24445117654421933, 'unc_rel': 0.32585113252793185}. Best is trial 18 with value: 0.625.
    [CPU] Loading pubmed...
    DEBUG 3.1: Dataset init start
    DEBUG 3.2: prepare_data start pubmed
    ----Data statistics------'
    Name: pubmed
    #Nodes 19717
    #Edges 44324
    #Classes 3
    #Ave_degree 4.50
    ----Split statistics------'
    #Train samples 60 (default)
    #Val samples 500 (default)
    #Test samples 1000 (default)
    ----label noise information:------
    Instance dependent noise
    #Actual noise rate 0.40
    [cuda:1] LNPCC waiting for GPU slot...
    [cuda:1] Slot acquired (waited 152.0s). Starting GCN...
    FINAL_RESULT: {'acc': {'train': 0.6666666666666666, 'valid': 0.42, 'test': 0.604}, 'wall_s': 33.83, 'cpu_s': 27.79, 'gpu_s': 5.99, 'wait_s': 151.96}
    [Time] wall=33.8s | cpu=27.8s | gpu=6.0s
    C:\Users\fbrev\Documents\Acadêmico\Simulações\Python\NoisyGL\predictor\Base_Predictor.py:114: UserWarning: expandable_segments not supported on this platform (Triggered internally at ..\c10/cuda/CUDAAllocatorConfig.h:28.)
    self.edge_index = self._cpu_edge_index.to(self.device)
    C:\Users\fbrev\Documents\Acadêmico\Simulações\Python\NoisyGL\predictor\Base_Predictor.py:144: UserWarning: Sparse CSR tensor support is in beta state. If you miss a functionality in the sparse tensor support, please submit a feature request to https://github.com/pytorch/pytorch/issues. (Triggered internally at ..\aten\src\ATen\SparseCsrTensorImpl.cpp:55.)
    self.adj_csr = self.adj.to_sparse_csr().to(self.device)
[I 2026-05-06 20:53:20,719] Trial 38 finished with value: 0.604 and parameters: {'lr': 0.001, 'weight_decay': 0.001, 'n_hidden': 256, 'n_layer': 3, 'dropout': 0.6425185984983557, 'knn_mode': 's', 'k': 49, 'dexp': 9.910983366242531, 'p_grd': 0.36363422482677005, 'unc_rem': 0.7474624944486913, 'unc_rel': 0.7098437829113801}. Best is trial 18 with value: 0.625.
    [CPU] Loading pubmed...
    DEBUG 3.1: Dataset init start
    DEBUG 3.2: prepare_data start pubmed
    ----Data statistics------'
    Name: pubmed
    #Nodes 19717
    #Edges 44324
    #Classes 3
    #Ave_degree 4.50
    ----Split statistics------'
    #Train samples 60 (default)
    #Val samples 500 (default)
    #Test samples 1000 (default)
    ----label noise information:------
    Instance dependent noise
    #Actual noise rate 0.40
    [cuda:1] LNPCC waiting for GPU slot...
    [cuda:1] Slot acquired (waited 326.0s). Starting GCN...
    FINAL_RESULT: {'acc': {'train': 0.36666666666666664, 'valid': 0.324, 'test': 0.413}, 'wall_s': 30.14, 'cpu_s': 27.31, 'gpu_s': 2.78, 'wait_s': 326.03}
    [Time] wall=30.1s | cpu=27.3s | gpu=2.8s
    C:\Users\fbrev\Documents\Acadêmico\Simulações\Python\NoisyGL\predictor\Base_Predictor.py:114: UserWarning: expandable_segments not supported on this platform (Triggered internally at ..\c10/cuda/CUDAAllocatorConfig.h:28.)
    self.edge_index = self._cpu_edge_index.to(self.device)
    C:\Users\fbrev\Documents\Acadêmico\Simulações\Python\NoisyGL\predictor\Base_Predictor.py:144: UserWarning: Sparse CSR tensor support is in beta state. If you miss a functionality in the sparse tensor support, please submit a feature request to https://github.com/pytorch/pytorch/issues. (Triggered internally at ..\aten\src\ATen\SparseCsrTensorImpl.cpp:55.)
    self.adj_csr = self.adj.to_sparse_csr().to(self.device)
[I 2026-05-06 20:59:23,136] Trial 39 finished with value: 0.413 and parameters: {'lr': 0.1, 'weight_decay': 0.05, 'n_hidden': 32, 'n_layer': 3, 'dropout': 0.16593277056538736, 'knn_mode': 's', 'k': 22, 'dexp': 5.482901758231488, 'p_grd': 0.5143619405400186, 'unc_rem': 0.016459482312448454, 'unc_rel': 0.7826122416044925}. Best is trial 18 with value: 0.625.
    [CPU] Loading pubmed...
    DEBUG 3.1: Dataset init start
    DEBUG 3.2: prepare_data start pubmed
    ----Data statistics------'
    Name: pubmed
    #Nodes 19717
    #Edges 44324
    #Classes 3
    #Ave_degree 4.50
    ----Split statistics------'
    #Train samples 60 (default)
    #Val samples 500 (default)
    #Test samples 1000 (default)
    ----label noise information:------
    Instance dependent noise
    #Actual noise rate 0.40
    [cuda:1] LNPCC waiting for GPU slot...
    [cuda:1] Slot acquired (waited 268.6s). Starting GCN...
    FINAL_RESULT: {'acc': {'train': 0.65, 'valid': 0.428, 'test': 0.604}, 'wall_s': 90.96, 'cpu_s': 28.49, 'gpu_s': 3.97, 'wait_s': 268.6}
    [Time] wall=91.0s | cpu=28.5s | gpu=4.0s
    C:\Users\fbrev\Documents\Acadêmico\Simulações\Python\NoisyGL\predictor\Base_Predictor.py:114: UserWarning: expandable_segments not supported on this platform (Triggered internally at ..\c10/cuda/CUDAAllocatorConfig.h:28.)
    self.edge_index = self._cpu_edge_index.to(self.device)
    C:\Users\fbrev\Documents\Acadêmico\Simulações\Python\NoisyGL\predictor\Base_Predictor.py:144: UserWarning: Sparse CSR tensor support is in beta state. If you miss a functionality in the sparse tensor support, please submit a feature request to https://github.com/pytorch/pytorch/issues. (Triggered internally at ..\aten\src\ATen\SparseCsrTensorImpl.cpp:55.)
    self.adj_csr = self.adj.to_sparse_csr().to(self.device)
[I 2026-05-06 21:05:29,058] Trial 40 finished with value: 0.604 and parameters: {'lr': 0.005, 'weight_decay': 0.001, 'n_hidden': 128, 'n_layer': 3, 'dropout': 0.7484047060544147, 'knn_mode': 'd', 'k': 38, 'dexp': 2.6123162520954955, 'p_grd': 0.581587565312646, 'unc_rem': 0.34413855400509735, 'unc_rel': 0.7406499422365248}. Best is trial 18 with value: 0.625.
    [CPU] Loading pubmed...
    DEBUG 3.1: Dataset init start
    DEBUG 3.2: prepare_data start pubmed
    ----Data statistics------'
    Name: pubmed
    #Nodes 19717
    #Edges 44324
    #Classes 3
    #Ave_degree 4.50
    ----Split statistics------'
    #Train samples 60 (default)
    #Val samples 500 (default)
    #Test samples 1000 (default)
    ----label noise information:------
    Instance dependent noise
    #Actual noise rate 0.40
    [cuda:1] LNPCC waiting for GPU slot...
    [cuda:1] Slot acquired (waited 140.9s). Starting GCN...
    FINAL_RESULT: {'acc': {'train': 0.5833333333333334, 'valid': 0.434, 'test': 0.589}, 'wall_s': 89.6, 'cpu_s': 83.76, 'gpu_s': 5.79, 'wait_s': 140.85}
    [Time] wall=89.6s | cpu=83.8s | gpu=5.8s
    C:\Users\fbrev\Documents\Acadêmico\Simulações\Python\NoisyGL\predictor\Base_Predictor.py:114: UserWarning: expandable_segments not supported on this platform (Triggered internally at ..\c10/cuda/CUDAAllocatorConfig.h:28.)
    self.edge_index = self._cpu_edge_index.to(self.device)
    C:\Users\fbrev\Documents\Acadêmico\Simulações\Python\NoisyGL\predictor\Base_Predictor.py:144: UserWarning: Sparse CSR tensor support is in beta state. If you miss a functionality in the sparse tensor support, please submit a feature request to https://github.com/pytorch/pytorch/issues. (Triggered internally at ..\aten\src\ATen\SparseCsrTensorImpl.cpp:55.)
    self.adj_csr = self.adj.to_sparse_csr().to(self.device)
[I 2026-05-06 21:09:27,505] Trial 41 finished with value: 0.589 and parameters: {'lr': 0.01, 'weight_decay': 0.0001, 'n_hidden': 256, 'n_layer': 3, 'dropout': 0.2995677084278737, 'knn_mode': 's', 'k': 25, 'dexp': 6.7646872377920815, 'p_grd': 0.7454697776056507, 'unc_rem': 0.5060110336023314, 'unc_rel': 0.5187722504729019}. Best is trial 18 with value: 0.625.
    [CPU] Loading pubmed...
    DEBUG 3.1: Dataset init start
    DEBUG 3.2: prepare_data start pubmed
    ----Data statistics------'
    Name: pubmed
    #Nodes 19717
    #Edges 44324
    #Classes 3
    #Ave_degree 4.50
    ----Split statistics------'
    #Train samples 60 (default)
    #Val samples 500 (default)
    #Test samples 1000 (default)
    ----label noise information:------
    Instance dependent noise
    #Actual noise rate 0.40
    [cuda:1] LNPCC waiting for GPU slot...
    [cuda:1] Slot acquired (waited 323.8s). Starting GCN...
    FINAL_RESULT: {'acc': {'train': 0.6666666666666666, 'valid': 0.432, 'test': 0.608}, 'wall_s': 32.08, 'cpu_s': 26.18, 'gpu_s': 5.84, 'wait_s': 323.79}
    [Time] wall=32.1s | cpu=26.2s | gpu=5.8s
    C:\Users\fbrev\Documents\Acadêmico\Simulações\Python\NoisyGL\predictor\Base_Predictor.py:114: UserWarning: expandable_segments not supported on this platform (Triggered internally at ..\c10/cuda/CUDAAllocatorConfig.h:28.)
    self.edge_index = self._cpu_edge_index.to(self.device)
    C:\Users\fbrev\Documents\Acadêmico\Simulações\Python\NoisyGL\predictor\Base_Predictor.py:144: UserWarning: Sparse CSR tensor support is in beta state. If you miss a functionality in the sparse tensor support, please submit a feature request to https://github.com/pytorch/pytorch/issues. (Triggered internally at ..\aten\src\ATen\SparseCsrTensorImpl.cpp:55.)
    self.adj_csr = self.adj.to_sparse_csr().to(self.device)
[I 2026-05-06 21:15:29,291] Trial 42 finished with value: 0.608 and parameters: {'lr': 0.01, 'weight_decay': 0.0001, 'n_hidden': 256, 'n_layer': 3, 'dropout': 0.45129020276210846, 'knn_mode': 's', 'k': 26, 'dexp': 6.192861132517355, 'p_grd': 0.46844092018868666, 'unc_rem': 0.20505790991024891, 'unc_rel': 0.6501902777864302}. Best is trial 18 with value: 0.625.
    [CPU] Loading pubmed...
    DEBUG 3.1: Dataset init start
    DEBUG 3.2: prepare_data start pubmed
    ----Data statistics------'
    Name: pubmed
    #Nodes 19717
    #Edges 44324
    #Classes 3
    #Ave_degree 4.50
    ----Split statistics------'
    #Train samples 60 (default)
    #Val samples 500 (default)
    #Test samples 1000 (default)
    ----label noise information:------
    Instance dependent noise
    #Actual noise rate 0.40
    [cuda:1] LNPCC waiting for GPU slot...
    [cuda:1] Slot acquired (waited 153.9s). Starting GCN...
    FINAL_RESULT: {'acc': {'train': 0.6333333333333333, 'valid': 0.438, 'test': 0.605}, 'wall_s': 30.58, 'cpu_s': 24.79, 'gpu_s': 5.74, 'wait_s': 153.86}
    [Time] wall=30.6s | cpu=24.8s | gpu=5.7s
    C:\Users\fbrev\Documents\Acadêmico\Simulações\Python\NoisyGL\predictor\Base_Predictor.py:114: UserWarning: expandable_segments not supported on this platform (Triggered internally at ..\c10/cuda/CUDAAllocatorConfig.h:28.)
    self.edge_index = self._cpu_edge_index.to(self.device)
    C:\Users\fbrev\Documents\Acadêmico\Simulações\Python\NoisyGL\predictor\Base_Predictor.py:144: UserWarning: Sparse CSR tensor support is in beta state. If you miss a functionality in the sparse tensor support, please submit a feature request to https://github.com/pytorch/pytorch/issues. (Triggered internally at ..\aten\src\ATen\SparseCsrTensorImpl.cpp:55.)
    self.adj_csr = self.adj.to_sparse_csr().to(self.device)
[I 2026-05-06 21:18:39,504] Trial 43 finished with value: 0.605 and parameters: {'lr': 0.01, 'weight_decay': 0.0001, 'n_hidden': 256, 'n_layer': 3, 'dropout': 0.07578832681390257, 'knn_mode': 's', 'k': 19, 'dexp': 9.195199214317695, 'p_grd': 0.5771932433769212, 'unc_rem': 0.42300676198422194, 'unc_rel': 0.5057898857380465}. Best is trial 18 with value: 0.625.
    [CPU] Loading pubmed...
    DEBUG 3.1: Dataset init start
    DEBUG 3.2: prepare_data start pubmed
    ----Data statistics------'
    Name: pubmed
    #Nodes 19717
    #Edges 44324
    #Classes 3
    #Ave_degree 4.50
    ----Split statistics------'
    #Train samples 60 (default)
    #Val samples 500 (default)
    #Test samples 1000 (default)
    ----label noise information:------
    Instance dependent noise
    #Actual noise rate 0.40
    [cuda:1] LNPCC waiting for GPU slot...
    [cuda:1] Slot acquired (waited 144.2s). Starting GCN...
    FINAL_RESULT: {'acc': {'train': 0.6440677966101694, 'valid': 0.432, 'test': 0.608}, 'wall_s': 31.91, 'cpu_s': 25.92, 'gpu_s': 5.94, 'wait_s': 144.21}
    [Time] wall=31.9s | cpu=25.9s | gpu=5.9s
    C:\Users\fbrev\Documents\Acadêmico\Simulações\Python\NoisyGL\predictor\Base_Predictor.py:114: UserWarning: expandable_segments not supported on this platform (Triggered internally at ..\c10/cuda/CUDAAllocatorConfig.h:28.)
    self.edge_index = self._cpu_edge_index.to(self.device)
    C:\Users\fbrev\Documents\Acadêmico\Simulações\Python\NoisyGL\predictor\Base_Predictor.py:144: UserWarning: Sparse CSR tensor support is in beta state. If you miss a functionality in the sparse tensor support, please submit a feature request to https://github.com/pytorch/pytorch/issues. (Triggered internally at ..\aten\src\ATen\SparseCsrTensorImpl.cpp:55.)
    self.adj_csr = self.adj.to_sparse_csr().to(self.device)
[I 2026-05-06 21:21:41,481] Trial 44 finished with value: 0.608 and parameters: {'lr': 0.01, 'weight_decay': 0.0001, 'n_hidden': 256, 'n_layer': 3, 'dropout': 0.671664796861201, 'knn_mode': 's', 'k': 30, 'dexp': 7.50154280533092, 'p_grd': 0.24246109237730962, 'unc_rem': 0.33834043518046897, 'unc_rel': 0.607720193276232}. Best is trial 18 with value: 0.625.
    [CPU] Loading pubmed...
    DEBUG 3.1: Dataset init start
    DEBUG 3.2: prepare_data start pubmed
    ----Data statistics------'
    Name: pubmed
    #Nodes 19717
    #Edges 44324
    #Classes 3
    #Ave_degree 4.50
    ----Split statistics------'
    #Train samples 60 (default)
    #Val samples 500 (default)
    #Test samples 1000 (default)
    ----label noise information:------
    Instance dependent noise
    #Actual noise rate 0.40
    [cuda:1] LNPCC waiting for GPU slot...
    [cuda:1] Slot acquired (waited 155.5s). Starting GCN...
    FINAL_RESULT: {'acc': {'train': 0.7, 'valid': 0.424, 'test': 0.581}, 'wall_s': 28.59, 'cpu_s': 26.33, 'gpu_s': 2.21, 'wait_s': 155.49}
    [Time] wall=28.6s | cpu=26.3s | gpu=2.2s
    C:\Users\fbrev\Documents\Acadêmico\Simulações\Python\NoisyGL\predictor\Base_Predictor.py:114: UserWarning: expandable_segments not supported on this platform (Triggered internally at ..\c10/cuda/CUDAAllocatorConfig.h:28.)
    self.edge_index = self._cpu_edge_index.to(self.device)
    C:\Users\fbrev\Documents\Acadêmico\Simulações\Python\NoisyGL\predictor\Base_Predictor.py:144: UserWarning: Sparse CSR tensor support is in beta state. If you miss a functionality in the sparse tensor support, please submit a feature request to https://github.com/pytorch/pytorch/issues. (Triggered internally at ..\aten\src\ATen\SparseCsrTensorImpl.cpp:55.)
    self.adj_csr = self.adj.to_sparse_csr().to(self.device)
[I 2026-05-06 21:24:51,354] Trial 45 finished with value: 0.581 and parameters: {'lr': 0.01, 'weight_decay': 0.0001, 'n_hidden': 64, 'n_layer': 2, 'dropout': 0.7885530357007237, 'knn_mode': 's', 'k': 23, 'dexp': 8.055883470251349, 'p_grd': 0.5022582799598474, 'unc_rem': 0.07611019087401091, 'unc_rel': 0.39088855811785084}. Best is trial 18 with value: 0.625.
    [CPU] Loading pubmed...
    DEBUG 3.1: Dataset init start
    DEBUG 3.2: prepare_data start pubmed
    ----Data statistics------'
    Name: pubmed
    #Nodes 19717
    #Edges 44324
    #Classes 3
    #Ave_degree 4.50
    ----Split statistics------'
    #Train samples 60 (default)
    #Val samples 500 (default)
    #Test samples 1000 (default)
    ----label noise information:------
    Instance dependent noise
    #Actual noise rate 0.40
    [cuda:1] LNPCC waiting for GPU slot...
    [cuda:1] Slot acquired (waited 724.1s). Starting GCN...
    FINAL_RESULT: {'acc': {'train': 0.6166666666666667, 'valid': 0.424, 'test': 0.614}, 'wall_s': 32.5, 'cpu_s': 26.52, 'gpu_s': 5.93, 'wait_s': 724.1}
    [Time] wall=32.5s | cpu=26.5s | gpu=5.9s
    C:\Users\fbrev\Documents\Acadêmico\Simulações\Python\NoisyGL\predictor\Base_Predictor.py:114: UserWarning: expandable_segments not supported on this platform (Triggered internally at ..\c10/cuda/CUDAAllocatorConfig.h:28.)
    self.edge_index = self._cpu_edge_index.to(self.device)
    C:\Users\fbrev\Documents\Acadêmico\Simulações\Python\NoisyGL\predictor\Base_Predictor.py:144: UserWarning: Sparse CSR tensor support is in beta state. If you miss a functionality in the sparse tensor support, please submit a feature request to https://github.com/pytorch/pytorch/issues. (Triggered internally at ..\aten\src\ATen\SparseCsrTensorImpl.cpp:55.)
    self.adj_csr = self.adj.to_sparse_csr().to(self.device)
[I 2026-05-06 21:37:33,834] Trial 46 finished with value: 0.614 and parameters: {'lr': 0.05, 'weight_decay': 0.01, 'n_hidden': 256, 'n_layer': 3, 'dropout': 0.5324437834555977, 'knn_mode': 's', 'k': 27, 'dexp': 8.558258262247602, 'p_grd': 0.40981884172626426, 'unc_rem': 0.6718578358492766, 'unc_rel': 0.2846219419449342}. Best is trial 18 with value: 0.625.
    [CPU] Loading pubmed...
    DEBUG 3.1: Dataset init start
    DEBUG 3.2: prepare_data start pubmed
    ----Data statistics------'
    Name: pubmed
    #Nodes 19717
    #Edges 44324
    #Classes 3
    #Ave_degree 4.50
    ----Split statistics------'
    #Train samples 60 (default)
    #Val samples 500 (default)
    #Test samples 1000 (default)
    ----label noise information:------
    Instance dependent noise
    #Actual noise rate 0.40
    [cuda:1] LNPCC waiting for GPU slot...
    [cuda:1] Slot acquired (waited 177.4s). Starting GCN...
    FINAL_RESULT: {'acc': {'train': 0.6666666666666666, 'valid': 0.424, 'test': 0.597}, 'wall_s': 27.17, 'cpu_s': 24.01, 'gpu_s': 3.11, 'wait_s': 177.39}
    [Time] wall=27.2s | cpu=24.0s | gpu=3.1s
    C:\Users\fbrev\Documents\Acadêmico\Simulações\Python\NoisyGL\predictor\Base_Predictor.py:114: UserWarning: expandable_segments not supported on this platform (Triggered internally at ..\c10/cuda/CUDAAllocatorConfig.h:28.)
    self.edge_index = self._cpu_edge_index.to(self.device)
    C:\Users\fbrev\Documents\Acadêmico\Simulações\Python\NoisyGL\predictor\Base_Predictor.py:144: UserWarning: Sparse CSR tensor support is in beta state. If you miss a functionality in the sparse tensor support, please submit a feature request to https://github.com/pytorch/pytorch/issues. (Triggered internally at ..\aten\src\ATen\SparseCsrTensorImpl.cpp:55.)
    self.adj_csr = self.adj.to_sparse_csr().to(self.device)
