[I 2026-05-07 20:37:49,652] Trial 47 finished with value: 0.538 and parameters: {'lr': 0.1, 'weight_decay': 0.0, 'n_hidden': 32, 'n_layer': 2, 'dropout': 0.31026351854155493, 'knn_mode': 'd', 'k': 40, 'dexp': 7.589863796230814, 'p_grd': 0.7024009409489023, 'unc_rem': 0.474863201908548, 'unc_rel': 0.5661166123179506}. Best is trial 25 with value: 0.671.
    [CPU] Loading citeseer...
    DEBUG 3.1: Dataset init start
    DEBUG 3.2: prepare_data start citeseer
    ----Data statistics------'
    Name: citeseer
    #Nodes 3327
    #Edges 4552
    #Classes 6
    #Ave_degree 2.74
    ----Split statistics------'
    #Train samples 120 (default)
    #Val samples 500 (default)
    #Test samples 1000 (default)
    ----label noise information:------
    Instance dependent noise
    #Actual noise rate 0.30
    [cuda:1] LNPCC waiting for GPU slot...
    [cuda:1] Slot acquired (waited 134.5s). Starting GCN...
    FINAL_RESULT: {'acc': {'train': 0.9333333333333333, 'valid': 0.494, 'test': 0.649}, 'wall_s': 31.96, 'cpu_s': 30.22, 'gpu_s': 1.7, 'wait_s': 134.46}
    [Time] wall=32.0s | cpu=30.2s | gpu=1.7s
    C:\Users\fbrev\Documents\Acadêmico\Simulações\Python\NoisyGL\predictor\Base_Predictor.py:114: UserWarning: expandable_segments not supported on this platform (Triggered internally at ..\c10/cuda/CUDAAllocatorConfig.h:28.)
    self.edge_index = self._cpu_edge_index.to(self.device)
    C:\Users\fbrev\Documents\Acadêmico\Simulações\Python\NoisyGL\predictor\Base_Predictor.py:144: UserWarning: Sparse CSR tensor support is in beta state. If you miss a functionality in the sparse tensor support, please submit a feature request to https://github.com/pytorch/pytorch/issues. (Triggered internally at ..\aten\src\ATen\SparseCsrTensorImpl.cpp:55.)
    self.adj_csr = self.adj.to_sparse_csr().to(self.device)
[I 2026-05-07 20:40:41,541] Trial 48 finished with value: 0.649 and parameters: {'lr': 0.1, 'weight_decay': 0.05, 'n_hidden': 64, 'n_layer': 2, 'dropout': 0.36269864414783765, 'knn_mode': 'd', 'k': 38, 'dexp': 4.218160086231109, 'p_grd': 0.8447214002384974, 'unc_rem': 0.433006238996765, 'unc_rel': 0.89552195060775}. Best is trial 25 with value: 0.671.
    [CPU] Loading citeseer...
    DEBUG 3.1: Dataset init start
    DEBUG 3.2: prepare_data start citeseer
    ----Data statistics------'
    Name: citeseer
    #Nodes 3327
    #Edges 4552
    #Classes 6
    #Ave_degree 2.74
    ----Split statistics------'
    #Train samples 120 (default)
    #Val samples 500 (default)
    #Test samples 1000 (default)
    ----label noise information:------
    Instance dependent noise
    #Actual noise rate 0.30
    [cuda:1] LNPCC waiting for GPU slot...
    [cuda:1] Slot acquired (waited 120.0s). Starting GCN...
    FINAL_RESULT: {'acc': {'train': 0.9333333333333333, 'valid': 0.476, 'test': 0.615}, 'wall_s': 43.81, 'cpu_s': 41.44, 'gpu_s': 2.33, 'wait_s': 119.98}
    [Time] wall=43.8s | cpu=41.4s | gpu=2.3s
    C:\Users\fbrev\Documents\Acadêmico\Simulações\Python\NoisyGL\predictor\Base_Predictor.py:114: UserWarning: expandable_segments not supported on this platform (Triggered internally at ..\c10/cuda/CUDAAllocatorConfig.h:28.)
    self.edge_index = self._cpu_edge_index.to(self.device)
    C:\Users\fbrev\Documents\Acadêmico\Simulações\Python\NoisyGL\predictor\Base_Predictor.py:144: UserWarning: Sparse CSR tensor support is in beta state. If you miss a functionality in the sparse tensor support, please submit a feature request to https://github.com/pytorch/pytorch/issues. (Triggered internally at ..\aten\src\ATen\SparseCsrTensorImpl.cpp:55.)
    self.adj_csr = self.adj.to_sparse_csr().to(self.device)
