[I 2026-05-04 13:16:13,530] Trial 21 finished with value: 0.6265286923800565 and parameters: {'lr': 0.001, 'weight_decay': 0.0001, 'n_hidden': 64, 'n_layer': 2, 'dropout': 0.6190390920920961, 'knn_mode': 's', 'k': 29, 'dexp': 5.220580332958805, 'p_grd': 0.13410719363459178, 'unc_rem': 0.027873114592523812, 'unc_rel': 0.4618950179821688}. Best is trial 10 with value: 0.7013842225507324.
    [CPU] Loading dblp...
    DEBUG 3.1: Dataset init start
    DEBUG 3.2: prepare_data start dblp
    ----Data statistics------'
    Name: dblp
    #Nodes 17716
    #Edges 52867
    #Classes 4
    #Ave_degree 5.97
    ----Split statistics------'
    #Train samples 177 (1.0 % of nodes)
    #Val samples 2657 (15.0 % of nodes)
    #Test samples 14882 (remaining)
    ----label noise information:------
    Instance dependent noise
    #Actual noise rate 0.40
    [cuda:0] LNPCC waiting for GPU slot...
    [cuda:0] Slot acquired (waited 0.0s). Starting GCN...
    FINAL_RESULT: {'acc': {'train': 0.8181818181818182, 'valid': 0.45841174256680467, 'test': 0.6821663754871657}, 'wall_s': 37.73, 'cpu_s': 35.6, 'gpu_s': 2.07, 'wait_s': 0.0}
    [Time] wall=37.7s | cpu=35.6s | gpu=2.1s
    C:\Users\fbrev\Documents\Acadêmico\Simulações\Python\NoisyGL\predictor\Base_Predictor.py:114: UserWarning: expandable_segments not supported on this platform (Triggered internally at ..\c10/cuda/CUDAAllocatorConfig.h:28.)
    self.edge_index = self._cpu_edge_index.to(self.device)
    C:\Users\fbrev\Documents\Acadêmico\Simulações\Python\NoisyGL\predictor\Base_Predictor.py:144: UserWarning: Sparse CSR tensor support is in beta state. If you miss a functionality in the sparse tensor support, please submit a feature request to https://github.com/pytorch/pytorch/issues. (Triggered internally at ..\aten\src\ATen\SparseCsrTensorImpl.cpp:55.)
    self.adj_csr = self.adj.to_sparse_csr().to(self.device)
[I 2026-05-04 13:16:57,200] Trial 22 finished with value: 0.6821663754871657 and parameters: {'lr': 0.005, 'weight_decay': 0.0001, 'n_hidden': 64, 'n_layer': 2, 'dropout': 0.454567059189511, 'knn_mode': 's', 'k': 34, 'dexp': 6.598799731997454, 'p_grd': 0.34506103897116724, 'unc_rem': 0.566069877467629, 'unc_rel': 0.02606173869353806}. Best is trial 10 with value: 0.7013842225507324.
    [CPU] Loading dblp...
    DEBUG 3.1: Dataset init start
    DEBUG 3.2: prepare_data start dblp
    ----Data statistics------'
    Name: dblp
    #Nodes 17716
    #Edges 52867
    #Classes 4
    #Ave_degree 5.97
    ----Split statistics------'
    #Train samples 177 (1.0 % of nodes)
    #Val samples 2657 (15.0 % of nodes)
    #Test samples 14882 (remaining)
    ----label noise information:------
    Instance dependent noise
    #Actual noise rate 0.40
    [cuda:0] LNPCC waiting for GPU slot...
    [cuda:0] Slot acquired (waited 0.0s). Starting GCN...
    FINAL_RESULT: {'acc': {'train': 0.8409090909090909, 'valid': 0.44373353406097105, 'test': 0.6554226582448596}, 'wall_s': 32.26, 'cpu_s': 29.99, 'gpu_s': 2.21, 'wait_s': 0.0}
    [Time] wall=32.3s | cpu=30.0s | gpu=2.2s
    C:\Users\fbrev\Documents\Acadêmico\Simulações\Python\NoisyGL\predictor\Base_Predictor.py:114: UserWarning: expandable_segments not supported on this platform (Triggered internally at ..\c10/cuda/CUDAAllocatorConfig.h:28.)
    self.edge_index = self._cpu_edge_index.to(self.device)
    C:\Users\fbrev\Documents\Acadêmico\Simulações\Python\NoisyGL\predictor\Base_Predictor.py:144: UserWarning: Sparse CSR tensor support is in beta state. If you miss a functionality in the sparse tensor support, please submit a feature request to https://github.com/pytorch/pytorch/issues. (Triggered internally at ..\aten\src\ATen\SparseCsrTensorImpl.cpp:55.)
    self.adj_csr = self.adj.to_sparse_csr().to(self.device)
[I 2026-05-04 13:17:34,525] Trial 23 finished with value: 0.6554226582448596 and parameters: {'lr': 0.001, 'weight_decay': 0.0001, 'n_hidden': 64, 'n_layer': 2, 'dropout': 0.5874124629409407, 'knn_mode': 's', 'k': 27, 'dexp': 4.692427486706598, 'p_grd': 0.32435870444588244, 'unc_rem': 0.7863032592660781, 'unc_rel': 0.4921416517002297}. Best is trial 10 with value: 0.7013842225507324.
    [CPU] Loading dblp...
    DEBUG 3.1: Dataset init start
    DEBUG 3.2: prepare_data start dblp
    ----Data statistics------'
    Name: dblp
    #Nodes 17716
    #Edges 52867
    #Classes 4
    #Ave_degree 5.97
    ----Split statistics------'
    #Train samples 177 (1.0 % of nodes)
    #Val samples 2657 (15.0 % of nodes)
    #Test samples 14882 (remaining)
    ----label noise information:------
    Instance dependent noise
    #Actual noise rate 0.40
    [cuda:0] LNPCC waiting for GPU slot...
    [cuda:0] Slot acquired (waited 0.0s). Starting GCN...
    FINAL_RESULT: {'acc': {'train': 0.6568047337278107, 'valid': 0.46368084305607826, 'test': 0.6995027550060475}, 'wall_s': 36.02, 'cpu_s': 32.98, 'gpu_s': 2.96, 'wait_s': 0.0}
    [Time] wall=36.0s | cpu=33.0s | gpu=3.0s
    C:\Users\fbrev\Documents\Acadêmico\Simulações\Python\NoisyGL\predictor\Base_Predictor.py:114: UserWarning: expandable_segments not supported on this platform (Triggered internally at ..\c10/cuda/CUDAAllocatorConfig.h:28.)
    self.edge_index = self._cpu_edge_index.to(self.device)
    C:\Users\fbrev\Documents\Acadêmico\Simulações\Python\NoisyGL\predictor\Base_Predictor.py:144: UserWarning: Sparse CSR tensor support is in beta state. If you miss a functionality in the sparse tensor support, please submit a feature request to https://github.com/pytorch/pytorch/issues. (Triggered internally at ..\aten\src\ATen\SparseCsrTensorImpl.cpp:55.)
    self.adj_csr = self.adj.to_sparse_csr().to(self.device)
[I 2026-05-04 13:18:16,453] Trial 24 finished with value: 0.6995027550060475 and parameters: {'lr': 0.001, 'weight_decay': 0.0001, 'n_hidden': 64, 'n_layer': 3, 'dropout': 0.6488971984672707, 'knn_mode': 's', 'k': 36, 'dexp': 7.203288929972672, 'p_grd': 0.14396599103213378, 'unc_rem': 0.4869233485498311, 'unc_rel': 0.43441712687628015}. Best is trial 10 with value: 0.7013842225507324.
    [CPU] Loading dblp...
    DEBUG 3.1: Dataset init start
    DEBUG 3.2: prepare_data start dblp
    ----Data statistics------'
    Name: dblp
    #Nodes 17716
    #Edges 52867
    #Classes 4
    #Ave_degree 5.97
    ----Split statistics------'
    #Train samples 177 (1.0 % of nodes)
    #Val samples 2657 (15.0 % of nodes)
    #Test samples 14882 (remaining)
    ----label noise information:------
    Instance dependent noise
    #Actual noise rate 0.40
    [cuda:0] LNPCC waiting for GPU slot...
    [cuda:0] Slot acquired (waited 0.0s). Starting GCN...
    FINAL_RESULT: {'acc': {'train': 0.8529411764705882, 'valid': 0.41926985321791493, 'test': 0.6042198629216503}, 'wall_s': 31.64, 'cpu_s': 28.78, 'gpu_s': 2.8, 'wait_s': 0.0}
    [Time] wall=31.6s | cpu=28.8s | gpu=2.8s
    C:\Users\fbrev\Documents\Acadêmico\Simulações\Python\NoisyGL\predictor\Base_Predictor.py:114: UserWarning: expandable_segments not supported on this platform (Triggered internally at ..\c10/cuda/CUDAAllocatorConfig.h:28.)
    self.edge_index = self._cpu_edge_index.to(self.device)
    C:\Users\fbrev\Documents\Acadêmico\Simulações\Python\NoisyGL\predictor\Base_Predictor.py:144: UserWarning: Sparse CSR tensor support is in beta state. If you miss a functionality in the sparse tensor support, please submit a feature request to https://github.com/pytorch/pytorch/issues. (Triggered internally at ..\aten\src\ATen\SparseCsrTensorImpl.cpp:55.)
    self.adj_csr = self.adj.to_sparse_csr().to(self.device)
[I 2026-05-04 13:18:53,614] Trial 25 finished with value: 0.6042198629216503 and parameters: {'lr': 0.001, 'weight_decay': 0.0001, 'n_hidden': 64, 'n_layer': 3, 'dropout': 0.437581879319366, 'knn_mode': 's', 'k': 38, 'dexp': 5.550224277264683, 'p_grd': 0.10712113982636418, 'unc_rem': 0.5007935582505032, 'unc_rel': 0.4383385510512285}. Best is trial 10 with value: 0.7013842225507324.
    [CPU] Loading dblp...
    DEBUG 3.1: Dataset init start
    DEBUG 3.2: prepare_data start dblp
    ----Data statistics------'
    Name: dblp
    #Nodes 17716
    #Edges 52867
    #Classes 4
    #Ave_degree 5.97
    ----Split statistics------'
    #Train samples 177 (1.0 % of nodes)
    #Val samples 2657 (15.0 % of nodes)
    #Test samples 14882 (remaining)
    ----label noise information:------
    Instance dependent noise
    #Actual noise rate 0.40
    [cuda:0] LNPCC waiting for GPU slot...
    [cuda:0] Slot acquired (waited 4.1s). Starting GCN...
    FINAL_RESULT: {'acc': {'train': 0.8058823529411765, 'valid': 0.4723372224313135, 'test': 0.7100524123101734}, 'wall_s': 33.28, 'cpu_s': 30.6, 'gpu_s': 2.63, 'wait_s': 4.05}
    [Time] wall=33.3s | cpu=30.6s | gpu=2.6s
    C:\Users\fbrev\Documents\Acadêmico\Simulações\Python\NoisyGL\predictor\Base_Predictor.py:114: UserWarning: expandable_segments not supported on this platform (Triggered internally at ..\c10/cuda/CUDAAllocatorConfig.h:28.)
    self.edge_index = self._cpu_edge_index.to(self.device)
    C:\Users\fbrev\Documents\Acadêmico\Simulações\Python\NoisyGL\predictor\Base_Predictor.py:144: UserWarning: Sparse CSR tensor support is in beta state. If you miss a functionality in the sparse tensor support, please submit a feature request to https://github.com/pytorch/pytorch/issues. (Triggered internally at ..\aten\src\ATen\SparseCsrTensorImpl.cpp:55.)
    self.adj_csr = self.adj.to_sparse_csr().to(self.device)
[I 2026-05-04 13:19:36,344] Trial 26 finished with value: 0.7100524123101734 and parameters: {'lr': 0.001, 'weight_decay': 0.0001, 'n_hidden': 64, 'n_layer': 3, 'dropout': 0.2605953812451114, 'knn_mode': 's', 'k': 34, 'dexp': 6.294971931758701, 'p_grd': 0.16501602869118195, 'unc_rem': 0.6513765021129545, 'unc_rel': 0.16335136467190425}. Best is trial 26 with value: 0.7100524123101734.
    [CPU] Loading dblp...
    DEBUG 3.1: Dataset init start
    DEBUG 3.2: prepare_data start dblp
    ----Data statistics------'
    Name: dblp
    #Nodes 17716
    #Edges 52867
    #Classes 4
    #Ave_degree 5.97
    ----Split statistics------'
    #Train samples 177 (1.0 % of nodes)
    #Val samples 2657 (15.0 % of nodes)
    #Test samples 14882 (remaining)
    ----label noise information:------
    Instance dependent noise
    #Actual noise rate 0.40
    [cuda:0] LNPCC waiting for GPU slot...
    [cuda:0] Slot acquired (waited 0.0s). Starting GCN...
    FINAL_RESULT: {'acc': {'train': 0.8106508875739645, 'valid': 0.4651863003387279, 'test': 0.69822604488644}, 'wall_s': 32.17, 'cpu_s': 29.36, 'gpu_s': 2.75, 'wait_s': 0.0}
    [Time] wall=32.2s | cpu=29.4s | gpu=2.8s
    C:\Users\fbrev\Documents\Acadêmico\Simulações\Python\NoisyGL\predictor\Base_Predictor.py:114: UserWarning: expandable_segments not supported on this platform (Triggered internally at ..\c10/cuda/CUDAAllocatorConfig.h:28.)
    self.edge_index = self._cpu_edge_index.to(self.device)
    C:\Users\fbrev\Documents\Acadêmico\Simulações\Python\NoisyGL\predictor\Base_Predictor.py:144: UserWarning: Sparse CSR tensor support is in beta state. If you miss a functionality in the sparse tensor support, please submit a feature request to https://github.com/pytorch/pytorch/issues. (Triggered internally at ..\aten\src\ATen\SparseCsrTensorImpl.cpp:55.)
    self.adj_csr = self.adj.to_sparse_csr().to(self.device)
[I 2026-05-04 13:20:13,842] Trial 27 finished with value: 0.69822604488644 and parameters: {'lr': 0.001, 'weight_decay': 0.0001, 'n_hidden': 64, 'n_layer': 3, 'dropout': 0.31287298271377595, 'knn_mode': 's', 'k': 34, 'dexp': 6.143552673737193, 'p_grd': 0.16553796358003092, 'unc_rem': 0.6371800766075842, 'unc_rel': 0.1398103908236739}. Best is trial 26 with value: 0.7100524123101734.
    [CPU] Loading dblp...
    DEBUG 3.1: Dataset init start
    DEBUG 3.2: prepare_data start dblp
    ----Data statistics------'
    Name: dblp
    #Nodes 17716
    #Edges 52867
    #Classes 4
    #Ave_degree 5.97
    ----Split statistics------'
    #Train samples 177 (1.0 % of nodes)
    #Val samples 2657 (15.0 % of nodes)
    #Test samples 14882 (remaining)
    ----label noise information:------
    Instance dependent noise
    #Actual noise rate 0.40
    [cuda:0] LNPCC waiting for GPU slot...
    [cuda:0] Slot acquired (waited 0.2s). Starting GCN...
    FINAL_RESULT: {'acc': {'train': 0.8711656441717791, 'valid': 0.4441098983816334, 'test': 0.658580835909152}, 'wall_s': 29.84, 'cpu_s': 27.08, 'gpu_s': 2.71, 'wait_s': 0.2}
    [Time] wall=29.8s | cpu=27.1s | gpu=2.7s
    C:\Users\fbrev\Documents\Acadêmico\Simulações\Python\NoisyGL\predictor\Base_Predictor.py:114: UserWarning: expandable_segments not supported on this platform (Triggered internally at ..\c10/cuda/CUDAAllocatorConfig.h:28.)
    self.edge_index = self._cpu_edge_index.to(self.device)
    C:\Users\fbrev\Documents\Acadêmico\Simulações\Python\NoisyGL\predictor\Base_Predictor.py:144: UserWarning: Sparse CSR tensor support is in beta state. If you miss a functionality in the sparse tensor support, please submit a feature request to https://github.com/pytorch/pytorch/issues. (Triggered internally at ..\aten\src\ATen\SparseCsrTensorImpl.cpp:55.)
    self.adj_csr = self.adj.to_sparse_csr().to(self.device)
[I 2026-05-04 13:20:48,672] Trial 28 finished with value: 0.658580835909152 and parameters: {'lr': 0.001, 'weight_decay': 0.0001, 'n_hidden': 64, 'n_layer': 3, 'dropout': 0.3964712799556851, 'knn_mode': 's', 'k': 39, 'dexp': 7.3202850932370565, 'p_grd': 0.044161369107480905, 'unc_rem': 0.4124789278595041, 'unc_rel': 0.173335829510455}. Best is trial 26 with value: 0.7100524123101734.
    [CPU] Loading dblp...
    DEBUG 3.1: Dataset init start
    DEBUG 3.2: prepare_data start dblp
    ----Data statistics------'
    Name: dblp
    #Nodes 17716
    #Edges 52867
    #Classes 4
    #Ave_degree 5.97
    ----Split statistics------'
    #Train samples 177 (1.0 % of nodes)
    #Val samples 2657 (15.0 % of nodes)
    #Test samples 14882 (remaining)
    ----label noise information:------
    Instance dependent noise
    #Actual noise rate 0.40
    [cuda:0] LNPCC waiting for GPU slot...
    [cuda:0] Slot acquired (waited 0.0s). Starting GCN...
    FINAL_RESULT: {'acc': {'train': 0.1962025316455696, 'valid': 0.4527662777568687, 'test': 0.6689289074049187}, 'wall_s': 30.34, 'cpu_s': 27.72, 'gpu_s': 2.57, 'wait_s': 0.0}
    [Time] wall=30.3s | cpu=27.7s | gpu=2.6s
    C:\Users\fbrev\Documents\Acadêmico\Simulações\Python\NoisyGL\predictor\Base_Predictor.py:114: UserWarning: expandable_segments not supported on this platform (Triggered internally at ..\c10/cuda/CUDAAllocatorConfig.h:28.)
    self.edge_index = self._cpu_edge_index.to(self.device)
    C:\Users\fbrev\Documents\Acadêmico\Simulações\Python\NoisyGL\predictor\Base_Predictor.py:144: UserWarning: Sparse CSR tensor support is in beta state. If you miss a functionality in the sparse tensor support, please submit a feature request to https://github.com/pytorch/pytorch/issues. (Triggered internally at ..\aten\src\ATen\SparseCsrTensorImpl.cpp:55.)
    self.adj_csr = self.adj.to_sparse_csr().to(self.device)
[I 2026-05-04 13:21:24,056] Trial 29 finished with value: 0.6689289074049187 and parameters: {'lr': 0.1, 'weight_decay': 0.0001, 'n_hidden': 64, 'n_layer': 3, 'dropout': 0.28389491646435966, 'knn_mode': 's', 'k': 32, 'dexp': 6.496243440154323, 'p_grd': 0.1511389511489929, 'unc_rem': 0.5196143789563294, 'unc_rel': 0.03197459857351659}. Best is trial 26 with value: 0.7100524123101734.
    [CPU] Loading dblp...
    DEBUG 3.1: Dataset init start
    DEBUG 3.2: prepare_data start dblp
    ----Data statistics------'
    Name: dblp
    #Nodes 17716
    #Edges 52867
    #Classes 4
    #Ave_degree 5.97
    ----Split statistics------'
    #Train samples 177 (1.0 % of nodes)
    #Val samples 2657 (15.0 % of nodes)
    #Test samples 14882 (remaining)
    ----label noise information:------
    Instance dependent noise
    #Actual noise rate 0.40
    [cuda:0] LNPCC waiting for GPU slot...
    [cuda:0] Slot acquired (waited 0.4s). Starting GCN...
    FINAL_RESULT: {'acc': {'train': 0.6857142857142857, 'valid': 0.45803537824614227, 'test': 0.6796129552479505}, 'wall_s': 31.01, 'cpu_s': 28.39, 'gpu_s': 2.57, 'wait_s': 0.35}
    [Time] wall=31.0s | cpu=28.4s | gpu=2.6s
    C:\Users\fbrev\Documents\Acadêmico\Simulações\Python\NoisyGL\predictor\Base_Predictor.py:114: UserWarning: expandable_segments not supported on this platform (Triggered internally at ..\c10/cuda/CUDAAllocatorConfig.h:28.)
    self.edge_index = self._cpu_edge_index.to(self.device)
    C:\Users\fbrev\Documents\Acadêmico\Simulações\Python\NoisyGL\predictor\Base_Predictor.py:144: UserWarning: Sparse CSR tensor support is in beta state. If you miss a functionality in the sparse tensor support, please submit a feature request to https://github.com/pytorch/pytorch/issues. (Triggered internally at ..\aten\src\ATen\SparseCsrTensorImpl.cpp:55.)
    self.adj_csr = self.adj.to_sparse_csr().to(self.device)
[I 2026-05-04 13:22:00,632] Trial 30 finished with value: 0.6796129552479505 and parameters: {'lr': 0.001, 'weight_decay': 0.0001, 'n_hidden': 64, 'n_layer': 3, 'dropout': 0.5097378382272485, 'knn_mode': 's', 'k': 28, 'dexp': 8.853219097604232, 'p_grd': 0.18869251788194474, 'unc_rem': 0.42696214140361793, 'unc_rel': 0.5514169432782525}. Best is trial 26 with value: 0.7100524123101734.
    [CPU] Loading dblp...
    DEBUG 3.1: Dataset init start
    DEBUG 3.2: prepare_data start dblp
    ----Data statistics------'
    Name: dblp
    #Nodes 17716
    #Edges 52867
    #Classes 4
    #Ave_degree 5.97
    ----Split statistics------'
    #Train samples 177 (1.0 % of nodes)
    #Val samples 2657 (15.0 % of nodes)
    #Test samples 14882 (remaining)
    ----label noise information:------
    Instance dependent noise
    #Actual noise rate 0.40
    [cuda:0] LNPCC waiting for GPU slot...
    [cuda:0] Slot acquired (waited 2.0s). Starting GCN...
    FINAL_RESULT: {'acc': {'train': 0.7857142857142857, 'valid': 0.4471208129469326, 'test': 0.6683241499798415}, 'wall_s': 32.74, 'cpu_s': 29.87, 'gpu_s': 2.81, 'wait_s': 1.98}
    [Time] wall=32.7s | cpu=29.9s | gpu=2.8s
    C:\Users\fbrev\Documents\Acadêmico\Simulações\Python\NoisyGL\predictor\Base_Predictor.py:114: UserWarning: expandable_segments not supported on this platform (Triggered internally at ..\c10/cuda/CUDAAllocatorConfig.h:28.)
    self.edge_index = self._cpu_edge_index.to(self.device)
    C:\Users\fbrev\Documents\Acadêmico\Simulações\Python\NoisyGL\predictor\Base_Predictor.py:144: UserWarning: Sparse CSR tensor support is in beta state. If you miss a functionality in the sparse tensor support, please submit a feature request to https://github.com/pytorch/pytorch/issues. (Triggered internally at ..\aten\src\ATen\SparseCsrTensorImpl.cpp:55.)
    self.adj_csr = self.adj.to_sparse_csr().to(self.device)
[I 2026-05-04 13:22:40,852] Trial 31 finished with value: 0.6683241499798415 and parameters: {'lr': 0.001, 'weight_decay': 0.0001, 'n_hidden': 64, 'n_layer': 3, 'dropout': 0.4016574540647778, 'knn_mode': 's', 'k': 35, 'dexp': 6.1802673519592854, 'p_grd': 0.1640364389688324, 'unc_rem': 0.6424885615349862, 'unc_rel': 0.12251786082385702}. Best is trial 26 with value: 0.7100524123101734.
    [CPU] Loading dblp...
    DEBUG 3.1: Dataset init start
    DEBUG 3.2: prepare_data start dblp
    ----Data statistics------'
    Name: dblp
    #Nodes 17716
    #Edges 52867
    #Classes 4
    #Ave_degree 5.97
    ----Split statistics------'
    #Train samples 177 (1.0 % of nodes)
    #Val samples 2657 (15.0 % of nodes)
    #Test samples 14882 (remaining)
    ----label noise information:------
    Instance dependent noise
    #Actual noise rate 0.40
    [cuda:0] LNPCC waiting for GPU slot...
    [cuda:0] Slot acquired (waited 0.0s). Starting GCN...
    FINAL_RESULT: {'acc': {'train': 0.7, 'valid': 0.45502446368084304, 'test': 0.6760516059669399}, 'wall_s': 31.08, 'cpu_s': 28.17, 'gpu_s': 2.85, 'wait_s': 0.0}
    [Time] wall=31.1s | cpu=28.2s | gpu=2.8s
    C:\Users\fbrev\Documents\Acadêmico\Simulações\Python\NoisyGL\predictor\Base_Predictor.py:114: UserWarning: expandable_segments not supported on this platform (Triggered internally at ..\c10/cuda/CUDAAllocatorConfig.h:28.)
    self.edge_index = self._cpu_edge_index.to(self.device)
    C:\Users\fbrev\Documents\Acadêmico\Simulações\Python\NoisyGL\predictor\Base_Predictor.py:144: UserWarning: Sparse CSR tensor support is in beta state. If you miss a functionality in the sparse tensor support, please submit a feature request to https://github.com/pytorch/pytorch/issues. (Triggered internally at ..\aten\src\ATen\SparseCsrTensorImpl.cpp:55.)
    self.adj_csr = self.adj.to_sparse_csr().to(self.device)
