[I 2026-05-06 20:01:13,721] Trial 47 finished with value: 0.649 and parameters: {'lr': 0.01, 'weight_decay': 0.01, 'n_hidden': 64, 'n_layer': 3, 'dropout': 0.08305669012742756, 'knn_mode': 'd', 'k': 44, 'dexp': 3.8614458046987052, 'p_grd': 0.33831206022838395, 'unc_rem': 0.350485820726408, 'unc_rel': 0.09011929474481303}. Best is trial 3 with value: 0.731.
    [CPU] Loading pubmed...
    DEBUG 3.1: Dataset init start
    DEBUG 3.2: prepare_data start pubmed
    ----Data statistics------'
    Name: pubmed
    #Nodes 19717
    #Edges 44324
    #Classes 3
    #Ave_degree 4.50
    ----Split statistics------'
    #Train samples 60 (default)
    #Val samples 500 (default)
    #Test samples 1000 (default)
    ----label noise information:------
    Instance dependent noise
    #Actual noise rate 0.21
    [cuda:1] LNPCC waiting for GPU slot...
    [cuda:1] Slot acquired (waited 139.5s). Starting GCN...
    FINAL_RESULT: {'acc': {'train': 0.9152542372881356, 'valid': 0.62, 'test': 0.722}, 'wall_s': 31.86, 'cpu_s': 28.05, 'gpu_s': 3.75, 'wait_s': 139.48}
    [Time] wall=31.9s | cpu=28.1s | gpu=3.8s
    C:\Users\fbrev\Documents\Acadêmico\Simulações\Python\NoisyGL\predictor\Base_Predictor.py:114: UserWarning: expandable_segments not supported on this platform (Triggered internally at ..\c10/cuda/CUDAAllocatorConfig.h:28.)
    self.edge_index = self._cpu_edge_index.to(self.device)
    C:\Users\fbrev\Documents\Acadêmico\Simulações\Python\NoisyGL\predictor\Base_Predictor.py:144: UserWarning: Sparse CSR tensor support is in beta state. If you miss a functionality in the sparse tensor support, please submit a feature request to https://github.com/pytorch/pytorch/issues. (Triggered internally at ..\aten\src\ATen\SparseCsrTensorImpl.cpp:55.)
    self.adj_csr = self.adj.to_sparse_csr().to(self.device)
[I 2026-05-06 20:04:11,541] Trial 48 finished with value: 0.722 and parameters: {'lr': 0.01, 'weight_decay': 0.0001, 'n_hidden': 256, 'n_layer': 2, 'dropout': 0.17431189350574275, 'knn_mode': 's', 'k': 40, 'dexp': 2.087642770414168, 'p_grd': 0.2568836702381665, 'unc_rem': 0.6095579458016233, 'unc_rel': 0.5757572899613581}. Best is trial 3 with value: 0.731.
    [CPU] Loading pubmed...
    DEBUG 3.1: Dataset init start
    DEBUG 3.2: prepare_data start pubmed
    ----Data statistics------'
    Name: pubmed
    #Nodes 19717
    #Edges 44324
    #Classes 3
    #Ave_degree 4.50
    ----Split statistics------'
    #Train samples 60 (default)
    #Val samples 500 (default)
    #Test samples 1000 (default)
    ----label noise information:------
    Instance dependent noise
    #Actual noise rate 0.21
    [cuda:1] LNPCC waiting for GPU slot...
    [cuda:1] Slot acquired (waited 147.3s). Starting GCN...
    FINAL_RESULT: {'acc': {'train': 0.8461538461538461, 'valid': 0.58, 'test': 0.695}, 'wall_s': 32.03, 'cpu_s': 29.81, 'gpu_s': 2.16, 'wait_s': 147.31}
    [Time] wall=32.0s | cpu=29.8s | gpu=2.2s
    C:\Users\fbrev\Documents\Acadêmico\Simulações\Python\NoisyGL\predictor\Base_Predictor.py:114: UserWarning: expandable_segments not supported on this platform (Triggered internally at ..\c10/cuda/CUDAAllocatorConfig.h:28.)
    self.edge_index = self._cpu_edge_index.to(self.device)
    C:\Users\fbrev\Documents\Acadêmico\Simulações\Python\NoisyGL\predictor\Base_Predictor.py:144: UserWarning: Sparse CSR tensor support is in beta state. If you miss a functionality in the sparse tensor support, please submit a feature request to https://github.com/pytorch/pytorch/issues. (Triggered internally at ..\aten\src\ATen\SparseCsrTensorImpl.cpp:55.)
    self.adj_csr = self.adj.to_sparse_csr().to(self.device)
