[I 2026-05-07 20:43:30,846] Trial 49 finished with value: 0.615 and parameters: {'lr': 0.01, 'weight_decay': 0.01, 'n_hidden': 256, 'n_layer': 2, 'dropout': 0.5302877227067182, 'knn_mode': 'd', 'k': 19, 'dexp': 6.67939323563988, 'p_grd': 0.9214851635557938, 'unc_rem': 0.8051120361865551, 'unc_rel': 0.6559156957613088}. Best is trial 25 with value: 0.671.

[Retest] Phase 1 Finished. Validating Top 3 (10 runs each)...

  [Retest] Candidate 1/3 (Trial 25, HPO_acc=0.6710)
    [CPU] Loading citeseer...
    DEBUG 3.1: Dataset init start
    DEBUG 3.2: prepare_data start citeseer
    ----Data statistics------'
    Name: citeseer
    #Nodes 3327
    #Edges 4552
    #Classes 6
    #Ave_degree 2.74
    ----Split statistics------'
    #Train samples 120 (default)
    #Val samples 500 (default)
    #Test samples 1000 (default)
    ----label noise information:------
    Instance dependent noise
    #Actual noise rate 0.31
    [cuda:1] LNPCC waiting for GPU slot...
    [cuda:1] Slot acquired (waited 1.8s). Starting GCN...
    FINAL_RESULT: {'acc': {'train': 0.9, 'valid': 0.492, 'test': 0.627}, 'wall_s': 21.89, 'cpu_s': 20.02, 'gpu_s': 1.83, 'wait_s': 1.82}
    [Time] wall=21.9s | cpu=20.0s | gpu=1.8s
    C:\Users\fbrev\Documents\Acadêmico\Simulações\Python\NoisyGL\predictor\Base_Predictor.py:114: UserWarning: expandable_segments not supported on this platform (Triggered internally at ..\c10/cuda/CUDAAllocatorConfig.h:28.)
    self.edge_index = self._cpu_edge_index.to(self.device)
    C:\Users\fbrev\Documents\Acadêmico\Simulações\Python\NoisyGL\predictor\Base_Predictor.py:144: UserWarning: Sparse CSR tensor support is in beta state. If you miss a functionality in the sparse tensor support, please submit a feature request to https://github.com/pytorch/pytorch/issues. (Triggered internally at ..\aten\src\ATen\SparseCsrTensorImpl.cpp:55.)
    self.adj_csr = self.adj.to_sparse_csr().to(self.device)
    [CPU] Loading citeseer...
    DEBUG 3.1: Dataset init start
    DEBUG 3.2: prepare_data start citeseer
    ----Data statistics------'
    Name: citeseer
    #Nodes 3327
    #Edges 4552
    #Classes 6
    #Ave_degree 2.74
    ----Split statistics------'
    #Train samples 120 (default)
    #Val samples 500 (default)
    #Test samples 1000 (default)
    ----label noise information:------
    Instance dependent noise
    #Actual noise rate 0.30
    [cuda:1] LNPCC waiting for GPU slot...
    [cuda:1] Slot acquired (waited 0.0s). Starting GCN...
    FINAL_RESULT: {'acc': {'train': 0.9243697478991597, 'valid': 0.49, 'test': 0.67}, 'wall_s': 21.32, 'cpu_s': 19.64, 'gpu_s': 1.64, 'wait_s': 0.0}
    [Time] wall=21.3s | cpu=19.6s | gpu=1.6s
    C:\Users\fbrev\Documents\Acadêmico\Simulações\Python\NoisyGL\predictor\Base_Predictor.py:114: UserWarning: expandable_segments not supported on this platform (Triggered internally at ..\c10/cuda/CUDAAllocatorConfig.h:28.)
    self.edge_index = self._cpu_edge_index.to(self.device)
    C:\Users\fbrev\Documents\Acadêmico\Simulações\Python\NoisyGL\predictor\Base_Predictor.py:144: UserWarning: Sparse CSR tensor support is in beta state. If you miss a functionality in the sparse tensor support, please submit a feature request to https://github.com/pytorch/pytorch/issues. (Triggered internally at ..\aten\src\ATen\SparseCsrTensorImpl.cpp:55.)
    self.adj_csr = self.adj.to_sparse_csr().to(self.device)
    [CPU] Loading citeseer...
    DEBUG 3.1: Dataset init start
    DEBUG 3.2: prepare_data start citeseer
    ----Data statistics------'
    Name: citeseer
    #Nodes 3327
    #Edges 4552
    #Classes 6
    #Ave_degree 2.74
    ----Split statistics------'
    #Train samples 120 (default)
    #Val samples 500 (default)
    #Test samples 1000 (default)
    ----label noise information:------
    Instance dependent noise
    #Actual noise rate 0.30
    [cuda:1] LNPCC waiting for GPU slot...
    [cuda:1] Slot acquired (waited 0.0s). Starting GCN...
    FINAL_RESULT: {'acc': {'train': 0.907563025210084, 'valid': 0.478, 'test': 0.564}, 'wall_s': 18.78, 'cpu_s': 16.95, 'gpu_s': 1.79, 'wait_s': 0.0}
    [Time] wall=18.8s | cpu=16.9s | gpu=1.8s
    C:\Users\fbrev\Documents\Acadêmico\Simulações\Python\NoisyGL\predictor\Base_Predictor.py:114: UserWarning: expandable_segments not supported on this platform (Triggered internally at ..\c10/cuda/CUDAAllocatorConfig.h:28.)
    self.edge_index = self._cpu_edge_index.to(self.device)
    C:\Users\fbrev\Documents\Acadêmico\Simulações\Python\NoisyGL\predictor\Base_Predictor.py:144: UserWarning: Sparse CSR tensor support is in beta state. If you miss a functionality in the sparse tensor support, please submit a feature request to https://github.com/pytorch/pytorch/issues. (Triggered internally at ..\aten\src\ATen\SparseCsrTensorImpl.cpp:55.)
    self.adj_csr = self.adj.to_sparse_csr().to(self.device)
    [CPU] Loading citeseer...
    DEBUG 3.1: Dataset init start
    DEBUG 3.2: prepare_data start citeseer
    ----Data statistics------'
    Name: citeseer
    #Nodes 3327
    #Edges 4552
    #Classes 6
    #Ave_degree 2.74
    ----Split statistics------'
    #Train samples 120 (default)
    #Val samples 500 (default)
    #Test samples 1000 (default)
    ----label noise information:------
    Instance dependent noise
    #Actual noise rate 0.31
    [cuda:1] LNPCC waiting for GPU slot...
    [cuda:1] Slot acquired (waited 1.0s). Starting GCN...
    FINAL_RESULT: {'acc': {'train': 0.9333333333333333, 'valid': 0.492, 'test': 0.587}, 'wall_s': 21.67, 'cpu_s': 19.78, 'gpu_s': 1.85, 'wait_s': 1.01}
    [Time] wall=21.7s | cpu=19.8s | gpu=1.9s
    C:\Users\fbrev\Documents\Acadêmico\Simulações\Python\NoisyGL\predictor\Base_Predictor.py:114: UserWarning: expandable_segments not supported on this platform (Triggered internally at ..\c10/cuda/CUDAAllocatorConfig.h:28.)
    self.edge_index = self._cpu_edge_index.to(self.device)
    C:\Users\fbrev\Documents\Acadêmico\Simulações\Python\NoisyGL\predictor\Base_Predictor.py:144: UserWarning: Sparse CSR tensor support is in beta state. If you miss a functionality in the sparse tensor support, please submit a feature request to https://github.com/pytorch/pytorch/issues. (Triggered internally at ..\aten\src\ATen\SparseCsrTensorImpl.cpp:55.)
    self.adj_csr = self.adj.to_sparse_csr().to(self.device)
    [CPU] Loading citeseer...
    DEBUG 3.1: Dataset init start
    DEBUG 3.2: prepare_data start citeseer
    ----Data statistics------'
    Name: citeseer
    #Nodes 3327
    #Edges 4552
    #Classes 6
    #Ave_degree 2.74
    ----Split statistics------'
    #Train samples 120 (default)
    #Val samples 500 (default)
    #Test samples 1000 (default)
    ----label noise information:------
    Instance dependent noise
    #Actual noise rate 0.31
    [cuda:1] LNPCC waiting for GPU slot...
    [cuda:1] Slot acquired (waited 0.0s). Starting GCN...
    FINAL_RESULT: {'acc': {'train': 0.8916666666666667, 'valid': 0.45, 'test': 0.593}, 'wall_s': 19.85, 'cpu_s': 17.73, 'gpu_s': 2.09, 'wait_s': 0.0}
    [Time] wall=19.9s | cpu=17.7s | gpu=2.1s
    C:\Users\fbrev\Documents\Acadêmico\Simulações\Python\NoisyGL\predictor\Base_Predictor.py:114: UserWarning: expandable_segments not supported on this platform (Triggered internally at ..\c10/cuda/CUDAAllocatorConfig.h:28.)
    self.edge_index = self._cpu_edge_index.to(self.device)
    C:\Users\fbrev\Documents\Acadêmico\Simulações\Python\NoisyGL\predictor\Base_Predictor.py:144: UserWarning: Sparse CSR tensor support is in beta state. If you miss a functionality in the sparse tensor support, please submit a feature request to https://github.com/pytorch/pytorch/issues. (Triggered internally at ..\aten\src\ATen\SparseCsrTensorImpl.cpp:55.)
    self.adj_csr = self.adj.to_sparse_csr().to(self.device)
    [CPU] Loading citeseer...
    DEBUG 3.1: Dataset init start
    DEBUG 3.2: prepare_data start citeseer
    ----Data statistics------'
    Name: citeseer
    #Nodes 3327
    #Edges 4552
    #Classes 6
    #Ave_degree 2.74
    ----Split statistics------'
    #Train samples 120 (default)
    #Val samples 500 (default)
    #Test samples 1000 (default)
    ----label noise information:------
    Instance dependent noise
    #Actual noise rate 0.31
    [cuda:1] LNPCC waiting for GPU slot...
    [cuda:1] Slot acquired (waited 0.0s). Starting GCN...
    FINAL_RESULT: {'acc': {'train': 0.9416666666666667, 'valid': 0.434, 'test': 0.549}, 'wall_s': 21.43, 'cpu_s': 19.32, 'gpu_s': 2.05, 'wait_s': 0.0}
    [Time] wall=21.4s | cpu=19.3s | gpu=2.1s
    C:\Users\fbrev\Documents\Acadêmico\Simulações\Python\NoisyGL\predictor\Base_Predictor.py:114: UserWarning: expandable_segments not supported on this platform (Triggered internally at ..\c10/cuda/CUDAAllocatorConfig.h:28.)
    self.edge_index = self._cpu_edge_index.to(self.device)
    C:\Users\fbrev\Documents\Acadêmico\Simulações\Python\NoisyGL\predictor\Base_Predictor.py:144: UserWarning: Sparse CSR tensor support is in beta state. If you miss a functionality in the sparse tensor support, please submit a feature request to https://github.com/pytorch/pytorch/issues. (Triggered internally at ..\aten\src\ATen\SparseCsrTensorImpl.cpp:55.)
    self.adj_csr = self.adj.to_sparse_csr().to(self.device)
    [CPU] Loading citeseer...
    DEBUG 3.1: Dataset init start
    DEBUG 3.2: prepare_data start citeseer
    ----Data statistics------'
    Name: citeseer
    #Nodes 3327
    #Edges 4552
    #Classes 6
    #Ave_degree 2.74
    ----Split statistics------'
    #Train samples 120 (default)
    #Val samples 500 (default)
    #Test samples 1000 (default)
    ----label noise information:------
    Instance dependent noise
    #Actual noise rate 0.30
    [cuda:1] LNPCC waiting for GPU slot...
    [cuda:1] Slot acquired (waited 0.0s). Starting GCN...
    FINAL_RESULT: {'acc': {'train': 0.9083333333333333, 'valid': 0.5, 'test': 0.624}, 'wall_s': 21.93, 'cpu_s': 19.8, 'gpu_s': 2.08, 'wait_s': 0.0}
    [Time] wall=21.9s | cpu=19.8s | gpu=2.1s
    C:\Users\fbrev\Documents\Acadêmico\Simulações\Python\NoisyGL\predictor\Base_Predictor.py:114: UserWarning: expandable_segments not supported on this platform (Triggered internally at ..\c10/cuda/CUDAAllocatorConfig.h:28.)
    self.edge_index = self._cpu_edge_index.to(self.device)
    C:\Users\fbrev\Documents\Acadêmico\Simulações\Python\NoisyGL\predictor\Base_Predictor.py:144: UserWarning: Sparse CSR tensor support is in beta state. If you miss a functionality in the sparse tensor support, please submit a feature request to https://github.com/pytorch/pytorch/issues. (Triggered internally at ..\aten\src\ATen\SparseCsrTensorImpl.cpp:55.)
    self.adj_csr = self.adj.to_sparse_csr().to(self.device)
    [CPU] Loading citeseer...
    DEBUG 3.1: Dataset init start
    DEBUG 3.2: prepare_data start citeseer
    ----Data statistics------'
    Name: citeseer
    #Nodes 3327
    #Edges 4552
    #Classes 6
    #Ave_degree 2.74
    ----Split statistics------'
    #Train samples 120 (default)
    #Val samples 500 (default)
    #Test samples 1000 (default)
    ----label noise information:------
    Instance dependent noise
    #Actual noise rate 0.30
    [cuda:1] LNPCC waiting for GPU slot...
    [cuda:1] Slot acquired (waited 0.0s). Starting GCN...
    FINAL_RESULT: {'acc': {'train': 0.9416666666666667, 'valid': 0.486, 'test': 0.636}, 'wall_s': 20.63, 'cpu_s': 18.98, 'gpu_s': 1.62, 'wait_s': 0.0}
    [Time] wall=20.6s | cpu=19.0s | gpu=1.6s
    C:\Users\fbrev\Documents\Acadêmico\Simulações\Python\NoisyGL\predictor\Base_Predictor.py:114: UserWarning: expandable_segments not supported on this platform (Triggered internally at ..\c10/cuda/CUDAAllocatorConfig.h:28.)
    self.edge_index = self._cpu_edge_index.to(self.device)
    C:\Users\fbrev\Documents\Acadêmico\Simulações\Python\NoisyGL\predictor\Base_Predictor.py:144: UserWarning: Sparse CSR tensor support is in beta state. If you miss a functionality in the sparse tensor support, please submit a feature request to https://github.com/pytorch/pytorch/issues. (Triggered internally at ..\aten\src\ATen\SparseCsrTensorImpl.cpp:55.)
    self.adj_csr = self.adj.to_sparse_csr().to(self.device)
    [CPU] Loading citeseer...
    DEBUG 3.1: Dataset init start
    DEBUG 3.2: prepare_data start citeseer
    ----Data statistics------'
    Name: citeseer
    #Nodes 3327
    #Edges 4552
    #Classes 6
    #Ave_degree 2.74
    ----Split statistics------'
    #Train samples 120 (default)
    #Val samples 500 (default)
    #Test samples 1000 (default)
    ----label noise information:------
    Instance dependent noise
    #Actual noise rate 0.30
    [cuda:1] LNPCC waiting for GPU slot...
    [cuda:1] Slot acquired (waited 0.0s). Starting GCN...
    FINAL_RESULT: {'acc': {'train': 0.9, 'valid': 0.462, 'test': 0.639}, 'wall_s': 21.2, 'cpu_s': 19.43, 'gpu_s': 1.74, 'wait_s': 0.0}
    [Time] wall=21.2s | cpu=19.4s | gpu=1.7s
    C:\Users\fbrev\Documents\Acadêmico\Simulações\Python\NoisyGL\predictor\Base_Predictor.py:114: UserWarning: expandable_segments not supported on this platform (Triggered internally at ..\c10/cuda/CUDAAllocatorConfig.h:28.)
    self.edge_index = self._cpu_edge_index.to(self.device)
    C:\Users\fbrev\Documents\Acadêmico\Simulações\Python\NoisyGL\predictor\Base_Predictor.py:144: UserWarning: Sparse CSR tensor support is in beta state. If you miss a functionality in the sparse tensor support, please submit a feature request to https://github.com/pytorch/pytorch/issues. (Triggered internally at ..\aten\src\ATen\SparseCsrTensorImpl.cpp:55.)
    self.adj_csr = self.adj.to_sparse_csr().to(self.device)
    [CPU] Loading citeseer...
    DEBUG 3.1: Dataset init start
    DEBUG 3.2: prepare_data start citeseer
    ----Data statistics------'
    Name: citeseer
    #Nodes 3327
    #Edges 4552
    #Classes 6
    #Ave_degree 2.74
    ----Split statistics------'
    #Train samples 120 (default)
    #Val samples 500 (default)
    #Test samples 1000 (default)
    ----label noise information:------
    Instance dependent noise
    #Actual noise rate 0.30
    [cuda:1] LNPCC waiting for GPU slot...
    [cuda:1] Slot acquired (waited 1.9s). Starting GCN...
    FINAL_RESULT: {'acc': {'train': 0.9159663865546218, 'valid': 0.438, 'test': 0.596}, 'wall_s': 19.97, 'cpu_s': 18.13, 'gpu_s': 1.81, 'wait_s': 1.87}
    [Time] wall=20.0s | cpu=18.1s | gpu=1.8s
    C:\Users\fbrev\Documents\Acadêmico\Simulações\Python\NoisyGL\predictor\Base_Predictor.py:114: UserWarning: expandable_segments not supported on this platform (Triggered internally at ..\c10/cuda/CUDAAllocatorConfig.h:28.)
    self.edge_index = self._cpu_edge_index.to(self.device)
    C:\Users\fbrev\Documents\Acadêmico\Simulações\Python\NoisyGL\predictor\Base_Predictor.py:144: UserWarning: Sparse CSR tensor support is in beta state. If you miss a functionality in the sparse tensor support, please submit a feature request to https://github.com/pytorch/pytorch/issues. (Triggered internally at ..\aten\src\ATen\SparseCsrTensorImpl.cpp:55.)
    self.adj_csr = self.adj.to_sparse_csr().to(self.device)
  [Retest] Candidate 1 Avg: 0.6085

  [Retest] Candidate 2/3 (Trial 43, HPO_acc=0.6690)
    [CPU] Loading citeseer...
    DEBUG 3.1: Dataset init start
    DEBUG 3.2: prepare_data start citeseer
    ----Data statistics------'
    Name: citeseer
    #Nodes 3327
    #Edges 4552
    #Classes 6
    #Ave_degree 2.74
    ----Split statistics------'
    #Train samples 120 (default)
    #Val samples 500 (default)
    #Test samples 1000 (default)
    ----label noise information:------
    Instance dependent noise
    #Actual noise rate 0.31
    [cuda:1] LNPCC waiting for GPU slot...
    [cuda:1] Slot acquired (waited 0.0s). Starting GCN...
    FINAL_RESULT: {'acc': {'train': 0.825, 'valid': 0.5, 'test': 0.66}, 'wall_s': 32.28, 'cpu_s': 30.6, 'gpu_s': 1.63, 'wait_s': 0.0}
    [Time] wall=32.3s | cpu=30.6s | gpu=1.6s
    C:\Users\fbrev\Documents\Acadêmico\Simulações\Python\NoisyGL\predictor\Base_Predictor.py:114: UserWarning: expandable_segments not supported on this platform (Triggered internally at ..\c10/cuda/CUDAAllocatorConfig.h:28.)
    self.edge_index = self._cpu_edge_index.to(self.device)
    C:\Users\fbrev\Documents\Acadêmico\Simulações\Python\NoisyGL\predictor\Base_Predictor.py:144: UserWarning: Sparse CSR tensor support is in beta state. If you miss a functionality in the sparse tensor support, please submit a feature request to https://github.com/pytorch/pytorch/issues. (Triggered internally at ..\aten\src\ATen\SparseCsrTensorImpl.cpp:55.)
    self.adj_csr = self.adj.to_sparse_csr().to(self.device)
    [CPU] Loading citeseer...
    DEBUG 3.1: Dataset init start
    DEBUG 3.2: prepare_data start citeseer
    ----Data statistics------'
    Name: citeseer
    #Nodes 3327
    #Edges 4552
    #Classes 6
    #Ave_degree 2.74
    ----Split statistics------'
    #Train samples 120 (default)
    #Val samples 500 (default)
    #Test samples 1000 (default)
    ----label noise information:------
    Instance dependent noise
    #Actual noise rate 0.30
    [cuda:1] LNPCC waiting for GPU slot...
    [cuda:1] Slot acquired (waited 0.0s). Starting GCN...
    FINAL_RESULT: {'acc': {'train': 0.8583333333333333, 'valid': 0.486, 'test': 0.672}, 'wall_s': 18.07, 'cpu_s': 16.02, 'gpu_s': 2.0, 'wait_s': 0.0}
    [Time] wall=18.1s | cpu=16.0s | gpu=2.0s
    C:\Users\fbrev\Documents\Acadêmico\Simulações\Python\NoisyGL\predictor\Base_Predictor.py:114: UserWarning: expandable_segments not supported on this platform (Triggered internally at ..\c10/cuda/CUDAAllocatorConfig.h:28.)
    self.edge_index = self._cpu_edge_index.to(self.device)
    C:\Users\fbrev\Documents\Acadêmico\Simulações\Python\NoisyGL\predictor\Base_Predictor.py:144: UserWarning: Sparse CSR tensor support is in beta state. If you miss a functionality in the sparse tensor support, please submit a feature request to https://github.com/pytorch/pytorch/issues. (Triggered internally at ..\aten\src\ATen\SparseCsrTensorImpl.cpp:55.)
    self.adj_csr = self.adj.to_sparse_csr().to(self.device)
    [CPU] Loading citeseer...
    DEBUG 3.1: Dataset init start
    DEBUG 3.2: prepare_data start citeseer
    ----Data statistics------'
    Name: citeseer
    #Nodes 3327
    #Edges 4552
    #Classes 6
    #Ave_degree 2.74
    ----Split statistics------'
    #Train samples 120 (default)
    #Val samples 500 (default)
    #Test samples 1000 (default)
    ----label noise information:------
    Instance dependent noise
    #Actual noise rate 0.30
    [cuda:1] LNPCC waiting for GPU slot...
    [cuda:1] Slot acquired (waited 0.0s). Starting GCN...
    FINAL_RESULT: {'acc': {'train': 0.8916666666666667, 'valid': 0.486, 'test': 0.615}, 'wall_s': 27.36, 'cpu_s': 25.49, 'gpu_s': 1.84, 'wait_s': 0.0}
    [Time] wall=27.4s | cpu=25.5s | gpu=1.8s
    C:\Users\fbrev\Documents\Acadêmico\Simulações\Python\NoisyGL\predictor\Base_Predictor.py:114: UserWarning: expandable_segments not supported on this platform (Triggered internally at ..\c10/cuda/CUDAAllocatorConfig.h:28.)
    self.edge_index = self._cpu_edge_index.to(self.device)
    C:\Users\fbrev\Documents\Acadêmico\Simulações\Python\NoisyGL\predictor\Base_Predictor.py:144: UserWarning: Sparse CSR tensor support is in beta state. If you miss a functionality in the sparse tensor support, please submit a feature request to https://github.com/pytorch/pytorch/issues. (Triggered internally at ..\aten\src\ATen\SparseCsrTensorImpl.cpp:55.)
    self.adj_csr = self.adj.to_sparse_csr().to(self.device)
    [CPU] Loading citeseer...
    DEBUG 3.1: Dataset init start
    DEBUG 3.2: prepare_data start citeseer
    ----Data statistics------'
    Name: citeseer
    #Nodes 3327
    #Edges 4552
    #Classes 6
    #Ave_degree 2.74
    ----Split statistics------'
    #Train samples 120 (default)
    #Val samples 500 (default)
    #Test samples 1000 (default)
    ----label noise information:------
    Instance dependent noise
    #Actual noise rate 0.31
    [cuda:1] LNPCC waiting for GPU slot...
    [cuda:1] Slot acquired (waited 0.0s). Starting GCN...
    FINAL_RESULT: {'acc': {'train': 0.825, 'valid': 0.494, 'test': 0.624}, 'wall_s': 25.87, 'cpu_s': 24.16, 'gpu_s': 1.67, 'wait_s': 0.0}
    [Time] wall=25.9s | cpu=24.2s | gpu=1.7s
    C:\Users\fbrev\Documents\Acadêmico\Simulações\Python\NoisyGL\predictor\Base_Predictor.py:114: UserWarning: expandable_segments not supported on this platform (Triggered internally at ..\c10/cuda/CUDAAllocatorConfig.h:28.)
    self.edge_index = self._cpu_edge_index.to(self.device)
    C:\Users\fbrev\Documents\Acadêmico\Simulações\Python\NoisyGL\predictor\Base_Predictor.py:144: UserWarning: Sparse CSR tensor support is in beta state. If you miss a functionality in the sparse tensor support, please submit a feature request to https://github.com/pytorch/pytorch/issues. (Triggered internally at ..\aten\src\ATen\SparseCsrTensorImpl.cpp:55.)
    self.adj_csr = self.adj.to_sparse_csr().to(self.device)
    [CPU] Loading citeseer...
    DEBUG 3.1: Dataset init start
    DEBUG 3.2: prepare_data start citeseer
    ----Data statistics------'
    Name: citeseer
    #Nodes 3327
    #Edges 4552
    #Classes 6
    #Ave_degree 2.74
    ----Split statistics------'
    #Train samples 120 (default)
    #Val samples 500 (default)
    #Test samples 1000 (default)
    ----label noise information:------
    Instance dependent noise
    #Actual noise rate 0.31
    [cuda:1] LNPCC waiting for GPU slot...
    [cuda:1] Slot acquired (waited 1.9s). Starting GCN...
    FINAL_RESULT: {'acc': {'train': 0.8833333333333333, 'valid': 0.452, 'test': 0.594}, 'wall_s': 21.71, 'cpu_s': 19.94, 'gpu_s': 1.73, 'wait_s': 1.87}
    [Time] wall=21.7s | cpu=19.9s | gpu=1.7s
    C:\Users\fbrev\Documents\Acadêmico\Simulações\Python\NoisyGL\predictor\Base_Predictor.py:114: UserWarning: expandable_segments not supported on this platform (Triggered internally at ..\c10/cuda/CUDAAllocatorConfig.h:28.)
    self.edge_index = self._cpu_edge_index.to(self.device)
    C:\Users\fbrev\Documents\Acadêmico\Simulações\Python\NoisyGL\predictor\Base_Predictor.py:144: UserWarning: Spars