[I 2026-05-10 21:31:02,520] Trial 137 finished with value: 0.24936569222283508 and parameters: {'lr': 0.1, 'weight_decay': 0.001, 'n_hidden': 256, 'n_layer': 3, 'dropout': 0.6586300745698535, 'knn_mode': 's', 'k': 19, 'dexp': 7.566125644627659, 'p_grd': 0.256054572690995, 'unc_rem': 0.5125995540145175, 'unc_rel': 0.3884923847076278}. Best is trial 100 with value: 0.3474903474903475.
    [CPU] Loading roman-empire...
    DEBUG 3.1: Dataset init start
    DEBUG 3.2: prepare_data start roman-empire
    ----Data statistics------'
    Name: roman-empire
    #Nodes 22662
    #Edges 32927
    #Classes 18
    #Ave_degree 2.91
    ----Split statistics------'
    #Train samples 1133 (5.0 % of nodes)
    #Val samples 3399 (15.0 % of nodes)
    #Test samples 18130 (remaining)
    ----label noise information:------
    Instance dependent noise
    #Actual noise rate 0.40
    [cuda:1] LNPCC waiting for GPU slot...
    [cuda:1] Slot acquired (waited 0.0s). Starting GCN...
    FINAL_RESULT: {'acc': {'train': 0.3848190644307149, 'valid': 0.23359811709326272, 'test': 0.33728626585769445}, 'wall_s': 126.51, 'cpu_s': 122.55, 'gpu_s': 3.92, 'wait_s': 0.0}
    [Time] wall=126.5s | cpu=122.5s | gpu=3.9s
    C:\Users\fbrev\Documents\Acadêmico\Simulações\Python\NoisyGL\predictor\Base_Predictor.py:114: UserWarning: expandable_segments not supported on this platform (Triggered internally at ..\c10/cuda/CUDAAllocatorConfig.h:28.)
    self.edge_index = self._cpu_edge_index.to(self.device)
    C:\Users\fbrev\Documents\Acadêmico\Simulações\Python\NoisyGL\predictor\Base_Predictor.py:144: UserWarning: Sparse CSR tensor support is in beta state. If you miss a functionality in the sparse tensor support, please submit a feature request to https://github.com/pytorch/pytorch/issues. (Triggered internally at ..\aten\src\ATen\SparseCsrTensorImpl.cpp:55.)
    self.adj_csr = self.adj.to_sparse_csr().to(self.device)
[I 2026-05-10 21:33:15,116] Trial 139 finished with value: 0.33728626585769445 and parameters: {'lr': 0.1, 'weight_decay': 0.001, 'n_hidden': 256, 'n_layer': 2, 'dropout': 0.7370924058649732, 'knn_mode': 's', 'k': 12, 'dexp': 8.72076254614756, 'p_grd': 0.38586954590127026, 'unc_rem': 0.7650583263471594, 'unc_rel': 0.3366711917062074}. Best is trial 100 with value: 0.3474903474903475.
    [CPU] Loading roman-empire...
    DEBUG 3.1: Dataset init start
    DEBUG 3.2: prepare_data start roman-empire
    ----Data statistics------'
    Name: roman-empire
    #Nodes 22662
    #Edges 32927
    #Classes 18
    #Ave_degree 2.91
    ----Split statistics------'
    #Train samples 1133 (5.0 % of nodes)
    #Val samples 3399 (15.0 % of nodes)
    #Test samples 18130 (remaining)
    ----label noise information:------
    Instance dependent noise
    #Actual noise rate 0.40
    [cuda:1] LNPCC waiting for GPU slot...
    [cuda:1] Slot acquired (waited 0.0s). Starting GCN...
    FINAL_RESULT: {'acc': {'train': 0.38128861429832306, 'valid': 0.2333039129155634, 'test': 0.3326530612244898}, 'wall_s': 128.59, 'cpu_s': 124.67, 'gpu_s': 3.87, 'wait_s': 0.0}
    [Time] wall=128.6s | cpu=124.7s | gpu=3.9s
    C:\Users\fbrev\Documents\Acadêmico\Simulações\Python\NoisyGL\predictor\Base_Predictor.py:114: UserWarning: expandable_segments not supported on this platform (Triggered internally at ..\c10/cuda/CUDAAllocatorConfig.h:28.)
    self.edge_index = self._cpu_edge_index.to(self.device)
    C:\Users\fbrev\Documents\Acadêmico\Simulações\Python\NoisyGL\predictor\Base_Predictor.py:144: UserWarning: Sparse CSR tensor support is in beta state. If you miss a functionality in the sparse tensor support, please submit a feature request to https://github.com/pytorch/pytorch/issues. (Triggered internally at ..\aten\src\ATen\SparseCsrTensorImpl.cpp:55.)
    self.adj_csr = self.adj.to_sparse_csr().to(self.device)
[I 2026-05-10 21:35:30,116] Trial 141 finished with value: 0.3326530612244898 and parameters: {'lr': 0.1, 'weight_decay': 0.001, 'n_hidden': 256, 'n_layer': 2, 'dropout': 0.7391796469847497, 'knn_mode': 's', 'k': 16, 'dexp': 8.826877331145804, 'p_grd': 0.40625852562960074, 'unc_rem': 0.7662688167564001, 'unc_rel': 0.335911437805}. Best is trial 100 with value: 0.3474903474903475.
    [CPU] Loading roman-empire...
    DEBUG 3.1: Dataset init start
    DEBUG 3.2: prepare_data start roman-empire
    ----Data statistics------'
    Name: roman-empire
    #Nodes 22662
    #Edges 32927
    #Classes 18
    #Ave_degree 2.91
    ----Split statistics------'
    #Train samples 1133 (5.0 % of nodes)
    #Val samples 3399 (15.0 % of nodes)
    #Test samples 18130 (remaining)
    ----label noise information:------
    Instance dependent noise
    #Actual noise rate 0.40
    [cuda:1] LNPCC waiting for GPU slot...
    [cuda:1] Slot acquired (waited 0.0s). Starting GCN...
    FINAL_RESULT: {'acc': {'train': 0.33715798764342453, 'valid': 0.23536334215945867, 'test': 0.3309431880860452}, 'wall_s': 122.43, 'cpu_s': 117.74, 'gpu_s': 4.65, 'wait_s': 0.0}
    [Time] wall=122.4s | cpu=117.7s | gpu=4.6s
    C:\Users\fbrev\Documents\Acadêmico\Simulações\Python\NoisyGL\predictor\Base_Predictor.py:114: UserWarning: expandable_segments not supported on this platform (Triggered internally at ..\c10/cuda/CUDAAllocatorConfig.h:28.)
    self.edge_index = self._cpu_edge_index.to(self.device)
    C:\Users\fbrev\Documents\Acadêmico\Simulações\Python\NoisyGL\predictor\Base_Predictor.py:144: UserWarning: Sparse CSR tensor support is in beta state. If you miss a functionality in the sparse tensor support, please submit a feature request to https://github.com/pytorch/pytorch/issues. (Triggered internally at ..\aten\src\ATen\SparseCsrTensorImpl.cpp:55.)
    self.adj_csr = self.adj.to_sparse_csr().to(self.device)
[I 2026-05-10 21:37:38,914] Trial 143 finished with value: 0.3309431880860452 and parameters: {'lr': 0.1, 'weight_decay': 0.001, 'n_hidden': 256, 'n_layer': 2, 'dropout': 0.7759278907145315, 'knn_mode': 's', 'k': 15, 'dexp': 8.307087401091637, 'p_grd': 0.3813260293084327, 'unc_rem': 0.708577537403124, 'unc_rel': 0.374342482132524}. Best is trial 100 with value: 0.3474903474903475.
    [CPU] Loading roman-empire...
    DEBUG 3.1: Dataset init start
    DEBUG 3.2: prepare_data start roman-empire
    ----Data statistics------'
    Name: roman-empire
    #Nodes 22662
    #Edges 32927
    #Classes 18
    #Ave_degree 2.91
    ----Split statistics------'
    #Train samples 1133 (5.0 % of nodes)
    #Val samples 3399 (15.0 % of nodes)
    #Test samples 18130 (remaining)
    ----label noise information:------
    Instance dependent noise
    #Actual noise rate 0.40
    [cuda:1] LNPCC waiting for GPU slot...
    [cuda:1] Slot acquired (waited 0.0s). Starting GCN...
    FINAL_RESULT: {'acc': {'train': 0.34598411297440423, 'valid': 0.22035892909679317, 'test': 0.31125206839492553}, 'wall_s': 124.67, 'cpu_s': 120.82, 'gpu_s': 3.8, 'wait_s': 0.0}
    [Time] wall=124.7s | cpu=120.8s | gpu=3.8s
    C:\Users\fbrev\Documents\Acadêmico\Simulações\Python\NoisyGL\predictor\Base_Predictor.py:114: UserWarning: expandable_segments not supported on this platform (Triggered internally at ..\c10/cuda/CUDAAllocatorConfig.h:28.)
    self.edge_index = self._cpu_edge_index.to(self.device)
    C:\Users\fbrev\Documents\Acadêmico\Simulações\Python\NoisyGL\predictor\Base_Predictor.py:144: UserWarning: Sparse CSR tensor support is in beta state. If you miss a functionality in the sparse tensor support, please submit a feature request to https://github.com/pytorch/pytorch/issues. (Triggered internally at ..\aten\src\ATen\SparseCsrTensorImpl.cpp:55.)
    self.adj_csr = self.adj.to_sparse_csr().to(self.device)
[I 2026-05-10 21:39:49,711] Trial 144 finished with value: 0.31125206839492553 and parameters: {'lr': 0.001, 'weight_decay': 0.001, 'n_hidden': 256, 'n_layer': 2, 'dropout': 0.7082996031234576, 'knn_mode': 's', 'k': 14, 'dexp': 7.2887498208882775, 'p_grd': 0.3566354499594547, 'unc_rem': 0.5579046934642636, 'unc_rel': 0.3019790384261297}. Best is trial 100 with value: 0.3474903474903475.
    [CPU] Loading roman-empire...
    DEBUG 3.1: Dataset init start
    DEBUG 3.2: prepare_data start roman-empire
    ----Data statistics------'
    Name: roman-empire
    #Nodes 22662
    #Edges 32927
    #Classes 18
    #Ave_degree 2.91
    ----Split statistics------'
    #Train samples 1133 (5.0 % of nodes)
    #Val samples 3399 (15.0 % of nodes)
    #Test samples 18130 (remaining)
    ----label noise information:------
    Instance dependent noise
    #Actual noise rate 0.40
    [cuda:1] LNPCC waiting for GPU slot...
    [cuda:1] Slot acquired (waited 0.0s). Starting GCN...
    FINAL_RESULT: {'acc': {'train': 0.36010591350397175, 'valid': 0.23536334215945867, 'test': 0.3312741312741313}, 'wall_s': 120.12, 'cpu_s': 116.27, 'gpu_s': 3.81, 'wait_s': 0.0}
    [Time] wall=120.1s | cpu=116.3s | gpu=3.8s
    C:\Users\fbrev\Documents\Acadêmico\Simulações\Python\NoisyGL\predictor\Base_Predictor.py:114: UserWarning: expandable_segments not supported on this platform (Triggered internally at ..\c10/cuda/CUDAAllocatorConfig.h:28.)
    self.edge_index = self._cpu_edge_index.to(self.device)
    C:\Users\fbrev\Documents\Acadêmico\Simulações\Python\NoisyGL\predictor\Base_Predictor.py:144: UserWarning: Sparse CSR tensor support is in beta state. If you miss a functionality in the sparse tensor support, please submit a feature request to https://github.com/pytorch/pytorch/issues. (Triggered internally at ..\aten\src\ATen\SparseCsrTensorImpl.cpp:55.)
    self.adj_csr = self.adj.to_sparse_csr().to(self.device)
[I 2026-05-10 21:41:55,767] Trial 145 finished with value: 0.3312741312741313 and parameters: {'lr': 0.1, 'weight_decay': 0.001, 'n_hidden': 256, 'n_layer': 2, 'dropout': 0.7553487356505351, 'knn_mode': 's', 'k': 10, 'dexp': 9.068825855154877, 'p_grd': 0.4512884614823319, 'unc_rem': 0.8710415018150766, 'unc_rel': 0.3962686681904899}. Best is trial 100 with value: 0.3474903474903475.
    [CPU] Loading roman-empire...
    DEBUG 3.1: Dataset init start
    DEBUG 3.2: prepare_data start roman-empire
    ----Data statistics------'
    Name: roman-empire
    #Nodes 22662
    #Edges 32927
    #Classes 18
    #Ave_degree 2.91
    ----Split statistics------'
    #Train samples 1133 (5.0 % of nodes)
    #Val samples 3399 (15.0 % of nodes)
    #Test samples 18130 (remaining)
    ----label noise information:------
    Instance dependent noise
    #Actual noise rate 0.40
    [cuda:1] LNPCC waiting for GPU slot...
    [cuda:1] Slot acquired (waited 0.0s). Starting GCN...
    FINAL_RESULT: {'acc': {'train': 0.4554280670785525, 'valid': 0.22624301265077965, 'test': 0.33287369001654715}, 'wall_s': 120.42, 'cpu_s': 116.48, 'gpu_s': 3.9, 'wait_s': 0.0}
    [Time] wall=120.4s | cpu=116.5s | gpu=3.9s
    C:\Users\fbrev\Documents\Acadêmico\Simulações\Python\NoisyGL\predictor\Base_Predictor.py:114: UserWarning: expandable_segments not supported on this platform (Triggered internally at ..\c10/cuda/CUDAAllocatorConfig.h:28.)
    self.edge_index = self._cpu_edge_index.to(self.device)
    C:\Users\fbrev\Documents\Acadêmico\Simulações\Python\NoisyGL\predictor\Base_Predictor.py:144: UserWarning: Sparse CSR tensor support is in beta state. If you miss a functionality in the sparse tensor support, please submit a feature request to https://github.com/pytorch/pytorch/issues. (Triggered internally at ..\aten\src\ATen\SparseCsrTensorImpl.cpp:55.)
    self.adj_csr = self.adj.to_sparse_csr().to(self.device)
[I 2026-05-10 21:44:02,125] Trial 146 finished with value: 0.33287369001654715 and parameters: {'lr': 0.05, 'weight_decay': 0.001, 'n_hidden': 256, 'n_layer': 2, 'dropout': 0.7167450353087819, 'knn_mode': 's', 'k': 12, 'dexp': 8.517950189413313, 'p_grd': 0.4243003782524209, 'unc_rem': 0.7781866945004211, 'unc_rel': 0.2824768053487653}. Best is trial 100 with value: 0.3474903474903475.
    [CPU] Loading roman-empire...
    DEBUG 3.1: Dataset init start
    DEBUG 3.2: prepare_data start roman-empire
    ----Data statistics------'
    Name: roman-empire
    #Nodes 22662
    #Edges 32927
    #Classes 18
    #Ave_degree 2.91
    ----Split statistics------'
    #Train samples 1133 (5.0 % of nodes)
    #Val samples 3399 (15.0 % of nodes)
    #Test samples 18130 (remaining)
    ----label noise information:------
    Instance dependent noise
    #Actual noise rate 0.40
    [cuda:1] LNPCC waiting for GPU slot...
    [cuda:1] Slot acquired (waited 0.0s). Starting GCN...
    FINAL_RESULT: {'acc': {'train': 0.39276257722859664, 'valid': 0.2306560753162695, 'test': 0.326696083838941}, 'wall_s': 125.1, 'cpu_s': 122.07, 'gpu_s': 2.97, 'wait_s': 0.0}
    [Time] wall=125.1s | cpu=122.1s | gpu=3.0s
    C:\Users\fbrev\Documents\Acadêmico\Simulações\Python\NoisyGL\predictor\Base_Predictor.py:114: UserWarning: expandable_segments not supported on this platform (Triggered internally at ..\c10/cuda/CUDAAllocatorConfig.h:28.)
    self.edge_index = self._cpu_edge_index.to(self.device)
    C:\Users\fbrev\Documents\Acadêmico\Simulações\Python\NoisyGL\predictor\Base_Predictor.py:144: UserWarning: Sparse CSR tensor support is in beta state. If you miss a functionality in the sparse tensor support, please submit a feature request to https://github.com/pytorch/pytorch/issues. (Triggered internally at ..\aten\src\ATen\SparseCsrTensorImpl.cpp:55.)
    self.adj_csr = self.adj.to_sparse_csr().to(self.device)
[I 2026-05-10 21:46:13,021] Trial 147 finished with value: 0.326696083838941 and parameters: {'lr': 0.05, 'weight_decay': 0.001, 'n_hidden': 128, 'n_layer': 2, 'dropout': 0.7651060214587726, 'knn_mode': 's', 'k': 17, 'dexp': 6.992241643802789, 'p_grd': 0.34288332696880414, 'unc_rem': 0.798124637822216, 'unc_rel': 0.3278893799148818}. Best is trial 100 with value: 0.3474903474903475.
    [CPU] Loading roman-empire...
    DEBUG 3.1: Dataset init start
    DEBUG 3.2: prepare_data start roman-empire
    ----Data statistics------'
    Name: roman-empire
    #Nodes 22662
    #Edges 32927
    #Classes 18
    #Ave_degree 2.91
    ----Split statistics------'
    #Train samples 1133 (5.0 % of nodes)
    #Val samples 3399 (15.0 % of nodes)
    #Test samples 18130 (remaining)
    ----label noise information:------
    Instance dependent noise
    #Actual noise rate 0.40
    [cuda:1] LNPCC waiting for GPU slot...
    [cuda:1] Slot acquired (waited 0.8s). Starting GCN...
    FINAL_RESULT: {'acc': {'train': 0.40998217468805703, 'valid': 0.2218299499852898, 'test': 0.3216216216216216}, 'wall_s': 173.63, 'cpu_s': 170.15, 'gpu_s': 3.43, 'wait_s': 0.81}
    [Time] wall=173.6s | cpu=170.2s | gpu=3.4s
    C:\Users\fbrev\Documents\Acadêmico\Simulações\Python\NoisyGL\predictor\Base_Predictor.py:114: UserWarning: expandable_segments not supported on this platform (Triggered internally at ..\c10/cuda/CUDAAllocatorConfig.h:28.)
    self.edge_index = self._cpu_edge_index.to(self.device)
    C:\Users\fbrev\Documents\Acadêmico\Simulações\Python\NoisyGL\predictor\Base_Predictor.py:144: UserWarning: Sparse CSR tensor support is in beta state. If you miss a functionality in the sparse tensor support, please submit a feature request to https://github.com/pytorch/pytorch/issues. (Triggered internally at ..\aten\src\ATen\SparseCsrTensorImpl.cpp:55.)
    self.adj_csr = self.adj.to_sparse_csr().to(self.device)
[I 2026-05-10 21:49:13,631] Trial 148 finished with value: 0.3216216216216216 and parameters: {'lr': 0.05, 'weight_decay': 0.001, 'n_hidden': 256, 'n_layer': 2, 'dropout': 0.06249475693850581, 'knn_mode': 'd', 'k': 10, 'dexp': 8.0838814454329, 'p_grd': 0.3724118123435568, 'unc_rem': 0.5985627809982028, 'unc_rel': 0.38007114758948013}. Best is trial 100 with value: 0.3474903474903475.
    [CPU] Loading roman-empire...
    DEBUG 3.1: Dataset init start
    DEBUG 3.2: prepare_data start roman-empire
    ----Data statistics------'
    Name: roman-empire
    #Nodes 22662
    #Edges 32927
    #Classes 18
    #Ave_degree 2.91
    ----Split statistics------'
    #Train samples 1133 (5.0 % of nodes)
    #Val samples 3399 (15.0 % of nodes)
    #Test samples 18130 (remaining)
    ----label noise information:------
    Instance dependent noise
    #Actual noise rate 0.40
    [cuda:1] LNPCC waiting for GPU slot...
    [cuda:1] Slot acquired (waited 0.0s). Starting GCN...
    FINAL_RESULT: {'acc': {'train': 0.43147656940760387, 'valid': 0.23036187113857018, 'test': 0.32426916712631}, 'wall_s': 91.83, 'cpu_s': 87.98, 'gpu_s': 3.8, 'wait_s': 0.0}
    [Time] wall=91.8s | cpu=88.0s | gpu=3.8s
    C:\Users\fbrev\Documents\Acadêmico\Simulações\Python\NoisyGL\predictor\Base_Predictor.py:114: UserWarning: expandable_segments not supported on this platform (Triggered internally at ..\c10/cuda/CUDAAllocatorConfig.h:28.)
    self.edge_index = self._cpu_edge_index.to(self.device)
    C:\Users\fbrev\Documents\Acadêmico\Simulações\Python\NoisyGL\predictor\Base_Predictor.py:144: UserWarning: Sparse CSR tensor support is in beta state. If you miss a functionality in the sparse tensor support, please submit a feature request to https://github.com/pytorch/pytorch/issues. (Triggered internally at ..\aten\src\ATen\SparseCsrTensorImpl.cpp:55.)
    self.adj_csr = self.adj.to_sparse_csr().to(self.device)
