[I 2026-05-03 22:39:14,970] Trial 32 finished with value: 0.7029822029822029 and parameters: {'lr': 0.005, 'weight_decay': 0.001, 'n_hidden': 64, 'n_layer': 2, 'dropout': 0.6648481782029492, 'knn_mode': 'd', 'k': 27, 'dexp': 6.4881027955463315, 'p_grd': 0.7483213842534743, 'unc_rem': 0.06723882811573509, 'unc_rel': 0.16848574728810417}. Best is trial 23 with value: 0.7061087061087061.
    [CPU] Loading blogcatalog...
    DEBUG 3.1: Dataset init start
    DEBUG 3.2: prepare_data start blogcatalog
    ----Data statistics------'
    Name: blogcatalog
    #Nodes 5196
    #Edges 171743
    #Classes 6
    #Ave_degree 66.11
    ----Split statistics------'
    #Train samples 259 (5.0 % of nodes)
    #Val samples 779 (15.0 % of nodes)
    #Test samples 4158 (remaining)
    ----label noise information:------
    Instance dependent noise
    #Actual noise rate 0.40
    [cuda:1] LNPCC waiting for GPU slot...
    [cuda:1] Slot acquired (waited 5.9s). Starting GCN...
    FINAL_RESULT: {'acc': {'train': 0.29296875, 'valid': 0.2490372272143774, 'test': 0.2943722943722944}, 'wall_s': 29.31, 'cpu_s': 25.99, 'gpu_s': 3.21, 'wait_s': 5.93}
    [Time] wall=29.3s | cpu=26.0s | gpu=3.2s
    C:\Users\fbrev\Documents\Acadêmico\Simulações\Python\NoisyGL\predictor\Base_Predictor.py:114: UserWarning: expandable_segments not supported on this platform (Triggered internally at ..\c10/cuda/CUDAAllocatorConfig.h:28.)
    self.edge_index = self._cpu_edge_index.to(self.device)
    C:\Users\fbrev\Documents\Acadêmico\Simulações\Python\NoisyGL\predictor\Base_Predictor.py:144: UserWarning: Sparse CSR tensor support is in beta state. If you miss a functionality in the sparse tensor support, please submit a feature request to https://github.com/pytorch/pytorch/issues. (Triggered internally at ..\aten\src\ATen\SparseCsrTensorImpl.cpp:55.)
    self.adj_csr = self.adj.to_sparse_csr().to(self.device)
[I 2026-05-03 22:39:55,506] Trial 33 finished with value: 0.2943722943722944 and parameters: {'lr': 0.005, 'weight_decay': 0.05, 'n_hidden': 64, 'n_layer': 2, 'dropout': 0.5888207430113659, 'knn_mode': 'd', 'k': 28, 'dexp': 9.91676819197745, 'p_grd': 0.743710675416685, 'unc_rem': 0.10516176570679203, 'unc_rel': 0.17546266027548874}. Best is trial 23 with value: 0.7061087061087061.
    [CPU] Loading blogcatalog...
    DEBUG 3.1: Dataset init start
    DEBUG 3.2: prepare_data start blogcatalog
    ----Data statistics------'
    Name: blogcatalog
    #Nodes 5196
    #Edges 171743
    #Classes 6
    #Ave_degree 66.11
    ----Split statistics------'
    #Train samples 259 (5.0 % of nodes)
    #Val samples 779 (15.0 % of nodes)
    #Test samples 4158 (remaining)
    ----label noise information:------
    Instance dependent noise
    #Actual noise rate 0.40
    [cuda:1] LNPCC waiting for GPU slot...
    [cuda:1] Slot acquired (waited 15.1s). Starting GCN...
    FINAL_RESULT: {'acc': {'train': 0.556910569105691, 'valid': 0.4621309370988447, 'test': 0.6943241943241943}, 'wall_s': 37.76, 'cpu_s': 34.43, 'gpu_s': 3.23, 'wait_s': 15.07}
    [Time] wall=37.8s | cpu=34.4s | gpu=3.2s
    C:\Users\fbrev\Documents\Acadêmico\Simulações\Python\NoisyGL\predictor\Base_Predictor.py:114: UserWarning: expandable_segments not supported on this platform (Triggered internally at ..\c10/cuda/CUDAAllocatorConfig.h:28.)
    self.edge_index = self._cpu_edge_index.to(self.device)
    C:\Users\fbrev\Documents\Acadêmico\Simulações\Python\NoisyGL\predictor\Base_Predictor.py:144: UserWarning: Sparse CSR tensor support is in beta state. If you miss a functionality in the sparse tensor support, please submit a feature request to https://github.com/pytorch/pytorch/issues. (Triggered internally at ..\aten\src\ATen\SparseCsrTensorImpl.cpp:55.)
    self.adj_csr = self.adj.to_sparse_csr().to(self.device)
[I 2026-05-03 22:40:54,059] Trial 34 finished with value: 0.6943241943241943 and parameters: {'lr': 0.005, 'weight_decay': 0.001, 'n_hidden': 64, 'n_layer': 2, 'dropout': 0.7096288753303455, 'knn_mode': 'd', 'k': 28, 'dexp': 6.6300860201807215, 'p_grd': 0.9272749687278607, 'unc_rem': 0.07586907675488912, 'unc_rel': 0.06218939269810303}. Best is trial 23 with value: 0.7061087061087061.
    [CPU] Loading blogcatalog...
    DEBUG 3.1: Dataset init start
    DEBUG 3.2: prepare_data start blogcatalog
    ----Data statistics------'
    Name: blogcatalog
    #Nodes 5196
    #Edges 171743
    #Classes 6
    #Ave_degree 66.11
    ----Split statistics------'
    #Train samples 259 (5.0 % of nodes)
    #Val samples 779 (15.0 % of nodes)
    #Test samples 4158 (remaining)
    ----label noise information:------
    Instance dependent noise
    #Actual noise rate 0.40
    [cuda:1] LNPCC waiting for GPU slot...
    [cuda:1] Slot acquired (waited 0.8s). Starting GCN...
    FINAL_RESULT: {'acc': {'train': 0.5338645418326693, 'valid': 0.4685494223363286, 'test': 0.6998556998556998}, 'wall_s': 36.65, 'cpu_s': 33.36, 'gpu_s': 3.2, 'wait_s': 0.76}
    [Time] wall=36.6s | cpu=33.4s | gpu=3.2s
    C:\Users\fbrev\Documents\Acadêmico\Simulações\Python\NoisyGL\predictor\Base_Predictor.py:114: UserWarning: expandable_segments not supported on this platform (Triggered internally at ..\c10/cuda/CUDAAllocatorConfig.h:28.)
    self.edge_index = self._cpu_edge_index.to(self.device)
    C:\Users\fbrev\Documents\Acadêmico\Simulações\Python\NoisyGL\predictor\Base_Predictor.py:144: UserWarning: Sparse CSR tensor support is in beta state. If you miss a functionality in the sparse tensor support, please submit a feature request to https://github.com/pytorch/pytorch/issues. (Triggered internally at ..\aten\src\ATen\SparseCsrTensorImpl.cpp:55.)
    self.adj_csr = self.adj.to_sparse_csr().to(self.device)
[I 2026-05-03 22:41:37,131] Trial 35 finished with value: 0.6998556998556998 and parameters: {'lr': 0.005, 'weight_decay': 0.001, 'n_hidden': 64, 'n_layer': 2, 'dropout': 0.4736199488432396, 'knn_mode': 'd', 'k': 41, 'dexp': 6.164263041366129, 'p_grd': 0.8271812473157305, 'unc_rem': 0.07298875035132976, 'unc_rel': 0.37531642657833764}. Best is trial 23 with value: 0.7061087061087061.
    [CPU] Loading blogcatalog...
    DEBUG 3.1: Dataset init start
    DEBUG 3.2: prepare_data start blogcatalog
    ----Data statistics------'
    Name: blogcatalog
    #Nodes 5196
    #Edges 171743
    #Classes 6
    #Ave_degree 66.11
    ----Split statistics------'
    #Train samples 259 (5.0 % of nodes)
    #Val samples 779 (15.0 % of nodes)
    #Test samples 4158 (remaining)
    ----label noise information:------
    Instance dependent noise
    #Actual noise rate 0.40
    [cuda:1] LNPCC waiting for GPU slot...
    [cuda:1] Slot acquired (waited 51.4s). Starting GCN...
    FINAL_RESULT: {'acc': {'train': 0.4092664092664093, 'valid': 0.417201540436457, 'test': 0.6281866281866282}, 'wall_s': 32.95, 'cpu_s': 25.78, 'gpu_s': 7.08, 'wait_s': 51.4}
    [Time] wall=32.9s | cpu=25.8s | gpu=7.1s
    C:\Users\fbrev\Documents\Acadêmico\Simulações\Python\NoisyGL\predictor\Base_Predictor.py:114: UserWarning: expandable_segments not supported on this platform (Triggered internally at ..\c10/cuda/CUDAAllocatorConfig.h:28.)
    self.edge_index = self._cpu_edge_index.to(self.device)
    C:\Users\fbrev\Documents\Acadêmico\Simulações\Python\NoisyGL\predictor\Base_Predictor.py:144: UserWarning: Sparse CSR tensor support is in beta state. If you miss a functionality in the sparse tensor support, please submit a feature request to https://github.com/pytorch/pytorch/issues. (Triggered internally at ..\aten\src\ATen\SparseCsrTensorImpl.cpp:55.)
    self.adj_csr = self.adj.to_sparse_csr().to(self.device)
[I 2026-05-03 22:43:06,749] Trial 36 finished with value: 0.6281866281866282 and parameters: {'lr': 0.01, 'weight_decay': 0.01, 'n_hidden': 256, 'n_layer': 2, 'dropout': 0.3667488792116718, 'knn_mode': 'd', 'k': 35, 'dexp': 8.86586743104205, 'p_grd': 0.5684180973911585, 'unc_rem': 0.2525715360207065, 'unc_rel': 0.14843384186790679}. Best is trial 23 with value: 0.7061087061087061.
    [CPU] Loading blogcatalog...
    DEBUG 3.1: Dataset init start
    DEBUG 3.2: prepare_data start blogcatalog
    ----Data statistics------'
    Name: blogcatalog
    #Nodes 5196
    #Edges 171743
    #Classes 6
    #Ave_degree 66.11
    ----Split statistics------'
    #Train samples 259 (5.0 % of nodes)
    #Val samples 779 (15.0 % of nodes)
    #Test samples 4158 (remaining)
    ----label noise information:------
    Instance dependent noise
    #Actual noise rate 0.40
    [cuda:1] LNPCC waiting for GPU slot...
    [cuda:1] Slot acquired (waited 29.1s). Starting GCN...
    FINAL_RESULT: {'acc': {'train': 0.5598455598455598, 'valid': 0.4492939666238768, 'test': 0.6688311688311688}, 'wall_s': 37.31, 'cpu_s': 32.95, 'gpu_s': 4.29, 'wait_s': 29.15}
    [Time] wall=37.3s | cpu=32.9s | gpu=4.3s
    C:\Users\fbrev\Documents\Acadêmico\Simulações\Python\NoisyGL\predictor\Base_Predictor.py:114: UserWarning: expandable_segments not supported on this platform (Triggered internally at ..\c10/cuda/CUDAAllocatorConfig.h:28.)
    self.edge_index = self._cpu_edge_index.to(self.device)
    C:\Users\fbrev\Documents\Acadêmico\Simulações\Python\NoisyGL\predictor\Base_Predictor.py:144: UserWarning: Sparse CSR tensor support is in beta state. If you miss a functionality in the sparse tensor support, please submit a feature request to https://github.com/pytorch/pytorch/issues. (Triggered internally at ..\aten\src\ATen\SparseCsrTensorImpl.cpp:55.)
    self.adj_csr = self.adj.to_sparse_csr().to(self.device)
[I 2026-05-03 22:44:18,142] Trial 37 finished with value: 0.6688311688311688 and parameters: {'lr': 0.005, 'weight_decay': 0.0, 'n_hidden': 128, 'n_layer': 2, 'dropout': 0.2666363185178666, 'knn_mode': 'd', 'k': 48, 'dexp': 4.941308522150999, 'p_grd': 0.6682372036037298, 'unc_rem': 0.3363645030512473, 'unc_rel': 0.05815470186069638}. Best is trial 23 with value: 0.7061087061087061.
    [CPU] Loading blogcatalog...
    DEBUG 3.1: Dataset init start
    DEBUG 3.2: prepare_data start blogcatalog
    ----Data statistics------'
    Name: blogcatalog
    #Nodes 5196
    #Edges 171743
    #Classes 6
    #Ave_degree 66.11
    ----Split statistics------'
    #Train samples 259 (5.0 % of nodes)
    #Val samples 779 (15.0 % of nodes)
    #Test samples 4158 (remaining)
    ----label noise information:------
    Instance dependent noise
    #Actual noise rate 0.40
    [cuda:1] LNPCC waiting for GPU slot...
    [cuda:1] Slot acquired (waited 273.6s). Starting GCN...
    FINAL_RESULT: {'acc': {'train': 0.4555984555984556, 'valid': 0.4557124518613607, 'test': 0.6808561808561808}, 'wall_s': 27.03, 'cpu_s': 23.8, 'gpu_s': 3.15, 'wait_s': 273.58}
    [Time] wall=27.0s | cpu=23.8s | gpu=3.1s
    C:\Users\fbrev\Documents\Acadêmico\Simulações\Python\NoisyGL\predictor\Base_Predictor.py:114: UserWarning: expandable_segments not supported on this platform (Triggered internally at ..\c10/cuda/CUDAAllocatorConfig.h:28.)
    self.edge_index = self._cpu_edge_index.to(self.device)
    C:\Users\fbrev\Documents\Acadêmico\Simulações\Python\NoisyGL\predictor\Base_Predictor.py:144: UserWarning: Sparse CSR tensor support is in beta state. If you miss a functionality in the sparse tensor support, please submit a feature request to https://github.com/pytorch/pytorch/issues. (Triggered internally at ..\aten\src\ATen\SparseCsrTensorImpl.cpp:55.)
    self.adj_csr = self.adj.to_sparse_csr().to(self.device)
[I 2026-05-03 22:49:24,065] Trial 38 finished with value: 0.6808561808561808 and parameters: {'lr': 0.01, 'weight_decay': 0.001, 'n_hidden': 64, 'n_layer': 2, 'dropout': 0.5441460500022907, 'knn_mode': 'd', 'k': 30, 'dexp': 7.810383085844246, 'p_grd': 0.7265371500342648, 'unc_rem': 0.6391196244179044, 'unc_rel': 0.200416648013872}. Best is trial 23 with value: 0.7061087061087061.
    [CPU] Loading blogcatalog...
    DEBUG 3.1: Dataset init start
    DEBUG 3.2: prepare_data start blogcatalog
    ----Data statistics------'
    Name: blogcatalog
    #Nodes 5196
    #Edges 171743
    #Classes 6
    #Ave_degree 66.11
    ----Split statistics------'
    #Train samples 259 (5.0 % of nodes)
    #Val samples 779 (15.0 % of nodes)
    #Test samples 4158 (remaining)
    ----label noise information:------
    Instance dependent noise
    #Actual noise rate 0.40
    [cuda:1] LNPCC waiting for GPU slot...
    [cuda:1] Slot acquired (waited 271.0s). Starting GCN...
    FINAL_RESULT: {'acc': {'train': 0.5198237885462555, 'valid': 0.45186136071887034, 'test': 0.6712361712361712}, 'wall_s': 112.6, 'cpu_s': 103.98, 'gpu_s': 8.54, 'wait_s': 270.95}
    [Time] wall=112.6s | cpu=104.0s | gpu=8.5s
    C:\Users\fbrev\Documents\Acadêmico\Simulações\Python\NoisyGL\predictor\Base_Predictor.py:114: UserWarning: expandable_segments not supported on this platform (Triggered internally at ..\c10/cuda/CUDAAllocatorConfig.h:28.)
    self.edge_index = self._cpu_edge_index.to(self.device)
    C:\Users\fbrev\Documents\Acadêmico\Simulações\Python\NoisyGL\predictor\Base_Predictor.py:144: UserWarning: Sparse CSR tensor support is in beta state. If you miss a functionality in the sparse tensor support, please submit a feature request to https://github.com/pytorch/pytorch/issues. (Triggered internally at ..\aten\src\ATen\SparseCsrTensorImpl.cpp:55.)
    self.adj_csr = self.adj.to_sparse_csr().to(self.device)
[I 2026-05-03 22:55:52,450] Trial 39 finished with value: 0.6712361712361712 and parameters: {'lr': 0.005, 'weight_decay': 0.001, 'n_hidden': 256, 'n_layer': 2, 'dropout': 0.794877046232192, 'knn_mode': 'd', 'k': 46, 'dexp': 6.934109276084531, 'p_grd': 0.9912822337496685, 'unc_rem': 0.16849676079502632, 'unc_rel': 0.10388600482151446}. Best is trial 23 with value: 0.7061087061087061.
    [CPU] Loading blogcatalog...
    DEBUG 3.1: Dataset init start
    DEBUG 3.2: prepare_data start blogcatalog
    ----Data statistics------'
    Name: blogcatalog
    #Nodes 5196
    #Edges 171743
    #Classes 6
    #Ave_degree 66.11
    ----Split statistics------'
    #Train samples 259 (5.0 % of nodes)
    #Val samples 779 (15.0 % of nodes)
    #Test samples 4158 (remaining)
    ----label noise information:------
    Instance dependent noise
    #Actual noise rate 0.40
    [cuda:1] LNPCC waiting for GPU slot...
    [cuda:1] Slot acquired (waited 31.4s). Starting GCN...
    FINAL_RESULT: {'acc': {'train': 0.19678714859437751, 'valid': 0.22721437740693196, 'test': 0.2623857623857624}, 'wall_s': 43.24, 'cpu_s': 39.77, 'gpu_s': 3.34, 'wait_s': 31.43}
    [Time] wall=43.2s | cpu=39.8s | gpu=3.3s
    C:\Users\fbrev\Documents\Acadêmico\Simulações\Python\NoisyGL\predictor\Base_Predictor.py:114: UserWarning: expandable_segments not supported on this platform (Triggered internally at ..\c10/cuda/CUDAAllocatorConfig.h:28.)
    self.edge_index = self._cpu_edge_index.to(self.device)
    C:\Users\fbrev\Documents\Acadêmico\Simulações\Python\NoisyGL\predictor\Base_Predictor.py:144: UserWarning: Sparse CSR tensor support is in beta state. If you miss a functionality in the sparse tensor support, please submit a feature request to https://github.com/pytorch/pytorch/issues. (Triggered internally at ..\aten\src\ATen\SparseCsrTensorImpl.cpp:55.)
    self.adj_csr = self.adj.to_sparse_csr().to(self.device)
[I 2026-05-03 22:57:34,537] Trial 40 finished with value: 0.2623857623857624 and parameters: {'lr': 0.05, 'weight_decay': 0.05, 'n_hidden': 64, 'n_layer': 2, 'dropout': 0.731055107918423, 'knn_mode': 'd', 'k': 40, 'dexp': 8.660451488197506, 'p_grd': 0.8500073136926518, 'unc_rem': 0.06191895863042165, 'unc_rel': 0.28713811148893414}. Best is trial 23 with value: 0.7061087061087061.
    [CPU] Loading blogcatalog...
    DEBUG 3.1: Dataset init start
    DEBUG 3.2: prepare_data start blogcatalog
    ----Data statistics------'
    Name: blogcatalog
    #Nodes 5196
    #Edges 171743
    #Classes 6
    #Ave_degree 66.11
    ----Split statistics------'
    #Train samples 259 (5.0 % of nodes)
    #Val samples 779 (15.0 % of nodes)
    #Test samples 4158 (remaining)
    ----label noise information:------
    Instance dependent noise
    #Actual noise rate 0.40
    [cuda:1] LNPCC waiting for GPU slot...
    [cuda:1] Slot acquired (waited 62.0s). Starting GCN...
    FINAL_RESULT: {'acc': {'train': 0.52, 'valid': 0.4621309370988447, 'test': 0.6902356902356902}, 'wall_s': 37.24, 'cpu_s': 33.76, 'gpu_s': 3.4, 'wait_s': 61.96}
    [Time] wall=37.2s | cpu=33.8s | gpu=3.4s
    C:\Users\fbrev\Documents\Acadêmico\Simulações\Python\NoisyGL\predictor\Base_Predictor.py:114: UserWarning: expandable_segments not supported on this platform (Triggered internally at ..\c10/cuda/CUDAAllocatorConfig.h:28.)
    self.edge_index = self._cpu_edge_index.to(self.device)
    C:\Users\fbrev\Documents\Acadêmico\Simulações\Python\NoisyGL\predictor\Base_Predictor.py:144: UserWarning: Sparse CSR tensor support is in beta state. If you miss a functionality in the sparse tensor support, please submit a feature request to https://github.com/pytorch/pytorch/issues. (Triggered internally at ..\aten\src\ATen\SparseCsrTensorImpl.cpp:55.)
    self.adj_csr = self.adj.to_sparse_csr().to(self.device)
[I 2026-05-03 22:59:19,065] Trial 41 finished with value: 0.6902356902356902 and parameters: {'lr': 0.005, 'weight_decay': 0.001, 'n_hidden': 64, 'n_layer': 2, 'dropout': 0.4605248500120653, 'knn_mode': 'd', 'k': 42, 'dexp': 6.045318707709813, 'p_grd': 0.8211509824463558, 'unc_rem': 0.07816901120858662, 'unc_rel': 0.5136041733108984}. Best is trial 23 with value: 0.7061087061087061.
    [CPU] Loading blogcatalog...
    DEBUG 3.1: Dataset init start
    DEBUG 3.2: prepare_data start blogcatalog
    ----Data statistics------'
    Name: blogcatalog
    #Nodes 5196
    #Edges 171743
    #Classes 6
    #Ave_degree 66.11
    ----Split statistics------'
    #Train samples 259 (5.0 % of nodes)
    #Val samples 779 (15.0 % of nodes)
    #Test samples 4158 (remaining)
    ----label noise information:------
    Instance dependent noise
    #Actual noise rate 0.40
    [cuda:1] LNPCC waiting for GPU slot...
    [cuda:1] Slot acquired (waited 118.2s). Starting GCN...
    FINAL_RESULT: {'acc': {'train': 0.5057915057915058, 'valid': 0.4582798459563543, 'test': 0.6750841750841751}, 'wall_s': 40.99, 'cpu_s': 37.69, 'gpu_s': 3.21, 'wait_s': 118.2}
    [Time] wall=41.0s | cpu=37.7s | gpu=3.2s
    C:\Users\fbrev\Documents\Acadêmico\Simulações\Python\NoisyGL\predictor\Base_Predictor.py:114: UserWarning: expandable_segments not supported on this platform (Triggered internally at ..\c10/cuda/CUDAAllocatorConfig.h:28.)
    self.edge_index = self._cpu_edge_index.to(self.device)
    C:\Users\fbrev\Documents\Acadêmico\Simulações\Python\NoisyGL\predictor\Base_Predictor.py:144: UserWarning: Sparse CSR tensor support is in beta state. If you miss a functionality in the sparse tensor support, please submit a feature request to https://github.com/pytorch/pytorch/issues. (Triggered internally at ..\aten\src\ATen\SparseCsrTensorImpl.cpp:55.)
    self.adj_csr = self.adj.to_sparse_csr().to(self.device)
[I 2026-05-03 23:02:04,133] Trial 42 finished with value: 0.6750841750841751 and parameters: {'lr': 0.005, 'weight_decay': 0.001, 'n_hidden': 64, 'n_layer': 2, 'dropout': 0.6759936916598436, 'knn_mode': 'd', 'k': 36, 'dexp': 5.439684710941306, 'p_grd': 0.7528799506906265, 'unc_rem': 0.15393115400384122, 'unc_rel': 0.37040982617222307}. Best is trial 23 with value: 0.7061087061087061.
    [CPU] Loading blogcatalog...
    DEBUG 3.1: Dataset init start
    DEBUG 3.2: prepare_data start blogcatalog
    ----Data statistics------'
    Name: blogcatalog
    #Nodes 5196
    #Edges 171743
    #Classes 6
    #Ave_degree 66.11
    ----Split statistics------'
    #Train samples 259 (5.0 % of nodes)
    #Val samples 779 (15.0 % of nodes)
    #Test samples 4158 (remaining)
    ----label noise information:------
    Instance dependent noise
    #Actual noise rate 0.40
    [cuda:1] LNPCC waiting for GPU slot...
    [cuda:1] Slot acquired (waited 20.2s). Starting GCN...
    FINAL_RESULT: {'acc': {'train': 1.0, 'valid': 0.27086007702182285, 'test': 0.32395382395382394}, 'wall_s': 63.51, 'cpu_s': 60.07, 'gpu_s': 3.33, 'wait_s': 20.18}
    [Time] wall=63.5s | cpu=60.1s | gpu=3.3s
    C:\Users\fbrev\Documents\Acadêmico\Simulações\Python\NoisyGL\predictor\Base_Predictor.py:114: UserWarning: expandable_segments not supported on this platform (Triggered internally at ..\c10/cuda/CUDAAllocatorConfig.h:28.)
    self.edge_index = self._cpu_edge_index.to(self.device)
    C:\Users\fbrev\Documents\Acadêmico\Simulações\Python\NoisyGL\predictor\Base_Predictor.py:144: UserWarning: Sparse CSR tensor support is in beta state. If you miss a functionality in the sparse tensor support, please submit a feature request to https://github.com/pytorch/pytorch/issues. (Triggered internally at ..\aten\src\ATen\SparseCsrTensorImpl.cpp:55.)
    self.adj_csr = self.adj.to_sparse_csr().to(self.device)
