[I 2026-05-01 22:41:17,946] Trial 46 finished with value: 0.329 and parameters: {'lr': 0.1, 'weight_decay': 0.05, 'n_hidden': 64, 'n_layer': 2, 'dropout': 0.7431929616078136, 'knn_mode': 'd', 'k': 42, 'dexp': 5.2099838396574985, 'p_grd': 0.6102562501818447, 'unc_rem': 0.5268468031243984, 'unc_rel': 0.19717000865044085}. Best is trial 27 with value: 0.901.
    [CPU] Loading amazonpho...
    DEBUG 3.1: Dataset init start
    DEBUG 3.2: prepare_data start amazonpho
    ----Data statistics------'
    Name: amazonpho
    #Nodes 7650
    #Edges 119081
    #Classes 8
    #Ave_degree 31.13
    ----Split statistics------'
    #Train samples 160 (20 nodes per class)
    #Val samples 500 (specified)
    #Test samples 1000 (specified)
    ----label noise information:------
    Instance dependent noise
    #Actual noise rate 0.30
    [cuda:1] LNPCC waiting for GPU slot...
    [cuda:1] Slot acquired (waited 115.4s). Starting GCN...
    FINAL_RESULT: {'acc': {'train': 0.70625, 'valid': 0.634, 'test': 0.896}, 'wall_s': 24.95, 'cpu_s': 22.12, 'gpu_s': 2.76, 'wait_s': 115.43}
    [Time] wall=25.0s | cpu=22.1s | gpu=2.8s
    C:\Users\fbrev\Documents\Acadêmico\Simulações\Python\NoisyGL\predictor\Base_Predictor.py:114: UserWarning: expandable_segments not supported on this platform (Triggered internally at ..\c10/cuda/CUDAAllocatorConfig.h:28.)
    self.edge_index = self._cpu_edge_index.to(self.device)
    C:\Users\fbrev\Documents\Acadêmico\Simulações\Python\NoisyGL\predictor\Base_Predictor.py:144: UserWarning: Sparse CSR tensor support is in beta state. If you miss a functionality in the sparse tensor support, please submit a feature request to https://github.com/pytorch/pytorch/issues. (Triggered internally at ..\aten\src\ATen\SparseCsrTensorImpl.cpp:55.)
    self.adj_csr = self.adj.to_sparse_csr().to(self.device)
[I 2026-05-01 22:43:45,562] Trial 47 finished with value: 0.896 and parameters: {'lr': 0.001, 'weight_decay': 0.0, 'n_hidden': 64, 'n_layer': 2, 'dropout': 0.4714739076865779, 'knn_mode': 'd', 'k': 44, 'dexp': 7.727134461269394, 'p_grd': 0.714137482392465, 'unc_rem': 0.32728035911036657, 'unc_rel': 0.2686890301942033}. Best is trial 27 with value: 0.901.
    [CPU] Loading amazonpho...
    DEBUG 3.1: Dataset init start
    DEBUG 3.2: prepare_data start amazonpho
    ----Data statistics------'
    Name: amazonpho
    #Nodes 7650
    #Edges 119081
    #Classes 8
    #Ave_degree 31.13
    ----Split statistics------'
    #Train samples 160 (20 nodes per class)
    #Val samples 500 (specified)
    #Test samples 1000 (specified)
    ----label noise information:------
    Instance dependent noise
    #Actual noise rate 0.30
    [cuda:1] LNPCC waiting for GPU slot...
    [cuda:1] Slot acquired (waited 120.8s). Starting GCN...
    FINAL_RESULT: {'acc': {'train': 0.71875, 'valid': 0.632, 'test': 0.899}, 'wall_s': 22.64, 'cpu_s': 20.17, 'gpu_s': 2.4, 'wait_s': 120.83}
    [Time] wall=22.6s | cpu=20.2s | gpu=2.4s
    C:\Users\fbrev\Documents\Acadêmico\Simulações\Python\NoisyGL\predictor\Base_Predictor.py:114: UserWarning: expandable_segments not supported on this platform (Triggered internally at ..\c10/cuda/CUDAAllocatorConfig.h:28.)
    self.edge_index = self._cpu_edge_index.to(self.device)
    C:\Users\fbrev\Documents\Acadêmico\Simulações\Python\NoisyGL\predictor\Base_Predictor.py:144: UserWarning: Sparse CSR tensor support is in beta state. If you miss a functionality in the sparse tensor support, please submit a feature request to https://github.com/pytorch/pytorch/issues. (Triggered internally at ..\aten\src\ATen\SparseCsrTensorImpl.cpp:55.)
    self.adj_csr = self.adj.to_sparse_csr().to(self.device)
[I 2026-05-01 22:46:15,201] Trial 48 finished with value: 0.899 and parameters: {'lr': 0.001, 'weight_decay': 0.01, 'n_hidden': 64, 'n_layer': 2, 'dropout': 0.4216341539151989, 'knn_mode': 'd', 'k': 18, 'dexp': 5.705738771253618, 'p_grd': 0.8162261703216096, 'unc_rem': 0.46384564957293895, 'unc_rel': 0.08210964696511348}. Best is trial 27 with value: 0.901.
    [CPU] Loading amazonpho...
    DEBUG 3.1: Dataset init start
    DEBUG 3.2: prepare_data start amazonpho
    ----Data statistics------'
    Name: amazonpho
    #Nodes 7650
    #Edges 119081
    #Classes 8
    #Ave_degree 31.13
    ----Split statistics------'
    #Train samples 160 (20 nodes per class)
    #Val samples 500 (specified)
    #Test samples 1000 (specified)
    ----label noise information:------
    Instance dependent noise
    #Actual noise rate 0.30
    [cuda:1] LNPCC waiting for GPU slot...
    [cuda:1] Slot acquired (waited 124.2s). Starting GCN...
    FINAL_RESULT: {'acc': {'train': 0.725, 'valid': 0.616, 'test': 0.876}, 'wall_s': 26.03, 'cpu_s': 21.11, 'gpu_s': 4.85, 'wait_s': 124.16}
    [Time] wall=26.0s | cpu=21.1s | gpu=4.8s
    C:\Users\fbrev\Documents\Acadêmico\Simulações\Python\NoisyGL\predictor\Base_Predictor.py:114: UserWarning: expandable_segments not supported on this platform (Triggered internally at ..\c10/cuda/CUDAAllocatorConfig.h:28.)
    self.edge_index = self._cpu_edge_index.to(self.device)
    C:\Users\fbrev\Documents\Acadêmico\Simulações\Python\NoisyGL\predictor\Base_Predictor.py:144: UserWarning: Sparse CSR tensor support is in beta state. If you miss a functionality in the sparse tensor support, please submit a feature request to https://github.com/pytorch/pytorch/issues. (Triggered internally at ..\aten\src\ATen\SparseCsrTensorImpl.cpp:55.)
    self.adj_csr = self.adj.to_sparse_csr().to(self.device)
