[worker] START lnpcc_cora_0.1 gpu=0
[HPO] Starting Phase 1 (Optuna) for lnpcc_cora_instance_0.1...
[I 2026-05-08 02:25:21,309] A new study created in RDB with name: lnpcc_cora_instance_0.1
    [CPU] Loading cora...
    DEBUG 3.1: Dataset init start
    DEBUG 3.2: prepare_data start cora
    ----Data statistics------'
    Name: cora
    #Nodes 2708
    #Edges 5278
    #Classes 7
    #Ave_degree 3.90
    ----Split statistics------'
    #Train samples 140 (default)
    #Val samples 500 (default)
    #Test samples 1000 (default)
    ----label noise information:------
    Instance dependent noise
    #Actual noise rate 0.13
    [cuda:0] LNPCC waiting for GPU slot...
    [cuda:0] Slot acquired (waited 28.5s). Starting GCN...
    FINAL_RESULT: {'acc': {'train': 0.8214285714285714, 'valid': 0.71, 'test': 0.801}, 'wall_s': 8.46, 'cpu_s': 6.62, 'gpu_s': 1.8, 'wait_s': 28.49}
    [Time] wall=8.5s | cpu=6.6s | gpu=1.8s
    C:\Users\fbrev\Documents\Acadêmico\Simulações\Python\NoisyGL\predictor\Base_Predictor.py:114: UserWarning: expandable_segments not supported on this platform (Triggered internally at ..\c10/cuda/CUDAAllocatorConfig.h:28.)
    self.edge_index = self._cpu_edge_index.to(self.device)
    C:\Users\fbrev\Documents\Acadêmico\Simulações\Python\NoisyGL\predictor\Base_Predictor.py:144: UserWarning: Sparse CSR tensor support is in beta state. If you miss a functionality in the sparse tensor support, please submit a feature request to https://github.com/pytorch/pytorch/issues. (Triggered internally at ..\aten\src\ATen\SparseCsrTensorImpl.cpp:55.)
    self.adj_csr = self.adj.to_sparse_csr().to(self.device)
[I 2026-05-08 02:26:03,272] Trial 0 finished with value: 0.801 and parameters: {'lr': 0.01, 'weight_decay': 0.0001, 'n_hidden': 256, 'n_layer': 3, 'dropout': 0.7423310186926412, 'knn_mode': 's', 'k': 22, 'dexp': 6.549043457768621, 'p_grd': 0.660643336056814, 'unc_rem': 0.4738128842759197, 'unc_rel': 0.5330175031465186}. Best is trial 0 with value: 0.801.
    [CPU] Loading cora...
    DEBUG 3.1: Dataset init start
    DEBUG 3.2: prepare_data start cora
    ----Data statistics------'
    Name: cora
    #Nodes 2708
    #Edges 5278
    #Classes 7
    #Ave_degree 3.90
    ----Split statistics------'
    #Train samples 140 (default)
    #Val samples 500 (default)
    #Test samples 1000 (default)
    ----label noise information:------
    Instance dependent noise
    #Actual noise rate 0.13
    [cuda:0] LNPCC waiting for GPU slot...
    [cuda:0] Slot acquired (waited 17.4s). Starting GCN...
    FINAL_RESULT: {'acc': {'train': 0.8785714285714286, 'valid': 0.618, 'test': 0.675}, 'wall_s': 9.79, 'cpu_s': 7.76, 'gpu_s': 2.01, 'wait_s': 17.36}
    [Time] wall=9.8s | cpu=7.8s | gpu=2.0s
    C:\Users\fbrev\Documents\Acadêmico\Simulações\Python\NoisyGL\predictor\Base_Predictor.py:114: UserWarning: expandable_segments not supported on this platform (Triggered internally at ..\c10/cuda/CUDAAllocatorConfig.h:28.)
    self.edge_index = self._cpu_edge_index.to(self.device)
    C:\Users\fbrev\Documents\Acadêmico\Simulações\Python\NoisyGL\predictor\Base_Predictor.py:144: UserWarning: Sparse CSR tensor support is in beta state. If you miss a functionality in the sparse tensor support, please submit a feature request to https://github.com/pytorch/pytorch/issues. (Triggered internally at ..\aten\src\ATen\SparseCsrTensorImpl.cpp:55.)
    self.adj_csr = self.adj.to_sparse_csr().to(self.device)
[I 2026-05-08 02:26:35,558] Trial 1 finished with value: 0.675 and parameters: {'lr': 0.005, 'weight_decay': 0.05, 'n_hidden': 32, 'n_layer': 3, 'dropout': 0.07015571555985166, 'knn_mode': 'd', 'k': 8, 'dexp': 9.849369470845739, 'p_grd': 0.478806786720841, 'unc_rem': 0.3038151952343754, 'unc_rel': 0.3631246362119436}. Best is trial 0 with value: 0.801.
    [CPU] Loading cora...
    DEBUG 3.1: Dataset init start
    DEBUG 3.2: prepare_data start cora
    ----Data statistics------'
    Name: cora
    #Nodes 2708
    #Edges 5278
    #Classes 7
    #Ave_degree 3.90
    ----Split statistics------'
    #Train samples 140 (default)
    #Val samples 500 (default)
    #Test samples 1000 (default)
    ----label noise information:------
    Instance dependent noise
    #Actual noise rate 0.13
    [cuda:0] LNPCC waiting for GPU slot...
    [cuda:0] Slot acquired (waited 71.0s). Starting GCN...
    FINAL_RESULT: {'acc': {'train': 0.8394160583941606, 'valid': 0.634, 'test': 0.735}, 'wall_s': 42.44, 'cpu_s': 40.47, 'gpu_s': 1.96, 'wait_s': 70.98}
    [Time] wall=42.4s | cpu=40.5s | gpu=2.0s
    C:\Users\fbrev\Documents\Acadêmico\Simulações\Python\NoisyGL\predictor\Base_Predictor.py:114: UserWarning: expandable_segments not supported on this platform (Triggered internally at ..\c10/cuda/CUDAAllocatorConfig.h:28.)
    self.edge_index = self._cpu_edge_index.to(self.device)
    C:\Users\fbrev\Documents\Acadêmico\Simulações\Python\NoisyGL\predictor\Base_Predictor.py:144: UserWarning: Sparse CSR tensor support is in beta state. If you miss a functionality in the sparse tensor support, please submit a feature request to https://github.com/pytorch/pytorch/issues. (Triggered internally at ..\aten\src\ATen\SparseCsrTensorImpl.cpp:55.)
    self.adj_csr = self.adj.to_sparse_csr().to(self.device)
[I 2026-05-08 02:28:34,382] Trial 2 finished with value: 0.735 and parameters: {'lr': 0.05, 'weight_decay': 0.0, 'n_hidden': 128, 'n_layer': 3, 'dropout': 0.21625436690386757, 'knn_mode': 'd', 'k': 38, 'dexp': 3.874471529407347, 'p_grd': 0.9881400181698377, 'unc_rem': 0.9181621485275245, 'unc_rel': 0.9675166579372851}. Best is trial 0 with value: 0.801.
    [CPU] Loading cora...
    DEBUG 3.1: Dataset init start
    DEBUG 3.2: prepare_data start cora
    ----Data statistics------'
    Name: cora
    #Nodes 2708
    #Edges 5278
    #Classes 7
    #Ave_degree 3.90
    ----Split statistics------'
    #Train samples 140 (default)
    #Val samples 500 (default)
    #Test samples 1000 (default)
    ----label noise information:------
    Instance dependent noise
    #Actual noise rate 0.13
    [cuda:0] LNPCC waiting for GPU slot...
    [cuda:0] Slot acquired (waited 3.7s). Starting GCN...
    FINAL_RESULT: {'acc': {'train': 0.8260869565217391, 'valid': 0.706, 'test': 0.787}, 'wall_s': 7.84, 'cpu_s': 5.72, 'gpu_s': 2.1, 'wait_s': 3.7}
    [Time] wall=7.8s | cpu=5.7s | gpu=2.1s
    C:\Users\fbrev\Documents\Acadêmico\Simulações\Python\NoisyGL\predictor\Base_Predictor.py:114: UserWarning: expandable_segments not supported on this platform (Triggered internally at ..\c10/cuda/CUDAAllocatorConfig.h:28.)
    self.edge_index = self._cpu_edge_index.to(self.device)
    C:\Users\fbrev\Documents\Acadêmico\Simulações\Python\NoisyGL\predictor\Base_Predictor.py:144: UserWarning: Sparse CSR tensor support is in beta state. If you miss a functionality in the sparse tensor support, please submit a feature request to https://github.com/pytorch/pytorch/issues. (Triggered internally at ..\aten\src\ATen\SparseCsrTensorImpl.cpp:55.)
    self.adj_csr = self.adj.to_sparse_csr().to(self.device)
[I 2026-05-08 02:28:50,862] Trial 3 finished with value: 0.787 and parameters: {'lr': 0.01, 'weight_decay': 0.0, 'n_hidden': 256, 'n_layer': 3, 'dropout': 0.7679730381544515, 'knn_mode': 's', 'k': 24, 'dexp': 8.3269203648727, 'p_grd': 0.2184998850946086, 'unc_rem': 0.1269280697305547, 'unc_rel': 0.24879210037068566}. Best is trial 0 with value: 0.801.
    [CPU] Loading cora...
    DEBUG 3.1: Dataset init start
    DEBUG 3.2: prepare_data start cora
    ----Data statistics------'
    Name: cora
    #Nodes 2708
    #Edges 5278
    #Classes 7
    #Ave_degree 3.90
    ----Split statistics------'
    #Train samples 140 (default)
    #Val samples 500 (default)
    #Test samples 1000 (default)
    ----label noise information:------
    Instance dependent noise
    #Actual noise rate 0.13
    [cuda:0] LNPCC waiting for GPU slot...
    [cuda:0] Slot acquired (waited 18.6s). Starting GCN...
    FINAL_RESULT: {'acc': {'train': 0.8872180451127819, 'valid': 0.688, 'test': 0.774}, 'wall_s': 7.49, 'cpu_s': 5.71, 'gpu_s': 1.76, 'wait_s': 18.63}
    [Time] wall=7.5s | cpu=5.7s | gpu=1.8s
    C:\Users\fbrev\Documents\Acadêmico\Simulações\Python\NoisyGL\predictor\Base_Predictor.py:114: UserWarning: expandable_segments not supported on this platform (Triggered internally at ..\c10/cuda/CUDAAllocatorConfig.h:28.)
    self.edge_index = self._cpu_edge_index.to(self.device)
    C:\Users\fbrev\Documents\Acadêmico\Simulações\Python\NoisyGL\predictor\Base_Predictor.py:144: UserWarning: Sparse CSR tensor support is in beta state. If you miss a functionality in the sparse tensor support, please submit a feature request to https://github.com/pytorch/pytorch/issues. (Triggered internally at ..\aten\src\ATen\SparseCsrTensorImpl.cpp:55.)
    self.adj_csr = self.adj.to_sparse_csr().to(self.device)
[I 2026-05-08 02:29:22,005] Trial 4 finished with value: 0.774 and parameters: {'lr': 0.001, 'weight_decay': 0.01, 'n_hidden': 32, 'n_layer': 3, 'dropout': 0.7038458031184676, 'knn_mode': 's', 'k': 9, 'dexp': 2.686398662779987, 'p_grd': 0.260480876024059, 'unc_rem': 0.11716653894410789, 'unc_rel': 0.0855185384292958}. Best is trial 0 with value: 0.801.
    [CPU] Loading cora...
    DEBUG 3.1: Dataset init start
    DEBUG 3.2: prepare_data start cora
    ----Data statistics------'
    Name: cora
    #Nodes 2708
    #Edges 5278
    #Classes 7
    #Ave_degree 3.90
    ----Split statistics------'
    #Train samples 140 (default)
    #Val samples 500 (default)
    #Test samples 1000 (default)
    ----label noise information:------
    Instance dependent noise
    #Actual noise rate 0.13
    [cuda:0] LNPCC waiting for GPU slot...
    [cuda:0] Slot acquired (waited 3.2s). Starting GCN...
    FINAL_RESULT: {'acc': {'train': 0.8857142857142857, 'valid': 0.716, 'test': 0.814}, 'wall_s': 7.95, 'cpu_s': 6.11, 'gpu_s': 1.82, 'wait_s': 3.19}
    [Time] wall=8.0s | cpu=6.1s | gpu=1.8s
    C:\Users\fbrev\Documents\Acadêmico\Simulações\Python\NoisyGL\predictor\Base_Predictor.py:114: UserWarning: expandable_segments not supported on this platform (Triggered internally at ..\c10/cuda/CUDAAllocatorConfig.h:28.)
    self.edge_index = self._cpu_edge_index.to(self.device)
    C:\Users\fbrev\Documents\Acadêmico\Simulações\Python\NoisyGL\predictor\Base_Predictor.py:144: UserWarning: Sparse CSR tensor support is in beta state. If you miss a functionality in the sparse tensor support, please submit a feature request to https://github.com/pytorch/pytorch/issues. (Triggered internally at ..\aten\src\ATen\SparseCsrTensorImpl.cpp:55.)
    self.adj_csr = self.adj.to_sparse_csr().to(self.device)
[I 2026-05-08 02:29:38,106] Trial 5 finished with value: 0.814 and parameters: {'lr': 0.005, 'weight_decay': 0.001, 'n_hidden': 256, 'n_layer': 3, 'dropout': 0.5081407678113709, 'knn_mode': 's', 'k': 6, 'dexp': 8.201233283460219, 'p_grd': 0.7144216630336351, 'unc_rem': 0.6840438102211569, 'unc_rel': 0.7616068797550649}. Best is trial 5 with value: 0.814.
    [CPU] Loading cora...
    DEBUG 3.1: Dataset init start
    DEBUG 3.2: prepare_data start cora
    ----Data statistics------'
    Name: cora
    #Nodes 2708
    #Edges 5278
    #Classes 7
    #Ave_degree 3.90
    ----Split statistics------'
    #Train samples 140 (default)
    #Val samples 500 (default)
    #Test samples 1000 (default)
    ----label noise information:------
    Instance dependent noise
    #Actual noise rate 0.13
    [cuda:0] LNPCC waiting for GPU slot...
    [cuda:0] Slot acquired (waited 90.0s). Starting GCN...
    FINAL_RESULT: {'acc': {'train': 0.608, 'valid': 0.65, 'test': 0.723}, 'wall_s': 8.37, 'cpu_s': 6.43, 'gpu_s': 1.92, 'wait_s': 90.02}
    [Time] wall=8.4s | cpu=6.4s | gpu=1.9s
    C:\Users\fbrev\Documents\Acadêmico\Simulações\Python\NoisyGL\predictor\Base_Predictor.py:114: UserWarning: expandable_segments not supported on this platform (Triggered internally at ..\c10/cuda/CUDAAllocatorConfig.h:28.)
    self.edge_index = self._cpu_edge_index.to(self.device)
    C:\Users\fbrev\Documents\Acadêmico\Simulações\Python\NoisyGL\predictor\Base_Predictor.py:144: UserWarning: Sparse CSR tensor support is in beta state. If you miss a functionality in the sparse tensor support, please submit a feature request to https://github.com/pytorch/pytorch/issues. (Triggered internally at ..\aten\src\ATen\SparseCsrTensorImpl.cpp:55.)
    self.adj_csr = self.adj.to_sparse_csr().to(self.device)
[I 2026-05-08 02:31:21,614] Trial 6 finished with value: 0.723 and parameters: {'lr': 0.05, 'weight_decay': 0.001, 'n_hidden': 128, 'n_layer': 3, 'dropout': 0.7020473327625294, 'knn_mode': 'd', 'k': 15, 'dexp': 0.5878486504011348, 'p_grd': 0.011335731587640785, 'unc_rem': 0.5858998350477302, 'unc_rel': 0.7226749298158259}. Best is trial 5 with value: 0.814.
    [CPU] Loading cora...
    DEBUG 3.1: Dataset init start
    DEBUG 3.2: prepare_data start cora
    ----Data statistics------'
    Name: cora
    #Nodes 2708
    #Edges 5278
    #Classes 7
    #Ave_degree 3.90
    ----Split statistics------'
    #Train samples 140 (default)
    #Val samples 500 (default)
    #Test samples 1000 (default)
    ----label noise information:------
    Instance dependent noise
    #Actual noise rate 0.13
    [cuda:0] LNPCC waiting for GPU slot...
    [cuda:0] Slot acquired (waited 34.5s). Starting GCN...
    FINAL_RESULT: {'acc': {'train': 0.9357142857142857, 'valid': 0.682, 'test': 0.789}, 'wall_s': 7.5, 'cpu_s': 6.08, 'gpu_s': 1.4, 'wait_s': 34.45}
    [Time] wall=7.5s | cpu=6.1s | gpu=1.4s
    C:\Users\fbrev\Documents\Acadêmico\Simulações\Python\NoisyGL\predictor\Base_Predictor.py:114: UserWarning: expandable_segments not supported on this platform (Triggered internally at ..\c10/cuda/CUDAAllocatorConfig.h:28.)
    self.edge_index = self._cpu_edge_index.to(self.device)
    C:\Users\fbrev\Documents\Acadêmico\Simulações\Python\NoisyGL\predictor\Base_Predictor.py:144: UserWarning: Sparse CSR tensor support is in beta state. If you miss a functionality in the sparse tensor support, please submit a feature request to https://github.com/pytorch/pytorch/issues. (Triggered internally at ..\aten\src\ATen\SparseCsrTensorImpl.cpp:55.)
    self.adj_csr = self.adj.to_sparse_csr().to(self.device)
[I 2026-05-08 02:32:08,702] Trial 7 finished with value: 0.789 and parameters: {'lr': 0.005, 'weight_decay': 0.001, 'n_hidden': 64, 'n_layer': 2, 'dropout': 0.6564195734694973, 'knn_mode': 's', 'k': 7, 'dexp': 7.467726416853233, 'p_grd': 0.32445350005580476, 'unc_rem': 0.16404940716158267, 'unc_rel': 0.28013196087250636}. Best is trial 5 with value: 0.814.
    [CPU] Loading cora...
    DEBUG 3.1: Dataset init start
    DEBUG 3.2: prepare_data start cora
    ----Data statistics------'
    Name: cora
    #Nodes 2708
    #Edges 5278
    #Classes 7
    #Ave_degree 3.90
    ----Split statistics------'
    #Train samples 140 (default)
    #Val samples 500 (default)
    #Test samples 1000 (default)
    ----label noise information:------
    Instance dependent noise
    #Actual noise rate 0.13
    [cuda:0] LNPCC waiting for GPU slot...
    [cuda:0] Slot acquired (waited 83.8s). Starting GCN...
    FINAL_RESULT: {'acc': {'train': 0.9071428571428571, 'valid': 0.688, 'test': 0.804}, 'wall_s': 17.38, 'cpu_s': 15.64, 'gpu_s': 1.73, 'wait_s': 83.76}
    [Time] wall=17.4s | cpu=15.6s | gpu=1.7s
    C:\Users\fbrev\Documents\Acadêmico\Simulações\Python\NoisyGL\predictor\Base_Predictor.py:114: UserWarning: expandable_segments not supported on this platform (Triggered internally at ..\c10/cuda/CUDAAllocatorConfig.h:28.)
    self.edge_index = self._cpu_edge_index.to(self.device)
    C:\Users\fbrev\Documents\Acadêmico\Simulações\Python\NoisyGL\predictor\Base_Predictor.py:144: UserWarning: Sparse CSR tensor support is in beta state. If you miss a functionality in the sparse tensor support, please submit a feature request to https://github.com/pytorch/pytorch/issues. (Triggered internally at ..\aten\src\ATen\SparseCsrTensorImpl.cpp:55.)
    self.adj_csr = self.adj.to_sparse_csr().to(self.device)
[I 2026-05-08 02:33:55,236] Trial 8 finished with value: 0.804 and parameters: {'lr': 0.01, 'weight_decay': 0.001, 'n_hidden': 256, 'n_layer': 2, 'dropout': 0.3294390530051932, 'knn_mode': 'd', 'k': 49, 'dexp': 9.06038712732777, 'p_grd': 0.8773552621619033, 'unc_rem': 0.897822936218505, 'unc_rel': 0.3722181582772752}. Best is trial 5 with value: 0.814.
    [CPU] Loading cora...
    DEBUG 3.1: Dataset init start
    DEBUG 3.2: prepare_data start cora
    ----Data statistics------'
    Name: cora
    #Nodes 2708
    #Edges 5278
    #Classes 7
    #Ave_degree 3.90
    ----Split statistics------'
    #Train samples 140 (default)
    #Val samples 500 (default)
    #Test samples 1000 (default)
    ----label noise information:------
    Instance dependent noise
    #Actual noise rate 0.13
    [cuda:0] LNPCC waiting for GPU slot...
    [cuda:0] Slot acquired (waited 222.2s). Starting GCN...
    FINAL_RESULT: {'acc': {'train': 0.7841726618705036, 'valid': 0.586, 'test': 0.62}, 'wall_s': 7.7, 'cpu_s': 5.97, 'gpu_s': 1.71, 'wait_s': 222.24}
    [Time] wall=7.7s | cpu=6.0s | gpu=1.7s
    C:\Users\fbrev\Documents\Acadêmico\Simulações\Python\NoisyGL\predictor\Base_Predictor.py:114: UserWarning: expandable_segments not supported on this platform (Triggered internally at ..\c10/cuda/CUDAAllocatorConfig.h:28.)
    self.edge_index = self._cpu_edge_index.to(self.device)
    C:\Users\fbrev\Documents\Acadêmico\Simulações\Python\NoisyGL\predictor\Base_Predictor.py:144: UserWarning: Sparse CSR tensor support is in beta state. If you miss a functionality in the sparse tensor support, please submit a feature request to https://github.com/pytorch/pytorch/issues. (Triggered internally at ..\aten\src\ATen\SparseCsrTensorImpl.cpp:55.)
    self.adj_csr = self.adj.to_sparse_csr().to(self.device)
[I 2026-05-08 02:37:50,370] Trial 9 finished with value: 0.62 and parameters: {'lr': 0.005, 'weight_decay': 0.05, 'n_hidden': 128, 'n_layer': 3, 'dropout': 0.773886541698701, 'knn_mode': 's', 'k': 18, 'dexp': 8.269728185343707, 'p_grd': 0.2593333173174225, 'unc_rem': 0.40038097716656995, 'unc_rel': 0.6395700032731858}. Best is trial 5 with value: 0.814.
    [CPU] Loading cora...
    DEBUG 3.1: Dataset init start
    DEBUG 3.2: prepare_data start cora
    ----Data statistics------'
    Name: cora
    #Nodes 2708
    #Edges 5278
    #Classes 7
    #Ave_degree 3.90
    ----Split statistics------'
    #Train samples 140 (default)
    #Val samples 500 (default)
    #Test samples 1000 (default)
    ----label noise information:------
    Instance dependent noise
    #Actual noise rate 0.13
    [cuda:0] LNPCC waiting for GPU slot...
    [cuda:0] Slot acquired (waited 17.9s). Starting GCN...
    FINAL_RESULT: {'acc': {'train': 0.9, 'valid': 0.706, 'test': 0.792}, 'wall_s': 7.5, 'cpu_s': 5.73, 'gpu_s': 1.76, 'wait_s': 17.9}
    [Time] wall=7.5s | cpu=5.7s | gpu=1.8s
    C:\Users\fbrev\Documents\Acadêmico\Simulações\Python\NoisyGL\predictor\Base_Predictor.py:114: UserWarning: expandable_segments not supported on this platform (Triggered internally at ..\c10/cuda/CUDAAllocatorConfig.h:28.)
    self.edge_index = self._cpu_edge_index.to(self.device)
    C:\Users\fbrev\Documents\Acadêmico\Simulações\Python\NoisyGL\predictor\Base_Predictor.py:144: UserWarning: Sparse CSR tensor support is in beta state. If you miss a functionality in the sparse tensor support, please submit a feature request to https://github.com/pytorch/pytorch/issues. (Triggered internally at ..\aten\src\ATen\SparseCsrTensorImpl.cpp:55.)
    self.adj_csr = self.adj.to_sparse_csr().to(self.device)
[I 2026-05-08 02:38:20,733] Trial 10 finished with value: 0.792 and parameters: {'lr': 0.001, 'weight_decay': 0.0001, 'n_hidden': 64, 'n_layer': 3, 'dropout': 0.5010717996397103, 'knn_mode': 's', 'k': 31, 'dexp': 8.74303814548153, 'p_grd': 0.20174722186804284, 'unc_rem': 0.7503910147836939, 'unc_rel': 0.2507056072345083}. Best is trial 5 with value: 0.814.
    [CPU] Loading cora...
    DEBUG 3.1: Dataset init start
    DEBUG 3.2: prepare_data start cora
    ----Data statistics------'
    Name: cora
    #Nodes 2708
    #Edges 5278
    #Classes 7
    #Ave_degree 3.90
    ----Split statistics------'
    #Train samples 140 (default)
    #Val samples 500 (default)
    #Test samples 1000 (default)
    ----label noise information:------
    Instance dependent noise
    #Actual noise rate 0.13
    [cuda:0] LNPCC waiting for GPU slot...
    [cuda:0] Slot acquired (waited 158.3s). Starting GCN...
    FINAL_RESULT: {'acc': {'train': 0.9197080291970803, 'valid': 0.66, 'test': 0.756}, 'wall_s': 12.08, 'cpu_s': 10.5, 'gpu_s': 1.56, 'wait_s': 158.32}
    [Time] wall=12.1s | cpu=10.5s | gpu=1.6s
    C:\Users\fbrev\Documents\Acadêmico\Simulações\Python\NoisyGL\predictor\Base_Predictor.py:114: UserWarning: expandable_segments not supported on this platform (Triggered internally at ..\c10/cuda/CUDAAllocatorConfig.h:28.)
    self.edge_index = self._cpu_edge_index.to(self.device)
    C:\Users\fbrev\Documents\Acadêmico\Simulações\Python\NoisyGL\predictor\Base_Predictor.py:144: UserWarning: Sparse CSR tensor support is in beta state. If you miss a functionality in the sparse tensor support, please submit a feature request to https://github.com/pytorch/pytorch/issues. (Triggered internally at ..\aten\src\ATen\SparseCsrTensorImpl.cpp:55.)
    self.adj_csr = self.adj.to_sparse_csr().to(self.device)
