[I 2026-05-07 19:30:22,094] Trial 23 finished with value: 0.63 and parameters: {'lr': 0.1, 'weight_decay': 0.05, 'n_hidden': 32, 'n_layer': 2, 'dropout': 0.2611016693733711, 'knn_mode': 'd', 'k': 17, 'dexp': 2.129722134927682, 'p_grd': 0.4198253575768537, 'unc_rem': 0.3018074671096468, 'unc_rel': 0.8578911262049675}. Best is trial 21 with value: 0.651.
    [CPU] Loading citeseer...
    DEBUG 3.1: Dataset init start
    DEBUG 3.2: prepare_data start citeseer
    ----Data statistics------'
    Name: citeseer
    #Nodes 3327
    #Edges 4552
    #Classes 6
    #Ave_degree 2.74
    ----Split statistics------'
    #Train samples 120 (default)
    #Val samples 500 (default)
    #Test samples 1000 (default)
    ----label noise information:------
    Instance dependent noise
    #Actual noise rate 0.30
    [cuda:1] LNPCC waiting for GPU slot...
    [cuda:1] Slot acquired (waited 141.8s). Starting GCN...
    FINAL_RESULT: {'acc': {'train': 0.8728813559322034, 'valid': 0.492, 'test': 0.636}, 'wall_s': 21.34, 'cpu_s': 19.51, 'gpu_s': 1.78, 'wait_s': 141.82}
    [Time] wall=21.3s | cpu=19.5s | gpu=1.8s
    C:\Users\fbrev\Documents\Acadêmico\Simulações\Python\NoisyGL\predictor\Base_Predictor.py:114: UserWarning: expandable_segments not supported on this platform (Triggered internally at ..\c10/cuda/CUDAAllocatorConfig.h:28.)
    self.edge_index = self._cpu_edge_index.to(self.device)
    C:\Users\fbrev\Documents\Acadêmico\Simulações\Python\NoisyGL\predictor\Base_Predictor.py:144: UserWarning: Sparse CSR tensor support is in beta state. If you miss a functionality in the sparse tensor support, please submit a feature request to https://github.com/pytorch/pytorch/issues. (Triggered internally at ..\aten\src\ATen\SparseCsrTensorImpl.cpp:55.)
    self.adj_csr = self.adj.to_sparse_csr().to(self.device)
[I 2026-05-07 19:33:11,048] Trial 24 finished with value: 0.636 and parameters: {'lr': 0.1, 'weight_decay': 0.05, 'n_hidden': 32, 'n_layer': 2, 'dropout': 0.25149080106818494, 'knn_mode': 'd', 'k': 15, 'dexp': 0.3901671210985169, 'p_grd': 0.5769025909539, 'unc_rem': 0.37499080209005786, 'unc_rel': 0.879157319388088}. Best is trial 21 with value: 0.651.
    [CPU] Loading citeseer...
    DEBUG 3.1: Dataset init start
    DEBUG 3.2: prepare_data start citeseer
    ----Data statistics------'
    Name: citeseer
    #Nodes 3327
    #Edges 4552
    #Classes 6
    #Ave_degree 2.74
    ----Split statistics------'
    #Train samples 120 (default)
    #Val samples 500 (default)
    #Test samples 1000 (default)
    ----label noise information:------
    Instance dependent noise
    #Actual noise rate 0.30
    [cuda:1] LNPCC waiting for GPU slot...
    [cuda:1] Slot acquired (waited 139.9s). Starting GCN...
    FINAL_RESULT: {'acc': {'train': 0.8583333333333333, 'valid': 0.496, 'test': 0.671}, 'wall_s': 22.97, 'cpu_s': 21.35, 'gpu_s': 1.58, 'wait_s': 139.91}
    [Time] wall=23.0s | cpu=21.3s | gpu=1.6s
    C:\Users\fbrev\Documents\Acadêmico\Simulações\Python\NoisyGL\predictor\Base_Predictor.py:114: UserWarning: expandable_segments not supported on this platform (Triggered internally at ..\c10/cuda/CUDAAllocatorConfig.h:28.)
    self.edge_index = self._cpu_edge_index.to(self.device)
    C:\Users\fbrev\Documents\Acadêmico\Simulações\Python\NoisyGL\predictor\Base_Predictor.py:144: UserWarning: Sparse CSR tensor support is in beta state. If you miss a functionality in the sparse tensor support, please submit a feature request to https://github.com/pytorch/pytorch/issues. (Triggered internally at ..\aten\src\ATen\SparseCsrTensorImpl.cpp:55.)
    self.adj_csr = self.adj.to_sparse_csr().to(self.device)
[I 2026-05-07 19:35:59,421] Trial 25 finished with value: 0.671 and parameters: {'lr': 0.1, 'weight_decay': 0.05, 'n_hidden': 32, 'n_layer': 2, 'dropout': 0.2701604893148466, 'knn_mode': 'd', 'k': 15, 'dexp': 0.4463108152829385, 'p_grd': 0.5901254137085761, 'unc_rem': 0.4122707695299341, 'unc_rel': 0.8831263350156553}. Best is trial 25 with value: 0.671.
    [CPU] Loading citeseer...
    DEBUG 3.1: Dataset init start
    DEBUG 3.2: prepare_data start citeseer
    ----Data statistics------'
    Name: citeseer
    #Nodes 3327
    #Edges 4552
    #Classes 6
    #Ave_degree 2.74
    ----Split statistics------'
    #Train samples 120 (default)
    #Val samples 500 (default)
    #Test samples 1000 (default)
    ----label noise information:------
    Instance dependent noise
    #Actual noise rate 0.30
    [cuda:1] LNPCC waiting for GPU slot...
    [cuda:1] Slot acquired (waited 141.4s). Starting GCN...
    FINAL_RESULT: {'acc': {'train': 0.9243697478991597, 'valid': 0.49, 'test': 0.647}, 'wall_s': 22.38, 'cpu_s': 20.56, 'gpu_s': 1.78, 'wait_s': 141.44}
    [Time] wall=22.4s | cpu=20.6s | gpu=1.8s
    C:\Users\fbrev\Documents\Acadêmico\Simulações\Python\NoisyGL\predictor\Base_Predictor.py:114: UserWarning: expandable_segments not supported on this platform (Triggered internally at ..\c10/cuda/CUDAAllocatorConfig.h:28.)
    self.edge_index = self._cpu_edge_index.to(self.device)
    C:\Users\fbrev\Documents\Acadêmico\Simulações\Python\NoisyGL\predictor\Base_Predictor.py:144: UserWarning: Sparse CSR tensor support is in beta state. If you miss a functionality in the sparse tensor support, please submit a feature request to https://github.com/pytorch/pytorch/issues. (Triggered internally at ..\aten\src\ATen\SparseCsrTensorImpl.cpp:55.)
    self.adj_csr = self.adj.to_sparse_csr().to(self.device)
[I 2026-05-07 19:38:48,824] Trial 26 finished with value: 0.647 and parameters: {'lr': 0.1, 'weight_decay': 0.05, 'n_hidden': 32, 'n_layer': 2, 'dropout': 0.2605953812451114, 'knn_mode': 'd', 'k': 13, 'dexp': 0.1737590757253869, 'p_grd': 0.5955589533872729, 'unc_rem': 0.4239720813933167, 'unc_rel': 0.8792423291528682}. Best is trial 25 with value: 0.671.
    [CPU] Loading citeseer...
    DEBUG 3.1: Dataset init start
    DEBUG 3.2: prepare_data start citeseer
    ----Data statistics------'
    Name: citeseer
    #Nodes 3327
    #Edges 4552
    #Classes 6
    #Ave_degree 2.74
    ----Split statistics------'
    #Train samples 120 (default)
    #Val samples 500 (default)
    #Test samples 1000 (default)
    ----label noise information:------
    Instance dependent noise
    #Actual noise rate 0.30
    [cuda:1] LNPCC waiting for GPU slot...
    [cuda:1] Slot acquired (waited 142.4s). Starting GCN...
    FINAL_RESULT: {'acc': {'train': 0.8666666666666667, 'valid': 0.49, 'test': 0.656}, 'wall_s': 23.42, 'cpu_s': 21.7, 'gpu_s': 1.68, 'wait_s': 142.45}
    [Time] wall=23.4s | cpu=21.7s | gpu=1.7s
    C:\Users\fbrev\Documents\Acadêmico\Simulações\Python\NoisyGL\predictor\Base_Predictor.py:114: UserWarning: expandable_segments not supported on this platform (Triggered internally at ..\c10/cuda/CUDAAllocatorConfig.h:28.)
    self.edge_index = self._cpu_edge_index.to(self.device)
    C:\Users\fbrev\Documents\Acadêmico\Simulações\Python\NoisyGL\predictor\Base_Predictor.py:144: UserWarning: Sparse CSR tensor support is in beta state. If you miss a functionality in the sparse tensor support, please submit a feature request to https://github.com/pytorch/pytorch/issues. (Triggered internally at ..\aten\src\ATen\SparseCsrTensorImpl.cpp:55.)
    self.adj_csr = self.adj.to_sparse_csr().to(self.device)
[I 2026-05-07 19:41:40,340] Trial 27 finished with value: 0.656 and parameters: {'lr': 0.1, 'weight_decay': 0.05, 'n_hidden': 32, 'n_layer': 2, 'dropout': 0.43014593012178237, 'knn_mode': 'd', 'k': 34, 'dexp': 1.3709818385462642, 'p_grd': 0.7502647214296942, 'unc_rem': 0.5763871657154986, 'unc_rel': 0.9950252482832717}. Best is trial 25 with value: 0.671.
    [CPU] Loading citeseer...
    DEBUG 3.1: Dataset init start
    DEBUG 3.2: prepare_data start citeseer
    ----Data statistics------'
    Name: citeseer
    #Nodes 3327
    #Edges 4552
    #Classes 6
    #Ave_degree 2.74
    ----Split statistics------'
    #Train samples 120 (default)
    #Val samples 500 (default)
    #Test samples 1000 (default)
    ----label noise information:------
    Instance dependent noise
    #Actual noise rate 0.30
    [cuda:1] LNPCC waiting for GPU slot...
    [cuda:1] Slot acquired (waited 140.7s). Starting GCN...
    FINAL_RESULT: {'acc': {'train': 0.8416666666666667, 'valid': 0.504, 'test': 0.659}, 'wall_s': 23.47, 'cpu_s': 21.25, 'gpu_s': 2.19, 'wait_s': 140.68}
    [Time] wall=23.5s | cpu=21.2s | gpu=2.2s
    C:\Users\fbrev\Documents\Acadêmico\Simulações\Python\NoisyGL\predictor\Base_Predictor.py:114: UserWarning: expandable_segments not supported on this platform (Triggered internally at ..\c10/cuda/CUDAAllocatorConfig.h:28.)
    self.edge_index = self._cpu_edge_index.to(self.device)
    C:\Users\fbrev\Documents\Acadêmico\Simulações\Python\NoisyGL\predictor\Base_Predictor.py:144: UserWarning: Sparse CSR tensor support is in beta state. If you miss a functionality in the sparse tensor support, please submit a feature request to https://github.com/pytorch/pytorch/issues. (Triggered internally at ..\aten\src\ATen\SparseCsrTensorImpl.cpp:55.)
    self.adj_csr = self.adj.to_sparse_csr().to(self.device)
[I 2026-05-07 19:44:30,426] Trial 28 finished with value: 0.659 and parameters: {'lr': 0.1, 'weight_decay': 0.05, 'n_hidden': 32, 'n_layer': 2, 'dropout': 0.447413337711826, 'knn_mode': 'd', 'k': 35, 'dexp': 1.3423550557000938, 'p_grd': 0.7370031773684881, 'unc_rem': 0.5494985832514128, 'unc_rel': 0.9939353692718681}. Best is trial 25 with value: 0.671.
    [CPU] Loading citeseer...
    DEBUG 3.1: Dataset init start
    DEBUG 3.2: prepare_data start citeseer
    ----Data statistics------'
    Name: citeseer
    #Nodes 3327
    #Edges 4552
    #Classes 6
    #Ave_degree 2.74
    ----Split statistics------'
    #Train samples 120 (default)
    #Val samples 500 (default)
    #Test samples 1000 (default)
    ----label noise information:------
    Instance dependent noise
    #Actual noise rate 0.30
    [cuda:1] LNPCC waiting for GPU slot...
    [cuda:1] Slot acquired (waited 137.4s). Starting GCN...
    FINAL_RESULT: {'acc': {'train': 0.775, 'valid': 0.48, 'test': 0.631}, 'wall_s': 23.29, 'cpu_s': 21.59, 'gpu_s': 1.65, 'wait_s': 137.43}
    [Time] wall=23.3s | cpu=21.6s | gpu=1.7s
    C:\Users\fbrev\Documents\Acadêmico\Simulações\Python\NoisyGL\predictor\Base_Predictor.py:114: UserWarning: expandable_segments not supported on this platform (Triggered internally at ..\c10/cuda/CUDAAllocatorConfig.h:28.)
    self.edge_index = self._cpu_edge_index.to(self.device)
    C:\Users\fbrev\Documents\Acadêmico\Simulações\Python\NoisyGL\predictor\Base_Predictor.py:144: UserWarning: Sparse CSR tensor support is in beta state. If you miss a functionality in the sparse tensor support, please submit a feature request to https://github.com/pytorch/pytorch/issues. (Triggered internally at ..\aten\src\ATen\SparseCsrTensorImpl.cpp:55.)
    self.adj_csr = self.adj.to_sparse_csr().to(self.device)
[I 2026-05-07 19:47:17,454] Trial 29 finished with value: 0.631 and parameters: {'lr': 0.1, 'weight_decay': 0.05, 'n_hidden': 32, 'n_layer': 2, 'dropout': 0.4433846562766249, 'knn_mode': 'd', 'k': 37, 'dexp': 1.146700884136365, 'p_grd': 0.7339904541505696, 'unc_rem': 0.5324671359236125, 'unc_rel': 0.9146292368967253}. Best is trial 25 with value: 0.671.
    [CPU] Loading citeseer...
    DEBUG 3.1: Dataset init start
    DEBUG 3.2: prepare_data start citeseer
    ----Data statistics------'
    Name: citeseer
    #Nodes 3327
    #Edges 4552
    #Classes 6
    #Ave_degree 2.74
    ----Split statistics------'
    #Train samples 120 (default)
    #Val samples 500 (default)
    #Test samples 1000 (default)
    ----label noise information:------
    Instance dependent noise
    #Actual noise rate 0.30
    [cuda:1] LNPCC waiting for GPU slot...
    [cuda:1] Slot acquired (waited 143.4s). Starting GCN...
    FINAL_RESULT: {'acc': {'train': 0.9166666666666666, 'valid': 0.494, 'test': 0.65}, 'wall_s': 26.75, 'cpu_s': 25.04, 'gpu_s': 1.65, 'wait_s': 143.42}
    [Time] wall=26.7s | cpu=25.0s | gpu=1.7s
    C:\Users\fbrev\Documents\Acadêmico\Simulações\Python\NoisyGL\predictor\Base_Predictor.py:114: UserWarning: expandable_segments not supported on this platform (Triggered internally at ..\c10/cuda/CUDAAllocatorConfig.h:28.)
    self.edge_index = self._cpu_edge_index.to(self.device)
    C:\Users\fbrev\Documents\Acadêmico\Simulações\Python\NoisyGL\predictor\Base_Predictor.py:144: UserWarning: Sparse CSR tensor support is in beta state. If you miss a functionality in the sparse tensor support, please submit a feature request to https://github.com/pytorch/pytorch/issues. (Triggered internally at ..\aten\src\ATen\SparseCsrTensorImpl.cpp:55.)
    self.adj_csr = self.adj.to_sparse_csr().to(self.device)
[I 2026-05-07 19:50:13,493] Trial 30 finished with value: 0.65 and parameters: {'lr': 0.1, 'weight_decay': 0.05, 'n_hidden': 32, 'n_layer': 2, 'dropout': 0.42268343238160144, 'knn_mode': 'd', 'k': 35, 'dexp': 2.2539545423680805, 'p_grd': 0.7061304413278913, 'unc_rem': 0.5871015344898188, 'unc_rel': 0.9995896443677517}. Best is trial 25 with value: 0.671.
    [CPU] Loading citeseer...
    DEBUG 3.1: Dataset init start
    DEBUG 3.2: prepare_data start citeseer
    ----Data statistics------'
    Name: citeseer
    #Nodes 3327
    #Edges 4552
    #Classes 6
    #Ave_degree 2.74
    ----Split statistics------'
    #Train samples 120 (default)
    #Val samples 500 (default)
    #Test samples 1000 (default)
    ----label noise information:------
    Instance dependent noise
    #Actual noise rate 0.30
    [cuda:1] LNPCC waiting for GPU slot...
    [cuda:1] Slot acquired (waited 135.4s). Starting GCN...
    FINAL_RESULT: {'acc': {'train': 0.8166666666666667, 'valid': 0.5, 'test': 0.658}, 'wall_s': 24.96, 'cpu_s': 23.09, 'gpu_s': 1.83, 'wait_s': 135.38}
    [Time] wall=25.0s | cpu=23.1s | gpu=1.8s
    C:\Users\fbrev\Documents\Acadêmico\Simulações\Python\NoisyGL\predictor\Base_Predictor.py:114: UserWarning: expandable_segments not supported on this platform (Triggered internally at ..\c10/cuda/CUDAAllocatorConfig.h:28.)
    self.edge_index = self._cpu_edge_index.to(self.device)
    C:\Users\fbrev\Documents\Acadêmico\Simulações\Python\NoisyGL\predictor\Base_Predictor.py:144: UserWarning: Sparse CSR tensor support is in beta state. If you miss a functionality in the sparse tensor support, please submit a feature request to https://github.com/pytorch/pytorch/issues. (Triggered internally at ..\aten\src\ATen\SparseCsrTensorImpl.cpp:55.)
    self.adj_csr = self.adj.to_sparse_csr().to(self.device)
[I 2026-05-07 19:52:59,446] Trial 31 finished with value: 0.658 and parameters: {'lr': 0.1, 'weight_decay': 0.05, 'n_hidden': 32, 'n_layer': 2, 'dropout': 0.5761035480175297, 'knn_mode': 'd', 'k': 31, 'dexp': 1.2579084451277096, 'p_grd': 0.8050412794097148, 'unc_rem': 0.5068377200841115, 'unc_rel': 0.8322747362369114}. Best is trial 25 with value: 0.671.
    [CPU] Loading citeseer...
    DEBUG 3.1: Dataset init start
    DEBUG 3.2: prepare_data start citeseer
    ----Data statistics------'
    Name: citeseer
    #Nodes 3327
    #Edges 4552
    #Classes 6
    #Ave_degree 2.74
    ----Split statistics------'
    #Train samples 120 (default)
    #Val samples 500 (default)
    #Test samples 1000 (default)
    ----label noise information:------
    Instance dependent noise
    #Actual noise rate 0.30
    [cuda:1] LNPCC waiting for GPU slot...
    [cuda:1] Slot acquired (waited 138.7s). Starting GCN...
    FINAL_RESULT: {'acc': {'train': 0.8416666666666667, 'valid': 0.502, 'test': 0.643}, 'wall_s': 24.83, 'cpu_s': 23.24, 'gpu_s': 1.55, 'wait_s': 138.65}
    [Time] wall=24.8s | cpu=23.2s | gpu=1.6s
    C:\Users\fbrev\Documents\Acadêmico\Simulações\Python\NoisyGL\predictor\Base_Predictor.py:114: UserWarning: expandable_segments not supported on this platform (Triggered internally at ..\c10/cuda/CUDAAllocatorConfig.h:28.)
    self.edge_index = self._cpu_edge_index.to(self.device)
    C:\Users\fbrev\Documents\Acadêmico\Simulações\Python\NoisyGL\predictor\Base_Predictor.py:144: UserWarning: Sparse CSR tensor support is in beta state. If you miss a functionality in the sparse tensor support, please submit a feature request to https://github.com/pytorch/pytorch/issues. (Triggered internally at ..\aten\src\ATen\SparseCsrTensorImpl.cpp:55.)
    self.adj_csr = self.adj.to_sparse_csr().to(self.device)
[I 2026-05-07 19:55:48,516] Trial 32 finished with value: 0.643 and parameters: {'lr': 0.1, 'weight_decay': 0.05, 'n_hidden': 32, 'n_layer': 2, 'dropout': 0.5975050422828195, 'knn_mode': 'd', 'k': 26, 'dexp': 0.849982210916745, 'p_grd': 0.7897876049794978, 'unc_rem': 0.48617438270765956, 'unc_rel': 0.8263544133154841}. Best is trial 25 with value: 0.671.
    [CPU] Loading citeseer...
    DEBUG 3.1: Dataset init start
    DEBUG 3.2: prepare_data start citeseer
    ----Data statistics------'
    Name: citeseer
    #Nodes 3327
    #Edges 4552
    #Classes 6
    #Ave_degree 2.74
    ----Split statistics------'
    #Train samples 120 (default)
    #Val samples 500 (default)
    #Test samples 1000 (default)
    ----label noise information:------
    Instance dependent noise
    #Actual noise rate 0.30
    [cuda:1] LNPCC waiting for GPU slot...
    [cuda:1] Slot acquired (waited 139.2s). Starting GCN...
    FINAL_RESULT: {'acc': {'train': 0.865546218487395, 'valid': 0.482, 'test': 0.653}, 'wall_s': 27.73, 'cpu_s': 25.83, 'gpu_s': 1.86, 'wait_s': 139.15}
    [Time] wall=27.7s | cpu=25.8s | gpu=1.9s
    C:\Users\fbrev\Documents\Acadêmico\Simulações\Python\NoisyGL\predictor\Base_Predictor.py:114: UserWarning: expandable_segments not supported on this platform (Triggered internally at ..\c10/cuda/CUDAAllocatorConfig.h:28.)
    self.edge_index = self._cpu_edge_index.to(self.device)
    C:\Users\fbrev\Documents\Acadêmico\Simulações\Python\NoisyGL\predictor\Base_Predictor.py:144: UserWarning: Sparse CSR tensor support is in beta state. If you miss a functionality in the sparse tensor support, please submit a feature request to https://github.com/pytorch/pytorch/issues. (Triggered internally at ..\aten\src\ATen\SparseCsrTensorImpl.cpp:55.)
    self.adj_csr = self.adj.to_sparse_csr().to(self.device)
[I 2026-05-07 19:58:41,147] Trial 33 finished with value: 0.653 and parameters: {'lr': 0.1, 'weight_decay': 0.05, 'n_hidden': 32, 'n_layer': 2, 'dropout': 0.5727465706686705, 'knn_mode': 'd', 'k': 40, 'dexp': 1.7174899236999834, 'p_grd': 0.8969181383715834, 'unc_rem': 0.5853624016144027, 'unc_rel': 0.9259752750941442}. Best is trial 25 with value: 0.671.
    [CPU] Loading citeseer...
    DEBUG 3.1: Dataset init start
    DEBUG 3.2: prepare_data start citeseer
    ----Data statistics------'
    Name: citeseer
    #Nodes 3327
    #Edges 4552
    #Classes 6
    #Ave_degree 2.74
    ----Split statistics------'
    #Train samples 120 (default)
    #Val samples 500 (default)
    #Test samples 1000 (default)
    ----label noise information:------
    Instance dependent noise
    #Actual noise rate 0.30
    [cuda:1] LNPCC waiting for GPU slot...
    [cuda:1] Slot acquired (waited 123.4s). Starting GCN...
    FINAL_RESULT: {'acc': {'train': 0.8547008547008547, 'valid': 0.482, 'test': 0.637}, 'wall_s': 34.89, 'cpu_s': 33.17, 'gpu_s': 1.67, 'wait_s': 123.36}
    [Time] wall=34.9s | cpu=33.2s | gpu=1.7s
    C:\Users\fbrev\Documents\Acadêmico\Simulações\Python\NoisyGL\predictor\Base_Predictor.py:114: UserWarning: expandable_segments not supported on this platform (Triggered internally at ..\c10/cuda/CUDAAllocatorConfig.h:28.)
    self.edge_index = self._cpu_edge_index.to(self.device)
    C:\Users\fbrev\Documents\Acadêmico\Simulações\Python\NoisyGL\predictor\Base_Predictor.py:144: UserWarning: Sparse CSR tensor support is in beta state. If you miss a functionality in the sparse tensor support, please submit a feature request to https://github.com/pytorch/pytorch/issues. (Triggered internally at ..\aten\src\ATen\SparseCsrTensorImpl.cpp:55.)
    self.adj_csr = self.adj.to_sparse_csr().to(self.device)
[I 2026-05-07 20:01:25,016] Trial 34 finished with value: 0.637 and parameters: {'lr': 0.1, 'weight_decay': 0.05, 'n_hidden': 32, 'n_layer': 2, 'dropout': 0.5590187407967053, 'knn_mode': 'd', 'k': 32, 'dexp': 3.0969313970964842, 'p_grd': 0.9659945774682432, 'unc_rem': 0.649175581313225, 'unc_rel': 0.77385968866594}. Best is trial 25 with value: 0.671.
    [CPU] Loading citeseer...
    DEBUG 3.1: Dataset init start
    DEBUG 3.2: prepare_data start citeseer
    ----Data statistics------'
    Name: citeseer
    #Nodes 3327
    #Edges 4552
    #Classes 6
    #Ave_degree 2.74
    ----Split statistics------'
    #Train samples 120 (default)
    #Val samples 500 (default)
    #Test samples 1000 (default)
    ----label noise information:------
    Instance dependent noise
    #Actual noise rate 0.30
    [cuda:1] LNPCC waiting for GPU slot...
    [cuda:1] Slot acquired (waited 136.2s). Starting GCN...
    FINAL_RESULT: {'acc': {'train': 0.8833333333333333, 'valid': 0.502, 'test': 0.66}, 'wall_s': 28.2, 'cpu_s': 26.32, 'gpu_s': 1.83, 'wait_s': 136.19}
    [Time] wall=28.2s | cpu=26.3s | gpu=1.8s
    C:\Users\fbrev\Documents\Acadêmico\Simulações\Python\NoisyGL\predictor\Base_Predictor.py:114: UserWarning: expandable_segments not supported on this platform (Triggered internally at ..\c10/cuda/CUDAAllocatorConfig.h:28.)
    self.edge_index = self._cpu_edge_index.to(self.device)
    C:\Users\fbrev\Documents\Acadêmico\Simulações\Python\NoisyGL\predictor\Base_Predictor.py:144: UserWarning: Sparse CSR tensor support is in beta state. If you miss a functionality in the sparse tensor support, please submit a feature request to https://github.com/pytorch/pytorch/issues. (Triggered internally at ..\aten\src\ATen\SparseCsrTensorImpl.cpp:55.)
    self.adj_csr = self.adj.to_sparse_csr().to(self.device)
