[I 2026-04-30 07:26:27,384] Trial 13 finished with value: 0.403 and parameters: {'lr': 0.1, 'weight_decay': 0.01, 'n_hidden': 64, 'n_layer': 2, 'dropout': 0.14062982503090202, 'knn_mode': 'd', 'k': 21, 'dexp': 2.6455009303886685, 'p_grd': 0.3877144538888293, 'unc_rem': 0.27211818926590114, 'unc_rel': 0.3678477824590435}. Best is trial 7 with value: 0.825.
    [CPU] Loading amazoncom...
    DEBUG 3.1: Dataset init start
    DEBUG 3.2: prepare_data start amazoncom
    ----Data statistics------'
    Name: amazoncom
    #Nodes 13752
    #Edges 245861
    #Classes 10
    #Ave_degree 35.76
    ----Split statistics------'
    #Train samples 200 (20 nodes per class)
    #Val samples 500 (specified)
    #Test samples 1000 (specified)
    ----label noise information:------
    Instance dependent noise
    #Actual noise rate 0.13
    [cuda:0] LNPCC waiting for GPU slot...
    [cuda:0] Slot acquired (waited 675.6s). Starting GCN...
    FINAL_RESULT: {'acc': {'train': 0.75, 'valid': 0.684, 'test': 0.791}, 'wall_s': 39.82, 'cpu_s': 37.5, 'gpu_s': 2.26, 'wait_s': 675.63}
    [Time] wall=39.8s | cpu=37.5s | gpu=2.3s
    C:\Users\fbrev\Documents\Acadêmico\Simulações\Python\NoisyGL\predictor\Base_Predictor.py:144: UserWarning: Sparse CSR tensor support is in beta state. If you miss a functionality in the sparse tensor support, please submit a feature request to https://github.com/pytorch/pytorch/issues. (Triggered internally at ..\aten\src\ATen\SparseCsrTensorImpl.cpp:55.)
    self.adj_csr = self.adj.to_sparse_csr().to(self.device)
[I 2026-04-30 07:38:28,230] Trial 14 finished with value: 0.791 and parameters: {'lr': 0.01, 'weight_decay': 0.05, 'n_hidden': 32, 'n_layer': 2, 'dropout': 0.015305141591561267, 'knn_mode': 'd', 'k': 45, 'dexp': 9.576049467794768, 'p_grd': 0.8745776507907911, 'unc_rem': 0.70189039053817, 'unc_rel': 0.9645685504300959}. Best is trial 7 with value: 0.825.
    [CPU] Loading amazoncom...
    DEBUG 3.1: Dataset init start
    DEBUG 3.2: prepare_data start amazoncom
    ----Data statistics------'
    Name: amazoncom
    #Nodes 13752
    #Edges 245861
    #Classes 10
    #Ave_degree 35.76
    ----Split statistics------'
    #Train samples 200 (20 nodes per class)
    #Val samples 500 (specified)
    #Test samples 1000 (specified)
    ----label noise information:------
    Instance dependent noise
    #Actual noise rate 0.13
    [cuda:0] LNPCC waiting for GPU slot...
    [cuda:0] Slot acquired (waited 1272.9s). Starting GCN...
    FINAL_RESULT: {'acc': {'train': 0.8769230769230769, 'valid': 0.712, 'test': 0.786}, 'wall_s': 39.47, 'cpu_s': 25.81, 'gpu_s': 13.6, 'wait_s': 1272.93}
    [Time] wall=39.5s | cpu=25.8s | gpu=13.6s
    C:\Users\fbrev\Documents\Acadêmico\Simulações\Python\NoisyGL\predictor\Base_Predictor.py:144: UserWarning: Sparse CSR tensor support is in beta state. If you miss a functionality in the sparse tensor support, please submit a feature request to https://github.com/pytorch/pytorch/issues. (Triggered internally at ..\aten\src\ATen\SparseCsrTensorImpl.cpp:55.)
    self.adj_csr = self.adj.to_sparse_csr().to(self.device)
[I 2026-04-30 08:00:25,601] Trial 15 finished with value: 0.786 and parameters: {'lr': 0.001, 'weight_decay': 0.0001, 'n_hidden': 256, 'n_layer': 3, 'dropout': 0.1413949432925266, 'knn_mode': 's', 'k': 24, 'dexp': 4.516243024639353, 'p_grd': 0.32708225210193276, 'unc_rem': 0.7231122828216123, 'unc_rel': 0.46595637793214884}. Best is trial 7 with value: 0.825.
    [CPU] Loading amazoncom...
    DEBUG 3.1: Dataset init start
    DEBUG 3.2: prepare_data start amazoncom
    ----Data statistics------'
    Name: amazoncom
    #Nodes 13752
    #Edges 245861
    #Classes 10
    #Ave_degree 35.76
    ----Split statistics------'
    #Train samples 200 (20 nodes per class)
    #Val samples 500 (specified)
    #Test samples 1000 (specified)
    ----label noise information:------
    Instance dependent noise
    #Actual noise rate 0.13
    [cuda:0] LNPCC waiting for GPU slot...
    [cuda:0] Slot acquired (waited 298.6s). Starting GCN...
    FINAL_RESULT: {'acc': {'train': 0.1116751269035533, 'valid': 0.332, 'test': 0.382}, 'wall_s': 39.73, 'cpu_s': 25.94, 'gpu_s': 13.71, 'wait_s': 298.57}
    [Time] wall=39.7s | cpu=25.9s | gpu=13.7s
    C:\Users\fbrev\Documents\Acadêmico\Simulações\Python\NoisyGL\predictor\Base_Predictor.py:144: UserWarning: Sparse CSR tensor support is in beta state. If you miss a functionality in the sparse tensor support, please submit a feature request to https://github.com/pytorch/pytorch/issues. (Triggered internally at ..\aten\src\ATen\SparseCsrTensorImpl.cpp:55.)
    self.adj_csr = self.adj.to_sparse_csr().to(self.device)
[I 2026-04-30 08:06:08,929] Trial 16 finished with value: 0.382 and parameters: {'lr': 0.1, 'weight_decay': 0.001, 'n_hidden': 256, 'n_layer': 3, 'dropout': 0.18354570559166064, 'knn_mode': 's', 'k': 9, 'dexp': 8.051723414079143, 'p_grd': 0.6333930865364665, 'unc_rem': 0.7421993538209207, 'unc_rel': 0.802445782297044}. Best is trial 7 with value: 0.825.
    [CPU] Loading amazoncom...
    DEBUG 3.1: Dataset init start
    DEBUG 3.2: prepare_data start amazoncom
    ----Data statistics------'
    Name: amazoncom
    #Nodes 13752
    #Edges 245861
    #Classes 10
    #Ave_degree 35.76
    ----Split statistics------'
    #Train samples 200 (20 nodes per class)
    #Val samples 500 (specified)
    #Test samples 1000 (specified)
    ----label noise information:------
    Instance dependent noise
    #Actual noise rate 0.13
    [cuda:0] LNPCC waiting for GPU slot...
    [cuda:0] Slot acquired (waited 486.9s). Starting GCN...
    FINAL_RESULT: {'acc': {'train': 0.11616161616161616, 'valid': 0.33, 'test': 0.382}, 'wall_s': 40.06, 'cpu_s': 26.38, 'gpu_s': 13.62, 'wait_s': 486.91}
    [Time] wall=40.1s | cpu=26.4s | gpu=13.6s
    C:\Users\fbrev\Documents\Acadêmico\Simulações\Python\NoisyGL\predictor\Base_Predictor.py:144: UserWarning: Sparse CSR tensor support is in beta state. If you miss a functionality in the sparse tensor support, please submit a feature request to https://github.com/pytorch/pytorch/issues. (Triggered internally at ..\aten\src\ATen\SparseCsrTensorImpl.cpp:55.)
    self.adj_csr = self.adj.to_sparse_csr().to(self.device)
[I 2026-04-30 08:15:00,868] Trial 17 finished with value: 0.382 and parameters: {'lr': 0.05, 'weight_decay': 0.0, 'n_hidden': 256, 'n_layer': 3, 'dropout': 0.3641807986019758, 'knn_mode': 's', 'k': 49, 'dexp': 9.328383348297663, 'p_grd': 0.4182111015332727, 'unc_rem': 0.8642837879141492, 'unc_rel': 0.5757757652553932}. Best is trial 7 with value: 0.825.
    [CPU] Loading amazoncom...
    DEBUG 3.1: Dataset init start
    DEBUG 3.2: prepare_data start amazoncom
    ----Data statistics------'
    Name: amazoncom
    #Nodes 13752
    #Edges 245861
    #Classes 10
    #Ave_degree 35.76
    ----Split statistics------'
    #Train samples 200 (20 nodes per class)
    #Val samples 500 (specified)
    #Test samples 1000 (specified)
    ----label noise information:------
    Instance dependent noise
    #Actual noise rate 0.13
    [cuda:0] LNPCC waiting for GPU slot...
    [cuda:0] Slot acquired (waited 161.3s). Starting GCN...
    FINAL_RESULT: {'acc': {'train': 0.5329949238578681, 'valid': 0.532, 'test': 0.647}, 'wall_s': 31.41, 'cpu_s': 26.57, 'gpu_s': 4.78, 'wait_s': 161.26}
    [Time] wall=31.4s | cpu=26.6s | gpu=4.8s
    C:\Users\fbrev\Documents\Acadêmico\Simulações\Python\NoisyGL\predictor\Base_Predictor.py:144: UserWarning: Sparse CSR tensor support is in beta state. If you miss a functionality in the sparse tensor support, please submit a feature request to https://github.com/pytorch/pytorch/issues. (Triggered internally at ..\aten\src\ATen\SparseCsrTensorImpl.cpp:55.)
    self.adj_csr = self.adj.to_sparse_csr().to(self.device)
[I 2026-04-30 08:18:18,913] Trial 18 finished with value: 0.647 and parameters: {'lr': 0.05, 'weight_decay': 0.001, 'n_hidden': 64, 'n_layer': 3, 'dropout': 0.3219522623358499, 'knn_mode': 's', 'k': 22, 'dexp': 8.185841291407987, 'p_grd': 0.5114974534354224, 'unc_rem': 0.9861340676429743, 'unc_rel': 0.6712317219587044}. Best is trial 7 with value: 0.825.
    [CPU] Loading amazoncom...
    DEBUG 3.1: Dataset init start
    DEBUG 3.2: prepare_data start amazoncom
    ----Data statistics------'
    Name: amazoncom
    #Nodes 13752
    #Edges 245861
    #Classes 10
    #Ave_degree 35.76
    ----Split statistics------'
    #Train samples 200 (20 nodes per class)
    #Val samples 500 (specified)
    #Test samples 1000 (specified)
    ----label noise information:------
    Instance dependent noise
    #Actual noise rate 0.13
    [cuda:0] LNPCC waiting for GPU slot...
    [cuda:0] Slot acquired (waited 494.2s). Starting GCN...
    FINAL_RESULT: {'acc': {'train': 0.9685863874345549, 'valid': 0.666, 'test': 0.738}, 'wall_s': 27.79, 'cpu_s': 23.21, 'gpu_s': 4.51, 'wait_s': 494.19}
    [Time] wall=27.8s | cpu=23.2s | gpu=4.5s
    C:\Users\fbrev\Documents\Acadêmico\Simulações\Python\NoisyGL\predictor\Base_Predictor.py:144: UserWarning: Sparse CSR tensor support is in beta state. If you miss a functionality in the sparse tensor support, please submit a feature request to https://github.com/pytorch/pytorch/issues. (Triggered internally at ..\aten\src\ATen\SparseCsrTensorImpl.cpp:55.)
    self.adj_csr = self.adj.to_sparse_csr().to(self.device)
[I 2026-04-30 08:27:06,081] Trial 19 finished with value: 0.738 and parameters: {'lr': 0.001, 'weight_decay': 0.01, 'n_hidden': 128, 'n_layer': 2, 'dropout': 0.01692334190834286, 'knn_mode': 's', 'k': 12, 'dexp': 3.6597216058079924, 'p_grd': 0.22569094730999384, 'unc_rem': 0.29670909959681613, 'unc_rel': 0.3212860590798803}. Best is trial 7 with value: 0.825.
    [CPU] Loading amazoncom...
    DEBUG 3.1: Dataset init start
    DEBUG 3.2: prepare_data start amazoncom
    ----Data statistics------'
    Name: amazoncom
    #Nodes 13752
    #Edges 245861
    #Classes 10
    #Ave_degree 35.76
    ----Split statistics------'
    #Train samples 200 (20 nodes per class)
    #Val samples 500 (specified)
    #Test samples 1000 (specified)
    ----label noise information:------
    Instance dependent noise
    #Actual noise rate 0.13
    [cuda:0] LNPCC waiting for GPU slot...
    [cuda:0] Slot acquired (waited 161.5s). Starting GCN...
    FINAL_RESULT: {'acc': {'train': 0.8670212765957447, 'valid': 0.728, 'test': 0.816}, 'wall_s': 29.38, 'cpu_s': 26.19, 'gpu_s': 3.13, 'wait_s': 161.49}
    [Time] wall=29.4s | cpu=26.2s | gpu=3.1s
    C:\Users\fbrev\Documents\Acadêmico\Simulações\Python\NoisyGL\predictor\Base_Predictor.py:144: UserWarning: Sparse CSR tensor support is in beta state. If you miss a functionality in the sparse tensor support, please submit a feature request to https://github.com/pytorch/pytorch/issues. (Triggered internally at ..\aten\src\ATen\SparseCsrTensorImpl.cpp:55.)
    self.adj_csr = self.adj.to_sparse_csr().to(self.device)
[I 2026-04-30 08:30:22,058] Trial 20 finished with value: 0.816 and parameters: {'lr': 0.005, 'weight_decay': 0.001, 'n_hidden': 64, 'n_layer': 2, 'dropout': 0.6221492931231439, 'knn_mode': 'd', 'k': 32, 'dexp': 5.915453282004435, 'p_grd': 0.06257668384106913, 'unc_rem': 0.5474493293154991, 'unc_rel': 0.1102231922797901}. Best is trial 7 with value: 0.825.
    [CPU] Loading amazoncom...
    DEBUG 3.1: Dataset init start
    DEBUG 3.2: prepare_data start amazoncom
    ----Data statistics------'
    Name: amazoncom
    #Nodes 13752
    #Edges 245861
    #Classes 10
    #Ave_degree 35.76
    ----Split statistics------'
    #Train samples 200 (20 nodes per class)
    #Val samples 500 (specified)
    #Test samples 1000 (specified)
    ----label noise information:------
    Instance dependent noise
    #Actual noise rate 0.13
    [cuda:0] LNPCC waiting for GPU slot...
    [cuda:0] Slot acquired (waited 304.5s). Starting GCN...
    FINAL_RESULT: {'acc': {'train': 0.972972972972973, 'valid': 0.514, 'test': 0.572}, 'wall_s': 29.25, 'cpu_s': 26.06, 'gpu_s': 3.12, 'wait_s': 304.48}
    [Time] wall=29.3s | cpu=26.1s | gpu=3.1s
    C:\Users\fbrev\Documents\Acadêmico\Simulações\Python\NoisyGL\predictor\Base_Predictor.py:144: UserWarning: Sparse CSR tensor support is in beta state. If you miss a functionality in the sparse tensor support, please submit a feature request to https://github.com/pytorch/pytorch/issues. (Triggered internally at ..\aten\src\ATen\SparseCsrTensorImpl.cpp:55.)
    self.adj_csr = self.adj.to_sparse_csr().to(self.device)
[I 2026-04-30 08:36:01,010] Trial 21 finished with value: 0.572 and parameters: {'lr': 0.005, 'weight_decay': 0.001, 'n_hidden': 64, 'n_layer': 2, 'dropout': 0.6190390920920961, 'knn_mode': 'd', 'k': 33, 'dexp': 5.84893420904292, 'p_grd': 0.03391898055034277, 'unc_rem': 0.027873114592523812, 'unc_rel': 0.04342516401129001}. Best is trial 7 with value: 0.825.
    [CPU] Loading amazoncom...
    DEBUG 3.1: Dataset init start
    DEBUG 3.2: prepare_data start amazoncom
    ----Data statistics------'
    Name: amazoncom
    #Nodes 13752
    #Edges 245861
    #Classes 10
    #Ave_degree 35.76
    ----Split statistics------'
    #Train samples 200 (20 nodes per class)
    #Val samples 500 (specified)
    #Test samples 1000 (specified)
    ----label noise information:------
    Instance dependent noise
    #Actual noise rate 0.13
    [cuda:0] LNPCC waiting for GPU slot...
    [cuda:0] Slot acquired (waited 485.2s). Starting GCN...
    FINAL_RESULT: {'acc': {'train': 0.9368421052631579, 'valid': 0.692, 'test': 0.776}, 'wall_s': 34.77, 'cpu_s': 31.61, 'gpu_s': 3.1, 'wait_s': 485.25}
    [Time] wall=34.8s | cpu=31.6s | gpu=3.1s
    C:\Users\fbrev\Documents\Acadêmico\Simulações\Python\NoisyGL\predictor\Base_Predictor.py:144: UserWarning: Sparse CSR tensor support is in beta state. If you miss a functionality in the sparse tensor support, please submit a feature request to https://github.com/pytorch/pytorch/issues. (Triggered internally at ..\aten\src\ATen\SparseCsrTensorImpl.cpp:55.)
    self.adj_csr = self.adj.to_sparse_csr().to(self.device)
[I 2026-04-30 08:44:46,306] Trial 22 finished with value: 0.776 and parameters: {'lr': 0.005, 'weight_decay': 0.001, 'n_hidden': 64, 'n_layer': 2, 'dropout': 0.5952208080744661, 'knn_mode': 'd', 'k': 37, 'dexp': 6.856780440221188, 'p_grd': 0.10420589630225528, 'unc_rem': 0.582770587582198, 'unc_rel': 0.12304840502068276}. Best is trial 7 with value: 0.825.
    [CPU] Loading amazoncom...
    DEBUG 3.1: Dataset init start
    DEBUG 3.2: prepare_data start amazoncom
    ----Data statistics------'
    Name: amazoncom
    #Nodes 13752
    #Edges 245861
    #Classes 10
    #Ave_degree 35.76
    ----Split statistics------'
    #Train samples 200 (20 nodes per class)
    #Val samples 500 (specified)
    #Test samples 1000 (specified)
    ----label noise information:------
    Instance dependent noise
    #Actual noise rate 0.13
    [cuda:0] LNPCC waiting for GPU slot...
    [cuda:0] Slot acquired (waited 103.8s). Starting GCN...
    FINAL_RESULT: {'acc': {'train': 0.9719101123595506, 'valid': 0.698, 'test': 0.795}, 'wall_s': 33.29, 'cpu_s': 30.29, 'gpu_s': 2.93, 'wait_s': 103.77}
    [Time] wall=33.3s | cpu=30.3s | gpu=2.9s
    C:\Users\fbrev\Documents\Acadêmico\Simulações\Python\NoisyGL\predictor\Base_Predictor.py:144: UserWarning: Sparse CSR tensor support is in beta state. If you miss a functionality in the sparse tensor support, please submit a feature request to https://github.com/pytorch/pytorch/issues. (Triggered internally at ..\aten\src\ATen\SparseCsrTensorImpl.cpp:55.)
    self.adj_csr = self.adj.to_sparse_csr().to(self.device)
[I 2026-04-30 08:47:08,395] Trial 23 finished with value: 0.795 and parameters: {'lr': 0.005, 'weight_decay': 0.001, 'n_hidden': 64, 'n_layer': 2, 'dropout': 0.42830263476793856, 'knn_mode': 'd', 'k': 50, 'dexp': 5.238473355409606, 'p_grd': 0.1259561229810388, 'unc_rem': 0.42900425147138077, 'unc_rel': 0.004802174539642545}. Best is trial 7 with value: 0.825.
    [CPU] Loading amazoncom...
    DEBUG 3.1: Dataset init start
    DEBUG 3.2: prepare_data start amazoncom
    ----Data statistics------'
    Name: amazoncom
    #Nodes 13752
    #Edges 245861
    #Classes 10
    #Ave_degree 35.76
    ----Split statistics------'
    #Train samples 200 (20 nodes per class)
    #Val samples 500 (specified)
    #Test samples 1000 (specified)
    ----label noise information:------
    Instance dependent noise
    #Actual noise rate 0.13
    [cuda:0] LNPCC waiting for GPU slot...
    [cuda:0] Slot acquired (waited 700.4s). Starting GCN...
    FINAL_RESULT: {'acc': {'train': 0.775, 'valid': 0.716, 'test': 0.82}, 'wall_s': 41.5, 'cpu_s': 38.27, 'gpu_s': 3.17, 'wait_s': 700.45}
    [Time] wall=41.5s | cpu=38.3s | gpu=3.2s
    C:\Users\fbrev\Documents\Acadêmico\Simulações\Python\NoisyGL\predictor\Base_Predictor.py:144: UserWarning: Sparse CSR tensor support is in beta state. If you miss a functionality in the sparse tensor support, please submit a feature request to https://github.com/pytorch/pytorch/issues. (Triggered internally at ..\aten\src\ATen\SparseCsrTensorImpl.cpp:55.)
    self.adj_csr = self.adj.to_sparse_csr().to(self.device)
[I 2026-04-30 08:59:35,441] Trial 24 finished with value: 0.82 and parameters: {'lr': 0.005, 'weight_decay': 0.001, 'n_hidden': 64, 'n_layer': 2, 'dropout': 0.60188950037512, 'knn_mode': 'd', 'k': 31, 'dexp': 7.30636396597662, 'p_grd': 0.5769025909539, 'unc_rem': 0.5479542171577838, 'unc_rel': 0.4434734544845115}. Best is trial 7 with value: 0.825.
    [CPU] Loading amazoncom...
    DEBUG 3.1: Dataset init start
    DEBUG 3.2: prepare_data start amazoncom
    ----Data statistics------'
    Name: amazoncom
    #Nodes 13752
    #Edges 245861
    #Classes 10
    #Ave_degree 35.76
    ----Split statistics------'
    #Train samples 200 (20 nodes per class)
    #Val samples 500 (specified)
    #Test samples 1000 (specified)
    ----label noise information:------
    Instance dependent noise
    #Actual noise rate 0.13
    [cuda:0] LNPCC waiting for GPU slot...
    [cuda:0] Slot acquired (waited 1070.7s). Starting GCN...
    FINAL_RESULT: {'acc': {'train': 0.845, 'valid': 0.714, 'test': 0.818}, 'wall_s': 41.18, 'cpu_s': 38.11, 'gpu_s': 2.99, 'wait_s': 1070.74}
    [Time] wall=41.2s | cpu=38.1s | gpu=3.0s
    C:\Users\fbrev\Documents\Acadêmico\Simulações\Python\NoisyGL\predictor\Base_Predictor.py:144: UserWarning: Sparse CSR tensor support is in beta state. If you miss a functionality in the sparse tensor support, please submit a feature request to https://github.com/pytorch/pytorch/issues. (Triggered internally at ..\aten\src\ATen\SparseCsrTensorImpl.cpp:55.)
    self.adj_csr = self.adj.to_sparse_csr().to(self.device)
[I 2026-04-30 09:18:12,710] Trial 25 finished with value: 0.818 and parameters: {'lr': 0.005, 'weight_decay': 0.001, 'n_hidden': 64, 'n_layer': 2, 'dropout': 0.61610644374489, 'knn_mode': 'd', 'k': 29, 'dexp': 5.962094062887619, 'p_grd': 0.5662828124953205, 'unc_rem': 0.574588806761898, 'unc_rel': 0.15303149946029165}. Best is trial 7 with value: 0.825.
    [CPU] Loading amazoncom...
    DEBUG 3.1: Dataset init start
    DEBUG 3.2: prepare_data start amazoncom
    ----Data statistics------'
    Name: amazoncom
    #Nodes 13752
    #Edges 245861
    #Classes 10
    #Ave_degree 35.76
    ----Split statistics------'
    #Train samples 200 (20 nodes per class)
    #Val samples 500 (specified)
    #Test samples 1000 (specified)
    ----label noise information:------
    Instance dependent noise
    #Actual noise rate 0.13
    [cuda:0] LNPCC waiting for GPU slot...
    [cuda:0] Slot acquired (waited 1096.1s). Starting GCN...
    FINAL_RESULT: {'acc': {'train': 0.8, 'valid': 0.704, 'test': 0.81}, 'wall_s': 43.05, 'cpu_s': 39.35, 'gpu_s': 3.63, 'wait_s': 1096.06}
    [Time] wall=43.1s | cpu=39.4s | gpu=3.6s
    C:\Users\fbrev\Documents\Acadêmico\Simulações\Python\NoisyGL\predictor\Base_Predictor.py:144: UserWarning: Sparse CSR tensor support is in beta state. If you miss a functionality in the sparse tensor support, please submit a feature request to https://github.com/pytorch/pytorch/issues. (Triggered internally at ..\aten\src\ATen\SparseCsrTensorImpl.cpp:55.)
    self.adj_csr = self.adj.to_sparse_csr().to(self.device)
[I 2026-04-30 09:37:17,422] Trial 26 finished with value: 0.81 and parameters: {'lr': 0.005, 'weight_decay': 0.001, 'n_hidden': 64, 'n_layer': 2, 'dropout': 0.5641428252007726, 'knn_mode': 'd', 'k': 28, 'dexp': 7.508557390493493, 'p_grd': 0.5760078196247049, 'unc_rem': 0.36425326654057877, 'unc_rel': 0.16745858569249955}. Best is trial 7 with value: 0.825.
    [CPU] Loading amazoncom...
    DEBUG 3.1: Dataset init start
    DEBUG 3.2: prepare_data start amazoncom
    ----Data statistics------'
    Name: amazoncom
    #Nodes 13752
    #Edges 245861
    #Classes 10
    #Ave_degree 35.76
    ----Split statistics------'
    #Train samples 200 (20 nodes per class)
    #Val samples 500 (specified)
    #Test samples 1000 (specified)
    ----label noise information:------
    Instance dependent noise
    #Actual noise rate 0.13
    [cuda:0] LNPCC waiting for GPU slot...
    [cuda:0] Slot acquired (waited 312.2s). Starting GCN...
    FINAL_RESULT: {'acc': {'train': 0.765, 'valid': 0.712, 'test': 0.817}, 'wall_s': 44.6, 'cpu_s': 41.14, 'gpu_s': 3.38, 'wait_s': 312.21}
    [Time] wall=44.6s | cpu=41.1s | gpu=3.4s
    C:\Users\fbrev\Documents\Acadêmico\Simulações\Python\NoisyGL\predictor\Base_Predictor.py:144: UserWarning: Sparse CSR tensor support is in beta state. If you miss a functionality in the sparse tensor support, please submit a feature request to https://github.com/pytorch/pytorch/issues. (Triggered internally at ..\aten\src\ATen\SparseCsrTensorImpl.cpp:55.)
    self.adj_csr = self.adj.to_sparse_csr().to(self.device)
