[worker] START lnpcc_amazonpho_0.2 gpu=0
[HPO] Starting Phase 1 (Optuna) for lnpcc_amazonpho_instance_0.2...
[I 2026-05-01 20:04:25,339] A new study created in RDB with name: lnpcc_amazonpho_instance_0.2
    [CPU] Loading amazonpho...
    DEBUG 3.1: Dataset init start
    DEBUG 3.2: prepare_data start amazonpho
    ----Data statistics------'
    Name: amazonpho
    #Nodes 7650
    #Edges 119081
    #Classes 8
    #Ave_degree 31.13
    ----Split statistics------'
    #Train samples 160 (20 nodes per class)
    #Val samples 500 (specified)
    #Test samples 1000 (specified)
    ----label noise information:------
    Instance dependent noise
    #Actual noise rate 0.21
    [cuda:0] LNPCC waiting for GPU slot...
    [cuda:0] Slot acquired (waited 137.8s). Starting GCN...
    FINAL_RESULT: {'acc': {'train': 0.7643312101910829, 'valid': 0.718, 'test': 0.883}, 'wall_s': 21.51, 'cpu_s': 13.45, 'gpu_s': 8.02, 'wait_s': 137.82}
    [Time] wall=21.5s | cpu=13.5s | gpu=8.0s
    C:\Users\fbrev\Documents\Acadêmico\Simulações\Python\NoisyGL\predictor\Base_Predictor.py:114: UserWarning: expandable_segments not supported on this platform (Triggered internally at ..\c10/cuda/CUDAAllocatorConfig.h:28.)
    self.edge_index = self._cpu_edge_index.to(self.device)
    C:\Users\fbrev\Documents\Acadêmico\Simulações\Python\NoisyGL\predictor\Base_Predictor.py:144: UserWarning: Sparse CSR tensor support is in beta state. If you miss a functionality in the sparse tensor support, please submit a feature request to https://github.com/pytorch/pytorch/issues. (Triggered internally at ..\aten\src\ATen\SparseCsrTensorImpl.cpp:55.)
    self.adj_csr = self.adj.to_sparse_csr().to(self.device)
[I 2026-05-01 20:07:09,975] Trial 0 finished with value: 0.883 and parameters: {'lr': 0.01, 'weight_decay': 0.0001, 'n_hidden': 256, 'n_layer': 3, 'dropout': 0.7423310186926412, 'knn_mode': 's', 'k': 22, 'dexp': 6.549043457768621, 'p_grd': 0.660643336056814, 'unc_rem': 0.4738128842759197, 'unc_rel': 0.5330175031465186}. Best is trial 0 with value: 0.883.
    [CPU] Loading amazonpho...
    DEBUG 3.1: Dataset init start
    DEBUG 3.2: prepare_data start amazonpho
    ----Data statistics------'
    Name: amazonpho
    #Nodes 7650
    #Edges 119081
    #Classes 8
    #Ave_degree 31.13
    ----Split statistics------'
    #Train samples 160 (20 nodes per class)
    #Val samples 500 (specified)
    #Test samples 1000 (specified)
    ----label noise information:------
    Instance dependent noise
    #Actual noise rate 0.21
    [cuda:0] LNPCC waiting for GPU slot...
    [cuda:0] Slot acquired (waited 121.6s). Starting GCN...
    FINAL_RESULT: {'acc': {'train': 0.7875, 'valid': 0.72, 'test': 0.896}, 'wall_s': 16.39, 'cpu_s': 13.32, 'gpu_s': 3.03, 'wait_s': 121.64}
    [Time] wall=16.4s | cpu=13.3s | gpu=3.0s
    C:\Users\fbrev\Documents\Acadêmico\Simulações\Python\NoisyGL\predictor\Base_Predictor.py:114: UserWarning: expandable_segments not supported on this platform (Triggered internally at ..\c10/cuda/CUDAAllocatorConfig.h:28.)
    self.edge_index = self._cpu_edge_index.to(self.device)
    C:\Users\fbrev\Documents\Acadêmico\Simulações\Python\NoisyGL\predictor\Base_Predictor.py:144: UserWarning: Sparse CSR tensor support is in beta state. If you miss a functionality in the sparse tensor support, please submit a feature request to https://github.com/pytorch/pytorch/issues. (Triggered internally at ..\aten\src\ATen\SparseCsrTensorImpl.cpp:55.)
    self.adj_csr = self.adj.to_sparse_csr().to(self.device)
[I 2026-05-01 20:09:33,434] Trial 1 finished with value: 0.896 and parameters: {'lr': 0.005, 'weight_decay': 0.05, 'n_hidden': 32, 'n_layer': 3, 'dropout': 0.07015571555985166, 'knn_mode': 'd', 'k': 8, 'dexp': 9.849369470845739, 'p_grd': 0.478806786720841, 'unc_rem': 0.3038151952343754, 'unc_rel': 0.3631246362119436}. Best is trial 1 with value: 0.896.
    [CPU] Loading amazonpho...
    DEBUG 3.1: Dataset init start
    DEBUG 3.2: prepare_data start amazonpho
    ----Data statistics------'
    Name: amazonpho
    #Nodes 7650
    #Edges 119081
    #Classes 8
    #Ave_degree 31.13
    ----Split statistics------'
    #Train samples 160 (20 nodes per class)
    #Val samples 500 (specified)
    #Test samples 1000 (specified)
    ----label noise information:------
    Instance dependent noise
    #Actual noise rate 0.21
    [cuda:0] LNPCC waiting for GPU slot...
    [cuda:0] Slot acquired (waited 398.8s). Starting GCN...
    FINAL_RESULT: {'acc': {'train': 0.10897435897435898, 'valid': 0.252, 'test': 0.237}, 'wall_s': 55.76, 'cpu_s': 50.6, 'gpu_s': 5.12, 'wait_s': 398.8}
    [Time] wall=55.8s | cpu=50.6s | gpu=5.1s
    C:\Users\fbrev\Documents\Acadêmico\Simulações\Python\NoisyGL\predictor\Base_Predictor.py:114: UserWarning: expandable_segments not supported on this platform (Triggered internally at ..\c10/cuda/CUDAAllocatorConfig.h:28.)
    self.edge_index = self._cpu_edge_index.to(self.device)
    C:\Users\fbrev\Documents\Acadêmico\Simulações\Python\NoisyGL\predictor\Base_Predictor.py:144: UserWarning: Sparse CSR tensor support is in beta state. If you miss a functionality in the sparse tensor support, please submit a feature request to https://github.com/pytorch/pytorch/issues. (Triggered internally at ..\aten\src\ATen\SparseCsrTensorImpl.cpp:55.)
    self.adj_csr = self.adj.to_sparse_csr().to(self.device)
[I 2026-05-01 20:17:13,577] Trial 2 finished with value: 0.237 and parameters: {'lr': 0.05, 'weight_decay': 0.0, 'n_hidden': 128, 'n_layer': 3, 'dropout': 0.21625436690386757, 'knn_mode': 'd', 'k': 38, 'dexp': 3.874471529407347, 'p_grd': 0.9881400181698377, 'unc_rem': 0.9181621485275245, 'unc_rel': 0.9675166579372851}. Best is trial 1 with value: 0.896.
    [CPU] Loading amazonpho...
    DEBUG 3.1: Dataset init start
    DEBUG 3.2: prepare_data start amazonpho
    ----Data statistics------'
    Name: amazonpho
    #Nodes 7650
    #Edges 119081
    #Classes 8
    #Ave_degree 31.13
    ----Split statistics------'
    #Train samples 160 (20 nodes per class)
    #Val samples 500 (specified)
    #Test samples 1000 (specified)
    ----label noise information:------
    Instance dependent noise
    #Actual noise rate 0.21
    [cuda:0] LNPCC waiting for GPU slot...
    [cuda:0] Slot acquired (waited 270.9s). Starting GCN...
    FINAL_RESULT: {'acc': {'train': 0.7792207792207793, 'valid': 0.712, 'test': 0.882}, 'wall_s': 19.6, 'cpu_s': 11.44, 'gpu_s': 8.11, 'wait_s': 270.93}
    [Time] wall=19.6s | cpu=11.4s | gpu=8.1s
    C:\Users\fbrev\Documents\Acadêmico\Simulações\Python\NoisyGL\predictor\Base_Predictor.py:114: UserWarning: expandable_segments not supported on this platform (Triggered internally at ..\c10/cuda/CUDAAllocatorConfig.h:28.)
    self.edge_index = self._cpu_edge_index.to(self.device)
    C:\Users\fbrev\Documents\Acadêmico\Simulações\Python\NoisyGL\predictor\Base_Predictor.py:144: UserWarning: Sparse CSR tensor support is in beta state. If you miss a functionality in the sparse tensor support, please submit a feature request to https://github.com/pytorch/pytorch/issues. (Triggered internally at ..\aten\src\ATen\SparseCsrTensorImpl.cpp:55.)
    self.adj_csr = self.adj.to_sparse_csr().to(self.device)
[I 2026-05-01 20:22:09,629] Trial 3 finished with value: 0.882 and parameters: {'lr': 0.01, 'weight_decay': 0.0, 'n_hidden': 256, 'n_layer': 3, 'dropout': 0.7679730381544515, 'knn_mode': 's', 'k': 24, 'dexp': 8.3269203648727, 'p_grd': 0.2184998850946086, 'unc_rem': 0.1269280697305547, 'unc_rel': 0.24879210037068566}. Best is trial 1 with value: 0.896.
    [CPU] Loading amazonpho...
    DEBUG 3.1: Dataset init start
    DEBUG 3.2: prepare_data start amazonpho
    ----Data statistics------'
    Name: amazonpho
    #Nodes 7650
    #Edges 119081
    #Classes 8
    #Ave_degree 31.13
    ----Split statistics------'
    #Train samples 160 (20 nodes per class)
    #Val samples 500 (specified)
    #Test samples 1000 (specified)
    ----label noise information:------
    Instance dependent noise
    #Actual noise rate 0.21
    [cuda:0] LNPCC waiting for GPU slot...
    [cuda:0] Slot acquired (waited 597.9s). Starting GCN...
    FINAL_RESULT: {'acc': {'train': 0.8181818181818182, 'valid': 0.73, 'test': 0.892}, 'wall_s': 15.19, 'cpu_s': 11.96, 'gpu_s': 3.19, 'wait_s': 597.94}
    [Time] wall=15.2s | cpu=12.0s | gpu=3.2s
    C:\Users\fbrev\Documents\Acadêmico\Simulações\Python\NoisyGL\predictor\Base_Predictor.py:114: UserWarning: expandable_segments not supported on this platform (Triggered internally at ..\c10/cuda/CUDAAllocatorConfig.h:28.)
    self.edge_index = self._cpu_edge_index.to(self.device)
    C:\Users\fbrev\Documents\Acadêmico\Simulações\Python\NoisyGL\predictor\Base_Predictor.py:144: UserWarning: Sparse CSR tensor support is in beta state. If you miss a functionality in the sparse tensor support, please submit a feature request to https://github.com/pytorch/pytorch/issues. (Triggered internally at ..\aten\src\ATen\SparseCsrTensorImpl.cpp:55.)
    self.adj_csr = self.adj.to_sparse_csr().to(self.device)
[I 2026-05-01 20:32:28,114] Trial 4 finished with value: 0.892 and parameters: {'lr': 0.001, 'weight_decay': 0.01, 'n_hidden': 32, 'n_layer': 3, 'dropout': 0.7038458031184676, 'knn_mode': 's', 'k': 9, 'dexp': 2.686398662779987, 'p_grd': 0.260480876024059, 'unc_rem': 0.11716653894410789, 'unc_rel': 0.0855185384292958}. Best is trial 1 with value: 0.896.
    [CPU] Loading amazonpho...
    DEBUG 3.1: Dataset init start
    DEBUG 3.2: prepare_data start amazonpho
    ----Data statistics------'
    Name: amazonpho
    #Nodes 7650
    #Edges 119081
    #Classes 8
    #Ave_degree 31.13
    ----Split statistics------'
    #Train samples 160 (20 nodes per class)
    #Val samples 500 (specified)
    #Test samples 1000 (specified)
    ----label noise information:------
    Instance dependent noise
    #Actual noise rate 0.21
    [cuda:0] LNPCC waiting for GPU slot...
    [cuda:0] Slot acquired (waited 149.9s). Starting GCN...
    FINAL_RESULT: {'acc': {'train': 0.7692307692307693, 'valid': 0.73, 'test': 0.904}, 'wall_s': 22.0, 'cpu_s': 13.74, 'gpu_s': 8.22, 'wait_s': 149.9}
    [Time] wall=22.0s | cpu=13.7s | gpu=8.2s
    C:\Users\fbrev\Documents\Acadêmico\Simulações\Python\NoisyGL\predictor\Base_Predictor.py:114: UserWarning: expandable_segments not supported on this platform (Triggered internally at ..\c10/cuda/CUDAAllocatorConfig.h:28.)
    self.edge_index = self._cpu_edge_index.to(self.device)
    C:\Users\fbrev\Documents\Acadêmico\Simulações\Python\NoisyGL\predictor\Base_Predictor.py:144: UserWarning: Sparse CSR tensor support is in beta state. If you miss a functionality in the sparse tensor support, please submit a feature request to https://github.com/pytorch/pytorch/issues. (Triggered internally at ..\aten\src\ATen\SparseCsrTensorImpl.cpp:55.)
    self.adj_csr = self.adj.to_sparse_csr().to(self.device)
[I 2026-05-01 20:35:25,640] Trial 5 finished with value: 0.904 and parameters: {'lr': 0.005, 'weight_decay': 0.001, 'n_hidden': 256, 'n_layer': 3, 'dropout': 0.5081407678113709, 'knn_mode': 's', 'k': 6, 'dexp': 8.201233283460219, 'p_grd': 0.7144216630336351, 'unc_rem': 0.6840438102211569, 'unc_rel': 0.7616068797550649}. Best is trial 5 with value: 0.904.
    [CPU] Loading amazonpho...
    DEBUG 3.1: Dataset init start
    DEBUG 3.2: prepare_data start amazonpho
    ----Data statistics------'
    Name: amazonpho
    #Nodes 7650
    #Edges 119081
    #Classes 8
    #Ave_degree 31.13
    ----Split statistics------'
    #Train samples 160 (20 nodes per class)
    #Val samples 500 (specified)
    #Test samples 1000 (specified)
    ----label noise information:------
    Instance dependent noise
    #Actual noise rate 0.21
    [cuda:0] LNPCC waiting for GPU slot...
    [cuda:0] Slot acquired (waited 135.0s). Starting GCN...
    FINAL_RESULT: {'acc': {'train': 0.44666666666666666, 'valid': 0.296, 'test': 0.317}, 'wall_s': 17.43, 'cpu_s': 12.29, 'gpu_s': 5.11, 'wait_s': 135.04}
    [Time] wall=17.4s | cpu=12.3s | gpu=5.1s
    C:\Users\fbrev\Documents\Acadêmico\Simulações\Python\NoisyGL\predictor\Base_Predictor.py:114: UserWarning: expandable_segments not supported on this platform (Triggered internally at ..\c10/cuda/CUDAAllocatorConfig.h:28.)
    self.edge_index = self._cpu_edge_index.to(self.device)
    C:\Users\fbrev\Documents\Acadêmico\Simulações\Python\NoisyGL\predictor\Base_Predictor.py:144: UserWarning: Sparse CSR tensor support is in beta state. If you miss a functionality in the sparse tensor support, please submit a feature request to https://github.com/pytorch/pytorch/issues. (Triggered internally at ..\aten\src\ATen\SparseCsrTensorImpl.cpp:55.)
    self.adj_csr = self.adj.to_sparse_csr().to(self.device)
[I 2026-05-01 20:38:03,640] Trial 6 finished with value: 0.317 and parameters: {'lr': 0.05, 'weight_decay': 0.001, 'n_hidden': 128, 'n_layer': 3, 'dropout': 0.7020473327625294, 'knn_mode': 'd', 'k': 15, 'dexp': 0.5878486504011348, 'p_grd': 0.011335731587640785, 'unc_rem': 0.5858998350477302, 'unc_rel': 0.7226749298158259}. Best is trial 5 with value: 0.904.
    [CPU] Loading amazonpho...
    DEBUG 3.1: Dataset init start
    DEBUG 3.2: prepare_data start amazonpho
    ----Data statistics------'
    Name: amazonpho
    #Nodes 7650
    #Edges 119081
    #Classes 8
    #Ave_degree 31.13
    ----Split statistics------'
    #Train samples 160 (20 nodes per class)
    #Val samples 500 (specified)
    #Test samples 1000 (specified)
    ----label noise information:------
    Instance dependent noise
    #Actual noise rate 0.21
    [cuda:0] LNPCC waiting for GPU slot...
    [cuda:0] Slot acquired (waited 130.4s). Starting GCN...
    FINAL_RESULT: {'acc': {'train': 0.7756410256410257, 'valid': 0.734, 'test': 0.889}, 'wall_s': 14.99, 'cpu_s': 12.45, 'gpu_s': 2.51, 'wait_s': 130.4}
    [Time] wall=15.0s | cpu=12.4s | gpu=2.5s
    C:\Users\fbrev\Documents\Acadêmico\Simulações\Python\NoisyGL\predictor\Base_Predictor.py:114: UserWarning: expandable_segments not supported on this platform (Triggered internally at ..\c10/cuda/CUDAAllocatorConfig.h:28.)
    self.edge_index = self._cpu_edge_index.to(self.device)
    C:\Users\fbrev\Documents\Acadêmico\Simulações\Python\NoisyGL\predictor\Base_Predictor.py:144: UserWarning: Sparse CSR tensor support is in beta state. If you miss a functionality in the sparse tensor support, please submit a feature request to https://github.com/pytorch/pytorch/issues. (Triggered internally at ..\aten\src\ATen\SparseCsrTensorImpl.cpp:55.)
    self.adj_csr = self.adj.to_sparse_csr().to(self.device)
[I 2026-05-01 20:40:34,696] Trial 7 finished with value: 0.889 and parameters: {'lr': 0.005, 'weight_decay': 0.001, 'n_hidden': 64, 'n_layer': 2, 'dropout': 0.6564195734694973, 'knn_mode': 's', 'k': 7, 'dexp': 7.467726416853233, 'p_grd': 0.32445350005580476, 'unc_rem': 0.16404940716158267, 'unc_rel': 0.28013196087250636}. Best is trial 5 with value: 0.904.
    [CPU] Loading amazonpho...
    DEBUG 3.1: Dataset init start
    DEBUG 3.2: prepare_data start amazonpho
    ----Data statistics------'
    Name: amazonpho
    #Nodes 7650
    #Edges 119081
    #Classes 8
    #Ave_degree 31.13
    ----Split statistics------'
    #Train samples 160 (20 nodes per class)
    #Val samples 500 (specified)
    #Test samples 1000 (specified)
    ----label noise information:------
    Instance dependent noise
    #Actual noise rate 0.21
    [cuda:0] LNPCC waiting for GPU slot...
    [cuda:0] Slot acquired (waited 280.5s). Starting GCN...
    FINAL_RESULT: {'acc': {'train': 0.75, 'valid': 0.732, 'test': 0.908}, 'wall_s': 26.68, 'cpu_s': 21.87, 'gpu_s': 4.76, 'wait_s': 280.51}
    [Time] wall=26.7s | cpu=21.9s | gpu=4.8s
    C:\Users\fbrev\Documents\Acadêmico\Simulações\Python\NoisyGL\predictor\Base_Predictor.py:114: UserWarning: expandable_segments not supported on this platform (Triggered internally at ..\c10/cuda/CUDAAllocatorConfig.h:28.)
    self.edge_index = self._cpu_edge_index.to(self.device)
    C:\Users\fbrev\Documents\Acadêmico\Simulações\Python\NoisyGL\predictor\Base_Predictor.py:144: UserWarning: Sparse CSR tensor support is in beta state. If you miss a functionality in the sparse tensor support, please submit a feature request to https://github.com/pytorch/pytorch/issues. (Triggered internally at ..\aten\src\ATen\SparseCsrTensorImpl.cpp:55.)
    self.adj_csr = self.adj.to_sparse_csr().to(self.device)
[I 2026-05-01 20:45:47,492] Trial 8 finished with value: 0.908 and parameters: {'lr': 0.01, 'weight_decay': 0.001, 'n_hidden': 256, 'n_layer': 2, 'dropout': 0.3294390530051932, 'knn_mode': 'd', 'k': 49, 'dexp': 9.06038712732777, 'p_grd': 0.8773552621619033, 'unc_rem': 0.897822936218505, 'unc_rel': 0.3722181582772752}. Best is trial 8 with value: 0.908.
    [CPU] Loading amazonpho...
    DEBUG 3.1: Dataset init start
    DEBUG 3.2: prepare_data start amazonpho
    ----Data statistics------'
    Name: amazonpho
    #Nodes 7650
    #Edges 119081
    #Classes 8
    #Ave_degree 31.13
    ----Split statistics------'
    #Train samples 160 (20 nodes per class)
    #Val samples 500 (specified)
    #Test samples 1000 (specified)
    ----label noise information:------
    Instance dependent noise
    #Actual noise rate 0.21
    [cuda:0] LNPCC waiting for GPU slot...
    [cuda:0] Slot acquired (waited 267.6s). Starting GCN...
[I 2026-05-01 20:50:39,346] Trial 9 finished with value: 0.0 and parameters: {'lr': 0.005, 'weight_decay': 0.05, 'n_hidden': 128, 'n_layer': 3, 'dropout': 0.773886541698701, 'knn_mode': 's', 'k': 18, 'dexp': 8.269728185343707, 'p_grd': 0.2593333173174225, 'unc_rem': 0.40038097716656995, 'unc_rel': 0.6395700032731858}. Best is trial 8 with value: 0.908.
    [CPU] Loading amazonpho...
    DEBUG 3.1: Dataset init start
    DEBUG 3.2: prepare_data start amazonpho
    ----Data statistics------'
    Name: amazonpho
    #Nodes 7650
    #Edges 119081
    #Classes 8
    #Ave_degree 31.13
    ----Split statistics------'
    #Train samples 160 (20 nodes per class)
    #Val samples 500 (specified)
    #Test samples 1000 (specified)
    ----label noise information:------
    Instance dependent noise
    #Actual noise rate 0.21
    [cuda:0] LNPCC waiting for GPU slot...
    [cuda:0] Slot acquired (waited 136.2s). Starting GCN...
    FINAL_RESULT: {'acc': {'train': 0.8343949044585988, 'valid': 0.726, 'test': 0.895}, 'wall_s': 15.32, 'cpu_s': 11.37, 'gpu_s': 3.9, 'wait_s': 136.17}
    [Time] wall=15.3s | cpu=11.4s | gpu=3.9s
    C:\Users\fbrev\Documents\Acadêmico\Simulações\Python\NoisyGL\predictor\Base_Predictor.py:114: UserWarning: expandable_segments not supported on this platform (Triggered internally at ..\c10/cuda/CUDAAllocatorConfig.h:28.)
    self.edge_index = self._cpu_edge_index.to(self.device)
    C:\Users\fbrev\Documents\Acadêmico\Simulações\Python\NoisyGL\predictor\Base_Predictor.py:144: UserWarning: Sparse CSR tensor support is in beta state. If you miss a functionality in the sparse tensor support, please submit a feature request to https://github.com/pytorch/pytorch/issues. (Triggered internally at ..\aten\src\ATen\SparseCsrTensorImpl.cpp:55.)
    self.adj_csr = self.adj.to_sparse_csr().to(self.device)
[I 2026-05-01 20:53:16,324] Trial 10 finished with value: 0.895 and parameters: {'lr': 0.001, 'weight_decay': 0.0001, 'n_hidden': 64, 'n_layer': 3, 'dropout': 0.5010717996397103, 'knn_mode': 's', 'k': 31, 'dexp': 8.74303814548153, 'p_grd': 0.20174722186804284, 'unc_rem': 0.7503910147836939, 'unc_rel': 0.2507056072345083}. Best is trial 8 with value: 0.908.
    [CPU] Loading amazonpho...
    DEBUG 3.1: Dataset init start
    DEBUG 3.2: prepare_data start amazonpho
    ----Data statistics------'
    Name: amazonpho
    #Nodes 7650
    #Edges 119081
    #Classes 8
    #Ave_degree 31.13
    ----Split statistics------'
    #Train samples 160 (20 nodes per class)
    #Val samples 500 (specified)
    #Test samples 1000 (specified)
    ----label noise information:------
    Instance dependent noise
    #Actual noise rate 0.21
    [cuda:0] LNPCC waiting for GPU slot...
    [cuda:0] Slot acquired (waited 123.5s). Starting GCN...
    FINAL_RESULT: {'acc': {'train': 0.76875, 'valid': 0.732, 'test': 0.9}, 'wall_s': 23.1, 'cpu_s': 20.27, 'gpu_s': 2.79, 'wait_s': 123.48}
    [Time] wall=23.1s | cpu=20.3s | gpu=2.8s
    C:\Users\fbrev\Documents\Acadêmico\Simulações\Python\NoisyGL\predictor\Base_Predictor.py:114: UserWarning: expandable_segments not supported on this platform (Triggered internally at ..\c10/cuda/CUDAAllocatorConfig.h:28.)
    self.edge_index = self._cpu_edge_index.to(self.device)
    C:\Users\fbrev\Documents\Acadêmico\Simulações\Python\NoisyGL\predictor\Base_Predictor.py:144: UserWarning: Sparse CSR tensor support is in beta state. If you miss a functionality in the sparse tensor support, please submit a feature request to https://github.com/pytorch/pytorch/issues. (Triggered internally at ..\aten\src\ATen\SparseCsrTensorImpl.cpp:55.)
    self.adj_csr = self.adj.to_sparse_csr().to(self.device)
