[I 2026-05-06 15:52:54,714] Trial 23 finished with value: 0.498 and parameters: {'lr': 0.001, 'weight_decay': 0.0, 'n_hidden': 128, 'n_layer': 3, 'dropout': 0.44503942173909034, 'knn_mode': 'd', 'k': 37, 'dexp': 5.238473355409606, 'p_grd': 0.11408577968829464, 'unc_rem': 0.5930954227306299, 'unc_rel': 0.8700381584946559}. Best is trial 2 with value: 0.542.
    [CPU] Loading pubmed...
    DEBUG 3.1: Dataset init start
    DEBUG 3.2: prepare_data start pubmed
    ----Data statistics------'
    Name: pubmed
    #Nodes 19717
    #Edges 44324
    #Classes 3
    #Ave_degree 4.50
    ----Split statistics------'
    #Train samples 60 (default)
    #Val samples 500 (default)
    #Test samples 1000 (default)
    ----label noise information:------
    Instance dependent noise
    #Actual noise rate 0.50
    [cuda:0] LNPCC waiting for GPU slot...
    [cuda:0] Slot acquired (waited 2.5s). Starting GCN...
    FINAL_RESULT: {'acc': {'train': 0.5964912280701754, 'valid': 0.314, 'test': 0.421}, 'wall_s': 27.66, 'cpu_s': 23.36, 'gpu_s': 4.26, 'wait_s': 2.49}
    [Time] wall=27.7s | cpu=23.4s | gpu=4.3s
    C:\Users\fbrev\Documents\Acadêmico\Simulações\Python\NoisyGL\predictor\Base_Predictor.py:114: UserWarning: expandable_segments not supported on this platform (Triggered internally at ..\c10/cuda/CUDAAllocatorConfig.h:28.)
    self.edge_index = self._cpu_edge_index.to(self.device)
    C:\Users\fbrev\Documents\Acadêmico\Simulações\Python\NoisyGL\predictor\Base_Predictor.py:144: UserWarning: Sparse CSR tensor support is in beta state. If you miss a functionality in the sparse tensor support, please submit a feature request to https://github.com/pytorch/pytorch/issues. (Triggered internally at ..\aten\src\ATen\SparseCsrTensorImpl.cpp:55.)
    self.adj_csr = self.adj.to_sparse_csr().to(self.device)
[I 2026-05-06 15:53:31,094] Trial 24 finished with value: 0.421 and parameters: {'lr': 0.001, 'weight_decay': 0.01, 'n_hidden': 128, 'n_layer': 3, 'dropout': 0.2660790586587927, 'knn_mode': 'd', 'k': 28, 'dexp': 4.984242937564272, 'p_grd': 0.13185070163288254, 'unc_rem': 0.41543512539238825, 'unc_rel': 0.05476782420765691}. Best is trial 2 with value: 0.542.
    [CPU] Loading pubmed...
    DEBUG 3.1: Dataset init start
    DEBUG 3.2: prepare_data start pubmed
    ----Data statistics------'
    Name: pubmed
    #Nodes 19717
    #Edges 44324
    #Classes 3
    #Ave_degree 4.50
    ----Split statistics------'
    #Train samples 60 (default)
    #Val samples 500 (default)
    #Test samples 1000 (default)
    ----label noise information:------
    Instance dependent noise
    #Actual noise rate 0.50
    [cuda:0] LNPCC waiting for GPU slot...
    [cuda:0] Slot acquired (waited 4.1s). Starting GCN...
    FINAL_RESULT: {'acc': {'train': 1.0, 'valid': 0.308, 'test': 0.366}, 'wall_s': 25.15, 'cpu_s': 21.12, 'gpu_s': 3.99, 'wait_s': 4.12}
    [Time] wall=25.2s | cpu=21.1s | gpu=4.0s
    C:\Users\fbrev\Documents\Acadêmico\Simulações\Python\NoisyGL\predictor\Base_Predictor.py:114: UserWarning: expandable_segments not supported on this platform (Triggered internally at ..\c10/cuda/CUDAAllocatorConfig.h:28.)
    self.edge_index = self._cpu_edge_index.to(self.device)
    C:\Users\fbrev\Documents\Acadêmico\Simulações\Python\NoisyGL\predictor\Base_Predictor.py:144: UserWarning: Sparse CSR tensor support is in beta state. If you miss a functionality in the sparse tensor support, please submit a feature request to https://github.com/pytorch/pytorch/issues. (Triggered internally at ..\aten\src\ATen\SparseCsrTensorImpl.cpp:55.)
    self.adj_csr = self.adj.to_sparse_csr().to(self.device)
[I 2026-05-06 15:54:06,468] Trial 25 finished with value: 0.366 and parameters: {'lr': 0.05, 'weight_decay': 0.0, 'n_hidden': 128, 'n_layer': 3, 'dropout': 0.5897882732590197, 'knn_mode': 'd', 'k': 38, 'dexp': 2.2666341797338783, 'p_grd': 0.011855201066919993, 'unc_rem': 0.9884548748414678, 'unc_rel': 0.9115903079403296}. Best is trial 2 with value: 0.542.
    [CPU] Loading pubmed...
    DEBUG 3.1: Dataset init start
    DEBUG 3.2: prepare_data start pubmed
    ----Data statistics------'
    Name: pubmed
    #Nodes 19717
    #Edges 44324
    #Classes 3
    #Ave_degree 4.50
    ----Split statistics------'
    #Train samples 60 (default)
    #Val samples 500 (default)
    #Test samples 1000 (default)
    ----label noise information:------
    Instance dependent noise
    #Actual noise rate 0.50
    [cuda:0] LNPCC waiting for GPU slot...
    [cuda:0] Slot acquired (waited 0.0s). Starting GCN...
    FINAL_RESULT: {'acc': {'train': 0.31666666666666665, 'valid': 0.394, 'test': 0.558}, 'wall_s': 32.56, 'cpu_s': 29.9, 'gpu_s': 2.62, 'wait_s': 0.0}
    [Time] wall=32.6s | cpu=29.9s | gpu=2.6s
    C:\Users\fbrev\Documents\Acadêmico\Simulações\Python\NoisyGL\predictor\Base_Predictor.py:114: UserWarning: expandable_segments not supported on this platform (Triggered internally at ..\c10/cuda/CUDAAllocatorConfig.h:28.)
    self.edge_index = self._cpu_edge_index.to(self.device)
    C:\Users\fbrev\Documents\Acadêmico\Simulações\Python\NoisyGL\predictor\Base_Predictor.py:144: UserWarning: Sparse CSR tensor support is in beta state. If you miss a functionality in the sparse tensor support, please submit a feature request to https://github.com/pytorch/pytorch/issues. (Triggered internally at ..\aten\src\ATen\SparseCsrTensorImpl.cpp:55.)
    self.adj_csr = self.adj.to_sparse_csr().to(self.device)
[I 2026-05-06 15:54:45,323] Trial 26 finished with value: 0.558 and parameters: {'lr': 0.001, 'weight_decay': 0.0, 'n_hidden': 32, 'n_layer': 3, 'dropout': 0.39862046125390294, 'knn_mode': 'd', 'k': 33, 'dexp': 3.9184906694250063, 'p_grd': 0.5955589533872729, 'unc_rem': 0.49157003810613775, 'unc_rel': 0.84517044862803}. Best is trial 26 with value: 0.558.
    [CPU] Loading pubmed...
    DEBUG 3.1: Dataset init start
    DEBUG 3.2: prepare_data start pubmed
    ----Data statistics------'
    Name: pubmed
    #Nodes 19717
    #Edges 44324
    #Classes 3
    #Ave_degree 4.50
    ----Split statistics------'
    #Train samples 60 (default)
    #Val samples 500 (default)
    #Test samples 1000 (default)
    ----label noise information:------
    Instance dependent noise
    #Actual noise rate 0.50
    [cuda:0] LNPCC waiting for GPU slot...
    [cuda:0] Slot acquired (waited 0.0s). Starting GCN...
    FINAL_RESULT: {'acc': {'train': 1.0, 'valid': 0.382, 'test': 0.381}, 'wall_s': 37.82, 'cpu_s': 33.92, 'gpu_s': 3.87, 'wait_s': 0.0}
    [Time] wall=37.8s | cpu=33.9s | gpu=3.9s
    C:\Users\fbrev\Documents\Acadêmico\Simulações\Python\NoisyGL\predictor\Base_Predictor.py:114: UserWarning: expandable_segments not supported on this platform (Triggered internally at ..\c10/cuda/CUDAAllocatorConfig.h:28.)
    self.edge_index = self._cpu_edge_index.to(self.device)
    C:\Users\fbrev\Documents\Acadêmico\Simulações\Python\NoisyGL\predictor\Base_Predictor.py:144: UserWarning: Sparse CSR tensor support is in beta state. If you miss a functionality in the sparse tensor support, please submit a feature request to https://github.com/pytorch/pytorch/issues. (Triggered internally at ..\aten\src\ATen\SparseCsrTensorImpl.cpp:55.)
    self.adj_csr = self.adj.to_sparse_csr().to(self.device)
[I 2026-05-06 15:55:29,490] Trial 27 finished with value: 0.381 and parameters: {'lr': 0.1, 'weight_decay': 0.0, 'n_hidden': 128, 'n_layer': 3, 'dropout': 0.4132022633949301, 'knn_mode': 'd', 'k': 32, 'dexp': 4.119086070787822, 'p_grd': 0.9979342410039846, 'unc_rem': 0.5064303514765175, 'unc_rel': 0.859722544480315}. Best is trial 26 with value: 0.558.
    [CPU] Loading pubmed...
    DEBUG 3.1: Dataset init start
    DEBUG 3.2: prepare_data start pubmed
    ----Data statistics------'
    Name: pubmed
    #Nodes 19717
    #Edges 44324
    #Classes 3
    #Ave_degree 4.50
    ----Split statistics------'
    #Train samples 60 (default)
    #Val samples 500 (default)
    #Test samples 1000 (default)
    ----label noise information:------
    Instance dependent noise
    #Actual noise rate 0.50
    [cuda:0] LNPCC waiting for GPU slot...
    [cuda:0] Slot acquired (waited 0.0s). Starting GCN...
    FINAL_RESULT: {'acc': {'train': 0.6666666666666666, 'valid': 0.364, 'test': 0.559}, 'wall_s': 39.14, 'cpu_s': 36.56, 'gpu_s': 2.55, 'wait_s': 0.0}
    [Time] wall=39.1s | cpu=36.6s | gpu=2.6s
    C:\Users\fbrev\Documents\Acadêmico\Simulações\Python\NoisyGL\predictor\Base_Predictor.py:114: UserWarning: expandable_segments not supported on this platform (Triggered internally at ..\c10/cuda/CUDAAllocatorConfig.h:28.)
    self.edge_index = self._cpu_edge_index.to(self.device)
    C:\Users\fbrev\Documents\Acadêmico\Simulações\Python\NoisyGL\predictor\Base_Predictor.py:144: UserWarning: Sparse CSR tensor support is in beta state. If you miss a functionality in the sparse tensor support, please submit a feature request to https://github.com/pytorch/pytorch/issues. (Triggered internally at ..\aten\src\ATen\SparseCsrTensorImpl.cpp:55.)
    self.adj_csr = self.adj.to_sparse_csr().to(self.device)
[I 2026-05-06 15:56:14,933] Trial 28 finished with value: 0.559 and parameters: {'lr': 0.05, 'weight_decay': 0.0, 'n_hidden': 32, 'n_layer': 3, 'dropout': 0.25243514888237106, 'knn_mode': 'd', 'k': 42, 'dexp': 5.19094722809456, 'p_grd': 0.7486598237251052, 'unc_rem': 0.4987628794470734, 'unc_rel': 0.995590676224451}. Best is trial 28 with value: 0.559.
    [CPU] Loading pubmed...
    DEBUG 3.1: Dataset init start
    DEBUG 3.2: prepare_data start pubmed
    ----Data statistics------'
    Name: pubmed
    #Nodes 19717
    #Edges 44324
    #Classes 3
    #Ave_degree 4.50
    ----Split statistics------'
    #Train samples 60 (default)
    #Val samples 500 (default)
    #Test samples 1000 (default)
    ----label noise information:------
    Instance dependent noise
    #Actual noise rate 0.50
    [cuda:0] LNPCC waiting for GPU slot...
    [cuda:0] Slot acquired (waited 0.0s). Starting GCN...
    FINAL_RESULT: {'acc': {'train': 0.6666666666666666, 'valid': 0.356, 'test': 0.541}, 'wall_s': 33.28, 'cpu_s': 30.33, 'gpu_s': 2.91, 'wait_s': 0.0}
    [Time] wall=33.3s | cpu=30.3s | gpu=2.9s
    C:\Users\fbrev\Documents\Acadêmico\Simulações\Python\NoisyGL\predictor\Base_Predictor.py:114: UserWarning: expandable_segments not supported on this platform (Triggered internally at ..\c10/cuda/CUDAAllocatorConfig.h:28.)
    self.edge_index = self._cpu_edge_index.to(self.device)
    C:\Users\fbrev\Documents\Acadêmico\Simulações\Python\NoisyGL\predictor\Base_Predictor.py:144: UserWarning: Sparse CSR tensor support is in beta state. If you miss a functionality in the sparse tensor support, please submit a feature request to https://github.com/pytorch/pytorch/issues. (Triggered internally at ..\aten\src\ATen\SparseCsrTensorImpl.cpp:55.)
    self.adj_csr = self.adj.to_sparse_csr().to(self.device)
[I 2026-05-06 15:56:54,789] Trial 29 finished with value: 0.541 and parameters: {'lr': 0.05, 'weight_decay': 0.0, 'n_hidden': 32, 'n_layer': 3, 'dropout': 0.3236880019539325, 'knn_mode': 'd', 'k': 42, 'dexp': 6.448901515689685, 'p_grd': 0.6145151899466981, 'unc_rem': 0.38503175162875547, 'unc_rel': 0.8232565222782968}. Best is trial 28 with value: 0.559.
    [CPU] Loading pubmed...
    DEBUG 3.1: Dataset init start
    DEBUG 3.2: prepare_data start pubmed
    ----Data statistics------'
    Name: pubmed
    #Nodes 19717
    #Edges 44324
    #Classes 3
    #Ave_degree 4.50
    ----Split statistics------'
    #Train samples 60 (default)
    #Val samples 500 (default)
    #Test samples 1000 (default)
    ----label noise information:------
    Instance dependent noise
    #Actual noise rate 0.50
    [cuda:0] LNPCC waiting for GPU slot...
    [cuda:0] Slot acquired (waited 1.5s). Starting GCN...
    FINAL_RESULT: {'acc': {'train': 1.0, 'valid': 0.368, 'test': 0.456}, 'wall_s': 37.58, 'cpu_s': 34.83, 'gpu_s': 2.7, 'wait_s': 1.48}
    [Time] wall=37.6s | cpu=34.8s | gpu=2.7s
    C:\Users\fbrev\Documents\Acadêmico\Simulações\Python\NoisyGL\predictor\Base_Predictor.py:114: UserWarning: expandable_segments not supported on this platform (Triggered internally at ..\c10/cuda/CUDAAllocatorConfig.h:28.)
    self.edge_index = self._cpu_edge_index.to(self.device)
    C:\Users\fbrev\Documents\Acadêmico\Simulações\Python\NoisyGL\predictor\Base_Predictor.py:144: UserWarning: Sparse CSR tensor support is in beta state. If you miss a functionality in the sparse tensor support, please submit a feature request to https://github.com/pytorch/pytorch/issues. (Triggered internally at ..\aten\src\ATen\SparseCsrTensorImpl.cpp:55.)
    self.adj_csr = self.adj.to_sparse_csr().to(self.device)
[I 2026-05-06 15:57:40,805] Trial 30 finished with value: 0.456 and parameters: {'lr': 0.05, 'weight_decay': 0.0, 'n_hidden': 32, 'n_layer': 3, 'dropout': 0.10933848727992124, 'knn_mode': 'd', 'k': 41, 'dexp': 5.892273006753207, 'p_grd': 0.71184677557319, 'unc_rem': 0.5005633434832256, 'unc_rel': 0.9995923741427939}. Best is trial 28 with value: 0.559.
    [CPU] Loading pubmed...
    DEBUG 3.1: Dataset init start
    DEBUG 3.2: prepare_data start pubmed
    ----Data statistics------'
    Name: pubmed
    #Nodes 19717
    #Edges 44324
    #Classes 3
    #Ave_degree 4.50
    ----Split statistics------'
    #Train samples 60 (default)
    #Val samples 500 (default)
    #Test samples 1000 (default)
    ----label noise information:------
    Instance dependent noise
    #Actual noise rate 0.50
    [cuda:0] LNPCC waiting for GPU slot...
    [cuda:0] Slot acquired (waited 0.0s). Starting GCN...
    FINAL_RESULT: {'acc': {'train': 0.6666666666666666, 'valid': 0.362, 'test': 0.547}, 'wall_s': 31.47, 'cpu_s': 28.85, 'gpu_s': 2.59, 'wait_s': 0.0}
    [Time] wall=31.5s | cpu=28.8s | gpu=2.6s
    C:\Users\fbrev\Documents\Acadêmico\Simulações\Python\NoisyGL\predictor\Base_Predictor.py:114: UserWarning: expandable_segments not supported on this platform (Triggered internally at ..\c10/cuda/CUDAAllocatorConfig.h:28.)
    self.edge_index = self._cpu_edge_index.to(self.device)
    C:\Users\fbrev\Documents\Acadêmico\Simulações\Python\NoisyGL\predictor\Base_Predictor.py:144: UserWarning: Sparse CSR tensor support is in beta state. If you miss a functionality in the sparse tensor support, please submit a feature request to https://github.com/pytorch/pytorch/issues. (Triggered internally at ..\aten\src\ATen\SparseCsrTensorImpl.cpp:55.)
    self.adj_csr = self.adj.to_sparse_csr().to(self.device)
[I 2026-05-06 15:58:18,622] Trial 31 finished with value: 0.547 and parameters: {'lr': 0.05, 'weight_decay': 0.0, 'n_hidden': 32, 'n_layer': 3, 'dropout': 0.3152713814487472, 'knn_mode': 'd', 'k': 44, 'dexp': 6.341676383017585, 'p_grd': 0.6006909801179253, 'unc_rem': 0.40098131513000285, 'unc_rel': 0.835624696224292}. Best is trial 28 with value: 0.559.
    [CPU] Loading pubmed...
    DEBUG 3.1: Dataset init start
    DEBUG 3.2: prepare_data start pubmed
    ----Data statistics------'
    Name: pubmed
    #Nodes 19717
    #Edges 44324
    #Classes 3
    #Ave_degree 4.50
    ----Split statistics------'
    #Train samples 60 (default)
    #Val samples 500 (default)
    #Test samples 1000 (default)
    ----label noise information:------
    Instance dependent noise
    #Actual noise rate 0.50
    [cuda:0] LNPCC waiting for GPU slot...
    [cuda:0] Slot acquired (waited 1.9s). Starting GCN...
    FINAL_RESULT: {'acc': {'train': 0.6666666666666666, 'valid': 0.358, 'test': 0.561}, 'wall_s': 32.35, 'cpu_s': 29.8, 'gpu_s': 2.52, 'wait_s': 1.88}
    [Time] wall=32.3s | cpu=29.8s | gpu=2.5s
    C:\Users\fbrev\Documents\Acadêmico\Simulações\Python\NoisyGL\predictor\Base_Predictor.py:114: UserWarning: expandable_segments not supported on this platform (Triggered internally at ..\c10/cuda/CUDAAllocatorConfig.h:28.)
    self.edge_index = self._cpu_edge_index.to(self.device)
    C:\Users\fbrev\Documents\Acadêmico\Simulações\Python\NoisyGL\predictor\Base_Predictor.py:144: UserWarning: Sparse CSR tensor support is in beta state. If you miss a functionality in the sparse tensor support, please submit a feature request to https://github.com/pytorch/pytorch/issues. (Triggered internally at ..\aten\src\ATen\SparseCsrTensorImpl.cpp:55.)
    self.adj_csr = self.adj.to_sparse_csr().to(self.device)
[I 2026-05-06 15:58:58,986] Trial 32 finished with value: 0.561 and parameters: {'lr': 0.05, 'weight_decay': 0.0, 'n_hidden': 32, 'n_layer': 3, 'dropout': 0.38146872159309325, 'knn_mode': 'd', 'k': 44, 'dexp': 3.569536906465176, 'p_grd': 0.5559371128115046, 'unc_rem': 0.4525558208695122, 'unc_rel': 0.8908459895198063}. Best is trial 32 with value: 0.561.
    [CPU] Loading pubmed...
    DEBUG 3.1: Dataset init start
    DEBUG 3.2: prepare_data start pubmed
    ----Data statistics------'
    Name: pubmed
    #Nodes 19717
    #Edges 44324
    #Classes 3
    #Ave_degree 4.50
    ----Split statistics------'
    #Train samples 60 (default)
    #Val samples 500 (default)
    #Test samples 1000 (default)
    ----label noise information:------
    Instance dependent noise
    #Actual noise rate 0.50
    [cuda:0] LNPCC waiting for GPU slot...
    [cuda:0] Slot acquired (waited 1.3s). Starting GCN...
    FINAL_RESULT: {'acc': {'train': 0.6666666666666666, 'valid': 0.356, 'test': 0.559}, 'wall_s': 34.16, 'cpu_s': 31.51, 'gpu_s': 2.61, 'wait_s': 1.27}
    [Time] wall=34.2s | cpu=31.5s | gpu=2.6s
    C:\Users\fbrev\Documents\Acadêmico\Simulações\Python\NoisyGL\predictor\Base_Predictor.py:114: UserWarning: expandable_segments not supported on this platform (Triggered internally at ..\c10/cuda/CUDAAllocatorConfig.h:28.)
    self.edge_index = self._cpu_edge_index.to(self.device)
    C:\Users\fbrev\Documents\Acadêmico\Simulações\Python\NoisyGL\predictor\Base_Predictor.py:144: UserWarning: Sparse CSR tensor support is in beta state. If you miss a functionality in the sparse tensor support, please submit a feature request to https://github.com/pytorch/pytorch/issues. (Triggered internally at ..\aten\src\ATen\SparseCsrTensorImpl.cpp:55.)
    self.adj_csr = self.adj.to_sparse_csr().to(self.device)
[I 2026-05-06 15:59:40,736] Trial 33 finished with value: 0.559 and parameters: {'lr': 0.05, 'weight_decay': 0.0, 'n_hidden': 32, 'n_layer': 3, 'dropout': 0.38587614321792973, 'knn_mode': 'd', 'k': 46, 'dexp': 5.712534049680971, 'p_grd': 0.5484231134222358, 'unc_rem': 0.4490424325324832, 'unc_rel': 0.910784434014007}. Best is trial 32 with value: 0.561.
    [CPU] Loading pubmed...
    DEBUG 3.1: Dataset init start
    DEBUG 3.2: prepare_data start pubmed
    ----Data statistics------'
    Name: pubmed
    #Nodes 19717
    #Edges 44324
    #Classes 3
    #Ave_degree 4.50
    ----Split statistics------'
    #Train samples 60 (default)
    #Val samples 500 (default)
    #Test samples 1000 (default)
    ----label noise information:------
    Instance dependent noise
    #Actual noise rate 0.50
    [cuda:0] LNPCC waiting for GPU slot...
    [cuda:0] Slot acquired (waited 0.0s). Starting GCN...
    FINAL_RESULT: {'acc': {'train': 0.6666666666666666, 'valid': 0.36, 'test': 0.556}, 'wall_s': 38.14, 'cpu_s': 35.1, 'gpu_s': 3.0, 'wait_s': 0.0}
    [Time] wall=38.1s | cpu=35.1s | gpu=3.0s
    C:\Users\fbrev\Documents\Acadêmico\Simulações\Python\NoisyGL\predictor\Base_Predictor.py:114: UserWarning: expandable_segments not supported on this platform (Triggered internally at ..\c10/cuda/CUDAAllocatorConfig.h:28.)
    self.edge_index = self._cpu_edge_index.to(self.device)
    C:\Users\fbrev\Documents\Acadêmico\Simulações\Python\NoisyGL\predictor\Base_Predictor.py:144: UserWarning: Sparse CSR tensor support is in beta state. If you miss a functionality in the sparse tensor support, please submit a feature request to https://github.com/pytorch/pytorch/issues. (Triggered internally at ..\aten\src\ATen\SparseCsrTensorImpl.cpp:55.)
    self.adj_csr = self.adj.to_sparse_csr().to(self.device)
[I 2026-05-06 16:00:25,451] Trial 34 finished with value: 0.556 and parameters: {'lr': 0.05, 'weight_decay': 0.0, 'n_hidden': 32, 'n_layer': 3, 'dropout': 0.4296841286167136, 'knn_mode': 'd', 'k': 47, 'dexp': 4.590657975881986, 'p_grd': 0.5519745017843192, 'unc_rem': 0.4621999315464902, 'unc_rel': 0.8793292566209432}. Best is trial 32 with value: 0.561.
    [CPU] Loading pubmed...
    DEBUG 3.1: Dataset init start
    DEBUG 3.2: prepare_data start pubmed
    ----Data statistics------'
    Name: pubmed
    #Nodes 19717
    #Edges 44324
    #Classes 3
    #Ave_degree 4.50
    ----Split statistics------'
    #Train samples 60 (default)
    #Val samples 500 (default)
    #Test samples 1000 (default)
    ----label noise information:------
    Instance dependent noise
    #Actual noise rate 0.50
    [cuda:0] LNPCC waiting for GPU slot...
    [cuda:0] Slot acquired (waited 0.0s). Starting GCN...
    FINAL_RESULT: {'acc': {'train': 0.6666666666666666, 'valid': 0.364, 'test': 0.559}, 'wall_s': 36.1, 'cpu_s': 33.39, 'gpu_s': 2.67, 'wait_s': 0.0}
    [Time] wall=36.1s | cpu=33.4s | gpu=2.7s
    C:\Users\fbrev\Documents\Acadêmico\Simulações\Python\NoisyGL\predictor\Base_Predictor.py:114: UserWarning: expandable_segments not supported on this platform (Triggered internally at ..\c10/cuda/CUDAAllocatorConfig.h:28.)
    self.edge_index = self._cpu_edge_index.to(self.device)
    C:\Users\fbrev\Documents\Acadêmico\Simulações\Python\NoisyGL\predictor\Base_Predictor.py:144: UserWarning: Sparse CSR tensor support is in beta state. If you miss a functionality in the sparse tensor support, please submit a feature request to https://github.com/pytorch/pytorch/issues. (Triggered internally at ..\aten\src\ATen\SparseCsrTensorImpl.cpp:55.)
    self.adj_csr = self.adj.to_sparse_csr().to(self.device)
