[worker] START lnpcc_dblp_0.3 gpu=1
[HPO] Starting Phase 1 (Optuna) for lnpcc_dblp_instance_0.3...
[I 2026-05-05 14:50:38,145] Using an existing study with name 'lnpcc_dblp_instance_0.3' instead of creating a new one.
    [CPU] Loading dblp...
    DEBUG 3.1: Dataset init start
    DEBUG 3.2: prepare_data start dblp
    ----Data statistics------'
    Name: dblp
    #Nodes 17716
    #Edges 52867
    #Classes 4
    #Ave_degree 5.97
    ----Split statistics------'
    #Train samples 177 (1.0 % of nodes)
    #Val samples 2657 (15.0 % of nodes)
    #Test samples 14882 (remaining)
    ----label noise information:------
    Instance dependent noise
    #Actual noise rate 0.30
    [cuda:1] LNPCC waiting for GPU slot...
    [cuda:1] Slot acquired (waited 149.7s). Starting GCN...
    FINAL_RESULT: {'acc': {'train': 0.8571428571428571, 'valid': 0.5314264207753105, 'test': 0.7240290283564037}, 'wall_s': 49.45, 'cpu_s': 45.74, 'gpu_s': 3.52, 'wait_s': 149.67}
    [Time] wall=49.4s | cpu=45.7s | gpu=3.5s
    C:\Users\fbrev\Documents\Acadêmico\Simulações\Python\NoisyGL\predictor\Base_Predictor.py:114: UserWarning: expandable_segments not supported on this platform (Triggered internally at ..\c10/cuda/CUDAAllocatorConfig.h:28.)
    self.edge_index = self._cpu_edge_index.to(self.device)
    C:\Users\fbrev\Documents\Acadêmico\Simulações\Python\NoisyGL\predictor\Base_Predictor.py:144: UserWarning: Sparse CSR tensor support is in beta state. If you miss a functionality in the sparse tensor support, please submit a feature request to https://github.com/pytorch/pytorch/issues. (Triggered internally at ..\aten\src\ATen\SparseCsrTensorImpl.cpp:55.)
    self.adj_csr = self.adj.to_sparse_csr().to(self.device)
[I 2026-05-05 14:54:08,866] Trial 84 finished with value: 0.7240290283564037 and parameters: {'lr': 0.001, 'weight_decay': 0.0001, 'n_hidden': 64, 'n_layer': 3, 'dropout': 0.6769174830610946, 'knn_mode': 's', 'k': 30, 'dexp': 1.9054895940765828, 'p_grd': 0.1687620083812157, 'unc_rem': 0.20599924276810397, 'unc_rel': 0.03207772772392903}. Best is trial 57 with value: 0.7498992070958205.
    [CPU] Loading dblp...
    DEBUG 3.1: Dataset init start
    DEBUG 3.2: prepare_data start dblp
    ----Data statistics------'
    Name: dblp
    #Nodes 17716
    #Edges 52867
    #Classes 4
    #Ave_degree 5.97
    ----Split statistics------'
    #Train samples 177 (1.0 % of nodes)
    #Val samples 2657 (15.0 % of nodes)
    #Test samples 14882 (remaining)
    ----label noise information:------
    Instance dependent noise
    #Actual noise rate 0.30
    [cuda:1] LNPCC waiting for GPU slot...
    [cuda:1] Slot acquired (waited 706.6s). Starting GCN...
    FINAL_RESULT: {'acc': {'train': 0.9281045751633987, 'valid': 0.5427173503951825, 'test': 0.7310845316489719}, 'wall_s': 42.72, 'cpu_s': 39.2, 'gpu_s': 3.42, 'wait_s': 706.56}
    [Time] wall=42.7s | cpu=39.2s | gpu=3.4s
    C:\Users\fbrev\Documents\Acadêmico\Simulações\Python\NoisyGL\predictor\Base_Predictor.py:114: UserWarning: expandable_segments not supported on this platform (Triggered internally at ..\c10/cuda/CUDAAllocatorConfig.h:28.)
    self.edge_index = self._cpu_edge_index.to(self.device)
    C:\Users\fbrev\Documents\Acadêmico\Simulações\Python\NoisyGL\predictor\Base_Predictor.py:144: UserWarning: Sparse CSR tensor support is in beta state. If you miss a functionality in the sparse tensor support, please submit a feature request to https://github.com/pytorch/pytorch/issues. (Triggered internally at ..\aten\src\ATen\SparseCsrTensorImpl.cpp:55.)
    self.adj_csr = self.adj.to_sparse_csr().to(self.device)
[I 2026-05-05 15:06:44,533] Trial 85 finished with value: 0.7310845316489719 and parameters: {'lr': 0.001, 'weight_decay': 0.0001, 'n_hidden': 64, 'n_layer': 3, 'dropout': 0.6910542085996638, 'knn_mode': 's', 'k': 33, 'dexp': 2.9106799256961158, 'p_grd': 0.08813960970708506, 'unc_rem': 0.19283113284780926, 'unc_rel': 0.053878568030486726}. Best is trial 57 with value: 0.7498992070958205.
    [CPU] Loading dblp...
    DEBUG 3.1: Dataset init start
    DEBUG 3.2: prepare_data start dblp
    ----Data statistics------'
    Name: dblp
    #Nodes 17716
    #Edges 52867
    #Classes 4
    #Ave_degree 5.97
    ----Split statistics------'
    #Train samples 177 (1.0 % of nodes)
    #Val samples 2657 (15.0 % of nodes)
    #Test samples 14882 (remaining)
    ----label noise information:------
    Instance dependent noise
    #Actual noise rate 0.30
    [cuda:1] LNPCC waiting for GPU slot...
    [cuda:1] Slot acquired (waited 653.4s). Starting GCN...
    FINAL_RESULT: {'acc': {'train': 0.8493150684931506, 'valid': 0.5348136996612721, 'test': 0.7294046499126462}, 'wall_s': 40.78, 'cpu_s': 37.26, 'gpu_s': 3.44, 'wait_s': 653.45}
    [Time] wall=40.8s | cpu=37.3s | gpu=3.4s
    C:\Users\fbrev\Documents\Acadêmico\Simulações\Python\NoisyGL\predictor\Base_Predictor.py:114: UserWarning: expandable_segments not supported on this platform (Triggered internally at ..\c10/cuda/CUDAAllocatorConfig.h:28.)
    self.edge_index = self._cpu_edge_index.to(self.device)
    C:\Users\fbrev\Documents\Acadêmico\Simulações\Python\NoisyGL\predictor\Base_Predictor.py:144: UserWarning: Sparse CSR tensor support is in beta state. If you miss a functionality in the sparse tensor support, please submit a feature request to https://github.com/pytorch/pytorch/issues. (Triggered internally at ..\aten\src\ATen\SparseCsrTensorImpl.cpp:55.)
    self.adj_csr = self.adj.to_sparse_csr().to(self.device)
[I 2026-05-05 15:18:24,790] Trial 86 finished with value: 0.7294046499126462 and parameters: {'lr': 0.001, 'weight_decay': 0.0001, 'n_hidden': 64, 'n_layer': 3, 'dropout': 0.7240350734195481, 'knn_mode': 's', 'k': 34, 'dexp': 1.2242130776639735, 'p_grd': 0.19105844076943695, 'unc_rem': 0.22335667999479075, 'unc_rel': 0.017470818275617514}. Best is trial 57 with value: 0.7498992070958205.
    [CPU] Loading dblp...
    DEBUG 3.1: Dataset init start
    DEBUG 3.2: prepare_data start dblp
    ----Data statistics------'
    Name: dblp
    #Nodes 17716
    #Edges 52867
    #Classes 4
    #Ave_degree 5.97
    ----Split statistics------'
    #Train samples 177 (1.0 % of nodes)
    #Val samples 2657 (15.0 % of nodes)
    #Test samples 14882 (remaining)
    ----label noise information:------
    Instance dependent noise
    #Actual noise rate 0.30
    [cuda:1] LNPCC waiting for GPU slot...
    [cuda:1] Slot acquired (waited 308.2s). Starting GCN...
    FINAL_RESULT: {'acc': {'train': 0.8827160493827161, 'valid': 0.527286413248024, 'test': 0.6978228732697218}, 'wall_s': 39.59, 'cpu_s': 35.86, 'gpu_s': 3.65, 'wait_s': 308.2}
    [Time] wall=39.6s | cpu=35.9s | gpu=3.6s
    C:\Users\fbrev\Documents\Acadêmico\Simulações\Python\NoisyGL\predictor\Base_Predictor.py:114: UserWarning: expandable_segments not supported on this platform (Triggered internally at ..\c10/cuda/CUDAAllocatorConfig.h:28.)
    self.edge_index = self._cpu_edge_index.to(self.device)
    C:\Users\fbrev\Documents\Acadêmico\Simulações\Python\NoisyGL\predictor\Base_Predictor.py:144: UserWarning: Sparse CSR tensor support is in beta state. If you miss a functionality in the sparse tensor support, please submit a feature request to https://github.com/pytorch/pytorch/issues. (Triggered internally at ..\aten\src\ATen\SparseCsrTensorImpl.cpp:55.)
    self.adj_csr = self.adj.to_sparse_csr().to(self.device)
[I 2026-05-05 15:24:18,685] Trial 87 finished with value: 0.6978228732697218 and parameters: {'lr': 0.001, 'weight_decay': 0.0001, 'n_hidden': 64, 'n_layer': 3, 'dropout': 0.6085131762753005, 'knn_mode': 's', 'k': 31, 'dexp': 2.3245065037914174, 'p_grd': 0.15670319596635462, 'unc_rem': 0.37487129383739115, 'unc_rel': 0.08406621884869137}. Best is trial 57 with value: 0.7498992070958205.
    [CPU] Loading dblp...
    DEBUG 3.1: Dataset init start
    DEBUG 3.2: prepare_data start dblp
    ----Data statistics------'
    Name: dblp
    #Nodes 17716
    #Edges 52867
    #Classes 4
    #Ave_degree 5.97
    ----Split statistics------'
    #Train samples 177 (1.0 % of nodes)
    #Val samples 2657 (15.0 % of nodes)
    #Test samples 14882 (remaining)
    ----label noise information:------
    Instance dependent noise
    #Actual noise rate 0.30
    [cuda:1] LNPCC waiting for GPU slot...
    [cuda:1] Slot acquired (waited 145.2s). Starting GCN...
    FINAL_RESULT: {'acc': {'train': 0.8424242424242424, 'valid': 0.5216409484380881, 'test': 0.6812256417148232}, 'wall_s': 39.64, 'cpu_s': 35.97, 'gpu_s': 3.59, 'wait_s': 145.22}
    [Time] wall=39.6s | cpu=36.0s | gpu=3.6s
    C:\Users\fbrev\Documents\Acadêmico\Simulações\Python\NoisyGL\predictor\Base_Predictor.py:114: UserWarning: expandable_segments not supported on this platform (Triggered internally at ..\c10/cuda/CUDAAllocatorConfig.h:28.)
    self.edge_index = self._cpu_edge_index.to(self.device)
    C:\Users\fbrev\Documents\Acadêmico\Simulações\Python\NoisyGL\predictor\Base_Predictor.py:144: UserWarning: Sparse CSR tensor support is in beta state. If you miss a functionality in the sparse tensor support, please submit a feature request to https://github.com/pytorch/pytorch/issues. (Triggered internally at ..\aten\src\ATen\SparseCsrTensorImpl.cpp:55.)
    self.adj_csr = self.adj.to_sparse_csr().to(self.device)
[I 2026-05-05 15:27:29,667] Trial 88 finished with value: 0.6812256417148232 and parameters: {'lr': 0.1, 'weight_decay': 0.0001, 'n_hidden': 64, 'n_layer': 3, 'dropout': 0.48580921806105903, 'knn_mode': 's', 'k': 28, 'dexp': 1.5988435727431338, 'p_grd': 0.134342887318374, 'unc_rem': 0.1752862194648585, 'unc_rel': 0.17476216925912774}. Best is trial 57 with value: 0.7498992070958205.
    [CPU] Loading dblp...
    DEBUG 3.1: Dataset init start
    DEBUG 3.2: prepare_data start dblp
    ----Data statistics------'
    Name: dblp
    #Nodes 17716
    #Edges 52867
    #Classes 4
    #Ave_degree 5.97
    ----Split statistics------'
    #Train samples 177 (1.0 % of nodes)
    #Val samples 2657 (15.0 % of nodes)
    #Test samples 14882 (remaining)
    ----label noise information:------
    Instance dependent noise
    #Actual noise rate 0.30
    [cuda:1] LNPCC waiting for GPU slot...
    [cuda:1] Slot acquired (waited 135.2s). Starting GCN...
    FINAL_RESULT: {'acc': {'train': 0.7, 'valid': 0.5461046292811441, 'test': 0.7416341889530977}, 'wall_s': 42.31, 'cpu_s': 38.33, 'gpu_s': 3.88, 'wait_s': 135.2}
    [Time] wall=42.3s | cpu=38.3s | gpu=3.9s
    C:\Users\fbrev\Documents\Acadêmico\Simulações\Python\NoisyGL\predictor\Base_Predictor.py:114: UserWarning: expandable_segments not supported on this platform (Triggered internally at ..\c10/cuda/CUDAAllocatorConfig.h:28.)
    self.edge_index = self._cpu_edge_index.to(self.device)
    C:\Users\fbrev\Documents\Acadêmico\Simulações\Python\NoisyGL\predictor\Base_Predictor.py:144: UserWarning: Sparse CSR tensor support is in beta state. If you miss a functionality in the sparse tensor support, please submit a feature request to https://github.com/pytorch/pytorch/issues. (Triggered internally at ..\aten\src\ATen\SparseCsrTensorImpl.cpp:55.)
    self.adj_csr = self.adj.to_sparse_csr().to(self.device)
[I 2026-05-05 15:30:33,744] Trial 89 finished with value: 0.7416341889530977 and parameters: {'lr': 0.05, 'weight_decay': 0.0001, 'n_hidden': 64, 'n_layer': 3, 'dropout': 0.6554990529296844, 'knn_mode': 's', 'k': 27, 'dexp': 2.7555475662991906, 'p_grd': 0.4133040156355144, 'unc_rem': 0.27743846876694567, 'unc_rel': 0.14675144522110722}. Best is trial 57 with value: 0.7498992070958205.
    [CPU] Loading dblp...
    DEBUG 3.1: Dataset init start
    DEBUG 3.2: prepare_data start dblp
    ----Data statistics------'
    Name: dblp
    #Nodes 17716
    #Edges 52867
    #Classes 4
    #Ave_degree 5.97
    ----Split statistics------'
    #Train samples 177 (1.0 % of nodes)
    #Val samples 2657 (15.0 % of nodes)
    #Test samples 14882 (remaining)
    ----label noise information:------
    Instance dependent noise
    #Actual noise rate 0.30
    [cuda:1] LNPCC waiting for GPU slot...
    [cuda:1] Slot acquired (waited 662.3s). Starting GCN...
    FINAL_RESULT: {'acc': {'train': 0.7909604519774012, 'valid': 0.5088445615355665, 'test': 0.6757828248891278}, 'wall_s': 61.98, 'cpu_s': 54.86, 'gpu_s': 7.04, 'wait_s': 662.34}
    [Time] wall=62.0s | cpu=54.9s | gpu=7.0s
    C:\Users\fbrev\Documents\Acadêmico\Simulações\Python\NoisyGL\predictor\Base_Predictor.py:114: UserWarning: expandable_segments not supported on this platform (Triggered internally at ..\c10/cuda/CUDAAllocatorConfig.h:28.)
    self.edge_index = self._cpu_edge_index.to(self.device)
    C:\Users\fbrev\Documents\Acadêmico\Simulações\Python\NoisyGL\predictor\Base_Predictor.py:144: UserWarning: Sparse CSR tensor support is in beta state. If you miss a functionality in the sparse tensor support, please submit a feature request to https://github.com/pytorch/pytorch/issues. (Triggered internally at ..\aten\src\ATen\SparseCsrTensorImpl.cpp:55.)
    self.adj_csr = self.adj.to_sparse_csr().to(self.device)
[I 2026-05-05 15:42:44,869] Trial 90 finished with value: 0.6757828248891278 and parameters: {'lr': 0.05, 'weight_decay': 0.0001, 'n_hidden': 256, 'n_layer': 3, 'dropout': 0.6403084765341005, 'knn_mode': 'd', 'k': 22, 'dexp': 3.169630920562613, 'p_grd': 0.4209029660201112, 'unc_rem': 0.38212062780359446, 'unc_rel': 0.14071517955034546}. Best is trial 57 with value: 0.7498992070958205.
    [CPU] Loading dblp...
    DEBUG 3.1: Dataset init start
    DEBUG 3.2: prepare_data start dblp
    ----Data statistics------'
    Name: dblp
    #Nodes 17716
    #Edges 52867
    #Classes 4
    #Ave_degree 5.97
    ----Split statistics------'
    #Train samples 177 (1.0 % of nodes)
    #Val samples 2657 (15.0 % of nodes)
    #Test samples 14882 (remaining)
    ----label noise information:------
    Instance dependent noise
    #Actual noise rate 0.30
    [cuda:1] LNPCC waiting for GPU slot...
    [cuda:1] Slot acquired (waited 319.4s). Starting GCN...
    FINAL_RESULT: {'acc': {'train': 0.7687861271676301, 'valid': 0.5427173503951825, 'test': 0.7165703534471173}, 'wall_s': 41.43, 'cpu_s': 38.34, 'gpu_s': 2.99, 'wait_s': 319.36}
    [Time] wall=41.4s | cpu=38.3s | gpu=3.0s
    C:\Users\fbrev\Documents\Acadêmico\Simulações\Python\NoisyGL\predictor\Base_Predictor.py:114: UserWarning: expandable_segments not supported on this platform (Triggered internally at ..\c10/cuda/CUDAAllocatorConfig.h:28.)
    self.edge_index = self._cpu_edge_index.to(self.device)
    C:\Users\fbrev\Documents\Acadêmico\Simulações\Python\NoisyGL\predictor\Base_Predictor.py:144: UserWarning: Sparse CSR tensor support is in beta state. If you miss a functionality in the sparse tensor support, please submit a feature request to https://github.com/pytorch/pytorch/issues. (Triggered internally at ..\aten\src\ATen\SparseCsrTensorImpl.cpp:55.)
    self.adj_csr = self.adj.to_sparse_csr().to(self.device)
[I 2026-05-05 15:48:51,773] Trial 91 finished with value: 0.7165703534471173 and parameters: {'lr': 0.05, 'weight_decay': 0.0001, 'n_hidden': 32, 'n_layer': 3, 'dropout': 0.46851411506258095, 'knn_mode': 's', 'k': 26, 'dexp': 4.59264530768029, 'p_grd': 0.33408014215023984, 'unc_rem': 0.26447741346933906, 'unc_rel': 0.29166814100874233}. Best is trial 57 with value: 0.7498992070958205.
    [CPU] Loading dblp...
    DEBUG 3.1: Dataset init start
    DEBUG 3.2: prepare_data start dblp
    ----Data statistics------'
    Name: dblp
    #Nodes 17716
    #Edges 52867
    #Classes 4
    #Ave_degree 5.97
    ----Split statistics------'
    #Train samples 177 (1.0 % of nodes)
    #Val samples 2657 (15.0 % of nodes)
    #Test samples 14882 (remaining)
    ----label noise information:------
    Instance dependent noise
    #Actual noise rate 0.30
    [cuda:1] LNPCC waiting for GPU slot...
    [cuda:1] Slot acquired (waited 145.7s). Starting GCN...
    FINAL_RESULT: {'acc': {'train': 0.7413793103448276, 'valid': 0.5366955212645841, 'test': 0.7169063297943825}, 'wall_s': 44.54, 'cpu_s': 40.16, 'gpu_s': 4.29, 'wait_s': 145.74}
    [Time] wall=44.5s | cpu=40.2s | gpu=4.3s
    C:\Users\fbrev\Documents\Acadêmico\Simulações\Python\NoisyGL\predictor\Base_Predictor.py:114: UserWarning: expandable_segments not supported on this platform (Triggered internally at ..\c10/cuda/CUDAAllocatorConfig.h:28.)
    self.edge_index = self._cpu_edge_index.to(self.device)
    C:\Users\fbrev\Documents\Acadêmico\Simulações\Python\NoisyGL\predictor\Base_Predictor.py:144: UserWarning: Sparse CSR tensor support is in beta state. If you miss a functionality in the sparse tensor support, please submit a feature request to https://github.com/pytorch/pytorch/issues. (Triggered internally at ..\aten\src\ATen\SparseCsrTensorImpl.cpp:55.)
    self.adj_csr = self.adj.to_sparse_csr().to(self.device)
[I 2026-05-05 15:52:08,144] Trial 92 finished with value: 0.7169063297943825 and parameters: {'lr': 0.05, 'weight_decay': 0.0001, 'n_hidden': 128, 'n_layer': 3, 'dropout': 0.585961764908055, 'knn_mode': 's', 'k': 25, 'dexp': 2.8393275388716357, 'p_grd': 0.37830303241772606, 'unc_rem': 0.3403806129879299, 'unc_rel': 0.19416415572182744}. Best is trial 57 with value: 0.7498992070958205.
    [CPU] Loading dblp...
    DEBUG 3.1: Dataset init start
    DEBUG 3.2: prepare_data start dblp
    ----Data statistics------'
    Name: dblp
    #Nodes 17716
    #Edges 52867
    #Classes 4
    #Ave_degree 5.97
    ----Split statistics------'
    #Train samples 177 (1.0 % of nodes)
    #Val samples 2657 (15.0 % of nodes)
    #Test samples 14882 (remaining)
    ----label noise information:------
    Instance dependent noise
    #Actual noise rate 0.30
    [cuda:1] LNPCC waiting for GPU slot...
    [cuda:1] Slot acquired (waited 317.7s). Starting GCN...
    FINAL_RESULT: {'acc': {'train': 0.29545454545454547, 'valid': 0.3744824990590892, 'test': 0.4497379384491332}, 'wall_s': 39.02, 'cpu_s': 35.51, 'gpu_s': 3.43, 'wait_s': 317.67}
    [Time] wall=39.0s | cpu=35.5s | gpu=3.4s
    C:\Users\fbrev\Documents\Acadêmico\Simulações\Python\NoisyGL\predictor\Base_Predictor.py:114: UserWarning: expandable_segments not supported on this platform (Triggered internally at ..\c10/cuda/CUDAAllocatorConfig.h:28.)
    self.edge_index = self._cpu_edge_index.to(self.device)
    C:\Users\fbrev\Documents\Acadêmico\Simulações\Python\NoisyGL\predictor\Base_Predictor.py:144: UserWarning: Sparse CSR tensor support is in beta state. If you miss a functionality in the sparse tensor support, please submit a feature request to https://github.com/pytorch/pytorch/issues. (Triggered internally at ..\aten\src\ATen\SparseCsrTensorImpl.cpp:55.)
    self.adj_csr = self.adj.to_sparse_csr().to(self.device)
[I 2026-05-05 15:58:10,856] Trial 93 finished with value: 0.4497379384491332 and parameters: {'lr': 0.05, 'weight_decay': 0.05, 'n_hidden': 64, 'n_layer': 3, 'dropout': 0.42196283160945763, 'knn_mode': 's', 'k': 28, 'dexp': 6.333468366280488, 'p_grd': 0.30536630061552195, 'unc_rem': 0.6746077112270864, 'unc_rel': 0.10298026430994794}. Best is trial 57 with value: 0.7498992070958205.
    [CPU] Loading dblp...
    DEBUG 3.1: Dataset init start
    DEBUG 3.2: prepare_data start dblp
    ----Data statistics------'
    Name: dblp
    #Nodes 17716
    #Edges 52867
    #Classes 4
    #Ave_degree 5.97
    ----Split statistics------'
    #Train samples 177 (1.0 % of nodes)
    #Val samples 2657 (15.0 % of nodes)
    #Test samples 14882 (remaining)
    ----label noise information:------
    Instance dependent noise
    #Actual noise rate 0.30
    [cuda:1] LNPCC waiting for GPU slot...
    [cuda:1] Slot acquired (waited 692.8s). Starting GCN...
    FINAL_RESULT: {'acc': {'train': 0.8805031446540881, 'valid': 0.5479864508844562, 'test': 0.740223088294584}, 'wall_s': 42.8, 'cpu_s': 39.14, 'gpu_s': 3.56, 'wait_s': 692.76}
    [Time] wall=42.8s | cpu=39.1s | gpu=3.6s
    C:\Users\fbrev\Documents\Acadêmico\Simulações\Python\NoisyGL\predictor\Base_Predictor.py:114: UserWarning: expandable_segments not supported on this platform (Triggered internally at ..\c10/cuda/CUDAAllocatorConfig.h:28.)
    self.edge_index = self._cpu_edge_index.to(self.device)
    C:\Users\fbrev\Documents\Acadêmico\Simulações\Python\NoisyGL\predictor\Base_Predictor.py:144: UserWarning: Sparse CSR tensor support is in beta state. If you miss a functionality in the sparse tensor support, please submit a feature request to https://github.com/pytorch/pytorch/issues. (Triggered internally at ..\aten\src\ATen\SparseCsrTensorImpl.cpp:55.)
    self.adj_csr = self.adj.to_sparse_csr().to(self.device)
