[I 2026-05-01 22:11:51,290] Trial 34 finished with value: 0.893 and parameters: {'lr': 0.001, 'weight_decay': 0.0, 'n_hidden': 64, 'n_layer': 2, 'dropout': 0.5621948622410254, 'knn_mode': 'd', 'k': 43, 'dexp': 4.535603386832814, 'p_grd': 0.9850088272338445, 'unc_rem': 0.35809637798651206, 'unc_rel': 0.0008365056556808963}. Best is trial 27 with value: 0.901.
    [CPU] Loading amazonpho...
    DEBUG 3.1: Dataset init start
    DEBUG 3.2: prepare_data start amazonpho
    ----Data statistics------'
    Name: amazonpho
    #Nodes 7650
    #Edges 119081
    #Classes 8
    #Ave_degree 31.13
    ----Split statistics------'
    #Train samples 160 (20 nodes per class)
    #Val samples 500 (specified)
    #Test samples 1000 (specified)
    ----label noise information:------
    Instance dependent noise
    #Actual noise rate 0.30
    [cuda:1] LNPCC waiting for GPU slot...
    [cuda:1] Slot acquired (waited 118.0s). Starting GCN...
    FINAL_RESULT: {'acc': {'train': 0.70625, 'valid': 0.632, 'test': 0.898}, 'wall_s': 24.51, 'cpu_s': 21.85, 'gpu_s': 2.59, 'wait_s': 117.99}
    [Time] wall=24.5s | cpu=21.8s | gpu=2.6s
    C:\Users\fbrev\Documents\Acadêmico\Simulações\Python\NoisyGL\predictor\Base_Predictor.py:114: UserWarning: expandable_segments not supported on this platform (Triggered internally at ..\c10/cuda/CUDAAllocatorConfig.h:28.)
    self.edge_index = self._cpu_edge_index.to(self.device)
    C:\Users\fbrev\Documents\Acadêmico\Simulações\Python\NoisyGL\predictor\Base_Predictor.py:144: UserWarning: Sparse CSR tensor support is in beta state. If you miss a functionality in the sparse tensor support, please submit a feature request to https://github.com/pytorch/pytorch/issues. (Triggered internally at ..\aten\src\ATen\SparseCsrTensorImpl.cpp:55.)
    self.adj_csr = self.adj.to_sparse_csr().to(self.device)
[I 2026-05-01 22:14:20,201] Trial 35 finished with value: 0.898 and parameters: {'lr': 0.001, 'weight_decay': 0.0, 'n_hidden': 64, 'n_layer': 2, 'dropout': 0.2689164972355508, 'knn_mode': 'd', 'k': 28, 'dexp': 6.651505258512906, 'p_grd': 0.8897375177027349, 'unc_rem': 0.5958653727395511, 'unc_rel': 0.07306906618344641}. Best is trial 27 with value: 0.901.
    [CPU] Loading amazonpho...
    DEBUG 3.1: Dataset init start
    DEBUG 3.2: prepare_data start amazonpho
    ----Data statistics------'
    Name: amazonpho
    #Nodes 7650
    #Edges 119081
    #Classes 8
    #Ave_degree 31.13
    ----Split statistics------'
    #Train samples 160 (20 nodes per class)
    #Val samples 500 (specified)
    #Test samples 1000 (specified)
    ----label noise information:------
    Instance dependent noise
    #Actual noise rate 0.30
    [cuda:1] LNPCC waiting for GPU slot...
    [cuda:1] Slot acquired (waited 120.9s). Starting GCN...
    FINAL_RESULT: {'acc': {'train': 0.75, 'valid': 0.604, 'test': 0.853}, 'wall_s': 20.13, 'cpu_s': 17.76, 'gpu_s': 2.3, 'wait_s': 120.94}
    [Time] wall=20.1s | cpu=17.8s | gpu=2.3s
    C:\Users\fbrev\Documents\Acadêmico\Simulações\Python\NoisyGL\predictor\Base_Predictor.py:114: UserWarning: expandable_segments not supported on this platform (Triggered internally at ..\c10/cuda/CUDAAllocatorConfig.h:28.)
    self.edge_index = self._cpu_edge_index.to(self.device)
    C:\Users\fbrev\Documents\Acadêmico\Simulações\Python\NoisyGL\predictor\Base_Predictor.py:144: UserWarning: Sparse CSR tensor support is in beta state. If you miss a functionality in the sparse tensor support, please submit a feature request to https://github.com/pytorch/pytorch/issues. (Triggered internally at ..\aten\src\ATen\SparseCsrTensorImpl.cpp:55.)
    self.adj_csr = self.adj.to_sparse_csr().to(self.device)
[I 2026-05-01 22:16:47,468] Trial 36 finished with value: 0.853 and parameters: {'lr': 0.001, 'weight_decay': 0.0, 'n_hidden': 32, 'n_layer': 2, 'dropout': 0.3824211018889467, 'knn_mode': 'd', 'k': 37, 'dexp': 5.598598053220079, 'p_grd': 0.6516188752583909, 'unc_rem': 0.5027020795145616, 'unc_rel': 0.1301918515980925}. Best is trial 27 with value: 0.901.
    [CPU] Loading amazonpho...
    DEBUG 3.1: Dataset init start
    DEBUG 3.2: prepare_data start amazonpho
    ----Data statistics------'
    Name: amazonpho
    #Nodes 7650
    #Edges 119081
    #Classes 8
    #Ave_degree 31.13
    ----Split statistics------'
    #Train samples 160 (20 nodes per class)
    #Val samples 500 (specified)
    #Test samples 1000 (specified)
    ----label noise information:------
    Instance dependent noise
    #Actual noise rate 0.30
    [cuda:1] LNPCC waiting for GPU slot...
    [cuda:1] Slot acquired (waited 113.5s). Starting GCN...
    FINAL_RESULT: {'acc': {'train': 0.7125, 'valid': 0.632, 'test': 0.892}, 'wall_s': 22.29, 'cpu_s': 18.87, 'gpu_s': 3.36, 'wait_s': 113.46}
    [Time] wall=22.3s | cpu=18.9s | gpu=3.4s
    C:\Users\fbrev\Documents\Acadêmico\Simulações\Python\NoisyGL\predictor\Base_Predictor.py:114: UserWarning: expandable_segments not supported on this platform (Triggered internally at ..\c10/cuda/CUDAAllocatorConfig.h:28.)
    self.edge_index = self._cpu_edge_index.to(self.device)
    C:\Users\fbrev\Documents\Acadêmico\Simulações\Python\NoisyGL\predictor\Base_Predictor.py:144: UserWarning: Sparse CSR tensor support is in beta state. If you miss a functionality in the sparse tensor support, please submit a feature request to https://github.com/pytorch/pytorch/issues. (Triggered internally at ..\aten\src\ATen\SparseCsrTensorImpl.cpp:55.)
    self.adj_csr = self.adj.to_sparse_csr().to(self.device)
[I 2026-05-01 22:19:09,290] Trial 37 finished with value: 0.892 and parameters: {'lr': 0.001, 'weight_decay': 0.05, 'n_hidden': 128, 'n_layer': 2, 'dropout': 0.6896029345920494, 'knn_mode': 'd', 'k': 35, 'dexp': 7.488094052359026, 'p_grd': 0.76107467194862, 'unc_rem': 0.35501862613791907, 'unc_rel': 0.04553371931905008}. Best is trial 27 with value: 0.901.
    [CPU] Loading amazonpho...
    DEBUG 3.1: Dataset init start
    DEBUG 3.2: prepare_data start amazonpho
    ----Data statistics------'
    Name: amazonpho
    #Nodes 7650
    #Edges 119081
    #Classes 8
    #Ave_degree 31.13
    ----Split statistics------'
    #Train samples 160 (20 nodes per class)
    #Val samples 500 (specified)
    #Test samples 1000 (specified)
    ----label noise information:------
    Instance dependent noise
    #Actual noise rate 0.30
    [cuda:1] LNPCC waiting for GPU slot...
    [cuda:1] Slot acquired (waited 106.1s). Starting GCN...
    FINAL_RESULT: {'acc': {'train': 0.70625, 'valid': 0.638, 'test': 0.897}, 'wall_s': 40.46, 'cpu_s': 37.77, 'gpu_s': 2.6, 'wait_s': 106.07}
    [Time] wall=40.5s | cpu=37.8s | gpu=2.6s
    C:\Users\fbrev\Documents\Acadêmico\Simulações\Python\NoisyGL\predictor\Base_Predictor.py:114: UserWarning: expandable_segments not supported on this platform (Triggered internally at ..\c10/cuda/CUDAAllocatorConfig.h:28.)
    self.edge_index = self._cpu_edge_index.to(self.device)
    C:\Users\fbrev\Documents\Acadêmico\Simulações\Python\NoisyGL\predictor\Base_Predictor.py:144: UserWarning: Sparse CSR tensor support is in beta state. If you miss a functionality in the sparse tensor support, please submit a feature request to https://github.com/pytorch/pytorch/issues. (Triggered internally at ..\aten\src\ATen\SparseCsrTensorImpl.cpp:55.)
    self.adj_csr = self.adj.to_sparse_csr().to(self.device)
[I 2026-05-01 22:21:42,423] Trial 38 finished with value: 0.897 and parameters: {'lr': 0.001, 'weight_decay': 0.0, 'n_hidden': 64, 'n_layer': 2, 'dropout': 0.6383885427786213, 'knn_mode': 'd', 'k': 50, 'dexp': 4.825953731641104, 'p_grd': 0.9469284372458432, 'unc_rem': 0.4465809690551945, 'unc_rel': 0.17192019716973544}. Best is trial 27 with value: 0.901.
    [CPU] Loading amazonpho...
    DEBUG 3.1: Dataset init start
    DEBUG 3.2: prepare_data start amazonpho
    ----Data statistics------'
    Name: amazonpho
    #Nodes 7650
    #Edges 119081
    #Classes 8
    #Ave_degree 31.13
    ----Split statistics------'
    #Train samples 160 (20 nodes per class)
    #Val samples 500 (specified)
    #Test samples 1000 (specified)
    ----label noise information:------
    Instance dependent noise
    #Actual noise rate 0.30
    [cuda:1] LNPCC waiting for GPU slot...
    [cuda:1] Slot acquired (waited 112.3s). Starting GCN...
    FINAL_RESULT: {'acc': {'train': 0.7066666666666667, 'valid': 0.582, 'test': 0.827}, 'wall_s': 28.56, 'cpu_s': 25.94, 'gpu_s': 2.54, 'wait_s': 112.29}
    [Time] wall=28.6s | cpu=25.9s | gpu=2.5s
    C:\Users\fbrev\Documents\Acadêmico\Simulações\Python\NoisyGL\predictor\Base_Predictor.py:114: UserWarning: expandable_segments not supported on this platform (Triggered internally at ..\c10/cuda/CUDAAllocatorConfig.h:28.)
    self.edge_index = self._cpu_edge_index.to(self.device)
    C:\Users\fbrev\Documents\Acadêmico\Simulações\Python\NoisyGL\predictor\Base_Predictor.py:144: UserWarning: Sparse CSR tensor support is in beta state. If you miss a functionality in the sparse tensor support, please submit a feature request to https://github.com/pytorch/pytorch/issues. (Triggered internally at ..\aten\src\ATen\SparseCsrTensorImpl.cpp:55.)
    self.adj_csr = self.adj.to_sparse_csr().to(self.device)
[I 2026-05-01 22:24:09,902] Trial 39 finished with value: 0.827 and parameters: {'lr': 0.05, 'weight_decay': 0.01, 'n_hidden': 64, 'n_layer': 2, 'dropout': 0.472760297548309, 'knn_mode': 'd', 'k': 47, 'dexp': 1.2082775493577764, 'p_grd': 0.6765062917927491, 'unc_rem': 0.6404509548276179, 'unc_rel': 0.09581017577782672}. Best is trial 27 with value: 0.901.
    [CPU] Loading amazonpho...
    DEBUG 3.1: Dataset init start
    DEBUG 3.2: prepare_data start amazonpho
    ----Data statistics------'
    Name: amazonpho
    #Nodes 7650
    #Edges 119081
    #Classes 8
    #Ave_degree 31.13
    ----Split statistics------'
    #Train samples 160 (20 nodes per class)
    #Val samples 500 (specified)
    #Test samples 1000 (specified)
    ----label noise information:------
    Instance dependent noise
    #Actual noise rate 0.30
    [cuda:1] LNPCC waiting for GPU slot...
    [cuda:1] Slot acquired (waited 116.2s). Starting GCN...
    FINAL_RESULT: {'acc': {'train': 0.73125, 'valid': 0.606, 'test': 0.878}, 'wall_s': 24.72, 'cpu_s': 22.36, 'gpu_s': 2.29, 'wait_s': 116.15}
    [Time] wall=24.7s | cpu=22.4s | gpu=2.3s
    C:\Users\fbrev\Documents\Acadêmico\Simulações\Python\NoisyGL\predictor\Base_Predictor.py:114: UserWarning: expandable_segments not supported on this platform (Triggered internally at ..\c10/cuda/CUDAAllocatorConfig.h:28.)
    self.edge_index = self._cpu_edge_index.to(self.device)
    C:\Users\fbrev\Documents\Acadêmico\Simulações\Python\NoisyGL\predictor\Base_Predictor.py:144: UserWarning: Sparse CSR tensor support is in beta state. If you miss a functionality in the sparse tensor support, please submit a feature request to https://github.com/pytorch/pytorch/issues. (Triggered internally at ..\aten\src\ATen\SparseCsrTensorImpl.cpp:55.)
    self.adj_csr = self.adj.to_sparse_csr().to(self.device)
[I 2026-05-01 22:26:37,145] Trial 40 finished with value: 0.878 and parameters: {'lr': 0.001, 'weight_decay': 0.0, 'n_hidden': 32, 'n_layer': 2, 'dropout': 0.5530882168169641, 'knn_mode': 'd', 'k': 39, 'dexp': 6.670129816475053, 'p_grd': 0.8500073136926518, 'unc_rem': 0.5441473188949442, 'unc_rel': 0.05181120765100658}. Best is trial 27 with value: 0.901.
    [CPU] Loading amazonpho...
    DEBUG 3.1: Dataset init start
    DEBUG 3.2: prepare_data start amazonpho
    ----Data statistics------'
    Name: amazonpho
    #Nodes 7650
    #Edges 119081
    #Classes 8
    #Ave_degree 31.13
    ----Split statistics------'
    #Train samples 160 (20 nodes per class)
    #Val samples 500 (specified)
    #Test samples 1000 (specified)
    ----label noise information:------
    Instance dependent noise
    #Actual noise rate 0.30
    [cuda:1] LNPCC waiting for GPU slot...
    [cuda:1] Slot acquired (waited 112.0s). Starting GCN...
    FINAL_RESULT: {'acc': {'train': 0.69375, 'valid': 0.634, 'test': 0.898}, 'wall_s': 29.49, 'cpu_s': 26.86, 'gpu_s': 2.57, 'wait_s': 112.0}
    [Time] wall=29.5s | cpu=26.9s | gpu=2.6s
    C:\Users\fbrev\Documents\Acadêmico\Simulações\Python\NoisyGL\predictor\Base_Predictor.py:114: UserWarning: expandable_segments not supported on this platform (Triggered internally at ..\c10/cuda/CUDAAllocatorConfig.h:28.)
    self.edge_index = self._cpu_edge_index.to(self.device)
    C:\Users\fbrev\Documents\Acadêmico\Simulações\Python\NoisyGL\predictor\Base_Predictor.py:144: UserWarning: Sparse CSR tensor support is in beta state. If you miss a functionality in the sparse tensor support, please submit a feature request to https://github.com/pytorch/pytorch/issues. (Triggered internally at ..\aten\src\ATen\SparseCsrTensorImpl.cpp:55.)
    self.adj_csr = self.adj.to_sparse_csr().to(self.device)
[I 2026-05-01 22:29:04,854] Trial 41 finished with value: 0.898 and parameters: {'lr': 0.001, 'weight_decay': 0.0, 'n_hidden': 64, 'n_layer': 2, 'dropout': 0.3023507503141931, 'knn_mode': 'd', 'k': 25, 'dexp': 6.7646872377920815, 'p_grd': 0.9173750053433569, 'unc_rem': 0.6185391003787808, 'unc_rel': 0.0720117727149076}. Best is trial 27 with value: 0.901.
    [CPU] Loading amazonpho...
    DEBUG 3.1: Dataset init start
    DEBUG 3.2: prepare_data start amazonpho
    ----Data statistics------'
    Name: amazonpho
    #Nodes 7650
    #Edges 119081
    #Classes 8
    #Ave_degree 31.13
    ----Split statistics------'
    #Train samples 160 (20 nodes per class)
    #Val samples 500 (specified)
    #Test samples 1000 (specified)
    ----label noise information:------
    Instance dependent noise
    #Actual noise rate 0.30
    [cuda:1] LNPCC waiting for GPU slot...
    [cuda:1] Slot acquired (waited 95.0s). Starting GCN...
    FINAL_RESULT: {'acc': {'train': 0.7581699346405228, 'valid': 0.626, 'test': 0.898}, 'wall_s': 46.63, 'cpu_s': 43.88, 'gpu_s': 2.67, 'wait_s': 94.99}
    [Time] wall=46.6s | cpu=43.9s | gpu=2.7s
    C:\Users\fbrev\Documents\Acadêmico\Simulações\Python\NoisyGL\predictor\Base_Predictor.py:114: UserWarning: expandable_segments not supported on this platform (Triggered internally at ..\c10/cuda/CUDAAllocatorConfig.h:28.)
    self.edge_index = self._cpu_edge_index.to(self.device)
    C:\Users\fbrev\Documents\Acadêmico\Simulações\Python\NoisyGL\predictor\Base_Predictor.py:144: UserWarning: Sparse CSR tensor support is in beta state. If you miss a functionality in the sparse tensor support, please submit a feature request to https://github.com/pytorch/pytorch/issues. (Triggered internally at ..\aten\src\ATen\SparseCsrTensorImpl.cpp:55.)
    self.adj_csr = self.adj.to_sparse_csr().to(self.device)
[I 2026-05-01 22:31:32,768] Trial 42 finished with value: 0.898 and parameters: {'lr': 0.001, 'weight_decay': 0.0, 'n_hidden': 64, 'n_layer': 2, 'dropout': 0.23675374195921609, 'knn_mode': 'd', 'k': 29, 'dexp': 7.765808047235092, 'p_grd': 0.9940680443109382, 'unc_rem': 0.422831667624106, 'unc_rel': 0.025577050276738518}. Best is trial 27 with value: 0.901.
    [CPU] Loading amazonpho...
    DEBUG 3.1: Dataset init start
    DEBUG 3.2: prepare_data start amazonpho
    ----Data statistics------'
    Name: amazonpho
    #Nodes 7650
    #Edges 119081
    #Classes 8
    #Ave_degree 31.13
    ----Split statistics------'
    #Train samples 160 (20 nodes per class)
    #Val samples 500 (specified)
    #Test samples 1000 (specified)
    ----label noise information:------
    Instance dependent noise
    #Actual noise rate 0.30
    [cuda:1] LNPCC waiting for GPU slot...
    [cuda:1] Slot acquired (waited 111.4s). Starting GCN...
    FINAL_RESULT: {'acc': {'train': 0.7125, 'valid': 0.636, 'test': 0.898}, 'wall_s': 23.77, 'cpu_s': 21.13, 'gpu_s': 2.57, 'wait_s': 111.36}
    [Time] wall=23.8s | cpu=21.1s | gpu=2.6s
    C:\Users\fbrev\Documents\Acadêmico\Simulações\Python\NoisyGL\predictor\Base_Predictor.py:114: UserWarning: expandable_segments not supported on this platform (Triggered internally at ..\c10/cuda/CUDAAllocatorConfig.h:28.)
    self.edge_index = self._cpu_edge_index.to(self.device)
    C:\Users\fbrev\Documents\Acadêmico\Simulações\Python\NoisyGL\predictor\Base_Predictor.py:144: UserWarning: Sparse CSR tensor support is in beta state. If you miss a functionality in the sparse tensor support, please submit a feature request to https://github.com/pytorch/pytorch/issues. (Triggered internally at ..\aten\src\ATen\SparseCsrTensorImpl.cpp:55.)
    self.adj_csr = self.adj.to_sparse_csr().to(self.device)
[I 2026-05-01 22:33:54,143] Trial 43 finished with value: 0.898 and parameters: {'lr': 0.001, 'weight_decay': 0.0, 'n_hidden': 64, 'n_layer': 2, 'dropout': 0.2628152705855358, 'knn_mode': 'd', 'k': 27, 'dexp': 6.015197245327565, 'p_grd': 0.7710195994262893, 'unc_rem': 0.3974854688633877, 'unc_rel': 0.3106105194961702}. Best is trial 27 with value: 0.901.
    [CPU] Loading amazonpho...
    DEBUG 3.1: Dataset init start
    DEBUG 3.2: prepare_data start amazonpho
    ----Data statistics------'
    Name: amazonpho
    #Nodes 7650
    #Edges 119081
    #Classes 8
    #Ave_degree 31.13
    ----Split statistics------'
    #Train samples 160 (20 nodes per class)
    #Val samples 500 (specified)
    #Test samples 1000 (specified)
    ----label noise information:------
    Instance dependent noise
    #Actual noise rate 0.30
    [cuda:1] LNPCC waiting for GPU slot...
    [cuda:1] Slot acquired (waited 124.8s). Starting GCN...
    FINAL_RESULT: {'acc': {'train': 0.70625, 'valid': 0.632, 'test': 0.895}, 'wall_s': 22.51, 'cpu_s': 19.79, 'gpu_s': 2.66, 'wait_s': 124.77}
    [Time] wall=22.5s | cpu=19.8s | gpu=2.7s
    C:\Users\fbrev\Documents\Acadêmico\Simulações\Python\NoisyGL\predictor\Base_Predictor.py:114: UserWarning: expandable_segments not supported on this platform (Triggered internally at ..\c10/cuda/CUDAAllocatorConfig.h:28.)
    self.edge_index = self._cpu_edge_index.to(self.device)
    C:\Users\fbrev\Documents\Acadêmico\Simulações\Python\NoisyGL\predictor\Base_Predictor.py:144: UserWarning: Sparse CSR tensor support is in beta state. If you miss a functionality in the sparse tensor support, please submit a feature request to https://github.com/pytorch/pytorch/issues. (Triggered internally at ..\aten\src\ATen\SparseCsrTensorImpl.cpp:55.)
    self.adj_csr = self.adj.to_sparse_csr().to(self.device)
[I 2026-05-01 22:36:27,826] Trial 44 finished with value: 0.895 and parameters: {'lr': 0.001, 'weight_decay': 0.0, 'n_hidden': 64, 'n_layer': 2, 'dropout': 0.3524888951187083, 'knn_mode': 'd', 'k': 34, 'dexp': 8.76956894340213, 'p_grd': 0.8576554194785699, 'unc_rem': 0.26632113587150297, 'unc_rel': 0.22995373377777126}. Best is trial 27 with value: 0.901.
    [CPU] Loading amazonpho...
    DEBUG 3.1: Dataset init start
    DEBUG 3.2: prepare_data start amazonpho
    ----Data statistics------'
    Name: amazonpho
    #Nodes 7650
    #Edges 119081
    #Classes 8
    #Ave_degree 31.13
    ----Split statistics------'
    #Train samples 160 (20 nodes per class)
    #Val samples 500 (specified)
    #Test samples 1000 (specified)
    ----label noise information:------
    Instance dependent noise
    #Actual noise rate 0.30
    [cuda:1] LNPCC waiting for GPU slot...
    [cuda:1] Slot acquired (waited 116.3s). Starting GCN...
    FINAL_RESULT: {'acc': {'train': 0.66875, 'valid': 0.644, 'test': 0.895}, 'wall_s': 25.43, 'cpu_s': 22.03, 'gpu_s': 3.34, 'wait_s': 116.31}
    [Time] wall=25.4s | cpu=22.0s | gpu=3.3s
    C:\Users\fbrev\Documents\Acadêmico\Simulações\Python\NoisyGL\predictor\Base_Predictor.py:114: UserWarning: expandable_segments not supported on this platform (Triggered internally at ..\c10/cuda/CUDAAllocatorConfig.h:28.)
    self.edge_index = self._cpu_edge_index.to(self.device)
    C:\Users\fbrev\Documents\Acadêmico\Simulações\Python\NoisyGL\predictor\Base_Predictor.py:144: UserWarning: Sparse CSR tensor support is in beta state. If you miss a functionality in the sparse tensor support, please submit a feature request to https://github.com/pytorch/pytorch/issues. (Triggered internally at ..\aten\src\ATen\SparseCsrTensorImpl.cpp:55.)
    self.adj_csr = self.adj.to_sparse_csr().to(self.device)
[I 2026-05-01 22:38:55,890] Trial 45 finished with value: 0.895 and parameters: {'lr': 0.01, 'weight_decay': 0.0, 'n_hidden': 128, 'n_layer': 2, 'dropout': 0.4042858792532172, 'knn_mode': 'd', 'k': 29, 'dexp': 6.754291560336517, 'p_grd': 0.9060759882352998, 'unc_rem': 0.6155273720844, 'unc_rel': 0.10880268810004873}. Best is trial 27 with value: 0.901.
    [CPU] Loading amazonpho...
    DEBUG 3.1: Dataset init start
    DEBUG 3.2: prepare_data start amazonpho
    ----Data statistics------'
    Name: amazonpho
    #Nodes 7650
    #Edges 119081
    #Classes 8
    #Ave_degree 31.13
    ----Split statistics------'
    #Train samples 160 (20 nodes per class)
    #Val samples 500 (specified)
    #Test samples 1000 (specified)
    ----label noise information:------
    Instance dependent noise
    #Actual noise rate 0.30
    [cuda:1] LNPCC waiting for GPU slot...
    [cuda:1] Slot acquired (waited 111.2s). Starting GCN...
    FINAL_RESULT: {'acc': {'train': 0.15625, 'valid': 0.29, 'test': 0.329}, 'wall_s': 24.04, 'cpu_s': 21.35, 'gpu_s': 2.62, 'wait_s': 111.2}
    [Time] wall=24.0s | cpu=21.4s | gpu=2.6s
    C:\Users\fbrev\Documents\Acadêmico\Simulações\Python\NoisyGL\predictor\Base_Predictor.py:114: UserWarning: expandable_segments not supported on this platform (Triggered internally at ..\c10/cuda/CUDAAllocatorConfig.h:28.)
    self.edge_index = self._cpu_edge_index.to(self.device)
    C:\Users\fbrev\Documents\Acadêmico\Simulações\Python\NoisyGL\predictor\Base_Predictor.py:144: UserWarning: Sparse CSR tensor support is in beta state. If you miss a functionality in the sparse tensor support, please submit a feature request to https://github.com/pytorch/pytorch/issues. (Triggered internally at ..\aten\src\ATen\SparseCsrTensorImpl.cpp:55.)
    self.adj_csr = self.adj.to_sparse_csr().to(self.device)
