[I 2026-05-03 01:51:04,522] Trial 21 finished with value: 0.5268107573007754 and parameters: {'lr': 0.01, 'weight_decay': 0.0001, 'n_hidden': 32, 'n_layer': 2, 'dropout': 0.5443012893364925, 'knn_mode': 'd', 'k': 33, 'dexp': 6.59850214880725, 'p_grd': 0.5713376095963408, 'unc_rem': 0.043444563402753406, 'unc_rel': 0.02687254627666802}. Best is trial 21 with value: 0.5268107573007754.
    [CPU] Loading flickr...
    DEBUG 3.1: Dataset init start
    DEBUG 3.2: prepare_data start flickr
    ----Data statistics------'
    Name: flickr
    #Nodes 7575
    #Edges 239738
    #Classes 9
    #Ave_degree 63.30
    ----Split statistics------'
    #Train samples 378 (5.0 % of nodes)
    #Val samples 1136 (15.0 % of nodes)
    #Test samples 6061 (remaining)
    ----label noise information:------
    Instance dependent noise
    #Actual noise rate 0.30
    [cuda:1] LNPCC waiting for GPU slot...
    [cuda:1] Slot acquired (waited 49.9s). Starting GCN...
    FINAL_RESULT: {'acc': {'train': 1.0, 'valid': 0.25440140845070425, 'test': 0.3034152780069295}, 'wall_s': 170.76, 'cpu_s': 166.77, 'gpu_s': 3.75, 'wait_s': 49.87}
    [Time] wall=170.8s | cpu=166.8s | gpu=3.7s
    C:\Users\fbrev\anaconda3\envs\noisygl\Lib\site-packages\torch\_utils.py:315: UserWarning: Sparse CSR tensor support is in beta state. If you miss a functionality in the sparse tensor support, please submit a feature request to https://github.com/pytorch/pytorch/issues. (Triggered internally at ..\aten\src\ATen\SparseCsrTensorImpl.cpp:55.)
    result = torch.sparse_compressed_tensor(
    C:\Users\fbrev\Documents\Acadêmico\Simulações\Python\NoisyGL\predictor\Base_Predictor.py:114: UserWarning: expandable_segments not supported on this platform (Triggered internally at ..\c10/cuda/CUDAAllocatorConfig.h:28.)
    self.edge_index = self._cpu_edge_index.to(self.device)
[I 2026-05-03 01:54:50,172] Trial 22 finished with value: 0.3034152780069295 and parameters: {'lr': 0.01, 'weight_decay': 0.0001, 'n_hidden': 32, 'n_layer': 2, 'dropout': 0.4425321800018268, 'knn_mode': 'd', 'k': 39, 'dexp': 5.765711081538674, 'p_grd': 0.7532830679934119, 'unc_rem': 0.0024400565632121674, 'unc_rel': 0.1441586152878901}. Best is trial 21 with value: 0.5268107573007754.
    [CPU] Loading flickr...
    DEBUG 3.1: Dataset init start
    DEBUG 3.2: prepare_data start flickr
    ----Data statistics------'
    Name: flickr
    #Nodes 7575
    #Edges 239738
    #Classes 9
    #Ave_degree 63.30
    ----Split statistics------'
    #Train samples 378 (5.0 % of nodes)
    #Val samples 1136 (15.0 % of nodes)
    #Test samples 6061 (remaining)
    ----label noise information:------
    Instance dependent noise
    #Actual noise rate 0.30
    [cuda:1] LNPCC waiting for GPU slot...
    [cuda:1] Slot acquired (waited 35.2s). Starting GCN...
    FINAL_RESULT: {'acc': {'train': 0.6223404255319149, 'valid': 0.36619718309859156, 'test': 0.5129516581422208}, 'wall_s': 119.32, 'cpu_s': 115.44, 'gpu_s': 3.62, 'wait_s': 35.24}
    [Time] wall=119.3s | cpu=115.4s | gpu=3.6s
    C:\Users\fbrev\anaconda3\envs\noisygl\Lib\site-packages\torch\_utils.py:315: UserWarning: Sparse CSR tensor support is in beta state. If you miss a functionality in the sparse tensor support, please submit a feature request to https://github.com/pytorch/pytorch/issues. (Triggered internally at ..\aten\src\ATen\SparseCsrTensorImpl.cpp:55.)
    result = torch.sparse_compressed_tensor(
    C:\Users\fbrev\Documents\Acadêmico\Simulações\Python\NoisyGL\predictor\Base_Predictor.py:114: UserWarning: expandable_segments not supported on this platform (Triggered internally at ..\c10/cuda/CUDAAllocatorConfig.h:28.)
    self.edge_index = self._cpu_edge_index.to(self.device)
[I 2026-05-03 01:57:29,732] Trial 23 finished with value: 0.5129516581422208 and parameters: {'lr': 0.01, 'weight_decay': 0.0, 'n_hidden': 32, 'n_layer': 2, 'dropout': 0.6020637909339958, 'knn_mode': 'd', 'k': 37, 'dexp': 6.987190313086991, 'p_grd': 0.8568239109442223, 'unc_rem': 0.2229565117029395, 'unc_rel': 0.0027640906626854866}. Best is trial 21 with value: 0.5268107573007754.
    [CPU] Loading flickr...
    DEBUG 3.1: Dataset init start
    DEBUG 3.2: prepare_data start flickr
    ----Data statistics------'
    Name: flickr
    #Nodes 7575
    #Edges 239738
    #Classes 9
    #Ave_degree 63.30
    ----Split statistics------'
    #Train samples 378 (5.0 % of nodes)
    #Val samples 1136 (15.0 % of nodes)
    #Test samples 6061 (remaining)
    ----label noise information:------
    Instance dependent noise
    #Actual noise rate 0.30
    [cuda:1] LNPCC waiting for GPU slot...
    [cuda:1] Slot acquired (waited 29.6s). Starting GCN...
    FINAL_RESULT: {'acc': {'train': 0.6585365853658537, 'valid': 0.36883802816901406, 'test': 0.49381290216135953}, 'wall_s': 343.87, 'cpu_s': 339.88, 'gpu_s': 3.74, 'wait_s': 29.57}
    [Time] wall=343.9s | cpu=339.9s | gpu=3.7s
    C:\Users\fbrev\anaconda3\envs\noisygl\Lib\site-packages\torch\_utils.py:315: UserWarning: Sparse CSR tensor support is in beta state. If you miss a functionality in the sparse tensor support, please submit a feature request to https://github.com/pytorch/pytorch/issues. (Triggered internally at ..\aten\src\ATen\SparseCsrTensorImpl.cpp:55.)
    result = torch.sparse_compressed_tensor(
    C:\Users\fbrev\Documents\Acadêmico\Simulações\Python\NoisyGL\predictor\Base_Predictor.py:114: UserWarning: expandable_segments not supported on this platform (Triggered internally at ..\c10/cuda/CUDAAllocatorConfig.h:28.)
    self.edge_index = self._cpu_edge_index.to(self.device)
[I 2026-05-03 02:03:48,077] Trial 24 finished with value: 0.49381290216135953 and parameters: {'lr': 0.01, 'weight_decay': 0.0001, 'n_hidden': 32, 'n_layer': 2, 'dropout': 0.5865012950876709, 'knn_mode': 'd', 'k': 32, 'dexp': 5.347855211108866, 'p_grd': 0.9774624915257564, 'unc_rem': 0.20968856817584935, 'unc_rel': 0.002978171795919922}. Best is trial 21 with value: 0.5268107573007754.
    [CPU] Loading flickr...
    DEBUG 3.1: Dataset init start
    DEBUG 3.2: prepare_data start flickr
    ----Data statistics------'
    Name: flickr
    #Nodes 7575
    #Edges 239738
    #Classes 9
    #Ave_degree 63.30
    ----Split statistics------'
    #Train samples 378 (5.0 % of nodes)
    #Val samples 1136 (15.0 % of nodes)
    #Test samples 6061 (remaining)
    ----label noise information:------
    Instance dependent noise
    #Actual noise rate 0.30
    [cuda:1] LNPCC waiting for GPU slot...
    [cuda:1] Slot acquired (waited 60.9s). Starting GCN...
    FINAL_RESULT: {'acc': {'train': 0.7231182795698925, 'valid': 0.37764084507042256, 'test': 0.5193862398944069}, 'wall_s': 156.63, 'cpu_s': 152.55, 'gpu_s': 3.83, 'wait_s': 60.87}
    [Time] wall=156.6s | cpu=152.5s | gpu=3.8s
    C:\Users\fbrev\anaconda3\envs\noisygl\Lib\site-packages\torch\_utils.py:315: UserWarning: Sparse CSR tensor support is in beta state. If you miss a functionality in the sparse tensor support, please submit a feature request to https://github.com/pytorch/pytorch/issues. (Triggered internally at ..\aten\src\ATen\SparseCsrTensorImpl.cpp:55.)
    result = torch.sparse_compressed_tensor(
    C:\Users\fbrev\Documents\Acadêmico\Simulações\Python\NoisyGL\predictor\Base_Predictor.py:114: UserWarning: expandable_segments not supported on this platform (Triggered internally at ..\c10/cuda/CUDAAllocatorConfig.h:28.)
    self.edge_index = self._cpu_edge_index.to(self.device)
[I 2026-05-03 02:07:30,762] Trial 25 finished with value: 0.5193862398944069 and parameters: {'lr': 0.01, 'weight_decay': 0.0001, 'n_hidden': 32, 'n_layer': 2, 'dropout': 0.6223835836349069, 'knn_mode': 'd', 'k': 36, 'dexp': 1.4762917710154753, 'p_grd': 0.5789477701415533, 'unc_rem': 0.07140710708074295, 'unc_rel': 0.12882055845187484}. Best is trial 21 with value: 0.5268107573007754.
    [CPU] Loading flickr...
    DEBUG 3.1: Dataset init start
    DEBUG 3.2: prepare_data start flickr
    ----Data statistics------'
    Name: flickr
    #Nodes 7575
    #Edges 239738
    #Classes 9
    #Ave_degree 63.30
    ----Split statistics------'
    #Train samples 378 (5.0 % of nodes)
    #Val samples 1136 (15.0 % of nodes)
    #Test samples 6061 (remaining)
    ----label noise information:------
    Instance dependent noise
    #Actual noise rate 0.30
    [cuda:1] LNPCC waiting for GPU slot...
    [cuda:1] Slot acquired (waited 23.8s). Starting GCN...
    FINAL_RESULT: {'acc': {'train': 0.8575581395348837, 'valid': 0.3653169014084507, 'test': 0.5136116152450091}, 'wall_s': 134.08, 'cpu_s': 130.07, 'gpu_s': 3.75, 'wait_s': 23.8}
    [Time] wall=134.1s | cpu=130.1s | gpu=3.8s
    C:\Users\fbrev\anaconda3\envs\noisygl\Lib\site-packages\torch\_utils.py:315: UserWarning: Sparse CSR tensor support is in beta state. If you miss a functionality in the sparse tensor support, please submit a feature request to https://github.com/pytorch/pytorch/issues. (Triggered internally at ..\aten\src\ATen\SparseCsrTensorImpl.cpp:55.)
    result = torch.sparse_compressed_tensor(
    C:\Users\fbrev\Documents\Acadêmico\Simulações\Python\NoisyGL\predictor\Base_Predictor.py:114: UserWarning: expandable_segments not supported on this platform (Triggered internally at ..\c10/cuda/CUDAAllocatorConfig.h:28.)
    self.edge_index = self._cpu_edge_index.to(self.device)
[I 2026-05-03 02:10:14,390] Trial 26 finished with value: 0.5136116152450091 and parameters: {'lr': 0.01, 'weight_decay': 0.0001, 'n_hidden': 32, 'n_layer': 2, 'dropout': 0.2605953812451114, 'knn_mode': 'd', 'k': 29, 'dexp': 0.4990114924579987, 'p_grd': 0.5323792816417335, 'unc_rem': 0.0664019873949736, 'unc_rel': 0.14478132273745453}. Best is trial 21 with value: 0.5268107573007754.
    [CPU] Loading flickr...
    DEBUG 3.1: Dataset init start
    DEBUG 3.2: prepare_data start flickr
    ----Data statistics------'
    Name: flickr
    #Nodes 7575
    #Edges 239738
    #Classes 9
    #Ave_degree 63.30
    ----Split statistics------'
    #Train samples 378 (5.0 % of nodes)
    #Val samples 1136 (15.0 % of nodes)
    #Test samples 6061 (remaining)
    ----label noise information:------
    Instance dependent noise
    #Actual noise rate 0.30
    [cuda:1] LNPCC waiting for GPU slot...
    [cuda:1] Slot acquired (waited 5.3s). Starting GCN...
    FINAL_RESULT: {'acc': {'train': 0.7620320855614974, 'valid': 0.375, 'test': 0.519551229170104}, 'wall_s': 115.34, 'cpu_s': 111.26, 'gpu_s': 3.84, 'wait_s': 5.28}
    [Time] wall=115.3s | cpu=111.3s | gpu=3.8s
    C:\Users\fbrev\anaconda3\envs\noisygl\Lib\site-packages\torch\_utils.py:315: UserWarning: Sparse CSR tensor support is in beta state. If you miss a functionality in the sparse tensor support, please submit a feature request to https://github.com/pytorch/pytorch/issues. (Triggered internally at ..\aten\src\ATen\SparseCsrTensorImpl.cpp:55.)
    result = torch.sparse_compressed_tensor(
    C:\Users\fbrev\Documents\Acadêmico\Simulações\Python\NoisyGL\predictor\Base_Predictor.py:114: UserWarning: expandable_segments not supported on this platform (Triggered internally at ..\c10/cuda/CUDAAllocatorConfig.h:28.)
    self.edge_index = self._cpu_edge_index.to(self.device)
[I 2026-05-03 02:12:19,964] Trial 27 finished with value: 0.519551229170104 and parameters: {'lr': 0.01, 'weight_decay': 0.0001, 'n_hidden': 32, 'n_layer': 2, 'dropout': 0.4238684191290682, 'knn_mode': 'd', 'k': 34, 'dexp': 1.399856044201651, 'p_grd': 0.44046894259015046, 'unc_rem': 0.35985312792280755, 'unc_rel': 0.15652887599643853}. Best is trial 21 with value: 0.5268107573007754.
    [CPU] Loading flickr...
    DEBUG 3.1: Dataset init start
    DEBUG 3.2: prepare_data start flickr
    ----Data statistics------'
    Name: flickr
    #Nodes 7575
    #Edges 239738
    #Classes 9
    #Ave_degree 63.30
    ----Split statistics------'
    #Train samples 378 (5.0 % of nodes)
    #Val samples 1136 (15.0 % of nodes)
    #Test samples 6061 (remaining)
    ----label noise information:------
    Instance dependent noise
    #Actual noise rate 0.30
    [cuda:1] LNPCC waiting for GPU slot...
    [cuda:1] Slot acquired (waited 4.0s). Starting GCN...
    FINAL_RESULT: {'acc': {'train': 0.6604774535809018, 'valid': 0.3785211267605634, 'test': 0.5167464114832536}, 'wall_s': 120.84, 'cpu_s': 116.62, 'gpu_s': 3.93, 'wait_s': 3.96}
    [Time] wall=120.8s | cpu=116.6s | gpu=3.9s
    C:\Users\fbrev\anaconda3\envs\noisygl\Lib\site-packages\torch\_utils.py:315: UserWarning: Sparse CSR tensor support is in beta state. If you miss a functionality in the sparse tensor support, please submit a feature request to https://github.com/pytorch/pytorch/issues. (Triggered internally at ..\aten\src\ATen\SparseCsrTensorImpl.cpp:55.)
    result = torch.sparse_compressed_tensor(
    C:\Users\fbrev\Documents\Acadêmico\Simulações\Python\NoisyGL\predictor\Base_Predictor.py:114: UserWarning: expandable_segments not supported on this platform (Triggered internally at ..\c10/cuda/CUDAAllocatorConfig.h:28.)
    self.edge_index = self._cpu_edge_index.to(self.device)
[I 2026-05-03 02:14:30,236] Trial 28 finished with value: 0.5167464114832536 and parameters: {'lr': 0.01, 'weight_decay': 0.0001, 'n_hidden': 32, 'n_layer': 2, 'dropout': 0.42418553617689414, 'knn_mode': 'd', 'k': 35, 'dexp': 1.4169093091079485, 'p_grd': 0.6070013141776576, 'unc_rem': 0.36361719002835313, 'unc_rel': 0.10475422203923263}. Best is trial 21 with value: 0.5268107573007754.
    [CPU] Loading flickr...
    DEBUG 3.1: Dataset init start
    DEBUG 3.2: prepare_data start flickr
    ----Data statistics------'
    Name: flickr
    #Nodes 7575
    #Edges 239738
    #Classes 9
    #Ave_degree 63.30
    ----Split statistics------'
    #Train samples 378 (5.0 % of nodes)
    #Val samples 1136 (15.0 % of nodes)
    #Test samples 6061 (remaining)
    ----label noise information:------
    Instance dependent noise
    #Actual noise rate 0.30
    [cuda:1] LNPCC waiting for GPU slot...
    [cuda:1] Slot acquired (waited 9.2s). Starting GCN...
    FINAL_RESULT: {'acc': {'train': 0.6481481481481481, 'valid': 0.3001760563380282, 'test': 0.4157729747566408}, 'wall_s': 137.44, 'cpu_s': 133.48, 'gpu_s': 3.71, 'wait_s': 9.22}
    [Time] wall=137.4s | cpu=133.5s | gpu=3.7s
    C:\Users\fbrev\anaconda3\envs\noisygl\Lib\site-packages\torch\_utils.py:315: UserWarning: Sparse CSR tensor support is in beta state. If you miss a functionality in the sparse tensor support, please submit a feature request to https://github.com/pytorch/pytorch/issues. (Triggered internally at ..\aten\src\ATen\SparseCsrTensorImpl.cpp:55.)
    result = torch.sparse_compressed_tensor(
    C:\Users\fbrev\Documents\Acadêmico\Simulações\Python\NoisyGL\predictor\Base_Predictor.py:114: UserWarning: expandable_segments not supported on this platform (Triggered internally at ..\c10/cuda/CUDAAllocatorConfig.h:28.)
    self.edge_index = self._cpu_edge_index.to(self.device)
[I 2026-05-03 02:17:02,528] Trial 29 finished with value: 0.4157729747566408 and parameters: {'lr': 0.1, 'weight_decay': 0.0001, 'n_hidden': 32, 'n_layer': 2, 'dropout': 0.6350194411261073, 'knn_mode': 'd', 'k': 27, 'dexp': 2.0900674303474815, 'p_grd': 0.6854012537209451, 'unc_rem': 0.5152062215259419, 'unc_rel': 0.45495368427127175}. Best is trial 21 with value: 0.5268107573007754.
    [CPU] Loading flickr...
    DEBUG 3.1: Dataset init start
    DEBUG 3.2: prepare_data start flickr
    ----Data statistics------'
    Name: flickr
    #Nodes 7575
    #Edges 239738
    #Classes 9
    #Ave_degree 63.30
    ----Split statistics------'
    #Train samples 378 (5.0 % of nodes)
    #Val samples 1136 (15.0 % of nodes)
    #Test samples 6061 (remaining)
    ----label noise information:------
    Instance dependent noise
    #Actual noise rate 0.30
    [cuda:1] LNPCC waiting for GPU slot...
    [cuda:1] Slot acquired (waited 7.4s). Starting GCN...
    FINAL_RESULT: {'acc': {'train': 0.7526595744680851, 'valid': 0.3767605633802817, 'test': 0.5302755320904141}, 'wall_s': 119.77, 'cpu_s': 115.78, 'gpu_s': 3.75, 'wait_s': 7.35}
    [Time] wall=119.8s | cpu=115.8s | gpu=3.7s
    C:\Users\fbrev\anaconda3\envs\noisygl\Lib\site-packages\torch\_utils.py:315: UserWarning: Sparse CSR tensor support is in beta state. If you miss a functionality in the sparse tensor support, please submit a feature request to https://github.com/pytorch/pytorch/issues. (Triggered internally at ..\aten\src\ATen\SparseCsrTensorImpl.cpp:55.)
    result = torch.sparse_compressed_tensor(
    C:\Users\fbrev\Documents\Acadêmico\Simulações\Python\NoisyGL\predictor\Base_Predictor.py:114: UserWarning: expandable_segments not supported on this platform (Triggered internally at ..\c10/cuda/CUDAAllocatorConfig.h:28.)
    self.edge_index = self._cpu_edge_index.to(self.device)
[I 2026-05-03 02:19:14,849] Trial 30 finished with value: 0.5302755320904141 and parameters: {'lr': 0.01, 'weight_decay': 0.0001, 'n_hidden': 32, 'n_layer': 2, 'dropout': 0.47258727910552417, 'knn_mode': 'd', 'k': 41, 'dexp': 1.218080258778647, 'p_grd': 0.41828506376529073, 'unc_rem': 0.42696214140361793, 'unc_rel': 0.1876281267079763}. Best is trial 30 with value: 0.5302755320904141.
    [CPU] Loading flickr...
    DEBUG 3.1: Dataset init start
    DEBUG 3.2: prepare_data start flickr
    ----Data statistics------'
    Name: flickr
    #Nodes 7575
    #Edges 239738
    #Classes 9
    #Ave_degree 63.30
    ----Split statistics------'
    #Train samples 378 (5.0 % of nodes)
    #Val samples 1136 (15.0 % of nodes)
    #Test samples 6061 (remaining)
    ----label noise information:------
    Instance dependent noise
    #Actual noise rate 0.30
    [cuda:1] LNPCC waiting for GPU slot...
    [cuda:1] Slot acquired (waited 2.7s). Starting GCN...
    FINAL_RESULT: {'acc': {'train': 0.8116710875331565, 'valid': 0.3767605633802817, 'test': 0.5294505857119287}, 'wall_s': 134.51, 'cpu_s': 130.45, 'gpu_s': 3.81, 'wait_s': 2.74}
    [Time] wall=134.5s | cpu=130.4s | gpu=3.8s
    C:\Users\fbrev\anaconda3\envs\noisygl\Lib\site-packages\torch\_utils.py:315: UserWarning: Sparse CSR tensor support is in beta state. If you miss a functionality in the sparse tensor support, please submit a feature request to https://github.com/pytorch/pytorch/issues. (Triggered internally at ..\aten\src\ATen\SparseCsrTensorImpl.cpp:55.)
    result = torch.sparse_compressed_tensor(
    C:\Users\fbrev\Documents\Acadêmico\Simulações\Python\NoisyGL\predictor\Base_Predictor.py:114: UserWarning: expandable_segments not supported on this platform (Triggered internally at ..\c10/cuda/CUDAAllocatorConfig.h:28.)
    self.edge_index = self._cpu_edge_index.to(self.device)
[I 2026-05-03 02:21:37,807] Trial 31 finished with value: 0.5294505857119287 and parameters: {'lr': 0.01, 'weight_decay': 0.0001, 'n_hidden': 32, 'n_layer': 2, 'dropout': 0.45388691105769097, 'knn_mode': 'd', 'k': 42, 'dexp': 1.198338581071721, 'p_grd': 0.3997595501276575, 'unc_rem': 0.45566266840128156, 'unc_rel': 0.19295322096553752}. Best is trial 30 with value: 0.5302755320904141.
    [CPU] Loading flickr...
    DEBUG 3.1: Dataset init start
    DEBUG 3.2: prepare_data start flickr
    ----Data statistics------'
    Name: flickr
    #Nodes 7575
    #Edges 239738
    #Classes 9
    #Ave_degree 63.30
    ----Split statistics------'
    #Train samples 378 (5.0 % of nodes)
    #Val samples 1136 (15.0 % of nodes)
    #Test samples 6061 (remaining)
    ----label noise information:------
    Instance dependent noise
    #Actual noise rate 0.30
    [cuda:1] LNPCC waiting for GPU slot...
    [cuda:1] Slot acquired (waited 0.0s). Starting GCN...
    FINAL_RESULT: {'acc': {'train': 0.5664893617021277, 'valid': 0.37059859154929575, 'test': 0.5070120442171259}, 'wall_s': 127.9, 'cpu_s': 123.9, 'gpu_s': 3.73, 'wait_s': 0.0}
    [Time] wall=127.9s | cpu=123.9s | gpu=3.7s
    C:\Users\fbrev\anaconda3\envs\noisygl\Lib\site-packages\torch\_utils.py:315: UserWarning: Sparse CSR tensor support is in beta state. If you miss a functionality in the sparse tensor support, please submit a feature request to https://github.com/pytorch/pytorch/issues. (Triggered internally at ..\aten\src\ATen\SparseCsrTensorImpl.cpp:55.)
    result = torch.sparse_compressed_tensor(
    C:\Users\fbrev\Documents\Acadêmico\Simulações\Python\NoisyGL\predictor\Base_Predictor.py:114: UserWarning: expandable_segments not supported on this platform (Triggered internally at ..\c10/cuda/CUDAAllocatorConfig.h:28.)
    self.edge_index = self._cpu_edge_index.to(self.device)
