[I 2026-05-05 19:29:14,371] Trial 148 finished with value: 0.7785243918828114 and parameters: {'lr': 0.005, 'weight_decay': 0.0001, 'n_hidden': 128, 'n_layer': 3, 'dropout': 0.2231915839970074, 'knn_mode': 's', 'k': 48, 'dexp': 7.863007918374273, 'p_grd': 0.1450314956662436, 'unc_rem': 0.6548174004503451, 'unc_rel': 0.5881143375935297}. Best is trial 83 with value: 0.7836984276306947.
    [CPU] Loading dblp...
    DEBUG 3.1: Dataset init start
    DEBUG 3.2: prepare_data start dblp
    ----Data statistics------'
    Name: dblp
    #Nodes 17716
    #Edges 52867
    #Classes 4
    #Ave_degree 5.97
    ----Split statistics------'
    #Train samples 177 (1.0 % of nodes)
    #Val samples 2657 (15.0 % of nodes)
    #Test samples 14882 (remaining)
    ----label noise information:------
    Instance dependent noise
    #Actual noise rate 0.13
    [cuda:0] LNPCC waiting for GPU slot...
    [cuda:0] Slot acquired (waited 314.4s). Starting GCN...
    FINAL_RESULT: {'acc': {'train': 0.9770114942528736, 'valid': 0.7015430937147158, 'test': 0.7791291493078887}, 'wall_s': 40.28, 'cpu_s': 36.15, 'gpu_s': 4.07, 'wait_s': 314.45}
    [Time] wall=40.3s | cpu=36.1s | gpu=4.1s
    C:\Users\fbrev\Documents\Acadêmico\Simulações\Python\NoisyGL\predictor\Base_Predictor.py:114: UserWarning: expandable_segments not supported on this platform (Triggered internally at ..\c10/cuda/CUDAAllocatorConfig.h:28.)
    self.edge_index = self._cpu_edge_index.to(self.device)
    C:\Users\fbrev\Documents\Acadêmico\Simulações\Python\NoisyGL\predictor\Base_Predictor.py:144: UserWarning: Sparse CSR tensor support is in beta state. If you miss a functionality in the sparse tensor support, please submit a feature request to https://github.com/pytorch/pytorch/issues. (Triggered internally at ..\aten\src\ATen\SparseCsrTensorImpl.cpp:55.)
    self.adj_csr = self.adj.to_sparse_csr().to(self.device)
[I 2026-05-05 19:35:14,935] Trial 149 finished with value: 0.7791291493078887 and parameters: {'lr': 0.005, 'weight_decay': 0.0001, 'n_hidden': 128, 'n_layer': 3, 'dropout': 0.16149273689149996, 'knn_mode': 's', 'k': 44, 'dexp': 8.621013168369128, 'p_grd': 0.1454190772240128, 'unc_rem': 0.6425381260742702, 'unc_rel': 0.592839813775779}. Best is trial 83 with value: 0.7836984276306947.
    [CPU] Loading dblp...
    DEBUG 3.1: Dataset init start
    DEBUG 3.2: prepare_data start dblp
    ----Data statistics------'
    Name: dblp
    #Nodes 17716
    #Edges 52867
    #Classes 4
    #Ave_degree 5.97
    ----Split statistics------'
    #Train samples 177 (1.0 % of nodes)
    #Val samples 2657 (15.0 % of nodes)
    #Test samples 14882 (remaining)
    ----label noise information:------
    Instance dependent noise
    #Actual noise rate 0.13
    [cuda:0] LNPCC waiting for GPU slot...
    [cuda:0] Slot acquired (waited 136.2s). Starting GCN...
    FINAL_RESULT: {'acc': {'train': 0.9657142857142857, 'valid': 0.6804666917576214, 'test': 0.7556108049993281}, 'wall_s': 39.14, 'cpu_s': 34.93, 'gpu_s': 4.14, 'wait_s': 136.21}
    [Time] wall=39.1s | cpu=34.9s | gpu=4.1s
    C:\Users\fbrev\Documents\Acadêmico\Simulações\Python\NoisyGL\predictor\Base_Predictor.py:114: UserWarning: expandable_segments not supported on this platform (Triggered internally at ..\c10/cuda/CUDAAllocatorConfig.h:28.)
    self.edge_index = self._cpu_edge_index.to(self.device)
    C:\Users\fbrev\Documents\Acadêmico\Simulações\Python\NoisyGL\predictor\Base_Predictor.py:144: UserWarning: Sparse CSR tensor support is in beta state. If you miss a functionality in the sparse tensor support, please submit a feature request to https://github.com/pytorch/pytorch/issues. (Triggered internally at ..\aten\src\ATen\SparseCsrTensorImpl.cpp:55.)
    self.adj_csr = self.adj.to_sparse_csr().to(self.device)
[I 2026-05-05 19:38:15,842] Trial 150 finished with value: 0.7556108049993281 and parameters: {'lr': 0.005, 'weight_decay': 0.0001, 'n_hidden': 128, 'n_layer': 3, 'dropout': 0.15096127822399982, 'knn_mode': 's', 'k': 42, 'dexp': 8.776606415969614, 'p_grd': 0.14430997509124668, 'unc_rem': 0.6837015369789889, 'unc_rel': 0.5261458217747327}. Best is trial 83 with value: 0.7836984276306947.
    [CPU] Loading dblp...
    DEBUG 3.1: Dataset init start
    DEBUG 3.2: prepare_data start dblp
    ----Data statistics------'
    Name: dblp
    #Nodes 17716
    #Edges 52867
    #Classes 4
    #Ave_degree 5.97
    ----Split statistics------'
    #Train samples 177 (1.0 % of nodes)
    #Val samples 2657 (15.0 % of nodes)
    #Test samples 14882 (remaining)
    ----label noise information:------
    Instance dependent noise
    #Actual noise rate 0.13
    [cuda:0] LNPCC waiting for GPU slot...
    [cuda:0] Slot acquired (waited 127.3s). Starting GCN...
    FINAL_RESULT: {'acc': {'train': 0.9378531073446328, 'valid': 0.6910048927361686, 'test': 0.7736863324821932}, 'wall_s': 42.77, 'cpu_s': 38.53, 'gpu_s': 4.17, 'wait_s': 127.27}
    [Time] wall=42.8s | cpu=38.5s | gpu=4.2s
    C:\Users\fbrev\Documents\Acadêmico\Simulações\Python\NoisyGL\predictor\Base_Predictor.py:114: UserWarning: expandable_segments not supported on this platform (Triggered internally at ..\c10/cuda/CUDAAllocatorConfig.h:28.)
    self.edge_index = self._cpu_edge_index.to(self.device)
    C:\Users\fbrev\Documents\Acadêmico\Simulações\Python\NoisyGL\predictor\Base_Predictor.py:144: UserWarning: Sparse CSR tensor support is in beta state. If you miss a functionality in the sparse tensor support, please submit a feature request to https://github.com/pytorch/pytorch/issues. (Triggered internally at ..\aten\src\ATen\SparseCsrTensorImpl.cpp:55.)
    self.adj_csr = self.adj.to_sparse_csr().to(self.device)
[I 2026-05-05 19:41:11,900] Trial 151 finished with value: 0.7736863324821932 and parameters: {'lr': 0.005, 'weight_decay': 0.0001, 'n_hidden': 128, 'n_layer': 3, 'dropout': 0.2120816422478723, 'knn_mode': 's', 'k': 44, 'dexp': 7.882016738607342, 'p_grd': 0.23909508750049724, 'unc_rem': 0.6567077970286356, 'unc_rel': 0.5860612681709026}. Best is trial 83 with value: 0.7836984276306947.
    [CPU] Loading dblp...
    DEBUG 3.1: Dataset init start
    DEBUG 3.2: prepare_data start dblp
    ----Data statistics------'
    Name: dblp
    #Nodes 17716
    #Edges 52867
    #Classes 4
    #Ave_degree 5.97
    ----Split statistics------'
    #Train samples 177 (1.0 % of nodes)
    #Val samples 2657 (15.0 % of nodes)
    #Test samples 14882 (remaining)
    ----label noise information:------
    Instance dependent noise
    #Actual noise rate 0.13
    [cuda:0] LNPCC waiting for GPU slot...
    [cuda:0] Slot acquired (waited 133.9s). Starting GCN...
    FINAL_RESULT: {'acc': {'train': 0.9322033898305084, 'valid': 0.695144900263455, 'test': 0.7728127939793038}, 'wall_s': 42.45, 'cpu_s': 38.29, 'gpu_s': 4.09, 'wait_s': 133.89}
    [Time] wall=42.5s | cpu=38.3s | gpu=4.1s
    C:\Users\fbrev\Documents\Acadêmico\Simulações\Python\NoisyGL\predictor\Base_Predictor.py:114: UserWarning: expandable_segments not supported on this platform (Triggered internally at ..\c10/cuda/CUDAAllocatorConfig.h:28.)
    self.edge_index = self._cpu_edge_index.to(self.device)
    C:\Users\fbrev\Documents\Acadêmico\Simulações\Python\NoisyGL\predictor\Base_Predictor.py:144: UserWarning: Sparse CSR tensor support is in beta state. If you miss a functionality in the sparse tensor support, please submit a feature request to https://github.com/pytorch/pytorch/issues. (Triggered internally at ..\aten\src\ATen\SparseCsrTensorImpl.cpp:55.)
    self.adj_csr = self.adj.to_sparse_csr().to(self.device)
