[I 2026-04-27 02:52:58,340] Trial 74 finished with value: 0.39530492472569534 and parameters: {'lr': 0.005, 'weight_decay': 0.001, 'n_hidden': 256, 'n_layer': 3, 'dropout': 0.5959395214000882, 'knn_mode': 's', 'k': 30, 'dexp': 9.1795521290785, 'p_grd': 0.560904816240129, 'unc_rem': 0.45228251507619094, 'unc_rel': 0.9078621455099238}. Best is trial 32 with value: 0.3997448328655269.
    [CPU] Loading amazon-ratings...
    DEBUG 3.1: Dataset init start
    DEBUG 3.2: prepare_data start amazon-ratings
    ----Data statistics------'
    Name: amazon-ratings
    #Nodes 24492
    #Edges 93050
    #Classes 5
    #Ave_degree 7.60
    ----Split statistics------'
    #Train samples 1224 (5.0 % of nodes)
    #Val samples 3673 (15.0 % of nodes)
    #Test samples 19595 (remaining)
    ----label noise information:------
    Instance dependent noise
    #Actual noise rate 0.21
    [cuda:1] LNPCC waiting for GPU slot...
    [cuda:1] Slot acquired (waited 142.9s). Starting GCN...
    FINAL_RESULT: {'acc': {'train': 0.39869281045751637, 'valid': 0.348761230601688, 'test': 0.39877519775452924}, 'wall_s': 54.16, 'cpu_s': 46.24, 'gpu_s': 7.87, 'wait_s': 142.92}
    [Time] wall=54.2s | cpu=46.2s | gpu=7.9s
    C:\Users\fbrev\Documents\Acadêmico\Simulações\Python\NoisyGL\predictor\Base_Predictor.py:144: UserWarning: Sparse CSR tensor support is in beta state. If you miss a functionality in the sparse tensor support, please submit a feature request to https://github.com/pytorch/pytorch/issues. (Triggered internally at ..\aten\src\ATen\SparseCsrTensorImpl.cpp:55.)
    self.adj_csr = self.adj.to_sparse_csr().to(self.device)
[I 2026-04-27 02:56:20,666] Trial 75 finished with value: 0.39877519775452924 and parameters: {'lr': 0.005, 'weight_decay': 0.001, 'n_hidden': 256, 'n_layer': 3, 'dropout': 0.6876746265118067, 'knn_mode': 's', 'k': 37, 'dexp': 9.79478555783983, 'p_grd': 0.7262175006764444, 'unc_rem': 0.5339568097696802, 'unc_rel': 0.8866276633920465}. Best is trial 32 with value: 0.3997448328655269.
    [CPU] Loading amazon-ratings...
    DEBUG 3.1: Dataset init start
    DEBUG 3.2: prepare_data start amazon-ratings
    ----Data statistics------'
    Name: amazon-ratings
    #Nodes 24492
    #Edges 93050
    #Classes 5
    #Ave_degree 7.60
    ----Split statistics------'
    #Train samples 1224 (5.0 % of nodes)
    #Val samples 3673 (15.0 % of nodes)
    #Test samples 19595 (remaining)
    ----label noise information:------
    Instance dependent noise
    #Actual noise rate 0.21
    [cuda:1] LNPCC waiting for GPU slot...
    [cuda:1] Slot acquired (waited 139.8s). Starting GCN...
    FINAL_RESULT: {'acc': {'train': 0.4133986928104575, 'valid': 0.349305744622924, 'test': 0.39724419494769075}, 'wall_s': 50.83, 'cpu_s': 42.8, 'gpu_s': 7.98, 'wait_s': 139.84}
    [Time] wall=50.8s | cpu=42.8s | gpu=8.0s
    C:\Users\fbrev\Documents\Acadêmico\Simulações\Python\NoisyGL\predictor\Base_Predictor.py:144: UserWarning: Sparse CSR tensor support is in beta state. If you miss a functionality in the sparse tensor support, please submit a feature request to https://github.com/pytorch/pytorch/issues. (Triggered internally at ..\aten\src\ATen\SparseCsrTensorImpl.cpp:55.)
    self.adj_csr = self.adj.to_sparse_csr().to(self.device)
[I 2026-04-27 02:59:36,676] Trial 76 finished with value: 0.39724419494769075 and parameters: {'lr': 0.005, 'weight_decay': 0.001, 'n_hidden': 256, 'n_layer': 3, 'dropout': 0.6845637409715619, 'knn_mode': 's', 'k': 39, 'dexp': 6.918152384754427, 'p_grd': 0.7328132203608447, 'unc_rem': 0.6091782254237414, 'unc_rel': 0.1768272040922363}. Best is trial 32 with value: 0.3997448328655269.
    [CPU] Loading amazon-ratings...
    DEBUG 3.1: Dataset init start
    DEBUG 3.2: prepare_data start amazon-ratings
    ----Data statistics------'
    Name: amazon-ratings
    #Nodes 24492
    #Edges 93050
    #Classes 5
    #Ave_degree 7.60
    ----Split statistics------'
    #Train samples 1224 (5.0 % of nodes)
    #Val samples 3673 (15.0 % of nodes)
    #Test samples 19595 (remaining)
    ----label noise information:------
    Instance dependent noise
    #Actual noise rate 0.21
    [cuda:1] LNPCC waiting for GPU slot...
    [cuda:1] Slot acquired (waited 143.1s). Starting GCN...
    FINAL_RESULT: {'acc': {'train': 0.42354865085854454, 'valid': 0.34794445956983394, 'test': 0.3983669303393723}, 'wall_s': 48.41, 'cpu_s': 45.1, 'gpu_s': 3.26, 'wait_s': 143.11}
    [Time] wall=48.4s | cpu=45.1s | gpu=3.3s
    C:\Users\fbrev\Documents\Acadêmico\Simulações\Python\NoisyGL\predictor\Base_Predictor.py:144: UserWarning: Sparse CSR tensor support is in beta state. If you miss a functionality in the sparse tensor support, please submit a feature request to https://github.com/pytorch/pytorch/issues. (Triggered internally at ..\aten\src\ATen\SparseCsrTensorImpl.cpp:55.)
    self.adj_csr = self.adj.to_sparse_csr().to(self.device)
[I 2026-04-27 03:02:53,570] Trial 77 finished with value: 0.3983669303393723 and parameters: {'lr': 0.001, 'weight_decay': 0.0001, 'n_hidden': 64, 'n_layer': 3, 'dropout': 0.7477933013304111, 'knn_mode': 's', 'k': 37, 'dexp': 8.919706706043312, 'p_grd': 0.7810666615250078, 'unc_rem': 0.7020834075327467, 'unc_rel': 0.8843427111368032}. Best is trial 32 with value: 0.3997448328655269.
    [CPU] Loading amazon-ratings...
    DEBUG 3.1: Dataset init start
    DEBUG 3.2: prepare_data start amazon-ratings
    ----Data statistics------'
    Name: amazon-ratings
    #Nodes 24492
    #Edges 93050
    #Classes 5
    #Ave_degree 7.60
    ----Split statistics------'
    #Train samples 1224 (5.0 % of nodes)
    #Val samples 3673 (15.0 % of nodes)
    #Test samples 19595 (remaining)
    ----label noise information:------
    Instance dependent noise
    #Actual noise rate 0.21
    [cuda:1] LNPCC waiting for GPU slot...
    [cuda:1] Slot acquired (waited 143.4s). Starting GCN...
    FINAL_RESULT: {'acc': {'train': 0.4158496732026144, 'valid': 0.34821671658045195, 'test': 0.39831589691247765}, 'wall_s': 43.22, 'cpu_s': 39.9, 'gpu_s': 3.27, 'wait_s': 143.43}
    [Time] wall=43.2s | cpu=39.9s | gpu=3.3s
    C:\Users\fbrev\Documents\Acadêmico\Simulações\Python\NoisyGL\predictor\Base_Predictor.py:144: UserWarning: Sparse CSR tensor support is in beta state. If you miss a functionality in the sparse tensor support, please submit a feature request to https://github.com/pytorch/pytorch/issues. (Triggered internally at ..\aten\src\ATen\SparseCsrTensorImpl.cpp:55.)
    self.adj_csr = self.adj.to_sparse_csr().to(self.device)
[I 2026-04-27 03:06:05,550] Trial 78 finished with value: 0.39831589691247765 and parameters: {'lr': 0.001, 'weight_decay': 0.0001, 'n_hidden': 64, 'n_layer': 3, 'dropout': 0.7376543476212004, 'knn_mode': 's', 'k': 42, 'dexp': 4.818340816136818, 'p_grd': 0.8268455188808854, 'unc_rem': 0.7243957683768748, 'unc_rel': 0.8358546033393188}. Best is trial 32 with value: 0.3997448328655269.
    [CPU] Loading amazon-ratings...
    DEBUG 3.1: Dataset init start
    DEBUG 3.2: prepare_data start amazon-ratings
    ----Data statistics------'
    Name: amazon-ratings
    #Nodes 24492
    #Edges 93050
    #Classes 5
    #Ave_degree 7.60
    ----Split statistics------'
    #Train samples 1224 (5.0 % of nodes)
    #Val samples 3673 (15.0 % of nodes)
    #Test samples 19595 (remaining)
    ----label noise information:------
    Instance dependent noise
    #Actual noise rate 0.21
    [cuda:1] LNPCC waiting for GPU slot...
    [cuda:1] Slot acquired (waited 136.3s). Starting GCN...
    FINAL_RESULT: {'acc': {'train': 0.4011437908496732, 'valid': 0.3476722025592159, 'test': 0.3981627966317938}, 'wall_s': 57.28, 'cpu_s': 54.02, 'gpu_s': 3.22, 'wait_s': 136.34}
    [Time] wall=57.3s | cpu=54.0s | gpu=3.2s
    C:\Users\fbrev\Documents\Acadêmico\Simulações\Python\NoisyGL\predictor\Base_Predictor.py:144: UserWarning: Sparse CSR tensor support is in beta state. If you miss a functionality in the sparse tensor support, please submit a feature request to https://github.com/pytorch/pytorch/issues. (Triggered internally at ..\aten\src\ATen\SparseCsrTensorImpl.cpp:55.)
    self.adj_csr = self.adj.to_sparse_csr().to(self.device)
[I 2026-04-27 03:09:24,511] Trial 79 finished with value: 0.3981627966317938 and parameters: {'lr': 0.001, 'weight_decay': 0.0001, 'n_hidden': 64, 'n_layer': 3, 'dropout': 0.7553320646067814, 'knn_mode': 's', 'k': 43, 'dexp': 4.774351325516203, 'p_grd': 0.9200276775495679, 'unc_rem': 0.7076547500968469, 'unc_rel': 0.8345384950615439}. Best is trial 32 with value: 0.3997448328655269.
    [CPU] Loading amazon-ratings...
    DEBUG 3.1: Dataset init start
    DEBUG 3.2: prepare_data start amazon-ratings
    ----Data statistics------'
    Name: amazon-ratings
    #Nodes 24492
    #Edges 93050
    #Classes 5
    #Ave_degree 7.60
    ----Split statistics------'
    #Train samples 1224 (5.0 % of nodes)
    #Val samples 3673 (15.0 % of nodes)
    #Test samples 19595 (remaining)
    ----label noise information:------
    Instance dependent noise
    #Actual noise rate 0.21
    [cuda:1] LNPCC waiting for GPU slot...
    [cuda:1] Slot acquired (waited 80.0s). Starting GCN...
    FINAL_RESULT: {'acc': {'train': 0.43300653594771243, 'valid': 0.33759869316634905, 'test': 0.3883133452411329}, 'wall_s': 103.14, 'cpu_s': 100.9, 'gpu_s': 2.18, 'wait_s': 79.95}
    [Time] wall=103.1s | cpu=100.9s | gpu=2.2s
    C:\Users\fbrev\Documents\Acadêmico\Simulações\Python\NoisyGL\predictor\Base_Predictor.py:144: UserWarning: Sparse CSR tensor support is in beta state. If you miss a functionality in the sparse tensor support, please submit a feature request to https://github.com/pytorch/pytorch/issues. (Triggered internally at ..\aten\src\ATen\SparseCsrTensorImpl.cpp:55.)
    self.adj_csr = self.adj.to_sparse_csr().to(self.device)
[I 2026-04-27 03:12:32,827] Trial 80 finished with value: 0.3883133452411329 and parameters: {'lr': 0.001, 'weight_decay': 0.0001, 'n_hidden': 64, 'n_layer': 2, 'dropout': 0.6634921012424362, 'knn_mode': 'd', 'k': 50, 'dexp': 4.4197306336526445, 'p_grd': 0.9043648691530661, 'unc_rem': 0.7520679494317809, 'unc_rel': 0.7423522071387968}. Best is trial 32 with value: 0.3997448328655269.
    [CPU] Loading amazon-ratings...
    DEBUG 3.1: Dataset init start
    DEBUG 3.2: prepare_data start amazon-ratings
    ----Data statistics------'
    Name: amazon-ratings
    #Nodes 24492
    #Edges 93050
    #Classes 5
    #Ave_degree 7.60
    ----Split statistics------'
    #Train samples 1224 (5.0 % of nodes)
    #Val samples 3673 (15.0 % of nodes)
    #Test samples 19595 (remaining)
    ----label noise information:------
    Instance dependent noise
    #Actual noise rate 0.21
    [cuda:1] LNPCC waiting for GPU slot...
    [cuda:1] Slot acquired (waited 139.3s). Starting GCN...
    FINAL_RESULT: {'acc': {'train': 0.4395424836601307, 'valid': 0.3476722025592159, 'test': 0.3964786935442715}, 'wall_s': 51.05, 'cpu_s': 47.71, 'gpu_s': 3.29, 'wait_s': 139.25}
    [Time] wall=51.0s | cpu=47.7s | gpu=3.3s
    C:\Users\fbrev\Documents\Acadêmico\Simulações\Python\NoisyGL\predictor\Base_Predictor.py:144: UserWarning: Sparse CSR tensor support is in beta state. If you miss a functionality in the sparse tensor support, please submit a feature request to https://github.com/pytorch/pytorch/issues. (Triggered internally at ..\aten\src\ATen\SparseCsrTensorImpl.cpp:55.)
    self.adj_csr = self.adj.to_sparse_csr().to(self.device)
[I 2026-04-27 03:15:48,382] Trial 81 finished with value: 0.3964786935442715 and parameters: {'lr': 0.001, 'weight_decay': 0.0001, 'n_hidden': 64, 'n_layer': 3, 'dropout': 0.7539466802494975, 'knn_mode': 's', 'k': 40, 'dexp': 5.417054613628212, 'p_grd': 0.7832351030252473, 'unc_rem': 0.7863032390870621, 'unc_rel': 0.8788857428504461}. Best is trial 32 with value: 0.3997448328655269.
    [CPU] Loading amazon-ratings...
    DEBUG 3.1: Dataset init start
    DEBUG 3.2: prepare_data start amazon-ratings
    ----Data statistics------'
    Name: amazon-ratings
    #Nodes 24492
    #Edges 93050
    #Classes 5
    #Ave_degree 7.60
    ----Split statistics------'
    #Train samples 1224 (5.0 % of nodes)
    #Val samples 3673 (15.0 % of nodes)
    #Test samples 19595 (remaining)
    ----label noise information:------
    Instance dependent noise
    #Actual noise rate 0.21
    [cuda:1] LNPCC waiting for GPU slot...
    [cuda:1] Slot acquired (waited 127.6s). Starting GCN...
    FINAL_RESULT: {'acc': {'train': 0.4362745098039216, 'valid': 0.348761230601688, 'test': 0.39933656545037}, 'wall_s': 58.49, 'cpu_s': 55.07, 'gpu_s': 3.37, 'wait_s': 127.56}
    [Time] wall=58.5s | cpu=55.1s | gpu=3.4s
    C:\Users\fbrev\Documents\Acadêmico\Simulações\Python\NoisyGL\predictor\Base_Predictor.py:144: UserWarning: Sparse CSR tensor support is in beta state. If you miss a functionality in the sparse tensor support, please submit a feature request to https://github.com/pytorch/pytorch/issues. (Triggered internally at ..\aten\src\ATen\SparseCsrTensorImpl.cpp:55.)
    self.adj_csr = self.adj.to_sparse_csr().to(self.device)
[I 2026-04-27 03:18:59,939] Trial 82 finished with value: 0.39933656545037 and parameters: {'lr': 0.001, 'weight_decay': 0.0001, 'n_hidden': 64, 'n_layer': 3, 'dropout': 0.7697648845523353, 'knn_mode': 's', 'k': 43, 'dexp': 4.764628048370259, 'p_grd': 0.905112978868233, 'unc_rem': 0.7000946472289827, 'unc_rel': 0.834919223906948}. Best is trial 32 with value: 0.3997448328655269.
    [CPU] Loading amazon-ratings...
    DEBUG 3.1: Dataset init start
    DEBUG 3.2: prepare_data start amazon-ratings
    ----Data statistics------'
    Name: amazon-ratings
    #Nodes 24492
    #Edges 93050
    #Classes 5
    #Ave_degree 7.60
    ----Split statistics------'
    #Train samples 1224 (5.0 % of nodes)
    #Val samples 3673 (15.0 % of nodes)
    #Test samples 19595 (remaining)
    ----label noise information:------
    Instance dependent noise
    #Actual noise rate 0.21
    [cuda:1] LNPCC waiting for GPU slot...
    [cuda:1] Slot acquired (waited 125.7s). Starting GCN...
    FINAL_RESULT: {'acc': {'train': 0.4199346405228758, 'valid': 0.3498502586441601, 'test': 0.40051033426894617}, 'wall_s': 61.11, 'cpu_s': 57.84, 'gpu_s': 3.21, 'wait_s': 125.66}
    [Time] wall=61.1s | cpu=57.8s | gpu=3.2s
    C:\Users\fbrev\Documents\Acadêmico\Simulações\Python\NoisyGL\predictor\Base_Predictor.py:144: UserWarning: Sparse CSR tensor support is in beta state. If you miss a functionality in the sparse tensor support, please submit a feature request to https://github.com/pytorch/pytorch/issues. (Triggered internally at ..\aten\src\ATen\SparseCsrTensorImpl.cpp:55.)
    self.adj_csr = self.adj.to_sparse_csr().to(self.device)
[I 2026-04-27 03:22:12,569] Trial 83 finished with value: 0.40051033426894617 and parameters: {'lr': 0.001, 'weight_decay': 0.0001, 'n_hidden': 64, 'n_layer': 3, 'dropout': 0.7843789712113258, 'knn_mode': 's', 'k': 46, 'dexp': 3.7295013032528086, 'p_grd': 0.827235911496556, 'unc_rem': 0.8503303477350808, 'unc_rel': 0.8071292856994153}. Best is trial 83 with value: 0.40051033426894617.
    [CPU] Loading amazon-ratings...
    DEBUG 3.1: Dataset init start
    DEBUG 3.2: prepare_data start amazon-ratings
    ----Data statistics------'
    Name: amazon-ratings
    #Nodes 24492
    #Edges 93050
    #Classes 5
    #Ave_degree 7.60
    ----Split statistics------'
    #Train samples 1224 (5.0 % of nodes)
    #Val samples 3673 (15.0 % of nodes)
    #Test samples 19595 (remaining)
    ----label noise information:------
    Instance dependent noise
    #Actual noise rate 0.21
    [cuda:1] LNPCC waiting for GPU slot...
    [cuda:1] Slot acquired (waited 123.8s). Starting GCN...
    FINAL_RESULT: {'acc': {'train': 0.42810457516339867, 'valid': 0.3498502586441601, 'test': 0.3997448328655269}, 'wall_s': 72.07, 'cpu_s': 68.71, 'gpu_s': 3.31, 'wait_s': 123.77}
    [Time] wall=72.1s | cpu=68.7s | gpu=3.3s
    C:\Users\fbrev\Documents\Acadêmico\Simulações\Python\NoisyGL\predictor\Base_Predictor.py:144: UserWarning: Sparse CSR tensor support is in beta state. If you miss a functionality in the sparse tensor support, please submit a feature request to https://github.com/pytorch/pytorch/issues. (Triggered internally at ..\aten\src\ATen\SparseCsrTensorImpl.cpp:55.)
    self.adj_csr = self.adj.to_sparse_csr().to(self.device)
[I 2026-04-27 03:25:33,825] Trial 84 finished with value: 0.3997448328655269 and parameters: {'lr': 0.001, 'weight_decay': 0.0001, 'n_hidden': 64, 'n_layer': 3, 'dropout': 0.7777900462550071, 'knn_mode': 's', 'k': 48, 'dexp': 2.7218632497875075, 'p_grd': 0.9271901683466172, 'unc_rem': 0.8730757896482282, 'unc_rel': 0.791076460860837}. Best is trial 83 with value: 0.40051033426894617.
    [CPU] Loading amazon-ratings...
    DEBUG 3.1: Dataset init start
    DEBUG 3.2: prepare_data start amazon-ratings
    ----Data statistics------'
    Name: amazon-ratings
    #Nodes 24492
    #Edges 93050
    #Classes 5
    #Ave_degree 7.60
    ----Split statistics------'
    #Train samples 1224 (5.0 % of nodes)
    #Val samples 3673 (15.0 % of nodes)
    #Test samples 19595 (remaining)
    ----label noise information:------
    Instance dependent noise
    #Actual noise rate 0.21
    [cuda:1] LNPCC waiting for GPU slot...
    [cuda:1] Slot acquired (waited 115.5s). Starting GCN...
    FINAL_RESULT: {'acc': {'train': 0.41013071895424835, 'valid': 0.34794445956983394, 'test': 0.39933656545037}, 'wall_s': 87.04, 'cpu_s': 83.59, 'gpu_s': 3.4, 'wait_s': 115.48}
    [Time] wall=87.0s | cpu=83.6s | gpu=3.4s
    C:\Users\fbrev\Documents\Acadêmico\Simulações\Python\NoisyGL\predictor\Base_Predictor.py:144: UserWarning: Sparse CSR tensor support is in beta state. If you miss a functionality in the sparse tensor support, please submit a feature request to https://github.com/pytorch/pytorch/issues. (Triggered internally at ..\aten\src\ATen\SparseCsrTensorImpl.cpp:55.)
    self.adj_csr = self.adj.to_sparse_csr().to(self.device)
