[I 2026-05-06 18:52:30,988] Trial 23 finished with value: 0.604 and parameters: {'lr': 0.01, 'weight_decay': 0.0, 'n_hidden': 256, 'n_layer': 3, 'dropout': 0.41160971037642946, 'knn_mode': 's', 'k': 24, 'dexp': 4.633037724324533, 'p_grd': 0.623174986585139, 'unc_rem': 0.6125364492853749, 'unc_rel': 0.6136764124897903}. Best is trial 18 with value: 0.625.
    [CPU] Loading pubmed...
    DEBUG 3.1: Dataset init start
    DEBUG 3.2: prepare_data start pubmed
    ----Data statistics------'
    Name: pubmed
    #Nodes 19717
    #Edges 44324
    #Classes 3
    #Ave_degree 4.50
    ----Split statistics------'
    #Train samples 60 (default)
    #Val samples 500 (default)
    #Test samples 1000 (default)
    ----label noise information:------
    Instance dependent noise
    #Actual noise rate 0.40
    [cuda:1] LNPCC waiting for GPU slot...
    [cuda:1] Slot acquired (waited 318.2s). Starting GCN...
    FINAL_RESULT: {'acc': {'train': 0.7333333333333333, 'valid': 0.434, 'test': 0.609}, 'wall_s': 28.52, 'cpu_s': 25.07, 'gpu_s': 3.4, 'wait_s': 318.18}
    [Time] wall=28.5s | cpu=25.1s | gpu=3.4s
    C:\Users\fbrev\Documents\Acadêmico\Simulações\Python\NoisyGL\predictor\Base_Predictor.py:114: UserWarning: expandable_segments not supported on this platform (Triggered internally at ..\c10/cuda/CUDAAllocatorConfig.h:28.)
    self.edge_index = self._cpu_edge_index.to(self.device)
    C:\Users\fbrev\Documents\Acadêmico\Simulações\Python\NoisyGL\predictor\Base_Predictor.py:144: UserWarning: Sparse CSR tensor support is in beta state. If you miss a functionality in the sparse tensor support, please submit a feature request to https://github.com/pytorch/pytorch/issues. (Triggered internally at ..\aten\src\ATen\SparseCsrTensorImpl.cpp:55.)
    self.adj_csr = self.adj.to_sparse_csr().to(self.device)
[I 2026-05-06 18:58:23,774] Trial 24 finished with value: 0.609 and parameters: {'lr': 0.1, 'weight_decay': 0.0001, 'n_hidden': 64, 'n_layer': 3, 'dropout': 0.4200653519747377, 'knn_mode': 's', 'k': 35, 'dexp': 7.008008079353743, 'p_grd': 0.5562132360030522, 'unc_rem': 0.9882722394355498, 'unc_rel': 0.17133771119716024}. Best is trial 18 with value: 0.625.
    [CPU] Loading pubmed...
    DEBUG 3.1: Dataset init start
    DEBUG 3.2: prepare_data start pubmed
    ----Data statistics------'
    Name: pubmed
    #Nodes 19717
    #Edges 44324
    #Classes 3
    #Ave_degree 4.50
    ----Split statistics------'
    #Train samples 60 (default)
    #Val samples 500 (default)
    #Test samples 1000 (default)
    ----label noise information:------
    Instance dependent noise
    #Actual noise rate 0.40
    [cuda:1] LNPCC waiting for GPU slot...
    [cuda:1] Slot acquired (waited 547.6s). Starting GCN...
    FINAL_RESULT: {'acc': {'train': 0.5344827586206896, 'valid': 0.43, 'test': 0.598}, 'wall_s': 31.58, 'cpu_s': 25.52, 'gpu_s': 6.01, 'wait_s': 547.64}
    [Time] wall=31.6s | cpu=25.5s | gpu=6.0s
    C:\Users\fbrev\Documents\Acadêmico\Simulações\Python\NoisyGL\predictor\Base_Predictor.py:114: UserWarning: expandable_segments not supported on this platform (Triggered internally at ..\c10/cuda/CUDAAllocatorConfig.h:28.)
    self.edge_index = self._cpu_edge_index.to(self.device)
    C:\Users\fbrev\Documents\Acadêmico\Simulações\Python\NoisyGL\predictor\Base_Predictor.py:144: UserWarning: Sparse CSR tensor support is in beta state. If you miss a functionality in the sparse tensor support, please submit a feature request to https://github.com/pytorch/pytorch/issues. (Triggered internally at ..\aten\src\ATen\SparseCsrTensorImpl.cpp:55.)
    self.adj_csr = self.adj.to_sparse_csr().to(self.device)
[I 2026-05-06 19:08:09,872] Trial 25 finished with value: 0.598 and parameters: {'lr': 0.05, 'weight_decay': 0.0, 'n_hidden': 256, 'n_layer': 3, 'dropout': 0.12761083770939904, 'knn_mode': 's', 'k': 18, 'dexp': 1.4762917710154753, 'p_grd': 0.15637833653169625, 'unc_rem': 0.5251098435591551, 'unc_rel': 0.6893062119076994}. Best is trial 18 with value: 0.625.
    [CPU] Loading pubmed...
    DEBUG 3.1: Dataset init start
    DEBUG 3.2: prepare_data start pubmed
    ----Data statistics------'
    Name: pubmed
    #Nodes 19717
    #Edges 44324
    #Classes 3
    #Ave_degree 4.50
    ----Split statistics------'
    #Train samples 60 (default)
    #Val samples 500 (default)
    #Test samples 1000 (default)
    ----label noise information:------
    Instance dependent noise
    #Actual noise rate 0.40
    [cuda:1] LNPCC waiting for GPU slot...
    [cuda:1] Slot acquired (waited 1213.1s). Starting GCN...
    FINAL_RESULT: {'acc': {'train': 0.6610169491525424, 'valid': 0.416, 'test': 0.596}, 'wall_s': 34.29, 'cpu_s': 28.53, 'gpu_s': 5.69, 'wait_s': 1213.08}
    [Time] wall=34.3s | cpu=28.5s | gpu=5.7s
    C:\Users\fbrev\Documents\Acadêmico\Simulações\Python\NoisyGL\predictor\Base_Predictor.py:114: UserWarning: expandable_segments not supported on this platform (Triggered internally at ..\c10/cuda/CUDAAllocatorConfig.h:28.)
    self.edge_index = self._cpu_edge_index.to(self.device)
    C:\Users\fbrev\Documents\Acadêmico\Simulações\Python\NoisyGL\predictor\Base_Predictor.py:144: UserWarning: Sparse CSR tensor support is in beta state. If you miss a functionality in the sparse tensor support, please submit a feature request to https://github.com/pytorch/pytorch/issues. (Triggered internally at ..\aten\src\ATen\SparseCsrTensorImpl.cpp:55.)
    self.adj_csr = self.adj.to_sparse_csr().to(self.device)
[I 2026-05-06 19:29:03,867] Trial 26 finished with value: 0.596 and parameters: {'lr': 0.001, 'weight_decay': 0.001, 'n_hidden': 256, 'n_layer': 3, 'dropout': 0.2645131494362233, 'knn_mode': 's', 'k': 29, 'dexp': 4.922047830436639, 'p_grd': 0.3056868806882971, 'unc_rem': 0.4211495362927208, 'unc_rel': 0.8885989309900345}. Best is trial 18 with value: 0.625.
    [CPU] Loading pubmed...
    DEBUG 3.1: Dataset init start
    DEBUG 3.2: prepare_data start pubmed
    ----Data statistics------'
    Name: pubmed
    #Nodes 19717
    #Edges 44324
    #Classes 3
    #Ave_degree 4.50
    ----Split statistics------'
    #Train samples 60 (default)
    #Val samples 500 (default)
    #Test samples 1000 (default)
    ----label noise information:------
    Instance dependent noise
    #Actual noise rate 0.40
    [cuda:1] LNPCC waiting for GPU slot...
    [cuda:1] Slot acquired (waited 308.1s). Starting GCN...
    FINAL_RESULT: {'acc': {'train': 0.6666666666666666, 'valid': 0.416, 'test': 0.588}, 'wall_s': 28.73, 'cpu_s': 25.68, 'gpu_s': 3.0, 'wait_s': 308.09}
    [Time] wall=28.7s | cpu=25.7s | gpu=3.0s
    C:\Users\fbrev\Documents\Acadêmico\Simulações\Python\NoisyGL\predictor\Base_Predictor.py:114: UserWarning: expandable_segments not supported on this platform (Triggered internally at ..\c10/cuda/CUDAAllocatorConfig.h:28.)
    self.edge_index = self._cpu_edge_index.to(self.device)
    C:\Users\fbrev\Documents\Acadêmico\Simulações\Python\NoisyGL\predictor\Base_Predictor.py:144: UserWarning: Sparse CSR tensor support is in beta state. If you miss a functionality in the sparse tensor support, please submit a feature request to https://github.com/pytorch/pytorch/issues. (Triggered internally at ..\aten\src\ATen\SparseCsrTensorImpl.cpp:55.)
    self.adj_csr = self.adj.to_sparse_csr().to(self.device)
[I 2026-05-06 19:34:46,422] Trial 27 finished with value: 0.588 and parameters: {'lr': 0.01, 'weight_decay': 0.001, 'n_hidden': 64, 'n_layer': 3, 'dropout': 0.5709044161219181, 'knn_mode': 's', 'k': 20, 'dexp': 6.049160373955851, 'p_grd': 0.436565687604036, 'unc_rem': 0.8137242611412965, 'unc_rel': 0.43149443487245315}. Best is trial 18 with value: 0.625.
    [CPU] Loading pubmed...
    DEBUG 3.1: Dataset init start
    DEBUG 3.2: prepare_data start pubmed
    ----Data statistics------'
    Name: pubmed
    #Nodes 19717
    #Edges 44324
    #Classes 3
    #Ave_degree 4.50
    ----Split statistics------'
    #Train samples 60 (default)
    #Val samples 500 (default)
    #Test samples 1000 (default)
    ----label noise information:------
    Instance dependent noise
    #Actual noise rate 0.40
    [cuda:1] LNPCC waiting for GPU slot...
    [cuda:1] Slot acquired (waited 667.8s). Starting GCN...
    FINAL_RESULT: {'acc': {'train': 0.8181818181818182, 'valid': 0.414, 'test': 0.605}, 'wall_s': 29.7, 'cpu_s': 23.67, 'gpu_s': 5.97, 'wait_s': 667.77}
    [Time] wall=29.7s | cpu=23.7s | gpu=6.0s
    C:\Users\fbrev\Documents\Acadêmico\Simulações\Python\NoisyGL\predictor\Base_Predictor.py:114: UserWarning: expandable_segments not supported on this platform (Triggered internally at ..\c10/cuda/CUDAAllocatorConfig.h:28.)
    self.edge_index = self._cpu_edge_index.to(self.device)
    C:\Users\fbrev\Documents\Acadêmico\Simulações\Python\NoisyGL\predictor\Base_Predictor.py:144: UserWarning: Sparse CSR tensor support is in beta state. If you miss a functionality in the sparse tensor support, please submit a feature request to https://github.com/pytorch/pytorch/issues. (Triggered internally at ..\aten\src\ATen\SparseCsrTensorImpl.cpp:55.)
    self.adj_csr = self.adj.to_sparse_csr().to(self.device)
[I 2026-05-06 19:46:29,880] Trial 28 finished with value: 0.605 and parameters: {'lr': 0.001, 'weight_decay': 0.0, 'n_hidden': 256, 'n_layer': 3, 'dropout': 0.10931537032312766, 'knn_mode': 's', 'k': 15, 'dexp': 7.6355078790720174, 'p_grd': 0.11252653334824358, 'unc_rem': 0.6513451824381523, 'unc_rel': 0.12538276337022677}. Best is trial 18 with value: 0.625.
    [CPU] Loading pubmed...
    DEBUG 3.1: Dataset init start
    DEBUG 3.2: prepare_data start pubmed
    ----Data statistics------'
    Name: pubmed
    #Nodes 19717
    #Edges 44324
    #Classes 3
    #Ave_degree 4.50
    ----Split statistics------'
    #Train samples 60 (default)
    #Val samples 500 (default)
    #Test samples 1000 (default)
    ----label noise information:------
    Instance dependent noise
    #Actual noise rate 0.40
    [cuda:1] LNPCC waiting for GPU slot...
    [cuda:1] Slot acquired (waited 316.0s). Starting GCN...
    FINAL_RESULT: {'acc': {'train': 0.6666666666666666, 'valid': 0.432, 'test': 0.61}, 'wall_s': 33.51, 'cpu_s': 27.68, 'gpu_s': 5.77, 'wait_s': 316.04}
    [Time] wall=33.5s | cpu=27.7s | gpu=5.8s
    C:\Users\fbrev\Documents\Acadêmico\Simulações\Python\NoisyGL\predictor\Base_Predictor.py:114: UserWarning: expandable_segments not supported on this platform (Triggered internally at ..\c10/cuda/CUDAAllocatorConfig.h:28.)
    self.edge_index = self._cpu_edge_index.to(self.device)
    C:\Users\fbrev\Documents\Acadêmico\Simulações\Python\NoisyGL\predictor\Base_Predictor.py:144: UserWarning: Sparse CSR tensor support is in beta state. If you miss a functionality in the sparse tensor support, please submit a feature request to https://github.com/pytorch/pytorch/issues. (Triggered internally at ..\aten\src\ATen\SparseCsrTensorImpl.cpp:55.)
    self.adj_csr = self.adj.to_sparse_csr().to(self.device)
[I 2026-05-06 19:52:25,836] Trial 29 finished with value: 0.61 and parameters: {'lr': 0.01, 'weight_decay': 0.0001, 'n_hidden': 256, 'n_layer': 3, 'dropout': 0.4399695656291343, 'knn_mode': 's', 'k': 25, 'dexp': 6.496243440154323, 'p_grd': 0.5684858535950066, 'unc_rem': 0.4640432367007738, 'unc_rel': 0.5193907968514337}. Best is trial 18 with value: 0.625.
    [CPU] Loading pubmed...
    DEBUG 3.1: Dataset init start
    DEBUG 3.2: prepare_data start pubmed
    ----Data statistics------'
    Name: pubmed
    #Nodes 19717
    #Edges 44324
    #Classes 3
    #Ave_degree 4.50
    ----Split statistics------'
    #Train samples 60 (default)
    #Val samples 500 (default)
    #Test samples 1000 (default)
    ----label noise information:------
    Instance dependent noise
    #Actual noise rate 0.40
    [cuda:1] LNPCC waiting for GPU slot...
    [cuda:1] Slot acquired (waited 663.7s). Starting GCN...
    FINAL_RESULT: {'acc': {'train': 0.6333333333333333, 'valid': 0.432, 'test': 0.593}, 'wall_s': 31.77, 'cpu_s': 28.72, 'gpu_s': 2.99, 'wait_s': 663.69}
    [Time] wall=31.8s | cpu=28.7s | gpu=3.0s
    C:\Users\fbrev\Documents\Acadêmico\Simulações\Python\NoisyGL\predictor\Base_Predictor.py:114: UserWarning: expandable_segments not supported on this platform (Triggered internally at ..\c10/cuda/CUDAAllocatorConfig.h:28.)
    self.edge_index = self._cpu_edge_index.to(self.device)
    C:\Users\fbrev\Documents\Acadêmico\Simulações\Python\NoisyGL\predictor\Base_Predictor.py:144: UserWarning: Sparse CSR tensor support is in beta state. If you miss a functionality in the sparse tensor support, please submit a feature request to https://github.com/pytorch/pytorch/issues. (Triggered internally at ..\aten\src\ATen\SparseCsrTensorImpl.cpp:55.)
    self.adj_csr = self.adj.to_sparse_csr().to(self.device)
[I 2026-05-06 20:04:07,655] Trial 30 finished with value: 0.593 and parameters: {'lr': 0.05, 'weight_decay': 0.0001, 'n_hidden': 64, 'n_layer': 3, 'dropout': 0.26050246293238316, 'knn_mode': 's', 'k': 35, 'dexp': 4.205261928535041, 'p_grd': 0.5296997973141467, 'unc_rem': 0.7887629442874482, 'unc_rel': 0.5514169432782525}. Best is trial 18 with value: 0.625.
    [CPU] Loading pubmed...
    DEBUG 3.1: Dataset init start
    DEBUG 3.2: prepare_data start pubmed
    ----Data statistics------'
    Name: pubmed
    #Nodes 19717
    #Edges 44324
    #Classes 3
    #Ave_degree 4.50
    ----Split statistics------'
    #Train samples 60 (default)
    #Val samples 500 (default)
    #Test samples 1000 (default)
    ----label noise information:------
    Instance dependent noise
    #Actual noise rate 0.40
    [cuda:1] LNPCC waiting for GPU slot...
    [cuda:1] Slot acquired (waited 155.4s). Starting GCN...
    FINAL_RESULT: {'acc': {'train': 0.65, 'valid': 0.422, 'test': 0.587}, 'wall_s': 33.88, 'cpu_s': 27.99, 'gpu_s': 5.83, 'wait_s': 155.45}
    [Time] wall=33.9s | cpu=28.0s | gpu=5.8s
    C:\Users\fbrev\Documents\Acadêmico\Simulações\Python\NoisyGL\predictor\Base_Predictor.py:114: UserWarning: expandable_segments not supported on this platform (Triggered internally at ..\c10/cuda/CUDAAllocatorConfig.h:28.)
    self.edge_index = self._cpu_edge_index.to(self.device)
    C:\Users\fbrev\Documents\Acadêmico\Simulações\Python\NoisyGL\predictor\Base_Predictor.py:144: UserWarning: Sparse CSR tensor support is in beta state. If you miss a functionality in the sparse tensor support, please submit a feature request to https://github.com/pytorch/pytorch/issues. (Triggered internally at ..\aten\src\ATen\SparseCsrTensorImpl.cpp:55.)
    self.adj_csr = self.adj.to_sparse_csr().to(self.device)
[I 2026-05-06 20:07:23,254] Trial 31 finished with value: 0.587 and parameters: {'lr': 0.05, 'weight_decay': 0.0, 'n_hidden': 256, 'n_layer': 3, 'dropout': 0.37803305092614686, 'knn_mode': 's', 'k': 24, 'dexp': 9.136466600807777, 'p_grd': 0.4005303755603635, 'unc_rem': 0.8877148982462504, 'unc_rel': 0.5908898897023204}. Best is trial 18 with value: 0.625.
    [CPU] Loading pubmed...
    DEBUG 3.1: Dataset init start
    DEBUG 3.2: prepare_data start pubmed
    ----Data statistics------'
    Name: pubmed
    #Nodes 19717
    #Edges 44324
    #Classes 3
    #Ave_degree 4.50
    ----Split statistics------'
    #Train samples 60 (default)
    #Val samples 500 (default)
    #Test samples 1000 (default)
    ----label noise information:------
    Instance dependent noise
    #Actual noise rate 0.40
    [cuda:1] LNPCC waiting for GPU slot...
    [cuda:1] Slot acquired (waited 131.6s). Starting GCN...
    FINAL_RESULT: {'acc': {'train': 0.6666666666666666, 'valid': 0.432, 'test': 0.608}, 'wall_s': 32.21, 'cpu_s': 26.25, 'gpu_s': 5.91, 'wait_s': 131.63}
    [Time] wall=32.2s | cpu=26.2s | gpu=5.9s
    C:\Users\fbrev\Documents\Acadêmico\Simulações\Python\NoisyGL\predictor\Base_Predictor.py:114: UserWarning: expandable_segments not supported on this platform (Triggered internally at ..\c10/cuda/CUDAAllocatorConfig.h:28.)
    self.edge_index = self._cpu_edge_index.to(self.device)
    C:\Users\fbrev\Documents\Acadêmico\Simulações\Python\NoisyGL\predictor\Base_Predictor.py:144: UserWarning: Sparse CSR tensor support is in beta state. If you miss a functionality in the sparse tensor support, please submit a feature request to https://github.com/pytorch/pytorch/issues. (Triggered internally at ..\aten\src\ATen\SparseCsrTensorImpl.cpp:55.)
    self.adj_csr = self.adj.to_sparse_csr().to(self.device)
[I 2026-05-06 20:10:12,924] Trial 32 finished with value: 0.608 and parameters: {'lr': 0.05, 'weight_decay': 0.0, 'n_hidden': 256, 'n_layer': 3, 'dropout': 0.3372355639640416, 'knn_mode': 's', 'k': 22, 'dexp': 9.774382344994088, 'p_grd': 0.44626180120698955, 'unc_rem': 0.8589050002578337, 'unc_rel': 0.8394038468305847}. Best is trial 18 with value: 0.625.
    [CPU] Loading pubmed...
    DEBUG 3.1: Dataset init start
    DEBUG 3.2: prepare_data start pubmed
    ----Data statistics------'
    Name: pubmed
    #Nodes 19717
    #Edges 44324
    #Classes 3
    #Ave_degree 4.50
    ----Split statistics------'
    #Train samples 60 (default)
    #Val samples 500 (default)
    #Test samples 1000 (default)
    ----label noise information:------
    Instance dependent noise
    #Actual noise rate 0.40
    [cuda:1] LNPCC waiting for GPU slot...
    [cuda:1] Slot acquired (waited 324.1s). Starting GCN...
    FINAL_RESULT: {'acc': {'train': 0.6666666666666666, 'valid': 0.426, 'test': 0.602}, 'wall_s': 32.42, 'cpu_s': 26.42, 'gpu_s': 5.95, 'wait_s': 324.13}
    [Time] wall=32.4s | cpu=26.4s | gpu=6.0s
    C:\Users\fbrev\Documents\Acadêmico\Simulações\Python\NoisyGL\predictor\Base_Predictor.py:114: UserWarning: expandable_segments not supported on this platform (Triggered internally at ..\c10/cuda/CUDAAllocatorConfig.h:28.)
    self.edge_index = self._cpu_edge_index.to(self.device)
    C:\Users\fbrev\Documents\Acadêmico\Simulações\Python\NoisyGL\predictor\Base_Predictor.py:144: UserWarning: Sparse CSR tensor support is in beta state. If you miss a functionality in the sparse tensor support, please submit a feature request to https://github.com/pytorch/pytorch/issues. (Triggered internally at ..\aten\src\ATen\SparseCsrTensorImpl.cpp:55.)
    self.adj_csr = self.adj.to_sparse_csr().to(self.device)
[I 2026-05-06 20:16:15,193] Trial 33 finished with value: 0.602 and parameters: {'lr': 0.05, 'weight_decay': 0.0, 'n_hidden': 256, 'n_layer': 3, 'dropout': 0.06420581877739862, 'knn_mode': 's', 'k': 33, 'dexp': 8.758295397025867, 'p_grd': 0.318053521981267, 'unc_rem': 0.992779886161939, 'unc_rel': 0.6693600138209028}. Best is trial 18 with value: 0.625.
    [CPU] Loading pubmed...
    DEBUG 3.1: Dataset init start
    DEBUG 3.2: prepare_data start pubmed
    ----Data statistics------'
    Name: pubmed
    #Nodes 19717
    #Edges 44324
    #Classes 3
    #Ave_degree 4.50
    ----Split statistics------'
    #Train samples 60 (default)
    #Val samples 500 (default)
    #Test samples 1000 (default)
    ----label noise information:------
    Instance dependent noise
    #Actual noise rate 0.40
    [cuda:1] LNPCC waiting for GPU slot...
    [cuda:1] Slot acquired (waited 321.6s). Starting GCN...
    FINAL_RESULT: {'acc': {'train': 0.4, 'valid': 0.324, 'test': 0.413}, 'wall_s': 33.94, 'cpu_s': 27.89, 'gpu_s': 5.99, 'wait_s': 321.56}
    [Time] wall=33.9s | cpu=27.9s | gpu=6.0s
    C:\Users\fbrev\Documents\Acadêmico\Simulações\Python\NoisyGL\predictor\Base_Predictor.py:114: UserWarning: expandable_segments not supported on this platform (Triggered internally at ..\c10/cuda/CUDAAllocatorConfig.h:28.)
    self.edge_index = self._cpu_edge_index.to(self.device)
    C:\Users\fbrev\Documents\Acadêmico\Simulações\Python\NoisyGL\predictor\Base_Predictor.py:144: UserWarning: Sparse CSR tensor support is in beta state. If you miss a functionality in the sparse tensor support, please submit a feature request to https://github.com/pytorch/pytorch/issues. (Triggered internally at ..\aten\src\ATen\SparseCsrTensorImpl.cpp:55.)
    self.adj_csr = self.adj.to_sparse_csr().to(self.device)
[I 2026-05-06 20:22:17,566] Trial 34 finished with value: 0.413 and parameters: {'lr': 0.05, 'weight_decay': 0.05, 'n_hidden': 256, 'n_layer': 3, 'dropout': 0.45700432649637496, 'knn_mode': 's', 'k': 39, 'dexp': 9.476635958946062, 'p_grd': 0.4328033272599371, 'unc_rem': 0.9411136889516514, 'unc_rel': 0.5650112146865652}. Best is trial 18 with value: 0.625.
    [CPU] Loading pubmed...
    DEBUG 3.1: Dataset init start
    DEBUG 3.2: prepare_data start pubmed
    ----Data statistics------'
    Name: pubmed
    #Nodes 19717
    #Edges 44324
    #Classes 3
    #Ave_degree 4.50
    ----Split statistics------'
    #Train samples 60 (default)
    #Val samples 500 (default)
    #Test samples 1000 (default)
    ----label noise information:------
    Instance dependent noise
    #Actual noise rate 0.40
    [cuda:1] LNPCC waiting for GPU slot...
    [cuda:1] Slot acquired (waited 336.6s). Starting GCN...
    FINAL_RESULT: {'acc': {'train': 0.65, 'valid': 0.442, 'test': 0.608}, 'wall_s': 28.46, 'cpu_s': 25.4, 'gpu_s': 3.0, 'wait_s': 336.6}
    [Time] wall=28.5s | cpu=25.4s | gpu=3.0s
    C:\Users\fbrev\Documents\Acadêmico\Simulações\Python\NoisyGL\predictor\Base_Predictor.py:114: UserWarning: expandable_segments not supported on this platform (Triggered internally at ..\c10/cuda/CUDAAllocatorConfig.h:28.)
    self.edge_index = self._cpu_edge_index.to(self.device)
    C:\Users\fbrev\Documents\Acadêmico\Simulações\Python\NoisyGL\predictor\Base_Predictor.py:144: UserWarning: Sparse CSR tensor support is in beta state. If you miss a functionality in the sparse tensor support, please submit a feature request to https://github.com/pytorch/pytorch/issues. (Triggered internally at ..\aten\src\ATen\SparseCsrTensorImpl.cpp:55.)
    self.adj_csr = self.adj.to_sparse_csr().to(self.device)
