[I 2026-05-01 22:14:17,649] Trial 45 finished with value: 0.897 and parameters: {'lr': 0.005, 'weight_decay': 0.0001, 'n_hidden': 64, 'n_layer': 2, 'dropout': 0.5436907062222228, 'knn_mode': 'd', 'k': 30, 'dexp': 8.682362966373066, 'p_grd': 0.3638598874942962, 'unc_rem': 0.3308145405561168, 'unc_rel': 0.30891887571794974}. Best is trial 43 with value: 0.909.
    [CPU] Loading amazonpho...
    DEBUG 3.1: Dataset init start
    DEBUG 3.2: prepare_data start amazonpho
    ----Data statistics------'
    Name: amazonpho
    #Nodes 7650
    #Edges 119081
    #Classes 8
    #Ave_degree 31.13
    ----Split statistics------'
    #Train samples 160 (20 nodes per class)
    #Val samples 500 (specified)
    #Test samples 1000 (specified)
    ----label noise information:------
    Instance dependent noise
    #Actual noise rate 0.13
    [cuda:1] LNPCC waiting for GPU slot...
    [cuda:1] Slot acquired (waited 123.8s). Starting GCN...
    FINAL_RESULT: {'acc': {'train': 0.7707006369426752, 'valid': 0.806, 'test': 0.899}, 'wall_s': 17.34, 'cpu_s': 13.8, 'gpu_s': 3.48, 'wait_s': 123.84}
    [Time] wall=17.3s | cpu=13.8s | gpu=3.5s
    C:\Users\fbrev\Documents\Acadêmico\Simulações\Python\NoisyGL\predictor\Base_Predictor.py:114: UserWarning: expandable_segments not supported on this platform (Triggered internally at ..\c10/cuda/CUDAAllocatorConfig.h:28.)
    self.edge_index = self._cpu_edge_index.to(self.device)
    C:\Users\fbrev\Documents\Acadêmico\Simulações\Python\NoisyGL\predictor\Base_Predictor.py:144: UserWarning: Sparse CSR tensor support is in beta state. If you miss a functionality in the sparse tensor support, please submit a feature request to https://github.com/pytorch/pytorch/issues. (Triggered internally at ..\aten\src\ATen\SparseCsrTensorImpl.cpp:55.)
    self.adj_csr = self.adj.to_sparse_csr().to(self.device)
[I 2026-05-01 22:16:45,174] Trial 46 finished with value: 0.899 and parameters: {'lr': 0.005, 'weight_decay': 0.05, 'n_hidden': 128, 'n_layer': 2, 'dropout': 0.7431929616078136, 'knn_mode': 's', 'k': 27, 'dexp': 4.147086870260211, 'p_grd': 0.4458919286800508, 'unc_rem': 0.14471960587075566, 'unc_rel': 0.2830548891507614}. Best is trial 43 with value: 0.909.
    [CPU] Loading amazonpho...
    DEBUG 3.1: Dataset init start
    DEBUG 3.2: prepare_data start amazonpho
    ----Data statistics------'
    Name: amazonpho
    #Nodes 7650
    #Edges 119081
    #Classes 8
    #Ave_degree 31.13
    ----Split statistics------'
    #Train samples 160 (20 nodes per class)
    #Val samples 500 (specified)
    #Test samples 1000 (specified)
    ----label noise information:------
    Instance dependent noise
    #Actual noise rate 0.13
    [cuda:1] LNPCC waiting for GPU slot...
    [cuda:1] Slot acquired (waited 120.2s). Starting GCN...
    FINAL_RESULT: {'acc': {'train': 0.9090909090909091, 'valid': 0.806, 'test': 0.905}, 'wall_s': 20.24, 'cpu_s': 17.59, 'gpu_s': 2.57, 'wait_s': 120.18}
    [Time] wall=20.2s | cpu=17.6s | gpu=2.6s
    C:\Users\fbrev\Documents\Acadêmico\Simulações\Python\NoisyGL\predictor\Base_Predictor.py:114: UserWarning: expandable_segments not supported on this platform (Triggered internally at ..\c10/cuda/CUDAAllocatorConfig.h:28.)
    self.edge_index = self._cpu_edge_index.to(self.device)
    C:\Users\fbrev\Documents\Acadêmico\Simulações\Python\NoisyGL\predictor\Base_Predictor.py:144: UserWarning: Sparse CSR tensor support is in beta state. If you miss a functionality in the sparse tensor support, please submit a feature request to https://github.com/pytorch/pytorch/issues. (Triggered internally at ..\aten\src\ATen\SparseCsrTensorImpl.cpp:55.)
    self.adj_csr = self.adj.to_sparse_csr().to(self.device)
[I 2026-05-01 22:19:11,984] Trial 47 finished with value: 0.905 and parameters: {'lr': 0.005, 'weight_decay': 0.05, 'n_hidden': 64, 'n_layer': 2, 'dropout': 0.39468950903205235, 'knn_mode': 'd', 'k': 37, 'dexp': 2.9278523878126803, 'p_grd': 0.2920485516961565, 'unc_rem': 0.2563356925846637, 'unc_rel': 0.16827904884432962}. Best is trial 43 with value: 0.909.
    [CPU] Loading amazonpho...
    DEBUG 3.1: Dataset init start
    DEBUG 3.2: prepare_data start amazonpho
    ----Data statistics------'
    Name: amazonpho
    #Nodes 7650
    #Edges 119081
    #Classes 8
    #Ave_degree 31.13
    ----Split statistics------'
    #Train samples 160 (20 nodes per class)
    #Val samples 500 (specified)
    #Test samples 1000 (specified)
    ----label noise information:------
    Instance dependent noise
    #Actual noise rate 0.13
    [cuda:1] LNPCC waiting for GPU slot...
    [cuda:1] Slot acquired (waited 122.2s). Starting GCN...
    FINAL_RESULT: {'acc': {'train': 0.8851351351351351, 'valid': 0.762, 'test': 0.828}, 'wall_s': 16.39, 'cpu_s': 13.91, 'gpu_s': 2.42, 'wait_s': 122.2}
    [Time] wall=16.4s | cpu=13.9s | gpu=2.4s
    C:\Users\fbrev\Documents\Acadêmico\Simulações\Python\NoisyGL\predictor\Base_Predictor.py:114: UserWarning: expandable_segments not supported on this platform (Triggered internally at ..\c10/cuda/CUDAAllocatorConfig.h:28.)
    self.edge_index = self._cpu_edge_index.to(self.device)
    C:\Users\fbrev\Documents\Acadêmico\Simulações\Python\NoisyGL\predictor\Base_Predictor.py:144: UserWarning: Sparse CSR tensor support is in beta state. If you miss a functionality in the sparse tensor support, please submit a feature request to https://github.com/pytorch/pytorch/issues. (Triggered internally at ..\aten\src\ATen\SparseCsrTensorImpl.cpp:55.)
    self.adj_csr = self.adj.to_sparse_csr().to(self.device)
[I 2026-05-01 22:21:37,181] Trial 48 finished with value: 0.828 and parameters: {'lr': 0.005, 'weight_decay': 0.0, 'n_hidden': 32, 'n_layer': 2, 'dropout': 0.6440142211154131, 'knn_mode': 's', 'k': 40, 'dexp': 1.8823320575586502, 'p_grd': 0.24746984587943807, 'unc_rem': 0.08046646728913039, 'unc_rel': 0.394385572073619}. Best is trial 43 with value: 0.909.
    [CPU] Loading amazonpho...
    DEBUG 3.1: Dataset init start
    DEBUG 3.2: prepare_data start amazonpho
    ----Data statistics------'
    Name: amazonpho
    #Nodes 7650
    #Edges 119081
    #Classes 8
    #Ave_degree 31.13
    ----Split statistics------'
    #Train samples 160 (20 nodes per class)
    #Val samples 500 (specified)
    #Test samples 1000 (specified)
    ----label noise information:------
    Instance dependent noise
    #Actual noise rate 0.13
    [cuda:1] LNPCC waiting for GPU slot...
    [cuda:1] Slot acquired (waited 123.6s). Starting GCN...
    FINAL_RESULT: {'acc': {'train': 0.7579617834394905, 'valid': 0.762, 'test': 0.863}, 'wall_s': 17.64, 'cpu_s': 15.06, 'gpu_s': 2.51, 'wait_s': 123.6}
    [Time] wall=17.6s | cpu=15.1s | gpu=2.5s
    C:\Users\fbrev\Documents\Acadêmico\Simulações\Python\NoisyGL\predictor\Base_Predictor.py:114: UserWarning: expandable_segments not supported on this platform (Triggered internally at ..\c10/cuda/CUDAAllocatorConfig.h:28.)
    self.edge_index = self._cpu_edge_index.to(self.device)
    C:\Users\fbrev\Documents\Acadêmico\Simulações\Python\NoisyGL\predictor\Base_Predictor.py:144: UserWarning: Sparse CSR tensor support is in beta state. If you miss a functionality in the sparse tensor support, please submit a feature request to https://github.com/pytorch/pytorch/issues. (Triggered internally at ..\aten\src\ATen\SparseCsrTensorImpl.cpp:55.)
    self.adj_csr = self.adj.to_sparse_csr().to(self.device)
