[worker] START lnpcc_dblp_0.1 gpu=0
[HPO] Starting Phase 1 (Optuna) for lnpcc_dblp_instance_0.1...
[I 2026-05-05 14:50:38,002] Using an existing study with name 'lnpcc_dblp_instance_0.1' instead of creating a new one.
    [CPU] Loading dblp...
    DEBUG 3.1: Dataset init start
    DEBUG 3.2: prepare_data start dblp
    ----Data statistics------'
    Name: dblp
    #Nodes 17716
    #Edges 52867
    #Classes 4
    #Ave_degree 5.97
    ----Split statistics------'
    #Train samples 177 (1.0 % of nodes)
    #Val samples 2657 (15.0 % of nodes)
    #Test samples 14882 (remaining)
    ----label noise information:------
    Instance dependent noise
    #Actual noise rate 0.13
    [cuda:0] LNPCC waiting for GPU slot...
    [cuda:0] Slot acquired (waited 142.3s). Starting GCN...
    FINAL_RESULT: {'acc': {'train': 0.9540229885057471, 'valid': 0.6831012420022582, 'test': 0.7480177395511356}, 'wall_s': 51.13, 'cpu_s': 46.64, 'gpu_s': 4.26, 'wait_s': 142.28}
    [Time] wall=51.1s | cpu=46.6s | gpu=4.3s
    C:\Users\fbrev\Documents\Acadêmico\Simulações\Python\NoisyGL\predictor\Base_Predictor.py:114: UserWarning: expandable_segments not supported on this platform (Triggered internally at ..\c10/cuda/CUDAAllocatorConfig.h:28.)
    self.edge_index = self._cpu_edge_index.to(self.device)
    C:\Users\fbrev\Documents\Acadêmico\Simulações\Python\NoisyGL\predictor\Base_Predictor.py:144: UserWarning: Sparse CSR tensor support is in beta state. If you miss a functionality in the sparse tensor support, please submit a feature request to https://github.com/pytorch/pytorch/issues. (Triggered internally at ..\aten\src\ATen\SparseCsrTensorImpl.cpp:55.)
    self.adj_csr = self.adj.to_sparse_csr().to(self.device)
[I 2026-05-05 14:54:02,932] Trial 103 finished with value: 0.7480177395511356 and parameters: {'lr': 0.005, 'weight_decay': 0.0001, 'n_hidden': 128, 'n_layer': 3, 'dropout': 0.38777609878619584, 'knn_mode': 's', 'k': 43, 'dexp': 7.7549570867663045, 'p_grd': 0.15237079605734993, 'unc_rem': 0.5978478045279348, 'unc_rel': 0.5218905379385617}. Best is trial 83 with value: 0.7836984276306947.
    [CPU] Loading dblp...
    DEBUG 3.1: Dataset init start
    DEBUG 3.2: prepare_data start dblp
    ----Data statistics------'
    Name: dblp
    #Nodes 17716
    #Edges 52867
    #Classes 4
    #Ave_degree 5.97
    ----Split statistics------'
    #Train samples 177 (1.0 % of nodes)
    #Val samples 2657 (15.0 % of nodes)
    #Test samples 14882 (remaining)
    ----label noise information:------
    Instance dependent noise
    #Actual noise rate 0.13
    [cuda:0] LNPCC waiting for GPU slot...
    [cuda:0] Slot acquired (waited 315.9s). Starting GCN...
    FINAL_RESULT: {'acc': {'train': 0.96045197740113, 'valid': 0.6913812570568311, 'test': 0.7740223088294584}, 'wall_s': 46.48, 'cpu_s': 42.11, 'gpu_s': 4.31, 'wait_s': 315.87}
    [Time] wall=46.5s | cpu=42.1s | gpu=4.3s
    C:\Users\fbrev\Documents\Acadêmico\Simulações\Python\NoisyGL\predictor\Base_Predictor.py:114: UserWarning: expandable_segments not supported on this platform (Triggered internally at ..\c10/cuda/CUDAAllocatorConfig.h:28.)
    self.edge_index = self._cpu_edge_index.to(self.device)
    C:\Users\fbrev\Documents\Acadêmico\Simulações\Python\NoisyGL\predictor\Base_Predictor.py:144: UserWarning: Sparse CSR tensor support is in beta state. If you miss a functionality in the sparse tensor support, please submit a feature request to https://github.com/pytorch/pytorch/issues. (Triggered internally at ..\aten\src\ATen\SparseCsrTensorImpl.cpp:55.)
    self.adj_csr = self.adj.to_sparse_csr().to(self.device)
[I 2026-05-05 15:00:11,383] Trial 104 finished with value: 0.7740223088294584 and parameters: {'lr': 0.005, 'weight_decay': 0.0001, 'n_hidden': 128, 'n_layer': 3, 'dropout': 0.2470610936343668, 'knn_mode': 's', 'k': 49, 'dexp': 8.193283508369088, 'p_grd': 0.22928779991193587, 'unc_rem': 0.4978723186671529, 'unc_rel': 0.41402839850671713}. Best is trial 83 with value: 0.7836984276306947.
    [CPU] Loading dblp...
    DEBUG 3.1: Dataset init start
    DEBUG 3.2: prepare_data start dblp
    ----Data statistics------'
    Name: dblp
    #Nodes 17716
    #Edges 52867
    #Classes 4
    #Ave_degree 5.97
    ----Split statistics------'
    #Train samples 177 (1.0 % of nodes)
    #Val samples 2657 (15.0 % of nodes)
    #Test samples 14882 (remaining)
    ----label noise information:------
    Instance dependent noise
    #Actual noise rate 0.13
    [cuda:0] LNPCC waiting for GPU slot...
    [cuda:0] Slot acquired (waited 313.8s). Starting GCN...
    FINAL_RESULT: {'acc': {'train': 0.8757062146892656, 'valid': 0.6887467068121942, 'test': 0.7670340008063432}, 'wall_s': 47.13, 'cpu_s': 42.77, 'gpu_s': 4.29, 'wait_s': 313.77}
    [Time] wall=47.1s | cpu=42.8s | gpu=4.3s
    C:\Users\fbrev\Documents\Acadêmico\Simulações\Python\NoisyGL\predictor\Base_Predictor.py:114: UserWarning: expandable_segments not supported on this platform (Triggered internally at ..\c10/cuda/CUDAAllocatorConfig.h:28.)
    self.edge_index = self._cpu_edge_index.to(self.device)
    C:\Users\fbrev\Documents\Acadêmico\Simulações\Python\NoisyGL\predictor\Base_Predictor.py:144: UserWarning: Sparse CSR tensor support is in beta state. If you miss a functionality in the sparse tensor support, please submit a feature request to https://github.com/pytorch/pytorch/issues. (Triggered internally at ..\aten\src\ATen\SparseCsrTensorImpl.cpp:55.)
    self.adj_csr = self.adj.to_sparse_csr().to(self.device)
[I 2026-05-05 15:06:18,076] Trial 105 finished with value: 0.7670340008063432 and parameters: {'lr': 0.005, 'weight_decay': 0.0001, 'n_hidden': 128, 'n_layer': 3, 'dropout': 0.18993906719261255, 'knn_mode': 's', 'k': 49, 'dexp': 8.35582120380169, 'p_grd': 0.3745571788087707, 'unc_rem': 0.45232224595574144, 'unc_rel': 0.6845120933743892}. Best is trial 83 with value: 0.7836984276306947.
    [CPU] Loading dblp...
    DEBUG 3.1: Dataset init start
    DEBUG 3.2: prepare_data start dblp
    ----Data statistics------'
    Name: dblp
    #Nodes 17716
    #Edges 52867
    #Classes 4
    #Ave_degree 5.97
    ----Split statistics------'
    #Train samples 177 (1.0 % of nodes)
    #Val samples 2657 (15.0 % of nodes)
    #Test samples 14882 (remaining)
    ----label noise information:------
    Instance dependent noise
    #Actual noise rate 0.13
    [cuda:0] LNPCC waiting for GPU slot...
    [cuda:0] Slot acquired (waited 138.6s). Starting GCN...
    FINAL_RESULT: {'acc': {'train': 0.9941860465116279, 'valid': 0.6808430560782838, 'test': 0.751175917215428}, 'wall_s': 39.98, 'cpu_s': 35.72, 'gpu_s': 4.2, 'wait_s': 138.57}
    [Time] wall=40.0s | cpu=35.7s | gpu=4.2s
    C:\Users\fbrev\Documents\Acadêmico\Simulações\Python\NoisyGL\predictor\Base_Predictor.py:114: UserWarning: expandable_segments not supported on this platform (Triggered internally at ..\c10/cuda/CUDAAllocatorConfig.h:28.)
    self.edge_index = self._cpu_edge_index.to(self.device)
    C:\Users\fbrev\Documents\Acadêmico\Simulações\Python\NoisyGL\predictor\Base_Predictor.py:144: UserWarning: Sparse CSR tensor support is in beta state. If you miss a functionality in the sparse tensor support, please submit a feature request to https://github.com/pytorch/pytorch/issues. (Triggered internally at ..\aten\src\ATen\SparseCsrTensorImpl.cpp:55.)
    self.adj_csr = self.adj.to_sparse_csr().to(self.device)
[I 2026-05-05 15:09:22,657] Trial 106 finished with value: 0.751175917215428 and parameters: {'lr': 0.005, 'weight_decay': 0.0001, 'n_hidden': 128, 'n_layer': 3, 'dropout': 0.3031597748018, 'knn_mode': 's', 'k': 47, 'dexp': 8.162435024708639, 'p_grd': 0.10076714875045575, 'unc_rem': 0.3016579888072667, 'unc_rel': 0.5447111219588945}. Best is trial 83 with value: 0.7836984276306947.
    [CPU] Loading dblp...
    DEBUG 3.1: Dataset init start
    DEBUG 3.2: prepare_data start dblp
    ----Data statistics------'
    Name: dblp
    #Nodes 17716
    #Edges 52867
    #Classes 4
    #Ave_degree 5.97
    ----Split statistics------'
    #Train samples 177 (1.0 % of nodes)
    #Val samples 2657 (15.0 % of nodes)
    #Test samples 14882 (remaining)
    ----label noise information:------
    Instance dependent noise
    #Actual noise rate 0.13
    [cuda:0] LNPCC waiting for GPU slot...
    [cuda:0] Slot acquired (waited 300.8s). Starting GCN...
[I 2026-05-05 15:15:14,597] Trial 107 finished with value: 0.0 and parameters: {'lr': 0.005, 'weight_decay': 0.0001, 'n_hidden': 128, 'n_layer': 3, 'dropout': 0.2522667488469063, 'knn_mode': 's', 'k': 49, 'dexp': 8.500524259717832, 'p_grd': 0.23016101047205453, 'unc_rem': 0.49524500686008543, 'unc_rel': 0.5696927848380682}. Best is trial 83 with value: 0.7836984276306947.
    [CPU] Loading dblp...
    DEBUG 3.1: Dataset init start
    DEBUG 3.2: prepare_data start dblp
    ----Data statistics------'
    Name: dblp
    #Nodes 17716
    #Edges 52867
    #Classes 4
    #Ave_degree 5.97
    ----Split statistics------'
    #Train samples 177 (1.0 % of nodes)
    #Val samples 2657 (15.0 % of nodes)
    #Test samples 14882 (remaining)
    ----label noise information:------
    Instance dependent noise
    #Actual noise rate 0.13
    [cuda:0] LNPCC waiting for GPU slot...
    [cuda:0] Slot acquired (waited 309.1s). Starting GCN...
    FINAL_RESULT: {'acc': {'train': 0.9209039548022598, 'valid': 0.6925103500188182, 'test': 0.7713344980513371}, 'wall_s': 45.78, 'cpu_s': 41.43, 'gpu_s': 4.28, 'wait_s': 309.08}
    [Time] wall=45.8s | cpu=41.4s | gpu=4.3s
    C:\Users\fbrev\Documents\Acadêmico\Simulações\Python\NoisyGL\predictor\Base_Predictor.py:114: UserWarning: expandable_segments not supported on this platform (Triggered internally at ..\c10/cuda/CUDAAllocatorConfig.h:28.)
    self.edge_index = self._cpu_edge_index.to(self.device)
    C:\Users\fbrev\Documents\Acadêmico\Simulações\Python\NoisyGL\predictor\Base_Predictor.py:144: UserWarning: Sparse CSR tensor support is in beta state. If you miss a functionality in the sparse tensor support, please submit a feature request to https://github.com/pytorch/pytorch/issues. (Triggered internally at ..\aten\src\ATen\SparseCsrTensorImpl.cpp:55.)
    self.adj_csr = self.adj.to_sparse_csr().to(self.device)
[I 2026-05-05 15:21:15,164] Trial 108 finished with value: 0.7713344980513371 and parameters: {'lr': 0.005, 'weight_decay': 0.0001, 'n_hidden': 128, 'n_layer': 3, 'dropout': 0.3537983006631443, 'knn_mode': 's', 'k': 44, 'dexp': 7.635811208939771, 'p_grd': 0.32424642617369515, 'unc_rem': 0.4705026867876517, 'unc_rel': 0.8090778997507446}. Best is trial 83 with value: 0.7836984276306947.
    [CPU] Loading dblp...
    DEBUG 3.1: Dataset init start
    DEBUG 3.2: prepare_data start dblp
    ----Data statistics------'
    Name: dblp
    #Nodes 17716
    #Edges 52867
    #Classes 4
    #Ave_degree 5.97
    ----Split statistics------'
    #Train samples 177 (1.0 % of nodes)
    #Val samples 2657 (15.0 % of nodes)
    #Test samples 14882 (remaining)
    ----label noise information:------
    Instance dependent noise
    #Actual noise rate 0.13
    [cuda:0] LNPCC waiting for GPU slot...
    [cuda:0] Slot acquired (waited 313.6s). Starting GCN...
    FINAL_RESULT: {'acc': {'train': 0.768361581920904, 'valid': 0.6307866014301844, 'test': 0.6985620212337051}, 'wall_s': 44.1, 'cpu_s': 39.76, 'gpu_s': 4.27, 'wait_s': 313.6}
    [Time] wall=44.1s | cpu=39.8s | gpu=4.3s
    C:\Users\fbrev\Documents\Acadêmico\Simulações\Python\NoisyGL\predictor\Base_Predictor.py:114: UserWarning: expandable_segments not supported on this platform (Triggered internally at ..\c10/cuda/CUDAAllocatorConfig.h:28.)
    self.edge_index = self._cpu_edge_index.to(self.device)
    C:\Users\fbrev\Documents\Acadêmico\Simulações\Python\NoisyGL\predictor\Base_Predictor.py:144: UserWarning: Sparse CSR tensor support is in beta state. If you miss a functionality in the sparse tensor support, please submit a feature request to https://github.com/pytorch/pytorch/issues. (Triggered internally at ..\aten\src\ATen\SparseCsrTensorImpl.cpp:55.)
    self.adj_csr = self.adj.to_sparse_csr().to(self.device)
[I 2026-05-05 15:27:18,892] Trial 109 finished with value: 0.6985620212337051 and parameters: {'lr': 0.005, 'weight_decay': 0.05, 'n_hidden': 128, 'n_layer': 3, 'dropout': 0.34938668049901483, 'knn_mode': 's', 'k': 45, 'dexp': 7.652403418813926, 'p_grd': 0.3227827637234421, 'unc_rem': 0.5581192782128102, 'unc_rel': 0.8148542100107125}. Best is trial 83 with value: 0.7836984276306947.
    [CPU] Loading dblp...
    DEBUG 3.1: Dataset init start
    DEBUG 3.2: prepare_data start dblp
    ----Data statistics------'
    Name: dblp
    #Nodes 17716
    #Edges 52867
    #Classes 4
    #Ave_degree 5.97
    ----Split statistics------'
    #Train samples 177 (1.0 % of nodes)
    #Val samples 2657 (15.0 % of nodes)
    #Test samples 14882 (remaining)
    ----label noise information:------
    Instance dependent noise
    #Actual noise rate 0.13
    [cuda:0] LNPCC waiting for GPU slot...
    [cuda:0] Slot acquired (waited 712.3s). Starting GCN...
    FINAL_RESULT: {'acc': {'train': 0.9488636363636364, 'valid': 0.6597666541211893, 'test': 0.7244321999731219}, 'wall_s': 41.97, 'cpu_s': 37.66, 'gpu_s': 4.24, 'wait_s': 712.27}
    [Time] wall=42.0s | cpu=37.7s | gpu=4.2s
    C:\Users\fbrev\Documents\Acadêmico\Simulações\Python\NoisyGL\predictor\Base_Predictor.py:114: UserWarning: expandable_segments not supported on this platform (Triggered internally at ..\c10/cuda/CUDAAllocatorConfig.h:28.)
    self.edge_index = self._cpu_edge_index.to(self.device)
    C:\Users\fbrev\Documents\Acadêmico\Simulações\Python\NoisyGL\predictor\Base_Predictor.py:144: UserWarning: Sparse CSR tensor support is in beta state. If you miss a functionality in the sparse tensor support, please submit a feature request to https://github.com/pytorch/pytorch/issues. (Triggered internally at ..\aten\src\ATen\SparseCsrTensorImpl.cpp:55.)
    self.adj_csr = self.adj.to_sparse_csr().to(self.device)
[I 2026-05-05 15:39:59,267] Trial 110 finished with value: 0.7244321999731219 and parameters: {'lr': 0.005, 'weight_decay': 0.0001, 'n_hidden': 128, 'n_layer': 3, 'dropout': 0.26278843355499676, 'knn_mode': 's', 'k': 44, 'dexp': 7.349966696080015, 'p_grd': 0.05291148500005011, 'unc_rem': 0.4663381478118126, 'unc_rel': 0.7656225254728611}. Best is trial 83 with value: 0.7836984276306947.
    [CPU] Loading dblp...
    DEBUG 3.1: Dataset init start
    DEBUG 3.2: prepare_data start dblp
    ----Data statistics------'
    Name: dblp
    #Nodes 17716
    #Edges 52867
    #Classes 4
    #Ave_degree 5.97
    ----Split statistics------'
    #Train samples 177 (1.0 % of nodes)
    #Val samples 2657 (15.0 % of nodes)
    #Test samples 14882 (remaining)
    ----label noise information:------
    Instance dependent noise
    #Actual noise rate 0.13
    [cuda:0] LNPCC waiting for GPU slot...
    [cuda:0] Slot acquired (waited 324.7s). Starting GCN...
    FINAL_RESULT: {'acc': {'train': 0.9209039548022598, 'valid': 0.6985321791494167, 'test': 0.7720736460153205}, 'wall_s': 44.89, 'cpu_s': 40.58, 'gpu_s': 4.25, 'wait_s': 324.72}
    [Time] wall=44.9s | cpu=40.6s | gpu=4.3s
    C:\Users\fbrev\Documents\Acadêmico\Simulações\Python\NoisyGL\predictor\Base_Predictor.py:114: UserWarning: expandable_segments not supported on this platform (Triggered internally at ..\c10/cuda/CUDAAllocatorConfig.h:28.)
    self.edge_index = self._cpu_edge_index.to(self.device)
    C:\Users\fbrev\Documents\Acadêmico\Simulações\Python\NoisyGL\predictor\Base_Predictor.py:144: UserWarning: Sparse CSR tensor support is in beta state. If you miss a functionality in the sparse tensor support, please submit a feature request to https://github.com/pytorch/pytorch/issues. (Triggered internally at ..\aten\src\ATen\SparseCsrTensorImpl.cpp:55.)
    self.adj_csr = self.adj.to_sparse_csr().to(self.device)
[I 2026-05-05 15:46:14,791] Trial 111 finished with value: 0.7720736460153205 and parameters: {'lr': 0.005, 'weight_decay': 0.0001, 'n_hidden': 128, 'n_layer': 3, 'dropout': 0.31901558144901687, 'knn_mode': 's', 'k': 48, 'dexp': 8.756515088662917, 'p_grd': 0.27882124271696984, 'unc_rem': 0.39038329512397596, 'unc_rel': 0.851055130273082}. Best is trial 83 with value: 0.7836984276306947.
    [CPU] Loading dblp...
    DEBUG 3.1: Dataset init start
    DEBUG 3.2: prepare_data start dblp
    ----Data statistics------'
    Name: dblp
    #Nodes 17716
    #Edges 52867
    #Classes 4
    #Ave_degree 5.97
    ----Split statistics------'
    #Train samples 177 (1.0 % of nodes)
    #Val samples 2657 (15.0 % of nodes)
    #Test samples 14882 (remaining)
    ----label noise information:------
    Instance dependent noise
    #Actual noise rate 0.13
    [cuda:0] LNPCC waiting for GPU slot...
    [cuda:0] Slot acquired (waited 144.2s). Starting GCN...
    FINAL_RESULT: {'acc': {'train': 0.9943502824858758, 'valid': 0.6902521640948438, 'test': 0.768579492003763}, 'wall_s': 44.95, 'cpu_s': 40.46, 'gpu_s': 4.42, 'wait_s': 144.2}
    [Time] wall=45.0s | cpu=40.5s | gpu=4.4s
    C:\Users\fbrev\Documents\Acadêmico\Simulações\Python\NoisyGL\predictor\Base_Predictor.py:114: UserWarning: expandable_segments not supported on this platform (Triggered internally at ..\c10/cuda/CUDAAllocatorConfig.h:28.)
    self.edge_index = self._cpu_edge_index.to(self.device)
    C:\Users\fbrev\Documents\Acadêmico\Simulações\Python\NoisyGL\predictor\Base_Predictor.py:144: UserWarning: Sparse CSR tensor support is in beta state. If you miss a functionality in the sparse tensor support, please submit a feature request to https://github.com/pytorch/pytorch/issues. (Triggered internally at ..\aten\src\ATen\SparseCsrTensorImpl.cpp:55.)
    self.adj_csr = self.adj.to_sparse_csr().to(self.device)
[I 2026-05-05 15:49:31,408] Trial 112 finished with value: 0.768579492003763 and parameters: {'lr': 0.005, 'weight_decay': 0.0001, 'n_hidden': 128, 'n_layer': 3, 'dropout': 0.3186599752512381, 'knn_mode': 's', 'k': 50, 'dexp': 8.640148887198409, 'p_grd': 0.19252597724881965, 'unc_rem': 0.36142862524588504, 'unc_rel': 0.857478190888301}. Best is trial 83 with value: 0.7836984276306947.
    [CPU] Loading dblp...
    DEBUG 3.1: Dataset init start
    DEBUG 3.2: prepare_data start dblp
    ----Data statistics------'
    Name: dblp
    #Nodes 17716
    #Edges 52867
    #Classes 4
    #Ave_degree 5.97
    ----Split statistics------'
    #Train samples 177 (1.0 % of nodes)
    #Val samples 2657 (15.0 % of nodes)
    #Test samples 14882 (remaining)
    ----label noise information:------
    Instance dependent noise
    #Actual noise rate 0.13
    [cuda:0] LNPCC waiting for GPU slot...
    [cuda:0] Slot acquired (waited 332.0s). Starting GCN...
    FINAL_RESULT: {'acc': {'train': 0.9715909090909091, 'valid': 0.6902521640948438, 'test': 0.7672355866147024}, 'wall_s': 42.47, 'cpu_s': 38.23, 'gpu_s': 4.17, 'wait_s': 332.0}
    [Time] wall=42.5s | cpu=38.2s | gpu=4.2s
    C:\Users\fbrev\Documents\Acadêmico\Simulações\Python\NoisyGL\predictor\Base_Predictor.py:114: UserWarning: expandable_segments not supported on this platform (Triggered internally at ..\c10/cuda/CUDAAllocatorConfig.h:28.)
    self.edge_index = self._cpu_edge_index.to(self.device)
    C:\Users\fbrev\Documents\Acadêmico\Simulações\Python\NoisyGL\predictor\Base_Predictor.py:144: UserWarning: Sparse CSR tensor support is in beta state. If you miss a functionality in the sparse tensor support, please submit a feature request to https://github.com/pytorch/pytorch/issues. (Triggered internally at ..\aten\src\ATen\SparseCsrTensorImpl.cpp:55.)
    self.adj_csr = self.adj.to_sparse_csr().to(self.device)
[I 2026-05-05 15:55:52,131] Trial 113 finished with value: 0.7672355866147024 and parameters: {'lr': 0.005, 'weight_decay': 0.0001, 'n_hidden': 128, 'n_layer': 3, 'dropout': 0.42934123728604373, 'knn_mode': 's', 'k': 47, 'dexp': 8.02620468272084, 'p_grd': 0.27583129884889024, 'unc_rem': 0.39098988412282293, 'unc_rel': 0.8695253516580324}. Best is trial 83 with value: 0.7836984276306947.
    [CPU] Loading dblp...
    DEBUG 3.1: Dataset init start
    DEBUG 3.2: prepare_data start dblp
    ----Data statistics------'
    Name: dblp
    #Nodes 17716
    #Edges 52867
    #Classes 4
    #Ave_degree 5.97
    ----Split statistics------'
    #Train samples 177 (1.0 % of nodes)
    #Val samples 2657 (15.0 % of nodes)
    #Test samples 14882 (remaining)
    ----label noise information:------
    Instance dependent noise
    #Actual noise rate 0.13
    [cuda:0] LNPCC waiting for GPU slot...
    [cuda:0] Slot acquired (waited 337.3s). Starting GCN...
    FINAL_RESULT: {'acc': {'train': 0.8983050847457628, 'valid': 0.6834776063229205, 'test': 0.7632710657169736}, 'wall_s': 44.39, 'cpu_s': 39.83, 'gpu_s': 4.51, 'wait_s': 337.34}
    [Time] wall=44.4s | cpu=39.8s | gpu=4.5s
    C:\Users\fbrev\Documents\Acadêmico\Simulações\Python\NoisyGL\predictor\Base_Predictor.py:114: UserWarning: expandable_segments not supported on this platform (Triggered internally at ..\c10/cuda/CUDAAllocatorConfig.h:28.)
    self.edge_index = self._cpu_edge_index.to(self.device)
    C:\Users\fbrev\Documents\Acadêmico\Simulações\Python\NoisyGL\predictor\Base_Predictor.py:144: UserWarning: Sparse CSR tensor support is in beta state. If you miss a functionality in the sparse tensor support, please submit a feature request to https://github.com/pytorch/pytorch/issues. (Triggered internally at ..\aten\src\ATen\SparseCsrTensorImpl.cpp:55.)
    self.adj_csr = self.adj.to_sparse_csr().to(self.device)
