[worker] START lnpcc_pubmed_0.2 gpu=1
[HPO] Starting Phase 1 (Optuna) for lnpcc_pubmed_instance_0.2...
[I 2026-05-06 12:50:47,154] A new study created in RDB with name: lnpcc_pubmed_instance_0.2
    [CPU] Loading pubmed...
    DEBUG 3.1: Dataset init start
    DEBUG 3.2: prepare_data start pubmed
    ----Data statistics------'
    Name: pubmed
    #Nodes 19717
    #Edges 44324
    #Classes 3
    #Ave_degree 4.50
    ----Split statistics------'
    #Train samples 60 (default)
    #Val samples 500 (default)
    #Test samples 1000 (default)
    ----label noise information:------
    Instance dependent noise
    #Actual noise rate 0.21
    [cuda:1] LNPCC waiting for GPU slot...
    [cuda:1] Slot acquired (waited 1292.2s). Starting GCN...
    FINAL_RESULT: {'acc': {'train': 0.7333333333333333, 'valid': 0.618, 'test': 0.711}, 'wall_s': 29.53, 'cpu_s': 23.86, 'gpu_s': 5.61, 'wait_s': 1292.25}
    [Time] wall=29.5s | cpu=23.9s | gpu=5.6s
    C:\Users\fbrev\Documents\Acadêmico\Simulações\Python\NoisyGL\predictor\Base_Predictor.py:114: UserWarning: expandable_segments not supported on this platform (Triggered internally at ..\c10/cuda/CUDAAllocatorConfig.h:28.)
    self.edge_index = self._cpu_edge_index.to(self.device)
    C:\Users\fbrev\Documents\Acadêmico\Simulações\Python\NoisyGL\predictor\Base_Predictor.py:144: UserWarning: Sparse CSR tensor support is in beta state. If you miss a functionality in the sparse tensor support, please submit a feature request to https://github.com/pytorch/pytorch/issues. (Triggered internally at ..\aten\src\ATen\SparseCsrTensorImpl.cpp:55.)
    self.adj_csr = self.adj.to_sparse_csr().to(self.device)
[I 2026-05-06 13:12:54,760] Trial 0 finished with value: 0.711 and parameters: {'lr': 0.01, 'weight_decay': 0.0001, 'n_hidden': 256, 'n_layer': 3, 'dropout': 0.7423310186926412, 'knn_mode': 's', 'k': 22, 'dexp': 6.549043457768621, 'p_grd': 0.660643336056814, 'unc_rem': 0.4738128842759197, 'unc_rel': 0.5330175031465186}. Best is trial 0 with value: 0.711.
    [CPU] Loading pubmed...
    DEBUG 3.1: Dataset init start
    DEBUG 3.2: prepare_data start pubmed
    ----Data statistics------'
    Name: pubmed
    #Nodes 19717
    #Edges 44324
    #Classes 3
    #Ave_degree 4.50
    ----Split statistics------'
    #Train samples 60 (default)
    #Val samples 500 (default)
    #Test samples 1000 (default)
    ----label noise information:------
    Instance dependent noise
    #Actual noise rate 0.21
    [cuda:1] LNPCC waiting for GPU slot...
    [cuda:1] Slot acquired (waited 946.9s). Starting GCN...
    FINAL_RESULT: {'acc': {'train': 0.4166666666666667, 'valid': 0.458, 'test': 0.495}, 'wall_s': 27.67, 'cpu_s': 25.13, 'gpu_s': 2.47, 'wait_s': 946.92}
    [Time] wall=27.7s | cpu=25.1s | gpu=2.5s
    C:\Users\fbrev\Documents\Acadêmico\Simulações\Python\NoisyGL\predictor\Base_Predictor.py:114: UserWarning: expandable_segments not supported on this platform (Triggered internally at ..\c10/cuda/CUDAAllocatorConfig.h:28.)
    self.edge_index = self._cpu_edge_index.to(self.device)
    C:\Users\fbrev\Documents\Acadêmico\Simulações\Python\NoisyGL\predictor\Base_Predictor.py:144: UserWarning: Sparse CSR tensor support is in beta state. If you miss a functionality in the sparse tensor support, please submit a feature request to https://github.com/pytorch/pytorch/issues. (Triggered internally at ..\aten\src\ATen\SparseCsrTensorImpl.cpp:55.)
    self.adj_csr = self.adj.to_sparse_csr().to(self.device)
[I 2026-05-06 13:29:15,432] Trial 1 finished with value: 0.495 and parameters: {'lr': 0.005, 'weight_decay': 0.05, 'n_hidden': 32, 'n_layer': 3, 'dropout': 0.07015571555985166, 'knn_mode': 'd', 'k': 8, 'dexp': 9.849369470845739, 'p_grd': 0.478806786720841, 'unc_rem': 0.3038151952343754, 'unc_rel': 0.3631246362119436}. Best is trial 0 with value: 0.711.
    [CPU] Loading pubmed...
    DEBUG 3.1: Dataset init start
    DEBUG 3.2: prepare_data start pubmed
    ----Data statistics------'
    Name: pubmed
    #Nodes 19717
    #Edges 44324
    #Classes 3
    #Ave_degree 4.50
    ----Split statistics------'
    #Train samples 60 (default)
    #Val samples 500 (default)
    #Test samples 1000 (default)
    ----label noise information:------
    Instance dependent noise
    #Actual noise rate 0.21
    [cuda:1] LNPCC waiting for GPU slot...
    [cuda:1] Slot acquired (waited 945.0s). Starting GCN...
    FINAL_RESULT: {'acc': {'train': 0.559322033898305, 'valid': 0.582, 'test': 0.641}, 'wall_s': 41.21, 'cpu_s': 37.22, 'gpu_s': 3.94, 'wait_s': 944.97}
    [Time] wall=41.2s | cpu=37.2s | gpu=3.9s
    C:\Users\fbrev\Documents\Acadêmico\Simulações\Python\NoisyGL\predictor\Base_Predictor.py:114: UserWarning: expandable_segments not supported on this platform (Triggered internally at ..\c10/cuda/CUDAAllocatorConfig.h:28.)
    self.edge_index = self._cpu_edge_index.to(self.device)
    C:\Users\fbrev\Documents\Acadêmico\Simulações\Python\NoisyGL\predictor\Base_Predictor.py:144: UserWarning: Sparse CSR tensor support is in beta state. If you miss a functionality in the sparse tensor support, please submit a feature request to https://github.com/pytorch/pytorch/issues. (Triggered internally at ..\aten\src\ATen\SparseCsrTensorImpl.cpp:55.)
    self.adj_csr = self.adj.to_sparse_csr().to(self.device)
[I 2026-05-06 13:45:47,198] Trial 2 finished with value: 0.641 and parameters: {'lr': 0.05, 'weight_decay': 0.0, 'n_hidden': 128, 'n_layer': 3, 'dropout': 0.21625436690386757, 'knn_mode': 'd', 'k': 38, 'dexp': 3.874471529407347, 'p_grd': 0.9881400181698377, 'unc_rem': 0.9181621485275245, 'unc_rel': 0.9675166579372851}. Best is trial 0 with value: 0.711.
    [CPU] Loading pubmed...
    DEBUG 3.1: Dataset init start
    DEBUG 3.2: prepare_data start pubmed
    ----Data statistics------'
    Name: pubmed
    #Nodes 19717
    #Edges 44324
    #Classes 3
    #Ave_degree 4.50
    ----Split statistics------'
    #Train samples 60 (default)
    #Val samples 500 (default)
    #Test samples 1000 (default)
    ----label noise information:------
    Instance dependent noise
    #Actual noise rate 0.21
    [cuda:1] LNPCC waiting for GPU slot...
    [cuda:1] Slot acquired (waited 959.7s). Starting GCN...
    FINAL_RESULT: {'acc': {'train': 0.7457627118644068, 'valid': 0.624, 'test': 0.731}, 'wall_s': 31.65, 'cpu_s': 25.68, 'gpu_s': 5.92, 'wait_s': 959.74}
    [Time] wall=31.6s | cpu=25.7s | gpu=5.9s
    C:\Users\fbrev\Documents\Acadêmico\Simulações\Python\NoisyGL\predictor\Base_Predictor.py:114: UserWarning: expandable_segments not supported on this platform (Triggered internally at ..\c10/cuda/CUDAAllocatorConfig.h:28.)
    self.edge_index = self._cpu_edge_index.to(self.device)
    C:\Users\fbrev\Documents\Acadêmico\Simulações\Python\NoisyGL\predictor\Base_Predictor.py:144: UserWarning: Sparse CSR tensor support is in beta state. If you miss a functionality in the sparse tensor support, please submit a feature request to https://github.com/pytorch/pytorch/issues. (Triggered internally at ..\aten\src\ATen\SparseCsrTensorImpl.cpp:55.)
    self.adj_csr = self.adj.to_sparse_csr().to(self.device)
[I 2026-05-06 14:02:24,328] Trial 3 finished with value: 0.731 and parameters: {'lr': 0.01, 'weight_decay': 0.0, 'n_hidden': 256, 'n_layer': 3, 'dropout': 0.7679730381544515, 'knn_mode': 's', 'k': 24, 'dexp': 8.3269203648727, 'p_grd': 0.2184998850946086, 'unc_rem': 0.1269280697305547, 'unc_rel': 0.24879210037068566}. Best is trial 3 with value: 0.731.
    [CPU] Loading pubmed...
    DEBUG 3.1: Dataset init start
    DEBUG 3.2: prepare_data start pubmed
    ----Data statistics------'
    Name: pubmed
    #Nodes 19717
    #Edges 44324
    #Classes 3
    #Ave_degree 4.50
    ----Split statistics------'
    #Train samples 60 (default)
    #Val samples 500 (default)
    #Test samples 1000 (default)
    ----label noise information:------
    Instance dependent noise
    #Actual noise rate 0.21
    [cuda:1] LNPCC waiting for GPU slot...
    [cuda:1] Slot acquired (waited 778.8s). Starting GCN...
    FINAL_RESULT: {'acc': {'train': 0.7636363636363637, 'valid': 0.586, 'test': 0.663}, 'wall_s': 28.01, 'cpu_s': 25.43, 'gpu_s': 2.53, 'wait_s': 778.77}
    [Time] wall=28.0s | cpu=25.4s | gpu=2.5s
    C:\Users\fbrev\Documents\Acadêmico\Simulações\Python\NoisyGL\predictor\Base_Predictor.py:114: UserWarning: expandable_segments not supported on this platform (Triggered internally at ..\c10/cuda/CUDAAllocatorConfig.h:28.)
    self.edge_index = self._cpu_edge_index.to(self.device)
    C:\Users\fbrev\Documents\Acadêmico\Simulações\Python\NoisyGL\predictor\Base_Predictor.py:144: UserWarning: Sparse CSR tensor support is in beta state. If you miss a functionality in the sparse tensor support, please submit a feature request to https://github.com/pytorch/pytorch/issues. (Triggered internally at ..\aten\src\ATen\SparseCsrTensorImpl.cpp:55.)
    self.adj_csr = self.adj.to_sparse_csr().to(self.device)
[I 2026-05-06 14:15:56,789] Trial 4 finished with value: 0.663 and parameters: {'lr': 0.001, 'weight_decay': 0.01, 'n_hidden': 32, 'n_layer': 3, 'dropout': 0.7038458031184676, 'knn_mode': 's', 'k': 9, 'dexp': 2.686398662779987, 'p_grd': 0.260480876024059, 'unc_rem': 0.11716653894410789, 'unc_rel': 0.0855185384292958}. Best is trial 3 with value: 0.731.
    [CPU] Loading pubmed...
    DEBUG 3.1: Dataset init start
    DEBUG 3.2: prepare_data start pubmed
    ----Data statistics------'
    Name: pubmed
    #Nodes 19717
    #Edges 44324
    #Classes 3
    #Ave_degree 4.50
    ----Split statistics------'
    #Train samples 60 (default)
    #Val samples 500 (default)
    #Test samples 1000 (default)
    ----label noise information:------
    Instance dependent noise
    #Actual noise rate 0.21
    [cuda:1] LNPCC waiting for GPU slot...
    [cuda:1] Slot acquired (waited 955.8s). Starting GCN...
    FINAL_RESULT: {'acc': {'train': 0.8166666666666667, 'valid': 0.616, 'test': 0.709}, 'wall_s': 28.29, 'cpu_s': 22.28, 'gpu_s': 5.95, 'wait_s': 955.78}
    [Time] wall=28.3s | cpu=22.3s | gpu=5.9s
    C:\Users\fbrev\Documents\Acadêmico\Simulações\Python\NoisyGL\predictor\Base_Predictor.py:114: UserWarning: expandable_segments not supported on this platform (Triggered internally at ..\c10/cuda/CUDAAllocatorConfig.h:28.)
    self.edge_index = self._cpu_edge_index.to(self.device)
    C:\Users\fbrev\Documents\Acadêmico\Simulações\Python\NoisyGL\predictor\Base_Predictor.py:144: UserWarning: Sparse CSR tensor support is in beta state. If you miss a functionality in the sparse tensor support, please submit a feature request to https://github.com/pytorch/pytorch/issues. (Triggered internally at ..\aten\src\ATen\SparseCsrTensorImpl.cpp:55.)
    self.adj_csr = self.adj.to_sparse_csr().to(self.device)
[I 2026-05-06 14:32:26,621] Trial 5 finished with value: 0.709 and parameters: {'lr': 0.005, 'weight_decay': 0.001, 'n_hidden': 256, 'n_layer': 3, 'dropout': 0.5081407678113709, 'knn_mode': 's', 'k': 6, 'dexp': 8.201233283460219, 'p_grd': 0.7144216630336351, 'unc_rem': 0.6840438102211569, 'unc_rel': 0.7616068797550649}. Best is trial 3 with value: 0.731.
    [CPU] Loading pubmed...
    DEBUG 3.1: Dataset init start
    DEBUG 3.2: prepare_data start pubmed
    ----Data statistics------'
    Name: pubmed
    #Nodes 19717
    #Edges 44324
    #Classes 3
    #Ave_degree 4.50
    ----Split statistics------'
    #Train samples 60 (default)
    #Val samples 500 (default)
    #Test samples 1000 (default)
    ----label noise information:------
    Instance dependent noise
    #Actual noise rate 0.21
    [cuda:1] LNPCC waiting for GPU slot...
    [cuda:1] Slot acquired (waited 637.8s). Starting GCN...
    FINAL_RESULT: {'acc': {'train': 0.45098039215686275, 'valid': 0.392, 'test': 0.407}, 'wall_s': 26.5, 'cpu_s': 22.41, 'gpu_s': 4.03, 'wait_s': 637.78}
    [Time] wall=26.5s | cpu=22.4s | gpu=4.0s
    C:\Users\fbrev\Documents\Acadêmico\Simulações\Python\NoisyGL\predictor\Base_Predictor.py:114: UserWarning: expandable_segments not supported on this platform (Triggered internally at ..\c10/cuda/CUDAAllocatorConfig.h:28.)
    self.edge_index = self._cpu_edge_index.to(self.device)
    C:\Users\fbrev\Documents\Acadêmico\Simulações\Python\NoisyGL\predictor\Base_Predictor.py:144: UserWarning: Sparse CSR tensor support is in beta state. If you miss a functionality in the sparse tensor support, please submit a feature request to https://github.com/pytorch/pytorch/issues. (Triggered internally at ..\aten\src\ATen\SparseCsrTensorImpl.cpp:55.)
    self.adj_csr = self.adj.to_sparse_csr().to(self.device)
[I 2026-05-06 14:43:38,003] Trial 6 finished with value: 0.407 and parameters: {'lr': 0.05, 'weight_decay': 0.001, 'n_hidden': 128, 'n_layer': 3, 'dropout': 0.7020473327625294, 'knn_mode': 'd', 'k': 15, 'dexp': 0.5878486504011348, 'p_grd': 0.011335731587640785, 'unc_rem': 0.5858998350477302, 'unc_rel': 0.7226749298158259}. Best is trial 3 with value: 0.731.
    [CPU] Loading pubmed...
    DEBUG 3.1: Dataset init start
    DEBUG 3.2: prepare_data start pubmed
    ----Data statistics------'
    Name: pubmed
    #Nodes 19717
    #Edges 44324
    #Classes 3
    #Ave_degree 4.50
    ----Split statistics------'
    #Train samples 60 (default)
    #Val samples 500 (default)
    #Test samples 1000 (default)
    ----label noise information:------
    Instance dependent noise
    #Actual noise rate 0.21
    [cuda:1] LNPCC waiting for GPU slot...
    [cuda:1] Slot acquired (waited 1314.8s). Starting GCN...
    FINAL_RESULT: {'acc': {'train': 0.85, 'valid': 0.61, 'test': 0.713}, 'wall_s': 28.85, 'cpu_s': 26.66, 'gpu_s': 2.14, 'wait_s': 1314.77}
    [Time] wall=28.9s | cpu=26.7s | gpu=2.1s
    C:\Users\fbrev\Documents\Acadêmico\Simulações\Python\NoisyGL\predictor\Base_Predictor.py:114: UserWarning: expandable_segments not supported on this platform (Triggered internally at ..\c10/cuda/CUDAAllocatorConfig.h:28.)
    self.edge_index = self._cpu_edge_index.to(self.device)
    C:\Users\fbrev\Documents\Acadêmico\Simulações\Python\NoisyGL\predictor\Base_Predictor.py:144: UserWarning: Sparse CSR tensor support is in beta state. If you miss a functionality in the sparse tensor support, please submit a feature request to https://github.com/pytorch/pytorch/issues. (Triggered internally at ..\aten\src\ATen\SparseCsrTensorImpl.cpp:55.)
    self.adj_csr = self.adj.to_sparse_csr().to(self.device)
[I 2026-05-06 15:06:07,850] Trial 7 finished with value: 0.713 and parameters: {'lr': 0.005, 'weight_decay': 0.001, 'n_hidden': 64, 'n_layer': 2, 'dropout': 0.6564195734694973, 'knn_mode': 's', 'k': 7, 'dexp': 7.467726416853233, 'p_grd': 0.32445350005580476, 'unc_rem': 0.16404940716158267, 'unc_rel': 0.28013196087250636}. Best is trial 3 with value: 0.731.
    [CPU] Loading pubmed...
    DEBUG 3.1: Dataset init start
    DEBUG 3.2: prepare_data start pubmed
    ----Data statistics------'
    Name: pubmed
    #Nodes 19717
    #Edges 44324
    #Classes 3
    #Ave_degree 4.50
    ----Split statistics------'
    #Train samples 60 (default)
    #Val samples 500 (default)
    #Test samples 1000 (default)
    ----label noise information:------
    Instance dependent noise
    #Actual noise rate 0.21
    [cuda:1] LNPCC waiting for GPU slot...
    [cuda:1] Slot acquired (waited 2142.1s). Starting GCN...
    FINAL_RESULT: {'acc': {'train': 0.85, 'valid': 0.624, 'test': 0.718}, 'wall_s': 33.62, 'cpu_s': 29.52, 'gpu_s': 4.04, 'wait_s': 2142.08}
    [Time] wall=33.6s | cpu=29.5s | gpu=4.0s
    C:\Users\fbrev\Documents\Acadêmico\Simulações\Python\NoisyGL\predictor\Base_Predictor.py:114: UserWarning: expandable_segments not supported on this platform (Triggered internally at ..\c10/cuda/CUDAAllocatorConfig.h:28.)
    self.edge_index = self._cpu_edge_index.to(self.device)
    C:\Users\fbrev\Documents\Acadêmico\Simulações\Python\NoisyGL\predictor\Base_Predictor.py:144: UserWarning: Sparse CSR tensor support is in beta state. If you miss a functionality in the sparse tensor support, please submit a feature request to https://github.com/pytorch/pytorch/issues. (Triggered internally at ..\aten\src\ATen\SparseCsrTensorImpl.cpp:55.)
    self.adj_csr = self.adj.to_sparse_csr().to(self.device)
[I 2026-05-06 15:42:29,639] Trial 8 finished with value: 0.718 and parameters: {'lr': 0.01, 'weight_decay': 0.001, 'n_hidden': 256, 'n_layer': 2, 'dropout': 0.3294390530051932, 'knn_mode': 'd', 'k': 49, 'dexp': 9.06038712732777, 'p_grd': 0.8773552621619033, 'unc_rem': 0.897822936218505, 'unc_rel': 0.3722181582772752}. Best is trial 3 with value: 0.731.
    [CPU] Loading pubmed...
    DEBUG 3.1: Dataset init start
    DEBUG 3.2: prepare_data start pubmed
    ----Data statistics------'
    Name: pubmed
    #Nodes 19717
    #Edges 44324
    #Classes 3
    #Ave_degree 4.50
    ----Split statistics------'
    #Train samples 60 (default)
    #Val samples 500 (default)
    #Test samples 1000 (default)
    ----label noise information:------
    Instance dependent noise
    #Actual noise rate 0.21
    [cuda:1] LNPCC waiting for GPU slot...
    [cuda:1] Slot acquired (waited 307.0s). Starting GCN...
    FINAL_RESULT: {'acc': {'train': 0.31666666666666665, 'valid': 0.4, 'test': 0.437}, 'wall_s': 33.34, 'cpu_s': 29.2, 'gpu_s': 4.09, 'wait_s': 306.99}
    [Time] wall=33.3s | cpu=29.2s | gpu=4.1s
    C:\Users\fbrev\Documents\Acadêmico\Simulações\Python\NoisyGL\predictor\Base_Predictor.py:114: UserWarning: expandable_segments not supported on this platform (Triggered internally at ..\c10/cuda/CUDAAllocatorConfig.h:28.)
    self.edge_index = self._cpu_edge_index.to(self.device)
    C:\Users\fbrev\Documents\Acadêmico\Simulações\Python\NoisyGL\predictor\Base_Predictor.py:144: UserWarning: Sparse CSR tensor support is in beta state. If you miss a functionality in the sparse tensor support, please submit a feature request to https://github.com/pytorch/pytorch/issues. (Triggered internally at ..\aten\src\ATen\SparseCsrTensorImpl.cpp:55.)
    self.adj_csr = self.adj.to_sparse_csr().to(self.device)
[I 2026-05-06 15:48:16,981] Trial 9 finished with value: 0.437 and parameters: {'lr': 0.005, 'weight_decay': 0.05, 'n_hidden': 128, 'n_layer': 3, 'dropout': 0.773886541698701, 'knn_mode': 's', 'k': 18, 'dexp': 8.269728185343707, 'p_grd': 0.2593333173174225, 'unc_rem': 0.40038097716656995, 'unc_rel': 0.6395700032731858}. Best is trial 3 with value: 0.731.
    [CPU] Loading pubmed...
    DEBUG 3.1: Dataset init start
    DEBUG 3.2: prepare_data start pubmed
    ----Data statistics------'
    Name: pubmed
    #Nodes 19717
    #Edges 44324
    #Classes 3
    #Ave_degree 4.50
    ----Split statistics------'
    #Train samples 60 (default)
    #Val samples 500 (default)
    #Test samples 1000 (default)
    ----label noise information:------
    Instance dependent noise
    #Actual noise rate 0.21
    [cuda:1] LNPCC waiting for GPU slot...
    [cuda:1] Slot acquired (waited 134.6s). Starting GCN...
    FINAL_RESULT: {'acc': {'train': 0.9122807017543859, 'valid': 0.578, 'test': 0.702}, 'wall_s': 33.37, 'cpu_s': 29.92, 'gpu_s': 3.38, 'wait_s': 134.63}
    [Time] wall=33.4s | cpu=29.9s | gpu=3.4s
    C:\Users\fbrev\Documents\Acadêmico\Simulações\Python\NoisyGL\predictor\Base_Predictor.py:114: UserWarning: expandable_segments not supported on this platform (Triggered internally at ..\c10/cuda/CUDAAllocatorConfig.h:28.)
    self.edge_index = self._cpu_edge_index.to(self.device)
    C:\Users\fbrev\Documents\Acadêmico\Simulações\Python\NoisyGL\predictor\Base_Predictor.py:144: UserWarning: Sparse CSR tensor support is in beta state. If you miss a functionality in the sparse tensor support, please submit a feature request to https://github.com/pytorch/pytorch/issues. (Triggered internally at ..\aten\src\ATen\SparseCsrTensorImpl.cpp:55.)
    self.adj_csr = self.adj.to_sparse_csr().to(self.device)
[I 2026-05-06 15:51:11,463] Trial 10 finished with value: 0.702 and parameters: {'lr': 0.001, 'weight_decay': 0.0001, 'n_hidden': 64, 'n_layer': 3, 'dropout': 0.5010717996397103, 'knn_mode': 's', 'k': 31, 'dexp': 8.74303814548153, 'p_grd': 0.20174722186804284, 'unc_rem': 0.7503910147836939, 'unc_rel': 0.2507056072345083}. Best is trial 3 with value: 0.731.
    [CPU] Loading pubmed...
    DEBUG 3.1: Dataset init start
    DEBUG 3.2: prepare_data start pubmed
    ----Data statistics------'
    Name: pubmed
    #Nodes 19717
    #Edges 44324
    #Classes 3
    #Ave_degree 4.50
    ----Split statistics------'
    #Train samples 60 (default)
    #Val samples 500 (default)
    #Test samples 1000 (default)
    ----label noise information:------
    Instance dependent noise
    #Actual noise rate 0.21
    [cuda:1] LNPCC waiting for GPU slot...
    [cuda:1] Slot acquired (waited 629.6s). Starting GCN...
    FINAL_RESULT: {'acc': {'train': 0.8666666666666667, 'valid': 0.616, 'test': 0.704}, 'wall_s': 40.92, 'cpu_s': 38.44, 'gpu_s': 2.42, 'wait_s': 629.55}
    [Time] wall=40.9s | cpu=38.4s | gpu=2.4s
    C:\Users\fbrev\Documents\Acadêmico\Simulações\Python\NoisyGL\predictor\Base_Predictor.py:114: UserWarning: expandable_segments not supported on this platform (Triggered internally at ..\c10/cuda/CUDAAllocatorConfig.h:28.)
    self.edge_index = self._cpu_edge_index.to(self.device)
    C:\Users\fbrev\Documents\Acadêmico\Simulações\Python\NoisyGL\predictor\Base_Predictor.py:144: UserWarning: Sparse CSR tensor support is in beta state. If you miss a functionality in the sparse tensor support, please submit a feature request to https://github.com/pytorch/pytorch/issues. (Triggered internally at ..\aten\src\ATen\SparseCsrTensorImpl.cpp:55.)
    self.adj_csr = self.adj.to_sparse_csr().to(self.device)
