[I 2026-05-01 23:51:19,617] Trial 44 finished with value: 0.735 and parameters: {'lr': 0.005, 'weight_decay': 0.001, 'n_hidden': 32, 'n_layer': 2, 'dropout': 0.75285375738369, 'knn_mode': 's', 'k': 5, 'dexp': 2.0122207940161045, 'p_grd': 0.5061589777513892, 'unc_rem': 0.1353167167224592, 'unc_rel': 0.22311745048735007}. Best is trial 4 with value: 0.87.
    [CPU] Loading amazonpho...
    DEBUG 3.1: Dataset init start
    DEBUG 3.2: prepare_data start amazonpho
    ----Data statistics------'
    Name: amazonpho
    #Nodes 7650
    #Edges 119081
    #Classes 8
    #Ave_degree 31.13
    ----Split statistics------'
    #Train samples 160 (20 nodes per class)
    #Val samples 500 (specified)
    #Test samples 1000 (specified)
    ----label noise information:------
    Instance dependent noise
    #Actual noise rate 0.40
    [cuda:0] LNPCC waiting for GPU slot...
    [cuda:0] Slot acquired (waited 2.2s). Starting GCN...
    FINAL_RESULT: {'acc': {'train': 0.55625, 'valid': 0.514, 'test': 0.826}, 'wall_s': 20.22, 'cpu_s': 17.47, 'gpu_s': 2.71, 'wait_s': 2.24}
    [Time] wall=20.2s | cpu=17.5s | gpu=2.7s
    C:\Users\fbrev\Documents\Acadêmico\Simulações\Python\NoisyGL\predictor\Base_Predictor.py:114: UserWarning: expandable_segments not supported on this platform (Triggered internally at ..\c10/cuda/CUDAAllocatorConfig.h:28.)
    self.edge_index = self._cpu_edge_index.to(self.device)
    C:\Users\fbrev\Documents\Acadêmico\Simulações\Python\NoisyGL\predictor\Base_Predictor.py:144: UserWarning: Sparse CSR tensor support is in beta state. If you miss a functionality in the sparse tensor support, please submit a feature request to https://github.com/pytorch/pytorch/issues. (Triggered internally at ..\aten\src\ATen\SparseCsrTensorImpl.cpp:55.)
    self.adj_csr = self.adj.to_sparse_csr().to(self.device)
[I 2026-05-01 23:51:49,094] Trial 45 finished with value: 0.826 and parameters: {'lr': 0.005, 'weight_decay': 0.001, 'n_hidden': 64, 'n_layer': 2, 'dropout': 0.7198856229496355, 'knn_mode': 'd', 'k': 7, 'dexp': 2.6971404873491887, 'p_grd': 0.6452760535364289, 'unc_rem': 0.45279588086694317, 'unc_rel': 0.004365056709295757}. Best is trial 4 with value: 0.87.
    [CPU] Loading amazonpho...
    DEBUG 3.1: Dataset init start
    DEBUG 3.2: prepare_data start amazonpho
    ----Data statistics------'
    Name: amazonpho
    #Nodes 7650
    #Edges 119081
    #Classes 8
    #Ave_degree 31.13
    ----Split statistics------'
    #Train samples 160 (20 nodes per class)
    #Val samples 500 (specified)
    #Test samples 1000 (specified)
    ----label noise information:------
    Instance dependent noise
    #Actual noise rate 0.40
    [cuda:0] LNPCC waiting for GPU slot...
    [cuda:0] Slot acquired (waited 247.9s). Starting GCN...
    FINAL_RESULT: {'acc': {'train': 0.6305732484076433, 'valid': 0.522, 'test': 0.83}, 'wall_s': 17.55, 'cpu_s': 14.2, 'gpu_s': 3.31, 'wait_s': 247.93}
    [Time] wall=17.6s | cpu=14.2s | gpu=3.3s
    C:\Users\fbrev\Documents\Acadêmico\Simulações\Python\NoisyGL\predictor\Base_Predictor.py:114: UserWarning: expandable_segments not supported on this platform (Triggered internally at ..\c10/cuda/CUDAAllocatorConfig.h:28.)
    self.edge_index = self._cpu_edge_index.to(self.device)
    C:\Users\fbrev\Documents\Acadêmico\Simulações\Python\NoisyGL\predictor\Base_Predictor.py:144: UserWarning: Sparse CSR tensor support is in beta state. If you miss a functionality in the sparse tensor support, please submit a feature request to https://github.com/pytorch/pytorch/issues. (Triggered internally at ..\aten\src\ATen\SparseCsrTensorImpl.cpp:55.)
    self.adj_csr = self.adj.to_sparse_csr().to(self.device)
[I 2026-05-01 23:56:21,299] Trial 46 finished with value: 0.83 and parameters: {'lr': 0.001, 'weight_decay': 0.0, 'n_hidden': 128, 'n_layer': 2, 'dropout': 0.5178436024336629, 'knn_mode': 's', 'k': 12, 'dexp': 9.96846054414452, 'p_grd': 0.45382642710300325, 'unc_rem': 0.2881488946370295, 'unc_rel': 0.35521708208971337}. Best is trial 4 with value: 0.87.
    [CPU] Loading amazonpho...
    DEBUG 3.1: Dataset init start
    DEBUG 3.2: prepare_data start amazonpho
    ----Data statistics------'
    Name: amazonpho
    #Nodes 7650
    #Edges 119081
    #Classes 8
    #Ave_degree 31.13
    ----Split statistics------'
    #Train samples 160 (20 nodes per class)
    #Val samples 500 (specified)
    #Test samples 1000 (specified)
    ----label noise information:------
    Instance dependent noise
    #Actual noise rate 0.40
    [cuda:0] LNPCC waiting for GPU slot...
    [cuda:0] Slot acquired (waited 325.6s). Starting GCN...
    FINAL_RESULT: {'acc': {'train': 0.6066666666666667, 'valid': 0.518, 'test': 0.827}, 'wall_s': 27.55, 'cpu_s': 20.19, 'gpu_s': 7.3, 'wait_s': 325.59}
    [Time] wall=27.5s | cpu=20.2s | gpu=7.3s
    C:\Users\fbrev\Documents\Acadêmico\Simulações\Python\NoisyGL\predictor\Base_Predictor.py:114: UserWarning: expandable_segments not supported on this platform (Triggered internally at ..\c10/cuda/CUDAAllocatorConfig.h:28.)
    self.edge_index = self._cpu_edge_index.to(self.device)
    C:\Users\fbrev\Documents\Acadêmico\Simulações\Python\NoisyGL\predictor\Base_Predictor.py:144: UserWarning: Sparse CSR tensor support is in beta state. If you miss a functionality in the sparse tensor support, please submit a feature request to https://github.com/pytorch/pytorch/issues. (Triggered internally at ..\aten\src\ATen\SparseCsrTensorImpl.cpp:55.)
    self.adj_csr = self.adj.to_sparse_csr().to(self.device)
[I 2026-05-02 00:02:20,936] Trial 47 finished with value: 0.827 and parameters: {'lr': 0.01, 'weight_decay': 0.01, 'n_hidden': 256, 'n_layer': 3, 'dropout': 0.6284786186068682, 'knn_mode': 'd', 'k': 36, 'dexp': 3.33279485267862, 'p_grd': 0.3697161403797332, 'unc_rem': 0.08869870295321328, 'unc_rel': 0.2026101110932832}. Best is trial 4 with value: 0.87.
    [CPU] Loading amazonpho...
    DEBUG 3.1: Dataset init start
    DEBUG 3.2: prepare_data start amazonpho
    ----Data statistics------'
    Name: amazonpho
    #Nodes 7650
    #Edges 119081
    #Classes 8
    #Ave_degree 31.13
    ----Split statistics------'
    #Train samples 160 (20 nodes per class)
    #Val samples 500 (specified)
    #Test samples 1000 (specified)
    ----label noise information:------
    Instance dependent noise
    #Actual noise rate 0.40
    [cuda:0] LNPCC waiting for GPU slot...
    [cuda:0] Slot acquired (waited 410.0s). Starting GCN...
[I 2026-05-02 00:09:32,384] Trial 48 finished with value: 0.0 and parameters: {'lr': 0.005, 'weight_decay': 0.001, 'n_hidden': 64, 'n_layer': 2, 'dropout': 0.45544342540536353, 'knn_mode': 's', 'k': 10, 'dexp': 1.3231915257604907, 'p_grd': 0.2541962109878565, 'unc_rem': 0.5501793965069752, 'unc_rel': 0.3974664037022157}. Best is trial 4 with value: 0.87.
    [CPU] Loading amazonpho...
    DEBUG 3.1: Dataset init start
    DEBUG 3.2: prepare_data start amazonpho
    ----Data statistics------'
    Name: amazonpho
    #Nodes 7650
    #Edges 119081
    #Classes 8
    #Ave_degree 31.13
    ----Split statistics------'
    #Train samples 160 (20 nodes per class)
    #Val samples 500 (specified)
    #Test samples 1000 (specified)
    ----label noise information:------
    Instance dependent noise
    #Actual noise rate 0.40
    [cuda:0] LNPCC waiting for GPU slot...
    [cuda:0] Slot acquired (waited 113.5s). Starting GCN...
    FINAL_RESULT: {'acc': {'train': 0.3576158940397351, 'valid': 0.352, 'test': 0.555}, 'wall_s': 22.58, 'cpu_s': 20.33, 'gpu_s': 2.21, 'wait_s': 113.54}
    [Time] wall=22.6s | cpu=20.3s | gpu=2.2s
    C:\Users\fbrev\Documents\Acadêmico\Simulações\Python\NoisyGL\predictor\Base_Predictor.py:114: UserWarning: expandable_segments not supported on this platform (Triggered internally at ..\c10/cuda/CUDAAllocatorConfig.h:28.)
    self.edge_index = self._cpu_edge_index.to(self.device)
    C:\Users\fbrev\Documents\Acadêmico\Simulações\Python\NoisyGL\predictor\Base_Predictor.py:144: UserWarning: Sparse CSR tensor support is in beta state. If you miss a functionality in the sparse tensor support, please submit a feature request to https://github.com/pytorch/pytorch/issues. (Triggered internally at ..\aten\src\ATen\SparseCsrTensorImpl.cpp:55.)
    self.adj_csr = self.adj.to_sparse_csr().to(self.device)
