[I 2026-05-03 21:22:11,806] Trial 22 finished with value: 0.7058682058682059 and parameters: {'lr': 0.001, 'weight_decay': 0.001, 'n_hidden': 64, 'n_layer': 2, 'dropout': 0.6180621222378676, 'knn_mode': 'd', 'k': 50, 'dexp': 5.722388226272167, 'p_grd': 0.7946845595836732, 'unc_rem': 0.582770587582198, 'unc_rel': 0.43445716318255234}. Best is trial 22 with value: 0.7058682058682059.
    [CPU] Loading blogcatalog...
    DEBUG 3.1: Dataset init start
    DEBUG 3.2: prepare_data start blogcatalog
    ----Data statistics------'
    Name: blogcatalog
    #Nodes 5196
    #Edges 171743
    #Classes 6
    #Ave_degree 66.11
    ----Split statistics------'
    #Train samples 259 (5.0 % of nodes)
    #Val samples 779 (15.0 % of nodes)
    #Test samples 4158 (remaining)
    ----label noise information:------
    Instance dependent noise
    #Actual noise rate 0.30
    [cuda:0] LNPCC waiting for GPU slot...
    [cuda:0] Slot acquired (waited 47.6s). Starting GCN...
    FINAL_RESULT: {'acc': {'train': 0.637065637065637, 'valid': 0.5417201540436457, 'test': 0.7029822029822029}, 'wall_s': 34.27, 'cpu_s': 31.56, 'gpu_s': 2.64, 'wait_s': 47.6}
    [Time] wall=34.3s | cpu=31.6s | gpu=2.6s
    C:\Users\fbrev\Documents\Acadêmico\Simulações\Python\NoisyGL\predictor\Base_Predictor.py:114: UserWarning: expandable_segments not supported on this platform (Triggered internally at ..\c10/cuda/CUDAAllocatorConfig.h:28.)
    self.edge_index = self._cpu_edge_index.to(self.device)
    C:\Users\fbrev\Documents\Acadêmico\Simulações\Python\NoisyGL\predictor\Base_Predictor.py:144: UserWarning: Sparse CSR tensor support is in beta state. If you miss a functionality in the sparse tensor support, please submit a feature request to https://github.com/pytorch/pytorch/issues. (Triggered internally at ..\aten\src\ATen\SparseCsrTensorImpl.cpp:55.)
    self.adj_csr = self.adj.to_sparse_csr().to(self.device)
[I 2026-05-03 21:23:38,872] Trial 23 finished with value: 0.7029822029822029 and parameters: {'lr': 0.001, 'weight_decay': 0.001, 'n_hidden': 64, 'n_layer': 2, 'dropout': 0.5814133912017753, 'knn_mode': 'd', 'k': 50, 'dexp': 5.8406241535141525, 'p_grd': 0.790845377328677, 'unc_rem': 0.5816214113079468, 'unc_rel': 0.45754018760541687}. Best is trial 22 with value: 0.7058682058682059.
    [CPU] Loading blogcatalog...
    DEBUG 3.1: Dataset init start
    DEBUG 3.2: prepare_data start blogcatalog
    ----Data statistics------'
    Name: blogcatalog
    #Nodes 5196
    #Edges 171743
    #Classes 6
    #Ave_degree 66.11
    ----Split statistics------'
    #Train samples 259 (5.0 % of nodes)
    #Val samples 779 (15.0 % of nodes)
    #Test samples 4158 (remaining)
    ----label noise information:------
    Instance dependent noise
    #Actual noise rate 0.30
    [cuda:0] LNPCC waiting for GPU slot...
    [cuda:0] Slot acquired (waited 40.1s). Starting GCN...
    FINAL_RESULT: {'acc': {'train': 0.6177606177606177, 'valid': 0.5378690629011553, 'test': 0.7017797017797017}, 'wall_s': 33.99, 'cpu_s': 31.26, 'gpu_s': 2.64, 'wait_s': 40.14}
    [Time] wall=34.0s | cpu=31.3s | gpu=2.6s
    C:\Users\fbrev\Documents\Acadêmico\Simulações\Python\NoisyGL\predictor\Base_Predictor.py:114: UserWarning: expandable_segments not supported on this platform (Triggered internally at ..\c10/cuda/CUDAAllocatorConfig.h:28.)
    self.edge_index = self._cpu_edge_index.to(self.device)
    C:\Users\fbrev\Documents\Acadêmico\Simulações\Python\NoisyGL\predictor\Base_Predictor.py:144: UserWarning: Sparse CSR tensor support is in beta state. If you miss a functionality in the sparse tensor support, please submit a feature request to https://github.com/pytorch/pytorch/issues. (Triggered internally at ..\aten\src\ATen\SparseCsrTensorImpl.cpp:55.)
    self.adj_csr = self.adj.to_sparse_csr().to(self.device)
[I 2026-05-03 21:24:58,164] Trial 24 finished with value: 0.7017797017797017 and parameters: {'lr': 0.001, 'weight_decay': 0.001, 'n_hidden': 64, 'n_layer': 2, 'dropout': 0.5757366344260275, 'knn_mode': 'd', 'k': 50, 'dexp': 5.514614083861639, 'p_grd': 0.7561664322522319, 'unc_rem': 0.5332306115325427, 'unc_rel': 0.4501712657738214}. Best is trial 22 with value: 0.7058682058682059.
    [CPU] Loading blogcatalog...
    DEBUG 3.1: Dataset init start
    DEBUG 3.2: prepare_data start blogcatalog
    ----Data statistics------'
    Name: blogcatalog
    #Nodes 5196
    #Edges 171743
    #Classes 6
    #Ave_degree 66.11
    ----Split statistics------'
    #Train samples 259 (5.0 % of nodes)
    #Val samples 779 (15.0 % of nodes)
    #Test samples 4158 (remaining)
    ----label noise information:------
    Instance dependent noise
    #Actual noise rate 0.30
    [cuda:0] LNPCC waiting for GPU slot...
    [cuda:0] Slot acquired (waited 34.2s). Starting GCN...
    FINAL_RESULT: {'acc': {'train': 0.6254826254826255, 'valid': 0.5391527599486521, 'test': 0.6981721981721982}, 'wall_s': 41.97, 'cpu_s': 39.31, 'gpu_s': 2.6, 'wait_s': 34.17}
    [Time] wall=42.0s | cpu=39.3s | gpu=2.6s
    C:\Users\fbrev\Documents\Acadêmico\Simulações\Python\NoisyGL\predictor\Base_Predictor.py:114: UserWarning: expandable_segments not supported on this platform (Triggered internally at ..\c10/cuda/CUDAAllocatorConfig.h:28.)
    self.edge_index = self._cpu_edge_index.to(self.device)
    C:\Users\fbrev\Documents\Acadêmico\Simulações\Python\NoisyGL\predictor\Base_Predictor.py:144: UserWarning: Sparse CSR tensor support is in beta state. If you miss a functionality in the sparse tensor support, please submit a feature request to https://github.com/pytorch/pytorch/issues. (Triggered internally at ..\aten\src\ATen\SparseCsrTensorImpl.cpp:55.)
    self.adj_csr = self.adj.to_sparse_csr().to(self.device)
[I 2026-05-03 21:26:19,314] Trial 25 finished with value: 0.6981721981721982 and parameters: {'lr': 0.001, 'weight_decay': 0.001, 'n_hidden': 64, 'n_layer': 2, 'dropout': 0.3013454947549717, 'knn_mode': 'd', 'k': 46, 'dexp': 5.216099586720054, 'p_grd': 0.9083780305423158, 'unc_rem': 0.6075942915970413, 'unc_rel': 0.4103470519750337}. Best is trial 22 with value: 0.7058682058682059.
    [CPU] Loading blogcatalog...
    DEBUG 3.1: Dataset init start
    DEBUG 3.2: prepare_data start blogcatalog
    ----Data statistics------'
    Name: blogcatalog
    #Nodes 5196
    #Edges 171743
    #Classes 6
    #Ave_degree 66.11
    ----Split statistics------'
    #Train samples 259 (5.0 % of nodes)
    #Val samples 779 (15.0 % of nodes)
    #Test samples 4158 (remaining)
    ----label noise information:------
    Instance dependent noise
    #Actual noise rate 0.30
    [cuda:0] LNPCC waiting for GPU slot...
    [cuda:0] Slot acquired (waited 51.9s). Starting GCN...
    FINAL_RESULT: {'acc': {'train': 0.637065637065637, 'valid': 0.5378690629011553, 'test': 0.7022607022607023}, 'wall_s': 27.45, 'cpu_s': 24.72, 'gpu_s': 2.66, 'wait_s': 51.9}
    [Time] wall=27.4s | cpu=24.7s | gpu=2.7s
    C:\Users\fbrev\Documents\Acadêmico\Simulações\Python\NoisyGL\predictor\Base_Predictor.py:114: UserWarning: expandable_segments not supported on this platform (Triggered internally at ..\c10/cuda/CUDAAllocatorConfig.h:28.)
    self.edge_index = self._cpu_edge_index.to(self.device)
    C:\Users\fbrev\Documents\Acadêmico\Simulações\Python\NoisyGL\predictor\Base_Predictor.py:144: UserWarning: Sparse CSR tensor support is in beta state. If you miss a functionality in the sparse tensor support, please submit a feature request to https://github.com/pytorch/pytorch/issues. (Triggered internally at ..\aten\src\ATen\SparseCsrTensorImpl.cpp:55.)
    self.adj_csr = self.adj.to_sparse_csr().to(self.device)
[I 2026-05-03 21:27:43,291] Trial 26 finished with value: 0.7022607022607023 and parameters: {'lr': 0.001, 'weight_decay': 0.001, 'n_hidden': 64, 'n_layer': 2, 'dropout': 0.41461411797750813, 'knn_mode': 'd', 'k': 36, 'dexp': 5.971863536144038, 'p_grd': 0.5955589533872729, 'unc_rem': 0.43778962427789236, 'unc_rel': 0.5365004302063244}. Best is trial 22 with value: 0.7058682058682059.
    [CPU] Loading blogcatalog...
    DEBUG 3.1: Dataset init start
    DEBUG 3.2: prepare_data start blogcatalog
    ----Data statistics------'
    Name: blogcatalog
    #Nodes 5196
    #Edges 171743
    #Classes 6
    #Ave_degree 66.11
    ----Split statistics------'
    #Train samples 259 (5.0 % of nodes)
    #Val samples 779 (15.0 % of nodes)
    #Test samples 4158 (remaining)
    ----label noise information:------
    Instance dependent noise
    #Actual noise rate 0.30
    [cuda:0] LNPCC waiting for GPU slot...
    [cuda:0] Slot acquired (waited 39.6s). Starting GCN...
    FINAL_RESULT: {'acc': {'train': 0.2972972972972973, 'valid': 0.2952503209242619, 'test': 0.36002886002886003}, 'wall_s': 51.8, 'cpu_s': 45.73, 'gpu_s': 6.0, 'wait_s': 39.65}
    [Time] wall=51.8s | cpu=45.7s | gpu=6.0s
    C:\Users\fbrev\Documents\Acadêmico\Simulações\Python\NoisyGL\predictor\Base_Predictor.py:114: UserWarning: expandable_segments not supported on this platform (Triggered internally at ..\c10/cuda/CUDAAllocatorConfig.h:28.)
    self.edge_index = self._cpu_edge_index.to(self.device)
    C:\Users\fbrev\Documents\Acadêmico\Simulações\Python\NoisyGL\predictor\Base_Predictor.py:144: UserWarning: Sparse CSR tensor support is in beta state. If you miss a functionality in the sparse tensor support, please submit a feature request to https://github.com/pytorch/pytorch/issues. (Triggered internally at ..\aten\src\ATen\SparseCsrTensorImpl.cpp:55.)
    self.adj_csr = self.adj.to_sparse_csr().to(self.device)
[I 2026-05-03 21:29:19,265] Trial 27 finished with value: 0.36002886002886003 and parameters: {'lr': 0.1, 'weight_decay': 0.001, 'n_hidden': 256, 'n_layer': 2, 'dropout': 0.599135557878547, 'knn_mode': 'd', 'k': 46, 'dexp': 1.3998560442016532, 'p_grd': 0.7502647214296942, 'unc_rem': 0.626295293168868, 'unc_rel': 0.5881228256378621}. Best is trial 22 with value: 0.7058682058682059.
    [CPU] Loading blogcatalog...
    DEBUG 3.1: Dataset init start
    DEBUG 3.2: prepare_data start blogcatalog
    ----Data statistics------'
    Name: blogcatalog
    #Nodes 5196
    #Edges 171743
    #Classes 6
    #Ave_degree 66.11
    ----Split statistics------'
    #Train samples 259 (5.0 % of nodes)
    #Val samples 779 (15.0 % of nodes)
    #Test samples 4158 (remaining)
    ----label noise information:------
    Instance dependent noise
    #Actual noise rate 0.30
    [cuda:0] LNPCC waiting for GPU slot...
    [cuda:0] Slot acquired (waited 124.6s). Starting GCN...
    FINAL_RESULT: {'acc': {'train': 0.5791505791505791, 'valid': 0.5494223363286265, 'test': 0.708994708994709}, 'wall_s': 35.11, 'cpu_s': 32.29, 'gpu_s': 2.76, 'wait_s': 124.55}
    [Time] wall=35.1s | cpu=32.3s | gpu=2.8s
    C:\Users\fbrev\Documents\Acadêmico\Simulações\Python\NoisyGL\predictor\Base_Predictor.py:114: UserWarning: expandable_segments not supported on this platform (Triggered internally at ..\c10/cuda/CUDAAllocatorConfig.h:28.)
    self.edge_index = self._cpu_edge_index.to(self.device)
    C:\Users\fbrev\Documents\Acadêmico\Simulações\Python\NoisyGL\predictor\Base_Predictor.py:144: UserWarning: Sparse CSR tensor support is in beta state. If you miss a functionality in the sparse tensor support, please submit a feature request to https://github.com/pytorch/pytorch/issues. (Triggered internally at ..\aten\src\ATen\SparseCsrTensorImpl.cpp:55.)
    self.adj_csr = self.adj.to_sparse_csr().to(self.device)
[I 2026-05-03 21:32:03,617] Trial 28 finished with value: 0.708994708994709 and parameters: {'lr': 0.01, 'weight_decay': 0.001, 'n_hidden': 64, 'n_layer': 2, 'dropout': 0.4436569324809896, 'knn_mode': 'd', 'k': 43, 'dexp': 4.717097011137264, 'p_grd': 0.8464540133779828, 'unc_rem': 0.5294613258351407, 'unc_rel': 0.46935071502613473}. Best is trial 28 with value: 0.708994708994709.
    [CPU] Loading blogcatalog...
    DEBUG 3.1: Dataset init start
    DEBUG 3.2: prepare_data start blogcatalog
    ----Data statistics------'
    Name: blogcatalog
    #Nodes 5196
    #Edges 171743
    #Classes 6
    #Ave_degree 66.11
    ----Split statistics------'
    #Train samples 259 (5.0 % of nodes)
    #Val samples 779 (15.0 % of nodes)
    #Test samples 4158 (remaining)
    ----label noise information:------
    Instance dependent noise
    #Actual noise rate 0.30
    [cuda:0] LNPCC waiting for GPU slot...
    [cuda:0] Slot acquired (waited 131.4s). Starting GCN...
    FINAL_RESULT: {'acc': {'train': 0.61003861003861, 'valid': 0.55198973042362, 'test': 0.7111592111592112}, 'wall_s': 38.67, 'cpu_s': 32.51, 'gpu_s': 6.07, 'wait_s': 131.43}
    [Time] wall=38.7s | cpu=32.5s | gpu=6.1s
    C:\Users\fbrev\Documents\Acadêmico\Simulações\Python\NoisyGL\predictor\Base_Predictor.py:114: UserWarning: expandable_segments not supported on this platform (Triggered internally at ..\c10/cuda/CUDAAllocatorConfig.h:28.)
    self.edge_index = self._cpu_edge_index.to(self.device)
    C:\Users\fbrev\Documents\Acadêmico\Simulações\Python\NoisyGL\predictor\Base_Predictor.py:144: UserWarning: Sparse CSR tensor support is in beta state. If you miss a functionality in the sparse tensor support, please submit a feature request to https://github.com/pytorch/pytorch/issues. (Triggered internally at ..\aten\src\ATen\SparseCsrTensorImpl.cpp:55.)
    self.adj_csr = self.adj.to_sparse_csr().to(self.device)
[I 2026-05-03 21:34:59,197] Trial 29 finished with value: 0.7111592111592112 and parameters: {'lr': 0.01, 'weight_decay': 0.001, 'n_hidden': 256, 'n_layer': 2, 'dropout': 0.4270524379550553, 'knn_mode': 'd', 'k': 42, 'dexp': 4.597925564516931, 'p_grd': 0.6992787541874816, 'unc_rem': 0.3686193274828788, 'unc_rel': 0.542123845436612}. Best is trial 29 with value: 0.7111592111592112.
    [CPU] Loading blogcatalog...
    DEBUG 3.1: Dataset init start
    DEBUG 3.2: prepare_data start blogcatalog
    ----Data statistics------'
    Name: blogcatalog
    #Nodes 5196
    #Edges 171743
    #Classes 6
    #Ave_degree 66.11
    ----Split statistics------'
    #Train samples 259 (5.0 % of nodes)
    #Val samples 779 (15.0 % of nodes)
    #Test samples 4158 (remaining)
    ----label noise information:------
    Instance dependent noise
    #Actual noise rate 0.30
    [cuda:0] LNPCC waiting for GPU slot...
    [cuda:0] Slot acquired (waited 43.9s). Starting GCN...
    FINAL_RESULT: {'acc': {'train': 0.6602316602316602, 'valid': 0.5430038510911425, 'test': 0.696969696969697}, 'wall_s': 36.66, 'cpu_s': 30.4, 'gpu_s': 6.19, 'wait_s': 43.88}
    [Time] wall=36.7s | cpu=30.4s | gpu=6.2s
    C:\Users\fbrev\Documents\Acadêmico\Simulações\Python\NoisyGL\predictor\Base_Predictor.py:114: UserWarning: expandable_segments not supported on this platform (Triggered internally at ..\c10/cuda/CUDAAllocatorConfig.h:28.)
    self.edge_index = self._cpu_edge_index.to(self.device)
    C:\Users\fbrev\Documents\Acadêmico\Simulações\Python\NoisyGL\predictor\Base_Predictor.py:144: UserWarning: Sparse CSR tensor support is in beta state. If you miss a functionality in the sparse tensor support, please submit a feature request to https://github.com/pytorch/pytorch/issues. (Triggered internally at ..\aten\src\ATen\SparseCsrTensorImpl.cpp:55.)
    self.adj_csr = self.adj.to_sparse_csr().to(self.device)
[I 2026-05-03 21:36:24,859] Trial 30 finished with value: 0.696969696969697 and parameters: {'lr': 0.01, 'weight_decay': 0.001, 'n_hidden': 256, 'n_layer': 2, 'dropout': 0.42566236295671456, 'knn_mode': 'd', 'k': 35, 'dexp': 4.60499066937364, 'p_grd': 0.6809055289182094, 'unc_rem': 0.40781578079325376, 'unc_rel': 0.5204188764819524}. Best is trial 29 with value: 0.7111592111592112.
    [CPU] Loading blogcatalog...
    DEBUG 3.1: Dataset init start
    DEBUG 3.2: prepare_data start blogcatalog
    ----Data statistics------'
    Name: blogcatalog
    #Nodes 5196
    #Edges 171743
    #Classes 6
    #Ave_degree 66.11
    ----Split statistics------'
    #Train samples 259 (5.0 % of nodes)
    #Val samples 779 (15.0 % of nodes)
    #Test samples 4158 (remaining)
    ----label noise information:------
    Instance dependent noise
    #Actual noise rate 0.30
    [cuda:0] LNPCC waiting for GPU slot...
    [cuda:0] Slot acquired (waited 406.7s). Starting GCN...
    FINAL_RESULT: {'acc': {'train': 0.583011583011583, 'valid': 0.5417201540436457, 'test': 0.7113997113997114}, 'wall_s': 48.46, 'cpu_s': 42.23, 'gpu_s': 6.15, 'wait_s': 406.68}
    [Time] wall=48.5s | cpu=42.2s | gpu=6.1s
    C:\Users\fbrev\Documents\Acadêmico\Simulações\Python\NoisyGL\predictor\Base_Predictor.py:114: UserWarning: expandable_segments not supported on this platform (Triggered internally at ..\c10/cuda/CUDAAllocatorConfig.h:28.)
    self.edge_index = self._cpu_edge_index.to(self.device)
    C:\Users\fbrev\Documents\Acadêmico\Simulações\Python\NoisyGL\predictor\Base_Predictor.py:144: UserWarning: Sparse CSR tensor support is in beta state. If you miss a functionality in the sparse tensor support, please submit a feature request to https://github.com/pytorch/pytorch/issues. (Triggered internally at ..\aten\src\ATen\SparseCsrTensorImpl.cpp:55.)
    self.adj_csr = self.adj.to_sparse_csr().to(self.device)
[I 2026-05-03 21:44:05,033] Trial 31 finished with value: 0.7113997113997114 and parameters: {'lr': 0.01, 'weight_decay': 0.001, 'n_hidden': 256, 'n_layer': 2, 'dropout': 0.27805795761255525, 'knn_mode': 'd', 'k': 43, 'dexp': 4.527699415969152, 'p_grd': 0.8651098248066428, 'unc_rem': 0.3626832515794652, 'unc_rel': 0.39905900405090794}. Best is trial 31 with value: 0.7113997113997114.
    [CPU] Loading blogcatalog...
    DEBUG 3.1: Dataset init start
    DEBUG 3.2: prepare_data start blogcatalog
    ----Data statistics------'
    Name: blogcatalog
    #Nodes 5196
    #Edges 171743
    #Classes 6
    #Ave_degree 66.11
    ----Split statistics------'
    #Train samples 259 (5.0 % of nodes)
    #Val samples 779 (15.0 % of nodes)
    #Test samples 4158 (remaining)
    ----label noise information:------
    Instance dependent noise
    #Actual noise rate 0.30
    [cuda:0] LNPCC waiting for GPU slot...
    [cuda:0] Slot acquired (waited 40.1s). Starting GCN...
    FINAL_RESULT: {'acc': {'train': 0.61003861003861, 'valid': 0.5455712451861361, 'test': 0.7061087061087061}, 'wall_s': 37.86, 'cpu_s': 31.74, 'gpu_s': 6.04, 'wait_s': 40.08}
    [Time] wall=37.9s | cpu=31.7s | gpu=6.0s
    C:\Users\fbrev\Documents\Acadêmico\Simulações\Python\NoisyGL\predictor\Base_Predictor.py:114: UserWarning: expandable_segments not supported on this platform (Triggered internally at ..\c10/cuda/CUDAAllocatorConfig.h:28.)
    self.edge_index = self._cpu_edge_index.to(self.device)
    C:\Users\fbrev\Documents\Acadêmico\Simulações\Python\NoisyGL\predictor\Base_Predictor.py:144: UserWarning: Sparse CSR tensor support is in beta state. If you miss a functionality in the sparse tensor support, please submit a feature request to https://github.com/pytorch/pytorch/issues. (Triggered internally at ..\aten\src\ATen\SparseCsrTensorImpl.cpp:55.)
    self.adj_csr = self.adj.to_sparse_csr().to(self.device)
[I 2026-05-03 21:45:27,874] Trial 32 finished with value: 0.7061087061087061 and parameters: {'lr': 0.01, 'weight_decay': 0.001, 'n_hidden': 256, 'n_layer': 2, 'dropout': 0.37056291543092346, 'knn_mode': 'd', 'k': 43, 'dexp': 4.7001646674143185, 'p_grd': 0.5768398595937501, 'unc_rem': 0.48599908480949777, 'unc_rel': 0.509349296629869}. Best is trial 31 with value: 0.7113997113997114.
    [CPU] Loading blogcatalog...
    DEBUG 3.1: Dataset init start
    DEBUG 3.2: prepare_data start blogcatalog
    ----Data statistics------'
    Name: blogcatalog
    #Nodes 5196
    #Edges 171743
    #Classes 6
    #Ave_degree 66.11
    ----Split statistics------'
    #Train samples 259 (5.0 % of nodes)
    #Val samples 779 (15.0 % of nodes)
    #Test samples 4158 (remaining)
    ----label noise information:------
    Instance dependent noise
    #Actual noise rate 0.30
    [cuda:0] LNPCC waiting for GPU slot...
    [cuda:0] Slot acquired (waited 44.8s). Starting GCN...
    FINAL_RESULT: {'acc': {'train': 0.2277992277992278, 'valid': 0.2374839537869063, 'test': 0.2429052429052429}, 'wall_s': 39.33, 'cpu_s': 33.21, 'gpu_s': 6.04, 'wait_s': 44.8}
    [Time] wall=39.3s | cpu=33.2s | gpu=6.0s
    C:\Users\fbrev\Documents\Acadêmico\Simulações\Python\NoisyGL\predictor\Base_Predictor.py:114: UserWarning: expandable_segments not supported on this platform (Triggered internally at ..\c10/cuda/CUDAAllocatorConfig.h:28.)
    self.edge_index = self._cpu_edge_index.to(self.device)
    C:\Users\fbrev\Documents\Acadêmico\Simulações\Python\NoisyGL\predictor\Base_Predictor.py:144: UserWarning: Sparse CSR tensor support is in beta state. If you miss a functionality in the sparse tensor support, please submit a feature request to https://github.com/pytorch/pytorch/issues. (Triggered internally at ..\aten\src\ATen\SparseCsrTensorImpl.cpp:55.)
    self.adj_csr = self.adj.to_sparse_csr().to(self.device)
