[worker] START lnpcc_amazoncom_0.2 gpu=0
[HPO] Starting Phase 1 (Optuna) for lnpcc_amazoncom_instance_0.2...
[I 2026-04-30 23:18:05,419] Using an existing study with name 'lnpcc_amazoncom_instance_0.2' instead of creating a new one.
    [CPU] Loading amazoncom...
    DEBUG 3.1: Dataset init start
    DEBUG 3.2: prepare_data start amazoncom
    ----Data statistics------'
    Name: amazoncom
    #Nodes 13752
    #Edges 245861
    #Classes 10
    #Ave_degree 35.76
    ----Split statistics------'
    #Train samples 200 (20 nodes per class)
    #Val samples 500 (specified)
    #Test samples 1000 (specified)
    ----label noise information:------
    Instance dependent noise
    #Actual noise rate 0.20
    [cuda:0] LNPCC waiting for GPU slot...
    [cuda:0] Slot acquired (waited 121.0s). Starting GCN...
    FINAL_RESULT: {'acc': {'train': 0.7424242424242424, 'valid': 0.662, 'test': 0.818}, 'wall_s': 51.42, 'cpu_s': 42.09, 'gpu_s': 9.2, 'wait_s': 121.04}
    [Time] wall=51.4s | cpu=42.1s | gpu=9.2s
    C:\Users\fbrev\Documents\Acadêmico\Simulações\Python\NoisyGL\predictor\Base_Predictor.py:144: UserWarning: Sparse CSR tensor support is in beta state. If you miss a functionality in the sparse tensor support, please submit a feature request to https://github.com/pytorch/pytorch/issues. (Triggered internally at ..\aten\src\ATen\SparseCsrTensorImpl.cpp:55.)
    self.adj_csr = self.adj.to_sparse_csr().to(self.device)
[I 2026-04-30 23:21:07,055] Trial 43 finished with value: 0.818 and parameters: {'lr': 0.005, 'weight_decay': 0.01, 'n_hidden': 256, 'n_layer': 2, 'dropout': 0.634182212216343, 'knn_mode': 's', 'k': 34, 'dexp': 7.891926061528785, 'p_grd': 0.8513257879396015, 'unc_rem': 0.9608099786038816, 'unc_rel': 0.5130234100392814}. Best is trial 32 with value: 0.829.
    [CPU] Loading amazoncom...
    DEBUG 3.1: Dataset init start
    DEBUG 3.2: prepare_data start amazoncom
    ----Data statistics------'
    Name: amazoncom
    #Nodes 13752
    #Edges 245861
    #Classes 10
    #Ave_degree 35.76
    ----Split statistics------'
    #Train samples 200 (20 nodes per class)
    #Val samples 500 (specified)
    #Test samples 1000 (specified)
    ----label noise information:------
    Instance dependent noise
    #Actual noise rate 0.20
    [cuda:0] LNPCC waiting for GPU slot...
    [cuda:0] Slot acquired (waited 90.5s). Starting GCN...
    FINAL_RESULT: {'acc': {'train': 0.7258883248730964, 'valid': 0.656, 'test': 0.82}, 'wall_s': 56.87, 'cpu_s': 48.37, 'gpu_s': 8.43, 'wait_s': 90.54}
    [Time] wall=56.9s | cpu=48.4s | gpu=8.4s
    C:\Users\fbrev\Documents\Acadêmico\Simulações\Python\NoisyGL\predictor\Base_Predictor.py:144: UserWarning: Sparse CSR tensor support is in beta state. If you miss a functionality in the sparse tensor support, please submit a feature request to https://github.com/pytorch/pytorch/issues. (Triggered internally at ..\aten\src\ATen\SparseCsrTensorImpl.cpp:55.)
    self.adj_csr = self.adj.to_sparse_csr().to(self.device)
[I 2026-04-30 23:23:40,040] Trial 44 finished with value: 0.82 and parameters: {'lr': 0.005, 'weight_decay': 0.01, 'n_hidden': 256, 'n_layer': 2, 'dropout': 0.6891535860029826, 'knn_mode': 's', 'k': 25, 'dexp': 9.289366365141822, 'p_grd': 0.9191005887973988, 'unc_rem': 0.8946217966812046, 'unc_rel': 0.411596342560675}. Best is trial 32 with value: 0.829.
    [CPU] Loading amazoncom...
    DEBUG 3.1: Dataset init start
    DEBUG 3.2: prepare_data start amazoncom
    ----Data statistics------'
    Name: amazoncom
    #Nodes 13752
    #Edges 245861
    #Classes 10
    #Ave_degree 35.76
    ----Split statistics------'
    #Train samples 200 (20 nodes per class)
    #Val samples 500 (specified)
    #Test samples 1000 (specified)
    ----label noise information:------
    Instance dependent noise
    #Actual noise rate 0.20
    [cuda:0] LNPCC waiting for GPU slot...
    [cuda:0] Slot acquired (waited 111.6s). Starting GCN...
    FINAL_RESULT: {'acc': {'train': 0.7164948453608248, 'valid': 0.646, 'test': 0.822}, 'wall_s': 45.57, 'cpu_s': 36.79, 'gpu_s': 8.71, 'wait_s': 111.64}
    [Time] wall=45.6s | cpu=36.8s | gpu=8.7s
    C:\Users\fbrev\Documents\Acadêmico\Simulações\Python\NoisyGL\predictor\Base_Predictor.py:144: UserWarning: Sparse CSR tensor support is in beta state. If you miss a functionality in the sparse tensor support, please submit a feature request to https://github.com/pytorch/pytorch/issues. (Triggered internally at ..\aten\src\ATen\SparseCsrTensorImpl.cpp:55.)
    self.adj_csr = self.adj.to_sparse_csr().to(self.device)
[I 2026-04-30 23:26:23,398] Trial 45 finished with value: 0.822 and parameters: {'lr': 0.005, 'weight_decay': 0.01, 'n_hidden': 256, 'n_layer': 2, 'dropout': 0.4565425249504682, 'knn_mode': 's', 'k': 18, 'dexp': 8.448945838839778, 'p_grd': 0.991833077014167, 'unc_rem': 0.8640146820378518, 'unc_rel': 0.6375146613552207}. Best is trial 32 with value: 0.829.
    [CPU] Loading amazoncom...
    DEBUG 3.1: Dataset init start
    DEBUG 3.2: prepare_data start amazoncom
    ----Data statistics------'
    Name: amazoncom
    #Nodes 13752
    #Edges 245861
    #Classes 10
    #Ave_degree 35.76
    ----Split statistics------'
    #Train samples 200 (20 nodes per class)
    #Val samples 500 (specified)
    #Test samples 1000 (specified)
    ----label noise information:------
    Instance dependent noise
    #Actual noise rate 0.20
    [cuda:0] LNPCC waiting for GPU slot...
    [cuda:0] Slot acquired (waited 94.2s). Starting GCN...
    FINAL_RESULT: {'acc': {'train': 0.49489795918367346, 'valid': 0.548, 'test': 0.703}, 'wall_s': 62.84, 'cpu_s': 60.49, 'gpu_s': 2.27, 'wait_s': 94.23}
    [Time] wall=62.8s | cpu=60.5s | gpu=2.3s
    C:\Users\fbrev\Documents\Acadêmico\Simulações\Python\NoisyGL\predictor\Base_Predictor.py:144: UserWarning: Sparse CSR tensor support is in beta state. If you miss a functionality in the sparse tensor support, please submit a feature request to https://github.com/pytorch/pytorch/issues. (Triggered internally at ..\aten\src\ATen\SparseCsrTensorImpl.cpp:55.)
    self.adj_csr = self.adj.to_sparse_csr().to(self.device)
[I 2026-04-30 23:29:06,668] Trial 46 finished with value: 0.703 and parameters: {'lr': 0.05, 'weight_decay': 0.01, 'n_hidden': 32, 'n_layer': 2, 'dropout': 0.6190056329415422, 'knn_mode': 's', 'k': 32, 'dexp': 0.6445987811294929, 'p_grd': 0.9017530663754426, 'unc_rem': 0.7879854485957078, 'unc_rel': 0.4968611969479251}. Best is trial 32 with value: 0.829.
    [CPU] Loading amazoncom...
    DEBUG 3.1: Dataset init start
    DEBUG 3.2: prepare_data start amazoncom
    ----Data statistics------'
    Name: amazoncom
    #Nodes 13752
    #Edges 245861
    #Classes 10
    #Ave_degree 35.76
    ----Split statistics------'
    #Train samples 200 (20 nodes per class)
    #Val samples 500 (specified)
    #Test samples 1000 (specified)
    ----label noise information:------
    Instance dependent noise
    #Actual noise rate 0.20
    [cuda:0] LNPCC waiting for GPU slot...
    [cuda:0] Slot acquired (waited 86.4s). Starting GCN...
    FINAL_RESULT: {'acc': {'train': 0.6954314720812182, 'valid': 0.622, 'test': 0.782}, 'wall_s': 46.94, 'cpu_s': 38.91, 'gpu_s': 7.98, 'wait_s': 86.38}
    [Time] wall=46.9s | cpu=38.9s | gpu=8.0s
    C:\Users\fbrev\Documents\Acadêmico\Simulações\Python\NoisyGL\predictor\Base_Predictor.py:144: UserWarning: Sparse CSR tensor support is in beta state. If you miss a functionality in the sparse tensor support, please submit a feature request to https://github.com/pytorch/pytorch/issues. (Triggered internally at ..\aten\src\ATen\SparseCsrTensorImpl.cpp:55.)
    self.adj_csr = self.adj.to_sparse_csr().to(self.device)
[I 2026-04-30 23:31:25,269] Trial 47 finished with value: 0.782 and parameters: {'lr': 0.01, 'weight_decay': 0.05, 'n_hidden': 256, 'n_layer': 2, 'dropout': 0.5356897545390953, 'knn_mode': 's', 'k': 28, 'dexp': 7.788050805061207, 'p_grd': 0.8373212731321646, 'unc_rem': 0.9934706053352074, 'unc_rel': 0.7251605576361816}. Best is trial 32 with value: 0.829.
    [CPU] Loading amazoncom...
    DEBUG 3.1: Dataset init start
    DEBUG 3.2: prepare_data start amazoncom
    ----Data statistics------'
    Name: amazoncom
    #Nodes 13752
    #Edges 245861
    #Classes 10
    #Ave_degree 35.76
    ----Split statistics------'
    #Train samples 200 (20 nodes per class)
    #Val samples 500 (specified)
    #Test samples 1000 (specified)
    ----label noise information:------
    Instance dependent noise
    #Actual noise rate 0.20
    [cuda:0] LNPCC waiting for GPU slot...
    [cuda:0] Slot acquired (waited 93.3s). Starting GCN...
    FINAL_RESULT: {'acc': {'train': 0.702020202020202, 'valid': 0.656, 'test': 0.818}, 'wall_s': 43.29, 'cpu_s': 35.17, 'gpu_s': 8.05, 'wait_s': 93.33}
    [Time] wall=43.3s | cpu=35.2s | gpu=8.0s
    C:\Users\fbrev\Documents\Acadêmico\Simulações\Python\NoisyGL\predictor\Base_Predictor.py:144: UserWarning: Sparse CSR tensor support is in beta state. If you miss a functionality in the sparse tensor support, please submit a feature request to https://github.com/pytorch/pytorch/issues. (Triggered internally at ..\aten\src\ATen\SparseCsrTensorImpl.cpp:55.)
    self.adj_csr = self.adj.to_sparse_csr().to(self.device)
[I 2026-04-30 23:33:47,807] Trial 48 finished with value: 0.818 and parameters: {'lr': 0.005, 'weight_decay': 0.01, 'n_hidden': 256, 'n_layer': 2, 'dropout': 0.38348352350492215, 'knn_mode': 's', 'k': 37, 'dexp': 8.938853756032833, 'p_grd': 0.7819001974797903, 'unc_rem': 0.9436389143436588, 'unc_rel': 0.5652832870358279}. Best is trial 32 with value: 0.829.
    [CPU] Loading amazoncom...
    DEBUG 3.1: Dataset init start
    DEBUG 3.2: prepare_data start amazoncom
    ----Data statistics------'
    Name: amazoncom
    #Nodes 13752
    #Edges 245861
    #Classes 10
    #Ave_degree 35.76
    ----Split statistics------'
    #Train samples 200 (20 nodes per class)
    #Val samples 500 (specified)
    #Test samples 1000 (specified)
    ----label noise information:------
    Instance dependent noise
    #Actual noise rate 0.20
    [cuda:0] LNPCC waiting for GPU slot...
    [cuda:0] Slot acquired (waited 78.3s). Starting GCN...
    FINAL_RESULT: {'acc': {'train': 0.12690355329949238, 'valid': 0.344, 'test': 0.39}, 'wall_s': 45.91, 'cpu_s': 40.49, 'gpu_s': 5.36, 'wait_s': 78.31}
    [Time] wall=45.9s | cpu=40.5s | gpu=5.4s
    C:\Users\fbrev\Documents\Acadêmico\Simulações\Python\NoisyGL\predictor\Base_Predictor.py:144: UserWarning: Sparse CSR tensor support is in beta state. If you miss a functionality in the sparse tensor support, please submit a feature request to https://github.com/pytorch/pytorch/issues. (Triggered internally at ..\aten\src\ATen\SparseCsrTensorImpl.cpp:55.)
    self.adj_csr = self.adj.to_sparse_csr().to(self.device)
[I 2026-04-30 23:35:58,330] Trial 49 finished with value: 0.39 and parameters: {'lr': 0.1, 'weight_decay': 0.01, 'n_hidden': 128, 'n_layer': 2, 'dropout': 0.675452296996588, 'knn_mode': 's', 'k': 24, 'dexp': 9.466197367549345, 'p_grd': 0.9539266949806214, 'unc_rem': 0.8426592114183513, 'unc_rel': 0.38595283706039724}. Best is trial 32 with value: 0.829.
    [CPU] Loading amazoncom...
    DEBUG 3.1: Dataset init start
    DEBUG 3.2: prepare_data start amazoncom
    ----Data statistics------'
    Name: amazoncom
    #Nodes 13752
    #Edges 245861
    #Classes 10
    #Ave_degree 35.76
    ----Split statistics------'
    #Train samples 200 (20 nodes per class)
    #Val samples 500 (specified)
    #Test samples 1000 (specified)
    ----label noise information:------
    Instance dependent noise
    #Actual noise rate 0.20
    [cuda:0] LNPCC waiting for GPU slot...
    [cuda:0] Slot acquired (waited 85.1s). Starting GCN...
    FINAL_RESULT: {'acc': {'train': 0.7817258883248731, 'valid': 0.658, 'test': 0.82}, 'wall_s': 49.67, 'cpu_s': 41.78, 'gpu_s': 7.8, 'wait_s': 85.09}
    [Time] wall=49.7s | cpu=41.8s | gpu=7.8s
    C:\Users\fbrev\Documents\Acadêmico\Simulações\Python\NoisyGL\predictor\Base_Predictor.py:144: UserWarning: Sparse CSR tensor support is in beta state. If you miss a functionality in the sparse tensor support, please submit a feature request to https://github.com/pytorch/pytorch/issues. (Triggered internally at ..\aten\src\ATen\SparseCsrTensorImpl.cpp:55.)
    self.adj_csr = self.adj.to_sparse_csr().to(self.device)
[I 2026-04-30 23:38:19,273] Trial 50 finished with value: 0.82 and parameters: {'lr': 0.005, 'weight_decay': 0.01, 'n_hidden': 256, 'n_layer': 2, 'dropout': 0.5665379605556273, 'knn_mode': 's', 'k': 20, 'dexp': 8.54225104503049, 'p_grd': 0.8624464838650634, 'unc_rem': 0.7702810598209862, 'unc_rel': 0.6201873326214623}. Best is trial 32 with value: 0.829.
    [CPU] Loading amazoncom...
    DEBUG 3.1: Dataset init start
    DEBUG 3.2: prepare_data start amazoncom
    ----Data statistics------'
    Name: amazoncom
    #Nodes 13752
    #Edges 245861
    #Classes 10
    #Ave_degree 35.76
    ----Split statistics------'
    #Train samples 200 (20 nodes per class)
    #Val samples 500 (specified)
    #Test samples 1000 (specified)
    ----label noise information:------
    Instance dependent noise
    #Actual noise rate 0.20
    [cuda:0] LNPCC waiting for GPU slot...
    [cuda:0] Slot acquired (waited 77.1s). Starting GCN...
    FINAL_RESULT: {'acc': {'train': 0.7411167512690355, 'valid': 0.646, 'test': 0.808}, 'wall_s': 40.55, 'cpu_s': 37.21, 'gpu_s': 3.28, 'wait_s': 77.06}
    [Time] wall=40.5s | cpu=37.2s | gpu=3.3s
    C:\Users\fbrev\Documents\Acadêmico\Simulações\Python\NoisyGL\predictor\Base_Predictor.py:144: UserWarning: Sparse CSR tensor support is in beta state. If you miss a functionality in the sparse tensor support, please submit a feature request to https://github.com/pytorch/pytorch/issues. (Triggered internally at ..\aten\src\ATen\SparseCsrTensorImpl.cpp:55.)
    self.adj_csr = self.adj.to_sparse_csr().to(self.device)
[I 2026-04-30 23:40:22,401] Trial 51 finished with value: 0.808 and parameters: {'lr': 0.01, 'weight_decay': 0.0001, 'n_hidden': 32, 'n_layer': 3, 'dropout': 0.5183841205698347, 'knn_mode': 's', 'k': 26, 'dexp': 9.397314368121977, 'p_grd': 0.7616036458703119, 'unc_rem': 0.9021615659811354, 'unc_rel': 0.33765290283175975}. Best is trial 32 with value: 0.829.
    [CPU] Loading amazoncom...
    DEBUG 3.1: Dataset init start
    DEBUG 3.2: prepare_data start amazoncom
    ----Data statistics------'
    Name: amazoncom
    #Nodes 13752
    #Edges 245861
    #Classes 10
    #Ave_degree 35.76
    ----Split statistics------'
    #Train samples 200 (20 nodes per class)
    #Val samples 500 (specified)
    #Test samples 1000 (specified)
    ----label noise information:------
    Instance dependent noise
    #Actual noise rate 0.20
    [cuda:0] LNPCC waiting for GPU slot...
    [cuda:0] Slot acquired (waited 82.4s). Starting GCN...
    FINAL_RESULT: {'acc': {'train': 0.7626262626262627, 'valid': 0.66, 'test': 0.812}, 'wall_s': 33.42, 'cpu_s': 25.73, 'gpu_s': 7.63, 'wait_s': 82.43}
    [Time] wall=33.4s | cpu=25.7s | gpu=7.6s
    C:\Users\fbrev\Documents\Acadêmico\Simulações\Python\NoisyGL\predictor\Base_Predictor.py:144: UserWarning: Sparse CSR tensor support is in beta state. If you miss a functionality in the sparse tensor support, please submit a feature request to https://github.com/pytorch/pytorch/issues. (Triggered internally at ..\aten\src\ATen\SparseCsrTensorImpl.cpp:55.)
    self.adj_csr = self.adj.to_sparse_csr().to(self.device)
[I 2026-04-30 23:42:23,442] Trial 52 finished with value: 0.812 and parameters: {'lr': 0.005, 'weight_decay': 0.01, 'n_hidden': 256, 'n_layer': 2, 'dropout': 0.4242227463118403, 'knn_mode': 's', 'k': 37, 'dexp': 9.98698166121842, 'p_grd': 0.9391422428232885, 'unc_rem': 0.9211187794428998, 'unc_rel': 0.49393589311167746}. Best is trial 32 with value: 0.829.
    [CPU] Loading amazoncom...
    DEBUG 3.1: Dataset init start
    DEBUG 3.2: prepare_data start amazoncom
    ----Data statistics------'
    Name: amazoncom
    #Nodes 13752
    #Edges 245861
    #Classes 10
    #Ave_degree 35.76
    ----Split statistics------'
    #Train samples 200 (20 nodes per class)
    #Val samples 500 (specified)
    #Test samples 1000 (specified)
    ----label noise information:------
    Instance dependent noise
    #Actual noise rate 0.20
    [cuda:0] LNPCC waiting for GPU slot...
    [cuda:0] Slot acquired (waited 84.8s). Starting GCN...
    FINAL_RESULT: {'acc': {'train': 0.7868020304568528, 'valid': 0.66, 'test': 0.816}, 'wall_s': 37.09, 'cpu_s': 29.28, 'gpu_s': 7.75, 'wait_s': 84.81}
    [Time] wall=37.1s | cpu=29.3s | gpu=7.7s
    C:\Users\fbrev\Documents\Acadêmico\Simulações\Python\NoisyGL\predictor\Base_Predictor.py:144: UserWarning: Sparse CSR tensor support is in beta state. If you miss a functionality in the sparse tensor support, please submit a feature request to https://github.com/pytorch/pytorch/issues. (Triggered internally at ..\aten\src\ATen\SparseCsrTensorImpl.cpp:55.)
    self.adj_csr = self.adj.to_sparse_csr().to(self.device)
[I 2026-04-30 23:44:30,646] Trial 53 finished with value: 0.816 and parameters: {'lr': 0.005, 'weight_decay': 0.01, 'n_hidden': 256, 'n_layer': 2, 'dropout': 0.4808968587206793, 'knn_mode': 's', 'k': 29, 'dexp': 9.03928065025091, 'p_grd': 0.8899176641615152, 'unc_rem': 0.9978024812512184, 'unc_rel': 0.5204188764819524}. Best is trial 32 with value: 0.829.
    [CPU] Loading amazoncom...
    DEBUG 3.1: Dataset init start
    DEBUG 3.2: prepare_data start amazoncom
    ----Data statistics------'
    Name: amazoncom
    #Nodes 13752
    #Edges 245861
    #Classes 10
    #Ave_degree 35.76
    ----Split statistics------'
    #Train samples 200 (20 nodes per class)
    #Val samples 500 (specified)
    #Test samples 1000 (specified)
    ----label noise information:------
    Instance dependent noise
    #Actual noise rate 0.20
    [cuda:0] LNPCC waiting for GPU slot...
    [cuda:0] Slot acquired (waited 237.6s). Starting GCN...
    FINAL_RESULT: {'acc': {'train': 0.8058823529411765, 'valid': 0.648, 'test': 0.784}, 'wall_s': 34.37, 'cpu_s': 26.03, 'gpu_s': 8.28, 'wait_s': 237.57}
    [Time] wall=34.4s | cpu=26.0s | gpu=8.3s
    C:\Users\fbrev\Documents\Acadêmico\Simulações\Python\NoisyGL\predictor\Base_Predictor.py:144: UserWarning: Sparse CSR tensor support is in beta state. If you miss a functionality in the sparse tensor support, please submit a feature request to https://github.com/pytorch/pytorch/issues. (Triggered internally at ..\aten\src\ATen\SparseCsrTensorImpl.cpp:55.)
    self.adj_csr = self.adj.to_sparse_csr().to(self.device)
[I 2026-04-30 23:49:07,896] Trial 54 finished with value: 0.784 and parameters: {'lr': 0.005, 'weight_decay': 0.01, 'n_hidden': 256, 'n_layer': 2, 'dropout': 0.43301277978662567, 'knn_mode': 's', 'k': 36, 'dexp': 9.701655169525916, 'p_grd': 0.9976379794161425, 'unc_rem': 0.8817612360767632, 'unc_rel': 0.46950861138347666}. Best is trial 32 with value: 0.829.
    [CPU] Loading amazoncom...
    DEBUG 3.1: Dataset init start
    DEBUG 3.2: prepare_data start amazoncom
    ----Data statistics------'
    Name: amazoncom
    #Nodes 13752
    #Edges 245861
    #Classes 10
    #Ave_degree 35.76
    ----Split statistics------'
    #Train samples 200 (20 nodes per class)
    #Val samples 500 (specified)
    #Test samples 1000 (specified)
    ----label noise information:------
    Instance dependent noise
    #Actual noise rate 0.20
    [cuda:0] LNPCC waiting for GPU slot...
    [cuda:0] Slot acquired (waited 87.2s). Starting GCN...
    FINAL_RESULT: {'acc': {'train': 0.7055837563451777, 'valid': 0.624, 'test': 0.788}, 'wall_s': 51.44, 'cpu_s': 43.14, 'gpu_s': 8.22, 'wait_s': 87.15}
    [Time] wall=51.4s | cpu=43.1s | gpu=8.2s
    C:\Users\fbrev\Documents\Acadêmico\Simulações\Python\NoisyGL\predictor\Base_Predictor.py:144: UserWarning: Sparse CSR tensor support is in beta state. If you miss a functionality in the sparse tensor support, please submit a feature request to https://github.com/pytorch/pytorch/issues. (Triggered internally at ..\aten\src\ATen\SparseCsrTensorImpl.cpp:55.)
    self.adj_csr = self.adj.to_sparse_csr().to(self.device)
[I 2026-04-30 23:51:32,443] Trial 55 finished with value: 0.788 and parameters: {'lr': 0.005, 'weight_decay': 0.05, 'n_hidden': 256, 'n_layer': 2, 'dropout': 0.3494429340121136, 'knn_mode': 's', 'k': 23, 'dexp': 8.22273748384128, 'p_grd': 0.9474833713868647, 'unc_rem': 0.9404513730820582, 'unc_rel': 0.6590108895975703}. Best is trial 32 with value: 0.829.
    [CPU] Loading amazoncom...
    DEBUG 3.1: Dataset init start
    DEBUG 3.2: prepare_data start amazoncom
    ----Data statistics------'
    Name: amazoncom
    #Nodes 13752
    #Edges 245861
    #Classes 10
    #Ave_degree 35.76
    ----Split statistics------'
    #Train samples 200 (20 nodes per class)
    #Val samples 500 (specified)
    #Test samples 1000 (specified)
    ----label noise information:------
    Instance dependent noise
    #Actual noise rate 0.20
    [cuda:0] LNPCC waiting for GPU slot...
    [cuda:0] Slot acquired (waited 101.4s). Starting GCN...
    FINAL_RESULT: {'acc': {'train': 0.5353535353535354, 'valid': 0.568, 'test': 0.714}, 'wall_s': 47.81, 'cpu_s': 42.45, 'gpu_s': 5.28, 'wait_s': 101.4}
    [Time] wall=47.8s | cpu=42.4s | gpu=5.3s
    C:\Users\fbrev\Documents\Acadêmico\Simulações\Python\NoisyGL\predictor\Base_Predictor.py:144: UserWarning: Sparse CSR tensor support is in beta state. If you miss a functionality in the sparse tensor support, please submit a feature request to https://github.com/pytorch/pytorch/issues. (Triggered internally at ..\aten\src\ATen\SparseCsrTensorImpl.cpp:55.)
    self.adj_csr = self.adj.to_sparse_csr().to(self.device)
