[I 2026-05-03 02:07:22,298] Trial 21 finished with value: 0.42847714898531597 and parameters: {'lr': 0.005, 'weight_decay': 0.0, 'n_hidden': 64, 'n_layer': 2, 'dropout': 0.49781037370110626, 'knn_mode': 'd', 'k': 31, 'dexp': 6.8511141621524265, 'p_grd': 0.5335361979150074, 'unc_rem': 0.13132189509028402, 'unc_rel': 0.184740048555529}. Best is trial 12 with value: 0.45421547599406037.
    [CPU] Loading flickr...
    DEBUG 3.1: Dataset init start
    DEBUG 3.2: prepare_data start flickr
    ----Data statistics------'
    Name: flickr
    #Nodes 7575
    #Edges 239738
    #Classes 9
    #Ave_degree 63.30
    ----Split statistics------'
    #Train samples 378 (5.0 % of nodes)
    #Val samples 1136 (15.0 % of nodes)
    #Test samples 6061 (remaining)
    ----label noise information:------
    Instance dependent noise
    #Actual noise rate 0.40
    [cuda:0] LNPCC waiting for GPU slot...
    [cuda:0] Slot acquired (waited 54.0s). Starting GCN...
    FINAL_RESULT: {'acc': {'train': 1.0, 'valid': 0.176056338028169, 'test': 0.2514436561623494}, 'wall_s': 172.19, 'cpu_s': 168.16, 'gpu_s': 3.76, 'wait_s': 54.0}
    [Time] wall=172.2s | cpu=168.2s | gpu=3.8s
    C:\Users\fbrev\anaconda3\envs\noisygl\Lib\site-packages\torch\_utils.py:315: UserWarning: Sparse CSR tensor support is in beta state. If you miss a functionality in the sparse tensor support, please submit a feature request to https://github.com/pytorch/pytorch/issues. (Triggered internally at ..\aten\src\ATen\SparseCsrTensorImpl.cpp:55.)
    result = torch.sparse_compressed_tensor(
    C:\Users\fbrev\Documents\Acadêmico\Simulações\Python\NoisyGL\predictor\Base_Predictor.py:114: UserWarning: expandable_segments not supported on this platform (Triggered internally at ..\c10/cuda/CUDAAllocatorConfig.h:28.)
    self.edge_index = self._cpu_edge_index.to(self.device)
[I 2026-05-03 02:11:13,881] Trial 22 finished with value: 0.2514436561623494 and parameters: {'lr': 0.01, 'weight_decay': 0.0, 'n_hidden': 64, 'n_layer': 2, 'dropout': 0.5820403425592777, 'knn_mode': 'd', 'k': 40, 'dexp': 5.680307349837693, 'p_grd': 0.7668490520533604, 'unc_rem': 0.0024400565632121674, 'unc_rel': 0.18624130961068527}. Best is trial 12 with value: 0.45421547599406037.
    [CPU] Loading flickr...
    DEBUG 3.1: Dataset init start
    DEBUG 3.2: prepare_data start flickr
    ----Data statistics------'
    Name: flickr
    #Nodes 7575
    #Edges 239738
    #Classes 9
    #Ave_degree 63.30
    ----Split statistics------'
    #Train samples 378 (5.0 % of nodes)
    #Val samples 1136 (15.0 % of nodes)
    #Test samples 6061 (remaining)
    ----label noise information:------
    Instance dependent noise
    #Actual noise rate 0.40
    [cuda:0] LNPCC waiting for GPU slot...
    [cuda:0] Slot acquired (waited 1.6s). Starting GCN...
    FINAL_RESULT: {'acc': {'train': 0.7161803713527851, 'valid': 0.2975352112676056, 'test': 0.43243689160204585}, 'wall_s': 75.36, 'cpu_s': 71.13, 'gpu_s': 3.97, 'wait_s': 1.63}
    [Time] wall=75.4s | cpu=71.1s | gpu=4.0s
    C:\Users\fbrev\anaconda3\envs\noisygl\Lib\site-packages\torch\_utils.py:315: UserWarning: Sparse CSR tensor support is in beta state. If you miss a functionality in the sparse tensor support, please submit a feature request to https://github.com/pytorch/pytorch/issues. (Triggered internally at ..\aten\src\ATen\SparseCsrTensorImpl.cpp:55.)
    result = torch.sparse_compressed_tensor(
    C:\Users\fbrev\Documents\Acadêmico\Simulações\Python\NoisyGL\predictor\Base_Predictor.py:114: UserWarning: expandable_segments not supported on this platform (Triggered internally at ..\c10/cuda/CUDAAllocatorConfig.h:28.)
    self.edge_index = self._cpu_edge_index.to(self.device)
[I 2026-05-03 02:12:36,282] Trial 23 finished with value: 0.43243689160204585 and parameters: {'lr': 0.001, 'weight_decay': 0.0001, 'n_hidden': 64, 'n_layer': 2, 'dropout': 0.43457828178147995, 'knn_mode': 'd', 'k': 13, 'dexp': 7.133796168815216, 'p_grd': 0.6032503351273073, 'unc_rem': 0.42900425147138077, 'unc_rel': 0.004373226623293314}. Best is trial 12 with value: 0.45421547599406037.
    [CPU] Loading flickr...
    DEBUG 3.1: Dataset init start
    DEBUG 3.2: prepare_data start flickr
    ----Data statistics------'
    Name: flickr
    #Nodes 7575
    #Edges 239738
    #Classes 9
    #Ave_degree 63.30
    ----Split statistics------'
    #Train samples 378 (5.0 % of nodes)
    #Val samples 1136 (15.0 % of nodes)
    #Test samples 6061 (remaining)
    ----label noise information:------
    Instance dependent noise
    #Actual noise rate 0.40
    [cuda:0] LNPCC waiting for GPU slot...
    [cuda:0] Slot acquired (waited 18.0s). Starting GCN...
    FINAL_RESULT: {'acc': {'train': 0.48501362397820164, 'valid': 0.2605633802816901, 'test': 0.3898696584721993}, 'wall_s': 57.38, 'cpu_s': 53.28, 'gpu_s': 3.86, 'wait_s': 18.04}
    [Time] wall=57.4s | cpu=53.3s | gpu=3.9s
    C:\Users\fbrev\anaconda3\envs\noisygl\Lib\site-packages\torch\_utils.py:315: UserWarning: Sparse CSR tensor support is in beta state. If you miss a functionality in the sparse tensor support, please submit a feature request to https://github.com/pytorch/pytorch/issues. (Triggered internally at ..\aten\src\ATen\SparseCsrTensorImpl.cpp:55.)
    result = torch.sparse_compressed_tensor(
    C:\Users\fbrev\Documents\Acadêmico\Simulações\Python\NoisyGL\predictor\Base_Predictor.py:114: UserWarning: expandable_segments not supported on this platform (Triggered internally at ..\c10/cuda/CUDAAllocatorConfig.h:28.)
    self.edge_index = self._cpu_edge_index.to(self.device)
[I 2026-05-03 02:13:57,063] Trial 24 finished with value: 0.3898696584721993 and parameters: {'lr': 0.1, 'weight_decay': 0.0001, 'n_hidden': 64, 'n_layer': 2, 'dropout': 0.27005716303360905, 'knn_mode': 's', 'k': 13, 'dexp': 1.826618461426387, 'p_grd': 0.5769025909539, 'unc_rem': 0.2318615050421815, 'unc_rel': 0.0033595180857873353}. Best is trial 12 with value: 0.45421547599406037.
    [CPU] Loading flickr...
    DEBUG 3.1: Dataset init start
    DEBUG 3.2: prepare_data start flickr
    ----Data statistics------'
    Name: flickr
    #Nodes 7575
    #Edges 239738
    #Classes 9
    #Ave_degree 63.30
    ----Split statistics------'
    #Train samples 378 (5.0 % of nodes)
    #Val samples 1136 (15.0 % of nodes)
    #Test samples 6061 (remaining)
    ----label noise information:------
    Instance dependent noise
    #Actual noise rate 0.40
    [cuda:0] LNPCC waiting for GPU slot...
    [cuda:0] Slot acquired (waited 20.7s). Starting GCN...
    FINAL_RESULT: {'acc': {'train': 0.6246648793565683, 'valid': 0.28257042253521125, 'test': 0.4142880712753671}, 'wall_s': 56.1, 'cpu_s': 52.4, 'gpu_s': 3.45, 'wait_s': 20.73}
    [Time] wall=56.1s | cpu=52.4s | gpu=3.5s
    C:\Users\fbrev\anaconda3\envs\noisygl\Lib\site-packages\torch\_utils.py:315: UserWarning: Sparse CSR tensor support is in beta state. If you miss a functionality in the sparse tensor support, please submit a feature request to https://github.com/pytorch/pytorch/issues. (Triggered internally at ..\aten\src\ATen\SparseCsrTensorImpl.cpp:55.)
    result = torch.sparse_compressed_tensor(
    C:\Users\fbrev\Documents\Acadêmico\Simulações\Python\NoisyGL\predictor\Base_Predictor.py:114: UserWarning: expandable_segments not supported on this platform (Triggered internally at ..\c10/cuda/CUDAAllocatorConfig.h:28.)
    self.edge_index = self._cpu_edge_index.to(self.device)
[I 2026-05-03 02:15:19,181] Trial 25 finished with value: 0.4142880712753671 and parameters: {'lr': 0.001, 'weight_decay': 0.0001, 'n_hidden': 32, 'n_layer': 2, 'dropout': 0.4394249335351779, 'knn_mode': 's', 'k': 16, 'dexp': 5.060170993491637, 'p_grd': 0.4284016798192861, 'unc_rem': 0.39127807970545075, 'unc_rel': 0.11556587063046692}. Best is trial 12 with value: 0.45421547599406037.
    [CPU] Loading flickr...
    DEBUG 3.1: Dataset init start
    DEBUG 3.2: prepare_data start flickr
    ----Data statistics------'
    Name: flickr
    #Nodes 7575
    #Edges 239738
    #Classes 9
    #Ave_degree 63.30
    ----Split statistics------'
    #Train samples 378 (5.0 % of nodes)
    #Val samples 1136 (15.0 % of nodes)
    #Test samples 6061 (remaining)
    ----label noise information:------
    Instance dependent noise
    #Actual noise rate 0.40
    [cuda:0] LNPCC waiting for GPU slot...
    [cuda:0] Slot acquired (waited 19.0s). Starting GCN...
    FINAL_RESULT: {'acc': {'train': 0.7623456790123457, 'valid': 0.3019366197183099, 'test': 0.43854149480283783}, 'wall_s': 54.62, 'cpu_s': 50.44, 'gpu_s': 3.93, 'wait_s': 19.04}
    [Time] wall=54.6s | cpu=50.4s | gpu=3.9s
    C:\Users\fbrev\anaconda3\envs\noisygl\Lib\site-packages\torch\_utils.py:315: UserWarning: Sparse CSR tensor support is in beta state. If you miss a functionality in the sparse tensor support, please submit a feature request to https://github.com/pytorch/pytorch/issues. (Triggered internally at ..\aten\src\ATen\SparseCsrTensorImpl.cpp:55.)
    result = torch.sparse_compressed_tensor(
    C:\Users\fbrev\Documents\Acadêmico\Simulações\Python\NoisyGL\predictor\Base_Predictor.py:114: UserWarning: expandable_segments not supported on this platform (Triggered internally at ..\c10/cuda/CUDAAllocatorConfig.h:28.)
    self.edge_index = self._cpu_edge_index.to(self.device)
[I 2026-05-03 02:16:38,258] Trial 26 finished with value: 0.43854149480283783 and parameters: {'lr': 0.005, 'weight_decay': 0.0001, 'n_hidden': 64, 'n_layer': 2, 'dropout': 0.6206913211518087, 'knn_mode': 'd', 'k': 11, 'dexp': 6.095011576036051, 'p_grd': 0.11006826508350429, 'unc_rem': 0.17844534748480406, 'unc_rel': 0.007247822506731872}. Best is trial 12 with value: 0.45421547599406037.
    [CPU] Loading flickr...
    DEBUG 3.1: Dataset init start
    DEBUG 3.2: prepare_data start flickr
    ----Data statistics------'
    Name: flickr
    #Nodes 7575
    #Edges 239738
    #Classes 9
    #Ave_degree 63.30
    ----Split statistics------'
    #Train samples 378 (5.0 % of nodes)
    #Val samples 1136 (15.0 % of nodes)
    #Test samples 6061 (remaining)
    ----label noise information:------
    Instance dependent noise
    #Actual noise rate 0.40
    [cuda:0] LNPCC waiting for GPU slot...
    [cuda:0] Slot acquired (waited 32.1s). Starting GCN...
    FINAL_RESULT: {'acc': {'train': 0.7768361581920904, 'valid': 0.2984154929577465, 'test': 0.4205576637518561}, 'wall_s': 43.44, 'cpu_s': 39.99, 'gpu_s': 3.18, 'wait_s': 32.08}
    [Time] wall=43.4s | cpu=40.0s | gpu=3.2s
    C:\Users\fbrev\anaconda3\envs\noisygl\Lib\site-packages\torch\_utils.py:315: UserWarning: Sparse CSR tensor support is in beta state. If you miss a functionality in the sparse tensor support, please submit a feature request to https://github.com/pytorch/pytorch/issues. (Triggered internally at ..\aten\src\ATen\SparseCsrTensorImpl.cpp:55.)
    result = torch.sparse_compressed_tensor(
    C:\Users\fbrev\Documents\Acadêmico\Simulações\Python\NoisyGL\predictor\Base_Predictor.py:114: UserWarning: expandable_segments not supported on this platform (Triggered internally at ..\c10/cuda/CUDAAllocatorConfig.h:28.)
    self.edge_index = self._cpu_edge_index.to(self.device)
[I 2026-05-03 02:17:59,068] Trial 27 finished with value: 0.4205576637518561 and parameters: {'lr': 0.005, 'weight_decay': 0.0001, 'n_hidden': 32, 'n_layer': 2, 'dropout': 0.6109357444773982, 'knn_mode': 's', 'k': 5, 'dexp': 5.89396017488532, 'p_grd': 0.12040349030645836, 'unc_rem': 0.18049136112648934, 'unc_rel': 0.4555536223478697}. Best is trial 12 with value: 0.45421547599406037.
    [CPU] Loading flickr...
    DEBUG 3.1: Dataset init start
    DEBUG 3.2: prepare_data start flickr
    ----Data statistics------'
    Name: flickr
    #Nodes 7575
    #Edges 239738
    #Classes 9
    #Ave_degree 63.30
    ----Split statistics------'
    #Train samples 378 (5.0 % of nodes)
    #Val samples 1136 (15.0 % of nodes)
    #Test samples 6061 (remaining)
    ----label noise information:------
    Instance dependent noise
    #Actual noise rate 0.40
    [cuda:0] LNPCC waiting for GPU slot...
    [cuda:0] Slot acquired (waited 3.2s). Starting GCN...
    FINAL_RESULT: {'acc': {'train': 0.6496815286624203, 'valid': 0.3089788732394366, 'test': 0.44992575482593633}, 'wall_s': 67.81, 'cpu_s': 63.75, 'gpu_s': 3.81, 'wait_s': 3.24}
    [Time] wall=67.8s | cpu=63.8s | gpu=3.8s
    C:\Users\fbrev\anaconda3\envs\noisygl\Lib\site-packages\torch\_utils.py:315: UserWarning: Sparse CSR tensor support is in beta state. If you miss a functionality in the sparse tensor support, please submit a feature request to https://github.com/pytorch/pytorch/issues. (Triggered internally at ..\aten\src\ATen\SparseCsrTensorImpl.cpp:55.)
    result = torch.sparse_compressed_tensor(
    C:\Users\fbrev\Documents\Acadêmico\Simulações\Python\NoisyGL\predictor\Base_Predictor.py:114: UserWarning: expandable_segments not supported on this platform (Triggered internally at ..\c10/cuda/CUDAAllocatorConfig.h:28.)
    self.edge_index = self._cpu_edge_index.to(self.device)
[I 2026-05-03 02:19:15,674] Trial 28 finished with value: 0.44992575482593633 and parameters: {'lr': 0.005, 'weight_decay': 0.001, 'n_hidden': 64, 'n_layer': 2, 'dropout': 0.5701398966510886, 'knn_mode': 'd', 'k': 10, 'dexp': 3.8702489956430113, 'p_grd': 0.14184937445988782, 'unc_rem': 0.07922190182295445, 'unc_rel': 0.14185572479122793}. Best is trial 12 with value: 0.45421547599406037.
    [CPU] Loading flickr...
    DEBUG 3.1: Dataset init start
    DEBUG 3.2: prepare_data start flickr
    ----Data statistics------'
    Name: flickr
    #Nodes 7575
    #Edges 239738
    #Classes 9
    #Ave_degree 63.30
    ----Split statistics------'
    #Train samples 378 (5.0 % of nodes)
    #Val samples 1136 (15.0 % of nodes)
    #Test samples 6061 (remaining)
    ----label noise information:------
    Instance dependent noise
    #Actual noise rate 0.40
    [cuda:0] LNPCC waiting for GPU slot...
    [cuda:0] Slot acquired (waited 17.6s). Starting GCN...
    FINAL_RESULT: {'acc': {'train': 0.9901960784313726, 'valid': 0.2764084507042254, 'test': 0.4132981356211846}, 'wall_s': 56.74, 'cpu_s': 52.6, 'gpu_s': 3.87, 'wait_s': 17.63}
    [Time] wall=56.7s | cpu=52.6s | gpu=3.9s
    C:\Users\fbrev\anaconda3\envs\noisygl\Lib\site-packages\torch\_utils.py:315: UserWarning: Sparse CSR tensor support is in beta state. If you miss a functionality in the sparse tensor support, please submit a feature request to https://github.com/pytorch/pytorch/issues. (Triggered internally at ..\aten\src\ATen\SparseCsrTensorImpl.cpp:55.)
    result = torch.sparse_compressed_tensor(
    C:\Users\fbrev\Documents\Acadêmico\Simulações\Python\NoisyGL\predictor\Base_Predictor.py:114: UserWarning: expandable_segments not supported on this platform (Triggered internally at ..\c10/cuda/CUDAAllocatorConfig.h:28.)
    self.edge_index = self._cpu_edge_index.to(self.device)
[I 2026-05-03 02:20:35,663] Trial 29 finished with value: 0.4132981356211846 and parameters: {'lr': 0.01, 'weight_decay': 0.0001, 'n_hidden': 64, 'n_layer': 2, 'dropout': 0.5660897128830046, 'knn_mode': 'd', 'k': 18, 'dexp': 3.3453944964753717, 'p_grd': 0.0869513688822724, 'unc_rem': 0.045373856395741485, 'unc_rel': 0.1250439798443184}. Best is trial 12 with value: 0.45421547599406037.
    [CPU] Loading flickr...
    DEBUG 3.1: Dataset init start
    DEBUG 3.2: prepare_data start flickr
    ----Data statistics------'
    Name: flickr
    #Nodes 7575
    #Edges 239738
    #Classes 9
    #Ave_degree 63.30
    ----Split statistics------'
    #Train samples 378 (5.0 % of nodes)
    #Val samples 1136 (15.0 % of nodes)
    #Test samples 6061 (remaining)
    ----label noise information:------
    Instance dependent noise
    #Actual noise rate 0.40
    [cuda:0] LNPCC waiting for GPU slot...
    [cuda:0] Slot acquired (waited 9.0s). Starting GCN...
    FINAL_RESULT: {'acc': {'train': 0.685131195335277, 'valid': 0.30545774647887325, 'test': 0.4563603365781224}, 'wall_s': 68.33, 'cpu_s': 64.71, 'gpu_s': 3.36, 'wait_s': 9.03}
    [Time] wall=68.3s | cpu=64.7s | gpu=3.4s
    C:\Users\fbrev\anaconda3\envs\noisygl\Lib\site-packages\torch\_utils.py:315: UserWarning: Sparse CSR tensor support is in beta state. If you miss a functionality in the sparse tensor support, please submit a feature request to https://github.com/pytorch/pytorch/issues. (Triggered internally at ..\aten\src\ATen\SparseCsrTensorImpl.cpp:55.)
    result = torch.sparse_compressed_tensor(
    C:\Users\fbrev\Documents\Acadêmico\Simulações\Python\NoisyGL\predictor\Base_Predictor.py:114: UserWarning: expandable_segments not supported on this platform (Triggered internally at ..\c10/cuda/CUDAAllocatorConfig.h:28.)
    self.edge_index = self._cpu_edge_index.to(self.device)
[I 2026-05-03 02:21:58,494] Trial 30 finished with value: 0.4563603365781224 and parameters: {'lr': 0.005, 'weight_decay': 0.0001, 'n_hidden': 32, 'n_layer': 2, 'dropout': 0.40230126998761295, 'knn_mode': 'd', 'k': 11, 'dexp': 4.60499066937364, 'p_grd': 0.16565192616210245, 'unc_rem': 0.06850229848859085, 'unc_rel': 0.0510203507007059}. Best is trial 30 with value: 0.4563603365781224.
    [CPU] Loading flickr...
    DEBUG 3.1: Dataset init start
    DEBUG 3.2: prepare_data start flickr
    ----Data statistics------'
    Name: flickr
    #Nodes 7575
    #Edges 239738
    #Classes 9
    #Ave_degree 63.30
    ----Split statistics------'
    #Train samples 378 (5.0 % of nodes)
    #Val samples 1136 (15.0 % of nodes)
    #Test samples 6061 (remaining)
    ----label noise information:------
    Instance dependent noise
    #Actual noise rate 0.40
    [cuda:0] LNPCC waiting for GPU slot...
    [cuda:0] Slot acquired (waited 8.0s). Starting GCN...
    FINAL_RESULT: {'acc': {'train': 0.7658959537572254, 'valid': 0.31778169014084506, 'test': 0.4769839960402574}, 'wall_s': 66.05, 'cpu_s': 62.45, 'gpu_s': 3.35, 'wait_s': 7.96}
    [Time] wall=66.1s | cpu=62.4s | gpu=3.3s
    C:\Users\fbrev\anaconda3\envs\noisygl\Lib\site-packages\torch\_utils.py:315: UserWarning: Sparse CSR tensor support is in beta state. If you miss a functionality in the sparse tensor support, please submit a feature request to https://github.com/pytorch/pytorch/issues. (Triggered internally at ..\aten\src\ATen\SparseCsrTensorImpl.cpp:55.)
    result = torch.sparse_compressed_tensor(
    C:\Users\fbrev\Documents\Acadêmico\Simulações\Python\NoisyGL\predictor\Base_Predictor.py:114: UserWarning: expandable_segments not supported on this platform (Triggered internally at ..\c10/cuda/CUDAAllocatorConfig.h:28.)
    self.edge_index = self._cpu_edge_index.to(self.device)
[I 2026-05-03 02:23:18,304] Trial 31 finished with value: 0.4769839960402574 and parameters: {'lr': 0.005, 'weight_decay': 0.0001, 'n_hidden': 32, 'n_layer': 2, 'dropout': 0.4063541281129821, 'knn_mode': 'd', 'k': 11, 'dexp': 4.5346596797776995, 'p_grd': 0.1499522744449256, 'unc_rem': 0.07989585829675569, 'unc_rel': 0.0645404676822633}. Best is trial 31 with value: 0.4769839960402574.
    [CPU] Loading flickr...
    DEBUG 3.1: Dataset init start
    DEBUG 3.2: prepare_data start flickr
    ----Data statistics------'
    Name: flickr
    #Nodes 7575
    #Edges 239738
    #Classes 9
    #Ave_degree 63.30
    ----Split statistics------'
    #Train samples 378 (5.0 % of nodes)
    #Val samples 1136 (15.0 % of nodes)
    #Test samples 6061 (remaining)
    ----label noise information:------
    Instance dependent noise
    #Actual noise rate 0.40
    [cuda:0] LNPCC waiting for GPU slot...
    [cuda:0] Slot acquired (waited 12.4s). Starting GCN...
    FINAL_RESULT: {'acc': {'train': 0.7067039106145251, 'valid': 0.3028169014084507, 'test': 0.45949513281636695}, 'wall_s': 60.5, 'cpu_s': 57.15, 'gpu_s': 3.12, 'wait_s': 12.37}
    [Time] wall=60.5s | cpu=57.2s | gpu=3.1s
    C:\Users\fbrev\anaconda3\envs\noisygl\Lib\site-packages\torch\_utils.py:315: UserWarning: Sparse CSR tensor support is in beta state. If you miss a functionality in the sparse tensor support, please submit a feature request to https://github.com/pytorch/pytorch/issues. (Triggered internally at ..\aten\src\ATen\SparseCsrTensorImpl.cpp:55.)
    result = torch.sparse_compressed_tensor(
    C:\Users\fbrev\Documents\Acadêmico\Simulações\Python\NoisyGL\predictor\Base_Predictor.py:114: UserWarning: expandable_segments not supported on this platform (Triggered internally at ..\c10/cuda/CUDAAllocatorConfig.h:28.)
    self.edge_index = self._cpu_edge_index.to(self.device)
