[I 2026-05-03 01:48:41,355] Trial 22 finished with value: 0.3190892591981521 and parameters: {'lr': 0.01, 'weight_decay': 0.0001, 'n_hidden': 32, 'n_layer': 2, 'dropout': 0.4425321800018268, 'knn_mode': 'd', 'k': 39, 'dexp': 5.765711081538674, 'p_grd': 0.7532830679934119, 'unc_rem': 0.0024400565632121674, 'unc_rel': 0.1441586152878901}. Best is trial 12 with value: 0.5520541164824286.
    [CPU] Loading flickr...
    DEBUG 3.1: Dataset init start
    DEBUG 3.2: prepare_data start flickr
    ----Data statistics------'
    Name: flickr
    #Nodes 7575
    #Edges 239738
    #Classes 9
    #Ave_degree 63.30
    ----Split statistics------'
    #Train samples 378 (5.0 % of nodes)
    #Val samples 1136 (15.0 % of nodes)
    #Test samples 6061 (remaining)
    ----label noise information:------
    Instance dependent noise
    #Actual noise rate 0.20
    [cuda:0] LNPCC waiting for GPU slot...
    [cuda:0] Slot acquired (waited 67.2s). Starting GCN...
    FINAL_RESULT: {'acc': {'train': 0.7165775401069518, 'valid': 0.44454225352112675, 'test': 0.5459495132816367}, 'wall_s': 94.92, 'cpu_s': 91.54, 'gpu_s': 3.13, 'wait_s': 67.16}
    [Time] wall=94.9s | cpu=91.5s | gpu=3.1s
    C:\Users\fbrev\anaconda3\envs\noisygl\Lib\site-packages\torch\_utils.py:315: UserWarning: Sparse CSR tensor support is in beta state. If you miss a functionality in the sparse tensor support, please submit a feature request to https://github.com/pytorch/pytorch/issues. (Triggered internally at ..\aten\src\ATen\SparseCsrTensorImpl.cpp:55.)
    result = torch.sparse_compressed_tensor(
    C:\Users\fbrev\Documents\Acadêmico\Simulações\Python\NoisyGL\predictor\Base_Predictor.py:114: UserWarning: expandable_segments not supported on this platform (Triggered internally at ..\c10/cuda/CUDAAllocatorConfig.h:28.)
    self.edge_index = self._cpu_edge_index.to(self.device)
[I 2026-05-03 01:51:28,389] Trial 23 finished with value: 0.5459495132816367 and parameters: {'lr': 0.01, 'weight_decay': 0.0, 'n_hidden': 32, 'n_layer': 2, 'dropout': 0.6020637909339958, 'knn_mode': 'd', 'k': 37, 'dexp': 6.987190313086991, 'p_grd': 0.8568239109442223, 'unc_rem': 0.2229565117029395, 'unc_rel': 0.0027640906626854866}. Best is trial 12 with value: 0.5520541164824286.
    [CPU] Loading flickr...
    DEBUG 3.1: Dataset init start
    DEBUG 3.2: prepare_data start flickr
    ----Data statistics------'
    Name: flickr
    #Nodes 7575
    #Edges 239738
    #Classes 9
    #Ave_degree 63.30
    ----Split statistics------'
    #Train samples 378 (5.0 % of nodes)
    #Val samples 1136 (15.0 % of nodes)
    #Test samples 6061 (remaining)
    ----label noise information:------
    Instance dependent noise
    #Actual noise rate 0.20
    [cuda:0] LNPCC waiting for GPU slot...
    [cuda:0] Slot acquired (waited 26.7s). Starting GCN...
    FINAL_RESULT: {'acc': {'train': 0.7553191489361702, 'valid': 0.44630281690140844, 'test': 0.5357201781884178}, 'wall_s': 425.73, 'cpu_s': 422.41, 'gpu_s': 3.05, 'wait_s': 26.66}
    [Time] wall=425.7s | cpu=422.4s | gpu=3.1s
    C:\Users\fbrev\anaconda3\envs\noisygl\Lib\site-packages\torch\_utils.py:315: UserWarning: Sparse CSR tensor support is in beta state. If you miss a functionality in the sparse tensor support, please submit a feature request to https://github.com/pytorch/pytorch/issues. (Triggered internally at ..\aten\src\ATen\SparseCsrTensorImpl.cpp:55.)
    result = torch.sparse_compressed_tensor(
    C:\Users\fbrev\Documents\Acadêmico\Simulações\Python\NoisyGL\predictor\Base_Predictor.py:114: UserWarning: expandable_segments not supported on this platform (Triggered internally at ..\c10/cuda/CUDAAllocatorConfig.h:28.)
    self.edge_index = self._cpu_edge_index.to(self.device)
[I 2026-05-03 01:59:06,325] Trial 24 finished with value: 0.5357201781884178 and parameters: {'lr': 0.01, 'weight_decay': 0.0001, 'n_hidden': 32, 'n_layer': 2, 'dropout': 0.5865012950876709, 'knn_mode': 'd', 'k': 32, 'dexp': 5.347855211108866, 'p_grd': 0.9774624915257564, 'unc_rem': 0.20968856817584935, 'unc_rel': 0.002978171795919922}. Best is trial 12 with value: 0.5520541164824286.
    [CPU] Loading flickr...
    DEBUG 3.1: Dataset init start
    DEBUG 3.2: prepare_data start flickr
    ----Data statistics------'
    Name: flickr
    #Nodes 7575
    #Edges 239738
    #Classes 9
    #Ave_degree 63.30
    ----Split statistics------'
    #Train samples 378 (5.0 % of nodes)
    #Val samples 1136 (15.0 % of nodes)
    #Test samples 6061 (remaining)
    ----label noise information:------
    Instance dependent noise
    #Actual noise rate 0.20
    [cuda:0] LNPCC waiting for GPU slot...
    [cuda:0] Slot acquired (waited 10.7s). Starting GCN...
    FINAL_RESULT: {'acc': {'train': 0.7973333333333333, 'valid': 0.4515845070422535, 'test': 0.5504042237254578}, 'wall_s': 145.93, 'cpu_s': 142.43, 'gpu_s': 3.21, 'wait_s': 10.69}
    [Time] wall=145.9s | cpu=142.4s | gpu=3.2s
    C:\Users\fbrev\anaconda3\envs\noisygl\Lib\site-packages\torch\_utils.py:315: UserWarning: Sparse CSR tensor support is in beta state. If you miss a functionality in the sparse tensor support, please submit a feature request to https://github.com/pytorch/pytorch/issues. (Triggered internally at ..\aten\src\ATen\SparseCsrTensorImpl.cpp:55.)
    result = torch.sparse_compressed_tensor(
    C:\Users\fbrev\Documents\Acadêmico\Simulações\Python\NoisyGL\predictor\Base_Predictor.py:114: UserWarning: expandable_segments not supported on this platform (Triggered internally at ..\c10/cuda/CUDAAllocatorConfig.h:28.)
    self.edge_index = self._cpu_edge_index.to(self.device)
[I 2026-05-03 02:01:48,570] Trial 25 finished with value: 0.5504042237254578 and parameters: {'lr': 0.01, 'weight_decay': 0.0001, 'n_hidden': 32, 'n_layer': 2, 'dropout': 0.6223835836349069, 'knn_mode': 'd', 'k': 36, 'dexp': 1.4762917710154753, 'p_grd': 0.5789477701415533, 'unc_rem': 0.07140710708074295, 'unc_rel': 0.12882055845187484}. Best is trial 12 with value: 0.5520541164824286.
    [CPU] Loading flickr...
    DEBUG 3.1: Dataset init start
    DEBUG 3.2: prepare_data start flickr
    ----Data statistics------'
    Name: flickr
    #Nodes 7575
    #Edges 239738
    #Classes 9
    #Ave_degree 63.30
    ----Split statistics------'
    #Train samples 378 (5.0 % of nodes)
    #Val samples 1136 (15.0 % of nodes)
    #Test samples 6061 (remaining)
    ----label noise information:------
    Instance dependent noise
    #Actual noise rate 0.20
    [cuda:0] LNPCC waiting for GPU slot...
    [cuda:0] Slot acquired (waited 66.3s). Starting GCN...
    FINAL_RESULT: {'acc': {'train': 0.896551724137931, 'valid': 0.45422535211267606, 'test': 0.5543639663421878}, 'wall_s': 101.36, 'cpu_s': 97.86, 'gpu_s': 3.27, 'wait_s': 66.33}
    [Time] wall=101.4s | cpu=97.9s | gpu=3.3s
    C:\Users\fbrev\anaconda3\envs\noisygl\Lib\site-packages\torch\_utils.py:315: UserWarning: Sparse CSR tensor support is in beta state. If you miss a functionality in the sparse tensor support, please submit a feature request to https://github.com/pytorch/pytorch/issues. (Triggered internally at ..\aten\src\ATen\SparseCsrTensorImpl.cpp:55.)
    result = torch.sparse_compressed_tensor(
    C:\Users\fbrev\Documents\Acadêmico\Simulações\Python\NoisyGL\predictor\Base_Predictor.py:114: UserWarning: expandable_segments not supported on this platform (Triggered internally at ..\c10/cuda/CUDAAllocatorConfig.h:28.)
    self.edge_index = self._cpu_edge_index.to(self.device)
[I 2026-05-03 02:04:41,363] Trial 26 finished with value: 0.5543639663421878 and parameters: {'lr': 0.01, 'weight_decay': 0.0001, 'n_hidden': 32, 'n_layer': 2, 'dropout': 0.2605953812451114, 'knn_mode': 'd', 'k': 29, 'dexp': 0.4990114924579987, 'p_grd': 0.5323792816417335, 'unc_rem': 0.0664019873949736, 'unc_rel': 0.14478132273745453}. Best is trial 26 with value: 0.5543639663421878.
    [CPU] Loading flickr...
    DEBUG 3.1: Dataset init start
    DEBUG 3.2: prepare_data start flickr
    ----Data statistics------'
    Name: flickr
    #Nodes 7575
    #Edges 239738
    #Classes 9
    #Ave_degree 63.30
    ----Split statistics------'
    #Train samples 378 (5.0 % of nodes)
    #Val samples 1136 (15.0 % of nodes)
    #Test samples 6061 (remaining)
    ----label noise information:------
    Instance dependent noise
    #Actual noise rate 0.20
    [cuda:0] LNPCC waiting for GPU slot...
    [cuda:0] Slot acquired (waited 37.8s). Starting GCN...
    FINAL_RESULT: {'acc': {'train': 0.8774928774928775, 'valid': 0.448943661971831, 'test': 0.5492492987955783}, 'wall_s': 114.0, 'cpu_s': 110.76, 'gpu_s': 2.97, 'wait_s': 37.77}
    [Time] wall=114.0s | cpu=110.8s | gpu=3.0s
    C:\Users\fbrev\anaconda3\envs\noisygl\Lib\site-packages\torch\_utils.py:315: UserWarning: Sparse CSR tensor support is in beta state. If you miss a functionality in the sparse tensor support, please submit a feature request to https://github.com/pytorch/pytorch/issues. (Triggered internally at ..\aten\src\ATen\SparseCsrTensorImpl.cpp:55.)
    result = torch.sparse_compressed_tensor(
    C:\Users\fbrev\Documents\Acadêmico\Simulações\Python\NoisyGL\predictor\Base_Predictor.py:114: UserWarning: expandable_segments not supported on this platform (Triggered internally at ..\c10/cuda/CUDAAllocatorConfig.h:28.)
    self.edge_index = self._cpu_edge_index.to(self.device)
[I 2026-05-03 02:07:18,559] Trial 27 finished with value: 0.5492492987955783 and parameters: {'lr': 0.01, 'weight_decay': 0.0001, 'n_hidden': 32, 'n_layer': 2, 'dropout': 0.2444904005260044, 'knn_mode': 'd', 'k': 28, 'dexp': 0.2646675741686775, 'p_grd': 0.49132346424382417, 'unc_rem': 0.09674949996259473, 'unc_rel': 0.1561982938386245}. Best is trial 26 with value: 0.5543639663421878.
    [CPU] Loading flickr...
    DEBUG 3.1: Dataset init start
    DEBUG 3.2: prepare_data start flickr
    ----Data statistics------'
    Name: flickr
    #Nodes 7575
    #Edges 239738
    #Classes 9
    #Ave_degree 63.30
    ----Split statistics------'
    #Train samples 378 (5.0 % of nodes)
    #Val samples 1136 (15.0 % of nodes)
    #Test samples 6061 (remaining)
    ----label noise information:------
    Instance dependent noise
    #Actual noise rate 0.20
    [cuda:0] LNPCC waiting for GPU slot...
    [cuda:0] Slot acquired (waited 16.3s). Starting GCN...
    FINAL_RESULT: {'acc': {'train': 0.8404255319148937, 'valid': 0.4471830985915493, 'test': 0.54462959907606}, 'wall_s': 138.89, 'cpu_s': 135.57, 'gpu_s': 3.06, 'wait_s': 16.32}
    [Time] wall=138.9s | cpu=135.6s | gpu=3.1s
    C:\Users\fbrev\anaconda3\envs\noisygl\Lib\site-packages\torch\_utils.py:315: UserWarning: Sparse CSR tensor support is in beta state. If you miss a functionality in the sparse tensor support, please submit a feature request to https://github.com/pytorch/pytorch/issues. (Triggered internally at ..\aten\src\ATen\SparseCsrTensorImpl.cpp:55.)
    result = torch.sparse_compressed_tensor(
    C:\Users\fbrev\Documents\Acadêmico\Simulações\Python\NoisyGL\predictor\Base_Predictor.py:114: UserWarning: expandable_segments not supported on this platform (Triggered internally at ..\c10/cuda/CUDAAllocatorConfig.h:28.)
    self.edge_index = self._cpu_edge_index.to(self.device)
[I 2026-05-03 02:09:58,841] Trial 28 finished with value: 0.54462959907606 and parameters: {'lr': 0.01, 'weight_decay': 0.0001, 'n_hidden': 32, 'n_layer': 2, 'dropout': 0.3025536860766157, 'knn_mode': 'd', 'k': 27, 'dexp': 1.2033991935488277, 'p_grd': 0.5938645384243201, 'unc_rem': 0.3624325300995976, 'unc_rel': 0.12042673292243691}. Best is trial 26 with value: 0.5543639663421878.
    [CPU] Loading flickr...
    DEBUG 3.1: Dataset init start
    DEBUG 3.2: prepare_data start flickr
    ----Data statistics------'
    Name: flickr
    #Nodes 7575
    #Edges 239738
    #Classes 9
    #Ave_degree 63.30
    ----Split statistics------'
    #Train samples 378 (5.0 % of nodes)
    #Val samples 1136 (15.0 % of nodes)
    #Test samples 6061 (remaining)
    ----label noise information:------
    Instance dependent noise
    #Actual noise rate 0.20
    [cuda:0] LNPCC waiting for GPU slot...
    [cuda:0] Slot acquired (waited 83.9s). Starting GCN...
    FINAL_RESULT: {'acc': {'train': 0.7248677248677249, 'valid': 0.3882042253521127, 'test': 0.4532255403398779}, 'wall_s': 152.3, 'cpu_s': 148.94, 'gpu_s': 3.14, 'wait_s': 83.85}
    [Time] wall=152.3s | cpu=148.9s | gpu=3.1s
    C:\Users\fbrev\anaconda3\envs\noisygl\Lib\site-packages\torch\_utils.py:315: UserWarning: Sparse CSR tensor support is in beta state. If you miss a functionality in the sparse tensor support, please submit a feature request to https://github.com/pytorch/pytorch/issues. (Triggered internally at ..\aten\src\ATen\SparseCsrTensorImpl.cpp:55.)
    result = torch.sparse_compressed_tensor(
    C:\Users\fbrev\Documents\Acadêmico\Simulações\Python\NoisyGL\predictor\Base_Predictor.py:114: UserWarning: expandable_segments not supported on this platform (Triggered internally at ..\c10/cuda/CUDAAllocatorConfig.h:28.)
    self.edge_index = self._cpu_edge_index.to(self.device)
[I 2026-05-03 02:14:00,074] Trial 29 finished with value: 0.4532255403398779 and parameters: {'lr': 0.1, 'weight_decay': 0.0001, 'n_hidden': 32, 'n_layer': 2, 'dropout': 0.4330880746338249, 'knn_mode': 'd', 'k': 36, 'dexp': 1.8874228252027663, 'p_grd': 0.6854012537209451, 'unc_rem': 0.466307152115729, 'unc_rel': 0.42715975528216193}. Best is trial 26 with value: 0.5543639663421878.
    [CPU] Loading flickr...
    DEBUG 3.1: Dataset init start
    DEBUG 3.2: prepare_data start flickr
    ----Data statistics------'
    Name: flickr
    #Nodes 7575
    #Edges 239738
    #Classes 9
    #Ave_degree 63.30
    ----Split statistics------'
    #Train samples 378 (5.0 % of nodes)
    #Val samples 1136 (15.0 % of nodes)
    #Test samples 6061 (remaining)
    ----label noise information:------
    Instance dependent noise
    #Actual noise rate 0.20
    [cuda:0] LNPCC waiting for GPU slot...
    [cuda:0] Slot acquired (waited 105.8s). Starting GCN...
    FINAL_RESULT: {'acc': {'train': 0.8975069252077562, 'valid': 0.44630281690140844, 'test': 0.5451245669031513}, 'wall_s': 121.63, 'cpu_s': 118.42, 'gpu_s': 2.99, 'wait_s': 105.75}
    [Time] wall=121.6s | cpu=118.4s | gpu=3.0s
    C:\Users\fbrev\anaconda3\envs\noisygl\Lib\site-packages\torch\_utils.py:315: UserWarning: Sparse CSR tensor support is in beta state. If you miss a functionality in the sparse tensor support, please submit a feature request to https://github.com/pytorch/pytorch/issues. (Triggered internally at ..\aten\src\ATen\SparseCsrTensorImpl.cpp:55.)
    result = torch.sparse_compressed_tensor(
    C:\Users\fbrev\Documents\Acadêmico\Simulações\Python\NoisyGL\predictor\Base_Predictor.py:114: UserWarning: expandable_segments not supported on this platform (Triggered internally at ..\c10/cuda/CUDAAllocatorConfig.h:28.)
    self.edge_index = self._cpu_edge_index.to(self.device)
[I 2026-05-03 02:17:52,743] Trial 30 finished with value: 0.5451245669031513 and parameters: {'lr': 0.01, 'weight_decay': 0.0001, 'n_hidden': 32, 'n_layer': 2, 'dropout': 0.2603570871269953, 'knn_mode': 'd', 'k': 28, 'dexp': 1.8061269137716165, 'p_grd': 0.41828506376529073, 'unc_rem': 0.07579325234882953, 'unc_rel': 0.17590639184945586}. Best is trial 26 with value: 0.5543639663421878.
    [CPU] Loading flickr...
    DEBUG 3.1: Dataset init start
    DEBUG 3.2: prepare_data start flickr
    ----Data statistics------'
    Name: flickr
    #Nodes 7575
    #Edges 239738
    #Classes 9
    #Ave_degree 63.30
    ----Split statistics------'
    #Train samples 378 (5.0 % of nodes)
    #Val samples 1136 (15.0 % of nodes)
    #Test samples 6061 (remaining)
    ----label noise information:------
    Instance dependent noise
    #Actual noise rate 0.20
    [cuda:0] LNPCC waiting for GPU slot...
    [cuda:0] Slot acquired (waited 5.3s). Starting GCN...
    FINAL_RESULT: {'acc': {'train': 0.8158640226628895, 'valid': 0.4498239436619718, 'test': 0.5418247813892098}, 'wall_s': 155.42, 'cpu_s': 151.94, 'gpu_s': 3.21, 'wait_s': 5.27}
    [Time] wall=155.4s | cpu=151.9s | gpu=3.2s
    C:\Users\fbrev\anaconda3\envs\noisygl\Lib\site-packages\torch\_utils.py:315: UserWarning: Sparse CSR tensor support is in beta state. If you miss a functionality in the sparse tensor support, please submit a feature request to https://github.com/pytorch/pytorch/issues. (Triggered internally at ..\aten\src\ATen\SparseCsrTensorImpl.cpp:55.)
    result = torch.sparse_compressed_tensor(
    C:\Users\fbrev\Documents\Acadêmico\Simulações\Python\NoisyGL\predictor\Base_Predictor.py:114: UserWarning: expandable_segments not supported on this platform (Triggered internally at ..\c10/cuda/CUDAAllocatorConfig.h:28.)
    self.edge_index = self._cpu_edge_index.to(self.device)
[I 2026-05-03 02:20:38,868] Trial 31 finished with value: 0.5418247813892098 and parameters: {'lr': 0.01, 'weight_decay': 0.0001, 'n_hidden': 32, 'n_layer': 2, 'dropout': 0.628843004158621, 'knn_mode': 'd', 'k': 33, 'dexp': 0.9158080658089273, 'p_grd': 0.5585267732423281, 'unc_rem': 0.052552634062342715, 'unc_rel': 0.06973953984874776}. Best is trial 26 with value: 0.5543639663421878.
    [CPU] Loading flickr...
    DEBUG 3.1: Dataset init start
    DEBUG 3.2: prepare_data start flickr
    ----Data statistics------'
    Name: flickr
    #Nodes 7575
    #Edges 239738
    #Classes 9
    #Ave_degree 63.30
    ----Split statistics------'
    #Train samples 378 (5.0 % of nodes)
    #Val samples 1136 (15.0 % of nodes)
    #Test samples 6061 (remaining)
    ----label noise information:------
    Instance dependent noise
    #Actual noise rate 0.20
    [cuda:0] LNPCC waiting for GPU slot...
    [cuda:0] Slot acquired (waited 147.7s). Starting GCN...
    FINAL_RESULT: {'acc': {'train': 0.8783068783068783, 'valid': 0.4480633802816901, 'test': 0.5598086124401914}, 'wall_s': 159.63, 'cpu_s': 156.08, 'gpu_s': 3.28, 'wait_s': 147.72}
    [Time] wall=159.6s | cpu=156.1s | gpu=3.3s
    C:\Users\fbrev\anaconda3\envs\noisygl\Lib\site-packages\torch\_utils.py:315: UserWarning: Sparse CSR tensor support is in beta state. If you miss a functionality in the sparse tensor support, please submit a feature request to https://github.com/pytorch/pytorch/issues. (Triggered internally at ..\aten\src\ATen\SparseCsrTensorImpl.cpp:55.)
    result = torch.sparse_compressed_tensor(
    C:\Users\fbrev\Documents\Acadêmico\Simulações\Python\NoisyGL\predictor\Base_Predictor.py:114: UserWarning: expandable_segments not supported on this platform (Triggered internally at ..\c10/cuda/CUDAAllocatorConfig.h:28.)
    self.edge_index = self._cpu_edge_index.to(self.device)
[I 2026-05-03 02:25:51,728] Trial 32 finished with value: 0.5598086124401914 and parameters: {'lr': 0.01, 'weight_decay': 0.0001, 'n_hidden': 32, 'n_layer': 2, 'dropout': 0.08222436539590755, 'knn_mode': 'd', 'k': 35, 'dexp': 3.108155157716006, 'p_grd': 0.6435356305721912, 'unc_rem': 0.18855735820370068, 'unc_rel': 0.21519711176871864}. Best is trial 32 with value: 0.5598086124401914.
    [CPU] Loading flickr...
    DEBUG 3.1: Dataset init start
    DEBUG 3.2: prepare_data start flickr
    ----Data statistics------'
    Name: flickr
    #Nodes 7575
    #Edges 239738
    #Classes 9
    #Ave_degree 63.30
    ----Split statistics------'
    #Train samples 378 (5.0 % of nodes)
    #Val samples 1136 (15.0 % of nodes)
    #Test samples 6061 (remaining)
    ----label noise information:------
    Instance dependent noise
    #Actual noise rate 0.20
    [cuda:0] LNPCC waiting for GPU slot...
    [cuda:0] Slot acquired (waited 12.6s). Starting GCN...
    FINAL_RESULT: {'acc': {'train': 0.8968253968253969, 'valid': 0.4471830985915493, 'test': 0.5586536875103119}, 'wall_s': 156.81, 'cpu_s': 153.45, 'gpu_s': 3.09, 'wait_s': 12.56}
    [Time] wall=156.8s | cpu=153.4s | gpu=3.1s
    C:\Users\fbrev\anaconda3\envs\noisygl\Lib\site-packages\torch\_utils.py:315: UserWarning: Sparse CSR tensor support is in beta state. If you miss a functionality in the sparse tensor support, please submit a feature request to https://github.com/pytorch/pytorch/issues. (Triggered internally at ..\aten\src\ATen\SparseCsrTensorImpl.cpp:55.)
    result = torch.sparse_compressed_tensor(
    C:\Users\fbrev\Documents\Acadêmico\Simulações\Python\NoisyGL\predictor\Base_Predictor.py:114: UserWarning: expandable_segments not supported on this platform (Triggered internally at ..\c10/cuda/CUDAAllocatorConfig.h:28.)
    self.edge_index = self._cpu_edge_index.to(self.device)
