[I 2026-05-05 17:02:43,208] Trial 125 finished with value: 0.7540653138019083 and parameters: {'lr': 0.005, 'weight_decay': 0.0001, 'n_hidden': 128, 'n_layer': 3, 'dropout': 0.45441979985749925, 'knn_mode': 's', 'k': 46, 'dexp': 8.545652284301974, 'p_grd': 0.1717680583826957, 'unc_rem': 0.3823206623857907, 'unc_rel': 0.6592514605626464}. Best is trial 83 with value: 0.7836984276306947.
    [CPU] Loading dblp...
    DEBUG 3.1: Dataset init start
    DEBUG 3.2: prepare_data start dblp
    ----Data statistics------'
    Name: dblp
    #Nodes 17716
    #Edges 52867
    #Classes 4
    #Ave_degree 5.97
    ----Split statistics------'
    #Train samples 177 (1.0 % of nodes)
    #Val samples 2657 (15.0 % of nodes)
    #Test samples 14882 (remaining)
    ----label noise information:------
    Instance dependent noise
    #Actual noise rate 0.13
    [cuda:0] LNPCC waiting for GPU slot...
    [cuda:0] Slot acquired (waited 336.1s). Starting GCN...
    FINAL_RESULT: {'acc': {'train': 0.9371428571428572, 'valid': 0.6827248776815957, 'test': 0.7629350893697083}, 'wall_s': 47.58, 'cpu_s': 43.43, 'gpu_s': 4.09, 'wait_s': 336.1}
    [Time] wall=47.6s | cpu=43.4s | gpu=4.1s
    C:\Users\fbrev\Documents\Acadêmico\Simulações\Python\NoisyGL\predictor\Base_Predictor.py:114: UserWarning: expandable_segments not supported on this platform (Triggered internally at ..\c10/cuda/CUDAAllocatorConfig.h:28.)
    self.edge_index = self._cpu_edge_index.to(self.device)
    C:\Users\fbrev\Documents\Acadêmico\Simulações\Python\NoisyGL\predictor\Base_Predictor.py:144: UserWarning: Sparse CSR tensor support is in beta state. If you miss a functionality in the sparse tensor support, please submit a feature request to https://github.com/pytorch/pytorch/issues. (Triggered internally at ..\aten\src\ATen\SparseCsrTensorImpl.cpp:55.)
    self.adj_csr = self.adj.to_sparse_csr().to(self.device)
[I 2026-05-05 17:09:12,767] Trial 126 finished with value: 0.7629350893697083 and parameters: {'lr': 0.005, 'weight_decay': 0.0001, 'n_hidden': 128, 'n_layer': 3, 'dropout': 0.4043063360441749, 'knn_mode': 's', 'k': 50, 'dexp': 8.775322675574595, 'p_grd': 0.26380985534865586, 'unc_rem': 0.28164453762017916, 'unc_rel': 0.44402533935634414}. Best is trial 83 with value: 0.7836984276306947.
    [CPU] Loading dblp...
    DEBUG 3.1: Dataset init start
    DEBUG 3.2: prepare_data start dblp
    ----Data statistics------'
    Name: dblp
    #Nodes 17716
    #Edges 52867
    #Classes 4
    #Ave_degree 5.97
    ----Split statistics------'
    #Train samples 177 (1.0 % of nodes)
    #Val samples 2657 (15.0 % of nodes)
    #Test samples 14882 (remaining)
    ----label noise information:------
    Instance dependent noise
    #Actual noise rate 0.13
    [cuda:0] LNPCC waiting for GPU slot...
    [cuda:0] Slot acquired (waited 333.9s). Starting GCN...
    FINAL_RESULT: {'acc': {'train': 0.9770114942528736, 'valid': 0.689499435453519, 'test': 0.7748958473323478}, 'wall_s': 46.52, 'cpu_s': 42.23, 'gpu_s': 4.22, 'wait_s': 333.86}
    [Time] wall=46.5s | cpu=42.2s | gpu=4.2s
    C:\Users\fbrev\Documents\Acadêmico\Simulações\Python\NoisyGL\predictor\Base_Predictor.py:114: UserWarning: expandable_segments not supported on this platform (Triggered internally at ..\c10/cuda/CUDAAllocatorConfig.h:28.)
    self.edge_index = self._cpu_edge_index.to(self.device)
    C:\Users\fbrev\Documents\Acadêmico\Simulações\Python\NoisyGL\predictor\Base_Predictor.py:144: UserWarning: Sparse CSR tensor support is in beta state. If you miss a functionality in the sparse tensor support, please submit a feature request to https://github.com/pytorch/pytorch/issues. (Triggered internally at ..\aten\src\ATen\SparseCsrTensorImpl.cpp:55.)
    self.adj_csr = self.adj.to_sparse_csr().to(self.device)
[I 2026-05-05 17:15:39,356] Trial 127 finished with value: 0.7748958473323478 and parameters: {'lr': 0.005, 'weight_decay': 0.0001, 'n_hidden': 128, 'n_layer': 3, 'dropout': 0.3414104072476119, 'knn_mode': 's', 'k': 47, 'dexp': 8.335418006053269, 'p_grd': 0.21312887775065725, 'unc_rem': 0.3048626489175959, 'unc_rel': 0.5872196997876621}. Best is trial 83 with value: 0.7836984276306947.
    [CPU] Loading dblp...
    DEBUG 3.1: Dataset init start
    DEBUG 3.2: prepare_data start dblp
    ----Data statistics------'
    Name: dblp
    #Nodes 17716
    #Edges 52867
    #Classes 4
    #Ave_degree 5.97
    ----Split statistics------'
    #Train samples 177 (1.0 % of nodes)
    #Val samples 2657 (15.0 % of nodes)
    #Test samples 14882 (remaining)
    ----label noise information:------
    Instance dependent noise
    #Actual noise rate 0.13
    [cuda:0] LNPCC waiting for GPU slot...
    [cuda:0] Slot acquired (waited 162.2s). Starting GCN...
    FINAL_RESULT: {'acc': {'train': 0.9943181818181818, 'valid': 0.6789612344749718, 'test': 0.7466066388926219}, 'wall_s': 41.4, 'cpu_s': 37.16, 'gpu_s': 4.18, 'wait_s': 162.2}
    [Time] wall=41.4s | cpu=37.2s | gpu=4.2s
    C:\Users\fbrev\Documents\Acadêmico\Simulações\Python\NoisyGL\predictor\Base_Predictor.py:114: UserWarning: expandable_segments not supported on this platform (Triggered internally at ..\c10/cuda/CUDAAllocatorConfig.h:28.)
    self.edge_index = self._cpu_edge_index.to(self.device)
    C:\Users\fbrev\Documents\Acadêmico\Simulações\Python\NoisyGL\predictor\Base_Predictor.py:144: UserWarning: Sparse CSR tensor support is in beta state. If you miss a functionality in the sparse tensor support, please submit a feature request to https://github.com/pytorch/pytorch/issues. (Triggered internally at ..\aten\src\ATen\SparseCsrTensorImpl.cpp:55.)
    self.adj_csr = self.adj.to_sparse_csr().to(self.device)
[I 2026-05-05 17:19:08,811] Trial 128 finished with value: 0.7466066388926219 and parameters: {'lr': 0.1, 'weight_decay': 0.0001, 'n_hidden': 128, 'n_layer': 3, 'dropout': 0.33197052985402653, 'knn_mode': 's', 'k': 46, 'dexp': 7.780227859936402, 'p_grd': 0.19602245005507402, 'unc_rem': 0.3515484029538896, 'unc_rel': 0.35369146364518045}. Best is trial 83 with value: 0.7836984276306947.
    [CPU] Loading dblp...
    DEBUG 3.1: Dataset init start
    DEBUG 3.2: prepare_data start dblp
    ----Data statistics------'
    Name: dblp
    #Nodes 17716
    #Edges 52867
    #Classes 4
    #Ave_degree 5.97
    ----Split statistics------'
    #Train samples 177 (1.0 % of nodes)
    #Val samples 2657 (15.0 % of nodes)
    #Test samples 14882 (remaining)
    ----label noise information:------
    Instance dependent noise
    #Actual noise rate 0.13
    [cuda:0] LNPCC waiting for GPU slot...
    [cuda:0] Slot acquired (waited 727.3s). Starting GCN...
    FINAL_RESULT: {'acc': {'train': 0.8465909090909091, 'valid': 0.6258938652615732, 'test': 0.6913721274022309}, 'wall_s': 41.02, 'cpu_s': 36.6, 'gpu_s': 4.35, 'wait_s': 727.3}
    [Time] wall=41.0s | cpu=36.6s | gpu=4.4s
    C:\Users\fbrev\Documents\Acadêmico\Simulações\Python\NoisyGL\predictor\Base_Predictor.py:114: UserWarning: expandable_segments not supported on this platform (Triggered internally at ..\c10/cuda/CUDAAllocatorConfig.h:28.)
    self.edge_index = self._cpu_edge_index.to(self.device)
    C:\Users\fbrev\Documents\Acadêmico\Simulações\Python\NoisyGL\predictor\Base_Predictor.py:144: UserWarning: Sparse CSR tensor support is in beta state. If you miss a functionality in the sparse tensor support, please submit a feature request to https://github.com/pytorch/pytorch/issues. (Triggered internally at ..\aten\src\ATen\SparseCsrTensorImpl.cpp:55.)
    self.adj_csr = self.adj.to_sparse_csr().to(self.device)
[I 2026-05-05 17:32:03,432] Trial 129 finished with value: 0.6913721274022309 and parameters: {'lr': 0.005, 'weight_decay': 0.05, 'n_hidden': 128, 'n_layer': 3, 'dropout': 0.25995759890696996, 'knn_mode': 's', 'k': 47, 'dexp': 9.03673136669434, 'p_grd': 0.12333900319536986, 'unc_rem': 0.8005921940276884, 'unc_rel': 0.5969237204224882}. Best is trial 83 with value: 0.7836984276306947.
    [CPU] Loading dblp...
    DEBUG 3.1: Dataset init start
    DEBUG 3.2: prepare_data start dblp
    ----Data statistics------'
    Name: dblp
    #Nodes 17716
    #Edges 52867
    #Classes 4
    #Ave_degree 5.97
    ----Split statistics------'
    #Train samples 177 (1.0 % of nodes)
    #Val samples 2657 (15.0 % of nodes)
    #Test samples 14882 (remaining)
    ----label noise information:------
    Instance dependent noise
    #Actual noise rate 0.13
    [cuda:0] LNPCC waiting for GPU slot...
    [cuda:0] Slot acquired (waited 324.5s). Starting GCN...
    FINAL_RESULT: {'acc': {'train': 0.9488636363636364, 'valid': 0.6996612721114038, 'test': 0.7767773148770326}, 'wall_s': 44.77, 'cpu_s': 40.2, 'gpu_s': 4.5, 'wait_s': 324.47}
    [Time] wall=44.8s | cpu=40.2s | gpu=4.5s
    C:\Users\fbrev\Documents\Acadêmico\Simulações\Python\NoisyGL\predictor\Base_Predictor.py:114: UserWarning: expandable_segments not supported on this platform (Triggered internally at ..\c10/cuda/CUDAAllocatorConfig.h:28.)
    self.edge_index = self._cpu_edge_index.to(self.device)
    C:\Users\fbrev\Documents\Acadêmico\Simulações\Python\NoisyGL\predictor\Base_Predictor.py:144: UserWarning: Sparse CSR tensor support is in beta state. If you miss a functionality in the sparse tensor support, please submit a feature request to https://github.com/pytorch/pytorch/issues. (Triggered internally at ..\aten\src\ATen\SparseCsrTensorImpl.cpp:55.)
    self.adj_csr = self.adj.to_sparse_csr().to(self.device)
[I 2026-05-05 17:38:18,836] Trial 130 finished with value: 0.7767773148770326 and parameters: {'lr': 0.005, 'weight_decay': 0.0001, 'n_hidden': 128, 'n_layer': 3, 'dropout': 0.34633982281116343, 'knn_mode': 's', 'k': 45, 'dexp': 8.125522765180154, 'p_grd': 0.2241772024984618, 'unc_rem': 0.4860359599562136, 'unc_rel': 0.5263892581753069}. Best is trial 83 with value: 0.7836984276306947.
    [CPU] Loading dblp...
    DEBUG 3.1: Dataset init start
    DEBUG 3.2: prepare_data start dblp
    ----Data statistics------'
    Name: dblp
    #Nodes 17716
    #Edges 52867
    #Classes 4
    #Ave_degree 5.97
    ----Split statistics------'
    #Train samples 177 (1.0 % of nodes)
    #Val samples 2657 (15.0 % of nodes)
    #Test samples 14882 (remaining)
    ----label noise information:------
    Instance dependent noise
    #Actual noise rate 0.13
    [cuda:0] LNPCC waiting for GPU slot...
    [cuda:0] Slot acquired (waited 338.6s). Starting GCN...
    FINAL_RESULT: {'acc': {'train': 0.943502824858757, 'valid': 0.6910048927361686, 'test': 0.773148770326569}, 'wall_s': 44.28, 'cpu_s': 39.89, 'gpu_s': 4.32, 'wait_s': 338.62}
    [Time] wall=44.3s | cpu=39.9s | gpu=4.3s
    C:\Users\fbrev\Documents\Acadêmico\Simulações\Python\NoisyGL\predictor\Base_Predictor.py:114: UserWarning: expandable_segments not supported on this platform (Triggered internally at ..\c10/cuda/CUDAAllocatorConfig.h:28.)
    self.edge_index = self._cpu_edge_index.to(self.device)
    C:\Users\fbrev\Documents\Acadêmico\Simulações\Python\NoisyGL\predictor\Base_Predictor.py:144: UserWarning: Sparse CSR tensor support is in beta state. If you miss a functionality in the sparse tensor support, please submit a feature request to https://github.com/pytorch/pytorch/issues. (Triggered internally at ..\aten\src\ATen\SparseCsrTensorImpl.cpp:55.)
    self.adj_csr = self.adj.to_sparse_csr().to(self.device)
[I 2026-05-05 17:44:47,829] Trial 131 finished with value: 0.773148770326569 and parameters: {'lr': 0.005, 'weight_decay': 0.0001, 'n_hidden': 128, 'n_layer': 3, 'dropout': 0.3447396585438142, 'knn_mode': 's', 'k': 45, 'dexp': 8.493559908185816, 'p_grd': 0.21864118078745326, 'unc_rem': 0.48313303194619867, 'unc_rel': 0.5334938496804015}. Best is trial 83 with value: 0.7836984276306947.
    [CPU] Loading dblp...
    DEBUG 3.1: Dataset init start
    DEBUG 3.2: prepare_data start dblp
    ----Data statistics------'
    Name: dblp
    #Nodes 17716
    #Edges 52867
    #Classes 4
    #Ave_degree 5.97
    ----Split statistics------'
    #Train samples 177 (1.0 % of nodes)
    #Val samples 2657 (15.0 % of nodes)
    #Test samples 14882 (remaining)
    ----label noise information:------
    Instance dependent noise
    #Actual noise rate 0.13
    [cuda:0] LNPCC waiting for GPU slot...
    [cuda:0] Slot acquired (waited 153.4s). Starting GCN...
    FINAL_RESULT: {'acc': {'train': 0.9545454545454546, 'valid': 0.7034249153180279, 'test': 0.7810778121220266}, 'wall_s': 44.39, 'cpu_s': 39.56, 'gpu_s': 4.76, 'wait_s': 153.35}
    [Time] wall=44.4s | cpu=39.6s | gpu=4.8s
    C:\Users\fbrev\Documents\Acadêmico\Simulações\Python\NoisyGL\predictor\Base_Predictor.py:114: UserWarning: expandable_segments not supported on this platform (Triggered internally at ..\c10/cuda/CUDAAllocatorConfig.h:28.)
    self.edge_index = self._cpu_edge_index.to(self.device)
    C:\Users\fbrev\Documents\Acadêmico\Simulações\Python\NoisyGL\predictor\Base_Predictor.py:144: UserWarning: Sparse CSR tensor support is in beta state. If you miss a functionality in the sparse tensor support, please submit a feature request to https://github.com/pytorch/pytorch/issues. (Triggered internally at ..\aten\src\ATen\SparseCsrTensorImpl.cpp:55.)
    self.adj_csr = self.adj.to_sparse_csr().to(self.device)
[I 2026-05-05 17:48:11,727] Trial 132 finished with value: 0.7810778121220266 and parameters: {'lr': 0.005, 'weight_decay': 0.0001, 'n_hidden': 128, 'n_layer': 3, 'dropout': 0.313142133714806, 'knn_mode': 's', 'k': 43, 'dexp': 8.683857346809537, 'p_grd': 0.22483447449195626, 'unc_rem': 0.49769485275307646, 'unc_rel': 0.5330206227863137}. Best is trial 83 with value: 0.7836984276306947.
    [CPU] Loading dblp...
    DEBUG 3.1: Dataset init start
    DEBUG 3.2: prepare_data start dblp
    ----Data statistics------'
    Name: dblp
    #Nodes 17716
    #Edges 52867
    #Classes 4
    #Ave_degree 5.97
    ----Split statistics------'
    #Train samples 177 (1.0 % of nodes)
    #Val samples 2657 (15.0 % of nodes)
    #Test samples 14882 (remaining)
    ----label noise information:------
    Instance dependent noise
    #Actual noise rate 0.13
    [cuda:0] LNPCC waiting for GPU slot...
    [cuda:0] Slot acquired (waited 150.8s). Starting GCN...
    FINAL_RESULT: {'acc': {'train': 0.953757225433526, 'valid': 0.7026721866767031, 'test': 0.7777180486493751}, 'wall_s': 55.8, 'cpu_s': 51.42, 'gpu_s': 4.32, 'wait_s': 150.78}
    [Time] wall=55.8s | cpu=51.4s | gpu=4.3s
    C:\Users\fbrev\Documents\Acadêmico\Simulações\Python\NoisyGL\predictor\Base_Predictor.py:114: UserWarning: expandable_segments not supported on this platform (Triggered internally at ..\c10/cuda/CUDAAllocatorConfig.h:28.)
    self.edge_index = self._cpu_edge_index.to(self.device)
    C:\Users\fbrev\Documents\Acadêmico\Simulações\Python\NoisyGL\predictor\Base_Predictor.py:144: UserWarning: Sparse CSR tensor support is in beta state. If you miss a functionality in the sparse tensor support, please submit a feature request to https://github.com/pytorch/pytorch/issues. (Triggered internally at ..\aten\src\ATen\SparseCsrTensorImpl.cpp:55.)
    self.adj_csr = self.adj.to_sparse_csr().to(self.device)
[I 2026-05-05 17:51:45,756] Trial 133 finished with value: 0.7777180486493751 and parameters: {'lr': 0.005, 'weight_decay': 0.0001, 'n_hidden': 128, 'n_layer': 3, 'dropout': 0.3419687782310327, 'knn_mode': 's', 'k': 41, 'dexp': 8.427845442831595, 'p_grd': 0.217113714449542, 'unc_rem': 0.4942969175118781, 'unc_rel': 0.5319692557759167}. Best is trial 83 with value: 0.7836984276306947.
    [CPU] Loading dblp...
    DEBUG 3.1: Dataset init start
    DEBUG 3.2: prepare_data start dblp
    ----Data statistics------'
    Name: dblp
    #Nodes 17716
    #Edges 52867
    #Classes 4
    #Ave_degree 5.97
    ----Split statistics------'
    #Train samples 177 (1.0 % of nodes)
    #Val samples 2657 (15.0 % of nodes)
    #Test samples 14882 (remaining)
    ----label noise information:------
    Instance dependent noise
    #Actual noise rate 0.13
    [cuda:0] LNPCC waiting for GPU slot...
    [cuda:0] Slot acquired (waited 137.4s). Starting GCN...
    FINAL_RESULT: {'acc': {'train': 0.9659090909090909, 'valid': 0.6974030861874294, 'test': 0.7811450073914796}, 'wall_s': 45.03, 'cpu_s': 40.76, 'gpu_s': 4.2, 'wait_s': 137.41}
    [Time] wall=45.0s | cpu=40.8s | gpu=4.2s
    C:\Users\fbrev\Documents\Acadêmico\Simulações\Python\NoisyGL\predictor\Base_Predictor.py:114: UserWarning: expandable_segments not supported on this platform (Triggered internally at ..\c10/cuda/CUDAAllocatorConfig.h:28.)
    self.edge_index = self._cpu_edge_index.to(self.device)
    C:\Users\fbrev\Documents\Acadêmico\Simulações\Python\NoisyGL\predictor\Base_Predictor.py:144: UserWarning: Sparse CSR tensor support is in beta state. If you miss a functionality in the sparse tensor support, please submit a feature request to https://github.com/pytorch/pytorch/issues. (Triggered internally at ..\aten\src\ATen\SparseCsrTensorImpl.cpp:55.)
    self.adj_csr = self.adj.to_sparse_csr().to(self.device)
[I 2026-05-05 17:54:54,284] Trial 134 finished with value: 0.7811450073914796 and parameters: {'lr': 0.005, 'weight_decay': 0.0001, 'n_hidden': 128, 'n_layer': 3, 'dropout': 0.30894662543046614, 'knn_mode': 's', 'k': 41, 'dexp': 8.329992515350874, 'p_grd': 0.23666008592859838, 'unc_rem': 0.5123124345368029, 'unc_rel': 0.5683019309379537}. Best is trial 83 with value: 0.7836984276306947.
    [CPU] Loading dblp...
    DEBUG 3.1: Dataset init start
    DEBUG 3.2: prepare_data start dblp
    ----Data statistics------'
    Name: dblp
    #Nodes 17716
    #Edges 52867
    #Classes 4
    #Ave_degree 5.97
    ----Split statistics------'
    #Train samples 177 (1.0 % of nodes)
    #Val samples 2657 (15.0 % of nodes)
    #Test samples 14882 (remaining)
    ----label noise information:------
    Instance dependent noise
    #Actual noise rate 0.13
    [cuda:0] LNPCC waiting for GPU slot...
    [cuda:0] Slot acquired (waited 517.1s). Starting GCN...
    FINAL_RESULT: {'acc': {'train': 0.9548022598870056, 'valid': 0.6921339856981558, 'test': 0.7726112081709448}, 'wall_s': 42.65, 'cpu_s': 38.44, 'gpu_s': 4.15, 'wait_s': 517.11}
    [Time] wall=42.6s | cpu=38.4s | gpu=4.1s
    C:\Users\fbrev\Documents\Acadêmico\Simulações\Python\NoisyGL\predictor\Base_Predictor.py:114: UserWarning: expandable_segments not supported on this platform (Triggered internally at ..\c10/cuda/CUDAAllocatorConfig.h:28.)
    self.edge_index = self._cpu_edge_index.to(self.device)
    C:\Users\fbrev\Documents\Acadêmico\Simulações\Python\NoisyGL\predictor\Base_Predictor.py:144: UserWarning: Sparse CSR tensor support is in beta state. If you miss a functionality in the sparse tensor support, please submit a feature request to https://github.com/pytorch/pytorch/issues. (Triggered internally at ..\aten\src\ATen\SparseCsrTensorImpl.cpp:55.)
    self.adj_csr = self.adj.to_sparse_csr().to(self.device)
[I 2026-05-05 18:04:19,693] Trial 135 finished with value: 0.7726112081709448 and parameters: {'lr': 0.005, 'weight_decay': 0.001, 'n_hidden': 128, 'n_layer': 3, 'dropout': 0.30046474772944504, 'knn_mode': 's', 'k': 39, 'dexp': 8.032373648066313, 'p_grd': 0.20308044744139306, 'unc_rem': 0.5346107362085323, 'unc_rel': 0.5629744539291558}. Best is trial 83 with value: 0.7836984276306947.
    [CPU] Loading dblp...
    DEBUG 3.1: Dataset init start
    DEBUG 3.2: prepare_data start dblp
    ----Data statistics------'
    Name: dblp
    #Nodes 17716
    #Edges 52867
    #Classes 4
    #Ave_degree 5.97
    ----Split statistics------'
    #Train samples 177 (1.0 % of nodes)
    #Val samples 2657 (15.0 % of nodes)
    #Test samples 14882 (remaining)
    ----label noise information:------
    Instance dependent noise
    #Actual noise rate 0.13
    [cuda:0] LNPCC waiting for GPU slot...
    [cuda:0] Slot acquired (waited 325.0s). Starting GCN...
    FINAL_RESULT: {'acc': {'train': 0.9653179190751445, 'valid': 0.6849830636055702, 'test': 0.7634054562558796}, 'wall_s': 42.86, 'cpu_s': 38.68, 'gpu_s': 4.11, 'wait_s': 325.02}
    [Time] wall=42.9s | cpu=38.7s | gpu=4.1s
    C:\Users\fbrev\Documents\Acadêmico\Simulações\Python\NoisyGL\predictor\Base_Predictor.py:114: UserWarning: expandable_segments not supported on this platform (Triggered internally at ..\c10/cuda/CUDAAllocatorConfig.h:28.)
    self.edge_index = self._cpu_edge_index.to(self.device)
    C:\Users\fbrev\Documents\Acadêmico\Simulações\Python\NoisyGL\predictor\Base_Predictor.py:144: UserWarning: Sparse CSR tensor support is in beta state. If you miss a functionality in the sparse tensor support, please submit a feature request to https://github.com/pytorch/pytorch/issues. (Triggered internally at ..\aten\src\ATen\SparseCsrTensorImpl.cpp:55.)
    self.adj_csr = self.adj.to_sparse_csr().to(self.device)
