[I 2026-05-03 21:58:00,627] Trial 21 finished with value: 0.6837421837421838 and parameters: {'lr': 0.01, 'weight_decay': 0.0001, 'n_hidden': 32, 'n_layer': 2, 'dropout': 0.23339879093236446, 'knn_mode': 'd', 'k': 5, 'dexp': 5.84893420904292, 'p_grd': 0.5090495544606248, 'unc_rem': 0.027873114592523812, 'unc_rel': 0.4403155682874399}. Best is trial 8 with value: 0.7003367003367004.
    [CPU] Loading blogcatalog...
    DEBUG 3.1: Dataset init start
    DEBUG 3.2: prepare_data start blogcatalog
    ----Data statistics------'
    Name: blogcatalog
    #Nodes 5196
    #Edges 171743
    #Classes 6
    #Ave_degree 66.11
    ----Split statistics------'
    #Train samples 259 (5.0 % of nodes)
    #Val samples 779 (15.0 % of nodes)
    #Test samples 4158 (remaining)
    ----label noise information:------
    Instance dependent noise
    #Actual noise rate 0.40
    [cuda:1] LNPCC waiting for GPU slot...
    [cuda:1] Slot acquired (waited 258.5s). Starting GCN...
    FINAL_RESULT: {'acc': {'train': 1.0, 'valid': 0.23234916559691912, 'test': 0.2696007696007696}, 'wall_s': 34.47, 'cpu_s': 32.0, 'gpu_s': 2.39, 'wait_s': 258.52}
    [Time] wall=34.5s | cpu=32.0s | gpu=2.4s
    C:\Users\fbrev\Documents\Acadêmico\Simulações\Python\NoisyGL\predictor\Base_Predictor.py:114: UserWarning: expandable_segments not supported on this platform (Triggered internally at ..\c10/cuda/CUDAAllocatorConfig.h:28.)
    self.edge_index = self._cpu_edge_index.to(self.device)
    C:\Users\fbrev\Documents\Acadêmico\Simulações\Python\NoisyGL\predictor\Base_Predictor.py:144: UserWarning: Sparse CSR tensor support is in beta state. If you miss a functionality in the sparse tensor support, please submit a feature request to https://github.com/pytorch/pytorch/issues. (Triggered internally at ..\aten\src\ATen\SparseCsrTensorImpl.cpp:55.)
    self.adj_csr = self.adj.to_sparse_csr().to(self.device)
[I 2026-05-03 22:02:58,658] Trial 22 finished with value: 0.2696007696007696 and parameters: {'lr': 0.01, 'weight_decay': 0.001, 'n_hidden': 32, 'n_layer': 2, 'dropout': 0.30445832113654436, 'knn_mode': 'd', 'k': 13, 'dexp': 5.4799680598074065, 'p_grd': 0.9731094054347832, 'unc_rem': 0.0024400565632121674, 'unc_rel': 0.44129710384722415}. Best is trial 8 with value: 0.7003367003367004.
    [CPU] Loading blogcatalog...
    DEBUG 3.1: Dataset init start
    DEBUG 3.2: prepare_data start blogcatalog
    ----Data statistics------'
    Name: blogcatalog
    #Nodes 5196
    #Edges 171743
    #Classes 6
    #Ave_degree 66.11
    ----Split statistics------'
    #Train samples 259 (5.0 % of nodes)
    #Val samples 779 (15.0 % of nodes)
    #Test samples 4158 (remaining)
    ----label noise information:------
    Instance dependent noise
    #Actual noise rate 0.40
    [cuda:1] LNPCC waiting for GPU slot...
    [cuda:1] Slot acquired (waited 50.7s). Starting GCN...
    FINAL_RESULT: {'acc': {'train': 0.6395939086294417, 'valid': 0.46598202824133506, 'test': 0.7061087061087061}, 'wall_s': 28.1, 'cpu_s': 25.0, 'gpu_s': 3.01, 'wait_s': 50.68}
    [Time] wall=28.1s | cpu=25.0s | gpu=3.0s
    C:\Users\fbrev\Documents\Acadêmico\Simulações\Python\NoisyGL\predictor\Base_Predictor.py:114: UserWarning: expandable_segments not supported on this platform (Triggered internally at ..\c10/cuda/CUDAAllocatorConfig.h:28.)
    self.edge_index = self._cpu_edge_index.to(self.device)
    C:\Users\fbrev\Documents\Acadêmico\Simulações\Python\NoisyGL\predictor\Base_Predictor.py:144: UserWarning: Sparse CSR tensor support is in beta state. If you miss a functionality in the sparse tensor support, please submit a feature request to https://github.com/pytorch/pytorch/issues. (Triggered internally at ..\aten\src\ATen\SparseCsrTensorImpl.cpp:55.)
    self.adj_csr = self.adj.to_sparse_csr().to(self.device)
[I 2026-05-03 22:04:22,644] Trial 23 finished with value: 0.7061087061087061 and parameters: {'lr': 0.01, 'weight_decay': 0.001, 'n_hidden': 64, 'n_layer': 2, 'dropout': 0.42830263476793856, 'knn_mode': 'd', 'k': 36, 'dexp': 7.28934241482448, 'p_grd': 0.5666606652441211, 'unc_rem': 0.0158770311090998, 'unc_rel': 0.004802174539642545}. Best is trial 23 with value: 0.7061087061087061.
    [CPU] Loading blogcatalog...
    DEBUG 3.1: Dataset init start
    DEBUG 3.2: prepare_data start blogcatalog
    ----Data statistics------'
    Name: blogcatalog
    #Nodes 5196
    #Edges 171743
    #Classes 6
    #Ave_degree 66.11
    ----Split statistics------'
    #Train samples 259 (5.0 % of nodes)
    #Val samples 779 (15.0 % of nodes)
    #Test samples 4158 (remaining)
    ----label noise information:------
    Instance dependent noise
    #Actual noise rate 0.40
    [cuda:1] LNPCC waiting for GPU slot...
    [cuda:1] Slot acquired (waited 199.1s). Starting GCN...
    FINAL_RESULT: {'acc': {'train': 0.4864864864864865, 'valid': 0.4621309370988447, 'test': 0.6861471861471862}, 'wall_s': 29.02, 'cpu_s': 25.92, 'gpu_s': 3.02, 'wait_s': 199.13}
    [Time] wall=29.0s | cpu=25.9s | gpu=3.0s
    C:\Users\fbrev\Documents\Acadêmico\Simulações\Python\NoisyGL\predictor\Base_Predictor.py:114: UserWarning: expandable_segments not supported on this platform (Triggered internally at ..\c10/cuda/CUDAAllocatorConfig.h:28.)
    self.edge_index = self._cpu_edge_index.to(self.device)
    C:\Users\fbrev\Documents\Acadêmico\Simulações\Python\NoisyGL\predictor\Base_Predictor.py:144: UserWarning: Sparse CSR tensor support is in beta state. If you miss a functionality in the sparse tensor support, please submit a feature request to https://github.com/pytorch/pytorch/issues. (Triggered internally at ..\aten\src\ATen\SparseCsrTensorImpl.cpp:55.)
    self.adj_csr = self.adj.to_sparse_csr().to(self.device)
[I 2026-05-03 22:08:15,933] Trial 24 finished with value: 0.6861471861471862 and parameters: {'lr': 0.01, 'weight_decay': 0.001, 'n_hidden': 64, 'n_layer': 2, 'dropout': 0.4316002007559612, 'knn_mode': 'd', 'k': 37, 'dexp': 7.20921473885292, 'p_grd': 0.5926695241406099, 'unc_rem': 0.22116720296701559, 'unc_rel': 0.004110515579528105}. Best is trial 23 with value: 0.7061087061087061.
    [CPU] Loading blogcatalog...
    DEBUG 3.1: Dataset init start
    DEBUG 3.2: prepare_data start blogcatalog
    ----Data statistics------'
    Name: blogcatalog
    #Nodes 5196
    #Edges 171743
    #Classes 6
    #Ave_degree 66.11
    ----Split statistics------'
    #Train samples 259 (5.0 % of nodes)
    #Val samples 779 (15.0 % of nodes)
    #Test samples 4158 (remaining)
    ----label noise information:------
    Instance dependent noise
    #Actual noise rate 0.40
    [cuda:1] LNPCC waiting for GPU slot...
    [cuda:1] Slot acquired (waited 38.5s). Starting GCN...
    FINAL_RESULT: {'acc': {'train': 0.6186770428015564, 'valid': 0.4557124518613607, 'test': 0.701058201058201}, 'wall_s': 33.26, 'cpu_s': 30.02, 'gpu_s': 3.16, 'wait_s': 38.51}
    [Time] wall=33.3s | cpu=30.0s | gpu=3.2s
    C:\Users\fbrev\Documents\Acadêmico\Simulações\Python\NoisyGL\predictor\Base_Predictor.py:114: UserWarning: expandable_segments not supported on this platform (Triggered internally at ..\c10/cuda/CUDAAllocatorConfig.h:28.)
    self.edge_index = self._cpu_edge_index.to(self.device)
    C:\Users\fbrev\Documents\Acadêmico\Simulações\Python\NoisyGL\predictor\Base_Predictor.py:144: UserWarning: Sparse CSR tensor support is in beta state. If you miss a functionality in the sparse tensor support, please submit a feature request to https://github.com/pytorch/pytorch/issues. (Triggered internally at ..\aten\src\ATen\SparseCsrTensorImpl.cpp:55.)
    self.adj_csr = self.adj.to_sparse_csr().to(self.device)
[I 2026-05-03 22:09:32,936] Trial 25 finished with value: 0.701058201058201 and parameters: {'lr': 0.005, 'weight_decay': 0.001, 'n_hidden': 64, 'n_layer': 2, 'dropout': 0.6050937062025971, 'knn_mode': 'd', 'k': 47, 'dexp': 7.230877818767205, 'p_grd': 0.8180864870496382, 'unc_rem': 0.20201710565189115, 'unc_rel': 0.13973934845315894}. Best is trial 23 with value: 0.7061087061087061.
    [CPU] Loading blogcatalog...
    DEBUG 3.1: Dataset init start
    DEBUG 3.2: prepare_data start blogcatalog
    ----Data statistics------'
    Name: blogcatalog
    #Nodes 5196
    #Edges 171743
    #Classes 6
    #Ave_degree 66.11
    ----Split statistics------'
    #Train samples 259 (5.0 % of nodes)
    #Val samples 779 (15.0 % of nodes)
    #Test samples 4158 (remaining)
    ----label noise information:------
    Instance dependent noise
    #Actual noise rate 0.40
    [cuda:1] LNPCC waiting for GPU slot...
    [cuda:1] Slot acquired (waited 107.3s). Starting GCN...
    FINAL_RESULT: {'acc': {'train': 0.4517374517374517, 'valid': 0.45699614890885754, 'test': 0.6642616642616642}, 'wall_s': 37.09, 'cpu_s': 33.99, 'gpu_s': 3.02, 'wait_s': 107.26}
    [Time] wall=37.1s | cpu=34.0s | gpu=3.0s
    C:\Users\fbrev\Documents\Acadêmico\Simulações\Python\NoisyGL\predictor\Base_Predictor.py:114: UserWarning: expandable_segments not supported on this platform (Triggered internally at ..\c10/cuda/CUDAAllocatorConfig.h:28.)
    self.edge_index = self._cpu_edge_index.to(self.device)
    C:\Users\fbrev\Documents\Acadêmico\Simulações\Python\NoisyGL\predictor\Base_Predictor.py:144: UserWarning: Sparse CSR tensor support is in beta state. If you miss a functionality in the sparse tensor support, please submit a feature request to https://github.com/pytorch/pytorch/issues. (Triggered internally at ..\aten\src\ATen\SparseCsrTensorImpl.cpp:55.)
    self.adj_csr = self.adj.to_sparse_csr().to(self.device)
[I 2026-05-03 22:12:02,242] Trial 26 finished with value: 0.6642616642616642 and parameters: {'lr': 0.01, 'weight_decay': 0.001, 'n_hidden': 64, 'n_layer': 2, 'dropout': 0.5888520373545756, 'knn_mode': 'd', 'k': 50, 'dexp': 6.52422391503387, 'p_grd': 0.7907266974783274, 'unc_rem': 0.40305615644303383, 'unc_rel': 0.12596433384766212}. Best is trial 23 with value: 0.7061087061087061.
    [CPU] Loading blogcatalog...
    DEBUG 3.1: Dataset init start
    DEBUG 3.2: prepare_data start blogcatalog
    ----Data statistics------'
    Name: blogcatalog
    #Nodes 5196
    #Edges 171743
    #Classes 6
    #Ave_degree 66.11
    ----Split statistics------'
    #Train samples 259 (5.0 % of nodes)
    #Val samples 779 (15.0 % of nodes)
    #Test samples 4158 (remaining)
    ----label noise information:------
    Instance dependent noise
    #Actual noise rate 0.40
    [cuda:1] LNPCC waiting for GPU slot...
    [cuda:1] Slot acquired (waited 64.1s). Starting GCN...
    FINAL_RESULT: {'acc': {'train': 0.29523809523809524, 'valid': 0.34146341463414637, 'test': 0.4713804713804714}, 'wall_s': 34.57, 'cpu_s': 31.44, 'gpu_s': 3.05, 'wait_s': 64.12}
    [Time] wall=34.6s | cpu=31.4s | gpu=3.1s
    C:\Users\fbrev\Documents\Acadêmico\Simulações\Python\NoisyGL\predictor\Base_Predictor.py:114: UserWarning: expandable_segments not supported on this platform (Triggered internally at ..\c10/cuda/CUDAAllocatorConfig.h:28.)
    self.edge_index = self._cpu_edge_index.to(self.device)
    C:\Users\fbrev\Documents\Acadêmico\Simulações\Python\NoisyGL\predictor\Base_Predictor.py:144: UserWarning: Sparse CSR tensor support is in beta state. If you miss a functionality in the sparse tensor support, please submit a feature request to https://github.com/pytorch/pytorch/issues. (Triggered internally at ..\aten\src\ATen\SparseCsrTensorImpl.cpp:55.)
    self.adj_csr = self.adj.to_sparse_csr().to(self.device)
[I 2026-05-03 22:13:45,719] Trial 27 finished with value: 0.4713804713804714 and parameters: {'lr': 0.1, 'weight_decay': 0.001, 'n_hidden': 64, 'n_layer': 2, 'dropout': 0.4301459301217825, 'knn_mode': 'd', 'k': 45, 'dexp': 9.110922704385917, 'p_grd': 0.881989058744486, 'unc_rem': 0.03420161055247892, 'unc_rel': 0.01441761828816052}. Best is trial 23 with value: 0.7061087061087061.
    [CPU] Loading blogcatalog...
    DEBUG 3.1: Dataset init start
    DEBUG 3.2: prepare_data start blogcatalog
    ----Data statistics------'
    Name: blogcatalog
    #Nodes 5196
    #Edges 171743
    #Classes 6
    #Ave_degree 66.11
    ----Split statistics------'
    #Train samples 259 (5.0 % of nodes)
    #Val samples 779 (15.0 % of nodes)
    #Test samples 4158 (remaining)
    ----label noise information:------
    Instance dependent noise
    #Actual noise rate 0.40
    [cuda:1] LNPCC waiting for GPU slot...
    [cuda:1] Slot acquired (waited 49.1s). Starting GCN...
    FINAL_RESULT: {'acc': {'train': 0.5116279069767442, 'valid': 0.4582798459563543, 'test': 0.6962481962481962}, 'wall_s': 31.59, 'cpu_s': 28.38, 'gpu_s': 3.1, 'wait_s': 49.13}
    [Time] wall=31.6s | cpu=28.4s | gpu=3.1s
    C:\Users\fbrev\Documents\Acadêmico\Simulações\Python\NoisyGL\predictor\Base_Predictor.py:114: UserWarning: expandable_segments not supported on this platform (Triggered internally at ..\c10/cuda/CUDAAllocatorConfig.h:28.)
    self.edge_index = self._cpu_edge_index.to(self.device)
    C:\Users\fbrev\Documents\Acadêmico\Simulações\Python\NoisyGL\predictor\Base_Predictor.py:144: UserWarning: Sparse CSR tensor support is in beta state. If you miss a functionality in the sparse tensor support, please submit a feature request to https://github.com/pytorch/pytorch/issues. (Triggered internally at ..\aten\src\ATen\SparseCsrTensorImpl.cpp:55.)
    self.adj_csr = self.adj.to_sparse_csr().to(self.device)
[I 2026-05-03 22:15:11,591] Trial 28 finished with value: 0.6962481962481962 and parameters: {'lr': 0.005, 'weight_decay': 0.001, 'n_hidden': 64, 'n_layer': 2, 'dropout': 0.5447488440477569, 'knn_mode': 'd', 'k': 39, 'dexp': 6.511286547217286, 'p_grd': 0.7815764668241777, 'unc_rem': 0.2103475305889525, 'unc_rel': 0.15447065806389193}. Best is trial 23 with value: 0.7061087061087061.
    [CPU] Loading blogcatalog...
    DEBUG 3.1: Dataset init start
    DEBUG 3.2: prepare_data start blogcatalog
    ----Data statistics------'
    Name: blogcatalog
    #Nodes 5196
    #Edges 171743
    #Classes 6
    #Ave_degree 66.11
    ----Split statistics------'
    #Train samples 259 (5.0 % of nodes)
    #Val samples 779 (15.0 % of nodes)
    #Test samples 4158 (remaining)
    ----label noise information:------
    Instance dependent noise
    #Actual noise rate 0.40
    [cuda:1] LNPCC waiting for GPU slot...
    [cuda:1] Slot acquired (waited 187.7s). Starting GCN...
    FINAL_RESULT: {'acc': {'train': 0.4362934362934363, 'valid': 0.4544287548138639, 'test': 0.6972101972101972}, 'wall_s': 36.85, 'cpu_s': 29.37, 'gpu_s': 7.4, 'wait_s': 187.72}
    [Time] wall=36.8s | cpu=29.4s | gpu=7.4s
    C:\Users\fbrev\Documents\Acadêmico\Simulações\Python\NoisyGL\predictor\Base_Predictor.py:114: UserWarning: expandable_segments not supported on this platform (Triggered internally at ..\c10/cuda/CUDAAllocatorConfig.h:28.)
    self.edge_index = self._cpu_edge_index.to(self.device)
    C:\Users\fbrev\Documents\Acadêmico\Simulações\Python\NoisyGL\predictor\Base_Predictor.py:144: UserWarning: Sparse CSR tensor support is in beta state. If you miss a functionality in the sparse tensor support, please submit a feature request to https://github.com/pytorch/pytorch/issues. (Triggered internally at ..\aten\src\ATen\SparseCsrTensorImpl.cpp:55.)
    self.adj_csr = self.adj.to_sparse_csr().to(self.device)
[I 2026-05-03 22:19:01,129] Trial 29 finished with value: 0.6972101972101972 and parameters: {'lr': 0.01, 'weight_decay': 0.001, 'n_hidden': 256, 'n_layer': 2, 'dropout': 0.3990928436814985, 'knn_mode': 'd', 'k': 46, 'dexp': 7.416241841338912, 'p_grd': 0.6898648885367047, 'unc_rem': 0.4097102115372092, 'unc_rel': 0.05822517876383865}. Best is trial 23 with value: 0.7061087061087061.
    [CPU] Loading blogcatalog...
    DEBUG 3.1: Dataset init start
    DEBUG 3.2: prepare_data start blogcatalog
    ----Data statistics------'
    Name: blogcatalog
    #Nodes 5196
    #Edges 171743
    #Classes 6
    #Ave_degree 66.11
    ----Split statistics------'
    #Train samples 259 (5.0 % of nodes)
    #Val samples 779 (15.0 % of nodes)
    #Test samples 4158 (remaining)
    ----label noise information:------
    Instance dependent noise
    #Actual noise rate 0.40
    [cuda:1] LNPCC waiting for GPU slot...
    [cuda:1] Slot acquired (waited 990.2s). Starting GCN...
    FINAL_RESULT: {'acc': {'train': 0.5116279069767442, 'valid': 0.4595635430038511, 'test': 0.6952861952861953}, 'wall_s': 44.07, 'cpu_s': 36.82, 'gpu_s': 7.16, 'wait_s': 990.21}
    [Time] wall=44.1s | cpu=36.8s | gpu=7.2s
    C:\Users\fbrev\Documents\Acadêmico\Simulações\Python\NoisyGL\predictor\Base_Predictor.py:114: UserWarning: expandable_segments not supported on this platform (Triggered internally at ..\c10/cuda/CUDAAllocatorConfig.h:28.)
    self.edge_index = self._cpu_edge_index.to(self.device)
    C:\Users\fbrev\Documents\Acadêmico\Simulações\Python\NoisyGL\predictor\Base_Predictor.py:144: UserWarning: Sparse CSR tensor support is in beta state. If you miss a functionality in the sparse tensor support, please submit a feature request to https://github.com/pytorch/pytorch/issues. (Triggered internally at ..\aten\src\ATen\SparseCsrTensorImpl.cpp:55.)
    self.adj_csr = self.adj.to_sparse_csr().to(self.device)
[I 2026-05-03 22:36:20,467] Trial 30 finished with value: 0.6952861952861953 and parameters: {'lr': 0.01, 'weight_decay': 0.001, 'n_hidden': 256, 'n_layer': 2, 'dropout': 0.2963836239698793, 'knn_mode': 'd', 'k': 34, 'dexp': 5.0047803017543355, 'p_grd': 0.8943848810811871, 'unc_rem': 0.47192177125249674, 'unc_rel': 0.5514169432782525}. Best is trial 23 with value: 0.7061087061087061.
    [CPU] Loading blogcatalog...
    DEBUG 3.1: Dataset init start
    DEBUG 3.2: prepare_data start blogcatalog
    ----Data statistics------'
    Name: blogcatalog
    #Nodes 5196
    #Edges 171743
    #Classes 6
    #Ave_degree 66.11
    ----Split statistics------'
    #Train samples 259 (5.0 % of nodes)
    #Val samples 779 (15.0 % of nodes)
    #Test samples 4158 (remaining)
    ----label noise information:------
    Instance dependent noise
    #Actual noise rate 0.40
    [cuda:1] LNPCC waiting for GPU slot...
    [cuda:1] Slot acquired (waited 75.7s). Starting GCN...
    FINAL_RESULT: {'acc': {'train': 0.5675675675675675, 'valid': 0.46084724005134786, 'test': 0.6880711880711881}, 'wall_s': 34.48, 'cpu_s': 30.95, 'gpu_s': 3.41, 'wait_s': 75.71}
    [Time] wall=34.5s | cpu=31.0s | gpu=3.4s
    C:\Users\fbrev\Documents\Acadêmico\Simulações\Python\NoisyGL\predictor\Base_Predictor.py:114: UserWarning: expandable_segments not supported on this platform (Triggered internally at ..\c10/cuda/CUDAAllocatorConfig.h:28.)
    self.edge_index = self._cpu_edge_index.to(self.device)
    C:\Users\fbrev\Documents\Acadêmico\Simulações\Python\NoisyGL\predictor\Base_Predictor.py:144: UserWarning: Sparse CSR tensor support is in beta state. If you miss a functionality in the sparse tensor support, please submit a feature request to https://github.com/pytorch/pytorch/issues. (Triggered internally at ..\aten\src\ATen\SparseCsrTensorImpl.cpp:55.)
    self.adj_csr = self.adj.to_sparse_csr().to(self.device)
[I 2026-05-03 22:38:16,491] Trial 31 finished with value: 0.6880711880711881 and parameters: {'lr': 0.005, 'weight_decay': 0.001, 'n_hidden': 64, 'n_layer': 2, 'dropout': 0.6372329827910617, 'knn_mode': 'd', 'k': 42, 'dexp': 7.523810603408595, 'p_grd': 0.6081200105420246, 'unc_rem': 0.17247752906569946, 'unc_rel': 0.31329827524335363}. Best is trial 23 with value: 0.7061087061087061.
    [CPU] Loading blogcatalog...
    DEBUG 3.1: Dataset init start
    DEBUG 3.2: prepare_data start blogcatalog
    ----Data statistics------'
    Name: blogcatalog
    #Nodes 5196
    #Edges 171743
    #Classes 6
    #Ave_degree 66.11
    ----Split statistics------'
    #Train samples 259 (5.0 % of nodes)
    #Val samples 779 (15.0 % of nodes)
    #Test samples 4158 (remaining)
    ----label noise information:------
    Instance dependent noise
    #Actual noise rate 0.40
    [cuda:1] LNPCC waiting for GPU slot...
    [cuda:1] Slot acquired (waited 22.5s). Starting GCN...
    FINAL_RESULT: {'acc': {'train': 0.562015503875969, 'valid': 0.4595635430038511, 'test': 0.7029822029822029}, 'wall_s': 30.06, 'cpu_s': 26.88, 'gpu_s': 3.09, 'wait_s': 22.5}
    [Time] wall=30.1s | cpu=26.9s | gpu=3.1s
    C:\Users\fbrev\Documents\Acadêmico\Simulações\Python\NoisyGL\predictor\Base_Predictor.py:114: UserWarning: expandable_segments not supported on this platform (Triggered internally at ..\c10/cuda/CUDAAllocatorConfig.h:28.)
    self.edge_index = self._cpu_edge_index.to(self.device)
    C:\Users\fbrev\Documents\Acadêmico\Simulações\Python\NoisyGL\predictor\Base_Predictor.py:144: UserWarning: Sparse CSR tensor support is in beta state. If you miss a functionality in the sparse tensor support, please submit a feature request to https://github.com/pytorch/pytorch/issues. (Triggered internally at ..\aten\src\ATen\SparseCsrTensorImpl.cpp:55.)
    self.adj_csr = self.adj.to_sparse_csr().to(self.device)
