[I 2026-05-03 21:58:43,169] Trial 32 finished with value: 0.6572871572871573 and parameters: {'lr': 0.01, 'weight_decay': 0.001, 'n_hidden': 128, 'n_layer': 2, 'dropout': 0.29453485038394217, 'knn_mode': 'd', 'k': 28, 'dexp': 9.191226663008736, 'p_grd': 0.10592363496683396, 'unc_rem': 0.09016563270950877, 'unc_rel': 0.07663748645843865}. Best is trial 31 with value: 0.6801346801346801.
    [CPU] Loading blogcatalog...
    DEBUG 3.1: Dataset init start
    DEBUG 3.2: prepare_data start blogcatalog
    ----Data statistics------'
    Name: blogcatalog
    #Nodes 5196
    #Edges 171743
    #Classes 6
    #Ave_degree 66.11
    ----Split statistics------'
    #Train samples 259 (5.0 % of nodes)
    #Val samples 779 (15.0 % of nodes)
    #Test samples 4158 (remaining)
    ----label noise information:------
    Instance dependent noise
    #Actual noise rate 0.50
    [cuda:0] LNPCC waiting for GPU slot...
    [cuda:0] Slot acquired (waited 0.9s). Starting GCN...
    FINAL_RESULT: {'acc': {'train': 0.5330188679245284, 'valid': 0.38254172015404364, 'test': 0.6731601731601732}, 'wall_s': 21.21, 'cpu_s': 17.41, 'gpu_s': 3.73, 'wait_s': 0.86}
    [Time] wall=21.2s | cpu=17.4s | gpu=3.7s
    C:\Users\fbrev\Documents\Acadêmico\Simulações\Python\NoisyGL\predictor\Base_Predictor.py:114: UserWarning: expandable_segments not supported on this platform (Triggered internally at ..\c10/cuda/CUDAAllocatorConfig.h:28.)
    self.edge_index = self._cpu_edge_index.to(self.device)
    C:\Users\fbrev\Documents\Acadêmico\Simulações\Python\NoisyGL\predictor\Base_Predictor.py:144: UserWarning: Sparse CSR tensor support is in beta state. If you miss a functionality in the sparse tensor support, please submit a feature request to https://github.com/pytorch/pytorch/issues. (Triggered internally at ..\aten\src\ATen\SparseCsrTensorImpl.cpp:55.)
    self.adj_csr = self.adj.to_sparse_csr().to(self.device)
[I 2026-05-03 21:59:09,898] Trial 33 finished with value: 0.6731601731601732 and parameters: {'lr': 0.01, 'weight_decay': 0.001, 'n_hidden': 128, 'n_layer': 2, 'dropout': 0.2779241836794235, 'knn_mode': 'd', 'k': 29, 'dexp': 9.132068812640105, 'p_grd': 0.07504949348382944, 'unc_rem': 0.34935393513306934, 'unc_rel': 0.07891806352638311}. Best is trial 31 with value: 0.6801346801346801.
    [CPU] Loading blogcatalog...
    DEBUG 3.1: Dataset init start
    DEBUG 3.2: prepare_data start blogcatalog
    ----Data statistics------'
    Name: blogcatalog
    #Nodes 5196
    #Edges 171743
    #Classes 6
    #Ave_degree 66.11
    ----Split statistics------'
    #Train samples 259 (5.0 % of nodes)
    #Val samples 779 (15.0 % of nodes)
    #Test samples 4158 (remaining)
    ----label noise information:------
    Instance dependent noise
    #Actual noise rate 0.50
    [cuda:0] LNPCC waiting for GPU slot...
    [cuda:0] Slot acquired (waited 0.0s). Starting GCN...
    FINAL_RESULT: {'acc': {'train': 0.6051282051282051, 'valid': 0.36585365853658536, 'test': 0.5723905723905723}, 'wall_s': 20.81, 'cpu_s': 16.99, 'gpu_s': 3.74, 'wait_s': 0.0}
    [Time] wall=20.8s | cpu=17.0s | gpu=3.7s
    C:\Users\fbrev\Documents\Acadêmico\Simulações\Python\NoisyGL\predictor\Base_Predictor.py:114: UserWarning: expandable_segments not supported on this platform (Triggered internally at ..\c10/cuda/CUDAAllocatorConfig.h:28.)
    self.edge_index = self._cpu_edge_index.to(self.device)
    C:\Users\fbrev\Documents\Acadêmico\Simulações\Python\NoisyGL\predictor\Base_Predictor.py:144: UserWarning: Sparse CSR tensor support is in beta state. If you miss a functionality in the sparse tensor support, please submit a feature request to https://github.com/pytorch/pytorch/issues. (Triggered internally at ..\aten\src\ATen\SparseCsrTensorImpl.cpp:55.)
    self.adj_csr = self.adj.to_sparse_csr().to(self.device)
[I 2026-05-03 21:59:35,657] Trial 34 finished with value: 0.5723905723905723 and parameters: {'lr': 0.01, 'weight_decay': 0.001, 'n_hidden': 128, 'n_layer': 2, 'dropout': 0.2628882192849818, 'knn_mode': 'd', 'k': 29, 'dexp': 7.676123048850996, 'p_grd': 0.07927590634398034, 'unc_rem': 0.35809637798651206, 'unc_rel': 0.06782883455094554}. Best is trial 31 with value: 0.6801346801346801.
    [CPU] Loading blogcatalog...
    DEBUG 3.1: Dataset init start
    DEBUG 3.2: prepare_data start blogcatalog
    ----Data statistics------'
    Name: blogcatalog
    #Nodes 5196
    #Edges 171743
    #Classes 6
    #Ave_degree 66.11
    ----Split statistics------'
    #Train samples 259 (5.0 % of nodes)
    #Val samples 779 (15.0 % of nodes)
    #Test samples 4158 (remaining)
    ----label noise information:------
    Instance dependent noise
    #Actual noise rate 0.50
    [cuda:0] LNPCC waiting for GPU slot...
    [cuda:0] Slot acquired (waited 4.9s). Starting GCN...
    FINAL_RESULT: {'acc': {'train': 0.4549019607843137, 'valid': 0.37098844672657255, 'test': 0.6298701298701299}, 'wall_s': 22.56, 'cpu_s': 18.71, 'gpu_s': 3.78, 'wait_s': 4.91}
    [Time] wall=22.6s | cpu=18.7s | gpu=3.8s
    C:\Users\fbrev\Documents\Acadêmico\Simulações\Python\NoisyGL\predictor\Base_Predictor.py:114: UserWarning: expandable_segments not supported on this platform (Triggered internally at ..\c10/cuda/CUDAAllocatorConfig.h:28.)
    self.edge_index = self._cpu_edge_index.to(self.device)
    C:\Users\fbrev\Documents\Acadêmico\Simulações\Python\NoisyGL\predictor\Base_Predictor.py:144: UserWarning: Sparse CSR tensor support is in beta state. If you miss a functionality in the sparse tensor support, please submit a feature request to https://github.com/pytorch/pytorch/issues. (Triggered internally at ..\aten\src\ATen\SparseCsrTensorImpl.cpp:55.)
    self.adj_csr = self.adj.to_sparse_csr().to(self.device)
[I 2026-05-03 22:00:07,950] Trial 35 finished with value: 0.6298701298701299 and parameters: {'lr': 0.01, 'weight_decay': 0.001, 'n_hidden': 128, 'n_layer': 2, 'dropout': 0.2397373522747402, 'knn_mode': 'd', 'k': 35, 'dexp': 9.800544436150387, 'p_grd': 0.1806609138450604, 'unc_rem': 0.0722603783628147, 'unc_rel': 0.1579279428049376}. Best is trial 31 with value: 0.6801346801346801.
    [CPU] Loading blogcatalog...
    DEBUG 3.1: Dataset init start
    DEBUG 3.2: prepare_data start blogcatalog
    ----Data statistics------'
    Name: blogcatalog
    #Nodes 5196
    #Edges 171743
    #Classes 6
    #Ave_degree 66.11
    ----Split statistics------'
    #Train samples 259 (5.0 % of nodes)
    #Val samples 779 (15.0 % of nodes)
    #Test samples 4158 (remaining)
    ----label noise information:------
    Instance dependent noise
    #Actual noise rate 0.50
    [cuda:0] LNPCC waiting for GPU slot...
    [cuda:0] Slot acquired (waited 0.0s). Starting GCN...
    FINAL_RESULT: {'acc': {'train': 0.841726618705036, 'valid': 0.3324775353016688, 'test': 0.5437710437710438}, 'wall_s': 20.66, 'cpu_s': 16.77, 'gpu_s': 3.82, 'wait_s': 0.0}
    [Time] wall=20.7s | cpu=16.8s | gpu=3.8s
    C:\Users\fbrev\Documents\Acadêmico\Simulações\Python\NoisyGL\predictor\Base_Predictor.py:114: UserWarning: expandable_segments not supported on this platform (Triggered internally at ..\c10/cuda/CUDAAllocatorConfig.h:28.)
    self.edge_index = self._cpu_edge_index.to(self.device)
    C:\Users\fbrev\Documents\Acadêmico\Simulações\Python\NoisyGL\predictor\Base_Predictor.py:144: UserWarning: Sparse CSR tensor support is in beta state. If you miss a functionality in the sparse tensor support, please submit a feature request to https://github.com/pytorch/pytorch/issues. (Triggered internally at ..\aten\src\ATen\SparseCsrTensorImpl.cpp:55.)
    self.adj_csr = self.adj.to_sparse_csr().to(self.device)
[I 2026-05-03 22:00:33,505] Trial 36 finished with value: 0.5437710437710438 and parameters: {'lr': 0.01, 'weight_decay': 0.001, 'n_hidden': 128, 'n_layer': 2, 'dropout': 0.1439904778637907, 'knn_mode': 'd', 'k': 26, 'dexp': 9.04546109443591, 'p_grd': 0.05180024411913962, 'unc_rem': 0.177417787127854, 'unc_rel': 0.06204798593891903}. Best is trial 31 with value: 0.6801346801346801.
    [CPU] Loading blogcatalog...
    DEBUG 3.1: Dataset init start
    DEBUG 3.2: prepare_data start blogcatalog
    ----Data statistics------'
    Name: blogcatalog
    #Nodes 5196
    #Edges 171743
    #Classes 6
    #Ave_degree 66.11
    ----Split statistics------'
    #Train samples 259 (5.0 % of nodes)
    #Val samples 779 (15.0 % of nodes)
    #Test samples 4158 (remaining)
    ----label noise information:------
    Instance dependent noise
    #Actual noise rate 0.50
    [cuda:0] LNPCC waiting for GPU slot...
    [cuda:0] Slot acquired (waited 1.1s). Starting GCN...
    FINAL_RESULT: {'acc': {'train': 0.21621621621621623, 'valid': 0.2593068035943517, 'test': 0.3590668590668591}, 'wall_s': 24.51, 'cpu_s': 20.58, 'gpu_s': 3.86, 'wait_s': 1.06}
    [Time] wall=24.5s | cpu=20.6s | gpu=3.9s
    C:\Users\fbrev\Documents\Acadêmico\Simulações\Python\NoisyGL\predictor\Base_Predictor.py:114: UserWarning: expandable_segments not supported on this platform (Triggered internally at ..\c10/cuda/CUDAAllocatorConfig.h:28.)
    self.edge_index = self._cpu_edge_index.to(self.device)
    C:\Users\fbrev\Documents\Acadêmico\Simulações\Python\NoisyGL\predictor\Base_Predictor.py:144: UserWarning: Sparse CSR tensor support is in beta state. If you miss a functionality in the sparse tensor support, please submit a feature request to https://github.com/pytorch/pytorch/issues. (Triggered internally at ..\aten\src\ATen\SparseCsrTensorImpl.cpp:55.)
    self.adj_csr = self.adj.to_sparse_csr().to(self.device)
[I 2026-05-03 22:01:03,884] Trial 37 finished with value: 0.3590668590668591 and parameters: {'lr': 0.01, 'weight_decay': 0.05, 'n_hidden': 128, 'n_layer': 2, 'dropout': 0.3819952525634881, 'knn_mode': 'd', 'k': 31, 'dexp': 8.683445565162724, 'p_grd': 0.29178672173657616, 'unc_rem': 0.22748007375680832, 'unc_rel': 0.13744582432002037}. Best is trial 31 with value: 0.6801346801346801.
    [CPU] Loading blogcatalog...
    DEBUG 3.1: Dataset init start
    DEBUG 3.2: prepare_data start blogcatalog
    ----Data statistics------'
    Name: blogcatalog
    #Nodes 5196
    #Edges 171743
    #Classes 6
    #Ave_degree 66.11
    ----Split statistics------'
    #Train samples 259 (5.0 % of nodes)
    #Val samples 779 (15.0 % of nodes)
    #Test samples 4158 (remaining)
    ----label noise information:------
    Instance dependent noise
    #Actual noise rate 0.50
    [cuda:0] LNPCC waiting for GPU slot...
    [cuda:0] Slot acquired (waited 0.8s). Starting GCN...
    FINAL_RESULT: {'acc': {'train': 0.9487179487179487, 'valid': 0.2490372272143774, 'test': 0.2566137566137566}, 'wall_s': 17.92, 'cpu_s': 14.18, 'gpu_s': 3.67, 'wait_s': 0.81}
    [Time] wall=17.9s | cpu=14.2s | gpu=3.7s
    C:\Users\fbrev\Documents\Acadêmico\Simulações\Python\NoisyGL\predictor\Base_Predictor.py:114: UserWarning: expandable_segments not supported on this platform (Triggered internally at ..\c10/cuda/CUDAAllocatorConfig.h:28.)
    self.edge_index = self._cpu_edge_index.to(self.device)
    C:\Users\fbrev\Documents\Acadêmico\Simulações\Python\NoisyGL\predictor\Base_Predictor.py:144: UserWarning: Sparse CSR tensor support is in beta state. If you miss a functionality in the sparse tensor support, please submit a feature request to https://github.com/pytorch/pytorch/issues. (Triggered internally at ..\aten\src\ATen\SparseCsrTensorImpl.cpp:55.)
    self.adj_csr = self.adj.to_sparse_csr().to(self.device)
[I 2026-05-03 22:01:27,446] Trial 38 finished with value: 0.2566137566137566 and parameters: {'lr': 0.01, 'weight_decay': 0.001, 'n_hidden': 128, 'n_layer': 2, 'dropout': 0.09015853856688136, 'knn_mode': 'd', 'k': 26, 'dexp': 9.903705099546858, 'p_grd': 0.007233952295542759, 'unc_rem': 0.096526089125331, 'unc_rel': 0.02825013970518006}. Best is trial 31 with value: 0.6801346801346801.
    [CPU] Loading blogcatalog...
    DEBUG 3.1: Dataset init start
    DEBUG 3.2: prepare_data start blogcatalog
    ----Data statistics------'
    Name: blogcatalog
    #Nodes 5196
    #Edges 171743
    #Classes 6
    #Ave_degree 66.11
    ----Split statistics------'
    #Train samples 259 (5.0 % of nodes)
    #Val samples 779 (15.0 % of nodes)
    #Test samples 4158 (remaining)
    ----label noise information:------
    Instance dependent noise
    #Actual noise rate 0.50
    [cuda:0] LNPCC waiting for GPU slot...
    [cuda:0] Slot acquired (waited 0.0s). Starting GCN...
    FINAL_RESULT: {'acc': {'train': 0.6105769230769231, 'valid': 0.3645699614890886, 'test': 0.6313131313131313}, 'wall_s': 23.13, 'cpu_s': 20.96, 'gpu_s': 2.1, 'wait_s': 0.0}
    [Time] wall=23.1s | cpu=21.0s | gpu=2.1s
    C:\Users\fbrev\Documents\Acadêmico\Simulações\Python\NoisyGL\predictor\Base_Predictor.py:114: UserWarning: expandable_segments not supported on this platform (Triggered internally at ..\c10/cuda/CUDAAllocatorConfig.h:28.)
    self.edge_index = self._cpu_edge_index.to(self.device)
    C:\Users\fbrev\Documents\Acadêmico\Simulações\Python\NoisyGL\predictor\Base_Predictor.py:144: UserWarning: Sparse CSR tensor support is in beta state. If you miss a functionality in the sparse tensor support, please submit a feature request to https://github.com/pytorch/pytorch/issues. (Triggered internally at ..\aten\src\ATen\SparseCsrTensorImpl.cpp:55.)
    self.adj_csr = self.adj.to_sparse_csr().to(self.device)
[I 2026-05-03 22:01:55,378] Trial 39 finished with value: 0.6313131313131313 and parameters: {'lr': 0.05, 'weight_decay': 0.001, 'n_hidden': 32, 'n_layer': 2, 'dropout': 0.3376772571869122, 'knn_mode': 'd', 'k': 39, 'dexp': 6.724049604377254, 'p_grd': 0.0866227013638016, 'unc_rem': 0.3482552974266774, 'unc_rel': 0.19946077289222422}. Best is trial 31 with value: 0.6801346801346801.
    [CPU] Loading blogcatalog...
    DEBUG 3.1: Dataset init start
    DEBUG 3.2: prepare_data start blogcatalog
    ----Data statistics------'
    Name: blogcatalog
    #Nodes 5196
    #Edges 171743
    #Classes 6
    #Ave_degree 66.11
    ----Split statistics------'
    #Train samples 259 (5.0 % of nodes)
    #Val samples 779 (15.0 % of nodes)
    #Test samples 4158 (remaining)
    ----label noise information:------
    Instance dependent noise
    #Actual noise rate 0.50
    [cuda:0] LNPCC waiting for GPU slot...
    [cuda:0] Slot acquired (waited 2.4s). Starting GCN...
    FINAL_RESULT: {'acc': {'train': 0.49034749034749037, 'valid': 0.362002567394095, 'test': 0.5952380952380952}, 'wall_s': 27.75, 'cpu_s': 24.05, 'gpu_s': 3.64, 'wait_s': 2.43}
    [Time] wall=27.8s | cpu=24.0s | gpu=3.6s
    C:\Users\fbrev\Documents\Acadêmico\Simulações\Python\NoisyGL\predictor\Base_Predictor.py:114: UserWarning: expandable_segments not supported on this platform (Triggered internally at ..\c10/cuda/CUDAAllocatorConfig.h:28.)
    self.edge_index = self._cpu_edge_index.to(self.device)
    C:\Users\fbrev\Documents\Acadêmico\Simulações\Python\NoisyGL\predictor\Base_Predictor.py:144: UserWarning: Sparse CSR tensor support is in beta state. If you miss a functionality in the sparse tensor support, please submit a feature request to https://github.com/pytorch/pytorch/issues. (Triggered internally at ..\aten\src\ATen\SparseCsrTensorImpl.cpp:55.)
    self.adj_csr = self.adj.to_sparse_csr().to(self.device)
[I 2026-05-03 22:02:30,278] Trial 40 finished with value: 0.5952380952380952 and parameters: {'lr': 0.01, 'weight_decay': 0.0, 'n_hidden': 128, 'n_layer': 2, 'dropout': 0.31121359905724566, 'knn_mode': 'd', 'k': 35, 'dexp': 7.7022840647046795, 'p_grd': 0.3679760475320669, 'unc_rem': 0.13713857085150133, 'unc_rel': 0.10271025131544262}. Best is trial 31 with value: 0.6801346801346801.
    [CPU] Loading blogcatalog...
    DEBUG 3.1: Dataset init start
    DEBUG 3.2: prepare_data start blogcatalog
    ----Data statistics------'
    Name: blogcatalog
    #Nodes 5196
    #Edges 171743
    #Classes 6
    #Ave_degree 66.11
    ----Split statistics------'
    #Train samples 259 (5.0 % of nodes)
    #Val samples 779 (15.0 % of nodes)
    #Test samples 4158 (remaining)
    ----label noise information:------
    Instance dependent noise
    #Actual noise rate 0.50
    [cuda:0] LNPCC waiting for GPU slot...
    [cuda:0] Slot acquired (waited 3.2s). Starting GCN...
    FINAL_RESULT: {'acc': {'train': 0.44921875, 'valid': 0.38767650834403083, 'test': 0.6553631553631554}, 'wall_s': 28.28, 'cpu_s': 21.98, 'gpu_s': 6.23, 'wait_s': 3.2}
    [Time] wall=28.3s | cpu=22.0s | gpu=6.2s
    C:\Users\fbrev\Documents\Acadêmico\Simulações\Python\NoisyGL\predictor\Base_Predictor.py:114: UserWarning: expandable_segments not supported on this platform (Triggered internally at ..\c10/cuda/CUDAAllocatorConfig.h:28.)
    self.edge_index = self._cpu_edge_index.to(self.device)
    C:\Users\fbrev\Documents\Acadêmico\Simulações\Python\NoisyGL\predictor\Base_Predictor.py:144: UserWarning: Sparse CSR tensor support is in beta state. If you miss a functionality in the sparse tensor support, please submit a feature request to https://github.com/pytorch/pytorch/issues. (Triggered internally at ..\aten\src\ATen\SparseCsrTensorImpl.cpp:55.)
    self.adj_csr = self.adj.to_sparse_csr().to(self.device)
[I 2026-05-03 22:03:06,597] Trial 41 finished with value: 0.6553631553631554 and parameters: {'lr': 0.01, 'weight_decay': 0.001, 'n_hidden': 256, 'n_layer': 2, 'dropout': 0.19811400093513956, 'knn_mode': 'd', 'k': 41, 'dexp': 8.625689720549744, 'p_grd': 0.18079635736741537, 'unc_rem': 0.07180017830414581, 'unc_rel': 0.06026704354231527}. Best is trial 31 with value: 0.6801346801346801.
    [CPU] Loading blogcatalog...
    DEBUG 3.1: Dataset init start
    DEBUG 3.2: prepare_data start blogcatalog
    ----Data statistics------'
    Name: blogcatalog
    #Nodes 5196
    #Edges 171743
    #Classes 6
    #Ave_degree 66.11
    ----Split statistics------'
    #Train samples 259 (5.0 % of nodes)
    #Val samples 779 (15.0 % of nodes)
    #Test samples 4158 (remaining)
    ----label noise information:------
    Instance dependent noise
    #Actual noise rate 0.50
    [cuda:0] LNPCC waiting for GPU slot...
    [cuda:0] Slot acquired (waited 3.6s). Starting GCN...
    FINAL_RESULT: {'acc': {'train': 0.5, 'valid': 0.3761232349165597, 'test': 0.6108706108706109}, 'wall_s': 26.67, 'cpu_s': 22.89, 'gpu_s': 3.7, 'wait_s': 3.65}
    [Time] wall=26.7s | cpu=22.9s | gpu=3.7s
    C:\Users\fbrev\Documents\Acadêmico\Simulações\Python\NoisyGL\predictor\Base_Predictor.py:114: UserWarning: expandable_segments not supported on this platform (Triggered internally at ..\c10/cuda/CUDAAllocatorConfig.h:28.)
    self.edge_index = self._cpu_edge_index.to(self.device)
    C:\Users\fbrev\Documents\Acadêmico\Simulações\Python\NoisyGL\predictor\Base_Predictor.py:144: UserWarning: Sparse CSR tensor support is in beta state. If you miss a functionality in the sparse tensor support, please submit a feature request to https://github.com/pytorch/pytorch/issues. (Triggered internally at ..\aten\src\ATen\SparseCsrTensorImpl.cpp:55.)
    self.adj_csr = self.adj.to_sparse_csr().to(self.device)
[I 2026-05-03 22:03:42,078] Trial 42 finished with value: 0.6108706108706109 and parameters: {'lr': 0.01, 'weight_decay': 0.001, 'n_hidden': 128, 'n_layer': 2, 'dropout': 0.2164977420782273, 'knn_mode': 'd', 'k': 41, 'dexp': 8.946334369491293, 'p_grd': 0.18921616147441012, 'unc_rem': 0.06926193627119528, 'unc_rel': 0.07027569616271956}. Best is trial 31 with value: 0.6801346801346801.
    [CPU] Loading blogcatalog...
    DEBUG 3.1: Dataset init start
    DEBUG 3.2: prepare_data start blogcatalog
    ----Data statistics------'
    Name: blogcatalog
    #Nodes 5196
    #Edges 171743
    #Classes 6
    #Ave_degree 66.11
    ----Split statistics------'
    #Train samples 259 (5.0 % of nodes)
    #Val samples 779 (15.0 % of nodes)
    #Test samples 4158 (remaining)
    ----label noise information:------
    Instance dependent noise
    #Actual noise rate 0.50
    [cuda:0] LNPCC waiting for GPU slot...
    [cuda:0] Slot acquired (waited 0.0s). Starting GCN...
    FINAL_RESULT: {'acc': {'train': 0.444015444015444, 'valid': 0.3722721437740693, 'test': 0.6731601731601732}, 'wall_s': 29.19, 'cpu_s': 23.08, 'gpu_s': 6.04, 'wait_s': 0.0}
    [Time] wall=29.2s | cpu=23.1s | gpu=6.0s
    C:\Users\fbrev\Documents\Acadêmico\Simulações\Python\NoisyGL\predictor\Base_Predictor.py:114: UserWarning: expandable_segments not supported on this platform (Triggered internally at ..\c10/cuda/CUDAAllocatorConfig.h:28.)
    self.edge_index = self._cpu_edge_index.to(self.device)
    C:\Users\fbrev\Documents\Acadêmico\Simulações\Python\NoisyGL\predictor\Base_Predictor.py:144: UserWarning: Sparse CSR tensor support is in beta state. If you miss a functionality in the sparse tensor support, please submit a feature request to https://github.com/pytorch/pytorch/issues. (Triggered internally at ..\aten\src\ATen\SparseCsrTensorImpl.cpp:55.)
    self.adj_csr = self.adj.to_sparse_csr().to(self.device)
