[I 2026-05-08 03:32:22,851] Trial 35 finished with value: 0.702 and parameters: {'lr': 0.005, 'weight_decay': 0.0001, 'n_hidden': 32, 'n_layer': 3, 'dropout': 0.44834409636057543, 'knn_mode': 's', 'k': 39, 'dexp': 3.0182273390571916, 'p_grd': 0.7606857257845444, 'unc_rem': 0.0555033400145494, 'unc_rel': 0.1590264318598461}. Best is trial 33 with value: 0.76.
    [CPU] Loading cora...
    DEBUG 3.1: Dataset init start
    DEBUG 3.2: prepare_data start cora
    ----Data statistics------'
    Name: cora
    #Nodes 2708
    #Edges 5278
    #Classes 7
    #Ave_degree 3.90
    ----Split statistics------'
    #Train samples 140 (default)
    #Val samples 500 (default)
    #Test samples 1000 (default)
    ----label noise information:------
    Instance dependent noise
    #Actual noise rate 0.41
    [cuda:1] LNPCC waiting for GPU slot...
    [cuda:1] Slot acquired (waited 0.9s). Starting GCN...
    FINAL_RESULT: {'acc': {'train': 0.7857142857142857, 'valid': 0.462, 'test': 0.744}, 'wall_s': 10.92, 'cpu_s': 8.15, 'gpu_s': 2.71, 'wait_s': 0.86}
    [Time] wall=10.9s | cpu=8.1s | gpu=2.7s
    C:\Users\fbrev\Documents\Acadêmico\Simulações\Python\NoisyGL\predictor\Base_Predictor.py:114: UserWarning: expandable_segments not supported on this platform (Triggered internally at ..\c10/cuda/CUDAAllocatorConfig.h:28.)
    self.edge_index = self._cpu_edge_index.to(self.device)
    C:\Users\fbrev\Documents\Acadêmico\Simulações\Python\NoisyGL\predictor\Base_Predictor.py:144: UserWarning: Sparse CSR tensor support is in beta state. If you miss a functionality in the sparse tensor support, please submit a feature request to https://github.com/pytorch/pytorch/issues. (Triggered internally at ..\aten\src\ATen\SparseCsrTensorImpl.cpp:55.)
    self.adj_csr = self.adj.to_sparse_csr().to(self.device)
[I 2026-05-08 03:32:40,789] Trial 36 finished with value: 0.744 and parameters: {'lr': 0.005, 'weight_decay': 0.0001, 'n_hidden': 256, 'n_layer': 3, 'dropout': 0.26123447004132205, 'knn_mode': 's', 'k': 43, 'dexp': 4.247022971537446, 'p_grd': 0.6962695306436503, 'unc_rem': 0.22563766634979518, 'unc_rel': 0.9204967011286804}. Best is trial 33 with value: 0.76.
    [CPU] Loading cora...
    DEBUG 3.1: Dataset init start
    DEBUG 3.2: prepare_data start cora
    ----Data statistics------'
    Name: cora
    #Nodes 2708
    #Edges 5278
    #Classes 7
    #Ave_degree 3.90
    ----Split statistics------'
    #Train samples 140 (default)
    #Val samples 500 (default)
    #Test samples 1000 (default)
    ----label noise information:------
    Instance dependent noise
    #Actual noise rate 0.41
    [cuda:1] LNPCC waiting for GPU slot...
    [cuda:1] Slot acquired (waited 0.5s). Starting GCN...
    FINAL_RESULT: {'acc': {'train': 0.7898550724637681, 'valid': 0.462, 'test': 0.737}, 'wall_s': 9.03, 'cpu_s': 6.88, 'gpu_s': 2.12, 'wait_s': 0.46}
    [Time] wall=9.0s | cpu=6.9s | gpu=2.1s
    C:\Users\fbrev\Documents\Acadêmico\Simulações\Python\NoisyGL\predictor\Base_Predictor.py:114: UserWarning: expandable_segments not supported on this platform (Triggered internally at ..\c10/cuda/CUDAAllocatorConfig.h:28.)
    self.edge_index = self._cpu_edge_index.to(self.device)
    C:\Users\fbrev\Documents\Acadêmico\Simulações\Python\NoisyGL\predictor\Base_Predictor.py:144: UserWarning: Sparse CSR tensor support is in beta state. If you miss a functionality in the sparse tensor support, please submit a feature request to https://github.com/pytorch/pytorch/issues. (Triggered internally at ..\aten\src\ATen\SparseCsrTensorImpl.cpp:55.)
    self.adj_csr = self.adj.to_sparse_csr().to(self.device)
[I 2026-05-08 03:32:56,084] Trial 37 finished with value: 0.737 and parameters: {'lr': 0.005, 'weight_decay': 0.01, 'n_hidden': 128, 'n_layer': 3, 'dropout': 0.6585442883761095, 'knn_mode': 's', 'k': 37, 'dexp': 0.6433493121947018, 'p_grd': 0.9301385556051313, 'unc_rem': 0.08579593194535458, 'unc_rel': 0.9196487916639479}. Best is trial 33 with value: 0.76.
    [CPU] Loading cora...
    DEBUG 3.1: Dataset init start
    DEBUG 3.2: prepare_data start cora
    ----Data statistics------'
    Name: cora
    #Nodes 2708
    #Edges 5278
    #Classes 7
    #Ave_degree 3.90
    ----Split statistics------'
    #Train samples 140 (default)
    #Val samples 500 (default)
    #Test samples 1000 (default)
    ----label noise information:------
    Instance dependent noise
    #Actual noise rate 0.41
    [cuda:1] LNPCC waiting for GPU slot...
    [cuda:1] Slot acquired (waited 0.3s). Starting GCN...
    FINAL_RESULT: {'acc': {'train': 0.8857142857142857, 'valid': 0.324, 'test': 0.459}, 'wall_s': 9.95, 'cpu_s': 7.32, 'gpu_s': 2.6, 'wait_s': 0.31}
    [Time] wall=9.9s | cpu=7.3s | gpu=2.6s
    C:\Users\fbrev\Documents\Acadêmico\Simulações\Python\NoisyGL\predictor\Base_Predictor.py:114: UserWarning: expandable_segments not supported on this platform (Triggered internally at ..\c10/cuda/CUDAAllocatorConfig.h:28.)
    self.edge_index = self._cpu_edge_index.to(self.device)
    C:\Users\fbrev\Documents\Acadêmico\Simulações\Python\NoisyGL\predictor\Base_Predictor.py:144: UserWarning: Sparse CSR tensor support is in beta state. If you miss a functionality in the sparse tensor support, please submit a feature request to https://github.com/pytorch/pytorch/issues. (Triggered internally at ..\aten\src\ATen\SparseCsrTensorImpl.cpp:55.)
    self.adj_csr = self.adj.to_sparse_csr().to(self.device)
[I 2026-05-08 03:33:11,816] Trial 38 finished with value: 0.459 and parameters: {'lr': 0.1, 'weight_decay': 0.0, 'n_hidden': 256, 'n_layer': 3, 'dropout': 0.39705210796258195, 'knn_mode': 's', 'k': 26, 'dexp': 2.169151621388566, 'p_grd': 0.6778872289328662, 'unc_rem': 0.20294443099629994, 'unc_rel': 0.7546556873290416}. Best is trial 33 with value: 0.76.
    [CPU] Loading cora...
    DEBUG 3.1: Dataset init start
    DEBUG 3.2: prepare_data start cora
    ----Data statistics------'
    Name: cora
    #Nodes 2708
    #Edges 5278
    #Classes 7
    #Ave_degree 3.90
    ----Split statistics------'
    #Train samples 140 (default)
    #Val samples 500 (default)
    #Test samples 1000 (default)
    ----label noise information:------
    Instance dependent noise
    #Actual noise rate 0.41
    [cuda:1] LNPCC waiting for GPU slot...
    [cuda:1] Slot acquired (waited 0.0s). Starting GCN...
    FINAL_RESULT: {'acc': {'train': 0.7571428571428571, 'valid': 0.484, 'test': 0.763}, 'wall_s': 9.34, 'cpu_s': 6.99, 'gpu_s': 2.32, 'wait_s': 0.0}
    [Time] wall=9.3s | cpu=7.0s | gpu=2.3s
    C:\Users\fbrev\Documents\Acadêmico\Simulações\Python\NoisyGL\predictor\Base_Predictor.py:114: UserWarning: expandable_segments not supported on this platform (Triggered internally at ..\c10/cuda/CUDAAllocatorConfig.h:28.)
    self.edge_index = self._cpu_edge_index.to(self.device)
    C:\Users\fbrev\Documents\Acadêmico\Simulações\Python\NoisyGL\predictor\Base_Predictor.py:144: UserWarning: Sparse CSR tensor support is in beta state. If you miss a functionality in the sparse tensor support, please submit a feature request to https://github.com/pytorch/pytorch/issues. (Triggered internally at ..\aten\src\ATen\SparseCsrTensorImpl.cpp:55.)
    self.adj_csr = self.adj.to_sparse_csr().to(self.device)
[I 2026-05-08 03:33:27,091] Trial 39 finished with value: 0.763 and parameters: {'lr': 0.005, 'weight_decay': 0.0001, 'n_hidden': 256, 'n_layer': 3, 'dropout': 0.7340362846936898, 'knn_mode': 's', 'k': 30, 'dexp': 6.939723535029486, 'p_grd': 0.5001169530001921, 'unc_rem': 0.3482552974266774, 'unc_rel': 0.4259428836232479}. Best is trial 39 with value: 0.763.
    [CPU] Loading cora...
    DEBUG 3.1: Dataset init start
    DEBUG 3.2: prepare_data start cora
    ----Data statistics------'
    Name: cora
    #Nodes 2708
    #Edges 5278
    #Classes 7
    #Ave_degree 3.90
    ----Split statistics------'
    #Train samples 140 (default)
    #Val samples 500 (default)
    #Test samples 1000 (default)
    ----label noise information:------
    Instance dependent noise
    #Actual noise rate 0.41
    [cuda:1] LNPCC waiting for GPU slot...
    [cuda:1] Slot acquired (waited 0.0s). Starting GCN...
    FINAL_RESULT: {'acc': {'train': 0.45714285714285713, 'valid': 0.27, 'test': 0.327}, 'wall_s': 8.68, 'cpu_s': 6.33, 'gpu_s': 2.32, 'wait_s': 0.0}
    [Time] wall=8.7s | cpu=6.3s | gpu=2.3s
    C:\Users\fbrev\Documents\Acadêmico\Simulações\Python\NoisyGL\predictor\Base_Predictor.py:114: UserWarning: expandable_segments not supported on this platform (Triggered internally at ..\c10/cuda/CUDAAllocatorConfig.h:28.)
    self.edge_index = self._cpu_edge_index.to(self.device)
    C:\Users\fbrev\Documents\Acadêmico\Simulações\Python\NoisyGL\predictor\Base_Predictor.py:144: UserWarning: Sparse CSR tensor support is in beta state. If you miss a functionality in the sparse tensor support, please submit a feature request to https://github.com/pytorch/pytorch/issues. (Triggered internally at ..\aten\src\ATen\SparseCsrTensorImpl.cpp:55.)
    self.adj_csr = self.adj.to_sparse_csr().to(self.device)
[I 2026-05-08 03:33:41,608] Trial 40 finished with value: 0.327 and parameters: {'lr': 0.005, 'weight_decay': 0.05, 'n_hidden': 32, 'n_layer': 3, 'dropout': 0.7199122113853095, 'knn_mode': 's', 'k': 24, 'dexp': 6.795041033111875, 'p_grd': 0.42908266325781597, 'unc_rem': 0.4473073708381006, 'unc_rel': 0.416358369008322}. Best is trial 39 with value: 0.763.
    [CPU] Loading cora...
    DEBUG 3.1: Dataset init start
    DEBUG 3.2: prepare_data start cora
    ----Data statistics------'
    Name: cora
    #Nodes 2708
    #Edges 5278
    #Classes 7
    #Ave_degree 3.90
    ----Split statistics------'
    #Train samples 140 (default)
    #Val samples 500 (default)
    #Test samples 1000 (default)
    ----label noise information:------
    Instance dependent noise
    #Actual noise rate 0.41
    [cuda:1] LNPCC waiting for GPU slot...
    [cuda:1] Slot acquired (waited 0.0s). Starting GCN...
    FINAL_RESULT: {'acc': {'train': 0.7, 'valid': 0.48, 'test': 0.76}, 'wall_s': 10.28, 'cpu_s': 7.48, 'gpu_s': 2.77, 'wait_s': 0.0}
    [Time] wall=10.3s | cpu=7.5s | gpu=2.8s
    C:\Users\fbrev\Documents\Acadêmico\Simulações\Python\NoisyGL\predictor\Base_Predictor.py:114: UserWarning: expandable_segments not supported on this platform (Triggered internally at ..\c10/cuda/CUDAAllocatorConfig.h:28.)
    self.edge_index = self._cpu_edge_index.to(self.device)
    C:\Users\fbrev\Documents\Acadêmico\Simulações\Python\NoisyGL\predictor\Base_Predictor.py:144: UserWarning: Sparse CSR tensor support is in beta state. If you miss a functionality in the sparse tensor support, please submit a feature request to https://github.com/pytorch/pytorch/issues. (Triggered internally at ..\aten\src\ATen\SparseCsrTensorImpl.cpp:55.)
    self.adj_csr = self.adj.to_sparse_csr().to(self.device)
[I 2026-05-08 03:33:58,446] Trial 41 finished with value: 0.76 and parameters: {'lr': 0.005, 'weight_decay': 0.0001, 'n_hidden': 256, 'n_layer': 3, 'dropout': 0.7867577335639363, 'knn_mode': 's', 'k': 29, 'dexp': 5.401715407911916, 'p_grd': 0.729285748379955, 'unc_rem': 0.3389377125121661, 'unc_rel': 0.52229584167617}. Best is trial 39 with value: 0.763.
    [CPU] Loading cora...
    DEBUG 3.1: Dataset init start
    DEBUG 3.2: prepare_data start cora
    ----Data statistics------'
    Name: cora
    #Nodes 2708
    #Edges 5278
    #Classes 7
    #Ave_degree 3.90
    ----Split statistics------'
    #Train samples 140 (default)
    #Val samples 500 (default)
    #Test samples 1000 (default)
    ----label noise information:------
    Instance dependent noise
    #Actual noise rate 0.41
    [cuda:1] LNPCC waiting for GPU slot...
    [cuda:1] Slot acquired (waited 0.2s). Starting GCN...
    FINAL_RESULT: {'acc': {'train': 0.7714285714285715, 'valid': 0.482, 'test': 0.768}, 'wall_s': 9.99, 'cpu_s': 7.18, 'gpu_s': 2.77, 'wait_s': 0.15}
    [Time] wall=10.0s | cpu=7.2s | gpu=2.8s
    C:\Users\fbrev\Documents\Acadêmico\Simulações\Python\NoisyGL\predictor\Base_Predictor.py:114: UserWarning: expandable_segments not supported on this platform (Triggered internally at ..\c10/cuda/CUDAAllocatorConfig.h:28.)
    self.edge_index = self._cpu_edge_index.to(self.device)
    C:\Users\fbrev\Documents\Acadêmico\Simulações\Python\NoisyGL\predictor\Base_Predictor.py:144: UserWarning: Sparse CSR tensor support is in beta state. If you miss a functionality in the sparse tensor support, please submit a feature request to https://github.com/pytorch/pytorch/issues. (Triggered internally at ..\aten\src\ATen\SparseCsrTensorImpl.cpp:55.)
    self.adj_csr = self.adj.to_sparse_csr().to(self.device)
[I 2026-05-08 03:34:15,004] Trial 42 finished with value: 0.768 and parameters: {'lr': 0.005, 'weight_decay': 0.0001, 'n_hidden': 256, 'n_layer': 3, 'dropout': 0.733819228815229, 'knn_mode': 's', 'k': 30, 'dexp': 7.568171927026013, 'p_grd': 0.5202768188515585, 'unc_rem': 0.3401943649247263, 'unc_rel': 0.5027033876738543}. Best is trial 42 with value: 0.768.
    [CPU] Loading cora...
    DEBUG 3.1: Dataset init start
    DEBUG 3.2: prepare_data start cora
    ----Data statistics------'
    Name: cora
    #Nodes 2708
    #Edges 5278
    #Classes 7
    #Ave_degree 3.90
    ----Split statistics------'
    #Train samples 140 (default)
    #Val samples 500 (default)
    #Test samples 1000 (default)
    ----label noise information:------
    Instance dependent noise
    #Actual noise rate 0.41
    [cuda:1] LNPCC waiting for GPU slot...
    [cuda:1] Slot acquired (waited 0.8s). Starting GCN...
    FINAL_RESULT: {'acc': {'train': 0.7214285714285714, 'valid': 0.478, 'test': 0.753}, 'wall_s': 9.23, 'cpu_s': 6.76, 'gpu_s': 2.44, 'wait_s': 0.76}
    [Time] wall=9.2s | cpu=6.8s | gpu=2.4s
    C:\Users\fbrev\Documents\Acadêmico\Simulações\Python\NoisyGL\predictor\Base_Predictor.py:114: UserWarning: expandable_segments not supported on this platform (Triggered internally at ..\c10/cuda/CUDAAllocatorConfig.h:28.)
    self.edge_index = self._cpu_edge_index.to(self.device)
    C:\Users\fbrev\Documents\Acadêmico\Simulações\Python\NoisyGL\predictor\Base_Predictor.py:144: UserWarning: Sparse CSR tensor support is in beta state. If you miss a functionality in the sparse tensor support, please submit a feature request to https://github.com/pytorch/pytorch/issues. (Triggered internally at ..\aten\src\ATen\SparseCsrTensorImpl.cpp:55.)
    self.adj_csr = self.adj.to_sparse_csr().to(self.device)
[I 2026-05-08 03:34:30,647] Trial 43 finished with value: 0.753 and parameters: {'lr': 0.005, 'weight_decay': 0.0001, 'n_hidden': 256, 'n_layer': 3, 'dropout': 0.7869719716821987, 'knn_mode': 's', 'k': 30, 'dexp': 7.560549321546252, 'p_grd': 0.5234804446233313, 'unc_rem': 0.327757192611673, 'unc_rel': 0.5271259991669958}. Best is trial 42 with value: 0.768.
    [CPU] Loading cora...
    DEBUG 3.1: Dataset init start
    DEBUG 3.2: prepare_data start cora
    ----Data statistics------'
    Name: cora
    #Nodes 2708
    #Edges 5278
    #Classes 7
    #Ave_degree 3.90
    ----Split statistics------'
    #Train samples 140 (default)
    #Val samples 500 (default)
    #Test samples 1000 (default)
    ----label noise information:------
    Instance dependent noise
    #Actual noise rate 0.41
    [cuda:1] LNPCC waiting for GPU slot...
    [cuda:1] Slot acquired (waited 1.2s). Starting GCN...
    FINAL_RESULT: {'acc': {'train': 0.7428571428571429, 'valid': 0.482, 'test': 0.76}, 'wall_s': 9.99, 'cpu_s': 7.52, 'gpu_s': 2.43, 'wait_s': 1.17}
    [Time] wall=10.0s | cpu=7.5s | gpu=2.4s
    C:\Users\fbrev\Documents\Acadêmico\Simulações\Python\NoisyGL\predictor\Base_Predictor.py:114: UserWarning: expandable_segments not supported on this platform (Triggered internally at ..\c10/cuda/CUDAAllocatorConfig.h:28.)
    self.edge_index = self._cpu_edge_index.to(self.device)
    C:\Users\fbrev\Documents\Acadêmico\Simulações\Python\NoisyGL\predictor\Base_Predictor.py:144: UserWarning: Sparse CSR tensor support is in beta state. If you miss a functionality in the sparse tensor support, please submit a feature request to https://github.com/pytorch/pytorch/issues. (Triggered internally at ..\aten\src\ATen\SparseCsrTensorImpl.cpp:55.)
    self.adj_csr = self.adj.to_sparse_csr().to(self.device)
[I 2026-05-08 03:34:47,678] Trial 44 finished with value: 0.76 and parameters: {'lr': 0.005, 'weight_decay': 0.001, 'n_hidden': 256, 'n_layer': 3, 'dropout': 0.7394984075779972, 'knn_mode': 's', 'k': 31, 'dexp': 7.3088662289960356, 'p_grd': 0.4368365143377809, 'unc_rem': 0.26160698833398094, 'unc_rel': 0.6923372434986733}. Best is trial 42 with value: 0.768.
    [CPU] Loading cora...
    DEBUG 3.1: Dataset init start
    DEBUG 3.2: prepare_data start cora
    ----Data statistics------'
    Name: cora
    #Nodes 2708
    #Edges 5278
    #Classes 7
    #Ave_degree 3.90
    ----Split statistics------'
    #Train samples 140 (default)
    #Val samples 500 (default)
    #Test samples 1000 (default)
    ----label noise information:------
    Instance dependent noise
    #Actual noise rate 0.41
    [cuda:1] LNPCC waiting for GPU slot...
    [cuda:1] Slot acquired (waited 1.2s). Starting GCN...
    FINAL_RESULT: {'acc': {'train': 0.6785714285714286, 'valid': 0.47, 'test': 0.756}, 'wall_s': 8.9, 'cpu_s': 6.63, 'gpu_s': 2.23, 'wait_s': 1.22}
    [Time] wall=8.9s | cpu=6.6s | gpu=2.2s
    C:\Users\fbrev\Documents\Acadêmico\Simulações\Python\NoisyGL\predictor\Base_Predictor.py:114: UserWarning: expandable_segments not supported on this platform (Triggered internally at ..\c10/cuda/CUDAAllocatorConfig.h:28.)
    self.edge_index = self._cpu_edge_index.to(self.device)
    C:\Users\fbrev\Documents\Acadêmico\Simulações\Python\NoisyGL\predictor\Base_Predictor.py:144: UserWarning: Sparse CSR tensor support is in beta state. If you miss a functionality in the sparse tensor support, please submit a feature request to https://github.com/pytorch/pytorch/issues. (Triggered internally at ..\aten\src\ATen\SparseCsrTensorImpl.cpp:55.)
    self.adj_csr = self.adj.to_sparse_csr().to(self.device)
[I 2026-05-08 03:35:03,784] Trial 45 finished with value: 0.756 and parameters: {'lr': 0.005, 'weight_decay': 0.0001, 'n_hidden': 128, 'n_layer': 3, 'dropout': 0.7533841878035261, 'knn_mode': 's', 'k': 32, 'dexp': 7.650847358614504, 'p_grd': 0.449632820160048, 'unc_rem': 0.26830460863638367, 'unc_rel': 0.666878898293936}. Best is trial 42 with value: 0.768.
    [CPU] Loading cora...
    DEBUG 3.1: Dataset init start
    DEBUG 3.2: prepare_data start cora
    ----Data statistics------'
    Name: cora
    #Nodes 2708
    #Edges 5278
    #Classes 7
    #Ave_degree 3.90
    ----Split statistics------'
    #Train samples 140 (default)
    #Val samples 500 (default)
    #Test samples 1000 (default)
    ----label noise information:------
    Instance dependent noise
    #Actual noise rate 0.41
    [cuda:1] LNPCC waiting for GPU slot...
    [cuda:1] Slot acquired (waited 0.9s). Starting GCN...
    FINAL_RESULT: {'acc': {'train': 0.7071428571428572, 'valid': 0.424, 'test': 0.643}, 'wall_s': 9.8, 'cpu_s': 7.11, 'gpu_s': 2.65, 'wait_s': 0.91}
    [Time] wall=9.8s | cpu=7.1s | gpu=2.7s
    C:\Users\fbrev\Documents\Acadêmico\Simulações\Python\NoisyGL\predictor\Base_Predictor.py:114: UserWarning: expandable_segments not supported on this platform (Triggered internally at ..\c10/cuda/CUDAAllocatorConfig.h:28.)
    self.edge_index = self._cpu_edge_index.to(self.device)
    C:\Users\fbrev\Documents\Acadêmico\Simulações\Python\NoisyGL\predictor\Base_Predictor.py:144: UserWarning: Sparse CSR tensor support is in beta state. If you miss a functionality in the sparse tensor support, please submit a feature request to https://github.com/pytorch/pytorch/issues. (Triggered internally at ..\aten\src\ATen\SparseCsrTensorImpl.cpp:55.)
    self.adj_csr = self.adj.to_sparse_csr().to(self.device)
[I 2026-05-08 03:35:20,113] Trial 46 finished with value: 0.643 and parameters: {'lr': 0.05, 'weight_decay': 0.0001, 'n_hidden': 256, 'n_layer': 3, 'dropout': 0.6878786897562583, 'knn_mode': 's', 'k': 45, 'dexp': 8.712939764201616, 'p_grd': 0.3435442454125738, 'unc_rem': 0.16637533348343422, 'unc_rel': 0.6913124655267352}. Best is trial 42 with value: 0.768.
    [CPU] Loading cora...
    DEBUG 3.1: Dataset init start
    DEBUG 3.2: prepare_data start cora
    ----Data statistics------'
    Name: cora
    #Nodes 2708
    #Edges 5278
    #Classes 7
    #Ave_degree 3.90
    ----Split statistics------'
    #Train samples 140 (default)
    #Val samples 500 (default)
    #Test samples 1000 (default)
    ----label noise information:------
    Instance dependent noise
    #Actual noise rate 0.41
    [cuda:1] LNPCC waiting for GPU slot...
    [cuda:1] Slot acquired (waited 2.3s). Starting GCN...
    FINAL_RESULT: {'acc': {'train': 0.8432835820895522, 'valid': 0.504, 'test': 0.762}, 'wall_s': 8.6, 'cpu_s': 6.24, 'gpu_s': 2.32, 'wait_s': 2.33}
    [Time] wall=8.6s | cpu=6.2s | gpu=2.3s
    C:\Users\fbrev\Documents\Acadêmico\Simulações\Python\NoisyGL\predictor\Base_Predictor.py:114: UserWarning: expandable_segments not supported on this platform (Triggered internally at ..\c10/cuda/CUDAAllocatorConfig.h:28.)
    self.edge_index = self._cpu_edge_index.to(self.device)
    C:\Users\fbrev\Documents\Acadêmico\Simulações\Python\NoisyGL\predictor\Base_Predictor.py:144: UserWarning: Sparse CSR tensor support is in beta state. If you miss a functionality in the sparse tensor support, please submit a feature request to https://github.com/pytorch/pytorch/issues. (Triggered internally at ..\aten\src\ATen\SparseCsrTensorImpl.cpp:55.)
    self.adj_csr = self.adj.to_sparse_csr().to(self.device)
