[I 2026-04-30 23:54:07,334] Trial 56 finished with value: 0.714 and parameters: {'lr': 0.05, 'weight_decay': 0.01, 'n_hidden': 128, 'n_layer': 2, 'dropout': 0.3103196205188199, 'knn_mode': 's', 'k': 33, 'dexp': 9.584747280122553, 'p_grd': 0.884893033254723, 'unc_rem': 0.8382452528337194, 'unc_rel': 0.5851856159507404}. Best is trial 32 with value: 0.829.
    [CPU] Loading amazoncom...
    DEBUG 3.1: Dataset init start
    DEBUG 3.2: prepare_data start amazoncom
    ----Data statistics------'
    Name: amazoncom
    #Nodes 13752
    #Edges 245861
    #Classes 10
    #Ave_degree 35.76
    ----Split statistics------'
    #Train samples 200 (20 nodes per class)
    #Val samples 500 (specified)
    #Test samples 1000 (specified)
    ----label noise information:------
    Instance dependent noise
    #Actual noise rate 0.20
    [cuda:0] LNPCC waiting for GPU slot...
    [cuda:0] Slot acquired (waited 257.1s). Starting GCN...
    FINAL_RESULT: {'acc': {'train': 0.7828282828282829, 'valid': 0.66, 'test': 0.829}, 'wall_s': 50.46, 'cpu_s': 41.8, 'gpu_s': 8.59, 'wait_s': 257.1}
    [Time] wall=50.5s | cpu=41.8s | gpu=8.6s
    C:\Users\fbrev\Documents\Acadêmico\Simulações\Python\NoisyGL\predictor\Base_Predictor.py:144: UserWarning: Sparse CSR tensor support is in beta state. If you miss a functionality in the sparse tensor support, please submit a feature request to https://github.com/pytorch/pytorch/issues. (Triggered internally at ..\aten\src\ATen\SparseCsrTensorImpl.cpp:55.)
    self.adj_csr = self.adj.to_sparse_csr().to(self.device)
[I 2026-04-30 23:59:20,531] Trial 57 finished with value: 0.829 and parameters: {'lr': 0.005, 'weight_decay': 0.01, 'n_hidden': 256, 'n_layer': 2, 'dropout': 0.2636192128944535, 'knn_mode': 's', 'k': 42, 'dexp': 8.690324022721505, 'p_grd': 0.8238554258635834, 'unc_rem': 0.9645898872755666, 'unc_rel': 0.45685114157048456}. Best is trial 32 with value: 0.829.
    [CPU] Loading amazoncom...
    DEBUG 3.1: Dataset init start
    DEBUG 3.2: prepare_data start amazoncom
    ----Data statistics------'
    Name: amazoncom
    #Nodes 13752
    #Edges 245861
    #Classes 10
    #Ave_degree 35.76
    ----Split statistics------'
    #Train samples 200 (20 nodes per class)
    #Val samples 500 (specified)
    #Test samples 1000 (specified)
    ----label noise information:------
    Instance dependent noise
    #Actual noise rate 0.20
    [cuda:0] LNPCC waiting for GPU slot...
    [cuda:0] Slot acquired (waited 111.0s). Starting GCN...
    FINAL_RESULT: {'acc': {'train': 0.7373737373737373, 'valid': 0.65, 'test': 0.799}, 'wall_s': 60.61, 'cpu_s': 45.74, 'gpu_s': 14.81, 'wait_s': 111.03}
    [Time] wall=60.6s | cpu=45.7s | gpu=14.8s
    C:\Users\fbrev\Documents\Acadêmico\Simulações\Python\NoisyGL\predictor\Base_Predictor.py:144: UserWarning: Sparse CSR tensor support is in beta state. If you miss a functionality in the sparse tensor support, please submit a feature request to https://github.com/pytorch/pytorch/issues. (Triggered internally at ..\aten\src\ATen\SparseCsrTensorImpl.cpp:55.)
    self.adj_csr = self.adj.to_sparse_csr().to(self.device)
[I 2026-05-01 00:02:18,050] Trial 58 finished with value: 0.799 and parameters: {'lr': 0.005, 'weight_decay': 0.01, 'n_hidden': 256, 'n_layer': 3, 'dropout': 0.2397373522747402, 'knn_mode': 's', 'k': 42, 'dexp': 7.808517362049729, 'p_grd': 0.8222298776092256, 'unc_rem': 0.9680108937708383, 'unc_rel': 0.42904101077190765}. Best is trial 32 with value: 0.829.
    [CPU] Loading amazoncom...
    DEBUG 3.1: Dataset init start
    DEBUG 3.2: prepare_data start amazoncom
    ----Data statistics------'
    Name: amazoncom
    #Nodes 13752
    #Edges 245861
    #Classes 10
    #Ave_degree 35.76
    ----Split statistics------'
    #Train samples 200 (20 nodes per class)
    #Val samples 500 (specified)
    #Test samples 1000 (specified)
    ----label noise information:------
    Instance dependent noise
    #Actual noise rate 0.20
    [cuda:0] LNPCC waiting for GPU slot...
    [cuda:0] Slot acquired (waited 447.1s). Starting GCN...
    FINAL_RESULT: {'acc': {'train': 0.1414141414141414, 'valid': 0.35, 'test': 0.413}, 'wall_s': 52.59, 'cpu_s': 44.35, 'gpu_s': 8.18, 'wait_s': 447.08}
    [Time] wall=52.6s | cpu=44.3s | gpu=8.2s
    C:\Users\fbrev\Documents\Acadêmico\Simulações\Python\NoisyGL\predictor\Base_Predictor.py:144: UserWarning: Sparse CSR tensor support is in beta state. If you miss a functionality in the sparse tensor support, please submit a feature request to https://github.com/pytorch/pytorch/issues. (Triggered internally at ..\aten\src\ATen\SparseCsrTensorImpl.cpp:55.)
    self.adj_csr = self.adj.to_sparse_csr().to(self.device)
[I 2026-05-01 00:10:43,080] Trial 59 finished with value: 0.413 and parameters: {'lr': 0.1, 'weight_decay': 0.0001, 'n_hidden': 256, 'n_layer': 2, 'dropout': 0.26645022576951155, 'knn_mode': 's', 'k': 45, 'dexp': 8.66410735820531, 'p_grd': 0.7898156891324293, 'unc_rem': 0.9409844839084653, 'unc_rel': 0.45619281897325403}. Best is trial 32 with value: 0.829.
    [CPU] Loading amazoncom...
    DEBUG 3.1: Dataset init start
    DEBUG 3.2: prepare_data start amazoncom
    ----Data statistics------'
    Name: amazoncom
    #Nodes 13752
    #Edges 245861
    #Classes 10
    #Ave_degree 35.76
    ----Split statistics------'
    #Train samples 200 (20 nodes per class)
    #Val samples 500 (specified)
    #Test samples 1000 (specified)
    ----label noise information:------
    Instance dependent noise
    #Actual noise rate 0.20
    [cuda:0] LNPCC waiting for GPU slot...
    [cuda:0] Slot acquired (waited 108.0s). Starting GCN...
    FINAL_RESULT: {'acc': {'train': 0.6802030456852792, 'valid': 0.662, 'test': 0.818}, 'wall_s': 49.85, 'cpu_s': 46.7, 'gpu_s': 3.07, 'wait_s': 108.03}
    [Time] wall=49.8s | cpu=46.7s | gpu=3.1s
    C:\Users\fbrev\Documents\Acadêmico\Simulações\Python\NoisyGL\predictor\Base_Predictor.py:144: UserWarning: Sparse CSR tensor support is in beta state. If you miss a functionality in the sparse tensor support, please submit a feature request to https://github.com/pytorch/pytorch/issues. (Triggered internally at ..\aten\src\ATen\SparseCsrTensorImpl.cpp:55.)
    self.adj_csr = self.adj.to_sparse_csr().to(self.device)
[I 2026-05-01 00:13:26,406] Trial 60 finished with value: 0.818 and parameters: {'lr': 0.005, 'weight_decay': 0.01, 'n_hidden': 32, 'n_layer': 2, 'dropout': 0.6104641886577398, 'knn_mode': 's', 'k': 31, 'dexp': 9.105588698407562, 'p_grd': 0.8421119088554005, 'unc_rem': 0.8300917165721247, 'unc_rel': 0.36937912837811493}. Best is trial 32 with value: 0.829.
    [CPU] Loading amazoncom...
    DEBUG 3.1: Dataset init start
    DEBUG 3.2: prepare_data start amazoncom
    ----Data statistics------'
    Name: amazoncom
    #Nodes 13752
    #Edges 245861
    #Classes 10
    #Ave_degree 35.76
    ----Split statistics------'
    #Train samples 200 (20 nodes per class)
    #Val samples 500 (specified)
    #Test samples 1000 (specified)
    ----label noise information:------
    Instance dependent noise
    #Actual noise rate 0.20
    [cuda:0] LNPCC waiting for GPU slot...
    [cuda:0] Slot acquired (waited 91.2s). Starting GCN...
    FINAL_RESULT: {'acc': {'train': 0.7676767676767676, 'valid': 0.66, 'test': 0.813}, 'wall_s': 59.64, 'cpu_s': 51.17, 'gpu_s': 8.39, 'wait_s': 91.2}
    [Time] wall=59.6s | cpu=51.2s | gpu=8.4s
    C:\Users\fbrev\Documents\Acadêmico\Simulações\Python\NoisyGL\predictor\Base_Predictor.py:144: UserWarning: Sparse CSR tensor support is in beta state. If you miss a functionality in the sparse tensor support, please submit a feature request to https://github.com/pytorch/pytorch/issues. (Triggered internally at ..\aten\src\ATen\SparseCsrTensorImpl.cpp:55.)
    self.adj_csr = self.adj.to_sparse_csr().to(self.device)
[I 2026-05-01 00:16:02,991] Trial 61 finished with value: 0.813 and parameters: {'lr': 0.005, 'weight_decay': 0.01, 'n_hidden': 256, 'n_layer': 2, 'dropout': 0.13176172678078055, 'knn_mode': 's', 'k': 42, 'dexp': 6.9601266466022444, 'p_grd': 0.8969596512543705, 'unc_rem': 0.20294443099629994, 'unc_rel': 0.5349482732210128}. Best is trial 32 with value: 0.829.
    [CPU] Loading amazoncom...
    DEBUG 3.1: Dataset init start
    DEBUG 3.2: prepare_data start amazoncom
    ----Data statistics------'
    Name: amazoncom
    #Nodes 13752
    #Edges 245861
    #Classes 10
    #Ave_degree 35.76
    ----Split statistics------'
    #Train samples 200 (20 nodes per class)
    #Val samples 500 (specified)
    #Test samples 1000 (specified)
    ----label noise information:------
    Instance dependent noise
    #Actual noise rate 0.20
    [cuda:0] LNPCC waiting for GPU slot...
    [cuda:0] Slot acquired (waited 94.8s). Starting GCN...
    FINAL_RESULT: {'acc': {'train': 0.8080808080808081, 'valid': 0.662, 'test': 0.815}, 'wall_s': 58.39, 'cpu_s': 50.31, 'gpu_s': 7.99, 'wait_s': 94.78}
    [Time] wall=58.4s | cpu=50.3s | gpu=8.0s
    C:\Users\fbrev\Documents\Acadêmico\Simulações\Python\NoisyGL\predictor\Base_Predictor.py:144: UserWarning: Sparse CSR tensor support is in beta state. If you miss a functionality in the sparse tensor support, please submit a feature request to https://github.com/pytorch/pytorch/issues. (Triggered internally at ..\aten\src\ATen\SparseCsrTensorImpl.cpp:55.)
    self.adj_csr = self.adj.to_sparse_csr().to(self.device)
[I 2026-05-01 00:18:41,916] Trial 62 finished with value: 0.815 and parameters: {'lr': 0.005, 'weight_decay': 0.01, 'n_hidden': 256, 'n_layer': 2, 'dropout': 0.49660322856299405, 'knn_mode': 's', 'k': 39, 'dexp': 8.43993508406665, 'p_grd': 0.9478628583588454, 'unc_rem': 0.9031016280514432, 'unc_rel': 0.4921671004533544}. Best is trial 32 with value: 0.829.
    [CPU] Loading amazoncom...
    DEBUG 3.1: Dataset init start
    DEBUG 3.2: prepare_data start amazoncom
    ----Data statistics------'
    Name: amazoncom
    #Nodes 13752
    #Edges 245861
    #Classes 10
    #Ave_degree 35.76
    ----Split statistics------'
    #Train samples 200 (20 nodes per class)
    #Val samples 500 (specified)
    #Test samples 1000 (specified)
    ----label noise information:------
    Instance dependent noise
    #Actual noise rate 0.20
    [cuda:0] LNPCC waiting for GPU slot...
    [cuda:0] Slot acquired (waited 87.6s). Starting GCN...
    FINAL_RESULT: {'acc': {'train': 0.8181818181818182, 'valid': 0.66, 'test': 0.832}, 'wall_s': 56.19, 'cpu_s': 47.95, 'gpu_s': 8.16, 'wait_s': 87.58}
    [Time] wall=56.2s | cpu=48.0s | gpu=8.2s
    C:\Users\fbrev\Documents\Acadêmico\Simulações\Python\NoisyGL\predictor\Base_Predictor.py:144: UserWarning: Sparse CSR tensor support is in beta state. If you miss a functionality in the sparse tensor support, please submit a feature request to https://github.com/pytorch/pytorch/issues. (Triggered internally at ..\aten\src\ATen\SparseCsrTensorImpl.cpp:55.)
    self.adj_csr = self.adj.to_sparse_csr().to(self.device)
[I 2026-05-01 00:21:11,247] Trial 63 finished with value: 0.832 and parameters: {'lr': 0.005, 'weight_decay': 0.01, 'n_hidden': 256, 'n_layer': 2, 'dropout': 0.4172212709886203, 'knn_mode': 's', 'k': 47, 'dexp': 9.359133459176293, 'p_grd': 0.9675214873031418, 'unc_rem': 0.9652075563424145, 'unc_rel': 0.4035969088288223}. Best is trial 63 with value: 0.832.
    [CPU] Loading amazoncom...
    DEBUG 3.1: Dataset init start
    DEBUG 3.2: prepare_data start amazoncom
    ----Data statistics------'
    Name: amazoncom
    #Nodes 13752
    #Edges 245861
    #Classes 10
    #Ave_degree 35.76
    ----Split statistics------'
    #Train samples 200 (20 nodes per class)
    #Val samples 500 (specified)
    #Test samples 1000 (specified)
    ----label noise information:------
    Instance dependent noise
    #Actual noise rate 0.20
    [cuda:0] LNPCC waiting for GPU slot...
    [cuda:0] Slot acquired (waited 97.3s). Starting GCN...
    FINAL_RESULT: {'acc': {'train': 0.7575757575757576, 'valid': 0.658, 'test': 0.826}, 'wall_s': 44.15, 'cpu_s': 36.0, 'gpu_s': 8.09, 'wait_s': 97.34}
    [Time] wall=44.1s | cpu=36.0s | gpu=8.1s
    C:\Users\fbrev\Documents\Acadêmico\Simulações\Python\NoisyGL\predictor\Base_Predictor.py:144: UserWarning: Sparse CSR tensor support is in beta state. If you miss a functionality in the sparse tensor support, please submit a feature request to https://github.com/pytorch/pytorch/issues. (Triggered internally at ..\aten\src\ATen\SparseCsrTensorImpl.cpp:55.)
    self.adj_csr = self.adj.to_sparse_csr().to(self.device)
[I 2026-05-01 00:23:38,141] Trial 64 finished with value: 0.826 and parameters: {'lr': 0.005, 'weight_decay': 0.01, 'n_hidden': 256, 'n_layer': 2, 'dropout': 0.570000158098347, 'knn_mode': 's', 'k': 50, 'dexp': 8.129001017520931, 'p_grd': 0.68475803167958, 'unc_rem': 0.9689499641558589, 'unc_rel': 0.5592995109294705}. Best is trial 63 with value: 0.832.
    [CPU] Loading amazoncom...
    DEBUG 3.1: Dataset init start
    DEBUG 3.2: prepare_data start amazoncom
    ----Data statistics------'
    Name: amazoncom
    #Nodes 13752
    #Edges 245861
    #Classes 10
    #Ave_degree 35.76
    ----Split statistics------'
    #Train samples 200 (20 nodes per class)
    #Val samples 500 (specified)
    #Test samples 1000 (specified)
    ----label noise information:------
    Instance dependent noise
    #Actual noise rate 0.20
    [cuda:0] LNPCC waiting for GPU slot...
    [cuda:0] Slot acquired (waited 103.7s). Starting GCN...
    FINAL_RESULT: {'acc': {'train': 0.7676767676767676, 'valid': 0.658, 'test': 0.816}, 'wall_s': 46.6, 'cpu_s': 38.25, 'gpu_s': 8.29, 'wait_s': 103.7}
    [Time] wall=46.6s | cpu=38.2s | gpu=8.3s
    C:\Users\fbrev\Documents\Acadêmico\Simulações\Python\NoisyGL\predictor\Base_Predictor.py:144: UserWarning: Sparse CSR tensor support is in beta state. If you miss a functionality in the sparse tensor support, please submit a feature request to https://github.com/pytorch/pytorch/issues. (Triggered internally at ..\aten\src\ATen\SparseCsrTensorImpl.cpp:55.)
    self.adj_csr = self.adj.to_sparse_csr().to(self.device)
[I 2026-05-01 00:26:13,819] Trial 65 finished with value: 0.816 and parameters: {'lr': 0.005, 'weight_decay': 0.01, 'n_hidden': 256, 'n_layer': 2, 'dropout': 0.3493596147085031, 'knn_mode': 's', 'k': 50, 'dexp': 8.05279493235646, 'p_grd': 0.6906620412340159, 'unc_rem': 0.9701633803725255, 'unc_rel': 0.3945265365007865}. Best is trial 63 with value: 0.832.
    [CPU] Loading amazoncom...
    DEBUG 3.1: Dataset init start
    DEBUG 3.2: prepare_data start amazoncom
    ----Data statistics------'
    Name: amazoncom
    #Nodes 13752
    #Edges 245861
    #Classes 10
    #Ave_degree 35.76
    ----Split statistics------'
    #Train samples 200 (20 nodes per class)
    #Val samples 500 (specified)
    #Test samples 1000 (specified)
    ----label noise information:------
    Instance dependent noise
    #Actual noise rate 0.20
    [cuda:0] LNPCC waiting for GPU slot...
    [cuda:0] Slot acquired (waited 93.4s). Starting GCN...
    FINAL_RESULT: {'acc': {'train': 0.601010101010101, 'valid': 0.616, 'test': 0.782}, 'wall_s': 45.59, 'cpu_s': 40.3, 'gpu_s': 5.22, 'wait_s': 93.35}
    [Time] wall=45.6s | cpu=40.3s | gpu=5.2s
    C:\Users\fbrev\Documents\Acadêmico\Simulações\Python\NoisyGL\predictor\Base_Predictor.py:144: UserWarning: Sparse CSR tensor support is in beta state. If you miss a functionality in the sparse tensor support, please submit a feature request to https://github.com/pytorch/pytorch/issues. (Triggered internally at ..\aten\src\ATen\SparseCsrTensorImpl.cpp:55.)
    self.adj_csr = self.adj.to_sparse_csr().to(self.device)
[I 2026-05-01 00:28:38,356] Trial 66 finished with value: 0.782 and parameters: {'lr': 0.01, 'weight_decay': 0.05, 'n_hidden': 128, 'n_layer': 2, 'dropout': 0.4548793172140174, 'knn_mode': 's', 'k': 47, 'dexp': 9.215166697855086, 'p_grd': 0.7575443789594156, 'unc_rem': 0.8759439939767164, 'unc_rel': 0.2697777192453981}. Best is trial 63 with value: 0.832.
    [CPU] Loading amazoncom...
    DEBUG 3.1: Dataset init start
    DEBUG 3.2: prepare_data start amazoncom
    ----Data statistics------'
    Name: amazoncom
    #Nodes 13752
    #Edges 245861
    #Classes 10
    #Ave_degree 35.76
    ----Split statistics------'
    #Train samples 200 (20 nodes per class)
    #Val samples 500 (specified)
    #Test samples 1000 (specified)
    ----label noise information:------
    Instance dependent noise
    #Actual noise rate 0.20
    [cuda:0] LNPCC waiting for GPU slot...
    [cuda:0] Slot acquired (waited 74.0s). Starting GCN...
    FINAL_RESULT: {'acc': {'train': 0.725, 'valid': 0.648, 'test': 0.802}, 'wall_s': 85.45, 'cpu_s': 70.3, 'gpu_s': 15.07, 'wait_s': 74.01}
    [Time] wall=85.5s | cpu=70.3s | gpu=15.1s
    C:\Users\fbrev\Documents\Acadêmico\Simulações\Python\NoisyGL\predictor\Base_Predictor.py:144: UserWarning: Sparse CSR tensor support is in beta state. If you miss a functionality in the sparse tensor support, please submit a feature request to https://github.com/pytorch/pytorch/issues. (Triggered internally at ..\aten\src\ATen\SparseCsrTensorImpl.cpp:55.)
    self.adj_csr = self.adj.to_sparse_csr().to(self.device)
[I 2026-05-01 00:31:23,727] Trial 67 finished with value: 0.802 and parameters: {'lr': 0.005, 'weight_decay': 0.01, 'n_hidden': 256, 'n_layer': 3, 'dropout': 0.7550480891315188, 'knn_mode': 'd', 'k': 47, 'dexp': 8.863717451053935, 'p_grd': 0.9621639948426786, 'unc_rem': 0.9220135823581097, 'unc_rel': 0.4408466990323363}. Best is trial 63 with value: 0.832.
    [CPU] Loading amazoncom...
    DEBUG 3.1: Dataset init start
    DEBUG 3.2: prepare_data start amazoncom
    ----Data statistics------'
    Name: amazoncom
    #Nodes 13752
    #Edges 245861
    #Classes 10
    #Ave_degree 35.76
    ----Split statistics------'
    #Train samples 200 (20 nodes per class)
    #Val samples 500 (specified)
    #Test samples 1000 (specified)
    ----label noise information:------
    Instance dependent noise
    #Actual noise rate 0.20
    [cuda:0] LNPCC waiting for GPU slot...
    [cuda:0] Slot acquired (waited 233.9s). Starting GCN...
    FINAL_RESULT: {'acc': {'train': 0.3333333333333333, 'valid': 0.438, 'test': 0.552}, 'wall_s': 54.52, 'cpu_s': 46.07, 'gpu_s': 8.39, 'wait_s': 233.86}
    [Time] wall=54.5s | cpu=46.1s | gpu=8.4s
    C:\Users\fbrev\Documents\Acadêmico\Simulações\Python\NoisyGL\predictor\Base_Predictor.py:144: UserWarning: Sparse CSR tensor support is in beta state. If you miss a functionality in the sparse tensor support, please submit a feature request to https://github.com/pytorch/pytorch/issues. (Triggered internally at ..\aten\src\ATen\SparseCsrTensorImpl.cpp:55.)
    self.adj_csr = self.adj.to_sparse_csr().to(self.device)
[I 2026-05-01 00:36:17,782] Trial 68 finished with value: 0.552 and parameters: {'lr': 0.05, 'weight_decay': 0.01, 'n_hidden': 256, 'n_layer': 2, 'dropout': 0.5112661069481595, 'knn_mode': 's', 'k': 46, 'dexp': 9.521869000645204, 'p_grd': 0.9237632804030022, 'unc_rem': 0.955535878157028, 'unc_rel': 0.3562962779806032}. Best is trial 63 with value: 0.832.
    [CPU] Loading amazoncom...
    DEBUG 3.1: Dataset init start
    DEBUG 3.2: prepare_data start amazoncom
    ----Data statistics------'
    Name: amazoncom
    #Nodes 13752
    #Edges 245861
    #Classes 10
    #Ave_degree 35.76
    ----Split statistics------'
    #Train samples 200 (20 nodes per class)
    #Val samples 500 (specified)
    #Test samples 1000 (specified)
    ----label noise information:------
    Instance dependent noise
    #Actual noise rate 0.20
    [cuda:0] LNPCC waiting for GPU slot...
    [cuda:0] Slot acquired (waited 83.6s). Starting GCN...
    FINAL_RESULT: {'acc': {'train': 0.7323232323232324, 'valid': 0.646, 'test': 0.802}, 'wall_s': 61.92, 'cpu_s': 53.74, 'gpu_s': 8.13, 'wait_s': 83.56}
    [Time] wall=61.9s | cpu=53.7s | gpu=8.1s
    C:\Users\fbrev\Documents\Acadêmico\Simulações\Python\NoisyGL\predictor\Base_Predictor.py:144: UserWarning: Sparse CSR tensor support is in beta state. If you miss a functionality in the sparse tensor support, please submit a feature request to https://github.com/pytorch/pytorch/issues. (Triggered internally at ..\aten\src\ATen\SparseCsrTensorImpl.cpp:55.)
    self.adj_csr = self.adj.to_sparse_csr().to(self.device)
[I 2026-05-01 00:38:48,718] Trial 69 finished with value: 0.802 and parameters: {'lr': 0.001, 'weight_decay': 0.0001, 'n_hidden': 256, 'n_layer': 2, 'dropout': 0.38087357787030285, 'knn_mode': 's', 'k': 43, 'dexp': 4.2223345451250625, 'p_grd': 0.862758531890313, 'unc_rem': 0.9970324207843599, 'unc_rel': 0.711087178338623}. Best is trial 63 with value: 0.832.
    [CPU] Loading amazoncom...
    DEBUG 3.1: Dataset init start
    DEBUG 3.2: prepare_data start amazoncom
    ----Data statistics------'
    Name: amazoncom
    #Nodes 13752
    #Edges 245861
    #Classes 10
    #Ave_degree 35.76
    ----Split statistics------'
    #Train samples 200 (20 nodes per class)
    #Val samples 500 (specified)
    #Test samples 1000 (specified)
    ----label noise information:------
    Instance dependent noise
    #Actual noise rate 0.20
    [cuda:0] LNPCC waiting for GPU slot...
    [cuda:0] Slot acquired (waited 102.5s). Starting GCN...
    FINAL_RESULT: {'acc': {'train': 0.7727272727272727, 'valid': 0.66, 'test': 0.827}, 'wall_s': 46.32, 'cpu_s': 38.06, 'gpu_s': 8.17, 'wait_s': 102.47}
    [Time] wall=46.3s | cpu=38.1s | gpu=8.2s
    C:\Users\fbrev\Documents\Acadêmico\Simulações\Python\NoisyGL\predictor\Base_Predictor.py:144: UserWarning: Sparse CSR tensor support is in beta state. If you miss a functionality in the sparse tensor support, please submit a feature request to https://github.com/pytorch/pytorch/issues. (Triggered internally at ..\aten\src\ATen\SparseCsrTensorImpl.cpp:55.)
    self.adj_csr = self.adj.to_sparse_csr().to(self.device)
