[I 2026-05-01 22:24:05,048] Trial 49 finished with value: 0.863 and parameters: {'lr': 0.05, 'weight_decay': 0.01, 'n_hidden': 64, 'n_layer': 2, 'dropout': 0.7064220084176779, 'knn_mode': 'd', 'k': 19, 'dexp': 7.979812741566179, 'p_grd': 0.17020496711488353, 'unc_rem': 0.2917169410645518, 'unc_rel': 0.3490594071251208}. Best is trial 43 with value: 0.909.

[Retest] Phase 1 Finished. Validating Top 3 (10 runs each)...

  [Retest] Candidate 1/3 (Trial 43, HPO_acc=0.9090)
    [CPU] Loading amazonpho...
    DEBUG 3.1: Dataset init start
    DEBUG 3.2: prepare_data start amazonpho
    ----Data statistics------'
    Name: amazonpho
    #Nodes 7650
    #Edges 119081
    #Classes 8
    #Ave_degree 31.13
    ----Split statistics------'
    #Train samples 160 (20 nodes per class)
    #Val samples 500 (specified)
    #Test samples 1000 (specified)
    ----label noise information:------
    Instance dependent noise
    #Actual noise rate 0.13
    [cuda:1] LNPCC waiting for GPU slot...
    [cuda:1] Slot acquired (waited 119.7s). Starting GCN...
    FINAL_RESULT: {'acc': {'train': 0.81875, 'valid': 0.792, 'test': 0.892}, 'wall_s': 20.29, 'cpu_s': 17.52, 'gpu_s': 2.71, 'wait_s': 119.71}
    [Time] wall=20.3s | cpu=17.5s | gpu=2.7s
    C:\Users\fbrev\Documents\Acadêmico\Simulações\Python\NoisyGL\predictor\Base_Predictor.py:114: UserWarning: expandable_segments not supported on this platform (Triggered internally at ..\c10/cuda/CUDAAllocatorConfig.h:28.)
    self.edge_index = self._cpu_edge_index.to(self.device)
    C:\Users\fbrev\Documents\Acadêmico\Simulações\Python\NoisyGL\predictor\Base_Predictor.py:144: UserWarning: Sparse CSR tensor support is in beta state. If you miss a functionality in the sparse tensor support, please submit a feature request to https://github.com/pytorch/pytorch/issues. (Triggered internally at ..\aten\src\ATen\SparseCsrTensorImpl.cpp:55.)
    self.adj_csr = self.adj.to_sparse_csr().to(self.device)
    [CPU] Loading amazonpho...
    DEBUG 3.1: Dataset init start
    DEBUG 3.2: prepare_data start amazonpho
    ----Data statistics------'
    Name: amazonpho
    #Nodes 7650
    #Edges 119081
    #Classes 8
    #Ave_degree 31.13
    ----Split statistics------'
    #Train samples 160 (20 nodes per class)
    #Val samples 500 (specified)
    #Test samples 1000 (specified)
    ----label noise information:------
    Instance dependent noise
    #Actual noise rate 0.13
    [cuda:1] LNPCC waiting for GPU slot...
    [cuda:1] Slot acquired (waited 122.0s). Starting GCN...
    FINAL_RESULT: {'acc': {'train': 0.79375, 'valid': 0.778, 'test': 0.868}, 'wall_s': 19.44, 'cpu_s': 16.54, 'gpu_s': 2.83, 'wait_s': 121.96}
    [Time] wall=19.4s | cpu=16.5s | gpu=2.8s
    C:\Users\fbrev\Documents\Acadêmico\Simulações\Python\NoisyGL\predictor\Base_Predictor.py:114: UserWarning: expandable_segments not supported on this platform (Triggered internally at ..\c10/cuda/CUDAAllocatorConfig.h:28.)
    self.edge_index = self._cpu_edge_index.to(self.device)
    C:\Users\fbrev\Documents\Acadêmico\Simulações\Python\NoisyGL\predictor\Base_Predictor.py:144: UserWarning: Sparse CSR tensor support is in beta state. If you miss a functionality in the sparse tensor support, please submit a feature request to https://github.com/pytorch/pytorch/issues. (Triggered internally at ..\aten\src\ATen\SparseCsrTensorImpl.cpp:55.)
    self.adj_csr = self.adj.to_sparse_csr().to(self.device)
    [CPU] Loading amazonpho...
    DEBUG 3.1: Dataset init start
    DEBUG 3.2: prepare_data start amazonpho
    ----Data statistics------'
    Name: amazonpho
    #Nodes 7650
    #Edges 119081
    #Classes 8
    #Ave_degree 31.13
    ----Split statistics------'
    #Train samples 160 (20 nodes per class)
    #Val samples 500 (specified)
    #Test samples 1000 (specified)
    ----label noise information:------
    Instance dependent noise
    #Actual noise rate 0.13
    [cuda:1] LNPCC waiting for GPU slot...
    [cuda:1] Slot acquired (waited 125.2s). Starting GCN...
    FINAL_RESULT: {'acc': {'train': 0.7672955974842768, 'valid': 0.766, 'test': 0.856}, 'wall_s': 19.55, 'cpu_s': 16.83, 'gpu_s': 2.63, 'wait_s': 125.2}
    [Time] wall=19.5s | cpu=16.8s | gpu=2.6s
    C:\Users\fbrev\Documents\Acadêmico\Simulações\Python\NoisyGL\predictor\Base_Predictor.py:114: UserWarning: expandable_segments not supported on this platform (Triggered internally at ..\c10/cuda/CUDAAllocatorConfig.h:28.)
    self.edge_index = self._cpu_edge_index.to(self.device)
    C:\Users\fbrev\Documents\Acadêmico\Simulações\Python\NoisyGL\predictor\Base_Predictor.py:144: UserWarning: Sparse CSR tensor support is in beta state. If you miss a functionality in the sparse tensor support, please submit a feature request to https://github.com/pytorch/pytorch/issues. (Triggered internally at ..\aten\src\ATen\SparseCsrTensorImpl.cpp:55.)
    self.adj_csr = self.adj.to_sparse_csr().to(self.device)
    [CPU] Loading amazonpho...
    DEBUG 3.1: Dataset init start
    DEBUG 3.2: prepare_data start amazonpho
    ----Data statistics------'
    Name: amazonpho
    #Nodes 7650
    #Edges 119081
    #Classes 8
    #Ave_degree 31.13
    ----Split statistics------'
    #Train samples 160 (20 nodes per class)
    #Val samples 500 (specified)
    #Test samples 1000 (specified)
    ----label noise information:------
    Instance dependent noise
    #Actual noise rate 0.13
    [cuda:1] LNPCC waiting for GPU slot...
    [cuda:1] Slot acquired (waited 124.2s). Starting GCN...
    FINAL_RESULT: {'acc': {'train': 0.74375, 'valid': 0.738, 'test': 0.826}, 'wall_s': 19.83, 'cpu_s': 17.15, 'gpu_s': 2.6, 'wait_s': 124.16}
    [Time] wall=19.8s | cpu=17.1s | gpu=2.6s
    C:\Users\fbrev\Documents\Acadêmico\Simulações\Python\NoisyGL\predictor\Base_Predictor.py:114: UserWarning: expandable_segments not supported on this platform (Triggered internally at ..\c10/cuda/CUDAAllocatorConfig.h:28.)
    self.edge_index = self._cpu_edge_index.to(self.device)
    C:\Users\fbrev\Documents\Acadêmico\Simulações\Python\NoisyGL\predictor\Base_Predictor.py:144: UserWarning: Sparse CSR tensor support is in beta state. If you miss a functionality in the sparse tensor support, please submit a feature request to https://github.com/pytorch/pytorch/issues. (Triggered internally at ..\aten\src\ATen\SparseCsrTensorImpl.cpp:55.)
    self.adj_csr = self.adj.to_sparse_csr().to(self.device)
    [CPU] Loading amazonpho...
    DEBUG 3.1: Dataset init start
    DEBUG 3.2: prepare_data start amazonpho
    ----Data statistics------'
    Name: amazonpho
    #Nodes 7650
    #Edges 119081
    #Classes 8
    #Ave_degree 31.13
    ----Split statistics------'
    #Train samples 160 (20 nodes per class)
    #Val samples 500 (specified)
    #Test samples 1000 (specified)
    ----label noise information:------
    Instance dependent noise
    #Actual noise rate 0.12
    [cuda:1] LNPCC waiting for GPU slot...
    [cuda:1] Slot acquired (waited 118.5s). Starting GCN...
    FINAL_RESULT: {'acc': {'train': 0.825, 'valid': 0.806, 'test': 0.894}, 'wall_s': 20.47, 'cpu_s': 17.76, 'gpu_s': 2.64, 'wait_s': 118.53}
    [Time] wall=20.5s | cpu=17.8s | gpu=2.6s
    C:\Users\fbrev\Documents\Acadêmico\Simulações\Python\NoisyGL\predictor\Base_Predictor.py:114: UserWarning: expandable_segments not supported on this platform (Triggered internally at ..\c10/cuda/CUDAAllocatorConfig.h:28.)
    self.edge_index = self._cpu_edge_index.to(self.device)
    C:\Users\fbrev\Documents\Acadêmico\Simulações\Python\NoisyGL\predictor\Base_Predictor.py:144: UserWarning: Sparse CSR tensor support is in beta state. If you miss a functionality in the sparse tensor support, please submit a feature request to https://github.com/pytorch/pytorch/issues. (Triggered internally at ..\aten\src\ATen\SparseCsrTensorImpl.cpp:55.)
    self.adj_csr = self.adj.to_sparse_csr().to(self.device)
    [CPU] Loading amazonpho...
    DEBUG 3.1: Dataset init start
    DEBUG 3.2: prepare_data start amazonpho
    ----Data statistics------'
    Name: amazonpho
    #Nodes 7650
    #Edges 119081
    #Classes 8
    #Ave_degree 31.13
    ----Split statistics------'
    #Train samples 160 (20 nodes per class)
    #Val samples 500 (specified)
    #Test samples 1000 (specified)
    ----label noise information:------
    Instance dependent noise
    #Actual noise rate 0.14
    [cuda:1] LNPCC waiting for GPU slot...
    [cuda:1] Slot acquired (waited 121.0s). Starting GCN...
    FINAL_RESULT: {'acc': {'train': 0.71875, 'valid': 0.756, 'test': 0.896}, 'wall_s': 19.93, 'cpu_s': 17.16, 'gpu_s': 2.7, 'wait_s': 121.02}
    [Time] wall=19.9s | cpu=17.2s | gpu=2.7s
    C:\Users\fbrev\Documents\Acadêmico\Simulações\Python\NoisyGL\predictor\Base_Predictor.py:114: UserWarning: expandable_segments not supported on this platform (Triggered internally at ..\c10/cuda/CUDAAllocatorConfig.h:28.)
    self.edge_index = self._cpu_edge_index.to(self.device)
    C:\Users\fbrev\Documents\Acadêmico\Simulações\Python\NoisyGL\predictor\Base_Predictor.py:144: UserWarning: Sparse CSR tensor support is in beta state. If you miss a functionality in the sparse tensor support, please submit a feature request to https://github.com/pytorch/pytorch/issues. (Triggered internally at ..\aten\src\ATen\SparseCsrTensorImpl.cpp:55.)
    self.adj_csr = self.adj.to_sparse_csr().to(self.device)
    [CPU] Loading amazonpho...
    DEBUG 3.1: Dataset init start
    DEBUG 3.2: prepare_data start amazonpho
    ----Data statistics------'
    Name: amazonpho
    #Nodes 7650
    #Edges 119081
    #Classes 8
    #Ave_degree 31.13
    ----Split statistics------'
    #Train samples 160 (20 nodes per class)
    #Val samples 500 (specified)
    #Test samples 1000 (specified)
    ----label noise information:------
    Instance dependent noise
    #Actual noise rate 0.13
    [cuda:1] LNPCC waiting for GPU slot...
    [cuda:1] Slot acquired (waited 122.5s). Starting GCN...
    FINAL_RESULT: {'acc': {'train': 0.81875, 'valid': 0.812, 'test': 0.902}, 'wall_s': 19.14, 'cpu_s': 16.36, 'gpu_s': 2.73, 'wait_s': 122.54}
    [Time] wall=19.1s | cpu=16.4s | gpu=2.7s
    C:\Users\fbrev\Documents\Acadêmico\Simulações\Python\NoisyGL\predictor\Base_Predictor.py:114: UserWarning: expandable_segments not supported on this platform (Triggered internally at ..\c10/cuda/CUDAAllocatorConfig.h:28.)
    self.edge_index = self._cpu_edge_index.to(self.device)
    C:\Users\fbrev\Documents\Acadêmico\Simulações\Python\NoisyGL\predictor\Base_Predictor.py:144: UserWarning: Sparse CSR tensor support is in beta state. If you miss a functionality in the sparse tensor support, please submit a feature request to https://github.com/pytorch/pytorch/issues. (Triggered internally at ..\aten\src\ATen\SparseCsrTensorImpl.cpp:55.)
    self.adj_csr = self.adj.to_sparse_csr().to(self.device)
    [CPU] Loading amazonpho...
    DEBUG 3.1: Dataset init start
    DEBUG 3.2: prepare_data start amazonpho
    ----Data statistics------'
    Name: amazonpho
    #Nodes 7650
    #Edges 119081
    #Classes 8
    #Ave_degree 31.13
    ----Split statistics------'
    #Train samples 160 (20 nodes per class)
    #Val samples 500 (specified)
    #Test samples 1000 (specified)
    ----label noise information:------
    Instance dependent noise
    #Actual noise rate 0.13
    [cuda:1] LNPCC waiting for GPU slot...
    [cuda:1] Slot acquired (waited 119.9s). Starting GCN...
    FINAL_RESULT: {'acc': {'train': 0.85, 'valid': 0.764, 'test': 0.912}, 'wall_s': 21.11, 'cpu_s': 18.21, 'gpu_s': 2.83, 'wait_s': 119.93}
    [Time] wall=21.1s | cpu=18.2s | gpu=2.8s
    C:\Users\fbrev\Documents\Acadêmico\Simulações\Python\NoisyGL\predictor\Base_Predictor.py:114: UserWarning: expandable_segments not supported on this platform (Triggered internally at ..\c10/cuda/CUDAAllocatorConfig.h:28.)
    self.edge_index = self._cpu_edge_index.to(self.device)
    C:\Users\fbrev\Documents\Acadêmico\Simulações\Python\NoisyGL\predictor\Base_Predictor.py:144: UserWarning: Sparse CSR tensor support is in beta state. If you miss a functionality in the sparse tensor support, please submit a feature request to https://github.com/pytorch/pytorch/issues. (Triggered internally at ..\aten\src\ATen\SparseCsrTensorImpl.cpp:55.)
    self.adj_csr = self.adj.to_sparse_csr().to(self.device)
    [CPU] Loading amazonpho...
    DEBUG 3.1: Dataset init start
    DEBUG 3.2: prepare_data start amazonpho
    ----Data statistics------'
    Name: amazonpho
    #Nodes 7650
    #Edges 119081
    #Classes 8
    #Ave_degree 31.13
    ----Split statistics------'
    #Train samples 160 (20 nodes per class)
    #Val samples 500 (specified)
    #Test samples 1000 (specified)
    ----label noise information:------
    Instance dependent noise
    #Actual noise rate 0.13
    [cuda:1] LNPCC waiting for GPU slot...
    [cuda:1] Slot acquired (waited 124.7s). Starting GCN...
    FINAL_RESULT: {'acc': {'train': 0.775, 'valid': 0.796, 'test': 0.873}, 'wall_s': 20.6, 'cpu_s': 17.9, 'gpu_s': 2.63, 'wait_s': 124.71}
    [Time] wall=20.6s | cpu=17.9s | gpu=2.6s
    C:\Users\fbrev\Documents\Acadêmico\Simulações\Python\NoisyGL\predictor\Base_Predictor.py:114: UserWarning: expandable_segments not supported on this platform (Triggered internally at ..\c10/cuda/CUDAAllocatorConfig.h:28.)
    self.edge_index = self._cpu_edge_index.to(self.device)
    C:\Users\fbrev\Documents\Acadêmico\Simulações\Python\NoisyGL\predictor\Base_Predictor.py:144: UserWarning: Sparse CSR tensor support is in beta state. If you miss a functionality in the sparse tensor support, please submit a feature request to https://github.com/pytorch/pytorch/issues. (Triggered internally at ..\aten\src\ATen\SparseCsrTensorImpl.cpp:55.)
    self.adj_csr = self.adj.to_sparse_csr().to(self.device)
    [CPU] Loading amazonpho...
    DEBUG 3.1: Dataset init start
    DEBUG 3.2: prepare_data start amazonpho
    ----Data statistics------'
    Name: amazonpho
    #Nodes 7650
    #Edges 119081
    #Classes 8
    #Ave_degree 31.13
    ----Split statistics------'
    #Train samples 160 (20 nodes per class)
    #Val samples 500 (specified)
    #Test samples 1000 (specified)
    ----label noise information:------
    Instance dependent noise
    #Actual noise rate 0.13
    [cuda:1] LNPCC waiting for GPU slot...
    [cuda:1] Slot acquired (waited 116.9s). Starting GCN...
    FINAL_RESULT: {'acc': {'train': 0.73125, 'valid': 0.726, 'test': 0.853}, 'wall_s': 21.21, 'cpu_s': 18.45, 'gpu_s': 2.68, 'wait_s': 116.89}
    [Time] wall=21.2s | cpu=18.5s | gpu=2.7s
    C:\Users\fbrev\Documents\Acadêmico\Simulações\Python\NoisyGL\predictor\Base_Predictor.py:114: UserWarning: expandable_segments not supported on this platform (Triggered internally at ..\c10/cuda/CUDAAllocatorConfig.h:28.)
    self.edge_index = self._cpu_edge_index.to(self.device)
    C:\Users\fbrev\Documents\Acadêmico\Simulações\Python\NoisyGL\predictor\Base_Predictor.py:144: UserWarning: Sparse CSR tensor support is in beta state. If you miss a functionality in the sparse tensor support, please submit a feature request to https://github.com/pytorch/pytorch/issues. (Triggered internally at ..\aten\src\ATen\SparseCsrTensorImpl.cpp:55.)
    self.adj_csr = self.adj.to_sparse_csr().to(self.device)
  [Retest] Candidate 1 Avg: 0.8772

  [Retest] Candidate 2/3 (Trial 35, HPO_acc=0.9080)
    [CPU] Loading amazonpho...
    DEBUG 3.1: Dataset init start
    DEBUG 3.2: prepare_data start amazonpho
    ----Data statistics------'
    Name: amazonpho
    #Nodes 7650
    #Edges 119081
    #Classes 8
    #Ave_degree 31.13
    ----Split statistics------'
    #Train samples 160 (20 nodes per class)
    #Val samples 500 (specified)
    #Test samples 1000 (specified)
    ----label noise information:------
    Instance dependent noise
    #Actual noise rate 0.13
    [cuda:1] LNPCC waiting for GPU slot...
    [cuda:1] Slot acquired (waited 126.5s). Starting GCN...
    FINAL_RESULT: {'acc': {'train': 0.81875, 'valid': 0.794, 'test': 0.896}, 'wall_s': 20.14, 'cpu_s': 17.43, 'gpu_s': 2.66, 'wait_s': 126.5}
    [Time] wall=20.1s | cpu=17.4s | gpu=2.7s
    C:\Users\fbrev\Documents\Acadêmico\Simulações\Python\NoisyGL\predictor\Base_Predictor.py:114: UserWarning: expandable_segments not supported on this platform (Triggered internally at ..\c10/cuda/CUDAAllocatorConfig.h:28.)
    self.edge_index = self._cpu_edge_index.to(self.device)
    C:\Users\fbrev\Documents\Acadêmico\Simulações\Python\NoisyGL\predictor\Base_Predictor.py:144: UserWarning: Sparse CSR tensor support is in beta state. If you miss a functionality in the sparse tensor support, please submit a feature request to https://github.com/pytorch/pytorch/issues. (Triggered internally at ..\aten\src\ATen\SparseCsrTensorImpl.cpp:55.)
    self.adj_csr = self.adj.to_sparse_csr().to(self.device)
    [CPU] Loading amazonpho...
    DEBUG 3.1: Dataset init start
    DEBUG 3.2: prepare_data start amazonpho
    ----Data statistics------'
    Name: amazonpho
    #Nodes 7650
    #Edges 119081
    #Classes 8
    #Ave_degree 31.13
    ----Split statistics------'
    #Train samples 160 (20 nodes per class)
    #Val samples 500 (specified)
    #Test samples 1000 (specified)
    ----label noise information:------
    Instance dependent noise
    #Actual noise rate 0.13
    [cuda:1] LNPCC waiting for GPU slot...
    [cuda:1] Slot acquired (waited 131.8s). Starting GCN...
    FINAL_RESULT: {'acc': {'train': 0.79375, 'valid': 0.784, 'test': 0.892}, 'wall_s': 19.29, 'cpu_s': 16.62, 'gpu_s': 2.6, 'wait_s': 131.78}
    [Time] wall=19.3s | cpu=16.6s | gpu=2.6s
    C:\Users\fbrev\Documents\Acadêmico\Simulações\Python\NoisyGL\predictor\Base_Predictor.py:114: UserWarning: expandable_segments not supported on this platform (Triggered internally at ..\c10/cuda/CUDAAllocatorConfig.h:28.)
    self.edge_index = self._cpu_edge_index.to(self.device)
    C:\Users\fbrev\Documents\Acadêmico\Simulações\Python\NoisyGL\predictor\Base_Predictor.py:144: UserWarning: Sparse CSR tensor support is in beta state. If you miss a functionality in the sparse tensor support, please submit a feature request to https://github.com/pytorch/pytorch/issues. (Triggered internally at ..\aten\src\ATen\SparseCsrTensorImpl.cpp:55.)
    self.adj_csr = self.adj.to_sparse_csr().to(self.device)
    [CPU] Loading amazonpho...
    DEBUG 3.1: Dataset init start
    DEBUG 3.2: prepare_data start amazonpho
    ----Data statistics------'
    Name: amazonpho
    #Nodes 7650
    #Edges 119081
    #Classes 8
    #Ave_degree 31.13
    ----Split statistics------'
    #Train samples 160 (20 nodes per class)
    #Val samples 500 (specified)
    #Test samples 1000 (specified)
    ----label noise information:------
    Instance dependent noise
    #Actual noise rate 0.13
    [cuda:1] LNPCC waiting for GPU slot...
    [cuda:1] Slot acquired (waited 297.1s). Starting GCN...
    FINAL_RESULT: {'acc': {'train': 0.7735849056603774, 'valid': 0.768, 'test': 0.867}, 'wall_s': 18.75, 'cpu_s': 16.18, 'gpu_s': 2.5, 'wait_s': 297.08}
    [Time] wall=18.8s | cpu=16.2s | gpu=2.5s
    C:\Users\fbrev\Documents\Acadêmico\Simulações\Python\NoisyGL\predictor\Base_Predictor.py:114: UserWarning: expandable_segments not supported on this platform (Triggered internally at ..\c10/cuda/CUDAAllocatorConfig.h:28.)
    self.edge_index = self._cpu_edge_index.to(self.device)
    C:\Users\fbrev\Documents\Acadêmico\Simulações\Python\NoisyGL\predictor\Base_Predictor.py:144: UserWarning: Sparse CSR tensor support is in beta state. If you miss a functionality in the sparse tensor support, please submit a feature request to https://github.com/pytorch/pytorch/issues. (Triggered internally at ..\aten\src\ATen\SparseCsrTensorImpl.cpp:55.)
    self.adj_csr = self.adj.to_sparse_csr().to(self.device)
    [CPU] Loading amazonpho...
    DEBUG 3.1: Dataset init start
    DEBUG 3.2: prepare_data start amazonpho
    ----Data statistics------'
    Name: amazonpho
    #Nodes 7650
    #Edges 119081
    #Classes 8
    #Ave_degree 31.13
    ----Split statistics------'
    #Train samples 160 (20 nodes per class)
    #Val samples 500 (specified)
    #Test samples 1000 (specified)
    ----label noise information:------
    Instance dependent noise
    #Actual noise rate 0.13
    [cuda:1] LNPCC waiting for GPU slot...
    [cuda:1] Slot acquired (waited 119.2s). Starting GCN...
    FINAL_RESULT: {'acc': {'train': 0.775, 'valid': 0.738, 'test': 0.826}, 'wall_s': 22.57, 'cpu_s': 20.02, 'gpu_s': 2.5, 'wait_s': 119.21}
    [Time] wall=22.6s | cpu=20.0s | gpu=2.5s
    C:\Users\fbrev\Documents\Acadêmico\Simulações\Python\NoisyGL\predictor\Base_Predictor.py:114: UserWarning: expandable_segments not supported on this platform (Triggered internally at ..\c10/cuda/CUDAAllocatorConfig.h:28.)
    self.edge_index = self._cpu_edge_index.to(self.device)
    C:\Users\fbrev\Documents\Acadêmico\Simulações\Python\NoisyGL\predictor\Base_Predictor.py:144: UserWarning: Sparse CSR tensor support is in beta state. If you miss a functionality in the sparse tensor support, please submit a feature request to https://github.com/pytorch/pytorch/issues. (Triggered internally at ..\aten\src\ATen\SparseCsrTensorImpl.cpp:55.)
    self.adj_csr = self.adj.to_sparse_csr().to(self.device)
    [CPU] Loading amazonpho...
    DEBUG 3.1: Dataset init start
    DEBUG 3.2: prepare_data start amazonpho
    ----Data statistics------'
    Name: amazonpho
    #Nodes 7650
    #Edges 119081
    #Classes 8
    #Ave_degree 31.13
    ----Split statistics------'
    #Train samples 160 (20 nodes per class)
    #Val samples 500 (specified)
    #Test samples 1000 (specified)
    ----label noise information:------
    Instance dependent noise
    #Actual noise rate 0.12
    [cuda:1] LNPCC waiting for GPU slot...
    [cuda:1] Slot acquired (waited 131.0s). Starting GCN...
    FINAL_RESULT: {'acc': {'train': 0.8427672955974843, 'valid': 0.804, 'test': 0.889}, 'wall_s': 23.91, 'cpu_s': 21.19, 'gpu_s': 2.65, 'wait_s': 130.97}
    [Time] wall=23.9s | cpu=21.2s | gpu=2.7s
    C:\Users\fbrev\Documents\Acadêmico\Simulações\Python\NoisyGL\predictor\Base_Predictor.py:11