[I 2026-04-27 03:29:02,327] Trial 85 finished with value: 0.39933656545037 and parameters: {'lr': 0.001, 'weight_decay': 0.0001, 'n_hidden': 64, 'n_layer': 3, 'dropout': 0.7985414937562374, 'knn_mode': 's', 'k': 47, 'dexp': 3.2247963131290995, 'p_grd': 0.9582632149589239, 'unc_rem': 0.8399664519712761, 'unc_rel': 0.7902312985871254}. Best is trial 83 with value: 0.40051033426894617.

[Retest] Phase 1 Finished. Validating Top 3 (10 runs each)...

  [Retest] Candidate 1/3 (Trial 83, HPO_acc=0.4005)
    [CPU] Loading amazon-ratings...
    DEBUG 3.1: Dataset init start
    DEBUG 3.2: prepare_data start amazon-ratings
    ----Data statistics------'
    Name: amazon-ratings
    #Nodes 24492
    #Edges 93050
    #Classes 5
    #Ave_degree 7.60
    ----Split statistics------'
    #Train samples 1224 (5.0 % of nodes)
    #Val samples 3673 (15.0 % of nodes)
    #Test samples 19595 (remaining)
    ----label noise information:------
    Instance dependent noise
    #Actual noise rate 0.21
    [cuda:1] LNPCC waiting for GPU slot...
    [cuda:1] Slot acquired (waited 131.4s). Starting GCN...
    FINAL_RESULT: {'acc': {'train': 0.4910130718954248, 'valid': 0.3362374081132589, 'test': 0.3961724929829038}, 'wall_s': 64.12, 'cpu_s': 60.67, 'gpu_s': 3.4, 'wait_s': 131.45}
    [Time] wall=64.1s | cpu=60.7s | gpu=3.4s
    C:\Users\fbrev\Documents\Acadêmico\Simulações\Python\NoisyGL\predictor\Base_Predictor.py:144: UserWarning: Sparse CSR tensor support is in beta state. If you miss a functionality in the sparse tensor support, please submit a feature request to https://github.com/pytorch/pytorch/issues. (Triggered internally at ..\aten\src\ATen\SparseCsrTensorImpl.cpp:55.)
    self.adj_csr = self.adj.to_sparse_csr().to(self.device)
    [CPU] Loading amazon-ratings...
    DEBUG 3.1: Dataset init start
    DEBUG 3.2: prepare_data start amazon-ratings
    ----Data statistics------'
    Name: amazon-ratings
    #Nodes 24492
    #Edges 93050
    #Classes 5
    #Ave_degree 7.60
    ----Split statistics------'
    #Train samples 1224 (5.0 % of nodes)
    #Val samples 3673 (15.0 % of nodes)
    #Test samples 19595 (remaining)
    ----label noise information:------
    Instance dependent noise
    #Actual noise rate 0.21
    [cuda:1] LNPCC waiting for GPU slot...
    [cuda:1] Slot acquired (waited 126.9s). Starting GCN...
    FINAL_RESULT: {'acc': {'train': 0.36764705882352944, 'valid': 0.3593792540157909, 'test': 0.3837203368206175}, 'wall_s': 66.03, 'cpu_s': 62.66, 'gpu_s': 3.31, 'wait_s': 126.86}
    [Time] wall=66.0s | cpu=62.7s | gpu=3.3s
    C:\Users\fbrev\Documents\Acadêmico\Simulações\Python\NoisyGL\predictor\Base_Predictor.py:144: UserWarning: Sparse CSR tensor support is in beta state. If you miss a functionality in the sparse tensor support, please submit a feature request to https://github.com/pytorch/pytorch/issues. (Triggered internally at ..\aten\src\ATen\SparseCsrTensorImpl.cpp:55.)
    self.adj_csr = self.adj.to_sparse_csr().to(self.device)
    [CPU] Loading amazon-ratings...
    DEBUG 3.1: Dataset init start
    DEBUG 3.2: prepare_data start amazon-ratings
    ----Data statistics------'
    Name: amazon-ratings
    #Nodes 24492
    #Edges 93050
    #Classes 5
    #Ave_degree 7.60
    ----Split statistics------'
    #Train samples 1224 (5.0 % of nodes)
    #Val samples 3673 (15.0 % of nodes)
    #Test samples 19595 (remaining)
    ----label noise information:------
    Instance dependent noise
    #Actual noise rate 0.21
    [cuda:1] LNPCC waiting for GPU slot...
    [cuda:1] Slot acquired (waited 126.2s). Starting GCN...
    FINAL_RESULT: {'acc': {'train': 0.3790849673202614, 'valid': 0.337054179145113, 'test': 0.38601684103087525}, 'wall_s': 65.56, 'cpu_s': 62.05, 'gpu_s': 3.46, 'wait_s': 126.21}
    [Time] wall=65.6s | cpu=62.1s | gpu=3.5s
    C:\Users\fbrev\Documents\Acadêmico\Simulações\Python\NoisyGL\predictor\Base_Predictor.py:144: UserWarning: Sparse CSR tensor support is in beta state. If you miss a functionality in the sparse tensor support, please submit a feature request to https://github.com/pytorch/pytorch/issues. (Triggered internally at ..\aten\src\ATen\SparseCsrTensorImpl.cpp:55.)
    self.adj_csr = self.adj.to_sparse_csr().to(self.device)
    [CPU] Loading amazon-ratings...
    DEBUG 3.1: Dataset init start
    DEBUG 3.2: prepare_data start amazon-ratings
    ----Data statistics------'
    Name: amazon-ratings
    #Nodes 24492
    #Edges 93050
    #Classes 5
    #Ave_degree 7.60
    ----Split statistics------'
    #Train samples 1224 (5.0 % of nodes)
    #Val samples 3673 (15.0 % of nodes)
    #Test samples 19595 (remaining)
    ----label noise information:------
    Instance dependent noise
    #Actual noise rate 0.21
    [cuda:1] LNPCC waiting for GPU slot...
    [cuda:1] Slot acquired (waited 135.0s). Starting GCN...
    FINAL_RESULT: {'acc': {'train': 0.36356209150326796, 'valid': 0.3408657772937653, 'test': 0.38280173513651444}, 'wall_s': 58.48, 'cpu_s': 55.1, 'gpu_s': 3.33, 'wait_s': 135.01}
    [Time] wall=58.5s | cpu=55.1s | gpu=3.3s
    C:\Users\fbrev\Documents\Acadêmico\Simulações\Python\NoisyGL\predictor\Base_Predictor.py:144: UserWarning: Sparse CSR tensor support is in beta state. If you miss a functionality in the sparse tensor support, please submit a feature request to https://github.com/pytorch/pytorch/issues. (Triggered internally at ..\aten\src\ATen\SparseCsrTensorImpl.cpp:55.)
    self.adj_csr = self.adj.to_sparse_csr().to(self.device)
    [CPU] Loading amazon-ratings...
    DEBUG 3.1: Dataset init start
    DEBUG 3.2: prepare_data start amazon-ratings
    ----Data statistics------'
    Name: amazon-ratings
    #Nodes 24492
    #Edges 93050
    #Classes 5
    #Ave_degree 7.60
    ----Split statistics------'
    #Train samples 1224 (5.0 % of nodes)
    #Val samples 3673 (15.0 % of nodes)
    #Test samples 19595 (remaining)
    ----label noise information:------
    Instance dependent noise
    #Actual noise rate 0.21
    [cuda:1] LNPCC waiting for GPU slot...
    [cuda:1] Slot acquired (waited 135.9s). Starting GCN...
    FINAL_RESULT: {'acc': {'train': 0.4387254901960784, 'valid': 0.3269806697522461, 'test': 0.37815769328910437}, 'wall_s': 56.25, 'cpu_s': 52.73, 'gpu_s': 3.46, 'wait_s': 135.93}
    [Time] wall=56.2s | cpu=52.7s | gpu=3.5s
    C:\Users\fbrev\Documents\Acadêmico\Simulações\Python\NoisyGL\predictor\Base_Predictor.py:144: UserWarning: Sparse CSR tensor support is in beta state. If you miss a functionality in the sparse tensor support, please submit a feature request to https://github.com/pytorch/pytorch/issues. (Triggered internally at ..\aten\src\ATen\SparseCsrTensorImpl.cpp:55.)
    self.adj_csr = self.adj.to_sparse_csr().to(self.device)
    [CPU] Loading amazon-ratings...
    DEBUG 3.1: Dataset init start
    DEBUG 3.2: prepare_data start amazon-ratings
    ----Data statistics------'
    Name: amazon-ratings
    #Nodes 24492
    #Edges 93050
    #Classes 5
    #Ave_degree 7.60
    ----Split statistics------'
    #Train samples 1224 (5.0 % of nodes)
    #Val samples 3673 (15.0 % of nodes)
    #Test samples 19595 (remaining)
    ----label noise information:------
    Instance dependent noise
    #Actual noise rate 0.21
    [cuda:1] LNPCC waiting for GPU slot...
    [cuda:1] Slot acquired (waited 133.5s). Starting GCN...
    FINAL_RESULT: {'acc': {'train': 0.41911764705882354, 'valid': 0.36128505309011705, 'test': 0.39214085225822914}, 'wall_s': 54.12, 'cpu_s': 50.66, 'gpu_s': 3.41, 'wait_s': 133.48}
    [Time] wall=54.1s | cpu=50.7s | gpu=3.4s
    C:\Users\fbrev\Documents\Acadêmico\Simulações\Python\NoisyGL\predictor\Base_Predictor.py:144: UserWarning: Sparse CSR tensor support is in beta state. If you miss a functionality in the sparse tensor support, please submit a feature request to https://github.com/pytorch/pytorch/issues. (Triggered internally at ..\aten\src\ATen\SparseCsrTensorImpl.cpp:55.)
    self.adj_csr = self.adj.to_sparse_csr().to(self.device)
    [CPU] Loading amazon-ratings...
    DEBUG 3.1: Dataset init start
    DEBUG 3.2: prepare_data start amazon-ratings
    ----Data statistics------'
    Name: amazon-ratings
    #Nodes 24492
    #Edges 93050
    #Classes 5
    #Ave_degree 7.60
    ----Split statistics------'
    #Train samples 1224 (5.0 % of nodes)
    #Val samples 3673 (15.0 % of nodes)
    #Test samples 19595 (remaining)
    ----label noise information:------
    Instance dependent noise
    #Actual noise rate 0.20
    [cuda:1] LNPCC waiting for GPU slot...
    [cuda:1] Slot acquired (waited 132.9s). Starting GCN...
    FINAL_RESULT: {'acc': {'train': 0.39215686274509803, 'valid': 0.348761230601688, 'test': 0.39346772135748914}, 'wall_s': 59.01, 'cpu_s': 55.41, 'gpu_s': 3.54, 'wait_s': 132.89}
    [Time] wall=59.0s | cpu=55.4s | gpu=3.5s
    C:\Users\fbrev\Documents\Acadêmico\Simulações\Python\NoisyGL\predictor\Base_Predictor.py:144: UserWarning: Sparse CSR tensor support is in beta state. If you miss a functionality in the sparse tensor support, please submit a feature request to https://github.com/pytorch/pytorch/issues. (Triggered internally at ..\aten\src\ATen\SparseCsrTensorImpl.cpp:55.)
    self.adj_csr = self.adj.to_sparse_csr().to(self.device)
    [CPU] Loading amazon-ratings...
    DEBUG 3.1: Dataset init start
    DEBUG 3.2: prepare_data start amazon-ratings
    ----Data statistics------'
    Name: amazon-ratings
    #Nodes 24492
    #Edges 93050
    #Classes 5
    #Ave_degree 7.60
    ----Split statistics------'
    #Train samples 1224 (5.0 % of nodes)
    #Val samples 3673 (15.0 % of nodes)
    #Test samples 19595 (remaining)
    ----label noise information:------
    Instance dependent noise
    #Actual noise rate 0.21
    [cuda:1] LNPCC waiting for GPU slot...
    [cuda:1] Slot acquired (waited 133.9s). Starting GCN...
    FINAL_RESULT: {'acc': {'train': 0.43137254901960786, 'valid': 0.3397767492512932, 'test': 0.38729267670324063}, 'wall_s': 58.92, 'cpu_s': 55.5, 'gpu_s': 3.37, 'wait_s': 133.89}
    [Time] wall=58.9s | cpu=55.5s | gpu=3.4s
    C:\Users\fbrev\Documents\Acadêmico\Simulações\Python\NoisyGL\predictor\Base_Predictor.py:144: UserWarning: Sparse CSR tensor support is in beta state. If you miss a functionality in the sparse tensor support, please submit a feature request to https://github.com/pytorch/pytorch/issues. (Triggered internally at ..\aten\src\ATen\SparseCsrTensorImpl.cpp:55.)
    self.adj_csr = self.adj.to_sparse_csr().to(self.device)
    [CPU] Loading amazon-ratings...
    DEBUG 3.1: Dataset init start
    DEBUG 3.2: prepare_data start amazon-ratings
    ----Data statistics------'
    Name: amazon-ratings
    #Nodes 24492
    #Edges 93050
    #Classes 5
    #Ave_degree 7.60
    ----Split statistics------'
    #Train samples 1224 (5.0 % of nodes)
    #Val samples 3673 (15.0 % of nodes)
    #Test samples 19595 (remaining)
    ----label noise information:------
    Instance dependent noise
    #Actual noise rate 0.20
    [cuda:1] LNPCC waiting for GPU slot...
    [cuda:1] Slot acquired (waited 131.8s). Starting GCN...
    FINAL_RESULT: {'acc': {'train': 0.477124183006536, 'valid': 0.3514838007078682, 'test': 0.387905077825976}, 'wall_s': 57.27, 'cpu_s': 53.75, 'gpu_s': 3.47, 'wait_s': 131.76}
    [Time] wall=57.3s | cpu=53.7s | gpu=3.5s
    C:\Users\fbrev\Documents\Acadêmico\Simulações\Python\NoisyGL\predictor\Base_Predictor.py:144: UserWarning: Sparse CSR tensor support is in beta state. If you miss a functionality in the sparse tensor support, please submit a feature request to https://github.com/pytorch/pytorch/issues. (Triggered internally at ..\aten\src\ATen\SparseCsrTensorImpl.cpp:55.)
    self.adj_csr = self.adj.to_sparse_csr().to(self.device)
    [CPU] Loading amazon-ratings...
    DEBUG 3.1: Dataset init start
    DEBUG 3.2: prepare_data start amazon-ratings
    ----Data statistics------'
    Name: amazon-ratings
    #Nodes 24492
    #Edges 93050
    #Classes 5
    #Ave_degree 7.60
    ----Split statistics------'
    #Train samples 1224 (5.0 % of nodes)
    #Val samples 3673 (15.0 % of nodes)
    #Test samples 19595 (remaining)
    ----label noise information:------
    Instance dependent noise
    #Actual noise rate 0.21
    [cuda:1] LNPCC waiting for GPU slot...
    [cuda:1] Slot acquired (waited 135.3s). Starting GCN...
    FINAL_RESULT: {'acc': {'train': 0.41013071895424835, 'valid': 0.33814320718758506, 'test': 0.3959173258484307}, 'wall_s': 52.23, 'cpu_s': 48.78, 'gpu_s': 3.39, 'wait_s': 135.34}
    [Time] wall=52.2s | cpu=48.8s | gpu=3.4s
    C:\Users\fbrev\Documents\Acadêmico\Simulações\Python\NoisyGL\predictor\Base_Predictor.py:144: UserWarning: Sparse CSR tensor support is in beta state. If you miss a functionality in the sparse tensor support, please submit a feature request to https://github.com/pytorch/pytorch/issues. (Triggered internally at ..\aten\src\ATen\SparseCsrTensorImpl.cpp:55.)
    self.adj_csr = self.adj.to_sparse_csr().to(self.device)
  [Retest] Candidate 1 Avg: 0.3884

  [Retest] Candidate 2/3 (Trial 32, HPO_acc=0.3997)
    [CPU] Loading amazon-ratings...
    DEBUG 3.1: Dataset init start
    DEBUG 3.2: prepare_data start amazon-ratings
    ----Data statistics------'
    Name: amazon-ratings
    #Nodes 24492
    #Edges 93050
    #Classes 5
    #Ave_degree 7.60
    ----Split statistics------'
    #Train samples 1224 (5.0 % of nodes)
    #Val samples 3673 (15.0 % of nodes)
    #Test samples 19595 (remaining)
    ----label noise information:------
    Instance dependent noise
    #Actual noise rate 0.21
    [cuda:1] LNPCC waiting for GPU slot...
    [cuda:1] Slot acquired (waited 148.1s). Starting GCN...
    FINAL_RESULT: {'acc': {'train': 0.5089869281045751, 'valid': 0.34331609038932753, 'test': 0.39280428680785917}, 'wall_s': 45.75, 'cpu_s': 37.53, 'gpu_s': 8.16, 'wait_s': 148.13}
    [Time] wall=45.8s | cpu=37.5s | gpu=8.2s
    C:\Users\fbrev\Documents\Acadêmico\Simulações\Python\NoisyGL\predictor\Base_Predictor.py:144: UserWarning: Sparse CSR tensor support is in beta state. If you miss a functionality in the sparse tensor support, please submit a feature request to https://github.com/pytorch/pytorch/issues. (Triggered internally at ..\aten\src\ATen\SparseCsrTensorImpl.cpp:55.)
    self.adj_csr = self.adj.to_sparse_csr().to(self.device)
    [CPU] Loading amazon-ratings...
    DEBUG 3.1: Dataset init start
    DEBUG 3.2: prepare_data start amazon-ratings
    ----Data statistics------'
    Name: amazon-ratings
    #Nodes 24492
    #Edges 93050
    #Classes 5
    #Ave_degree 7.60
    ----Split statistics------'
    #Train samples 1224 (5.0 % of nodes)
    #Val samples 3673 (15.0 % of nodes)
    #Test samples 19595 (remaining)
    ----label noise information:------
    Instance dependent noise
    #Actual noise rate 0.21
    [cuda:1] LNPCC waiting for GPU slot...
    [cuda:1] Slot acquired (waited 143.9s). Starting GCN...
    FINAL_RESULT: {'acc': {'train': 0.4027777777777778, 'valid': 0.3623740811325892, 'test': 0.39515182444501146}, 'wall_s': 47.52, 'cpu_s': 39.35, 'gpu_s': 8.12, 'wait_s': 143.87}
    [Time] wall=47.5s | cpu=39.3s | gpu=8.1s
    C:\Users\fbrev\Documents\Acadêmico\Simulações\Python\NoisyGL\predictor\Base_Predictor.py:144: UserWarning: Sparse CSR tensor support is in beta state. If you miss a functionality in the sparse tensor support, please submit a feature request to https://github.com/pytorch/pytorch/issues. (Triggered internally at ..\aten\src\ATen\SparseCsrTensorImpl.cpp:55.)
    self.adj_csr = self.adj.to_sparse_csr().to(self.device)
    [CPU] Loading amazon-ratings...
    DEBUG 3.1: Dataset init start
    DEBUG 3.2: prepare_data start amazon-ratings
    ----Data statistics------'
    Name: amazon-ratings
    #Nodes 24492
    #Edges 93050
    #Classes 5
    #Ave_degree 7.60
    ----Split statistics------'
    #Train samples 1224 (5.0 % of nodes)
    #Val samples 3673 (15.0 % of nodes)
    #Test samples 19595 (remaining)
    ----label noise information:------
    Instance dependent noise
    #Actual noise rate 0.21
    [cuda:1] LNPCC waiting for GPU slot...
    [cuda:1] Slot acquired (waited 146.3s). Starting GCN...
    FINAL_RESULT: {'acc': {'train': 0.38562091503267976, 'valid': 0.3335148380070787, 'test': 0.38290380199030366}, 'wall_s': 49.58, 'cpu_s': 41.35, 'gpu_s': 8.17, 'wait_s': 146.33}
    [Time] wall=49.6s | cpu=41.3s | gpu=8.2s
    C:\Users\fbrev\Documents\Acadêmico\Simulações\Python\NoisyGL\predictor\Base_Predictor.py:144: UserWarning: Sparse CSR tensor support is in beta state. If you miss a functionality in the sparse tensor support, please submit a feature request to https://github.com/pytorch/pytorch/issues. (Triggered internally at ..\aten\src\ATen\SparseCsrTensorImpl.cpp:55.)
    self.adj_csr = self.adj.to_sparse_csr().to(self.device)
    [CPU] Loading amazon-ratings...
    DEBUG 3.1: Dataset init start
    DEBUG 3.2: prepare_data start amazon-ratings
    ----Data statistics------'
    Name: amazon-ratings
    #Nodes 24492
    #Edges 93050
    #Classes 5
    #Ave_degree 7.60
    ----Split statistics------'
    #Train samples 1224 (5.0 % of nodes)
    #Val samples 3673 (15.0 % of nodes)
    #Test samples 19595 (remaining)
    ----label noise information:------
    Instance dependent noise
    #Actual noise rate 0.21
    [cuda:1] LNPCC waiting for GPU slot...
    [cuda:1] Slot acquired (waited 142.9s). Starting GCN...
    FINAL_RESULT: {'acc': {'train': 0.34558823529411764, 'valid': 0.3397767492512932, 'test': 0.3805052309262567}, 'wall_s': 53.52, 'cpu_s': 45.1, 'gpu_s': 8.37, 'wait_s': 142.94}
    [Time] wall=53.5s | cpu=45.1s | gpu=8.4s
    C:\Users\fbrev\Documents\Acadêmico\Simulações\Python\NoisyGL\predictor\Base_Predictor.py:144: UserWarning: Sparse CSR tensor support is in beta state. If you miss a functionality in the sparse tensor support, please submit a feature request to https://github.com/pytorch/pytorch/issues. (Triggered internally at ..\aten\src\ATen\SparseCsrTensorImpl.cpp:55.)
    self.adj_csr = self.adj.to_sparse_csr().to(self.device)
    [CPU] Loading amazon-ratings...
    DEBUG 3.1: Dataset init start
    DEBUG 3.2: prepare_data start amazon-ratings
    ----Data statistics------'
    Name: amazon-ratings
    #Nodes 24492
    #Edges 93050
    #Classes 5
    #Ave_degree 7.60
    ----Split statistics------'
    #Train samples 1224 (5.0 % of nodes)
    #Val samples 3673 (15.0 % of nodes)
    #Test samples 19595 (remaining)
    ----label noise information:------
    Instance dependent noise
    #Actual noise rate 0.21
    [cuda:1] LNPCC waiting for GPU slot...
    [cuda:1] Slot acquired (waited 146.2s). Starting GCN...
    FINAL_RESULT: {'acc': {'train': 0.40931372549019607, 'valid': 0.33052001089028044, 'test': 0.3815769328910436}, 'wall_s': 53.56, 'cpu_s': 45.32, 'gpu_s': 8.19, 'wait_s': 146.24}
    [Time] wall=53.6s | cpu=45.3s | gpu=8.2s
    C:\Users\fbrev\Documents\Acadêmico\Simulações\Python\NoisyGL\predictor\Base_Predictor.py:144: UserWarning: Sparse CSR tensor support is in beta state. If you miss a functionality in the sparse tensor support, please submit a feature request to https://github.com/pytorch/pytorch/issues. (Triggered internally at ..\aten\src\ATen\SparseCsrTensorImpl.cpp:55.)
    self.adj_csr = self.adj.to_sparse_csr().to(self.device)
    [CPU] Loading amazon-ratings...
    DEBUG 3.1: Dataset init start
    DEBUG 3.2: prepare_data start amazon-ratings
    ----Data statistics------'
    Name: amazon-ratings
    #Nodes 24492
    #Edges 93050
    #Classes 5
    #Ave_degree 7.60
    ----Split statistics------'
    #Train samples 1224 (5.0 % of nodes)
    #Val samples 3673 (15.0 % of nodes)
    #Test samples 19595 (remaining)
    ----label noise information:------
    Instance dependent noise
    #Actual noise rate 0.21
    [cuda:1] LNPCC waiting for GPU slot...
    [cuda:1] Slot acquired (waited 138.5s). Starting GCN...
    FINAL_RESULT: {'acc': {'train': 0.4362745098039216, 'valid': 0.3667301933024775, 'test': 0.38479203878540447}, 'wall_s': 49.59, 'cpu_s': 41.55, 'gpu_s': 7.96, 'wait_s': 138.54}
    [Time] wall=49.6s | cpu=41.6s | gpu=8.0s
    C:\Users\fbrev\Documents\Acadêmico\Simulações\Python\NoisyGL\predictor\Base_Predictor.py:144: UserWarning: Sparse CSR tensor support is in beta state. If you miss a functionality in the sparse tensor support, please submit a feature request to https://github.com/pytorch/pytorch/issues. (Triggered internally at ..\aten\src\ATen\SparseCsrTensorImpl.cpp:55.)
    self.adj_csr = self.adj.to_sparse_csr().to(self.device)
    [CPU] Loading amazon-ratings...
    DEBUG 3.1: Dataset init start
    DEBUG 3.2: prepare_data start amazon-ratings
    ----Data statistics------'
    Name: amazon-ratings
    #Nodes 24492
    #Edges 93050
    #Classes 5
    #Ave_degree 7.60
    ----Split statistics------'
    #Train samples 1224 (5.0 % of nodes)
    #Val samples 3673 (15.0 % of nodes)
    #Test samples 19595 (remaining)
    ----label noise information:------
    Instance dependent noise
    #Actual noise rate 0.20
    [cuda:1] LNPCC waiting for GPU slot...
    [cuda:1] Slot acquired (waited 145.4s). Starting GCN...
    FINAL_RESULT: {'acc': {'train': 0.4117647058823529, 'valid': 0.3495780016335421, 'test': 0.3990813983158969}, 'wall_s': 46.39, 'cpu_s': 38.15, 'gpu_s': 8.18, 'wait_s': 145.37}
    [Time] wall=46.4s | cpu=38.1s | gpu=8.2s
    C:\Users\fbrev\Documents\Acadêmico\Simulações\Python\NoisyGL\predictor\Base_Predictor.py:144: UserWarning: Sparse CSR tensor support is in beta state. If you miss a functionality in the sparse tensor support, please submit a feature request to https://github.com/pytorch/pytorch/issues. (Triggered internally at ..\aten\src\ATen\SparseCsrTensorImpl.cpp:55.)
    self.adj_csr = self.adj.to_sparse_csr().to(self.device)
    [CPU] Loading amazon-ratings...
    DEBUG 3.1: Dataset init start
    DEBUG 3.2: prepare_data start amazon-ratings
    ----Data statistics------'
    Name: amazon-ratings
    #Nodes 24492
    #Edges 93050
    #Classes 5
    #Ave_degree 7.60
    ----Split statistics------'
    #Train samples 1224 (5.0 % of node