[I 2026-05-08 03:28:55,187] Trial 47 finished with value: 0.771 and parameters: {'lr': 0.005, 'weight_decay': 0.0, 'n_hidden': 128, 'n_layer': 3, 'dropout': 0.797785001228767, 'knn_mode': 's', 'k': 43, 'dexp': 2.9278523878126803, 'p_grd': 0.07086383282630865, 'unc_rem': 0.32339581738952233, 'unc_rel': 0.006224967819973115}. Best is trial 42 with value: 0.819.
    [CPU] Loading cora...
    DEBUG 3.1: Dataset init start
    DEBUG 3.2: prepare_data start cora
    ----Data statistics------'
    Name: cora
    #Nodes 2708
    #Edges 5278
    #Classes 7
    #Ave_degree 3.90
    ----Split statistics------'
    #Train samples 140 (default)
    #Val samples 500 (default)
    #Test samples 1000 (default)
    ----label noise information:------
    Instance dependent noise
    #Actual noise rate 0.13
    [cuda:0] LNPCC waiting for GPU slot...
    [cuda:0] Slot acquired (waited 83.7s). Starting GCN...
    FINAL_RESULT: {'acc': {'train': 0.8714285714285714, 'valid': 0.708, 'test': 0.814}, 'wall_s': 11.09, 'cpu_s': 8.31, 'gpu_s': 2.75, 'wait_s': 83.71}
    [Time] wall=11.1s | cpu=8.3s | gpu=2.8s
    C:\Users\fbrev\Documents\Acadêmico\Simulações\Python\NoisyGL\predictor\Base_Predictor.py:114: UserWarning: expandable_segments not supported on this platform (Triggered internally at ..\c10/cuda/CUDAAllocatorConfig.h:28.)
    self.edge_index = self._cpu_edge_index.to(self.device)
    C:\Users\fbrev\Documents\Acadêmico\Simulações\Python\NoisyGL\predictor\Base_Predictor.py:144: UserWarning: Sparse CSR tensor support is in beta state. If you miss a functionality in the sparse tensor support, please submit a feature request to https://github.com/pytorch/pytorch/issues. (Triggered internally at ..\aten\src\ATen\SparseCsrTensorImpl.cpp:55.)
    self.adj_csr = self.adj.to_sparse_csr().to(self.device)
[I 2026-05-08 03:30:36,673] Trial 48 finished with value: 0.814 and parameters: {'lr': 0.01, 'weight_decay': 0.0001, 'n_hidden': 128, 'n_layer': 3, 'dropout': 0.6384785943235548, 'knn_mode': 's', 'k': 40, 'dexp': 1.8823320575586502, 'p_grd': 0.8928725818406006, 'unc_rem': 0.4136004043460676, 'unc_rel': 0.42035627641173917}. Best is trial 42 with value: 0.819.
    [CPU] Loading cora...
    DEBUG 3.1: Dataset init start
    DEBUG 3.2: prepare_data start cora
    ----Data statistics------'
    Name: cora
    #Nodes 2708
    #Edges 5278
    #Classes 7
    #Ave_degree 3.90
    ----Split statistics------'
    #Train samples 140 (default)
    #Val samples 500 (default)
    #Test samples 1000 (default)
    ----label noise information:------
    Instance dependent noise
    #Actual noise rate 0.13
    [cuda:0] LNPCC waiting for GPU slot...
    [cuda:0] Slot acquired (waited 16.3s). Starting GCN...
