[I 2026-05-07 20:42:31,393] Trial 35 finished with value: 0.638 and parameters: {'lr': 0.001, 'weight_decay': 0.05, 'n_hidden': 32, 'n_layer': 3, 'dropout': 0.28418288491685106, 'knn_mode': 'd', 'k': 8, 'dexp': 4.237664729781146, 'p_grd': 0.17752519004249745, 'unc_rem': 0.4271130840653521, 'unc_rel': 0.7272499076737665}. Best is trial 9 with value: 0.678.
    [CPU] Loading citeseer...
    DEBUG 3.1: Dataset init start
    DEBUG 3.2: prepare_data start citeseer
    ----Data statistics------'
    Name: citeseer
    #Nodes 3327
    #Edges 4552
    #Classes 6
    #Ave_degree 2.74
    ----Split statistics------'
    #Train samples 120 (default)
    #Val samples 500 (default)
    #Test samples 1000 (default)
    ----label noise information:------
    Instance dependent noise
    #Actual noise rate 0.20
    [cuda:0] LNPCC waiting for GPU slot...
    [cuda:0] Slot acquired (waited 367.6s). Starting GCN...
    FINAL_RESULT: {'acc': {'train': 0.9482758620689655, 'valid': 0.522, 'test': 0.654}, 'wall_s': 9.78, 'cpu_s': 7.09, 'gpu_s': 2.67, 'wait_s': 367.55}
    [Time] wall=9.8s | cpu=7.1s | gpu=2.7s
    C:\Users\fbrev\Documents\Acadêmico\Simulações\Python\NoisyGL\predictor\Base_Predictor.py:114: UserWarning: expandable_segments not supported on this platform (Triggered internally at ..\c10/cuda/CUDAAllocatorConfig.h:28.)
    self.edge_index = self._cpu_edge_index.to(self.device)
    C:\Users\fbrev\Documents\Acadêmico\Simulações\Python\NoisyGL\predictor\Base_Predictor.py:144: UserWarning: Sparse CSR tensor support is in beta state. If you miss a functionality in the sparse tensor support, please submit a feature request to https://github.com/pytorch/pytorch/issues. (Triggered internally at ..\aten\src\ATen\SparseCsrTensorImpl.cpp:55.)
    self.adj_csr = self.adj.to_sparse_csr().to(self.device)
[I 2026-05-07 20:48:53,933] Trial 36 finished with value: 0.654 and parameters: {'lr': 0.005, 'weight_decay': 0.0, 'n_hidden': 128, 'n_layer': 3, 'dropout': 0.6239092127282523, 'knn_mode': 's', 'k': 13, 'dexp': 3.0540076181951554, 'p_grd': 0.272694894090156, 'unc_rem': 0.32182146163711356, 'unc_rel': 0.4023491117305564}. Best is trial 9 with value: 0.678.
    [CPU] Loading citeseer...
    DEBUG 3.1: Dataset init start
    DEBUG 3.2: prepare_data start citeseer
    ----Data statistics------'
    Name: citeseer
    #Nodes 3327
    #Edges 4552
    #Classes 6
    #Ave_degree 2.74
    ----Split statistics------'
    #Train samples 120 (default)
    #Val samples 500 (default)
    #Test samples 1000 (default)
    ----label noise information:------
    Instance dependent noise
    #Actual noise rate 0.20
    [cuda:0] LNPCC waiting for GPU slot...
    [cuda:0] Slot acquired (waited 175.2s). Starting GCN...
    FINAL_RESULT: {'acc': {'train': 0.7916666666666666, 'valid': 0.586, 'test': 0.671}, 'wall_s': 10.24, 'cpu_s': 8.06, 'gpu_s': 2.14, 'wait_s': 175.16}
    [Time] wall=10.2s | cpu=8.1s | gpu=2.1s
    C:\Users\fbrev\Documents\Acadêmico\Simulações\Python\NoisyGL\predictor\Base_Predictor.py:114: UserWarning: expandable_segments not supported on this platform (Triggered internally at ..\c10/cuda/CUDAAllocatorConfig.h:28.)
    self.edge_index = self._cpu_edge_index.to(self.device)
    C:\Users\fbrev\Documents\Acadêmico\Simulações\Python\NoisyGL\predictor\Base_Predictor.py:144: UserWarning: Sparse CSR tensor support is in beta state. If you miss a functionality in the sparse tensor support, please submit a feature request to https://github.com/pytorch/pytorch/issues. (Triggered internally at ..\aten\src\ATen\SparseCsrTensorImpl.cpp:55.)
    self.adj_csr = self.adj.to_sparse_csr().to(self.device)
[I 2026-05-07 20:52:05,091] Trial 37 finished with value: 0.671 and parameters: {'lr': 0.05, 'weight_decay': 0.05, 'n_hidden': 128, 'n_layer': 3, 'dropout': 0.716520833820943, 'knn_mode': 's', 'k': 5, 'dexp': 8.77158890531777, 'p_grd': 0.3829175941411102, 'unc_rem': 0.07986215503100189, 'unc_rel': 0.29674677763995405}. Best is trial 9 with value: 0.678.
    [CPU] Loading citeseer...
    DEBUG 3.1: Dataset init start
    DEBUG 3.2: prepare_data start citeseer
    ----Data statistics------'
    Name: citeseer
    #Nodes 3327
    #Edges 4552
    #Classes 6
    #Ave_degree 2.74
    ----Split statistics------'
    #Train samples 120 (default)
    #Val samples 500 (default)
    #Test samples 1000 (default)
    ----label noise information:------
    Instance dependent noise
    #Actual noise rate 0.20
    [cuda:0] LNPCC waiting for GPU slot...
    [cuda:0] Slot acquired (waited 164.3s). Starting GCN...
    FINAL_RESULT: {'acc': {'train': 0.8823529411764706, 'valid': 0.528, 'test': 0.628}, 'wall_s': 22.22, 'cpu_s': 19.79, 'gpu_s': 2.4, 'wait_s': 164.26}
    [Time] wall=22.2s | cpu=19.8s | gpu=2.4s
    C:\Users\fbrev\Documents\Acadêmico\Simulações\Python\NoisyGL\predictor\Base_Predictor.py:114: UserWarning: expandable_segments not supported on this platform (Triggered internally at ..\c10/cuda/CUDAAllocatorConfig.h:28.)
    self.edge_index = self._cpu_edge_index.to(self.device)
    C:\Users\fbrev\Documents\Acadêmico\Simulações\Python\NoisyGL\predictor\Base_Predictor.py:144: UserWarning: Sparse CSR tensor support is in beta state. If you miss a functionality in the sparse tensor support, please submit a feature request to https://github.com/pytorch/pytorch/issues. (Triggered internally at ..\aten\src\ATen\SparseCsrTensorImpl.cpp:55.)
    self.adj_csr = self.adj.to_sparse_csr().to(self.device)
[I 2026-05-07 20:55:17,385] Trial 38 finished with value: 0.628 and parameters: {'lr': 0.005, 'weight_decay': 0.01, 'n_hidden': 32, 'n_layer': 3, 'dropout': 0.7539831900971985, 'knn_mode': 'd', 'k': 35, 'dexp': 0.355276490934769, 'p_grd': 0.46913489681370113, 'unc_rem': 0.17784574791460772, 'unc_rel': 0.6871213287164591}. Best is trial 9 with value: 0.678.
    [CPU] Loading citeseer...
    DEBUG 3.1: Dataset init start
    DEBUG 3.2: prepare_data start citeseer
    ----Data statistics------'
    Name: citeseer
    #Nodes 3327
    #Edges 4552
    #Classes 6
    #Ave_degree 2.74
    ----Split statistics------'
    #Train samples 120 (default)
    #Val samples 500 (default)
    #Test samples 1000 (default)
    ----label noise information:------
    Instance dependent noise
    #Actual noise rate 0.20
    [cuda:0] LNPCC waiting for GPU slot...
    [cuda:0] Slot acquired (waited 170.9s). Starting GCN...
    FINAL_RESULT: {'acc': {'train': 0.9333333333333333, 'valid': 0.528, 'test': 0.608}, 'wall_s': 11.47, 'cpu_s': 8.84, 'gpu_s': 2.6, 'wait_s': 170.87}
    [Time] wall=11.5s | cpu=8.8s | gpu=2.6s
    C:\Users\fbrev\Documents\Acadêmico\Simulações\Python\NoisyGL\predictor\Base_Predictor.py:114: UserWarning: expandable_segments not supported on this platform (Triggered internally at ..\c10/cuda/CUDAAllocatorConfig.h:28.)
    self.edge_index = self._cpu_edge_index.to(self.device)
    C:\Users\fbrev\Documents\Acadêmico\Simulações\Python\NoisyGL\predictor\Base_Predictor.py:144: UserWarning: Sparse CSR tensor support is in beta state. If you miss a functionality in the sparse tensor support, please submit a feature request to https://github.com/pytorch/pytorch/issues. (Triggered internally at ..\aten\src\ATen\SparseCsrTensorImpl.cpp:55.)
    self.adj_csr = self.adj.to_sparse_csr().to(self.device)
[I 2026-05-07 20:58:25,845] Trial 39 finished with value: 0.608 and parameters: {'lr': 0.01, 'weight_decay': 0.0001, 'n_hidden': 128, 'n_layer': 3, 'dropout': 0.40219640562969144, 'knn_mode': 's', 'k': 25, 'dexp': 0.9851747072048592, 'p_grd': 0.541416487976009, 'unc_rem': 0.6374984456047388, 'unc_rel': 0.7627535991559481}. Best is trial 9 with value: 0.678.
    [CPU] Loading citeseer...
    DEBUG 3.1: Dataset init start
    DEBUG 3.2: prepare_data start citeseer
    ----Data statistics------'
    Name: citeseer
    #Nodes 3327
    #Edges 4552
    #Classes 6
    #Ave_degree 2.74
    ----Split statistics------'
    #Train samples 120 (default)
    #Val samples 500 (default)
    #Test samples 1000 (default)
    ----label noise information:------
    Instance dependent noise
    #Actual noise rate 0.20
    [cuda:0] LNPCC waiting for GPU slot...
    [cuda:0] Slot acquired (waited 164.5s). Starting GCN...
    FINAL_RESULT: {'acc': {'train': 0.625, 'valid': 0.448, 'test': 0.553}, 'wall_s': 21.8, 'cpu_s': 19.22, 'gpu_s': 2.55, 'wait_s': 164.51}
    [Time] wall=21.8s | cpu=19.2s | gpu=2.5s
    C:\Users\fbrev\Documents\Acadêmico\Simulações\Python\NoisyGL\predictor\Base_Predictor.py:114: UserWarning: expandable_segments not supported on this platform (Triggered internally at ..\c10/cuda/CUDAAllocatorConfig.h:28.)
    self.edge_index = self._cpu_edge_index.to(self.device)
    C:\Users\fbrev\Documents\Acadêmico\Simulações\Python\NoisyGL\predictor\Base_Predictor.py:144: UserWarning: Sparse CSR tensor support is in beta state. If you miss a functionality in the sparse tensor support, please submit a feature request to https://github.com/pytorch/pytorch/issues. (Triggered internally at ..\aten\src\ATen\SparseCsrTensorImpl.cpp:55.)
    self.adj_csr = self.adj.to_sparse_csr().to(self.device)
[I 2026-05-07 21:01:38,115] Trial 40 finished with value: 0.553 and parameters: {'lr': 0.1, 'weight_decay': 0.05, 'n_hidden': 32, 'n_layer': 3, 'dropout': 0.4670073780416431, 'knn_mode': 'd', 'k': 7, 'dexp': 1.8930432822048264, 'p_grd': 0.7471335561107457, 'unc_rem': 0.11208052888608723, 'unc_rel': 0.6007116753565349}. Best is trial 9 with value: 0.678.
    [CPU] Loading citeseer...
    DEBUG 3.1: Dataset init start
    DEBUG 3.2: prepare_data start citeseer
    ----Data statistics------'
    Name: citeseer
    #Nodes 3327
    #Edges 4552
    #Classes 6
    #Ave_degree 2.74
    ----Split statistics------'
    #Train samples 120 (default)
    #Val samples 500 (default)
    #Test samples 1000 (default)
    ----label noise information:------
    Instance dependent noise
    #Actual noise rate 0.20
    [cuda:0] LNPCC waiting for GPU slot...
    [cuda:0] Slot acquired (waited 346.9s). Starting GCN...
    FINAL_RESULT: {'acc': {'train': 0.7, 'valid': 0.56, 'test': 0.672}, 'wall_s': 10.7, 'cpu_s': 8.19, 'gpu_s': 2.38, 'wait_s': 346.87}
    [Time] wall=10.7s | cpu=8.2s | gpu=2.4s
    C:\Users\fbrev\Documents\Acadêmico\Simulações\Python\NoisyGL\predictor\Base_Predictor.py:114: UserWarning: expandable_segments not supported on this platform (Triggered internally at ..\c10/cuda/CUDAAllocatorConfig.h:28.)
    self.edge_index = self._cpu_edge_index.to(self.device)
    C:\Users\fbrev\Documents\Acadêmico\Simulações\Python\NoisyGL\predictor\Base_Predictor.py:144: UserWarning: Sparse CSR tensor support is in beta state. If you miss a functionality in the sparse tensor support, please submit a feature request to https://github.com/pytorch/pytorch/issues. (Triggered internally at ..\aten\src\ATen\SparseCsrTensorImpl.cpp:55.)
    self.adj_csr = self.adj.to_sparse_csr().to(self.device)
[I 2026-05-07 21:07:41,433] Trial 41 finished with value: 0.672 and parameters: {'lr': 0.05, 'weight_decay': 0.05, 'n_hidden': 128, 'n_layer': 3, 'dropout': 0.7128751427743562, 'knn_mode': 's', 'k': 5, 'dexp': 8.722490933775523, 'p_grd': 0.3679434991234924, 'unc_rem': 0.07180017830414581, 'unc_rel': 0.1785287096364871}. Best is trial 9 with value: 0.678.
    [CPU] Loading citeseer...
    DEBUG 3.1: Dataset init start
    DEBUG 3.2: prepare_data start citeseer
    ----Data statistics------'
    Name: citeseer
    #Nodes 3327
    #Edges 4552
    #Classes 6
    #Ave_degree 2.74
    ----Split statistics------'
    #Train samples 120 (default)
    #Val samples 500 (default)
    #Test samples 1000 (default)
    ----label noise information:------
    Instance dependent noise
    #Actual noise rate 0.20
    [cuda:0] LNPCC waiting for GPU slot...
    [cuda:0] Slot acquired (waited 166.5s). Starting GCN...
    FINAL_RESULT: {'acc': {'train': 0.6470588235294118, 'valid': 0.582, 'test': 0.699}, 'wall_s': 9.5, 'cpu_s': 7.02, 'gpu_s': 2.45, 'wait_s': 166.48}
    [Time] wall=9.5s | cpu=7.0s | gpu=2.5s
    C:\Users\fbrev\Documents\Acadêmico\Simulações\Python\NoisyGL\predictor\Base_Predictor.py:114: UserWarning: expandable_segments not supported on this platform (Triggered internally at ..\c10/cuda/CUDAAllocatorConfig.h:28.)
    self.edge_index = self._cpu_edge_index.to(self.device)
    C:\Users\fbrev\Documents\Acadêmico\Simulações\Python\NoisyGL\predictor\Base_Predictor.py:144: UserWarning: Sparse CSR tensor support is in beta state. If you miss a functionality in the sparse tensor support, please submit a feature request to https://github.com/pytorch/pytorch/issues. (Triggered internally at ..\aten\src\ATen\SparseCsrTensorImpl.cpp:55.)
    self.adj_csr = self.adj.to_sparse_csr().to(self.device)
[I 2026-05-07 21:10:43,185] Trial 42 finished with value: 0.699 and parameters: {'lr': 0.05, 'weight_decay': 0.05, 'n_hidden': 128, 'n_layer': 3, 'dropout': 0.7977660438096369, 'knn_mode': 's', 'k': 11, 'dexp': 9.908686072598696, 'p_grd': 0.23600141231679223, 'unc_rem': 0.20505790991024891, 'unc_rel': 0.18930340379429386}. Best is trial 42 with value: 0.699.
    [CPU] Loading citeseer...
    DEBUG 3.1: Dataset init start
    DEBUG 3.2: prepare_data start citeseer
    ----Data statistics------'
    Name: citeseer
    #Nodes 3327
    #Edges 4552
    #Classes 6
    #Ave_degree 2.74
    ----Split statistics------'
    #Train samples 120 (default)
    #Val samples 500 (default)
    #Test samples 1000 (default)
    ----label noise information:------
    Instance dependent noise
    #Actual noise rate 0.20
    [cuda:0] LNPCC waiting for GPU slot...
    [cuda:0] Slot acquired (waited 344.0s). Starting GCN...
    FINAL_RESULT: {'acc': {'train': 0.7333333333333333, 'valid': 0.568, 'test': 0.665}, 'wall_s': 9.73, 'cpu_s': 7.38, 'gpu_s': 2.32, 'wait_s': 343.96}
    [Time] wall=9.7s | cpu=7.4s | gpu=2.3s
    C:\Users\fbrev\Documents\Acadêmico\Simulações\Python\NoisyGL\predictor\Base_Predictor.py:114: UserWarning: expandable_segments not supported on this platform (Triggered internally at ..\c10/cuda/CUDAAllocatorConfig.h:28.)
    self.edge_index = self._cpu_edge_index.to(self.device)
    C:\Users\fbrev\Documents\Acadêmico\Simulações\Python\NoisyGL\predictor\Base_Predictor.py:144: UserWarning: Sparse CSR tensor support is in beta state. If you miss a functionality in the sparse tensor support, please submit a feature request to https://github.com/pytorch/pytorch/issues. (Triggered internally at ..\aten\src\ATen\SparseCsrTensorImpl.cpp:55.)
    self.adj_csr = self.adj.to_sparse_csr().to(self.device)
[I 2026-05-07 21:16:42,339] Trial 43 finished with value: 0.665 and parameters: {'lr': 0.05, 'weight_decay': 0.05, 'n_hidden': 128, 'n_layer': 3, 'dropout': 0.5498573789621055, 'knn_mode': 's', 'k': 11, 'dexp': 9.93388843374332, 'p_grd': 0.35071679465883676, 'unc_rem': 0.23178290401619292, 'unc_rel': 0.20244640164228297}. Best is trial 42 with value: 0.699.
    [CPU] Loading citeseer...
    DEBUG 3.1: Dataset init start
    DEBUG 3.2: prepare_data start citeseer
    ----Data statistics------'
    Name: citeseer
    #Nodes 3327
    #Edges 4552
    #Classes 6
    #Ave_degree 2.74
    ----Split statistics------'
    #Train samples 120 (default)
    #Val samples 500 (default)
    #Test samples 1000 (default)
    ----label noise information:------
    Instance dependent noise
    #Actual noise rate 0.20
    [cuda:0] LNPCC waiting for GPU slot...
    [cuda:0] Slot acquired (waited 163.9s). Starting GCN...
    FINAL_RESULT: {'acc': {'train': 0.8319327731092437, 'valid': 0.582, 'test': 0.685}, 'wall_s': 9.3, 'cpu_s': 7.23, 'gpu_s': 2.04, 'wait_s': 163.87}
    [Time] wall=9.3s | cpu=7.2s | gpu=2.0s
    C:\Users\fbrev\Documents\Acadêmico\Simulações\Python\NoisyGL\predictor\Base_Predictor.py:114: UserWarning: expandable_segments not supported on this platform (Triggered internally at ..\c10/cuda/CUDAAllocatorConfig.h:28.)
    self.edge_index = self._cpu_edge_index.to(self.device)
    C:\Users\fbrev\Documents\Acadêmico\Simulações\Python\NoisyGL\predictor\Base_Predictor.py:144: UserWarning: Sparse CSR tensor support is in beta state. If you miss a functionality in the sparse tensor support, please submit a feature request to https://github.com/pytorch/pytorch/issues. (Triggered internally at ..\aten\src\ATen\SparseCsrTensorImpl.cpp:55.)
    self.adj_csr = self.adj.to_sparse_csr().to(self.device)
[I 2026-05-07 21:19:40,871] Trial 44 finished with value: 0.685 and parameters: {'lr': 0.05, 'weight_decay': 0.05, 'n_hidden': 128, 'n_layer': 3, 'dropout': 0.7994422543231329, 'knn_mode': 's', 'k': 8, 'dexp': 8.785053643042577, 'p_grd': 0.24192615215323862, 'unc_rem': 0.17819429088672928, 'unc_rel': 0.16506289249388298}. Best is trial 42 with value: 0.699.
    [CPU] Loading citeseer...
    DEBUG 3.1: Dataset init start
    DEBUG 3.2: prepare_data start citeseer
    ----Data statistics------'
    Name: citeseer
    #Nodes 3327
    #Edges 4552
    #Classes 6
    #Ave_degree 2.74
    ----Split statistics------'
    #Train samples 120 (default)
    #Val samples 500 (default)
    #Test samples 1000 (default)
    ----label noise information:------
    Instance dependent noise
    #Actual noise rate 0.20
    [cuda:0] LNPCC waiting for GPU slot...
    [cuda:0] Slot acquired (waited 525.2s). Starting GCN...
    FINAL_RESULT: {'acc': {'train': 0.773109243697479, 'valid': 0.586, 'test': 0.688}, 'wall_s': 8.96, 'cpu_s': 6.71, 'gpu_s': 2.22, 'wait_s': 525.16}
    [Time] wall=9.0s | cpu=6.7s | gpu=2.2s
    C:\Users\fbrev\Documents\Acadêmico\Simulações\Python\NoisyGL\predictor\Base_Predictor.py:114: UserWarning: expandable_segments not supported on this platform (Triggered internally at ..\c10/cuda/CUDAAllocatorConfig.h:28.)
    self.edge_index = self._cpu_edge_index.to(self.device)
    C:\Users\fbrev\Documents\Acadêmico\Simulações\Python\NoisyGL\predictor\Base_Predictor.py:144: UserWarning: Sparse CSR tensor support is in beta state. If you miss a functionality in the sparse tensor support, please submit a feature request to https://github.com/pytorch/pytorch/issues. (Triggered internally at ..\aten\src\ATen\SparseCsrTensorImpl.cpp:55.)
    self.adj_csr = self.adj.to_sparse_csr().to(self.device)
[I 2026-05-07 21:28:40,050] Trial 45 finished with value: 0.688 and parameters: {'lr': 0.05, 'weight_decay': 0.05, 'n_hidden': 128, 'n_layer': 3, 'dropout': 0.7954678826396964, 'knn_mode': 's', 'k': 7, 'dexp': 8.743610394038857, 'p_grd': 0.2109627199645375, 'unc_rem': 0.06224331417879911, 'unc_rel': 0.1524665143176167}. Best is trial 42 with value: 0.699.
    [CPU] Loading citeseer...
    DEBUG 3.1: Dataset init start
    DEBUG 3.2: prepare_data start citeseer
    ----Data statistics------'
    Name: citeseer
    #Nodes 3327
    #Edges 4552
    #Classes 6
    #Ave_degree 2.74
    ----Split statistics------'
    #Train samples 120 (default)
    #Val samples 500 (default)
    #Test samples 1000 (default)
    ----label noise information:------
    Instance dependent noise
    #Actual noise rate 0.20
    [cuda:0] LNPCC waiting for GPU slot...
    [cuda:0] Slot acquired (waited 1051.9s). Starting GCN...
    FINAL_RESULT: {'acc': {'train': 0.9150943396226415, 'valid': 0.586, 'test': 0.675}, 'wall_s': 8.69, 'cpu_s': 6.9, 'gpu_s': 1.77, 'wait_s': 1051.89}
    [Time] wall=8.7s | cpu=6.9s | gpu=1.8s
    C:\Users\fbrev\Documents\Acadêmico\Simulações\Python\NoisyGL\predictor\Base_Predictor.py:114: UserWarning: expandable_segments not supported on this platform (Triggered internally at ..\c10/cuda/CUDAAllocatorConfig.h:28.)
    self.edge_index = self._cpu_edge_index.to(self.device)
    C:\Users\fbrev\Documents\Acadêmico\Simulações\Python\NoisyGL\predictor\Base_Predictor.py:144: UserWarning: Sparse CSR tensor support is in beta state. If you miss a functionality in the sparse tensor support, please submit a feature request to https://github.com/pytorch/pytorch/issues. (Triggered internally at ..\aten\src\ATen\SparseCsrTensorImpl.cpp:55.)
    self.adj_csr = self.adj.to_sparse_csr().to(self.device)
[I 2026-05-07 21:46:26,219] Trial 46 finished with value: 0.675 and parameters: {'lr': 0.05, 'weight_decay': 0.05, 'n_hidden': 128, 'n_layer': 2, 'dropout': 0.791025696188585, 'knn_mode': 's', 'k': 15, 'dexp': 9.26341581067556, 'p_grd': 0.05420139077219199, 'unc_rem': 0.1816938484199332, 'unc_rel': 0.012713701240169156}. Best is trial 42 with value: 0.699.
    [CPU] Loading citeseer...
    DEBUG 3.1: Dataset init start
    DEBUG 3.2: prepare_data start citeseer
    ----Data statistics------'
    Name: citeseer
    #Nodes 3327
    #Edges 4552
    #Classes 6
    #Ave_degree 2.74
    ----Split statistics------'
    #Train samples 120 (default)
    #Val samples 500 (default)
    #Test samples 1000 (default)
    ----label noise information:------
    Instance dependent noise
    #Actual noise rate 0.20
    [cuda:0] LNPCC waiting for GPU slot...
    [cuda:0] Slot acquired (waited 344.0s). Starting GCN...
    FINAL_RESULT: {'acc': {'train': 0.7844827586206896, 'valid': 0.6, 'test': 0.707}, 'wall_s': 9.62, 'cpu_s': 7.46, 'gpu_s': 2.14, 'wait_s': 343.96}
    [Time] wall=9.6s | cpu=7.5s | gpu=2.1s
    C:\Users\fbrev\Documents\Acadêmico\Simulações\Python\NoisyGL\predictor\Base_Predictor.py:114: UserWarning: expandable_segments not supported on this platform (Triggered internally at ..\c10/cuda/CUDAAllocatorConfig.h:28.)
    self.edge_index = self._cpu_edge_index.to(self.device)
    C:\Users\fbrev\Documents\Acadêmico\Simulações\Python\NoisyGL\predictor\Base_Predictor.py:144: UserWarning: Sparse CSR tensor support is in beta state. If you miss a functionality in the sparse tensor support, please submit a feature request to https://github.com/pytorch/pytorch/issues. (Triggered internally at ..\aten\src\ATen\SparseCsrTensorImpl.cpp:55.)
    self.adj_csr = self.adj.to_sparse_csr().to(self.device)
