[I 2026-05-03 02:47:14,400] Trial 49 finished with value: 0.5700379475334103 and parameters: {'lr': 0.01, 'weight_decay': 0.0001, 'n_hidden': 32, 'n_layer': 2, 'dropout': 0.16941558595370976, 'knn_mode': 's', 'k': 20, 'dexp': 4.041011655075482, 'p_grd': 0.2916332779316846, 'unc_rem': 0.18633609740509752, 'unc_rel': 0.23945362630752476}. Best is trial 31 with value: 0.5807622504537205.

[Retest] Phase 1 Finished. Validating Top 3 (10 runs each)...

  [Retest] Candidate 1/3 (Trial 31, HPO_acc=0.5808)
    [CPU] Loading flickr...
    DEBUG 3.1: Dataset init start
    DEBUG 3.2: prepare_data start flickr
    ----Data statistics------'
    Name: flickr
    #Nodes 7575
    #Edges 239738
    #Classes 9
    #Ave_degree 63.30
    ----Split statistics------'
    #Train samples 378 (5.0 % of nodes)
    #Val samples 1136 (15.0 % of nodes)
    #Test samples 6061 (remaining)
    ----label noise information:------
    Instance dependent noise
    #Actual noise rate 0.13
    [cuda:1] LNPCC waiting for GPU slot...
    [cuda:1] Slot acquired (waited 0.0s). Starting GCN...
    FINAL_RESULT: {'acc': {'train': 0.839572192513369, 'valid': 0.4982394366197183, 'test': 0.5697079689820161}, 'wall_s': 124.1, 'cpu_s': 120.03, 'gpu_s': 3.78, 'wait_s': 0.0}
    [Time] wall=124.1s | cpu=120.0s | gpu=3.8s
    C:\Users\fbrev\anaconda3\envs\noisygl\Lib\site-packages\torch\_utils.py:315: UserWarning: Sparse CSR tensor support is in beta state. If you miss a functionality in the sparse tensor support, please submit a feature request to https://github.com/pytorch/pytorch/issues. (Triggered internally at ..\aten\src\ATen\SparseCsrTensorImpl.cpp:55.)
    result = torch.sparse_compressed_tensor(
    C:\Users\fbrev\Documents\Acadêmico\Simulações\Python\NoisyGL\predictor\Base_Predictor.py:114: UserWarning: expandable_segments not supported on this platform (Triggered internally at ..\c10/cuda/CUDAAllocatorConfig.h:28.)
    self.edge_index = self._cpu_edge_index.to(self.device)
    [CPU] Loading flickr...
    DEBUG 3.1: Dataset init start
    DEBUG 3.2: prepare_data start flickr
    ----Data statistics------'
    Name: flickr
    #Nodes 7575
    #Edges 239738
    #Classes 9
    #Ave_degree 63.30
    ----Split statistics------'
    #Train samples 378 (5.0 % of nodes)
    #Val samples 1136 (15.0 % of nodes)
    #Test samples 6061 (remaining)
    ----label noise information:------
    Instance dependent noise
    #Actual noise rate 0.13
    [cuda:1] LNPCC waiting for GPU slot...
    [cuda:1] Slot acquired (waited 1.5s). Starting GCN...
    FINAL_RESULT: {'acc': {'train': 0.9708994708994709, 'valid': 0.5325704225352113, 'test': 0.5541989770664907}, 'wall_s': 123.48, 'cpu_s': 119.49, 'gpu_s': 3.72, 'wait_s': 1.47}
    [Time] wall=123.5s | cpu=119.5s | gpu=3.7s
    C:\Users\fbrev\anaconda3\envs\noisygl\Lib\site-packages\torch\_utils.py:315: UserWarning: Sparse CSR tensor support is in beta state. If you miss a functionality in the sparse tensor support, please submit a feature request to https://github.com/pytorch/pytorch/issues. (Triggered internally at ..\aten\src\ATen\SparseCsrTensorImpl.cpp:55.)
    result = torch.sparse_compressed_tensor(
    C:\Users\fbrev\Documents\Acadêmico\Simulações\Python\NoisyGL\predictor\Base_Predictor.py:114: UserWarning: expandable_segments not supported on this platform (Triggered internally at ..\c10/cuda/CUDAAllocatorConfig.h:28.)
    self.edge_index = self._cpu_edge_index.to(self.device)
    [CPU] Loading flickr...
    DEBUG 3.1: Dataset init start
    DEBUG 3.2: prepare_data start flickr
    ----Data statistics------'
    Name: flickr
    #Nodes 7575
    #Edges 239738
    #Classes 9
    #Ave_degree 63.30
    ----Split statistics------'
    #Train samples 378 (5.0 % of nodes)
    #Val samples 1136 (15.0 % of nodes)
    #Test samples 6061 (remaining)
    ----label noise information:------
    Instance dependent noise
    #Actual noise rate 0.14
    [cuda:1] LNPCC waiting for GPU slot...
    [cuda:1] Slot acquired (waited 1.7s). Starting GCN...
    FINAL_RESULT: {'acc': {'train': 0.9444444444444444, 'valid': 0.4841549295774648, 'test': 0.5805972611780235}, 'wall_s': 119.12, 'cpu_s': 114.87, 'gpu_s': 3.94, 'wait_s': 1.67}
    [Time] wall=119.1s | cpu=114.9s | gpu=3.9s
    C:\Users\fbrev\anaconda3\envs\noisygl\Lib\site-packages\torch\_utils.py:315: UserWarning: Sparse CSR tensor support is in beta state. If you miss a functionality in the sparse tensor support, please submit a feature request to https://github.com/pytorch/pytorch/issues. (Triggered internally at ..\aten\src\ATen\SparseCsrTensorImpl.cpp:55.)
    result = torch.sparse_compressed_tensor(
    C:\Users\fbrev\Documents\Acadêmico\Simulações\Python\NoisyGL\predictor\Base_Predictor.py:114: UserWarning: expandable_segments not supported on this platform (Triggered internally at ..\c10/cuda/CUDAAllocatorConfig.h:28.)
    self.edge_index = self._cpu_edge_index.to(self.device)
    [CPU] Loading flickr...
    DEBUG 3.1: Dataset init start
    DEBUG 3.2: prepare_data start flickr
    ----Data statistics------'
    Name: flickr
    #Nodes 7575
    #Edges 239738
    #Classes 9
    #Ave_degree 63.30
    ----Split statistics------'
    #Train samples 378 (5.0 % of nodes)
    #Val samples 1136 (15.0 % of nodes)
    #Test samples 6061 (remaining)
    ----label noise information:------
    Instance dependent noise
    #Actual noise rate 0.13
    [cuda:1] LNPCC waiting for GPU slot...
    [cuda:1] Slot acquired (waited 117.8s). Starting GCN...
    FINAL_RESULT: {'acc': {'train': 0.944, 'valid': 0.5211267605633803, 'test': 0.5682230655007424}, 'wall_s': 133.79, 'cpu_s': 129.72, 'gpu_s': 3.76, 'wait_s': 117.78}
    [Time] wall=133.8s | cpu=129.7s | gpu=3.8s
    C:\Users\fbrev\anaconda3\envs\noisygl\Lib\site-packages\torch\_utils.py:315: UserWarning: Sparse CSR tensor support is in beta state. If you miss a functionality in the sparse tensor support, please submit a feature request to https://github.com/pytorch/pytorch/issues. (Triggered internally at ..\aten\src\ATen\SparseCsrTensorImpl.cpp:55.)
    result = torch.sparse_compressed_tensor(
    C:\Users\fbrev\Documents\Acadêmico\Simulações\Python\NoisyGL\predictor\Base_Predictor.py:114: UserWarning: expandable_segments not supported on this platform (Triggered internally at ..\c10/cuda/CUDAAllocatorConfig.h:28.)
    self.edge_index = self._cpu_edge_index.to(self.device)
    [CPU] Loading flickr...
    DEBUG 3.1: Dataset init start
    DEBUG 3.2: prepare_data start flickr
    ----Data statistics------'
    Name: flickr
    #Nodes 7575
    #Edges 239738
    #Classes 9
    #Ave_degree 63.30
    ----Split statistics------'
    #Train samples 378 (5.0 % of nodes)
    #Val samples 1136 (15.0 % of nodes)
    #Test samples 6061 (remaining)
    ----label noise information:------
    Instance dependent noise
    #Actual noise rate 0.13
    [cuda:1] LNPCC waiting for GPU slot...
    [cuda:1] Slot acquired (waited 180.9s). Starting GCN...
    FINAL_RESULT: {'acc': {'train': 0.9517426273458445, 'valid': 0.5149647887323944, 'test': 0.5601385909915856}, 'wall_s': 102.84, 'cpu_s': 98.84, 'gpu_s': 3.76, 'wait_s': 180.88}
    [Time] wall=102.8s | cpu=98.8s | gpu=3.8s
    C:\Users\fbrev\anaconda3\envs\noisygl\Lib\site-packages\torch\_utils.py:315: UserWarning: Sparse CSR tensor support is in beta state. If you miss a functionality in the sparse tensor support, please submit a feature request to https://github.com/pytorch/pytorch/issues. (Triggered internally at ..\aten\src\ATen\SparseCsrTensorImpl.cpp:55.)
    result = torch.sparse_compressed_tensor(
    C:\Users\fbrev\Documents\Acadêmico\Simulações\Python\NoisyGL\predictor\Base_Predictor.py:114: UserWarning: expandable_segments not supported on this platform (Triggered internally at ..\c10/cuda/CUDAAllocatorConfig.h:28.)
    self.edge_index = self._cpu_edge_index.to(self.device)
    [CPU] Loading flickr...
    DEBUG 3.1: Dataset init start
    DEBUG 3.2: prepare_data start flickr
    ----Data statistics------'
    Name: flickr
    #Nodes 7575
    #Edges 239738
    #Classes 9
    #Ave_degree 63.30
    ----Split statistics------'
    #Train samples 378 (5.0 % of nodes)
    #Val samples 1136 (15.0 % of nodes)
    #Test samples 6061 (remaining)
    ----label noise information:------
    Instance dependent noise
    #Actual noise rate 0.13
    [cuda:1] LNPCC waiting for GPU slot...
    [cuda:1] Slot acquired (waited 303.7s). Starting GCN...
    FINAL_RESULT: {'acc': {'train': 0.9283819628647215, 'valid': 0.49911971830985913, 'test': 0.5622834515756476}, 'wall_s': 102.31, 'cpu_s': 98.33, 'gpu_s': 3.72, 'wait_s': 303.66}
    [Time] wall=102.3s | cpu=98.3s | gpu=3.7s
    C:\Users\fbrev\anaconda3\envs\noisygl\Lib\site-packages\torch\_utils.py:315: UserWarning: Sparse CSR tensor support is in beta state. If you miss a functionality in the sparse tensor support, please submit a feature request to https://github.com/pytorch/pytorch/issues. (Triggered internally at ..\aten\src\ATen\SparseCsrTensorImpl.cpp:55.)
    result = torch.sparse_compressed_tensor(
    C:\Users\fbrev\Documents\Acadêmico\Simulações\Python\NoisyGL\predictor\Base_Predictor.py:114: UserWarning: expandable_segments not supported on this platform (Triggered internally at ..\c10/cuda/CUDAAllocatorConfig.h:28.)
    self.edge_index = self._cpu_edge_index.to(self.device)
    [CPU] Loading flickr...
    DEBUG 3.1: Dataset init start
    DEBUG 3.2: prepare_data start flickr
    ----Data statistics------'
    Name: flickr
    #Nodes 7575
    #Edges 239738
    #Classes 9
    #Ave_degree 63.30
    ----Split statistics------'
    #Train samples 378 (5.0 % of nodes)
    #Val samples 1136 (15.0 % of nodes)
    #Test samples 6061 (remaining)
    ----label noise information:------
    Instance dependent noise
    #Actual noise rate 0.12
    [cuda:1] LNPCC waiting for GPU slot...
    [cuda:1] Slot acquired (waited 290.6s). Starting GCN...
    FINAL_RESULT: {'acc': {'train': 0.8746666666666667, 'valid': 0.5202464788732394, 'test': 0.5583237089589177}, 'wall_s': 126.11, 'cpu_s': 122.21, 'gpu_s': 3.64, 'wait_s': 290.64}
    [Time] wall=126.1s | cpu=122.2s | gpu=3.6s
    C:\Users\fbrev\anaconda3\envs\noisygl\Lib\site-packages\torch\_utils.py:315: UserWarning: Sparse CSR tensor support is in beta state. If you miss a functionality in the sparse tensor support, please submit a feature request to https://github.com/pytorch/pytorch/issues. (Triggered internally at ..\aten\src\ATen\SparseCsrTensorImpl.cpp:55.)
    result = torch.sparse_compressed_tensor(
    C:\Users\fbrev\Documents\Acadêmico\Simulações\Python\NoisyGL\predictor\Base_Predictor.py:114: UserWarning: expandable_segments not supported on this platform (Triggered internally at ..\c10/cuda/CUDAAllocatorConfig.h:28.)
    self.edge_index = self._cpu_edge_index.to(self.device)
    [CPU] Loading flickr...
    DEBUG 3.1: Dataset init start
    DEBUG 3.2: prepare_data start flickr
    ----Data statistics------'
    Name: flickr
    #Nodes 7575
    #Edges 239738
    #Classes 9
    #Ave_degree 63.30
    ----Split statistics------'
    #Train samples 378 (5.0 % of nodes)
    #Val samples 1136 (15.0 % of nodes)
    #Test samples 6061 (remaining)
    ----label noise information:------
    Instance dependent noise
    #Actual noise rate 0.13
    [cuda:1] LNPCC waiting for GPU slot...
    [cuda:1] Slot acquired (waited 16.9s). Starting GCN...
    FINAL_RESULT: {'acc': {'train': 0.8994708994708994, 'valid': 0.5105633802816901, 'test': 0.5579937304075235}, 'wall_s': 117.09, 'cpu_s': 113.03, 'gpu_s': 3.82, 'wait_s': 16.86}
    [Time] wall=117.1s | cpu=113.0s | gpu=3.8s
    C:\Users\fbrev\anaconda3\envs\noisygl\Lib\site-packages\torch\_utils.py:315: UserWarning: Sparse CSR tensor support is in beta state. If you miss a functionality in the sparse tensor support, please submit a feature request to https://github.com/pytorch/pytorch/issues. (Triggered internally at ..\aten\src\ATen\SparseCsrTensorImpl.cpp:55.)
    result = torch.sparse_compressed_tensor(
    C:\Users\fbrev\Documents\Acadêmico\Simulações\Python\NoisyGL\predictor\Base_Predictor.py:114: UserWarning: expandable_segments not supported on this platform (Triggered internally at ..\c10/cuda/CUDAAllocatorConfig.h:28.)
    self.edge_index = self._cpu_edge_index.to(self.device)
    [CPU] Loading flickr...
    DEBUG 3.1: Dataset init start
    DEBUG 3.2: prepare_data start flickr
    ----Data statistics------'
    Name: flickr
    #Nodes 7575
    #Edges 239738
    #Classes 9
    #Ave_degree 63.30
    ----Split statistics------'
    #Train samples 378 (5.0 % of nodes)
    #Val samples 1136 (15.0 % of nodes)
    #Test samples 6061 (remaining)
    ----label noise information:------
    Instance dependent noise
    #Actual noise rate 0.13
    [cuda:1] LNPCC waiting for GPU slot...
    [cuda:1] Slot acquired (waited 46.0s). Starting GCN...
    FINAL_RESULT: {'acc': {'train': 0.9386666666666666, 'valid': 0.5044014084507042, 'test': 0.5705329153605015}, 'wall_s': 107.12, 'cpu_s': 102.9, 'gpu_s': 3.95, 'wait_s': 46.04}
    [Time] wall=107.1s | cpu=102.9s | gpu=4.0s
    C:\Users\fbrev\anaconda3\envs\noisygl\Lib\site-packages\torch\_utils.py:315: UserWarning: Sparse CSR tensor support is in beta state. If you miss a functionality in the sparse tensor support, please submit a feature request to https://github.com/pytorch/pytorch/issues. (Triggered internally at ..\aten\src\ATen\SparseCsrTensorImpl.cpp:55.)
    result = torch.sparse_compressed_tensor(
    C:\Users\fbrev\Documents\Acadêmico\Simulações\Python\NoisyGL\predictor\Base_Predictor.py:114: UserWarning: expandable_segments not supported on this platform (Triggered internally at ..\c10/cuda/CUDAAllocatorConfig.h:28.)
    self.edge_index = self._cpu_edge_index.to(self.device)
    [CPU] Loading flickr...
    DEBUG 3.1: Dataset init start
    DEBUG 3.2: prepare_data start flickr
    ----Data statistics------'
    Name: flickr
    #Nodes 7575
    #Edges 239738
    #Classes 9
    #Ave_degree 63.30
    ----Split statistics------'
    #Train samples 378 (5.0 % of nodes)
    #Val samples 1136 (15.0 % of nodes)
    #Test samples 6061 (remaining)
    ----label noise information:------
    Instance dependent noise
    #Actual noise rate 0.13
    [cuda:1] LNPCC waiting for GPU slot...
    [cuda:1] Slot acquired (waited 48.3s). Starting GCN...
    FINAL_RESULT: {'acc': {'train': 0.8888888888888888, 'valid': 0.5325704225352113, 'test': 0.5457845240059396}, 'wall_s': 92.56, 'cpu_s': 88.3, 'gpu_s': 3.98, 'wait_s': 48.26}
    [Time] wall=92.6s | cpu=88.3s | gpu=4.0s
    C:\Users\fbrev\anaconda3\envs\noisygl\Lib\site-packages\torch\_utils.py:315: UserWarning: Sparse CSR tensor support is in beta state. If you miss a functionality in the sparse tensor support, please submit a feature request to https://github.com/pytorch/pytorch/issues. (Triggered internally at ..\aten\src\ATen\SparseCsrTensorImpl.cpp:55.)
    result = torch.sparse_compressed_tensor(
    C:\Users\fbrev\Documents\Acadêmico\Simulações\Python\NoisyGL\predictor\Base_Predictor.py:114: UserWarning: expandable_segments not supported on this platform (Triggered internally at ..\c10/cuda/CUDAAllocatorConfig.h:28.)
    self.edge_index = self._cpu_edge_index.to(self.device)
  [Retest] Candidate 1 Avg: 0.5628

  [Retest] Candidate 2/3 (Trial 37, HPO_acc=0.5799)
    [CPU] Loading flickr...
    DEBUG 3.1: Dataset init start
    DEBUG 3.2: prepare_data start flickr
    ----Data statistics------'
    Name: flickr
    #Nodes 7575
    #Edges 239738
    #Classes 9
    #Ave_degree 63.30
    ----Split statistics------'
    #Train samples 378 (5.0 % of nodes)
    #Val samples 1136 (15.0 % of nodes)
    #Test samples 6061 (remaining)
    ----label noise information:------
    Instance dependent noise
    #Actual noise rate 0.13
    [cuda:1] LNPCC waiting for GPU slot...
    [cuda:1] Slot acquired (waited 618.6s). Starting GCN...
    FINAL_RESULT: {'acc': {'train': 0.9812834224598931, 'valid': 0.5123239436619719, 'test': 0.5802672826266293}, 'wall_s': 53.01, 'cpu_s': 49.09, 'gpu_s': 3.64, 'wait_s': 618.64}
    [Time] wall=53.0s | cpu=49.1s | gpu=3.6s
    C:\Users\fbrev\anaconda3\envs\noisygl\Lib\site-packages\torch\_utils.py:315: UserWarning: Sparse CSR tensor support is in beta state. If you miss a functionality in the sparse tensor support, please submit a feature request to https://github.com/pytorch/pytorch/issues. (Triggered internally at ..\aten\src\ATen\SparseCsrTensorImpl.cpp:55.)
    result = torch.sparse_compressed_tensor(
    C:\Users\fbrev\Documents\Acadêmico\Simulações\Python\NoisyGL\predictor\Base_Predictor.py:114: UserWarning: expandable_segments not supported on this platform (Triggered internally at ..\c10/cuda/CUDAAllocatorConfig.h:28.)
    self.edge_index = self._cpu_edge_index.to(self.device)
    [CPU] Loading flickr...
    DEBUG 3.1: Dataset init start
    DEBUG 3.2: prepare_data start flickr
    ----Data statistics------'
    Name: flickr
    #Nodes 7575
    #Edges 239738
    #Classes 9
    #Ave_degree 63.30
    ----Split statistics------'
    #Train samples 378 (5.0 % of nodes)
    #Val samples 1136 (15.0 % of nodes)
    #Test samples 6061 (remaining)
    ----label noise information:------
    Instance dependent noise
    #Actual noise rate 0.13
    [cuda:1] LNPCC waiting for GPU slot...
    [cuda:1] Slot acquired (waited 1458.0s). Starting GCN...
    FINAL_RESULT: {'acc': {'train': 0.9919786096256684, 'valid': 0.5360915492957746, 'test': 0.5530440521366111}, 'wall_s': 57.96, 'cpu_s': 54.0, 'gpu_s': 3.72, 'wait_s': 1458.01}
    [Time] wall=58.0s | cpu=54.0s | gpu=3.7s
    C:\Users\fbrev\anaconda3\envs\noisygl\Lib\site-packages\torch\_utils.py:315: UserWarning: Sparse CSR tensor support is in beta state. If you miss a functionality in the sparse tensor support, please submit a feature request to https://github.com/pytorch/pytorch/issues. (Triggered internally at ..\aten\src\ATen\SparseCsrTensorImpl.cpp:55.)
    result = torch.sparse_compressed_tensor(
    C:\Users\fbrev\Documents\Acadêmico\Simulações\Python\NoisyGL\predictor\Base_Predictor.py:114: UserWarning: expandable_segments not supported on this platform (Triggered internally at ..\c10/cuda/CUDAAllocatorConfig.h:28.)
    self.edge_index = self._cpu_edge_index.to(self.device)
    [CPU] Loading flickr...
    DEBUG 3.1: Dataset init start
    DEBUG 3.2: prepare_data start flickr
    ----Data statistics------'
    Name: flickr
    #Nodes 7575
    #Edges 239738
    #Classes 9
    #Ave_degree 63.30
    ----Split statistics------'
    #Train samples 378 (5.0 % of nodes)
    #Val samples 1136 (15.0 % of nodes)
    #Test samples 6061 (remaining)
    ----label noise information:------
    Instance dependent noise
    #Actual noise rate 0.14
    [cuda:1] LNPCC waiting for GPU slot...
    [cuda:1] Slot acquired (waited 311.3s). Starting GCN...
    FINAL_RESULT: {'acc': {'train': 0.9734748010610079, 'valid': 0.49471830985915494, 'test': 0.5761425507342023}, 'wall_s': 49.77, 'cpu_s': 45.62, 'gpu_s': 3.89, 'wait_s': 311.35}
    [Time] wall=49.8s | cpu=45.6s | gpu=3.9s
    C:\Users\fbrev\anaconda3\envs\noisygl\Lib\site-packages\torch\_utils.py:315: UserWarning: Sparse CSR tensor support is in beta state. If you miss a functionality in the sparse tensor support, please submit a feature request to https://github.com/pytorch/pytorch/issues. (Triggered internally at ..\aten\src\ATen\SparseCsrTensorImpl.cpp:55.)
    result = torch.sparse_compressed_tensor(
    C:\Users\fbrev\Documents\Acadêmico\Simulações\Python\NoisyGL\predictor\Base_Predictor.py:114: UserWarning: expandable_segments not supported on this platform (Triggered internally at ..\c10/cuda/CUDAAllocatorConfig.h:28.)
    self.edge_index = self._cpu_edge_index.to(self.device)
    [CPU] Loading flickr...
    DEBUG 3.1: Dataset init start
    DEBUG 3.2: prepare_data start flickr
    ----Data statistics------'
    Name: flickr
    #Nodes 7575
    #Edges 239738
    #Classes 9
    #Ave_degree 63.30
    ----Split statistics------'
    #Train samples 378 (5.0 % of nodes)
    #Val samples 1136 (15.0 % of nodes)
    #Test samples 6061 (remaining)
    ----label noise information:------
    Instance dependent noise
    #Actual noise rate 0.13
    [cuda:1] LNPCC waiting for GPU slot...
    [cuda:1] Slot acquired (waited 71.6s). Starting GCN...
    FINAL_RESULT: {'acc': {'train': 0.8803191489361702, 'valid': 0.5158450704225352, 'test': 0.5632733872298301}, 'wall_s': 51.48, 'cpu_s': 47.39, 'gpu_s': 3.83, 'wait_s': 71.55}
    [Time] wall=51.5s | cpu=47.4s | gpu=3.8s
    C:\Users\fbrev\anaconda3\envs\noisygl\Lib\site-packages\torch\_utils.py:315: UserWarning: Sparse CSR tensor support is in beta state. If you miss a functionality in the sparse tensor support, please submit a feature request to https://github.com/pytorch/pytorch/issues. (Triggered internally at ..\aten\src\ATen\SparseCsrTensorImpl.cpp:55.)
    result = torch.sparse_compressed_tensor(
    C:\Users\fbrev\Documents\Acadêmico\Simulações\Python\NoisyGL\predictor\Base_Predictor.py:114: UserWarning: expandable_segments not supported on this platform (Triggered internally at ..\c10/cuda/CUDAAllocatorConfig.h:28.)
    self.edge_index = self._cpu_edge_index.to(self.device)
    [CPU] Loading flickr...
    DEBUG 3.1: Dataset init start
    DEBUG 3.2: prepare_data start flickr
    ----Data statistics------'
    Name: flickr
    #Nodes 7575
    #Edges 239738
    #Classes 9
    #Ave_degree 63.30
    ----Split statistics------'
    #Train samples 378 (5.0 % of nodes)
    #Val samples 1136 (15.0 % of nodes)
    #Test samples 6061 (remaining)
    ----label noise information:------
    Instance dependent noise
    #Actual noise rate 0.13
    [cuda:1] LNPCC waiting for GPU slot...
    [cuda:1] Slot acquired (waited 191.6s). Starting GCN...
    FINAL_RESULT: {'acc': {'train': 0.9946808510638298, 'valid': 0.522887323943662, 'test': 0.5543639663421878}, 'wall_s': 54.99, 'cpu_s': 50.92, 'gpu_s': 3.81, 'wait_s': 191.61}
    [Time] wall=55.0s | cpu=50.9s | gpu=3.8s
    C:\Users\fbrev\anaconda3\envs\noisygl\Lib\site-packages\torch\_