[I 2026-05-01 03:45:04,134] Trial 91 finished with value: 0.771 and parameters: {'lr': 0.001, 'weight_decay': 0.01, 'n_hidden': 32, 'n_layer': 2, 'dropout': 0.6447369530044793, 'knn_mode': 's', 'k': 40, 'dexp': 4.718233391563833, 'p_grd': 0.9738898188566802, 'unc_rem': 0.7405185560162276, 'unc_rel': 0.867148653684896}. Best is trial 74 with value: 0.797.

[Retest] Phase 1 Finished. Validating Top 3 (10 runs each)...

  [Retest] Candidate 1/3 (Trial 74, HPO_acc=0.7970)
    [CPU] Loading amazoncom...
    DEBUG 3.1: Dataset init start
    DEBUG 3.2: prepare_data start amazoncom
    ----Data statistics------'
    Name: amazoncom
    #Nodes 13752
    #Edges 245861
    #Classes 10
    #Ave_degree 35.76
    ----Split statistics------'
    #Train samples 200 (20 nodes per class)
    #Val samples 500 (specified)
    #Test samples 1000 (specified)
    ----label noise information:------
    Instance dependent noise
    #Actual noise rate 0.39
    [cuda:1] LNPCC waiting for GPU slot...
    [cuda:1] Slot acquired (waited 360.0s). Starting GCN...
    FINAL_RESULT: {'acc': {'train': 0.6530612244897959, 'valid': 0.504, 'test': 0.774}, 'wall_s': 47.46, 'cpu_s': 44.53, 'gpu_s': 2.85, 'wait_s': 360.01}
    [Time] wall=47.5s | cpu=44.5s | gpu=2.8s
    C:\Users\fbrev\Documents\Acadêmico\Simulações\Python\NoisyGL\predictor\Base_Predictor.py:144: UserWarning: Sparse CSR tensor support is in beta state. If you miss a functionality in the sparse tensor support, please submit a feature request to https://github.com/pytorch/pytorch/issues. (Triggered internally at ..\aten\src\ATen\SparseCsrTensorImpl.cpp:55.)
    self.adj_csr = self.adj.to_sparse_csr().to(self.device)
    [CPU] Loading amazoncom...
    DEBUG 3.1: Dataset init start
    DEBUG 3.2: prepare_data start amazoncom
    ----Data statistics------'
    Name: amazoncom
    #Nodes 13752
    #Edges 245861
    #Classes 10
    #Ave_degree 35.76
    ----Split statistics------'
    #Train samples 200 (20 nodes per class)
    #Val samples 500 (specified)
    #Test samples 1000 (specified)
    ----label noise information:------
    Instance dependent noise
    #Actual noise rate 0.39
    [cuda:1] LNPCC waiting for GPU slot...
    [cuda:1] Slot acquired (waited 593.7s). Starting GCN...
    FINAL_RESULT: {'acc': {'train': 0.5846153846153846, 'valid': 0.444, 'test': 0.61}, 'wall_s': 51.04, 'cpu_s': 48.11, 'gpu_s': 2.83, 'wait_s': 593.72}
    [Time] wall=51.0s | cpu=48.1s | gpu=2.8s
    C:\Users\fbrev\Documents\Acadêmico\Simulações\Python\NoisyGL\predictor\Base_Predictor.py:144: UserWarning: Sparse CSR tensor support is in beta state. If you miss a functionality in the sparse tensor support, please submit a feature request to https://github.com/pytorch/pytorch/issues. (Triggered internally at ..\aten\src\ATen\SparseCsrTensorImpl.cpp:55.)
    self.adj_csr = self.adj.to_sparse_csr().to(self.device)
    [CPU] Loading amazoncom...
    DEBUG 3.1: Dataset init start
    DEBUG 3.2: prepare_data start amazoncom
    ----Data statistics------'
    Name: amazoncom
    #Nodes 13752
    #Edges 245861
    #Classes 10
    #Ave_degree 35.76
    ----Split statistics------'
    #Train samples 200 (20 nodes per class)
    #Val samples 500 (specified)
    #Test samples 1000 (specified)
    ----label noise information:------
    Instance dependent noise
    #Actual noise rate 0.40
    [cuda:1] LNPCC waiting for GPU slot...
    [cuda:1] Slot acquired (waited 93.0s). Starting GCN...
    FINAL_RESULT: {'acc': {'train': 0.6060606060606061, 'valid': 0.46, 'test': 0.717}, 'wall_s': 49.49, 'cpu_s': 46.64, 'gpu_s': 2.74, 'wait_s': 92.99}
    [Time] wall=49.5s | cpu=46.6s | gpu=2.7s
    C:\Users\fbrev\Documents\Acadêmico\Simulações\Python\NoisyGL\predictor\Base_Predictor.py:144: UserWarning: Sparse CSR tensor support is in beta state. If you miss a functionality in the sparse tensor support, please submit a feature request to https://github.com/pytorch/pytorch/issues. (Triggered internally at ..\aten\src\ATen\SparseCsrTensorImpl.cpp:55.)
    self.adj_csr = self.adj.to_sparse_csr().to(self.device)
    [CPU] Loading amazoncom...
    DEBUG 3.1: Dataset init start
    DEBUG 3.2: prepare_data start amazoncom
    ----Data statistics------'
    Name: amazoncom
    #Nodes 13752
    #Edges 245861
    #Classes 10
    #Ave_degree 35.76
    ----Split statistics------'
    #Train samples 200 (20 nodes per class)
    #Val samples 500 (specified)
    #Test samples 1000 (specified)
    ----label noise information:------
    Instance dependent noise
    #Actual noise rate 0.40
    [cuda:1] LNPCC waiting for GPU slot...
    [cuda:1] Slot acquired (waited 727.0s). Starting GCN...
    FINAL_RESULT: {'acc': {'train': 0.5279187817258884, 'valid': 0.514, 'test': 0.771}, 'wall_s': 52.61, 'cpu_s': 49.82, 'gpu_s': 2.72, 'wait_s': 726.96}
    [Time] wall=52.6s | cpu=49.8s | gpu=2.7s
    C:\Users\fbrev\Documents\Acadêmico\Simulações\Python\NoisyGL\predictor\Base_Predictor.py:144: UserWarning: Sparse CSR tensor support is in beta state. If you miss a functionality in the sparse tensor support, please submit a feature request to https://github.com/pytorch/pytorch/issues. (Triggered internally at ..\aten\src\ATen\SparseCsrTensorImpl.cpp:55.)
    self.adj_csr = self.adj.to_sparse_csr().to(self.device)
    [CPU] Loading amazoncom...
    DEBUG 3.1: Dataset init start
    DEBUG 3.2: prepare_data start amazoncom
    ----Data statistics------'
    Name: amazoncom
    #Nodes 13752
    #Edges 245861
    #Classes 10
    #Ave_degree 35.76
    ----Split statistics------'
    #Train samples 200 (20 nodes per class)
    #Val samples 500 (specified)
    #Test samples 1000 (specified)
    ----label noise information:------
    Instance dependent noise
    #Actual noise rate 0.40
    [cuda:1] LNPCC waiting for GPU slot...
    [cuda:1] Slot acquired (waited 72.8s). Starting GCN...
    FINAL_RESULT: {'acc': {'train': 0.5888324873096447, 'valid': 0.46, 'test': 0.753}, 'wall_s': 47.52, 'cpu_s': 44.52, 'gpu_s': 2.9, 'wait_s': 72.83}
    [Time] wall=47.5s | cpu=44.5s | gpu=2.9s
    C:\Users\fbrev\Documents\Acadêmico\Simulações\Python\NoisyGL\predictor\Base_Predictor.py:144: UserWarning: Sparse CSR tensor support is in beta state. If you miss a functionality in the sparse tensor support, please submit a feature request to https://github.com/pytorch/pytorch/issues. (Triggered internally at ..\aten\src\ATen\SparseCsrTensorImpl.cpp:55.)
    self.adj_csr = self.adj.to_sparse_csr().to(self.device)
    [CPU] Loading amazoncom...
    DEBUG 3.1: Dataset init start
    DEBUG 3.2: prepare_data start amazoncom
    ----Data statistics------'
    Name: amazoncom
    #Nodes 13752
    #Edges 245861
    #Classes 10
    #Ave_degree 35.76
    ----Split statistics------'
    #Train samples 200 (20 nodes per class)
    #Val samples 500 (specified)
    #Test samples 1000 (specified)
    ----label noise information:------
    Instance dependent noise
    #Actual noise rate 0.40
    [cuda:1] LNPCC waiting for GPU slot...
    [cuda:1] Slot acquired (waited 101.0s). Starting GCN...
    FINAL_RESULT: {'acc': {'train': 0.5612244897959183, 'valid': 0.414, 'test': 0.677}, 'wall_s': 52.27, 'cpu_s': 49.31, 'gpu_s': 2.85, 'wait_s': 101.04}
    [Time] wall=52.3s | cpu=49.3s | gpu=2.9s
    C:\Users\fbrev\Documents\Acadêmico\Simulações\Python\NoisyGL\predictor\Base_Predictor.py:144: UserWarning: Sparse CSR tensor support is in beta state. If you miss a functionality in the sparse tensor support, please submit a feature request to https://github.com/pytorch/pytorch/issues. (Triggered internally at ..\aten\src\ATen\SparseCsrTensorImpl.cpp:55.)
    self.adj_csr = self.adj.to_sparse_csr().to(self.device)
    [CPU] Loading amazoncom...
    DEBUG 3.1: Dataset init start
    DEBUG 3.2: prepare_data start amazoncom
    ----Data statistics------'
    Name: amazoncom
    #Nodes 13752
    #Edges 245861
    #Classes 10
    #Ave_degree 35.76
    ----Split statistics------'
    #Train samples 200 (20 nodes per class)
    #Val samples 500 (specified)
    #Test samples 1000 (specified)
    ----label noise information:------
    Instance dependent noise
    #Actual noise rate 0.40
    [cuda:1] LNPCC waiting for GPU slot...
    [cuda:1] Slot acquired (waited 75.4s). Starting GCN...
    FINAL_RESULT: {'acc': {'train': 0.5326633165829145, 'valid': 0.412, 'test': 0.673}, 'wall_s': 50.68, 'cpu_s': 47.75, 'gpu_s': 2.83, 'wait_s': 75.36}
    [Time] wall=50.7s | cpu=47.8s | gpu=2.8s
    C:\Users\fbrev\Documents\Acadêmico\Simulações\Python\NoisyGL\predictor\Base_Predictor.py:144: UserWarning: Sparse CSR tensor support is in beta state. If you miss a functionality in the sparse tensor support, please submit a feature request to https://github.com/pytorch/pytorch/issues. (Triggered internally at ..\aten\src\ATen\SparseCsrTensorImpl.cpp:55.)
    self.adj_csr = self.adj.to_sparse_csr().to(self.device)
    [CPU] Loading amazoncom...
    DEBUG 3.1: Dataset init start
    DEBUG 3.2: prepare_data start amazoncom
    ----Data statistics------'
    Name: amazoncom
    #Nodes 13752
    #Edges 245861
    #Classes 10
    #Ave_degree 35.76
    ----Split statistics------'
    #Train samples 200 (20 nodes per class)
    #Val samples 500 (specified)
    #Test samples 1000 (specified)
    ----label noise information:------
    Instance dependent noise
    #Actual noise rate 0.40
    [cuda:1] LNPCC waiting for GPU slot...
    [cuda:1] Slot acquired (waited 382.2s). Starting GCN...
    FINAL_RESULT: {'acc': {'train': 0.5714285714285714, 'valid': 0.504, 'test': 0.772}, 'wall_s': 50.26, 'cpu_s': 47.36, 'gpu_s': 2.81, 'wait_s': 382.16}
    [Time] wall=50.3s | cpu=47.4s | gpu=2.8s
    C:\Users\fbrev\Documents\Acadêmico\Simulações\Python\NoisyGL\predictor\Base_Predictor.py:144: UserWarning: Sparse CSR tensor support is in beta state. If you miss a functionality in the sparse tensor support, please submit a feature request to https://github.com/pytorch/pytorch/issues. (Triggered internally at ..\aten\src\ATen\SparseCsrTensorImpl.cpp:55.)
    self.adj_csr = self.adj.to_sparse_csr().to(self.device)
    [CPU] Loading amazoncom...
    DEBUG 3.1: Dataset init start
    DEBUG 3.2: prepare_data start amazoncom
    ----Data statistics------'
    Name: amazoncom
    #Nodes 13752
    #Edges 245861
    #Classes 10
    #Ave_degree 35.76
    ----Split statistics------'
    #Train samples 200 (20 nodes per class)
    #Val samples 500 (specified)
    #Test samples 1000 (specified)
    ----label noise information:------
    Instance dependent noise
    #Actual noise rate 0.40
    [cuda:1] LNPCC waiting for GPU slot...
    [cuda:1] Slot acquired (waited 72.2s). Starting GCN...
    FINAL_RESULT: {'acc': {'train': 0.6060606060606061, 'valid': 0.504, 'test': 0.793}, 'wall_s': 49.32, 'cpu_s': 46.3, 'gpu_s': 2.93, 'wait_s': 72.22}
    [Time] wall=49.3s | cpu=46.3s | gpu=2.9s
    C:\Users\fbrev\Documents\Acadêmico\Simulações\Python\NoisyGL\predictor\Base_Predictor.py:144: UserWarning: Sparse CSR tensor support is in beta state. If you miss a functionality in the sparse tensor support, please submit a feature request to https://github.com/pytorch/pytorch/issues. (Triggered internally at ..\aten\src\ATen\SparseCsrTensorImpl.cpp:55.)
    self.adj_csr = self.adj.to_sparse_csr().to(self.device)
    [CPU] Loading amazoncom...
    DEBUG 3.1: Dataset init start
    DEBUG 3.2: prepare_data start amazoncom
    ----Data statistics------'
    Name: amazoncom
    #Nodes 13752
    #Edges 245861
    #Classes 10
    #Ave_degree 35.76
    ----Split statistics------'
    #Train samples 200 (20 nodes per class)
    #Val samples 500 (specified)
    #Test samples 1000 (specified)
    ----label noise information:------
    Instance dependent noise
    #Actual noise rate 0.40
    [cuda:1] LNPCC waiting for GPU slot...
    [cuda:1] Slot acquired (waited 215.3s). Starting GCN...
    FINAL_RESULT: {'acc': {'train': 0.5628140703517588, 'valid': 0.412, 'test': 0.639}, 'wall_s': 48.16, 'cpu_s': 45.2, 'gpu_s': 2.86, 'wait_s': 215.31}
    [Time] wall=48.2s | cpu=45.2s | gpu=2.9s
    C:\Users\fbrev\Documents\Acadêmico\Simulações\Python\NoisyGL\predictor\Base_Predictor.py:144: UserWarning: Sparse CSR tensor support is in beta state. If you miss a functionality in the sparse tensor support, please submit a feature request to https://github.com/pytorch/pytorch/issues. (Triggered internally at ..\aten\src\ATen\SparseCsrTensorImpl.cpp:55.)
    self.adj_csr = self.adj.to_sparse_csr().to(self.device)
  [Retest] Candidate 1 Avg: 0.7179

  [Retest] Candidate 2/3 (Trial 81, HPO_acc=0.7920)
    [CPU] Loading amazoncom...
    DEBUG 3.1: Dataset init start
    DEBUG 3.2: prepare_data start amazoncom
    ----Data statistics------'
    Name: amazoncom
    #Nodes 13752
    #Edges 245861
    #Classes 10
    #Ave_degree 35.76
    ----Split statistics------'
    #Train samples 200 (20 nodes per class)
    #Val samples 500 (specified)
    #Test samples 1000 (specified)
    ----label noise information:------
    Instance dependent noise
    #Actual noise rate 0.39
    [cuda:1] LNPCC waiting for GPU slot...
    [cuda:1] Slot acquired (waited 196.2s). Starting GCN...
    FINAL_RESULT: {'acc': {'train': 0.6071428571428571, 'valid': 0.506, 'test': 0.781}, 'wall_s': 46.94, 'cpu_s': 44.05, 'gpu_s': 2.81, 'wait_s': 196.17}
    [Time] wall=46.9s | cpu=44.1s | gpu=2.8s
    C:\Users\fbrev\Documents\Acadêmico\Simulações\Python\NoisyGL\predictor\Base_Predictor.py:144: UserWarning: Sparse CSR tensor support is in beta state. If you miss a functionality in the sparse tensor support, please submit a feature request to https://github.com/pytorch/pytorch/issues. (Triggered internally at ..\aten\src\ATen\SparseCsrTensorImpl.cpp:55.)
    self.adj_csr = self.adj.to_sparse_csr().to(self.device)
    [CPU] Loading amazoncom...
    DEBUG 3.1: Dataset init start
    DEBUG 3.2: prepare_data start amazoncom
    ----Data statistics------'
    Name: amazoncom
    #Nodes 13752
    #Edges 245861
    #Classes 10
    #Ave_degree 35.76
    ----Split statistics------'
    #Train samples 200 (20 nodes per class)
    #Val samples 500 (specified)
    #Test samples 1000 (specified)
    ----label noise information:------
    Instance dependent noise
    #Actual noise rate 0.39
    [cuda:1] LNPCC waiting for GPU slot...
    [cuda:1] Slot acquired (waited 97.3s). Starting GCN...
    FINAL_RESULT: {'acc': {'train': 0.6358974358974359, 'valid': 0.438, 'test': 0.595}, 'wall_s': 44.83, 'cpu_s': 41.77, 'gpu_s': 2.95, 'wait_s': 97.29}
    [Time] wall=44.8s | cpu=41.8s | gpu=2.9s
    C:\Users\fbrev\Documents\Acadêmico\Simulações\Python\NoisyGL\predictor\Base_Predictor.py:144: UserWarning: Sparse CSR tensor support is in beta state. If you miss a functionality in the sparse tensor support, please submit a feature request to https://github.com/pytorch/pytorch/issues. (Triggered internally at ..\aten\src\ATen\SparseCsrTensorImpl.cpp:55.)
    self.adj_csr = self.adj.to_sparse_csr().to(self.device)
    [CPU] Loading amazoncom...
    DEBUG 3.1: Dataset init start
    DEBUG 3.2: prepare_data start amazoncom
    ----Data statistics------'
    Name: amazoncom
    #Nodes 13752
    #Edges 245861
    #Classes 10
    #Ave_degree 35.76
    ----Split statistics------'
    #Train samples 200 (20 nodes per class)
    #Val samples 500 (specified)
    #Test samples 1000 (specified)
    ----label noise information:------
    Instance dependent noise
    #Actual noise rate 0.40
    [cuda:1] LNPCC waiting for GPU slot...
    [cuda:1] Slot acquired (waited 339.2s). Starting GCN...
    FINAL_RESULT: {'acc': {'train': 0.6060606060606061, 'valid': 0.466, 'test': 0.734}, 'wall_s': 49.2, 'cpu_s': 46.19, 'gpu_s': 2.91, 'wait_s': 339.18}
    [Time] wall=49.2s | cpu=46.2s | gpu=2.9s
    C:\Users\fbrev\Documents\Acadêmico\Simulações\Python\NoisyGL\predictor\Base_Predictor.py:144: UserWarning: Sparse CSR tensor support is in beta state. If you miss a functionality in the sparse tensor support, please submit a feature request to https://github.com/pytorch/pytorch/issues. (Triggered internally at ..\aten\src\ATen\SparseCsrTensorImpl.cpp:55.)
    self.adj_csr = self.adj.to_sparse_csr().to(self.device)
    [CPU] Loading amazoncom...
    DEBUG 3.1: Dataset init start
    DEBUG 3.2: prepare_data start amazoncom
    ----Data statistics------'
    Name: amazoncom
    #Nodes 13752
    #Edges 245861
    #Classes 10
    #Ave_degree 35.76
    ----Split statistics------'
    #Train samples 200 (20 nodes per class)
    #Val samples 500 (specified)
    #Test samples 1000 (specified)
    ----label noise information:------
    Instance dependent noise
    #Actual noise rate 0.40
    [cuda:1] LNPCC waiting for GPU slot...
    [cuda:1] Slot acquired (waited 613.6s). Starting GCN...
    FINAL_RESULT: {'acc': {'train': 0.5380710659898477, 'valid': 0.508, 'test': 0.774}, 'wall_s': 54.25, 'cpu_s': 51.28, 'gpu_s': 2.9, 'wait_s': 613.57}
    [Time] wall=54.2s | cpu=51.3s | gpu=2.9s
    C:\Users\fbrev\Documents\Acadêmico\Simulações\Python\NoisyGL\predictor\Base_Predictor.py:144: UserWarning: Sparse CSR tensor support is in beta state. If you miss a functionality in the sparse tensor support, please submit a feature request to https://github.com/pytorch/pytorch/issues. (Triggered internally at ..\aten\src\ATen\SparseCsrTensorImpl.cpp:55.)
    self.adj_csr = self.adj.to_sparse_csr().to(self.device)
    [CPU] Loading amazoncom...
    DEBUG 3.1: Dataset init start
    DEBUG 3.2: prepare_data start amazoncom
    ----Data statistics------'
    Name: amazoncom
    #Nodes 13752
    #Edges 245861
    #Classes 10
    #Ave_degree 35.76
    ----Split statistics------'
    #Train samples 200 (20 nodes per class)
    #Val samples 500 (specified)
    #Test samples 1000 (specified)
    ----label noise information:------
    Instance dependent noise
    #Actual noise rate 0.40
    [cuda:1] LNPCC waiting for GPU slot...
    [cuda:1] Slot acquired (waited 87.8s). Starting GCN...
    FINAL_RESULT: {'acc': {'train': 0.5989847715736041, 'valid': 0.462, 'test': 0.745}, 'wall_s': 50.44, 'cpu_s': 47.56, 'gpu_s': 2.77, 'wait_s': 87.78}
    [Time] wall=50.4s | cpu=47.6s | gpu=2.8s
    C:\Users\fbrev\Documents\Acadêmico\Simulações\Python\NoisyGL\predictor\Base_Predictor.py:144: UserWarning: Sparse CSR tensor support is in beta state. If you miss a functionality in the sparse tensor support, please submit a feature request to https://github.com/pytorch/pytorch/issues. (Triggered internally at ..\aten\src\ATen\SparseCsrTensorImpl.cpp:55.)
    self.adj_csr = self.adj.to_sparse_csr().to(self.device)
    [CPU] Loading amazoncom...
    DEBUG 3.1: Dataset init start
    DEBUG 3.2: prepare_data start amazoncom
    ----Data statistics------'
    Name: amazoncom
    #Nodes 13752
    #Edges 245861
    #Classes 10
    #Ave_degree 35.76
    ----Split statistics------'
    #Train samples 200 (20 nodes per class)
    #Val samples 500 (specified)
    #Test samples 1000 (specified)
    ----label noise information:------
    Instance dependent noise
    #Actual noise rate 0.40
    [cuda:1] LNPCC waiting for GPU slot...
    [cuda:1] Slot acquired (waited 213.9s). Starting GCN...
    FINAL_RESULT: {'acc': {'train': 0.5663265306122449, 'valid': 0.418, 'test': 0.686}, 'wall_s': 52.81, 'cpu_s': 50.05, 'gpu_s': 2.66, 'wait_s': 213.86}
    [Time] wall=52.8s | cpu=50.1s | gpu=2.7s
    C:\Users\fbrev\Documents\Acadêmico\Simulações\Python\NoisyGL\predictor\Base_Predictor.py:144: UserWarning: Sparse CSR tensor support is in beta state. If you miss a functionality in the sparse tensor support, please submit a feature request to https://github.com/pytorch/pytorch/issues. (Triggered internally at ..\aten\src\ATen\SparseCsrTensorImpl.cpp:55.)
    self.adj_csr = self.adj.to_sparse_csr().to(self.device)
    [CPU] Loading amazoncom...
    DEBUG 3.1: Dataset init start
    DEBUG 3.2: prepare_data start amazoncom
    ----Data statistics------'
    Name: amazoncom
    #Nodes 13752
    #Edges 245861
    #Classes 10
    #Ave_degree 35.76
    ----Split statistics------'
    #Train samples 200 (20 nodes per class)
    #Val samples 500 (specified)
    #Test samples 1000 (specified)
    ----label noise information:------
    Instance dependent noise
    #Actual noise rate 0.40
    [cuda:1] LNPCC waiting for GPU slot...
    [cuda:1] Slot acquired (waited 91.1s). Starting GCN...
    FINAL_RESULT: {'acc': {'train': 0.5577889447236181, 'valid': 0.41, 'test': 0.651}, 'wall_s': 54.74, 'cpu_s': 51.68, 'gpu_s': 2.96, 'wait_s': 91.1}
    [Time] wall=54.7s | cpu=51.7s | gpu=3.0s
    C:\Users\fbrev\Documents\Acadêmico\Simulações\Python\NoisyGL\predictor\Base_Predictor.py:144: UserWarning: Sparse CSR tensor support is in beta state. If you miss a functionality in the sparse tensor support, please submit a feature request to https://github.com/pytorch/pytorch/issues. (Triggered internally at ..\aten\src\ATen\SparseCsrTensorImpl.cpp:55.)
    self.adj_csr = self.adj.to_sparse_csr().to(self.device)
    [CPU] Loading amazoncom...
    DEBUG 3.1: Dataset init start
    DEBUG 3.2: prepare_data start amazoncom
    ----Data statistics------'
    Name: amazoncom
    #Nodes 13752
    #Edges 245861
    #Classes 10
    #Ave_degree 35.76
    ----Split statistics------'
    #Train samples 200 (20 nodes per class)
    #Val samples 500 (specified)
    #Test samples 1000 (specified)
    ----label noise information:------
    Instance dependent noise
    #Actual noise rate 0.40
    [cuda:1] LNPCC waiting for GPU slot...
    [cuda:1] Slot acquired (waited 73.7s). Starting GCN...
    FINAL_RESULT: {'acc': {'train': 0.5459183673469388, 'valid': 0.49, 'test': 0.741}, 'wall_s': 45.71, 'cpu_s': 42.84, 'gpu_s': 2.8, 'wait_s': 73.75}
    [Time] wall=45.7s | cpu=42.8s | gpu=2.8s
    C:\Users\fbrev\Documents\Acadêmico\Simulações\Python\NoisyGL\predictor\Base_Predictor.py:144: UserWarning: Sparse CSR tensor support is in beta state. If you miss a functionality in the sparse tensor support, please submit a feature request to https://github.com/pytorch/pytorch/issues. (Triggered internally at ..\aten\src\ATen\SparseCsrT