[I 2026-05-05 18:11:24,455] Trial 116 finished with value: 0.7323612417685795 and parameters: {'lr': 0.005, 'weight_decay': 0.0001, 'n_hidden': 128, 'n_layer': 3, 'dropout': 0.5356825629525054, 'knn_mode': 's', 'k': 15, 'dexp': 2.127163176658733, 'p_grd': 0.3407158878404473, 'unc_rem': 0.08504287896989211, 'unc_rel': 0.11867460897293938}. Best is trial 95 with value: 0.7595081306276038.
    [CPU] Loading dblp...
    DEBUG 3.1: Dataset init start
    DEBUG 3.2: prepare_data start dblp
    ----Data statistics------'
    Name: dblp
    #Nodes 17716
    #Edges 52867
    #Classes 4
    #Ave_degree 5.97
    ----Split statistics------'
    #Train samples 177 (1.0 % of nodes)
    #Val samples 2657 (15.0 % of nodes)
    #Test samples 14882 (remaining)
    ----label noise information:------
    Instance dependent noise
    #Actual noise rate 0.30
    [cuda:1] LNPCC waiting for GPU slot...
    [cuda:1] Slot acquired (waited 145.4s). Starting GCN...
    FINAL_RESULT: {'acc': {'train': 0.75, 'valid': 0.5242754986827248, 'test': 0.6970837253057385}, 'wall_s': 39.78, 'cpu_s': 35.0, 'gpu_s': 4.7, 'wait_s': 145.35}
    [Time] wall=39.8s | cpu=35.0s | gpu=4.7s
    C:\Users\fbrev\Documents\Acadêmico\Simulações\Python\NoisyGL\predictor\Base_Predictor.py:114: UserWarning: expandable_segments not supported on this platform (Triggered internally at ..\c10/cuda/CUDAAllocatorConfig.h:28.)
    self.edge_index = self._cpu_edge_index.to(self.device)
    C:\Users\fbrev\Documents\Acadêmico\Simulações\Python\NoisyGL\predictor\Base_Predictor.py:144: UserWarning: Sparse CSR tensor support is in beta state. If you miss a functionality in the sparse tensor support, please submit a feature request to https://github.com/pytorch/pytorch/issues. (Triggered internally at ..\aten\src\ATen\SparseCsrTensorImpl.cpp:55.)
    self.adj_csr = self.adj.to_sparse_csr().to(self.device)
[I 2026-05-05 18:14:35,443] Trial 117 finished with value: 0.6970837253057385 and parameters: {'lr': 0.005, 'weight_decay': 0.0001, 'n_hidden': 128, 'n_layer': 3, 'dropout': 0.701892966941362, 'knn_mode': 's', 'k': 19, 'dexp': 3.4695039773285794, 'p_grd': 0.2171801223439459, 'unc_rem': 0.4600472273913249, 'unc_rel': 0.052610794080490325}. Best is trial 95 with value: 0.7595081306276038.
    [CPU] Loading dblp...
    DEBUG 3.1: Dataset init start
    DEBUG 3.2: prepare_data start dblp
    ----Data statistics------'
    Name: dblp
    #Nodes 17716
    #Edges 52867
    #Classes 4
    #Ave_degree 5.97
    ----Split statistics------'
    #Train samples 177 (1.0 % of nodes)
    #Val samples 2657 (15.0 % of nodes)
    #Test samples 14882 (remaining)
    ----label noise information:------
    Instance dependent noise
    #Actual noise rate 0.30
    [cuda:1] LNPCC waiting for GPU slot...
    [cuda:1] Slot acquired (waited 134.6s). Starting GCN...
    FINAL_RESULT: {'acc': {'train': 0.52, 'valid': 0.5182536695521265, 'test': 0.6825695471038838}, 'wall_s': 42.48, 'cpu_s': 39.17, 'gpu_s': 3.2, 'wait_s': 134.62}
    [Time] wall=42.5s | cpu=39.2s | gpu=3.2s
    C:\Users\fbrev\Documents\Acadêmico\Simulações\Python\NoisyGL\predictor\Base_Predictor.py:114: UserWarning: expandable_segments not supported on this platform (Triggered internally at ..\c10/cuda/CUDAAllocatorConfig.h:28.)
    self.edge_index = self._cpu_edge_index.to(self.device)
    C:\Users\fbrev\Documents\Acadêmico\Simulações\Python\NoisyGL\predictor\Base_Predictor.py:144: UserWarning: Sparse CSR tensor support is in beta state. If you miss a functionality in the sparse tensor support, please submit a feature request to https://github.com/pytorch/pytorch/issues. (Triggered internally at ..\aten\src\ATen\SparseCsrTensorImpl.cpp:55.)
    self.adj_csr = self.adj.to_sparse_csr().to(self.device)
[I 2026-05-05 18:17:38,734] Trial 118 finished with value: 0.6825695471038838 and parameters: {'lr': 0.1, 'weight_decay': 0.0001, 'n_hidden': 32, 'n_layer': 3, 'dropout': 0.519474643800492, 'knn_mode': 's', 'k': 17, 'dexp': 4.432780903300036, 'p_grd': 0.4334507293000644, 'unc_rem': 0.04606804965805422, 'unc_rel': 0.1752765360908344}. Best is trial 95 with value: 0.7595081306276038.
    [CPU] Loading dblp...
    DEBUG 3.1: Dataset init start
    DEBUG 3.2: prepare_data start dblp
    ----Data statistics------'
    Name: dblp
    #Nodes 17716
    #Edges 52867
    #Classes 4
    #Ave_degree 5.97
    ----Split statistics------'
    #Train samples 177 (1.0 % of nodes)
    #Val samples 2657 (15.0 % of nodes)
    #Test samples 14882 (remaining)
    ----label noise information:------
    Instance dependent noise
    #Actual noise rate 0.30
    [cuda:1] LNPCC waiting for GPU slot...
    [cuda:1] Slot acquired (waited 139.7s). Starting GCN...
    FINAL_RESULT: {'acc': {'train': 0.8571428571428571, 'valid': 0.517877305231464, 'test': 0.6926488375218385}, 'wall_s': 40.84, 'cpu_s': 38.04, 'gpu_s': 2.71, 'wait_s': 139.75}
    [Time] wall=40.8s | cpu=38.0s | gpu=2.7s
    C:\Users\fbrev\Documents\Acadêmico\Simulações\Python\NoisyGL\predictor\Base_Predictor.py:114: UserWarning: expandable_segments not supported on this platform (Triggered internally at ..\c10/cuda/CUDAAllocatorConfig.h:28.)
    self.edge_index = self._cpu_edge_index.to(self.device)
    C:\Users\fbrev\Documents\Acadêmico\Simulações\Python\NoisyGL\predictor\Base_Predictor.py:144: UserWarning: Sparse CSR tensor support is in beta state. If you miss a functionality in the sparse tensor support, please submit a feature request to https://github.com/pytorch/pytorch/issues. (Triggered internally at ..\aten\src\ATen\SparseCsrTensorImpl.cpp:55.)
    self.adj_csr = self.adj.to_sparse_csr().to(self.device)
[I 2026-05-05 18:20:45,320] Trial 119 finished with value: 0.6926488375218385 and parameters: {'lr': 0.01, 'weight_decay': 0.0001, 'n_hidden': 64, 'n_layer': 2, 'dropout': 0.6290227503952637, 'knn_mode': 's', 'k': 26, 'dexp': 4.86942459612244, 'p_grd': 0.2571900477347737, 'unc_rem': 0.7887702636526992, 'unc_rel': 0.6285504188936257}. Best is trial 95 with value: 0.7595081306276038.
    [CPU] Loading dblp...
    DEBUG 3.1: Dataset init start
    DEBUG 3.2: prepare_data start dblp
    ----Data statistics------'
    Name: dblp
    #Nodes 17716
    #Edges 52867
    #Classes 4
    #Ave_degree 5.97
    ----Split statistics------'
    #Train samples 177 (1.0 % of nodes)
    #Val samples 2657 (15.0 % of nodes)
    #Test samples 14882 (remaining)
    ----label noise information:------
    Instance dependent noise
    #Actual noise rate 0.30
    [cuda:1] LNPCC waiting for GPU slot...
    [cuda:1] Slot acquired (waited 49.1s). Starting GCN...
    FINAL_RESULT: {'acc': {'train': 0.6912751677852349, 'valid': 0.5148663906661648, 'test': 0.6838462572234915}, 'wall_s': 143.66, 'cpu_s': 140.13, 'gpu_s': 3.45, 'wait_s': 49.14}
    [Time] wall=143.7s | cpu=140.1s | gpu=3.4s
    C:\Users\fbrev\Documents\Acadêmico\Simulações\Python\NoisyGL\predictor\Base_Predictor.py:114: UserWarning: expandable_segments not supported on this platform (Triggered internally at ..\c10/cuda/CUDAAllocatorConfig.h:28.)
    self.edge_index = self._cpu_edge_index.to(self.device)
    C:\Users\fbrev\Documents\Acadêmico\Simulações\Python\NoisyGL\predictor\Base_Predictor.py:144: UserWarning: Sparse CSR tensor support is in beta state. If you miss a functionality in the sparse tensor support, please submit a feature request to https://github.com/pytorch/pytorch/issues. (Triggered internally at ..\aten\src\ATen\SparseCsrTensorImpl.cpp:55.)
    self.adj_csr = self.adj.to_sparse_csr().to(self.device)
[I 2026-05-05 18:24:04,430] Trial 120 finished with value: 0.6838462572234915 and parameters: {'lr': 0.005, 'weight_decay': 0.05, 'n_hidden': 64, 'n_layer': 3, 'dropout': 0.37770594712115046, 'knn_mode': 'd', 'k': 44, 'dexp': 1.7997107053576193, 'p_grd': 0.3201844002934696, 'unc_rem': 0.13372891329380215, 'unc_rel': 0.21100056525302394}. Best is trial 95 with value: 0.7595081306276038.
    [CPU] Loading dblp...
    DEBUG 3.1: Dataset init start
    DEBUG 3.2: prepare_data start dblp
    ----Data statistics------'
    Name: dblp
    #Nodes 17716
    #Edges 52867
    #Classes 4
    #Ave_degree 5.97
    ----Split statistics------'
    #Train samples 177 (1.0 % of nodes)
    #Val samples 2657 (15.0 % of nodes)
    #Test samples 14882 (remaining)
    ----label noise information:------
    Instance dependent noise
    #Actual noise rate 0.30
    [cuda:1] LNPCC waiting for GPU slot...
    [cuda:1] Slot acquired (waited 160.0s). Starting GCN...
    FINAL_RESULT: {'acc': {'train': 0.9020979020979021, 'valid': 0.5114791117802032, 'test': 0.6780002687810778}, 'wall_s': 35.42, 'cpu_s': 31.78, 'gpu_s': 3.56, 'wait_s': 160.03}
    [Time] wall=35.4s | cpu=31.8s | gpu=3.6s
    C:\Users\fbrev\Documents\Acadêmico\Simulações\Python\NoisyGL\predictor\Base_Predictor.py:114: UserWarning: expandable_segments not supported on this platform (Triggered internally at ..\c10/cuda/CUDAAllocatorConfig.h:28.)
    self.edge_index = self._cpu_edge_index.to(self.device)
    C:\Users\fbrev\Documents\Acadêmico\Simulações\Python\NoisyGL\predictor\Base_Predictor.py:144: UserWarning: Sparse CSR tensor support is in beta state. If you miss a functionality in the sparse tensor support, please submit a feature request to https://github.com/pytorch/pytorch/issues. (Triggered internally at ..\aten\src\ATen\SparseCsrTensorImpl.cpp:55.)
    self.adj_csr = self.adj.to_sparse_csr().to(self.device)
[I 2026-05-05 18:27:26,071] Trial 121 finished with value: 0.6780002687810778 and parameters: {'lr': 0.05, 'weight_decay': 0.0001, 'n_hidden': 64, 'n_layer': 3, 'dropout': 0.4980205745592602, 'knn_mode': 's', 'k': 10, 'dexp': 3.0440385588469985, 'p_grd': 0.021731627361473188, 'unc_rem': 0.10528012259706321, 'unc_rel': 0.081955302286983}. Best is trial 95 with value: 0.7595081306276038.
    [CPU] Loading dblp...
    DEBUG 3.1: Dataset init start
    DEBUG 3.2: prepare_data start dblp
    ----Data statistics------'
    Name: dblp
    #Nodes 17716
    #Edges 52867
    #Classes 4
    #Ave_degree 5.97
    ----Split statistics------'
    #Train samples 177 (1.0 % of nodes)
    #Val samples 2657 (15.0 % of nodes)
    #Test samples 14882 (remaining)
    ----label noise information:------
    Instance dependent noise
    #Actual noise rate 0.30
    [cuda:1] LNPCC waiting for GPU slot...
    [cuda:1] Slot acquired (waited 140.6s). Starting GCN...
    FINAL_RESULT: {'acc': {'train': 0.9878048780487805, 'valid': 0.5261573202860369, 'test': 0.7015858083590916}, 'wall_s': 41.02, 'cpu_s': 37.32, 'gpu_s': 3.62, 'wait_s': 140.57}
    [Time] wall=41.0s | cpu=37.3s | gpu=3.6s
    C:\Users\fbrev\Documents\Acadêmico\Simulações\Python\NoisyGL\predictor\Base_Predictor.py:114: UserWarning: expandable_segments not supported on this platform (Triggered internally at ..\c10/cuda/CUDAAllocatorConfig.h:28.)
    self.edge_index = self._cpu_edge_index.to(self.device)
    C:\Users\fbrev\Documents\Acadêmico\Simulações\Python\NoisyGL\predictor\Base_Predictor.py:144: UserWarning: Sparse CSR tensor support is in beta state. If you miss a functionality in the sparse tensor support, please submit a feature request to https://github.com/pytorch/pytorch/issues. (Triggered internally at ..\aten\src\ATen\SparseCsrTensorImpl.cpp:55.)
    self.adj_csr = self.adj.to_sparse_csr().to(self.device)
[I 2026-05-05 18:30:33,627] Trial 122 finished with value: 0.7015858083590916 and parameters: {'lr': 0.1, 'weight_decay': 0.0001, 'n_hidden': 64, 'n_layer': 3, 'dropout': 0.659370932594695, 'knn_mode': 's', 'k': 33, 'dexp': 4.226036700161089, 'p_grd': 0.18537587843831527, 'unc_rem': 0.16337664600160146, 'unc_rel': 0.1271755157254101}. Best is trial 95 with value: 0.7595081306276038.
    [CPU] Loading dblp...
    DEBUG 3.1: Dataset init start
    DEBUG 3.2: prepare_data start dblp
    ----Data statistics------'
    Name: dblp
    #Nodes 17716
    #Edges 52867
    #Classes 4
    #Ave_degree 5.97
    ----Split statistics------'
    #Train samples 177 (1.0 % of nodes)
    #Val samples 2657 (15.0 % of nodes)
    #Test samples 14882 (remaining)
    ----label noise information:------
    Instance dependent noise
    #Actual noise rate 0.30
    [cuda:1] LNPCC waiting for GPU slot...
    [cuda:1] Slot acquired (waited 139.1s). Starting GCN...
    FINAL_RESULT: {'acc': {'train': 0.9202453987730062, 'valid': 0.5302973278133233, 'test': 0.6896922456659051}, 'wall_s': 38.97, 'cpu_s': 34.16, 'gpu_s': 4.73, 'wait_s': 139.08}
    [Time] wall=39.0s | cpu=34.2s | gpu=4.7s
    C:\Users\fbrev\Documents\Acadêmico\Simulações\Python\NoisyGL\predictor\Base_Predictor.py:114: UserWarning: expandable_segments not supported on this platform (Triggered internally at ..\c10/cuda/CUDAAllocatorConfig.h:28.)
    self.edge_index = self._cpu_edge_index.to(self.device)
    C:\Users\fbrev\Documents\Acadêmico\Simulações\Python\NoisyGL\predictor\Base_Predictor.py:144: UserWarning: Sparse CSR tensor support is in beta state. If you miss a functionality in the sparse tensor support, please submit a feature request to https://github.com/pytorch/pytorch/issues. (Triggered internally at ..\aten\src\ATen\SparseCsrTensorImpl.cpp:55.)
    self.adj_csr = self.adj.to_sparse_csr().to(self.device)
[I 2026-05-05 18:33:38,392] Trial 123 finished with value: 0.6896922456659051 and parameters: {'lr': 0.001, 'weight_decay': 0.001, 'n_hidden': 128, 'n_layer': 3, 'dropout': 0.585110537870814, 'knn_mode': 's', 'k': 22, 'dexp': 3.896279684927455, 'p_grd': 0.10446027938933625, 'unc_rem': 0.8437766267100117, 'unc_rel': 0.09161687051952405}. Best is trial 95 with value: 0.7595081306276038.
    [CPU] Loading dblp...
    DEBUG 3.1: Dataset init start
    DEBUG 3.2: prepare_data start dblp
    ----Data statistics------'
    Name: dblp
    #Nodes 17716
    #Edges 52867
    #Classes 4
    #Ave_degree 5.97
    ----Split statistics------'
    #Train samples 177 (1.0 % of nodes)
    #Val samples 2657 (15.0 % of nodes)
    #Test samples 14882 (remaining)
    ----label noise information:------
    Instance dependent noise
    #Actual noise rate 0.30
    [cuda:1] LNPCC waiting for GPU slot...
    [cuda:1] Slot acquired (waited 139.1s). Starting GCN...
    FINAL_RESULT: {'acc': {'train': 0.8611111111111112, 'valid': 0.539330071509221, 'test': 0.7306813600322537}, 'wall_s': 41.89, 'cpu_s': 38.29, 'gpu_s': 3.52, 'wait_s': 139.06}
    [Time] wall=41.9s | cpu=38.3s | gpu=3.5s
    C:\Users\fbrev\Documents\Acadêmico\Simulações\Python\NoisyGL\predictor\Base_Predictor.py:114: UserWarning: expandable_segments not supported on this platform (Triggered internally at ..\c10/cuda/CUDAAllocatorConfig.h:28.)
    self.edge_index = self._cpu_edge_index.to(self.device)
    C:\Users\fbrev\Documents\Acadêmico\Simulações\Python\NoisyGL\predictor\Base_Predictor.py:144: UserWarning: Sparse CSR tensor support is in beta state. If you miss a functionality in the sparse tensor support, please submit a feature request to https://github.com/pytorch/pytorch/issues. (Triggered internally at ..\aten\src\ATen\SparseCsrTensorImpl.cpp:55.)
    self.adj_csr = self.adj.to_sparse_csr().to(self.device)
[I 2026-05-05 18:36:46,462] Trial 124 finished with value: 0.7306813600322537 and parameters: {'lr': 0.001, 'weight_decay': 0.0001, 'n_hidden': 64, 'n_layer': 3, 'dropout': 0.6746916149186786, 'knn_mode': 's', 'k': 31, 'dexp': 2.09242038537038, 'p_grd': 0.17093480749719492, 'unc_rem': 0.18138077348511067, 'unc_rel': 0.03648291167865356}. Best is trial 95 with value: 0.7595081306276038.
    [CPU] Loading dblp...
    DEBUG 3.1: Dataset init start
    DEBUG 3.2: prepare_data start dblp
    ----Data statistics------'
    Name: dblp
    #Nodes 17716
    #Edges 52867
    #Classes 4
    #Ave_degree 5.97
    ----Split statistics------'
    #Train samples 177 (1.0 % of nodes)
    #Val samples 2657 (15.0 % of nodes)
    #Test samples 14882 (remaining)
    ----label noise information:------
    Instance dependent noise
    #Actual noise rate 0.30
    [cuda:1] LNPCC waiting for GPU slot...
    [cuda:1] Slot acquired (waited 324.3s). Starting GCN...
    FINAL_RESULT: {'acc': {'train': 0.8618421052631579, 'valid': 0.5144900263455024, 'test': 0.6820319849482597}, 'wall_s': 41.18, 'cpu_s': 37.29, 'gpu_s': 3.8, 'wait_s': 324.34}
    [Time] wall=41.2s | cpu=37.3s | gpu=3.8s
    C:\Users\fbrev\Documents\Acadêmico\Simulações\Python\NoisyGL\predictor\Base_Predictor.py:114: UserWarning: expandable_segments not supported on this platform (Triggered internally at ..\c10/cuda/CUDAAllocatorConfig.h:28.)
    self.edge_index = self._cpu_edge_index.to(self.device)
    C:\Users\fbrev\Documents\Acadêmico\Simulações\Python\NoisyGL\predictor\Base_Predictor.py:144: UserWarning: Sparse CSR tensor support is in beta state. If you miss a functionality in the sparse tensor support, please submit a feature request to https://github.com/pytorch/pytorch/issues. (Triggered internally at ..\aten\src\ATen\SparseCsrTensorImpl.cpp:55.)
    self.adj_csr = self.adj.to_sparse_csr().to(self.device)
[I 2026-05-05 18:42:58,750] Trial 125 finished with value: 0.6820319849482597 and parameters: {'lr': 0.001, 'weight_decay': 0.0001, 'n_hidden': 64, 'n_layer': 3, 'dropout': 0.6880050590244496, 'knn_mode': 's', 'k': 29, 'dexp': 2.6571576853999517, 'p_grd': 0.13414745935910624, 'unc_rem': 0.24775313428656268, 'unc_rel': 0.06865770251688467}. Best is trial 95 with value: 0.7595081306276038.
    [CPU] Loading dblp...
    DEBUG 3.1: Dataset init start
    DEBUG 3.2: prepare_data start dblp
    ----Data statistics------'
    Name: dblp
    #Nodes 17716
    #Edges 52867
    #Classes 4
    #Ave_degree 5.97
    ----Split statistics------'
    #Train samples 177 (1.0 % of nodes)
    #Val samples 2657 (15.0 % of nodes)
    #Test samples 14882 (remaining)
    ----label noise information:------
    Instance dependent noise
    #Actual noise rate 0.30
    [cuda:1] LNPCC waiting for GPU slot...
    [cuda:1] Slot acquired (waited 149.5s). Starting GCN...
    FINAL_RESULT: {'acc': {'train': 0.9741935483870968, 'valid': 0.5532555513737297, 'test': 0.7464050530842629}, 'wall_s': 41.63, 'cpu_s': 37.99, 'gpu_s': 3.53, 'wait_s': 149.5}
    [Time] wall=41.6s | cpu=38.0s | gpu=3.5s
    C:\Users\fbrev\Documents\Acadêmico\Simulações\Python\NoisyGL\predictor\Base_Predictor.py:114: UserWarning: expandable_segments not supported on this platform (Triggered internally at ..\c10/cuda/CUDAAllocatorConfig.h:28.)
    self.edge_index = self._cpu_edge_index.to(self.device)
    C:\Users\fbrev\Documents\Acadêmico\Simulações\Python\NoisyGL\predictor\Base_Predictor.py:144: UserWarning: Sparse CSR tensor support is in beta state. If you miss a functionality in the sparse tensor support, please submit a feature request to https://github.com/pytorch/pytorch/issues. (Triggered internally at ..\aten\src\ATen\SparseCsrTensorImpl.cpp:55.)
    self.adj_csr = self.adj.to_sparse_csr().to(self.device)
[I 2026-05-05 18:46:16,466] Trial 126 finished with value: 0.7464050530842629 and parameters: {'lr': 0.001, 'weight_decay': 0.0001, 'n_hidden': 64, 'n_layer': 3, 'dropout': 0.641809854824843, 'knn_mode': 's', 'k': 35, 'dexp': 2.3903685320322907, 'p_grd': 0.21106394893930908, 'unc_rem': 0.2142297735594326, 'unc_rel': 0.04794537895226728}. Best is trial 95 with value: 0.7595081306276038.
    [CPU] Loading dblp...
    DEBUG 3.1: Dataset init start
    DEBUG 3.2: prepare_data start dblp
    ----Data statistics------'
    Name: dblp
    #Nodes 17716
    #Edges 52867
    #Classes 4
    #Ave_degree 5.97
    ----Split statistics------'
    #Train samples 177 (1.0 % of nodes)
    #Val samples 2657 (15.0 % of nodes)
    #Test samples 14882 (remaining)
    ----label noise information:------
    Instance dependent noise
    #Actual noise rate 0.30
    [cuda:1] LNPCC waiting for GPU slot...
    [cuda:1] Slot acquired (waited 130.6s). Starting GCN...
    FINAL_RESULT: {'acc': {'train': 0.8461538461538461, 'valid': 0.5269100489273617, 'test': 0.70487837656229}, 'wall_s': 40.22, 'cpu_s': 36.28, 'gpu_s': 3.85, 'wait_s': 130.63}
    [Time] wall=40.2s | cpu=36.3s | gpu=3.9s
    C:\Users\fbrev\Documents\Acadêmico\Simulações\Python\NoisyGL\predictor\Base_Predictor.py:114: UserWarning: expandable_segments not supported on this platform (Triggered internally at ..\c10/cuda/CUDAAllocatorConfig.h:28.)
    self.edge_index = self._cpu_edge_index.to(self.device)
    C:\Users\fbrev\Documents\Acadêmico\Simulações\Python\NoisyGL\predictor\Base_Predictor.py:144: UserWarning: Sparse CSR tensor support is in beta state. If you miss a functionality in the sparse tensor support, please submit a feature request to https://github.com/pytorch/pytorch/issues. (Triggered internally at ..\aten\src\ATen\SparseCsrTensorImpl.cpp:55.)
    self.adj_csr = self.adj.to_sparse_csr().to(self.device)
