[I 2026-05-01 21:14:43,893] Trial 22 finished with value: 0.907 and parameters: {'lr': 0.01, 'weight_decay': 0.05, 'n_hidden': 32, 'n_layer': 2, 'dropout': 0.2935395617100538, 'knn_mode': 'd', 'k': 40, 'dexp': 7.020646839400056, 'p_grd': 0.8644041923828916, 'unc_rem': 0.6145178546256347, 'unc_rel': 0.43445716318255234}. Best is trial 7 with value: 0.907.
    [CPU] Loading amazonpho...
    DEBUG 3.1: Dataset init start
    DEBUG 3.2: prepare_data start amazonpho
    ----Data statistics------'
    Name: amazonpho
    #Nodes 7650
    #Edges 119081
    #Classes 8
    #Ave_degree 31.13
    ----Split statistics------'
    #Train samples 160 (20 nodes per class)
    #Val samples 500 (specified)
    #Test samples 1000 (specified)
    ----label noise information:------
    Instance dependent noise
    #Actual noise rate 0.13
    [cuda:1] LNPCC waiting for GPU slot...
    [cuda:1] Slot acquired (waited 120.6s). Starting GCN...
    FINAL_RESULT: {'acc': {'train': 0.85625, 'valid': 0.806, 'test': 0.895}, 'wall_s': 24.68, 'cpu_s': 22.13, 'gpu_s': 2.47, 'wait_s': 120.63}
    [Time] wall=24.7s | cpu=22.1s | gpu=2.5s
    C:\Users\fbrev\Documents\Acadêmico\Simulações\Python\NoisyGL\predictor\Base_Predictor.py:114: UserWarning: expandable_segments not supported on this platform (Triggered internally at ..\c10/cuda/CUDAAllocatorConfig.h:28.)
    self.edge_index = self._cpu_edge_index.to(self.device)
    C:\Users\fbrev\Documents\Acadêmico\Simulações\Python\NoisyGL\predictor\Base_Predictor.py:144: UserWarning: Sparse CSR tensor support is in beta state. If you miss a functionality in the sparse tensor support, please submit a feature request to https://github.com/pytorch/pytorch/issues. (Triggered internally at ..\aten\src\ATen\SparseCsrTensorImpl.cpp:55.)
    self.adj_csr = self.adj.to_sparse_csr().to(self.device)
[I 2026-05-01 21:17:15,179] Trial 23 finished with value: 0.895 and parameters: {'lr': 0.01, 'weight_decay': 0.001, 'n_hidden': 64, 'n_layer': 2, 'dropout': 0.29619264633625636, 'knn_mode': 'd', 'k': 38, 'dexp': 7.045386358559175, 'p_grd': 0.8354885342181474, 'unc_rem': 0.6322077696930051, 'unc_rel': 0.004802174539642545}. Best is trial 7 with value: 0.907.
    [CPU] Loading amazonpho...
    DEBUG 3.1: Dataset init start
    DEBUG 3.2: prepare_data start amazonpho
    ----Data statistics------'
    Name: amazonpho
    #Nodes 7650
    #Edges 119081
    #Classes 8
    #Ave_degree 31.13
    ----Split statistics------'
    #Train samples 160 (20 nodes per class)
    #Val samples 500 (specified)
    #Test samples 1000 (specified)
    ----label noise information:------
    Instance dependent noise
    #Actual noise rate 0.13
    [cuda:1] LNPCC waiting for GPU slot...
    [cuda:1] Slot acquired (waited 269.0s). Starting GCN...
    FINAL_RESULT: {'acc': {'train': 0.85, 'valid': 0.808, 'test': 0.892}, 'wall_s': 24.34, 'cpu_s': 22.06, 'gpu_s': 2.21, 'wait_s': 268.99}
    [Time] wall=24.3s | cpu=22.1s | gpu=2.2s
    C:\Users\fbrev\Documents\Acadêmico\Simulações\Python\NoisyGL\predictor\Base_Predictor.py:114: UserWarning: expandable_segments not supported on this platform (Triggered internally at ..\c10/cuda/CUDAAllocatorConfig.h:28.)
    self.edge_index = self._cpu_edge_index.to(self.device)
    C:\Users\fbrev\Documents\Acadêmico\Simulações\Python\NoisyGL\predictor\Base_Predictor.py:144: UserWarning: Sparse CSR tensor support is in beta state. If you miss a functionality in the sparse tensor support, please submit a feature request to https://github.com/pytorch/pytorch/issues. (Triggered internally at ..\aten\src\ATen\SparseCsrTensorImpl.cpp:55.)
    self.adj_csr = self.adj.to_sparse_csr().to(self.device)
[I 2026-05-01 21:22:14,823] Trial 24 finished with value: 0.892 and parameters: {'lr': 0.01, 'weight_decay': 0.001, 'n_hidden': 32, 'n_layer': 2, 'dropout': 0.4316002007559612, 'knn_mode': 'd', 'k': 44, 'dexp': 5.533907037333363, 'p_grd': 0.7450258523528894, 'unc_rem': 0.4548321501407625, 'unc_rel': 0.44856006285661293}. Best is trial 7 with value: 0.907.
    [CPU] Loading amazonpho...
    DEBUG 3.1: Dataset init start
    DEBUG 3.2: prepare_data start amazonpho
    ----Data statistics------'
    Name: amazonpho
    #Nodes 7650
    #Edges 119081
    #Classes 8
    #Ave_degree 31.13
    ----Split statistics------'
    #Train samples 160 (20 nodes per class)
    #Val samples 500 (specified)
    #Test samples 1000 (specified)
    ----label noise information:------
    Instance dependent noise
    #Actual noise rate 0.13
    [cuda:1] LNPCC waiting for GPU slot...
    [cuda:1] Slot acquired (waited 115.3s). Starting GCN...
    FINAL_RESULT: {'acc': {'train': 0.8625, 'valid': 0.81, 'test': 0.903}, 'wall_s': 27.93, 'cpu_s': 23.03, 'gpu_s': 4.82, 'wait_s': 115.32}
    [Time] wall=27.9s | cpu=23.0s | gpu=4.8s
    C:\Users\fbrev\Documents\Acadêmico\Simulações\Python\NoisyGL\predictor\Base_Predictor.py:114: UserWarning: expandable_segments not supported on this platform (Triggered internally at ..\c10/cuda/CUDAAllocatorConfig.h:28.)
    self.edge_index = self._cpu_edge_index.to(self.device)
    C:\Users\fbrev\Documents\Acadêmico\Simulações\Python\NoisyGL\predictor\Base_Predictor.py:144: UserWarning: Sparse CSR tensor support is in beta state. If you miss a functionality in the sparse tensor support, please submit a feature request to https://github.com/pytorch/pytorch/issues. (Triggered internally at ..\aten\src\ATen\SparseCsrTensorImpl.cpp:55.)
    self.adj_csr = self.adj.to_sparse_csr().to(self.device)
[I 2026-05-01 21:24:44,061] Trial 25 finished with value: 0.903 and parameters: {'lr': 0.005, 'weight_decay': 0.05, 'n_hidden': 256, 'n_layer': 2, 'dropout': 0.2820143577741001, 'knn_mode': 'd', 'k': 40, 'dexp': 7.24435468747419, 'p_grd': 0.9083469063864031, 'unc_rem': 0.8211874041503026, 'unc_rel': 0.4225797389622218}. Best is trial 7 with value: 0.907.
    [CPU] Loading amazonpho...
    DEBUG 3.1: Dataset init start
    DEBUG 3.2: prepare_data start amazonpho
    ----Data statistics------'
    Name: amazonpho
    #Nodes 7650
    #Edges 119081
    #Classes 8
    #Ave_degree 31.13
    ----Split statistics------'
    #Train samples 160 (20 nodes per class)
    #Val samples 500 (specified)
    #Test samples 1000 (specified)
    ----label noise information:------
    Instance dependent noise
    #Actual noise rate 0.13
    [cuda:1] LNPCC waiting for GPU slot...
    [cuda:1] Slot acquired (waited 118.4s). Starting GCN...
    FINAL_RESULT: {'acc': {'train': 0.84375, 'valid': 0.806, 'test': 0.894}, 'wall_s': 21.62, 'cpu_s': 18.82, 'gpu_s': 2.75, 'wait_s': 118.42}
    [Time] wall=21.6s | cpu=18.8s | gpu=2.7s
    C:\Users\fbrev\Documents\Acadêmico\Simulações\Python\NoisyGL\predictor\Base_Predictor.py:114: UserWarning: expandable_segments not supported on this platform (Triggered internally at ..\c10/cuda/CUDAAllocatorConfig.h:28.)
    self.edge_index = self._cpu_edge_index.to(self.device)
    C:\Users\fbrev\Documents\Acadêmico\Simulações\Python\NoisyGL\predictor\Base_Predictor.py:144: UserWarning: Sparse CSR tensor support is in beta state. If you miss a functionality in the sparse tensor support, please submit a feature request to https://github.com/pytorch/pytorch/issues. (Triggered internally at ..\aten\src\ATen\SparseCsrTensorImpl.cpp:55.)
    self.adj_csr = self.adj.to_sparse_csr().to(self.device)
[I 2026-05-01 21:27:10,316] Trial 26 finished with value: 0.894 and parameters: {'lr': 0.01, 'weight_decay': 0.001, 'n_hidden': 64, 'n_layer': 2, 'dropout': 0.4209870022998712, 'knn_mode': 'd', 'k': 35, 'dexp': 6.095011576036051, 'p_grd': 0.5760078196247049, 'unc_rem': 0.36425326654057877, 'unc_rel': 0.3231987096000312}. Best is trial 7 with value: 0.907.
    [CPU] Loading amazonpho...
    DEBUG 3.1: Dataset init start
    DEBUG 3.2: prepare_data start amazonpho
    ----Data statistics------'
    Name: amazonpho
    #Nodes 7650
    #Edges 119081
    #Classes 8
    #Ave_degree 31.13
    ----Split statistics------'
    #Train samples 160 (20 nodes per class)
    #Val samples 500 (specified)
    #Test samples 1000 (specified)
    ----label noise information:------
    Instance dependent noise
    #Actual noise rate 0.13
    [cuda:1] LNPCC waiting for GPU slot...
    [cuda:1] Slot acquired (waited 111.4s). Starting GCN...
    FINAL_RESULT: {'acc': {'train': 0.4, 'valid': 0.562, 'test': 0.649}, 'wall_s': 24.91, 'cpu_s': 22.66, 'gpu_s': 2.16, 'wait_s': 111.44}
    [Time] wall=24.9s | cpu=22.7s | gpu=2.2s
    C:\Users\fbrev\Documents\Acadêmico\Simulações\Python\NoisyGL\predictor\Base_Predictor.py:114: UserWarning: expandable_segments not supported on this platform (Triggered internally at ..\c10/cuda/CUDAAllocatorConfig.h:28.)
    self.edge_index = self._cpu_edge_index.to(self.device)
    C:\Users\fbrev\Documents\Acadêmico\Simulações\Python\NoisyGL\predictor\Base_Predictor.py:144: UserWarning: Sparse CSR tensor support is in beta state. If you miss a functionality in the sparse tensor support, please submit a feature request to https://github.com/pytorch/pytorch/issues. (Triggered internally at ..\aten\src\ATen\SparseCsrTensorImpl.cpp:55.)
    self.adj_csr = self.adj.to_sparse_csr().to(self.device)
[I 2026-05-01 21:29:33,190] Trial 27 finished with value: 0.649 and parameters: {'lr': 0.1, 'weight_decay': 0.05, 'n_hidden': 32, 'n_layer': 2, 'dropout': 0.581462667281794, 'knn_mode': 'd', 'k': 46, 'dexp': 7.503459560124966, 'p_grd': 0.7686908572381598, 'unc_rem': 0.9981607879231895, 'unc_rel': 0.5291540248818907}. Best is trial 7 with value: 0.907.
    [CPU] Loading amazonpho...
    DEBUG 3.1: Dataset init start
    DEBUG 3.2: prepare_data start amazonpho
    ----Data statistics------'
    Name: amazonpho
    #Nodes 7650
    #Edges 119081
    #Classes 8
    #Ave_degree 31.13
    ----Split statistics------'
    #Train samples 160 (20 nodes per class)
    #Val samples 500 (specified)
    #Test samples 1000 (specified)
    ----label noise information:------
    Instance dependent noise
    #Actual noise rate 0.13
    [cuda:1] LNPCC waiting for GPU slot...
    [cuda:1] Slot acquired (waited 128.4s). Starting GCN...
    FINAL_RESULT: {'acc': {'train': 0.9144736842105263, 'valid': 0.798, 'test': 0.896}, 'wall_s': 16.5, 'cpu_s': 14.03, 'gpu_s': 2.39, 'wait_s': 128.4}
    [Time] wall=16.5s | cpu=14.0s | gpu=2.4s
    C:\Users\fbrev\Documents\Acadêmico\Simulações\Python\NoisyGL\predictor\Base_Predictor.py:114: UserWarning: expandable_segments not supported on this platform (Triggered internally at ..\c10/cuda/CUDAAllocatorConfig.h:28.)
    self.edge_index = self._cpu_edge_index.to(self.device)
    C:\Users\fbrev\Documents\Acadêmico\Simulações\Python\NoisyGL\predictor\Base_Predictor.py:144: UserWarning: Sparse CSR tensor support is in beta state. If you miss a functionality in the sparse tensor support, please submit a feature request to https://github.com/pytorch/pytorch/issues. (Triggered internally at ..\aten\src\ATen\SparseCsrTensorImpl.cpp:55.)
    self.adj_csr = self.adj.to_sparse_csr().to(self.device)
[I 2026-05-01 21:32:04,005] Trial 28 finished with value: 0.896 and parameters: {'lr': 0.005, 'weight_decay': 0.001, 'n_hidden': 32, 'n_layer': 2, 'dropout': 0.38869087741148006, 'knn_mode': 'd', 'k': 28, 'dexp': 5.2425070554203606, 'p_grd': 0.14184937445988782, 'unc_rem': 0.22084200052430086, 'unc_rel': 0.15447065806389193}. Best is trial 7 with value: 0.907.
    [CPU] Loading amazonpho...
    DEBUG 3.1: Dataset init start
    DEBUG 3.2: prepare_data start amazonpho
    ----Data statistics------'
    Name: amazonpho
    #Nodes 7650
    #Edges 119081
    #Classes 8
    #Ave_degree 31.13
    ----Split statistics------'
    #Train samples 160 (20 nodes per class)
    #Val samples 500 (specified)
    #Test samples 1000 (specified)
    ----label noise information:------
    Instance dependent noise
    #Actual noise rate 0.13
    [cuda:1] LNPCC waiting for GPU slot...
    [cuda:1] Slot acquired (waited 124.5s). Starting GCN...
    FINAL_RESULT: {'acc': {'train': 0.83125, 'valid': 0.806, 'test': 0.905}, 'wall_s': 25.66, 'cpu_s': 20.62, 'gpu_s': 4.96, 'wait_s': 124.54}
    [Time] wall=25.7s | cpu=20.6s | gpu=5.0s
    C:\Users\fbrev\Documents\Acadêmico\Simulações\Python\NoisyGL\predictor\Base_Predictor.py:114: UserWarning: expandable_segments not supported on this platform (Triggered internally at ..\c10/cuda/CUDAAllocatorConfig.h:28.)
    self.edge_index = self._cpu_edge_index.to(self.device)
    C:\Users\fbrev\Documents\Acadêmico\Simulações\Python\NoisyGL\predictor\Base_Predictor.py:144: UserWarning: Sparse CSR tensor support is in beta state. If you miss a functionality in the sparse tensor support, please submit a feature request to https://github.com/pytorch/pytorch/issues. (Triggered internally at ..\aten\src\ATen\SparseCsrTensorImpl.cpp:55.)
    self.adj_csr = self.adj.to_sparse_csr().to(self.device)
[I 2026-05-01 21:34:40,333] Trial 29 finished with value: 0.905 and parameters: {'lr': 0.01, 'weight_decay': 0.001, 'n_hidden': 256, 'n_layer': 2, 'dropout': 0.2748548706935028, 'knn_mode': 'd', 'k': 48, 'dexp': 6.496243440154323, 'p_grd': 0.6442356920521052, 'unc_rem': 0.4518061809906313, 'unc_rel': 0.5917142049877765}. Best is trial 7 with value: 0.907.
    [CPU] Loading amazonpho...
    DEBUG 3.1: Dataset init start
    DEBUG 3.2: prepare_data start amazonpho
    ----Data statistics------'
    Name: amazonpho
    #Nodes 7650
    #Edges 119081
    #Classes 8
    #Ave_degree 31.13
    ----Split statistics------'
    #Train samples 160 (20 nodes per class)
    #Val samples 500 (specified)
    #Test samples 1000 (specified)
    ----label noise information:------
    Instance dependent noise
    #Actual noise rate 0.13
    [cuda:1] LNPCC waiting for GPU slot...
    [cuda:1] Slot acquired (waited 127.1s). Starting GCN...
    FINAL_RESULT: {'acc': {'train': 0.84375, 'valid': 0.81, 'test': 0.907}, 'wall_s': 20.64, 'cpu_s': 17.95, 'gpu_s': 2.63, 'wait_s': 127.15}
    [Time] wall=20.6s | cpu=18.0s | gpu=2.6s
    C:\Users\fbrev\Documents\Acadêmico\Simulações\Python\NoisyGL\predictor\Base_Predictor.py:114: UserWarning: expandable_segments not supported on this platform (Triggered internally at ..\c10/cuda/CUDAAllocatorConfig.h:28.)
    self.edge_index = self._cpu_edge_index.to(self.device)
    C:\Users\fbrev\Documents\Acadêmico\Simulações\Python\NoisyGL\predictor\Base_Predictor.py:144: UserWarning: Sparse CSR tensor support is in beta state. If you miss a functionality in the sparse tensor support, please submit a feature request to https://github.com/pytorch/pytorch/issues. (Triggered internally at ..\aten\src\ATen\SparseCsrTensorImpl.cpp:55.)
    self.adj_csr = self.adj.to_sparse_csr().to(self.device)
[I 2026-05-01 21:37:14,225] Trial 30 finished with value: 0.907 and parameters: {'lr': 0.01, 'weight_decay': 0.05, 'n_hidden': 64, 'n_layer': 2, 'dropout': 0.27273303905958035, 'knn_mode': 'd', 'k': 34, 'dexp': 6.534732930297791, 'p_grd': 0.6416758597489908, 'unc_rem': 0.48864248989684, 'unc_rel': 0.5725593711659782}. Best is trial 7 with value: 0.907.
    [CPU] Loading amazonpho...
    DEBUG 3.1: Dataset init start
    DEBUG 3.2: prepare_data start amazonpho
    ----Data statistics------'
    Name: amazonpho
    #Nodes 7650
    #Edges 119081
    #Classes 8
    #Ave_degree 31.13
    ----Split statistics------'
    #Train samples 160 (20 nodes per class)
    #Val samples 500 (specified)
    #Test samples 1000 (specified)
    ----label noise information:------
    Instance dependent noise
    #Actual noise rate 0.13
    [cuda:1] LNPCC waiting for GPU slot...
    [cuda:1] Slot acquired (waited 127.1s). Starting GCN...
    FINAL_RESULT: {'acc': {'train': 0.86875, 'valid': 0.808, 'test': 0.905}, 'wall_s': 22.8, 'cpu_s': 20.15, 'gpu_s': 2.59, 'wait_s': 127.15}
    [Time] wall=22.8s | cpu=20.1s | gpu=2.6s
    C:\Users\fbrev\Documents\Acadêmico\Simulações\Python\NoisyGL\predictor\Base_Predictor.py:114: UserWarning: expandable_segments not supported on this platform (Triggered internally at ..\c10/cuda/CUDAAllocatorConfig.h:28.)
    self.edge_index = self._cpu_edge_index.to(self.device)
    C:\Users\fbrev\Documents\Acadêmico\Simulações\Python\NoisyGL\predictor\Base_Predictor.py:144: UserWarning: Sparse CSR tensor support is in beta state. If you miss a functionality in the sparse tensor support, please submit a feature request to https://github.com/pytorch/pytorch/issues. (Triggered internally at ..\aten\src\ATen\SparseCsrTensorImpl.cpp:55.)
    self.adj_csr = self.adj.to_sparse_csr().to(self.device)
[I 2026-05-01 21:39:50,660] Trial 31 finished with value: 0.905 and parameters: {'lr': 0.01, 'weight_decay': 0.05, 'n_hidden': 64, 'n_layer': 2, 'dropout': 0.24145578091635939, 'knn_mode': 'd', 'k': 36, 'dexp': 6.423159626336163, 'p_grd': 0.664547480308316, 'unc_rem': 0.49724914583068064, 'unc_rel': 0.5663779556716035}. Best is trial 7 with value: 0.907.
    [CPU] Loading amazonpho...
    DEBUG 3.1: Dataset init start
    DEBUG 3.2: prepare_data start amazonpho
    ----Data statistics------'
    Name: amazonpho
    #Nodes 7650
    #Edges 119081
    #Classes 8
    #Ave_degree 31.13
    ----Split statistics------'
    #Train samples 160 (20 nodes per class)
    #Val samples 500 (specified)
    #Test samples 1000 (specified)
    ----label noise information:------
    Instance dependent noise
    #Actual noise rate 0.13
    [cuda:1] LNPCC waiting for GPU slot...
    [cuda:1] Slot acquired (waited 118.2s). Starting GCN...
    FINAL_RESULT: {'acc': {'train': 0.85625, 'valid': 0.808, 'test': 0.906}, 'wall_s': 22.8, 'cpu_s': 20.13, 'gpu_s': 2.6, 'wait_s': 118.24}
    [Time] wall=22.8s | cpu=20.1s | gpu=2.6s
    C:\Users\fbrev\Documents\Acadêmico\Simulações\Python\NoisyGL\predictor\Base_Predictor.py:114: UserWarning: expandable_segments not supported on this platform (Triggered internally at ..\c10/cuda/CUDAAllocatorConfig.h:28.)
    self.edge_index = self._cpu_edge_index.to(self.device)
    C:\Users\fbrev\Documents\Acadêmico\Simulações\Python\NoisyGL\predictor\Base_Predictor.py:144: UserWarning: Sparse CSR tensor support is in beta state. If you miss a functionality in the sparse tensor support, please submit a feature request to https://github.com/pytorch/pytorch/issues. (Triggered internally at ..\aten\src\ATen\SparseCsrTensorImpl.cpp:55.)
    self.adj_csr = self.adj.to_sparse_csr().to(self.device)
[I 2026-05-01 21:42:18,782] Trial 32 finished with value: 0.906 and parameters: {'lr': 0.01, 'weight_decay': 0.05, 'n_hidden': 64, 'n_layer': 2, 'dropout': 0.12670575604559273, 'knn_mode': 'd', 'k': 32, 'dexp': 6.556872021799133, 'p_grd': 0.5974855150783308, 'unc_rem': 0.4541771652537089, 'unc_rel': 0.6387368121493274}. Best is trial 7 with value: 0.907.
    [CPU] Loading amazonpho...
    DEBUG 3.1: Dataset init start
    DEBUG 3.2: prepare_data start amazonpho
    ----Data statistics------'
    Name: amazonpho
    #Nodes 7650
    #Edges 119081
    #Classes 8
    #Ave_degree 31.13
    ----Split statistics------'
    #Train samples 160 (20 nodes per class)
    #Val samples 500 (specified)
    #Test samples 1000 (specified)
    ----label noise information:------
    Instance dependent noise
    #Actual noise rate 0.13
    [cuda:1] LNPCC waiting for GPU slot...
    [cuda:1] Slot acquired (waited 122.9s). Starting GCN...
    FINAL_RESULT: {'acc': {'train': 0.85, 'valid': 0.81, 'test': 0.902}, 'wall_s': 22.09, 'cpu_s': 19.23, 'gpu_s': 2.8, 'wait_s': 122.87}
    [Time] wall=22.1s | cpu=19.2s | gpu=2.8s
    C:\Users\fbrev\Documents\Acadêmico\Simulações\Python\NoisyGL\predictor\Base_Predictor.py:114: UserWarning: expandable_segments not supported on this platform (Triggered internally at ..\c10/cuda/CUDAAllocatorConfig.h:28.)
    self.edge_index = self._cpu_edge_index.to(self.device)
    C:\Users\fbrev\Documents\Acadêmico\Simulações\Python\NoisyGL\predictor\Base_Predictor.py:144: UserWarning: Sparse CSR tensor support is in beta state. If you miss a functionality in the sparse tensor support, please submit a feature request to https://github.com/pytorch/pytorch/issues. (Triggered internally at ..\aten\src\ATen\SparseCsrTensorImpl.cpp:55.)
    self.adj_csr = self.adj.to_sparse_csr().to(self.device)
[I 2026-05-01 21:44:50,342] Trial 33 finished with value: 0.902 and parameters: {'lr': 0.01, 'weight_decay': 0.05, 'n_hidden': 64, 'n_layer': 2, 'dropout': 0.12829189729692136, 'knn_mode': 'd', 'k': 32, 'dexp': 4.91126054863768, 'p_grd': 0.5622762683502682, 'unc_rem': 0.5914727888929857, 'unc_rel': 0.48142132065110876}. Best is trial 7 with value: 0.907.
    [CPU] Loading amazonpho...
    DEBUG 3.1: Dataset init start
    DEBUG 3.2: prepare_data start amazonpho
    ----Data statistics------'
    Name: amazonpho
    #Nodes 7650
    #Edges 119081
    #Classes 8
    #Ave_degree 31.13
    ----Split statistics------'
    #Train samples 160 (20 nodes per class)
    #Val samples 500 (specified)
    #Test samples 1000 (specified)
    ----label noise information:------
    Instance dependent noise
    #Actual noise rate 0.13
    [cuda:1] LNPCC waiting for GPU slot...
    [cuda:1] Slot acquired (waited 121.3s). Starting GCN...
    FINAL_RESULT: {'acc': {'train': 0.85625, 'valid': 0.808, 'test': 0.906}, 'wall_s': 19.54, 'cpu_s': 16.88, 'gpu_s': 2.58, 'wait_s': 121.29}
    [Time] wall=19.5s | cpu=16.9s | gpu=2.6s
    C:\Users\fbrev\Documents\Acadêmico\Simulações\Python\NoisyGL\predictor\Base_Predictor.py:114: UserWarning: expandable_segments not supported on this platform (Triggered internally at ..\c10/cuda/CUDAAllocatorConfig.h:28.)
    self.edge_index = self._cpu_edge_index.to(self.device)
    C:\Users\fbrev\Documents\Acadêmico\Simulações\Python\NoisyGL\predictor\Base_Predictor.py:144: UserWarning: Sparse CSR tensor support is in beta state. If you miss a functionality in the sparse tensor support, please submit a feature request to https://github.com/pytorch/pytorch/issues. (Triggered internally at ..\aten\src\ATen\SparseCsrTensorImpl.cpp:55.)
    self.adj_csr = self.adj.to_sparse_csr().to(self.device)
