[I 2026-05-08 04:02:01,665] Trial 47 finished with value: 0.778 and parameters: {'lr': 0.005, 'weight_decay': 0.0, 'n_hidden': 256, 'n_layer': 3, 'dropout': 0.5062940399123381, 'knn_mode': 's', 'k': 25, 'dexp': 4.706836383625651, 'p_grd': 0.07086383282630865, 'unc_rem': 0.6230150471362015, 'unc_rel': 0.006224967819973115}. Best is trial 22 with value: 0.791.
    [CPU] Loading cora...
    DEBUG 3.1: Dataset init start
    DEBUG 3.2: prepare_data start cora
    ----Data statistics------'
    Name: cora
    #Nodes 2708
    #Edges 5278
    #Classes 7
    #Ave_degree 3.90
    ----Split statistics------'
    #Train samples 140 (default)
    #Val samples 500 (default)
    #Test samples 1000 (default)
    ----label noise information:------
    Instance dependent noise
    #Actual noise rate 0.31
    [cuda:0] LNPCC waiting for GPU slot...
    [cuda:0] Slot acquired (waited 7.9s). Starting GCN...
    FINAL_RESULT: {'acc': {'train': 0.9428571428571428, 'valid': 0.514, 'test': 0.733}, 'wall_s': 18.45, 'cpu_s': 16.11, 'gpu_s': 2.32, 'wait_s': 7.9}
    [Time] wall=18.4s | cpu=16.1s | gpu=2.3s
    C:\Users\fbrev\Documents\Acadêmico\Simulações\Python\NoisyGL\predictor\Base_Predictor.py:114: UserWarning: expandable_segments not supported on this platform (Triggered internally at ..\c10/cuda/CUDAAllocatorConfig.h:28.)
    self.edge_index = self._cpu_edge_index.to(self.device)
    C:\Users\fbrev\Documents\Acadêmico\Simulações\Python\NoisyGL\predictor\Base_Predictor.py:144: UserWarning: Sparse CSR tensor support is in beta state. If you miss a functionality in the sparse tensor support, please submit a feature request to https://github.com/pytorch/pytorch/issues. (Triggered internally at ..\aten\src\ATen\SparseCsrTensorImpl.cpp:55.)
    self.adj_csr = self.adj.to_sparse_csr().to(self.device)
[I 2026-05-08 04:02:33,394] Trial 48 finished with value: 0.733 and parameters: {'lr': 0.005, 'weight_decay': 0.01, 'n_hidden': 64, 'n_layer': 3, 'dropout': 0.3629524899165296, 'knn_mode': 'd', 'k': 44, 'dexp': 3.91843844145189, 'p_grd': 0.46799211446246164, 'unc_rem': 0.433006238996765, 'unc_rel': 0.42035627641173917}. Best is trial 22 with value: 0.791.
    [CPU] Loading cora...
    DEBUG 3.1: Dataset init start
    DEBUG 3.2: prepare_data start cora
    ----Data statistics------'
    Name: cora
    #Nodes 2708
    #Edges 5278
    #Classes 7
    #Ave_degree 3.90
    ----Split statistics------'
    #Train samples 140 (default)
    #Val samples 500 (default)
    #Test samples 1000 (default)
    ----label noise information:------
    Instance dependent noise
    #Actual noise rate 0.31
    [cuda:0] LNPCC waiting for GPU slot...
    [cuda:0] Slot acquired (waited 68.2s). Starting GCN...
    FINAL_RESULT: {'acc': {'train': 0.8785714285714286, 'valid': 0.508, 'test': 0.755}, 'wall_s': 8.35, 'cpu_s': 6.82, 'gpu_s': 1.51, 'wait_s': 68.2}
    [Time] wall=8.4s | cpu=6.8s | gpu=1.5s
    C:\Users\fbrev\Documents\Acadêmico\Simulações\Python\NoisyGL\predictor\Base_Predictor.py:114: UserWarning: expandable_segments not supported on this platform (Triggered internally at ..\c10/cuda/CUDAAllocatorConfig.h:28.)
    self.edge_index = self._cpu_edge_index.to(self.device)
    C:\Users\fbrev\Documents\Acadêmico\Simulações\Python\NoisyGL\predictor\Base_Predictor.py:144: UserWarning: Sparse CSR tensor support is in beta state. If you miss a functionality in the sparse tensor support, please submit a feature request to https://github.com/pytorch/pytorch/issues. (Triggered internally at ..\aten\src\ATen\SparseCsrTensorImpl.cpp:55.)
    self.adj_csr = self.adj.to_sparse_csr().to(self.device)
