[I 2026-05-07 22:10:22,123] Trial 49 finished with value: 0.593 and parameters: {'lr': 0.05, 'weight_decay': 0.0, 'n_hidden': 128, 'n_layer': 2, 'dropout': 0.6686147381917107, 'knn_mode': 's', 'k': 20, 'dexp': 7.820373531611815, 'p_grd': 0.14787799146312502, 'unc_rem': 0.03326735622367856, 'unc_rel': 0.14262954202538214}. Best is trial 47 with value: 0.707.

[Retest] Phase 1 Finished. Validating Top 3 (10 runs each)...

  [Retest] Candidate 1/3 (Trial 47, HPO_acc=0.7070)
    [CPU] Loading citeseer...
    DEBUG 3.1: Dataset init start
    DEBUG 3.2: prepare_data start citeseer
    ----Data statistics------'
    Name: citeseer
    #Nodes 3327
    #Edges 4552
    #Classes 6
    #Ave_degree 2.74
    ----Split statistics------'
    #Train samples 120 (default)
    #Val samples 500 (default)
    #Test samples 1000 (default)
    ----label noise information:------
    Instance dependent noise
    #Actual noise rate 0.22
    [cuda:0] LNPCC waiting for GPU slot...
    [cuda:0] Slot acquired (waited 16.8s). Starting GCN...
    FINAL_RESULT: {'acc': {'train': 0.7672413793103449, 'valid': 0.564, 'test': 0.687}, 'wall_s': 8.94, 'cpu_s': 6.81, 'gpu_s': 2.11, 'wait_s': 16.81}
    [Time] wall=8.9s | cpu=6.8s | gpu=2.1s
    C:\Users\fbrev\Documents\Acadêmico\Simulações\Python\NoisyGL\predictor\Base_Predictor.py:114: UserWarning: expandable_segments not supported on this platform (Triggered internally at ..\c10/cuda/CUDAAllocatorConfig.h:28.)
    self.edge_index = self._cpu_edge_index.to(self.device)
    C:\Users\fbrev\Documents\Acadêmico\Simulações\Python\NoisyGL\predictor\Base_Predictor.py:144: UserWarning: Sparse CSR tensor support is in beta state. If you miss a functionality in the sparse tensor support, please submit a feature request to https://github.com/pytorch/pytorch/issues. (Triggered internally at ..\aten\src\ATen\SparseCsrTensorImpl.cpp:55.)
    self.adj_csr = self.adj.to_sparse_csr().to(self.device)
    [CPU] Loading citeseer...
    DEBUG 3.1: Dataset init start
    DEBUG 3.2: prepare_data start citeseer
    ----Data statistics------'
    Name: citeseer
    #Nodes 3327
    #Edges 4552
    #Classes 6
    #Ave_degree 2.74
    ----Split statistics------'
    #Train samples 120 (default)
    #Val samples 500 (default)
    #Test samples 1000 (default)
    ----label noise information:------
    Instance dependent noise
    #Actual noise rate 0.20
    [cuda:0] LNPCC waiting for GPU slot...
    [cuda:0] Slot acquired (waited 339.5s). Starting GCN...
    FINAL_RESULT: {'acc': {'train': 0.8067226890756303, 'valid': 0.57, 'test': 0.689}, 'wall_s': 9.15, 'cpu_s': 6.88, 'gpu_s': 2.24, 'wait_s': 339.48}
    [Time] wall=9.2s | cpu=6.9s | gpu=2.2s
    C:\Users\fbrev\Documents\Acadêmico\Simulações\Python\NoisyGL\predictor\Base_Predictor.py:114: UserWarning: expandable_segments not supported on this platform (Triggered internally at ..\c10/cuda/CUDAAllocatorConfig.h:28.)
    self.edge_index = self._cpu_edge_index.to(self.device)
    C:\Users\fbrev\Documents\Acadêmico\Simulações\Python\NoisyGL\predictor\Base_Predictor.py:144: UserWarning: Sparse CSR tensor support is in beta state. If you miss a functionality in the sparse tensor support, please submit a feature request to https://github.com/pytorch/pytorch/issues. (Triggered internally at ..\aten\src\ATen\SparseCsrTensorImpl.cpp:55.)
    self.adj_csr = self.adj.to_sparse_csr().to(self.device)
    [CPU] Loading citeseer...
    DEBUG 3.1: Dataset init start
    DEBUG 3.2: prepare_data start citeseer
    ----Data statistics------'
    Name: citeseer
    #Nodes 3327
    #Edges 4552
    #Classes 6
    #Ave_degree 2.74
    ----Split statistics------'
    #Train samples 120 (default)
    #Val samples 500 (default)
    #Test samples 1000 (default)
    ----label noise information:------
    Instance dependent noise
    #Actual noise rate 0.21
    [cuda:0] LNPCC waiting for GPU slot...
    [cuda:0] Slot acquired (waited 162.4s). Starting GCN...
    FINAL_RESULT: {'acc': {'train': 0.853448275862069, 'valid': 0.538, 'test': 0.638}, 'wall_s': 9.23, 'cpu_s': 7.03, 'gpu_s': 2.17, 'wait_s': 162.37}
    [Time] wall=9.2s | cpu=7.0s | gpu=2.2s
    C:\Users\fbrev\Documents\Acadêmico\Simulações\Python\NoisyGL\predictor\Base_Predictor.py:114: UserWarning: expandable_segments not supported on this platform (Triggered internally at ..\c10/cuda/CUDAAllocatorConfig.h:28.)
    self.edge_index = self._cpu_edge_index.to(self.device)
    C:\Users\fbrev\Documents\Acadêmico\Simulações\Python\NoisyGL\predictor\Base_Predictor.py:144: UserWarning: Sparse CSR tensor support is in beta state. If you miss a functionality in the sparse tensor support, please submit a feature request to https://github.com/pytorch/pytorch/issues. (Triggered internally at ..\aten\src\ATen\SparseCsrTensorImpl.cpp:55.)
    self.adj_csr = self.adj.to_sparse_csr().to(self.device)
    [CPU] Loading citeseer...
    DEBUG 3.1: Dataset init start
    DEBUG 3.2: prepare_data start citeseer
    ----Data statistics------'
    Name: citeseer
    #Nodes 3327
    #Edges 4552
    #Classes 6
    #Ave_degree 2.74
    ----Split statistics------'
    #Train samples 120 (default)
    #Val samples 500 (default)
    #Test samples 1000 (default)
    ----label noise information:------
    Instance dependent noise
    #Actual noise rate 0.21
    [cuda:0] LNPCC waiting for GPU slot...
    [cuda:0] Slot acquired (waited 367.6s). Starting GCN...
    FINAL_RESULT: {'acc': {'train': 0.8434782608695652, 'valid': 0.57, 'test': 0.609}, 'wall_s': 9.26, 'cpu_s': 7.31, 'gpu_s': 1.92, 'wait_s': 367.64}
    [Time] wall=9.3s | cpu=7.3s | gpu=1.9s
    C:\Users\fbrev\Documents\Acadêmico\Simulações\Python\NoisyGL\predictor\Base_Predictor.py:114: UserWarning: expandable_segments not supported on this platform (Triggered internally at ..\c10/cuda/CUDAAllocatorConfig.h:28.)
    self.edge_index = self._cpu_edge_index.to(self.device)
    C:\Users\fbrev\Documents\Acadêmico\Simulações\Python\NoisyGL\predictor\Base_Predictor.py:144: UserWarning: Sparse CSR tensor support is in beta state. If you miss a functionality in the sparse tensor support, please submit a feature request to https://github.com/pytorch/pytorch/issues. (Triggered internally at ..\aten\src\ATen\SparseCsrTensorImpl.cpp:55.)
    self.adj_csr = self.adj.to_sparse_csr().to(self.device)
    [CPU] Loading citeseer...
    DEBUG 3.1: Dataset init start
    DEBUG 3.2: prepare_data start citeseer
    ----Data statistics------'
    Name: citeseer
    #Nodes 3327
    #Edges 4552
    #Classes 6
    #Ave_degree 2.74
    ----Split statistics------'
    #Train samples 120 (default)
    #Val samples 500 (default)
    #Test samples 1000 (default)
    ----label noise information:------
    Instance dependent noise
    #Actual noise rate 0.22
    [cuda:0] LNPCC waiting for GPU slot...
    [cuda:0] Slot acquired (waited 589.5s). Starting GCN...
    FINAL_RESULT: {'acc': {'train': 0.652542372881356, 'valid': 0.47, 'test': 0.575}, 'wall_s': 8.66, 'cpu_s': 6.57, 'gpu_s': 2.07, 'wait_s': 589.53}
    [Time] wall=8.7s | cpu=6.6s | gpu=2.1s
    C:\Users\fbrev\Documents\Acadêmico\Simulações\Python\NoisyGL\predictor\Base_Predictor.py:114: UserWarning: expandable_segments not supported on this platform (Triggered internally at ..\c10/cuda/CUDAAllocatorConfig.h:28.)
    self.edge_index = self._cpu_edge_index.to(self.device)
    C:\Users\fbrev\Documents\Acadêmico\Simulações\Python\NoisyGL\predictor\Base_Predictor.py:144: UserWarning: Sparse CSR tensor support is in beta state. If you miss a functionality in the sparse tensor support, please submit a feature request to https://github.com/pytorch/pytorch/issues. (Triggered internally at ..\aten\src\ATen\SparseCsrTensorImpl.cpp:55.)
    self.adj_csr = self.adj.to_sparse_csr().to(self.device)
    [CPU] Loading citeseer...
    DEBUG 3.1: Dataset init start
    DEBUG 3.2: prepare_data start citeseer
    ----Data statistics------'
    Name: citeseer
    #Nodes 3327
    #Edges 4552
    #Classes 6
    #Ave_degree 2.74
    ----Split statistics------'
    #Train samples 120 (default)
    #Val samples 500 (default)
    #Test samples 1000 (default)
    ----label noise information:------
    Instance dependent noise
    #Actual noise rate 0.21
    [cuda:0] LNPCC waiting for GPU slot...
    [cuda:0] Slot acquired (waited 553.9s). Starting GCN...
    FINAL_RESULT: {'acc': {'train': 0.8067226890756303, 'valid': 0.53, 'test': 0.654}, 'wall_s': 9.38, 'cpu_s': 6.54, 'gpu_s': 2.82, 'wait_s': 553.89}
    [Time] wall=9.4s | cpu=6.5s | gpu=2.8s
    C:\Users\fbrev\Documents\Acadêmico\Simulações\Python\NoisyGL\predictor\Base_Predictor.py:114: UserWarning: expandable_segments not supported on this platform (Triggered internally at ..\c10/cuda/CUDAAllocatorConfig.h:28.)
    self.edge_index = self._cpu_edge_index.to(self.device)
    C:\Users\fbrev\Documents\Acadêmico\Simulações\Python\NoisyGL\predictor\Base_Predictor.py:144: UserWarning: Sparse CSR tensor support is in beta state. If you miss a functionality in the sparse tensor support, please submit a feature request to https://github.com/pytorch/pytorch/issues. (Triggered internally at ..\aten\src\ATen\SparseCsrTensorImpl.cpp:55.)
    self.adj_csr = self.adj.to_sparse_csr().to(self.device)
    [CPU] Loading citeseer...
    DEBUG 3.1: Dataset init start
    DEBUG 3.2: prepare_data start citeseer
    ----Data statistics------'
    Name: citeseer
    #Nodes 3327
    #Edges 4552
    #Classes 6
    #Ave_degree 2.74
    ----Split statistics------'
    #Train samples 120 (default)
    #Val samples 500 (default)
    #Test samples 1000 (default)
    ----label noise information:------
    Instance dependent noise
    #Actual noise rate 0.20
    [cuda:0] LNPCC waiting for GPU slot...
    [cuda:0] Slot acquired (waited 198.5s). Starting GCN...
    FINAL_RESULT: {'acc': {'train': 0.7948717948717948, 'valid': 0.564, 'test': 0.68}, 'wall_s': 8.65, 'cpu_s': 6.62, 'gpu_s': 2.0, 'wait_s': 198.49}
    [Time] wall=8.6s | cpu=6.6s | gpu=2.0s
    C:\Users\fbrev\Documents\Acadêmico\Simulações\Python\NoisyGL\predictor\Base_Predictor.py:114: UserWarning: expandable_segments not supported on this platform (Triggered internally at ..\c10/cuda/CUDAAllocatorConfig.h:28.)
    self.edge_index = self._cpu_edge_index.to(self.device)
    C:\Users\fbrev\Documents\Acadêmico\Simulações\Python\NoisyGL\predictor\Base_Predictor.py:144: UserWarning: Sparse CSR tensor support is in beta state. If you miss a functionality in the sparse tensor support, please submit a feature request to https://github.com/pytorch/pytorch/issues. (Triggered internally at ..\aten\src\ATen\SparseCsrTensorImpl.cpp:55.)
    self.adj_csr = self.adj.to_sparse_csr().to(self.device)
    [CPU] Loading citeseer...
    DEBUG 3.1: Dataset init start
    DEBUG 3.2: prepare_data start citeseer
    ----Data statistics------'
    Name: citeseer
    #Nodes 3327
    #Edges 4552
    #Classes 6
    #Ave_degree 2.74
    ----Split statistics------'
    #Train samples 120 (default)
    #Val samples 500 (default)
    #Test samples 1000 (default)
    ----label noise information:------
    Instance dependent noise
    #Actual noise rate 0.20
    [cuda:0] LNPCC waiting for GPU slot...
    [cuda:0] Slot acquired (waited 188.5s). Starting GCN...
    FINAL_RESULT: {'acc': {'train': 0.8067226890756303, 'valid': 0.56, 'test': 0.659}, 'wall_s': 10.6, 'cpu_s': 7.38, 'gpu_s': 3.19, 'wait_s': 188.53}
    [Time] wall=10.6s | cpu=7.4s | gpu=3.2s
    C:\Users\fbrev\Documents\Acadêmico\Simulações\Python\NoisyGL\predictor\Base_Predictor.py:114: UserWarning: expandable_segments not supported on this platform (Triggered internally at ..\c10/cuda/CUDAAllocatorConfig.h:28.)
    self.edge_index = self._cpu_edge_index.to(self.device)
    C:\Users\fbrev\Documents\Acadêmico\Simulações\Python\NoisyGL\predictor\Base_Predictor.py:144: UserWarning: Sparse CSR tensor support is in beta state. If you miss a functionality in the sparse tensor support, please submit a feature request to https://github.com/pytorch/pytorch/issues. (Triggered internally at ..\aten\src\ATen\SparseCsrTensorImpl.cpp:55.)
    self.adj_csr = self.adj.to_sparse_csr().to(self.device)
    [CPU] Loading citeseer...
    DEBUG 3.1: Dataset init start
    DEBUG 3.2: prepare_data start citeseer
    ----Data statistics------'
    Name: citeseer
    #Nodes 3327
    #Edges 4552
    #Classes 6
    #Ave_degree 2.74
    ----Split statistics------'
    #Train samples 120 (default)
    #Val samples 500 (default)
    #Test samples 1000 (default)
    ----label noise information:------
    Instance dependent noise
    #Actual noise rate 0.21
    [cuda:0] LNPCC waiting for GPU slot...
    [cuda:0] Slot acquired (waited 263.6s). Starting GCN...
    FINAL_RESULT: {'acc': {'train': 0.9145299145299145, 'valid': 0.572, 'test': 0.7}, 'wall_s': 14.04, 'cpu_s': 11.63, 'gpu_s': 2.37, 'wait_s': 263.64}
    [Time] wall=14.0s | cpu=11.6s | gpu=2.4s
    C:\Users\fbrev\Documents\Acadêmico\Simulações\Python\NoisyGL\predictor\Base_Predictor.py:114: UserWarning: expandable_segments not supported on this platform (Triggered internally at ..\c10/cuda/CUDAAllocatorConfig.h:28.)
    self.edge_index = self._cpu_edge_index.to(self.device)
    C:\Users\fbrev\Documents\Acadêmico\Simulações\Python\NoisyGL\predictor\Base_Predictor.py:144: UserWarning: Sparse CSR tensor support is in beta state. If you miss a functionality in the sparse tensor support, please submit a feature request to https://github.com/pytorch/pytorch/issues. (Triggered internally at ..\aten\src\ATen\SparseCsrTensorImpl.cpp:55.)
    self.adj_csr = self.adj.to_sparse_csr().to(self.device)
    [CPU] Loading citeseer...
    DEBUG 3.1: Dataset init start
    DEBUG 3.2: prepare_data start citeseer
    ----Data statistics------'
    Name: citeseer
    #Nodes 3327
    #Edges 4552
    #Classes 6
    #Ave_degree 2.74
    ----Split statistics------'
    #Train samples 120 (default)
    #Val samples 500 (default)
    #Test samples 1000 (default)
    ----label noise information:------
    Instance dependent noise
    #Actual noise rate 0.21
    [cuda:0] LNPCC waiting for GPU slot...
    [cuda:0] Slot acquired (waited 170.7s). Starting GCN...
    FINAL_RESULT: {'acc': {'train': 0.853448275862069, 'valid': 0.534, 'test': 0.676}, 'wall_s': 9.29, 'cpu_s': 6.91, 'gpu_s': 2.35, 'wait_s': 170.73}
    [Time] wall=9.3s | cpu=6.9s | gpu=2.4s
    C:\Users\fbrev\Documents\Acadêmico\Simulações\Python\NoisyGL\predictor\Base_Predictor.py:114: UserWarning: expandable_segments not supported on this platform (Triggered internally at ..\c10/cuda/CUDAAllocatorConfig.h:28.)
    self.edge_index = self._cpu_edge_index.to(self.device)
    C:\Users\fbrev\Documents\Acadêmico\Simulações\Python\NoisyGL\predictor\Base_Predictor.py:144: UserWarning: Sparse CSR tensor support is in beta state. If you miss a functionality in the sparse tensor support, please submit a feature request to https://github.com/pytorch/pytorch/issues. (Triggered internally at ..\aten\src\ATen\SparseCsrTensorImpl.cpp:55.)
    self.adj_csr = self.adj.to_sparse_csr().to(self.device)
  [Retest] Candidate 1 Avg: 0.6567

  [Retest] Candidate 2/3 (Trial 42, HPO_acc=0.6990)
    [CPU] Loading citeseer...
    DEBUG 3.1: Dataset init start
    DEBUG 3.2: prepare_data start citeseer
    ----Data statistics------'
    Name: citeseer
    #Nodes 3327
    #Edges 4552
    #Classes 6
    #Ave_degree 2.74
    ----Split statistics------'
    #Train samples 120 (default)
    #Val samples 500 (default)
    #Test samples 1000 (default)
    ----label noise information:------
    Instance dependent noise
    #Actual noise rate 0.22
    [cuda:0] LNPCC waiting for GPU slot...
    [cuda:0] Slot acquired (waited 167.7s). Starting GCN...
    FINAL_RESULT: {'acc': {'train': 0.6779661016949152, 'valid': 0.552, 'test': 0.645}, 'wall_s': 10.31, 'cpu_s': 8.42, 'gpu_s': 1.85, 'wait_s': 167.72}
    [Time] wall=10.3s | cpu=8.4s | gpu=1.9s
    C:\Users\fbrev\Documents\Acadêmico\Simulações\Python\NoisyGL\predictor\Base_Predictor.py:114: UserWarning: expandable_segments not supported on this platform (Triggered internally at ..\c10/cuda/CUDAAllocatorConfig.h:28.)
    self.edge_index = self._cpu_edge_index.to(self.device)
    C:\Users\fbrev\Documents\Acadêmico\Simulações\Python\NoisyGL\predictor\Base_Predictor.py:144: UserWarning: Sparse CSR tensor support is in beta state. If you miss a functionality in the sparse tensor support, please submit a feature request to https://github.com/pytorch/pytorch/issues. (Triggered internally at ..\aten\src\ATen\SparseCsrTensorImpl.cpp:55.)
    self.adj_csr = self.adj.to_sparse_csr().to(self.device)
    [CPU] Loading citeseer...
    DEBUG 3.1: Dataset init start
    DEBUG 3.2: prepare_data start citeseer
    ----Data statistics------'
    Name: citeseer
    #Nodes 3327
    #Edges 4552
    #Classes 6
    #Ave_degree 2.74
    ----Split statistics------'
    #Train samples 120 (default)
    #Val samples 500 (default)
    #Test samples 1000 (default)
    ----label noise information:------
    Instance dependent noise
    #Actual noise rate 0.20
    [cuda:0] LNPCC waiting for GPU slot...
    [cuda:0] Slot acquired (waited 381.6s). Starting GCN...
    FINAL_RESULT: {'acc': {'train': 0.8487394957983193, 'valid': 0.584, 'test': 0.672}, 'wall_s': 10.6, 'cpu_s': 8.5, 'gpu_s': 2.07, 'wait_s': 381.61}
    [Time] wall=10.6s | cpu=8.5s | gpu=2.1s
    C:\Users\fbrev\Documents\Acadêmico\Simulações\Python\NoisyGL\predictor\Base_Predictor.py:114: UserWarning: expandable_segments not supported on this platform (Triggered internally at ..\c10/cuda/CUDAAllocatorConfig.h:28.)
    self.edge_index = self._cpu_edge_index.to(self.device)
    C:\Users\fbrev\Documents\Acadêmico\Simulações\Python\NoisyGL\predictor\Base_Predictor.py:144: UserWarning: Sparse CSR tensor support is in beta state. If you miss a functionality in the sparse tensor support, please submit a feature request to https://github.com/pytorch/pytorch/issues. (Triggered internally at ..\aten\src\ATen\SparseCsrTensorImpl.cpp:55.)
    self.adj_csr = self.adj.to_sparse_csr().to(self.device)
    [CPU] Loading citeseer...
    DEBUG 3.1: Dataset init start
    DEBUG 3.2: prepare_data start citeseer
    ----Data statistics------'
    Name: citeseer
    #Nodes 3327
    #Edges 4552
    #Classes 6
    #Ave_degree 2.74
    ----Split statistics------'
    #Train samples 120 (default)
    #Val samples 500 (default)
    #Test samples 1000 (default)
    ----label noise information:------
    Instance dependent noise
    #Actual noise rate 0.21
    [cuda:0] LNPCC waiting for GPU slot...
    [cuda:0] Slot acquired (waited 16.8s). Starting GCN...
    FINAL_RESULT: {'acc': {'train': 0.7310924369747899, 'valid': 0.546, 'test': 0.642}, 'wall_s': 8.62, 'cpu_s': 6.75, 'gpu_s': 1.83, 'wait_s': 16.78}
    [Time] wall=8.6s | cpu=6.7s | gpu=1.8s
    C:\Users\fbrev\Documents\Acadêmico\Simulações\Python\NoisyGL\predictor\Base_Predictor.py:114: UserWarning: expandable_segments not supported on this platform (Triggered internally at ..\c10/cuda/CUDAAllocatorConfig.h:28.)
    self.edge_index = self._cpu_edge_index.to(self.device)
    C:\Users\fbrev\Documents\Acadêmico\Simulações\Python\NoisyGL\predictor\Base_Predictor.py:144: UserWarning: Sparse CSR tensor support is in beta state. If you miss a functionality in the sparse tensor support, please submit a feature request to https://github.com/pytorch/pytorch/issues. (Triggered internally at ..\aten\src\ATen\SparseCsrTensorImpl.cpp:55.)
    self.adj_csr = self.adj.to_sparse_csr().to(self.device)
    [CPU] Loading citeseer...
    DEBUG 3.1: Dataset init start
    DEBUG 3.2: prepare_data start citeseer
    ----Data statistics------'
    Name: citeseer
    #Nodes 3327
    #Edges 4552
    #Classes 6
    #Ave_degree 2.74
    ----Split statistics------'
    #Train samples 120 (default)
    #Val samples 500 (default)
    #Test samples 1000 (default)
    ----label noise information:------
    Instance dependent noise
    #Actual noise rate 0.21
    [cuda:0] LNPCC waiting for GPU slot...
    [cuda:0] Slot acquired (waited 193.9s). Starting GCN...
    FINAL_RESULT: {'acc': {'train': 0.7931034482758621, 'valid': 0.572, 'test': 0.635}, 'wall_s': 8.71, 'cpu_s': 6.77, 'gpu_s': 1.92, 'wait_s': 193.95}
    [Time] wall=8.7s | cpu=6.8s | gpu=1.9s
    C:\Users\fbrev\Documents\Acadêmico\Simulações\Python\NoisyGL\predictor\Base_Predictor.py:114: UserWarning: expandable_segments not supported on this platform (Triggered internally at ..\c10/cuda/CUDAAllocatorConfig.h:28.)
    self.edge_index = self._cpu_edge_index.to(self.device)
    C:\Users\fbrev\Documents\Acadêmico\Simulações\Python\NoisyGL\predictor\Base_Predictor.py:144: UserWarning: Sparse CSR tensor support is in beta state. If you miss a functionality in the sparse tensor support, please submit a feature request to https://github.com/pytorch/pytorch/issues. (Triggered internally at ..\aten\src\ATen\SparseCsrTensorImpl.cpp:55.)
    self.adj_csr = self.adj.to_sparse_csr().to(self.device)
    [CPU] Loading citeseer...
    DEBUG 3.1: Dataset init start
    DEBUG 3.2: prepare_data start citeseer
    ----Data statistics------'
    Name: citeseer
    #Nodes 3327
    #Edges 4552
    #Classes 6
    #Ave_degree 2.74
    ----Split statistics------'
    #Train samples 120 (default)
    #Val samples 500 (default)
    #Test samples 1000 (default)
    ----label noise information:------
    Instance dependent noise
    #Actual noise rate 0.22
    [cuda:0] LNPCC waiting for GPU slot...
    [cuda:0] Slot acquired (waited 162.1s). Starting GCN...
    FINAL_RESULT: {'acc': {'train': 0.7899159663865546, 'valid': 0.466, 'test': 0.561}, 'wall_s': 8.76, 'cpu_s': 6.86, 'gpu_s': 1.88, 'wait_s': 162.13}
    [Time] wall=8.8s | cpu=6.9s | gpu=1.9s
    C:\Users\fbrev\Documents\Acadêmico\Simulações\Python\NoisyGL\predictor\Base_Predictor.py:114: UserWarning: expandable_segments not supported on this platform (Triggered internally at ..\c10/cuda/CUDAAllocatorConfig.h:28.)
    self.edge_index = self._cpu_edge_index.to(self.device)
    C:\Users\fbrev\Documents\Acadêmico\Sim