[I 2026-05-03 02:24:36,441] Trial 32 finished with value: 0.45949513281636695 and parameters: {'lr': 0.005, 'weight_decay': 0.0001, 'n_hidden': 32, 'n_layer': 2, 'dropout': 0.41500119785564393, 'knn_mode': 'd', 'k': 10, 'dexp': 4.6420099476125545, 'p_grd': 0.1559393972862156, 'unc_rem': 0.07548803228918037, 'unc_rel': 0.13914341746410475}. Best is trial 31 with value: 0.4769839960402574.
    [CPU] Loading flickr...
    DEBUG 3.1: Dataset init start
    DEBUG 3.2: prepare_data start flickr
    ----Data statistics------'
    Name: flickr
    #Nodes 7575
    #Edges 239738
    #Classes 9
    #Ave_degree 63.30
    ----Split statistics------'
    #Train samples 378 (5.0 % of nodes)
    #Val samples 1136 (15.0 % of nodes)
    #Test samples 6061 (remaining)
    ----label noise information:------
    Instance dependent noise
    #Actual noise rate 0.40
    [cuda:0] LNPCC waiting for GPU slot...
    [cuda:0] Slot acquired (waited 75.1s). Starting GCN...
    FINAL_RESULT: {'acc': {'train': 0.7049180327868853, 'valid': 0.3019366197183099, 'test': 0.459660122092064}, 'wall_s': 77.64, 'cpu_s': 74.09, 'gpu_s': 3.31, 'wait_s': 75.1}
    [Time] wall=77.6s | cpu=74.1s | gpu=3.3s
    C:\Users\fbrev\anaconda3\envs\noisygl\Lib\site-packages\torch\_utils.py:315: UserWarning: Sparse CSR tensor support is in beta state. If you miss a functionality in the sparse tensor support, please submit a feature request to https://github.com/pytorch/pytorch/issues. (Triggered internally at ..\aten\src\ATen\SparseCsrTensorImpl.cpp:55.)
    result = torch.sparse_compressed_tensor(
    C:\Users\fbrev\Documents\Acadêmico\Simulações\Python\NoisyGL\predictor\Base_Predictor.py:114: UserWarning: expandable_segments not supported on this platform (Triggered internally at ..\c10/cuda/CUDAAllocatorConfig.h:28.)
    self.edge_index = self._cpu_edge_index.to(self.device)
[I 2026-05-03 02:27:14,357] Trial 33 finished with value: 0.459660122092064 and parameters: {'lr': 0.005, 'weight_decay': 0.0001, 'n_hidden': 32, 'n_layer': 2, 'dropout': 0.25949993663820525, 'knn_mode': 'd', 'k': 15, 'dexp': 4.819088819286065, 'p_grd': 0.17860702063605888, 'unc_rem': 0.07522669526970813, 'unc_rel': 0.07118537199733495}. Best is trial 31 with value: 0.4769839960402574.
    [CPU] Loading flickr...
    DEBUG 3.1: Dataset init start
    DEBUG 3.2: prepare_data start flickr
    ----Data statistics------'
    Name: flickr
    #Nodes 7575
    #Edges 239738
    #Classes 9
    #Ave_degree 63.30
    ----Split statistics------'
    #Train samples 378 (5.0 % of nodes)
    #Val samples 1136 (15.0 % of nodes)
    #Test samples 6061 (remaining)
    ----label noise information:------
    Instance dependent noise
    #Actual noise rate 0.40
    [cuda:0] LNPCC waiting for GPU slot...
    [cuda:0] Slot acquired (waited 16.5s). Starting GCN...
    FINAL_RESULT: {'acc': {'train': 0.7115902964959568, 'valid': 0.3028169014084507, 'test': 0.45042072265302757}, 'wall_s': 73.65, 'cpu_s': 70.38, 'gpu_s': 3.05, 'wait_s': 16.51}
    [Time] wall=73.7s | cpu=70.4s | gpu=3.1s
    C:\Users\fbrev\anaconda3\envs\noisygl\Lib\site-packages\torch\_utils.py:315: UserWarning: Sparse CSR tensor support is in beta state. If you miss a functionality in the sparse tensor support, please submit a feature request to https://github.com/pytorch/pytorch/issues. (Triggered internally at ..\aten\src\ATen\SparseCsrTensorImpl.cpp:55.)
    result = torch.sparse_compressed_tensor(
    C:\Users\fbrev\Documents\Acadêmico\Simulações\Python\NoisyGL\predictor\Base_Predictor.py:114: UserWarning: expandable_segments not supported on this platform (Triggered internally at ..\c10/cuda/CUDAAllocatorConfig.h:28.)
    self.edge_index = self._cpu_edge_index.to(self.device)
[I 2026-05-03 02:28:49,755] Trial 34 finished with value: 0.45042072265302757 and parameters: {'lr': 0.005, 'weight_decay': 0.0001, 'n_hidden': 32, 'n_layer': 2, 'dropout': 0.38846729617692116, 'knn_mode': 'd', 'k': 16, 'dexp': 4.822187205575512, 'p_grd': 0.16394088410512353, 'unc_rem': 0.21907967954307317, 'unc_rel': 0.06218939269810303}. Best is trial 31 with value: 0.4769839960402574.
    [CPU] Loading flickr...
    DEBUG 3.1: Dataset init start
    DEBUG 3.2: prepare_data start flickr
    ----Data statistics------'
    Name: flickr
    #Nodes 7575
    #Edges 239738
    #Classes 9
    #Ave_degree 63.30
    ----Split statistics------'
    #Train samples 378 (5.0 % of nodes)
    #Val samples 1136 (15.0 % of nodes)
    #Test samples 6061 (remaining)
    ----label noise information:------
    Instance dependent noise
    #Actual noise rate 0.40
    [cuda:0] LNPCC waiting for GPU slot...
    [cuda:0] Slot acquired (waited 69.7s). Starting GCN...
    FINAL_RESULT: {'acc': {'train': 0.8116710875331565, 'valid': 0.3001760563380282, 'test': 0.4528955617884837}, 'wall_s': 91.8, 'cpu_s': 88.48, 'gpu_s': 3.06, 'wait_s': 69.74}
    [Time] wall=91.8s | cpu=88.5s | gpu=3.1s
    C:\Users\fbrev\anaconda3\envs\noisygl\Lib\site-packages\torch\_utils.py:315: UserWarning: Sparse CSR tensor support is in beta state. If you miss a functionality in the sparse tensor support, please submit a feature request to https://github.com/pytorch/pytorch/issues. (Triggered internally at ..\aten\src\ATen\SparseCsrTensorImpl.cpp:55.)
    result = torch.sparse_compressed_tensor(
    C:\Users\fbrev\Documents\Acadêmico\Simulações\Python\NoisyGL\predictor\Base_Predictor.py:114: UserWarning: expandable_segments not supported on this platform (Triggered internally at ..\c10/cuda/CUDAAllocatorConfig.h:28.)
    self.edge_index = self._cpu_edge_index.to(self.device)
[I 2026-05-03 02:31:36,379] Trial 35 finished with value: 0.4528955617884837 and parameters: {'lr': 0.005, 'weight_decay': 0.0001, 'n_hidden': 32, 'n_layer': 2, 'dropout': 0.2850865027007741, 'knn_mode': 'd', 'k': 20, 'dexp': 4.3740337018499895, 'p_grd': 0.31318212205257673, 'unc_rem': 0.06909469009145423, 'unc_rel': 0.08469370064163162}. Best is trial 31 with value: 0.4769839960402574.
    [CPU] Loading flickr...
    DEBUG 3.1: Dataset init start
    DEBUG 3.2: prepare_data start flickr
    ----Data statistics------'
    Name: flickr
    #Nodes 7575
    #Edges 239738
    #Classes 9
    #Ave_degree 63.30
    ----Split statistics------'
    #Train samples 378 (5.0 % of nodes)
    #Val samples 1136 (15.0 % of nodes)
    #Test samples 6061 (remaining)
    ----label noise information:------
    Instance dependent noise
    #Actual noise rate 0.40
    [cuda:0] LNPCC waiting for GPU slot...
    [cuda:0] Slot acquired (waited 58.8s). Starting GCN...
    FINAL_RESULT: {'acc': {'train': 0.02702702702702703, 'valid': 0.11707746478873239, 'test': 0.10064345817521861}, 'wall_s': 40.74, 'cpu_s': 37.32, 'gpu_s': 3.18, 'wait_s': 58.75}
    [Time] wall=40.7s | cpu=37.3s | gpu=3.2s
    C:\Users\fbrev\anaconda3\envs\noisygl\Lib\site-packages\torch\_utils.py:315: UserWarning: Sparse CSR tensor support is in beta state. If you miss a functionality in the sparse tensor support, please submit a feature request to https://github.com/pytorch/pytorch/issues. (Triggered internally at ..\aten\src\ATen\SparseCsrTensorImpl.cpp:55.)
    result = torch.sparse_compressed_tensor(
    C:\Users\fbrev\Documents\Acadêmico\Simulações\Python\NoisyGL\predictor\Base_Predictor.py:114: UserWarning: expandable_segments not supported on this platform (Triggered internally at ..\c10/cuda/CUDAAllocatorConfig.h:28.)
    self.edge_index = self._cpu_edge_index.to(self.device)
[I 2026-05-03 02:33:21,141] Trial 36 finished with value: 0.10064345817521861 and parameters: {'lr': 0.005, 'weight_decay': 0.0001, 'n_hidden': 32, 'n_layer': 2, 'dropout': 0.42208668327185533, 'knn_mode': 'd', 'k': 27, 'dexp': 5.312247177366378, 'p_grd': 0.002575470469526886, 'unc_rem': 0.3499196903168912, 'unc_rel': 0.1603169638180514}. Best is trial 31 with value: 0.4769839960402574.
    [CPU] Loading flickr...
    DEBUG 3.1: Dataset init start
    DEBUG 3.2: prepare_data start flickr
    ----Data statistics------'
    Name: flickr
    #Nodes 7575
    #Edges 239738
    #Classes 9
    #Ave_degree 63.30
    ----Split statistics------'
    #Train samples 378 (5.0 % of nodes)
    #Val samples 1136 (15.0 % of nodes)
    #Test samples 6061 (remaining)
    ----label noise information:------
    Instance dependent noise
    #Actual noise rate 0.40
    [cuda:0] LNPCC waiting for GPU slot...
    [cuda:0] Slot acquired (waited 30.1s). Starting GCN...
    FINAL_RESULT: {'acc': {'train': 0.1134453781512605, 'valid': 0.11795774647887323, 'test': 0.09965352252103614}, 'wall_s': 44.41, 'cpu_s': 41.06, 'gpu_s': 3.11, 'wait_s': 30.13}
    [Time] wall=44.4s | cpu=41.1s | gpu=3.1s
    C:\Users\fbrev\anaconda3\envs\noisygl\Lib\site-packages\torch\_utils.py:315: UserWarning: Sparse CSR tensor support is in beta state. If you miss a functionality in the sparse tensor support, please submit a feature request to https://github.com/pytorch/pytorch/issues. (Triggered internally at ..\aten\src\ATen\SparseCsrTensorImpl.cpp:55.)
    result = torch.sparse_compressed_tensor(
    C:\Users\fbrev\Documents\Acadêmico\Simulações\Python\NoisyGL\predictor\Base_Predictor.py:114: UserWarning: expandable_segments not supported on this platform (Triggered internally at ..\c10/cuda/CUDAAllocatorConfig.h:28.)
    self.edge_index = self._cpu_edge_index.to(self.device)
[I 2026-05-03 02:34:40,871] Trial 37 finished with value: 0.09965352252103614 and parameters: {'lr': 0.005, 'weight_decay': 0.05, 'n_hidden': 32, 'n_layer': 2, 'dropout': 0.2666363185178666, 'knn_mode': 'd', 'k': 9, 'dexp': 2.4612947767087374, 'p_grd': 0.04896691933165914, 'unc_rem': 0.5064439309363896, 'unc_rel': 0.05001369564335282}. Best is trial 31 with value: 0.4769839960402574.
    [CPU] Loading flickr...
    DEBUG 3.1: Dataset init start
    DEBUG 3.2: prepare_data start flickr
    ----Data statistics------'
    Name: flickr
    #Nodes 7575
    #Edges 239738
    #Classes 9
    #Ave_degree 63.30
    ----Split statistics------'
    #Train samples 378 (5.0 % of nodes)
    #Val samples 1136 (15.0 % of nodes)
    #Test samples 6061 (remaining)
    ----label noise information:------
    Instance dependent noise
    #Actual noise rate 0.40
    [cuda:0] LNPCC waiting for GPU slot...
    [cuda:0] Slot acquired (waited 5.2s). Starting GCN...
    FINAL_RESULT: {'acc': {'train': 0.7593123209169055, 'valid': 0.30985915492957744, 'test': 0.4743441676291041}, 'wall_s': 72.56, 'cpu_s': 69.27, 'gpu_s': 3.07, 'wait_s': 5.22}
    [Time] wall=72.6s | cpu=69.3s | gpu=3.1s
    C:\Users\fbrev\anaconda3\envs\noisygl\Lib\site-packages\torch\_utils.py:315: UserWarning: Sparse CSR tensor support is in beta state. If you miss a functionality in the sparse tensor support, please submit a feature request to https://github.com/pytorch/pytorch/issues. (Triggered internally at ..\aten\src\ATen\SparseCsrTensorImpl.cpp:55.)
    result = torch.sparse_compressed_tensor(
    C:\Users\fbrev\Documents\Acadêmico\Simulações\Python\NoisyGL\predictor\Base_Predictor.py:114: UserWarning: expandable_segments not supported on this platform (Triggered internally at ..\c10/cuda/CUDAAllocatorConfig.h:28.)
    self.edge_index = self._cpu_edge_index.to(self.device)
[I 2026-05-03 02:36:03,824] Trial 38 finished with value: 0.4743441676291041 and parameters: {'lr': 0.005, 'weight_decay': 0.0001, 'n_hidden': 32, 'n_layer': 2, 'dropout': 0.3583450036814877, 'knn_mode': 'd', 'k': 14, 'dexp': 4.262114295961137, 'p_grd': 0.1760786854990268, 'unc_rem': 0.056273699568195557, 'unc_rel': 0.10803692923975072}. Best is trial 31 with value: 0.4769839960402574.
    [CPU] Loading flickr...
    DEBUG 3.1: Dataset init start
    DEBUG 3.2: prepare_data start flickr
    ----Data statistics------'
    Name: flickr
    #Nodes 7575
    #Edges 239738
    #Classes 9
    #Ave_degree 63.30
    ----Split statistics------'
    #Train samples 378 (5.0 % of nodes)
    #Val samples 1136 (15.0 % of nodes)
    #Test samples 6061 (remaining)
    ----label noise information:------
    Instance dependent noise
    #Actual noise rate 0.40
    [cuda:0] LNPCC waiting for GPU slot...
    [cuda:0] Slot acquired (waited 74.4s). Starting GCN...
    FINAL_RESULT: {'acc': {'train': 0.7566765578635015, 'valid': 0.30545774647887325, 'test': 0.4530605510641808}, 'wall_s': 89.24, 'cpu_s': 85.77, 'gpu_s': 3.25, 'wait_s': 74.39}
    [Time] wall=89.2s | cpu=85.8s | gpu=3.3s
    C:\Users\fbrev\anaconda3\envs\noisygl\Lib\site-packages\torch\_utils.py:315: UserWarning: Sparse CSR tensor support is in beta state. If you miss a functionality in the sparse tensor support, please submit a feature request to https://github.com/pytorch/pytorch/issues. (Triggered internally at ..\aten\src\ATen\SparseCsrTensorImpl.cpp:55.)
    result = torch.sparse_compressed_tensor(
    C:\Users\fbrev\Documents\Acadêmico\Simulações\Python\NoisyGL\predictor\Base_Predictor.py:114: UserWarning: expandable_segments not supported on this platform (Triggered internally at ..\c10/cuda/CUDAAllocatorConfig.h:28.)
    self.edge_index = self._cpu_edge_index.to(self.device)
[I 2026-05-03 02:38:52,538] Trial 39 finished with value: 0.4530605510641808 and parameters: {'lr': 0.005, 'weight_decay': 0.0001, 'n_hidden': 32, 'n_layer': 2, 'dropout': 0.3475995471829037, 'knn_mode': 'd', 'k': 14, 'dexp': 1.7784691526932694, 'p_grd': 0.2870878699937952, 'unc_rem': 0.23679760128987612, 'unc_rel': 0.30775743736371575}. Best is trial 31 with value: 0.4769839960402574.
    [CPU] Loading flickr...
    DEBUG 3.1: Dataset init start
    DEBUG 3.2: prepare_data start flickr
    ----Data statistics------'
    Name: flickr
    #Nodes 7575
    #Edges 239738
    #Classes 9
    #Ave_degree 63.30
    ----Split statistics------'
    #Train samples 378 (5.0 % of nodes)
    #Val samples 1136 (15.0 % of nodes)
    #Test samples 6061 (remaining)
    ----label noise information:------
    Instance dependent noise
    #Actual noise rate 0.40
    [cuda:0] LNPCC waiting for GPU slot...
    [cuda:0] Slot acquired (waited 15.2s). Starting GCN...
    FINAL_RESULT: {'acc': {'train': 0.18716577540106952, 'valid': 0.15492957746478872, 'test': 0.1542649727767695}, 'wall_s': 75.27, 'cpu_s': 71.94, 'gpu_s': 3.07, 'wait_s': 15.2}
    [Time] wall=75.3s | cpu=71.9s | gpu=3.1s
    C:\Users\fbrev\anaconda3\envs\noisygl\Lib\site-packages\torch\_utils.py:315: UserWarning: Sparse CSR tensor support is in beta state. If you miss a functionality in the sparse tensor support, please submit a feature request to https://github.com/pytorch/pytorch/issues. (Triggered internally at ..\aten\src\ATen\SparseCsrTensorImpl.cpp:55.)
    result = torch.sparse_compressed_tensor(
    C:\Users\fbrev\Documents\Acadêmico\Simulações\Python\NoisyGL\predictor\Base_Predictor.py:114: UserWarning: expandable_segments not supported on this platform (Triggered internally at ..\c10/cuda/CUDAAllocatorConfig.h:28.)
    self.edge_index = self._cpu_edge_index.to(self.device)
[I 2026-05-03 02:40:28,259] Trial 40 finished with value: 0.1542649727767695 and parameters: {'lr': 0.005, 'weight_decay': 0.01, 'n_hidden': 32, 'n_layer': 2, 'dropout': 0.4624390493615994, 'knn_mode': 'd', 'k': 18, 'dexp': 4.320686821607895, 'p_grd': 0.22639137149223099, 'unc_rem': 0.5390047262750891, 'unc_rel': 0.11293246448895614}. Best is trial 31 with value: 0.4769839960402574.
    [CPU] Loading flickr...
    DEBUG 3.1: Dataset init start
    DEBUG 3.2: prepare_data start flickr
    ----Data statistics------'
    Name: flickr
    #Nodes 7575
    #Edges 239738
    #Classes 9
    #Ave_degree 63.30
    ----Split statistics------'
    #Train samples 378 (5.0 % of nodes)
    #Val samples 1136 (15.0 % of nodes)
    #Test samples 6061 (remaining)
    ----label noise information:------
    Instance dependent noise
    #Actual noise rate 0.40
    [cuda:0] LNPCC waiting for GPU slot...
    [cuda:0] Slot acquired (waited 19.5s). Starting GCN...
    FINAL_RESULT: {'acc': {'train': 0.7317073170731707, 'valid': 0.3089788732394366, 'test': 0.455535390199637}, 'wall_s': 57.42, 'cpu_s': 53.9, 'gpu_s': 3.3, 'wait_s': 19.51}
    [Time] wall=57.4s | cpu=53.9s | gpu=3.3s
    C:\Users\fbrev\anaconda3\envs\noisygl\Lib\site-packages\torch\_utils.py:315: UserWarning: Sparse CSR tensor support is in beta state. If you miss a functionality in the sparse tensor support, please submit a feature request to https://github.com/pytorch/pytorch/issues. (Triggered internally at ..\aten\src\ATen\SparseCsrTensorImpl.cpp:55.)
    result = torch.sparse_compressed_tensor(
    C:\Users\fbrev\Documents\Acadêmico\Simulações\Python\NoisyGL\predictor\Base_Predictor.py:114: UserWarning: expandable_segments not supported on this platform (Triggered internally at ..\c10/cuda/CUDAAllocatorConfig.h:28.)
    self.edge_index = self._cpu_edge_index.to(self.device)
[I 2026-05-03 02:41:50,465] Trial 41 finished with value: 0.455535390199637 and parameters: {'lr': 0.005, 'weight_decay': 0.0001, 'n_hidden': 32, 'n_layer': 2, 'dropout': 0.3878131098562845, 'knn_mode': 'd', 'k': 8, 'dexp': 5.09406477586159, 'p_grd': 0.19446860318230808, 'unc_rem': 0.07538269711289244, 'unc_rel': 0.04263161996615329}. Best is trial 31 with value: 0.4769839960402574.
    [CPU] Loading flickr...
    DEBUG 3.1: Dataset init start
    DEBUG 3.2: prepare_data start flickr
    ----Data statistics------'
    Name: flickr
    #Nodes 7575
    #Edges 239738
    #Classes 9
    #Ave_degree 63.30
    ----Split statistics------'
    #Train samples 378 (5.0 % of nodes)
    #Val samples 1136 (15.0 % of nodes)
    #Test samples 6061 (remaining)
    ----label noise information:------
    Instance dependent noise
    #Actual noise rate 0.40
    [cuda:0] LNPCC waiting for GPU slot...
    [cuda:0] Slot acquired (waited 4.1s). Starting GCN...
    FINAL_RESULT: {'acc': {'train': 0.8242811501597445, 'valid': 0.31954225352112675, 'test': 0.4890282131661442}, 'wall_s': 64.87, 'cpu_s': 61.29, 'gpu_s': 3.32, 'wait_s': 4.05}
    [Time] wall=64.9s | cpu=61.3s | gpu=3.3s
    C:\Users\fbrev\anaconda3\envs\noisygl\Lib\site-packages\torch\_utils.py:315: UserWarning: Sparse CSR tensor support is in beta state. If you miss a functionality in the sparse tensor support, please submit a feature request to https://github.com/pytorch/pytorch/issues. (Triggered internally at ..\aten\src\ATen\SparseCsrTensorImpl.cpp:55.)
    result = torch.sparse_compressed_tensor(
    C:\Users\fbrev\Documents\Acadêmico\Simulações\Python\NoisyGL\predictor\Base_Predictor.py:114: UserWarning: expandable_segments not supported on this platform (Triggered internally at ..\c10/cuda/CUDAAllocatorConfig.h:28.)
    self.edge_index = self._cpu_edge_index.to(self.device)
[I 2026-05-03 02:43:04,799] Trial 42 finished with value: 0.4890282131661442 and parameters: {'lr': 0.005, 'weight_decay': 0.0001, 'n_hidden': 32, 'n_layer': 2, 'dropout': 0.30940100478357446, 'knn_mode': 'd', 'k': 11, 'dexp': 4.151939013085769, 'p_grd': 0.1624301315344161, 'unc_rem': 0.0330112116682224, 'unc_rel': 0.1476276477621586}. Best is trial 42 with value: 0.4890282131661442.
    [CPU] Loading flickr...
    DEBUG 3.1: Dataset init start
    DEBUG 3.2: prepare_data start flickr
    ----Data statistics------'
    Name: flickr
    #Nodes 7575
    #Edges 239738
    #Classes 9
    #Ave_degree 63.30
    ----Split statistics------'
    #Train samples 378 (5.0 % of nodes)
    #Val samples 1136 (15.0 % of nodes)
    #Test samples 6061 (remaining)
    ----label noise information:------
    Instance dependent noise
    #Actual noise rate 0.40
    [cuda:0] LNPCC waiting for GPU slot...
    [cuda:0] Slot acquired (waited 5.0s). Starting GCN...
    FINAL_RESULT: {'acc': {'train': 0.948936170212766, 'valid': 0.2323943661971831, 'test': 0.2963207391519551}, 'wall_s': 46.43, 'cpu_s': 42.84, 'gpu_s': 3.34, 'wait_s': 4.97}
    [Time] wall=46.4s | cpu=42.8s | gpu=3.3s
    C:\Users\fbrev\anaconda3\envs\noisygl\Lib\site-packages\torch\_utils.py:315: UserWarning: Sparse CSR tensor support is in beta state. If you miss a functionality in the sparse tensor support, please submit a feature request to https://github.com/pytorch/pytorch/issues. (Triggered internally at ..\aten\src\ATen\SparseCsrTensorImpl.cpp:55.)
    result = torch.sparse_compressed_tensor(
    C:\Users\fbrev\Documents\Acadêmico\Simulações\Python\NoisyGL\predictor\Base_Predictor.py:114: UserWarning: expandable_segments not supported on this platform (Triggered internally at ..\c10/cuda/CUDAAllocatorConfig.h:28.)
    self.edge_index = self._cpu_edge_index.to(self.device)
