[I 2026-05-01 22:19:14,515] Trial 34 finished with value: 0.598 and parameters: {'lr': 0.005, 'weight_decay': 0.0, 'n_hidden': 64, 'n_layer': 2, 'dropout': 0.4376877516948119, 'knn_mode': 's', 'k': 37, 'dexp': 7.533999394346139, 'p_grd': 0.014674153455268374, 'unc_rem': 0.0003150568846217016, 'unc_rel': 0.08159133075246314}. Best is trial 23 with value: 0.831.
    [CPU] Loading amazonpho...
    DEBUG 3.1: Dataset init start
    DEBUG 3.2: prepare_data start amazonpho
    ----Data statistics------'
    Name: amazonpho
    #Nodes 7650
    #Edges 119081
    #Classes 8
    #Ave_degree 31.13
    ----Split statistics------'
    #Train samples 160 (20 nodes per class)
    #Val samples 500 (specified)
    #Test samples 1000 (specified)
    ----label noise information:------
    Instance dependent noise
    #Actual noise rate 0.50
    [cuda:1] LNPCC waiting for GPU slot...
    [cuda:1] Slot acquired (waited 121.6s). Starting GCN...
    FINAL_RESULT: {'acc': {'train': 0.6118421052631579, 'valid': 0.428, 'test': 0.781}, 'wall_s': 17.23, 'cpu_s': 14.54, 'gpu_s': 2.62, 'wait_s': 121.56}
    [Time] wall=17.2s | cpu=14.5s | gpu=2.6s
    C:\Users\fbrev\Documents\Acadêmico\Simulações\Python\NoisyGL\predictor\Base_Predictor.py:114: UserWarning: expandable_segments not supported on this platform (Triggered internally at ..\c10/cuda/CUDAAllocatorConfig.h:28.)
    self.edge_index = self._cpu_edge_index.to(self.device)
    C:\Users\fbrev\Documents\Acadêmico\Simulações\Python\NoisyGL\predictor\Base_Predictor.py:144: UserWarning: Sparse CSR tensor support is in beta state. If you miss a functionality in the sparse tensor support, please submit a feature request to https://github.com/pytorch/pytorch/issues. (Triggered internally at ..\aten\src\ATen\SparseCsrTensorImpl.cpp:55.)
    self.adj_csr = self.adj.to_sparse_csr().to(self.device)
[I 2026-05-01 22:21:39,815] Trial 35 finished with value: 0.781 and parameters: {'lr': 0.005, 'weight_decay': 0.05, 'n_hidden': 64, 'n_layer': 2, 'dropout': 0.6772755523768512, 'knn_mode': 's', 'k': 40, 'dexp': 6.113783912974077, 'p_grd': 0.16785321032080053, 'unc_rem': 0.358963619476874, 'unc_rel': 0.42834156014395963}. Best is trial 23 with value: 0.831.
    [CPU] Loading amazonpho...
    DEBUG 3.1: Dataset init start
    DEBUG 3.2: prepare_data start amazonpho
    ----Data statistics------'
    Name: amazonpho
    #Nodes 7650
    #Edges 119081
    #Classes 8
    #Ave_degree 31.13
    ----Split statistics------'
    #Train samples 160 (20 nodes per class)
    #Val samples 500 (specified)
    #Test samples 1000 (specified)
    ----label noise information:------
    Instance dependent noise
    #Actual noise rate 0.50
    [cuda:1] LNPCC waiting for GPU slot...
    [cuda:1] Slot acquired (waited 124.6s). Starting GCN...
    FINAL_RESULT: {'acc': {'train': 0.7152777777777778, 'valid': 0.402, 'test': 0.668}, 'wall_s': 16.26, 'cpu_s': 13.91, 'gpu_s': 2.28, 'wait_s': 124.57}
    [Time] wall=16.3s | cpu=13.9s | gpu=2.3s
    C:\Users\fbrev\Documents\Acadêmico\Simulações\Python\NoisyGL\predictor\Base_Predictor.py:114: UserWarning: expandable_segments not supported on this platform (Triggered internally at ..\c10/cuda/CUDAAllocatorConfig.h:28.)
    self.edge_index = self._cpu_edge_index.to(self.device)
    C:\Users\fbrev\Documents\Acadêmico\Simulações\Python\NoisyGL\predictor\Base_Predictor.py:144: UserWarning: Sparse CSR tensor support is in beta state. If you miss a functionality in the sparse tensor support, please submit a feature request to https://github.com/pytorch/pytorch/issues. (Triggered internally at ..\aten\src\ATen\SparseCsrTensorImpl.cpp:55.)
    self.adj_csr = self.adj.to_sparse_csr().to(self.device)
[I 2026-05-01 22:24:07,412] Trial 36 finished with value: 0.668 and parameters: {'lr': 0.005, 'weight_decay': 0.0, 'n_hidden': 32, 'n_layer': 2, 'dropout': 0.28869576776731987, 'knn_mode': 's', 'k': 34, 'dexp': 5.182081874371019, 'p_grd': 0.27403141795379965, 'unc_rem': 0.148706433010859, 'unc_rel': 0.133500042711963}. Best is trial 23 with value: 0.831.
    [CPU] Loading amazonpho...
    DEBUG 3.1: Dataset init start
    DEBUG 3.2: prepare_data start amazonpho
    ----Data statistics------'
    Name: amazonpho
    #Nodes 7650
    #Edges 119081
    #Classes 8
    #Ave_degree 31.13
    ----Split statistics------'
    #Train samples 160 (20 nodes per class)
    #Val samples 500 (specified)
    #Test samples 1000 (specified)
    ----label noise information:------
    Instance dependent noise
    #Actual noise rate 0.50
    [cuda:1] LNPCC waiting for GPU slot...
    [cuda:1] Slot acquired (waited 122.7s). Starting GCN...
    FINAL_RESULT: {'acc': {'train': 0.8653846153846154, 'valid': 0.426, 'test': 0.831}, 'wall_s': 18.53, 'cpu_s': 15.0, 'gpu_s': 3.46, 'wait_s': 122.65}
    [Time] wall=18.5s | cpu=15.0s | gpu=3.5s
    C:\Users\fbrev\Documents\Acadêmico\Simulações\Python\NoisyGL\predictor\Base_Predictor.py:114: UserWarning: expandable_segments not supported on this platform (Triggered internally at ..\c10/cuda/CUDAAllocatorConfig.h:28.)
    self.edge_index = self._cpu_edge_index.to(self.device)
    C:\Users\fbrev\Documents\Acadêmico\Simulações\Python\NoisyGL\predictor\Base_Predictor.py:144: UserWarning: Sparse CSR tensor support is in beta state. If you miss a functionality in the sparse tensor support, please submit a feature request to https://github.com/pytorch/pytorch/issues. (Triggered internally at ..\aten\src\ATen\SparseCsrTensorImpl.cpp:55.)
    self.adj_csr = self.adj.to_sparse_csr().to(self.device)
[I 2026-05-01 22:26:34,808] Trial 37 finished with value: 0.831 and parameters: {'lr': 0.005, 'weight_decay': 0.0, 'n_hidden': 128, 'n_layer': 2, 'dropout': 0.7581899991303682, 'knn_mode': 'd', 'k': 25, 'dexp': 6.9246146993701485, 'p_grd': 0.07520514732428876, 'unc_rem': 0.082891899173129, 'unc_rel': 0.047742558516471946}. Best is trial 23 with value: 0.831.
    [CPU] Loading amazonpho...
    DEBUG 3.1: Dataset init start
    DEBUG 3.2: prepare_data start amazonpho
    ----Data statistics------'
    Name: amazonpho
    #Nodes 7650
    #Edges 119081
    #Classes 8
    #Ave_degree 31.13
    ----Split statistics------'
    #Train samples 160 (20 nodes per class)
    #Val samples 500 (specified)
    #Test samples 1000 (specified)
    ----label noise information:------
    Instance dependent noise
    #Actual noise rate 0.50
    [cuda:1] LNPCC waiting for GPU slot...
    [cuda:1] Slot acquired (waited 118.7s). Starting GCN...
    FINAL_RESULT: {'acc': {'train': 0.5125, 'valid': 0.44, 'test': 0.793}, 'wall_s': 22.59, 'cpu_s': 19.3, 'gpu_s': 3.23, 'wait_s': 118.72}
    [Time] wall=22.6s | cpu=19.3s | gpu=3.2s
    C:\Users\fbrev\Documents\Acadêmico\Simulações\Python\NoisyGL\predictor\Base_Predictor.py:114: UserWarning: expandable_segments not supported on this platform (Triggered internally at ..\c10/cuda/CUDAAllocatorConfig.h:28.)
    self.edge_index = self._cpu_edge_index.to(self.device)
    C:\Users\fbrev\Documents\Acadêmico\Simulações\Python\NoisyGL\predictor\Base_Predictor.py:144: UserWarning: Sparse CSR tensor support is in beta state. If you miss a functionality in the sparse tensor support, please submit a feature request to https://github.com/pytorch/pytorch/issues. (Triggered internally at ..\aten\src\ATen\SparseCsrTensorImpl.cpp:55.)
    self.adj_csr = self.adj.to_sparse_csr().to(self.device)
[I 2026-05-01 22:29:02,288] Trial 38 finished with value: 0.793 and parameters: {'lr': 0.005, 'weight_decay': 0.01, 'n_hidden': 128, 'n_layer': 2, 'dropout': 0.7923391779931291, 'knn_mode': 'd', 'k': 30, 'dexp': 4.219417954172566, 'p_grd': 0.5653694022304386, 'unc_rem': 0.10274557000412674, 'unc_rel': 0.008384454981857942}. Best is trial 23 with value: 0.831.
    [CPU] Loading amazonpho...
    DEBUG 3.1: Dataset init start
    DEBUG 3.2: prepare_data start amazonpho
    ----Data statistics------'
    Name: amazonpho
    #Nodes 7650
    #Edges 119081
    #Classes 8
    #Ave_degree 31.13
    ----Split statistics------'
    #Train samples 160 (20 nodes per class)
    #Val samples 500 (specified)
    #Test samples 1000 (specified)
    ----label noise information:------
    Instance dependent noise
    #Actual noise rate 0.50
    [cuda:1] LNPCC waiting for GPU slot...
    [cuda:1] Slot acquired (waited 121.7s). Starting GCN...
    FINAL_RESULT: {'acc': {'train': 0.3333333333333333, 'valid': 0.336, 'test': 0.565}, 'wall_s': 16.98, 'cpu_s': 13.54, 'gpu_s': 3.37, 'wait_s': 121.72}
    [Time] wall=17.0s | cpu=13.5s | gpu=3.4s
    C:\Users\fbrev\Documents\Acadêmico\Simulações\Python\NoisyGL\predictor\Base_Predictor.py:114: UserWarning: expandable_segments not supported on this platform (Triggered internally at ..\c10/cuda/CUDAAllocatorConfig.h:28.)
    self.edge_index = self._cpu_edge_index.to(self.device)
    C:\Users\fbrev\Documents\Acadêmico\Simulações\Python\NoisyGL\predictor\Base_Predictor.py:144: UserWarning: Sparse CSR tensor support is in beta state. If you miss a functionality in the sparse tensor support, please submit a feature request to https://github.com/pytorch/pytorch/issues. (Triggered internally at ..\aten\src\ATen\SparseCsrTensorImpl.cpp:55.)
    self.adj_csr = self.adj.to_sparse_csr().to(self.device)
[I 2026-05-01 22:31:27,415] Trial 39 finished with value: 0.565 and parameters: {'lr': 0.05, 'weight_decay': 0.0, 'n_hidden': 128, 'n_layer': 2, 'dropout': 0.7369279586334003, 'knn_mode': 'd', 'k': 19, 'dexp': 3.160761859375873, 'p_grd': 0.05814037649513338, 'unc_rem': 0.22243209924005364, 'unc_rel': 0.288487239560226}. Best is trial 23 with value: 0.831.
    [CPU] Loading amazonpho...
    DEBUG 3.1: Dataset init start
    DEBUG 3.2: prepare_data start amazonpho
    ----Data statistics------'
    Name: amazonpho
    #Nodes 7650
    #Edges 119081
    #Classes 8
    #Ave_degree 31.13
    ----Split statistics------'
    #Train samples 160 (20 nodes per class)
    #Val samples 500 (specified)
    #Test samples 1000 (specified)
    ----label noise information:------
    Instance dependent noise
    #Actual noise rate 0.50
    [cuda:1] LNPCC waiting for GPU slot...
    [cuda:1] Slot acquired (waited 116.5s). Starting GCN...
    FINAL_RESULT: {'acc': {'train': 0.847457627118644, 'valid': 0.408, 'test': 0.757}, 'wall_s': 27.26, 'cpu_s': 23.86, 'gpu_s': 3.34, 'wait_s': 116.52}
    [Time] wall=27.3s | cpu=23.9s | gpu=3.3s
    C:\Users\fbrev\Documents\Acadêmico\Simulações\Python\NoisyGL\predictor\Base_Predictor.py:114: UserWarning: expandable_segments not supported on this platform (Triggered internally at ..\c10/cuda/CUDAAllocatorConfig.h:28.)
    self.edge_index = self._cpu_edge_index.to(self.device)
    C:\Users\fbrev\Documents\Acadêmico\Simulações\Python\NoisyGL\predictor\Base_Predictor.py:144: UserWarning: Sparse CSR tensor support is in beta state. If you miss a functionality in the sparse tensor support, please submit a feature request to https://github.com/pytorch/pytorch/issues. (Triggered internally at ..\aten\src\ATen\SparseCsrTensorImpl.cpp:55.)
    self.adj_csr = self.adj.to_sparse_csr().to(self.device)
[I 2026-05-01 22:33:57,526] Trial 40 finished with value: 0.757 and parameters: {'lr': 0.005, 'weight_decay': 0.0, 'n_hidden': 128, 'n_layer': 2, 'dropout': 0.7386776919498625, 'knn_mode': 'd', 'k': 44, 'dexp': 1.1205205179277606, 'p_grd': 0.38007074038768074, 'unc_rem': 0.13611969454630624, 'unc_rel': 0.2111910015052815}. Best is trial 23 with value: 0.831.
    [CPU] Loading amazonpho...
    DEBUG 3.1: Dataset init start
    DEBUG 3.2: prepare_data start amazonpho
    ----Data statistics------'
    Name: amazonpho
    #Nodes 7650
    #Edges 119081
    #Classes 8
    #Ave_degree 31.13
    ----Split statistics------'
    #Train samples 160 (20 nodes per class)
    #Val samples 500 (specified)
    #Test samples 1000 (specified)
    ----label noise information:------
    Instance dependent noise
    #Actual noise rate 0.50
    [cuda:1] LNPCC waiting for GPU slot...
    [cuda:1] Slot acquired (waited 119.5s). Starting GCN...
    FINAL_RESULT: {'acc': {'train': 0.7636363636363637, 'valid': 0.41, 'test': 0.79}, 'wall_s': 19.11, 'cpu_s': 15.66, 'gpu_s': 3.39, 'wait_s': 119.47}
    [Time] wall=19.1s | cpu=15.7s | gpu=3.4s
    C:\Users\fbrev\Documents\Acadêmico\Simulações\Python\NoisyGL\predictor\Base_Predictor.py:114: UserWarning: expandable_segments not supported on this platform (Triggered internally at ..\c10/cuda/CUDAAllocatorConfig.h:28.)
    self.edge_index = self._cpu_edge_index.to(self.device)
    C:\Users\fbrev\Documents\Acadêmico\Simulações\Python\NoisyGL\predictor\Base_Predictor.py:144: UserWarning: Sparse CSR tensor support is in beta state. If you miss a functionality in the sparse tensor support, please submit a feature request to https://github.com/pytorch/pytorch/issues. (Triggered internally at ..\aten\src\ATen\SparseCsrTensorImpl.cpp:55.)
    self.adj_csr = self.adj.to_sparse_csr().to(self.device)
[I 2026-05-01 22:36:22,583] Trial 41 finished with value: 0.79 and parameters: {'lr': 0.005, 'weight_decay': 0.0, 'n_hidden': 128, 'n_layer': 2, 'dropout': 0.598423315446464, 'knn_mode': 'd', 'k': 25, 'dexp': 6.7646872377920815, 'p_grd': 0.09980595336189524, 'unc_rem': 0.05797599871919542, 'unc_rel': 0.06026704354231527}. Best is trial 23 with value: 0.831.
    [CPU] Loading amazonpho...
    DEBUG 3.1: Dataset init start
    DEBUG 3.2: prepare_data start amazonpho
    ----Data statistics------'
    Name: amazonpho
    #Nodes 7650
    #Edges 119081
    #Classes 8
    #Ave_degree 31.13
    ----Split statistics------'
    #Train samples 160 (20 nodes per class)
    #Val samples 500 (specified)
    #Test samples 1000 (specified)
    ----label noise information:------
    Instance dependent noise
    #Actual noise rate 0.50
    [cuda:1] LNPCC waiting for GPU slot...
    [cuda:1] Slot acquired (waited 122.7s). Starting GCN...
    FINAL_RESULT: {'acc': {'train': 0.6111111111111112, 'valid': 0.418, 'test': 0.763}, 'wall_s': 18.09, 'cpu_s': 15.31, 'gpu_s': 2.71, 'wait_s': 122.71}
    [Time] wall=18.1s | cpu=15.3s | gpu=2.7s
    C:\Users\fbrev\Documents\Acadêmico\Simulações\Python\NoisyGL\predictor\Base_Predictor.py:114: UserWarning: expandable_segments not supported on this platform (Triggered internally at ..\c10/cuda/CUDAAllocatorConfig.h:28.)
    self.edge_index = self._cpu_edge_index.to(self.device)
    C:\Users\fbrev\Documents\Acadêmico\Simulações\Python\NoisyGL\predictor\Base_Predictor.py:144: UserWarning: Sparse CSR tensor support is in beta state. If you miss a functionality in the sparse tensor support, please submit a feature request to https://github.com/pytorch/pytorch/issues. (Triggered internally at ..\aten\src\ATen\SparseCsrTensorImpl.cpp:55.)
    self.adj_csr = self.adj.to_sparse_csr().to(self.device)
[I 2026-05-01 22:38:49,779] Trial 42 finished with value: 0.763 and parameters: {'lr': 0.005, 'weight_decay': 0.0, 'n_hidden': 64, 'n_layer': 2, 'dropout': 0.6799496632112912, 'knn_mode': 'd', 'k': 27, 'dexp': 7.386293941302227, 'p_grd': 0.19478011069105494, 'unc_rem': 0.04269750579509818, 'unc_rel': 0.10917035987170097}. Best is trial 23 with value: 0.831.
    [CPU] Loading amazonpho...
    DEBUG 3.1: Dataset init start
    DEBUG 3.2: prepare_data start amazonpho
    ----Data statistics------'
    Name: amazonpho
    #Nodes 7650
    #Edges 119081
    #Classes 8
    #Ave_degree 31.13
    ----Split statistics------'
    #Train samples 160 (20 nodes per class)
    #Val samples 500 (specified)
    #Test samples 1000 (specified)
    ----label noise information:------
    Instance dependent noise
    #Actual noise rate 0.50
    [cuda:1] LNPCC waiting for GPU slot...
    [cuda:1] Slot acquired (waited 131.5s). Starting GCN...
    FINAL_RESULT: {'acc': {'train': 0.8807339449541285, 'valid': 0.406, 'test': 0.774}, 'wall_s': 16.41, 'cpu_s': 12.84, 'gpu_s': 3.51, 'wait_s': 131.48}
    [Time] wall=16.4s | cpu=12.8s | gpu=3.5s
    C:\Users\fbrev\Documents\Acadêmico\Simulações\Python\NoisyGL\predictor\Base_Predictor.py:114: UserWarning: expandable_segments not supported on this platform (Triggered internally at ..\c10/cuda/CUDAAllocatorConfig.h:28.)
    self.edge_index = self._cpu_edge_index.to(self.device)
    C:\Users\fbrev\Documents\Acadêmico\Simulações\Python\NoisyGL\predictor\Base_Predictor.py:144: UserWarning: Sparse CSR tensor support is in beta state. If you miss a functionality in the sparse tensor support, please submit a feature request to https://github.com/pytorch/pytorch/issues. (Triggered internally at ..\aten\src\ATen\SparseCsrTensorImpl.cpp:55.)
    self.adj_csr = self.adj.to_sparse_csr().to(self.device)
[I 2026-05-01 22:41:24,131] Trial 43 finished with value: 0.774 and parameters: {'lr': 0.005, 'weight_decay': 0.0, 'n_hidden': 128, 'n_layer': 2, 'dropout': 0.5286988481053684, 'knn_mode': 's', 'k': 23, 'dexp': 5.594428635724269, 'p_grd': 0.002222362532891639, 'unc_rem': 0.09759620414232997, 'unc_rel': 0.05092372794605859}. Best is trial 23 with value: 0.831.
    [CPU] Loading amazonpho...
    DEBUG 3.1: Dataset init start
    DEBUG 3.2: prepare_data start amazonpho
    ----Data statistics------'
    Name: amazonpho
    #Nodes 7650
    #Edges 119081
    #Classes 8
    #Ave_degree 31.13
    ----Split statistics------'
    #Train samples 160 (20 nodes per class)
    #Val samples 500 (specified)
    #Test samples 1000 (specified)
    ----label noise information:------
    Instance dependent noise
    #Actual noise rate 0.50
    [cuda:1] LNPCC waiting for GPU slot...
    [cuda:1] Slot acquired (waited 116.5s). Starting GCN...
    FINAL_RESULT: {'acc': {'train': 0.5477707006369427, 'valid': 0.42, 'test': 0.676}, 'wall_s': 23.51, 'cpu_s': 20.86, 'gpu_s': 2.59, 'wait_s': 116.5}
    [Time] wall=23.5s | cpu=20.9s | gpu=2.6s
    C:\Users\fbrev\Documents\Acadêmico\Simulações\Python\NoisyGL\predictor\Base_Predictor.py:114: UserWarning: expandable_segments not supported on this platform (Triggered internally at ..\c10/cuda/CUDAAllocatorConfig.h:28.)
    self.edge_index = self._cpu_edge_index.to(self.device)
    C:\Users\fbrev\Documents\Acadêmico\Simulações\Python\NoisyGL\predictor\Base_Predictor.py:144: UserWarning: Sparse CSR tensor support is in beta state. If you miss a functionality in the sparse tensor support, please submit a feature request to https://github.com/pytorch/pytorch/issues. (Triggered internally at ..\aten\src\ATen\SparseCsrTensorImpl.cpp:55.)
    self.adj_csr = self.adj.to_sparse_csr().to(self.device)
[I 2026-05-01 22:43:50,911] Trial 44 finished with value: 0.676 and parameters: {'lr': 0.005, 'weight_decay': 0.0001, 'n_hidden': 64, 'n_layer': 2, 'dropout': 0.4720313844945254, 'knn_mode': 'd', 'k': 35, 'dexp': 7.802342595629101, 'p_grd': 0.22306620484813086, 'unc_rem': 0.17052299644286284, 'unc_rel': 0.1673088055579064}. Best is trial 23 with value: 0.831.
    [CPU] Loading amazonpho...
    DEBUG 3.1: Dataset init start
    DEBUG 3.2: prepare_data start amazonpho
    ----Data statistics------'
    Name: amazonpho
    #Nodes 7650
    #Edges 119081
    #Classes 8
    #Ave_degree 31.13
    ----Split statistics------'
    #Train samples 160 (20 nodes per class)
    #Val samples 500 (specified)
    #Test samples 1000 (specified)
    ----label noise information:------
    Instance dependent noise
    #Actual noise rate 0.50
    [cuda:1] LNPCC waiting for GPU slot...
    [cuda:1] Slot acquired (waited 125.5s). Starting GCN...
    FINAL_RESULT: {'acc': {'train': 0.7092198581560284, 'valid': 0.442, 'test': 0.786}, 'wall_s': 14.54, 'cpu_s': 12.25, 'gpu_s': 2.2, 'wait_s': 125.48}
    [Time] wall=14.5s | cpu=12.3s | gpu=2.2s
    C:\Users\fbrev\Documents\Acadêmico\Simulações\Python\NoisyGL\predictor\Base_Predictor.py:114: UserWarning: expandable_segments not supported on this platform (Triggered internally at ..\c10/cuda/CUDAAllocatorConfig.h:28.)
    self.edge_index = self._cpu_edge_index.to(self.device)
    C:\Users\fbrev\Documents\Acadêmico\Simulações\Python\NoisyGL\predictor\Base_Predictor.py:144: UserWarning: Sparse CSR tensor support is in beta state. If you miss a functionality in the sparse tensor support, please submit a feature request to https://github.com/pytorch/pytorch/issues. (Triggered internally at ..\aten\src\ATen\SparseCsrTensorImpl.cpp:55.)
    self.adj_csr = self.adj.to_sparse_csr().to(self.device)
