[I 2026-05-04 12:40:08,801] Trial 43 finished with value: 0.7634726515253326 and parameters: {'lr': 0.005, 'weight_decay': 0.0001, 'n_hidden': 256, 'n_layer': 3, 'dropout': 0.5824265360850477, 'knn_mode': 's', 'k': 43, 'dexp': 3.046736506295166, 'p_grd': 0.6047096217984965, 'unc_rem': 0.5497357344230196, 'unc_rel': 0.7188971597991307}. Best is trial 22 with value: 0.7636070420642387.
    [CPU] Loading dblp...
    DEBUG 3.1: Dataset init start
    DEBUG 3.2: prepare_data start dblp
    ----Data statistics------'
    Name: dblp
    #Nodes 17716
    #Edges 52867
    #Classes 4
    #Ave_degree 5.97
    ----Split statistics------'
    #Train samples 177 (1.0 % of nodes)
    #Val samples 2657 (15.0 % of nodes)
    #Test samples 14882 (remaining)
    ----label noise information:------
    Instance dependent noise
    #Actual noise rate 0.20
    [cuda:0] LNPCC waiting for GPU slot...
    [cuda:0] Slot acquired (waited 18.6s). Starting GCN...
    FINAL_RESULT: {'acc': {'train': 0.8295454545454546, 'valid': 0.6217538577342868, 'test': 0.7585002015858083}, 'wall_s': 36.48, 'cpu_s': 30.14, 'gpu_s': 6.29, 'wait_s': 18.6}
    [Time] wall=36.5s | cpu=30.1s | gpu=6.3s
    C:\Users\fbrev\Documents\Acadêmico\Simulações\Python\NoisyGL\predictor\Base_Predictor.py:114: UserWarning: expandable_segments not supported on this platform (Triggered internally at ..\c10/cuda/CUDAAllocatorConfig.h:28.)
    self.edge_index = self._cpu_edge_index.to(self.device)
    C:\Users\fbrev\Documents\Acadêmico\Simulações\Python\NoisyGL\predictor\Base_Predictor.py:144: UserWarning: Sparse CSR tensor support is in beta state. If you miss a functionality in the sparse tensor support, please submit a feature request to https://github.com/pytorch/pytorch/issues. (Triggered internally at ..\aten\src\ATen\SparseCsrTensorImpl.cpp:55.)
    self.adj_csr = self.adj.to_sparse_csr().to(self.device)
[I 2026-05-04 12:41:09,137] Trial 44 finished with value: 0.7585002015858083 and parameters: {'lr': 0.005, 'weight_decay': 0.0001, 'n_hidden': 256, 'n_layer': 3, 'dropout': 0.7987891702354355, 'knn_mode': 's', 'k': 47, 'dexp': 1.8116678392380097, 'p_grd': 0.5960815402116464, 'unc_rem': 0.6793738209421287, 'unc_rel': 0.031186314169099005}. Best is trial 22 with value: 0.7636070420642387.
    [CPU] Loading dblp...
    DEBUG 3.1: Dataset init start
    DEBUG 3.2: prepare_data start dblp
    ----Data statistics------'
    Name: dblp
    #Nodes 17716
    #Edges 52867
    #Classes 4
    #Ave_degree 5.97
    ----Split statistics------'
    #Train samples 177 (1.0 % of nodes)
    #Val samples 2657 (15.0 % of nodes)
    #Test samples 14882 (remaining)
    ----label noise information:------
    Instance dependent noise
    #Actual noise rate 0.20
    [cuda:0] LNPCC waiting for GPU slot...
    [cuda:0] Slot acquired (waited 12.7s). Starting GCN...
    FINAL_RESULT: {'acc': {'train': 0.2937853107344633, 'valid': 0.39405344373353407, 'test': 0.4482596425211665}, 'wall_s': 39.19, 'cpu_s': 35.35, 'gpu_s': 3.79, 'wait_s': 12.66}
    [Time] wall=39.2s | cpu=35.4s | gpu=3.8s
    C:\Users\fbrev\Documents\Acadêmico\Simulações\Python\NoisyGL\predictor\Base_Predictor.py:114: UserWarning: expandable_segments not supported on this platform (Triggered internally at ..\c10/cuda/CUDAAllocatorConfig.h:28.)
    self.edge_index = self._cpu_edge_index.to(self.device)
    C:\Users\fbrev\Documents\Acadêmico\Simulações\Python\NoisyGL\predictor\Base_Predictor.py:144: UserWarning: Sparse CSR tensor support is in beta state. If you miss a functionality in the sparse tensor support, please submit a feature request to https://github.com/pytorch/pytorch/issues. (Triggered internally at ..\aten\src\ATen\SparseCsrTensorImpl.cpp:55.)
    self.adj_csr = self.adj.to_sparse_csr().to(self.device)
[I 2026-05-04 12:42:06,277] Trial 45 finished with value: 0.4482596425211665 and parameters: {'lr': 0.01, 'weight_decay': 0.05, 'n_hidden': 128, 'n_layer': 3, 'dropout': 0.631581467086926, 'knn_mode': 's', 'k': 37, 'dexp': 3.053729617688621, 'p_grd': 0.7315518235893154, 'unc_rem': 0.5051919448840483, 'unc_rel': 0.6168289558139608}. Best is trial 22 with value: 0.7636070420642387.
    [CPU] Loading dblp...
    DEBUG 3.1: Dataset init start
    DEBUG 3.2: prepare_data start dblp
    ----Data statistics------'
    Name: dblp
    #Nodes 17716
    #Edges 52867
    #Classes 4
    #Ave_degree 5.97
    ----Split statistics------'
    #Train samples 177 (1.0 % of nodes)
    #Val samples 2657 (15.0 % of nodes)
    #Test samples 14882 (remaining)
    ----label noise information:------
    Instance dependent noise
    #Actual noise rate 0.20
    [cuda:0] LNPCC waiting for GPU slot...
    [cuda:0] Slot acquired (waited 18.5s). Starting GCN...
    FINAL_RESULT: {'acc': {'train': 0.9378531073446328, 'valid': 0.6108392924350772, 'test': 0.7376024727859158}, 'wall_s': 36.48, 'cpu_s': 32.36, 'gpu_s': 4.06, 'wait_s': 18.52}
    [Time] wall=36.5s | cpu=32.4s | gpu=4.1s
    C:\Users\fbrev\Documents\Acadêmico\Simulações\Python\NoisyGL\predictor\Base_Predictor.py:114: UserWarning: expandable_segments not supported on this platform (Triggered internally at ..\c10/cuda/CUDAAllocatorConfig.h:28.)
    self.edge_index = self._cpu_edge_index.to(self.device)
    C:\Users\fbrev\Documents\Acadêmico\Simulações\Python\NoisyGL\predictor\Base_Predictor.py:144: UserWarning: Sparse CSR tensor support is in beta state. If you miss a functionality in the sparse tensor support, please submit a feature request to https://github.com/pytorch/pytorch/issues. (Triggered internally at ..\aten\src\ATen\SparseCsrTensorImpl.cpp:55.)
    self.adj_csr = self.adj.to_sparse_csr().to(self.device)
[I 2026-05-04 12:43:06,622] Trial 46 finished with value: 0.7376024727859158 and parameters: {'lr': 0.1, 'weight_decay': 0.0001, 'n_hidden': 256, 'n_layer': 2, 'dropout': 0.5111886522449463, 'knn_mode': 's', 'k': 43, 'dexp': 5.03133724978838, 'p_grd': 0.4542053747264286, 'unc_rem': 0.5427775659134131, 'unc_rel': 0.8569464445986806}. Best is trial 22 with value: 0.7636070420642387.
    [CPU] Loading dblp...
    DEBUG 3.1: Dataset init start
    DEBUG 3.2: prepare_data start dblp
    ----Data statistics------'
    Name: dblp
    #Nodes 17716
    #Edges 52867
    #Classes 4
    #Ave_degree 5.97
    ----Split statistics------'
    #Train samples 177 (1.0 % of nodes)
    #Val samples 2657 (15.0 % of nodes)
    #Test samples 14882 (remaining)
    ----label noise information:------
    Instance dependent noise
    #Actual noise rate 0.20
    [cuda:0] LNPCC waiting for GPU slot...
    [cuda:0] Slot acquired (waited 17.4s). Starting GCN...
    FINAL_RESULT: {'acc': {'train': 0.8361581920903954, 'valid': 0.6191193074896499, 'test': 0.7507727455987099}, 'wall_s': 40.07, 'cpu_s': 33.86, 'gpu_s': 6.16, 'wait_s': 17.39}
    [Time] wall=40.1s | cpu=33.9s | gpu=6.2s
    C:\Users\fbrev\Documents\Acadêmico\Simulações\Python\NoisyGL\predictor\Base_Predictor.py:114: UserWarning: expandable_segments not supported on this platform (Triggered internally at ..\c10/cuda/CUDAAllocatorConfig.h:28.)
    self.edge_index = self._cpu_edge_index.to(self.device)
    C:\Users\fbrev\Documents\Acadêmico\Simulações\Python\NoisyGL\predictor\Base_Predictor.py:144: UserWarning: Sparse CSR tensor support is in beta state. If you miss a functionality in the sparse tensor support, please submit a feature request to https://github.com/pytorch/pytorch/issues. (Triggered internally at ..\aten\src\ATen\SparseCsrTensorImpl.cpp:55.)
    self.adj_csr = self.adj.to_sparse_csr().to(self.device)
[I 2026-05-04 12:44:09,288] Trial 47 finished with value: 0.7507727455987099 and parameters: {'lr': 0.005, 'weight_decay': 0.0, 'n_hidden': 256, 'n_layer': 3, 'dropout': 0.7123244324973129, 'knn_mode': 's', 'k': 30, 'dexp': 6.945337336690882, 'p_grd': 0.5404837401623006, 'unc_rem': 0.42689600513469284, 'unc_rel': 0.7483898125706537}. Best is trial 22 with value: 0.7636070420642387.
    [CPU] Loading dblp...
    DEBUG 3.1: Dataset init start
    DEBUG 3.2: prepare_data start dblp
    ----Data statistics------'
    Name: dblp
    #Nodes 17716
    #Edges 52867
    #Classes 4
    #Ave_degree 5.97
    ----Split statistics------'
    #Train samples 177 (1.0 % of nodes)
    #Val samples 2657 (15.0 % of nodes)
    #Test samples 14882 (remaining)
    ----label noise information:------
    Instance dependent noise
    #Actual noise rate 0.20
    [cuda:0] LNPCC waiting for GPU slot...
    [cuda:0] Slot acquired (waited 17.8s). Starting GCN...
    FINAL_RESULT: {'acc': {'train': 0.9069767441860465, 'valid': 0.5314264207753105, 'test': 0.6353984679478565}, 'wall_s': 36.11, 'cpu_s': 33.2, 'gpu_s': 2.87, 'wait_s': 17.76}
    [Time] wall=36.1s | cpu=33.2s | gpu=2.9s
    C:\Users\fbrev\Documents\Acadêmico\Simulações\Python\NoisyGL\predictor\Base_Predictor.py:114: UserWarning: expandable_segments not supported on this platform (Triggered internally at ..\c10/cuda/CUDAAllocatorConfig.h:28.)
    self.edge_index = self._cpu_edge_index.to(self.device)
    C:\Users\fbrev\Documents\Acadêmico\Simulações\Python\NoisyGL\predictor\Base_Predictor.py:144: UserWarning: Sparse CSR tensor support is in beta state. If you miss a functionality in the sparse tensor support, please submit a feature request to https://github.com/pytorch/pytorch/issues. (Triggered internally at ..\aten\src\ATen\SparseCsrTensorImpl.cpp:55.)
    self.adj_csr = self.adj.to_sparse_csr().to(self.device)
[I 2026-05-04 12:45:08,135] Trial 48 finished with value: 0.6353984679478565 and parameters: {'lr': 0.005, 'weight_decay': 0.01, 'n_hidden': 64, 'n_layer': 3, 'dropout': 0.46812918812542836, 'knn_mode': 'd', 'k': 48, 'dexp': 2.0380483487923913, 'p_grd': 0.05945268665072112, 'unc_rem': 0.7072485402178644, 'unc_rel': 0.9593117766638837}. Best is trial 22 with value: 0.7636070420642387.
    [CPU] Loading dblp...
    DEBUG 3.1: Dataset init start
    DEBUG 3.2: prepare_data start dblp
    ----Data statistics------'
    Name: dblp
    #Nodes 17716
    #Edges 52867
    #Classes 4
    #Ave_degree 5.97
    ----Split statistics------'
    #Train samples 177 (1.0 % of nodes)
    #Val samples 2657 (15.0 % of nodes)
    #Test samples 14882 (remaining)
    ----label noise information:------
    Instance dependent noise
    #Actual noise rate 0.20
    [cuda:0] LNPCC waiting for GPU slot...
    [cuda:0] Slot acquired (waited 20.5s). Starting GCN...
    FINAL_RESULT: {'acc': {'train': 0.8926553672316384, 'valid': 0.6014301844185171, 'test': 0.7320252654213143}, 'wall_s': 40.32, 'cpu_s': 36.35, 'gpu_s': 3.92, 'wait_s': 20.5}
    [Time] wall=40.3s | cpu=36.3s | gpu=3.9s
    C:\Users\fbrev\Documents\Acadêmico\Simulações\Python\NoisyGL\predictor\Base_Predictor.py:114: UserWarning: expandable_segments not supported on this platform (Triggered internally at ..\c10/cuda/CUDAAllocatorConfig.h:28.)
    self.edge_index = self._cpu_edge_index.to(self.device)
    C:\Users\fbrev\Documents\Acadêmico\Simulações\Python\NoisyGL\predictor\Base_Predictor.py:144: UserWarning: Sparse CSR tensor support is in beta state. If you miss a functionality in the sparse tensor support, please submit a feature request to https://github.com/pytorch/pytorch/issues. (Triggered internally at ..\aten\src\ATen\SparseCsrTensorImpl.cpp:55.)
    self.adj_csr = self.adj.to_sparse_csr().to(self.device)
