[worker] START lnpcc_dblp_0.4 gpu=0
[HPO] Starting Phase 1 (Optuna) for lnpcc_dblp_instance_0.4...
[I 2026-05-04 12:37:55,228] A new study created in RDB with name: lnpcc_dblp_instance_0.4
    [CPU] Loading dblp...
    DEBUG 3.1: Dataset init start
    DEBUG 3.2: prepare_data start dblp
    ----Data statistics------'
    Name: dblp
    #Nodes 17716
    #Edges 52867
    #Classes 4
    #Ave_degree 5.97
    ----Split statistics------'
    #Train samples 177 (1.0 % of nodes)
    #Val samples 2657 (15.0 % of nodes)
    #Test samples 14882 (remaining)
    ----label noise information:------
    Instance dependent noise
    #Actual noise rate 0.40
    [cuda:0] LNPCC waiting for GPU slot...
    [cuda:0] Slot acquired (waited 26.8s). Starting GCN...
    FINAL_RESULT: {'acc': {'train': 0.536723163841808, 'valid': 0.4617990214527663, 'test': 0.6829727187206021}, 'wall_s': 39.82, 'cpu_s': 33.62, 'gpu_s': 6.15, 'wait_s': 26.83}
    [Time] wall=39.8s | cpu=33.6s | gpu=6.2s
    C:\Users\fbrev\Documents\Acadêmico\Simulações\Python\NoisyGL\predictor\Base_Predictor.py:114: UserWarning: expandable_segments not supported on this platform (Triggered internally at ..\c10/cuda/CUDAAllocatorConfig.h:28.)
    self.edge_index = self._cpu_edge_index.to(self.device)
    C:\Users\fbrev\Documents\Acadêmico\Simulações\Python\NoisyGL\predictor\Base_Predictor.py:144: UserWarning: Sparse CSR tensor support is in beta state. If you miss a functionality in the sparse tensor support, please submit a feature request to https://github.com/pytorch/pytorch/issues. (Triggered internally at ..\aten\src\ATen\SparseCsrTensorImpl.cpp:55.)
    self.adj_csr = self.adj.to_sparse_csr().to(self.device)
[I 2026-05-04 12:39:06,905] Trial 0 finished with value: 0.6829727187206021 and parameters: {'lr': 0.01, 'weight_decay': 0.0001, 'n_hidden': 256, 'n_layer': 3, 'dropout': 0.7423310186926412, 'knn_mode': 's', 'k': 22, 'dexp': 6.549043457768621, 'p_grd': 0.660643336056814, 'unc_rem': 0.4738128842759197, 'unc_rel': 0.5330175031465186}. Best is trial 0 with value: 0.6829727187206021.
    [CPU] Loading dblp...
    DEBUG 3.1: Dataset init start
    DEBUG 3.2: prepare_data start dblp
    ----Data statistics------'
    Name: dblp
    #Nodes 17716
    #Edges 52867
    #Classes 4
    #Ave_degree 5.97
    ----Split statistics------'
    #Train samples 177 (1.0 % of nodes)
    #Val samples 2657 (15.0 % of nodes)
    #Test samples 14882 (remaining)
    ----label noise information:------
    Instance dependent noise
    #Actual noise rate 0.40
    [cuda:0] LNPCC waiting for GPU slot...
    [cuda:0] Slot acquired (waited 16.6s). Starting GCN...
    FINAL_RESULT: {'acc': {'train': 0.5310734463276836, 'valid': 0.45841174256680467, 'test': 0.689423464588093}, 'wall_s': 33.95, 'cpu_s': 31.54, 'gpu_s': 2.36, 'wait_s': 16.63}
    [Time] wall=34.0s | cpu=31.5s | gpu=2.4s
    C:\Users\fbrev\Documents\Acadêmico\Simulações\Python\NoisyGL\predictor\Base_Predictor.py:114: UserWarning: expandable_segments not supported on this platform (Triggered internally at ..\c10/cuda/CUDAAllocatorConfig.h:28.)
    self.edge_index = self._cpu_edge_index.to(self.device)
    C:\Users\fbrev\Documents\Acadêmico\Simulações\Python\NoisyGL\predictor\Base_Predictor.py:144: UserWarning: Sparse CSR tensor support is in beta state. If you miss a functionality in the sparse tensor support, please submit a feature request to https://github.com/pytorch/pytorch/issues. (Triggered internally at ..\aten\src\ATen\SparseCsrTensorImpl.cpp:55.)
    self.adj_csr = self.adj.to_sparse_csr().to(self.device)
[I 2026-05-04 12:40:02,803] Trial 1 finished with value: 0.689423464588093 and parameters: {'lr': 0.005, 'weight_decay': 0.05, 'n_hidden': 32, 'n_layer': 3, 'dropout': 0.07015571555985166, 'knn_mode': 'd', 'k': 8, 'dexp': 9.849369470845739, 'p_grd': 0.478806786720841, 'unc_rem': 0.3038151952343754, 'unc_rel': 0.3631246362119436}. Best is trial 1 with value: 0.689423464588093.
    [CPU] Loading dblp...
    DEBUG 3.1: Dataset init start
    DEBUG 3.2: prepare_data start dblp
    ----Data statistics------'
    Name: dblp
    #Nodes 17716
    #Edges 52867
    #Classes 4
    #Ave_degree 5.97
    ----Split statistics------'
    #Train samples 177 (1.0 % of nodes)
    #Val samples 2657 (15.0 % of nodes)
    #Test samples 14882 (remaining)
    ----label noise information:------
    Instance dependent noise
    #Actual noise rate 0.40
    [cuda:0] LNPCC waiting for GPU slot...
    [cuda:0] Slot acquired (waited 51.1s). Starting GCN...
    FINAL_RESULT: {'acc': {'train': 0.7344632768361582, 'valid': 0.4531426420775311, 'test': 0.6698024459078081}, 'wall_s': 311.03, 'cpu_s': 307.09, 'gpu_s': 3.88, 'wait_s': 51.11}
    [Time] wall=311.0s | cpu=307.1s | gpu=3.9s
    C:\Users\fbrev\Documents\Acadêmico\Simulações\Python\NoisyGL\predictor\Base_Predictor.py:114: UserWarning: expandable_segments not supported on this platform (Triggered internally at ..\c10/cuda/CUDAAllocatorConfig.h:28.)
    self.edge_index = self._cpu_edge_index.to(self.device)
    C:\Users\fbrev\Documents\Acadêmico\Simulações\Python\NoisyGL\predictor\Base_Predictor.py:144: UserWarning: Sparse CSR tensor support is in beta state. If you miss a functionality in the sparse tensor support, please submit a feature request to https://github.com/pytorch/pytorch/issues. (Triggered internally at ..\aten\src\ATen\SparseCsrTensorImpl.cpp:55.)
    self.adj_csr = self.adj.to_sparse_csr().to(self.device)
[I 2026-05-04 12:46:10,098] Trial 2 finished with value: 0.6698024459078081 and parameters: {'lr': 0.05, 'weight_decay': 0.0, 'n_hidden': 128, 'n_layer': 3, 'dropout': 0.21625436690386757, 'knn_mode': 'd', 'k': 38, 'dexp': 3.874471529407347, 'p_grd': 0.9881400181698377, 'unc_rem': 0.9181621485275245, 'unc_rel': 0.9675166579372851}. Best is trial 1 with value: 0.689423464588093.
    [CPU] Loading dblp...
    DEBUG 3.1: Dataset init start
    DEBUG 3.2: prepare_data start dblp
    ----Data statistics------'
    Name: dblp
    #Nodes 17716
    #Edges 52867
    #Classes 4
    #Ave_degree 5.97
    ----Split statistics------'
    #Train samples 177 (1.0 % of nodes)
    #Val samples 2657 (15.0 % of nodes)
    #Test samples 14882 (remaining)
    ----label noise information:------
    Instance dependent noise
    #Actual noise rate 0.40
    [cuda:0] LNPCC waiting for GPU slot...
    [cuda:0] Slot acquired (waited 30.2s). Starting GCN...
    FINAL_RESULT: {'acc': {'train': 0.5212121212121212, 'valid': 0.45502446368084304, 'test': 0.6759844106974869}, 'wall_s': 34.84, 'cpu_s': 28.72, 'gpu_s': 6.05, 'wait_s': 30.16}
    [Time] wall=34.8s | cpu=28.7s | gpu=6.1s
    C:\Users\fbrev\Documents\Acadêmico\Simulações\Python\NoisyGL\predictor\Base_Predictor.py:114: UserWarning: expandable_segments not supported on this platform (Triggered internally at ..\c10/cuda/CUDAAllocatorConfig.h:28.)
    self.edge_index = self._cpu_edge_index.to(self.device)
    C:\Users\fbrev\Documents\Acadêmico\Simulações\Python\NoisyGL\predictor\Base_Predictor.py:144: UserWarning: Sparse CSR tensor support is in beta state. If you miss a functionality in the sparse tensor support, please submit a feature request to https://github.com/pytorch/pytorch/issues. (Triggered internally at ..\aten\src\ATen\SparseCsrTensorImpl.cpp:55.)
    self.adj_csr = self.adj.to_sparse_csr().to(self.device)
[I 2026-05-04 12:47:20,140] Trial 3 finished with value: 0.6759844106974869 and parameters: {'lr': 0.01, 'weight_decay': 0.0, 'n_hidden': 256, 'n_layer': 3, 'dropout': 0.7679730381544515, 'knn_mode': 's', 'k': 24, 'dexp': 8.3269203648727, 'p_grd': 0.2184998850946086, 'unc_rem': 0.1269280697305547, 'unc_rel': 0.24879210037068566}. Best is trial 1 with value: 0.689423464588093.
    [CPU] Loading dblp...
    DEBUG 3.1: Dataset init start
    DEBUG 3.2: prepare_data start dblp
    ----Data statistics------'
    Name: dblp
    #Nodes 17716
    #Edges 52867
    #Classes 4
    #Ave_degree 5.97
    ----Split statistics------'
    #Train samples 177 (1.0 % of nodes)
    #Val samples 2657 (15.0 % of nodes)
    #Test samples 14882 (remaining)
    ----label noise information:------
    Instance dependent noise
    #Actual noise rate 0.40
    [cuda:0] LNPCC waiting for GPU slot...
    [cuda:0] Slot acquired (waited 18.3s). Starting GCN...
    FINAL_RESULT: {'acc': {'train': 0.8013245033112583, 'valid': 0.4670681219420399, 'test': 0.6902298078215293}, 'wall_s': 33.12, 'cpu_s': 30.98, 'gpu_s': 2.09, 'wait_s': 18.34}
    [Time] wall=33.1s | cpu=31.0s | gpu=2.1s
    C:\Users\fbrev\Documents\Acadêmico\Simulações\Python\NoisyGL\predictor\Base_Predictor.py:114: UserWarning: expandable_segments not supported on this platform (Triggered internally at ..\c10/cuda/CUDAAllocatorConfig.h:28.)
    self.edge_index = self._cpu_edge_index.to(self.device)
    C:\Users\fbrev\Documents\Acadêmico\Simulações\Python\NoisyGL\predictor\Base_Predictor.py:144: UserWarning: Sparse CSR tensor support is in beta state. If you miss a functionality in the sparse tensor support, please submit a feature request to https://github.com/pytorch/pytorch/issues. (Triggered internally at ..\aten\src\ATen\SparseCsrTensorImpl.cpp:55.)
    self.adj_csr = self.adj.to_sparse_csr().to(self.device)
[I 2026-05-04 12:48:16,656] Trial 4 finished with value: 0.6902298078215293 and parameters: {'lr': 0.001, 'weight_decay': 0.01, 'n_hidden': 32, 'n_layer': 3, 'dropout': 0.7038458031184676, 'knn_mode': 's', 'k': 9, 'dexp': 2.686398662779987, 'p_grd': 0.260480876024059, 'unc_rem': 0.11716653894410789, 'unc_rel': 0.0855185384292958}. Best is trial 4 with value: 0.6902298078215293.
    [CPU] Loading dblp...
    DEBUG 3.1: Dataset init start
    DEBUG 3.2: prepare_data start dblp
    ----Data statistics------'
    Name: dblp
    #Nodes 17716
    #Edges 52867
    #Classes 4
    #Ave_degree 5.97
    ----Split statistics------'
    #Train samples 177 (1.0 % of nodes)
    #Val samples 2657 (15.0 % of nodes)
    #Test samples 14882 (remaining)
    ----label noise information:------
    Instance dependent noise
    #Actual noise rate 0.40
    [cuda:0] LNPCC waiting for GPU slot...
    [cuda:0] Slot acquired (waited 21.9s). Starting GCN...
    FINAL_RESULT: {'acc': {'train': 0.5649717514124294, 'valid': 0.46405720737674067, 'test': 0.6846526004569279}, 'wall_s': 42.46, 'cpu_s': 35.93, 'gpu_s': 6.45, 'wait_s': 21.91}
    [Time] wall=42.5s | cpu=35.9s | gpu=6.4s
    C:\Users\fbrev\Documents\Acadêmico\Simulações\Python\NoisyGL\predictor\Base_Predictor.py:114: UserWarning: expandable_segments not supported on this platform (Triggered internally at ..\c10/cuda/CUDAAllocatorConfig.h:28.)
    self.edge_index = self._cpu_edge_index.to(self.device)
    C:\Users\fbrev\Documents\Acadêmico\Simulações\Python\NoisyGL\predictor\Base_Predictor.py:144: UserWarning: Sparse CSR tensor support is in beta state. If you miss a functionality in the sparse tensor support, please submit a feature request to https://github.com/pytorch/pytorch/issues. (Triggered internally at ..\aten\src\ATen\SparseCsrTensorImpl.cpp:55.)
    self.adj_csr = self.adj.to_sparse_csr().to(self.device)
[I 2026-05-04 12:49:26,065] Trial 5 finished with value: 0.6846526004569279 and parameters: {'lr': 0.005, 'weight_decay': 0.001, 'n_hidden': 256, 'n_layer': 3, 'dropout': 0.5081407678113709, 'knn_mode': 's', 'k': 6, 'dexp': 8.201233283460219, 'p_grd': 0.7144216630336351, 'unc_rem': 0.6840438102211569, 'unc_rel': 0.7616068797550649}. Best is trial 4 with value: 0.6902298078215293.
    [CPU] Loading dblp...
    DEBUG 3.1: Dataset init start
    DEBUG 3.2: prepare_data start dblp
    ----Data statistics------'
    Name: dblp
    #Nodes 17716
    #Edges 52867
    #Classes 4
    #Ave_degree 5.97
    ----Split statistics------'
    #Train samples 177 (1.0 % of nodes)
    #Val samples 2657 (15.0 % of nodes)
    #Test samples 14882 (remaining)
    ----label noise information:------
    Instance dependent noise
    #Actual noise rate 0.40
    [cuda:0] LNPCC waiting for GPU slot...
    [cuda:0] Slot acquired (waited 24.7s). Starting GCN...
    FINAL_RESULT: {'acc': {'train': 0.41509433962264153, 'valid': 0.34851336093338353, 'test': 0.45605429377771806}, 'wall_s': 31.28, 'cpu_s': 27.43, 'gpu_s': 3.8, 'wait_s': 24.73}
    [Time] wall=31.3s | cpu=27.4s | gpu=3.8s
    C:\Users\fbrev\Documents\Acadêmico\Simulações\Python\NoisyGL\predictor\Base_Predictor.py:114: UserWarning: expandable_segments not supported on this platform (Triggered internally at ..\c10/cuda/CUDAAllocatorConfig.h:28.)
    self.edge_index = self._cpu_edge_index.to(self.device)
    C:\Users\fbrev\Documents\Acadêmico\Simulações\Python\NoisyGL\predictor\Base_Predictor.py:144: UserWarning: Sparse CSR tensor support is in beta state. If you miss a functionality in the sparse tensor support, please submit a feature request to https://github.com/pytorch/pytorch/issues. (Triggered internally at ..\aten\src\ATen\SparseCsrTensorImpl.cpp:55.)
    self.adj_csr = self.adj.to_sparse_csr().to(self.device)
[I 2026-05-04 12:50:27,286] Trial 6 finished with value: 0.45605429377771806 and parameters: {'lr': 0.05, 'weight_decay': 0.001, 'n_hidden': 128, 'n_layer': 3, 'dropout': 0.7020473327625294, 'knn_mode': 'd', 'k': 15, 'dexp': 0.5878486504011348, 'p_grd': 0.011335731587640785, 'unc_rem': 0.5858998350477302, 'unc_rel': 0.7226749298158259}. Best is trial 4 with value: 0.6902298078215293.
    [CPU] Loading dblp...
    DEBUG 3.1: Dataset init start
    DEBUG 3.2: prepare_data start dblp
    ----Data statistics------'
    Name: dblp
    #Nodes 17716
    #Edges 52867
    #Classes 4
    #Ave_degree 5.97
    ----Split statistics------'
    #Train samples 177 (1.0 % of nodes)
    #Val samples 2657 (15.0 % of nodes)
    #Test samples 14882 (remaining)
    ----label noise information:------
    Instance dependent noise
    #Actual noise rate 0.40
    [cuda:0] LNPCC waiting for GPU slot...
    [cuda:0] Slot acquired (waited 25.9s). Starting GCN...
    FINAL_RESULT: {'acc': {'train': 0.838150289017341, 'valid': 0.4617990214527663, 'test': 0.69379115710254}, 'wall_s': 30.64, 'cpu_s': 28.27, 'gpu_s': 2.32, 'wait_s': 25.91}
    [Time] wall=30.6s | cpu=28.3s | gpu=2.3s
    C:\Users\fbrev\Documents\Acadêmico\Simulações\Python\NoisyGL\predictor\Base_Predictor.py:114: UserWarning: expandable_segments not supported on this platform (Triggered internally at ..\c10/cuda/CUDAAllocatorConfig.h:28.)
    self.edge_index = self._cpu_edge_index.to(self.device)
    C:\Users\fbrev\Documents\Acadêmico\Simulações\Python\NoisyGL\predictor\Base_Predictor.py:144: UserWarning: Sparse CSR tensor support is in beta state. If you miss a functionality in the sparse tensor support, please submit a feature request to https://github.com/pytorch/pytorch/issues. (Triggered internally at ..\aten\src\ATen\SparseCsrTensorImpl.cpp:55.)
    self.adj_csr = self.adj.to_sparse_csr().to(self.device)
[I 2026-05-04 12:51:29,002] Trial 7 finished with value: 0.69379115710254 and parameters: {'lr': 0.005, 'weight_decay': 0.001, 'n_hidden': 64, 'n_layer': 2, 'dropout': 0.6564195734694973, 'knn_mode': 's', 'k': 7, 'dexp': 7.467726416853233, 'p_grd': 0.32445350005580476, 'unc_rem': 0.16404940716158267, 'unc_rel': 0.28013196087250636}. Best is trial 7 with value: 0.69379115710254.
    [CPU] Loading dblp...
    DEBUG 3.1: Dataset init start
    DEBUG 3.2: prepare_data start dblp
    ----Data statistics------'
    Name: dblp
    #Nodes 17716
    #Edges 52867
    #Classes 4
    #Ave_degree 5.97
    ----Split statistics------'
    #Train samples 177 (1.0 % of nodes)
    #Val samples 2657 (15.0 % of nodes)
    #Test samples 14882 (remaining)
    ----label noise information:------
    Instance dependent noise
    #Actual noise rate 0.40
    [cuda:0] LNPCC waiting for GPU slot...
    [cuda:0] Slot acquired (waited 50.9s). Starting GCN...
    FINAL_RESULT: {'acc': {'train': 0.7796610169491526, 'valid': 0.45803537824614227, 'test': 0.6749092863862384}, 'wall_s': 137.1, 'cpu_s': 132.48, 'gpu_s': 4.56, 'wait_s': 50.94}
    [Time] wall=137.1s | cpu=132.5s | gpu=4.6s
    C:\Users\fbrev\Documents\Acadêmico\Simulações\Python\NoisyGL\predictor\Base_Predictor.py:114: UserWarning: expandable_segments not supported on this platform (Triggered internally at ..\c10/cuda/CUDAAllocatorConfig.h:28.)
    self.edge_index = self._cpu_edge_index.to(self.device)
    C:\Users\fbrev\Documents\Acadêmico\Simulações\Python\NoisyGL\predictor\Base_Predictor.py:144: UserWarning: Sparse CSR tensor support is in beta state. If you miss a functionality in the sparse tensor support, please submit a feature request to https://github.com/pytorch/pytorch/issues. (Triggered internally at ..\aten\src\ATen\SparseCsrTensorImpl.cpp:55.)
    self.adj_csr = self.adj.to_sparse_csr().to(self.device)
[I 2026-05-04 12:54:42,731] Trial 8 finished with value: 0.6749092863862384 and parameters: {'lr': 0.01, 'weight_decay': 0.001, 'n_hidden': 256, 'n_layer': 2, 'dropout': 0.3294390530051932, 'knn_mode': 'd', 'k': 49, 'dexp': 9.06038712732777, 'p_grd': 0.8773552621619033, 'unc_rem': 0.897822936218505, 'unc_rel': 0.3722181582772752}. Best is trial 7 with value: 0.69379115710254.
    [CPU] Loading dblp...
    DEBUG 3.1: Dataset init start
    DEBUG 3.2: prepare_data start dblp
    ----Data statistics------'
    Name: dblp
    #Nodes 17716
    #Edges 52867
    #Classes 4
    #Ave_degree 5.97
    ----Split statistics------'
    #Train samples 177 (1.0 % of nodes)
    #Val samples 2657 (15.0 % of nodes)
    #Test samples 14882 (remaining)
    ----label noise information:------
    Instance dependent noise
    #Actual noise rate 0.40
    [cuda:0] LNPCC waiting for GPU slot...
    [cuda:0] Slot acquired (waited 20.1s). Starting GCN...
    FINAL_RESULT: {'acc': {'train': 0.23728813559322035, 'valid': 0.34851336093338353, 'test': 0.45625587958607716}, 'wall_s': 41.37, 'cpu_s': 37.16, 'gpu_s': 4.12, 'wait_s': 20.15}
    [Time] wall=41.4s | cpu=37.2s | gpu=4.1s
    C:\Users\fbrev\Documents\Acadêmico\Simulações\Python\NoisyGL\predictor\Base_Predictor.py:114: UserWarning: expandable_segments not supported on this platform (Triggered internally at ..\c10/cuda/CUDAAllocatorConfig.h:28.)
    self.edge_index = self._cpu_edge_index.to(self.device)
    C:\Users\fbrev\Documents\Acadêmico\Simulações\Python\NoisyGL\predictor\Base_Predictor.py:144: UserWarning: Sparse CSR tensor support is in beta state. If you miss a functionality in the sparse tensor support, please submit a feature request to https://github.com/pytorch/pytorch/issues. (Triggered internally at ..\aten\src\ATen\SparseCsrTensorImpl.cpp:55.)
    self.adj_csr = self.adj.to_sparse_csr().to(self.device)
[I 2026-05-04 12:55:50,329] Trial 9 finished with value: 0.45625587958607716 and parameters: {'lr': 0.005, 'weight_decay': 0.05, 'n_hidden': 128, 'n_layer': 3, 'dropout': 0.773886541698701, 'knn_mode': 's', 'k': 18, 'dexp': 8.269728185343707, 'p_grd': 0.2593333173174225, 'unc_rem': 0.40038097716656995, 'unc_rel': 0.6395700032731858}. Best is trial 7 with value: 0.69379115710254.
    [CPU] Loading dblp...
    DEBUG 3.1: Dataset init start
    DEBUG 3.2: prepare_data start dblp
    ----Data statistics------'
    Name: dblp
    #Nodes 17716
    #Edges 52867
    #Classes 4
    #Ave_degree 5.97
    ----Split statistics------'
    #Train samples 177 (1.0 % of nodes)
    #Val samples 2657 (15.0 % of nodes)
    #Test samples 14882 (remaining)
    ----label noise information:------
    Instance dependent noise
    #Actual noise rate 0.40
    [cuda:0] LNPCC waiting for GPU slot...
    [cuda:0] Slot acquired (waited 27.9s). Starting GCN...
    FINAL_RESULT: {'acc': {'train': 0.7588235294117647, 'valid': 0.4674444862627023, 'test': 0.7013842225507324}, 'wall_s': 37.82, 'cpu_s': 34.67, 'gpu_s': 3.1, 'wait_s': 27.88}
    [Time] wall=37.8s | cpu=34.7s | gpu=3.1s
    C:\Users\fbrev\Documents\Acadêmico\Simulações\Python\NoisyGL\predictor\Base_Predictor.py:114: UserWarning: expandable_segments not supported on this platform (Triggered internally at ..\c10/cuda/CUDAAllocatorConfig.h:28.)
    self.edge_index = self._cpu_edge_index.to(self.device)
    C:\Users\fbrev\Documents\Acadêmico\Simulações\Python\NoisyGL\predictor\Base_Predictor.py:144: UserWarning: Sparse CSR tensor support is in beta state. If you miss a functionality in the sparse tensor support, please submit a feature request to https://github.com/pytorch/pytorch/issues. (Triggered internally at ..\aten\src\ATen\SparseCsrTensorImpl.cpp:55.)
    self.adj_csr = self.adj.to_sparse_csr().to(self.device)
