[I 2026-05-01 22:12:51,197] Trial 22 finished with value: 0.848 and parameters: {'lr': 0.005, 'weight_decay': 0.01, 'n_hidden': 64, 'n_layer': 2, 'dropout': 0.6180621222378676, 'knn_mode': 's', 'k': 11, 'dexp': 1.4288420627827092, 'p_grd': 0.09840185339130603, 'unc_rem': 0.16882764084688834, 'unc_rel': 0.021508964979356796}. Best is trial 4 with value: 0.87.
    [CPU] Loading amazonpho...
    DEBUG 3.1: Dataset init start
    DEBUG 3.2: prepare_data start amazonpho
    ----Data statistics------'
    Name: amazonpho
    #Nodes 7650
    #Edges 119081
    #Classes 8
    #Ave_degree 31.13
    ----Split statistics------'
    #Train samples 160 (20 nodes per class)
    #Val samples 500 (specified)
    #Test samples 1000 (specified)
    ----label noise information:------
    Instance dependent noise
    #Actual noise rate 0.40
    [cuda:0] LNPCC waiting for GPU slot...
    [cuda:0] Slot acquired (waited 128.6s). Starting GCN...
    FINAL_RESULT: {'acc': {'train': 0.664, 'valid': 0.514, 'test': 0.814}, 'wall_s': 17.33, 'cpu_s': 14.56, 'gpu_s': 2.73, 'wait_s': 128.6}
    [Time] wall=17.3s | cpu=14.6s | gpu=2.7s
    C:\Users\fbrev\Documents\Acadêmico\Simulações\Python\NoisyGL\predictor\Base_Predictor.py:114: UserWarning: expandable_segments not supported on this platform (Triggered internally at ..\c10/cuda/CUDAAllocatorConfig.h:28.)
    self.edge_index = self._cpu_edge_index.to(self.device)
    C:\Users\fbrev\Documents\Acadêmico\Simulações\Python\NoisyGL\predictor\Base_Predictor.py:144: UserWarning: Sparse CSR tensor support is in beta state. If you miss a functionality in the sparse tensor support, please submit a feature request to https://github.com/pytorch/pytorch/issues. (Triggered internally at ..\aten\src\ATen\SparseCsrTensorImpl.cpp:55.)
    self.adj_csr = self.adj.to_sparse_csr().to(self.device)
[I 2026-05-01 22:15:22,988] Trial 23 finished with value: 0.814 and parameters: {'lr': 0.005, 'weight_decay': 0.001, 'n_hidden': 64, 'n_layer': 2, 'dropout': 0.6144722227953028, 'knn_mode': 's', 'k': 17, 'dexp': 2.0947669222461034, 'p_grd': 0.5929264894348475, 'unc_rem': 0.010506786994281259, 'unc_rel': 0.1199923985601958}. Best is trial 4 with value: 0.87.
    [CPU] Loading amazonpho...
    DEBUG 3.1: Dataset init start
    DEBUG 3.2: prepare_data start amazonpho
    ----Data statistics------'
    Name: amazonpho
    #Nodes 7650
    #Edges 119081
    #Classes 8
    #Ave_degree 31.13
    ----Split statistics------'
    #Train samples 160 (20 nodes per class)
    #Val samples 500 (specified)
    #Test samples 1000 (specified)
    ----label noise information:------
    Instance dependent noise
    #Actual noise rate 0.40
    [cuda:0] LNPCC waiting for GPU slot...
    [cuda:0] Slot acquired (waited 291.0s). Starting GCN...
    FINAL_RESULT: {'acc': {'train': 0.8817204301075269, 'valid': 0.496, 'test': 0.71}, 'wall_s': 14.35, 'cpu_s': 11.81, 'gpu_s': 2.5, 'wait_s': 290.96}
    [Time] wall=14.4s | cpu=11.8s | gpu=2.5s
    C:\Users\fbrev\Documents\Acadêmico\Simulações\Python\NoisyGL\predictor\Base_Predictor.py:114: UserWarning: expandable_segments not supported on this platform (Triggered internally at ..\c10/cuda/CUDAAllocatorConfig.h:28.)
    self.edge_index = self._cpu_edge_index.to(self.device)
    C:\Users\fbrev\Documents\Acadêmico\Simulações\Python\NoisyGL\predictor\Base_Predictor.py:144: UserWarning: Sparse CSR tensor support is in beta state. If you miss a functionality in the sparse tensor support, please submit a feature request to https://github.com/pytorch/pytorch/issues. (Triggered internally at ..\aten\src\ATen\SparseCsrTensorImpl.cpp:55.)
    self.adj_csr = self.adj.to_sparse_csr().to(self.device)
[I 2026-05-01 22:20:34,312] Trial 24 finished with value: 0.71 and parameters: {'lr': 0.005, 'weight_decay': 0.001, 'n_hidden': 64, 'n_layer': 2, 'dropout': 0.6750574809219558, 'knn_mode': 's', 'k': 31, 'dexp': 0.22990802967503177, 'p_grd': 0.13347312917747195, 'unc_rem': 0.20788661002919095, 'unc_rel': 0.003125587861461287}. Best is trial 4 with value: 0.87.
    [CPU] Loading amazonpho...
    DEBUG 3.1: Dataset init start
    DEBUG 3.2: prepare_data start amazonpho
    ----Data statistics------'
    Name: amazonpho
    #Nodes 7650
    #Edges 119081
    #Classes 8
    #Ave_degree 31.13
    ----Split statistics------'
    #Train samples 160 (20 nodes per class)
    #Val samples 500 (specified)
    #Test samples 1000 (specified)
    ----label noise information:------
    Instance dependent noise
    #Actual noise rate 0.40
    [cuda:0] LNPCC waiting for GPU slot...
    [cuda:0] Slot acquired (waited 292.7s). Starting GCN...
    FINAL_RESULT: {'acc': {'train': 0.8702290076335878, 'valid': 0.532, 'test': 0.802}, 'wall_s': 15.54, 'cpu_s': 13.21, 'gpu_s': 2.28, 'wait_s': 292.73}
    [Time] wall=15.5s | cpu=13.2s | gpu=2.3s
    C:\Users\fbrev\Documents\Acadêmico\Simulações\Python\NoisyGL\predictor\Base_Predictor.py:114: UserWarning: expandable_segments not supported on this platform (Triggered internally at ..\c10/cuda/CUDAAllocatorConfig.h:28.)
    self.edge_index = self._cpu_edge_index.to(self.device)
    C:\Users\fbrev\Documents\Acadêmico\Simulações\Python\NoisyGL\predictor\Base_Predictor.py:144: UserWarning: Sparse CSR tensor support is in beta state. If you miss a functionality in the sparse tensor support, please submit a feature request to https://github.com/pytorch/pytorch/issues. (Triggered internally at ..\aten\src\ATen\SparseCsrTensorImpl.cpp:55.)
    self.adj_csr = self.adj.to_sparse_csr().to(self.device)
[I 2026-05-01 22:25:48,569] Trial 25 finished with value: 0.802 and parameters: {'lr': 0.001, 'weight_decay': 0.01, 'n_hidden': 32, 'n_layer': 2, 'dropout': 0.5550503036172463, 'knn_mode': 's', 'k': 5, 'dexp': 1.4254593283947794, 'p_grd': 0.31646052136286185, 'unc_rem': 0.07050446155280152, 'unc_rel': 0.1498000248828415}. Best is trial 4 with value: 0.87.
    [CPU] Loading amazonpho...
    DEBUG 3.1: Dataset init start
    DEBUG 3.2: prepare_data start amazonpho
    ----Data statistics------'
    Name: amazonpho
    #Nodes 7650
    #Edges 119081
    #Classes 8
    #Ave_degree 31.13
    ----Split statistics------'
    #Train samples 160 (20 nodes per class)
    #Val samples 500 (specified)
    #Test samples 1000 (specified)
    ----label noise information:------
    Instance dependent noise
    #Actual noise rate 0.40
    [cuda:0] LNPCC waiting for GPU slot...
    [cuda:0] Slot acquired (waited 132.9s). Starting GCN...
    FINAL_RESULT: {'acc': {'train': 0.6447368421052632, 'valid': 0.514, 'test': 0.806}, 'wall_s': 15.93, 'cpu_s': 13.15, 'gpu_s': 2.73, 'wait_s': 132.93}
    [Time] wall=15.9s | cpu=13.2s | gpu=2.7s
    C:\Users\fbrev\Documents\Acadêmico\Simulações\Python\NoisyGL\predictor\Base_Predictor.py:114: UserWarning: expandable_segments not supported on this platform (Triggered internally at ..\c10/cuda/CUDAAllocatorConfig.h:28.)
    self.edge_index = self._cpu_edge_index.to(self.device)
    C:\Users\fbrev\Documents\Acadêmico\Simulações\Python\NoisyGL\predictor\Base_Predictor.py:144: UserWarning: Sparse CSR tensor support is in beta state. If you miss a functionality in the sparse tensor support, please submit a feature request to https://github.com/pytorch/pytorch/issues. (Triggered internally at ..\aten\src\ATen\SparseCsrTensorImpl.cpp:55.)
    self.adj_csr = self.adj.to_sparse_csr().to(self.device)
[I 2026-05-01 22:28:23,510] Trial 26 finished with value: 0.806 and parameters: {'lr': 0.005, 'weight_decay': 0.001, 'n_hidden': 64, 'n_layer': 2, 'dropout': 0.43379543986823715, 'knn_mode': 's', 'k': 10, 'dexp': 4.922047830436639, 'p_grd': 0.34222531272682194, 'unc_rem': 0.4079894883833203, 'unc_rel': 0.08684407629609385}. Best is trial 4 with value: 0.87.
    [CPU] Loading amazonpho...
    DEBUG 3.1: Dataset init start
    DEBUG 3.2: prepare_data start amazonpho
    ----Data statistics------'
    Name: amazonpho
    #Nodes 7650
    #Edges 119081
    #Classes 8
    #Ave_degree 31.13
    ----Split statistics------'
    #Train samples 160 (20 nodes per class)
    #Val samples 500 (specified)
    #Test samples 1000 (specified)
    ----label noise information:------
    Instance dependent noise
    #Actual noise rate 0.40
    [cuda:0] LNPCC waiting for GPU slot...
    [cuda:0] Slot acquired (waited 1062.2s). Starting GCN...
    FINAL_RESULT: {'acc': {'train': 0.22875816993464052, 'valid': 0.33, 'test': 0.434}, 'wall_s': 16.08, 'cpu_s': 13.55, 'gpu_s': 2.48, 'wait_s': 1062.24}
    [Time] wall=16.1s | cpu=13.6s | gpu=2.5s
    C:\Users\fbrev\Documents\Acadêmico\Simulações\Python\NoisyGL\predictor\Base_Predictor.py:114: UserWarning: expandable_segments not supported on this platform (Triggered internally at ..\c10/cuda/CUDAAllocatorConfig.h:28.)
    self.edge_index = self._cpu_edge_index.to(self.device)
    C:\Users\fbrev\Documents\Acadêmico\Simulações\Python\NoisyGL\predictor\Base_Predictor.py:144: UserWarning: Sparse CSR tensor support is in beta state. If you miss a functionality in the sparse tensor support, please submit a feature request to https://github.com/pytorch/pytorch/issues. (Triggered internally at ..\aten\src\ATen\SparseCsrTensorImpl.cpp:55.)
    self.adj_csr = self.adj.to_sparse_csr().to(self.device)
[I 2026-05-01 22:46:28,201] Trial 27 finished with value: 0.434 and parameters: {'lr': 0.1, 'weight_decay': 0.01, 'n_hidden': 32, 'n_layer': 2, 'dropout': 0.5925093059187847, 'knn_mode': 's', 'k': 14, 'dexp': 2.727545859002131, 'p_grd': 0.5479458530781703, 'unc_rem': 0.2190945188871533, 'unc_rel': 0.16868352834219769}. Best is trial 4 with value: 0.87.
    [CPU] Loading amazonpho...
    DEBUG 3.1: Dataset init start
    DEBUG 3.2: prepare_data start amazonpho
    ----Data statistics------'
    Name: amazonpho
    #Nodes 7650
    #Edges 119081
    #Classes 8
    #Ave_degree 31.13
    ----Split statistics------'
    #Train samples 160 (20 nodes per class)
    #Val samples 500 (specified)
    #Test samples 1000 (specified)
    ----label noise information:------
    Instance dependent noise
    #Actual noise rate 0.40
    [cuda:0] LNPCC waiting for GPU slot...
    [cuda:0] Slot acquired (waited 135.5s). Starting GCN...
    FINAL_RESULT: {'acc': {'train': 0.5641025641025641, 'valid': 0.52, 'test': 0.826}, 'wall_s': 17.02, 'cpu_s': 14.13, 'gpu_s': 2.83, 'wait_s': 135.53}
    [Time] wall=17.0s | cpu=14.1s | gpu=2.8s
    C:\Users\fbrev\Documents\Acadêmico\Simulações\Python\NoisyGL\predictor\Base_Predictor.py:114: UserWarning: expandable_segments not supported on this platform (Triggered internally at ..\c10/cuda/CUDAAllocatorConfig.h:28.)
    self.edge_index = self._cpu_edge_index.to(self.device)
    C:\Users\fbrev\Documents\Acadêmico\Simulações\Python\NoisyGL\predictor\Base_Predictor.py:144: UserWarning: Sparse CSR tensor support is in beta state. If you miss a functionality in the sparse tensor support, please submit a feature request to https://github.com/pytorch/pytorch/issues. (Triggered internally at ..\aten\src\ATen\SparseCsrTensorImpl.cpp:55.)
    self.adj_csr = self.adj.to_sparse_csr().to(self.device)
[I 2026-05-01 22:49:07,702] Trial 28 finished with value: 0.826 and parameters: {'lr': 0.001, 'weight_decay': 0.001, 'n_hidden': 64, 'n_layer': 2, 'dropout': 0.6925284323906487, 'knn_mode': 's', 'k': 9, 'dexp': 6.251483931074446, 'p_grd': 0.41852802985370763, 'unc_rem': 0.08183214528312605, 'unc_rel': 0.06318537046782365}. Best is trial 4 with value: 0.87.
    [CPU] Loading amazonpho...
    DEBUG 3.1: Dataset init start
    DEBUG 3.2: prepare_data start amazonpho
    ----Data statistics------'
    Name: amazonpho
    #Nodes 7650
    #Edges 119081
    #Classes 8
    #Ave_degree 31.13
    ----Split statistics------'
    #Train samples 160 (20 nodes per class)
    #Val samples 500 (specified)
    #Test samples 1000 (specified)
    ----label noise information:------
    Instance dependent noise
    #Actual noise rate 0.40
    [cuda:0] LNPCC waiting for GPU slot...
    [cuda:0] Slot acquired (waited 145.2s). Starting GCN...
    FINAL_RESULT: {'acc': {'train': 0.535031847133758, 'valid': 0.52, 'test': 0.825}, 'wall_s': 18.1, 'cpu_s': 15.16, 'gpu_s': 2.88, 'wait_s': 145.25}
    [Time] wall=18.1s | cpu=15.2s | gpu=2.9s
    C:\Users\fbrev\Documents\Acadêmico\Simulações\Python\NoisyGL\predictor\Base_Predictor.py:114: UserWarning: expandable_segments not supported on this platform (Triggered internally at ..\c10/cuda/CUDAAllocatorConfig.h:28.)
    self.edge_index = self._cpu_edge_index.to(self.device)
    C:\Users\fbrev\Documents\Acadêmico\Simulações\Python\NoisyGL\predictor\Base_Predictor.py:144: UserWarning: Sparse CSR tensor support is in beta state. If you miss a functionality in the sparse tensor support, please submit a feature request to https://github.com/pytorch/pytorch/issues. (Triggered internally at ..\aten\src\ATen\SparseCsrTensorImpl.cpp:55.)
    self.adj_csr = self.adj.to_sparse_csr().to(self.device)
[I 2026-05-01 22:51:57,736] Trial 29 finished with value: 0.825 and parameters: {'lr': 0.005, 'weight_decay': 0.001, 'n_hidden': 64, 'n_layer': 2, 'dropout': 0.7210433786964978, 'knn_mode': 's', 'k': 18, 'dexp': 7.381925270784317, 'p_grd': 0.704542305093963, 'unc_rem': 0.3808475925615581, 'unc_rel': 0.49862799012014564}. Best is trial 4 with value: 0.87.
    [CPU] Loading amazonpho...
    DEBUG 3.1: Dataset init start
    DEBUG 3.2: prepare_data start amazonpho
    ----Data statistics------'
    Name: amazonpho
    #Nodes 7650
    #Edges 119081
    #Classes 8
    #Ave_degree 31.13
    ----Split statistics------'
    #Train samples 160 (20 nodes per class)
    #Val samples 500 (specified)
    #Test samples 1000 (specified)
    ----label noise information:------
    Instance dependent noise
    #Actual noise rate 0.40
    [cuda:0] LNPCC waiting for GPU slot...
    [cuda:0] Slot acquired (waited 622.1s). Starting GCN...
    FINAL_RESULT: {'acc': {'train': 0.9178082191780822, 'valid': 0.53, 'test': 0.827}, 'wall_s': 14.66, 'cpu_s': 12.27, 'gpu_s': 2.35, 'wait_s': 622.09}
    [Time] wall=14.7s | cpu=12.3s | gpu=2.3s
    C:\Users\fbrev\Documents\Acadêmico\Simulações\Python\NoisyGL\predictor\Base_Predictor.py:114: UserWarning: expandable_segments not supported on this platform (Triggered internally at ..\c10/cuda/CUDAAllocatorConfig.h:28.)
    self.edge_index = self._cpu_edge_index.to(self.device)
    C:\Users\fbrev\Documents\Acadêmico\Simulações\Python\NoisyGL\predictor\Base_Predictor.py:144: UserWarning: Sparse CSR tensor support is in beta state. If you miss a functionality in the sparse tensor support, please submit a feature request to https://github.com/pytorch/pytorch/issues. (Triggered internally at ..\aten\src\ATen\SparseCsrTensorImpl.cpp:55.)
    self.adj_csr = self.adj.to_sparse_csr().to(self.device)
[I 2026-05-01 23:02:40,442] Trial 30 finished with value: 0.827 and parameters: {'lr': 0.005, 'weight_decay': 0.01, 'n_hidden': 32, 'n_layer': 2, 'dropout': 0.5537719664887956, 'knn_mode': 's', 'k': 7, 'dexp': 1.1674198447833273, 'p_grd': 0.1394831902401092, 'unc_rem': 0.590785563365514, 'unc_rel': 0.44257556788024055}. Best is trial 4 with value: 0.87.
    [CPU] Loading amazonpho...
    DEBUG 3.1: Dataset init start
    DEBUG 3.2: prepare_data start amazonpho
    ----Data statistics------'
    Name: amazonpho
    #Nodes 7650
    #Edges 119081
    #Classes 8
    #Ave_degree 31.13
    ----Split statistics------'
    #Train samples 160 (20 nodes per class)
    #Val samples 500 (specified)
    #Test samples 1000 (specified)
    ----label noise information:------
    Instance dependent noise
    #Actual noise rate 0.40
    [cuda:0] LNPCC waiting for GPU slot...
    [cuda:0] Slot acquired (waited 138.7s). Starting GCN...
    FINAL_RESULT: {'acc': {'train': 0.9690721649484536, 'valid': 0.43, 'test': 0.623}, 'wall_s': 18.19, 'cpu_s': 15.63, 'gpu_s': 2.51, 'wait_s': 138.73}
    [Time] wall=18.2s | cpu=15.6s | gpu=2.5s
    C:\Users\fbrev\Documents\Acadêmico\Simulações\Python\NoisyGL\predictor\Base_Predictor.py:114: UserWarning: expandable_segments not supported on this platform (Triggered internally at ..\c10/cuda/CUDAAllocatorConfig.h:28.)
    self.edge_index = self._cpu_edge_index.to(self.device)
    C:\Users\fbrev\Documents\Acadêmico\Simulações\Python\NoisyGL\predictor\Base_Predictor.py:144: UserWarning: Sparse CSR tensor support is in beta state. If you miss a functionality in the sparse tensor support, please submit a feature request to https://github.com/pytorch/pytorch/issues. (Triggered internally at ..\aten\src\ATen\SparseCsrTensorImpl.cpp:55.)
    self.adj_csr = self.adj.to_sparse_csr().to(self.device)
[I 2026-05-01 23:05:29,234] Trial 31 finished with value: 0.623 and parameters: {'lr': 0.005, 'weight_decay': 0.01, 'n_hidden': 64, 'n_layer': 2, 'dropout': 0.6581645553861316, 'knn_mode': 's', 'k': 11, 'dexp': 1.7595938238422517, 'p_grd': 0.1010563133845485, 'unc_rem': 0.16894511801257414, 'unc_rel': 0.007926927962361344}. Best is trial 4 with value: 0.87.
    [CPU] Loading amazonpho...
    DEBUG 3.1: Dataset init start
    DEBUG 3.2: prepare_data start amazonpho
    ----Data statistics------'
    Name: amazonpho
    #Nodes 7650
    #Edges 119081
    #Classes 8
    #Ave_degree 31.13
    ----Split statistics------'
    #Train samples 160 (20 nodes per class)
    #Val samples 500 (specified)
    #Test samples 1000 (specified)
    ----label noise information:------
    Instance dependent noise
    #Actual noise rate 0.40
    [cuda:0] LNPCC waiting for GPU slot...
    [cuda:0] Slot acquired (waited 136.2s). Starting GCN...
    FINAL_RESULT: {'acc': {'train': 0.7521367521367521, 'valid': 0.522, 'test': 0.845}, 'wall_s': 15.43, 'cpu_s': 12.81, 'gpu_s': 2.57, 'wait_s': 136.22}
    [Time] wall=15.4s | cpu=12.8s | gpu=2.6s
    C:\Users\fbrev\Documents\Acadêmico\Simulações\Python\NoisyGL\predictor\Base_Predictor.py:114: UserWarning: expandable_segments not supported on this platform (Triggered internally at ..\c10/cuda/CUDAAllocatorConfig.h:28.)
    self.edge_index = self._cpu_edge_index.to(self.device)
    C:\Users\fbrev\Documents\Acadêmico\Simulações\Python\NoisyGL\predictor\Base_Predictor.py:144: UserWarning: Sparse CSR tensor support is in beta state. If you miss a functionality in the sparse tensor support, please submit a feature request to https://github.com/pytorch/pytorch/issues. (Triggered internally at ..\aten\src\ATen\SparseCsrTensorImpl.cpp:55.)
    self.adj_csr = self.adj.to_sparse_csr().to(self.device)
[I 2026-05-01 23:08:10,925] Trial 32 finished with value: 0.845 and parameters: {'lr': 0.005, 'weight_decay': 0.01, 'n_hidden': 64, 'n_layer': 2, 'dropout': 0.7355710383564973, 'knn_mode': 's', 'k': 12, 'dexp': 0.9155116992999338, 'p_grd': 0.28680514317844785, 'unc_rem': 0.23621131410680762, 'unc_rel': 0.03235023707947676}. Best is trial 4 with value: 0.87.
    [CPU] Loading amazonpho...
    DEBUG 3.1: Dataset init start
    DEBUG 3.2: prepare_data start amazonpho
    ----Data statistics------'
    Name: amazonpho
    #Nodes 7650
    #Edges 119081
    #Classes 8
    #Ave_degree 31.13
    ----Split statistics------'
    #Train samples 160 (20 nodes per class)
    #Val samples 500 (specified)
    #Test samples 1000 (specified)
    ----label noise information:------
    Instance dependent noise
    #Actual noise rate 0.40
    [cuda:0] LNPCC waiting for GPU slot...
    [cuda:0] Slot acquired (waited 287.6s). Starting GCN...
    FINAL_RESULT: {'acc': {'train': 0.6993006993006993, 'valid': 0.518, 'test': 0.845}, 'wall_s': 13.66, 'cpu_s': 10.95, 'gpu_s': 2.66, 'wait_s': 287.62}
    [Time] wall=13.7s | cpu=10.9s | gpu=2.7s
    C:\Users\fbrev\Documents\Acadêmico\Simulações\Python\NoisyGL\predictor\Base_Predictor.py:114: UserWarning: expandable_segments not supported on this platform (Triggered internally at ..\c10/cuda/CUDAAllocatorConfig.h:28.)
    self.edge_index = self._cpu_edge_index.to(self.device)
    C:\Users\fbrev\Documents\Acadêmico\Simulações\Python\NoisyGL\predictor\Base_Predictor.py:144: UserWarning: Sparse CSR tensor support is in beta state. If you miss a functionality in the sparse tensor support, please submit a feature request to https://github.com/pytorch/pytorch/issues. (Triggered internally at ..\aten\src\ATen\SparseCsrTensorImpl.cpp:55.)
    self.adj_csr = self.adj.to_sparse_csr().to(self.device)
