[I 2026-04-27 02:23:41,303] Trial 74 finished with value: 0.3961724929829038 and parameters: {'lr': 0.005, 'weight_decay': 0.001, 'n_hidden': 64, 'n_layer': 3, 'dropout': 0.2690091552029387, 'knn_mode': 's', 'k': 39, 'dexp': 9.982222554288859, 'p_grd': 0.3463347249304616, 'unc_rem': 0.8180793258437218, 'unc_rel': 0.7690979510968796}. Best is trial 44 with value: 0.3977034957897423.
    [CPU] Loading amazon-ratings...
    DEBUG 3.1: Dataset init start
    DEBUG 3.2: prepare_data start amazon-ratings
    ----Data statistics------'
    Name: amazon-ratings
    #Nodes 24492
    #Edges 93050
    #Classes 5
    #Ave_degree 7.60
    ----Split statistics------'
    #Train samples 1224 (5.0 % of nodes)
    #Val samples 3673 (15.0 % of nodes)
    #Test samples 19595 (remaining)
    ----label noise information:------
    Instance dependent noise
    #Actual noise rate 0.40
    [cuda:1] LNPCC waiting for GPU slot...
    [cuda:1] Slot acquired (waited 148.9s). Starting GCN...
    FINAL_RESULT: {'acc': {'train': 0.380718954248366, 'valid': 0.2872311462020147, 'test': 0.39254911967338607}, 'wall_s': 37.05, 'cpu_s': 33.73, 'gpu_s': 3.28, 'wait_s': 148.9}
    [Time] wall=37.1s | cpu=33.7s | gpu=3.3s
    C:\Users\fbrev\Documents\Acadêmico\Simulações\Python\NoisyGL\predictor\Base_Predictor.py:144: UserWarning: Sparse CSR tensor support is in beta state. If you miss a functionality in the sparse tensor support, please submit a feature request to https://github.com/pytorch/pytorch/issues. (Triggered internally at ..\aten\src\ATen\SparseCsrTensorImpl.cpp:55.)
    self.adj_csr = self.adj.to_sparse_csr().to(self.device)
[I 2026-04-27 02:26:52,472] Trial 75 finished with value: 0.39254911967338607 and parameters: {'lr': 0.001, 'weight_decay': 0.001, 'n_hidden': 64, 'n_layer': 3, 'dropout': 0.2678188470365311, 'knn_mode': 's', 'k': 36, 'dexp': 9.966451517808013, 'p_grd': 0.33106438385156106, 'unc_rem': 0.8153605754155082, 'unc_rel': 0.7607589485511328}. Best is trial 44 with value: 0.3977034957897423.
    [CPU] Loading amazon-ratings...
    DEBUG 3.1: Dataset init start
    DEBUG 3.2: prepare_data start amazon-ratings
    ----Data statistics------'
    Name: amazon-ratings
    #Nodes 24492
    #Edges 93050
    #Classes 5
    #Ave_degree 7.60
    ----Split statistics------'
    #Train samples 1224 (5.0 % of nodes)
    #Val samples 3673 (15.0 % of nodes)
    #Test samples 19595 (remaining)
    ----label noise information:------
    Instance dependent noise
    #Actual noise rate 0.40
    [cuda:1] LNPCC waiting for GPU slot...
    [cuda:1] Slot acquired (waited 168.9s). Starting GCN...
    FINAL_RESULT: {'acc': {'train': 0.3805601317957166, 'valid': 0.2806969779471821, 'test': 0.38611890788466446}, 'wall_s': 25.47, 'cpu_s': 22.08, 'gpu_s': 3.34, 'wait_s': 168.88}
    [Time] wall=25.5s | cpu=22.1s | gpu=3.3s
    C:\Users\fbrev\Documents\Acadêmico\Simulações\Python\NoisyGL\predictor\Base_Predictor.py:144: UserWarning: Sparse CSR tensor support is in beta state. If you miss a functionality in the sparse tensor support, please submit a feature request to https://github.com/pytorch/pytorch/issues. (Triggered internally at ..\aten\src\ATen\SparseCsrTensorImpl.cpp:55.)
    self.adj_csr = self.adj.to_sparse_csr().to(self.device)
[I 2026-04-27 02:30:12,034] Trial 76 finished with value: 0.38611890788466446 and parameters: {'lr': 0.005, 'weight_decay': 0.001, 'n_hidden': 64, 'n_layer': 3, 'dropout': 0.36543462342695415, 'knn_mode': 's', 'k': 42, 'dexp': 9.443581182415418, 'p_grd': 0.1870503751040186, 'unc_rem': 0.9014600297678235, 'unc_rel': 0.8039987147968731}. Best is trial 44 with value: 0.3977034957897423.
    [CPU] Loading amazon-ratings...
    DEBUG 3.1: Dataset init start
    DEBUG 3.2: prepare_data start amazon-ratings
    ----Data statistics------'
    Name: amazon-ratings
    #Nodes 24492
    #Edges 93050
    #Classes 5
    #Ave_degree 7.60
    ----Split statistics------'
    #Train samples 1224 (5.0 % of nodes)
    #Val samples 3673 (15.0 % of nodes)
    #Test samples 19595 (remaining)
    ----label noise information:------
    Instance dependent noise
    #Actual noise rate 0.40
    [cuda:1] LNPCC waiting for GPU slot...
    [cuda:1] Slot acquired (waited 161.1s). Starting GCN...
    FINAL_RESULT: {'acc': {'train': 0.25901639344262295, 'valid': 0.2635447862782467, 'test': 0.367440673641235}, 'wall_s': 31.99, 'cpu_s': 28.8, 'gpu_s': 3.15, 'wait_s': 161.08}
    [Time] wall=32.0s | cpu=28.8s | gpu=3.1s
    C:\Users\fbrev\Documents\Acadêmico\Simulações\Python\NoisyGL\predictor\Base_Predictor.py:144: UserWarning: Sparse CSR tensor support is in beta state. If you miss a functionality in the sparse tensor support, please submit a feature request to https://github.com/pytorch/pytorch/issues. (Triggered internally at ..\aten\src\ATen\SparseCsrTensorImpl.cpp:55.)
    self.adj_csr = self.adj.to_sparse_csr().to(self.device)
[I 2026-04-27 02:33:30,524] Trial 77 finished with value: 0.367440673641235 and parameters: {'lr': 0.005, 'weight_decay': 0.05, 'n_hidden': 64, 'n_layer': 3, 'dropout': 0.18803295686328364, 'knn_mode': 's', 'k': 39, 'dexp': 9.16281255889445, 'p_grd': 0.28577936405071686, 'unc_rem': 0.877360414034394, 'unc_rel': 0.6678249119784451}. Best is trial 44 with value: 0.3977034957897423.
    [CPU] Loading amazon-ratings...
    DEBUG 3.1: Dataset init start
    DEBUG 3.2: prepare_data start amazon-ratings
    ----Data statistics------'
    Name: amazon-ratings
    #Nodes 24492
    #Edges 93050
    #Classes 5
    #Ave_degree 7.60
    ----Split statistics------'
    #Train samples 1224 (5.0 % of nodes)
    #Val samples 3673 (15.0 % of nodes)
    #Test samples 19595 (remaining)
    ----label noise information:------
    Instance dependent noise
    #Actual noise rate 0.40
    [cuda:1] LNPCC waiting for GPU slot...
    [cuda:1] Slot acquired (waited 150.5s). Starting GCN...
    FINAL_RESULT: {'acc': {'train': 0.35375816993464054, 'valid': 0.28532534712768853, 'test': 0.3933146210768053}, 'wall_s': 37.7, 'cpu_s': 34.48, 'gpu_s': 3.17, 'wait_s': 150.47}
    [Time] wall=37.7s | cpu=34.5s | gpu=3.2s
    C:\Users\fbrev\Documents\Acadêmico\Simulações\Python\NoisyGL\predictor\Base_Predictor.py:144: UserWarning: Sparse CSR tensor support is in beta state. If you miss a functionality in the sparse tensor support, please submit a feature request to https://github.com/pytorch/pytorch/issues. (Triggered internally at ..\aten\src\ATen\SparseCsrTensorImpl.cpp:55.)
    self.adj_csr = self.adj.to_sparse_csr().to(self.device)
[I 2026-04-27 02:36:44,131] Trial 78 finished with value: 0.3933146210768053 and parameters: {'lr': 0.005, 'weight_decay': 0.001, 'n_hidden': 64, 'n_layer': 3, 'dropout': 0.3316740901121804, 'knn_mode': 's', 'k': 36, 'dexp': 7.2989049881640105, 'p_grd': 0.45182465318839554, 'unc_rem': 0.5607849085185244, 'unc_rel': 0.7383056505230917}. Best is trial 44 with value: 0.3977034957897423.
    [CPU] Loading amazon-ratings...
    DEBUG 3.1: Dataset init start
    DEBUG 3.2: prepare_data start amazon-ratings
    ----Data statistics------'
    Name: amazon-ratings
    #Nodes 24492
    #Edges 93050
    #Classes 5
    #Ave_degree 7.60
    ----Split statistics------'
    #Train samples 1224 (5.0 % of nodes)
    #Val samples 3673 (15.0 % of nodes)
    #Test samples 19595 (remaining)
    ----label noise information:------
    Instance dependent noise
    #Actual noise rate 0.40
    [cuda:1] LNPCC waiting for GPU slot...
    [cuda:1] Slot acquired (waited 161.5s). Starting GCN...
    FINAL_RESULT: {'acc': {'train': 0.38934426229508196, 'valid': 0.27742989381976585, 'test': 0.3830569022709875}, 'wall_s': 25.75, 'cpu_s': 22.5, 'gpu_s': 3.2, 'wait_s': 161.54}
    [Time] wall=25.7s | cpu=22.5s | gpu=3.2s
    C:\Users\fbrev\Documents\Acadêmico\Simulações\Python\NoisyGL\predictor\Base_Predictor.py:144: UserWarning: Sparse CSR tensor support is in beta state. If you miss a functionality in the sparse tensor support, please submit a feature request to https://github.com/pytorch/pytorch/issues. (Triggered internally at ..\aten\src\ATen\SparseCsrTensorImpl.cpp:55.)
    self.adj_csr = self.adj.to_sparse_csr().to(self.device)
[I 2026-04-27 02:39:56,901] Trial 79 finished with value: 0.3830569022709875 and parameters: {'lr': 0.005, 'weight_decay': 0.001, 'n_hidden': 64, 'n_layer': 3, 'dropout': 0.11356086068673432, 'knn_mode': 's', 'k': 38, 'dexp': 8.404211615752425, 'p_grd': 0.2346559728982271, 'unc_rem': 0.9285912216300425, 'unc_rel': 0.5706751992254648}. Best is trial 44 with value: 0.3977034957897423.
    [CPU] Loading amazon-ratings...
    DEBUG 3.1: Dataset init start
    DEBUG 3.2: prepare_data start amazon-ratings
    ----Data statistics------'
    Name: amazon-ratings
    #Nodes 24492
    #Edges 93050
    #Classes 5
    #Ave_degree 7.60
    ----Split statistics------'
    #Train samples 1224 (5.0 % of nodes)
    #Val samples 3673 (15.0 % of nodes)
    #Test samples 19595 (remaining)
    ----label noise information:------
    Instance dependent noise
    #Actual noise rate 0.40
    [cuda:1] LNPCC waiting for GPU slot...
    [cuda:1] Slot acquired (waited 157.8s). Starting GCN...
    FINAL_RESULT: {'acc': {'train': 0.3729508196721312, 'valid': 0.2836918050639804, 'test': 0.3864761418729268}, 'wall_s': 32.12, 'cpu_s': 28.89, 'gpu_s': 3.18, 'wait_s': 157.79}
    [Time] wall=32.1s | cpu=28.9s | gpu=3.2s
    C:\Users\fbrev\Documents\Acadêmico\Simulações\Python\NoisyGL\predictor\Base_Predictor.py:144: UserWarning: Sparse CSR tensor support is in beta state. If you miss a functionality in the sparse tensor support, please submit a feature request to https://github.com/pytorch/pytorch/issues. (Triggered internally at ..\aten\src\ATen\SparseCsrTensorImpl.cpp:55.)
    self.adj_csr = self.adj.to_sparse_csr().to(self.device)
[I 2026-04-27 02:43:12,027] Trial 80 finished with value: 0.3864761418729268 and parameters: {'lr': 0.01, 'weight_decay': 0.001, 'n_hidden': 64, 'n_layer': 3, 'dropout': 0.14381693360540204, 'knn_mode': 's', 'k': 46, 'dexp': 7.004115470803021, 'p_grd': 0.3288404261728238, 'unc_rem': 0.4724556114278932, 'unc_rel': 0.4018131919345936}. Best is trial 44 with value: 0.3977034957897423.
    [CPU] Loading amazon-ratings...
    DEBUG 3.1: Dataset init start
    DEBUG 3.2: prepare_data start amazon-ratings
    ----Data statistics------'
    Name: amazon-ratings
    #Nodes 24492
    #Edges 93050
    #Classes 5
    #Ave_degree 7.60
    ----Split statistics------'
    #Train samples 1224 (5.0 % of nodes)
    #Val samples 3673 (15.0 % of nodes)
    #Test samples 19595 (remaining)
    ----label noise information:------
    Instance dependent noise
    #Actual noise rate 0.40
    [cuda:1] LNPCC waiting for GPU slot...
    [cuda:1] Slot acquired (waited 142.5s). Starting GCN...
    FINAL_RESULT: {'acc': {'train': 0.2769607843137255, 'valid': 0.2630002722570106, 'test': 0.36820617504465425}, 'wall_s': 41.57, 'cpu_s': 39.41, 'gpu_s': 2.1, 'wait_s': 142.52}
    [Time] wall=41.6s | cpu=39.4s | gpu=2.1s
    C:\Users\fbrev\Documents\Acadêmico\Simulações\Python\NoisyGL\predictor\Base_Predictor.py:144: UserWarning: Sparse CSR tensor support is in beta state. If you miss a functionality in the sparse tensor support, please submit a feature request to https://github.com/pytorch/pytorch/issues. (Triggered internally at ..\aten\src\ATen\SparseCsrTensorImpl.cpp:55.)
    self.adj_csr = self.adj.to_sparse_csr().to(self.device)
[I 2026-04-27 02:46:21,488] Trial 81 finished with value: 0.36820617504465425 and parameters: {'lr': 0.005, 'weight_decay': 0.01, 'n_hidden': 64, 'n_layer': 2, 'dropout': 0.24489713054229365, 'knn_mode': 's', 'k': 34, 'dexp': 9.793039116581355, 'p_grd': 0.415728005274439, 'unc_rem': 0.7868438715057848, 'unc_rel': 0.8150160704858408}. Best is trial 44 with value: 0.3977034957897423.
    [CPU] Loading amazon-ratings...
    DEBUG 3.1: Dataset init start
    DEBUG 3.2: prepare_data start amazon-ratings
    ----Data statistics------'
    Name: amazon-ratings
    #Nodes 24492
    #Edges 93050
    #Classes 5
    #Ave_degree 7.60
    ----Split statistics------'
    #Train samples 1224 (5.0 % of nodes)
    #Val samples 3673 (15.0 % of nodes)
    #Test samples 19595 (remaining)
    ----label noise information:------
    Instance dependent noise
    #Actual noise rate 0.40
    [cuda:1] LNPCC waiting for GPU slot...
    [cuda:1] Slot acquired (waited 151.6s). Starting GCN...
    FINAL_RESULT: {'acc': {'train': 0.38461538461538464, 'valid': 0.2836918050639804, 'test': 0.39066088287828526}, 'wall_s': 38.49, 'cpu_s': 33.77, 'gpu_s': 4.68, 'wait_s': 151.64}
    [Time] wall=38.5s | cpu=33.8s | gpu=4.7s
    C:\Users\fbrev\Documents\Acadêmico\Simulações\Python\NoisyGL\predictor\Base_Predictor.py:144: UserWarning: Sparse CSR tensor support is in beta state. If you miss a functionality in the sparse tensor support, please submit a feature request to https://github.com/pytorch/pytorch/issues. (Triggered internally at ..\aten\src\ATen\SparseCsrTensorImpl.cpp:55.)
    self.adj_csr = self.adj.to_sparse_csr().to(self.device)
[I 2026-04-27 02:49:36,660] Trial 82 finished with value: 0.39066088287828526 and parameters: {'lr': 0.005, 'weight_decay': 0.001, 'n_hidden': 128, 'n_layer': 3, 'dropout': 0.21496566736090728, 'knn_mode': 's', 'k': 30, 'dexp': 8.6909719942129, 'p_grd': 0.37722523258753643, 'unc_rem': 0.7529491115819648, 'unc_rel': 0.7631625419128636}. Best is trial 44 with value: 0.3977034957897423.
    [CPU] Loading amazon-ratings...
    DEBUG 3.1: Dataset init start
    DEBUG 3.2: prepare_data start amazon-ratings
    ----Data statistics------'
    Name: amazon-ratings
    #Nodes 24492
    #Edges 93050
    #Classes 5
    #Ave_degree 7.60
    ----Split statistics------'
    #Train samples 1224 (5.0 % of nodes)
    #Val samples 3673 (15.0 % of nodes)
    #Test samples 19595 (remaining)
    ----label noise information:------
    Instance dependent noise
    #Actual noise rate 0.40
    [cuda:1] LNPCC waiting for GPU slot...
    [cuda:1] Slot acquired (waited 154.2s). Starting GCN...
    FINAL_RESULT: {'acc': {'train': 0.3619281045751634, 'valid': 0.2864143751701606, 'test': 0.39540699157948456}, 'wall_s': 34.55, 'cpu_s': 31.31, 'gpu_s': 3.18, 'wait_s': 154.2}
    [Time] wall=34.6s | cpu=31.3s | gpu=3.2s
    C:\Users\fbrev\Documents\Acadêmico\Simulações\Python\NoisyGL\predictor\Base_Predictor.py:144: UserWarning: Sparse CSR tensor support is in beta state. If you miss a functionality in the sparse tensor support, please submit a feature request to https://github.com/pytorch/pytorch/issues. (Triggered internally at ..\aten\src\ATen\SparseCsrTensorImpl.cpp:55.)
    self.adj_csr = self.adj.to_sparse_csr().to(self.device)
[I 2026-04-27 02:52:50,393] Trial 83 finished with value: 0.39540699157948456 and parameters: {'lr': 0.005, 'weight_decay': 0.001, 'n_hidden': 64, 'n_layer': 3, 'dropout': 0.2761386405637409, 'knn_mode': 's', 'k': 34, 'dexp': 7.972845792415136, 'p_grd': 0.34655629981301617, 'unc_rem': 0.8210640607623644, 'unc_rel': 0.6818072661700306}. Best is trial 44 with value: 0.3977034957897423.
    [CPU] Loading amazon-ratings...
    DEBUG 3.1: Dataset init start
    DEBUG 3.2: prepare_data start amazon-ratings
    ----Data statistics------'
    Name: amazon-ratings
    #Nodes 24492
    #Edges 93050
    #Classes 5
    #Ave_degree 7.60
    ----Split statistics------'
    #Train samples 1224 (5.0 % of nodes)
    #Val samples 3673 (15.0 % of nodes)
    #Test samples 19595 (remaining)
    ----label noise information:------
    Instance dependent noise
    #Actual noise rate 0.40
    [cuda:1] LNPCC waiting for GPU slot...
    [cuda:1] Slot acquired (waited 163.8s). Starting GCN...
    FINAL_RESULT: {'acc': {'train': 0.36467702371218313, 'valid': 0.290498230329431, 'test': 0.39760142893595307}, 'wall_s': 33.48, 'cpu_s': 30.28, 'gpu_s': 3.16, 'wait_s': 163.75}
    [Time] wall=33.5s | cpu=30.3s | gpu=3.2s
    C:\Users\fbrev\Documents\Acadêmico\Simulações\Python\NoisyGL\predictor\Base_Predictor.py:144: UserWarning: Sparse CSR tensor support is in beta state. If you miss a functionality in the sparse tensor support, please submit a feature request to https://github.com/pytorch/pytorch/issues. (Triggered internally at ..\aten\src\ATen\SparseCsrTensorImpl.cpp:55.)
    self.adj_csr = self.adj.to_sparse_csr().to(self.device)
[I 2026-04-27 02:56:12,778] Trial 84 finished with value: 0.39760142893595307 and parameters: {'lr': 0.005, 'weight_decay': 0.001, 'n_hidden': 64, 'n_layer': 3, 'dropout': 0.2835025003650139, 'knn_mode': 's', 'k': 32, 'dexp': 7.751442355593444, 'p_grd': 0.34305795567225567, 'unc_rem': 0.8288952902097232, 'unc_rel': 0.7151112333086896}. Best is trial 44 with value: 0.3977034957897423.
    [CPU] Loading amazon-ratings...
    DEBUG 3.1: Dataset init start
    DEBUG 3.2: prepare_data start amazon-ratings
    ----Data statistics------'
    Name: amazon-ratings
    #Nodes 24492
    #Edges 93050
    #Classes 5
    #Ave_degree 7.60
    ----Split statistics------'
    #Train samples 1224 (5.0 % of nodes)
    #Val samples 3673 (15.0 % of nodes)
    #Test samples 19595 (remaining)
    ----label noise information:------
    Instance dependent noise
    #Actual noise rate 0.40
    [cuda:1] LNPCC waiting for GPU slot...
    [cuda:1] Slot acquired (waited 173.3s). Starting GCN...
    FINAL_RESULT: {'acc': {'train': 0.38165438165438165, 'valid': 0.28559760413830654, 'test': 0.3912222505741261}, 'wall_s': 28.79, 'cpu_s': 25.52, 'gpu_s': 3.23, 'wait_s': 173.29}
    [Time] wall=28.8s | cpu=25.5s | gpu=3.2s
    C:\Users\fbrev\Documents\Acadêmico\Simulações\Python\NoisyGL\predictor\Base_Predictor.py:144: UserWarning: Sparse CSR tensor support is in beta state. If you miss a functionality in the sparse tensor support, please submit a feature request to https://github.com/pytorch/pytorch/issues. (Triggered internally at ..\aten\src\ATen\SparseCsrTensorImpl.cpp:55.)
    self.adj_csr = self.adj.to_sparse_csr().to(self.device)
