[I 2026-05-05 16:02:19,693] Trial 114 finished with value: 0.7632710657169736 and parameters: {'lr': 0.005, 'weight_decay': 0.0001, 'n_hidden': 128, 'n_layer': 3, 'dropout': 0.2988998345116799, 'knn_mode': 's', 'k': 49, 'dexp': 9.477675148434948, 'p_grd': 0.35188594600073264, 'unc_rem': 0.4136615668203412, 'unc_rel': 0.7363634779417633}. Best is trial 83 with value: 0.7836984276306947.
    [CPU] Loading dblp...
    DEBUG 3.1: Dataset init start
    DEBUG 3.2: prepare_data start dblp
    ----Data statistics------'
    Name: dblp
    #Nodes 17716
    #Edges 52867
    #Classes 4
    #Ave_degree 5.97
    ----Split statistics------'
    #Train samples 177 (1.0 % of nodes)
    #Val samples 2657 (15.0 % of nodes)
    #Test samples 14882 (remaining)
    ----label noise information:------
    Instance dependent noise
    #Actual noise rate 0.13
    [cuda:0] LNPCC waiting for GPU slot...
    [cuda:0] Slot acquired (waited 140.6s). Starting GCN...
    FINAL_RESULT: {'acc': {'train': 0.9540229885057471, 'valid': 0.6793375987956342, 'test': 0.7507055503292568}, 'wall_s': 43.83, 'cpu_s': 39.2, 'gpu_s': 4.56, 'wait_s': 140.57}
    [Time] wall=43.8s | cpu=39.2s | gpu=4.6s
    C:\Users\fbrev\Documents\Acadêmico\Simulações\Python\NoisyGL\predictor\Base_Predictor.py:114: UserWarning: expandable_segments not supported on this platform (Triggered internally at ..\c10/cuda/CUDAAllocatorConfig.h:28.)
    self.edge_index = self._cpu_edge_index.to(self.device)
    C:\Users\fbrev\Documents\Acadêmico\Simulações\Python\NoisyGL\predictor\Base_Predictor.py:144: UserWarning: Sparse CSR tensor support is in beta state. If you miss a functionality in the sparse tensor support, please submit a feature request to https://github.com/pytorch/pytorch/issues. (Triggered internally at ..\aten\src\ATen\SparseCsrTensorImpl.cpp:55.)
    self.adj_csr = self.adj.to_sparse_csr().to(self.device)
[I 2026-05-05 16:05:29,992] Trial 115 finished with value: 0.7507055503292568 and parameters: {'lr': 0.005, 'weight_decay': 0.001, 'n_hidden': 128, 'n_layer': 3, 'dropout': 0.3798413450659325, 'knn_mode': 's', 'k': 45, 'dexp': 9.215700016405055, 'p_grd': 0.15082981712190893, 'unc_rem': 0.3516529662123594, 'unc_rel': 0.8444941143199567}. Best is trial 83 with value: 0.7836984276306947.
    [CPU] Loading dblp...
    DEBUG 3.1: Dataset init start
    DEBUG 3.2: prepare_data start dblp
    ----Data statistics------'
    Name: dblp
    #Nodes 17716
    #Edges 52867
    #Classes 4
    #Ave_degree 5.97
    ----Split statistics------'
    #Train samples 177 (1.0 % of nodes)
    #Val samples 2657 (15.0 % of nodes)
    #Test samples 14882 (remaining)
    ----label noise information:------
    Instance dependent noise
    #Actual noise rate 0.13
    [cuda:0] LNPCC waiting for GPU slot...
    [cuda:0] Slot acquired (waited 318.6s). Starting GCN...
    FINAL_RESULT: {'acc': {'train': 0.8983050847457628, 'valid': 0.6917576213774934, 'test': 0.7689154683510281}, 'wall_s': 43.82, 'cpu_s': 39.51, 'gpu_s': 4.24, 'wait_s': 318.6}
    [Time] wall=43.8s | cpu=39.5s | gpu=4.2s
    C:\Users\fbrev\Documents\Acadêmico\Simulações\Python\NoisyGL\predictor\Base_Predictor.py:114: UserWarning: expandable_segments not supported on this platform (Triggered internally at ..\c10/cuda/CUDAAllocatorConfig.h:28.)
    self.edge_index = self._cpu_edge_index.to(self.device)
    C:\Users\fbrev\Documents\Acadêmico\Simulações\Python\NoisyGL\predictor\Base_Predictor.py:144: UserWarning: Sparse CSR tensor support is in beta state. If you miss a functionality in the sparse tensor support, please submit a feature request to https://github.com/pytorch/pytorch/issues. (Triggered internally at ..\aten\src\ATen\SparseCsrTensorImpl.cpp:55.)
    self.adj_csr = self.adj.to_sparse_csr().to(self.device)
[I 2026-05-05 16:11:38,222] Trial 116 finished with value: 0.7689154683510281 and parameters: {'lr': 0.005, 'weight_decay': 0.0001, 'n_hidden': 128, 'n_layer': 3, 'dropout': 0.3534903090339409, 'knn_mode': 's', 'k': 48, 'dexp': 9.715802073447952, 'p_grd': 0.318463968401886, 'unc_rem': 0.25510988117911226, 'unc_rel': 0.9745487840549882}. Best is trial 83 with value: 0.7836984276306947.
    [CPU] Loading dblp...
    DEBUG 3.1: Dataset init start
    DEBUG 3.2: prepare_data start dblp
    ----Data statistics------'
    Name: dblp
    #Nodes 17716
    #Edges 52867
    #Classes 4
    #Ave_degree 5.97
    ----Split statistics------'
    #Train samples 177 (1.0 % of nodes)
    #Val samples 2657 (15.0 % of nodes)
    #Test samples 14882 (remaining)
    ----label noise information:------
    Instance dependent noise
    #Actual noise rate 0.13
    [cuda:0] LNPCC waiting for GPU slot...
    [cuda:0] Slot acquired (waited 686.4s). Starting GCN...
    FINAL_RESULT: {'acc': {'train': 0.9774011299435028, 'valid': 0.6624012043658262, 'test': 0.7300766026071764}, 'wall_s': 43.9, 'cpu_s': 39.43, 'gpu_s': 4.42, 'wait_s': 686.35}
    [Time] wall=43.9s | cpu=39.4s | gpu=4.4s
    C:\Users\fbrev\Documents\Acadêmico\Simulações\Python\NoisyGL\predictor\Base_Predictor.py:114: UserWarning: expandable_segments not supported on this platform (Triggered internally at ..\c10/cuda/CUDAAllocatorConfig.h:28.)
    self.edge_index = self._cpu_edge_index.to(self.device)
    C:\Users\fbrev\Documents\Acadêmico\Simulações\Python\NoisyGL\predictor\Base_Predictor.py:144: UserWarning: Sparse CSR tensor support is in beta state. If you miss a functionality in the sparse tensor support, please submit a feature request to https://github.com/pytorch/pytorch/issues. (Triggered internally at ..\aten\src\ATen\SparseCsrTensorImpl.cpp:55.)
    self.adj_csr = self.adj.to_sparse_csr().to(self.device)
[I 2026-05-05 16:23:54,357] Trial 117 finished with value: 0.7300766026071764 and parameters: {'lr': 0.005, 'weight_decay': 0.01, 'n_hidden': 128, 'n_layer': 3, 'dropout': 0.2104023544275535, 'knn_mode': 's', 'k': 50, 'dexp': 7.008862265817307, 'p_grd': 0.22143653021610377, 'unc_rem': 0.4719435848056303, 'unc_rel': 0.9053795925071818}. Best is trial 83 with value: 0.7836984276306947.
    [CPU] Loading dblp...
    DEBUG 3.1: Dataset init start
    DEBUG 3.2: prepare_data start dblp
    ----Data statistics------'
    Name: dblp
    #Nodes 17716
    #Edges 52867
    #Classes 4
    #Ave_degree 5.97
    ----Split statistics------'
    #Train samples 177 (1.0 % of nodes)
    #Val samples 2657 (15.0 % of nodes)
    #Test samples 14882 (remaining)
    ----label noise information:------
    Instance dependent noise
    #Actual noise rate 0.13
    [cuda:0] LNPCC waiting for GPU slot...
    [cuda:0] Slot acquired (waited 137.4s). Starting GCN...
    FINAL_RESULT: {'acc': {'train': 0.9152542372881356, 'valid': 0.6913812570568311, 'test': 0.7685122967343099}, 'wall_s': 46.32, 'cpu_s': 41.67, 'gpu_s': 4.58, 'wait_s': 137.38}
    [Time] wall=46.3s | cpu=41.7s | gpu=4.6s
    C:\Users\fbrev\Documents\Acadêmico\Simulações\Python\NoisyGL\predictor\Base_Predictor.py:114: UserWarning: expandable_segments not supported on this platform (Triggered internally at ..\c10/cuda/CUDAAllocatorConfig.h:28.)
    self.edge_index = self._cpu_edge_index.to(self.device)
    C:\Users\fbrev\Documents\Acadêmico\Simulações\Python\NoisyGL\predictor\Base_Predictor.py:144: UserWarning: Sparse CSR tensor support is in beta state. If you miss a functionality in the sparse tensor support, please submit a feature request to https://github.com/pytorch/pytorch/issues. (Triggered internally at ..\aten\src\ATen\SparseCsrTensorImpl.cpp:55.)
    self.adj_csr = self.adj.to_sparse_csr().to(self.device)
[I 2026-05-05 16:27:04,071] Trial 118 finished with value: 0.7685122967343099 and parameters: {'lr': 0.005, 'weight_decay': 0.0001, 'n_hidden': 128, 'n_layer': 3, 'dropout': 0.4040596107839081, 'knn_mode': 's', 'k': 42, 'dexp': 8.276804056268247, 'p_grd': 0.3616525984130222, 'unc_rem': 0.5082330717178618, 'unc_rel': 0.7795183477394204}. Best is trial 83 with value: 0.7836984276306947.
    [CPU] Loading dblp...
    DEBUG 3.1: Dataset init start
    DEBUG 3.2: prepare_data start dblp
    ----Data statistics------'
    Name: dblp
    #Nodes 17716
    #Edges 52867
    #Classes 4
    #Ave_degree 5.97
    ----Split statistics------'
    #Train samples 177 (1.0 % of nodes)
    #Val samples 2657 (15.0 % of nodes)
    #Test samples 14882 (remaining)
    ----label noise information:------
    Instance dependent noise
    #Actual noise rate 0.13
    [cuda:0] LNPCC waiting for GPU slot...
    [cuda:0] Slot acquired (waited 91.7s). Starting GCN...
    FINAL_RESULT: {'acc': {'train': 0.8977272727272727, 'valid': 0.63793752352277, 'test': 0.7123370514715764}, 'wall_s': 103.11, 'cpu_s': 100.27, 'gpu_s': 2.77, 'wait_s': 91.69}
    [Time] wall=103.1s | cpu=100.3s | gpu=2.8s
    C:\Users\fbrev\Documents\Acadêmico\Simulações\Python\NoisyGL\predictor\Base_Predictor.py:114: UserWarning: expandable_segments not supported on this platform (Triggered internally at ..\c10/cuda/CUDAAllocatorConfig.h:28.)
    self.edge_index = self._cpu_edge_index.to(self.device)
    C:\Users\fbrev\Documents\Acadêmico\Simulações\Python\NoisyGL\predictor\Base_Predictor.py:144: UserWarning: Sparse CSR tensor support is in beta state. If you miss a functionality in the sparse tensor support, please submit a feature request to https://github.com/pytorch/pytorch/issues. (Triggered internally at ..\aten\src\ATen\SparseCsrTensorImpl.cpp:55.)
    self.adj_csr = self.adj.to_sparse_csr().to(self.device)
[I 2026-05-05 16:30:24,642] Trial 119 finished with value: 0.7123370514715764 and parameters: {'lr': 0.005, 'weight_decay': 0.0001, 'n_hidden': 32, 'n_layer': 3, 'dropout': 0.3212898522104664, 'knn_mode': 'd', 'k': 47, 'dexp': 7.591536114478835, 'p_grd': 0.2411185453099711, 'unc_rem': 0.5832572584341738, 'unc_rel': 0.614845123785178}. Best is trial 83 with value: 0.7836984276306947.
    [CPU] Loading dblp...
    DEBUG 3.1: Dataset init start
    DEBUG 3.2: prepare_data start dblp
    ----Data statistics------'
    Name: dblp
    #Nodes 17716
    #Edges 52867
    #Classes 4
    #Ave_degree 5.97
    ----Split statistics------'
    #Train samples 177 (1.0 % of nodes)
    #Val samples 2657 (15.0 % of nodes)
    #Test samples 14882 (remaining)
    ----label noise information:------
    Instance dependent noise
    #Actual noise rate 0.13
    [cuda:0] LNPCC waiting for GPU slot...
    [cuda:0] Slot acquired (waited 900.9s). Starting GCN...
    FINAL_RESULT: {'acc': {'train': 0.903954802259887, 'valid': 0.6642830259691381, 'test': 0.7385432065582583}, 'wall_s': 45.28, 'cpu_s': 42.79, 'gpu_s': 2.42, 'wait_s': 900.87}
    [Time] wall=45.3s | cpu=42.8s | gpu=2.4s
    C:\Users\fbrev\Documents\Acadêmico\Simulações\Python\NoisyGL\predictor\Base_Predictor.py:114: UserWarning: expandable_segments not supported on this platform (Triggered internally at ..\c10/cuda/CUDAAllocatorConfig.h:28.)
    self.edge_index = self._cpu_edge_index.to(self.device)
    C:\Users\fbrev\Documents\Acadêmico\Simulações\Python\NoisyGL\predictor\Base_Predictor.py:144: UserWarning: Sparse CSR tensor support is in beta state. If you miss a functionality in the sparse tensor support, please submit a feature request to https://github.com/pytorch/pytorch/issues. (Triggered internally at ..\aten\src\ATen\SparseCsrTensorImpl.cpp:55.)
    self.adj_csr = self.adj.to_sparse_csr().to(self.device)
[I 2026-05-05 16:46:16,809] Trial 120 finished with value: 0.7385432065582583 and parameters: {'lr': 0.05, 'weight_decay': 0.0001, 'n_hidden': 64, 'n_layer': 2, 'dropout': 0.28853660361581956, 'knn_mode': 's', 'k': 44, 'dexp': 8.800414186574919, 'p_grd': 0.4035679634596529, 'unc_rem': 0.41927552870715573, 'unc_rel': 0.4532023744223563}. Best is trial 83 with value: 0.7836984276306947.
    [CPU] Loading dblp...
    DEBUG 3.1: Dataset init start
    DEBUG 3.2: prepare_data start dblp
    ----Data statistics------'
    Name: dblp
    #Nodes 17716
    #Edges 52867
    #Classes 4
    #Ave_degree 5.97
    ----Split statistics------'
    #Train samples 177 (1.0 % of nodes)
    #Val samples 2657 (15.0 % of nodes)
    #Test samples 14882 (remaining)
    ----label noise information:------
    Instance dependent noise
    #Actual noise rate 0.13
    [cuda:0] LNPCC waiting for GPU slot...
    [cuda:0] Slot acquired (waited 149.6s). Starting GCN...
    FINAL_RESULT: {'acc': {'train': 0.9378531073446328, 'valid': 0.6797139631162966, 'test': 0.7513775030237871}, 'wall_s': 42.77, 'cpu_s': 38.37, 'gpu_s': 4.34, 'wait_s': 149.62}
    [Time] wall=42.8s | cpu=38.4s | gpu=4.3s
    C:\Users\fbrev\Documents\Acadêmico\Simulações\Python\NoisyGL\predictor\Base_Predictor.py:114: UserWarning: expandable_segments not supported on this platform (Triggered internally at ..\c10/cuda/CUDAAllocatorConfig.h:28.)
    self.edge_index = self._cpu_edge_index.to(self.device)
    C:\Users\fbrev\Documents\Acadêmico\Simulações\Python\NoisyGL\predictor\Base_Predictor.py:144: UserWarning: Sparse CSR tensor support is in beta state. If you miss a functionality in the sparse tensor support, please submit a feature request to https://github.com/pytorch/pytorch/issues. (Triggered internally at ..\aten\src\ATen\SparseCsrTensorImpl.cpp:55.)
    self.adj_csr = self.adj.to_sparse_csr().to(self.device)
[I 2026-05-05 16:49:35,453] Trial 121 finished with value: 0.7513775030237871 and parameters: {'lr': 0.001, 'weight_decay': 0.0001, 'n_hidden': 128, 'n_layer': 3, 'dropout': 0.36297232251601474, 'knn_mode': 's', 'k': 48, 'dexp': 7.331985068917821, 'p_grd': 0.2945604001715024, 'unc_rem': 0.5515422404268269, 'unc_rel': 0.5090175958044728}. Best is trial 83 with value: 0.7836984276306947.
    [CPU] Loading dblp...
    DEBUG 3.1: Dataset init start
    DEBUG 3.2: prepare_data start dblp
    ----Data statistics------'
    Name: dblp
    #Nodes 17716
    #Edges 52867
    #Classes 4
    #Ave_degree 5.97
    ----Split statistics------'
    #Train samples 177 (1.0 % of nodes)
    #Val samples 2657 (15.0 % of nodes)
    #Test samples 14882 (remaining)
    ----label noise information:------
    Instance dependent noise
    #Actual noise rate 0.13
    [cuda:0] LNPCC waiting for GPU slot...
    [cuda:0] Slot acquired (waited 150.9s). Starting GCN...
    FINAL_RESULT: {'acc': {'train': 0.9657142857142857, 'valid': 0.6883703424915318, 'test': 0.7683107109259508}, 'wall_s': 47.86, 'cpu_s': 43.29, 'gpu_s': 4.51, 'wait_s': 150.91}
    [Time] wall=47.9s | cpu=43.3s | gpu=4.5s
    C:\Users\fbrev\Documents\Acadêmico\Simulações\Python\NoisyGL\predictor\Base_Predictor.py:114: UserWarning: expandable_segments not supported on this platform (Triggered internally at ..\c10/cuda/CUDAAllocatorConfig.h:28.)
    self.edge_index = self._cpu_edge_index.to(self.device)
    C:\Users\fbrev\Documents\Acadêmico\Simulações\Python\NoisyGL\predictor\Base_Predictor.py:144: UserWarning: Sparse CSR tensor support is in beta state. If you miss a functionality in the sparse tensor support, please submit a feature request to https://github.com/pytorch/pytorch/issues. (Triggered internally at ..\aten\src\ATen\SparseCsrTensorImpl.cpp:55.)
    self.adj_csr = self.adj.to_sparse_csr().to(self.device)
[I 2026-05-05 16:53:00,337] Trial 122 finished with value: 0.7683107109259508 and parameters: {'lr': 0.005, 'weight_decay': 0.0001, 'n_hidden': 128, 'n_layer': 3, 'dropout': 0.37185457683839257, 'knn_mode': 's', 'k': 48, 'dexp': 8.044976603038798, 'p_grd': 0.27551499371376126, 'unc_rem': 0.4480665373883756, 'unc_rel': 0.47870921818076717}. Best is trial 83 with value: 0.7836984276306947.
    [CPU] Loading dblp...
    DEBUG 3.1: Dataset init start
    DEBUG 3.2: prepare_data start dblp
    ----Data statistics------'
    Name: dblp
    #Nodes 17716
    #Edges 52867
    #Classes 4
    #Ave_degree 5.97
    ----Split statistics------'
    #Train samples 177 (1.0 % of nodes)
    #Val samples 2657 (15.0 % of nodes)
    #Test samples 14882 (remaining)
    ----label noise information:------
    Instance dependent noise
    #Actual noise rate 0.13
    [cuda:0] LNPCC waiting for GPU slot...
    [cuda:0] Slot acquired (waited 141.8s). Starting GCN...
    FINAL_RESULT: {'acc': {'train': 0.9152542372881356, 'valid': 0.6996612721114038, 'test': 0.7766429243381267}, 'wall_s': 43.99, 'cpu_s': 39.68, 'gpu_s': 4.25, 'wait_s': 141.76}
    [Time] wall=44.0s | cpu=39.7s | gpu=4.2s
    C:\Users\fbrev\Documents\Acadêmico\Simulações\Python\NoisyGL\predictor\Base_Predictor.py:114: UserWarning: expandable_segments not supported on this platform (Triggered internally at ..\c10/cuda/CUDAAllocatorConfig.h:28.)
    self.edge_index = self._cpu_edge_index.to(self.device)
    C:\Users\fbrev\Documents\Acadêmico\Simulações\Python\NoisyGL\predictor\Base_Predictor.py:144: UserWarning: Sparse CSR tensor support is in beta state. If you miss a functionality in the sparse tensor support, please submit a feature request to https://github.com/pytorch/pytorch/issues. (Triggered internally at ..\aten\src\ATen\SparseCsrTensorImpl.cpp:55.)
    self.adj_csr = self.adj.to_sparse_csr().to(self.device)
[I 2026-05-05 16:56:11,862] Trial 123 finished with value: 0.7766429243381267 and parameters: {'lr': 0.005, 'weight_decay': 0.0001, 'n_hidden': 128, 'n_layer': 3, 'dropout': 0.442399249568602, 'knn_mode': 's', 'k': 49, 'dexp': 8.692764975814478, 'p_grd': 0.2834605181802815, 'unc_rem': 0.3885484233297188, 'unc_rel': 0.4219023868591469}. Best is trial 83 with value: 0.7836984276306947.
    [CPU] Loading dblp...
    DEBUG 3.1: Dataset init start
    DEBUG 3.2: prepare_data start dblp
    ----Data statistics------'
    Name: dblp
    #Nodes 17716
    #Edges 52867
    #Classes 4
    #Ave_degree 5.97
    ----Split statistics------'
    #Train samples 177 (1.0 % of nodes)
    #Val samples 2657 (15.0 % of nodes)
    #Test samples 14882 (remaining)
    ----label noise information:------
    Instance dependent noise
    #Actual noise rate 0.13
    [cuda:0] LNPCC waiting for GPU slot...
    [cuda:0] Slot acquired (waited 142.2s). Starting GCN...
    FINAL_RESULT: {'acc': {'train': 0.9090909090909091, 'valid': 0.6947685359427926, 'test': 0.7703937642789948}, 'wall_s': 47.59, 'cpu_s': 43.06, 'gpu_s': 4.47, 'wait_s': 142.2}
    [Time] wall=47.6s | cpu=43.1s | gpu=4.5s
    C:\Users\fbrev\Documents\Acadêmico\Simulações\Python\NoisyGL\predictor\Base_Predictor.py:114: UserWarning: expandable_segments not supported on this platform (Triggered internally at ..\c10/cuda/CUDAAllocatorConfig.h:28.)
    self.edge_index = self._cpu_edge_index.to(self.device)
    C:\Users\fbrev\Documents\Acadêmico\Simulações\Python\NoisyGL\predictor\Base_Predictor.py:144: UserWarning: Sparse CSR tensor support is in beta state. If you miss a functionality in the sparse tensor support, please submit a feature request to https://github.com/pytorch/pytorch/issues. (Triggered internally at ..\aten\src\ATen\SparseCsrTensorImpl.cpp:55.)
    self.adj_csr = self.adj.to_sparse_csr().to(self.device)
[I 2026-05-05 16:59:27,535] Trial 124 finished with value: 0.7703937642789948 and parameters: {'lr': 0.005, 'weight_decay': 0.0001, 'n_hidden': 128, 'n_layer': 3, 'dropout': 0.43759955299441866, 'knn_mode': 's', 'k': 49, 'dexp': 9.15093206900511, 'p_grd': 0.32952233024794325, 'unc_rem': 0.39644736245344064, 'unc_rel': 0.41456278222768145}. Best is trial 83 with value: 0.7836984276306947.
    [CPU] Loading dblp...
    DEBUG 3.1: Dataset init start
    DEBUG 3.2: prepare_data start dblp
    ----Data statistics------'
    Name: dblp
    #Nodes 17716
    #Edges 52867
    #Classes 4
    #Ave_degree 5.97
    ----Split statistics------'
    #Train samples 177 (1.0 % of nodes)
    #Val samples 2657 (15.0 % of nodes)
    #Test samples 14882 (remaining)
    ----label noise information:------
    Instance dependent noise
    #Actual noise rate 0.13
    [cuda:0] LNPCC waiting for GPU slot...
    [cuda:0] Slot acquired (waited 145.0s). Starting GCN...
    FINAL_RESULT: {'acc': {'train': 0.9261363636363636, 'valid': 0.6793375987956342, 'test': 0.7540653138019083}, 'wall_s': 45.01, 'cpu_s': 40.6, 'gpu_s': 4.35, 'wait_s': 144.98}
    [Time] wall=45.0s | cpu=40.6s | gpu=4.3s
    C:\Users\fbrev\Documents\Acadêmico\Simulações\Python\NoisyGL\predictor\Base_Predictor.py:114: UserWarning: expandable_segments not supported on this platform (Triggered internally at ..\c10/cuda/CUDAAllocatorConfig.h:28.)
    self.edge_index = self._cpu_edge_index.to(self.device)
    C:\Users\fbrev\Documents\Acadêmico\Simulações\Python\NoisyGL\predictor\Base_Predictor.py:144: UserWarning: Sparse CSR tensor support is in beta state. If you miss a functionality in the sparse tensor support, please submit a feature request to https://github.com/pytorch/pytorch/issues. (Triggered internally at ..\aten\src\ATen\SparseCsrTensorImpl.cpp:55.)
    self.adj_csr = self.adj.to_sparse_csr().to(self.device)
