[I 2026-05-03 03:08:13,133] Trial 44 finished with value: 0.556838805477644 and parameters: {'lr': 0.005, 'weight_decay': 0.0001, 'n_hidden': 32, 'n_layer': 2, 'dropout': 0.1792885941074972, 'knn_mode': 'd', 'k': 39, 'dexp': 4.958636006272867, 'p_grd': 0.9271709553659961, 'unc_rem': 0.15143274161336462, 'unc_rel': 0.2832024950981181}. Best is trial 35 with value: 0.562943408678436.
    [CPU] Loading flickr...
    DEBUG 3.1: Dataset init start
    DEBUG 3.2: prepare_data start flickr
    ----Data statistics------'
    Name: flickr
    #Nodes 7575
    #Edges 239738
    #Classes 9
    #Ave_degree 63.30
    ----Split statistics------'
    #Train samples 378 (5.0 % of nodes)
    #Val samples 1136 (15.0 % of nodes)
    #Test samples 6061 (remaining)
    ----label noise information:------
    Instance dependent noise
    #Actual noise rate 0.20
    [cuda:0] LNPCC waiting for GPU slot...
    [cuda:0] Slot acquired (waited 105.4s). Starting GCN...
    FINAL_RESULT: {'acc': {'train': 0.129973474801061, 'valid': 0.1382042253521127, 'test': 0.14007589506682067}, 'wall_s': 276.39, 'cpu_s': 270.86, 'gpu_s': 5.26, 'wait_s': 105.43}
    [Time] wall=276.4s | cpu=270.9s | gpu=5.3s
    C:\Users\fbrev\anaconda3\envs\noisygl\Lib\site-packages\torch\_utils.py:315: UserWarning: Sparse CSR tensor support is in beta state. If you miss a functionality in the sparse tensor support, please submit a feature request to https://github.com/pytorch/pytorch/issues. (Triggered internally at ..\aten\src\ATen\SparseCsrTensorImpl.cpp:55.)
    result = torch.sparse_compressed_tensor(
    C:\Users\fbrev\Documents\Acadêmico\Simulações\Python\NoisyGL\predictor\Base_Predictor.py:114: UserWarning: expandable_segments not supported on this platform (Triggered internally at ..\c10/cuda/CUDAAllocatorConfig.h:28.)
    self.edge_index = self._cpu_edge_index.to(self.device)
[I 2026-05-03 03:14:40,328] Trial 45 finished with value: 0.14007589506682067 and parameters: {'lr': 0.005, 'weight_decay': 0.05, 'n_hidden': 128, 'n_layer': 2, 'dropout': 0.18226561611553363, 'knn_mode': 'd', 'k': 35, 'dexp': 5.257899420130487, 'p_grd': 0.9522732302854597, 'unc_rem': 0.1817882670103624, 'unc_rel': 0.1959375912766778}. Best is trial 35 with value: 0.562943408678436.
    [CPU] Loading flickr...
    DEBUG 3.1: Dataset init start
    DEBUG 3.2: prepare_data start flickr
    ----Data statistics------'
    Name: flickr
    #Nodes 7575
    #Edges 239738
    #Classes 9
    #Ave_degree 63.30
    ----Split statistics------'
    #Train samples 378 (5.0 % of nodes)
    #Val samples 1136 (15.0 % of nodes)
    #Test samples 6061 (remaining)
    ----label noise information:------
    Instance dependent noise
    #Actual noise rate 0.20
    [cuda:0] LNPCC waiting for GPU slot...
    [cuda:0] Slot acquired (waited 103.3s). Starting GCN...
    FINAL_RESULT: {'acc': {'train': 0.7962962962962963, 'valid': 0.4533450704225352, 'test': 0.5540339877907936}, 'wall_s': 271.52, 'cpu_s': 268.33, 'gpu_s': 2.92, 'wait_s': 103.31}
    [Time] wall=271.5s | cpu=268.3s | gpu=2.9s
    C:\Users\fbrev\anaconda3\envs\noisygl\Lib\site-packages\torch\_utils.py:315: UserWarning: Sparse CSR tensor support is in beta state. If you miss a functionality in the sparse tensor support, please submit a feature request to https://github.com/pytorch/pytorch/issues. (Triggered internally at ..\aten\src\ATen\SparseCsrTensorImpl.cpp:55.)
    result = torch.sparse_compressed_tensor(
    C:\Users\fbrev\Documents\Acadêmico\Simulações\Python\NoisyGL\predictor\Base_Predictor.py:114: UserWarning: expandable_segments not supported on this platform (Triggered internally at ..\c10/cuda/CUDAAllocatorConfig.h:28.)
    self.edge_index = self._cpu_edge_index.to(self.device)
[I 2026-05-03 03:21:00,365] Trial 46 finished with value: 0.5540339877907936 and parameters: {'lr': 0.005, 'weight_decay': 0.0001, 'n_hidden': 32, 'n_layer': 2, 'dropout': 0.16597879896082257, 'knn_mode': 'd', 'k': 39, 'dexp': 4.946889821611011, 'p_grd': 0.9243830563356741, 'unc_rem': 0.1497259001762975, 'unc_rel': 0.2699404720382281}. Best is trial 35 with value: 0.562943408678436.
    [CPU] Loading flickr...
    DEBUG 3.1: Dataset init start
    DEBUG 3.2: prepare_data start flickr
    ----Data statistics------'
    Name: flickr
    #Nodes 7575
    #Edges 239738
    #Classes 9
    #Ave_degree 63.30
    ----Split statistics------'
    #Train samples 378 (5.0 % of nodes)
    #Val samples 1136 (15.0 % of nodes)
    #Test samples 6061 (remaining)
    ----label noise information:------
    Instance dependent noise
    #Actual noise rate 0.20
    [cuda:0] LNPCC waiting for GPU slot...
    [cuda:0] Slot acquired (waited 75.0s). Starting GCN...
    FINAL_RESULT: {'acc': {'train': 0.9964028776978417, 'valid': 0.3028169014084507, 'test': 0.3388879722818017}, 'wall_s': 43.73, 'cpu_s': 40.53, 'gpu_s': 2.96, 'wait_s': 74.96}
    [Time] wall=43.7s | cpu=40.5s | gpu=3.0s
    C:\Users\fbrev\anaconda3\envs\noisygl\Lib\site-packages\torch\_utils.py:315: UserWarning: Sparse CSR tensor support is in beta state. If you miss a functionality in the sparse tensor support, please submit a feature request to https://github.com/pytorch/pytorch/issues. (Triggered internally at ..\aten\src\ATen\SparseCsrTensorImpl.cpp:55.)
    result = torch.sparse_compressed_tensor(
    C:\Users\fbrev\Documents\Acadêmico\Simulações\Python\NoisyGL\predictor\Base_Predictor.py:114: UserWarning: expandable_segments not supported on this platform (Triggered internally at ..\c10/cuda/CUDAAllocatorConfig.h:28.)
    self.edge_index = self._cpu_edge_index.to(self.device)
[I 2026-05-03 03:23:04,054] Trial 47 finished with value: 0.3388879722818017 and parameters: {'lr': 0.005, 'weight_decay': 0.0, 'n_hidden': 32, 'n_layer': 2, 'dropout': 0.10868460169682798, 'knn_mode': 'd', 'k': 43, 'dexp': 3.9834149006843953, 'p_grd': 0.07086383282630865, 'unc_rem': 0.2543366343455432, 'unc_rel': 0.33085450835983926}. Best is trial 35 with value: 0.562943408678436.
    [CPU] Loading flickr...
    DEBUG 3.1: Dataset init start
    DEBUG 3.2: prepare_data start flickr
    ----Data statistics------'
    Name: flickr
    #Nodes 7575
    #Edges 239738
    #Classes 9
    #Ave_degree 63.30
    ----Split statistics------'
    #Train samples 378 (5.0 % of nodes)
    #Val samples 1136 (15.0 % of nodes)
    #Test samples 6061 (remaining)
    ----label noise information:------
    Instance dependent noise
    #Actual noise rate 0.20
    [cuda:0] LNPCC waiting for GPU slot...
    [cuda:0] Slot acquired (waited 80.8s). Starting GCN...
    FINAL_RESULT: {'acc': {'train': 0.15079365079365079, 'valid': 0.136443661971831, 'test': 0.1536050156739812}, 'wall_s': 171.44, 'cpu_s': 167.47, 'gpu_s': 3.75, 'wait_s': 80.76}
    [Time] wall=171.4s | cpu=167.5s | gpu=3.7s
    C:\Users\fbrev\anaconda3\envs\noisygl\Lib\site-packages\torch\_utils.py:315: UserWarning: Sparse CSR tensor support is in beta state. If you miss a functionality in the sparse tensor support, please submit a feature request to https://github.com/pytorch/pytorch/issues. (Triggered internally at ..\aten\src\ATen\SparseCsrTensorImpl.cpp:55.)
    result = torch.sparse_compressed_tensor(
    C:\Users\fbrev\Documents\Acadêmico\Simulações\Python\NoisyGL\predictor\Base_Predictor.py:114: UserWarning: expandable_segments not supported on this platform (Triggered internally at ..\c10/cuda/CUDAAllocatorConfig.h:28.)
    self.edge_index = self._cpu_edge_index.to(self.device)
[I 2026-05-03 03:27:21,073] Trial 48 finished with value: 0.1536050156739812 and parameters: {'lr': 0.1, 'weight_decay': 0.01, 'n_hidden': 64, 'n_layer': 2, 'dropout': 0.20283513147333698, 'knn_mode': 'd', 'k': 48, 'dexp': 3.6251785366526623, 'p_grd': 0.7029038844634862, 'unc_rem': 0.12204051847075824, 'unc_rel': 0.23570852885582175}. Best is trial 35 with value: 0.562943408678436.
    [CPU] Loading flickr...
    DEBUG 3.1: Dataset init start
    DEBUG 3.2: prepare_data start flickr
    ----Data statistics------'
    Name: flickr
    #Nodes 7575
    #Edges 239738
    #Classes 9
    #Ave_degree 63.30
    ----Split statistics------'
    #Train samples 378 (5.0 % of nodes)
    #Val samples 1136 (15.0 % of nodes)
    #Test samples 6061 (remaining)
    ----label noise information:------
    Instance dependent noise
    #Actual noise rate 0.20
    [cuda:0] LNPCC waiting for GPU slot...
    [cuda:0] Slot acquired (waited 90.2s). Starting GCN...
    FINAL_RESULT: {'acc': {'train': 0.8386243386243386, 'valid': 0.44630281690140844, 'test': 0.5447945883517571}, 'wall_s': 159.55, 'cpu_s': 150.38, 'gpu_s': 8.92, 'wait_s': 90.18}
    [Time] wall=159.5s | cpu=150.4s | gpu=8.9s
    C:\Users\fbrev\anaconda3\envs\noisygl\Lib\site-packages\torch\_utils.py:315: UserWarning: Sparse CSR tensor support is in beta state. If you miss a functionality in the sparse tensor support, please submit a feature request to https://github.com/pytorch/pytorch/issues. (Triggered internally at ..\aten\src\ATen\SparseCsrTensorImpl.cpp:55.)
    result = torch.sparse_compressed_tensor(
    C:\Users\fbrev\Documents\Acadêmico\Simulações\Python\NoisyGL\predictor\Base_Predictor.py:114: UserWarning: expandable_segments not supported on this platform (Triggered internally at ..\c10/cuda/CUDAAllocatorConfig.h:28.)
    self.edge_index = self._cpu_edge_index.to(self.device)
