[I 2026-05-10 21:50:30,558] Trial 138 finished with value: 0.3068394925537783 and parameters: {'lr': 0.001, 'weight_decay': 0.0001, 'n_hidden': 32, 'n_layer': 2, 'dropout': 0.5970785803131602, 'knn_mode': 'd', 'k': 25, 'dexp': 7.542013706938136, 'p_grd': 0.27084539272213437, 'unc_rem': 0.16840633290198573, 'unc_rel': 0.4858817274378959}. Best is trial 102 with value: 0.4013789299503585.
    [CPU] Loading roman-empire...
    DEBUG 3.1: Dataset init start
    DEBUG 3.2: prepare_data start roman-empire
    ----Data statistics------'
    Name: roman-empire
    #Nodes 22662
    #Edges 32927
    #Classes 18
    #Ave_degree 2.91
    ----Split statistics------'
    #Train samples 1133 (5.0 % of nodes)
    #Val samples 3399 (15.0 % of nodes)
    #Test samples 18130 (remaining)
    ----label noise information:------
    Instance dependent noise
    #Actual noise rate 0.20
    [cuda:1] LNPCC waiting for GPU slot...
    [cuda:1] Slot acquired (waited 0.0s). Starting GCN...
    FINAL_RESULT: {'acc': {'train': 0.3704379562043796, 'valid': 0.3021476904972051, 'test': 0.36674020959735243}, 'wall_s': 221.5, 'cpu_s': 219.11, 'gpu_s': 2.33, 'wait_s': 0.0}
    [Time] wall=221.5s | cpu=219.1s | gpu=2.3s
    C:\Users\fbrev\Documents\Acadêmico\Simulações\Python\NoisyGL\predictor\Base_Predictor.py:114: UserWarning: expandable_segments not supported on this platform (Triggered internally at ..\c10/cuda/CUDAAllocatorConfig.h:28.)
    self.edge_index = self._cpu_edge_index.to(self.device)
    C:\Users\fbrev\Documents\Acadêmico\Simulações\Python\NoisyGL\predictor\Base_Predictor.py:144: UserWarning: Sparse CSR tensor support is in beta state. If you miss a functionality in the sparse tensor support, please submit a feature request to https://github.com/pytorch/pytorch/issues. (Triggered internally at ..\aten\src\ATen\SparseCsrTensorImpl.cpp:55.)
    self.adj_csr = self.adj.to_sparse_csr().to(self.device)
[I 2026-05-10 21:54:18,123] Trial 140 finished with value: 0.36674020959735243 and parameters: {'lr': 0.005, 'weight_decay': 0.001, 'n_hidden': 32, 'n_layer': 2, 'dropout': 0.6889977211935618, 'knn_mode': 'd', 'k': 30, 'dexp': 6.6694562890574485, 'p_grd': 0.30758122791019094, 'unc_rem': 0.14378325271365, 'unc_rel': 0.5352478447513389}. Best is trial 102 with value: 0.4013789299503585.
    [CPU] Loading roman-empire...
    DEBUG 3.1: Dataset init start
    DEBUG 3.2: prepare_data start roman-empire
    ----Data statistics------'
    Name: roman-empire
    #Nodes 22662
    #Edges 32927
    #Classes 18
    #Ave_degree 2.91
    ----Split statistics------'
    #Train samples 1133 (5.0 % of nodes)
    #Val samples 3399 (15.0 % of nodes)
    #Test samples 18130 (remaining)
    ----label noise information:------
    Instance dependent noise
    #Actual noise rate 0.20
    [cuda:1] LNPCC waiting for GPU slot...
    [cuda:1] Slot acquired (waited 0.0s). Starting GCN...
    FINAL_RESULT: {'acc': {'train': 0.432, 'valid': 0.32068255369226245, 'test': 0.3864864864864865}, 'wall_s': 286.91, 'cpu_s': 284.34, 'gpu_s': 2.51, 'wait_s': 0.0}
    [Time] wall=286.9s | cpu=284.3s | gpu=2.5s
    C:\Users\fbrev\Documents\Acadêmico\Simulações\Python\NoisyGL\predictor\Base_Predictor.py:114: UserWarning: expandable_segments not supported on this platform (Triggered internally at ..\c10/cuda/CUDAAllocatorConfig.h:28.)
    self.edge_index = self._cpu_edge_index.to(self.device)
    C:\Users\fbrev\Documents\Acadêmico\Simulações\Python\NoisyGL\predictor\Base_Predictor.py:144: UserWarning: Sparse CSR tensor support is in beta state. If you miss a functionality in the sparse tensor support, please submit a feature request to https://github.com/pytorch/pytorch/issues. (Triggered internally at ..\aten\src\ATen\SparseCsrTensorImpl.cpp:55.)
    self.adj_csr = self.adj.to_sparse_csr().to(self.device)
[I 2026-05-10 21:59:10,888] Trial 142 finished with value: 0.3864864864864865 and parameters: {'lr': 0.1, 'weight_decay': 0.001, 'n_hidden': 32, 'n_layer': 2, 'dropout': 0.6560602047939287, 'knn_mode': 'd', 'k': 39, 'dexp': 6.492667613467058, 'p_grd': 0.3661437623114609, 'unc_rem': 0.29487425760284613, 'unc_rel': 0.5162506654414502}. Best is trial 102 with value: 0.4013789299503585.
    [CPU] Loading roman-empire...
    DEBUG 3.1: Dataset init start
    DEBUG 3.2: prepare_data start roman-empire
    ----Data statistics------'
    Name: roman-empire
    #Nodes 22662
    #Edges 32927
    #Classes 18
    #Ave_degree 2.91
    ----Split statistics------'
    #Train samples 1133 (5.0 % of nodes)
    #Val samples 3399 (15.0 % of nodes)
    #Test samples 18130 (remaining)
    ----label noise information:------
    Instance dependent noise
    #Actual noise rate 0.20
    [cuda:1] LNPCC waiting for GPU slot...
    [cuda:1] Slot acquired (waited 0.0s). Starting GCN...
    FINAL_RESULT: {'acc': {'train': 0.44275491949910556, 'valid': 0.31509267431597526, 'test': 0.38952013237727523}, 'wall_s': 168.75, 'cpu_s': 166.1, 'gpu_s': 2.6, 'wait_s': 0.0}
    [Time] wall=168.8s | cpu=166.1s | gpu=2.6s
    C:\Users\fbrev\Documents\Acadêmico\Simulações\Python\NoisyGL\predictor\Base_Predictor.py:114: UserWarning: expandable_segments not supported on this platform (Triggered internally at ..\c10/cuda/CUDAAllocatorConfig.h:28.)
    self.edge_index = self._cpu_edge_index.to(self.device)
    C:\Users\fbrev\Documents\Acadêmico\Simulações\Python\NoisyGL\predictor\Base_Predictor.py:144: UserWarning: Sparse CSR tensor support is in beta state. If you miss a functionality in the sparse tensor support, please submit a feature request to https://github.com/pytorch/pytorch/issues. (Triggered internally at ..\aten\src\ATen\SparseCsrTensorImpl.cpp:55.)
    self.adj_csr = self.adj.to_sparse_csr().to(self.device)
[I 2026-05-10 22:02:06,297] Trial 144 finished with value: 0.38952013237727523 and parameters: {'lr': 0.1, 'weight_decay': 0.001, 'n_hidden': 32, 'n_layer': 2, 'dropout': 0.6673525657996235, 'knn_mode': 'd', 'k': 12, 'dexp': 6.3395142795196815, 'p_grd': 0.348453963446286, 'unc_rem': 0.33128319996014116, 'unc_rel': 0.5601116081618317}. Best is trial 102 with value: 0.4013789299503585.
    [CPU] Loading roman-empire...
    DEBUG 3.1: Dataset init start
    DEBUG 3.2: prepare_data start roman-empire
    ----Data statistics------'
    Name: roman-empire
    #Nodes 22662
    #Edges 32927
    #Classes 18
    #Ave_degree 2.91
    ----Split statistics------'
    #Train samples 1133 (5.0 % of nodes)
    #Val samples 3399 (15.0 % of nodes)
    #Test samples 18130 (remaining)
    ----label noise information:------
    Instance dependent noise
    #Actual noise rate 0.20
    [cuda:1] LNPCC waiting for GPU slot...
    [cuda:1] Slot acquired (waited 0.0s). Starting GCN...
    FINAL_RESULT: {'acc': {'train': 0.38761061946902653, 'valid': 0.323036187113857, 'test': 0.3901820187534473}, 'wall_s': 343.89, 'cpu_s': 341.52, 'gpu_s': 2.3, 'wait_s': 0.0}
    [Time] wall=343.9s | cpu=341.5s | gpu=2.3s
    C:\Users\fbrev\Documents\Acadêmico\Simulações\Python\NoisyGL\predictor\Base_Predictor.py:114: UserWarning: expandable_segments not supported on this platform (Triggered internally at ..\c10/cuda/CUDAAllocatorConfig.h:28.)
    self.edge_index = self._cpu_edge_index.to(self.device)
    C:\Users\fbrev\Documents\Acadêmico\Simulações\Python\NoisyGL\predictor\Base_Predictor.py:144: UserWarning: Sparse CSR tensor support is in beta state. If you miss a functionality in the sparse tensor support, please submit a feature request to https://github.com/pytorch/pytorch/issues. (Triggered internally at ..\aten\src\ATen\SparseCsrTensorImpl.cpp:55.)
    self.adj_csr = self.adj.to_sparse_csr().to(self.device)
[I 2026-05-10 22:07:56,398] Trial 146 finished with value: 0.3901820187534473 and parameters: {'lr': 0.1, 'weight_decay': 0.001, 'n_hidden': 32, 'n_layer': 2, 'dropout': 0.7295307808270755, 'knn_mode': 'd', 'k': 38, 'dexp': 4.939262261665569, 'p_grd': 0.4119165671010482, 'unc_rem': 0.9810557176666994, 'unc_rel': 0.5855372158357829}. Best is trial 102 with value: 0.4013789299503585.
    [CPU] Loading roman-empire...
    DEBUG 3.1: Dataset init start
    DEBUG 3.2: prepare_data start roman-empire
    ----Data statistics------'
    Name: roman-empire
    #Nodes 22662
    #Edges 32927
    #Classes 18
    #Ave_degree 2.91
    ----Split statistics------'
    #Train samples 1133 (5.0 % of nodes)
    #Val samples 3399 (15.0 % of nodes)
    #Test samples 18130 (remaining)
    ----label noise information:------
    Instance dependent noise
    #Actual noise rate 0.20
    [cuda:1] LNPCC waiting for GPU slot...
    [cuda:1] Slot acquired (waited 0.0s). Starting GCN...
    FINAL_RESULT: {'acc': {'train': 0.4725663716814159, 'valid': 0.3192115328037658, 'test': 0.3862658576944291}, 'wall_s': 399.85, 'cpu_s': 396.79, 'gpu_s': 3.01, 'wait_s': 0.0}
    [Time] wall=399.9s | cpu=396.8s | gpu=3.0s
    C:\Users\fbrev\Documents\Acadêmico\Simulações\Python\NoisyGL\predictor\Base_Predictor.py:114: UserWarning: expandable_segments not supported on this platform (Triggered internally at ..\c10/cuda/CUDAAllocatorConfig.h:28.)
    self.edge_index = self._cpu_edge_index.to(self.device)
    C:\Users\fbrev\Documents\Acadêmico\Simulações\Python\NoisyGL\predictor\Base_Predictor.py:144: UserWarning: Sparse CSR tensor support is in beta state. If you miss a functionality in the sparse tensor support, please submit a feature request to https://github.com/pytorch/pytorch/issues. (Triggered internally at ..\aten\src\ATen\SparseCsrTensorImpl.cpp:55.)
    self.adj_csr = self.adj.to_sparse_csr().to(self.device)
[I 2026-05-10 22:14:42,403] Trial 147 finished with value: 0.3862658576944291 and parameters: {'lr': 0.1, 'weight_decay': 0.001, 'n_hidden': 128, 'n_layer': 2, 'dropout': 0.6271937228085186, 'knn_mode': 'd', 'k': 36, 'dexp': 7.047768391811778, 'p_grd': 0.5608939288950571, 'unc_rem': 0.2449360256867497, 'unc_rel': 0.640364350827825}. Best is trial 102 with value: 0.4013789299503585.
    [CPU] Loading roman-empire...
    DEBUG 3.1: Dataset init start
    DEBUG 3.2: prepare_data start roman-empire
    ----Data statistics------'
    Name: roman-empire
    #Nodes 22662
    #Edges 32927
    #Classes 18
    #Ave_degree 2.91
    ----Split statistics------'
    #Train samples 1133 (5.0 % of nodes)
    #Val samples 3399 (15.0 % of nodes)
    #Test samples 18130 (remaining)
    ----label noise information:------
    Instance dependent noise
    #Actual noise rate 0.20
    [cuda:1] LNPCC waiting for GPU slot...
    [cuda:1] Slot acquired (waited 0.0s). Starting GCN...
    FINAL_RESULT: {'acc': {'train': 0.41984056687333926, 'valid': 0.3200941453368638, 'test': 0.39034749034749033}, 'wall_s': 235.21, 'cpu_s': 232.91, 'gpu_s': 2.25, 'wait_s': 0.0}
    [Time] wall=235.2s | cpu=232.9s | gpu=2.3s
    C:\Users\fbrev\Documents\Acadêmico\Simulações\Python\NoisyGL\predictor\Base_Predictor.py:114: UserWarning: expandable_segments not supported on this platform (Triggered internally at ..\c10/cuda/CUDAAllocatorConfig.h:28.)
    self.edge_index = self._cpu_edge_index.to(self.device)
    C:\Users\fbrev\Documents\Acadêmico\Simulações\Python\NoisyGL\predictor\Base_Predictor.py:144: UserWarning: Sparse CSR tensor support is in beta state. If you miss a functionality in the sparse tensor support, please submit a feature request to https://github.com/pytorch/pytorch/issues. (Triggered internally at ..\aten\src\ATen\SparseCsrTensorImpl.cpp:55.)
    self.adj_csr = self.adj.to_sparse_csr().to(self.device)
[I 2026-05-10 22:18:43,624] Trial 148 finished with value: 0.39034749034749033 and parameters: {'lr': 0.1, 'weight_decay': 0.001, 'n_hidden': 32, 'n_layer': 2, 'dropout': 0.6991853004994683, 'knn_mode': 'd', 'k': 23, 'dexp': 5.91890633968229, 'p_grd': 0.47088354159900503, 'unc_rem': 0.2756406780249613, 'unc_rel': 0.5430142423199161}. Best is trial 102 with value: 0.4013789299503585.
    [CPU] Loading roman-empire...
    DEBUG 3.1: Dataset init start
    DEBUG 3.2: prepare_data start roman-empire
    ----Data statistics------'
    Name: roman-empire
    #Nodes 22662
    #Edges 32927
    #Classes 18
    #Ave_degree 2.91
    ----Split statistics------'
    #Train samples 1133 (5.0 % of nodes)
    #Val samples 3399 (15.0 % of nodes)
    #Test samples 18130 (remaining)
    ----label noise information:------
    Instance dependent noise
    #Actual noise rate 0.20
    [cuda:1] LNPCC waiting for GPU slot...
    [cuda:1] Slot acquired (waited 0.0s). Starting GCN...
    FINAL_RESULT: {'acc': {'train': 0.5502222222222222, 'valid': 0.32244777875845837, 'test': 0.3913403199117485}, 'wall_s': 217.75, 'cpu_s': 215.22, 'gpu_s': 2.48, 'wait_s': 0.0}
    [Time] wall=217.8s | cpu=215.2s | gpu=2.5s
    C:\Users\fbrev\Documents\Acadêmico\Simulações\Python\NoisyGL\predictor\Base_Predictor.py:114: UserWarning: expandable_segments not supported on this platform (Triggered internally at ..\c10/cuda/CUDAAllocatorConfig.h:28.)
    self.edge_index = self._cpu_edge_index.to(self.device)
    C:\Users\fbrev\Documents\Acadêmico\Simulações\Python\NoisyGL\predictor\Base_Predictor.py:144: UserWarning: Sparse CSR tensor support is in beta state. If you miss a functionality in the sparse tensor support, please submit a feature request to https://github.com/pytorch/pytorch/issues. (Triggered internally at ..\aten\src\ATen\SparseCsrTensorImpl.cpp:55.)
    self.adj_csr = self.adj.to_sparse_csr().to(self.device)
