[worker] START lnpcc_amazon-ratings_0.1 gpu=0
[HPO] Starting Phase 1 (Optuna) for lnpcc_amazon-ratings_instance_0.1...
[I 2026-04-27 13:20:14,786] Using an existing study with name 'lnpcc_amazon-ratings_instance_0.1' instead of creating a new one.
    [CPU] Loading amazon-ratings...
    DEBUG 3.1: Dataset init start
    DEBUG 3.2: prepare_data start amazon-ratings
    ----Data statistics------'
    Name: amazon-ratings
    #Nodes 24492
    #Edges 93050
    #Classes 5
    #Ave_degree 7.60
    ----Split statistics------'
    #Train samples 1224 (5.0 % of nodes)
    #Val samples 3673 (15.0 % of nodes)
    #Test samples 19595 (remaining)
    ----label noise information:------
    Instance dependent noise
    #Actual noise rate 0.13
    [cuda:0] LNPCC waiting for GPU slot...
    [cuda:0] Slot acquired (waited 199.4s). Starting GCN...
    FINAL_RESULT: {'acc': {'train': 0.4117647058823529, 'valid': 0.35638442689899263, 'test': 0.3869354427149783}, 'wall_s': 55.0, 'cpu_s': 50.66, 'gpu_s': 4.23, 'wait_s': 199.37}
    [Time] wall=55.0s | cpu=50.7s | gpu=4.2s
    C:\Users\fbrev\Documents\Acadêmico\Simulações\Python\NoisyGL\predictor\Base_Predictor.py:144: UserWarning: Sparse CSR tensor support is in beta state. If you miss a functionality in the sparse tensor support, please submit a feature request to https://github.com/pytorch/pytorch/issues. (Triggered internally at ..\aten\src\ATen\SparseCsrTensorImpl.cpp:55.)
    self.adj_csr = self.adj.to_sparse_csr().to(self.device)
[I 2026-04-27 13:24:38,173] Trial 111 finished with value: 0.3869354427149783 and parameters: {'lr': 0.1, 'weight_decay': 0.0001, 'n_hidden': 64, 'n_layer': 3, 'dropout': 0.6857524161165134, 'knn_mode': 's', 'k': 45, 'dexp': 7.913370986957897, 'p_grd': 0.4366193960465372, 'unc_rem': 0.14645263168964837, 'unc_rel': 0.5884627972051806}. Best is trial 29 with value: 0.40505230926256697.
    [CPU] Loading amazon-ratings...
    DEBUG 3.1: Dataset init start
    DEBUG 3.2: prepare_data start amazon-ratings
    ----Data statistics------'
    Name: amazon-ratings
    #Nodes 24492
    #Edges 93050
    #Classes 5
    #Ave_degree 7.60
    ----Split statistics------'
    #Train samples 1224 (5.0 % of nodes)
    #Val samples 3673 (15.0 % of nodes)
    #Test samples 19595 (remaining)
    ----label noise information:------
    Instance dependent noise
    #Actual noise rate 0.13
    [cuda:0] LNPCC waiting for GPU slot...
    [cuda:0] Slot acquired (waited 177.0s). Starting GCN...
    FINAL_RESULT: {'acc': {'train': 0.4338235294117647, 'valid': 0.36319085216444325, 'test': 0.3961214595560092}, 'wall_s': 74.63, 'cpu_s': 70.46, 'gpu_s': 4.12, 'wait_s': 177.05}
    [Time] wall=74.6s | cpu=70.5s | gpu=4.1s
    C:\Users\fbrev\Documents\Acadêmico\Simulações\Python\NoisyGL\predictor\Base_Predictor.py:144: UserWarning: Sparse CSR tensor support is in beta state. If you miss a functionality in the sparse tensor support, please submit a feature request to https://github.com/pytorch/pytorch/issues. (Triggered internally at ..\aten\src\ATen\SparseCsrTensorImpl.cpp:55.)
    self.adj_csr = self.adj.to_sparse_csr().to(self.device)
[I 2026-04-27 13:28:57,125] Trial 112 finished with value: 0.3961214595560092 and parameters: {'lr': 0.001, 'weight_decay': 0.001, 'n_hidden': 64, 'n_layer': 3, 'dropout': 0.40551629889361834, 'knn_mode': 's', 'k': 38, 'dexp': 7.764927555187233, 'p_grd': 0.6159137146472271, 'unc_rem': 0.9386424351631352, 'unc_rel': 0.7711065715172467}. Best is trial 29 with value: 0.40505230926256697.
    [CPU] Loading amazon-ratings...
    DEBUG 3.1: Dataset init start
    DEBUG 3.2: prepare_data start amazon-ratings
    ----Data statistics------'
    Name: amazon-ratings
    #Nodes 24492
    #Edges 93050
    #Classes 5
    #Ave_degree 7.60
    ----Split statistics------'
    #Train samples 1224 (5.0 % of nodes)
    #Val samples 3673 (15.0 % of nodes)
    #Test samples 19595 (remaining)
    ----label noise information:------
    Instance dependent noise
    #Actual noise rate 0.13
    [cuda:0] LNPCC waiting for GPU slot...
    [cuda:0] Slot acquired (waited 218.4s). Starting GCN...
    FINAL_RESULT: {'acc': {'train': 0.36631234668847096, 'valid': 0.35638442689899263, 'test': 0.3792293952538913}, 'wall_s': 63.54, 'cpu_s': 59.23, 'gpu_s': 4.25, 'wait_s': 218.45}
    [Time] wall=63.5s | cpu=59.2s | gpu=4.3s
    C:\Users\fbrev\Documents\Acadêmico\Simulações\Python\NoisyGL\predictor\Base_Predictor.py:144: UserWarning: Sparse CSR tensor support is in beta state. If you miss a functionality in the sparse tensor support, please submit a feature request to https://github.com/pytorch/pytorch/issues. (Triggered internally at ..\aten\src\ATen\SparseCsrTensorImpl.cpp:55.)
    self.adj_csr = self.adj.to_sparse_csr().to(self.device)
[I 2026-04-27 13:33:47,530] Trial 113 finished with value: 0.3792293952538913 and parameters: {'lr': 0.1, 'weight_decay': 0.001, 'n_hidden': 64, 'n_layer': 3, 'dropout': 0.7648385242265733, 'knn_mode': 's', 'k': 47, 'dexp': 3.741101036764663, 'p_grd': 0.4851778255697917, 'unc_rem': 0.848551500501356, 'unc_rel': 0.6201166875334572}. Best is trial 29 with value: 0.40505230926256697.
    [CPU] Loading amazon-ratings...
    DEBUG 3.1: Dataset init start
    DEBUG 3.2: prepare_data start amazon-ratings
    ----Data statistics------'
    Name: amazon-ratings
    #Nodes 24492
    #Edges 93050
    #Classes 5
    #Ave_degree 7.60
    ----Split statistics------'
    #Train samples 1224 (5.0 % of nodes)
    #Val samples 3673 (15.0 % of nodes)
    #Test samples 19595 (remaining)
    ----label noise information:------
    Instance dependent noise
    #Actual noise rate 0.13
    [cuda:0] LNPCC waiting for GPU slot...
    [cuda:0] Slot acquired (waited 699.6s). Starting GCN...
    FINAL_RESULT: {'acc': {'train': 0.40522875816993464, 'valid': 0.36373536618567925, 'test': 0.4019392702219954}, 'wall_s': 58.28, 'cpu_s': 54.17, 'gpu_s': 4.05, 'wait_s': 699.56}
    [Time] wall=58.3s | cpu=54.2s | gpu=4.1s
    C:\Users\fbrev\Documents\Acadêmico\Simulações\Python\NoisyGL\predictor\Base_Predictor.py:144: UserWarning: Sparse CSR tensor support is in beta state. If you miss a functionality in the sparse tensor support, please submit a feature request to https://github.com/pytorch/pytorch/issues. (Triggered internally at ..\aten\src\ATen\SparseCsrTensorImpl.cpp:55.)
    self.adj_csr = self.adj.to_sparse_csr().to(self.device)
[I 2026-04-27 13:46:32,943] Trial 114 finished with value: 0.4019392702219954 and parameters: {'lr': 0.1, 'weight_decay': 0.001, 'n_hidden': 64, 'n_layer': 3, 'dropout': 0.7192048569105968, 'knn_mode': 's', 'k': 44, 'dexp': 8.314276128819559, 'p_grd': 0.4759111946355921, 'unc_rem': 0.881455928871813, 'unc_rel': 0.6675847157357665}. Best is trial 29 with value: 0.40505230926256697.
    [CPU] Loading amazon-ratings...
    DEBUG 3.1: Dataset init start
    DEBUG 3.2: prepare_data start amazon-ratings
    ----Data statistics------'
    Name: amazon-ratings
    #Nodes 24492
    #Edges 93050
    #Classes 5
    #Ave_degree 7.60
    ----Split statistics------'
    #Train samples 1224 (5.0 % of nodes)
    #Val samples 3673 (15.0 % of nodes)
    #Test samples 19595 (remaining)
    ----label noise information:------
    Instance dependent noise
    #Actual noise rate 0.13
    [cuda:0] LNPCC waiting for GPU slot...
    [cuda:0] Slot acquired (waited 199.8s). Starting GCN...
    FINAL_RESULT: {'acc': {'train': 0.37336601307189543, 'valid': 0.3626463381432072, 'test': 0.39724419494769075}, 'wall_s': 57.29, 'cpu_s': 53.21, 'gpu_s': 4.03, 'wait_s': 199.75}
    [Time] wall=57.3s | cpu=53.2s | gpu=4.0s
    C:\Users\fbrev\Documents\Acadêmico\Simulações\Python\NoisyGL\predictor\Base_Predictor.py:144: UserWarning: Sparse CSR tensor support is in beta state. If you miss a functionality in the sparse tensor support, please submit a feature request to https://github.com/pytorch/pytorch/issues. (Triggered internally at ..\aten\src\ATen\SparseCsrTensorImpl.cpp:55.)
    self.adj_csr = self.adj.to_sparse_csr().to(self.device)
[I 2026-04-27 13:50:56,685] Trial 115 finished with value: 0.39724419494769075 and parameters: {'lr': 0.1, 'weight_decay': 0.001, 'n_hidden': 64, 'n_layer': 3, 'dropout': 0.7081767403895639, 'knn_mode': 's', 'k': 42, 'dexp': 8.431058487817433, 'p_grd': 0.5171808124654191, 'unc_rem': 0.7844893853221119, 'unc_rel': 0.6704342295636375}. Best is trial 29 with value: 0.40505230926256697.
    [CPU] Loading amazon-ratings...
    DEBUG 3.1: Dataset init start
    DEBUG 3.2: prepare_data start amazon-ratings
    ----Data statistics------'
    Name: amazon-ratings
    #Nodes 24492
    #Edges 93050
    #Classes 5
    #Ave_degree 7.60
    ----Split statistics------'
    #Train samples 1224 (5.0 % of nodes)
    #Val samples 3673 (15.0 % of nodes)
    #Test samples 19595 (remaining)
    ----label noise information:------
    Instance dependent noise
    #Actual noise rate 0.13
    [cuda:0] LNPCC waiting for GPU slot...
    [cuda:0] Slot acquired (waited 188.0s). Starting GCN...
    FINAL_RESULT: {'acc': {'train': 0.41017227235438886, 'valid': 0.3699972774298938, 'test': 0.3973972952283746}, 'wall_s': 61.7, 'cpu_s': 57.52, 'gpu_s': 4.13, 'wait_s': 187.99}
    [Time] wall=61.7s | cpu=57.5s | gpu=4.1s
    C:\Users\fbrev\Documents\Acadêmico\Simulações\Python\NoisyGL\predictor\Base_Predictor.py:144: UserWarning: Sparse CSR tensor support is in beta state. If you miss a functionality in the sparse tensor support, please submit a feature request to https://github.com/pytorch/pytorch/issues. (Triggered internally at ..\aten\src\ATen\SparseCsrTensorImpl.cpp:55.)
    self.adj_csr = self.adj.to_sparse_csr().to(self.device)
[I 2026-04-27 13:55:13,184] Trial 116 finished with value: 0.3973972952283746 and parameters: {'lr': 0.1, 'weight_decay': 0.001, 'n_hidden': 64, 'n_layer': 3, 'dropout': 0.7447244074250494, 'knn_mode': 's', 'k': 45, 'dexp': 8.94337743024295, 'p_grd': 0.49115318177112566, 'unc_rem': 0.09932102567225637, 'unc_rel': 0.6483464531104826}. Best is trial 29 with value: 0.40505230926256697.
    [CPU] Loading amazon-ratings...
    DEBUG 3.1: Dataset init start
    DEBUG 3.2: prepare_data start amazon-ratings
    ----Data statistics------'
    Name: amazon-ratings
    #Nodes 24492
    #Edges 93050
    #Classes 5
    #Ave_degree 7.60
    ----Split statistics------'
    #Train samples 1224 (5.0 % of nodes)
    #Val samples 3673 (15.0 % of nodes)
    #Test samples 19595 (remaining)
    ----label noise information:------
    Instance dependent noise
    #Actual noise rate 0.13
    [cuda:0] LNPCC waiting for GPU slot...
    [cuda:0] Slot acquired (waited 923.8s). Starting GCN...
    FINAL_RESULT: {'acc': {'train': 0.3799019607843137, 'valid': 0.36564116526000545, 'test': 0.3958152589946415}, 'wall_s': 60.81, 'cpu_s': 57.07, 'gpu_s': 3.68, 'wait_s': 923.81}
    [Time] wall=60.8s | cpu=57.1s | gpu=3.7s
    C:\Users\fbrev\Documents\Acadêmico\Simulações\Python\NoisyGL\predictor\Base_Predictor.py:144: UserWarning: Sparse CSR tensor support is in beta state. If you miss a functionality in the sparse tensor support, please submit a feature request to https://github.com/pytorch/pytorch/issues. (Triggered internally at ..\aten\src\ATen\SparseCsrTensorImpl.cpp:55.)
    self.adj_csr = self.adj.to_sparse_csr().to(self.device)
[I 2026-04-27 14:11:44,323] Trial 117 finished with value: 0.3958152589946415 and parameters: {'lr': 0.1, 'weight_decay': 0.001, 'n_hidden': 64, 'n_layer': 3, 'dropout': 0.7157468361836484, 'knn_mode': 's', 'k': 44, 'dexp': 8.283011585334261, 'p_grd': 0.5730803748273022, 'unc_rem': 0.8986436578720203, 'unc_rel': 0.7401991076291471}. Best is trial 29 with value: 0.40505230926256697.
    [CPU] Loading amazon-ratings...
    DEBUG 3.1: Dataset init start
    DEBUG 3.2: prepare_data start amazon-ratings
    ----Data statistics------'
    Name: amazon-ratings
    #Nodes 24492
    #Edges 93050
    #Classes 5
    #Ave_degree 7.60
    ----Split statistics------'
    #Train samples 1224 (5.0 % of nodes)
    #Val samples 3673 (15.0 % of nodes)
    #Test samples 19595 (remaining)
    ----label noise information:------
    Instance dependent noise
    #Actual noise rate 0.13
    [cuda:0] LNPCC waiting for GPU slot...
    [cuda:0] Slot acquired (waited 213.3s). Starting GCN...
    FINAL_RESULT: {'acc': {'train': 0.42915980230642503, 'valid': 0.3558399128777566, 'test': 0.388568512375606}, 'wall_s': 35.23, 'cpu_s': 31.08, 'gpu_s': 4.12, 'wait_s': 213.3}
    [Time] wall=35.2s | cpu=31.1s | gpu=4.1s
    C:\Users\fbrev\Documents\Acadêmico\Simulações\Python\NoisyGL\predictor\Base_Predictor.py:144: UserWarning: Sparse CSR tensor support is in beta state. If you miss a functionality in the sparse tensor support, please submit a feature request to https://github.com/pytorch/pytorch/issues. (Triggered internally at ..\aten\src\ATen\SparseCsrTensorImpl.cpp:55.)
    self.adj_csr = self.adj.to_sparse_csr().to(self.device)
[I 2026-04-27 14:15:58,927] Trial 118 finished with value: 0.388568512375606 and parameters: {'lr': 0.1, 'weight_decay': 0.001, 'n_hidden': 64, 'n_layer': 3, 'dropout': 0.05907667270930206, 'knn_mode': 's', 'k': 42, 'dexp': 7.1834273949904475, 'p_grd': 0.17690277103029328, 'unc_rem': 0.8320158634551782, 'unc_rel': 0.7892474478324625}. Best is trial 29 with value: 0.40505230926256697.
    [CPU] Loading amazon-ratings...
    DEBUG 3.1: Dataset init start
    DEBUG 3.2: prepare_data start amazon-ratings
    ----Data statistics------'
    Name: amazon-ratings
    #Nodes 24492
    #Edges 93050
    #Classes 5
    #Ave_degree 7.60
    ----Split statistics------'
    #Train samples 1224 (5.0 % of nodes)
    #Val samples 3673 (15.0 % of nodes)
    #Test samples 19595 (remaining)
    ----label noise information:------
    Instance dependent noise
    #Actual noise rate 0.13
    [cuda:0] LNPCC waiting for GPU slot...
    [cuda:0] Slot acquired (waited 445.9s). Starting GCN...
    FINAL_RESULT: {'acc': {'train': 0.3946078431372549, 'valid': 0.3569289409202287, 'test': 0.3914774177085991}, 'wall_s': 47.3, 'cpu_s': 43.2, 'gpu_s': 4.06, 'wait_s': 445.85}
    [Time] wall=47.3s | cpu=43.2s | gpu=4.1s
    C:\Users\fbrev\Documents\Acadêmico\Simulações\Python\NoisyGL\predictor\Base_Predictor.py:144: UserWarning: Sparse CSR tensor support is in beta state. If you miss a functionality in the sparse tensor support, please submit a feature request to https://github.com/pytorch/pytorch/issues. (Triggered internally at ..\aten\src\ATen\SparseCsrTensorImpl.cpp:55.)
    self.adj_csr = self.adj.to_sparse_csr().to(self.device)
[I 2026-04-27 14:24:18,283] Trial 119 finished with value: 0.3914774177085991 and parameters: {'lr': 0.1, 'weight_decay': 0.001, 'n_hidden': 64, 'n_layer': 3, 'dropout': 0.6670897170804477, 'knn_mode': 's', 'k': 43, 'dexp': 7.531494673367676, 'p_grd': 0.4413731316716666, 'unc_rem': 0.25350347489910563, 'unc_rel': 0.7014076118377134}. Best is trial 29 with value: 0.40505230926256697.
    [CPU] Loading amazon-ratings...
    DEBUG 3.1: Dataset init start
    DEBUG 3.2: prepare_data start amazon-ratings
    ----Data statistics------'
    Name: amazon-ratings
    #Nodes 24492
    #Edges 93050
    #Classes 5
    #Ave_degree 7.60
    ----Split statistics------'
    #Train samples 1224 (5.0 % of nodes)
    #Val samples 3673 (15.0 % of nodes)
    #Test samples 19595 (remaining)
    ----label noise information:------
    Instance dependent noise
    #Actual noise rate 0.13
    [cuda:0] LNPCC waiting for GPU slot...
    [cuda:0] Slot acquired (waited 671.9s). Starting GCN...
    FINAL_RESULT: {'acc': {'train': 0.15522875816993464, 'valid': 0.32752518377348216, 'test': 0.36851237560602196}, 'wall_s': 55.28, 'cpu_s': 52.23, 'gpu_s': 3.0, 'wait_s': 671.88}
    [Time] wall=55.3s | cpu=52.2s | gpu=3.0s
    C:\Users\fbrev\Documents\Acadêmico\Simulações\Python\NoisyGL\predictor\Base_Predictor.py:144: UserWarning: Sparse CSR tensor support is in beta state. If you miss a functionality in the sparse tensor support, please submit a feature request to https://github.com/pytorch/pytorch/issues. (Triggered internally at ..\aten\src\ATen\SparseCsrTensorImpl.cpp:55.)
    self.adj_csr = self.adj.to_sparse_csr().to(self.device)
[I 2026-04-27 14:36:31,170] Trial 120 finished with value: 0.36851237560602196 and parameters: {'lr': 0.1, 'weight_decay': 0.05, 'n_hidden': 64, 'n_layer': 3, 'dropout': 0.6461959922725148, 'knn_mode': 's', 'k': 39, 'dexp': 8.5792724769088, 'p_grd': 0.6816681811806183, 'unc_rem': 0.9287504189256315, 'unc_rel': 0.7245721641033781}. Best is trial 29 with value: 0.40505230926256697.
    [CPU] Loading amazon-ratings...
    DEBUG 3.1: Dataset init start
    DEBUG 3.2: prepare_data start amazon-ratings
    ----Data statistics------'
    Name: amazon-ratings
    #Nodes 24492
    #Edges 93050
    #Classes 5
    #Ave_degree 7.60
    ----Split statistics------'
    #Train samples 1224 (5.0 % of nodes)
    #Val samples 3673 (15.0 % of nodes)
    #Test samples 19595 (remaining)
    ----label noise information:------
    Instance dependent noise
    #Actual noise rate 0.13
    [cuda:0] LNPCC waiting for GPU slot...
    [cuda:0] Slot acquired (waited 152.4s). Starting GCN...
    FINAL_RESULT: {'acc': {'train': 0.4223856209150327, 'valid': 0.3667301933024775, 'test': 0.3869864761418729}, 'wall_s': 87.2, 'cpu_s': 84.89, 'gpu_s': 2.28, 'wait_s': 152.43}
    [Time] wall=87.2s | cpu=84.9s | gpu=2.3s
    C:\Users\fbrev\Documents\Acadêmico\Simulações\Python\NoisyGL\predictor\Base_Predictor.py:144: UserWarning: Sparse CSR tensor support is in beta state. If you miss a functionality in the sparse tensor support, please submit a feature request to https://github.com/pytorch/pytorch/issues. (Triggered internally at ..\aten\src\ATen\SparseCsrTensorImpl.cpp:55.)
    self.adj_csr = self.adj.to_sparse_csr().to(self.device)
[I 2026-04-27 14:40:36,639] Trial 121 finished with value: 0.3869864761418729 and parameters: {'lr': 0.1, 'weight_decay': 0.001, 'n_hidden': 32, 'n_layer': 2, 'dropout': 0.7210380069169746, 'knn_mode': 'd', 'k': 46, 'dexp': 7.987853473418753, 'p_grd': 0.5876747235935318, 'unc_rem': 0.8728795980504285, 'unc_rel': 0.5514169432782525}. Best is trial 29 with value: 0.40505230926256697.
    [CPU] Loading amazon-ratings...
    DEBUG 3.1: Dataset init start
    DEBUG 3.2: prepare_data start amazon-ratings
    ----Data statistics------'
    Name: amazon-ratings
    #Nodes 24492
    #Edges 93050
    #Classes 5
    #Ave_degree 7.60
    ----Split statistics------'
    #Train samples 1224 (5.0 % of nodes)
    #Val samples 3673 (15.0 % of nodes)
    #Test samples 19595 (remaining)
    ----label noise information:------
    Instance dependent noise
    #Actual noise rate 0.13
    [cuda:0] LNPCC waiting for GPU slot...
    [cuda:0] Slot acquired (waited 950.0s). Starting GCN...
    FINAL_RESULT: {'acc': {'train': 0.4550653594771242, 'valid': 0.37054179145112986, 'test': 0.3912732840010207}, 'wall_s': 50.83, 'cpu_s': 47.08, 'gpu_s': 3.7, 'wait_s': 950.03}
    [Time] wall=50.8s | cpu=47.1s | gpu=3.7s
    C:\Users\fbrev\Documents\Acadêmico\Simulações\Python\NoisyGL\predictor\Base_Predictor.py:144: UserWarning: Sparse CSR tensor support is in beta state. If you miss a functionality in the sparse tensor support, please submit a feature request to https://github.com/pytorch/pytorch/issues. (Triggered internally at ..\aten\src\ATen\SparseCsrTensorImpl.cpp:55.)
    self.adj_csr = self.adj.to_sparse_csr().to(self.device)
[I 2026-04-27 14:57:24,296] Trial 122 finished with value: 0.3912732840010207 and parameters: {'lr': 0.05, 'weight_decay': 0.001, 'n_hidden': 64, 'n_layer': 3, 'dropout': 0.7814689897991488, 'knn_mode': 's', 'k': 40, 'dexp': 4.243924343957331, 'p_grd': 0.5435739601948908, 'unc_rem': 0.889617860250579, 'unc_rel': 0.7622135523893792}. Best is trial 29 with value: 0.40505230926256697.
    [CPU] Loading amazon-ratings...
    DEBUG 3.1: Dataset init start
    DEBUG 3.2: prepare_data start amazon-ratings
    ----Data statistics------'
    Name: amazon-ratings
    #Nodes 24492
    #Edges 93050
    #Classes 5
    #Ave_degree 7.60
    ----Split statistics------'
    #Train samples 1224 (5.0 % of nodes)
    #Val samples 3673 (15.0 % of nodes)
    #Test samples 19595 (remaining)
    ----label noise information:------
    Instance dependent noise
    #Actual noise rate 0.13
    [cuda:0] LNPCC waiting for GPU slot...
    [cuda:0] Slot acquired (waited 675.2s). Starting GCN...
    FINAL_RESULT: {'acc': {'train': 0.3985270049099836, 'valid': 0.3661856792812415, 'test': 0.3962235264097984}, 'wall_s': 57.91, 'cpu_s': 52.49, 'gpu_s': 5.37, 'wait_s': 675.2}
    [Time] wall=57.9s | cpu=52.5s | gpu=5.4s
    C:\Users\fbrev\Documents\Acadêmico\Simulações\Python\NoisyGL\predictor\Base_Predictor.py:144: UserWarning: Sparse CSR tensor support is in beta state. If you miss a functionality in the sparse tensor support, please submit a feature request to https://github.com/pytorch/pytorch/issues. (Triggered internally at ..\aten\src\ATen\SparseCsrTensorImpl.cpp:55.)
    self.adj_csr = self.adj.to_sparse_csr().to(self.device)
