[I 2026-05-06 16:02:28,778] Trial 11 finished with value: 0.704 and parameters: {'lr': 0.001, 'weight_decay': 0.0, 'n_hidden': 64, 'n_layer': 2, 'dropout': 0.494065325686168, 'knn_mode': 'd', 'k': 42, 'dexp': 7.078978279425739, 'p_grd': 0.8093090331933839, 'unc_rem': 0.8175565956907389, 'unc_rel': 0.2011242639539048}. Best is trial 3 with value: 0.731.
    [CPU] Loading pubmed...
    DEBUG 3.1: Dataset init start
    DEBUG 3.2: prepare_data start pubmed
    ----Data statistics------'
    Name: pubmed
    #Nodes 19717
    #Edges 44324
    #Classes 3
    #Ave_degree 4.50
    ----Split statistics------'
    #Train samples 60 (default)
    #Val samples 500 (default)
    #Test samples 1000 (default)
    ----label noise information:------
    Instance dependent noise
    #Actual noise rate 0.21
    [cuda:1] LNPCC waiting for GPU slot...
    [cuda:1] Slot acquired (waited 794.3s). Starting GCN...
    FINAL_RESULT: {'acc': {'train': 0.864406779661017, 'valid': 0.61, 'test': 0.705}, 'wall_s': 32.52, 'cpu_s': 30.25, 'gpu_s': 2.22, 'wait_s': 794.31}
    [Time] wall=32.5s | cpu=30.2s | gpu=2.2s
    C:\Users\fbrev\Documents\Acadêmico\Simulações\Python\NoisyGL\predictor\Base_Predictor.py:114: UserWarning: expandable_segments not supported on this platform (Triggered internally at ..\c10/cuda/CUDAAllocatorConfig.h:28.)
    self.edge_index = self._cpu_edge_index.to(self.device)
    C:\Users\fbrev\Documents\Acadêmico\Simulações\Python\NoisyGL\predictor\Base_Predictor.py:144: UserWarning: Sparse CSR tensor support is in beta state. If you miss a functionality in the sparse tensor support, please submit a feature request to https://github.com/pytorch/pytorch/issues. (Triggered internally at ..\aten\src\ATen\SparseCsrTensorImpl.cpp:55.)
    self.adj_csr = self.adj.to_sparse_csr().to(self.device)
[I 2026-05-06 16:16:22,364] Trial 12 finished with value: 0.705 and parameters: {'lr': 0.01, 'weight_decay': 0.0001, 'n_hidden': 32, 'n_layer': 2, 'dropout': 0.2122528355439598, 'knn_mode': 's', 'k': 5, 'dexp': 3.415604653326267, 'p_grd': 0.48484851513627636, 'unc_rem': 0.1202648011676728, 'unc_rel': 0.22897144679153436}. Best is trial 3 with value: 0.731.
    [CPU] Loading pubmed...
    DEBUG 3.1: Dataset init start
    DEBUG 3.2: prepare_data start pubmed
    ----Data statistics------'
    Name: pubmed
    #Nodes 19717
    #Edges 44324
    #Classes 3
    #Ave_degree 4.50
    ----Split statistics------'
    #Train samples 60 (default)
    #Val samples 500 (default)
    #Test samples 1000 (default)
    ----label noise information:------
    Instance dependent noise
    #Actual noise rate 0.21
    [cuda:1] LNPCC waiting for GPU slot...
    [cuda:1] Slot acquired (waited 967.3s). Starting GCN...
    FINAL_RESULT: {'acc': {'train': 0.7833333333333333, 'valid': 0.598, 'test': 0.713}, 'wall_s': 29.9, 'cpu_s': 27.44, 'gpu_s': 2.39, 'wait_s': 967.27}
    [Time] wall=29.9s | cpu=27.4s | gpu=2.4s
    C:\Users\fbrev\Documents\Acadêmico\Simulações\Python\NoisyGL\predictor\Base_Predictor.py:114: UserWarning: expandable_segments not supported on this platform (Triggered internally at ..\c10/cuda/CUDAAllocatorConfig.h:28.)
    self.edge_index = self._cpu_edge_index.to(self.device)
    C:\Users\fbrev\Documents\Acadêmico\Simulações\Python\NoisyGL\predictor\Base_Predictor.py:144: UserWarning: Sparse CSR tensor support is in beta state. If you miss a functionality in the sparse tensor support, please submit a feature request to https://github.com/pytorch/pytorch/issues. (Triggered internally at ..\aten\src\ATen\SparseCsrTensorImpl.cpp:55.)
    self.adj_csr = self.adj.to_sparse_csr().to(self.device)
[I 2026-05-06 16:33:05,783] Trial 13 finished with value: 0.713 and parameters: {'lr': 0.1, 'weight_decay': 0.01, 'n_hidden': 64, 'n_layer': 2, 'dropout': 0.14062982503090202, 'knn_mode': 'd', 'k': 21, 'dexp': 2.6455009303886685, 'p_grd': 0.3877144538888293, 'unc_rem': 0.27211818926590114, 'unc_rel': 0.3678477824590435}. Best is trial 3 with value: 0.731.
    [CPU] Loading pubmed...
    DEBUG 3.1: Dataset init start
    DEBUG 3.2: prepare_data start pubmed
    ----Data statistics------'
    Name: pubmed
    #Nodes 19717
    #Edges 44324
    #Classes 3
    #Ave_degree 4.50
    ----Split statistics------'
    #Train samples 60 (default)
    #Val samples 500 (default)
    #Test samples 1000 (default)
    ----label noise information:------
    Instance dependent noise
    #Actual noise rate 0.21
    [cuda:1] LNPCC waiting for GPU slot...
    [cuda:1] Slot acquired (waited 482.6s). Starting GCN...
    FINAL_RESULT: {'acc': {'train': 0.36666666666666664, 'valid': 0.38, 'test': 0.436}, 'wall_s': 31.74, 'cpu_s': 29.4, 'gpu_s': 2.29, 'wait_s': 482.65}
    [Time] wall=31.7s | cpu=29.4s | gpu=2.3s
    C:\Users\fbrev\Documents\Acadêmico\Simulações\Python\NoisyGL\predictor\Base_Predictor.py:114: UserWarning: expandable_segments not supported on this platform (Triggered internally at ..\c10/cuda/CUDAAllocatorConfig.h:28.)
    self.edge_index = self._cpu_edge_index.to(self.device)
    C:\Users\fbrev\Documents\Acadêmico\Simulações\Python\NoisyGL\predictor\Base_Predictor.py:144: UserWarning: Sparse CSR tensor support is in beta state. If you miss a functionality in the sparse tensor support, please submit a feature request to https://github.com/pytorch/pytorch/issues. (Triggered internally at ..\aten\src\ATen\SparseCsrTensorImpl.cpp:55.)
    self.adj_csr = self.adj.to_sparse_csr().to(self.device)
[I 2026-05-06 16:41:46,847] Trial 14 finished with value: 0.436 and parameters: {'lr': 0.01, 'weight_decay': 0.05, 'n_hidden': 32, 'n_layer': 2, 'dropout': 0.015305141591561267, 'knn_mode': 'd', 'k': 45, 'dexp': 9.576049467794768, 'p_grd': 0.8745776507907911, 'unc_rem': 0.70189039053817, 'unc_rel': 0.9645685504300959}. Best is trial 3 with value: 0.731.
    [CPU] Loading pubmed...
    DEBUG 3.1: Dataset init start
    DEBUG 3.2: prepare_data start pubmed
    ----Data statistics------'
    Name: pubmed
    #Nodes 19717
    #Edges 44324
    #Classes 3
    #Ave_degree 4.50
    ----Split statistics------'
    #Train samples 60 (default)
    #Val samples 500 (default)
    #Test samples 1000 (default)
    ----label noise information:------
    Instance dependent noise
    #Actual noise rate 0.21
    [cuda:1] LNPCC waiting for GPU slot...
    [cuda:1] Slot acquired (waited 295.8s). Starting GCN...
    FINAL_RESULT: {'acc': {'train': 0.7796610169491526, 'valid': 0.604, 'test': 0.719}, 'wall_s': 34.09, 'cpu_s': 27.97, 'gpu_s': 6.05, 'wait_s': 295.76}
    [Time] wall=34.1s | cpu=28.0s | gpu=6.0s
    C:\Users\fbrev\Documents\Acadêmico\Simulações\Python\NoisyGL\predictor\Base_Predictor.py:114: UserWarning: expandable_segments not supported on this platform (Triggered internally at ..\c10/cuda/CUDAAllocatorConfig.h:28.)
    self.edge_index = self._cpu_edge_index.to(self.device)
    C:\Users\fbrev\Documents\Acadêmico\Simulações\Python\NoisyGL\predictor\Base_Predictor.py:144: UserWarning: Sparse CSR tensor support is in beta state. If you miss a functionality in the sparse tensor support, please submit a feature request to https://github.com/pytorch/pytorch/issues. (Triggered internally at ..\aten\src\ATen\SparseCsrTensorImpl.cpp:55.)
    self.adj_csr = self.adj.to_sparse_csr().to(self.device)
[I 2026-05-06 16:47:23,293] Trial 15 finished with value: 0.719 and parameters: {'lr': 0.001, 'weight_decay': 0.0001, 'n_hidden': 256, 'n_layer': 3, 'dropout': 0.1413949432925266, 'knn_mode': 's', 'k': 24, 'dexp': 4.516243024639353, 'p_grd': 0.32708225210193276, 'unc_rem': 0.7231122828216123, 'unc_rel': 0.46595637793214884}. Best is trial 3 with value: 0.731.
    [CPU] Loading pubmed...
    DEBUG 3.1: Dataset init start
    DEBUG 3.2: prepare_data start pubmed
    ----Data statistics------'
    Name: pubmed
    #Nodes 19717
    #Edges 44324
    #Classes 3
    #Ave_degree 4.50
    ----Split statistics------'
    #Train samples 60 (default)
    #Val samples 500 (default)
    #Test samples 1000 (default)
    ----label noise information:------
    Instance dependent noise
    #Actual noise rate 0.21
    [cuda:1] LNPCC waiting for GPU slot...
    [cuda:1] Slot acquired (waited 141.7s). Starting GCN...
    FINAL_RESULT: {'acc': {'train': 0.7666666666666667, 'valid': 0.602, 'test': 0.68}, 'wall_s': 31.61, 'cpu_s': 25.44, 'gpu_s': 6.1, 'wait_s': 141.68}
    [Time] wall=31.6s | cpu=25.4s | gpu=6.1s
    C:\Users\fbrev\Documents\Acadêmico\Simulações\Python\NoisyGL\predictor\Base_Predictor.py:114: UserWarning: expandable_segments not supported on this platform (Triggered internally at ..\c10/cuda/CUDAAllocatorConfig.h:28.)
    self.edge_index = self._cpu_edge_index.to(self.device)
    C:\Users\fbrev\Documents\Acadêmico\Simulações\Python\NoisyGL\predictor\Base_Predictor.py:144: UserWarning: Sparse CSR tensor support is in beta state. If you miss a functionality in the sparse tensor support, please submit a feature request to https://github.com/pytorch/pytorch/issues. (Triggered internally at ..\aten\src\ATen\SparseCsrTensorImpl.cpp:55.)
    self.adj_csr = self.adj.to_sparse_csr().to(self.device)
[I 2026-05-06 16:50:22,685] Trial 16 finished with value: 0.68 and parameters: {'lr': 0.1, 'weight_decay': 0.001, 'n_hidden': 256, 'n_layer': 3, 'dropout': 0.18354570559166064, 'knn_mode': 's', 'k': 9, 'dexp': 8.051723414079143, 'p_grd': 0.6333930865364665, 'unc_rem': 0.7421993538209207, 'unc_rel': 0.802445782297044}. Best is trial 3 with value: 0.731.
    [CPU] Loading pubmed...
    DEBUG 3.1: Dataset init start
    DEBUG 3.2: prepare_data start pubmed
    ----Data statistics------'
    Name: pubmed
    #Nodes 19717
    #Edges 44324
    #Classes 3
    #Ave_degree 4.50
    ----Split statistics------'
    #Train samples 60 (default)
    #Val samples 500 (default)
    #Test samples 1000 (default)
    ----label noise information:------
    Instance dependent noise
    #Actual noise rate 0.21
    [cuda:1] LNPCC waiting for GPU slot...
    [cuda:1] Slot acquired (waited 295.2s). Starting GCN...
    FINAL_RESULT: {'acc': {'train': 0.7833333333333333, 'valid': 0.568, 'test': 0.661}, 'wall_s': 34.99, 'cpu_s': 28.82, 'gpu_s': 6.12, 'wait_s': 295.19}
    [Time] wall=35.0s | cpu=28.8s | gpu=6.1s
    C:\Users\fbrev\Documents\Acadêmico\Simulações\Python\NoisyGL\predictor\Base_Predictor.py:114: UserWarning: expandable_segments not supported on this platform (Triggered internally at ..\c10/cuda/CUDAAllocatorConfig.h:28.)
    self.edge_index = self._cpu_edge_index.to(self.device)
    C:\Users\fbrev\Documents\Acadêmico\Simulações\Python\NoisyGL\predictor\Base_Predictor.py:144: UserWarning: Sparse CSR tensor support is in beta state. If you miss a functionality in the sparse tensor support, please submit a feature request to https://github.com/pytorch/pytorch/issues. (Triggered internally at ..\aten\src\ATen\SparseCsrTensorImpl.cpp:55.)
    self.adj_csr = self.adj.to_sparse_csr().to(self.device)
[I 2026-05-06 16:55:59,233] Trial 17 finished with value: 0.661 and parameters: {'lr': 0.05, 'weight_decay': 0.0, 'n_hidden': 256, 'n_layer': 3, 'dropout': 0.3641807986019758, 'knn_mode': 's', 'k': 49, 'dexp': 9.328383348297663, 'p_grd': 0.4182111015332727, 'unc_rem': 0.8642837879141492, 'unc_rel': 0.5757757652553932}. Best is trial 3 with value: 0.731.
    [CPU] Loading pubmed...
    DEBUG 3.1: Dataset init start
    DEBUG 3.2: prepare_data start pubmed
    ----Data statistics------'
    Name: pubmed
    #Nodes 19717
    #Edges 44324
    #Classes 3
    #Ave_degree 4.50
    ----Split statistics------'
    #Train samples 60 (default)
    #Val samples 500 (default)
    #Test samples 1000 (default)
    ----label noise information:------
    Instance dependent noise
    #Actual noise rate 0.21
    [cuda:1] LNPCC waiting for GPU slot...
    [cuda:1] Slot acquired (waited 473.2s). Starting GCN...
    FINAL_RESULT: {'acc': {'train': 0.6833333333333333, 'valid': 0.59, 'test': 0.69}, 'wall_s': 31.15, 'cpu_s': 27.89, 'gpu_s': 3.2, 'wait_s': 473.17}
    [Time] wall=31.2s | cpu=27.9s | gpu=3.2s
    C:\Users\fbrev\Documents\Acadêmico\Simulações\Python\NoisyGL\predictor\Base_Predictor.py:114: UserWarning: expandable_segments not supported on this platform (Triggered internally at ..\c10/cuda/CUDAAllocatorConfig.h:28.)
    self.edge_index = self._cpu_edge_index.to(self.device)
    C:\Users\fbrev\Documents\Acadêmico\Simulações\Python\NoisyGL\predictor\Base_Predictor.py:144: UserWarning: Sparse CSR tensor support is in beta state. If you miss a functionality in the sparse tensor support, please submit a feature request to https://github.com/pytorch/pytorch/issues. (Triggered internally at ..\aten\src\ATen\SparseCsrTensorImpl.cpp:55.)
    self.adj_csr = self.adj.to_sparse_csr().to(self.device)
[I 2026-05-06 17:04:30,551] Trial 18 finished with value: 0.69 and parameters: {'lr': 0.05, 'weight_decay': 0.001, 'n_hidden': 64, 'n_layer': 3, 'dropout': 0.3219522623358499, 'knn_mode': 's', 'k': 22, 'dexp': 8.185841291407987, 'p_grd': 0.5114974534354224, 'unc_rem': 0.9861340676429743, 'unc_rel': 0.6712317219587044}. Best is trial 3 with value: 0.731.
    [CPU] Loading pubmed...
    DEBUG 3.1: Dataset init start
    DEBUG 3.2: prepare_data start pubmed
    ----Data statistics------'
    Name: pubmed
    #Nodes 19717
    #Edges 44324
    #Classes 3
    #Ave_degree 4.50
    ----Split statistics------'
    #Train samples 60 (default)
    #Val samples 500 (default)
    #Test samples 1000 (default)
    ----label noise information:------
    Instance dependent noise
    #Actual noise rate 0.21
    [cuda:1] LNPCC waiting for GPU slot...
    [cuda:1] Slot acquired (waited 140.3s). Starting GCN...
    FINAL_RESULT: {'acc': {'train': 0.8305084745762712, 'valid': 0.59, 'test': 0.667}, 'wall_s': 33.58, 'cpu_s': 30.67, 'gpu_s': 2.85, 'wait_s': 140.28}
    [Time] wall=33.6s | cpu=30.7s | gpu=2.9s
    C:\Users\fbrev\Documents\Acadêmico\Simulações\Python\NoisyGL\predictor\Base_Predictor.py:114: UserWarning: expandable_segments not supported on this platform (Triggered internally at ..\c10/cuda/CUDAAllocatorConfig.h:28.)
    self.edge_index = self._cpu_edge_index.to(self.device)
    C:\Users\fbrev\Documents\Acadêmico\Simulações\Python\NoisyGL\predictor\Base_Predictor.py:144: UserWarning: Sparse CSR tensor support is in beta state. If you miss a functionality in the sparse tensor support, please submit a feature request to https://github.com/pytorch/pytorch/issues. (Triggered internally at ..\aten\src\ATen\SparseCsrTensorImpl.cpp:55.)
    self.adj_csr = self.adj.to_sparse_csr().to(self.device)
[I 2026-05-06 17:07:31,100] Trial 19 finished with value: 0.667 and parameters: {'lr': 0.001, 'weight_decay': 0.01, 'n_hidden': 128, 'n_layer': 2, 'dropout': 0.01692334190834286, 'knn_mode': 's', 'k': 12, 'dexp': 3.6597216058079924, 'p_grd': 0.22569094730999384, 'unc_rem': 0.29670909959681613, 'unc_rel': 0.3212860590798803}. Best is trial 3 with value: 0.731.
    [CPU] Loading pubmed...
    DEBUG 3.1: Dataset init start
    DEBUG 3.2: prepare_data start pubmed
    ----Data statistics------'
    Name: pubmed
    #Nodes 19717
    #Edges 44324
    #Classes 3
    #Ave_degree 4.50
    ----Split statistics------'
    #Train samples 60 (default)
    #Val samples 500 (default)
    #Test samples 1000 (default)
    ----label noise information:------
    Instance dependent noise
    #Actual noise rate 0.21
    [cuda:1] LNPCC waiting for GPU slot...
    [cuda:1] Slot acquired (waited 148.7s). Starting GCN...
    FINAL_RESULT: {'acc': {'train': 0.8392857142857143, 'valid': 0.6, 'test': 0.685}, 'wall_s': 32.06, 'cpu_s': 25.8, 'gpu_s': 6.2, 'wait_s': 148.68}
    [Time] wall=32.1s | cpu=25.8s | gpu=6.2s
    C:\Users\fbrev\Documents\Acadêmico\Simulações\Python\NoisyGL\predictor\Base_Predictor.py:114: UserWarning: expandable_segments not supported on this platform (Triggered internally at ..\c10/cuda/CUDAAllocatorConfig.h:28.)
    self.edge_index = self._cpu_edge_index.to(self.device)
    C:\Users\fbrev\Documents\Acadêmico\Simulações\Python\NoisyGL\predictor\Base_Predictor.py:144: UserWarning: Sparse CSR tensor support is in beta state. If you miss a functionality in the sparse tensor support, please submit a feature request to https://github.com/pytorch/pytorch/issues. (Triggered internally at ..\aten\src\ATen\SparseCsrTensorImpl.cpp:55.)
    self.adj_csr = self.adj.to_sparse_csr().to(self.device)
[I 2026-05-06 17:10:38,803] Trial 20 finished with value: 0.685 and parameters: {'lr': 0.001, 'weight_decay': 0.0001, 'n_hidden': 256, 'n_layer': 3, 'dropout': 0.6221492931231439, 'knn_mode': 's', 'k': 31, 'dexp': 5.808380056424188, 'p_grd': 0.08098808770586782, 'unc_rem': 0.5653780585520983, 'unc_rel': 0.1102231922797901}. Best is trial 3 with value: 0.731.
    [CPU] Loading pubmed...
    DEBUG 3.1: Dataset init start
    DEBUG 3.2: prepare_data start pubmed
    ----Data statistics------'
    Name: pubmed
    #Nodes 19717
    #Edges 44324
    #Classes 3
    #Ave_degree 4.50
    ----Split statistics------'
    #Train samples 60 (default)
    #Val samples 500 (default)
    #Test samples 1000 (default)
    ----label noise information:------
    Instance dependent noise
    #Actual noise rate 0.21
    [cuda:1] LNPCC waiting for GPU slot...
    [cuda:1] Slot acquired (waited 469.0s). Starting GCN...
    FINAL_RESULT: {'acc': {'train': 0.9423076923076923, 'valid': 0.6, 'test': 0.716}, 'wall_s': 28.25, 'cpu_s': 24.33, 'gpu_s': 3.87, 'wait_s': 468.99}
    [Time] wall=28.2s | cpu=24.3s | gpu=3.9s
    C:\Users\fbrev\Documents\Acadêmico\Simulações\Python\NoisyGL\predictor\Base_Predictor.py:114: UserWarning: expandable_segments not supported on this platform (Triggered internally at ..\c10/cuda/CUDAAllocatorConfig.h:28.)
    self.edge_index = self._cpu_edge_index.to(self.device)
    C:\Users\fbrev\Documents\Acadêmico\Simulações\Python\NoisyGL\predictor\Base_Predictor.py:144: UserWarning: Sparse CSR tensor support is in beta state. If you miss a functionality in the sparse tensor support, please submit a feature request to https://github.com/pytorch/pytorch/issues. (Triggered internally at ..\aten\src\ATen\SparseCsrTensorImpl.cpp:55.)
    self.adj_csr = self.adj.to_sparse_csr().to(self.device)
[I 2026-05-06 17:19:02,766] Trial 21 finished with value: 0.716 and parameters: {'lr': 0.01, 'weight_decay': 0.0, 'n_hidden': 256, 'n_layer': 2, 'dropout': 0.31361154255666285, 'knn_mode': 'd', 'k': 28, 'dexp': 5.220580332958805, 'p_grd': 0.14791990462102117, 'unc_rem': 0.026864887958488043, 'unc_rel': 0.4400581235181085}. Best is trial 3 with value: 0.731.
    [CPU] Loading pubmed...
    DEBUG 3.1: Dataset init start
    DEBUG 3.2: prepare_data start pubmed
    ----Data statistics------'
    Name: pubmed
    #Nodes 19717
    #Edges 44324
    #Classes 3
    #Ave_degree 4.50
    ----Split statistics------'
    #Train samples 60 (default)
    #Val samples 500 (default)
    #Test samples 1000 (default)
    ----label noise information:------
    Instance dependent noise
    #Actual noise rate 0.21
    [cuda:1] LNPCC waiting for GPU slot...
    [cuda:1] Slot acquired (waited 130.7s). Starting GCN...
    FINAL_RESULT: {'acc': {'train': 0.8333333333333334, 'valid': 0.632, 'test': 0.725}, 'wall_s': 30.85, 'cpu_s': 26.98, 'gpu_s': 3.82, 'wait_s': 130.71}
    [Time] wall=30.9s | cpu=27.0s | gpu=3.8s
    C:\Users\fbrev\Documents\Acadêmico\Simulações\Python\NoisyGL\predictor\Base_Predictor.py:114: UserWarning: expandable_segments not supported on this platform (Triggered internally at ..\c10/cuda/CUDAAllocatorConfig.h:28.)
    self.edge_index = self._cpu_edge_index.to(self.device)
    C:\Users\fbrev\Documents\Acadêmico\Simulações\Python\NoisyGL\predictor\Base_Predictor.py:144: UserWarning: Sparse CSR tensor support is in beta state. If you miss a functionality in the sparse tensor support, please submit a feature request to https://github.com/pytorch/pytorch/issues. (Triggered internally at ..\aten\src\ATen\SparseCsrTensorImpl.cpp:55.)
    self.adj_csr = self.adj.to_sparse_csr().to(self.device)
[I 2026-05-06 17:21:51,152] Trial 22 finished with value: 0.725 and parameters: {'lr': 0.01, 'weight_decay': 0.0001, 'n_hidden': 256, 'n_layer': 2, 'dropout': 0.27687603287855045, 'knn_mode': 'd', 'k': 36, 'dexp': 6.572652338532, 'p_grd': 0.31769486671163283, 'unc_rem': 0.6184137721534679, 'unc_rel': 0.4638034357516571}. Best is trial 3 with value: 0.731.
    [CPU] Loading pubmed...
    DEBUG 3.1: Dataset init start
    DEBUG 3.2: prepare_data start pubmed
    ----Data statistics------'
    Name: pubmed
    #Nodes 19717
    #Edges 44324
    #Classes 3
    #Ave_degree 4.50
    ----Split statistics------'
    #Train samples 60 (default)
    #Val samples 500 (default)
    #Test samples 1000 (default)
    ----label noise information:------
    Instance dependent noise
    #Actual noise rate 0.21
    [cuda:1] LNPCC waiting for GPU slot...
    [cuda:1] Slot acquired (waited 245.5s). Starting GCN...
    FINAL_RESULT: {'acc': {'train': 0.8333333333333334, 'valid': 0.634, 'test': 0.723}, 'wall_s': 30.04, 'cpu_s': 25.54, 'gpu_s': 4.45, 'wait_s': 245.47}
    [Time] wall=30.0s | cpu=25.5s | gpu=4.5s
    C:\Users\fbrev\Documents\Acadêmico\Simulações\Python\NoisyGL\predictor\Base_Predictor.py:114: UserWarning: expandable_segments not supported on this platform (Triggered internally at ..\c10/cuda/CUDAAllocatorConfig.h:28.)
    self.edge_index = self._cpu_edge_index.to(self.device)
    C:\Users\fbrev\Documents\Acadêmico\Simulações\Python\NoisyGL\predictor\Base_Predictor.py:144: UserWarning: Sparse CSR tensor support is in beta state. If you miss a functionality in the sparse tensor support, please submit a feature request to https://github.com/pytorch/pytorch/issues. (Triggered internally at ..\aten\src\ATen\SparseCsrTensorImpl.cpp:55.)
    self.adj_csr = self.adj.to_sparse_csr().to(self.device)
