[I 2026-05-10 18:29:38,998] Trial 67 finished with value: 0.23772752344180917 and parameters: {'lr': 0.05, 'weight_decay': 0.001, 'n_hidden': 32, 'n_layer': 3, 'dropout': 0.6657259645059637, 'knn_mode': 'd', 'k': 33, 'dexp': 4.712017919483539, 'p_grd': 0.763450822419197, 'unc_rem': 0.1380671737889212, 'unc_rel': 0.13575846333095146}. Best is trial 34 with value: 0.3345835631549917.
    [CPU] Loading roman-empire...
    DEBUG 3.1: Dataset init start
    DEBUG 3.2: prepare_data start roman-empire
    ----Data statistics------'
    Name: roman-empire
    #Nodes 22662
    #Edges 32927
    #Classes 18
    #Ave_degree 2.91
    ----Split statistics------'
    #Train samples 1133 (5.0 % of nodes)
    #Val samples 3399 (15.0 % of nodes)
    #Test samples 18130 (remaining)
    ----label noise information:------
    Instance dependent noise
    #Actual noise rate 0.40
    [cuda:1] LNPCC waiting for GPU slot...
    [cuda:1] Slot acquired (waited 0.0s). Starting GCN...
    FINAL_RESULT: {'acc': {'train': 0.3909973521624007, 'valid': 0.21977052074139453, 'test': 0.3068946497517926}, 'wall_s': 103.21, 'cpu_s': 100.94, 'gpu_s': 2.23, 'wait_s': 0.0}
    [Time] wall=103.2s | cpu=100.9s | gpu=2.2s
    C:\Users\fbrev\Documents\Acadêmico\Simulações\Python\NoisyGL\predictor\Base_Predictor.py:114: UserWarning: expandable_segments not supported on this platform (Triggered internally at ..\c10/cuda/CUDAAllocatorConfig.h:28.)
    self.edge_    ----Data statistics------'
    Name: roman-empire
    #Nodes 22662
    #Edges 32927
    #Classes 18
    #Ave_degree 2.91
    ----Split statistics------'
    #Train samples 1133 (5.0 % of nodes)
    #Val samples 3399 (15.0 % of nodes)
    #Test samples 18130 (remaining)
    ----label noise information:------
    Instance dependent noise
    #Actual noise rate 0.40
    [cuda:1] LNPCC waiting for GPU slot...
    [cuda:1] Slot acquired (waited 0.0s). Starting GCN...
    FINAL_RESULT: {'acc': {'train': 0.2504520795660036, 'valid': 0.17563989408649602, 'test': 0.21731936017650302}, 'wall_s': 386.98, 'cpu_s': 384.05, 'gpu_s': 2.89, 'wait_s': 0.0}
    [Time] wall=387.0s | cpu=384.0s | gpu=2.9s
    C:\Users\fbrev\Documents\Acadêmico\Simulações\Python\NoisyGL\predictor\Base_Predictor.py:114: UserWarning: expandable_segments not supported on this platform (Triggered internally at ..\c10/cuda/CUDAAllocatorConfig.h:28.)
    self.edge_index = self._    ----Data statistics------'
    Name: roman-empire
    #Nodes 22662
    #Edges 32927
    #Classes 18
    #Ave_degree 2.91
    ----Split statistics------'
    #Train samples 1133 (5.0 % of nodes)
    #Val samples 3399 (15.0 % of nodes)
    #Test samples 18130 (remaining)
    ----label noise information:------
    Instance dependent noise
    #Actual noise rate 0.40
    [cuda:1] LNPCC waiting for GPU slot...
    [cuda:1] Slot acquired (waited 0.0s). Starting GCN...
    FINAL_RESULT: {'acc': {'train': 0.1856763925729443, 'valid': 0.18446601941747573, 'test': 0.25956977385548813}, 'wall_s': 431.6, 'cpu_s': 429.37, 'gpu_s': 2.19, 'wait_s': 0.0}
    [Time] wall=431.6s | cpu=429.4s | gpu=2.2s
    C:\Users\fbrev\Documents\Acadêmico\Simulações\Python\NoisyGL\predictor\Base_Predictor.py:114: UserWarning: expandable_segments not supported on this platform (Triggered internally at ..\c10/cuda/CUDAAllocatorConfig.h:28.)
    self.edge_in    ----Data statistics------'
    Name: roman-empire
    #Nodes 22662
    #Edges 32927
    #Classes 18
    #Ave_degree 2.91
    ----Split statistics------'
    #Train samples 1133 (5.0 % of nodes)
    #Val samples 3399 (15.0 % of nodes)
    #Test samples 18130 (remaining)
    ----label noise information:------
    Instance dependent noise
    #Actual noise rate 0.40
    [cuda:1] LNPCC waiting for GPU slot...
    [cuda:1] Slot acquired (waited 0.0s). Starting GCN...
    FINAL_RESULT: {'acc': {'train': 0.1856763925729443, 'valid': 0.18446601941747573, 'test': 0.25956977385548813}, 'wall_s': 429.71, 'cpu_s': 427.38, 'gpu_s': 2.3, 'wait_s': 0.0}
    [Time] wall=429.7s | cpu=427.4s | gpu=2.3s
    C:\Users\fbrev\Documents\Acadêmico\Simulações\Python\NoisyGL\predictor\Base_Predictor.py:114: UserWarning: expandable_segments not supported on this platform (Triggered internally at ..\c10/cuda/CUDAAllocatorConfig.h:28.)
    self.edge_index = self._cpu_    ----Data statistics------'
    Name: roman-empire
    #Nodes 22662
    #Edges 32927
    #Classes 18
    #Ave_degree 2.91
    ----Split statistics------'
    #Train samples 1133 (5.0 % of nodes)
    #Val samples 3399 (15.0 % of nodes)
    #Test samples 18130 (remaining)
    ----label noise information:------
    Instance dependent noise
    #Actual noise rate 0.40
    [cuda:1] LNPCC waiting for GPU slot...
    [cuda:1] Slot acquired (waited 0.0s). Starting GCN...
    FINAL_RESULT: {'acc': {'train': 0.3288650580875782, 'valid': 0.2283024418946749, 'test': 0.32691671263099836}, 'wall_s': 357.16, 'cpu_s': 354.8, 'gpu_s': 2.31, 'wait_s': 0.0}
    [Time] wall=357.2s | cpu=354.8s | gpu=2.3s
    C:\Users\fbrev\Documents\Acadêmico\Simulações\Python\NoisyGL\predictor\Base_Predictor.py:114: UserWarning: expandable_segments not supported on this platform (Triggered internally at ..\c10/cuda/CUDAAllocatorConfig.h:28.)
    self.edge_ind    ----Data statistics------'
    Name: roman-empire
    #Nodes 22662
    #Edges 32927
    #Classes 18
    #Ave_degree 2.91
    ----Split statistics------'
    #Train samples 1133 (5.0 % of nodes)
    #Val samples 3399 (15.0 % of nodes)
    #Test samples 18130 (remaining)
    ----label noise information:------
    Instance dependent noise
    #Actual noise rate 0.40
    [cuda:1] LNPCC waiting for GPU slot...
    [cuda:1] Slot acquired (waited 0.0s). Starting GCN...
    FINAL_RESULT: {'acc': {'train': 0.3288650580875782, 'valid': 0.2283024418946749, 'test': 0.32691671263099836}, 'wall_s': 357.66, 'cpu_s': 355.33, 'gpu_s': 2.28, 'wait_s': 0.0}
    [Time] wall=357.7s | cpu=355.3s | gpu=2.3s
    C:\Users\fbrev\Documents\Acadêmico\Simulações\Python\NoisyGL\predictor\Base_Predictor.py:114: UserWarning: expandable_segments not supported on this platform (Triggered internally at ..\c10/cuda/CUDAAllocatorConfig.h:28.)
    self.edge_index = self._cpu_    ----Data statistics------'
    Name: roman-empire
    #Nodes 22662
    #Edges 32927
    #Classes 18
    #Ave_degree 2.91
    ----Split statistics------'
    #Train samples 1133 (5.0 % of nodes)
    #Val samples 3399 (15.0 % of nodes)
    #Test samples 18130 (remaining)
    ----label noise information:------
    Instance dependent noise
    #Actual noise rate 0.40
    [cuda:1] LNPCC waiting for GPU slot...
    [cuda:1] Slot acquired (waited 0.0s). Starting GCN...
    FINAL_RESULT: {'acc': {'train': 0.3262411347517731, 'valid': 0.23183289202706678, 'test': 0.3289023717595146}, 'wall_s': 416.58, 'cpu_s': 414.26, 'gpu_s': 2.27, 'wait_s': 0.0}
    [Time] wall=416.6s | cpu=414.3s | gpu=2.3s
    C:\Users\fbrev\Documents\Acadêmico\Simulações\Python\NoisyGL\predictor\Base_Predictor.py:114: UserWarning: expandable_segments not supported on this platform (Triggered internally at ..\c10/cuda/CUDAAllocatorConfig.h:28.)
    self.edge_ind    ----Data statistics------'
    Name: roman-empire
    #Nodes 22662
    #Edges 32927
    #Classes 18
    #Ave_degree 2.91
    ----Split statistics------'
    #Train samples 1133 (5.0 % of nodes)
    #Val samples 3399 (15.0 % of nodes)
    #Test samples 18130 (remaining)
    ----label noise information:------
    Instance dependent noise
    #Actual noise rate 0.40
    [cuda:1] LNPCC waiting for GPU slot...
    [cuda:1] Slot acquired (waited 0.0s). Starting GCN...
    FINAL_RESULT: {'acc': {'train': 0.34245366284201234, 'valid': 0.22918505442777287, 'test': 0.3283507997793712}, 'wall_s': 640.15, 'cpu_s': 637.82, 'gpu_s': 2.28, 'wait_s': 0.0}
    [Time] wall=640.1s | cpu=637.8s | gpu=2.3s
    C:\Users\fbrev\Documents\Acadêmico\Simulações\Python\NoisyGL\predictor\Base_Predictor.py:114: UserWarning: expandable_segments not supported on this platform (Triggered internally at ..\c10/cuda/CUDAAllocatorConfig.h:28.)
    self.edge_index = self._    ----Data statistics------'
    Name: roman-empire
    #Nodes 22662
    #Edges 32927
    #Classes 18
    #Ave_degree 2.91
    ----Split statistics------'
    #Train samples 1133 (5.0 % of nodes)
    #Val samples 3399 (15.0 % of nodes)
    #Test samples 18130 (remaining)
    ----label noise information:------
    Instance dependent noise
    #Actual noise rate 0.40
    [cuda:1] LNPCC waiting for GPU slot...
    [cuda:1] Slot acquired (waited 0.0s). Starting GCN...
    FINAL_RESULT: {'acc': {'train': 0.35216240070609, 'valid': 0.22741982936157693, 'test': 0.3252619966905681}, 'wall_s': 505.15, 'cpu_s': 502.72, 'gpu_s': 2.38, 'wait_s': 0.0}
    [Time] wall=505.1s | cpu=502.7s | gpu=2.4s
    C:\Users\fbrev\Documents\Acadêmico\Simulações\Python\NoisyGL\predictor\Base_Predictor.py:114: UserWarning: expandable_segments not supported on this platform (Triggered internally at ..\c10/cuda/CUDAAllocatorConfig.h:28.)
    self.edge_index    ----Data statistics------'
    Name: roman-empire
    #Nodes 22662
    #Edges 32927
    #Classes 18
    #Ave_degree 2.91
    ----Split statistics------'
    #Train samples 1133 (5.0 % of nodes)
    #Val samples 3399 (15.0 % of nodes)
    #Test samples 18130 (remaining)
    ----label noise information:------
    Instance dependent noise
    #Actual noise rate 0.40
    [cuda:1] LNPCC waiting for GPU slot...
    [cuda:1] Slot acquired (waited 0.0s). Starting GCN...
    FINAL_RESULT: {'acc': {'train': 0.415929203539823, 'valid': 0.22859664607237423, 'test': 0.3173745173745174}, 'wall_s': 488.1, 'cpu_s': 485.15, 'gpu_s': 2.91, 'wait_s': 0.0}
    [Time] wall=488.1s | cpu=485.2s | gpu=2.9s
    C:\Users\fbrev\Documents\Acadêmico\Simulações\Python\NoisyGL\predictor\Base_Predictor.py:114: UserWarning: expandable_segments not supported on this platform (Triggered internally at ..\c10/cuda/CUDAAllocatorConfig.h:28.)
    self.edge_index = self._cpu_edge_index.to(self.device)
    C:\Users\fbrev\Documents\Acadêmico\Simulações\Python\NoisyGL\predictor\Base_Predictor.py:144: UserWarning: Sparse CSR tensor support is in beta state. If you miss a functionality in the sparse tensor support, please submit a feature request to https://github.com/pytorch/pytorch/issues. (Triggered internally at ..\aten\src\ATen\SparseCsrTensorImpl.cpp:55.)
    self.adj_csr = self.adj.to_sparse_csr().to(self.device)
[I 2026-05-10 19:06:40,320] Trial 77 finished with value: 0.3173745173745174 and parameters: {'lr': 0.01, 'weight_decay': 0.001, 'n_hidden': 128, 'n_layer': 2, 'dropout': 0.5296571943652342, 'knn_mode': 'd', 'k': 18, 'dexp': 3.5584502813964622, 'p_grd': 0.8929360932233211, 'unc_rem': 0.24490257279232167, 'unc_rel': 0.11582489494372597}. Best is trial 34 with value: 0.3345835631549917.
    [CPU] Loading roman-empire...
    DEBUG 3.1: Dataset init start
    DEBUG 3.2: prepare_data start roman-empire
    ----Data statistics------'
    Name: roman-empire
    #Nodes 22662
    #Edges 32927
    #Classes 18
    #Ave_degree 2.91
    ----Split statistics------'
    #Train samples 1133 (5.0 % of nodes)
    #Val samples 3399 (15.0 % of nodes)
    #Test samples 18130 (remaining)
    ----label noise information:------
    Instance dependent noise
    #Actual noise rate 0.40
    [cuda:1] LNPCC waiting for GPU slot...
    [cuda:1] Slot acquired (waited 0.0s). Starting GCN...
    FINAL_RESULT: {'acc': {'train': 0.23737821080602303, 'valid': 0.20476610767872905, 'test': 0.2861555432984004}, 'wall_s': 74.72, 'cpu_s': 72.55, 'gpu_s': 2.13, 'wait_s': 0.0}
    [Time] wall=74.7s | cpu=72.5s | gpu=2.1s
    C:\Users\fbrev\Documents\Acadêmico\Simulações\Python\NoisyGL\predictor\Base_Predictor.py:114: UserWarning: expandable_segments not supported on this platform (Triggered internally at ..\c10/cuda/CUDAAllocatorConfig.h:28.)
    self.edge_index = self._cpu_edg    ----Data statistics------'
    Name: roman-empire
    #Nodes 22662
    #Edges 32927
    #Classes 18
    #Ave_degree 2.91
    ----Split statistics------'
    #Train samples 1133 (5.0 % of nodes)
    #Val samples 3399 (15.0 % of nodes)
    #Test samples 18130 (remaining)
    ----label noise information:------
    Instance dependent noise
    #Actual noise rate 0.40
    [cuda:1] LNPCC waiting for GPU slot...
    [cuda:1] Slot acquired (waited 0.0s). Starting GCN...
    FINAL_RESULT: {'acc': {'train': 0.4157801418439716, 'valid': 0.22359517505148574, 'test': 0.3158852730281302}, 'wall_s': 477.38, 'cpu_s': 474.6, 'gpu_s': 2.74, 'wait_s': 0.0}
    [Time] wall=477.4s | cpu=474.6s | gpu=2.7s
    C:\Users\fbrev\Documents\Acadêmico\Simulações\Python\NoisyGL\predictor\Base_Predictor.py:114: UserWarning: expandable_segments not supported on this platform (Triggered internally at ..\c10/cuda/CUDAAllocatorConfig.h:28.)
    self.edge_i    ----Data statistics------'
    Name: roman-empire
    #Nodes 22662
    #Edges 32927
    #Classes 18
    #Ave_degree 2.91
    ----Split statistics------'
    #Train samples 1133 (5.0 % of nodes)
    #Val samples 3399 (15.0 % of nodes)
    #Test samples 18130 (remaining)
    ----label noise information:------
    Instance dependent noise
    #Actual noise rate 0.40
    [cuda:1] LNPCC waiting for GPU slot...
    [cuda:1] Slot acquired (waited 0.0s). Starting GCN...
    FINAL_RESULT: {'acc': {'train': 0.3306808134394341, 'valid': 0.23036187113857018, 'test': 0.3252068394925538}, 'wall_s': 441.38, 'cpu_s': 439.14, 'gpu_s': 2.2, 'wait_s': 0.0}
    [Time] wall=441.4s | cpu=439.1s | gpu=2.2s
    C:\Users\fbrev\Documents\Acadêmico\Simulações\Python\NoisyGL\predictor\Base_Predictor.py:114: UserWarning: expandable_segments not supported on this platform (Triggered internally at ..\c10/cuda/CUDAAllocatorConfig.h:28.)
    self.edge_index = self._cpu_    ----Data statistics------'
    Name: roman-empire
    #Nodes 22662
    #Edges 32927
    #Classes 18
    #Ave_degree 2.91
    ----Split statistics------'
    #Train samples 1133 (5.0 % of nodes)
    #Val samples 3399 (15.0 % of nodes)
    #Test samples 18130 (remaining)
    ----label noise information:------
    Instance dependent noise
    #Actual noise rate 0.40
    [cuda:1] LNPCC waiting for GPU slot...
    [cuda:1] Slot acquired (waited 0.0s). Starting GCN...
    FINAL_RESULT: {'acc': {'train': 0.3491773308957952, 'valid': 0.22477199176228302, 'test': 0.3255929398786542}, 'wall_s': 577.61, 'cpu_s': 575.19, 'gpu_s': 2.38, 'wait_s': 0.0}
    [Time] wall=577.6s | cpu=575.2s | gpu=2.4s
    C:\Users\fbrev\Documents\Acadêmico\Simulações\Python\NoisyGL\predictor\Base_Predictor.py:114: UserWarning: expandable_segments not supported on this platform (Triggered internally at ..\c10/cuda/CUDAAllocatorConfig.h:28.)
    self.edge_    ----Data statistics------'
    Name: roman-empire
    #Nodes 22662
    #Edges 32927
    #Classes 18
    #Ave_degree 2.91
    ----Split statistics------'
    #Train samples 1133 (5.0 % of nodes)
    #Val samples 3399 (15.0 % of nodes)
    #Test samples 18130 (remaining)
    ----label noise information:------
    Instance dependent noise
    #Actual noise rate 0.40
    [cuda:1] LNPCC waiting for GPU slot...
    [cuda:1] Slot acquired (waited 0.0s). Starting GCN...
    FINAL_RESULT: {'acc': {'train': 0.35013262599469497, 'valid': 0.2297734627831715, 'test': 0.33072255929398786}, 'wall_s': 900.11, 'cpu_s': 897.66, 'gpu_s': 2.41, 'wait_s': 0.0}
    [Time] wall=900.1s | cpu=897.7s | gpu=2.4s
    C:\Users\fbrev\Documents\Acadêmico\Simulações\Python\NoisyGL\predictor\Base_Predictor.py:114: UserWarning: expandable_segments not supported on this platform (Triggered internally at ..\c10/cuda/CUDAAllocatorConfig.h:28.)
    self.edge_index = self._cpu_edge_index.to(self.device)
    C:\Users\fbrev\Documents\Acadêmico\Simulações\Python\NoisyGL\predictor\Base_Predictor.py:144: UserWarning: Sparse CSR tensor support is in beta state. If you miss a functionality in the sparse tensor support, please submit a feature request to https://github.com/pytorch/pytorch/issues. (Triggered internally at ..\aten\src\ATen\SparseCsrTensorImpl.cpp:55.)
    self.adj_csr = self.adj.to_sparse_csr().to(self.device)
[I 2026-05-10 19:30:34,861] Trial 83 finished with value: 0.33072255929398786 and parameters: {'lr': 0.01, 'weight_decay': 0.001, 'n_hidden': 32, 'n_layer': 2, 'dropout': 0.5640480226773084, 'knn_mode': 'd', 'k': 23, 'dexp': 5.150729342621859, 'p_grd': 0.9793497387489383, 'unc_rem': 0.45445692832578855, 'unc_rel': 0.23426633601349012}. Best is trial 34 with value: 0.3345835631549917.
    [CPU] Loading roman-empire...
    DEBUG 3.1: Dataset init start
    DEBUG 3.2: prepare_data start roman-empire
    ----Data statistics------'
    Name: roman-empire
    #Nodes 22662
    #Edges 32927
    #Classes 18
    #Ave_degree 2.91
    ----Split statistics------'
    #Train samples 1133 (5.0 % of nodes)
    #Val samples 3399 (15.0 % of nodes)
    #Test samples 18130 (remaining)
    ----label noise information:------
    Instance dependent noise
    #Actual noise rate 0.40
    [cuda:1] LNPCC waiting for GPU slot...
    [cuda:1] Slot acquired (waited 0.0s). Starting GCN...
    FINAL_RESULT: {'acc': {'train': 0.420627802690583, 'valid': 0.23124448367166814, 'test': 0.3340871483728627}, 'wall_s': 924.23, 'cpu_s': 922.12, 'gpu_s': 2.07, 'wait_s': 0.0}
    [Time] wall=924.2s | cpu=922.1s | gpu=2.1s
    C:\Users\fbrev\Documents\Acadêmico\Simulações\Python\NoisyGL\predictor\Base_Predictor.py:114: UserWarning: expandable_segments not supported on this platform (Triggered internally at ..\c10/cuda/CUDAAllocatorConfig.h:28.)
    self.edge_index = self._cpu_edge_index.to(self.device)
    C:\Users\fbrev\Documents\Acadêmico\Simulações\Python\NoisyGL\predictor\Base_Predictor.py:144: UserWarning: Sparse CSR tensor support is in beta state. If you miss a functionality in the sparse tensor support, please submit a feature request to https://github.com/pytorch/pytorch/issues. (Triggered internally at ..\aten\src\ATen\SparseCsrTensorImpl.cpp:55.)
    self.adj_csr = self.adj.to_sparse_csr().to(self.device)
[I 2026-05-10 19:46:05,100] Trial 86 finished with value: 0.3340871483728627 and parameters: {'lr': 0.05, 'weight_decay': 0.001, 'n_hidden': 32, 'n_layer': 2, 'dropout': 0.5419701479517675, 'knn_mode': 'd', 'k': 22, 'dexp': 5.905173981824332, 'p_grd': 0.9944672410330745, 'unc_rem': 0.349157132957554, 'unc_rel': 0.2679487468327548}. Best is trial 34 with value: 0.3345835631549917.
    [CPU] Loading roman-empire...
    DEBUG 3.1: Dataset init start
    DEBUG 3.2: prepare_data start roman-empire
    ----Data statistics------'
    Name: roman-empire
    #Nodes 22662
    #Edges 32927
    #Classes 18
    #Ave_degree 2.91
    ----Split statistics------'
    #Train samples 1133 (5.0 % of nodes)
    #Val samples 3399 (15.0 % of nodes)
    #Test samples 18130 (remaining)
    ----label noise information:------
    Instance dependent noise
    #Actual noise rate 0.40
    [cuda:1] LNPCC waiting for GPU slot...
    [cuda:1] Slot acquired (waited 0.0s). Starting GCN...
    FINAL_RESULT: {'acc': {'train': 0.39695340501792115, 'valid': 0.23095027949396882, 'test': 0.3259238830667402}, 'wall_s': 868.39, 'cpu_s': 865.96, 'gpu_s': 2.39, 'wait_s': 0.0}
    [Time] wall=868.4s | cpu=866.0s | gpu=2.4s
    C:\Users\fbrev\Documents\Acadêmico\Simulações\Python\NoisyGL\predictor\Base_Predictor.py:114: UserWarning: expandable_segments not supported on this platform (Triggered internally at ..\c10/cuda/CUDAAllocatorConfig.h:28.)
    self.edge_index = self._cpu_edge_index.to(self.device)
    C:\Users\fbrev\Documents\Acadêmico\Simulações\Python\NoisyGL\predictor\Base_Predictor.py:144: UserWarning: Sparse CSR tensor support is in beta state. If you miss a functionality in the sparse tensor support, please submit a feature request to https://github.com/pytorch/pytorch/issues. (Triggered internally at ..\aten\src\ATen\SparseCsrTensorImpl.cpp:55.)
    self.adj_csr = self.adj.to_sparse_csr().to(self.device)
