[I 2026-05-01 20:39:09,723] Trial 11 finished with value: 0.898 and parameters: {'lr': 0.001, 'weight_decay': 0.0, 'n_hidden': 64, 'n_layer': 2, 'dropout': 0.494065325686168, 'knn_mode': 'd', 'k': 42, 'dexp': 7.078978279425739, 'p_grd': 0.8093090331933839, 'unc_rem': 0.8175565956907389, 'unc_rel': 0.2011242639539048}. Best is trial 7 with value: 0.907.
    [CPU] Loading amazonpho...
    DEBUG 3.1: Dataset init start
    DEBUG 3.2: prepare_data start amazonpho
    ----Data statistics------'
    Name: amazonpho
    #Nodes 7650
    #Edges 119081
    #Classes 8
    #Ave_degree 31.13
    ----Split statistics------'
    #Train samples 160 (20 nodes per class)
    #Val samples 500 (specified)
    #Test samples 1000 (specified)
    ----label noise information:------
    Instance dependent noise
    #Actual noise rate 0.13
    [cuda:1] LNPCC waiting for GPU slot...
    [cuda:1] Slot acquired (waited 155.5s). Starting GCN...
    FINAL_RESULT: {'acc': {'train': 0.8974358974358975, 'valid': 0.786, 'test': 0.856}, 'wall_s': 15.91, 'cpu_s': 13.59, 'gpu_s': 2.25, 'wait_s': 155.51}
    [Time] wall=15.9s | cpu=13.6s | gpu=2.3s
    C:\Users\fbrev\Documents\Acadêmico\Simulações\Python\NoisyGL\predictor\Base_Predictor.py:114: UserWarning: expandable_segments not supported on this platform (Triggered internally at ..\c10/cuda/CUDAAllocatorConfig.h:28.)
    self.edge_index = self._cpu_edge_index.to(self.device)
    C:\Users\fbrev\Documents\Acadêmico\Simulações\Python\NoisyGL\predictor\Base_Predictor.py:144: UserWarning: Sparse CSR tensor support is in beta state. If you miss a functionality in the sparse tensor support, please submit a feature request to https://github.com/pytorch/pytorch/issues. (Triggered internally at ..\aten\src\ATen\SparseCsrTensorImpl.cpp:55.)
    self.adj_csr = self.adj.to_sparse_csr().to(self.device)
[I 2026-05-01 20:42:06,727] Trial 12 finished with value: 0.856 and parameters: {'lr': 0.01, 'weight_decay': 0.0001, 'n_hidden': 32, 'n_layer': 2, 'dropout': 0.2122528355439598, 'knn_mode': 's', 'k': 5, 'dexp': 3.415604653326267, 'p_grd': 0.48484851513627636, 'unc_rem': 0.1202648011676728, 'unc_rel': 0.22897144679153436}. Best is trial 7 with value: 0.907.
    [CPU] Loading amazonpho...
    DEBUG 3.1: Dataset init start
    DEBUG 3.2: prepare_data start amazonpho
    ----Data statistics------'
    Name: amazonpho
    #Nodes 7650
    #Edges 119081
    #Classes 8
    #Ave_degree 31.13
    ----Split statistics------'
    #Train samples 160 (20 nodes per class)
    #Val samples 500 (specified)
    #Test samples 1000 (specified)
    ----label noise information:------
    Instance dependent noise
    #Actual noise rate 0.13
    [cuda:1] LNPCC waiting for GPU slot...
    [cuda:1] Slot acquired (waited 296.5s). Starting GCN...
    FINAL_RESULT: {'acc': {'train': 0.310126582278481, 'valid': 0.392, 'test': 0.446}, 'wall_s': 17.57, 'cpu_s': 14.93, 'gpu_s': 2.58, 'wait_s': 296.46}
    [Time] wall=17.6s | cpu=14.9s | gpu=2.6s
    C:\Users\fbrev\Documents\Acadêmico\Simulações\Python\NoisyGL\predictor\Base_Predictor.py:114: UserWarning: expandable_segments not supported on this platform (Triggered internally at ..\c10/cuda/CUDAAllocatorConfig.h:28.)
    self.edge_index = self._cpu_edge_index.to(self.device)
    C:\Users\fbrev\Documents\Acadêmico\Simulações\Python\NoisyGL\predictor\Base_Predictor.py:144: UserWarning: Sparse CSR tensor support is in beta state. If you miss a functionality in the sparse tensor support, please submit a feature request to https://github.com/pytorch/pytorch/issues. (Triggered internally at ..\aten\src\ATen\SparseCsrTensorImpl.cpp:55.)
    self.adj_csr = self.adj.to_sparse_csr().to(self.device)
[I 2026-05-01 20:47:26,390] Trial 13 finished with value: 0.446 and parameters: {'lr': 0.1, 'weight_decay': 0.01, 'n_hidden': 64, 'n_layer': 2, 'dropout': 0.14062982503090202, 'knn_mode': 'd', 'k': 21, 'dexp': 2.6455009303886685, 'p_grd': 0.3877144538888293, 'unc_rem': 0.27211818926590114, 'unc_rel': 0.3678477824590435}. Best is trial 7 with value: 0.907.
    [CPU] Loading amazonpho...
    DEBUG 3.1: Dataset init start
    DEBUG 3.2: prepare_data start amazonpho
    ----Data statistics------'
    Name: amazonpho
    #Nodes 7650
    #Edges 119081
    #Classes 8
    #Ave_degree 31.13
    ----Split statistics------'
    #Train samples 160 (20 nodes per class)
    #Val samples 500 (specified)
    #Test samples 1000 (specified)
    ----label noise information:------
    Instance dependent noise
    #Actual noise rate 0.13
    [cuda:1] LNPCC waiting for GPU slot...
    [cuda:1] Slot acquired (waited 120.5s). Starting GCN...
    FINAL_RESULT: {'acc': {'train': 0.8375, 'valid': 0.806, 'test': 0.903}, 'wall_s': 24.46, 'cpu_s': 22.23, 'gpu_s': 2.17, 'wait_s': 120.54}
    [Time] wall=24.5s | cpu=22.2s | gpu=2.2s
    C:\Users\fbrev\Documents\Acadêmico\Simulações\Python\NoisyGL\predictor\Base_Predictor.py:114: UserWarning: expandable_segments not supported on this platform (Triggered internally at ..\c10/cuda/CUDAAllocatorConfig.h:28.)
    self.edge_index = self._cpu_edge_index.to(self.device)
    C:\Users\fbrev\Documents\Acadêmico\Simulações\Python\NoisyGL\predictor\Base_Predictor.py:144: UserWarning: Sparse CSR tensor support is in beta state. If you miss a functionality in the sparse tensor support, please submit a feature request to https://github.com/pytorch/pytorch/issues. (Triggered internally at ..\aten\src\ATen\SparseCsrTensorImpl.cpp:55.)
    self.adj_csr = self.adj.to_sparse_csr().to(self.device)
[I 2026-05-01 20:49:56,954] Trial 14 finished with value: 0.903 and parameters: {'lr': 0.01, 'weight_decay': 0.05, 'n_hidden': 32, 'n_layer': 2, 'dropout': 0.015305141591561267, 'knn_mode': 'd', 'k': 45, 'dexp': 9.576049467794768, 'p_grd': 0.8745776507907911, 'unc_rem': 0.70189039053817, 'unc_rel': 0.9645685504300959}. Best is trial 7 with value: 0.907.
    [CPU] Loading amazonpho...
    DEBUG 3.1: Dataset init start
    DEBUG 3.2: prepare_data start amazonpho
    ----Data statistics------'
    Name: amazonpho
    #Nodes 7650
    #Edges 119081
    #Classes 8
    #Ave_degree 31.13
    ----Split statistics------'
    #Train samples 160 (20 nodes per class)
    #Val samples 500 (specified)
    #Test samples 1000 (specified)
    ----label noise information:------
    Instance dependent noise
    #Actual noise rate 0.13
    [cuda:1] LNPCC waiting for GPU slot...
    [cuda:1] Slot acquired (waited 268.0s). Starting GCN...
    FINAL_RESULT: {'acc': {'train': 0.8910256410256411, 'valid': 0.796, 'test': 0.885}, 'wall_s': 20.04, 'cpu_s': 11.75, 'gpu_s': 8.22, 'wait_s': 267.99}
    [Time] wall=20.0s | cpu=11.8s | gpu=8.2s
    C:\Users\fbrev\Documents\Acadêmico\Simulações\Python\NoisyGL\predictor\Base_Predictor.py:114: UserWarning: expandable_segments not supported on this platform (Triggered internally at ..\c10/cuda/CUDAAllocatorConfig.h:28.)
    self.edge_index = self._cpu_edge_index.to(self.device)
    C:\Users\fbrev\Documents\Acadêmico\Simulações\Python\NoisyGL\predictor\Base_Predictor.py:144: UserWarning: Sparse CSR tensor support is in beta state. If you miss a functionality in the sparse tensor support, please submit a feature request to https://github.com/pytorch/pytorch/issues. (Triggered internally at ..\aten\src\ATen\SparseCsrTensorImpl.cpp:55.)
    self.adj_csr = self.adj.to_sparse_csr().to(self.device)
[I 2026-05-01 20:54:50,769] Trial 15 finished with value: 0.885 and parameters: {'lr': 0.001, 'weight_decay': 0.0001, 'n_hidden': 256, 'n_layer': 3, 'dropout': 0.1413949432925266, 'knn_mode': 's', 'k': 24, 'dexp': 4.516243024639353, 'p_grd': 0.32708225210193276, 'unc_rem': 0.7231122828216123, 'unc_rel': 0.46595637793214884}. Best is trial 7 with value: 0.907.
    [CPU] Loading amazonpho...
    DEBUG 3.1: Dataset init start
    DEBUG 3.2: prepare_data start amazonpho
    ----Data statistics------'
    Name: amazonpho
    #Nodes 7650
    #Edges 119081
    #Classes 8
    #Ave_degree 31.13
    ----Split statistics------'
    #Train samples 160 (20 nodes per class)
    #Val samples 500 (specified)
    #Test samples 1000 (specified)
    ----label noise information:------
    Instance dependent noise
    #Actual noise rate 0.13
    [cuda:1] LNPCC waiting for GPU slot...
    [cuda:1] Slot acquired (waited 127.1s). Starting GCN...
    FINAL_RESULT: {'acc': {'train': 0.14102564102564102, 'valid': 0.29, 'test': 0.296}, 'wall_s': 22.21, 'cpu_s': 14.03, 'gpu_s': 8.12, 'wait_s': 127.15}
    [Time] wall=22.2s | cpu=14.0s | gpu=8.1s
    C:\Users\fbrev\Documents\Acadêmico\Simulações\Python\NoisyGL\predictor\Base_Predictor.py:114: UserWarning: expandable_segments not supported on this platform (Triggered internally at ..\c10/cuda/CUDAAllocatorConfig.h:28.)
    self.edge_index = self._cpu_edge_index.to(self.device)
    C:\Users\fbrev\Documents\Acadêmico\Simulações\Python\NoisyGL\predictor\Base_Predictor.py:144: UserWarning: Sparse CSR tensor support is in beta state. If you miss a functionality in the sparse tensor support, please submit a feature request to https://github.com/pytorch/pytorch/issues. (Triggered internally at ..\aten\src\ATen\SparseCsrTensorImpl.cpp:55.)
    self.adj_csr = self.adj.to_sparse_csr().to(self.device)
[I 2026-05-01 20:57:25,911] Trial 16 finished with value: 0.296 and parameters: {'lr': 0.1, 'weight_decay': 0.001, 'n_hidden': 256, 'n_layer': 3, 'dropout': 0.18354570559166064, 'knn_mode': 's', 'k': 9, 'dexp': 8.051723414079143, 'p_grd': 0.6333930865364665, 'unc_rem': 0.7421993538209207, 'unc_rel': 0.802445782297044}. Best is trial 7 with value: 0.907.
    [CPU] Loading amazonpho...
    DEBUG 3.1: Dataset init start
    DEBUG 3.2: prepare_data start amazonpho
    ----Data statistics------'
    Name: amazonpho
    #Nodes 7650
    #Edges 119081
    #Classes 8
    #Ave_degree 31.13
    ----Split statistics------'
    #Train samples 160 (20 nodes per class)
    #Val samples 500 (specified)
    #Test samples 1000 (specified)
    ----label noise information:------
    Instance dependent noise
    #Actual noise rate 0.13
    [cuda:1] LNPCC waiting for GPU slot...
    [cuda:1] Slot acquired (waited 128.3s). Starting GCN...
    FINAL_RESULT: {'acc': {'train': 0.1337579617834395, 'valid': 0.25, 'test': 0.237}, 'wall_s': 20.19, 'cpu_s': 11.94, 'gpu_s': 8.18, 'wait_s': 128.28}
    [Time] wall=20.2s | cpu=11.9s | gpu=8.2s
    C:\Users\fbrev\Documents\Acadêmico\Simulações\Python\NoisyGL\predictor\Base_Predictor.py:114: UserWarning: expandable_segments not supported on this platform (Triggered internally at ..\c10/cuda/CUDAAllocatorConfig.h:28.)
    self.edge_index = self._cpu_edge_index.to(self.device)
    C:\Users\fbrev\Documents\Acadêmico\Simulações\Python\NoisyGL\predictor\Base_Predictor.py:144: UserWarning: Sparse CSR tensor support is in beta state. If you miss a functionality in the sparse tensor support, please submit a feature request to https://github.com/pytorch/pytorch/issues. (Triggered internally at ..\aten\src\ATen\SparseCsrTensorImpl.cpp:55.)
    self.adj_csr = self.adj.to_sparse_csr().to(self.device)
[I 2026-05-01 20:59:59,914] Trial 17 finished with value: 0.237 and parameters: {'lr': 0.05, 'weight_decay': 0.0, 'n_hidden': 256, 'n_layer': 3, 'dropout': 0.3641807986019758, 'knn_mode': 's', 'k': 49, 'dexp': 9.328383348297663, 'p_grd': 0.4182111015332727, 'unc_rem': 0.8642837879141492, 'unc_rel': 0.5757757652553932}. Best is trial 7 with value: 0.907.
    [CPU] Loading amazonpho...
    DEBUG 3.1: Dataset init start
    DEBUG 3.2: prepare_data start amazonpho
    ----Data statistics------'
    Name: amazonpho
    #Nodes 7650
    #Edges 119081
    #Classes 8
    #Ave_degree 31.13
    ----Split statistics------'
    #Train samples 160 (20 nodes per class)
    #Val samples 500 (specified)
    #Test samples 1000 (specified)
    ----label noise information:------
    Instance dependent noise
    #Actual noise rate 0.13
    [cuda:1] LNPCC waiting for GPU slot...
    [cuda:1] Slot acquired (waited 128.1s). Starting GCN...
    FINAL_RESULT: {'acc': {'train': 0.7961783439490446, 'valid': 0.762, 'test': 0.859}, 'wall_s': 16.4, 'cpu_s': 12.74, 'gpu_s': 3.59, 'wait_s': 128.05}
    [Time] wall=16.4s | cpu=12.7s | gpu=3.6s
    C:\Users\fbrev\Documents\Acadêmico\Simulações\Python\NoisyGL\predictor\Base_Predictor.py:114: UserWarning: expandable_segments not supported on this platform (Triggered internally at ..\c10/cuda/CUDAAllocatorConfig.h:28.)
    self.edge_index = self._cpu_edge_index.to(self.device)
    C:\Users\fbrev\Documents\Acadêmico\Simulações\Python\NoisyGL\predictor\Base_Predictor.py:144: UserWarning: Sparse CSR tensor support is in beta state. If you miss a functionality in the sparse tensor support, please submit a feature request to https://github.com/pytorch/pytorch/issues. (Triggered internally at ..\aten\src\ATen\SparseCsrTensorImpl.cpp:55.)
    self.adj_csr = self.adj.to_sparse_csr().to(self.device)
[I 2026-05-01 21:02:30,113] Trial 18 finished with value: 0.859 and parameters: {'lr': 0.05, 'weight_decay': 0.001, 'n_hidden': 64, 'n_layer': 3, 'dropout': 0.3219522623358499, 'knn_mode': 's', 'k': 22, 'dexp': 8.185841291407987, 'p_grd': 0.5114974534354224, 'unc_rem': 0.9861340676429743, 'unc_rel': 0.6712317219587044}. Best is trial 7 with value: 0.907.
    [CPU] Loading amazonpho...
    DEBUG 3.1: Dataset init start
    DEBUG 3.2: prepare_data start amazonpho
    ----Data statistics------'
    Name: amazonpho
    #Nodes 7650
    #Edges 119081
    #Classes 8
    #Ave_degree 31.13
    ----Split statistics------'
    #Train samples 160 (20 nodes per class)
    #Val samples 500 (specified)
    #Test samples 1000 (specified)
    ----label noise information:------
    Instance dependent noise
    #Actual noise rate 0.13
    [cuda:1] LNPCC waiting for GPU slot...
    [cuda:1] Slot acquired (waited 271.6s). Starting GCN...
    FINAL_RESULT: {'acc': {'train': 0.9675324675324676, 'valid': 0.796, 'test': 0.898}, 'wall_s': 14.98, 'cpu_s': 11.43, 'gpu_s': 3.49, 'wait_s': 271.65}
    [Time] wall=15.0s | cpu=11.4s | gpu=3.5s
    C:\Users\fbrev\Documents\Acadêmico\Simulações\Python\NoisyGL\predictor\Base_Predictor.py:114: UserWarning: expandable_segments not supported on this platform (Triggered internally at ..\c10/cuda/CUDAAllocatorConfig.h:28.)
    self.edge_index = self._cpu_edge_index.to(self.device)
    C:\Users\fbrev\Documents\Acadêmico\Simulações\Python\NoisyGL\predictor\Base_Predictor.py:144: UserWarning: Sparse CSR tensor support is in beta state. If you miss a functionality in the sparse tensor support, please submit a feature request to https://github.com/pytorch/pytorch/issues. (Triggered internally at ..\aten\src\ATen\SparseCsrTensorImpl.cpp:55.)
    self.adj_csr = self.adj.to_sparse_csr().to(self.device)
[I 2026-05-01 21:07:22,860] Trial 19 finished with value: 0.898 and parameters: {'lr': 0.001, 'weight_decay': 0.01, 'n_hidden': 128, 'n_layer': 2, 'dropout': 0.01692334190834286, 'knn_mode': 's', 'k': 12, 'dexp': 3.6597216058079924, 'p_grd': 0.22569094730999384, 'unc_rem': 0.29670909959681613, 'unc_rel': 0.3212860590798803}. Best is trial 7 with value: 0.907.
    [CPU] Loading amazonpho...
    DEBUG 3.1: Dataset init start
    DEBUG 3.2: prepare_data start amazonpho
    ----Data statistics------'
    Name: amazonpho
    #Nodes 7650
    #Edges 119081
    #Classes 8
    #Ave_degree 31.13
    ----Split statistics------'
    #Train samples 160 (20 nodes per class)
    #Val samples 500 (specified)
    #Test samples 1000 (specified)
    ----label noise information:------
    Instance dependent noise
    #Actual noise rate 0.13
    [cuda:1] LNPCC waiting for GPU slot...
    [cuda:1] Slot acquired (waited 129.0s). Starting GCN...
    FINAL_RESULT: {'acc': {'train': 0.9738562091503268, 'valid': 0.78, 'test': 0.888}, 'wall_s': 16.73, 'cpu_s': 14.08, 'gpu_s': 2.56, 'wait_s': 129.0}
    [Time] wall=16.7s | cpu=14.1s | gpu=2.6s
    C:\Users\fbrev\Documents\Acadêmico\Simulações\Python\NoisyGL\predictor\Base_Predictor.py:114: UserWarning: expandable_segments not supported on this platform (Triggered internally at ..\c10/cuda/CUDAAllocatorConfig.h:28.)
    self.edge_index = self._cpu_edge_index.to(self.device)
    C:\Users\fbrev\Documents\Acadêmico\Simulações\Python\NoisyGL\predictor\Base_Predictor.py:144: UserWarning: Sparse CSR tensor support is in beta state. If you miss a functionality in the sparse tensor support, please submit a feature request to https://github.com/pytorch/pytorch/issues. (Triggered internally at ..\aten\src\ATen\SparseCsrTensorImpl.cpp:55.)
    self.adj_csr = self.adj.to_sparse_csr().to(self.device)
[I 2026-05-01 21:09:54,543] Trial 20 finished with value: 0.888 and parameters: {'lr': 0.005, 'weight_decay': 0.001, 'n_hidden': 64, 'n_layer': 2, 'dropout': 0.6221492931231439, 'knn_mode': 'd', 'k': 32, 'dexp': 5.915453282004435, 'p_grd': 0.06257668384106913, 'unc_rem': 0.5474493293154991, 'unc_rel': 0.1102231922797901}. Best is trial 7 with value: 0.907.
    [CPU] Loading amazonpho...
    DEBUG 3.1: Dataset init start
    DEBUG 3.2: prepare_data start amazonpho
    ----Data statistics------'
    Name: amazonpho
    #Nodes 7650
    #Edges 119081
    #Classes 8
    #Ave_degree 31.13
    ----Split statistics------'
    #Train samples 160 (20 nodes per class)
    #Val samples 500 (specified)
    #Test samples 1000 (specified)
    ----label noise information:------
    Instance dependent noise
    #Actual noise rate 0.13
    [cuda:1] LNPCC waiting for GPU slot...
    [cuda:1] Slot acquired (waited 109.6s). Starting GCN...
    FINAL_RESULT: {'acc': {'train': 0.8343949044585988, 'valid': 0.798, 'test': 0.884}, 'wall_s': 26.67, 'cpu_s': 24.27, 'gpu_s': 2.33, 'wait_s': 109.62}
    [Time] wall=26.7s | cpu=24.3s | gpu=2.3s
    C:\Users\fbrev\Documents\Acadêmico\Simulações\Python\NoisyGL\predictor\Base_Predictor.py:114: UserWarning: expandable_segments not supported on this platform (Triggered internally at ..\c10/cuda/CUDAAllocatorConfig.h:28.)
    self.edge_index = self._cpu_edge_index.to(self.device)
    C:\Users\fbrev\Documents\Acadêmico\Simulações\Python\NoisyGL\predictor\Base_Predictor.py:144: UserWarning: Sparse CSR tensor support is in beta state. If you miss a functionality in the sparse tensor support, please submit a feature request to https://github.com/pytorch/pytorch/issues. (Triggered internally at ..\aten\src\ATen\SparseCsrTensorImpl.cpp:55.)
    self.adj_csr = self.adj.to_sparse_csr().to(self.device)
[I 2026-05-01 21:12:16,882] Trial 21 finished with value: 0.884 and parameters: {'lr': 0.01, 'weight_decay': 0.05, 'n_hidden': 32, 'n_layer': 2, 'dropout': 0.6073459241494369, 'knn_mode': 'd', 'k': 50, 'dexp': 9.777976137508189, 'p_grd': 0.9497461320970425, 'unc_rem': 0.027873114592523812, 'unc_rel': 0.971574619759168}. Best is trial 7 with value: 0.907.
    [CPU] Loading amazonpho...
    DEBUG 3.1: Dataset init start
    DEBUG 3.2: prepare_data start amazonpho
    ----Data statistics------'
    Name: amazonpho
    #Nodes 7650
    #Edges 119081
    #Classes 8
    #Ave_degree 31.13
    ----Split statistics------'
    #Train samples 160 (20 nodes per class)
    #Val samples 500 (specified)
    #Test samples 1000 (specified)
    ----label noise information:------
    Instance dependent noise
    #Actual noise rate 0.13
    [cuda:1] LNPCC waiting for GPU slot...
    [cuda:1] Slot acquired (waited 116.3s). Starting GCN...
    FINAL_RESULT: {'acc': {'train': 0.85625, 'valid': 0.808, 'test': 0.907}, 'wall_s': 24.62, 'cpu_s': 22.28, 'gpu_s': 2.27, 'wait_s': 116.3}
    [Time] wall=24.6s | cpu=22.3s | gpu=2.3s
    C:\Users\fbrev\Documents\Acadêmico\Simulações\Python\NoisyGL\predictor\Base_Predictor.py:114: UserWarning: expandable_segments not supported on this platform (Triggered internally at ..\c10/cuda/CUDAAllocatorConfig.h:28.)
    self.edge_index = self._cpu_edge_index.to(self.device)
    C:\Users\fbrev\Documents\Acadêmico\Simulações\Python\NoisyGL\predictor\Base_Predictor.py:144: UserWarning: Sparse CSR tensor support is in beta state. If you miss a functionality in the sparse tensor support, please submit a feature request to https://github.com/pytorch/pytorch/issues. (Triggered internally at ..\aten\src\ATen\SparseCsrTensorImpl.cpp:55.)
    self.adj_csr = self.adj.to_sparse_csr().to(self.device)
