[I 2026-04-27 15:09:43,797] Trial 123 finished with value: 0.3962235264097984 and parameters: {'lr': 0.1, 'weight_decay': 0.001, 'n_hidden': 128, 'n_layer': 3, 'dropout': 0.7547103373599714, 'knn_mode': 's', 'k': 48, 'dexp': 4.7940954061567, 'p_grd': 0.47820489452832704, 'unc_rem': 0.875759231725903, 'unc_rel': 0.6264608198438347}. Best is trial 29 with value: 0.40505230926256697.
    [CPU] Loading amazon-ratings...
    DEBUG 3.1: Dataset init start
    DEBUG 3.2: prepare_data start amazon-ratings
    ----Data statistics------'
    Name: amazon-ratings
    #Nodes 24492
    #Edges 93050
    #Classes 5
    #Ave_degree 7.60
    ----Split statistics------'
    #Train samples 1224 (5.0 % of nodes)
    #Val samples 3673 (15.0 % of nodes)
    #Test samples 19595 (remaining)
    ----label noise information:------
    Instance dependent noise
    #Actual noise rate 0.13
    [cuda:0] LNPCC waiting for GPU slot...
    [cuda:0] Slot acquired (waited 195.1s). Starting GCN...
    FINAL_RESULT: {'acc': {'train': 0.38480392156862747, 'valid': 0.3629185951538252, 'test': 0.3932635876499107}, 'wall_s': 55.74, 'cpu_s': 46.75, 'gpu_s': 8.95, 'wait_s': 195.07}
    [Time] wall=55.7s | cpu=46.7s | gpu=9.0s
    C:\Users\fbrev\Documents\Acadêmico\Simulações\Python\NoisyGL\predictor\Base_Predictor.py:144: UserWarning: Sparse CSR tensor support is in beta state. If you miss a functionality in the sparse tensor support, please submit a feature request to https://github.com/pytorch/pytorch/issues. (Triggered internally at ..\aten\src\ATen\SparseCsrTensorImpl.cpp:55.)
    self.adj_csr = self.adj.to_sparse_csr().to(self.device)
[I 2026-04-27 15:14:00,879] Trial 124 finished with value: 0.3932635876499107 and parameters: {'lr': 0.1, 'weight_decay': 0.001, 'n_hidden': 256, 'n_layer': 3, 'dropout': 0.799323035916677, 'knn_mode': 's', 'k': 46, 'dexp': 5.033181543887962, 'p_grd': 0.4669695969128294, 'unc_rem': 0.8567160794614109, 'unc_rel': 0.6785492231723849}. Best is trial 29 with value: 0.40505230926256697.
    [CPU] Loading amazon-ratings...
    DEBUG 3.1: Dataset init start
    DEBUG 3.2: prepare_data start amazon-ratings
    ----Data statistics------'
    Name: amazon-ratings
    #Nodes 24492
    #Edges 93050
    #Classes 5
    #Ave_degree 7.60
    ----Split statistics------'
    #Train samples 1224 (5.0 % of nodes)
    #Val samples 3673 (15.0 % of nodes)
    #Test samples 19595 (remaining)
    ----label noise information:------
    Instance dependent noise
    #Actual noise rate 0.13
    [cuda:0] LNPCC waiting for GPU slot...
    [cuda:0] Slot acquired (waited 447.3s). Starting GCN...
    FINAL_RESULT: {'acc': {'train': 0.40931372549019607, 'valid': 0.37135856248298393, 'test': 0.3959173258484307}, 'wall_s': 47.83, 'cpu_s': 44.06, 'gpu_s': 3.72, 'wait_s': 447.26}
    [Time] wall=47.8s | cpu=44.1s | gpu=3.7s
    C:\Users\fbrev\Documents\Acadêmico\Simulações\Python\NoisyGL\predictor\Base_Predictor.py:144: UserWarning: Sparse CSR tensor support is in beta state. If you miss a functionality in the sparse tensor support, please submit a feature request to https://github.com/pytorch/pytorch/issues. (Triggered internally at ..\aten\src\ATen\SparseCsrTensorImpl.cpp:55.)
    self.adj_csr = self.adj.to_sparse_csr().to(self.device)
[I 2026-04-27 15:22:22,843] Trial 125 finished with value: 0.3959173258484307 and parameters: {'lr': 0.1, 'weight_decay': 0.001, 'n_hidden': 64, 'n_layer': 3, 'dropout': 0.743173148913637, 'knn_mode': 's', 'k': 44, 'dexp': 4.410707363107579, 'p_grd': 0.5190436730261426, 'unc_rem': 0.801196576872309, 'unc_rel': 0.5931628570463741}. Best is trial 29 with value: 0.40505230926256697.
    [CPU] Loading amazon-ratings...
    DEBUG 3.1: Dataset init start
    DEBUG 3.2: prepare_data start amazon-ratings
    ----Data statistics------'
    Name: amazon-ratings
    #Nodes 24492
    #Edges 93050
    #Classes 5
    #Ave_degree 7.60
    ----Split statistics------'
    #Train samples 1224 (5.0 % of nodes)
    #Val samples 3673 (15.0 % of nodes)
    #Test samples 19595 (remaining)
    ----label noise information:------
    Instance dependent noise
    #Actual noise rate 0.13
    [cuda:0] LNPCC waiting for GPU slot...
    [cuda:0] Slot acquired (waited 201.3s). Starting GCN...
    FINAL_RESULT: {'acc': {'train': 0.39279869067103107, 'valid': 0.3661856792812415, 'test': 0.3967848941056392}, 'wall_s': 48.93, 'cpu_s': 44.83, 'gpu_s': 4.05, 'wait_s': 201.3}
    [Time] wall=48.9s | cpu=44.8s | gpu=4.1s
    C:\Users\fbrev\Documents\Acadêmico\Simulações\Python\NoisyGL\predictor\Base_Predictor.py:144: UserWarning: Sparse CSR tensor support is in beta state. If you miss a functionality in the sparse tensor support, please submit a feature request to https://github.com/pytorch/pytorch/issues. (Triggered internally at ..\aten\src\ATen\SparseCsrTensorImpl.cpp:55.)
    self.adj_csr = self.adj.to_sparse_csr().to(self.device)
[I 2026-04-27 15:26:39,633] Trial 126 finished with value: 0.3967848941056392 and parameters: {'lr': 0.1, 'weight_decay': 0.001, 'n_hidden': 64, 'n_layer': 3, 'dropout': 0.6945547027929713, 'knn_mode': 's', 'k': 11, 'dexp': 4.563026352586606, 'p_grd': 0.39777117910331067, 'unc_rem': 0.9154535770171682, 'unc_rel': 0.6627786477788731}. Best is trial 29 with value: 0.40505230926256697.
    [CPU] Loading amazon-ratings...
    DEBUG 3.1: Dataset init start
    DEBUG 3.2: prepare_data start amazon-ratings
    ----Data statistics------'
    Name: amazon-ratings
    #Nodes 24492
    #Edges 93050
    #Classes 5
    #Ave_degree 7.60
    ----Split statistics------'
    #Train samples 1224 (5.0 % of nodes)
    #Val samples 3673 (15.0 % of nodes)
    #Test samples 19595 (remaining)
    ----label noise information:------
    Instance dependent noise
    #Actual noise rate 0.13
    [cuda:0] LNPCC waiting for GPU slot...
    [cuda:0] Slot acquired (waited 214.2s). Starting GCN...
    FINAL_RESULT: {'acc': {'train': 0.44353518821603927, 'valid': 0.36101279607949904, 'test': 0.3945394233222761}, 'wall_s': 46.61, 'cpu_s': 41.19, 'gpu_s': 5.36, 'wait_s': 214.2}
    [Time] wall=46.6s | cpu=41.2s | gpu=5.4s
    C:\Users\fbrev\Documents\Acadêmico\Simulações\Python\NoisyGL\predictor\Base_Predictor.py:144: UserWarning: Sparse CSR tensor support is in beta state. If you miss a functionality in the sparse tensor support, please submit a feature request to https://github.com/pytorch/pytorch/issues. (Triggered internally at ..\aten\src\ATen\SparseCsrTensorImpl.cpp:55.)
    self.adj_csr = self.adj.to_sparse_csr().to(self.device)
[I 2026-04-27 15:31:06,706] Trial 127 finished with value: 0.3945394233222761 and parameters: {'lr': 0.01, 'weight_decay': 0.001, 'n_hidden': 128, 'n_layer': 3, 'dropout': 0.7289061256623246, 'knn_mode': 's', 'k': 47, 'dexp': 5.150729342621859, 'p_grd': 0.3653582227112274, 'unc_rem': 0.8264291522020403, 'unc_rel': 0.7197049161979504}. Best is trial 29 with value: 0.40505230926256697.
    [CPU] Loading amazon-ratings...
    DEBUG 3.1: Dataset init start
    DEBUG 3.2: prepare_data start amazon-ratings
    ----Data statistics------'
    Name: amazon-ratings
    #Nodes 24492
    #Edges 93050
    #Classes 5
    #Ave_degree 7.60
    ----Split statistics------'
    #Train samples 1224 (5.0 % of nodes)
    #Val samples 3673 (15.0 % of nodes)
    #Test samples 19595 (remaining)
    ----label noise information:------
    Instance dependent noise
    #Actual noise rate 0.13
    [cuda:0] LNPCC waiting for GPU slot...
    [cuda:0] Slot acquired (waited 686.1s). Starting GCN...
    FINAL_RESULT: {'acc': {'train': 0.3954248366013072, 'valid': 0.36591342227062346, 'test': 0.3955600918601684}, 'wall_s': 69.68, 'cpu_s': 65.68, 'gpu_s': 3.97, 'wait_s': 686.05}
    [Time] wall=69.7s | cpu=65.7s | gpu=4.0s
    C:\Users\fbrev\Documents\Acadêmico\Simulações\Python\NoisyGL\predictor\Base_Predictor.py:144: UserWarning: Sparse CSR tensor support is in beta state. If you miss a functionality in the sparse tensor support, please submit a feature request to https://github.com/pytorch/pytorch/issues. (Triggered internally at ..\aten\src\ATen\SparseCsrTensorImpl.cpp:55.)
    self.adj_csr = self.adj.to_sparse_csr().to(self.device)
[I 2026-04-27 15:43:49,145] Trial 128 finished with value: 0.3955600918601684 and parameters: {'lr': 0.1, 'weight_decay': 0.001, 'n_hidden': 64, 'n_layer': 3, 'dropout': 0.30574617419055006, 'knn_mode': 's', 'k': 49, 'dexp': 3.472327708312996, 'p_grd': 0.6504428586315133, 'unc_rem': 0.35927734078119095, 'unc_rel': 0.6464406033864666}. Best is trial 29 with value: 0.40505230926256697.
    [CPU] Loading amazon-ratings...
    DEBUG 3.1: Dataset init start
    DEBUG 3.2: prepare_data start amazon-ratings
    ----Data statistics------'
    Name: amazon-ratings
    #Nodes 24492
    #Edges 93050
    #Classes 5
    #Ave_degree 7.60
    ----Split statistics------'
    #Train samples 1224 (5.0 % of nodes)
    #Val samples 3673 (15.0 % of nodes)
    #Test samples 19595 (remaining)
    ----label noise information:------
    Instance dependent noise
    #Actual noise rate 0.13
    [cuda:0] LNPCC waiting for GPU slot...
    [cuda:0] Slot acquired (waited 194.8s). Starting GCN...
    FINAL_RESULT: {'acc': {'train': 0.40180032733224225, 'valid': 0.3670024503130956, 'test': 0.4008165348303139}, 'wall_s': 60.52, 'cpu_s': 56.5, 'gpu_s': 3.98, 'wait_s': 194.78}
    [Time] wall=60.5s | cpu=56.5s | gpu=4.0s
    C:\Users\fbrev\Documents\Acadêmico\Simulações\Python\NoisyGL\predictor\Base_Predictor.py:144: UserWarning: Sparse CSR tensor support is in beta state. If you miss a functionality in the sparse tensor support, please submit a feature request to https://github.com/pytorch/pytorch/issues. (Triggered internally at ..\aten\src\ATen\SparseCsrTensorImpl.cpp:55.)
    self.adj_csr = self.adj.to_sparse_csr().to(self.device)
[I 2026-04-27 15:48:10,839] Trial 129 finished with value: 0.4008165348303139 and parameters: {'lr': 0.1, 'weight_decay': 0.001, 'n_hidden': 64, 'n_layer': 3, 'dropout': 0.7680152461166344, 'knn_mode': 's', 'k': 41, 'dexp': 5.4196658026084545, 'p_grd': 0.49891062437362904, 'unc_rem': 0.7826230942226724, 'unc_rel': 0.7483113125596113}. Best is trial 29 with value: 0.40505230926256697.
    [CPU] Loading amazon-ratings...
    DEBUG 3.1: Dataset init start
    DEBUG 3.2: prepare_data start amazon-ratings
    ----Data statistics------'
    Name: amazon-ratings
    #Nodes 24492
    #Edges 93050
    #Classes 5
    #Ave_degree 7.60
    ----Split statistics------'
    #Train samples 1224 (5.0 % of nodes)
    #Val samples 3673 (15.0 % of nodes)
    #Test samples 19595 (remaining)
    ----label noise information:------
    Instance dependent noise
    #Actual noise rate 0.13
    [cuda:0] LNPCC waiting for GPU slot...
    [cuda:0] Slot acquired (waited 193.5s). Starting GCN...
    FINAL_RESULT: {'acc': {'train': 0.4068627450980392, 'valid': 0.36836373536618566, 'test': 0.4026027047716254}, 'wall_s': 60.18, 'cpu_s': 55.95, 'gpu_s': 4.19, 'wait_s': 193.47}
    [Time] wall=60.2s | cpu=55.9s | gpu=4.2s
    C:\Users\fbrev\Documents\Acadêmico\Simulações\Python\NoisyGL\predictor\Base_Predictor.py:144: UserWarning: Sparse CSR tensor support is in beta state. If you miss a functionality in the sparse tensor support, please submit a feature request to https://github.com/pytorch/pytorch/issues. (Triggered internally at ..\aten\src\ATen\SparseCsrTensorImpl.cpp:55.)
    self.adj_csr = self.adj.to_sparse_csr().to(self.device)
[I 2026-04-27 15:52:30,647] Trial 130 finished with value: 0.4026027047716254 and parameters: {'lr': 0.1, 'weight_decay': 0.001, 'n_hidden': 64, 'n_layer': 3, 'dropout': 0.7694230149303819, 'knn_mode': 's', 'k': 42, 'dexp': 3.9278350075159403, 'p_grd': 0.49968997557059736, 'unc_rem': 0.7870679642571233, 'unc_rel': 0.7449407176881988}. Best is trial 29 with value: 0.40505230926256697.
    [CPU] Loading amazon-ratings...
    DEBUG 3.1: Dataset init start
    DEBUG 3.2: prepare_data start amazon-ratings
    ----Data statistics------'
    Name: amazon-ratings
    #Nodes 24492
    #Edges 93050
    #Classes 5
    #Ave_degree 7.60
    ----Split statistics------'
    #Train samples 1224 (5.0 % of nodes)
    #Val samples 3673 (15.0 % of nodes)
    #Test samples 19595 (remaining)
    ----label noise information:------
    Instance dependent noise
    #Actual noise rate 0.13
    [cuda:0] LNPCC waiting for GPU slot...
    [cuda:0] Slot acquired (waited 194.3s). Starting GCN...
    FINAL_RESULT: {'acc': {'train': 0.34967320261437906, 'valid': 0.3302477538796624, 'test': 0.3702985455473335}, 'wall_s': 60.89, 'cpu_s': 56.86, 'gpu_s': 3.99, 'wait_s': 194.25}
    [Time] wall=60.9s | cpu=56.9s | gpu=4.0s
    C:\Users\fbrev\Documents\Acadêmico\Simulações\Python\NoisyGL\predictor\Base_Predictor.py:144: UserWarning: Sparse CSR tensor support is in beta state. If you miss a functionality in the sparse tensor support, please submit a feature request to https://github.com/pytorch/pytorch/issues. (Triggered internally at ..\aten\src\ATen\SparseCsrTensorImpl.cpp:55.)
    self.adj_csr = self.adj.to_sparse_csr().to(self.device)
[I 2026-04-27 15:56:52,289] Trial 131 finished with value: 0.3702985455473335 and parameters: {'lr': 0.1, 'weight_decay': 0.0, 'n_hidden': 64, 'n_layer': 3, 'dropout': 0.7840820570073064, 'knn_mode': 's', 'k': 37, 'dexp': 3.2001477468180686, 'p_grd': 0.5653590953404003, 'unc_rem': 0.7269490960984085, 'unc_rel': 0.8336959543645098}. Best is trial 29 with value: 0.40505230926256697.
    [CPU] Loading amazon-ratings...
    DEBUG 3.1: Dataset init start
    DEBUG 3.2: prepare_data start amazon-ratings
    ----Data statistics------'
    Name: amazon-ratings
    #Nodes 24492
    #Edges 93050
    #Classes 5
    #Ave_degree 7.60
    ----Split statistics------'
    #Train samples 1224 (5.0 % of nodes)
    #Val samples 3673 (15.0 % of nodes)
    #Test samples 19595 (remaining)
    ----label noise information:------
    Instance dependent noise
    #Actual noise rate 0.13
    [cuda:0] LNPCC waiting for GPU slot...
    [cuda:0] Slot acquired (waited 450.9s). Starting GCN...
    FINAL_RESULT: {'acc': {'train': 0.4071954210956664, 'valid': 0.3675469643343316, 'test': 0.39918346516968617}, 'wall_s': 48.9, 'cpu_s': 45.0, 'gpu_s': 3.85, 'wait_s': 450.88}
    [Time] wall=48.9s | cpu=45.0s | gpu=3.9s
    C:\Users\fbrev\Documents\Acadêmico\Simulações\Python\NoisyGL\predictor\Base_Predictor.py:144: UserWarning: Sparse CSR tensor support is in beta state. If you miss a functionality in the sparse tensor support, please submit a feature request to https://github.com/pytorch/pytorch/issues. (Triggered internally at ..\aten\src\ATen\SparseCsrTensorImpl.cpp:55.)
    self.adj_csr = self.adj.to_sparse_csr().to(self.device)
[I 2026-04-27 16:05:18,371] Trial 132 finished with value: 0.39918346516968617 and parameters: {'lr': 0.1, 'weight_decay': 0.001, 'n_hidden': 64, 'n_layer': 3, 'dropout': 0.7705712104853982, 'knn_mode': 's', 'k': 41, 'dexp': 3.6853194750237677, 'p_grd': 0.4999004131162476, 'unc_rem': 0.3292765889255187, 'unc_rel': 0.7553653184590134}. Best is trial 29 with value: 0.40505230926256697.
    [CPU] Loading amazon-ratings...
    DEBUG 3.1: Dataset init start
    DEBUG 3.2: prepare_data start amazon-ratings
    ----Data statistics------'
    Name: amazon-ratings
    #Nodes 24492
    #Edges 93050
    #Classes 5
    #Ave_degree 7.60
    ----Split statistics------'
    #Train samples 1224 (5.0 % of nodes)
    #Val samples 3673 (15.0 % of nodes)
    #Test samples 19595 (remaining)
    ----label noise information:------
    Instance dependent noise
    #Actual noise rate 0.13
    [cuda:0] LNPCC waiting for GPU slot...
    [cuda:0] Slot acquired (waited 194.0s). Starting GCN...
    FINAL_RESULT: {'acc': {'train': 0.40558292282430214, 'valid': 0.36918050639803973, 'test': 0.3995917325848431}, 'wall_s': 61.22, 'cpu_s': 57.44, 'gpu_s': 3.75, 'wait_s': 193.96}
    [Time] wall=61.2s | cpu=57.4s | gpu=3.7s
    C:\Users\fbrev\Documents\Acadêmico\Simulações\Python\NoisyGL\predictor\Base_Predictor.py:144: UserWarning: Sparse CSR tensor support is in beta state. If you miss a functionality in the sparse tensor support, please submit a feature request to https://github.com/pytorch/pytorch/issues. (Triggered internally at ..\aten\src\ATen\SparseCsrTensorImpl.cpp:55.)
    self.adj_csr = self.adj.to_sparse_csr().to(self.device)
[I 2026-04-27 16:09:40,092] Trial 133 finished with value: 0.3995917325848431 and parameters: {'lr': 0.1, 'weight_decay': 0.001, 'n_hidden': 64, 'n_layer': 3, 'dropout': 0.7689630361966824, 'knn_mode': 's', 'k': 40, 'dexp': 3.954746714698336, 'p_grd': 0.5022884862088823, 'unc_rem': 0.20505790991024891, 'unc_rel': 0.7482474038655841}. Best is trial 29 with value: 0.40505230926256697.
    [CPU] Loading amazon-ratings...
    DEBUG 3.1: Dataset init start
    DEBUG 3.2: prepare_data start amazon-ratings
    ----Data statistics------'
    Name: amazon-ratings
    #Nodes 24492
    #Edges 93050
    #Classes 5
    #Ave_degree 7.60
    ----Split statistics------'
    #Train samples 1224 (5.0 % of nodes)
    #Val samples 3673 (15.0 % of nodes)
    #Test samples 19595 (remaining)
    ----label noise information:------
    Instance dependent noise
    #Actual noise rate 0.13
    [cuda:0] LNPCC waiting for GPU slot...
    [cuda:0] Slot acquired (waited 734.8s). Starting GCN...
    FINAL_RESULT: {'acc': {'train': 0.41618969746524936, 'valid': 0.3670024503130956, 'test': 0.39918346516968617}, 'wall_s': 53.59, 'cpu_s': 49.48, 'gpu_s': 4.06, 'wait_s': 734.82}
    [Time] wall=53.6s | cpu=49.5s | gpu=4.1s
    C:\Users\fbrev\Documents\Acadêmico\Simulações\Python\NoisyGL\predictor\Base_Predictor.py:144: UserWarning: Sparse CSR tensor support is in beta state. If you miss a functionality in the sparse tensor support, please submit a feature request to https://github.com/pytorch/pytorch/issues. (Triggered internally at ..\aten\src\ATen\SparseCsrTensorImpl.cpp:55.)
    self.adj_csr = self.adj.to_sparse_csr().to(self.device)
[I 2026-04-27 16:22:55,285] Trial 134 finished with value: 0.39918346516968617 and parameters: {'lr': 0.1, 'weight_decay': 0.001, 'n_hidden': 64, 'n_layer': 3, 'dropout': 0.7601557832558988, 'knn_mode': 's', 'k': 41, 'dexp': 3.999606438641158, 'p_grd': 0.503928614357559, 'unc_rem': 0.19932189921802804, 'unc_rel': 0.7792464718208989}. Best is trial 29 with value: 0.40505230926256697.
    [CPU] Loading amazon-ratings...
    DEBUG 3.1: Dataset init start
    DEBUG 3.2: prepare_data start amazon-ratings
    ----Data statistics------'
    Name: amazon-ratings
    #Nodes 24492
    #Edges 93050
    #Classes 5
    #Ave_degree 7.60
    ----Split statistics------'
    #Train samples 1224 (5.0 % of nodes)
    #Val samples 3673 (15.0 % of nodes)
    #Test samples 19595 (remaining)
    ----label noise information:------
    Instance dependent noise
    #Actual noise rate 0.13
    [cuda:0] LNPCC waiting for GPU slot...
    [cuda:0] Slot acquired (waited 448.3s). Starting GCN...
    FINAL_RESULT: {'acc': {'train': 0.41013071895424835, 'valid': 0.36373536618567925, 'test': 0.39540699157948456}, 'wall_s': 73.93, 'cpu_s': 69.96, 'gpu_s': 3.92, 'wait_s': 448.3}
    [Time] wall=73.9s | cpu=70.0s | gpu=3.9s
    C:\Users\fbrev\Documents\Acadêmico\Simulações\Python\NoisyGL\predictor\Base_Predictor.py:144: UserWarning: Sparse CSR tensor support is in beta state. If you miss a functionality in the sparse tensor support, please submit a feature request to https://github.com/pytorch/pytorch/issues. (Triggered internally at ..\aten\src\ATen\SparseCsrTensorImpl.cpp:55.)
    self.adj_csr = self.adj.to_sparse_csr().to(self.device)
[I 2026-04-27 16:31:44,983] Trial 135 finished with value: 0.39540699157948456 and parameters: {'lr': 0.1, 'weight_decay': 0.001, 'n_hidden': 64, 'n_layer': 3, 'dropout': 0.7678673502675774, 'knn_mode': 's', 'k': 40, 'dexp': 4.33280396332657, 'p_grd': 0.5476174760569619, 'unc_rem': 0.32748493832273107, 'unc_rel': 0.8092287439953012}. Best is trial 29 with value: 0.40505230926256697.
    [CPU] Loading amazon-ratings...
    DEBUG 3.1: Dataset init start
    DEBUG 3.2: prepare_data start amazon-ratings
    ----Data statistics------'
    Name: amazon-ratings
    #Nodes 24492
    #Edges 93050
    #Classes 5
    #Ave_degree 7.60
    ----Split statistics------'
    #Train samples 1224 (5.0 % of nodes)
    #Val samples 3673 (15.0 % of nodes)
    #Test samples 19595 (remaining)
    ----label noise information:------
    Instance dependent noise
    #Actual noise rate 0.13
    [cuda:0] LNPCC waiting for GPU slot...
    [cuda:0] Slot acquired (waited 199.3s). Starting GCN...
    FINAL_RESULT: {'acc': {'train': 0.18755118755118755, 'valid': 0.32752518377348216, 'test': 0.36851237560602196}, 'wall_s': 60.72, 'cpu_s': 56.56, 'gpu_s': 4.12, 'wait_s': 199.35}
    [Time] wall=60.7s | cpu=56.6s | gpu=4.1s
    C:\Users\fbrev\Documents\Acadêmico\Simulações\Python\NoisyGL\predictor\Base_Predictor.py:144: UserWarning: Sparse CSR tensor support is in beta state. If you miss a functionality in the sparse tensor support, please submit a feature request to https://github.com/pytorch/pytorch/issues. (Triggered internally at ..\aten\src\ATen\SparseCsrTensorImpl.cpp:55.)
    self.adj_csr = self.adj.to_sparse_csr().to(self.device)
