[I 2026-05-01 22:12:48,415] Trial 23 finished with value: 0.834 and parameters: {'lr': 0.005, 'weight_decay': 0.001, 'n_hidden': 256, 'n_layer': 2, 'dropout': 0.44014512646335935, 'knn_mode': 'd', 'k': 36, 'dexp': 5.81723541805636, 'p_grd': 0.9977037088625663, 'unc_rem': 0.6247255712899781, 'unc_rel': 0.8578911262049675}. Best is trial 20 with value: 0.911.
    [CPU] Loading amazonpho...
    DEBUG 3.1: Dataset init start
    DEBUG 3.2: prepare_data start amazonpho
    ----Data statistics------'
    Name: amazonpho
    #Nodes 7650
    #Edges 119081
    #Classes 8
    #Ave_degree 31.13
    ----Split statistics------'
    #Train samples 160 (20 nodes per class)
    #Val samples 500 (specified)
    #Test samples 1000 (specified)
    ----label noise information:------
    Instance dependent noise
    #Actual noise rate 0.21
    [cuda:0] LNPCC waiting for GPU slot...
    [cuda:0] Slot acquired (waited 116.8s). Starting GCN...
    FINAL_RESULT: {'acc': {'train': 0.7875, 'valid': 0.726, 'test': 0.892}, 'wall_s': 28.88, 'cpu_s': 24.03, 'gpu_s': 4.81, 'wait_s': 116.79}
    [Time] wall=28.9s | cpu=24.0s | gpu=4.8s
    C:\Users\fbrev\Documents\Acadêmico\Simulações\Python\NoisyGL\predictor\Base_Predictor.py:114: UserWarning: expandable_segments not supported on this platform (Triggered internally at ..\c10/cuda/CUDAAllocatorConfig.h:28.)
    self.edge_index = self._cpu_edge_index.to(self.device)
    C:\Users\fbrev\Documents\Acadêmico\Simulações\Python\NoisyGL\predictor\Base_Predictor.py:144: UserWarning: Sparse CSR tensor support is in beta state. If you miss a functionality in the sparse tensor support, please submit a feature request to https://github.com/pytorch/pytorch/issues. (Triggered internally at ..\aten\src\ATen\SparseCsrTensorImpl.cpp:55.)
    self.adj_csr = self.adj.to_sparse_csr().to(self.device)
[I 2026-05-01 22:15:20,343] Trial 24 finished with value: 0.892 and parameters: {'lr': 0.005, 'weight_decay': 0.001, 'n_hidden': 256, 'n_layer': 2, 'dropout': 0.5757366344260275, 'knn_mode': 'd', 'k': 31, 'dexp': 5.240847305688652, 'p_grd': 0.870142970895465, 'unc_rem': 0.49493418224742636, 'unc_rel': 0.4501712657738214}. Best is trial 20 with value: 0.911.
    [CPU] Loading amazonpho...
    DEBUG 3.1: Dataset init start
    DEBUG 3.2: prepare_data start amazonpho
    ----Data statistics------'
    Name: amazonpho
    #Nodes 7650
    #Edges 119081
    #Classes 8
    #Ave_degree 31.13
    ----Split statistics------'
    #Train samples 160 (20 nodes per class)
    #Val samples 500 (specified)
    #Test samples 1000 (specified)
    ----label noise information:------
    Instance dependent noise
    #Actual noise rate 0.21
    [cuda:0] LNPCC waiting for GPU slot...
    [cuda:0] Slot acquired (waited 279.8s). Starting GCN...
    FINAL_RESULT: {'acc': {'train': 0.75625, 'valid': 0.724, 'test': 0.903}, 'wall_s': 25.46, 'cpu_s': 20.4, 'gpu_s': 5.02, 'wait_s': 279.78}
    [Time] wall=25.5s | cpu=20.4s | gpu=5.0s
    C:\Users\fbrev\Documents\Acadêmico\Simulações\Python\NoisyGL\predictor\Base_Predictor.py:114: UserWarning: expandable_segments not supported on this platform (Triggered internally at ..\c10/cuda/CUDAAllocatorConfig.h:28.)
    self.edge_index = self._cpu_edge_index.to(self.device)
    C:\Users\fbrev\Documents\Acadêmico\Simulações\Python\NoisyGL\predictor\Base_Predictor.py:144: UserWarning: Sparse CSR tensor support is in beta state. If you miss a functionality in the sparse tensor support, please submit a feature request to https://github.com/pytorch/pytorch/issues. (Triggered internally at ..\aten\src\ATen\SparseCsrTensorImpl.cpp:55.)
    self.adj_csr = self.adj.to_sparse_csr().to(self.device)
[I 2026-05-01 22:20:31,798] Trial 25 finished with value: 0.903 and parameters: {'lr': 0.01, 'weight_decay': 0.001, 'n_hidden': 256, 'n_layer': 2, 'dropout': 0.3013454947549717, 'knn_mode': 'd', 'k': 50, 'dexp': 6.40969000658677, 'p_grd': 0.5986381015439523, 'unc_rem': 0.990057569767929, 'unc_rel': 0.8655559646631751}. Best is trial 20 with value: 0.911.
    [CPU] Loading amazonpho...
    DEBUG 3.1: Dataset init start
    DEBUG 3.2: prepare_data start amazonpho
    ----Data statistics------'
    Name: amazonpho
    #Nodes 7650
    #Edges 119081
    #Classes 8
    #Ave_degree 31.13
    ----Split statistics------'
    #Train samples 160 (20 nodes per class)
    #Val samples 500 (specified)
    #Test samples 1000 (specified)
    ----label noise information:------
    Instance dependent noise
    #Actual noise rate 0.21
    [cuda:0] LNPCC waiting for GPU slot...
    [cuda:0] Slot acquired (waited 125.3s). Starting GCN...
    FINAL_RESULT: {'acc': {'train': 0.78125, 'valid': 0.726, 'test': 0.901}, 'wall_s': 26.15, 'cpu_s': 20.86, 'gpu_s': 5.24, 'wait_s': 125.34}
    [Time] wall=26.2s | cpu=20.9s | gpu=5.2s
    C:\Users\fbrev\Documents\Acadêmico\Simulações\Python\NoisyGL\predictor\Base_Predictor.py:114: UserWarning: expandable_segments not supported on this platform (Triggered internally at ..\c10/cuda/CUDAAllocatorConfig.h:28.)
    self.edge_index = self._cpu_edge_index.to(self.device)
    C:\Users\fbrev\Documents\Acadêmico\Simulações\Python\NoisyGL\predictor\Base_Predictor.py:144: UserWarning: Sparse CSR tensor support is in beta state. If you miss a functionality in the sparse tensor support, please submit a feature request to https://github.com/pytorch/pytorch/issues. (Triggered internally at ..\aten\src\ATen\SparseCsrTensorImpl.cpp:55.)
    self.adj_csr = self.adj.to_sparse_csr().to(self.device)
[I 2026-05-01 22:23:09,393] Trial 26 finished with value: 0.901 and parameters: {'lr': 0.005, 'weight_decay': 0.001, 'n_hidden': 256, 'n_layer': 2, 'dropout': 0.41461411797750813, 'knn_mode': 'd', 'k': 37, 'dexp': 4.803140479354376, 'p_grd': 0.7323718243549506, 'unc_rem': 0.8178573570748496, 'unc_rel': 0.6144482450718679}. Best is trial 20 with value: 0.911.
    [CPU] Loading amazonpho...
    DEBUG 3.1: Dataset init start
    DEBUG 3.2: prepare_data start amazonpho
    ----Data statistics------'
    Name: amazonpho
    #Nodes 7650
    #Edges 119081
    #Classes 8
    #Ave_degree 31.13
    ----Split statistics------'
    #Train samples 160 (20 nodes per class)
    #Val samples 500 (specified)
    #Test samples 1000 (specified)
    ----label noise information:------
    Instance dependent noise
    #Actual noise rate 0.21
    [cuda:0] LNPCC waiting for GPU slot...
    [cuda:0] Slot acquired (waited 117.4s). Starting GCN...
    FINAL_RESULT: {'acc': {'train': 0.13924050632911392, 'valid': 0.29, 'test': 0.335}, 'wall_s': 33.4, 'cpu_s': 28.35, 'gpu_s': 5.0, 'wait_s': 117.41}
    [Time] wall=33.4s | cpu=28.4s | gpu=5.0s
    C:\Users\fbrev\Documents\Acadêmico\Simulações\Python\NoisyGL\predictor\Base_Predictor.py:114: UserWarning: expandable_segments not supported on this platform (Triggered internally at ..\c10/cuda/CUDAAllocatorConfig.h:28.)
    self.edge_index = self._cpu_edge_index.to(self.device)
    C:\Users\fbrev\Documents\Acadêmico\Simulações\Python\NoisyGL\predictor\Base_Predictor.py:144: UserWarning: Sparse CSR tensor support is in beta state. If you miss a functionality in the sparse tensor support, please submit a feature request to https://github.com/pytorch/pytorch/issues. (Triggered internally at ..\aten\src\ATen\SparseCsrTensorImpl.cpp:55.)
    self.adj_csr = self.adj.to_sparse_csr().to(self.device)
[I 2026-05-01 22:25:46,357] Trial 27 finished with value: 0.335 and parameters: {'lr': 0.1, 'weight_decay': 0.001, 'n_hidden': 256, 'n_layer': 2, 'dropout': 0.5856779792350408, 'knn_mode': 'd', 'k': 42, 'dexp': 1.3998560442016532, 'p_grd': 0.8916816175979914, 'unc_rem': 0.3918779229771807, 'unc_rel': 0.10204752689615137}. Best is trial 20 with value: 0.911.
    [CPU] Loading amazonpho...
    DEBUG 3.1: Dataset init start
    DEBUG 3.2: prepare_data start amazonpho
    ----Data statistics------'
    Name: amazonpho
    #Nodes 7650
    #Edges 119081
    #Classes 8
    #Ave_degree 31.13
    ----Split statistics------'
    #Train samples 160 (20 nodes per class)
    #Val samples 500 (specified)
    #Test samples 1000 (specified)
    ----label noise information:------
    Instance dependent noise
    #Actual noise rate 0.21
    [cuda:0] LNPCC waiting for GPU slot...
    [cuda:0] Slot acquired (waited 284.9s). Starting GCN...
    FINAL_RESULT: {'acc': {'train': 0.78125, 'valid': 0.726, 'test': 0.9}, 'wall_s': 23.41, 'cpu_s': 18.28, 'gpu_s': 5.08, 'wait_s': 284.89}
    [Time] wall=23.4s | cpu=18.3s | gpu=5.1s
    C:\Users\fbrev\Documents\Acadêmico\Simulações\Python\NoisyGL\predictor\Base_Predictor.py:114: UserWarning: expandable_segments not supported on this platform (Triggered internally at ..\c10/cuda/CUDAAllocatorConfig.h:28.)
    self.edge_index = self._cpu_edge_index.to(self.device)
    C:\Users\fbrev\Documents\Acadêmico\Simulações\Python\NoisyGL\predictor\Base_Predictor.py:144: UserWarning: Sparse CSR tensor support is in beta state. If you miss a functionality in the sparse tensor support, please submit a feature request to https://github.com/pytorch/pytorch/issues. (Triggered internally at ..\aten\src\ATen\SparseCsrTensorImpl.cpp:55.)
    self.adj_csr = self.adj.to_sparse_csr().to(self.device)
[I 2026-05-01 22:31:00,802] Trial 28 finished with value: 0.9 and parameters: {'lr': 0.01, 'weight_decay': 0.001, 'n_hidden': 256, 'n_layer': 2, 'dropout': 0.28010485255787915, 'knn_mode': 'd', 'k': 28, 'dexp': 7.193932141841819, 'p_grd': 0.74867400485211, 'unc_rem': 0.6110615977317462, 'unc_rel': 0.9902946924928495}. Best is trial 20 with value: 0.911.
    [CPU] Loading amazonpho...
    DEBUG 3.1: Dataset init start
    DEBUG 3.2: prepare_data start amazonpho
    ----Data statistics------'
    Name: amazonpho
    #Nodes 7650
    #Edges 119081
    #Classes 8
    #Ave_degree 31.13
    ----Split statistics------'
    #Train samples 160 (20 nodes per class)
    #Val samples 500 (specified)
    #Test samples 1000 (specified)
    ----label noise information:------
    Instance dependent noise
    #Actual noise rate 0.21
    [cuda:0] LNPCC waiting for GPU slot...
    [cuda:0] Slot acquired (waited 590.8s). Starting GCN...
    FINAL_RESULT: {'acc': {'train': 0.8269230769230769, 'valid': 0.722, 'test': 0.904}, 'wall_s': 22.84, 'cpu_s': 17.63, 'gpu_s': 5.16, 'wait_s': 590.82}
    [Time] wall=22.8s | cpu=17.6s | gpu=5.2s
    C:\Users\fbrev\Documents\Acadêmico\Simulações\Python\NoisyGL\predictor\Base_Predictor.py:114: UserWarning: expandable_segments not supported on this platform (Triggered internally at ..\c10/cuda/CUDAAllocatorConfig.h:28.)
    self.edge_index = self._cpu_edge_index.to(self.device)
    C:\Users\fbrev\Documents\Acadêmico\Simulações\Python\NoisyGL\predictor\Base_Predictor.py:144: UserWarning: Sparse CSR tensor support is in beta state. If you miss a functionality in the sparse tensor support, please submit a feature request to https://github.com/pytorch/pytorch/issues. (Triggered internally at ..\aten\src\ATen\SparseCsrTensorImpl.cpp:55.)
    self.adj_csr = self.adj.to_sparse_csr().to(self.device)
[I 2026-05-01 22:41:20,399] Trial 29 finished with value: 0.904 and parameters: {'lr': 0.01, 'weight_decay': 0.001, 'n_hidden': 256, 'n_layer': 2, 'dropout': 0.4468944687247347, 'knn_mode': 'd', 'k': 34, 'dexp': 6.448901515689685, 'p_grd': 0.5830614565442489, 'unc_rem': 0.025027439885451253, 'unc_rel': 0.4889878417911552}. Best is trial 20 with value: 0.911.
    [CPU] Loading amazonpho...
    DEBUG 3.1: Dataset init start
    DEBUG 3.2: prepare_data start amazonpho
    ----Data statistics------'
    Name: amazonpho
    #Nodes 7650
    #Edges 119081
    #Classes 8
    #Ave_degree 31.13
    ----Split statistics------'
    #Train samples 160 (20 nodes per class)
    #Val samples 500 (specified)
    #Test samples 1000 (specified)
    ----label noise information:------
    Instance dependent noise
    #Actual noise rate 0.21
    [cuda:0] LNPCC waiting for GPU slot...
    [cuda:0] Slot acquired (waited 438.0s). Starting GCN...
    FINAL_RESULT: {'acc': {'train': 0.7625, 'valid': 0.72, 'test': 0.897}, 'wall_s': 27.63, 'cpu_s': 22.54, 'gpu_s': 5.04, 'wait_s': 438.04}
    [Time] wall=27.6s | cpu=22.5s | gpu=5.0s
    C:\Users\fbrev\Documents\Acadêmico\Simulações\Python\NoisyGL\predictor\Base_Predictor.py:114: UserWarning: expandable_segments not supported on this platform (Triggered internally at ..\c10/cuda/CUDAAllocatorConfig.h:28.)
    self.edge_index = self._cpu_edge_index.to(self.device)
    C:\Users\fbrev\Documents\Acadêmico\Simulações\Python\NoisyGL\predictor\Base_Predictor.py:144: UserWarning: Sparse CSR tensor support is in beta state. If you miss a functionality in the sparse tensor support, please submit a feature request to https://github.com/pytorch/pytorch/issues. (Triggered internally at ..\aten\src\ATen\SparseCsrTensorImpl.cpp:55.)
    self.adj_csr = self.adj.to_sparse_csr().to(self.device)
[I 2026-05-01 22:49:12,798] Trial 30 finished with value: 0.897 and parameters: {'lr': 0.005, 'weight_decay': 0.001, 'n_hidden': 256, 'n_layer': 2, 'dropout': 0.5428933872277986, 'knn_mode': 'd', 'k': 41, 'dexp': 5.465508915369178, 'p_grd': 0.6634340698424441, 'unc_rem': 0.42696214140361793, 'unc_rel': 0.5511570432421813}. Best is trial 20 with value: 0.911.
    [CPU] Loading amazonpho...
    DEBUG 3.1: Dataset init start
    DEBUG 3.2: prepare_data start amazonpho
    ----Data statistics------'
    Name: amazonpho
    #Nodes 7650
    #Edges 119081
    #Classes 8
    #Ave_degree 31.13
    ----Split statistics------'
    #Train samples 160 (20 nodes per class)
    #Val samples 500 (specified)
    #Test samples 1000 (specified)
    ----label noise information:------
    Instance dependent noise
    #Actual noise rate 0.21
    [cuda:0] LNPCC waiting for GPU slot...
    [cuda:0] Slot acquired (waited 134.2s). Starting GCN...
    FINAL_RESULT: {'acc': {'train': 0.7625, 'valid': 0.734, 'test': 0.901}, 'wall_s': 21.15, 'cpu_s': 16.17, 'gpu_s': 4.93, 'wait_s': 134.25}
    [Time] wall=21.2s | cpu=16.2s | gpu=4.9s
    C:\Users\fbrev\Documents\Acadêmico\Simulações\Python\NoisyGL\predictor\Base_Predictor.py:114: UserWarning: expandable_segments not supported on this platform (Triggered internally at ..\c10/cuda/CUDAAllocatorConfig.h:28.)
    self.edge_index = self._cpu_edge_index.to(self.device)
    C:\Users\fbrev\Documents\Acadêmico\Simulações\Python\NoisyGL\predictor\Base_Predictor.py:144: UserWarning: Sparse CSR tensor support is in beta state. If you miss a functionality in the sparse tensor support, please submit a feature request to https://github.com/pytorch/pytorch/issues. (Triggered internally at ..\aten\src\ATen\SparseCsrTensorImpl.cpp:55.)
    self.adj_csr = self.adj.to_sparse_csr().to(self.device)
[I 2026-05-01 22:51:54,942] Trial 31 finished with value: 0.901 and parameters: {'lr': 0.005, 'weight_decay': 0.001, 'n_hidden': 256, 'n_layer': 2, 'dropout': 0.6379276229650668, 'knn_mode': 'd', 'k': 27, 'dexp': 9.00944045854347, 'p_grd': 0.7151428045559299, 'unc_rem': 0.6632777880689076, 'unc_rel': 0.7393751784004035}. Best is trial 20 with value: 0.911.
    [CPU] Loading amazonpho...
    DEBUG 3.1: Dataset init start
    DEBUG 3.2: prepare_data start amazonpho
    ----Data statistics------'
    Name: amazonpho
    #Nodes 7650
    #Edges 119081
    #Classes 8
    #Ave_degree 31.13
    ----Split statistics------'
    #Train samples 160 (20 nodes per class)
    #Val samples 500 (specified)
    #Test samples 1000 (specified)
    ----label noise information:------
    Instance dependent noise
    #Actual noise rate 0.21
    [cuda:0] LNPCC waiting for GPU slot...
    [cuda:0] Slot acquired (waited 125.6s). Starting GCN...
    FINAL_RESULT: {'acc': {'train': 0.76875, 'valid': 0.72, 'test': 0.881}, 'wall_s': 23.29, 'cpu_s': 18.33, 'gpu_s': 4.92, 'wait_s': 125.58}
    [Time] wall=23.3s | cpu=18.3s | gpu=4.9s
    C:\Users\fbrev\Documents\Acadêmico\Simulações\Python\NoisyGL\predictor\Base_Predictor.py:114: UserWarning: expandable_segments not supported on this platform (Triggered internally at ..\c10/cuda/CUDAAllocatorConfig.h:28.)
    self.edge_index = self._cpu_edge_index.to(self.device)
    C:\Users\fbrev\Documents\Acadêmico\Simulações\Python\NoisyGL\predictor\Base_Predictor.py:144: UserWarning: Sparse CSR tensor support is in beta state. If you miss a functionality in the sparse tensor support, please submit a feature request to https://github.com/pytorch/pytorch/issues. (Triggered internally at ..\aten\src\ATen\SparseCsrTensorImpl.cpp:55.)
    self.adj_csr = self.adj.to_sparse_csr().to(self.device)
[I 2026-05-01 22:54:30,398] Trial 32 finished with value: 0.881 and parameters: {'lr': 0.005, 'weight_decay': 0.001, 'n_hidden': 256, 'n_layer': 2, 'dropout': 0.3677568280608576, 'knn_mode': 'd', 'k': 46, 'dexp': 7.454127696733986, 'p_grd': 0.7897876049794978, 'unc_rem': 0.5422620208865986, 'unc_rel': 0.7863075650623639}. Best is trial 20 with value: 0.911.
    [CPU] Loading amazonpho...
    DEBUG 3.1: Dataset init start
    DEBUG 3.2: prepare_data start amazonpho
    ----Data statistics------'
    Name: amazonpho
    #Nodes 7650
    #Edges 119081
    #Classes 8
    #Ave_degree 31.13
    ----Split statistics------'
    #Train samples 160 (20 nodes per class)
    #Val samples 500 (specified)
    #Test samples 1000 (specified)
    ----label noise information:------
    Instance dependent noise
    #Actual noise rate 0.21
    [cuda:0] LNPCC waiting for GPU slot...
    [cuda:0] Slot acquired (waited 126.7s). Starting GCN...
    FINAL_RESULT: {'acc': {'train': 0.75625, 'valid': 0.73, 'test': 0.903}, 'wall_s': 27.01, 'cpu_s': 22.04, 'gpu_s': 4.91, 'wait_s': 126.66}
    [Time] wall=27.0s | cpu=22.0s | gpu=4.9s
    C:\Users\fbrev\Documents\Acadêmico\Simulações\Python\NoisyGL\predictor\Base_Predictor.py:114: UserWarning: expandable_segments not supported on this platform (Triggered internally at ..\c10/cuda/CUDAAllocatorConfig.h:28.)
    self.edge_index = self._cpu_edge_index.to(self.device)
    C:\Users\fbrev\Documents\Acadêmico\Simulações\Python\NoisyGL\predictor\Base_Predictor.py:144: UserWarning: Sparse CSR tensor support is in beta state. If you miss a functionality in the sparse tensor support, please submit a feature request to https://github.com/pytorch/pytorch/issues. (Triggered internally at ..\aten\src\ATen\SparseCsrTensorImpl.cpp:55.)
    self.adj_csr = self.adj.to_sparse_csr().to(self.device)
[I 2026-05-01 22:57:10,421] Trial 33 finished with value: 0.903 and parameters: {'lr': 0.005, 'weight_decay': 0.05, 'n_hidden': 256, 'n_layer': 2, 'dropout': 0.4976116610770294, 'knn_mode': 'd', 'k': 18, 'dexp': 9.91676819197745, 'p_grd': 0.9216060833565989, 'unc_rem': 0.9000907657486416, 'unc_rel': 0.8995305957041907}. Best is trial 20 with value: 0.911.
    [CPU] Loading amazonpho...
    DEBUG 3.1: Dataset init start
    DEBUG 3.2: prepare_data start amazonpho
    ----Data statistics------'
    Name: amazonpho
    #Nodes 7650
    #Edges 119081
    #Classes 8
    #Ave_degree 31.13
    ----Split statistics------'
    #Train samples 160 (20 nodes per class)
    #Val samples 500 (specified)
    #Test samples 1000 (specified)
    ----label noise information:------
    Instance dependent noise
    #Actual noise rate 0.21
    [cuda:0] LNPCC waiting for GPU slot...
    [cuda:0] Slot acquired (waited 143.0s). Starting GCN...
    FINAL_RESULT: {'acc': {'train': 0.79375, 'valid': 0.726, 'test': 0.905}, 'wall_s': 21.79, 'cpu_s': 16.97, 'gpu_s': 4.77, 'wait_s': 143.04}
    [Time] wall=21.8s | cpu=17.0s | gpu=4.8s
    C:\Users\fbrev\Documents\Acadêmico\Simulações\Python\NoisyGL\predictor\Base_Predictor.py:114: UserWarning: expandable_segments not supported on this platform (Triggered internally at ..\c10/cuda/CUDAAllocatorConfig.h:28.)
    self.edge_index = self._cpu_edge_index.to(self.device)
    C:\Users\fbrev\Documents\Acadêmico\Simulações\Python\NoisyGL\predictor\Base_Predictor.py:144: UserWarning: Sparse CSR tensor support is in beta state. If you miss a functionality in the sparse tensor support, please submit a feature request to https://github.com/pytorch/pytorch/issues. (Triggered internally at ..\aten\src\ATen\SparseCsrTensorImpl.cpp:55.)
    self.adj_csr = self.adj.to_sparse_csr().to(self.device)
[I 2026-05-01 23:00:01,434] Trial 34 finished with value: 0.905 and parameters: {'lr': 0.005, 'weight_decay': 0.001, 'n_hidden': 256, 'n_layer': 2, 'dropout': 0.5363819464617354, 'knn_mode': 'd', 'k': 33, 'dexp': 6.066787315900578, 'p_grd': 0.6841038902784335, 'unc_rem': 0.7793483459493004, 'unc_rel': 0.7346455333072852}. Best is trial 20 with value: 0.911.
    [CPU] Loading amazonpho...
    DEBUG 3.1: Dataset init start
    DEBUG 3.2: prepare_data start amazonpho
    ----Data statistics------'
    Name: amazonpho
    #Nodes 7650
    #Edges 119081
    #Classes 8
    #Ave_degree 31.13
    ----Split statistics------'
    #Train samples 160 (20 nodes per class)
    #Val samples 500 (specified)
    #Test samples 1000 (specified)
    ----label noise information:------
    Instance dependent noise
    #Actual noise rate 0.21
    [cuda:0] LNPCC waiting for GPU slot...
    [cuda:0] Slot acquired (waited 126.4s). Starting GCN...
    FINAL_RESULT: {'acc': {'train': 0.7625, 'valid': 0.73, 'test': 0.901}, 'wall_s': 24.52, 'cpu_s': 22.06, 'gpu_s': 2.42, 'wait_s': 126.37}
    [Time] wall=24.5s | cpu=22.1s | gpu=2.4s
    C:\Users\fbrev\Documents\Acadêmico\Simulações\Python\NoisyGL\predictor\Base_Predictor.py:114: UserWarning: expandable_segments not supported on this platform (Triggered internally at ..\c10/cuda/CUDAAllocatorConfig.h:28.)
    self.edge_index = self._cpu_edge_index.to(self.device)
    C:\Users\fbrev\Documents\Acadêmico\Simulações\Python\NoisyGL\predictor\Base_Predictor.py:144: UserWarning: Sparse CSR tensor support is in beta state. If you miss a functionality in the sparse tensor support, please submit a feature request to https://github.com/pytorch/pytorch/issues. (Triggered internally at ..\aten\src\ATen\SparseCsrTensorImpl.cpp:55.)
    self.adj_csr = self.adj.to_sparse_csr().to(self.device)
