[I 2026-05-05 16:10:32,556] Trial 94 finished with value: 0.740223088294584 and parameters: {'lr': 0.01, 'weight_decay': 0.0001, 'n_hidden': 64, 'n_layer': 3, 'dropout': 0.001895586014672962, 'knn_mode': 's', 'k': 31, 'dexp': 2.2106625731714153, 'p_grd': 0.277942818104294, 'unc_rem': 0.2797458784988599, 'unc_rel': 0.06520555820408375}. Best is trial 57 with value: 0.7498992070958205.
    [CPU] Loading dblp...
    DEBUG 3.1: Dataset init start
    DEBUG 3.2: prepare_data start dblp
    ----Data statistics------'
    Name: dblp
    #Nodes 17716
    #Edges 52867
    #Classes 4
    #Ave_degree 5.97
    ----Split statistics------'
    #Train samples 177 (1.0 % of nodes)
    #Val samples 2657 (15.0 % of nodes)
    #Test samples 14882 (remaining)
    ----label noise information:------
    Instance dependent noise
    #Actual noise rate 0.30
    [cuda:1] LNPCC waiting for GPU slot...
    [cuda:1] Slot acquired (waited 489.1s). Starting GCN...
    FINAL_RESULT: {'acc': {'train': 0.8607594936708861, 'valid': 0.5596537448249906, 'test': 0.7595081306276038}, 'wall_s': 43.08, 'cpu_s': 39.46, 'gpu_s': 3.52, 'wait_s': 489.07}
    [Time] wall=43.1s | cpu=39.5s | gpu=3.5s
    C:\Users\fbrev\Documents\Acadêmico\Simulações\Python\NoisyGL\predictor\Base_Predictor.py:114: UserWarning: expandable_segments not supported on this platform (Triggered internally at ..\c10/cuda/CUDAAllocatorConfig.h:28.)
    self.edge_index = self._cpu_edge_index.to(self.device)
    C:\Users\fbrev\Documents\Acadêmico\Simulações\Python\NoisyGL\predictor\Base_Predictor.py:144: UserWarning: Sparse CSR tensor support is in beta state. If you miss a functionality in the sparse tensor support, please submit a feature request to https://github.com/pytorch/pytorch/issues. (Triggered internally at ..\aten\src\ATen\SparseCsrTensorImpl.cpp:55.)
    self.adj_csr = self.adj.to_sparse_csr().to(self.device)
[I 2026-05-05 16:19:30,603] Trial 95 finished with value: 0.7595081306276038 and parameters: {'lr': 0.001, 'weight_decay': 0.0001, 'n_hidden': 64, 'n_layer': 3, 'dropout': 0.6681246090229624, 'knn_mode': 's', 'k': 27, 'dexp': 0.8409123709965418, 'p_grd': 0.36165726845630697, 'unc_rem': 0.13444440487102338, 'unc_rel': 0.1377092019648474}. Best is trial 95 with value: 0.7595081306276038.
    [CPU] Loading dblp...
    DEBUG 3.1: Dataset init start
    DEBUG 3.2: prepare_data start dblp
    ----Data statistics------'
    Name: dblp
    #Nodes 17716
    #Edges 52867
    #Classes 4
    #Ave_degree 5.97
    ----Split statistics------'
    #Train samples 177 (1.0 % of nodes)
    #Val samples 2657 (15.0 % of nodes)
    #Test samples 14882 (remaining)
    ----label noise information:------
    Instance dependent noise
    #Actual noise rate 0.30
    [cuda:1] LNPCC waiting for GPU slot...
    [cuda:1] Slot acquired (waited 138.2s). Starting GCN...
    FINAL_RESULT: {'acc': {'train': 0.8081395348837209, 'valid': 0.5374482499059089, 'test': 0.7265152533261658}, 'wall_s': 41.81, 'cpu_s': 38.02, 'gpu_s': 3.69, 'wait_s': 138.19}
    [Time] wall=41.8s | cpu=38.0s | gpu=3.7s
    C:\Users\fbrev\Documents\Acadêmico\Simulações\Python\NoisyGL\predictor\Base_Predictor.py:114: UserWarning: expandable_segments not supported on this platform (Triggered internally at ..\c10/cuda/CUDAAllocatorConfig.h:28.)
    self.edge_index = self._cpu_edge_index.to(self.device)
    C:\Users\fbrev\Documents\Acadêmico\Simulações\Python\NoisyGL\predictor\Base_Predictor.py:144: UserWarning: Sparse CSR tensor support is in beta state. If you miss a functionality in the sparse tensor support, please submit a feature request to https://github.com/pytorch/pytorch/issues. (Triggered internally at ..\aten\src\ATen\SparseCsrTensorImpl.cpp:55.)
    self.adj_csr = self.adj.to_sparse_csr().to(self.device)
[I 2026-05-05 16:22:36,433] Trial 96 finished with value: 0.7265152533261658 and parameters: {'lr': 0.001, 'weight_decay': 0.0001, 'n_hidden': 64, 'n_layer': 3, 'dropout': 0.6526674168280143, 'knn_mode': 's', 'k': 27, 'dexp': 5.110765334857589, 'p_grd': 0.34757104573455494, 'unc_rem': 0.05574993200723442, 'unc_rel': 0.1504336533962462}. Best is trial 95 with value: 0.7595081306276038.
    [CPU] Loading dblp...
    DEBUG 3.1: Dataset init start
    DEBUG 3.2: prepare_data start dblp
    ----Data statistics------'
    Name: dblp
    #Nodes 17716
    #Edges 52867
    #Classes 4
    #Ave_degree 5.97
    ----Split statistics------'
    #Train samples 177 (1.0 % of nodes)
    #Val samples 2657 (15.0 % of nodes)
    #Test samples 14882 (remaining)
    ----label noise information:------
    Instance dependent noise
    #Actual noise rate 0.30
    [cuda:1] LNPCC waiting for GPU slot...
    [cuda:1] Slot acquired (waited 132.7s). Starting GCN...
    FINAL_RESULT: {'acc': {'train': 0.6440677966101694, 'valid': 0.5310500564546481, 'test': 0.7160999865609461}, 'wall_s': 44.75, 'cpu_s': 40.85, 'gpu_s': 3.8, 'wait_s': 132.69}
    [Time] wall=44.7s | cpu=40.8s | gpu=3.8s
    C:\Users\fbrev\Documents\Acadêmico\Simulações\Python\NoisyGL\predictor\Base_Predictor.py:114: UserWarning: expandable_segments not supported on this platform (Triggered internally at ..\c10/cuda/CUDAAllocatorConfig.h:28.)
    self.edge_index = self._cpu_edge_index.to(self.device)
    C:\Users\fbrev\Documents\Acadêmico\Simulações\Python\NoisyGL\predictor\Base_Predictor.py:144: UserWarning: Sparse CSR tensor support is in beta state. If you miss a functionality in the sparse tensor support, please submit a feature request to https://github.com/pytorch/pytorch/issues. (Triggered internally at ..\aten\src\ATen\SparseCsrTensorImpl.cpp:55.)
    self.adj_csr = self.adj.to_sparse_csr().to(self.device)
[I 2026-05-05 16:25:40,287] Trial 97 finished with value: 0.7160999865609461 and parameters: {'lr': 0.05, 'weight_decay': 0.0001, 'n_hidden': 64, 'n_layer': 3, 'dropout': 0.7531941171752063, 'knn_mode': 's', 'k': 24, 'dexp': 9.91676819197745, 'p_grd': 0.4432355420911878, 'unc_rem': 0.1283838939185729, 'unc_rel': 0.12695081902616925}. Best is trial 95 with value: 0.7595081306276038.
    [CPU] Loading dblp...
    DEBUG 3.1: Dataset init start
    DEBUG 3.2: prepare_data start dblp
    ----Data statistics------'
    Name: dblp
    #Nodes 17716
    #Edges 52867
    #Classes 4
    #Ave_degree 5.97
    ----Split statistics------'
    #Train samples 177 (1.0 % of nodes)
    #Val samples 2657 (15.0 % of nodes)
    #Test samples 14882 (remaining)
    ----label noise information:------
    Instance dependent noise
    #Actual noise rate 0.30
    [cuda:1] LNPCC waiting for GPU slot...
    [cuda:1] Slot acquired (waited 142.5s). Starting GCN...
    FINAL_RESULT: {'acc': {'train': 0.8466257668711656, 'valid': 0.539330071509221, 'test': 0.7278591587152264}, 'wall_s': 43.06, 'cpu_s': 39.35, 'gpu_s': 3.65, 'wait_s': 142.5}
    [Time] wall=43.1s | cpu=39.4s | gpu=3.6s
    C:\Users\fbrev\Documents\Acadêmico\Simulações\Python\NoisyGL\predictor\Base_Predictor.py:114: UserWarning: expandable_segments not supported on this platform (Triggered internally at ..\c10/cuda/CUDAAllocatorConfig.h:28.)
    self.edge_index = self._cpu_edge_index.to(self.device)
    C:\Users\fbrev\Documents\Acadêmico\Simulações\Python\NoisyGL\predictor\Base_Predictor.py:144: UserWarning: Sparse CSR tensor support is in beta state. If you miss a functionality in the sparse tensor support, please submit a feature request to https://github.com/pytorch/pytorch/issues. (Triggered internally at ..\aten\src\ATen\SparseCsrTensorImpl.cpp:55.)
    self.adj_csr = self.adj.to_sparse_csr().to(self.device)
[I 2026-05-05 16:28:51,856] Trial 98 finished with value: 0.7278591587152264 and parameters: {'lr': 0.001, 'weight_decay': 0.0001, 'n_hidden': 64, 'n_layer': 3, 'dropout': 0.5484329119540251, 'knn_mode': 's', 'k': 29, 'dexp': 0.622205950444455, 'p_grd': 0.398095150812043, 'unc_rem': 0.09088925645937862, 'unc_rel': 0.23828393173166237}. Best is trial 95 with value: 0.7595081306276038.
    [CPU] Loading dblp...
    DEBUG 3.1: Dataset init start
    DEBUG 3.2: prepare_data start dblp
    ----Data statistics------'
    Name: dblp
    #Nodes 17716
    #Edges 52867
    #Classes 4
    #Ave_degree 5.97
    ----Split statistics------'
    #Train samples 177 (1.0 % of nodes)
    #Val samples 2657 (15.0 % of nodes)
    #Test samples 14882 (remaining)
    ----label noise information:------
    Instance dependent noise
    #Actual noise rate 0.30
    [cuda:1] LNPCC waiting for GPU slot...
    [cuda:1] Slot acquired (waited 291.3s). Starting GCN...
    FINAL_RESULT: {'acc': {'train': 0.7290322580645161, 'valid': 0.5318027850959729, 'test': 0.7255073242843704}, 'wall_s': 63.52, 'cpu_s': 60.07, 'gpu_s': 3.37, 'wait_s': 291.26}
    [Time] wall=63.5s | cpu=60.1s | gpu=3.4s
    C:\Users\fbrev\Documents\Acadêmico\Simulações\Python\NoisyGL\predictor\Base_Predictor.py:114: UserWarning: expandable_segments not supported on this platform (Triggered internally at ..\c10/cuda/CUDAAllocatorConfig.h:28.)
    self.edge_index = self._cpu_edge_index.to(self.device)
    C:\Users\fbrev\Documents\Acadêmico\Simulações\Python\NoisyGL\predictor\Base_Predictor.py:144: UserWarning: Sparse CSR tensor support is in beta state. If you miss a functionality in the sparse tensor support, please submit a feature request to https://github.com/pytorch/pytorch/issues. (Triggered internally at ..\aten\src\ATen\SparseCsrTensorImpl.cpp:55.)
    self.adj_csr = self.adj.to_sparse_csr().to(self.device)
[I 2026-05-05 16:34:52,595] Trial 99 finished with value: 0.7255073242843704 and parameters: {'lr': 0.1, 'weight_decay': 0.0001, 'n_hidden': 64, 'n_layer': 3, 'dropout': 0.6149359774308888, 'knn_mode': 'd', 'k': 26, 'dexp': 0.9970789728039697, 'p_grd': 0.3655345520926165, 'unc_rem': 0.5057055397740767, 'unc_rel': 0.18557577397998007}. Best is trial 95 with value: 0.7595081306276038.
    [CPU] Loading dblp...
    DEBUG 3.1: Dataset init start
    DEBUG 3.2: prepare_data start dblp
    ----Data statistics------'
    Name: dblp
    #Nodes 17716
    #Edges 52867
    #Classes 4
    #Ave_degree 5.97
    ----Split statistics------'
    #Train samples 177 (1.0 % of nodes)
    #Val samples 2657 (15.0 % of nodes)
    #Test samples 14882 (remaining)
    ----label noise information:------
    Instance dependent noise
    #Actual noise rate 0.30
    [cuda:1] LNPCC waiting for GPU slot...
    [cuda:1] Slot acquired (waited 318.7s). Starting GCN...
    FINAL_RESULT: {'acc': {'train': 0.7848101265822784, 'valid': 0.5408355287918706, 'test': 0.7349146620077947}, 'wall_s': 45.59, 'cpu_s': 38.54, 'gpu_s': 6.96, 'wait_s': 318.73}
    [Time] wall=45.6s | cpu=38.5s | gpu=7.0s
    C:\Users\fbrev\Documents\Acadêmico\Simulações\Python\NoisyGL\predictor\Base_Predictor.py:114: UserWarning: expandable_segments not supported on this platform (Triggered internally at ..\c10/cuda/CUDAAllocatorConfig.h:28.)
    self.edge_index = self._cpu_edge_index.to(self.device)
    C:\Users\fbrev\Documents\Acadêmico\Simulações\Python\NoisyGL\predictor\Base_Predictor.py:144: UserWarning: Sparse CSR tensor support is in beta state. If you miss a functionality in the sparse tensor support, please submit a feature request to https://github.com/pytorch/pytorch/issues. (Triggered internally at ..\aten\src\ATen\SparseCsrTensorImpl.cpp:55.)
    self.adj_csr = self.adj.to_sparse_csr().to(self.device)
[I 2026-05-05 16:41:02,746] Trial 100 finished with value: 0.7349146620077947 and parameters: {'lr': 0.005, 'weight_decay': 0.001, 'n_hidden': 256, 'n_layer': 3, 'dropout': 0.777866760333278, 'knn_mode': 's', 'k': 21, 'dexp': 5.565410756373666, 'p_grd': 0.40697186041809974, 'unc_rem': 0.0036207675868053756, 'unc_rel': 0.10406063089513318}. Best is trial 95 with value: 0.7595081306276038.
    [CPU] Loading dblp...
    DEBUG 3.1: Dataset init start
    DEBUG 3.2: prepare_data start dblp
    ----Data statistics------'
    Name: dblp
    #Nodes 17716
    #Edges 52867
    #Classes 4
    #Ave_degree 5.97
    ----Split statistics------'
    #Train samples 177 (1.0 % of nodes)
    #Val samples 2657 (15.0 % of nodes)
    #Test samples 14882 (remaining)
    ----label noise information:------
    Instance dependent noise
    #Actual noise rate 0.30
    [cuda:1] LNPCC waiting for GPU slot...
    [cuda:1] Slot acquired (waited 139.2s). Starting GCN...
    FINAL_RESULT: {'acc': {'train': 0.9655172413793104, 'valid': 0.5363191569439217, 'test': 0.7166375487165704}, 'wall_s': 42.49, 'cpu_s': 39.21, 'gpu_s': 3.2, 'wait_s': 139.18}
    [Time] wall=42.5s | cpu=39.2s | gpu=3.2s
    C:\Users\fbrev\Documents\Acadêmico\Simulações\Python\NoisyGL\predictor\Base_Predictor.py:114: UserWarning: expandable_segments not supported on this platform (Triggered internally at ..\c10/cuda/CUDAAllocatorConfig.h:28.)
    self.edge_index = self._cpu_edge_index.to(self.device)
    C:\Users\fbrev\Documents\Acadêmico\Simulações\Python\NoisyGL\predictor\Base_Predictor.py:144: UserWarning: Sparse CSR tensor support is in beta state. If you miss a functionality in the sparse tensor support, please submit a feature request to https://github.com/pytorch/pytorch/issues. (Triggered internally at ..\aten\src\ATen\SparseCsrTensorImpl.cpp:55.)
    self.adj_csr = self.adj.to_sparse_csr().to(self.device)
[I 2026-05-05 16:44:10,405] Trial 101 finished with value: 0.7166375487165704 and parameters: {'lr': 0.001, 'weight_decay': 0.0001, 'n_hidden': 128, 'n_layer': 2, 'dropout': 0.4474599644250394, 'knn_mode': 's', 'k': 34, 'dexp': 0.24645722320992314, 'p_grd': 0.4740913493313902, 'unc_rem': 0.9248662324682416, 'unc_rel': 0.8345541251361419}. Best is trial 95 with value: 0.7595081306276038.
    [CPU] Loading dblp...
    DEBUG 3.1: Dataset init start
    DEBUG 3.2: prepare_data start dblp
    ----Data statistics------'
    Name: dblp
    #Nodes 17716
    #Edges 52867
    #Classes 4
    #Ave_degree 5.97
    ----Split statistics------'
    #Train samples 177 (1.0 % of nodes)
    #Val samples 2657 (15.0 % of nodes)
    #Test samples 14882 (remaining)
    ----label noise information:------
    Instance dependent noise
    #Actual noise rate 0.30
    [cuda:1] LNPCC waiting for GPU slot...
    [cuda:1] Slot acquired (waited 334.4s). Starting GCN...
    FINAL_RESULT: {'acc': {'train': 0.8827160493827161, 'valid': 0.5325555137372977, 'test': 0.7196613358419567}, 'wall_s': 37.21, 'cpu_s': 33.68, 'gpu_s': 3.45, 'wait_s': 334.36}
    [Time] wall=37.2s | cpu=33.7s | gpu=3.4s
    C:\Users\fbrev\Documents\Acadêmico\Simulações\Python\NoisyGL\predictor\Base_Predictor.py:114: UserWarning: expandable_segments not supported on this platform (Triggered internally at ..\c10/cuda/CUDAAllocatorConfig.h:28.)
    self.edge_index = self._cpu_edge_index.to(self.device)
    C:\Users\fbrev\Documents\Acadêmico\Simulações\Python\NoisyGL\predictor\Base_Predictor.py:144: UserWarning: Sparse CSR tensor support is in beta state. If you miss a functionality in the sparse tensor support, please submit a feature request to https://github.com/pytorch/pytorch/issues. (Triggered internally at ..\aten\src\ATen\SparseCsrTensorImpl.cpp:55.)
    self.adj_csr = self.adj.to_sparse_csr().to(self.device)
[I 2026-05-05 16:50:28,176] Trial 102 finished with value: 0.7196613358419567 and parameters: {'lr': 0.001, 'weight_decay': 0.0, 'n_hidden': 32, 'n_layer': 3, 'dropout': 0.04873594911064967, 'knn_mode': 's', 'k': 23, 'dexp': 2.521227428959975, 'p_grd': 0.3225821961237776, 'unc_rem': 0.1541553122648151, 'unc_rel': 0.16855004610780727}. Best is trial 95 with value: 0.7595081306276038.
    [CPU] Loading dblp...
    DEBUG 3.1: Dataset init start
    DEBUG 3.2: prepare_data start dblp
    ----Data statistics------'
    Name: dblp
    #Nodes 17716
    #Edges 52867
    #Classes 4
    #Ave_degree 5.97
    ----Split statistics------'
    #Train samples 177 (1.0 % of nodes)
    #Val samples 2657 (15.0 % of nodes)
    #Test samples 14882 (remaining)
    ----label noise information:------
    Instance dependent noise
    #Actual noise rate 0.30
    [cuda:1] LNPCC waiting for GPU slot...
    [cuda:1] Slot acquired (waited 331.3s). Starting GCN...
    FINAL_RESULT: {'acc': {'train': 0.8658536585365854, 'valid': 0.5344373353406097, 'test': 0.7115979035075931}, 'wall_s': 41.72, 'cpu_s': 37.77, 'gpu_s': 3.86, 'wait_s': 331.32}
    [Time] wall=41.7s | cpu=37.8s | gpu=3.9s
    C:\Users\fbrev\Documents\Acadêmico\Simulações\Python\NoisyGL\predictor\Base_Predictor.py:114: UserWarning: expandable_segments not supported on this platform (Triggered internally at ..\c10/cuda/CUDAAllocatorConfig.h:28.)
    self.edge_index = self._cpu_edge_index.to(self.device)
    C:\Users\fbrev\Documents\Acadêmico\Simulações\Python\NoisyGL\predictor\Base_Predictor.py:144: UserWarning: Sparse CSR tensor support is in beta state. If you miss a functionality in the sparse tensor support, please submit a feature request to https://github.com/pytorch/pytorch/issues. (Triggered internally at ..\aten\src\ATen\SparseCsrTensorImpl.cpp:55.)
    self.adj_csr = self.adj.to_sparse_csr().to(self.device)
[I 2026-05-05 16:56:47,419] Trial 103 finished with value: 0.7115979035075931 and parameters: {'lr': 0.001, 'weight_decay': 0.0001, 'n_hidden': 64, 'n_layer': 3, 'dropout': 0.6938110621514083, 'knn_mode': 's', 'k': 30, 'dexp': 3.7234376137949043, 'p_grd': 0.24382514555220897, 'unc_rem': 0.3150894015619824, 'unc_rel': 0.39588691167176093}. Best is trial 95 with value: 0.7595081306276038.
    [CPU] Loading dblp...
    DEBUG 3.1: Dataset init start
    DEBUG 3.2: prepare_data start dblp
    ----Data statistics------'
    Name: dblp
    #Nodes 17716
    #Edges 52867
    #Classes 4
    #Ave_degree 5.97
    ----Split statistics------'
    #Train samples 177 (1.0 % of nodes)
    #Val samples 2657 (15.0 % of nodes)
    #Test samples 14882 (remaining)
    ----label noise information:------
    Instance dependent noise
    #Actual noise rate 0.30
    [cuda:1] LNPCC waiting for GPU slot...
    [cuda:1] Slot acquired (waited 140.7s). Starting GCN...
    FINAL_RESULT: {'acc': {'train': 0.8580645161290322, 'valid': 0.5355664283025969, 'test': 0.7278591587152264}, 'wall_s': 42.14, 'cpu_s': 38.32, 'gpu_s': 3.71, 'wait_s': 140.72}
    [Time] wall=42.1s | cpu=38.3s | gpu=3.7s
    C:\Users\fbrev\Documents\Acadêmico\Simulações\Python\NoisyGL\predictor\Base_Predictor.py:114: UserWarning: expandable_segments not supported on this platform (Triggered internally at ..\c10/cuda/CUDAAllocatorConfig.h:28.)
    self.edge_index = self._cpu_edge_index.to(self.device)
    C:\Users\fbrev\Documents\Acadêmico\Simulações\Python\NoisyGL\predictor\Base_Predictor.py:144: UserWarning: Sparse CSR tensor support is in beta state. If you miss a functionality in the sparse tensor support, please submit a feature request to https://github.com/pytorch/pytorch/issues. (Triggered internally at ..\aten\src\ATen\SparseCsrTensorImpl.cpp:55.)
    self.adj_csr = self.adj.to_sparse_csr().to(self.device)
[I 2026-05-05 16:59:56,754] Trial 104 finished with value: 0.7278591587152264 and parameters: {'lr': 0.001, 'weight_decay': 0.0001, 'n_hidden': 64, 'n_layer': 3, 'dropout': 0.6701034123752208, 'knn_mode': 's', 'k': 32, 'dexp': 1.9679333543554838, 'p_grd': 0.2906149100006792, 'unc_rem': 0.22747805767049228, 'unc_rel': 0.02668183008888459}. Best is trial 95 with value: 0.7595081306276038.
    [CPU] Loading dblp...
    DEBUG 3.1: Dataset init start
    DEBUG 3.2: prepare_data start dblp
    ----Data statistics------'
    Name: dblp
    #Nodes 17716
    #Edges 52867
    #Classes 4
    #Ave_degree 5.97
    ----Split statistics------'
    #Train samples 177 (1.0 % of nodes)
    #Val samples 2657 (15.0 % of nodes)
    #Test samples 14882 (remaining)
    ----label noise information:------
    Instance dependent noise
    #Actual noise rate 0.30
    [cuda:1] LNPCC waiting for GPU slot...
    [cuda:1] Slot acquired (waited 131.0s). Starting GCN...
    FINAL_RESULT: {'acc': {'train': 0.847682119205298, 'valid': 0.5287918705306737, 'test': 0.7109931460825157}, 'wall_s': 39.44, 'cpu_s': 35.85, 'gpu_s': 3.5, 'wait_s': 130.96}
    [Time] wall=39.4s | cpu=35.9s | gpu=3.5s
    C:\Users\fbrev\Documents\Acadêmico\Simulações\Python\NoisyGL\predictor\Base_Predictor.py:114: UserWarning: expandable_segments not supported on this platform (Triggered internally at ..\c10/cuda/CUDAAllocatorConfig.h:28.)
    self.edge_index = self._cpu_edge_index.to(self.device)
    C:\Users\fbrev\Documents\Acadêmico\Simulações\Python\NoisyGL\predictor\Base_Predictor.py:144: UserWarning: Sparse CSR tensor support is in beta state. If you miss a functionality in the sparse tensor support, please submit a feature request to https://github.com/pytorch/pytorch/issues. (Triggered internally at ..\aten\src\ATen\SparseCsrTensorImpl.cpp:55.)
    self.adj_csr = self.adj.to_sparse_csr().to(self.device)
