[I 2026-04-27 16:36:11,727] Trial 136 finished with value: 0.36851237560602196 and parameters: {'lr': 0.1, 'weight_decay': 0.01, 'n_hidden': 64, 'n_layer': 3, 'dropout': 0.7309214318128213, 'knn_mode': 's', 'k': 42, 'dexp': 3.8183616045657227, 'p_grd': 0.5315937813956572, 'unc_rem': 0.27806577300926794, 'unc_rel': 0.7516715941689985}. Best is trial 29 with value: 0.40505230926256697.
    [CPU] Loading amazon-ratings...
    DEBUG 3.1: Dataset init start
    DEBUG 3.2: prepare_data start amazon-ratings
    ----Data statistics------'
    Name: amazon-ratings
    #Nodes 24492
    #Edges 93050
    #Classes 5
    #Ave_degree 7.60
    ----Split statistics------'
    #Train samples 1224 (5.0 % of nodes)
    #Val samples 3673 (15.0 % of nodes)
    #Test samples 19595 (remaining)
    ----label noise information:------
    Instance dependent noise
    #Actual noise rate 0.13
    [cuda:0] LNPCC waiting for GPU slot...
    [cuda:0] Slot acquired (waited 186.4s). Starting GCN...
    FINAL_RESULT: {'acc': {'train': 0.4063777596075225, 'valid': 0.3640076231962973, 'test': 0.39760142893595307}, 'wall_s': 74.53, 'cpu_s': 70.68, 'gpu_s': 3.8, 'wait_s': 186.36}
    [Time] wall=74.5s | cpu=70.7s | gpu=3.8s
    C:\Users\fbrev\Documents\Acadêmico\Simulações\Python\NoisyGL\predictor\Base_Predictor.py:144: UserWarning: Sparse CSR tensor support is in beta state. If you miss a functionality in the sparse tensor support, please submit a feature request to https://github.com/pytorch/pytorch/issues. (Triggered internally at ..\aten\src\ATen\SparseCsrTensorImpl.cpp:55.)
    self.adj_csr = self.adj.to_sparse_csr().to(self.device)
[I 2026-04-27 16:40:39,581] Trial 137 finished with value: 0.39760142893595307 and parameters: {'lr': 0.1, 'weight_decay': 0.001, 'n_hidden': 64, 'n_layer': 3, 'dropout': 0.7074453900363584, 'knn_mode': 's', 'k': 43, 'dexp': 3.8870399399285587, 'p_grd': 0.6231756032175663, 'unc_rem': 0.18542099155285613, 'unc_rel': 0.7950191652050819}. Best is trial 29 with value: 0.40505230926256697.
    [CPU] Loading amazon-ratings...
    DEBUG 3.1: Dataset init start
    DEBUG 3.2: prepare_data start amazon-ratings
    ----Data statistics------'
    Name: amazon-ratings
    #Nodes 24492
    #Edges 93050
    #Classes 5
    #Ave_degree 7.60
    ----Split statistics------'
    #Train samples 1224 (5.0 % of nodes)
    #Val samples 3673 (15.0 % of nodes)
    #Test samples 19595 (remaining)
    ----label noise information:------
    Instance dependent noise
    #Actual noise rate 0.13
    [cuda:0] LNPCC waiting for GPU slot...
    [cuda:0] Slot acquired (waited 982.3s). Starting GCN...
    FINAL_RESULT: {'acc': {'train': 0.419460343417825, 'valid': 0.3672747073237136, 'test': 0.39760142893595307}, 'wall_s': 64.0, 'cpu_s': 60.28, 'gpu_s': 3.68, 'wait_s': 982.3}
    [Time] wall=64.0s | cpu=60.3s | gpu=3.7s
    C:\Users\fbrev\Documents\Acadêmico\Simulações\Python\NoisyGL\predictor\Base_Predictor.py:144: UserWarning: Sparse CSR tensor support is in beta state. If you miss a functionality in the sparse tensor support, please submit a feature request to https://github.com/pytorch/pytorch/issues. (Triggered internally at ..\aten\src\ATen\SparseCsrTensorImpl.cpp:55.)
    self.adj_csr = self.adj.to_sparse_csr().to(self.device)
[I 2026-04-27 16:58:12,666] Trial 138 finished with value: 0.39760142893595307 and parameters: {'lr': 0.1, 'weight_decay': 0.001, 'n_hidden': 64, 'n_layer': 3, 'dropout': 0.26355411447340515, 'knn_mode': 's', 'k': 41, 'dexp': 8.20537941782604, 'p_grd': 0.5009386218984114, 'unc_rem': 0.42689600513469284, 'unc_rel': 0.703476853612063}. Best is trial 29 with value: 0.40505230926256697.
    [CPU] Loading amazon-ratings...
    DEBUG 3.1: Dataset init start
    DEBUG 3.2: prepare_data start amazon-ratings
    ----Data statistics------'
    Name: amazon-ratings
    #Nodes 24492
    #Edges 93050
    #Classes 5
    #Ave_degree 7.60
    ----Split statistics------'
    #Train samples 1224 (5.0 % of nodes)
    #Val samples 3673 (15.0 % of nodes)
    #Test samples 19595 (remaining)
    ----label noise information:------
    Instance dependent noise
    #Actual noise rate 0.13
    [cuda:0] LNPCC waiting for GPU slot...
    [cuda:0] Slot acquired (waited 960.5s). Starting GCN...
    FINAL_RESULT: {'acc': {'train': 0.4560669456066946, 'valid': 0.3670024503130956, 'test': 0.3910691502934422}, 'wall_s': 46.99, 'cpu_s': 42.94, 'gpu_s': 4.0, 'wait_s': 960.48}
    [Time] wall=47.0s | cpu=42.9s | gpu=4.0s
    C:\Users\fbrev\Documents\Acadêmico\Simulações\Python\NoisyGL\predictor\Base_Predictor.py:144: UserWarning: Sparse CSR tensor support is in beta state. If you miss a functionality in the sparse tensor support, please submit a feature request to https://github.com/pytorch/pytorch/issues. (Triggered internally at ..\aten\src\ATen\SparseCsrTensorImpl.cpp:55.)
    self.adj_csr = self.adj.to_sparse_csr().to(self.device)
[I 2026-04-27 17:15:06,694] Trial 139 finished with value: 0.3910691502934422 and parameters: {'lr': 0.001, 'weight_decay': 0.001, 'n_hidden': 64, 'n_layer': 3, 'dropout': 0.6793594174604157, 'knn_mode': 's', 'k': 42, 'dexp': 7.813833258378739, 'p_grd': 0.4272763617245973, 'unc_rem': 0.044009536573926894, 'unc_rel': 0.7295999658781581}. Best is trial 29 with value: 0.40505230926256697.
    [CPU] Loading amazon-ratings...
    DEBUG 3.1: Dataset init start
    DEBUG 3.2: prepare_data start amazon-ratings
    ----Data statistics------'
    Name: amazon-ratings
    #Nodes 24492
    #Edges 93050
    #Classes 5
    #Ave_degree 7.60
    ----Split statistics------'
    #Train samples 1224 (5.0 % of nodes)
    #Val samples 3673 (15.0 % of nodes)
    #Test samples 19595 (remaining)
    ----label noise information:------
    Instance dependent noise
    #Actual noise rate 0.13
    [cuda:0] LNPCC waiting for GPU slot...
    [cuda:0] Slot acquired (waited 607.5s). Starting GCN...
    FINAL_RESULT: {'acc': {'train': 0.4717906786590352, 'valid': 0.37054179145112986, 'test': 0.39504975759122224}, 'wall_s': 149.83, 'cpu_s': 145.76, 'gpu_s': 4.03, 'wait_s': 607.5}
    [Time] wall=149.8s | cpu=145.8s | gpu=4.0s
    C:\Users\fbrev\Documents\Acadêmico\Simulações\Python\NoisyGL\predictor\Base_Predictor.py:144: UserWarning: Sparse CSR tensor support is in beta state. If you miss a functionality in the sparse tensor support, please submit a feature request to https://github.com/pytorch/pytorch/issues. (Triggered internally at ..\aten\src\ATen\SparseCsrTensorImpl.cpp:55.)
    self.adj_csr = self.adj.to_sparse_csr().to(self.device)
[I 2026-04-27 17:27:50,588] Trial 140 finished with value: 0.39504975759122224 and parameters: {'lr': 0.1, 'weight_decay': 0.0001, 'n_hidden': 64, 'n_layer': 3, 'dropout': 0.7439954432692447, 'knn_mode': 's', 'k': 38, 'dexp': 4.19433681124272, 'p_grd': 0.9961618545643931, 'unc_rem': 0.38175225507629135, 'unc_rel': 0.7546378397139302}. Best is trial 29 with value: 0.40505230926256697.
    [CPU] Loading amazon-ratings...
    DEBUG 3.1: Dataset init start
    DEBUG 3.2: prepare_data start amazon-ratings
    ----Data statistics------'
    Name: amazon-ratings
    #Nodes 24492
    #Edges 93050
    #Classes 5
    #Ave_degree 7.60
    ----Split statistics------'
    #Train samples 1224 (5.0 % of nodes)
    #Val samples 3673 (15.0 % of nodes)
    #Test samples 19595 (remaining)
    ----label noise information:------
    Instance dependent noise
    #Actual noise rate 0.13
    [cuda:0] LNPCC waiting for GPU slot...
    [cuda:0] Slot acquired (waited 189.8s). Starting GCN...
    FINAL_RESULT: {'acc': {'train': 0.39983579638752054, 'valid': 0.3670024503130956, 'test': 0.39372288849196224}, 'wall_s': 59.42, 'cpu_s': 55.24, 'gpu_s': 4.13, 'wait_s': 189.79}
    [Time] wall=59.4s | cpu=55.2s | gpu=4.1s
    C:\Users\fbrev\Documents\Acadêmico\Simulações\Python\NoisyGL\predictor\Base_Predictor.py:144: UserWarning: Sparse CSR tensor support is in beta state. If you miss a functionality in the sparse tensor support, please submit a feature request to https://github.com/pytorch/pytorch/issues. (Triggered internally at ..\aten\src\ATen\SparseCsrTensorImpl.cpp:55.)
    self.adj_csr = self.adj.to_sparse_csr().to(self.device)
[I 2026-04-27 17:32:06,446] Trial 141 finished with value: 0.39372288849196224 and parameters: {'lr': 0.1, 'weight_decay': 0.001, 'n_hidden': 64, 'n_layer': 3, 'dropout': 0.7677856119724898, 'knn_mode': 's', 'k': 40, 'dexp': 8.918141792850568, 'p_grd': 0.5173135888215328, 'unc_rem': 0.09492731638385586, 'unc_rel': 0.7701955301731224}. Best is trial 29 with value: 0.40505230926256697.
    [CPU] Loading amazon-ratings...
    DEBUG 3.1: Dataset init start
    DEBUG 3.2: prepare_data start amazon-ratings
    ----Data statistics------'
    Name: amazon-ratings
    #Nodes 24492
    #Edges 93050
    #Classes 5
    #Ave_degree 7.60
    ----Split statistics------'
    #Train samples 1224 (5.0 % of nodes)
    #Val samples 3673 (15.0 % of nodes)
    #Test samples 19595 (remaining)
    ----label noise information:------
    Instance dependent noise
    #Actual noise rate 0.13
    [cuda:0] LNPCC waiting for GPU slot...
    [cuda:0] Slot acquired (waited 149.5s). Starting GCN...
    FINAL_RESULT: {'acc': {'train': 0.4256535947712418, 'valid': 0.36346310917506125, 'test': 0.39356978821127836}, 'wall_s': 90.04, 'cpu_s': 86.92, 'gpu_s': 3.07, 'wait_s': 149.53}
    [Time] wall=90.0s | cpu=86.9s | gpu=3.1s
    C:\Users\fbrev\Documents\Acadêmico\Simulações\Python\NoisyGL\predictor\Base_Predictor.py:144: UserWarning: Sparse CSR tensor support is in beta state. If you miss a functionality in the sparse tensor support, please submit a feature request to https://github.com/pytorch/pytorch/issues. (Triggered internally at ..\aten\src\ATen\SparseCsrTensorImpl.cpp:55.)
    self.adj_csr = self.adj.to_sparse_csr().to(self.device)
[I 2026-04-27 17:36:12,759] Trial 142 finished with value: 0.39356978821127836 and parameters: {'lr': 0.1, 'weight_decay': 0.001, 'n_hidden': 64, 'n_layer': 2, 'dropout': 0.721874448488231, 'knn_mode': 'd', 'k': 44, 'dexp': 4.559439672606615, 'p_grd': 0.45385606118097116, 'unc_rem': 0.7781540323352604, 'unc_rel': 0.8672852313526473}. Best is trial 29 with value: 0.40505230926256697.
    [CPU] Loading amazon-ratings...
    DEBUG 3.1: Dataset init start
    DEBUG 3.2: prepare_data start amazon-ratings
    ----Data statistics------'
    Name: amazon-ratings
    #Nodes 24492
    #Edges 93050
    #Classes 5
    #Ave_degree 7.60
    ----Split statistics------'
    #Train samples 1224 (5.0 % of nodes)
    #Val samples 3673 (15.0 % of nodes)
    #Test samples 19595 (remaining)
    ----label noise information:------
    Instance dependent noise
    #Actual noise rate 0.13
    [cuda:0] LNPCC waiting for GPU slot...
    [cuda:0] Slot acquired (waited 190.3s). Starting GCN...
    FINAL_RESULT: {'acc': {'train': 0.3896636587366694, 'valid': 0.3661856792812415, 'test': 0.3981117632048992}, 'wall_s': 55.7, 'cpu_s': 51.8, 'gpu_s': 3.86, 'wait_s': 190.31}
    [Time] wall=55.7s | cpu=51.8s | gpu=3.9s
    C:\Users\fbrev\Documents\Acadêmico\Simulações\Python\NoisyGL\predictor\Base_Predictor.py:144: UserWarning: Sparse CSR tensor support is in beta state. If you miss a functionality in the sparse tensor support, please submit a feature request to https://github.com/pytorch/pytorch/issues. (Triggered internally at ..\aten\src\ATen\SparseCsrTensorImpl.cpp:55.)
    self.adj_csr = self.adj.to_sparse_csr().to(self.device)
[I 2026-04-27 17:40:25,482] Trial 143 finished with value: 0.3981117632048992 and parameters: {'lr': 0.1, 'weight_decay': 0.001, 'n_hidden': 64, 'n_layer': 3, 'dropout': 0.7614165293976004, 'knn_mode': 's', 'k': 41, 'dexp': 3.9931283931254193, 'p_grd': 0.49888640762890435, 'unc_rem': 0.154776683584186, 'unc_rel': 0.7859238110606959}. Best is trial 29 with value: 0.40505230926256697.
    [CPU] Loading amazon-ratings...
    DEBUG 3.1: Dataset init start
    DEBUG 3.2: prepare_data start amazon-ratings
    ----Data statistics------'
    Name: amazon-ratings
    #Nodes 24492
    #Edges 93050
    #Classes 5
    #Ave_degree 7.60
    ----Split statistics------'
    #Train samples 1224 (5.0 % of nodes)
    #Val samples 3673 (15.0 % of nodes)
    #Test samples 19595 (remaining)
    ----label noise information:------
    Instance dependent noise
    #Actual noise rate 0.13
    [cuda:0] LNPCC waiting for GPU slot...
    [cuda:0] Slot acquired (waited 200.9s). Starting GCN...
    FINAL_RESULT: {'acc': {'train': 0.39983646770237125, 'valid': 0.3664579362918595, 'test': 0.3967848941056392}, 'wall_s': 46.96, 'cpu_s': 43.09, 'gpu_s': 3.82, 'wait_s': 200.93}
    [Time] wall=47.0s | cpu=43.1s | gpu=3.8s
    C:\Users\fbrev\Documents\Acadêmico\Simulações\Python\NoisyGL\predictor\Base_Predictor.py:144: UserWarning: Sparse CSR tensor support is in beta state. If you miss a functionality in the sparse tensor support, please submit a feature request to https://github.com/pytorch/pytorch/issues. (Triggered internally at ..\aten\src\ATen\SparseCsrTensorImpl.cpp:55.)
    self.adj_csr = self.adj.to_sparse_csr().to(self.device)
[I 2026-04-27 17:44:39,902] Trial 144 finished with value: 0.3967848941056392 and parameters: {'lr': 0.1, 'weight_decay': 0.001, 'n_hidden': 64, 'n_layer': 3, 'dropout': 0.7944554837019516, 'knn_mode': 's', 'k': 39, 'dexp': 3.4342103314271304, 'p_grd': 0.4960038085213213, 'unc_rem': 0.2253219233469046, 'unc_rel': 0.8048382622165451}. Best is trial 29 with value: 0.40505230926256697.
    [CPU] Loading amazon-ratings...
    DEBUG 3.1: Dataset init start
    DEBUG 3.2: prepare_data start amazon-ratings
    ----Data statistics------'
    Name: amazon-ratings
    #Nodes 24492
    #Edges 93050
    #Classes 5
    #Ave_degree 7.60
    ----Split statistics------'
    #Train samples 1224 (5.0 % of nodes)
    #Val samples 3673 (15.0 % of nodes)
    #Test samples 19595 (remaining)
    ----label noise information:------
    Instance dependent noise
    #Actual noise rate 0.13
    [cuda:0] LNPCC waiting for GPU slot...
    [cuda:0] Slot acquired (waited 684.4s). Starting GCN...
    FINAL_RESULT: {'acc': {'train': 0.42342342342342343, 'valid': 0.3689082493874217, 'test': 0.39734626180147997}, 'wall_s': 51.99, 'cpu_s': 48.2, 'gpu_s': 3.74, 'wait_s': 684.42}
    [Time] wall=52.0s | cpu=48.2s | gpu=3.7s
    C:\Users\fbrev\Documents\Acadêmico\Simulações\Python\NoisyGL\predictor\Base_Predictor.py:144: UserWarning: Sparse CSR tensor support is in beta state. If you miss a functionality in the sparse tensor support, please submit a feature request to https://github.com/pytorch/pytorch/issues. (Triggered internally at ..\aten\src\ATen\SparseCsrTensorImpl.cpp:55.)
    self.adj_csr = self.adj.to_sparse_csr().to(self.device)
[I 2026-04-27 17:57:03,127] Trial 145 finished with value: 0.39734626180147997 and parameters: {'lr': 0.1, 'weight_decay': 0.001, 'n_hidden': 64, 'n_layer': 3, 'dropout': 0.741537358256401, 'knn_mode': 's', 'k': 41, 'dexp': 4.0460136568356635, 'p_grd': 0.5405303112830301, 'unc_rem': 0.3223594249902515, 'unc_rel': 0.6908444584807077}. Best is trial 29 with value: 0.40505230926256697.
    [CPU] Loading amazon-ratings...
    DEBUG 3.1: Dataset init start
    DEBUG 3.2: prepare_data start amazon-ratings
    ----Data statistics------'
    Name: amazon-ratings
    #Nodes 24492
    #Edges 93050
    #Classes 5
    #Ave_degree 7.60
    ----Split statistics------'
    #Train samples 1224 (5.0 % of nodes)
    #Val samples 3673 (15.0 % of nodes)
    #Test samples 19595 (remaining)
    ----label noise information:------
    Instance dependent noise
    #Actual noise rate 0.13
    [cuda:0] LNPCC waiting for GPU slot...
    [cuda:0] Slot acquired (waited 182.4s). Starting GCN...
    FINAL_RESULT: {'acc': {'train': 0.4024590163934426, 'valid': 0.37081404846174787, 'test': 0.39984689971931614}, 'wall_s': 61.19, 'cpu_s': 57.32, 'gpu_s': 3.82, 'wait_s': 182.43}
    [Time] wall=61.2s | cpu=57.3s | gpu=3.8s
    C:\Users\fbrev\Documents\Acadêmico\Simulações\Python\NoisyGL\predictor\Base_Predictor.py:144: UserWarning: Sparse CSR tensor support is in beta state. If you miss a functionality in the sparse tensor support, please submit a feature request to https://github.com/pytorch/pytorch/issues. (Triggered internally at ..\aten\src\ATen\SparseCsrTensorImpl.cpp:55.)
    self.adj_csr = self.adj.to_sparse_csr().to(self.device)
[I 2026-04-27 18:01:13,563] Trial 146 finished with value: 0.39984689971931614 and parameters: {'lr': 0.1, 'weight_decay': 0.001, 'n_hidden': 64, 'n_layer': 3, 'dropout': 0.7686981034896659, 'knn_mode': 's', 'k': 43, 'dexp': 3.708216741908808, 'p_grd': 0.5123397423464755, 'unc_rem': 0.19497769081528987, 'unc_rel': 0.8398330008823844}. Best is trial 29 with value: 0.40505230926256697.
    [CPU] Loading amazon-ratings...
    DEBUG 3.1: Dataset init start
    DEBUG 3.2: prepare_data start amazon-ratings
    ----Data statistics------'
    Name: amazon-ratings
    #Nodes 24492
    #Edges 93050
    #Classes 5
    #Ave_degree 7.60
    ----Split statistics------'
    #Train samples 1224 (5.0 % of nodes)
    #Val samples 3673 (15.0 % of nodes)
    #Test samples 19595 (remaining)
    ----label noise information:------
    Instance dependent noise
    #Actual noise rate 0.13
    [cuda:0] LNPCC waiting for GPU slot...
    [cuda:0] Slot acquired (waited 413.4s). Starting GCN...
    FINAL_RESULT: {'acc': {'train': 0.39411283728536384, 'valid': 0.3689082493874217, 'test': 0.39862209747384536}, 'wall_s': 57.86, 'cpu_s': 54.05, 'gpu_s': 3.76, 'wait_s': 413.42}
    [Time] wall=57.9s | cpu=54.1s | gpu=3.8s
    C:\Users\fbrev\Documents\Acadêmico\Simulações\Python\NoisyGL\predictor\Base_Predictor.py:144: UserWarning: Sparse CSR tensor support is in beta state. If you miss a functionality in the sparse tensor support, please submit a feature request to https://github.com/pytorch/pytorch/issues. (Triggered internally at ..\aten\src\ATen\SparseCsrTensorImpl.cpp:55.)
    self.adj_csr = self.adj.to_sparse_csr().to(self.device)
[I 2026-04-27 18:09:11,252] Trial 147 finished with value: 0.39862209747384536 and parameters: {'lr': 0.1, 'weight_decay': 0.001, 'n_hidden': 64, 'n_layer': 3, 'dropout': 0.7781285163581673, 'knn_mode': 's', 'k': 43, 'dexp': 9.311525262156065, 'p_grd': 0.576126778947376, 'unc_rem': 0.12504980270894245, 'unc_rel': 0.8872811029551277}. Best is trial 29 with value: 0.40505230926256697.
    [CPU] Loading amazon-ratings...
    DEBUG 3.1: Dataset init start
    DEBUG 3.2: prepare_data start amazon-ratings
    ----Data statistics------'
    Name: amazon-ratings
    #Nodes 24492
    #Edges 93050
    #Classes 5
    #Ave_degree 7.60
    ----Split statistics------'
    #Train samples 1224 (5.0 % of nodes)
    #Val samples 3673 (15.0 % of nodes)
    #Test samples 19595 (remaining)
    ----label noise information:------
    Instance dependent noise
    #Actual noise rate 0.13
    [cuda:0] LNPCC waiting for GPU slot...
    [cuda:0] Slot acquired (waited 682.5s). Starting GCN...
    FINAL_RESULT: {'acc': {'train': 0.408298755186722, 'valid': 0.3642798802069153, 'test': 0.39540699157948456}, 'wall_s': 52.29, 'cpu_s': 49.25, 'gpu_s': 2.99, 'wait_s': 682.5}
    [Time] wall=52.3s | cpu=49.3s | gpu=3.0s
    C:\Users\fbrev\Documents\Acadêmico\Simulações\Python\NoisyGL\predictor\Base_Predictor.py:144: UserWarning: Sparse CSR tensor support is in beta state. If you miss a functionality in the sparse tensor support, please submit a feature request to https://github.com/pytorch/pytorch/issues. (Triggered internally at ..\aten\src\ATen\SparseCsrTensorImpl.cpp:55.)
    self.adj_csr = self.adj.to_sparse_csr().to(self.device)
[I 2026-04-27 18:21:32,398] Trial 148 finished with value: 0.39540699157948456 and parameters: {'lr': 0.1, 'weight_decay': 0.001, 'n_hidden': 32, 'n_layer': 3, 'dropout': 0.3533960606387425, 'knn_mode': 's', 'k': 45, 'dexp': 3.3589173850838665, 'p_grd': 0.5255964951488439, 'unc_rem': 0.06571509825893357, 'unc_rel': 0.17297262622677456}. Best is trial 29 with value: 0.40505230926256697.
    [CPU] Loading amazon-ratings...
    DEBUG 3.1: Dataset init start
    DEBUG 3.2: prepare_data start amazon-ratings
    ----Data statistics------'
    Name: amazon-ratings
    #Nodes 24492
    #Edges 93050
    #Classes 5
    #Ave_degree 7.60
    ----Split statistics------'
    #Train samples 1224 (5.0 % of nodes)
    #Val samples 3673 (15.0 % of nodes)
    #Test samples 19595 (remaining)
    ----label noise information:------
    Instance dependent noise
    #Actual noise rate 0.13
    [cuda:0] LNPCC waiting for GPU slot...
    [cuda:0] Slot acquired (waited 698.8s). Starting GCN...
    FINAL_RESULT: {'acc': {'train': 0.3924466338259442, 'valid': 0.36564116526000545, 'test': 0.39719316152079615}, 'wall_s': 51.93, 'cpu_s': 47.92, 'gpu_s': 3.96, 'wait_s': 698.79}
    [Time] wall=51.9s | cpu=47.9s | gpu=4.0s
    C:\Users\fbrev\Documents\Acadêmico\Simulações\Python\NoisyGL\predictor\Base_Predictor.py:144: UserWarning: Sparse CSR tensor support is in beta state. If you miss a functionality in the sparse tensor support, please submit a feature request to https://github.com/pytorch/pytorch/issues. (Triggered internally at ..\aten\src\ATen\SparseCsrTensorImpl.cpp:55.)
    self.adj_csr = self.adj.to_sparse_csr().to(self.device)
