[I 2026-05-03 21:02:23,522] Trial 44 finished with value: 0.7251082251082251 and parameters: {'lr': 0.005, 'weight_decay': 0.001, 'n_hidden': 64, 'n_layer': 2, 'dropout': 0.7983307107898306, 'knn_mode': 'd', 'k': 14, 'dexp': 8.749128175746907, 'p_grd': 0.23953852479547422, 'unc_rem': 0.677322892576263, 'unc_rel': 0.26726389604163764}. Best is trial 31 with value: 0.7328042328042328.
    [CPU] Loading blogcatalog...
    DEBUG 3.1: Dataset init start
    DEBUG 3.2: prepare_data start blogcatalog
    ----Data statistics------'
    Name: blogcatalog
    #Nodes 5196
    #Edges 171743
    #Classes 6
    #Ave_degree 66.11
    ----Split statistics------'
    #Train samples 259 (5.0 % of nodes)
    #Val samples 779 (15.0 % of nodes)
    #Test samples 4158 (remaining)
    ----label noise information:------
    Instance dependent noise
    #Actual noise rate 0.13
    [cuda:0] LNPCC waiting for GPU slot...
    [cuda:0] Slot acquired (waited 138.1s). Starting GCN...
    FINAL_RESULT: {'acc': {'train': 0.7976653696498055, 'valid': 0.6546854942233633, 'test': 0.7092352092352092}, 'wall_s': 22.49, 'cpu_s': 18.46, 'gpu_s': 3.96, 'wait_s': 138.12}
    [Time] wall=22.5s | cpu=18.5s | gpu=4.0s
    C:\Users\fbrev\Documents\Acadêmico\Simulações\Python\NoisyGL\predictor\Base_Predictor.py:114: UserWarning: expandable_segments not supported on this platform (Triggered internally at ..\c10/cuda/CUDAAllocatorConfig.h:28.)
    self.edge_index = self._cpu_edge_index.to(self.device)
    C:\Users\fbrev\Documents\Acadêmico\Simulações\Python\NoisyGL\predictor\Base_Predictor.py:144: UserWarning: Sparse CSR tensor support is in beta state. If you miss a functionality in the sparse tensor support, please submit a feature request to https://github.com/pytorch/pytorch/issues. (Triggered internally at ..\aten\src\ATen\SparseCsrTensorImpl.cpp:55.)
    self.adj_csr = self.adj.to_sparse_csr().to(self.device)
[I 2026-05-03 21:05:09,345] Trial 45 finished with value: 0.7092352092352092 and parameters: {'lr': 0.01, 'weight_decay': 0.001, 'n_hidden': 128, 'n_layer': 2, 'dropout': 0.5108903478045342, 'knn_mode': 'd', 'k': 17, 'dexp': 9.91223166164396, 'p_grd': 0.17852450098692, 'unc_rem': 0.4355535588781527, 'unc_rel': 0.010070103060870805}. Best is trial 31 with value: 0.7328042328042328.
    [CPU] Loading blogcatalog...
    DEBUG 3.1: Dataset init start
    DEBUG 3.2: prepare_data start blogcatalog
    ----Data statistics------'
    Name: blogcatalog
    #Nodes 5196
    #Edges 171743
    #Classes 6
    #Ave_degree 66.11
    ----Split statistics------'
    #Train samples 259 (5.0 % of nodes)
    #Val samples 779 (15.0 % of nodes)
    #Test samples 4158 (remaining)
    ----label noise information:------
    Instance dependent noise
    #Actual noise rate 0.13
    [cuda:0] LNPCC waiting for GPU slot...
    [cuda:0] Slot acquired (waited 70.2s). Starting GCN...
    FINAL_RESULT: {'acc': {'train': 0.5192307692307693, 'valid': 0.5083440308087291, 'test': 0.5291005291005291}, 'wall_s': 18.48, 'cpu_s': 15.19, 'gpu_s': 3.2, 'wait_s': 70.25}
    [Time] wall=18.5s | cpu=15.2s | gpu=3.2s
    C:\Users\fbrev\Documents\Acadêmico\Simulações\Python\NoisyGL\predictor\Base_Predictor.py:114: UserWarning: expandable_segments not supported on this platform (Triggered internally at ..\c10/cuda/CUDAAllocatorConfig.h:28.)
    self.edge_index = self._cpu_edge_index.to(self.device)
    C:\Users\fbrev\Documents\Acadêmico\Simulações\Python\NoisyGL\predictor\Base_Predictor.py:144: UserWarning: Sparse CSR tensor support is in beta state. If you miss a functionality in the sparse tensor support, please submit a feature request to https://github.com/pytorch/pytorch/issues. (Triggered internally at ..\aten\src\ATen\SparseCsrTensorImpl.cpp:55.)
    self.adj_csr = self.adj.to_sparse_csr().to(self.device)
[I 2026-05-03 21:06:43,187] Trial 46 finished with value: 0.5291005291005291 and parameters: {'lr': 0.1, 'weight_decay': 0.001, 'n_hidden': 64, 'n_layer': 2, 'dropout': 0.6173117332557496, 'knn_mode': 'd', 'k': 43, 'dexp': 8.736432810853255, 'p_grd': 0.04597356794153375, 'unc_rem': 0.5717420230226842, 'unc_rel': 0.11256196874930727}. Best is trial 31 with value: 0.7328042328042328.
    [CPU] Loading blogcatalog...
    DEBUG 3.1: Dataset init start
    DEBUG 3.2: prepare_data start blogcatalog
    ----Data statistics------'
    Name: blogcatalog
    #Nodes 5196
    #Edges 171743
    #Classes 6
    #Ave_degree 66.11
    ----Split statistics------'
    #Train samples 259 (5.0 % of nodes)
    #Val samples 779 (15.0 % of nodes)
    #Test samples 4158 (remaining)
    ----label noise information:------
    Instance dependent noise
    #Actual noise rate 0.13
    [cuda:0] LNPCC waiting for GPU slot...
    [cuda:0] Slot acquired (waited 146.5s). Starting GCN...
    FINAL_RESULT: {'acc': {'train': 0.7686274509803922, 'valid': 0.637997432605905, 'test': 0.7198172198172198}, 'wall_s': 22.62, 'cpu_s': 19.8, 'gpu_s': 2.75, 'wait_s': 146.49}
    [Time] wall=22.6s | cpu=19.8s | gpu=2.8s
    C:\Users\fbrev\Documents\Acadêmico\Simulações\Python\NoisyGL\predictor\Base_Predictor.py:114: UserWarning: expandable_segments not supported on this platform (Triggered internally at ..\c10/cuda/CUDAAllocatorConfig.h:28.)
    self.edge_index = self._cpu_edge_index.to(self.device)
    C:\Users\fbrev\Documents\Acadêmico\Simulações\Python\NoisyGL\predictor\Base_Predictor.py:144: UserWarning: Sparse CSR tensor support is in beta state. If you miss a functionality in the sparse tensor support, please submit a feature request to https://github.com/pytorch/pytorch/issues. (Triggered internally at ..\aten\src\ATen\SparseCsrTensorImpl.cpp:55.)
    self.adj_csr = self.adj.to_sparse_csr().to(self.device)
[I 2026-05-03 21:09:37,642] Trial 47 finished with value: 0.7198172198172198 and parameters: {'lr': 0.005, 'weight_decay': 0.0, 'n_hidden': 64, 'n_layer': 2, 'dropout': 0.5744095249474602, 'knn_mode': 'd', 'k': 21, 'dexp': 7.830867662201484, 'p_grd': 0.11019307385736524, 'unc_rem': 0.8024979958713234, 'unc_rel': 0.054791929461835844}. Best is trial 31 with value: 0.7328042328042328.
    [CPU] Loading blogcatalog...
    DEBUG 3.1: Dataset init start
    DEBUG 3.2: prepare_data start blogcatalog
    ----Data statistics------'
    Name: blogcatalog
    #Nodes 5196
    #Edges 171743
    #Classes 6
    #Ave_degree 66.11
    ----Split statistics------'
    #Train samples 259 (5.0 % of nodes)
    #Val samples 779 (15.0 % of nodes)
    #Test samples 4158 (remaining)
    ----label noise information:------
    Instance dependent noise
    #Actual noise rate 0.13
    [cuda:0] LNPCC waiting for GPU slot...
    [cuda:0] Slot acquired (waited 56.3s). Starting GCN...
    FINAL_RESULT: {'acc': {'train': 0.6911196911196911, 'valid': 0.6418485237483954, 'test': 0.7077922077922078}, 'wall_s': 22.95, 'cpu_s': 19.93, 'gpu_s': 2.95, 'wait_s': 56.25}
    [Time] wall=22.9s | cpu=19.9s | gpu=2.9s
    C:\Users\fbrev\Documents\Acadêmico\Simulações\Python\NoisyGL\predictor\Base_Predictor.py:114: UserWarning: expandable_segments not supported on this platform (Triggered internally at ..\c10/cuda/CUDAAllocatorConfig.h:28.)
    self.edge_index = self._cpu_edge_index.to(self.device)
    C:\Users\fbrev\Documents\Acadêmico\Simulações\Python\NoisyGL\predictor\Base_Predictor.py:144: UserWarning: Sparse CSR tensor support is in beta state. If you miss a functionality in the sparse tensor support, please submit a feature request to https://github.com/pytorch/pytorch/issues. (Triggered internally at ..\aten\src\ATen\SparseCsrTensorImpl.cpp:55.)
    self.adj_csr = self.adj.to_sparse_csr().to(self.device)
[I 2026-05-03 21:11:01,687] Trial 48 finished with value: 0.7077922077922078 and parameters: {'lr': 0.005, 'weight_decay': 0.01, 'n_hidden': 64, 'n_layer': 2, 'dropout': 0.5030538181198108, 'knn_mode': 'd', 'k': 30, 'dexp': 7.204009687081502, 'p_grd': 0.34363533874784413, 'unc_rem': 0.6197464979657513, 'unc_rel': 0.19922444369770623}. Best is trial 31 with value: 0.7328042328042328.
    [CPU] Loading blogcatalog...
    DEBUG 3.1: Dataset init start
    DEBUG 3.2: prepare_data start blogcatalog
    ----Data statistics------'
    Name: blogcatalog
    #Nodes 5196
    #Edges 171743
    #Classes 6
    #Ave_degree 66.11
    ----Split statistics------'
    #Train samples 259 (5.0 % of nodes)
    #Val samples 779 (15.0 % of nodes)
    #Test samples 4158 (remaining)
    ----label noise information:------
    Instance dependent noise
    #Actual noise rate 0.13
    [cuda:0] LNPCC waiting for GPU slot...
    [cuda:0] Slot acquired (waited 66.8s). Starting GCN...
    FINAL_RESULT: {'acc': {'train': 0.8051948051948052, 'valid': 0.6238767650834403, 'test': 0.6921596921596922}, 'wall_s': 91.41, 'cpu_s': 85.18, 'gpu_s': 6.15, 'wait_s': 66.79}
    [Time] wall=91.4s | cpu=85.2s | gpu=6.2s
    C:\Users\fbrev\Documents\Acadêmico\Simulações\Python\NoisyGL\predictor\Base_Predictor.py:114: UserWarning: expandable_segments not supported on this platform (Triggered internally at ..\c10/cuda/CUDAAllocatorConfig.h:28.)
    self.edge_index = self._cpu_edge_index.to(self.device)
    C:\Users\fbrev\Documents\Acadêmico\Simulações\Python\NoisyGL\predictor\Base_Predictor.py:144: UserWarning: Sparse CSR tensor support is in beta state. If you miss a functionality in the sparse tensor support, please submit a feature request to https://github.com/pytorch/pytorch/issues. (Triggered internally at ..\aten\src\ATen\SparseCsrTensorImpl.cpp:55.)
    self.adj_csr = self.adj.to_sparse_csr().to(self.device)
