[worker] START lnpcc_amazon-ratings_0.2 gpu=1
[HPO] Starting Phase 1 (Optuna) for lnpcc_amazon-ratings_instance_0.2...
[I 2026-04-27 01:35:30,142] Using an existing study with name 'lnpcc_amazon-ratings_instance_0.2' instead of creating a new one.
    [CPU] Loading amazon-ratings...
    DEBUG 3.1: Dataset init start
    DEBUG 3.2: prepare_data start amazon-ratings
    ----Data statistics------'
    Name: amazon-ratings
    #Nodes 24492
    #Edges 93050
    #Classes 5
    #Ave_degree 7.60
    ----Split statistics------'
    #Train samples 1224 (5.0 % of nodes)
    #Val samples 3673 (15.0 % of nodes)
    #Test samples 19595 (remaining)
    ----label noise information:------
    Instance dependent noise
    #Actual noise rate 0.21
    [cuda:1] LNPCC waiting for GPU slot...
    [cuda:1] Slot acquired (waited 0.0s). Starting GCN...
    FINAL_RESULT: {'acc': {'train': 0.2181372549019608, 'valid': 0.3117342771576368, 'test': 0.36851237560602196}, 'wall_s': 81.35, 'cpu_s': 72.66, 'gpu_s': 8.63, 'wait_s': 0.0}
    [Time] wall=81.3s | cpu=72.7s | gpu=8.6s
    C:\Users\fbrev\Documents\Acadêmico\Simulações\Python\NoisyGL\predictor\Base_Predictor.py:144: UserWarning: Sparse CSR tensor support is in beta state. If you miss a functionality in the sparse tensor support, please submit a feature request to https://github.com/pytorch/pytorch/issues. (Triggered internally at ..\aten\src\ATen\SparseCsrTensorImpl.cpp:55.)
    self.adj_csr = self.adj.to_sparse_csr().to(self.device)
[I 2026-04-27 01:36:57,799] Trial 36 finished with value: 0.36851237560602196 and parameters: {'lr': 0.005, 'weight_decay': 0.01, 'n_hidden': 256, 'n_layer': 3, 'dropout': 0.31950462142486924, 'knn_mode': 's', 'k': 41, 'dexp': 4.280018336956683, 'p_grd': 0.70047166030536, 'unc_rem': 0.5105701048587412, 'unc_rel': 0.7446817052511542}. Best is trial 32 with value: 0.3997448328655269.
    [CPU] Loading amazon-ratings...
    DEBUG 3.1: Dataset init start
    DEBUG 3.2: prepare_data start amazon-ratings
    ----Data statistics------'
    Name: amazon-ratings
    #Nodes 24492
    #Edges 93050
    #Classes 5
    #Ave_degree 7.60
    ----Split statistics------'
    #Train samples 1224 (5.0 % of nodes)
    #Val samples 3673 (15.0 % of nodes)
    #Test samples 19595 (remaining)
    ----label noise information:------
    Instance dependent noise
    #Actual noise rate 0.21
    [cuda:1] LNPCC waiting for GPU slot...
    [cuda:1] Slot acquired (waited 12.5s). Starting GCN...
    FINAL_RESULT: {'acc': {'train': 0.3916256157635468, 'valid': 0.3408657772937653, 'test': 0.38729267670324063}, 'wall_s': 92.01, 'cpu_s': 83.32, 'gpu_s': 8.61, 'wait_s': 12.55}
    [Time] wall=92.0s | cpu=83.3s | gpu=8.6s
    C:\Users\fbrev\Documents\Acadêmico\Simulações\Python\NoisyGL\predictor\Base_Predictor.py:144: UserWarning: Sparse CSR tensor support is in beta state. If you miss a functionality in the sparse tensor support, please submit a feature request to https://github.com/pytorch/pytorch/issues. (Triggered internally at ..\aten\src\ATen\SparseCsrTensorImpl.cpp:55.)
    self.adj_csr = self.adj.to_sparse_csr().to(self.device)
[I 2026-04-27 01:38:49,811] Trial 37 finished with value: 0.38729267670324063 and parameters: {'lr': 0.01, 'weight_decay': 0.001, 'n_hidden': 256, 'n_layer': 3, 'dropout': 0.17462968691024783, 'knn_mode': 'd', 'k': 37, 'dexp': 6.584201283113847, 'p_grd': 0.44630468864022727, 'unc_rem': 0.6477776427865891, 'unc_rel': 0.10758124464211244}. Best is trial 32 with value: 0.3997448328655269.
    [CPU] Loading amazon-ratings...
    DEBUG 3.1: Dataset init start
    DEBUG 3.2: prepare_data start amazon-ratings
    ----Data statistics------'
    Name: amazon-ratings
    #Nodes 24492
    #Edges 93050
    #Classes 5
    #Ave_degree 7.60
    ----Split statistics------'
    #Train samples 1224 (5.0 % of nodes)
    #Val samples 3673 (15.0 % of nodes)
    #Test samples 19595 (remaining)
    ----label noise information:------
    Instance dependent noise
    #Actual noise rate 0.21
    [cuda:1] LNPCC waiting for GPU slot...
    [cuda:1] Slot acquired (waited 3.1s). Starting GCN...
    FINAL_RESULT: {'acc': {'train': 0.41911764705882354, 'valid': 0.34277157636809147, 'test': 0.39239601939270224}, 'wall_s': 95.03, 'cpu_s': 89.68, 'gpu_s': 5.29, 'wait_s': 3.06}
    [Time] wall=95.0s | cpu=89.7s | gpu=5.3s
    C:\Users\fbrev\Documents\Acadêmico\Simulações\Python\NoisyGL\predictor\Base_Predictor.py:144: UserWarning: Sparse CSR tensor support is in beta state. If you miss a functionality in the sparse tensor support, please submit a feature request to https://github.com/pytorch/pytorch/issues. (Triggered internally at ..\aten\src\ATen\SparseCsrTensorImpl.cpp:55.)
    self.adj_csr = self.adj.to_sparse_csr().to(self.device)
[I 2026-04-27 01:40:35,630] Trial 38 finished with value: 0.39239601939270224 and parameters: {'lr': 0.005, 'weight_decay': 0.0, 'n_hidden': 128, 'n_layer': 3, 'dropout': 0.3526880498594061, 'knn_mode': 's', 'k': 46, 'dexp': 3.0479436402503346, 'p_grd': 0.8067695117441793, 'unc_rem': 0.25622425437927177, 'unc_rel': 0.7078906733809928}. Best is trial 32 with value: 0.3997448328655269.
    [CPU] Loading amazon-ratings...
    DEBUG 3.1: Dataset init start
    DEBUG 3.2: prepare_data start amazon-ratings
    ----Data statistics------'
    Name: amazon-ratings
    #Nodes 24492
    #Edges 93050
    #Classes 5
    #Ave_degree 7.60
    ----Split statistics------'
    #Train samples 1224 (5.0 % of nodes)
    #Val samples 3673 (15.0 % of nodes)
    #Test samples 19595 (remaining)
    ----label noise information:------
    Instance dependent noise
    #Actual noise rate 0.21
    [cuda:1] LNPCC waiting for GPU slot...
    [cuda:1] Slot acquired (waited 0.9s). Starting GCN...
    FINAL_RESULT: {'acc': {'train': 0.4039247751430908, 'valid': 0.3512115436972502, 'test': 0.39704006124011226}, 'wall_s': 207.02, 'cpu_s': 198.4, 'gpu_s': 8.55, 'wait_s': 0.92}
    [Time] wall=207.0s | cpu=198.4s | gpu=8.6s
    C:\Users\fbrev\Documents\Acadêmico\Simulações\Python\NoisyGL\predictor\Base_Predictor.py:144: UserWarning: Sparse CSR tensor support is in beta state. If you miss a functionality in the sparse tensor support, please submit a feature request to https://github.com/pytorch/pytorch/issues. (Triggered internally at ..\aten\src\ATen\SparseCsrTensorImpl.cpp:55.)
    self.adj_csr = self.adj.to_sparse_csr().to(self.device)
[I 2026-04-27 01:44:10,669] Trial 39 finished with value: 0.39704006124011226 and parameters: {'lr': 0.005, 'weight_decay': 0.001, 'n_hidden': 256, 'n_layer': 3, 'dropout': 0.29337544806692056, 'knn_mode': 's', 'k': 18, 'dexp': 1.3985696347326626, 'p_grd': 0.9845666132200487, 'unc_rem': 0.3391570927605838, 'unc_rel': 0.014023483651560364}. Best is trial 32 with value: 0.3997448328655269.
    [CPU] Loading amazon-ratings...
    DEBUG 3.1: Dataset init start
    DEBUG 3.2: prepare_data start amazon-ratings
    ----Data statistics------'
    Name: amazon-ratings
    #Nodes 24492
    #Edges 93050
    #Classes 5
    #Ave_degree 7.60
    ----Split statistics------'
    #Train samples 1224 (5.0 % of nodes)
    #Val samples 3673 (15.0 % of nodes)
    #Test samples 19595 (remaining)
    ----label noise information:------
    Instance dependent noise
    #Actual noise rate 0.21
    [cuda:1] LNPCC waiting for GPU slot...
    [cuda:1] Slot acquired (waited 8.0s). Starting GCN...
    FINAL_RESULT: {'acc': {'train': 0.22433774834437087, 'valid': 0.3117342771576368, 'test': 0.36851237560602196}, 'wall_s': 81.82, 'cpu_s': 73.3, 'gpu_s': 8.46, 'wait_s': 8.03}
    [Time] wall=81.8s | cpu=73.3s | gpu=8.5s
    C:\Users\fbrev\Documents\Acadêmico\Simulações\Python\NoisyGL\predictor\Base_Predictor.py:144: UserWarning: Sparse CSR tensor support is in beta state. If you miss a functionality in the sparse tensor support, please submit a feature request to https://github.com/pytorch/pytorch/issues. (Triggered internally at ..\aten\src\ATen\SparseCsrTensorImpl.cpp:55.)
    self.adj_csr = self.adj.to_sparse_csr().to(self.device)
[I 2026-04-27 01:45:47,172] Trial 40 finished with value: 0.36851237560602196 and parameters: {'lr': 0.01, 'weight_decay': 0.05, 'n_hidden': 256, 'n_layer': 3, 'dropout': 0.7227674317021641, 'knn_mode': 'd', 'k': 31, 'dexp': 5.174343595568233, 'p_grd': 0.3587568770240944, 'unc_rem': 0.46735864287690976, 'unc_rel': 0.442701570023049}. Best is trial 32 with value: 0.3997448328655269.
    [CPU] Loading amazon-ratings...
    DEBUG 3.1: Dataset init start
    DEBUG 3.2: prepare_data start amazon-ratings
    ----Data statistics------'
    Name: amazon-ratings
    #Nodes 24492
    #Edges 93050
    #Classes 5
    #Ave_degree 7.60
    ----Split statistics------'
    #Train samples 1224 (5.0 % of nodes)
    #Val samples 3673 (15.0 % of nodes)
    #Test samples 19595 (remaining)
    ----label noise information:------
    Instance dependent noise
    #Actual noise rate 0.21
    [cuda:1] LNPCC waiting for GPU slot...
    [cuda:1] Slot acquired (waited 0.7s). Starting GCN...
    FINAL_RESULT: {'acc': {'train': 0.4068627450980392, 'valid': 0.35039477266539615, 'test': 0.39540699157948456}, 'wall_s': 63.14, 'cpu_s': 60.07, 'gpu_s': 3.01, 'wait_s': 0.66}
    [Time] wall=63.1s | cpu=60.1s | gpu=3.0s
    C:\Users\fbrev\Documents\Acadêmico\Simulações\Python\NoisyGL\predictor\Base_Predictor.py:144: UserWarning: Sparse CSR tensor support is in beta state. If you miss a functionality in the sparse tensor support, please submit a feature request to https://github.com/pytorch/pytorch/issues. (Triggered internally at ..\aten\src\ATen\SparseCsrTensorImpl.cpp:55.)
    self.adj_csr = self.adj.to_sparse_csr().to(self.device)
[I 2026-04-27 01:46:58,000] Trial 41 finished with value: 0.39540699157948456 and parameters: {'lr': 0.005, 'weight_decay': 0.001, 'n_hidden': 32, 'n_layer': 3, 'dropout': 0.24459015414626928, 'knn_mode': 's', 'k': 24, 'dexp': 7.612146715842068, 'p_grd': 0.760266319996694, 'unc_rem': 0.5435375342112091, 'unc_rel': 0.5725336558555045}. Best is trial 32 with value: 0.3997448328655269.
    [CPU] Loading amazon-ratings...
    DEBUG 3.1: Dataset init start
    DEBUG 3.2: prepare_data start amazon-ratings
    ----Data statistics------'
    Name: amazon-ratings
    #Nodes 24492
    #Edges 93050
    #Classes 5
    #Ave_degree 7.60
    ----Split statistics------'
    #Train samples 1224 (5.0 % of nodes)
    #Val samples 3673 (15.0 % of nodes)
    #Test samples 19595 (remaining)
    ----label noise information:------
    Instance dependent noise
    #Actual noise rate 0.21
    [cuda:1] LNPCC waiting for GPU slot...
    [cuda:1] Slot acquired (waited 1.0s). Starting GCN...
    FINAL_RESULT: {'acc': {'train': 0.4068627450980392, 'valid': 0.349305744622924, 'test': 0.3915794845623884}, 'wall_s': 69.18, 'cpu_s': 60.8, 'gpu_s': 8.31, 'wait_s': 0.97}
    [Time] wall=69.2s | cpu=60.8s | gpu=8.3s
    C:\Users\fbrev\Documents\Acadêmico\Simulações\Python\NoisyGL\predictor\Base_Predictor.py:144: UserWarning: Sparse CSR tensor support is in beta state. If you miss a functionality in the sparse tensor support, please submit a feature request to https://github.com/pytorch/pytorch/issues. (Triggered internally at ..\aten\src\ATen\SparseCsrTensorImpl.cpp:55.)
    self.adj_csr = self.adj.to_sparse_csr().to(self.device)
[I 2026-04-27 01:48:15,054] Trial 42 finished with value: 0.3915794845623884 and parameters: {'lr': 0.005, 'weight_decay': 0.001, 'n_hidden': 256, 'n_layer': 3, 'dropout': 0.2792843475498933, 'knn_mode': 's', 'k': 36, 'dexp': 7.6012460230476995, 'p_grd': 0.5930361461065842, 'unc_rem': 0.36425326654057877, 'unc_rel': 0.9237404265900303}. Best is trial 32 with value: 0.3997448328655269.
    [CPU] Loading amazon-ratings...
    DEBUG 3.1: Dataset init start
    DEBUG 3.2: prepare_data start amazon-ratings
    ----Data statistics------'
    Name: amazon-ratings
    #Nodes 24492
    #Edges 93050
    #Classes 5
    #Ave_degree 7.60
    ----Split statistics------'
    #Train samples 1224 (5.0 % of nodes)
    #Val samples 3673 (15.0 % of nodes)
    #Test samples 19595 (remaining)
    ----label noise information:------
    Instance dependent noise
    #Actual noise rate 0.21
    [cuda:1] LNPCC waiting for GPU slot...
    [cuda:1] Slot acquired (waited 4.6s). Starting GCN...
    FINAL_RESULT: {'acc': {'train': 0.39329517579721995, 'valid': 0.349033487612306, 'test': 0.39387598877264607}, 'wall_s': 73.72, 'cpu_s': 65.26, 'gpu_s': 8.39, 'wait_s': 4.62}
    [Time] wall=73.7s | cpu=65.3s | gpu=8.4s
    C:\Users\fbrev\Documents\Acadêmico\Simulações\Python\NoisyGL\predictor\Base_Predictor.py:144: UserWarning: Sparse CSR tensor support is in beta state. If you miss a functionality in the sparse tensor support, please submit a feature request to https://github.com/pytorch/pytorch/issues. (Triggered internally at ..\aten\src\ATen\SparseCsrTensorImpl.cpp:55.)
    self.adj_csr = self.adj.to_sparse_csr().to(self.device)
[I 2026-04-27 01:49:40,348] Trial 43 finished with value: 0.39387598877264607 and parameters: {'lr': 0.005, 'weight_decay': 0.001, 'n_hidden': 256, 'n_layer': 3, 'dropout': 0.1932553726940902, 'knn_mode': 's', 'k': 39, 'dexp': 9.997449508202504, 'p_grd': 0.5559723779921546, 'unc_rem': 0.1958249664888005, 'unc_rel': 0.9565464566023179}. Best is trial 32 with value: 0.3997448328655269.
    [CPU] Loading amazon-ratings...
    DEBUG 3.1: Dataset init start
    DEBUG 3.2: prepare_data start amazon-ratings
    ----Data statistics------'
    Name: amazon-ratings
    #Nodes 24492
    #Edges 93050
    #Classes 5
    #Ave_degree 7.60
    ----Split statistics------'
    #Train samples 1224 (5.0 % of nodes)
    #Val samples 3673 (15.0 % of nodes)
    #Test samples 19595 (remaining)
    ----label noise information:------
    Instance dependent noise
    #Actual noise rate 0.21
    [cuda:1] LNPCC waiting for GPU slot...
    [cuda:1] Slot acquired (waited 3.1s). Starting GCN...
    FINAL_RESULT: {'acc': {'train': 0.4166666666666667, 'valid': 0.349305744622924, 'test': 0.3977545292166369}, 'wall_s': 79.09, 'cpu_s': 70.38, 'gpu_s': 8.63, 'wait_s': 3.1}
    [Time] wall=79.1s | cpu=70.4s | gpu=8.6s
    C:\Users\fbrev\Documents\Acadêmico\Simulações\Python\NoisyGL\predictor\Base_Predictor.py:144: UserWarning: Sparse CSR tensor support is in beta state. If you miss a functionality in the sparse tensor support, please submit a feature request to https://github.com/pytorch/pytorch/issues. (Triggered internally at ..\aten\src\ATen\SparseCsrTensorImpl.cpp:55.)
    self.adj_csr = self.adj.to_sparse_csr().to(self.device)
[I 2026-04-27 01:51:09,198] Trial 44 finished with value: 0.3977545292166369 and parameters: {'lr': 0.005, 'weight_decay': 0.001, 'n_hidden': 256, 'n_layer': 3, 'dropout': 0.38869087741148006, 'knn_mode': 's', 'k': 36, 'dexp': 8.85060405458949, 'p_grd': 0.6674524163206018, 'unc_rem': 0.40402652469618305, 'unc_rel': 0.9937490461340556}. Best is trial 32 with value: 0.3997448328655269.
    [CPU] Loading amazon-ratings...
    DEBUG 3.1: Dataset init start
    DEBUG 3.2: prepare_data start amazon-ratings
    ----Data statistics------'
    Name: amazon-ratings
    #Nodes 24492
    #Edges 93050
    #Classes 5
    #Ave_degree 7.60
    ----Split statistics------'
    #Train samples 1224 (5.0 % of nodes)
    #Val samples 3673 (15.0 % of nodes)
    #Test samples 19595 (remaining)
    ----label noise information:------
    Instance dependent noise
    #Actual noise rate 0.21
    [cuda:1] LNPCC waiting for GPU slot...
    [cuda:1] Slot acquired (waited 1.3s). Starting GCN...
    FINAL_RESULT: {'acc': {'train': 0.43286071726438696, 'valid': 0.337326436155731, 'test': 0.38101556519520285}, 'wall_s': 33.1, 'cpu_s': 27.7, 'gpu_s': 5.32, 'wait_s': 1.27}
    [Time] wall=33.1s | cpu=27.7s | gpu=5.3s
    C:\Users\fbrev\Documents\Acadêmico\Simulações\Python\NoisyGL\predictor\Base_Predictor.py:144: UserWarning: Sparse CSR tensor support is in beta state. If you miss a functionality in the sparse tensor support, please submit a feature request to https://github.com/pytorch/pytorch/issues. (Triggered internally at ..\aten\src\ATen\SparseCsrTensorImpl.cpp:55.)
    self.adj_csr = self.adj.to_sparse_csr().to(self.device)
[I 2026-04-27 01:51:51,165] Trial 45 finished with value: 0.38101556519520285 and parameters: {'lr': 0.005, 'weight_decay': 0.001, 'n_hidden': 128, 'n_layer': 3, 'dropout': 0.5555689248435928, 'knn_mode': 's', 'k': 31, 'dexp': 7.162630982965459, 'p_grd': 0.0869513688822724, 'unc_rem': 0.6359467730560091, 'unc_rel': 0.8015833661792442}. Best is trial 32 with value: 0.3997448328655269.
    [CPU] Loading amazon-ratings...
    DEBUG 3.1: Dataset init start
    DEBUG 3.2: prepare_data start amazon-ratings
    ----Data statistics------'
    Name: amazon-ratings
    #Nodes 24492
    #Edges 93050
    #Classes 5
    #Ave_degree 7.60
    ----Split statistics------'
    #Train samples 1224 (5.0 % of nodes)
    #Val samples 3673 (15.0 % of nodes)
    #Test samples 19595 (remaining)
    ----label noise information:------
    Instance dependent noise
    #Actual noise rate 0.21
    [cuda:1] LNPCC waiting for GPU slot...
    [cuda:1] Slot acquired (waited 3.4s). Starting GCN...
    FINAL_RESULT: {'acc': {'train': 0.43617021276595747, 'valid': 0.34277157636809147, 'test': 0.3785659607042613}, 'wall_s': 63.88, 'cpu_s': 58.83, 'gpu_s': 4.98, 'wait_s': 3.41}
    [Time] wall=63.9s | cpu=58.8s | gpu=5.0s
    C:\Users\fbrev\Documents\Acadêmico\Simulações\Python\NoisyGL\predictor\Base_Predictor.py:144: UserWarning: Sparse CSR tensor support is in beta state. If you miss a functionality in the sparse tensor support, please submit a feature request to https://github.com/pytorch/pytorch/issues. (Triggered internally at ..\aten\src\ATen\SparseCsrTensorImpl.cpp:55.)
    self.adj_csr = self.adj.to_sparse_csr().to(self.device)
[I 2026-04-27 01:53:05,312] Trial 46 finished with value: 0.3785659607042613 and parameters: {'lr': 0.1, 'weight_decay': 0.0, 'n_hidden': 256, 'n_layer': 2, 'dropout': 0.08660378165941965, 'knn_mode': 's', 'k': 42, 'dexp': 6.0524659258997815, 'p_grd': 0.513540992508552, 'unc_rem': 0.3186107577578837, 'unc_rel': 0.9398679175757255}. Best is trial 32 with value: 0.3997448328655269.
    [CPU] Loading amazon-ratings...
    DEBUG 3.1: Dataset init start
    DEBUG 3.2: prepare_data start amazon-ratings
    ----Data statistics------'
    Name: amazon-ratings
    #Nodes 24492
    #Edges 93050
    #Classes 5
    #Ave_degree 7.60
    ----Split statistics------'
    #Train samples 1224 (5.0 % of nodes)
    #Val samples 3673 (15.0 % of nodes)
    #Test samples 19595 (remaining)
    ----label noise information:------
    Instance dependent noise
    #Actual noise rate 0.21
    [cuda:1] LNPCC waiting for GPU slot...
    [cuda:1] Slot acquired (waited 0.0s). Starting GCN...
    FINAL_RESULT: {'acc': {'train': 0.41748366013071897, 'valid': 0.3471276885379799, 'test': 0.39091605001275836}, 'wall_s': 99.76, 'cpu_s': 91.43, 'gpu_s': 8.25, 'wait_s': 0.0}
    [Time] wall=99.8s | cpu=91.4s | gpu=8.2s
    C:\Users\fbrev\Documents\Acadêmico\Simulações\Python\NoisyGL\predictor\Base_Predictor.py:144: UserWarning: Sparse CSR tensor support is in beta state. If you miss a functionality in the sparse tensor support, please submit a feature request to https://github.com/pytorch/pytorch/issues. (Triggered internally at ..\aten\src\ATen\SparseCsrTensorImpl.cpp:55.)
    self.adj_csr = self.adj.to_sparse_csr().to(self.device)
[I 2026-04-27 01:54:52,098] Trial 47 finished with value: 0.39091605001275836 and parameters: {'lr': 0.01, 'weight_decay': 0.0001, 'n_hidden': 256, 'n_layer': 3, 'dropout': 0.15402329167467713, 'knn_mode': 'd', 'k': 40, 'dexp': 7.788734589704157, 'p_grd': 0.6001567309657727, 'unc_rem': 0.4953675875672182, 'unc_rel': 0.8846638984407329}. Best is trial 32 with value: 0.3997448328655269.
    [CPU] Loading amazon-ratings...
    DEBUG 3.1: Dataset init start
    DEBUG 3.2: prepare_data start amazon-ratings
    ----Data statistics------'
    Name: amazon-ratings
    #Nodes 24492
    #Edges 93050
    #Classes 5
    #Ave_degree 7.60
    ----Split statistics------'
    #Train samples 1224 (5.0 % of nodes)
    #Val samples 3673 (15.0 % of nodes)
    #Test samples 19595 (remaining)
    ----label noise information:------
    Instance dependent noise
    #Actual noise rate 0.21
    [cuda:1] LNPCC waiting for GPU slot...
    [cuda:1] Slot acquired (waited 0.0s). Starting GCN...
    FINAL_RESULT: {'acc': {'train': 0.21031096563011456, 'valid': 0.3117342771576368, 'test': 0.36851237560602196}, 'wall_s': 64.62, 'cpu_s': 56.1, 'gpu_s': 8.46, 'wait_s': 0.0}
    [Time] wall=64.6s | cpu=56.1s | gpu=8.5s
    C:\Users\fbrev\Documents\Acadêmico\Simulações\Python\NoisyGL\predictor\Base_Predictor.py:144: UserWarning: Sparse CSR tensor support is in beta state. If you miss a functionality in the sparse tensor support, please submit a feature request to https://github.com/pytorch/pytorch/issues. (Triggered internally at ..\aten\src\ATen\SparseCsrTensorImpl.cpp:55.)
    self.adj_csr = self.adj.to_sparse_csr().to(self.device)
