[I 2026-04-30 16:11:04,548] Trial 13 finished with value: 0.388 and parameters: {'lr': 0.1, 'weight_decay': 0.01, 'n_hidden': 64, 'n_layer': 2, 'dropout': 0.14062982503090202, 'knn_mode': 'd', 'k': 21, 'dexp': 2.6455009303886685, 'p_grd': 0.3877144538888293, 'unc_rem': 0.27211818926590114, 'unc_rel': 0.3678477824590435}. Best is trial 5 with value: 0.648.
    [CPU] Loading amazoncom...
    DEBUG 3.1: Dataset init start
    DEBUG 3.2: prepare_data start amazoncom
    ----Data statistics------'
    Name: amazoncom
    #Nodes 13752
    #Edges 245861
    #Classes 10
    #Ave_degree 35.76
    ----Split statistics------'
    #Train samples 200 (20 nodes per class)
    #Val samples 500 (specified)
    #Test samples 1000 (specified)
    ----label noise information:------
    Instance dependent noise
    #Actual noise rate 0.50
    [cuda:0] LNPCC waiting for GPU slot...
    [cuda:0] Slot acquired (waited 0.0s). Starting GCN...
    FINAL_RESULT: {'acc': {'train': 0.49, 'valid': 0.348, 'test': 0.514}, 'wall_s': 45.4, 'cpu_s': 42.56, 'gpu_s': 2.75, 'wait_s': 0.0}
    [Time] wall=45.4s | cpu=42.6s | gpu=2.7s
    C:\Users\fbrev\Documents\Acadêmico\Simulações\Python\NoisyGL\predictor\Base_Predictor.py:144: UserWarning: Sparse CSR tensor support is in beta state. If you miss a functionality in the sparse tensor support, please submit a feature request to https://github.com/pytorch/pytorch/issues. (Triggered internally at ..\aten\src\ATen\SparseCsrTensorImpl.cpp:55.)
    self.adj_csr = self.adj.to_sparse_csr().to(self.device)
[I 2026-04-30 16:11:56,731] Trial 14 finished with value: 0.514 and parameters: {'lr': 0.01, 'weight_decay': 0.05, 'n_hidden': 32, 'n_layer': 2, 'dropout': 0.015305141591561267, 'knn_mode': 'd', 'k': 45, 'dexp': 9.576049467794768, 'p_grd': 0.8745776507907911, 'unc_rem': 0.70189039053817, 'unc_rel': 0.9645685504300959}. Best is trial 5 with value: 0.648.
    [CPU] Loading amazoncom...
    DEBUG 3.1: Dataset init start
    DEBUG 3.2: prepare_data start amazoncom
    ----Data statistics------'
    Name: amazoncom
    #Nodes 13752
    #Edges 245861
    #Classes 10
    #Ave_degree 35.76
    ----Split statistics------'
    #Train samples 200 (20 nodes per class)
    #Val samples 500 (specified)
    #Test samples 1000 (specified)
    ----label noise information:------
    Instance dependent noise
    #Actual noise rate 0.50
    [cuda:0] LNPCC waiting for GPU slot...
    [cuda:0] Slot acquired (waited 0.0s). Starting GCN...
    FINAL_RESULT: {'acc': {'train': 0.6683673469387755, 'valid': 0.378, 'test': 0.532}, 'wall_s': 52.35, 'cpu_s': 37.43, 'gpu_s': 14.82, 'wait_s': 0.0}
    [Time] wall=52.3s | cpu=37.4s | gpu=14.8s
    C:\Users\fbrev\Documents\Acadêmico\Simulações\Python\NoisyGL\predictor\Base_Predictor.py:144: UserWarning: Sparse CSR tensor support is in beta state. If you miss a functionality in the sparse tensor support, please submit a feature request to https://github.com/pytorch/pytorch/issues. (Triggered internally at ..\aten\src\ATen\SparseCsrTensorImpl.cpp:55.)
    self.adj_csr = self.adj.to_sparse_csr().to(self.device)
[I 2026-04-30 16:12:56,151] Trial 15 finished with value: 0.532 and parameters: {'lr': 0.001, 'weight_decay': 0.0001, 'n_hidden': 256, 'n_layer': 3, 'dropout': 0.1413949432925266, 'knn_mode': 's', 'k': 24, 'dexp': 4.516243024639353, 'p_grd': 0.32708225210193276, 'unc_rem': 0.7231122828216123, 'unc_rel': 0.46595637793214884}. Best is trial 5 with value: 0.648.
    [CPU] Loading amazoncom...
    DEBUG 3.1: Dataset init start
    DEBUG 3.2: prepare_data start amazoncom
    ----Data statistics------'
    Name: amazoncom
    #Nodes 13752
    #Edges 245861
    #Classes 10
    #Ave_degree 35.76
    ----Split statistics------'
    #Train samples 200 (20 nodes per class)
    #Val samples 500 (specified)
    #Test samples 1000 (specified)
    ----label noise information:------
    Instance dependent noise
    #Actual noise rate 0.50
    [cuda:0] LNPCC waiting for GPU slot...
    [cuda:0] Slot acquired (waited 0.0s). Starting GCN...
    FINAL_RESULT: {'acc': {'train': 0.116751269035533, 'valid': 0.23, 'test': 0.382}, 'wall_s': 50.06, 'cpu_s': 35.03, 'gpu_s': 14.95, 'wait_s': 0.0}
    [Time] wall=50.1s | cpu=35.0s | gpu=15.0s
    C:\Users\fbrev\Documents\Acadêmico\Simulações\Python\NoisyGL\predictor\Base_Predictor.py:144: UserWarning: Sparse CSR tensor support is in beta state. If you miss a functionality in the sparse tensor support, please submit a feature request to https://github.com/pytorch/pytorch/issues. (Triggered internally at ..\aten\src\ATen\SparseCsrTensorImpl.cpp:55.)
    self.adj_csr = self.adj.to_sparse_csr().to(self.device)
[I 2026-04-30 16:13:52,553] Trial 16 finished with value: 0.382 and parameters: {'lr': 0.1, 'weight_decay': 0.001, 'n_hidden': 256, 'n_layer': 3, 'dropout': 0.18354570559166064, 'knn_mode': 's', 'k': 9, 'dexp': 8.051723414079143, 'p_grd': 0.6333930865364665, 'unc_rem': 0.7421993538209207, 'unc_rel': 0.802445782297044}. Best is trial 5 with value: 0.648.
    [CPU] Loading amazoncom...
    DEBUG 3.1: Dataset init start
    DEBUG 3.2: prepare_data start amazoncom
    ----Data statistics------'
    Name: amazoncom
    #Nodes 13752
    #Edges 245861
    #Classes 10
    #Ave_degree 35.76
    ----Split statistics------'
    #Train samples 200 (20 nodes per class)
    #Val samples 500 (specified)
    #Test samples 1000 (specified)
    ----label noise information:------
    Instance dependent noise
    #Actual noise rate 0.50
    [cuda:0] LNPCC waiting for GPU slot...
    [cuda:0] Slot acquired (waited 0.0s). Starting GCN...
    FINAL_RESULT: {'acc': {'train': 0.1414141414141414, 'valid': 0.258, 'test': 0.413}, 'wall_s': 52.66, 'cpu_s': 37.62, 'gpu_s': 14.97, 'wait_s': 0.0}
    [Time] wall=52.7s | cpu=37.6s | gpu=15.0s
    C:\Users\fbrev\Documents\Acadêmico\Simulações\Python\NoisyGL\predictor\Base_Predictor.py:144: UserWarning: Sparse CSR tensor support is in beta state. If you miss a functionality in the sparse tensor support, please submit a feature request to https://github.com/pytorch/pytorch/issues. (Triggered internally at ..\aten\src\ATen\SparseCsrTensorImpl.cpp:55.)
    self.adj_csr = self.adj.to_sparse_csr().to(self.device)
[I 2026-04-30 16:14:51,660] Trial 17 finished with value: 0.413 and parameters: {'lr': 0.05, 'weight_decay': 0.0, 'n_hidden': 256, 'n_layer': 3, 'dropout': 0.3641807986019758, 'knn_mode': 's', 'k': 49, 'dexp': 9.328383348297663, 'p_grd': 0.4182111015332727, 'unc_rem': 0.8642837879141492, 'unc_rel': 0.5757757652553932}. Best is trial 5 with value: 0.648.
    [CPU] Loading amazoncom...
    DEBUG 3.1: Dataset init start
    DEBUG 3.2: prepare_data start amazoncom
    ----Data statistics------'
    Name: amazoncom
    #Nodes 13752
    #Edges 245861
    #Classes 10
    #Ave_degree 35.76
    ----Split statistics------'
    #Train samples 200 (20 nodes per class)
    #Val samples 500 (specified)
    #Test samples 1000 (specified)
    ----label noise information:------
    Instance dependent noise
    #Actual noise rate 0.50
    [cuda:0] LNPCC waiting for GPU slot...
    [cuda:0] Slot acquired (waited 0.6s). Starting GCN...
    FINAL_RESULT: {'acc': {'train': 0.08629441624365482, 'valid': 0.23, 'test': 0.382}, 'wall_s': 47.68, 'cpu_s': 42.51, 'gpu_s': 5.09, 'wait_s': 0.61}
    [Time] wall=47.7s | cpu=42.5s | gpu=5.1s
    C:\Users\fbrev\Documents\Acadêmico\Simulações\Python\NoisyGL\predictor\Base_Predictor.py:144: UserWarning: Sparse CSR tensor support is in beta state. If you miss a functionality in the sparse tensor support, please submit a feature request to https://github.com/pytorch/pytorch/issues. (Triggered internally at ..\aten\src\ATen\SparseCsrTensorImpl.cpp:55.)
    self.adj_csr = self.adj.to_sparse_csr().to(self.device)
[I 2026-04-30 16:15:47,261] Trial 18 finished with value: 0.382 and parameters: {'lr': 0.05, 'weight_decay': 0.001, 'n_hidden': 64, 'n_layer': 3, 'dropout': 0.3219522623358499, 'knn_mode': 's', 'k': 22, 'dexp': 8.185841291407987, 'p_grd': 0.5114974534354224, 'unc_rem': 0.9861340676429743, 'unc_rel': 0.6712317219587044}. Best is trial 5 with value: 0.648.
    [CPU] Loading amazoncom...
    DEBUG 3.1: Dataset init start
    DEBUG 3.2: prepare_data start amazoncom
    ----Data statistics------'
    Name: amazoncom
    #Nodes 13752
    #Edges 245861
    #Classes 10
    #Ave_degree 35.76
    ----Split statistics------'
    #Train samples 200 (20 nodes per class)
    #Val samples 500 (specified)
    #Test samples 1000 (specified)
    ----label noise information:------
    Instance dependent noise
    #Actual noise rate 0.50
    [cuda:0] LNPCC waiting for GPU slot...
    [cuda:0] Slot acquired (waited 6.0s). Starting GCN...
    FINAL_RESULT: {'acc': {'train': 0.7472527472527473, 'valid': 0.33, 'test': 0.446}, 'wall_s': 37.27, 'cpu_s': 32.49, 'gpu_s': 4.71, 'wait_s': 6.04}
    [Time] wall=37.3s | cpu=32.5s | gpu=4.7s
    C:\Users\fbrev\Documents\Acadêmico\Simulações\Python\NoisyGL\predictor\Base_Predictor.py:144: UserWarning: Sparse CSR tensor support is in beta state. If you miss a functionality in the sparse tensor support, please submit a feature request to https://github.com/pytorch/pytorch/issues. (Triggered internally at ..\aten\src\ATen\SparseCsrTensorImpl.cpp:55.)
    self.adj_csr = self.adj.to_sparse_csr().to(self.device)
[I 2026-04-30 16:16:36,341] Trial 19 finished with value: 0.446 and parameters: {'lr': 0.001, 'weight_decay': 0.01, 'n_hidden': 128, 'n_layer': 2, 'dropout': 0.01692334190834286, 'knn_mode': 's', 'k': 12, 'dexp': 3.6597216058079924, 'p_grd': 0.22569094730999384, 'unc_rem': 0.29670909959681613, 'unc_rel': 0.3212860590798803}. Best is trial 5 with value: 0.648.
    [CPU] Loading amazoncom...
    DEBUG 3.1: Dataset init start
    DEBUG 3.2: prepare_data start amazoncom
    ----Data statistics------'
    Name: amazoncom
    #Nodes 13752
    #Edges 245861
    #Classes 10
    #Ave_degree 35.76
    ----Split statistics------'
    #Train samples 200 (20 nodes per class)
    #Val samples 500 (specified)
    #Test samples 1000 (specified)
    ----label noise information:------
    Instance dependent noise
    #Actual noise rate 0.50
    [cuda:0] LNPCC waiting for GPU slot...
    [cuda:0] Slot acquired (waited 0.0s). Starting GCN...
    FINAL_RESULT: {'acc': {'train': 0.6871508379888268, 'valid': 0.372, 'test': 0.581}, 'wall_s': 34.98, 'cpu_s': 32.44, 'gpu_s': 2.45, 'wait_s': 0.0}
    [Time] wall=35.0s | cpu=32.4s | gpu=2.5s
    C:\Users\fbrev\Documents\Acadêmico\Simulações\Python\NoisyGL\predictor\Base_Predictor.py:144: UserWarning: Sparse CSR tensor support is in beta state. If you miss a functionality in the sparse tensor support, please submit a feature request to https://github.com/pytorch/pytorch/issues. (Triggered internally at ..\aten\src\ATen\SparseCsrTensorImpl.cpp:55.)
    self.adj_csr = self.adj.to_sparse_csr().to(self.device)
[I 2026-04-30 16:17:17,546] Trial 20 finished with value: 0.581 and parameters: {'lr': 0.005, 'weight_decay': 0.0001, 'n_hidden': 32, 'n_layer': 2, 'dropout': 0.5540269865489365, 'knn_mode': 's', 'k': 5, 'dexp': 5.8406393479887395, 'p_grd': 0.6431446222874779, 'unc_rem': 0.012931860469679174, 'unc_rel': 0.06384964030897206}. Best is trial 5 with value: 0.648.
    [CPU] Loading amazoncom...
    DEBUG 3.1: Dataset init start
    DEBUG 3.2: prepare_data start amazoncom
    ----Data statistics------'
    Name: amazoncom
    #Nodes 13752
    #Edges 245861
    #Classes 10
    #Ave_degree 35.76
    ----Split statistics------'
    #Train samples 200 (20 nodes per class)
    #Val samples 500 (specified)
    #Test samples 1000 (specified)
    ----label noise information:------
    Instance dependent noise
    #Actual noise rate 0.50
    [cuda:0] LNPCC waiting for GPU slot...
    [cuda:0] Slot acquired (waited 0.0s). Starting GCN...
    FINAL_RESULT: {'acc': {'train': 0.5204081632653061, 'valid': 0.384, 'test': 0.611}, 'wall_s': 37.72, 'cpu_s': 35.13, 'gpu_s': 2.51, 'wait_s': 0.0}
    [Time] wall=37.7s | cpu=35.1s | gpu=2.5s
    C:\Users\fbrev\Documents\Acadêmico\Simulações\Python\NoisyGL\predictor\Base_Predictor.py:144: UserWarning: Sparse CSR tensor support is in beta state. If you miss a functionality in the sparse tensor support, please submit a feature request to https://github.com/pytorch/pytorch/issues. (Triggered internally at ..\aten\src\ATen\SparseCsrTensorImpl.cpp:55.)
    self.adj_csr = self.adj.to_sparse_csr().to(self.device)
[I 2026-04-30 16:18:01,367] Trial 21 finished with value: 0.611 and parameters: {'lr': 0.005, 'weight_decay': 0.001, 'n_hidden': 32, 'n_layer': 2, 'dropout': 0.611840987021268, 'knn_mode': 's', 'k': 5, 'dexp': 6.980014758624176, 'p_grd': 0.5822360249942187, 'unc_rem': 0.5971200402230834, 'unc_rel': 0.15005862882221824}. Best is trial 5 with value: 0.648.
    [CPU] Loading amazoncom...
    DEBUG 3.1: Dataset init start
    DEBUG 3.2: prepare_data start amazoncom
    ----Data statistics------'
    Name: amazoncom
    #Nodes 13752
    #Edges 245861
    #Classes 10
    #Ave_degree 35.76
    ----Split statistics------'
    #Train samples 200 (20 nodes per class)
    #Val samples 500 (specified)
    #Test samples 1000 (specified)
    ----label noise information:------
    Instance dependent noise
    #Actual noise rate 0.50
    [cuda:0] LNPCC waiting for GPU slot...
    [cuda:0] Slot acquired (waited 0.0s). Starting GCN...
    FINAL_RESULT: {'acc': {'train': 0.5329949238578681, 'valid': 0.398, 'test': 0.617}, 'wall_s': 46.48, 'cpu_s': 43.14, 'gpu_s': 3.27, 'wait_s': 0.0}
    [Time] wall=46.5s | cpu=43.1s | gpu=3.3s
    C:\Users\fbrev\Documents\Acadêmico\Simulações\Python\NoisyGL\predictor\Base_Predictor.py:144: UserWarning: Sparse CSR tensor support is in beta state. If you miss a functionality in the sparse tensor support, please submit a feature request to https://github.com/pytorch/pytorch/issues. (Triggered internally at ..\aten\src\ATen\SparseCsrTensorImpl.cpp:55.)
    self.adj_csr = self.adj.to_sparse_csr().to(self.device)
[I 2026-04-30 16:18:53,562] Trial 22 finished with value: 0.617 and parameters: {'lr': 0.005, 'weight_decay': 0.001, 'n_hidden': 64, 'n_layer': 2, 'dropout': 0.6180621222378676, 'knn_mode': 's', 'k': 14, 'dexp': 5.655278188699354, 'p_grd': 0.7369849057157386, 'unc_rem': 0.16882764084688834, 'unc_rel': 0.8438220409125181}. Best is trial 5 with value: 0.648.
    [CPU] Loading amazoncom...
    DEBUG 3.1: Dataset init start
    DEBUG 3.2: prepare_data start amazoncom
    ----Data statistics------'
    Name: amazoncom
    #Nodes 13752
    #Edges 245861
    #Classes 10
    #Ave_degree 35.76
    ----Split statistics------'
    #Train samples 200 (20 nodes per class)
    #Val samples 500 (specified)
    #Test samples 1000 (specified)
    ----label noise information:------
    Instance dependent noise
    #Actual noise rate 0.50
    [cuda:0] LNPCC waiting for GPU slot...
    [cuda:0] Slot acquired (waited 0.0s). Starting GCN...
    FINAL_RESULT: {'acc': {'train': 0.5392670157068062, 'valid': 0.386, 'test': 0.59}, 'wall_s': 43.07, 'cpu_s': 40.46, 'gpu_s': 2.54, 'wait_s': 0.0}
    [Time] wall=43.1s | cpu=40.5s | gpu=2.5s
    C:\Users\fbrev\Documents\Acadêmico\Simulações\Python\NoisyGL\predictor\Base_Predictor.py:144: UserWarning: Sparse CSR tensor support is in beta state. If you miss a functionality in the sparse tensor support, please submit a feature request to https://github.com/pytorch/pytorch/issues. (Triggered internally at ..\aten\src\ATen\SparseCsrTensorImpl.cpp:55.)
    self.adj_csr = self.adj.to_sparse_csr().to(self.device)
[I 2026-04-30 16:19:43,194] Trial 23 finished with value: 0.59 and parameters: {'lr': 0.005, 'weight_decay': 0.001, 'n_hidden': 32, 'n_layer': 2, 'dropout': 0.46089442312733003, 'knn_mode': 's', 'k': 15, 'dexp': 5.747199080322265, 'p_grd': 0.6984450333853109, 'unc_rem': 0.026350934289606096, 'unc_rel': 0.8578911262049675}. Best is trial 5 with value: 0.648.
    [CPU] Loading amazoncom...
    DEBUG 3.1: Dataset init start
    DEBUG 3.2: prepare_data start amazoncom
    ----Data statistics------'
    Name: amazoncom
    #Nodes 13752
    #Edges 245861
    #Classes 10
    #Ave_degree 35.76
    ----Split statistics------'
    #Train samples 200 (20 nodes per class)
    #Val samples 500 (specified)
    #Test samples 1000 (specified)
    ----label noise information:------
    Instance dependent noise
    #Actual noise rate 0.50
    [cuda:0] LNPCC waiting for GPU slot...
    [cuda:0] Slot acquired (waited 6.0s). Starting GCN...
    FINAL_RESULT: {'acc': {'train': 0.6387434554973822, 'valid': 0.38, 'test': 0.595}, 'wall_s': 46.99, 'cpu_s': 43.64, 'gpu_s': 3.28, 'wait_s': 5.99}
    [Time] wall=47.0s | cpu=43.6s | gpu=3.3s
    C:\Users\fbrev\Documents\Acadêmico\Simulações\Python\NoisyGL\predictor\Base_Predictor.py:144: UserWarning: Sparse CSR tensor support is in beta state. If you miss a functionality in the sparse tensor support, please submit a feature request to https://github.com/pytorch/pytorch/issues. (Triggered internally at ..\aten\src\ATen\SparseCsrTensorImpl.cpp:55.)
    self.adj_csr = self.adj.to_sparse_csr().to(self.device)
[I 2026-04-30 16:20:42,462] Trial 24 finished with value: 0.595 and parameters: {'lr': 0.005, 'weight_decay': 0.0001, 'n_hidden': 64, 'n_layer': 2, 'dropout': 0.27005716303360905, 'knn_mode': 's', 'k': 13, 'dexp': 1.826618461426387, 'p_grd': 0.7545504609379745, 'unc_rem': 0.22478452609075278, 'unc_rel': 0.8152013896604273}. Best is trial 5 with value: 0.648.
    [CPU] Loading amazoncom...
    DEBUG 3.1: Dataset init start
    DEBUG 3.2: prepare_data start amazoncom
    ----Data statistics------'
    Name: amazoncom
    #Nodes 13752
    #Edges 245861
    #Classes 10
    #Ave_degree 35.76
    ----Split statistics------'
    #Train samples 200 (20 nodes per class)
    #Val samples 500 (specified)
    #Test samples 1000 (specified)
    ----label noise information:------
    Instance dependent noise
    #Actual noise rate 0.50
    [cuda:0] LNPCC waiting for GPU slot...
    [cuda:0] Slot acquired (waited 0.0s). Starting GCN...
    FINAL_RESULT: {'acc': {'train': 0.47474747474747475, 'valid': 0.348, 'test': 0.503}, 'wall_s': 39.6, 'cpu_s': 36.95, 'gpu_s': 2.56, 'wait_s': 0.0}
    [Time] wall=39.6s | cpu=37.0s | gpu=2.6s
    C:\Users\fbrev\Documents\Acadêmico\Simulações\Python\NoisyGL\predictor\Base_Predictor.py:144: UserWarning: Sparse CSR tensor support is in beta state. If you miss a functionality in the sparse tensor support, please submit a feature request to https://github.com/pytorch/pytorch/issues. (Triggered internally at ..\aten\src\ATen\SparseCsrTensorImpl.cpp:55.)
    self.adj_csr = self.adj.to_sparse_csr().to(self.device)
[I 2026-04-30 16:21:28,211] Trial 25 finished with value: 0.503 and parameters: {'lr': 0.01, 'weight_decay': 0.001, 'n_hidden': 32, 'n_layer': 2, 'dropout': 0.40859669139223437, 'knn_mode': 's', 'k': 32, 'dexp': 4.944816110088705, 'p_grd': 0.5605941264035613, 'unc_rem': 0.3912780797054508, 'unc_rel': 0.8992857881797629}. Best is trial 5 with value: 0.648.
    [CPU] Loading amazoncom...
    DEBUG 3.1: Dataset init start
    DEBUG 3.2: prepare_data start amazoncom
    ----Data statistics------'
    Name: amazoncom
    #Nodes 13752
    #Edges 245861
    #Classes 10
    #Ave_degree 35.76
    ----Split statistics------'
    #Train samples 200 (20 nodes per class)
    #Val samples 500 (specified)
    #Test samples 1000 (specified)
    ----label noise information:------
    Instance dependent noise
    #Actual noise rate 0.50
    [cuda:0] LNPCC waiting for GPU slot...
    [cuda:0] Slot acquired (waited 0.0s). Starting GCN...
    FINAL_RESULT: {'acc': {'train': 0.5888324873096447, 'valid': 0.398, 'test': 0.619}, 'wall_s': 52.27, 'cpu_s': 44.14, 'gpu_s': 8.05, 'wait_s': 0.0}
    [Time] wall=52.3s | cpu=44.1s | gpu=8.1s
    C:\Users\fbrev\Documents\Acadêmico\Simulações\Python\NoisyGL\predictor\Base_Predictor.py:144: UserWarning: Sparse CSR tensor support is in beta state. If you miss a functionality in the sparse tensor support, please submit a feature request to https://github.com/pytorch/pytorch/issues. (Triggered internally at ..\aten\src\ATen\SparseCsrTensorImpl.cpp:55.)
    self.adj_csr = self.adj.to_sparse_csr().to(self.device)
[I 2026-04-30 16:22:27,345] Trial 26 finished with value: 0.619 and parameters: {'lr': 0.005, 'weight_decay': 0.0001, 'n_hidden': 256, 'n_layer': 2, 'dropout': 0.5804680681603397, 'knn_mode': 's', 'k': 11, 'dexp': 6.118780562459628, 'p_grd': 0.7730203313719253, 'unc_rem': 0.594622927081361, 'unc_rel': 0.7450900664106197}. Best is trial 5 with value: 0.648.
    [CPU] Loading amazoncom...
    DEBUG 3.1: Dataset init start
    DEBUG 3.2: prepare_data start amazoncom
    ----Data statistics------'
    Name: amazoncom
    #Nodes 13752
    #Edges 245861
    #Classes 10
    #Ave_degree 35.76
    ----Split statistics------'
    #Train samples 200 (20 nodes per class)
    #Val samples 500 (specified)
    #Test samples 1000 (specified)
    ----label noise information:------
    Instance dependent noise
    #Actual noise rate 0.50
    [cuda:0] LNPCC waiting for GPU slot...
    [cuda:0] Slot acquired (waited 4.2s). Starting GCN...
    FINAL_RESULT: {'acc': {'train': 0.09836065573770492, 'valid': 0.23, 'test': 0.382}, 'wall_s': 36.37, 'cpu_s': 28.5, 'gpu_s': 7.78, 'wait_s': 4.17}
    [Time] wall=36.4s | cpu=28.5s | gpu=7.8s
    C:\Users\fbrev\Documents\Acadêmico\Simulações\Python\NoisyGL\predictor\Base_Predictor.py:144: UserWarning: Sparse CSR tensor support is in beta state. If you miss a functionality in the sparse tensor support, please submit a feature request to https://github.com/pytorch/pytorch/issues. (Triggered internally at ..\aten\src\ATen\SparseCsrTensorImpl.cpp:55.)
    self.adj_csr = self.adj.to_sparse_csr().to(self.device)
