[I 2026-05-01 21:42:21,456] Trial 22 finished with value: 0.857 and parameters: {'lr': 0.001, 'weight_decay': 0.0001, 'n_hidden': 64, 'n_layer': 2, 'dropout': 0.5350086804431573, 'knn_mode': 'd', 'k': 40, 'dexp': 6.546462476613005, 'p_grd': 0.13384768130526375, 'unc_rem': 0.0024400565632121674, 'unc_rel': 0.11048589629717051}. Best is trial 11 with value: 0.897.
    [CPU] Loading amazonpho...
    DEBUG 3.1: Dataset init start
    DEBUG 3.2: prepare_data start amazonpho
    ----Data statistics------'
    Name: amazonpho
    #Nodes 7650
    #Edges 119081
    #Classes 8
    #Ave_degree 31.13
    ----Split statistics------'
    #Train samples 160 (20 nodes per class)
    #Val samples 500 (specified)
    #Test samples 1000 (specified)
    ----label noise information:------
    Instance dependent noise
    #Actual noise rate 0.30
    [cuda:1] LNPCC waiting for GPU slot...
    [cuda:1] Slot acquired (waited 114.2s). Starting GCN...
    FINAL_RESULT: {'acc': {'train': 0.6933333333333334, 'valid': 0.63, 'test': 0.888}, 'wall_s': 22.65, 'cpu_s': 19.98, 'gpu_s': 2.61, 'wait_s': 114.25}
    [Time] wall=22.7s | cpu=20.0s | gpu=2.6s
    C:\Users\fbrev\Documents\Acadêmico\Simulações\Python\NoisyGL\predictor\Base_Predictor.py:114: UserWarning: expandable_segments not supported on this platform (Triggered internally at ..\c10/cuda/CUDAAllocatorConfig.h:28.)
    self.edge_index = self._cpu_edge_index.to(self.device)
    C:\Users\fbrev\Documents\Acadêmico\Simulações\Python\NoisyGL\predictor\Base_Predictor.py:144: UserWarning: Sparse CSR tensor support is in beta state. If you miss a functionality in the sparse tensor support, please submit a feature request to https://github.com/pytorch/pytorch/issues. (Triggered internally at ..\aten\src\ATen\SparseCsrTensorImpl.cpp:55.)
    self.adj_csr = self.adj.to_sparse_csr().to(self.device)
[I 2026-05-01 21:44:44,688] Trial 23 finished with value: 0.888 and parameters: {'lr': 0.001, 'weight_decay': 0.0, 'n_hidden': 64, 'n_layer': 2, 'dropout': 0.5832079476417736, 'knn_mode': 'd', 'k': 39, 'dexp': 7.1457613054719715, 'p_grd': 0.5666606652441211, 'unc_rem': 0.0158770311090998, 'unc_rel': 0.18364001255964077}. Best is trial 11 with value: 0.897.
    [CPU] Loading amazonpho...
    DEBUG 3.1: Dataset init start
    DEBUG 3.2: prepare_data start amazonpho
    ----Data statistics------'
    Name: amazonpho
    #Nodes 7650
    #Edges 119081
    #Classes 8
    #Ave_degree 31.13
    ----Split statistics------'
    #Train samples 160 (20 nodes per class)
    #Val samples 500 (specified)
    #Test samples 1000 (specified)
    ----label noise information:------
    Instance dependent noise
    #Actual noise rate 0.30
    [cuda:1] LNPCC waiting for GPU slot...
    [cuda:1] Slot acquired (waited 119.0s). Starting GCN...
    FINAL_RESULT: {'acc': {'train': 0.725, 'valid': 0.628, 'test': 0.894}, 'wall_s': 22.25, 'cpu_s': 19.64, 'gpu_s': 2.54, 'wait_s': 118.95}
    [Time] wall=22.2s | cpu=19.6s | gpu=2.5s
    C:\Users\fbrev\Documents\Acadêmico\Simulações\Python\NoisyGL\predictor\Base_Predictor.py:114: UserWarning: expandable_segments not supported on this platform (Triggered internally at ..\c10/cuda/CUDAAllocatorConfig.h:28.)
    self.edge_index = self._cpu_edge_index.to(self.device)
    C:\Users\fbrev\Documents\Acadêmico\Simulações\Python\NoisyGL\predictor\Base_Predictor.py:144: UserWarning: Sparse CSR tensor support is in beta state. If you miss a functionality in the sparse tensor support, please submit a feature request to https://github.com/pytorch/pytorch/issues. (Triggered internally at ..\aten\src\ATen\SparseCsrTensorImpl.cpp:55.)
    self.adj_csr = self.adj.to_sparse_csr().to(self.device)
[I 2026-05-01 21:47:13,329] Trial 24 finished with value: 0.894 and parameters: {'lr': 0.001, 'weight_decay': 0.0, 'n_hidden': 64, 'n_layer': 2, 'dropout': 0.6072247844163561, 'knn_mode': 'd', 'k': 36, 'dexp': 7.20921473885292, 'p_grd': 0.5769025909539, 'unc_rem': 0.22116720296701559, 'unc_rel': 0.15410211873683824}. Best is trial 11 with value: 0.897.
    [CPU] Loading amazonpho...
    DEBUG 3.1: Dataset init start
    DEBUG 3.2: prepare_data start amazonpho
    ----Data statistics------'
    Name: amazonpho
    #Nodes 7650
    #Edges 119081
    #Classes 8
    #Ave_degree 31.13
    ----Split statistics------'
    #Train samples 160 (20 nodes per class)
    #Val samples 500 (specified)
    #Test samples 1000 (specified)
    ----label noise information:------
    Instance dependent noise
    #Actual noise rate 0.30
    [cuda:1] LNPCC waiting for GPU slot...
    [cuda:1] Slot acquired (waited 113.9s). Starting GCN...
    FINAL_RESULT: {'acc': {'train': 0.68125, 'valid': 0.63, 'test': 0.887}, 'wall_s': 25.99, 'cpu_s': 23.19, 'gpu_s': 2.74, 'wait_s': 113.93}
    [Time] wall=26.0s | cpu=23.2s | gpu=2.7s
    C:\Users\fbrev\Documents\Acadêmico\Simulações\Python\NoisyGL\predictor\Base_Predictor.py:114: UserWarning: expandable_segments not supported on this platform (Triggered internally at ..\c10/cuda/CUDAAllocatorConfig.h:28.)
    self.edge_index = self._cpu_edge_index.to(self.device)
    C:\Users\fbrev\Documents\Acadêmico\Simulações\Python\NoisyGL\predictor\Base_Predictor.py:144: UserWarning: Sparse CSR tensor support is in beta state. If you miss a functionality in the sparse tensor support, please submit a feature request to https://github.com/pytorch/pytorch/issues. (Triggered internally at ..\aten\src\ATen\SparseCsrTensorImpl.cpp:55.)
    self.adj_csr = self.adj.to_sparse_csr().to(self.device)
[I 2026-05-01 21:49:39,632] Trial 25 finished with value: 0.887 and parameters: {'lr': 0.005, 'weight_decay': 0.0, 'n_hidden': 64, 'n_layer': 2, 'dropout': 0.42904069481868223, 'knn_mode': 'd', 'k': 32, 'dexp': 5.244805982254144, 'p_grd': 0.814459190873867, 'unc_rem': 0.19909902220961287, 'unc_rel': 0.15303149946029165}. Best is trial 11 with value: 0.897.
    [CPU] Loading amazonpho...
    DEBUG 3.1: Dataset init start
    DEBUG 3.2: prepare_data start amazonpho
    ----Data statistics------'
    Name: amazonpho
    #Nodes 7650
    #Edges 119081
    #Classes 8
    #Ave_degree 31.13
    ----Split statistics------'
    #Train samples 160 (20 nodes per class)
    #Val samples 500 (specified)
    #Test samples 1000 (specified)
    ----label noise information:------
    Instance dependent noise
    #Actual noise rate 0.30
    [cuda:1] LNPCC waiting for GPU slot...
    [cuda:1] Slot acquired (waited 119.8s). Starting GCN...
    FINAL_RESULT: {'acc': {'train': 0.70625, 'valid': 0.636, 'test': 0.899}, 'wall_s': 22.17, 'cpu_s': 19.43, 'gpu_s': 2.67, 'wait_s': 119.8}
    [Time] wall=22.2s | cpu=19.4s | gpu=2.7s
    C:\Users\fbrev\Documents\Acadêmico\Simulações\Python\NoisyGL\predictor\Base_Predictor.py:114: UserWarning: expandable_segments not supported on this platform (Triggered internally at ..\c10/cuda/CUDAAllocatorConfig.h:28.)
    self.edge_index = self._cpu_edge_index.to(self.device)
    C:\Users\fbrev\Documents\Acadêmico\Simulações\Python\NoisyGL\predictor\Base_Predictor.py:144: UserWarning: Sparse CSR tensor support is in beta state. If you miss a functionality in the sparse tensor support, please submit a feature request to https://github.com/pytorch/pytorch/issues. (Triggered internally at ..\aten\src\ATen\SparseCsrTensorImpl.cpp:55.)
    self.adj_csr = self.adj.to_sparse_csr().to(self.device)
[I 2026-05-01 21:52:08,058] Trial 26 finished with value: 0.899 and parameters: {'lr': 0.001, 'weight_decay': 0.0, 'n_hidden': 64, 'n_layer': 2, 'dropout': 0.6336497109220159, 'knn_mode': 'd', 'k': 34, 'dexp': 6.916957795956908, 'p_grd': 0.7675530553821879, 'unc_rem': 0.38600963867696625, 'unc_rel': 0.013009426622495934}. Best is trial 26 with value: 0.899.
    [CPU] Loading amazonpho...
    DEBUG 3.1: Dataset init start
    DEBUG 3.2: prepare_data start amazonpho
    ----Data statistics------'
    Name: amazonpho
    #Nodes 7650
    #Edges 119081
    #Classes 8
    #Ave_degree 31.13
    ----Split statistics------'
    #Train samples 160 (20 nodes per class)
    #Val samples 500 (specified)
    #Test samples 1000 (specified)
    ----label noise information:------
    Instance dependent noise
    #Actual noise rate 0.30
    [cuda:1] LNPCC waiting for GPU slot...
    [cuda:1] Slot acquired (waited 117.4s). Starting GCN...
    FINAL_RESULT: {'acc': {'train': 0.725, 'valid': 0.628, 'test': 0.901}, 'wall_s': 24.93, 'cpu_s': 22.22, 'gpu_s': 2.64, 'wait_s': 117.37}
    [Time] wall=24.9s | cpu=22.2s | gpu=2.6s
    C:\Users\fbrev\Documents\Acadêmico\Simulações\Python\NoisyGL\predictor\Base_Predictor.py:114: UserWarning: expandable_segments not supported on this platform (Triggered internally at ..\c10/cuda/CUDAAllocatorConfig.h:28.)
    self.edge_index = self._cpu_edge_index.to(self.device)
    C:\Users\fbrev\Documents\Acadêmico\Simulações\Python\NoisyGL\predictor\Base_Predictor.py:144: UserWarning: Sparse CSR tensor support is in beta state. If you miss a functionality in the sparse tensor support, please submit a feature request to https://github.com/pytorch/pytorch/issues. (Triggered internally at ..\aten\src\ATen\SparseCsrTensorImpl.cpp:55.)
    self.adj_csr = self.adj.to_sparse_csr().to(self.device)
[I 2026-05-01 21:54:36,820] Trial 27 finished with value: 0.901 and parameters: {'lr': 0.001, 'weight_decay': 0.0, 'n_hidden': 64, 'n_layer': 2, 'dropout': 0.43342298872271684, 'knn_mode': 'd', 'k': 43, 'dexp': 5.782599684652621, 'p_grd': 0.7502647214296942, 'unc_rem': 0.4067466086047151, 'unc_rel': 0.02818190842223406}. Best is trial 27 with value: 0.901.
    [CPU] Loading amazonpho...
    DEBUG 3.1: Dataset init start
    DEBUG 3.2: prepare_data start amazonpho
    ----Data statistics------'
    Name: amazonpho
    #Nodes 7650
    #Edges 119081
    #Classes 8
    #Ave_degree 31.13
    ----Split statistics------'
    #Train samples 160 (20 nodes per class)
    #Val samples 500 (specified)
    #Test samples 1000 (specified)
    ----label noise information:------
    Instance dependent noise
    #Actual noise rate 0.30
    [cuda:1] LNPCC waiting for GPU slot...
    [cuda:1] Slot acquired (waited 110.2s). Starting GCN...
    FINAL_RESULT: {'acc': {'train': 0.70625, 'valid': 0.63, 'test': 0.898}, 'wall_s': 27.41, 'cpu_s': 24.65, 'gpu_s': 2.7, 'wait_s': 110.2}
    [Time] wall=27.4s | cpu=24.6s | gpu=2.7s
    C:\Users\fbrev\Documents\Acadêmico\Simulações\Python\NoisyGL\predictor\Base_Predictor.py:114: UserWarning: expandable_segments not supported on this platform (Triggered internally at ..\c10/cuda/CUDAAllocatorConfig.h:28.)
    self.edge_index = self._cpu_edge_index.to(self.device)
    C:\Users\fbrev\Documents\Acadêmico\Simulações\Python\NoisyGL\predictor\Base_Predictor.py:144: UserWarning: Sparse CSR tensor support is in beta state. If you miss a functionality in the sparse tensor support, please submit a feature request to https://github.com/pytorch/pytorch/issues. (Triggered internally at ..\aten\src\ATen\SparseCsrTensorImpl.cpp:55.)
    self.adj_csr = self.adj.to_sparse_csr().to(self.device)
[I 2026-05-01 21:57:00,869] Trial 28 finished with value: 0.898 and parameters: {'lr': 0.001, 'weight_decay': 0.0, 'n_hidden': 64, 'n_layer': 2, 'dropout': 0.4333662966443437, 'knn_mode': 'd', 'k': 45, 'dexp': 5.478131934619145, 'p_grd': 0.7536994898552691, 'unc_rem': 0.3886654289266653, 'unc_rel': 0.0269945540554335}. Best is trial 27 with value: 0.901.
    [CPU] Loading amazonpho...
    DEBUG 3.1: Dataset init start
    DEBUG 3.2: prepare_data start amazonpho
    ----Data statistics------'
    Name: amazonpho
    #Nodes 7650
    #Edges 119081
    #Classes 8
    #Ave_degree 31.13
    ----Split statistics------'
    #Train samples 160 (20 nodes per class)
    #Val samples 500 (specified)
    #Test samples 1000 (specified)
    ----label noise information:------
    Instance dependent noise
    #Actual noise rate 0.30
    [cuda:1] LNPCC waiting for GPU slot...
    [cuda:1] Slot acquired (waited 121.9s). Starting GCN...
    FINAL_RESULT: {'acc': {'train': 0.70625, 'valid': 0.632, 'test': 0.897}, 'wall_s': 27.71, 'cpu_s': 24.81, 'gpu_s': 2.83, 'wait_s': 121.89}
    [Time] wall=27.7s | cpu=24.8s | gpu=2.8s
    C:\Users\fbrev\Documents\Acadêmico\Simulações\Python\NoisyGL\predictor\Base_Predictor.py:114: UserWarning: expandable_segments not supported on this platform (Triggered internally at ..\c10/cuda/CUDAAllocatorConfig.h:28.)
    self.edge_index = self._cpu_edge_index.to(self.device)
    C:\Users\fbrev\Documents\Acadêmico\Simulações\Python\NoisyGL\predictor\Base_Predictor.py:144: UserWarning: Sparse CSR tensor support is in beta state. If you miss a functionality in the sparse tensor support, please submit a feature request to https://github.com/pytorch/pytorch/issues. (Triggered internally at ..\aten\src\ATen\SparseCsrTensorImpl.cpp:55.)
    self.adj_csr = self.adj.to_sparse_csr().to(self.device)
[I 2026-05-01 21:59:37,719] Trial 29 finished with value: 0.897 and parameters: {'lr': 0.001, 'weight_decay': 0.0, 'n_hidden': 64, 'n_layer': 2, 'dropout': 0.4464386963362086, 'knn_mode': 'd', 'k': 46, 'dexp': 5.671239358709606, 'p_grd': 0.7074630452414065, 'unc_rem': 0.42982048432028463, 'unc_rel': 0.009450704972588752}. Best is trial 27 with value: 0.901.
    [CPU] Loading amazonpho...
    DEBUG 3.1: Dataset init start
    DEBUG 3.2: prepare_data start amazonpho
    ----Data statistics------'
    Name: amazonpho
    #Nodes 7650
    #Edges 119081
    #Classes 8
    #Ave_degree 31.13
    ----Split statistics------'
    #Train samples 160 (20 nodes per class)
    #Val samples 500 (specified)
    #Test samples 1000 (specified)
    ----label noise information:------
    Instance dependent noise
    #Actual noise rate 0.30
    [cuda:1] LNPCC waiting for GPU slot...
    [cuda:1] Slot acquired (waited 110.1s). Starting GCN...
    FINAL_RESULT: {'acc': {'train': 0.1, 'valid': 0.242, 'test': 0.254}, 'wall_s': 25.96, 'cpu_s': 23.29, 'gpu_s': 2.59, 'wait_s': 110.06}
    [Time] wall=26.0s | cpu=23.3s | gpu=2.6s
    C:\Users\fbrev\Documents\Acadêmico\Simulações\Python\NoisyGL\predictor\Base_Predictor.py:114: UserWarning: expandable_segments not supported on this platform (Triggered internally at ..\c10/cuda/CUDAAllocatorConfig.h:28.)
    self.edge_index = self._cpu_edge_index.to(self.device)
    C:\Users\fbrev\Documents\Acadêmico\Simulações\Python\NoisyGL\predictor\Base_Predictor.py:144: UserWarning: Sparse CSR tensor support is in beta state. If you miss a functionality in the sparse tensor support, please submit a feature request to https://github.com/pytorch/pytorch/issues. (Triggered internally at ..\aten\src\ATen\SparseCsrTensorImpl.cpp:55.)
    self.adj_csr = self.adj.to_sparse_csr().to(self.device)
[I 2026-05-01 22:02:00,558] Trial 30 finished with value: 0.254 and parameters: {'lr': 0.1, 'weight_decay': 0.0, 'n_hidden': 64, 'n_layer': 2, 'dropout': 0.2895059051867161, 'knn_mode': 'd', 'k': 35, 'dexp': 4.60499066937364, 'p_grd': 0.7405941107602585, 'unc_rem': 0.3629505270702381, 'unc_rel': 0.005180599831182346}. Best is trial 27 with value: 0.901.
    [CPU] Loading amazonpho...
    DEBUG 3.1: Dataset init start
    DEBUG 3.2: prepare_data start amazonpho
    ----Data statistics------'
    Name: amazonpho
    #Nodes 7650
    #Edges 119081
    #Classes 8
    #Ave_degree 31.13
    ----Split statistics------'
    #Train samples 160 (20 nodes per class)
    #Val samples 500 (specified)
    #Test samples 1000 (specified)
    ----label noise information:------
    Instance dependent noise
    #Actual noise rate 0.30
    [cuda:1] LNPCC waiting for GPU slot...
    [cuda:1] Slot acquired (waited 119.6s). Starting GCN...
    FINAL_RESULT: {'acc': {'train': 0.7, 'valid': 0.634, 'test': 0.897}, 'wall_s': 26.42, 'cpu_s': 23.72, 'gpu_s': 2.64, 'wait_s': 119.62}
    [Time] wall=26.4s | cpu=23.7s | gpu=2.6s
    C:\Users\fbrev\Documents\Acadêmico\Simulações\Python\NoisyGL\predictor\Base_Predictor.py:114: UserWarning: expandable_segments not supported on this platform (Triggered internally at ..\c10/cuda/CUDAAllocatorConfig.h:28.)
    self.edge_index = self._cpu_edge_index.to(self.device)
    C:\Users\fbrev\Documents\Acadêmico\Simulações\Python\NoisyGL\predictor\Base_Predictor.py:144: UserWarning: Sparse CSR tensor support is in beta state. If you miss a functionality in the sparse tensor support, please submit a feature request to https://github.com/pytorch/pytorch/issues. (Triggered internally at ..\aten\src\ATen\SparseCsrTensorImpl.cpp:55.)
    self.adj_csr = self.adj.to_sparse_csr().to(self.device)
[I 2026-05-01 22:04:33,010] Trial 31 finished with value: 0.897 and parameters: {'lr': 0.001, 'weight_decay': 0.0, 'n_hidden': 64, 'n_layer': 2, 'dropout': 0.4009713856139582, 'knn_mode': 'd', 'k': 44, 'dexp': 5.338584686349474, 'p_grd': 0.8017606406101272, 'unc_rem': 0.5126650116279562, 'unc_rel': 0.0660103593423931}. Best is trial 27 with value: 0.901.
    [CPU] Loading amazonpho...
    DEBUG 3.1: Dataset init start
    DEBUG 3.2: prepare_data start amazonpho
    ----Data statistics------'
    Name: amazonpho
    #Nodes 7650
    #Edges 119081
    #Classes 8
    #Ave_degree 31.13
    ----Split statistics------'
    #Train samples 160 (20 nodes per class)
    #Val samples 500 (specified)
    #Test samples 1000 (specified)
    ----label noise information:------
    Instance dependent noise
    #Actual noise rate 0.30
    [cuda:1] LNPCC waiting for GPU slot...
    [cuda:1] Slot acquired (waited 113.4s). Starting GCN...
    FINAL_RESULT: {'acc': {'train': 0.7044025157232704, 'valid': 0.634, 'test': 0.898}, 'wall_s': 27.62, 'cpu_s': 25.08, 'gpu_s': 2.48, 'wait_s': 113.39}
    [Time] wall=27.6s | cpu=25.1s | gpu=2.5s
    C:\Users\fbrev\Documents\Acadêmico\Simulações\Python\NoisyGL\predictor\Base_Predictor.py:114: UserWarning: expandable_segments not supported on this platform (Triggered internally at ..\c10/cuda/CUDAAllocatorConfig.h:28.)
    self.edge_index = self._cpu_edge_index.to(self.device)
    C:\Users\fbrev\Documents\Acadêmico\Simulações\Python\NoisyGL\predictor\Base_Predictor.py:144: UserWarning: Sparse CSR tensor support is in beta state. If you miss a functionality in the sparse tensor support, please submit a feature request to https://github.com/pytorch/pytorch/issues. (Triggered internally at ..\aten\src\ATen\SparseCsrTensorImpl.cpp:55.)
    self.adj_csr = self.adj.to_sparse_csr().to(self.device)
[I 2026-05-01 22:07:00,393] Trial 32 finished with value: 0.898 and parameters: {'lr': 0.001, 'weight_decay': 0.0, 'n_hidden': 64, 'n_layer': 2, 'dropout': 0.4636222366681402, 'knn_mode': 'd', 'k': 44, 'dexp': 6.810386554625773, 'p_grd': 0.9474833713868647, 'unc_rem': 0.4770977777190668, 'unc_rel': 0.12175086206582623}. Best is trial 27 with value: 0.901.
    [CPU] Loading amazonpho...
    DEBUG 3.1: Dataset init start
    DEBUG 3.2: prepare_data start amazonpho
    ----Data statistics------'
    Name: amazonpho
    #Nodes 7650
    #Edges 119081
    #Classes 8
    #Ave_degree 31.13
    ----Split statistics------'
    #Train samples 160 (20 nodes per class)
    #Val samples 500 (specified)
    #Test samples 1000 (specified)
    ----label noise information:------
    Instance dependent noise
    #Actual noise rate 0.30
    [cuda:1] LNPCC waiting for GPU slot...
    [cuda:1] Slot acquired (waited 106.2s). Starting GCN...
    FINAL_RESULT: {'acc': {'train': 0.7044025157232704, 'valid': 0.634, 'test': 0.895}, 'wall_s': 30.45, 'cpu_s': 27.74, 'gpu_s': 2.64, 'wait_s': 106.2}
    [Time] wall=30.4s | cpu=27.7s | gpu=2.6s
    C:\Users\fbrev\Documents\Acadêmico\Simulações\Python\NoisyGL\predictor\Base_Predictor.py:114: UserWarning: expandable_segments not supported on this platform (Triggered internally at ..\c10/cuda/CUDAAllocatorConfig.h:28.)
    self.edge_index = self._cpu_edge_index.to(self.device)
    C:\Users\fbrev\Documents\Acadêmico\Simulações\Python\NoisyGL\predictor\Base_Predictor.py:144: UserWarning: Sparse CSR tensor support is in beta state. If you miss a functionality in the sparse tensor support, please submit a feature request to https://github.com/pytorch/pytorch/issues. (Triggered internally at ..\aten\src\ATen\SparseCsrTensorImpl.cpp:55.)
    self.adj_csr = self.adj.to_sparse_csr().to(self.device)
[I 2026-05-01 22:09:23,535] Trial 33 finished with value: 0.895 and parameters: {'lr': 0.001, 'weight_decay': 0.0, 'n_hidden': 64, 'n_layer': 2, 'dropout': 0.4490705735593798, 'knn_mode': 'd', 'k': 47, 'dexp': 6.161747463048478, 'p_grd': 0.9428581115944458, 'unc_rem': 0.4732567254608078, 'unc_rel': 0.11858503961923367}. Best is trial 27 with value: 0.901.
    [CPU] Loading amazonpho...
    DEBUG 3.1: Dataset init start
    DEBUG 3.2: prepare_data start amazonpho
    ----Data statistics------'
    Name: amazonpho
    #Nodes 7650
    #Edges 119081
    #Classes 8
    #Ave_degree 31.13
    ----Split statistics------'
    #Train samples 160 (20 nodes per class)
    #Val samples 500 (specified)
    #Test samples 1000 (specified)
    ----label noise information:------
    Instance dependent noise
    #Actual noise rate 0.30
    [cuda:1] LNPCC waiting for GPU slot...
    [cuda:1] Slot acquired (waited 81.2s). Starting GCN...
    FINAL_RESULT: {'acc': {'train': 0.66875, 'valid': 0.638, 'test': 0.893}, 'wall_s': 60.35, 'cpu_s': 57.72, 'gpu_s': 2.56, 'wait_s': 81.21}
    [Time] wall=60.4s | cpu=57.7s | gpu=2.6s
    C:\Users\fbrev\Documents\Acadêmico\Simulações\Python\NoisyGL\predictor\Base_Predictor.py:114: UserWarning: expandable_segments not supported on this platform (Triggered internally at ..\c10/cuda/CUDAAllocatorConfig.h:28.)
    self.edge_index = self._cpu_edge_index.to(self.device)
    C:\Users\fbrev\Documents\Acadêmico\Simulações\Python\NoisyGL\predictor\Base_Predictor.py:144: UserWarning: Sparse CSR tensor support is in beta state. If you miss a functionality in the sparse tensor support, please submit a feature request to https://github.com/pytorch/pytorch/issues. (Triggered internally at ..\aten\src\ATen\SparseCsrTensorImpl.cpp:55.)
    self.adj_csr = self.adj.to_sparse_csr().to(self.device)
