[I 2026-04-30 16:30:38,963] Trial 41 finished with value: 0.795 and parameters: {'lr': 0.01, 'weight_decay': 0.01, 'n_hidden': 256, 'n_layer': 2, 'dropout': 0.5504369528573803, 'knn_mode': 'd', 'k': 19, 'dexp': 2.2677388063447648, 'p_grd': 0.41575478286379675, 'unc_rem': 0.15561972265269178, 'unc_rel': 0.2621370816468965}. Best is trial 37 with value: 0.826.
    [CPU] Loading amazoncom...
    DEBUG 3.1: Dataset init start
    DEBUG 3.2: prepare_data start amazoncom
    ----Data statistics------'
    Name: amazoncom
    #Nodes 13752
    #Edges 245861
    #Classes 10
    #Ave_degree 35.76
    ----Split statistics------'
    #Train samples 200 (20 nodes per class)
    #Val samples 500 (specified)
    #Test samples 1000 (specified)
    ----label noise information:------
    Instance dependent noise
    #Actual noise rate 0.30
    [cuda:0] LNPCC waiting for GPU slot...
    [cuda:0] Slot acquired (waited 0.0s). Starting GCN...
    FINAL_RESULT: {'acc': {'train': 0.685, 'valid': 0.576, 'test': 0.8}, 'wall_s': 58.29, 'cpu_s': 50.36, 'gpu_s': 7.85, 'wait_s': 0.0}
    [Time] wall=58.3s | cpu=50.4s | gpu=7.9s
    C:\Users\fbrev\Documents\Acadêmico\Simulações\Python\NoisyGL\predictor\Base_Predictor.py:144: UserWarning: Sparse CSR tensor support is in beta state. If you miss a functionality in the sparse tensor support, please submit a feature request to https://github.com/pytorch/pytorch/issues. (Triggered internally at ..\aten\src\ATen\SparseCsrTensorImpl.cpp:55.)
    self.adj_csr = self.adj.to_sparse_csr().to(self.device)
[I 2026-04-30 16:31:43,509] Trial 42 finished with value: 0.8 and parameters: {'lr': 0.01, 'weight_decay': 0.01, 'n_hidden': 256, 'n_layer': 2, 'dropout': 0.627706873979569, 'knn_mode': 'd', 'k': 28, 'dexp': 3.1600607987408256, 'p_grd': 0.4495213768689533, 'unc_rem': 0.26330259809794315, 'unc_rel': 0.3656676219977607}. Best is trial 37 with value: 0.826.
    [CPU] Loading amazoncom...
    DEBUG 3.1: Dataset init start
    DEBUG 3.2: prepare_data start amazoncom
    ----Data statistics------'
    Name: amazoncom
    #Nodes 13752
    #Edges 245861
    #Classes 10
    #Ave_degree 35.76
    ----Split statistics------'
    #Train samples 200 (20 nodes per class)
    #Val samples 500 (specified)
    #Test samples 1000 (specified)
    ----label noise information:------
    Instance dependent noise
    #Actual noise rate 0.30
    [cuda:0] LNPCC waiting for GPU slot...
    [cuda:0] Slot acquired (waited 6.4s). Starting GCN...
    FINAL_RESULT: {'acc': {'train': 0.7208121827411168, 'valid': 0.582, 'test': 0.802}, 'wall_s': 55.29, 'cpu_s': 47.17, 'gpu_s': 8.03, 'wait_s': 6.4}
    [Time] wall=55.3s | cpu=47.2s | gpu=8.0s
    C:\Users\fbrev\Documents\Acadêmico\Simulações\Python\NoisyGL\predictor\Base_Predictor.py:144: UserWarning: Sparse CSR tensor support is in beta state. If you miss a functionality in the sparse tensor support, please submit a feature request to https://github.com/pytorch/pytorch/issues. (Triggered internally at ..\aten\src\ATen\SparseCsrTensorImpl.cpp:55.)
    self.adj_csr = self.adj.to_sparse_csr().to(self.device)
[I 2026-04-30 16:32:51,060] Trial 43 finished with value: 0.802 and parameters: {'lr': 0.01, 'weight_decay': 0.01, 'n_hidden': 256, 'n_layer': 2, 'dropout': 0.5218844962821944, 'knn_mode': 'd', 'k': 26, 'dexp': 4.069628957845627, 'p_grd': 0.3472804561574646, 'unc_rem': 0.09526564934429113, 'unc_rel': 0.11789379077886784}. Best is trial 37 with value: 0.826.
    [CPU] Loading amazoncom...
    DEBUG 3.1: Dataset init start
    DEBUG 3.2: prepare_data start amazoncom
    ----Data statistics------'
    Name: amazoncom
    #Nodes 13752
    #Edges 245861
    #Classes 10
    #Ave_degree 35.76
    ----Split statistics------'
    #Train samples 200 (20 nodes per class)
    #Val samples 500 (specified)
    #Test samples 1000 (specified)
    ----label noise information:------
    Instance dependent noise
    #Actual noise rate 0.30
    [cuda:0] LNPCC waiting for GPU slot...
    [cuda:0] Slot acquired (waited 0.0s). Starting GCN...
    FINAL_RESULT: {'acc': {'train': 0.66, 'valid': 0.584, 'test': 0.822}, 'wall_s': 54.57, 'cpu_s': 45.88, 'gpu_s': 8.61, 'wait_s': 0.0}
    [Time] wall=54.6s | cpu=45.9s | gpu=8.6s
    C:\Users\fbrev\Documents\Acadêmico\Simulações\Python\NoisyGL\predictor\Base_Predictor.py:144: UserWarning: Sparse CSR tensor support is in beta state. If you miss a functionality in the sparse tensor support, please submit a feature request to https://github.com/pytorch/pytorch/issues. (Triggered internally at ..\aten\src\ATen\SparseCsrTensorImpl.cpp:55.)
    self.adj_csr = self.adj.to_sparse_csr().to(self.device)
[I 2026-04-30 16:33:51,708] Trial 44 finished with value: 0.822 and parameters: {'lr': 0.01, 'weight_decay': 0.0, 'n_hidden': 256, 'n_layer': 2, 'dropout': 0.4720313844945252, 'knn_mode': 'd', 'k': 16, 'dexp': 5.155020973183862, 'p_grd': 0.5360706549813311, 'unc_rem': 0.17194636083917555, 'unc_rel': 0.21126006301524367}. Best is trial 37 with value: 0.826.
    [CPU] Loading amazoncom...
    DEBUG 3.1: Dataset init start
    DEBUG 3.2: prepare_data start amazoncom
    ----Data statistics------'
    Name: amazoncom
    #Nodes 13752
    #Edges 245861
    #Classes 10
    #Ave_degree 35.76
    ----Split statistics------'
    #Train samples 200 (20 nodes per class)
    #Val samples 500 (specified)
    #Test samples 1000 (specified)
    ----label noise information:------
    Instance dependent noise
    #Actual noise rate 0.30
    [cuda:0] LNPCC waiting for GPU slot...
    [cuda:0] Slot acquired (waited 2.0s). Starting GCN...
    FINAL_RESULT: {'acc': {'train': 0.29, 'valid': 0.318, 'test': 0.463}, 'wall_s': 53.33, 'cpu_s': 44.74, 'gpu_s': 8.51, 'wait_s': 2.04}
    [Time] wall=53.3s | cpu=44.7s | gpu=8.5s
    C:\Users\fbrev\Documents\Acadêmico\Simulações\Python\NoisyGL\predictor\Base_Predictor.py:144: UserWarning: Sparse CSR tensor support is in beta state. If you miss a functionality in the sparse tensor support, please submit a feature request to https://github.com/pytorch/pytorch/issues. (Triggered internally at ..\aten\src\ATen\SparseCsrTensorImpl.cpp:55.)
    self.adj_csr = self.adj.to_sparse_csr().to(self.device)
[I 2026-04-30 16:34:53,621] Trial 45 finished with value: 0.463 and parameters: {'lr': 0.05, 'weight_decay': 0.0, 'n_hidden': 256, 'n_layer': 2, 'dropout': 0.47521953529902927, 'knn_mode': 'd', 'k': 15, 'dexp': 5.258334020922984, 'p_grd': 0.5520951694754225, 'unc_rem': 0.2046807739458456, 'unc_rel': 0.30891887571794974}. Best is trial 37 with value: 0.826.
    [CPU] Loading amazoncom...
    DEBUG 3.1: Dataset init start
    DEBUG 3.2: prepare_data start amazoncom
    ----Data statistics------'
    Name: amazoncom
    #Nodes 13752
    #Edges 245861
    #Classes 10
    #Ave_degree 35.76
    ----Split statistics------'
    #Train samples 200 (20 nodes per class)
    #Val samples 500 (specified)
    #Test samples 1000 (specified)
    ----label noise information:------
    Instance dependent noise
    #Actual noise rate 0.30
    [cuda:0] LNPCC waiting for GPU slot...
    [cuda:0] Slot acquired (waited 0.0s). Starting GCN...
    FINAL_RESULT: {'acc': {'train': 0.155, 'valid': 0.288, 'test': 0.382}, 'wall_s': 47.48, 'cpu_s': 39.08, 'gpu_s': 8.3, 'wait_s': 0.0}
    [Time] wall=47.5s | cpu=39.1s | gpu=8.3s
    C:\Users\fbrev\Documents\Acadêmico\Simulações\Python\NoisyGL\predictor\Base_Predictor.py:144: UserWarning: Sparse CSR tensor support is in beta state. If you miss a functionality in the sparse tensor support, please submit a feature request to https://github.com/pytorch/pytorch/issues. (Triggered internally at ..\aten\src\ATen\SparseCsrTensorImpl.cpp:55.)
    self.adj_csr = self.adj.to_sparse_csr().to(self.device)
[I 2026-04-30 16:35:47,312] Trial 46 finished with value: 0.382 and parameters: {'lr': 0.1, 'weight_decay': 0.0, 'n_hidden': 256, 'n_layer': 2, 'dropout': 0.7153715594393552, 'knn_mode': 'd', 'k': 9, 'dexp': 9.96846054414452, 'p_grd': 0.6140079995802648, 'unc_rem': 0.4691977192443529, 'unc_rel': 0.16925873317555024}. Best is trial 37 with value: 0.826.
    [CPU] Loading amazoncom...
    DEBUG 3.1: Dataset init start
    DEBUG 3.2: prepare_data start amazoncom
    ----Data statistics------'
    Name: amazoncom
    #Nodes 13752
    #Edges 245861
    #Classes 10
    #Ave_degree 35.76
    ----Split statistics------'
    #Train samples 200 (20 nodes per class)
    #Val samples 500 (specified)
    #Test samples 1000 (specified)
    ----label noise information:------
    Instance dependent noise
    #Actual noise rate 0.30
    [cuda:0] LNPCC waiting for GPU slot...
    [cuda:0] Slot acquired (waited 8.0s). Starting GCN...
    FINAL_RESULT: {'acc': {'train': 0.7291666666666666, 'valid': 0.59, 'test': 0.79}, 'wall_s': 58.64, 'cpu_s': 53.69, 'gpu_s': 4.88, 'wait_s': 8.03}
    [Time] wall=58.6s | cpu=53.7s | gpu=4.9s
    C:\Users\fbrev\Documents\Acadêmico\Simulações\Python\NoisyGL\predictor\Base_Predictor.py:144: UserWarning: Sparse CSR tensor support is in beta state. If you miss a functionality in the sparse tensor support, please submit a feature request to https://github.com/pytorch/pytorch/issues. (Triggered internally at ..\aten\src\ATen\SparseCsrTensorImpl.cpp:55.)
    self.adj_csr = self.adj.to_sparse_csr().to(self.device)
[I 2026-04-30 16:37:01,011] Trial 47 finished with value: 0.79 and parameters: {'lr': 0.01, 'weight_decay': 0.0, 'n_hidden': 128, 'n_layer': 2, 'dropout': 0.1774580062654969, 'knn_mode': 'd', 'k': 18, 'dexp': 1.250520031882763, 'p_grd': 0.829834258073255, 'unc_rem': 0.6338107911686527, 'unc_rel': 0.20689810185022475}. Best is trial 37 with value: 0.826.
    [CPU] Loading amazoncom...
    DEBUG 3.1: Dataset init start
    DEBUG 3.2: prepare_data start amazoncom
    ----Data statistics------'
    Name: amazoncom
    #Nodes 13752
    #Edges 245861
    #Classes 10
    #Ave_degree 35.76
    ----Split statistics------'
    #Train samples 200 (20 nodes per class)
    #Val samples 500 (specified)
    #Test samples 1000 (specified)
    ----label noise information:------
    Instance dependent noise
    #Actual noise rate 0.30
    [cuda:0] LNPCC waiting for GPU slot...
    [cuda:0] Slot acquired (waited 0.0s). Starting GCN...
    FINAL_RESULT: {'acc': {'train': 0.66, 'valid': 0.584, 'test': 0.803}, 'wall_s': 65.09, 'cpu_s': 56.53, 'gpu_s': 8.49, 'wait_s': 0.0}
    [Time] wall=65.1s | cpu=56.5s | gpu=8.5s
    C:\Users\fbrev\Documents\Acadêmico\Simulações\Python\NoisyGL\predictor\Base_Predictor.py:144: UserWarning: Sparse CSR tensor support is in beta state. If you miss a functionality in the sparse tensor support, please submit a feature request to https://github.com/pytorch/pytorch/issues. (Triggered internally at ..\aten\src\ATen\SparseCsrTensorImpl.cpp:55.)
    self.adj_csr = self.adj.to_sparse_csr().to(self.device)
[I 2026-04-30 16:38:12,212] Trial 48 finished with value: 0.803 and parameters: {'lr': 0.01, 'weight_decay': 0.0, 'n_hidden': 256, 'n_layer': 2, 'dropout': 0.36251956157975895, 'knn_mode': 'd', 'k': 22, 'dexp': 4.282031905916422, 'p_grd': 0.691488996668301, 'unc_rem': 0.2610961452095101, 'unc_rel': 0.035949745399083244}. Best is trial 37 with value: 0.826.
    [CPU] Loading amazoncom...
    DEBUG 3.1: Dataset init start
    DEBUG 3.2: prepare_data start amazoncom
    ----Data statistics------'
    Name: amazoncom
    #Nodes 13752
    #Edges 245861
    #Classes 10
    #Ave_degree 35.76
    ----Split statistics------'
    #Train samples 200 (20 nodes per class)
    #Val samples 500 (specified)
    #Test samples 1000 (specified)
    ----label noise information:------
    Instance dependent noise
    #Actual noise rate 0.30
    [cuda:0] LNPCC waiting for GPU slot...
    [cuda:0] Slot acquired (waited 0.0s). Starting GCN...
    FINAL_RESULT: {'acc': {'train': 0.64, 'valid': 0.55, 'test': 0.753}, 'wall_s': 50.54, 'cpu_s': 46.52, 'gpu_s': 3.94, 'wait_s': 0.0}
    [Time] wall=50.5s | cpu=46.5s | gpu=3.9s
    C:\Users\fbrev\Documents\Acadêmico\Simulações\Python\NoisyGL\predictor\Base_Predictor.py:144: UserWarning: Sparse CSR tensor support is in beta state. If you miss a functionality in the sparse tensor support, please submit a feature request to https://github.com/pytorch/pytorch/issues. (Triggered internally at ..\aten\src\ATen\SparseCsrTensorImpl.cpp:55.)
    self.adj_csr = self.adj.to_sparse_csr().to(self.device)
