[I 2026-05-10 21:27:02,056] Trial 149 finished with value: 0.36420297848869276 and parameters: {'lr': 0.05, 'weight_decay': 0.001, 'n_hidden': 128, 'n_layer': 2, 'dropout': 0.773428645033182, 'knn_mode': 'd', 'k': 37, 'dexp': 9.018081085419007, 'p_grd': 0.6223552892476623, 'unc_rem': 0.6566781103214336, 'unc_rel': 0.1412381649492071}. Best is trial 46 with value: 0.3781025923883067.

[Retest] Phase 1 Finished. Validating Top 3 (10 runs each)...

  [Retest] Candidate 1/3 (Trial 46, HPO_acc=0.3781)
    [CPU] Loading roman-empire...
    DEBUG 3.1: Dataset init start
    DEBUG 3.2: prepare_data start roman-empire
    ----Data statistics------'
    Name: roman-empire
    #Nodes 22662
    #Edges 32927
    #Classes 18
    #Ave_degree 2.91
    ----Split statistics------'
    #Train samples 1133 (5.0 % of nodes)
    #Val samples 3399 (15.0 % of nodes)
    #Test samples 18130 (remaining)
    ----label noise information:------
    Instance dependent noise
    #Actual noise rate 0.30
    [cuda:0] LNPCC waiting for GPU slot...
    [cuda:0] Slot acquired (waited 0.0s). Starting GCN...
    FINAL_RESULT: {'acc': {'train': 0.5402193784277879, 'valid': 0.2686084142394822, 'test': 0.3619966905681191}, 'wall_s': 219.14, 'cpu_s': 216.31, 'gpu_s': 2.8, 'wait_s': 0.0}
    [Time] wall=219.1s | cpu=216.3s | gpu=2.8s
    C:\Users\fbrev\Documents\Acadêmico\Simulações\Python\NoisyGL\predictor\Base_Predictor.py:114: UserWarning: expandable_segments not supported on this platform (Triggered internally at ..\c10/cuda/CUDAAllocatorConfig.h:28.)
    self.edge_index = self._cpu_edge_index.to(self.device)
    C:\Users\fbrev\Documents\Acadêmico\Simulações\Python\NoisyGL\predictor\Base_Predictor.py:144: UserWarning: Sparse CSR tensor support is in beta state. If you miss a functionality in the sparse tensor support, please submit a feature request to https://github.com/pytorch/pytorch/issues. (Triggered internally at ..\aten\src\ATen\SparseCsrTensorImpl.cpp:55.)
    self.adj_csr = self.adj.to_sparse_csr().to(self.device)
    [CPU] Loading roman-empire...
    DEBUG 3.1: Dataset init start
    DEBUG 3.2: prepare_data start roman-empire
    ----Data statistics------'
    Name: roman-empire
    #Nodes 22662
    #Edges 32927
    #Classes 18
    #Ave_degree 2.91
    ----Split statistics------'
    #Train samples 1133 (5.0 % of nodes)
    #Val samples 3399 (15.0 % of nodes)
    #Test samples 18130 (remaining)
    ----label noise information:------
    Instance dependent noise
    #Actual noise rate 0.30
    [cuda:0] LNPCC waiting for GPU slot...
    [cuda:0] Slot acquired (waited 0.0s). Starting GCN...
    FINAL_RESULT: {'acc': {'train': 0.4879852125693161, 'valid': 0.27919976463665785, 'test': 0.37175951461665746}, 'wall_s': 208.37, 'cpu_s': 205.67, 'gpu_s': 2.68, 'wait_s': 0.0}
    [Time] wall=208.4s | cpu=205.7s | gpu=2.7s
    C:\Users\fbrev\Documents\Acadêmico\Simulações\Python\NoisyGL\predictor\Base_Predictor.py:114: UserWarning: expandable_segments not supported on this platform (Triggered internally at ..\c10/cuda/CUDAAllocatorConfig.h:28.)
    self.edge_index = self._cpu_edge_index.to(self.device)
    C:\Users\fbrev\Documents\Acadêmico\Simulações\Python\NoisyGL\predictor\Base_Predictor.py:144: UserWarning: Sparse CSR tensor support is in beta state. If you miss a functionality in the sparse tensor support, please submit a feature request to https://github.com/pytorch/pytorch/issues. (Triggered internally at ..\aten\src\ATen\SparseCsrTensorImpl.cpp:55.)
    self.adj_csr = self.adj.to_sparse_csr().to(self.device)
    [CPU] Loading roman-empire...
    DEBUG 3.1: Dataset init start
    DEBUG 3.2: prepare_data start roman-empire
    ----Data statistics------'
    Name: roman-empire
    #Nodes 22662
    #Edges 32927
    #Classes 18
    #Ave_degree 2.91
    ----Split statistics------'
    #Train samples 1133 (5.0 % of nodes)
    #Val samples 3399 (15.0 % of nodes)
    #Test samples 18130 (remaining)
    ----label noise information:------
    Instance dependent noise
    #Actual noise rate 0.30
    [cuda:0] LNPCC waiting for GPU slot...
    [cuda:0] Slot acquired (waited 0.0s). Starting GCN...
    FINAL_RESULT: {'acc': {'train': 0.500459981600736, 'valid': 0.27684613121506324, 'test': 0.3599007170435742}, 'wall_s': 264.92, 'cpu_s': 262.28, 'gpu_s': 2.6, 'wait_s': 0.0}
    [Time] wall=264.9s | cpu=262.3s | gpu=2.6s
    C:\Users\fbrev\Documents\Acadêmico\Simulações\Python\NoisyGL\predictor\Base_Predictor.py:114: UserWarning: expandable_segments not supported on this platform (Triggered internally at ..\c10/cuda/CUDAAllocatorConfig.h:28.)
    self.edge_index = self._cpu_edge_index.to(self.device)
    C:\Users\fbrev\Documents\Acadêmico\Simulações\Python\NoisyGL\predictor\Base_Predictor.py:144: UserWarning: Sparse CSR tensor support is in beta state. If you miss a functionality in the sparse tensor support, please submit a feature request to https://github.com/pytorch/pytorch/issues. (Triggered internally at ..\aten\src\ATen\SparseCsrTensorImpl.cpp:55.)
    self.adj_csr = self.adj.to_sparse_csr().to(self.device)
    [CPU] Loading roman-empire...
    DEBUG 3.1: Dataset init start
    DEBUG 3.2: prepare_data start roman-empire
    ----Data statistics------'
    Name: roman-empire
    #Nodes 22662
    #Edges 32927
    #Classes 18
    #Ave_degree 2.91
    ----Split statistics------'
    #Train samples 1133 (5.0 % of nodes)
    #Val samples 3399 (15.0 % of nodes)
    #Test samples 18130 (remaining)
    ----label noise information:------
    Instance dependent noise
    #Actual noise rate 0.30
    [cuda:0] LNPCC waiting for GPU slot...
    [cuda:0] Slot acquired (waited 0.0s). Starting GCN...
    FINAL_RESULT: {'acc': {'train': 0.4614678899082569, 'valid': 0.26890261841718155, 'test': 0.35962493105350246}, 'wall_s': 239.15, 'cpu_s': 236.51, 'gpu_s': 2.61, 'wait_s': 0.0}
    [Time] wall=239.2s | cpu=236.5s | gpu=2.6s
    C:\Users\fbrev\Documents\Acadêmico\Simulações\Python\NoisyGL\predictor\Base_Predictor.py:114: UserWarning: expandable_segments not supported on this platform (Triggered internally at ..\c10/cuda/CUDAAllocatorConfig.h:28.)
    self.edge_index = self._cpu_edge_index.to(self.device)
    C:\Users\fbrev\Documents\Acadêmico\Simulações\Python\NoisyGL\predictor\Base_Predictor.py:144: UserWarning: Sparse CSR tensor support is in beta state. If you miss a functionality in the sparse tensor support, please submit a feature request to https://github.com/pytorch/pytorch/issues. (Triggered internally at ..\aten\src\ATen\SparseCsrTensorImpl.cpp:55.)
    self.adj_csr = self.adj.to_sparse_csr().to(self.device)
    [CPU] Loading roman-empire...
    DEBUG 3.1: Dataset init start
    DEBUG 3.2: prepare_data start roman-empire
    ----Data statistics------'
    Name: roman-empire
    #Nodes 22662
    #Edges 32927
    #Classes 18
    #Ave_degree 2.91
    ----Split statistics------'
    #Train samples 1133 (5.0 % of nodes)
    #Val samples 3399 (15.0 % of nodes)
    #Test samples 18130 (remaining)
    ----label noise information:------
    Instance dependent noise
    #Actual noise rate 0.30
    [cuda:0] LNPCC waiting for GPU slot...
    [cuda:0] Slot acquired (waited 0.0s). Starting GCN...
    FINAL_RESULT: {'acc': {'train': 0.4623955431754875, 'valid': 0.25772285966460723, 'test': 0.35714285714285715}, 'wall_s': 244.52, 'cpu_s': 241.96, 'gpu_s': 2.54, 'wait_s': 0.0}
    [Time] wall=244.5s | cpu=242.0s | gpu=2.5s
    C:\Users\fbrev\Documents\Acadêmico\Simulações\Python\NoisyGL\predictor\Base_Predictor.py:114: UserWarning: expandable_segments not supported on this platform (Triggered internally at ..\c10/cuda/CUDAAllocatorConfig.h:28.)
    self.edge_index = self._cpu_edge_index.to(self.device)
    C:\Users\fbrev\Documents\Acadêmico\Simulações\Python\NoisyGL\predictor\Base_Predictor.py:144: UserWarning: Sparse CSR tensor support is in beta state. If you miss a functionality in the sparse tensor support, please submit a feature request to https://github.com/pytorch/pytorch/issues. (Triggered internally at ..\aten\src\ATen\SparseCsrTensorImpl.cpp:55.)
    self.adj_csr = self.adj.to_sparse_csr().to(self.device)
    [CPU] Loading roman-empire...
    DEBUG 3.1: Dataset init start
    DEBUG 3.2: prepare_data start roman-empire
    ----Data statistics------'
    Name: roman-empire
    #Nodes 22662
    #Edges 32927
    #Classes 18
    #Ave_degree 2.91
    ----Split statistics------'
    #Train samples 1133 (5.0 % of nodes)
    #Val samples 3399 (15.0 % of nodes)
    #Test samples 18130 (remaining)
    ----label noise information:------
    Instance dependent noise
    #Actual noise rate 0.30
    [cuda:0] LNPCC waiting for GPU slot...
    [cuda:0] Slot acquired (waited 0.0s). Starting GCN...
    FINAL_RESULT: {'acc': {'train': 0.4727608494921514, 'valid': 0.25684024713150927, 'test': 0.34202978488692776}, 'wall_s': 216.02, 'cpu_s': 213.33, 'gpu_s': 2.67, 'wait_s': 0.0}
    [Time] wall=216.0s | cpu=213.3s | gpu=2.7s
    C:\Users\fbrev\Documents\Acadêmico\Simulações\Python\NoisyGL\predictor\Base_Predictor.py:114: UserWarning: expandable_segments not supported on this platform (Triggered internally at ..\c10/cuda/CUDAAllocatorConfig.h:28.)
    self.edge_index = self._cpu_edge_index.to(self.device)
    C:\Users\fbrev\Documents\Acadêmico\Simulações\Python\NoisyGL\predictor\Base_Predictor.py:144: UserWarning: Sparse CSR tensor support is in beta state. If you miss a functionality in the sparse tensor support, please submit a feature request to https://github.com/pytorch/pytorch/issues. (Triggered internally at ..\aten\src\ATen\SparseCsrTensorImpl.cpp:55.)
    self.adj_csr = self.adj.to_sparse_csr().to(self.device)
    [CPU] Loading roman-empire...
    DEBUG 3.1: Dataset init start
    DEBUG 3.2: prepare_data start roman-empire
    ----Data statistics------'
    Name: roman-empire
    #Nodes 22662
    #Edges 32927
    #Classes 18
    #Ave_degree 2.91
    ----Split statistics------'
    #Train samples 1133 (5.0 % of nodes)
    #Val samples 3399 (15.0 % of nodes)
    #Test samples 18130 (remaining)
    ----label noise information:------
    Instance dependent noise
    #Actual noise rate 0.30
    [cuda:0] LNPCC waiting for GPU slot...
    [cuda:0] Slot acquired (waited 0.0s). Starting GCN...
    FINAL_RESULT: {'acc': {'train': 0.4867579908675799, 'valid': 0.2765519270373639, 'test': 0.37027027027027026}, 'wall_s': 234.52, 'cpu_s': 231.86, 'gpu_s': 2.63, 'wait_s': 0.0}
    [Time] wall=234.5s | cpu=231.9s | gpu=2.6s
    C:\Users\fbrev\Documents\Acadêmico\Simulações\Python\NoisyGL\predictor\Base_Predictor.py:114: UserWarning: expandable_segments not supported on this platform (Triggered internally at ..\c10/cuda/CUDAAllocatorConfig.h:28.)
    self.edge_index = self._cpu_edge_index.to(self.device)
    C:\Users\fbrev\Documents\Acadêmico\Simulações\Python\NoisyGL\predictor\Base_Predictor.py:144: UserWarning: Sparse CSR tensor support is in beta state. If you miss a functionality in the sparse tensor support, please submit a feature request to https://github.com/pytorch/pytorch/issues. (Triggered internally at ..\aten\src\ATen\SparseCsrTensorImpl.cpp:55.)
    self.adj_csr = self.adj.to_sparse_csr().to(self.device)
    [CPU] Loading roman-empire...
    DEBUG 3.1: Dataset init start
    DEBUG 3.2: prepare_data start roman-empire
    ----Data statistics------'
    Name: roman-empire
    #Nodes 22662
    #Edges 32927
    #Classes 18
    #Ave_degree 2.91
    ----Split statistics------'
    #Train samples 1133 (5.0 % of nodes)
    #Val samples 3399 (15.0 % of nodes)
    #Test samples 18130 (remaining)
    ----label noise information:------
    Instance dependent noise
    #Actual noise rate 0.30
    [cuda:0] LNPCC waiting for GPU slot...
    [cuda:0] Slot acquired (waited 0.0s). Starting GCN...
    FINAL_RESULT: {'acc': {'train': 0.48342541436464087, 'valid': 0.2783171521035599, 'test': 0.3672366243794815}, 'wall_s': 212.67, 'cpu_s': 210.01, 'gpu_s': 2.63, 'wait_s': 0.0}
    [Time] wall=212.7s | cpu=210.0s | gpu=2.6s
    C:\Users\fbrev\Documents\Acadêmico\Simulações\Python\NoisyGL\predictor\Base_Predictor.py:114: UserWarning: expandable_segments not supported on this platform (Triggered internally at ..\c10/cuda/CUDAAllocatorConfig.h:28.)
    self.edge_index = self._cpu_edge_index.to(self.device)
    C:\Users\fbrev\Documents\Acadêmico\Simulações\Python\NoisyGL\predictor\Base_Predictor.py:144: UserWarning: Sparse CSR tensor support is in beta state. If you miss a functionality in the sparse tensor support, please submit a feature request to https://github.com/pytorch/pytorch/issues. (Triggered internally at ..\aten\src\ATen\SparseCsrTensorImpl.cpp:55.)
    self.adj_csr = self.adj.to_sparse_csr().to(self.device)
    [CPU] Loading roman-empire...
    DEBUG 3.1: Dataset init start
    DEBUG 3.2: prepare_data start roman-empire
    ----Data statistics------'
    Name: roman-empire
    #Nodes 22662
    #Edges 32927
    #Classes 18
    #Ave_degree 2.91
    ----Split statistics------'
    #Train samples 1133 (5.0 % of nodes)
    #Val samples 3399 (15.0 % of nodes)
    #Test samples 18130 (remaining)
    ----label noise information:------
    Instance dependent noise
    #Actual noise rate 0.30
    [cuda:0] LNPCC waiting for GPU slot...
    [cuda:0] Slot acquired (waited 0.0s). Starting GCN...
    FINAL_RESULT: {'acc': {'train': 0.48294930875576036, 'valid': 0.2644895557516917, 'test': 0.3569222283507998}, 'wall_s': 241.01, 'cpu_s': 238.51, 'gpu_s': 2.47, 'wait_s': 0.0}
    [Time] wall=241.0s | cpu=238.5s | gpu=2.5s
    C:\Users\fbrev\Documents\Acadêmico\Simulações\Python\NoisyGL\predictor\Base_Predictor.py:114: UserWarning: expandable_segments not supported on this platform (Triggered internally at ..\c10/cuda/CUDAAllocatorConfig.h:28.)
    self.edge_index = self._cpu_edge_index.to(self.device)
    C:\Users\fbrev\Documents\Acadêmico\Simulações\Python\NoisyGL\predictor\Base_Predictor.py:144: UserWarning: Sparse CSR tensor support is in beta state. If you miss a functionality in the sparse tensor support, please submit a feature request to https://github.com/pytorch/pytorch/issues. (Triggered internally at ..\aten\src\ATen\SparseCsrTensorImpl.cpp:55.)
    self.adj_csr = self.adj.to_sparse_csr().to(self.device)
    [CPU] Loading roman-empire...
    DEBUG 3.1: Dataset init start
    DEBUG 3.2: prepare_data start roman-empire
    ----Data statistics------'
    Name: roman-empire
    #Nodes 22662
    #Edges 32927
    #Classes 18
    #Ave_degree 2.91
    ----Split statistics------'
    #Train samples 1133 (5.0 % of nodes)
    #Val samples 3399 (15.0 % of nodes)
    #Test samples 18130 (remaining)
    ----label noise information:------
    Instance dependent noise
    #Actual noise rate 0.30
    [cuda:0] LNPCC waiting for GPU slot...
    [cuda:0] Slot acquired (waited 0.0s). Starting GCN...
    FINAL_RESULT: {'acc': {'train': 0.46734130634774607, 'valid': 0.2709620476610768, 'test': 0.3467181467181467}, 'wall_s': 234.41, 'cpu_s': 231.77, 'gpu_s': 2.61, 'wait_s': 0.0}
    [Time] wall=234.4s | cpu=231.8s | gpu=2.6s
    C:\Users\fbrev\Documents\Acadêmico\Simulações\Python\NoisyGL\predictor\Base_Predictor.py:114: UserWarning: expandable_segments not supported on this platform (Triggered internally at ..\c10/cuda/CUDAAllocatorConfig.h:28.)
    self.edge_index = self._cpu_edge_index.to(self.device)
    C:\Users\fbrev\Documents\Acadêmico\Simulações\Python\NoisyGL\predictor\Base_Predictor.py:144: UserWarning: Sparse CSR tensor support is in beta state. If you miss a functionality in the sparse tensor support, please submit a feature request to https://github.com/pytorch/pytorch/issues. (Triggered internally at ..\aten\src\ATen\SparseCsrTensorImpl.cpp:55.)
    self.adj_csr = self.adj.to_sparse_csr().to(self.device)
  [Retest] Candidate 1 Avg: 0.3594

  [Retest] Candidate 2/3 (Trial 45, HPO_acc=0.3774)
    [CPU] Loading roman-empire...
    DEBUG 3.1: Dataset init start
    DEBUG 3.2: prepare_data start roman-empire
    ----Data statistics------'
    Name: roman-empire
    #Nodes 22662
    #Edges 32927
    #Classes 18
    #Ave_degree 2.91
    ----Split statistics------'
    #Train samples 1133 (5.0 % of nodes)
    #Val samples 3399 (15.0 % of nodes)
    #Test samples 18130 (remaining)
    ----label noise information:------
    Instance dependent noise
    #Actual noise rate 0.30
    [cuda:0] LNPCC waiting for GPU slot...
    [cuda:0] Slot acquired (waited 0.0s). Starting GCN...
    FINAL_RESULT: {'acc': {'train': 0.48083941605839414, 'valid': 0.2627243306854957, 'test': 0.3549365692222835}, 'wall_s': 286.06, 'cpu_s': 283.43, 'gpu_s': 2.58, 'wait_s': 0.0}
    [Time] wall=286.1s | cpu=283.4s | gpu=2.6s
    C:\Users\fbrev\Documents\Acadêmico\Simulações\Python\NoisyGL\predictor\Base_Predictor.py:114: UserWarning: expandable_segments not supported on this platform (Triggered internally at ..\c10/cuda/CUDAAllocatorConfig.h:28.)
    self.edge_index = self._cpu_edge_index.to(self.device)
    C:\Users\fbrev\Documents\Acadêmico\Simulações\Python\NoisyGL\predictor\Base_Predictor.py:144: UserWarning: Sparse CSR tensor support is in beta state. If you miss a functionality in the sparse tensor support, please submit a feature request to https://github.com/pytorch/pytorch/issues. (Triggered internally at ..\aten\src\ATen\SparseCsrTensorImpl.cpp:55.)
    self.adj_csr = self.adj.to_sparse_csr().to(self.device)
    [CPU] Loading roman-empire...
    DEBUG 3.1: Dataset init start
    DEBUG 3.2: prepare_data start roman-empire
    ----Data statistics------'
    Name: roman-empire
    #Nodes 22662
    #Edges 32927
    #Classes 18
    #Ave_degree 2.91
    ----Split statistics------'
    #Train samples 1133 (5.0 % of nodes)
    #Val samples 3399 (15.0 % of nodes)
    #Test samples 18130 (remaining)
    ----label noise information:------
    Instance dependent noise
    #Actual noise rate 0.30
    [cuda:0] LNPCC waiting for GPU slot...
    [cuda:0] Slot acquired (waited 0.0s). Starting GCN...
    FINAL_RESULT: {'acc': {'train': 0.49538745387453875, 'valid': 0.26301853486319504, 'test': 0.36916712630998344}, 'wall_s': 237.77, 'cpu_s': 235.15, 'gpu_s': 2.59, 'wait_s': 0.0}
    [Time] wall=237.8s | cpu=235.1s | gpu=2.6s
    C:\Users\fbrev\Documents\Acadêmico\Simulações\Python\NoisyGL\predictor\Base_Predictor.py:114: UserWarning: expandable_segments not supported on this platform (Triggered internally at ..\c10/cuda/CUDAAllocatorConfig.h:28.)
    self.edge_index = self._cpu_edge_index.to(self.device)
    C:\Users\fbrev\Documents\Acadêmico\Simulações\Python\NoisyGL\predictor\Base_Predictor.py:144: UserWarning: Sparse CSR tensor support is in beta state. If you miss a functionality in the sparse tensor support, please submit a feature request to https://github.com/pytorch/pytorch/issues. (Triggered internally at ..\aten\src\ATen\SparseCsrTensorImpl.cpp:55.)
    self.adj_csr = self.adj.to_sparse_csr().to(self.device)
    [CPU] Loading roman-empire...
    DEBUG 3.1: Dataset init start
    DEBUG 3.2: prepare_data start roman-empire
    ----Data statistics------'
    Name: roman-empire
    #Nodes 22662
    #Edges 32927
    #Classes 18
    #Ave_degree 2.91
    ----Split statistics------'
    #Train samples 1133 (5.0 % of nodes)
    #Val samples 3399 (15.0 % of nodes)
    #Test samples 18130 (remaining)
    ----label noise information:------
    Instance dependent noise
    #Actual noise rate 0.30
    [cuda:0] LNPCC waiting for GPU slot...
    [cuda:0] Slot acquired (waited 0.0s). Starting GCN...
    FINAL_RESULT: {'acc': {'train': 0.47641073080481033, 'valid': 0.26890261841718155, 'test': 0.36916712630998344}, 'wall_s': 277.0, 'cpu_s': 274.4, 'gpu_s': 2.56, 'wait_s': 0.0}
    [Time] wall=277.0s | cpu=274.4s | gpu=2.6s
    C:\Users\fbrev\Documents\Acadêmico\Simulações\Python\NoisyGL\predictor\Base_Predictor.py:114: UserWarning: expandable_segments not supported on this platform (Triggered internally at ..\c10/cuda/CUDAAllocatorConfig.h:28.)
    self.edge_index = self._cpu_edge_index.to(self.device)
    C:\Users\fbrev\Documents\Acadêmico\Simulações\Python\NoisyGL\predictor\Base_Predictor.py:144: UserWarning: Sparse CSR tensor support is in beta state. If you miss a functionality in the sparse tensor support, please submit a feature request to https://github.com/pytorch/pytorch/issues. (Triggered internally at ..\aten\src\ATen\SparseCsrTensorImpl.cpp:55.)
    self.adj_csr = self.adj.to_sparse_csr().to(self.device)
    [CPU] Loading roman-empire...
    DEBUG 3.1: Dataset init start
    DEBUG 3.2: prepare_data start roman-empire
    ----Data statistics------'
    Name: roman-empire
    #Nodes 22662
    #Edges 32927
    #Classes 18
    #Ave_degree 2.91
    ----Split statistics------'
    #Train samples 1133 (5.0 % of nodes)
    #Val samples 3399 (15.0 % of nodes)
    #Test samples 18130 (remaining)
    ----label noise information:------
    Instance dependent noise
    #Actual noise rate 0.30
    [cuda:0] LNPCC waiting for GPU slot...
    [cuda:0] Slot acquired (waited 0.0s). Starting GCN...
    FINAL_RESULT: {'acc': {'train': 0.4463955637707948, 'valid': 0.2715504560164754, 'test': 0.35339216767788195}, 'wall_s': 260.13, 'cpu_s': 257.06, 'gpu_s': 3.03, 'wait_s': 0.0}
    [Time] wall=260.1s | cpu=257.1s | gpu=3.0s
    C:\Users\fbrev\Documents\Acadêmico\Simulações\Python\NoisyGL\predictor\Base_Predictor.py:114: UserWarning: expandable_segments not supported on this platform (Triggered internally at ..\c10/cuda/CUDAAllocatorConfig.h:28.)
    self.edge_index = self._cpu_edge_index.to(self.device)
    C:\Users\fbrev\Documents\Acadêmico\Simulações\Python\NoisyGL\predictor\Base_Predictor.py:144: UserWarning: Sparse CSR tensor support is in beta state. If you miss a functionality in the sparse tensor supp