[I 2026-05-10 21:04:46,506] Trial 115 finished with value: 0.3293436293436293 and parameters: {'lr': 0.05, 'weight_decay': 0.001, 'n_hidden': 32, 'n_layer': 2, 'dropout': 0.7546583201319198, 'knn_mode': 'd', 'k': 7, 'dexp': 6.279534160234828, 'p_grd': 0.40983376931447174, 'unc_rem': 0.6384865611299918, 'unc_rel': 0.3728234864333098}. Best is trial 100 with value: 0.3474903474903475.
    [CPU] Loading roman-empire...
    DEBUG 3.1: Dataset init start
    DEBUG 3.2: prepare_data start roman-empire
    ----Data statistics------'
    Name: roman-empire
    #Nodes 22662
    #Edges 32927
    #Classes 18
    #Ave_degree 2.91
    ----Split statistics------'
    #Train samples 1133 (5.0 % of nodes)
    #Val samples 3399 (15.0 % of nodes)
    #Test samples 18130 (remaining)
    ----label noise information:------
    Instance dependent noise
    #Actual noise rate 0.40
    [cuda:1] LNPCC waiting for GPU slot...
    [cuda:1] Slot acquired (waited 0.0s). Starting GCN...
    FINAL_RESULT: {'acc': {'train': 0.45907473309608543, 'valid': 0.2333039129155634, 'test': 0.33838940981798127}, 'wall_s': 203.68, 'cpu_s': 199.86, 'gpu_s': 3.78, 'wait_s': 0.0}
    [Time] wall=203.7s | cpu=199.9s | gpu=3.8s
    C:\Users\fbrev\Documents\Acadêmico\Simulações\Python\NoisyGL\predictor\Base_Predictor.py:114: UserWarning: expandable_segments not supported on this platform (Triggered internally at ..\c10/cuda/CUDAAllocatorConfig.h:28.)
    self.edge_index = self._cpu_edge_index.to(self.device)
    C:\Users\fbrev\Documents\Acadêmico\Simulações\Python\NoisyGL\predictor\Base_Predictor.py:144: UserWarning: Sparse CSR tensor support is in beta state. If you miss a functionality in the sparse tensor support, please submit a feature request to https://github.com/pytorch/pytorch/issues. (Triggered internally at ..\aten\src\ATen\SparseCsrTensorImpl.cpp:55.)
    self.adj_csr = self.adj.to_sparse_csr().to(self.device)
[I 2026-05-10 21:08:16,613] Trial 117 finished with value: 0.33838940981798127 and parameters: {'lr': 0.05, 'weight_decay': 0.001, 'n_hidden': 256, 'n_layer': 2, 'dropout': 0.7313742243730915, 'knn_mode': 'd', 'k': 17, 'dexp': 6.195758887901184, 'p_grd': 0.45020502795557643, 'unc_rem': 0.5362067464157472, 'unc_rel': 0.35616923092148384}. Best is trial 100 with value: 0.3474903474903475.
    [CPU] Loading roman-empire...
    DEBUG 3.1: Dataset init start
    DEBUG 3.2: prepare_data start roman-empire
    ----Data statistics------'
    Name: roman-empire
    #Nodes 22662
    #Edges 32927
    #Classes 18
    #Ave_degree 2.91
    ----Split statistics------'
    #Train samples 1133 (5.0 % of nodes)
    #Val samples 3399 (15.0 % of nodes)
    #Test samples 18130 (remaining)
    ----label noise information:------
    Instance dependent noise
    #Actual noise rate 0.40
    [cuda:1] LNPCC waiting for GPU slot...
    [cuda:1] Slot acquired (waited 0.0s). Starting GCN...
    FINAL_RESULT: {'acc': {'train': 0.4786476868327402, 'valid': 0.23095027949396882, 'test': 0.3377826806398235}, 'wall_s': 242.63, 'cpu_s': 238.66, 'gpu_s': 3.91, 'wait_s': 0.0}
    [Time] wall=242.6s | cpu=238.7s | gpu=3.9s
    C:\Users\fbrev\Documents\Acadêmico\Simulações\Python\NoisyGL\predictor\Base_Predictor.py:114: UserWarning: expandable_segments not supported on this platform (Triggered internally at ..\c10/cuda/CUDAAllocatorConfig.h:28.)
    self.edge_index = self._cpu_edge_index.to(self.device)
    C:\Users\fbrev\Documents\Acadêmico\Simulações\Python\NoisyGL\predictor\Base_Predictor.py:144: UserWarning: Sparse CSR tensor support is in beta state. If you miss a functionality in the sparse tensor support, please submit a feature request to https://github.com/pytorch/pytorch/issues. (Triggered internally at ..\aten\src\ATen\SparseCsrTensorImpl.cpp:55.)
    self.adj_csr = self.adj.to_sparse_csr().to(self.device)
[I 2026-05-10 21:12:25,973] Trial 118 finished with value: 0.3377826806398235 and parameters: {'lr': 0.05, 'weight_decay': 0.001, 'n_hidden': 256, 'n_layer': 2, 'dropout': 0.7314437278195138, 'knn_mode': 'd', 'k': 16, 'dexp': 7.135107495396332, 'p_grd': 0.4480980221877274, 'unc_rem': 0.5369221180548162, 'unc_rel': 0.35557755569834393}. Best is trial 100 with value: 0.3474903474903475.
    [CPU] Loading roman-empire...
    DEBUG 3.1: Dataset init start
    DEBUG 3.2: prepare_data start roman-empire
    ----Data statistics------'
    Name: roman-empire
    #Nodes 22662
    #Edges 32927
    #Classes 18
    #Ave_degree 2.91
    ----Split statistics------'
    #Train samples 1133 (5.0 % of nodes)
    #Val samples 3399 (15.0 % of nodes)
    #Test samples 18130 (remaining)
    ----label noise information:------
    Instance dependent noise
    #Actual noise rate 0.40
    [cuda:1] LNPCC waiting for GPU slot...
    [cuda:1] Slot acquired (waited 0.0s). Starting GCN...
    FINAL_RESULT: {'acc': {'train': 0.06001765225066196, 'valid': 0.10767872903795234, 'test': 0.1498069498069498}, 'wall_s': 126.51, 'cpu_s': 122.65, 'gpu_s': 3.81, 'wait_s': 0.0}
    [Time] wall=126.5s | cpu=122.6s | gpu=3.8s
    C:\Users\fbrev\Documents\Acadêmico\Simulações\Python\NoisyGL\predictor\Base_Predictor.py:114: UserWarning: expandable_segments not supported on this platform (Triggered internally at ..\c10/cuda/CUDAAllocatorConfig.h:28.)
    self.edge_index = self._cpu_edge_index.to(self.device)
    C:\Users\fbrev\Documents\Acadêmico\Simulações\Python\NoisyGL\predictor\Base_Predictor.py:144: UserWarning: Sparse CSR tensor support is in beta state. If you miss a functionality in the sparse tensor support, please submit a feature request to https://github.com/pytorch/pytorch/issues. (Triggered internally at ..\aten\src\ATen\SparseCsrTensorImpl.cpp:55.)
    self.adj_csr = self.adj.to_sparse_csr().to(self.device)
[I 2026-05-10 21:14:39,174] Trial 121 finished with value: 0.1498069498069498 and parameters: {'lr': 0.05, 'weight_decay': 0.05, 'n_hidden': 256, 'n_layer': 2, 'dropout': 0.7336390198291542, 'knn_mode': 's', 'k': 16, 'dexp': 7.191410500303164, 'p_grd': 0.4492913538612064, 'unc_rem': 0.6966536276367276, 'unc_rel': 0.43622293001768414}. Best is trial 100 with value: 0.3474903474903475.
    [CPU] Loading roman-empire...
    DEBUG 3.1: Dataset init start
    DEBUG 3.2: prepare_data start roman-empire
    ----Data statistics------'
    Name: roman-empire
    #Nodes 22662
    #Edges 32927
    #Classes 18
    #Ave_degree 2.91
    ----Split statistics------'
    #Train samples 1133 (5.0 % of nodes)
    #Val samples 3399 (15.0 % of nodes)
    #Test samples 18130 (remaining)
    ----label noise information:------
    Instance dependent noise
    #Actual noise rate 0.40
    [cuda:1] LNPCC waiting for GPU slot...
    [cuda:1] Slot acquired (waited 0.0s). Starting GCN...
    FINAL_RESULT: {'acc': {'train': 0.4730803177405119, 'valid': 0.2271256251838776, 'test': 0.31936017650303367}, 'wall_s': 123.02, 'cpu_s': 119.54, 'gpu_s': 3.41, 'wait_s': 0.0}
    [Time] wall=123.0s | cpu=119.5s | gpu=3.4s
    C:\Users\fbrev\Documents\Acadêmico\Simulações\Python\NoisyGL\predictor\Base_Predictor.py:114: UserWarning: expandable_segments not supported on this platform (Triggered internally at ..\c10/cuda/CUDAAllocatorConfig.h:28.)
    self.edge_index = self._cpu_edge_index.to(self.device)
    C:\Users\fbrev\Documents\Acadêmico\Simulações\Python\NoisyGL\predictor\Base_Predictor.py:144: UserWarning: Sparse CSR tensor support is in beta state. If you miss a functionality in the sparse tensor support, please submit a feature request to https://github.com/pytorch/pytorch/issues. (Triggered internally at ..\aten\src\ATen\SparseCsrTensorImpl.cpp:55.)
    self.adj_csr = self.adj.to_sparse_csr().to(self.device)
[I 2026-05-10 21:16:48,594] Trial 123 finished with value: 0.31936017650303367 and parameters: {'lr': 0.05, 'weight_decay': 0.001, 'n_hidden': 256, 'n_layer': 2, 'dropout': 0.6735606388810633, 'knn_mode': 's', 'k': 16, 'dexp': 7.517558310817177, 'p_grd': 0.4083622490648208, 'unc_rem': 0.617141087598478, 'unc_rel': 0.38021808245015803}. Best is trial 100 with value: 0.3474903474903475.
    [CPU] Loading roman-empire...
    DEBUG 3.1: Dataset init start
    DEBUG 3.2: prepare_data start roman-empire
    ----Data statistics------'
    Name: roman-empire
    #Nodes 22662
    #Edges 32927
    #Classes 18
    #Ave_degree 2.91
    ----Split statistics------'
    #Train samples 1133 (5.0 % of nodes)
    #Val samples 3399 (15.0 % of nodes)
    #Test samples 18130 (remaining)
    ----label noise information:------
    Instance dependent noise
    #Actual noise rate 0.40
    [cuda:1] LNPCC waiting for GPU slot...
    [cuda:1] Slot acquired (waited 0.0s). Starting GCN...
    FINAL_RESULT: {'acc': {'train': 0.4942630185348632, 'valid': 0.22653721682847897, 'test': 0.3203530060672918}, 'wall_s': 124.62, 'cpu_s': 120.72, 'gpu_s': 3.84, 'wait_s': 0.0}
    [Time] wall=124.6s | cpu=120.7s | gpu=3.8s
    C:\Users\fbrev\Documents\Acadêmico\Simulações\Python\NoisyGL\predictor\Base_Predictor.py:114: UserWarning: expandable_segments not supported on this platform (Triggered internally at ..\c10/cuda/CUDAAllocatorConfig.h:28.)
    self.edge_index = self._cpu_edge_index.to(self.device)
    C:\Users\fbrev\Documents\Acadêmico\Simulações\Python\NoisyGL\predictor\Base_Predictor.py:144: UserWarning: Sparse CSR tensor support is in beta state. If you miss a functionality in the sparse tensor support, please submit a feature request to https://github.com/pytorch/pytorch/issues. (Triggered internally at ..\aten\src\ATen\SparseCsrTensorImpl.cpp:55.)
    self.adj_csr = self.adj.to_sparse_csr().to(self.device)
[I 2026-05-10 21:18:59,413] Trial 125 finished with value: 0.3203530060672918 and parameters: {'lr': 0.05, 'weight_decay': 0.001, 'n_hidden': 256, 'n_layer': 2, 'dropout': 0.6949612056848988, 'knn_mode': 's', 'k': 17, 'dexp': 6.427150042717093, 'p_grd': 0.49147886356402937, 'unc_rem': 0.5390807120749549, 'unc_rel': 0.40612545944300193}. Best is trial 100 with value: 0.3474903474903475.
    [CPU] Loading roman-empire...
    DEBUG 3.1: Dataset init start
    DEBUG 3.2: prepare_data start roman-empire
    ----Data statistics------'
    Name: roman-empire
    #Nodes 22662
    #Edges 32927
    #Classes 18
    #Ave_degree 2.91
    ----Split statistics------'
    #Train samples 1133 (5.0 % of nodes)
    #Val samples 3399 (15.0 % of nodes)
    #Test samples 18130 (remaining)
    ----label noise information:------
    Instance dependent noise
    #Actual noise rate 0.40
    [cuda:1] LNPCC waiting for GPU slot...
    [cuda:1] Slot acquired (waited 0.0s). Starting GCN...
    FINAL_RESULT: {'acc': {'train': 0.39629302736098854, 'valid': 0.23506913798175935, 'test': 0.32840595697738556}, 'wall_s': 127.44, 'cpu_s': 123.79, 'gpu_s': 3.6, 'wait_s': 0.0}
    [Time] wall=127.4s | cpu=123.8s | gpu=3.6s
    C:\Users\fbrev\Documents\Acadêmico\Simulações\Python\NoisyGL\predictor\Base_Predictor.py:114: UserWarning: expandable_segments not supported on this platform (Triggered internally at ..\c10/cuda/CUDAAllocatorConfig.h:28.)
    self.edge_index = self._cpu_edge_index.to(self.device)
    C:\Users\fbrev\Documents\Acadêmico\Simulações\Python\NoisyGL\predictor\Base_Predictor.py:144: UserWarning: Sparse CSR tensor support is in beta state. If you miss a functionality in the sparse tensor support, please submit a feature request to https://github.com/pytorch/pytorch/issues. (Triggered internally at ..\aten\src\ATen\SparseCsrTensorImpl.cpp:55.)
    self.adj_csr = self.adj.to_sparse_csr().to(self.device)
[I 2026-05-10 21:21:13,129] Trial 127 finished with value: 0.32840595697738556 and parameters: {'lr': 0.05, 'weight_decay': 0.001, 'n_hidden': 256, 'n_layer': 2, 'dropout': 0.7879000395097764, 'knn_mode': 's', 'k': 13, 'dexp': 8.376495694680253, 'p_grd': 0.3948855780498217, 'unc_rem': 0.656881843601942, 'unc_rel': 0.35255419440499014}. Best is trial 100 with value: 0.3474903474903475.
    [CPU] Loading roman-empire...
    DEBUG 3.1: Dataset init start
    DEBUG 3.2: prepare_data start roman-empire
    ----Data statistics------'
    Name: roman-empire
    #Nodes 22662
    #Edges 32927
    #Classes 18
    #Ave_degree 2.91
    ----Split statistics------'
    #Train samples 1133 (5.0 % of nodes)
    #Val samples 3399 (15.0 % of nodes)
    #Test samples 18130 (remaining)
    ----label noise information:------
    Instance dependent noise
    #Actual noise rate 0.40
    [cuda:1] LNPCC waiting for GPU slot...
    [cuda:1] Slot acquired (waited 0.0s). Starting GCN...
    FINAL_RESULT: {'acc': {'train': 0.4077669902912621, 'valid': 0.2194763165636952, 'test': 0.30987313844456704}, 'wall_s': 124.68, 'cpu_s': 121.18, 'gpu_s': 3.45, 'wait_s': 0.0}
    [Time] wall=124.7s | cpu=121.2s | gpu=3.5s
    C:\Users\fbrev\Documents\Acadêmico\Simulações\Python\NoisyGL\predictor\Base_Predictor.py:114: UserWarning: expandable_segments not supported on this platform (Triggered internally at ..\c10/cuda/CUDAAllocatorConfig.h:28.)
    self.edge_index = self._cpu_edge_index.to(self.device)
    C:\Users\fbrev\Documents\Acadêmico\Simulações\Python\NoisyGL\predictor\Base_Predictor.py:144: UserWarning: Sparse CSR tensor support is in beta state. If you miss a functionality in the sparse tensor support, please submit a feature request to https://github.com/pytorch/pytorch/issues. (Triggered internally at ..\aten\src\ATen\SparseCsrTensorImpl.cpp:55.)
    self.adj_csr = self.adj.to_sparse_csr().to(self.device)
[I 2026-05-10 21:23:23,878] Trial 129 finished with value: 0.30987313844456704 and parameters: {'lr': 0.005, 'weight_decay': 0.0001, 'n_hidden': 256, 'n_layer': 2, 'dropout': 0.7838096963912519, 'knn_mode': 's', 'k': 14, 'dexp': 6.1061877361517425, 'p_grd': 0.5168151944657315, 'unc_rem': 0.5912106280626616, 'unc_rel': 0.44527224508206814}. Best is trial 100 with value: 0.3474903474903475.
    [CPU] Loading roman-empire...
    DEBUG 3.1: Dataset init start
    DEBUG 3.2: prepare_data start roman-empire
    ----Data statistics------'
    Name: roman-empire
    #Nodes 22662
    #Edges 32927
    #Classes 18
    #Ave_degree 2.91
    ----Split statistics------'
    #Train samples 1133 (5.0 % of nodes)
    #Val samples 3399 (15.0 % of nodes)
    #Test samples 18130 (remaining)
    ----label noise information:------
    Instance dependent noise
    #Actual noise rate 0.40
    [cuda:1] LNPCC waiting for GPU slot...
    [cuda:1] Slot acquired (waited 0.0s). Starting GCN...
    FINAL_RESULT: {'acc': {'train': 0.45189761694616065, 'valid': 0.2280082377169756, 'test': 0.3212906784335356}, 'wall_s': 125.68, 'cpu_s': 121.86, 'gpu_s': 3.76, 'wait_s': 0.0}
    [Time] wall=125.7s | cpu=121.9s | gpu=3.8s
    C:\Users\fbrev\Documents\Acadêmico\Simulações\Python\NoisyGL\predictor\Base_Predictor.py:114: UserWarning: expandable_segments not supported on this platform (Triggered internally at ..\c10/cuda/CUDAAllocatorConfig.h:28.)
    self.edge_index = self._cpu_edge_index.to(self.device)
    C:\Users\fbrev\Documents\Acadêmico\Simulações\Python\NoisyGL\predictor\Base_Predictor.py:144: UserWarning: Sparse CSR tensor support is in beta state. If you miss a functionality in the sparse tensor support, please submit a feature request to https://github.com/pytorch/pytorch/issues. (Triggered internally at ..\aten\src\ATen\SparseCsrTensorImpl.cpp:55.)
    self.adj_csr = self.adj.to_sparse_csr().to(self.device)
[I 2026-05-10 21:25:36,070] Trial 131 finished with value: 0.3212906784335356 and parameters: {'lr': 0.05, 'weight_decay': 0.001, 'n_hidden': 256, 'n_layer': 2, 'dropout': 0.7216121776900752, 'knn_mode': 's', 'k': 11, 'dexp': 9.58274146562481, 'p_grd': 0.4292066978530458, 'unc_rem': 0.7862804717686026, 'unc_rel': 0.4100601177259854}. Best is trial 100 with value: 0.3474903474903475.
    [CPU] Loading roman-empire...
    DEBUG 3.1: Dataset init start
    DEBUG 3.2: prepare_data start roman-empire
    ----Data statistics------'
    Name: roman-empire
    #Nodes 22662
    #Edges 32927
    #Classes 18
    #Ave_degree 2.91
    ----Split statistics------'
    #Train samples 1133 (5.0 % of nodes)
    #Val samples 3399 (15.0 % of nodes)
    #Test samples 18130 (remaining)
    ----label noise information:------
    Instance dependent noise
    #Actual noise rate 0.40
    [cuda:1] LNPCC waiting for GPU slot...
    [cuda:1] Slot acquired (waited 0.0s). Starting GCN...
    FINAL_RESULT: {'acc': {'train': 0.4148278905560459, 'valid': 0.23183289202706678, 'test': 0.33028130170987313}, 'wall_s': 108.29, 'cpu_s': 104.19, 'gpu_s': 4.06, 'wait_s': 0.0}
    [Time] wall=108.3s | cpu=104.2s | gpu=4.1s
    C:\Users\fbrev\Documents\Acadêmico\Simulações\Python\NoisyGL\predictor\Base_Predictor.py:114: UserWarning: expandable_segments not supported on this platform (Triggered internally at ..\c10/cuda/CUDAAllocatorConfig.h:28.)
    self.edge_index = self._cpu_edge_index.to(self.device)
    C:\Users\fbrev\Documents\Acadêmico\Simulações\Python\NoisyGL\predictor\Base_Predictor.py:144: UserWarning: Sparse CSR tensor support is in beta state. If you miss a functionality in the sparse tensor support, please submit a feature request to https://github.com/pytorch/pytorch/issues. (Triggered internally at ..\aten\src\ATen\SparseCsrTensorImpl.cpp:55.)
    self.adj_csr = self.adj.to_sparse_csr().to(self.device)
[I 2026-05-10 21:27:30,766] Trial 133 finished with value: 0.33028130170987313 and parameters: {'lr': 0.05, 'weight_decay': 0.001, 'n_hidden': 256, 'n_layer': 2, 'dropout': 0.7703837674117591, 'knn_mode': 's', 'k': 13, 'dexp': 7.8528113040559315, 'p_grd': 0.36393153854815025, 'unc_rem': 0.8205069391815326, 'unc_rel': 0.3632474016797975}. Best is trial 100 with value: 0.3474903474903475.
    [CPU] Loading roman-empire...
    DEBUG 3.1: Dataset init start
    DEBUG 3.2: prepare_data start roman-empire
    ----Data statistics------'
    Name: roman-empire
    #Nodes 22662
    #Edges 32927
    #Classes 18
    #Ave_degree 2.91
    ----Split statistics------'
    #Train samples 1133 (5.0 % of nodes)
    #Val samples 3399 (15.0 % of nodes)
    #Test samples 18130 (remaining)
    ----label noise information:------
    Instance dependent noise
    #Actual noise rate 0.40
    [cuda:1] LNPCC waiting for GPU slot...
    [cuda:1] Slot acquired (waited 0.0s). Starting GCN...
    FINAL_RESULT: {'acc': {'train': 0.4416961130742049, 'valid': 0.2271256251838776, 'test': 0.31235521235521235}, 'wall_s': 114.85, 'cpu_s': 110.9, 'gpu_s': 3.89, 'wait_s': 0.0}
    [Time] wall=114.9s | cpu=110.9s | gpu=3.9s
    C:\Users\fbrev\Documents\Acadêmico\Simulações\Python\NoisyGL\predictor\Base_Predictor.py:114: UserWarning: expandable_segments not supported on this platform (Triggered internally at ..\c10/cuda/CUDAAllocatorConfig.h:28.)
    self.edge_index = self._cpu_edge_index.to(self.device)
    C:\Users\fbrev\Documents\Acadêmico\Simulações\Python\NoisyGL\predictor\Base_Predictor.py:144: UserWarning: Sparse CSR tensor support is in beta state. If you miss a functionality in the sparse tensor support, please submit a feature request to https://github.com/pytorch/pytorch/issues. (Triggered internally at ..\aten\src\ATen\SparseCsrTensorImpl.cpp:55.)
    self.adj_csr = self.adj.to_sparse_csr().to(self.device)
[I 2026-05-10 21:29:32,625] Trial 135 finished with value: 0.31235521235521235 and parameters: {'lr': 0.05, 'weight_decay': 0.001, 'n_hidden': 256, 'n_layer': 2, 'dropout': 0.7465189349985318, 'knn_mode': 's', 'k': 17, 'dexp': 8.581774499440394, 'p_grd': 0.29859020535240066, 'unc_rem': 0.675126517095543, 'unc_rel': 0.31686413333078}. Best is trial 100 with value: 0.3474903474903475.
    [CPU] Loading roman-empire...
    DEBUG 3.1: Dataset init start
    DEBUG 3.2: prepare_data start roman-empire
    ----Data statistics------'
    Name: roman-empire
    #Nodes 22662
    #Edges 32927
    #Classes 18
    #Ave_degree 2.91
    ----Split statistics------'
    #Train samples 1133 (5.0 % of nodes)
    #Val samples 3399 (15.0 % of nodes)
    #Test samples 18130 (remaining)
    ----label noise information:------
    Instance dependent noise
    #Actual noise rate 0.40
    [cuda:1] LNPCC waiting for GPU slot...
    [cuda:1] Slot acquired (waited 0.0s). Starting GCN...
    FINAL_RESULT: {'acc': {'train': 0.22506619593998234, 'valid': 0.18122977346278318, 'test': 0.24936569222283508}, 'wall_s': 83.35, 'cpu_s': 77.66, 'gpu_s': 5.64, 'wait_s': 0.0}
    [Time] wall=83.3s | cpu=77.7s | gpu=5.6s
    C:\Users\fbrev\Documents\Acadêmico\Simulações\Python\NoisyGL\predictor\Base_Predictor.py:114: UserWarning: expandable_segments not supported on this platform (Triggered internally at ..\c10/cuda/CUDAAllocatorConfig.h:28.)
    self.edge_index = self._cpu_edge_index.to(self.device)
    C:\Users\fbrev\Documents\Acadêmico\Simulações\Python\NoisyGL\predictor\Base_Predictor.py:144: UserWarning: Sparse CSR tensor support is in beta state. If you miss a functionality in the sparse tensor support, please submit a feature request to https://github.com/pytorch/pytorch/issues. (Triggered internally at ..\aten\src\ATen\SparseCsrTensorImpl.cpp:55.)
    self.adj_csr = self.adj.to_sparse_csr().to(self.device)
