[I 2026-05-08 04:09:41,798] Trial 47 finished with value: 0.483 and parameters: {'lr': 0.01, 'weight_decay': 0.0, 'n_hidden': 256, 'n_layer': 2, 'dropout': 0.7124058010419964, 'knn_mode': 'd', 'k': 14, 'dexp': 1.9929960924969774, 'p_grd': 0.17124731879849436, 'unc_rem': 0.6462197116311947, 'unc_rel': 0.006224967819973115}. Best is trial 33 with value: 0.647.
    [CPU] Loading cora...
    DEBUG 3.1: Dataset init start
    DEBUG 3.2: prepare_data start cora
    ----Data statistics------'
    Name: cora
    #Nodes 2708
    #Edges 5278
    #Classes 7
    #Ave_degree 3.90
    ----Split statistics------'
    #Train samples 140 (default)
    #Val samples 500 (default)
    #Test samples 1000 (default)
    ----label noise information:------
    Instance dependent noise
    #Actual noise rate 0.51
    [cuda:0] LNPCC waiting for GPU slot...
    [cuda:0] Slot acquired (waited 6.8s). Starting GCN...
    FINAL_RESULT: {'acc': {'train': 0.7857142857142857, 'valid': 0.354, 'test': 0.584}, 'wall_s': 14.09, 'cpu_s': 12.52, 'gpu_s': 1.55, 'wait_s': 6.79}
    [Time] wall=14.1s | cpu=12.5s | gpu=1.6s
    C:\Users\fbrev\Documents\Acadêmico\Simulações\Python\NoisyGL\predictor\Base_Predictor.py:114: UserWarning: expandable_segments not supported on this platform (Triggered internally at ..\c10/cuda/CUDAAllocatorConfig.h:28.)
    self.edge_index = self._cpu_edge_index.to(self.device)
    C:\Users\fbrev\Documents\Acadêmico\Simulações\Python\NoisyGL\predictor\Base_Predictor.py:144: UserWarning: Sparse CSR tensor support is in beta state. If you miss a functionality in the sparse tensor support, please submit a feature request to https://github.com/pytorch/pytorch/issues. (Triggered internally at ..\aten\src\ATen\SparseCsrTensorImpl.cpp:55.)
    self.adj_csr = self.adj.to_sparse_csr().to(self.device)
[I 2026-05-08 04:10:07,786] Trial 48 finished with value: 0.584 and parameters: {'lr': 0.01, 'weight_decay': 0.01, 'n_hidden': 64, 'n_layer': 2, 'dropout': 0.749584315675936, 'knn_mode': 'd', 'k': 25, 'dexp': 2.2894519183172295, 'p_grd': 0.5094841966278063, 'unc_rem': 0.7643019564913399, 'unc_rel': 0.7648391325786652}. Best is trial 33 with value: 0.647.
    [CPU] Loading cora...
    DEBUG 3.1: Dataset init start
    DEBUG 3.2: prepare_data start cora
    ----Data statistics------'
    Name: cora
    #Nodes 2708
    #Edges 5278
    #Classes 7
    #Ave_degree 3.90
    ----Split statistics------'
    #Train samples 140 (default)
    #Val samples 500 (default)
    #Test samples 1000 (default)
    ----label noise information:------
    Instance dependent noise
    #Actual noise rate 0.51
    [cuda:0] LNPCC waiting for GPU slot...
    [cuda:0] Slot acquired (waited 12.9s). Starting GCN...
    FINAL_RESULT: {'acc': {'train': 0.9626865671641791, 'valid': 0.216, 'test': 0.276}, 'wall_s': 9.16, 'cpu_s': 7.49, 'gpu_s': 1.66, 'wait_s': 12.86}
    [Time] wall=9.2s | cpu=7.5s | gpu=1.7s
    C:\Users\fbrev\Documents\Acadêmico\Simulações\Python\NoisyGL\predictor\Base_Predictor.py:114: UserWarning: expandable_segments not supported on this platform (Triggered internally at ..\c10/cuda/CUDAAllocatorConfig.h:28.)
    self.edge_index = self._cpu_edge_index.to(self.device)
    C:\Users\fbrev\Documents\Acadêmico\Simulações\Python\NoisyGL\predictor\Base_Predictor.py:144: UserWarning: Sparse CSR tensor support is in beta state. If you miss a functionality in the sparse tensor support, please submit a feature request to https://github.com/pytorch/pytorch/issues. (Triggered internally at ..\aten\src\ATen\SparseCsrTensorImpl.cpp:55.)
    self.adj_csr = self.adj.to_sparse_csr().to(self.device)
