[I 2026-05-07 20:09:47,575] Trial 23 finished with value: 0.208 and parameters: {'lr': 0.01, 'weight_decay': 0.05, 'n_hidden': 64, 'n_layer': 2, 'dropout': 0.5832079476417736, 'knn_mode': 'd', 'k': 31, 'dexp': 5.77743740787442, 'p_grd': 0.12944928768813618, 'unc_rem': 0.20054645181986033, 'unc_rel': 0.1333428593010182}. Best is trial 22 with value: 0.468.
    [CPU] Loading citeseer...
    DEBUG 3.1: Dataset init start
    DEBUG 3.2: prepare_data start citeseer
    ----Data statistics------'
    Name: citeseer
    #Nodes 3327
    #Edges 4552
    #Classes 6
    #Ave_degree 2.74
    ----Split statistics------'
    #Train samples 120 (default)
    #Val samples 500 (default)
    #Test samples 1000 (default)
    ----label noise information:------
    Instance dependent noise
    #Actual noise rate 0.51
    [cuda:1] LNPCC waiting for GPU slot...
    [cuda:1] Slot acquired (waited 153.9s). Starting GCN...
    FINAL_RESULT: {'acc': {'train': 0.8583333333333333, 'valid': 0.32, 'test': 0.407}, 'wall_s': 10.09, 'cpu_s': 8.34, 'gpu_s': 1.71, 'wait_s': 153.94}
    [Time] wall=10.1s | cpu=8.3s | gpu=1.7s
    C:\Users\fbrev\Documents\Acadêmico\Simulações\Python\NoisyGL\predictor\Base_Predictor.py:114: UserWarning: expandable_segments not supported on this platform (Triggered internally at ..\c10/cuda/CUDAAllocatorConfig.h:28.)
    self.edge_index = self._cpu_edge_index.to(self.device)
    C:\Users\fbrev\Documents\Acadêmico\Simulações\Python\NoisyGL\predictor\Base_Predictor.py:144: UserWarning: Sparse CSR tensor support is in beta state. If you miss a functionality in the sparse tensor support, please submit a feature request to https://github.com/pytorch/pytorch/issues. (Triggered internally at ..\aten\src\ATen\SparseCsrTensorImpl.cpp:55.)
    self.adj_csr = self.adj.to_sparse_csr().to(self.device)
[I 2026-05-07 20:12:37,287] Trial 24 finished with value: 0.407 and parameters: {'lr': 0.01, 'weight_decay': 0.05, 'n_hidden': 64, 'n_layer': 2, 'dropout': 0.4295937224860822, 'knn_mode': 's', 'k': 45, 'dexp': 5.372823652372881, 'p_grd': 0.5769025909539, 'unc_rem': 0.44351110034837754, 'unc_rel': 0.005343598451369988}. Best is trial 22 with value: 0.468.
    [CPU] Loading citeseer...
    DEBUG 3.1: Dataset init start
    DEBUG 3.2: prepare_data start citeseer
    ----Data statistics------'
    Name: citeseer
    #Nodes 3327
    #Edges 4552
    #Classes 6
    #Ave_degree 2.74
    ----Split statistics------'
    #Train samples 120 (default)
    #Val samples 500 (default)
    #Test samples 1000 (default)
    ----label noise information:------
    Instance dependent noise
    #Actual noise rate 0.51
    [cuda:1] LNPCC waiting for GPU slot...
    [cuda:1] Slot acquired (waited 152.9s). Starting GCN...
    FINAL_RESULT: {'acc': {'train': 0.8583333333333333, 'valid': 0.32, 'test': 0.405}, 'wall_s': 10.01, 'cpu_s': 8.2, 'gpu_s': 1.75, 'wait_s': 152.87}
    [Time] wall=10.0s | cpu=8.2s | gpu=1.7s
    C:\Users\fbrev\Documents\Acadêmico\Simulações\Python\NoisyGL\predictor\Base_Predictor.py:114: UserWarning: expandable_segments not supported on this platform (Triggered internally at ..\c10/cuda/CUDAAllocatorConfig.h:28.)
    self.edge_index = self._cpu_edge_index.to(self.device)
    C:\Users\fbrev\Documents\Acadêmico\Simulações\Python\NoisyGL\predictor\Base_Predictor.py:144: UserWarning: Sparse CSR tensor support is in beta state. If you miss a functionality in the sparse tensor support, please submit a feature request to https://github.com/pytorch/pytorch/issues. (Triggered internally at ..\aten\src\ATen\SparseCsrTensorImpl.cpp:55.)
    self.adj_csr = self.adj.to_sparse_csr().to(self.device)
[I 2026-05-07 20:15:25,745] Trial 25 finished with value: 0.405 and parameters: {'lr': 0.01, 'weight_decay': 0.05, 'n_hidden': 64, 'n_layer': 2, 'dropout': 0.43680693426057743, 'knn_mode': 's', 'k': 44, 'dexp': 5.1657813303852915, 'p_grd': 0.5790313717289786, 'unc_rem': 0.45474221567022705, 'unc_rel': 0.13981649176499533}. Best is trial 22 with value: 0.468.
    [CPU] Loading citeseer...
    DEBUG 3.1: Dataset init start
    DEBUG 3.2: prepare_data start citeseer
    ----Data statistics------'
    Name: citeseer
    #Nodes 3327
    #Edges 4552
    #Classes 6
    #Ave_degree 2.74
    ----Split statistics------'
    #Train samples 120 (default)
    #Val samples 500 (default)
    #Test samples 1000 (default)
    ----label noise information:------
    Instance dependent noise
    #Actual noise rate 0.51
    [cuda:1] LNPCC waiting for GPU slot...
    [cuda:1] Slot acquired (waited 133.7s). Starting GCN...
    FINAL_RESULT: {'acc': {'train': 0.8571428571428571, 'valid': 0.334, 'test': 0.431}, 'wall_s': 25.85, 'cpu_s': 23.68, 'gpu_s': 2.13, 'wait_s': 133.67}
    [Time] wall=25.8s | cpu=23.7s | gpu=2.1s
    C:\Users\fbrev\Documents\Acadêmico\Simulações\Python\NoisyGL\predictor\Base_Predictor.py:114: UserWarning: expandable_segments not supported on this platform (Triggered internally at ..\c10/cuda/CUDAAllocatorConfig.h:28.)
    self.edge_index = self._cpu_edge_index.to(self.device)
    C:\Users\fbrev\Documents\Acadêmico\Simulações\Python\NoisyGL\predictor\Base_Predictor.py:144: UserWarning: Sparse CSR tensor support is in beta state. If you miss a functionality in the sparse tensor support, please submit a feature request to https://github.com/pytorch/pytorch/issues. (Triggered internally at ..\aten\src\ATen\SparseCsrTensorImpl.cpp:55.)
    self.adj_csr = self.adj.to_sparse_csr().to(self.device)
[I 2026-05-07 20:18:10,780] Trial 26 finished with value: 0.431 and parameters: {'lr': 0.01, 'weight_decay': 0.05, 'n_hidden': 64, 'n_layer': 2, 'dropout': 0.27051259583948684, 'knn_mode': 'd', 'k': 36, 'dexp': 1.0801564412151947, 'p_grd': 0.789074465678545, 'unc_rem': 0.584248750829552, 'unc_rel': 0.006491149740319574}. Best is trial 22 with value: 0.468.
    [CPU] Loading citeseer...
    DEBUG 3.1: Dataset init start
    DEBUG 3.2: prepare_data start citeseer
    ----Data statistics------'
    Name: citeseer
    #Nodes 3327
    #Edges 4552
    #Classes 6
    #Ave_degree 2.74
    ----Split statistics------'
    #Train samples 120 (default)
    #Val samples 500 (default)
    #Test samples 1000 (default)
    ----label noise information:------
    Instance dependent noise
    #Actual noise rate 0.51
    [cuda:1] LNPCC waiting for GPU slot...
    [cuda:1] Slot acquired (waited 132.9s). Starting GCN...
    FINAL_RESULT: {'acc': {'train': 1.0, 'valid': 0.176, 'test': 0.086}, 'wall_s': 28.8, 'cpu_s': 27.13, 'gpu_s': 1.62, 'wait_s': 132.89}
    [Time] wall=28.8s | cpu=27.1s | gpu=1.6s
    C:\Users\fbrev\Documents\Acadêmico\Simulações\Python\NoisyGL\predictor\Base_Predictor.py:114: UserWarning: expandable_segments not supported on this platform (Triggered internally at ..\c10/cuda/CUDAAllocatorConfig.h:28.)
    self.edge_index = self._cpu_edge_index.to(self.device)
    C:\Users\fbrev\Documents\Acadêmico\Simulações\Python\NoisyGL\predictor\Base_Predictor.py:144: UserWarning: Sparse CSR tensor support is in beta state. If you miss a functionality in the sparse tensor support, please submit a feature request to https://github.com/pytorch/pytorch/issues. (Triggered internally at ..\aten\src\ATen\SparseCsrTensorImpl.cpp:55.)
    self.adj_csr = self.adj.to_sparse_csr().to(self.device)
[I 2026-05-07 20:20:58,476] Trial 27 finished with value: 0.086 and parameters: {'lr': 0.01, 'weight_decay': 0.05, 'n_hidden': 32, 'n_layer': 2, 'dropout': 0.05907667270930206, 'knn_mode': 'd', 'k': 35, 'dexp': 0.43591345738351217, 'p_grd': 0.9981464621326035, 'unc_rem': 0.575742009476004, 'unc_rel': 0.8780048823365397}. Best is trial 22 with value: 0.468.
    [CPU] Loading citeseer...
    DEBUG 3.1: Dataset init start
    DEBUG 3.2: prepare_data start citeseer
    ----Data statistics------'
    Name: citeseer
    #Nodes 3327
    #Edges 4552
    #Classes 6
    #Ave_degree 2.74
    ----Split statistics------'
    #Train samples 120 (default)
    #Val samples 500 (default)
    #Test samples 1000 (default)
    ----label noise information:------
    Instance dependent noise
    #Actual noise rate 0.51
    [cuda:1] LNPCC waiting for GPU slot...
    [cuda:1] Slot acquired (waited 135.7s). Starting GCN...
    FINAL_RESULT: {'acc': {'train': 0.9333333333333333, 'valid': 0.334, 'test': 0.423}, 'wall_s': 26.46, 'cpu_s': 24.52, 'gpu_s': 1.89, 'wait_s': 135.7}
    [Time] wall=26.5s | cpu=24.5s | gpu=1.9s
    C:\Users\fbrev\Documents\Acadêmico\Simulações\Python\NoisyGL\predictor\Base_Predictor.py:114: UserWarning: expandable_segments not supported on this platform (Triggered internally at ..\c10/cuda/CUDAAllocatorConfig.h:28.)
    self.edge_index = self._cpu_edge_index.to(self.device)
    C:\Users\fbrev\Documents\Acadêmico\Simulações\Python\NoisyGL\predictor\Base_Predictor.py:144: UserWarning: Sparse CSR tensor support is in beta state. If you miss a functionality in the sparse tensor support, please submit a feature request to https://github.com/pytorch/pytorch/issues. (Triggered internally at ..\aten\src\ATen\SparseCsrTensorImpl.cpp:55.)
    self.adj_csr = self.adj.to_sparse_csr().to(self.device)
[I 2026-05-07 20:23:46,183] Trial 28 finished with value: 0.423 and parameters: {'lr': 0.01, 'weight_decay': 0.05, 'n_hidden': 64, 'n_layer': 2, 'dropout': 0.3055165142350094, 'knn_mode': 'd', 'k': 28, 'dexp': 1.4169093091079485, 'p_grd': 0.8080823188884857, 'unc_rem': 0.368208149728334, 'unc_rel': 0.44994113592713464}. Best is trial 22 with value: 0.468.
    [CPU] Loading citeseer...
    DEBUG 3.1: Dataset init start
    DEBUG 3.2: prepare_data start citeseer
    ----Data statistics------'
    Name: citeseer
    #Nodes 3327
    #Edges 4552
    #Classes 6
    #Ave_degree 2.74
    ----Split statistics------'
    #Train samples 120 (default)
    #Val samples 500 (default)
    #Test samples 1000 (default)
    ----label noise information:------
    Instance dependent noise
    #Actual noise rate 0.51
    [cuda:1] LNPCC waiting for GPU slot...
    [cuda:1] Slot acquired (waited 139.2s). Starting GCN...
    FINAL_RESULT: {'acc': {'train': 0.9083333333333333, 'valid': 0.336, 'test': 0.437}, 'wall_s': 23.54, 'cpu_s': 21.64, 'gpu_s': 1.85, 'wait_s': 139.16}
    [Time] wall=23.5s | cpu=21.6s | gpu=1.8s
    C:\Users\fbrev\Documents\Acadêmico\Simulações\Python\NoisyGL\predictor\Base_Predictor.py:114: UserWarning: expandable_segments not supported on this platform (Triggered internally at ..\c10/cuda/CUDAAllocatorConfig.h:28.)
    self.edge_index = self._cpu_edge_index.to(self.device)
    C:\Users\fbrev\Documents\Acadêmico\Simulações\Python\NoisyGL\predictor\Base_Predictor.py:144: UserWarning: Sparse CSR tensor support is in beta state. If you miss a functionality in the sparse tensor support, please submit a feature request to https://github.com/pytorch/pytorch/issues. (Triggered internally at ..\aten\src\ATen\SparseCsrTensorImpl.cpp:55.)
    self.adj_csr = self.adj.to_sparse_csr().to(self.device)
[I 2026-05-07 20:26:34,885] Trial 29 finished with value: 0.437 and parameters: {'lr': 0.01, 'weight_decay': 0.05, 'n_hidden': 64, 'n_layer': 2, 'dropout': 0.2514740224996508, 'knn_mode': 'd', 'k': 36, 'dexp': 1.7125853498399608, 'p_grd': 0.727329694098209, 'unc_rem': 0.6359467730560091, 'unc_rel': 0.07837963778168365}. Best is trial 22 with value: 0.468.
    [CPU] Loading citeseer...
    DEBUG 3.1: Dataset init start
    DEBUG 3.2: prepare_data start citeseer
    ----Data statistics------'
    Name: citeseer
    #Nodes 3327
    #Edges 4552
    #Classes 6
    #Ave_degree 2.74
    ----Split statistics------'
    #Train samples 120 (default)
    #Val samples 500 (default)
    #Test samples 1000 (default)
    ----label noise information:------
    Instance dependent noise
    #Actual noise rate 0.51
    [cuda:1] LNPCC waiting for GPU slot...
    [cuda:1] Slot acquired (waited 139.6s). Starting GCN...
    FINAL_RESULT: {'acc': {'train': 0.9, 'valid': 0.334, 'test': 0.415}, 'wall_s': 25.2, 'cpu_s': 23.36, 'gpu_s': 1.8, 'wait_s': 139.64}
    [Time] wall=25.2s | cpu=23.4s | gpu=1.8s
    C:\Users\fbrev\Documents\Acadêmico\Simulações\Python\NoisyGL\predictor\Base_Predictor.py:114: UserWarning: expandable_segments not supported on this platform (Triggered internally at ..\c10/cuda/CUDAAllocatorConfig.h:28.)
    self.edge_index = self._cpu_edge_index.to(self.device)
    C:\Users\fbrev\Documents\Acadêmico\Simulações\Python\NoisyGL\predictor\Base_Predictor.py:144: UserWarning: Sparse CSR tensor support is in beta state. If you miss a functionality in the sparse tensor support, please submit a feature request to https://github.com/pytorch/pytorch/issues. (Triggered internally at ..\aten\src\ATen\SparseCsrTensorImpl.cpp:55.)
    self.adj_csr = self.adj.to_sparse_csr().to(self.device)
[I 2026-05-07 20:29:25,371] Trial 30 finished with value: 0.415 and parameters: {'lr': 0.1, 'weight_decay': 0.05, 'n_hidden': 64, 'n_layer': 2, 'dropout': 0.26634291981603964, 'knn_mode': 'd', 'k': 35, 'dexp': 1.522712990906833, 'p_grd': 0.7017251427261545, 'unc_rem': 0.48725005027805957, 'unc_rel': 0.08561401160777311}. Best is trial 22 with value: 0.468.
    [CPU] Loading citeseer...
    DEBUG 3.1: Dataset init start
    DEBUG 3.2: prepare_data start citeseer
    ----Data statistics------'
    Name: citeseer
    #Nodes 3327
    #Edges 4552
    #Classes 6
    #Ave_degree 2.74
    ----Split statistics------'
    #Train samples 120 (default)
    #Val samples 500 (default)
    #Test samples 1000 (default)
    ----label noise information:------
    Instance dependent noise
    #Actual noise rate 0.51
    [cuda:1] LNPCC waiting for GPU slot...
    [cuda:1] Slot acquired (waited 139.7s). Starting GCN...
    FINAL_RESULT: {'acc': {'train': 0.8547008547008547, 'valid': 0.322, 'test': 0.42}, 'wall_s': 23.93, 'cpu_s': 22.05, 'gpu_s': 1.84, 'wait_s': 139.68}
    [Time] wall=23.9s | cpu=22.1s | gpu=1.8s
    C:\Users\fbrev\Documents\Acadêmico\Simulações\Python\NoisyGL\predictor\Base_Predictor.py:114: UserWarning: expandable_segments not supported on this platform (Triggered internally at ..\c10/cuda/CUDAAllocatorConfig.h:28.)
    self.edge_index = self._cpu_edge_index.to(self.device)
    C:\Users\fbrev\Documents\Acadêmico\Simulações\Python\NoisyGL\predictor\Base_Predictor.py:144: UserWarning: Sparse CSR tensor support is in beta state. If you miss a functionality in the sparse tensor support, please submit a feature request to https://github.com/pytorch/pytorch/issues. (Triggered internally at ..\aten\src\ATen\SparseCsrTensorImpl.cpp:55.)
    self.adj_csr = self.adj.to_sparse_csr().to(self.device)
[I 2026-05-07 20:32:14,616] Trial 31 finished with value: 0.42 and parameters: {'lr': 0.01, 'weight_decay': 0.05, 'n_hidden': 64, 'n_layer': 2, 'dropout': 0.38378339320958105, 'knn_mode': 'd', 'k': 39, 'dexp': 1.484857053322893, 'p_grd': 0.8519595701503911, 'unc_rem': 0.5383548883293087, 'unc_rel': 0.17365449850571002}. Best is trial 22 with value: 0.468.
    [CPU] Loading citeseer...
    DEBUG 3.1: Dataset init start
    DEBUG 3.2: prepare_data start citeseer
    ----Data statistics------'
    Name: citeseer
    #Nodes 3327
    #Edges 4552
    #Classes 6
    #Ave_degree 2.74
    ----Split statistics------'
    #Train samples 120 (default)
    #Val samples 500 (default)
    #Test samples 1000 (default)
    ----label noise information:------
    Instance dependent noise
    #Actual noise rate 0.51
    [cuda:1] LNPCC waiting for GPU slot...
    [cuda:1] Slot acquired (waited 138.7s). Starting GCN...
    FINAL_RESULT: {'acc': {'train': 0.8916666666666667, 'valid': 0.338, 'test': 0.434}, 'wall_s': 23.7, 'cpu_s': 21.78, 'gpu_s': 1.86, 'wait_s': 138.69}
    [Time] wall=23.7s | cpu=21.8s | gpu=1.9s
    C:\Users\fbrev\Documents\Acadêmico\Simulações\Python\NoisyGL\predictor\Base_Predictor.py:114: UserWarning: expandable_segments not supported on this platform (Triggered internally at ..\c10/cuda/CUDAAllocatorConfig.h:28.)
    self.edge_index = self._cpu_edge_index.to(self.device)
    C:\Users\fbrev\Documents\Acadêmico\Simulações\Python\NoisyGL\predictor\Base_Predictor.py:144: UserWarning: Sparse CSR tensor support is in beta state. If you miss a functionality in the sparse tensor support, please submit a feature request to https://github.com/pytorch/pytorch/issues. (Triggered internally at ..\aten\src\ATen\SparseCsrTensorImpl.cpp:55.)
    self.adj_csr = self.adj.to_sparse_csr().to(self.device)
[I 2026-05-07 20:35:02,692] Trial 32 finished with value: 0.434 and parameters: {'lr': 0.01, 'weight_decay': 0.05, 'n_hidden': 64, 'n_layer': 2, 'dropout': 0.13136498379963468, 'knn_mode': 'd', 'k': 35, 'dexp': 2.5272430087697106, 'p_grd': 0.7438863126086637, 'unc_rem': 0.6516628958804744, 'unc_rel': 0.060824045830358775}. Best is trial 22 with value: 0.468.
    [CPU] Loading citeseer...
    DEBUG 3.1: Dataset init start
    DEBUG 3.2: prepare_data start citeseer
    ----Data statistics------'
    Name: citeseer
    #Nodes 3327
    #Edges 4552
    #Classes 6
    #Ave_degree 2.74
    ----Split statistics------'
    #Train samples 120 (default)
    #Val samples 500 (default)
    #Test samples 1000 (default)
    ----label noise information:------
    Instance dependent noise
    #Actual noise rate 0.51
    [cuda:1] LNPCC waiting for GPU slot...
    [cuda:1] Slot acquired (waited 136.9s). Starting GCN...
    FINAL_RESULT: {'acc': {'train': 0.9083333333333333, 'valid': 0.332, 'test': 0.432}, 'wall_s': 22.64, 'cpu_s': 20.88, 'gpu_s': 1.73, 'wait_s': 136.87}
    [Time] wall=22.6s | cpu=20.9s | gpu=1.7s
    C:\Users\fbrev\Documents\Acadêmico\Simulações\Python\NoisyGL\predictor\Base_Predictor.py:114: UserWarning: expandable_segments not supported on this platform (Triggered internally at ..\c10/cuda/CUDAAllocatorConfig.h:28.)
    self.edge_index = self._cpu_edge_index.to(self.device)
    C:\Users\fbrev\Documents\Acadêmico\Simulações\Python\NoisyGL\predictor\Base_Predictor.py:144: UserWarning: Sparse CSR tensor support is in beta state. If you miss a functionality in the sparse tensor support, please submit a feature request to https://github.com/pytorch/pytorch/issues. (Triggered internally at ..\aten\src\ATen\SparseCsrTensorImpl.cpp:55.)
    self.adj_csr = self.adj.to_sparse_csr().to(self.device)
[I 2026-05-07 20:37:48,003] Trial 33 finished with value: 0.432 and parameters: {'lr': 0.01, 'weight_decay': 0.05, 'n_hidden': 64, 'n_layer': 2, 'dropout': 0.2470784884629366, 'knn_mode': 'd', 'k': 35, 'dexp': 2.2961727879513067, 'p_grd': 0.75426829836049, 'unc_rem': 0.6438071671611157, 'unc_rel': 0.057244623949626976}. Best is trial 22 with value: 0.468.
    [CPU] Loading citeseer...
    DEBUG 3.1: Dataset init start
    DEBUG 3.2: prepare_data start citeseer
    ----Data statistics------'
    Name: citeseer
    #Nodes 3327
    #Edges 4552
    #Classes 6
    #Ave_degree 2.74
    ----Split statistics------'
    #Train samples 120 (default)
    #Val samples 500 (default)
    #Test samples 1000 (default)
    ----label noise information:------
    Instance dependent noise
    #Actual noise rate 0.51
    [cuda:1] LNPCC waiting for GPU slot...
    [cuda:1] Slot acquired (waited 141.6s). Starting GCN...
    FINAL_RESULT: {'acc': {'train': 0.9, 'valid': 0.334, 'test': 0.433}, 'wall_s': 22.4, 'cpu_s': 20.74, 'gpu_s': 1.62, 'wait_s': 141.6}
    [Time] wall=22.4s | cpu=20.7s | gpu=1.6s
    C:\Users\fbrev\Documents\Acadêmico\Simulações\Python\NoisyGL\predictor\Base_Predictor.py:114: UserWarning: expandable_segments not supported on this platform (Triggered internally at ..\c10/cuda/CUDAAllocatorConfig.h:28.)
    self.edge_index = self._cpu_edge_index.to(self.device)
    C:\Users\fbrev\Documents\Acadêmico\Simulações\Python\NoisyGL\predictor\Base_Predictor.py:144: UserWarning: Sparse CSR tensor support is in beta state. If you miss a functionality in the sparse tensor support, please submit a feature request to https://github.com/pytorch/pytorch/issues. (Triggered internally at ..\aten\src\ATen\SparseCsrTensorImpl.cpp:55.)
    self.adj_csr = self.adj.to_sparse_csr().to(self.device)
[I 2026-05-07 20:40:37,647] Trial 34 finished with value: 0.433 and parameters: {'lr': 0.01, 'weight_decay': 0.05, 'n_hidden': 64, 'n_layer': 2, 'dropout': 0.1675395166505878, 'knn_mode': 'd', 'k': 28, 'dexp': 2.3991134643196195, 'p_grd': 0.7336039930138306, 'unc_rem': 0.6477971945284517, 'unc_rel': 0.07462109083345422}. Best is trial 22 with value: 0.468.
    [CPU] Loading citeseer...
    DEBUG 3.1: Dataset init start
    DEBUG 3.2: prepare_data start citeseer
    ----Data statistics------'
    Name: citeseer
    #Nodes 3327
    #Edges 4552
    #Classes 6
    #Ave_degree 2.74
    ----Split statistics------'
    #Train samples 120 (default)
    #Val samples 500 (default)
    #Test samples 1000 (default)
    ----label noise information:------
    Instance dependent noise
    #Actual noise rate 0.51
    [cuda:1] LNPCC waiting for GPU slot...
    [cuda:1] Slot acquired (waited 124.4s). Starting GCN...
    FINAL_RESULT: {'acc': {'train': 0.8916666666666667, 'valid': 0.34, 'test': 0.432}, 'wall_s': 38.35, 'cpu_s': 36.55, 'gpu_s': 1.75, 'wait_s': 124.42}
    [Time] wall=38.3s | cpu=36.6s | gpu=1.8s
    C:\Users\fbrev\Documents\Acadêmico\Simulações\Python\NoisyGL\predictor\Base_Predictor.py:114: UserWarning: expandable_segments not supported on this platform (Triggered internally at ..\c10/cuda/CUDAAllocatorConfig.h:28.)
    self.edge_index = self._cpu_edge_index.to(self.device)
    C:\Users\fbrev\Documents\Acadêmico\Simulações\Python\NoisyGL\predictor\Base_Predictor.py:144: UserWarning: Sparse CSR tensor support is in beta state. If you miss a functionality in the sparse tensor support, please submit a feature request to https://github.com/pytorch/pytorch/issues. (Triggered internally at ..\aten\src\ATen\SparseCsrTensorImpl.cpp:55.)
    self.adj_csr = self.adj.to_sparse_csr().to(self.device)
