[I 2026-05-08 03:35:36,949] Trial 47 finished with value: 0.762 and parameters: {'lr': 0.005, 'weight_decay': 0.0, 'n_hidden': 256, 'n_layer': 3, 'dropout': 0.7956719817345239, 'knn_mode': 's', 'k': 25, 'dexp': 7.257570650704746, 'p_grd': 0.09301345235865266, 'unc_rem': 0.32728035911036657, 'unc_rel': 0.4927036987354511}. Best is trial 42 with value: 0.768.
    [CPU] Loading cora...
    DEBUG 3.1: Dataset init start
    DEBUG 3.2: prepare_data start cora
    ----Data statistics------'
    Name: cora
    #Nodes 2708
    #Edges 5278
    #Classes 7
    #Ave_degree 3.90
    ----Split statistics------'
    #Train samples 140 (default)
    #Val samples 500 (default)
    #Test samples 1000 (default)
    ----label noise information:------
    Instance dependent noise
    #Actual noise rate 0.41
    [cuda:1] LNPCC waiting for GPU slot...
    [cuda:1] Slot acquired (waited 1.1s). Starting GCN...
[I 2026-05-08 03:35:55,248] Trial 48 finished with value: 0.0 and parameters: {'lr': 0.1, 'weight_decay': 0.0, 'n_hidden': 64, 'n_layer': 3, 'dropout': 0.6794280854748869, 'knn_mode': 's', 'k': 25, 'dexp': 7.813784278938013, 'p_grd': 0.05945268665072112, 'unc_rem': 0.3416967115520145, 'unc_rel': 0.33593868562717355}. Best is trial 42 with value: 0.768.
    [CPU] Loading cora...
    DEBUG 3.1: Dataset init start
    DEBUG 3.2: prepare_data start cora
    ----Data statistics------'
    Name: cora
    #Nodes 2708
    #Edges 5278
    #Classes 7
    #Ave_degree 3.90
    ----Split statistics------'
    #Train samples 140 (default)
    #Val samples 500 (default)
    #Test samples 1000 (default)
    ----label noise information:------
    Instance dependent noise
    #Actual noise rate 0.41
    [cuda:1] LNPCC waiting for GPU slot...
    [cuda:1] Slot acquired (waited 0.6s). Starting GCN...
    FINAL_RESULT: {'acc': {'train': 0.7925925925925926, 'valid': 0.492, 'test': 0.746}, 'wall_s': 9.17, 'cpu_s': 6.63, 'gpu_s': 2.51, 'wait_s': 0.61}
    [Time] wall=9.2s | cpu=6.6s | gpu=2.5s
    C:\Users\fbrev\Documents\Acadêmico\Simulações\Python\NoisyGL\predictor\Base_Predictor.py:114: UserWarning: expandable_segments not supported on this platform (Triggered internally at ..\c10/cuda/CUDAAllocatorConfig.h:28.)
    self.edge_index = self._cpu_edge_index.to(self.device)
    C:\Users\fbrev\Documents\Acadêmico\Simulações\Python\NoisyGL\predictor\Base_Predictor.py:144: UserWarning: Sparse CSR tensor support is in beta state. If you miss a functionality in the sparse tensor support, please submit a feature request to https://github.com/pytorch/pytorch/issues. (Triggered internally at ..\aten\src\ATen\SparseCsrTensorImpl.cpp:55.)
    self.adj_csr = self.adj.to_sparse_csr().to(self.device)
