[I 2026-04-30 16:13:56,055] Trial 27 finished with value: 0.432 and parameters: {'lr': 0.1, 'weight_decay': 0.001, 'n_hidden': 64, 'n_layer': 2, 'dropout': 0.3477010725373437, 'knn_mode': 's', 'k': 34, 'dexp': 2.6434213576819574, 'p_grd': 0.5954013499003865, 'unc_rem': 0.004192031464778991, 'unc_rel': 0.4011802439897173}. Best is trial 12 with value: 0.823.
    [CPU] Loading amazoncom...
    DEBUG 3.1: Dataset init start
    DEBUG 3.2: prepare_data start amazoncom
    ----Data statistics------'
    Name: amazoncom
    #Nodes 13752
    #Edges 245861
    #Classes 10
    #Ave_degree 35.76
    ----Split statistics------'
    #Train samples 200 (20 nodes per class)
    #Val samples 500 (specified)
    #Test samples 1000 (specified)
    ----label noise information:------
    Instance dependent noise
    #Actual noise rate 0.30
    [cuda:0] LNPCC waiting for GPU slot...
    [cuda:0] Slot acquired (waited 0.0s). Starting GCN...
    FINAL_RESULT: {'acc': {'train': 0.675, 'valid': 0.592, 'test': 0.803}, 'wall_s': 52.64, 'cpu_s': 49.55, 'gpu_s': 3.02, 'wait_s': 0.0}
    [Time] wall=52.6s | cpu=49.5s | gpu=3.0s
    C:\Users\fbrev\Documents\Acadêmico\Simulações\Python\NoisyGL\predictor\Base_Predictor.py:144: UserWarning: Sparse CSR tensor support is in beta state. If you miss a functionality in the sparse tensor support, please submit a feature request to https://github.com/pytorch/pytorch/issues. (Triggered internally at ..\aten\src\ATen\SparseCsrTensorImpl.cpp:55.)
    self.adj_csr = self.adj.to_sparse_csr().to(self.device)
[I 2026-04-30 16:14:55,148] Trial 28 finished with value: 0.803 and parameters: {'lr': 0.005, 'weight_decay': 0.001, 'n_hidden': 32, 'n_layer': 2, 'dropout': 0.5612706632528407, 'knn_mode': 'd', 'k': 42, 'dexp': 7.464984300235204, 'p_grd': 0.8663538032009601, 'unc_rem': 0.08183214528312605, 'unc_rel': 0.15447065806389193}. Best is trial 12 with value: 0.823.
    [CPU] Loading amazoncom...
    DEBUG 3.1: Dataset init start
    DEBUG 3.2: prepare_data start amazoncom
    ----Data statistics------'
    Name: amazoncom
    #Nodes 13752
    #Edges 245861
    #Classes 10
    #Ave_degree 35.76
    ----Split statistics------'
    #Train samples 200 (20 nodes per class)
    #Val samples 500 (specified)
    #Test samples 1000 (specified)
    ----label noise information:------
    Instance dependent noise
    #Actual noise rate 0.30
    [cuda:0] LNPCC waiting for GPU slot...
    [cuda:0] Slot acquired (waited 3.0s). Starting GCN...
    FINAL_RESULT: {'acc': {'train': 0.6649746192893401, 'valid': 0.59, 'test': 0.798}, 'wall_s': 50.27, 'cpu_s': 42.42, 'gpu_s': 7.75, 'wait_s': 2.95}
    [Time] wall=50.3s | cpu=42.4s | gpu=7.8s
    C:\Users\fbrev\Documents\Acadêmico\Simulações\Python\NoisyGL\predictor\Base_Predictor.py:144: UserWarning: Sparse CSR tensor support is in beta state. If you miss a functionality in the sparse tensor support, please submit a feature request to https://github.com/pytorch/pytorch/issues. (Triggered internally at ..\aten\src\ATen\SparseCsrTensorImpl.cpp:55.)
    self.adj_csr = self.adj.to_sparse_csr().to(self.device)
[I 2026-04-30 16:15:54,924] Trial 29 finished with value: 0.798 and parameters: {'lr': 0.01, 'weight_decay': 0.0001, 'n_hidden': 256, 'n_layer': 2, 'dropout': 0.43141871687146055, 'knn_mode': 's', 'k': 28, 'dexp': 6.448901515689685, 'p_grd': 0.7291615201893162, 'unc_rem': 0.39049910721583386, 'unc_rel': 0.5917142049877765}. Best is trial 12 with value: 0.823.
    [CPU] Loading amazoncom...
    DEBUG 3.1: Dataset init start
    DEBUG 3.2: prepare_data start amazoncom
    ----Data statistics------'
    Name: amazoncom
    #Nodes 13752
    #Edges 245861
    #Classes 10
    #Ave_degree 35.76
    ----Split statistics------'
    #Train samples 200 (20 nodes per class)
    #Val samples 500 (specified)
    #Test samples 1000 (specified)
    ----label noise information:------
    Instance dependent noise
    #Actual noise rate 0.30
    [cuda:0] LNPCC waiting for GPU slot...
    [cuda:0] Slot acquired (waited 0.9s). Starting GCN...
    FINAL_RESULT: {'acc': {'train': 0.6868686868686869, 'valid': 0.576, 'test': 0.78}, 'wall_s': 41.82, 'cpu_s': 38.46, 'gpu_s': 3.28, 'wait_s': 0.92}
    [Time] wall=41.8s | cpu=38.5s | gpu=3.3s
    C:\Users\fbrev\Documents\Acadêmico\Simulações\Python\NoisyGL\predictor\Base_Predictor.py:144: UserWarning: Sparse CSR tensor support is in beta state. If you miss a functionality in the sparse tensor support, please submit a feature request to https://github.com/pytorch/pytorch/issues. (Triggered internally at ..\aten\src\ATen\SparseCsrTensorImpl.cpp:55.)
    self.adj_csr = self.adj.to_sparse_csr().to(self.device)
[I 2026-04-30 16:16:43,598] Trial 30 finished with value: 0.78 and parameters: {'lr': 0.01, 'weight_decay': 0.0001, 'n_hidden': 64, 'n_layer': 2, 'dropout': 0.2793983642618424, 'knn_mode': 's', 'k': 47, 'dexp': 3.8880995772382128, 'p_grd': 0.6634340698424441, 'unc_rem': 0.47192177125249674, 'unc_rel': 0.4936826130500949}. Best is trial 12 with value: 0.823.
    [CPU] Loading amazoncom...
    DEBUG 3.1: Dataset init start
    DEBUG 3.2: prepare_data start amazoncom
    ----Data statistics------'
    Name: amazoncom
    #Nodes 13752
    #Edges 245861
    #Classes 10
    #Ave_degree 35.76
    ----Split statistics------'
    #Train samples 200 (20 nodes per class)
    #Val samples 500 (specified)
    #Test samples 1000 (specified)
    ----label noise information:------
    Instance dependent noise
    #Actual noise rate 0.30
    [cuda:0] LNPCC waiting for GPU slot...
    [cuda:0] Slot acquired (waited 0.0s). Starting GCN...
[I 2026-04-30 16:18:07,581] Trial 31 finished with value: 0.0 and parameters: {'lr': 0.01, 'weight_decay': 0.001, 'n_hidden': 32, 'n_layer': 2, 'dropout': 0.4560731208755722, 'knn_mode': 'd', 'k': 39, 'dexp': 1.055248587989484, 'p_grd': 0.7978936890161401, 'unc_rem': 0.04614416589014153, 'unc_rel': 0.0076113472043152774}. Best is trial 12 with value: 0.823.
    [CPU] Loading amazoncom...
    DEBUG 3.1: Dataset init start
    DEBUG 3.2: prepare_data start amazoncom
    ----Data statistics------'
    Name: amazoncom
    #Nodes 13752
    #Edges 245861
    #Classes 10
    #Ave_degree 35.76
    ----Split statistics------'
    #Train samples 200 (20 nodes per class)
    #Val samples 500 (specified)
    #Test samples 1000 (specified)
    ----label noise information:------
    Instance dependent noise
    #Actual noise rate 0.30
    [cuda:0] LNPCC waiting for GPU slot...
    [cuda:0] Slot acquired (waited 0.3s). Starting GCN...
    FINAL_RESULT: {'acc': {'train': 0.6934673366834171, 'valid': 0.586, 'test': 0.815}, 'wall_s': 73.43, 'cpu_s': 70.83, 'gpu_s': 2.52, 'wait_s': 0.31}
    [Time] wall=73.4s | cpu=70.8s | gpu=2.5s
    C:\Users\fbrev\Documents\Acadêmico\Simulações\Python\NoisyGL\predictor\Base_Predictor.py:144: UserWarning: Sparse CSR tensor support is in beta state. If you miss a functionality in the sparse tensor support, please submit a feature request to https://github.com/pytorch/pytorch/issues. (Triggered internally at ..\aten\src\ATen\SparseCsrTensorImpl.cpp:55.)
    self.adj_csr = self.adj.to_sparse_csr().to(self.device)
[I 2026-04-30 16:19:27,521] Trial 32 finished with value: 0.815 and parameters: {'lr': 0.01, 'weight_decay': 0.001, 'n_hidden': 32, 'n_layer': 2, 'dropout': 0.4297119279616927, 'knn_mode': 'd', 'k': 32, 'dexp': 1.9580253375474561, 'p_grd': 0.7897876049794978, 'unc_rem': 0.18218934637237907, 'unc_rel': 0.4265929342537358}. Best is trial 12 with value: 0.823.
    [CPU] Loading amazoncom...
    DEBUG 3.1: Dataset init start
    DEBUG 3.2: prepare_data start amazoncom
    ----Data statistics------'
    Name: amazoncom
    #Nodes 13752
    #Edges 245861
    #Classes 10
    #Ave_degree 35.76
    ----Split statistics------'
    #Train samples 200 (20 nodes per class)
    #Val samples 500 (specified)
    #Test samples 1000 (specified)
    ----label noise information:------
    Instance dependent noise
    #Actual noise rate 0.30
    [cuda:0] LNPCC waiting for GPU slot...
    [cuda:0] Slot acquired (waited 0.0s). Starting GCN...
    FINAL_RESULT: {'acc': {'train': 0.67, 'valid': 0.584, 'test': 0.803}, 'wall_s': 94.79, 'cpu_s': 92.21, 'gpu_s': 2.5, 'wait_s': 0.0}
    [Time] wall=94.8s | cpu=92.2s | gpu=2.5s
    C:\Users\fbrev\Documents\Acadêmico\Simulações\Python\NoisyGL\predictor\Base_Predictor.py:144: UserWarning: Sparse CSR tensor support is in beta state. If you miss a functionality in the sparse tensor support, please submit a feature request to https://github.com/pytorch/pytorch/issues. (Triggered internally at ..\aten\src\ATen\SparseCsrTensorImpl.cpp:55.)
    self.adj_csr = self.adj.to_sparse_csr().to(self.device)
[I 2026-04-30 16:21:08,446] Trial 33 finished with value: 0.803 and parameters: {'lr': 0.01, 'weight_decay': 0.001, 'n_hidden': 32, 'n_layer': 2, 'dropout': 0.3858703720065157, 'knn_mode': 'd', 'k': 32, 'dexp': 3.4801406129811525, 'p_grd': 0.9074531266666535, 'unc_rem': 0.2080031475992404, 'unc_rel': 0.3139021474364889}. Best is trial 12 with value: 0.823.
    [CPU] Loading amazoncom...
    DEBUG 3.1: Dataset init start
    DEBUG 3.2: prepare_data start amazoncom
    ----Data statistics------'
    Name: amazoncom
    #Nodes 13752
    #Edges 245861
    #Classes 10
    #Ave_degree 35.76
    ----Split statistics------'
    #Train samples 200 (20 nodes per class)
    #Val samples 500 (specified)
    #Test samples 1000 (specified)
    ----label noise information:------
    Instance dependent noise
    #Actual noise rate 0.30
    [cuda:0] LNPCC waiting for GPU slot...
    [cuda:0] Slot acquired (waited 4.9s). Starting GCN...
    FINAL_RESULT: {'acc': {'train': 0.7055837563451777, 'valid': 0.552, 'test': 0.739}, 'wall_s': 70.5, 'cpu_s': 67.89, 'gpu_s': 2.52, 'wait_s': 4.88}
    [Time] wall=70.5s | cpu=67.9s | gpu=2.5s
    C:\Users\fbrev\Documents\Acadêmico\Simulações\Python\NoisyGL\predictor\Base_Predictor.py:144: UserWarning: Sparse CSR tensor support is in beta state. If you miss a functionality in the sparse tensor support, please submit a feature request to https://github.com/pytorch/pytorch/issues. (Triggered internally at ..\aten\src\ATen\SparseCsrTensorImpl.cpp:55.)
    self.adj_csr = self.adj.to_sparse_csr().to(self.device)
[I 2026-04-30 16:22:29,991] Trial 34 finished with value: 0.739 and parameters: {'lr': 0.01, 'weight_decay': 0.05, 'n_hidden': 32, 'n_layer': 2, 'dropout': 0.31678674859457334, 'knn_mode': 'd', 'k': 41, 'dexp': 2.0743922755420217, 'p_grd': 0.5371445906578576, 'unc_rem': 0.21270495345300447, 'unc_rel': 0.42634643382512116}. Best is trial 12 with value: 0.823.
    [CPU] Loading amazoncom...
    DEBUG 3.1: Dataset init start
    DEBUG 3.2: prepare_data start amazoncom
    ----Data statistics------'
    Name: amazoncom
    #Nodes 13752
    #Edges 245861
    #Classes 10
    #Ave_degree 35.76
    ----Split statistics------'
    #Train samples 200 (20 nodes per class)
    #Val samples 500 (specified)
    #Test samples 1000 (specified)
    ----label noise information:------
    Instance dependent noise
    #Actual noise rate 0.30
    [cuda:0] LNPCC waiting for GPU slot...
    [cuda:0] Slot acquired (waited 0.3s). Starting GCN...
    FINAL_RESULT: {'acc': {'train': 0.6934673366834171, 'valid': 0.582, 'test': 0.795}, 'wall_s': 76.45, 'cpu_s': 73.84, 'gpu_s': 2.55, 'wait_s': 0.31}
    [Time] wall=76.5s | cpu=73.8s | gpu=2.5s
    C:\Users\fbrev\Documents\Acadêmico\Simulações\Python\NoisyGL\predictor\Base_Predictor.py:144: UserWarning: Sparse CSR tensor support is in beta state. If you miss a functionality in the sparse tensor support, please submit a feature request to https://github.com/pytorch/pytorch/issues. (Triggered internally at ..\aten\src\ATen\SparseCsrTensorImpl.cpp:55.)
    self.adj_csr = self.adj.to_sparse_csr().to(self.device)
[I 2026-04-30 16:23:52,838] Trial 35 finished with value: 0.795 and parameters: {'lr': 0.005, 'weight_decay': 0.001, 'n_hidden': 32, 'n_layer': 2, 'dropout': 0.22561623112727372, 'knn_mode': 'd', 'k': 27, 'dexp': 1.7642029203470313, 'p_grd': 0.9420286158540409, 'unc_rem': 0.0739139641029018, 'unc_rel': 0.3490605290843818}. Best is trial 12 with value: 0.823.
    [CPU] Loading amazoncom...
    DEBUG 3.1: Dataset init start
    DEBUG 3.2: prepare_data start amazoncom
    ----Data statistics------'
    Name: amazoncom
    #Nodes 13752
    #Edges 245861
    #Classes 10
    #Ave_degree 35.76
    ----Split statistics------'
    #Train samples 200 (20 nodes per class)
    #Val samples 500 (specified)
    #Test samples 1000 (specified)
    ----label noise information:------
    Instance dependent noise
    #Actual noise rate 0.30
    [cuda:0] LNPCC waiting for GPU slot...
    [cuda:0] Slot acquired (waited 0.0s). Starting GCN...
    FINAL_RESULT: {'acc': {'train': 0.7386934673366834, 'valid': 0.582, 'test': 0.813}, 'wall_s': 54.15, 'cpu_s': 46.11, 'gpu_s': 7.97, 'wait_s': 0.0}
    [Time] wall=54.2s | cpu=46.1s | gpu=8.0s
    C:\Users\fbrev\Documents\Acadêmico\Simulações\Python\NoisyGL\predictor\Base_Predictor.py:144: UserWarning: Sparse CSR tensor support is in beta state. If you miss a functionality in the sparse tensor support, please submit a feature request to https://github.com/pytorch/pytorch/issues. (Triggered internally at ..\aten\src\ATen\SparseCsrTensorImpl.cpp:55.)
    self.adj_csr = self.adj.to_sparse_csr().to(self.device)
[I 2026-04-30 16:24:53,057] Trial 36 finished with value: 0.813 and parameters: {'lr': 0.01, 'weight_decay': 0.01, 'n_hidden': 256, 'n_layer': 2, 'dropout': 0.5630833951046917, 'knn_mode': 'd', 'k': 27, 'dexp': 3.2910625793759514, 'p_grd': 0.4360960751590931, 'unc_rem': 0.1560477811152589, 'unc_rel': 0.2406452467979666}. Best is trial 12 with value: 0.823.
    [CPU] Loading amazoncom...
    DEBUG 3.1: Dataset init start
    DEBUG 3.2: prepare_data start amazoncom
    ----Data statistics------'
    Name: amazoncom
    #Nodes 13752
    #Edges 245861
    #Classes 10
    #Ave_degree 35.76
    ----Split statistics------'
    #Train samples 200 (20 nodes per class)
    #Val samples 500 (specified)
    #Test samples 1000 (specified)
    ----label noise information:------
    Instance dependent noise
    #Actual noise rate 0.30
    [cuda:0] LNPCC waiting for GPU slot...
    [cuda:0] Slot acquired (waited 0.0s). Starting GCN...
    FINAL_RESULT: {'acc': {'train': 0.69, 'valid': 0.584, 'test': 0.826}, 'wall_s': 55.5, 'cpu_s': 47.64, 'gpu_s': 7.77, 'wait_s': 0.0}
    [Time] wall=55.5s | cpu=47.6s | gpu=7.8s
    C:\Users\fbrev\Documents\Acadêmico\Simulações\Python\NoisyGL\predictor\Base_Predictor.py:144: UserWarning: Sparse CSR tensor support is in beta state. If you miss a functionality in the sparse tensor support, please submit a feature request to https://github.com/pytorch/pytorch/issues. (Triggered internally at ..\aten\src\ATen\SparseCsrTensorImpl.cpp:55.)
    self.adj_csr = self.adj.to_sparse_csr().to(self.device)
[I 2026-04-30 16:25:55,288] Trial 37 finished with value: 0.826 and parameters: {'lr': 0.01, 'weight_decay': 0.01, 'n_hidden': 256, 'n_layer': 2, 'dropout': 0.5519955396922651, 'knn_mode': 'd', 'k': 18, 'dexp': 4.2274690161373725, 'p_grd': 0.45789272757855043, 'unc_rem': 0.3363645030512473, 'unc_rel': 0.22140495485449857}. Best is trial 37 with value: 0.826.
    [CPU] Loading amazoncom...
    DEBUG 3.1: Dataset init start
    DEBUG 3.2: prepare_data start amazoncom
    ----Data statistics------'
    Name: amazoncom
    #Nodes 13752
    #Edges 245861
    #Classes 10
    #Ave_degree 35.76
    ----Split statistics------'
    #Train samples 200 (20 nodes per class)
    #Val samples 500 (specified)
    #Test samples 1000 (specified)
    ----label noise information:------
    Instance dependent noise
    #Actual noise rate 0.30
    [cuda:0] LNPCC waiting for GPU slot...
    [cuda:0] Slot acquired (waited 7.6s). Starting GCN...
    FINAL_RESULT: {'acc': {'train': 0.8554216867469879, 'valid': 0.534, 'test': 0.747}, 'wall_s': 51.67, 'cpu_s': 43.86, 'gpu_s': 7.74, 'wait_s': 7.55}
    [Time] wall=51.7s | cpu=43.9s | gpu=7.7s
    C:\Users\fbrev\Documents\Acadêmico\Simulações\Python\NoisyGL\predictor\Base_Predictor.py:144: UserWarning: Sparse CSR tensor support is in beta state. If you miss a functionality in the sparse tensor support, please submit a feature request to https://github.com/pytorch/pytorch/issues. (Triggered internally at ..\aten\src\ATen\SparseCsrTensorImpl.cpp:55.)
    self.adj_csr = self.adj.to_sparse_csr().to(self.device)
[I 2026-04-30 16:27:00,547] Trial 38 finished with value: 0.747 and parameters: {'lr': 0.01, 'weight_decay': 0.01, 'n_hidden': 256, 'n_layer': 2, 'dropout': 0.5647519821279081, 'knn_mode': 'd', 'k': 16, 'dexp': 0.2086198023935084, 'p_grd': 0.4836388635128923, 'unc_rem': 0.330188895138544, 'unc_rel': 0.08851375507921122}. Best is trial 37 with value: 0.826.
    [CPU] Loading amazoncom...
    DEBUG 3.1: Dataset init start
    DEBUG 3.2: prepare_data start amazoncom
    ----Data statistics------'
    Name: amazoncom
    #Nodes 13752
    #Edges 245861
    #Classes 10
    #Ave_degree 35.76
    ----Split statistics------'
    #Train samples 200 (20 nodes per class)
    #Val samples 500 (specified)
    #Test samples 1000 (specified)
    ----label noise information:------
    Instance dependent noise
    #Actual noise rate 0.30
    [cuda:0] LNPCC waiting for GPU slot...
    [cuda:0] Slot acquired (waited 0.0s). Starting GCN...
    FINAL_RESULT: {'acc': {'train': 0.685, 'valid': 0.59, 'test': 0.81}, 'wall_s': 55.28, 'cpu_s': 47.54, 'gpu_s': 7.65, 'wait_s': 0.0}
    [Time] wall=55.3s | cpu=47.5s | gpu=7.7s
    C:\Users\fbrev\Documents\Acadêmico\Simulações\Python\NoisyGL\predictor\Base_Predictor.py:144: UserWarning: Sparse CSR tensor support is in beta state. If you miss a functionality in the sparse tensor support, please submit a feature request to https://github.com/pytorch/pytorch/issues. (Triggered internally at ..\aten\src\ATen\SparseCsrTensorImpl.cpp:55.)
    self.adj_csr = self.adj.to_sparse_csr().to(self.device)
[I 2026-04-30 16:28:01,835] Trial 39 finished with value: 0.81 and parameters: {'lr': 0.01, 'weight_decay': 0.01, 'n_hidden': 256, 'n_layer': 2, 'dropout': 0.12749694404814177, 'knn_mode': 'd', 'k': 12, 'dexp': 4.409291791882954, 'p_grd': 0.6596155485977171, 'unc_rem': 0.5273071484973071, 'unc_rel': 0.28398130463349625}. Best is trial 37 with value: 0.826.
    [CPU] Loading amazoncom...
    DEBUG 3.1: Dataset init start
    DEBUG 3.2: prepare_data start amazoncom
    ----Data statistics------'
    Name: amazoncom
    #Nodes 13752
    #Edges 245861
    #Classes 10
    #Ave_degree 35.76
    ----Split statistics------'
    #Train samples 200 (20 nodes per class)
    #Val samples 500 (specified)
    #Test samples 1000 (specified)
    ----label noise information:------
    Instance dependent noise
    #Actual noise rate 0.30
    [cuda:0] LNPCC waiting for GPU slot...
    [cuda:0] Slot acquired (waited 0.0s). Starting GCN...
    FINAL_RESULT: {'acc': {'train': 0.6449704142011834, 'valid': 0.556, 'test': 0.783}, 'wall_s': 68.44, 'cpu_s': 63.54, 'gpu_s': 4.83, 'wait_s': 0.0}
    [Time] wall=68.4s | cpu=63.5s | gpu=4.8s
    C:\Users\fbrev\Documents\Acadêmico\Simulações\Python\NoisyGL\predictor\Base_Predictor.py:144: UserWarning: Sparse CSR tensor support is in beta state. If you miss a functionality in the sparse tensor support, please submit a feature request to https://github.com/pytorch/pytorch/issues. (Triggered internally at ..\aten\src\ATen\SparseCsrTensorImpl.cpp:55.)
    self.adj_csr = self.adj.to_sparse_csr().to(self.device)
[I 2026-04-30 16:29:16,499] Trial 40 finished with value: 0.783 and parameters: {'lr': 0.01, 'weight_decay': 0.01, 'n_hidden': 128, 'n_layer': 2, 'dropout': 0.6602302042462708, 'knn_mode': 'd', 'k': 12, 'dexp': 3.070722922270079, 'p_grd': 0.998186637830538, 'unc_rem': 0.35294441741104066, 'unc_rel': 0.22381217063105824}. Best is trial 37 with value: 0.826.
    [CPU] Loading amazoncom...
    DEBUG 3.1: Dataset init start
    DEBUG 3.2: prepare_data start amazoncom
    ----Data statistics------'
    Name: amazoncom
    #Nodes 13752
    #Edges 245861
    #Classes 10
    #Ave_degree 35.76
    ----Split statistics------'
    #Train samples 200 (20 nodes per class)
    #Val samples 500 (specified)
    #Test samples 1000 (specified)
    ----label noise information:------
    Instance dependent noise
    #Actual noise rate 0.30
    [cuda:0] LNPCC waiting for GPU slot...
    [cuda:0] Slot acquired (waited 15.3s). Starting GCN...
    FINAL_RESULT: {'acc': {'train': 0.8142076502732241, 'valid': 0.568, 'test': 0.795}, 'wall_s': 60.6, 'cpu_s': 52.55, 'gpu_s': 7.97, 'wait_s': 15.25}
    [Time] wall=60.6s | cpu=52.5s | gpu=8.0s
    C:\Users\fbrev\Documents\Acadêmico\Simulações\Python\NoisyGL\predictor\Base_Predictor.py:144: UserWarning: Sparse CSR tensor support is in beta state. If you miss a functionality in the sparse tensor support, please submit a feature request to https://github.com/pytorch/pytorch/issues. (Triggered internally at ..\aten\src\ATen\SparseCsrTensorImpl.cpp:55.)
    self.adj_csr = self.adj.to_sparse_csr().to(self.device)
