[I 2026-05-03 20:26:02,441] Trial 10 finished with value: 0.6608946608946609 and parameters: {'lr': 0.001, 'weight_decay': 0.0001, 'n_hidden': 64, 'n_layer': 3, 'dropout': 0.5010717996397103, 'knn_mode': 's', 'k': 31, 'dexp': 8.74303814548153, 'p_grd': 0.20174722186804284, 'unc_rem': 0.7503910147836939, 'unc_rel': 0.2507056072345083}. Best is trial 7 with value: 0.716931216931217.
    [CPU] Loading blogcatalog...
    DEBUG 3.1: Dataset init start
    DEBUG 3.2: prepare_data start blogcatalog
    ----Data statistics------'
    Name: blogcatalog
    #Nodes 5196
    #Edges 171743
    #Classes 6
    #Ave_degree 66.11
    ----Split statistics------'
    #Train samples 259 (5.0 % of nodes)
    #Val samples 779 (15.0 % of nodes)
    #Test samples 4158 (remaining)
    ----label noise information:------
    Instance dependent noise
    #Actual noise rate 0.20
    [cuda:1] LNPCC waiting for GPU slot...
    [cuda:1] Slot acquired (waited 181.8s). Starting GCN...
    FINAL_RESULT: {'acc': {'train': 0.7722007722007722, 'valid': 0.5802310654685494, 'test': 0.7017797017797017}, 'wall_s': 30.69, 'cpu_s': 27.55, 'gpu_s': 3.05, 'wait_s': 181.8}
    [Time] wall=30.7s | cpu=27.6s | gpu=3.1s
    C:\Users\fbrev\Documents\Acadêmico\Simulações\Python\NoisyGL\predictor\Base_Predictor.py:114: UserWarning: expandable_segments not supported on this platform (Triggered internally at ..\c10/cuda/CUDAAllocatorConfig.h:28.)
    self.edge_index = self._cpu_edge_index.to(self.device)
    C:\Users\fbrev\Documents\Acadêmico\Simulações\Python\NoisyGL\predictor\Base_Predictor.py:144: UserWarning: Sparse CSR tensor support is in beta state. If you miss a functionality in the sparse tensor support, please submit a feature request to https://github.com/pytorch/pytorch/issues. (Triggered internally at ..\aten\src\ATen\SparseCsrTensorImpl.cpp:55.)
    self.adj_csr = self.adj.to_sparse_csr().to(self.device)
[I 2026-05-03 20:29:39,600] Trial 11 finished with value: 0.7017797017797017 and parameters: {'lr': 0.001, 'weight_decay': 0.0, 'n_hidden': 64, 'n_layer': 2, 'dropout': 0.494065325686168, 'knn_mode': 'd', 'k': 42, 'dexp': 7.078978279425739, 'p_grd': 0.8093090331933839, 'unc_rem': 0.8175565956907389, 'unc_rel': 0.2011242639539048}. Best is trial 7 with value: 0.716931216931217.
    [CPU] Loading blogcatalog...
    DEBUG 3.1: Dataset init start
    DEBUG 3.2: prepare_data start blogcatalog
    ----Data statistics------'
    Name: blogcatalog
    #Nodes 5196
    #Edges 171743
    #Classes 6
    #Ave_degree 66.11
    ----Split statistics------'
    #Train samples 259 (5.0 % of nodes)
    #Val samples 779 (15.0 % of nodes)
    #Test samples 4158 (remaining)
    ----label noise information:------
    Instance dependent noise
    #Actual noise rate 0.20
    [cuda:1] LNPCC waiting for GPU slot...
    [cuda:1] Slot acquired (waited 53.1s). Starting GCN...
    FINAL_RESULT: {'acc': {'train': 0.9766536964980544, 'valid': 0.5853658536585366, 'test': 0.6777296777296777}, 'wall_s': 16.04, 'cpu_s': 13.61, 'gpu_s': 2.36, 'wait_s': 53.06}
    [Time] wall=16.0s | cpu=13.6s | gpu=2.4s
    C:\Users\fbrev\Documents\Acadêmico\Simulações\Python\NoisyGL\predictor\Base_Predictor.py:114: UserWarning: expandable_segments not supported on this platform (Triggered internally at ..\c10/cuda/CUDAAllocatorConfig.h:28.)
    self.edge_index = self._cpu_edge_index.to(self.device)
    C:\Users\fbrev\Documents\Acadêmico\Simulações\Python\NoisyGL\predictor\Base_Predictor.py:144: UserWarning: Sparse CSR tensor support is in beta state. If you miss a functionality in the sparse tensor support, please submit a feature request to https://github.com/pytorch/pytorch/issues. (Triggered internally at ..\aten\src\ATen\SparseCsrTensorImpl.cpp:55.)
    self.adj_csr = self.adj.to_sparse_csr().to(self.device)
[I 2026-05-03 20:30:53,306] Trial 12 finished with value: 0.6777296777296777 and parameters: {'lr': 0.01, 'weight_decay': 0.0001, 'n_hidden': 32, 'n_layer': 2, 'dropout': 0.2122528355439598, 'knn_mode': 's', 'k': 5, 'dexp': 3.415604653326267, 'p_grd': 0.48484851513627636, 'unc_rem': 0.1202648011676728, 'unc_rel': 0.22897144679153436}. Best is trial 7 with value: 0.716931216931217.
    [CPU] Loading blogcatalog...
    DEBUG 3.1: Dataset init start
    DEBUG 3.2: prepare_data start blogcatalog
    ----Data statistics------'
    Name: blogcatalog
    #Nodes 5196
    #Edges 171743
    #Classes 6
    #Ave_degree 66.11
    ----Split statistics------'
    #Train samples 259 (5.0 % of nodes)
    #Val samples 779 (15.0 % of nodes)
    #Test samples 4158 (remaining)
    ----label noise information:------
    Instance dependent noise
    #Actual noise rate 0.20
    [cuda:1] LNPCC waiting for GPU slot...
    [cuda:1] Slot acquired (waited 45.5s). Starting GCN...
    FINAL_RESULT: {'acc': {'train': 0.3333333333333333, 'valid': 0.39152759948652116, 'test': 0.4304954304954305}, 'wall_s': 24.08, 'cpu_s': 21.02, 'gpu_s': 2.95, 'wait_s': 45.46}
    [Time] wall=24.1s | cpu=21.0s | gpu=2.9s
    C:\Users\fbrev\Documents\Acadêmico\Simulações\Python\NoisyGL\predictor\Base_Predictor.py:114: UserWarning: expandable_segments not supported on this platform (Triggered internally at ..\c10/cuda/CUDAAllocatorConfig.h:28.)
    self.edge_index = self._cpu_edge_index.to(self.device)
    C:\Users\fbrev\Documents\Acadêmico\Simulações\Python\NoisyGL\predictor\Base_Predictor.py:144: UserWarning: Sparse CSR tensor support is in beta state. If you miss a functionality in the sparse tensor support, please submit a feature request to https://github.com/pytorch/pytorch/issues. (Triggered internally at ..\aten\src\ATen\SparseCsrTensorImpl.cpp:55.)
    self.adj_csr = self.adj.to_sparse_csr().to(self.device)
[I 2026-05-03 20:32:07,622] Trial 13 finished with value: 0.4304954304954305 and parameters: {'lr': 0.1, 'weight_decay': 0.01, 'n_hidden': 64, 'n_layer': 2, 'dropout': 0.14062982503090202, 'knn_mode': 'd', 'k': 21, 'dexp': 2.6455009303886685, 'p_grd': 0.3877144538888293, 'unc_rem': 0.27211818926590114, 'unc_rel': 0.3678477824590435}. Best is trial 7 with value: 0.716931216931217.
    [CPU] Loading blogcatalog...
    DEBUG 3.1: Dataset init start
    DEBUG 3.2: prepare_data start blogcatalog
    ----Data statistics------'
    Name: blogcatalog
    #Nodes 5196
    #Edges 171743
    #Classes 6
    #Ave_degree 66.11
    ----Split statistics------'
    #Train samples 259 (5.0 % of nodes)
    #Val samples 779 (15.0 % of nodes)
    #Test samples 4158 (remaining)
    ----label noise information:------
    Instance dependent noise
    #Actual noise rate 0.20
    [cuda:1] LNPCC waiting for GPU slot...
    [cuda:1] Slot acquired (waited 39.2s). Starting GCN...
    FINAL_RESULT: {'acc': {'train': 0.2625482625482625, 'valid': 0.34146341463414637, 'test': 0.3641173641173641}, 'wall_s': 30.17, 'cpu_s': 27.58, 'gpu_s': 2.51, 'wait_s': 39.22}
    [Time] wall=30.2s | cpu=27.6s | gpu=2.5s
    C:\Users\fbrev\Documents\Acadêmico\Simulações\Python\NoisyGL\predictor\Base_Predictor.py:114: UserWarning: expandable_segments not supported on this platform (Triggered internally at ..\c10/cuda/CUDAAllocatorConfig.h:28.)
    self.edge_index = self._cpu_edge_index.to(self.device)
    C:\Users\fbrev\Documents\Acadêmico\Simulações\Python\NoisyGL\predictor\Base_Predictor.py:144: UserWarning: Sparse CSR tensor support is in beta state. If you miss a functionality in the sparse tensor support, please submit a feature request to https://github.com/pytorch/pytorch/issues. (Triggered internally at ..\aten\src\ATen\SparseCsrTensorImpl.cpp:55.)
    self.adj_csr = self.adj.to_sparse_csr().to(self.device)
[I 2026-05-03 20:33:21,879] Trial 14 finished with value: 0.3641173641173641 and parameters: {'lr': 0.01, 'weight_decay': 0.05, 'n_hidden': 32, 'n_layer': 2, 'dropout': 0.015305141591561267, 'knn_mode': 'd', 'k': 45, 'dexp': 9.576049467794768, 'p_grd': 0.8745776507907911, 'unc_rem': 0.70189039053817, 'unc_rel': 0.9645685504300959}. Best is trial 7 with value: 0.716931216931217.
    [CPU] Loading blogcatalog...
    DEBUG 3.1: Dataset init start
    DEBUG 3.2: prepare_data start blogcatalog
    ----Data statistics------'
    Name: blogcatalog
    #Nodes 5196
    #Edges 171743
    #Classes 6
    #Ave_degree 66.11
    ----Split statistics------'
    #Train samples 259 (5.0 % of nodes)
    #Val samples 779 (15.0 % of nodes)
    #Test samples 4158 (remaining)
    ----label noise information:------
    Instance dependent noise
    #Actual noise rate 0.20
    [cuda:1] LNPCC waiting for GPU slot...
    [cuda:1] Slot acquired (waited 52.0s). Starting GCN...
    FINAL_RESULT: {'acc': {'train': 0.669260700389105, 'valid': 0.558408215661104, 'test': 0.6640211640211641}, 'wall_s': 26.04, 'cpu_s': 14.69, 'gpu_s': 11.27, 'wait_s': 52.03}
    [Time] wall=26.0s | cpu=14.7s | gpu=11.3s
    C:\Users\fbrev\Documents\Acadêmico\Simulações\Python\NoisyGL\predictor\Base_Predictor.py:114: UserWarning: expandable_segments not supported on this platform (Triggered internally at ..\c10/cuda/CUDAAllocatorConfig.h:28.)
    self.edge_index = self._cpu_edge_index.to(self.device)
    C:\Users\fbrev\Documents\Acadêmico\Simulações\Python\NoisyGL\predictor\Base_Predictor.py:144: UserWarning: Sparse CSR tensor support is in beta state. If you miss a functionality in the sparse tensor support, please submit a feature request to https://github.com/pytorch/pytorch/issues. (Triggered internally at ..\aten\src\ATen\SparseCsrTensorImpl.cpp:55.)
    self.adj_csr = self.adj.to_sparse_csr().to(self.device)
[I 2026-05-03 20:34:44,799] Trial 15 finished with value: 0.6640211640211641 and parameters: {'lr': 0.001, 'weight_decay': 0.0001, 'n_hidden': 256, 'n_layer': 3, 'dropout': 0.1413949432925266, 'knn_mode': 's', 'k': 24, 'dexp': 4.516243024639353, 'p_grd': 0.32708225210193276, 'unc_rem': 0.7231122828216123, 'unc_rel': 0.46595637793214884}. Best is trial 7 with value: 0.716931216931217.
    [CPU] Loading blogcatalog...
    DEBUG 3.1: Dataset init start
    DEBUG 3.2: prepare_data start blogcatalog
    ----Data statistics------'
    Name: blogcatalog
    #Nodes 5196
    #Edges 171743
    #Classes 6
    #Ave_degree 66.11
    ----Split statistics------'
    #Train samples 259 (5.0 % of nodes)
    #Val samples 779 (15.0 % of nodes)
    #Test samples 4158 (remaining)
    ----label noise information:------
    Instance dependent noise
    #Actual noise rate 0.20
    [cuda:1] LNPCC waiting for GPU slot...
    [cuda:1] Slot acquired (waited 193.7s). Starting GCN...
    FINAL_RESULT: {'acc': {'train': 0.26640926640926643, 'valid': 0.25802310654685495, 'test': 0.2691197691197691}, 'wall_s': 26.73, 'cpu_s': 15.58, 'gpu_s': 11.06, 'wait_s': 193.73}
    [Time] wall=26.7s | cpu=15.6s | gpu=11.1s
    C:\Users\fbrev\Documents\Acadêmico\Simulações\Python\NoisyGL\predictor\Base_Predictor.py:114: UserWarning: expandable_segments not supported on this platform (Triggered internally at ..\c10/cuda/CUDAAllocatorConfig.h:28.)
    self.edge_index = self._cpu_edge_index.to(self.device)
    C:\Users\fbrev\Documents\Acadêmico\Simulações\Python\NoisyGL\predictor\Base_Predictor.py:144: UserWarning: Sparse CSR tensor support is in beta state. If you miss a functionality in the sparse tensor support, please submit a feature request to https://github.com/pytorch/pytorch/issues. (Triggered internally at ..\aten\src\ATen\SparseCsrTensorImpl.cpp:55.)
    self.adj_csr = self.adj.to_sparse_csr().to(self.device)
[I 2026-05-03 20:38:30,087] Trial 16 finished with value: 0.2691197691197691 and parameters: {'lr': 0.1, 'weight_decay': 0.001, 'n_hidden': 256, 'n_layer': 3, 'dropout': 0.18354570559166064, 'knn_mode': 's', 'k': 9, 'dexp': 8.051723414079143, 'p_grd': 0.6333930865364665, 'unc_rem': 0.7421993538209207, 'unc_rel': 0.802445782297044}. Best is trial 7 with value: 0.716931216931217.
    [CPU] Loading blogcatalog...
    DEBUG 3.1: Dataset init start
    DEBUG 3.2: prepare_data start blogcatalog
    ----Data statistics------'
    Name: blogcatalog
    #Nodes 5196
    #Edges 171743
    #Classes 6
    #Ave_degree 66.11
    ----Split statistics------'
    #Train samples 259 (5.0 % of nodes)
    #Val samples 779 (15.0 % of nodes)
    #Test samples 4158 (remaining)
    ----label noise information:------
    Instance dependent noise
    #Actual noise rate 0.20
    [cuda:1] LNPCC waiting for GPU slot...
    [cuda:1] Slot acquired (waited 127.3s). Starting GCN...
    FINAL_RESULT: {'acc': {'train': 0.39768339768339767, 'valid': 0.362002567394095, 'test': 0.3763828763828764}, 'wall_s': 25.13, 'cpu_s': 13.8, 'gpu_s': 11.25, 'wait_s': 127.3}
    [Time] wall=25.1s | cpu=13.8s | gpu=11.2s
    C:\Users\fbrev\Documents\Acadêmico\Simulações\Python\NoisyGL\predictor\Base_Predictor.py:114: UserWarning: expandable_segments not supported on this platform (Triggered internally at ..\c10/cuda/CUDAAllocatorConfig.h:28.)
    self.edge_index = self._cpu_edge_index.to(self.device)
    C:\Users\fbrev\Documents\Acadêmico\Simulações\Python\NoisyGL\predictor\Base_Predictor.py:144: UserWarning: Sparse CSR tensor support is in beta state. If you miss a functionality in the sparse tensor support, please submit a feature request to https://github.com/pytorch/pytorch/issues. (Triggered internally at ..\aten\src\ATen\SparseCsrTensorImpl.cpp:55.)
    self.adj_csr = self.adj.to_sparse_csr().to(self.device)
[I 2026-05-03 20:41:07,193] Trial 17 finished with value: 0.3763828763828764 and parameters: {'lr': 0.05, 'weight_decay': 0.0, 'n_hidden': 256, 'n_layer': 3, 'dropout': 0.3641807986019758, 'knn_mode': 's', 'k': 49, 'dexp': 9.328383348297663, 'p_grd': 0.4182111015332727, 'unc_rem': 0.8642837879141492, 'unc_rel': 0.5757757652553932}. Best is trial 7 with value: 0.716931216931217.
    [CPU] Loading blogcatalog...
    DEBUG 3.1: Dataset init start
    DEBUG 3.2: prepare_data start blogcatalog
    ----Data statistics------'
    Name: blogcatalog
    #Nodes 5196
    #Edges 171743
    #Classes 6
    #Ave_degree 66.11
    ----Split statistics------'
    #Train samples 259 (5.0 % of nodes)
    #Val samples 779 (15.0 % of nodes)
    #Test samples 4158 (remaining)
    ----label noise information:------
    Instance dependent noise
    #Actual noise rate 0.20
    [cuda:1] LNPCC waiting for GPU slot...
    [cuda:1] Slot acquired (waited 415.7s). Starting GCN...
    FINAL_RESULT: {'acc': {'train': 0.5173745173745173, 'valid': 0.4839537869062901, 'test': 0.568061568061568}, 'wall_s': 18.71, 'cpu_s': 14.46, 'gpu_s': 4.18, 'wait_s': 415.74}
    [Time] wall=18.7s | cpu=14.5s | gpu=4.2s
    C:\Users\fbrev\Documents\Acadêmico\Simulações\Python\NoisyGL\predictor\Base_Predictor.py:114: UserWarning: expandable_segments not supported on this platform (Triggered internally at ..\c10/cuda/CUDAAllocatorConfig.h:28.)
    self.edge_index = self._cpu_edge_index.to(self.device)
    C:\Users\fbrev\Documents\Acadêmico\Simulações\Python\NoisyGL\predictor\Base_Predictor.py:144: UserWarning: Sparse CSR tensor support is in beta state. If you miss a functionality in the sparse tensor support, please submit a feature request to https://github.com/pytorch/pytorch/issues. (Triggered internally at ..\aten\src\ATen\SparseCsrTensorImpl.cpp:55.)
    self.adj_csr = self.adj.to_sparse_csr().to(self.device)
[I 2026-05-03 20:48:26,302] Trial 18 finished with value: 0.568061568061568 and parameters: {'lr': 0.05, 'weight_decay': 0.001, 'n_hidden': 64, 'n_layer': 3, 'dropout': 0.3219522623358499, 'knn_mode': 's', 'k': 22, 'dexp': 8.185841291407987, 'p_grd': 0.5114974534354224, 'unc_rem': 0.9861340676429743, 'unc_rel': 0.6712317219587044}. Best is trial 7 with value: 0.716931216931217.
    [CPU] Loading blogcatalog...
    DEBUG 3.1: Dataset init start
    DEBUG 3.2: prepare_data start blogcatalog
    ----Data statistics------'
    Name: blogcatalog
    #Nodes 5196
    #Edges 171743
    #Classes 6
    #Ave_degree 66.11
    ----Split statistics------'
    #Train samples 259 (5.0 % of nodes)
    #Val samples 779 (15.0 % of nodes)
    #Test samples 4158 (remaining)
    ----label noise information:------
    Instance dependent noise
    #Actual noise rate 0.20
    [cuda:1] LNPCC waiting for GPU slot...
    [cuda:1] Slot acquired (waited 63.7s). Starting GCN...
    FINAL_RESULT: {'acc': {'train': 0.7096774193548387, 'valid': 0.5622593068035944, 'test': 0.6731601731601732}, 'wall_s': 19.75, 'cpu_s': 15.36, 'gpu_s': 4.3, 'wait_s': 63.71}
    [Time] wall=19.7s | cpu=15.4s | gpu=4.3s
    C:\Users\fbrev\Documents\Acadêmico\Simulações\Python\NoisyGL\predictor\Base_Predictor.py:114: UserWarning: expandable_segments not supported on this platform (Triggered internally at ..\c10/cuda/CUDAAllocatorConfig.h:28.)
    self.edge_index = self._cpu_edge_index.to(self.device)
    C:\Users\fbrev\Documents\Acadêmico\Simulações\Python\NoisyGL\predictor\Base_Predictor.py:144: UserWarning: Sparse CSR tensor support is in beta state. If you miss a functionality in the sparse tensor support, please submit a feature request to https://github.com/pytorch/pytorch/issues. (Triggered internally at ..\aten\src\ATen\SparseCsrTensorImpl.cpp:55.)
    self.adj_csr = self.adj.to_sparse_csr().to(self.device)
[I 2026-05-03 20:49:55,118] Trial 19 finished with value: 0.6731601731601732 and parameters: {'lr': 0.001, 'weight_decay': 0.01, 'n_hidden': 128, 'n_layer': 2, 'dropout': 0.01692334190834286, 'knn_mode': 's', 'k': 12, 'dexp': 3.6597216058079924, 'p_grd': 0.22569094730999384, 'unc_rem': 0.29670909959681613, 'unc_rel': 0.3212860590798803}. Best is trial 7 with value: 0.716931216931217.
    [CPU] Loading blogcatalog...
    DEBUG 3.1: Dataset init start
    DEBUG 3.2: prepare_data start blogcatalog
    ----Data statistics------'
    Name: blogcatalog
    #Nodes 5196
    #Edges 171743
    #Classes 6
    #Ave_degree 66.11
    ----Split statistics------'
    #Train samples 259 (5.0 % of nodes)
    #Val samples 779 (15.0 % of nodes)
    #Test samples 4158 (remaining)
    ----label noise information:------
    Instance dependent noise
    #Actual noise rate 0.20
    [cuda:1] LNPCC waiting for GPU slot...
    [cuda:1] Slot acquired (waited 127.3s). Starting GCN...
    FINAL_RESULT: {'acc': {'train': 0.8290598290598291, 'valid': 0.6148908857509627, 'test': 0.7205387205387206}, 'wall_s': 18.68, 'cpu_s': 15.52, 'gpu_s': 3.07, 'wait_s': 127.29}
    [Time] wall=18.7s | cpu=15.5s | gpu=3.1s
    C:\Users\fbrev\Documents\Acadêmico\Simulações\Python\NoisyGL\predictor\Base_Predictor.py:114: UserWarning: expandable_segments not supported on this platform (Triggered internally at ..\c10/cuda/CUDAAllocatorConfig.h:28.)
    self.edge_index = self._cpu_edge_index.to(self.device)
    C:\Users\fbrev\Documents\Acadêmico\Simulações\Python\NoisyGL\predictor\Base_Predictor.py:144: UserWarning: Sparse CSR tensor support is in beta state. If you miss a functionality in the sparse tensor support, please submit a feature request to https://github.com/pytorch/pytorch/issues. (Triggered internally at ..\aten\src\ATen\SparseCsrTensorImpl.cpp:55.)
    self.adj_csr = self.adj.to_sparse_csr().to(self.device)
[I 2026-05-03 20:52:26,110] Trial 20 finished with value: 0.7205387205387206 and parameters: {'lr': 0.005, 'weight_decay': 0.001, 'n_hidden': 64, 'n_layer': 2, 'dropout': 0.6221492931231439, 'knn_mode': 'd', 'k': 32, 'dexp': 5.915453282004435, 'p_grd': 0.06257668384106913, 'unc_rem': 0.5474493293154991, 'unc_rel': 0.1102231922797901}. Best is trial 20 with value: 0.7205387205387206.
    [CPU] Loading blogcatalog...
    DEBUG 3.1: Dataset init start
    DEBUG 3.2: prepare_data start blogcatalog
    ----Data statistics------'
    Name: blogcatalog
    #Nodes 5196
    #Edges 171743
    #Classes 6
    #Ave_degree 66.11
    ----Split statistics------'
    #Train samples 259 (5.0 % of nodes)
    #Val samples 779 (15.0 % of nodes)
    #Test samples 4158 (remaining)
    ----label noise information:------
    Instance dependent noise
    #Actual noise rate 0.20
    [cuda:1] LNPCC waiting for GPU slot...
    [cuda:1] Slot acquired (waited 126.2s). Starting GCN...
    FINAL_RESULT: {'acc': {'train': 0.98, 'valid': 0.34017971758664955, 'test': 0.3965848965848966}, 'wall_s': 18.96, 'cpu_s': 15.71, 'gpu_s': 3.16, 'wait_s': 126.16}
    [Time] wall=19.0s | cpu=15.7s | gpu=3.2s
    C:\Users\fbrev\Documents\Acadêmico\Simulações\Python\NoisyGL\predictor\Base_Predictor.py:114: UserWarning: expandable_segments not supported on this platform (Triggered internally at ..\c10/cuda/CUDAAllocatorConfig.h:28.)
    self.edge_index = self._cpu_edge_index.to(self.device)
    C:\Users\fbrev\Documents\Acadêmico\Simulações\Python\NoisyGL\predictor\Base_Predictor.py:144: UserWarning: Sparse CSR tensor support is in beta state. If you miss a functionality in the sparse tensor support, please submit a feature request to https://github.com/pytorch/pytorch/issues. (Triggered internally at ..\aten\src\ATen\SparseCsrTensorImpl.cpp:55.)
    self.adj_csr = self.adj.to_sparse_csr().to(self.device)
