[I 2026-05-10 17:53:41,512] Trial 70 finished with value: 0.28334252619966904 and parameters: {'lr': 0.01, 'weight_decay': 0.01, 'n_hidden': 32, 'n_layer': 2, 'dropout': 0.5823726255680803, 'knn_mode': 'd', 'k': 35, 'dexp': 9.56709572682209, 'p_grd': 0.369538200453142, 'unc_rem': 0.3372440536423239, 'unc_rel': 0.42666447648263867}. Best is trial 46 with value: 0.3781025923883067.
    [CPU] Loading roman-empire...
    DEBUG 3.1: Dataset init start
    DEBUG 3.2: prepare_data start roman-empire
    ----Data statistics------'
    Name: roman-empire
    #Nodes 22662
    #Edges 32927
    #Classes 18
    #Ave_degree 2.91
    ----Split statistics------'
    #Train samples 1133 (5.0 % of nodes)
    #Val samples 3399 (15.0 % of nodes)
    #Test samples 18130 (remaining)
    ----label noise information:------
    Instance dependent noise
    #Actual noise rate 0.30
    [cuda:0] LNPCC waiting for GPU slot...
    [cuda:0] Slot acquired (waited 0.0s). Starting GCN...
    FINAL_RESULT: {'acc': {'train': 0.34611953612845675, 'valid': 0.2715504560164754, 'test': 0.35808052950910096}, 'wall_s': 260.9, 'cpu_s': 258.96, 'gpu_s': 1.91, 'wait_s': 0.0}
    [Time] wall=260.9s | cpu=259.0s | gpu=1.9s
    C:\Users\fbrev\Documents\Acadêmico\Simulações\Python\NoisyGL\predictor\Base_Predictor.py:114: UserWarning: expandable_segments not supported on this platform (Triggered internally at ..\c10/cuda/CUDAAllocatorConfig.h:28.)
    self.edge_index = self._cpu_edge_index.to(self.device)
    C:\Users\fbrev\Documents\Acadêmico\Simulações\Python\NoisyGL\predictor\Base_Predictor.py:144: UserWarning: Sparse CSR tensor support is in beta state. If you miss a functionality in the sparse tensor support, please submit a feature request to https://github.com/pytorch/pytorch/issues. (Triggered internally at ..\aten\src\ATen\SparseCsrTensorImpl.cpp:55.)
    self.adj_csr = self.adj.to_sparse_csr().to(self.device)
[I 2026-05-10 17:58:08,555] Trial 73 finished with value: 0.35808052950910096 and parameters: {'lr': 0.01, 'weight_decay': 0.001, 'n_hidden': 32, 'n_layer': 2, 'dropout': 0.7680051553689489, 'knn_mode': 'd', 'k': 27, 'dexp': 8.00972031719241, 'p_grd': 0.4669156552375857, 'unc_rem': 0.03406785311506444, 'unc_rel': 0.35265656842998694}. Best is trial 46 with value: 0.3781025923883067.
    [CPU] Loading roman-empire...
    DEBUG 3.1: Dataset init start
    DEBUG 3.2: prepare_data start roman-empire
    ----Data statistics------'
    Name: roman-empire
    #Nodes 22662
    #Edges 32927
    #Classes 18
    #Ave_degree 2.91
    ----Split statistics------'
    #Train samples 1133 (5.0 % of nodes)
    #Val samples 3399 (15.0 % of nodes)
    #Test samples 18130 (remaining)
    ----label noise information:------
    Instance dependent noise
    #Actual noise rate 0.30
    [cuda:0] LNPCC waiting for GPU slot...
    [cuda:0] Slot acquired (waited 0.0s). Starting GCN...
    FINAL_RESULT: {'acc': {'train': 0.33394160583941607, 'valid': 0.26802000588408353, 'test': 0.3519580805295091}, 'wall_s': 237.07, 'cpu_s': 235.16, 'gpu_s': 1.88, 'wait_s': 0.0}
    [Time] wall=237.1s | cpu=235.2s | gpu=1.9s
    C:\Users\fbrev\Documents\Acadêmico\Simulações\Python\NoisyGL\predictor\Base_Predictor.py:114: UserWarning: expandable_segments not supported on this platform (Triggered internally at ..\c10/cuda/CUDAAllocatorConfig.h:28.)
    self.edge_index = self._cpu_edge_index.to(self.device)
    C:\Users\fbrev\Documents\Acadêmico\Simulações\Python\NoisyGL\predictor\Base_Predictor.py:144: UserWarning: Sparse CSR tensor support is in beta state. If you miss a functionality in the sparse tensor support, please submit a feature request to https://github.com/pytorch/pytorch/issues. (Triggered internally at ..\aten\src\ATen\SparseCsrTensorImpl.cpp:55.)
    self.adj_csr = self.adj.to_sparse_csr().to(self.device)
[I 2026-05-10 18:02:11,697] Trial 75 finished with value: 0.3519580805295091 and parameters: {'lr': 0.01, 'weight_decay': 0.001, 'n_hidden': 32, 'n_layer': 2, 'dropout': 0.7611207531954637, 'knn_mode': 'd', 'k': 30, 'dexp': 9.145969357320483, 'p_grd': 0.47113735429544584, 'unc_rem': 0.01683817843643453, 'unc_rel': 0.48600938211485095}. Best is trial 46 with value: 0.3781025923883067.
    [CPU] Loading roman-empire...
    DEBUG 3.1: Dataset init start
    DEBUG 3.2: prepare_data start roman-empire
    ----Data statistics------'
    Name: roman-empire
    #Nodes 22662
    #Edges 32927
    #Classes 18
    #Ave_degree 2.91
    ----Split statistics------'
    #Train samples 1133 (5.0 % of nodes)
    #Val samples 3399 (15.0 % of nodes)
    #Test samples 18130 (remaining)
    ----label noise information:------
    Instance dependent noise
    #Actual noise rate 0.30
    [cuda:0] LNPCC waiting for GPU slot...
    [cuda:0] Slot acquired (waited 0.0s). Starting GCN...
    FINAL_RESULT: {'acc': {'train': 0.33127208480565373, 'valid': 0.2671373933509856, 'test': 0.3550468836183122}, 'wall_s': 267.93, 'cpu_s': 265.98, 'gpu_s': 1.92, 'wait_s': 0.0}
    [Time] wall=267.9s | cpu=266.0s | gpu=1.9s
    C:\Users\fbrev\Documents\Acadêmico\Simulações\Python\NoisyGL\predictor\Base_Predictor.py:114: UserWarning: expandable_segments not supported on this platform (Triggered internally at ..\c10/cuda/CUDAAllocatorConfig.h:28.)
    self.edge_index = self._cpu_edge_index.to(self.device)
    C:\Users\fbrev\Documents\Acadêmico\Simulações\Python\NoisyGL\predictor\Base_Predictor.py:144: UserWarning: Sparse CSR tensor support is in beta state. If you miss a functionality in the sparse tensor support, please submit a feature request to https://github.com/pytorch/pytorch/issues. (Triggered internally at ..\aten\src\ATen\SparseCsrTensorImpl.cpp:55.)
    self.adj_csr = self.adj.to_sparse_csr().to(self.device)
[I 2026-05-10 18:06:45,783] Trial 77 finished with value: 0.3550468836183122 and parameters: {'lr': 0.01, 'weight_decay': 0.001, 'n_hidden': 32, 'n_layer': 2, 'dropout': 0.7988054584963262, 'knn_mode': 'd', 'k': 31, 'dexp': 8.81462223060955, 'p_grd': 0.5264564939761661, 'unc_rem': 0.27255400610960867, 'unc_rel': 0.3377074714993609}. Best is trial 46 with value: 0.3781025923883067.
    [CPU] Loading roman-empire...
    DEBUG 3.1: Dataset init start
    DEBUG 3.2: prepare_data start roman-empire
    ----Data statistics------'
    Name: roman-empire
    #Nodes 22662
    #Edges 32927
    #Classes 18
    #Ave_degree 2.91
    ----Split statistics------'
    #Train samples 1133 (5.0 % of nodes)
    #Val samples 3399 (15.0 % of nodes)
    #Test samples 18130 (remaining)
    ----label noise information:------
    Instance dependent noise
    #Actual noise rate 0.30
    [cuda:0] LNPCC waiting for GPU slot...
    [cuda:0] Slot acquired (waited 0.0s). Starting GCN...
    FINAL_RESULT: {'acc': {'train': 0.37980339588918677, 'valid': 0.2627243306854957, 'test': 0.3530060672917816}, 'wall_s': 264.52, 'cpu_s': 262.62, 'gpu_s': 1.87, 'wait_s': 0.0}
    [Time] wall=264.5s | cpu=262.6s | gpu=1.9s
    C:\Users\fbrev\Documents\Acadêmico\Simulações\Python\NoisyGL\predictor\Base_Predictor.py:114: UserWarning: expandable_segments not supported on this platform (Triggered internally at ..\c10/cuda/CUDAAllocatorConfig.h:28.)
    self.edge_index = self._cpu_edge_index.to(self.device)
    C:\Users\fbrev\Documents\Acadêmico\Simulações\Python\NoisyGL\predictor\Base_Predictor.py:144: UserWarning: Sparse CSR tensor support is in beta state. If you miss a functionality in the sparse tensor support, please submit a feature request to https://github.com/pytorch/pytorch/issues. (Triggered internally at ..\aten\src\ATen\SparseCsrTensorImpl.cpp:55.)
    self.adj_csr = self.adj.to_sparse_csr().to(self.device)
[I 2026-05-10 18:11:16,615] Trial 79 finished with value: 0.3530060672917816 and parameters: {'lr': 0.01, 'weight_decay': 0.001, 'n_hidden': 32, 'n_layer': 2, 'dropout': 0.7036468564872038, 'knn_mode': 'd', 'k': 34, 'dexp': 6.970447314763618, 'p_grd': 0.4031800311346996, 'unc_rem': 0.09962455967986865, 'unc_rel': 0.28684078771562205}. Best is trial 46 with value: 0.3781025923883067.
    [CPU] Loading roman-empire...
    DEBUG 3.1: Dataset init start
    DEBUG 3.2: prepare_data start roman-empire    ----Data statistics------'
    Name: roman-empire
    #Nodes 22662
    #Edges 32927
    #Classes 18
    #Ave_degree 2.91
    ----Split statistics------'
    #Train samples 1133 (5.0 % of nodes)
    #Val samples 3399 (15.0 % of nodes)
    #Test samples 18130 (remaining)
    ----label noise information:------
    Instance dependent noise
    #Actual noise rate 0.30
    [cuda:0] LNPCC waiting for GPU slot...
    [cuda:0] Slot acquired (waited 0.0s). Starting GCN...
    FINAL_RESULT: {'acc': {'train': 0.34914950760966873, 'valid': 0.27037363930567815, 'test': 0.3565912851627137}, 'wall_s': 239.89, 'cpu_s': 237.88, 'gpu_s': 1.98, 'wait_s': 0.0}
    [Time] wall=239.9s | cpu=237.9s | gpu=2.0s
    C:\Users\fbrev\Documents\Acadêmico\Simulações\Python\NoisyGL\predictor\Base_Predictor.py:114: UserWarning: expandable_segments not supported on this platform (Triggered internally at ..\c10/cuda/CUDAAllocatorConfig.h:28.)
    self.edge_index = self._cpu_edge_index.to(self.device)
    C:\Users\fbrev\Documents\Acadêmico\Simulações\Python\NoisyGL\predictor\Base_Predictor.py:144: UserWarning: Sparse CSR tensor support is in beta state. If you miss a functionality in the sparse tensor support, please submit a feature request to https://github.com/pytorch/pytorch/issues. (Triggered internally at ..\aten\src\ATen\SparseCsrTensorImpl.cpp:55.)
    self.adj_csr = self.adj.to_sparse_csr().to(self.device)
[I 2026-05-10 18:14:51,415] Trial 80 finished with value: 0.3565912851627137 and parameters: {'lr': 0.01, 'weight_decay': 0.001, 'n_hidden': 32, 'n_layer': 2, 'dropout': 0.6949684799665596, 'knn_mode': 'd', 'k': 37, 'dexp': 7.888288842653223, 'p_grd': 0.408213728242281, 'unc_rem': 0.1116491647221107, 'unc_rel': 0.4977197898264091}. Best is trial 46 with value: 0.3781025923883067.
    [CPU] Loading roman-empire...
    DEBUG 3.1: Dataset init start
    DEBUG 3.2: prepare_data start roman-empire
    ----Data statistics------'
    Name: roman-empire
    #Nodes 22662
    #Edges 32927
    #Classes 18
    #Ave_degree 2.91
    ----Split statistics------'
    #Train samples 1133 (5.0 % of nodes)
    #Val samples 3399 (15.0 % of nodes)
    #Test samples 18130 (remaining)
    ----label noise information:------
    Instance dependent noise
    #Actual noise rate 0.30
    [cuda:0] LNPCC waiting for GPU slot...
    [cuda:0] Slot acquired (waited 0.0s). Starting GCN...
    FINAL_RESULT: {'acc': {'train': 0.3584392014519056, 'valid': 0.27066784348337747, 'test': 0.35041367898510756}, 'wall_s': 254.09, 'cpu_s': 252.05, 'gpu_s': 1.97, 'wait_s': 0.0}
    [Time] wall=254.1s | cpu=252.1s | gpu=2.0s
    C:\Users\fbrev\Documents\Acadêmico\Simulações\Python\NoisyGL\predictor\Base_Predictor.py:114: UserWarning: expandable_segments not supported on this platform (Triggered internally at ..\c10/cuda/CUDAAllocatorConfig.h:28.)
    self.edge_index = self._cpu_edge_index.to(self.device)
    C:\Users\fbrev\Documents\Acadêmico\Simulações\Python\NoisyGL\predictor\Base_Predictor.py:144: UserWarning: Sparse CSR tensor support is in beta state. If you miss a functionality in the sparse tensor support, please submit a feature request to https://github.com/pytorch/pytorch/issues. (Triggered internally at ..\aten\src\ATen\SparseCsrTensorImpl.cpp:55.)
    self.adj_csr = self.adj.to_sparse_csr().to(self.device)
[I 2026-05-10 18:19:11,923] Trial 83 finished with value: 0.35041367898510756 and parameters: {'lr': 0.01, 'weight_decay': 0.001, 'n_hidden': 32, 'n_layer': 2, 'dropout': 0.7394130780463902, 'knn_mode': 'd', 'k': 37, 'dexp': 8.380160048160759, 'p_grd': 0.41670173387099024, 'unc_rem': 0.032589346584309085, 'unc_rel': 0.5424933694138568}. Best is trial 46 with value: 0.3781025923883067.
    [CPU] Loading roman-empire...
    DEBUG 3.1: Dataset init start
    DEBUG 3.2: prepare_data start roman-empir       ----Data statistics------'
    Name: roman-empire
    #Nodes 22662
    #Edges 32927
    #Classes 18
    #Ave_degree 2.91
    ----Split statistics------'
    #Train samples 1133 (5.0 % of nodes)
    #Val samples 3399 (15.0 % of nodes)
    #Test samples 18130 (remaining)
    ----label noise information:------
    Instance dependent noise
    #Actual noise rate 0.30
    [cuda:0] LNPCC waiting for GPU slot...
    [cuda:0] Slot acquired (waited 0.0s). Starting GCN...
    FINAL_RESULT: {'acc': {'train': 0.2985781990521327, 'valid': 0.22536040011768166, 'test': 0.2890788747931605}, 'wall_s': 304.39, 'cpu_s': 302.42, 'gpu_s': 1.94, 'wait_s': 0.0}
    [Time] wall=304.4s | cpu=302.4s | gpu=1.9s
    C:\Users\fbrev\Documents\Acadêmico\Simulações\Python\NoisyGL\predictor\Base_Predictor.py:114: UserWarning: expandable_segments not supported on this platform (Triggered internally at ..\c10/cuda/CUDAAllocatorConfig.h:28.)
    self.edge_index = self._cpu_edge_index.to(self.device)
    C:\Users\fbrev\Documents\Acadêmico\Simulações\Python\NoisyGL\predictor\Base_Predictor.py:144: UserWarning: Sparse CSR tensor support is in beta state. If you miss a functionality in the sparse tensor support, please submit a feature request to https://github.com/pytorch/pytorch/issues. (Triggered internally at ..\aten\src\ATen\SparseCsrTensorImpl.cpp:55.)
    self.adj_csr = self.adj.to_sparse_csr().to(self.device)
[I 2026-05-10 18:24:22,523] Trial 85 finished with value: 0.2890788747931605 and parameters: {'lr': 0.001, 'weight_decay': 0.001, 'n_hidden': 32, 'n_layer': 2, 'dropout': 0.609469277534861, 'knn_mode': 'd', 'k': 44, 'dexp': 4.2274690161373725, 'p_grd': 0.33941384048786005, 'unc_rem': 0.0692253148589245, 'unc_rel': 0.8345541251361419}. Best is trial 46 with value: 0.3781025923883067.
    [CPU] Loading roman-empire...
    DEBUG 3.1: Dataset init start
    DEBUG 3.2: prepare_data start roman-empi        ----Data statistics------'
    Name: roman-empire
    #Nodes 22662
    #Edges 32927
    #Classes 18
    #Ave_degree 2.91
    ----Split statistics------'
    #Train samples 1133 (5.0 % of nodes)
    #Val samples 3399 (15.0 % of nodes)
    #Test samples 18130 (remaining)
    ----label noise information:------
    Instance dependent noise
    #Actual noise rate 0.30
    [cuda:0] LNPCC waiting for GPU slot...
    [cuda:0] Slot acquired (waited 0.0s). Starting GCN...
    FINAL_RESULT: {'acc': {'train': 0.3321492007104796, 'valid': 0.2644895557516917, 'test': 0.3506894649751793}, 'wall_s': 442.41, 'cpu_s': 440.53, 'gpu_s': 1.85, 'wait_s': 0.0}
    [Time] wall=442.4s | cpu=440.5s | gpu=1.8s
    C:\Users\fbrev\Documents\Acadêmico\Simulações\Python\NoisyGL\predictor\Base_Predictor.py:114: UserWarning: expandable_segments not supported on this platform (Triggered internally at ..\c10/cuda/CUDAAllocatorConfig.h:28.)
    self.edge_index = self._cpu_edge_index.to(self.device)
    C:\Users\fbrev\Documents\Acadêmico\Simulações\Python\NoisyGL\predictor\Base_Predictor.py:144: UserWarning: Sparse CSR tensor support is in beta state. If you miss a functionality in the sparse tensor support, please submit a feature request to https://github.com/pytorch/pytorch/issues. (Triggered internally at ..\aten\src\ATen\SparseCsrTensorImpl.cpp:55.)
    self.adj_csr = self.adj.to_sparse_csr().to(self.device)
[I 2026-05-10 18:31:51,066] Trial 87 finished with value: 0.3506894649751793 and parameters: {'lr': 0.01, 'weight_decay': 0.001, 'n_hidden': 32, 'n_layer': 2, 'dropout': 0.777149650205051, 'knn_mode': 'd', 'k': 49, 'dexp': 8.123666815942821, 'p_grd': 0.6102568138828979, 'unc_rem': 0.05040879264051734, 'unc_rel': 0.9285946193628972}. Best is trial 46 with value: 0.3781025923883067.
    [CPU] Loading roman-empire...
    DEBUG 3.1: Dataset init start
    DEBUG 3.2: prepare_data start roman-empire     ----Data statistics------'
    Name: roman-empire
    #Nodes 22662
    #Edges 32927
    #Classes 18
    #Ave_degree 2.91
    ----Split statistics------'
    #Train samples 1133 (5.0 % of nodes)
    #Val samples 3399 (15.0 % of nodes)
    #Test samples 18130 (remaining)
    ----label noise information:------
    Instance dependent noise
    #Actual noise rate 0.30
    [cuda:0] LNPCC waiting for GPU slot...
    [cuda:0] Slot acquired (waited 1.1s). Starting GCN...
    FINAL_RESULT: {'acc': {'train': 0.5627586206896552, 'valid': 0.25507502206531335, 'test': 0.3396580253723111}, 'wall_s': 293.28, 'cpu_s': 291.19, 'gpu_s': 2.06, 'wait_s': 1.07}
    [Time] wall=293.3s | cpu=291.2s | gpu=2.1s
    C:\Users\fbrev\Documents\Acadêmico\Simulações\Python\NoisyGL\predictor\Base_Predictor.py:114: UserWarning: expandable_segments not supported on this platform (Triggered internally at ..\c10/cuda/CUDAAllocatorConfig.h:28.)
    self.edge_index = self._cpu_edge_index.to(self.device)
    C:\Users\fbrev\Documents\Acadêmico\Simulações\Python\NoisyGL\predictor\Base_Predictor.py:144: UserWarning: Sparse CSR tensor support is in beta state. If you miss a functionality in the sparse tensor support, please submit a feature request to https://github.com/pytorch/pytorch/issues. (Triggered internally at ..\aten\src\ATen\SparseCsrTensorImpl.cpp:55.)
    self.adj_csr = self.adj.to_sparse_csr().to(self.device)
[I 2026-05-10 18:36:51,501] Trial 89 finished with value: 0.3396580253723111 and parameters: {'lr': 0.01, 'weight_decay': 0.001, 'n_hidden': 32, 'n_layer': 2, 'dropout': 0.6444978665026604, 'knn_mode': 'd', 'k': 47, 'dexp': 7.5045207322871175, 'p_grd': 0.46218398882609485, 'unc_rem': 0.002842309971412018, 'unc_rel': 0.40812666824515065}. Best is trial 46 with value: 0.3781025923883067.
    [CPU] Loading roman-empire...
    DEBUG 3.1: Dataset init start
    DEBUG 3.2: prepare_data start roman-empire
    ----Data statistics------'
    Name: roman-empire
    #Nodes 22662
    #Edges 32927
    #Classes 18
    #Ave_degree 2.91
    ----Split statistics------'
    #Train samples 1133 (5.0 % of nodes)
    #Val samples 3399 (15.0 % of nodes)
    #Test samples 18130 (remaining)
    ----label noise information:------
    Instance dependent noise
    #Actual noise rate 0.30
    [cuda:0] LNPCC waiting for GPU slot...
    [cuda:0] Slot acquired (waited 0.0s). Starting GCN...
    FINAL_RESULT: {'acc': {'train': 0.3623445825932504, 'valid': 0.27037363930567815, 'test': 0.3565912851627137}, 'wall_s': 302.14, 'cpu_s': 300.31, 'gpu_s': 1.8, 'wait_s': 0.0}
    [Time] wall=302.1s | cpu=300.3s | gpu=1.8s
    C:\Users\fbrev\Documents\Acadêmico\Simulações\Python\NoisyGL\predictor\Base_Predictor.py:114: UserWarning: expandable_segments not supported on this platform (Triggered internally at ..\c10/cuda/CUDAAllocatorConfig.h:28.)
    self.edge_index = self._cpu_edge_index.to(self.device)
    C:\Users\fbrev\Documents\Acadêmico\Simulações\Python\NoisyGL\predictor\Base_Predictor.py:144: UserWarning: Sparse CSR tensor support is in beta state. If you miss a functionality in the sparse tensor support, please submit a feature request to https://github.com/pytorch/pytorch/issues. (Triggered internally at ..\aten\src\ATen\SparseCsrTensorImpl.cpp:55.)
    self.adj_csr = self.adj.to_sparse_csr().to(self.device)
[I 2026-05-10 18:42:00,472] Trial 92 finished with value: 0.3565912851627137 and parameters: {'lr': 0.01, 'weight_decay': 0.001, 'n_hidden': 32, 'n_layer': 2, 'dropout': 0.7093683388514898, 'knn_mode': 'd', 'k': 40, 'dexp': 6.69104831523973, 'p_grd': 0.499026249661391, 'unc_rem': 0.12397997135411819, 'unc_rel': 0.3669865154166986}. Best is trial 46 with value: 0.3781025923883067.
    [CPU] Loading roman-empire...
    DEBUG 3.1: Dataset init start
    DEBUG 3.2: prepare_data start roman-empire
    ----Data statistics------'
    Name: roman-empire
    #Nodes 22662
    #Edges 32927
    #Classes 18
    #Ave_degree 2.91
    ----Split statistics------'
    #Train samples 1133 (5.0 % of nodes)
    #Val samples 3399 (15.0 % of nodes)
    #Test samples 18130 (remaining)
    ----label noise information:------
    Instance dependent noise
    #Actual noise rate 0.30
    [cuda:0] LNPCC waiting for GPU slot...
    [cuda:0] Slot acquired (waited 0.0s). Starting GCN...
    FINAL_RESULT: {'acc': {'train': 0.3548387096774194, 'valid': 0.26802000588408353, 'test': 0.3571980143408715}, 'wall_s': 226.38, 'cpu_s': 224.44, 'gpu_s': 1.9, 'wait_s': 0.0}
    [Time] wall=226.4s | cpu=224.4s | gpu=1.9s
    C:\Users\fbrev\Documents\Acadêmico\Simulações\Python\NoisyGL\predictor\Base_Predictor.py:114: UserWarning: expandable_segments not supported on this platform (Triggered internally at ..\c10/cuda/CUDAAllocatorConfig.h:28.)
    self.edge_index = self._cpu_edge_index.to(self.device)
    C:\Users\fbrev\Documents\Acadêmico\Simulações\Python\NoisyGL\predictor\Base_Predictor.py:144: UserWarning: Sparse CSR tensor support is in beta state. If you miss a functionality in the sparse tensor support, please submit a feature request to https://github.com/pytorch/pytorch/issues. (Triggered internally at ..\aten\src\ATen\SparseCsrTensorImpl.cpp:55.)
    self.adj_csr = self.adj.to_sparse_csr().to(self.device)
