[I 2026-05-06 15:16:06,036] Trial 35 finished with value: 0.711 and parameters: {'lr': 0.001, 'weight_decay': 0.0001, 'n_hidden': 32, 'n_layer': 3, 'dropout': 0.17991145431098104, 'knn_mode': 'd', 'k': 28, 'dexp': 4.759108576935979, 'p_grd': 0.5178077235818876, 'unc_rem': 0.00897982824400212, 'unc_rel': 0.6411701499379885}. Best is trial 27 with value: 0.765.
    [CPU] Loading pubmed...
    DEBUG 3.1: Dataset init start
    DEBUG 3.2: prepare_data start pubmed
    ----Data statistics------'
    Name: pubmed
    #Nodes 19717
    #Edges 44324
    #Classes 3
    #Ave_degree 4.50
    ----Split statistics------'
    #Train samples 60 (default)
    #Val samples 500 (default)
    #Test samples 1000 (default)
    ----label noise information:------
    Instance dependent noise
    #Actual noise rate 0.13
    [cuda:0] LNPCC waiting for GPU slot...
    [cuda:0] Slot acquired (waited 151.5s). Starting GCN...
    FINAL_RESULT: {'acc': {'train': 0.38333333333333336, 'valid': 0.374, 'test': 0.413}, 'wall_s': 32.41, 'cpu_s': 26.34, 'gpu_s': 6.03, 'wait_s': 151.52}
    [Time] wall=32.4s | cpu=26.3s | gpu=6.0s
    C:\Users\fbrev\Documents\Acadêmico\Simulações\Python\NoisyGL\predictor\Base_Predictor.py:114: UserWarning: expandable_segments not supported on this platform (Triggered internally at ..\c10/cuda/CUDAAllocatorConfig.h:28.)
    self.edge_index = self._cpu_edge_index.to(self.device)
    C:\Users\fbrev\Documents\Acadêmico\Simulações\Python\NoisyGL\predictor\Base_Predictor.py:144: UserWarning: Sparse CSR tensor support is in beta state. If you miss a functionality in the sparse tensor support, please submit a feature request to https://github.com/pytorch/pytorch/issues. (Triggered internally at ..\aten\src\ATen\SparseCsrTensorImpl.cpp:55.)
    self.adj_csr = self.adj.to_sparse_csr().to(self.device)
[I 2026-05-06 15:19:16,161] Trial 36 finished with value: 0.413 and parameters: {'lr': 0.01, 'weight_decay': 0.05, 'n_hidden': 256, 'n_layer': 3, 'dropout': 0.14139116246822328, 'knn_mode': 'd', 'k': 36, 'dexp': 4.127849766662535, 'p_grd': 0.41246643070431566, 'unc_rem': 0.517287147793394, 'unc_rel': 0.36243672960661966}. Best is trial 27 with value: 0.765.
    [CPU] Loading pubmed...
    DEBUG 3.1: Dataset init start
    DEBUG 3.2: prepare_data start pubmed
    ----Data statistics------'
    Name: pubmed
    #Nodes 19717
    #Edges 44324
    #Classes 3
    #Ave_degree 4.50
    ----Split statistics------'
    #Train samples 60 (default)
    #Val samples 500 (default)
    #Test samples 1000 (default)
    ----label noise information:------
    Instance dependent noise
    #Actual noise rate 0.13
    [cuda:0] LNPCC waiting for GPU slot...
    [cuda:0] Slot acquired (waited 341.0s). Starting GCN...
    FINAL_RESULT: {'acc': {'train': 0.8666666666666667, 'valid': 0.652, 'test': 0.731}, 'wall_s': 29.3, 'cpu_s': 26.65, 'gpu_s': 2.61, 'wait_s': 341.02}
    [Time] wall=29.3s | cpu=26.7s | gpu=2.6s
    C:\Users\fbrev\Documents\Acadêmico\Simulações\Python\NoisyGL\predictor\Base_Predictor.py:114: UserWarning: expandable_segments not supported on this platform (Triggered internally at ..\c10/cuda/CUDAAllocatorConfig.h:28.)
    self.edge_index = self._cpu_edge_index.to(self.device)
    C:\Users\fbrev\Documents\Acadêmico\Simulações\Python\NoisyGL\predictor\Base_Predictor.py:144: UserWarning: Sparse CSR tensor support is in beta state. If you miss a functionality in the sparse tensor support, please submit a feature request to https://github.com/pytorch/pytorch/issues. (Triggered internally at ..\aten\src\ATen\SparseCsrTensorImpl.cpp:55.)
    self.adj_csr = self.adj.to_sparse_csr().to(self.device)
[I 2026-05-06 15:25:32,376] Trial 37 finished with value: 0.731 and parameters: {'lr': 0.005, 'weight_decay': 0.0001, 'n_hidden': 128, 'n_layer': 2, 'dropout': 0.4498656323184482, 'knn_mode': 's', 'k': 47, 'dexp': 6.697200247873597, 'p_grd': 0.5640190595445264, 'unc_rem': 0.5947881974545085, 'unc_rel': 0.3215061498500841}. Best is trial 27 with value: 0.765.
    [CPU] Loading pubmed...
    DEBUG 3.1: Dataset init start
    DEBUG 3.2: prepare_data start pubmed
    ----Data statistics------'
    Name: pubmed
    #Nodes 19717
    #Edges 44324
    #Classes 3
    #Ave_degree 4.50
    ----Split statistics------'
    #Train samples 60 (default)
    #Val samples 500 (default)
    #Test samples 1000 (default)
    ----label noise information:------
    Instance dependent noise
    #Actual noise rate 0.13
    [cuda:0] LNPCC waiting for GPU slot...
    [cuda:0] Slot acquired (waited 155.3s). Starting GCN...
    FINAL_RESULT: {'acc': {'train': 0.8666666666666667, 'valid': 0.64, 'test': 0.672}, 'wall_s': 33.4, 'cpu_s': 27.58, 'gpu_s': 5.77, 'wait_s': 155.33}
    [Time] wall=33.4s | cpu=27.6s | gpu=5.8s
    C:\Users\fbrev\Documents\Acadêmico\Simulações\Python\NoisyGL\predictor\Base_Predictor.py:114: UserWarning: expandable_segments not supported on this platform (Triggered internally at ..\c10/cuda/CUDAAllocatorConfig.h:28.)
    self.edge_index = self._cpu_edge_index.to(self.device)
    C:\Users\fbrev\Documents\Acadêmico\Simulações\Python\NoisyGL\predictor\Base_Predictor.py:144: UserWarning: Sparse CSR tensor support is in beta state. If you miss a functionality in the sparse tensor support, please submit a feature request to https://github.com/pytorch/pytorch/issues. (Triggered internally at ..\aten\src\ATen\SparseCsrTensorImpl.cpp:55.)
    self.adj_csr = self.adj.to_sparse_csr().to(self.device)
[I 2026-05-06 15:28:47,400] Trial 38 finished with value: 0.672 and parameters: {'lr': 0.001, 'weight_decay': 0.01, 'n_hidden': 256, 'n_layer': 3, 'dropout': 0.07122577914239032, 'knn_mode': 'd', 'k': 41, 'dexp': 3.001507309025069, 'p_grd': 0.3225821961237776, 'unc_rem': 0.6954774589837575, 'unc_rel': 0.5298904312905663}. Best is trial 27 with value: 0.765.
    [CPU] Loading pubmed...
    DEBUG 3.1: Dataset init start
    DEBUG 3.2: prepare_data start pubmed
    ----Data statistics------'
    Name: pubmed
    #Nodes 19717
    #Edges 44324
    #Classes 3
    #Ave_degree 4.50
    ----Split statistics------'
    #Train samples 60 (default)
    #Val samples 500 (default)
    #Test samples 1000 (default)
    ----label noise information:------
    Instance dependent noise
    #Actual noise rate 0.13
    [cuda:0] LNPCC waiting for GPU slot...
    [cuda:0] Slot acquired (waited 153.9s). Starting GCN...
    FINAL_RESULT: {'acc': {'train': 0.6166666666666667, 'valid': 0.656, 'test': 0.748}, 'wall_s': 27.98, 'cpu_s': 24.32, 'gpu_s': 3.62, 'wait_s': 153.9}
    [Time] wall=28.0s | cpu=24.3s | gpu=3.6s
    C:\Users\fbrev\Documents\Acadêmico\Simulações\Python\NoisyGL\predictor\Base_Predictor.py:114: UserWarning: expandable_segments not supported on this platform (Triggered internally at ..\c10/cuda/CUDAAllocatorConfig.h:28.)
    self.edge_index = self._cpu_edge_index.to(self.device)
    C:\Users\fbrev\Documents\Acadêmico\Simulações\Python\NoisyGL\predictor\Base_Predictor.py:144: UserWarning: Sparse CSR tensor support is in beta state. If you miss a functionality in the sparse tensor support, please submit a feature request to https://github.com/pytorch/pytorch/issues. (Triggered internally at ..\aten\src\ATen\SparseCsrTensorImpl.cpp:55.)
    self.adj_csr = self.adj.to_sparse_csr().to(self.device)
[I 2026-05-06 15:31:55,439] Trial 39 finished with value: 0.748 and parameters: {'lr': 0.05, 'weight_decay': 0.0, 'n_hidden': 256, 'n_layer': 2, 'dropout': 0.3541347552537281, 'knn_mode': 's', 'k': 25, 'dexp': 7.344529812960168, 'p_grd': 0.6938681039893573, 'unc_rem': 0.7910628784825158, 'unc_rel': 0.43152939274865504}. Best is trial 27 with value: 0.765.
    [CPU] Loading pubmed...
    DEBUG 3.1: Dataset init start
    DEBUG 3.2: prepare_data start pubmed
    ----Data statistics------'
    Name: pubmed
    #Nodes 19717
    #Edges 44324
    #Classes 3
    #Ave_degree 4.50
    ----Split statistics------'
    #Train samples 60 (default)
    #Val samples 500 (default)
    #Test samples 1000 (default)
    ----label noise information:------
    Instance dependent noise
    #Actual noise rate 0.13
    [cuda:0] LNPCC waiting for GPU slot...
    [cuda:0] Slot acquired (waited 144.5s). Starting GCN...
    FINAL_RESULT: {'acc': {'train': 0.8333333333333334, 'valid': 0.65, 'test': 0.725}, 'wall_s': 38.68, 'cpu_s': 35.67, 'gpu_s': 2.97, 'wait_s': 144.47}
    [Time] wall=38.7s | cpu=35.7s | gpu=3.0s
    C:\Users\fbrev\Documents\Acadêmico\Simulações\Python\NoisyGL\predictor\Base_Predictor.py:114: UserWarning: expandable_segments not supported on this platform (Triggered internally at ..\c10/cuda/CUDAAllocatorConfig.h:28.)
    self.edge_index = self._cpu_edge_index.to(self.device)
    C:\Users\fbrev\Documents\Acadêmico\Simulações\Python\NoisyGL\predictor\Base_Predictor.py:144: UserWarning: Sparse CSR tensor support is in beta state. If you miss a functionality in the sparse tensor support, please submit a feature request to https://github.com/pytorch/pytorch/issues. (Triggered internally at ..\aten\src\ATen\SparseCsrTensorImpl.cpp:55.)
    self.adj_csr = self.adj.to_sparse_csr().to(self.device)
[I 2026-05-06 15:35:05,312] Trial 40 finished with value: 0.725 and parameters: {'lr': 0.1, 'weight_decay': 0.0001, 'n_hidden': 32, 'n_layer': 3, 'dropout': 0.22293622400469126, 'knn_mode': 'd', 'k': 34, 'dexp': 5.057777433863107, 'p_grd': 0.8300332961440905, 'unc_rem': 0.9242779244147985, 'unc_rel': 0.29512809239847393}. Best is trial 27 with value: 0.765.
    [CPU] Loading pubmed...
    DEBUG 3.1: Dataset init start
    DEBUG 3.2: prepare_data start pubmed
    ----Data statistics------'
    Name: pubmed
    #Nodes 19717
    #Edges 44324
    #Classes 3
    #Ave_degree 4.50
    ----Split statistics------'
    #Train samples 60 (default)
    #Val samples 500 (default)
    #Test samples 1000 (default)
    ----label noise information:------
    Instance dependent noise
    #Actual noise rate 0.13
    [cuda:0] LNPCC waiting for GPU slot...
    [cuda:0] Slot acquired (waited 4.2s). Starting GCN...
    FINAL_RESULT: {'acc': {'train': 0.8833333333333333, 'valid': 0.66, 'test': 0.713}, 'wall_s': 29.89, 'cpu_s': 26.19, 'gpu_s': 3.66, 'wait_s': 4.22}
    [Time] wall=29.9s | cpu=26.2s | gpu=3.7s
    C:\Users\fbrev\Documents\Acadêmico\Simulações\Python\NoisyGL\predictor\Base_Predictor.py:114: UserWarning: expandable_segments not supported on this platform (Triggered internally at ..\c10/cuda/CUDAAllocatorConfig.h:28.)
    self.edge_index = self._cpu_edge_index.to(self.device)
    C:\Users\fbrev\Documents\Acadêmico\Simulações\Python\NoisyGL\predictor\Base_Predictor.py:144: UserWarning: Sparse CSR tensor support is in beta state. If you miss a functionality in the sparse tensor support, please submit a feature request to https://github.com/pytorch/pytorch/issues. (Triggered internally at ..\aten\src\ATen\SparseCsrTensorImpl.cpp:55.)
    self.adj_csr = self.adj.to_sparse_csr().to(self.device)
[I 2026-05-06 15:35:45,673] Trial 41 finished with value: 0.713 and parameters: {'lr': 0.05, 'weight_decay': 0.0, 'n_hidden': 256, 'n_layer': 2, 'dropout': 0.36252232299173137, 'knn_mode': 's', 'k': 25, 'dexp': 7.606087532341726, 'p_grd': 0.6911854111984002, 'unc_rem': 0.7927224823786818, 'unc_rel': 0.4188640126573622}. Best is trial 27 with value: 0.765.
    [CPU] Loading pubmed...
    DEBUG 3.1: Dataset init start
    DEBUG 3.2: prepare_data start pubmed
    ----Data statistics------'
    Name: pubmed
    #Nodes 19717
    #Edges 44324
    #Classes 3
    #Ave_degree 4.50
    ----Split statistics------'
    #Train samples 60 (default)
    #Val samples 500 (default)
    #Test samples 1000 (default)
    ----label noise information:------
    Instance dependent noise
    #Actual noise rate 0.13
    [cuda:0] LNPCC waiting for GPU slot...
    [cuda:0] Slot acquired (waited 4.5s). Starting GCN...
    FINAL_RESULT: {'acc': {'train': 0.6166666666666667, 'valid': 0.662, 'test': 0.747}, 'wall_s': 29.08, 'cpu_s': 25.26, 'gpu_s': 3.78, 'wait_s': 4.52}
    [Time] wall=29.1s | cpu=25.3s | gpu=3.8s
    C:\Users\fbrev\Documents\Acadêmico\Simulações\Python\NoisyGL\predictor\Base_Predictor.py:114: UserWarning: expandable_segments not supported on this platform (Triggered internally at ..\c10/cuda/CUDAAllocatorConfig.h:28.)
    self.edge_index = self._cpu_edge_index.to(self.device)
    C:\Users\fbrev\Documents\Acadêmico\Simulações\Python\NoisyGL\predictor\Base_Predictor.py:144: UserWarning: Sparse CSR tensor support is in beta state. If you miss a functionality in the sparse tensor support, please submit a feature request to https://github.com/pytorch/pytorch/issues. (Triggered internally at ..\aten\src\ATen\SparseCsrTensorImpl.cpp:55.)
    self.adj_csr = self.adj.to_sparse_csr().to(self.device)
[I 2026-05-06 15:36:25,655] Trial 42 finished with value: 0.747 and parameters: {'lr': 0.05, 'weight_decay': 0.0, 'n_hidden': 256, 'n_layer': 2, 'dropout': 0.35990525403507356, 'knn_mode': 's', 'k': 18, 'dexp': 6.304725731884826, 'p_grd': 0.7363731382146924, 'unc_rem': 0.7198241416343658, 'unc_rel': 0.4586380649513387}. Best is trial 27 with value: 0.765.
    [CPU] Loading pubmed...
    DEBUG 3.1: Dataset init start
    DEBUG 3.2: prepare_data start pubmed
    ----Data statistics------'
    Name: pubmed
    #Nodes 19717
    #Edges 44324
    #Classes 3
    #Ave_degree 4.50
    ----Split statistics------'
    #Train samples 60 (default)
    #Val samples 500 (default)
    #Test samples 1000 (default)
    ----label noise information:------
    Instance dependent noise
    #Actual noise rate 0.13
    [cuda:0] LNPCC waiting for GPU slot...
    [cuda:0] Slot acquired (waited 2.6s). Starting GCN...
    FINAL_RESULT: {'acc': {'train': 0.6166666666666667, 'valid': 0.654, 'test': 0.697}, 'wall_s': 29.46, 'cpu_s': 25.84, 'gpu_s': 3.58, 'wait_s': 2.59}
    [Time] wall=29.5s | cpu=25.8s | gpu=3.6s
    C:\Users\fbrev\Documents\Acadêmico\Simulações\Python\NoisyGL\predictor\Base_Predictor.py:114: UserWarning: expandable_segments not supported on this platform (Triggered internally at ..\c10/cuda/CUDAAllocatorConfig.h:28.)
    self.edge_index = self._cpu_edge_index.to(self.device)
    C:\Users\fbrev\Documents\Acadêmico\Simulações\Python\NoisyGL\predictor\Base_Predictor.py:144: UserWarning: Sparse CSR tensor support is in beta state. If you miss a functionality in the sparse tensor support, please submit a feature request to https://github.com/pytorch/pytorch/issues. (Triggered internally at ..\aten\src\ATen\SparseCsrTensorImpl.cpp:55.)
    self.adj_csr = self.adj.to_sparse_csr().to(self.device)
[I 2026-05-06 15:37:03,671] Trial 43 finished with value: 0.697 and parameters: {'lr': 0.05, 'weight_decay': 0.0, 'n_hidden': 256, 'n_layer': 2, 'dropout': 0.29009760981858473, 'knn_mode': 's', 'k': 22, 'dexp': 7.092094899664329, 'p_grd': 0.6358231199166017, 'unc_rem': 0.8752741170384921, 'unc_rel': 0.6158492272412227}. Best is trial 27 with value: 0.765.
    [CPU] Loading pubmed...
    DEBUG 3.1: Dataset init start
    DEBUG 3.2: prepare_data start pubmed
    ----Data statistics------'
    Name: pubmed
    #Nodes 19717
    #Edges 44324
    #Classes 3
    #Ave_degree 4.50
    ----Split statistics------'
    #Train samples 60 (default)
    #Val samples 500 (default)
    #Test samples 1000 (default)
    ----label noise information:------
    Instance dependent noise
    #Actual noise rate 0.13
    [cuda:0] LNPCC waiting for GPU slot...
    [cuda:0] Slot acquired (waited 2.7s). Starting GCN...
    FINAL_RESULT: {'acc': {'train': 0.6, 'valid': 0.654, 'test': 0.739}, 'wall_s': 27.02, 'cpu_s': 23.25, 'gpu_s': 3.73, 'wait_s': 2.74}
    [Time] wall=27.0s | cpu=23.3s | gpu=3.7s
    C:\Users\fbrev\Documents\Acadêmico\Simulações\Python\NoisyGL\predictor\Base_Predictor.py:114: UserWarning: expandable_segments not supported on this platform (Triggered internally at ..\c10/cuda/CUDAAllocatorConfig.h:28.)
    self.edge_index = self._cpu_edge_index.to(self.device)
    C:\Users\fbrev\Documents\Acadêmico\Simulações\Python\NoisyGL\predictor\Base_Predictor.py:144: UserWarning: Sparse CSR tensor support is in beta state. If you miss a functionality in the sparse tensor support, please submit a feature request to https://github.com/pytorch/pytorch/issues. (Triggered internally at ..\aten\src\ATen\SparseCsrTensorImpl.cpp:55.)
    self.adj_csr = self.adj.to_sparse_csr().to(self.device)
[I 2026-05-06 15:37:39,986] Trial 44 finished with value: 0.739 and parameters: {'lr': 0.05, 'weight_decay': 0.0, 'n_hidden': 256, 'n_layer': 2, 'dropout': 0.456423120292754, 'knn_mode': 's', 'k': 30, 'dexp': 5.742255494758739, 'p_grd': 0.9458967290870115, 'unc_rem': 0.65121401911583, 'unc_rel': 0.37893441139954176}. Best is trial 27 with value: 0.765.
    [CPU] Loading pubmed...
    DEBUG 3.1: Dataset init start
    DEBUG 3.2: prepare_data start pubmed
    ----Data statistics------'
    Name: pubmed
    #Nodes 19717
    #Edges 44324
    #Classes 3
    #Ave_degree 4.50
    ----Split statistics------'
    #Train samples 60 (default)
    #Val samples 500 (default)
    #Test samples 1000 (default)
    ----label noise information:------
    Instance dependent noise
    #Actual noise rate 0.13
    [cuda:0] LNPCC waiting for GPU slot...
    [cuda:0] Slot acquired (waited 2.6s). Starting GCN...
    FINAL_RESULT: {'acc': {'train': 0.36666666666666664, 'valid': 0.386, 'test': 0.422}, 'wall_s': 28.45, 'cpu_s': 25.59, 'gpu_s': 2.82, 'wait_s': 2.64}
    [Time] wall=28.4s | cpu=25.6s | gpu=2.8s
    C:\Users\fbrev\Documents\Acadêmico\Simulações\Python\NoisyGL\predictor\Base_Predictor.py:114: UserWarning: expandable_segments not supported on this platform (Triggered internally at ..\c10/cuda/CUDAAllocatorConfig.h:28.)
    self.edge_index = self._cpu_edge_index.to(self.device)
    C:\Users\fbrev\Documents\Acadêmico\Simulações\Python\NoisyGL\predictor\Base_Predictor.py:144: UserWarning: Sparse CSR tensor support is in beta state. If you miss a functionality in the sparse tensor support, please submit a feature request to https://github.com/pytorch/pytorch/issues. (Triggered internally at ..\aten\src\ATen\SparseCsrTensorImpl.cpp:55.)
    self.adj_csr = self.adj.to_sparse_csr().to(self.device)
[I 2026-05-06 15:38:18,222] Trial 45 finished with value: 0.422 and parameters: {'lr': 0.005, 'weight_decay': 0.05, 'n_hidden': 128, 'n_layer': 2, 'dropout': 0.1777689034139029, 'knn_mode': 's', 'k': 24, 'dexp': 5.156895160889406, 'p_grd': 0.8193405956468507, 'unc_rem': 0.7990868509274096, 'unc_rel': 0.1782139394502482}. Best is trial 27 with value: 0.765.
    [CPU] Loading pubmed...
    DEBUG 3.1: Dataset init start
    DEBUG 3.2: prepare_data start pubmed
    ----Data statistics------'
    Name: pubmed
    #Nodes 19717
    #Edges 44324
    #Classes 3
    #Ave_degree 4.50
    ----Split statistics------'
    #Train samples 60 (default)
    #Val samples 500 (default)
    #Test samples 1000 (default)
    ----label noise information:------
    Instance dependent noise
    #Actual noise rate 0.13
    [cuda:0] LNPCC waiting for GPU slot...
    [cuda:0] Slot acquired (waited 5.1s). Starting GCN...
    FINAL_RESULT: {'acc': {'train': 0.7, 'valid': 0.66, 'test': 0.735}, 'wall_s': 32.24, 'cpu_s': 26.35, 'gpu_s': 5.84, 'wait_s': 5.13}
    [Time] wall=32.2s | cpu=26.3s | gpu=5.8s
    C:\Users\fbrev\Documents\Acadêmico\Simulações\Python\NoisyGL\predictor\Base_Predictor.py:114: UserWarning: expandable_segments not supported on this platform (Triggered internally at ..\c10/cuda/CUDAAllocatorConfig.h:28.)
    self.edge_index = self._cpu_edge_index.to(self.device)
    C:\Users\fbrev\Documents\Acadêmico\Simulações\Python\NoisyGL\predictor\Base_Predictor.py:144: UserWarning: Sparse CSR tensor support is in beta state. If you miss a functionality in the sparse tensor support, please submit a feature request to https://github.com/pytorch/pytorch/issues. (Triggered internally at ..\aten\src\ATen\SparseCsrTensorImpl.cpp:55.)
    self.adj_csr = self.adj.to_sparse_csr().to(self.device)
[I 2026-05-06 15:39:02,028] Trial 46 finished with value: 0.735 and parameters: {'lr': 0.01, 'weight_decay': 0.0001, 'n_hidden': 256, 'n_layer': 3, 'dropout': 0.10890330804912067, 'knn_mode': 's', 'k': 20, 'dexp': 7.74791728535366, 'p_grd': 0.6822898170875535, 'unc_rem': 0.4691977192443529, 'unc_rel': 0.6892489769797872}. Best is trial 27 with value: 0.765.
    [CPU] Loading pubmed...
    DEBUG 3.1: Dataset init start
    DEBUG 3.2: prepare_data start pubmed
    ----Data statistics------'
    Name: pubmed
    #Nodes 19717
    #Edges 44324
    #Classes 3
    #Ave_degree 4.50
    ----Split statistics------'
    #Train samples 60 (default)
    #Val samples 500 (default)
    #Test samples 1000 (default)
    ----label noise information:------
    Instance dependent noise
    #Actual noise rate 0.13
    [cuda:0] LNPCC waiting for GPU slot...
    [cuda:0] Slot acquired (waited 0.0s). Starting GCN...
    FINAL_RESULT: {'acc': {'train': 0.896551724137931, 'valid': 0.606, 'test': 0.694}, 'wall_s': 32.47, 'cpu_s': 28.59, 'gpu_s': 3.85, 'wait_s': 0.0}
    [Time] wall=32.5s | cpu=28.6s | gpu=3.8s
    C:\Users\fbrev\Documents\Acadêmico\Simulações\Python\NoisyGL\predictor\Base_Predictor.py:114: UserWarning: expandable_segments not supported on this platform (Triggered internally at ..\c10/cuda/CUDAAllocatorConfig.h:28.)
    self.edge_index = self._cpu_edge_index.to(self.device)
    C:\Users\fbrev\Documents\Acadêmico\Simulações\Python\NoisyGL\predictor\Base_Predictor.py:144: UserWarning: Sparse CSR tensor support is in beta state. If you miss a functionality in the sparse tensor support, please submit a feature request to https://github.com/pytorch/pytorch/issues. (Triggered internally at ..\aten\src\ATen\SparseCsrTensorImpl.cpp:55.)
    self.adj_csr = self.adj.to_sparse_csr().to(self.device)
