[I 2026-05-08 03:16:25,170] Trial 35 finished with value: 0.801 and parameters: {'lr': 0.005, 'weight_decay': 0.01, 'n_hidden': 32, 'n_layer': 3, 'dropout': 0.49050966673016494, 'knn_mode': 'd', 'k': 42, 'dexp': 5.662193229737673, 'p_grd': 0.6468681776672844, 'unc_rem': 0.5676141806599942, 'unc_rel': 0.4806300524039123}. Best is trial 5 with value: 0.814.
    [CPU] Loading cora...
    DEBUG 3.1: Dataset init start
    DEBUG 3.2: prepare_data start cora
    ----Data statistics------'
    Name: cora
    #Nodes 2708
    #Edges 5278
    #Classes 7
    #Ave_degree 3.90
    ----Split statistics------'
    #Train samples 140 (default)
    #Val samples 500 (default)
    #Test samples 1000 (default)
    ----label noise information:------
    Instance dependent noise
    #Actual noise rate 0.13
    [cuda:0] LNPCC waiting for GPU slot...
    [cuda:0] Slot acquired (waited 40.1s). Starting GCN...
    FINAL_RESULT: {'acc': {'train': 0.8428571428571429, 'valid': 0.72, 'test': 0.813}, 'wall_s': 17.84, 'cpu_s': 15.42, 'gpu_s': 2.4, 'wait_s': 40.14}
    [Time] wall=17.8s | cpu=15.4s | gpu=2.4s
    C:\Users\fbrev\Documents\Acadêmico\Simulações\Python\NoisyGL\predictor\Base_Predictor.py:114: UserWarning: expandable_segments not supported on this platform (Triggered internally at ..\c10/cuda/CUDAAllocatorConfig.h:28.)
    self.edge_index = self._cpu_edge_index.to(self.device)
    C:\Users\fbrev\Documents\Acadêmico\Simulações\Python\NoisyGL\predictor\Base_Predictor.py:144: UserWarning: Sparse CSR tensor support is in beta state. If you miss a functionality in the sparse tensor support, please submit a feature request to https://github.com/pytorch/pytorch/issues. (Triggered internally at ..\aten\src\ATen\SparseCsrTensorImpl.cpp:55.)
    self.adj_csr = self.adj.to_sparse_csr().to(self.device)
[I 2026-05-08 03:17:28,750] Trial 36 finished with value: 0.813 and parameters: {'lr': 0.005, 'weight_decay': 0.001, 'n_hidden': 256, 'n_layer': 3, 'dropout': 0.7157915143149871, 'knn_mode': 'd', 'k': 29, 'dexp': 1.2667158745773452, 'p_grd': 0.7721138425128696, 'unc_rem': 0.37471538223456136, 'unc_rel': 0.9331599455474684}. Best is trial 5 with value: 0.814.
    [CPU] Loading cora...
    DEBUG 3.1: Dataset init start
    DEBUG 3.2: prepare_data start cora
    ----Data statistics------'
    Name: cora
    #Nodes 2708
    #Edges 5278
    #Classes 7
    #Ave_degree 3.90
    ----Split statistics------'
    #Train samples 140 (default)
    #Val samples 500 (default)
    #Test samples 1000 (default)
    ----label noise information:------
    Instance dependent noise
    #Actual noise rate 0.13
    [cuda:0] LNPCC waiting for GPU slot...
    [cuda:0] Slot acquired (waited 16.3s). Starting GCN...
    FINAL_RESULT: {'acc': {'train': 0.8785714285714286, 'valid': 0.706, 'test': 0.811}, 'wall_s': 9.14, 'cpu_s': 7.25, 'gpu_s': 1.87, 'wait_s': 16.26}
    [Time] wall=9.1s | cpu=7.3s | gpu=1.9s
    C:\Users\fbrev\Documents\Acadêmico\Simulações\Python\NoisyGL\predictor\Base_Predictor.py:114: UserWarning: expandable_segments not supported on this platform (Triggered internally at ..\c10/cuda/CUDAAllocatorConfig.h:28.)
    self.edge_index = self._cpu_edge_index.to(self.device)
    C:\Users\fbrev\Documents\Acadêmico\Simulações\Python\NoisyGL\predictor\Base_Predictor.py:144: UserWarning: Sparse CSR tensor support is in beta state. If you miss a functionality in the sparse tensor support, please submit a feature request to https://github.com/pytorch/pytorch/issues. (Triggered internally at ..\aten\src\ATen\SparseCsrTensorImpl.cpp:55.)
    self.adj_csr = self.adj.to_sparse_csr().to(self.device)
[I 2026-05-08 03:18:00,070] Trial 37 finished with value: 0.811 and parameters: {'lr': 0.005, 'weight_decay': 0.0, 'n_hidden': 128, 'n_layer': 3, 'dropout': 0.7203267700805733, 'knn_mode': 's', 'k': 37, 'dexp': 0.6433493121947018, 'p_grd': 0.9395387208977648, 'unc_rem': 0.36721953239753746, 'unc_rel': 0.9585516294672558}. Best is trial 5 with value: 0.814.
    [CPU] Loading cora...
    DEBUG 3.1: Dataset init start
    DEBUG 3.2: prepare_data start cora
    ----Data statistics------'
    Name: cora
    #Nodes 2708
    #Edges 5278
    #Classes 7
    #Ave_degree 3.90
    ----Split statistics------'
    #Train samples 140 (default)
    #Val samples 500 (default)
    #Test samples 1000 (default)
    ----label noise information:------
    Instance dependent noise
    #Actual noise rate 0.13
    [cuda:0] LNPCC waiting for GPU slot...
    [cuda:0] Slot acquired (waited 33.7s). Starting GCN...
    FINAL_RESULT: {'acc': {'train': 0.8478260869565217, 'valid': 0.7, 'test': 0.802}, 'wall_s': 9.75, 'cpu_s': 7.35, 'gpu_s': 2.38, 'wait_s': 33.75}
    [Time] wall=9.7s | cpu=7.3s | gpu=2.4s
    C:\Users\fbrev\Documents\Acadêmico\Simulações\Python\NoisyGL\predictor\Base_Predictor.py:114: UserWarning: expandable_segments not supported on this platform (Triggered internally at ..\c10/cuda/CUDAAllocatorConfig.h:28.)
    self.edge_index = self._cpu_edge_index.to(self.device)
    C:\Users\fbrev\Documents\Acadêmico\Simulações\Python\NoisyGL\predictor\Base_Predictor.py:144: UserWarning: Sparse CSR tensor support is in beta state. If you miss a functionality in the sparse tensor support, please submit a feature request to https://github.com/pytorch/pytorch/issues. (Triggered internally at ..\aten\src\ATen\SparseCsrTensorImpl.cpp:55.)
    self.adj_csr = self.adj.to_sparse_csr().to(self.device)
[I 2026-05-08 03:18:49,009] Trial 38 finished with value: 0.802 and parameters: {'lr': 0.005, 'weight_decay': 0.0, 'n_hidden': 128, 'n_layer': 3, 'dropout': 0.7318408662921643, 'knn_mode': 's', 'k': 38, 'dexp': 0.20046724413600225, 'p_grd': 0.9497637809369044, 'unc_rem': 0.36134813520547493, 'unc_rel': 0.9480839984511631}. Best is trial 5 with value: 0.814.
    [CPU] Loading cora...
    DEBUG 3.1: Dataset init start
    DEBUG 3.2: prepare_data start cora
    ----Data statistics------'
    Name: cora
    #Nodes 2708
    #Edges 5278
    #Classes 7
    #Ave_degree 3.90
    ----Split statistics------'
    #Train samples 140 (default)
    #Val samples 500 (default)
    #Test samples 1000 (default)
    ----label noise information:------
    Instance dependent noise
    #Actual noise rate 0.13
    [cuda:0] LNPCC waiting for GPU slot...
    [cuda:0] Slot acquired (waited 2.6s). Starting GCN...
    FINAL_RESULT: {'acc': {'train': 0.7769784172661871, 'valid': 0.69, 'test': 0.792}, 'wall_s': 8.8, 'cpu_s': 6.91, 'gpu_s': 1.87, 'wait_s': 2.58}
    [Time] wall=8.8s | cpu=6.9s | gpu=1.9s
    C:\Users\fbrev\Documents\Acadêmico\Simulações\Python\NoisyGL\predictor\Base_Predictor.py:114: UserWarning: expandable_segments not supported on this platform (Triggered internally at ..\c10/cuda/CUDAAllocatorConfig.h:28.)
    self.edge_index = self._cpu_edge_index.to(self.device)
    C:\Users\fbrev\Documents\Acadêmico\Simulações\Python\NoisyGL\predictor\Base_Predictor.py:144: UserWarning: Sparse CSR tensor support is in beta state. If you miss a functionality in the sparse tensor support, please submit a feature request to https://github.com/pytorch/pytorch/issues. (Triggered internally at ..\aten\src\ATen\SparseCsrTensorImpl.cpp:55.)
    self.adj_csr = self.adj.to_sparse_csr().to(self.device)
[I 2026-05-08 03:19:05,904] Trial 39 finished with value: 0.792 and parameters: {'lr': 0.05, 'weight_decay': 0.0, 'n_hidden': 128, 'n_layer': 3, 'dropout': 0.7976090667853671, 'knn_mode': 's', 'k': 45, 'dexp': 1.2160652684997086, 'p_grd': 0.8636156668169446, 'unc_rem': 0.22243209924005364, 'unc_rel': 0.9278894067204226}. Best is trial 5 with value: 0.814.
    [CPU] Loading cora...
    DEBUG 3.1: Dataset init start
    DEBUG 3.2: prepare_data start cora
    ----Data statistics------'
    Name: cora
    #Nodes 2708
    #Edges 5278
    #Classes 7
    #Ave_degree 3.90
    ----Split statistics------'
    #Train samples 140 (default)
    #Val samples 500 (default)
    #Test samples 1000 (default)
    ----label noise information:------
    Instance dependent noise
    #Actual noise rate 0.13
    [cuda:0] LNPCC waiting for GPU slot...
    [cuda:0] Slot acquired (waited 35.5s). Starting GCN...
    FINAL_RESULT: {'acc': {'train': 0.8928571428571429, 'valid': 0.662, 'test': 0.726}, 'wall_s': 9.99, 'cpu_s': 7.61, 'gpu_s': 2.37, 'wait_s': 35.45}
    [Time] wall=10.0s | cpu=7.6s | gpu=2.4s
    C:\Users\fbrev\Documents\Acadêmico\Simulações\Python\NoisyGL\predictor\Base_Predictor.py:114: UserWarning: expandable_segments not supported on this platform (Triggered internally at ..\c10/cuda/CUDAAllocatorConfig.h:28.)
    self.edge_index = self._cpu_edge_index.to(self.device)
    C:\Users\fbrev\Documents\Acadêmico\Simulações\Python\NoisyGL\predictor\Base_Predictor.py:144: UserWarning: Sparse CSR tensor support is in beta state. If you miss a functionality in the sparse tensor support, please submit a feature request to https://github.com/pytorch/pytorch/issues. (Triggered internally at ..\aten\src\ATen\SparseCsrTensorImpl.cpp:55.)
    self.adj_csr = self.adj.to_sparse_csr().to(self.device)
[I 2026-05-08 03:19:56,835] Trial 40 finished with value: 0.726 and parameters: {'lr': 0.1, 'weight_decay': 0.0, 'n_hidden': 128, 'n_layer': 3, 'dropout': 0.6809355064563362, 'knn_mode': 's', 'k': 18, 'dexp': 1.1205205179277606, 'p_grd': 0.9342748839788276, 'unc_rem': 0.3355446175892504, 'unc_rel': 0.9966479725184461}. Best is trial 5 with value: 0.814.
    [CPU] Loading cora...
    DEBUG 3.1: Dataset init start
    DEBUG 3.2: prepare_data start cora
    ----Data statistics------'
    Name: cora
    #Nodes 2708
    #Edges 5278
    #Classes 7
    #Ave_degree 3.90
    ----Split statistics------'
    #Train samples 140 (default)
    #Val samples 500 (default)
    #Test samples 1000 (default)
    ----label noise information:------
    Instance dependent noise
    #Actual noise rate 0.13
    [cuda:0] LNPCC waiting for GPU slot...
    [cuda:0] Slot acquired (waited 193.8s). Starting GCN...
    FINAL_RESULT: {'acc': {'train': 0.8285714285714286, 'valid': 0.692, 'test': 0.811}, 'wall_s': 8.98, 'cpu_s': 6.7, 'gpu_s': 2.27, 'wait_s': 193.78}
    [Time] wall=9.0s | cpu=6.7s | gpu=2.3s
    C:\Users\fbrev\Documents\Acadêmico\Simulações\Python\NoisyGL\predictor\Base_Predictor.py:114: UserWarning: expandable_segments not supported on this platform (Triggered internally at ..\c10/cuda/CUDAAllocatorConfig.h:28.)
    self.edge_index = self._cpu_edge_index.to(self.device)
    C:\Users\fbrev\Documents\Acadêmico\Simulações\Python\NoisyGL\predictor\Base_Predictor.py:144: UserWarning: Sparse CSR tensor support is in beta state. If you miss a functionality in the sparse tensor support, please submit a feature request to https://github.com/pytorch/pytorch/issues. (Triggered internally at ..\aten\src\ATen\SparseCsrTensorImpl.cpp:55.)
    self.adj_csr = self.adj.to_sparse_csr().to(self.device)
[I 2026-05-08 03:23:25,223] Trial 41 finished with value: 0.811 and parameters: {'lr': 0.005, 'weight_decay': 0.0, 'n_hidden': 128, 'n_layer': 3, 'dropout': 0.7322770728915995, 'knn_mode': 's', 'k': 34, 'dexp': 1.846479862445377, 'p_grd': 0.7717593175322217, 'unc_rem': 0.47006707831222355, 'unc_rel': 0.8013456023928142}. Best is trial 5 with value: 0.814.
    [CPU] Loading cora...
    DEBUG 3.1: Dataset init start
    DEBUG 3.2: prepare_data start cora
    ----Data statistics------'
    Name: cora
    #Nodes 2708
    #Edges 5278
    #Classes 7
    #Ave_degree 3.90
    ----Split statistics------'
    #Train samples 140 (default)
    #Val samples 500 (default)
    #Test samples 1000 (default)
    ----label noise information:------
    Instance dependent noise
    #Actual noise rate 0.13
    [cuda:0] LNPCC waiting for GPU slot...
    [cuda:0] Slot acquired (waited 18.4s). Starting GCN...
    FINAL_RESULT: {'acc': {'train': 0.8285714285714286, 'valid': 0.698, 'test': 0.819}, 'wall_s': 9.14, 'cpu_s': 7.01, 'gpu_s': 2.12, 'wait_s': 18.37}
    [Time] wall=9.1s | cpu=7.0s | gpu=2.1s
    C:\Users\fbrev\Documents\Acadêmico\Simulações\Python\NoisyGL\predictor\Base_Predictor.py:114: UserWarning: expandable_segments not supported on this platform (Triggered internally at ..\c10/cuda/CUDAAllocatorConfig.h:28.)
    self.edge_index = self._cpu_edge_index.to(self.device)
    C:\Users\fbrev\Documents\Acadêmico\Simulações\Python\NoisyGL\predictor\Base_Predictor.py:144: UserWarning: Sparse CSR tensor support is in beta state. If you miss a functionality in the sparse tensor support, please submit a feature request to https://github.com/pytorch/pytorch/issues. (Triggered internally at ..\aten\src\ATen\SparseCsrTensorImpl.cpp:55.)
    self.adj_csr = self.adj.to_sparse_csr().to(self.device)
[I 2026-05-08 03:23:58,407] Trial 42 finished with value: 0.819 and parameters: {'lr': 0.005, 'weight_decay': 0.0, 'n_hidden': 128, 'n_layer': 3, 'dropout': 0.7350372326414045, 'knn_mode': 's', 'k': 38, 'dexp': 1.90268868516032, 'p_grd': 0.7800252117282197, 'unc_rem': 0.4647911530616054, 'unc_rel': 0.7192549954756247}. Best is trial 42 with value: 0.819.
    [CPU] Loading cora...
    DEBUG 3.1: Dataset init start
    DEBUG 3.2: prepare_data start cora
    ----Data statistics------'
    Name: cora
    #Nodes 2708
    #Edges 5278
    #Classes 7
    #Ave_degree 3.90
    ----Split statistics------'
    #Train samples 140 (default)
    #Val samples 500 (default)
    #Test samples 1000 (default)
    ----label noise information:------
    Instance dependent noise
    #Actual noise rate 0.13
    [cuda:0] LNPCC waiting for GPU slot...
    [cuda:0] Slot acquired (waited 52.9s). Starting GCN...
    FINAL_RESULT: {'acc': {'train': 0.8214285714285714, 'valid': 0.7, 'test': 0.819}, 'wall_s': 10.12, 'cpu_s': 7.43, 'gpu_s': 2.67, 'wait_s': 52.91}
    [Time] wall=10.1s | cpu=7.4s | gpu=2.7s
    C:\Users\fbrev\Documents\Acadêmico\Simulações\Python\NoisyGL\predictor\Base_Predictor.py:114: UserWarning: expandable_segments not supported on this platform (Triggered internally at ..\c10/cuda/CUDAAllocatorConfig.h:28.)
    self.edge_index = self._cpu_edge_index.to(self.device)
    C:\Users\fbrev\Documents\Acadêmico\Simulações\Python\NoisyGL\predictor\Base_Predictor.py:144: UserWarning: Sparse CSR tensor support is in beta state. If you miss a functionality in the sparse tensor support, please submit a feature request to https://github.com/pytorch/pytorch/issues. (Triggered internally at ..\aten\src\ATen\SparseCsrTensorImpl.cpp:55.)
    self.adj_csr = self.adj.to_sparse_csr().to(self.device)
[I 2026-05-08 03:25:07,541] Trial 43 finished with value: 0.819 and parameters: {'lr': 0.005, 'weight_decay': 0.0, 'n_hidden': 128, 'n_layer': 3, 'dropout': 0.735869357299728, 'knn_mode': 's', 'k': 37, 'dexp': 1.7865991049617314, 'p_grd': 0.8229905723840318, 'unc_rem': 0.3900395119532019, 'unc_rel': 0.708224912368066}. Best is trial 42 with value: 0.819.
    [CPU] Loading cora...
    DEBUG 3.1: Dataset init start
    DEBUG 3.2: prepare_data start cora
    ----Data statistics------'
    Name: cora
    #Nodes 2708
    #Edges 5278
    #Classes 7
    #Ave_degree 3.90
    ----Split statistics------'
    #Train samples 140 (default)
    #Val samples 500 (default)
    #Test samples 1000 (default)
    ----label noise information:------
    Instance dependent noise
    #Actual noise rate 0.13
    [cuda:0] LNPCC waiting for GPU slot...
    [cuda:0] Slot acquired (waited 49.2s). Starting GCN...
    FINAL_RESULT: {'acc': {'train': 0.85, 'valid': 0.704, 'test': 0.813}, 'wall_s': 11.12, 'cpu_s': 8.47, 'gpu_s': 2.63, 'wait_s': 49.23}
    [Time] wall=11.1s | cpu=8.5s | gpu=2.6s
    C:\Users\fbrev\Documents\Acadêmico\Simulações\Python\NoisyGL\predictor\Base_Predictor.py:114: UserWarning: expandable_segments not supported on this platform (Triggered internally at ..\c10/cuda/CUDAAllocatorConfig.h:28.)
    self.edge_index = self._cpu_edge_index.to(self.device)
    C:\Users\fbrev\Documents\Acadêmico\Simulações\Python\NoisyGL\predictor\Base_Predictor.py:144: UserWarning: Sparse CSR tensor support is in beta state. If you miss a functionality in the sparse tensor support, please submit a feature request to https://github.com/pytorch/pytorch/issues. (Triggered internally at ..\aten\src\ATen\SparseCsrTensorImpl.cpp:55.)
    self.adj_csr = self.adj.to_sparse_csr().to(self.device)
[I 2026-05-08 03:26:13,902] Trial 44 finished with value: 0.813 and parameters: {'lr': 0.005, 'weight_decay': 0.0, 'n_hidden': 128, 'n_layer': 3, 'dropout': 0.7590695022404896, 'knn_mode': 's', 'k': 40, 'dexp': 2.1649631150679998, 'p_grd': 0.8335089305814536, 'unc_rem': 0.24563243998960846, 'unc_rel': 0.7078531226451634}. Best is trial 42 with value: 0.819.
    [CPU] Loading cora...
    DEBUG 3.1: Dataset init start
    DEBUG 3.2: prepare_data start cora
    ----Data statistics------'
    Name: cora
    #Nodes 2708
    #Edges 5278
    #Classes 7
    #Ave_degree 3.90
    ----Split statistics------'
    #Train samples 140 (default)
    #Val samples 500 (default)
    #Test samples 1000 (default)
    ----label noise information:------
    Instance dependent noise
    #Actual noise rate 0.13
    [cuda:0] LNPCC waiting for GPU slot...
    [cuda:0] Slot acquired (waited 17.2s). Starting GCN...
    FINAL_RESULT: {'acc': {'train': 0.7928571428571428, 'valid': 0.714, 'test': 0.806}, 'wall_s': 10.62, 'cpu_s': 7.97, 'gpu_s': 2.63, 'wait_s': 17.18}
    [Time] wall=10.6s | cpu=8.0s | gpu=2.6s
    C:\Users\fbrev\Documents\Acadêmico\Simulações\Python\NoisyGL\predictor\Base_Predictor.py:114: UserWarning: expandable_segments not supported on this platform (Triggered internally at ..\c10/cuda/CUDAAllocatorConfig.h:28.)
    self.edge_index = self._cpu_edge_index.to(self.device)
    C:\Users\fbrev\Documents\Acadêmico\Simulações\Python\NoisyGL\predictor\Base_Predictor.py:144: UserWarning: Sparse CSR tensor support is in beta state. If you miss a functionality in the sparse tensor support, please submit a feature request to https://github.com/pytorch/pytorch/issues. (Triggered internally at ..\aten\src\ATen\SparseCsrTensorImpl.cpp:55.)
    self.adj_csr = self.adj.to_sparse_csr().to(self.device)
[I 2026-05-08 03:26:47,594] Trial 45 finished with value: 0.806 and parameters: {'lr': 0.01, 'weight_decay': 0.0, 'n_hidden': 128, 'n_layer': 3, 'dropout': 0.7697442948047528, 'knn_mode': 's', 'k': 41, 'dexp': 2.4166147492079264, 'p_grd': 0.8448142064095386, 'unc_rem': 0.2158871342282364, 'unc_rel': 0.7076710993399968}. Best is trial 42 with value: 0.819.
    [CPU] Loading cora...
    DEBUG 3.1: Dataset init start
    DEBUG 3.2: prepare_data start cora
    ----Data statistics------'
    Name: cora
    #Nodes 2708
    #Edges 5278
    #Classes 7
    #Ave_degree 3.90
    ----Split statistics------'
    #Train samples 140 (default)
    #Val samples 500 (default)
    #Test samples 1000 (default)
    ----label noise information:------
    Instance dependent noise
    #Actual noise rate 0.13
    [cuda:0] LNPCC waiting for GPU slot...
    [cuda:0] Slot acquired (waited 18.4s). Starting GCN...
    FINAL_RESULT: {'acc': {'train': 0.8642857142857143, 'valid': 0.71, 'test': 0.809}, 'wall_s': 10.23, 'cpu_s': 7.71, 'gpu_s': 2.51, 'wait_s': 18.39}
    [Time] wall=10.2s | cpu=7.7s | gpu=2.5s
    C:\Users\fbrev\Documents\Acadêmico\Simulações\Python\NoisyGL\predictor\Base_Predictor.py:114: UserWarning: expandable_segments not supported on this platform (Triggered internally at ..\c10/cuda/CUDAAllocatorConfig.h:28.)
    self.edge_index = self._cpu_edge_index.to(self.device)
    C:\Users\fbrev\Documents\Acadêmico\Simulações\Python\NoisyGL\predictor\Base_Predictor.py:144: UserWarning: Sparse CSR tensor support is in beta state. If you miss a functionality in the sparse tensor support, please submit a feature request to https://github.com/pytorch/pytorch/issues. (Triggered internally at ..\aten\src\ATen\SparseCsrTensorImpl.cpp:55.)
    self.adj_csr = self.adj.to_sparse_csr().to(self.device)
[I 2026-05-08 03:27:21,956] Trial 46 finished with value: 0.809 and parameters: {'lr': 0.005, 'weight_decay': 0.0, 'n_hidden': 128, 'n_layer': 3, 'dropout': 0.6875625794139179, 'knn_mode': 's', 'k': 45, 'dexp': 1.7872394621206193, 'p_grd': 0.8347051217319348, 'unc_rem': 0.24976978154078672, 'unc_rel': 0.6355062100700124}. Best is trial 42 with value: 0.819.
    [CPU] Loading cora...
    DEBUG 3.1: Dataset init start
    DEBUG 3.2: prepare_data start cora
    ----Data statistics------'
    Name: cora
    #Nodes 2708
    #Edges 5278
    #Classes 7
    #Ave_degree 3.90
    ----Split statistics------'
    #Train samples 140 (default)
    #Val samples 500 (default)
    #Test samples 1000 (default)
    ----label noise information:------
    Instance dependent noise
    #Actual noise rate 0.13
    [cuda:0] LNPCC waiting for GPU slot...
    [cuda:0] Slot acquired (waited 77.9s). Starting GCN...
    FINAL_RESULT: {'acc': {'train': 0.859375, 'valid': 0.684, 'test': 0.771}, 'wall_s': 9.16, 'cpu_s': 6.9, 'gpu_s': 2.23, 'wait_s': 77.89}
    [Time] wall=9.2s | cpu=6.9s | gpu=2.2s
    C:\Users\fbrev\Documents\Acadêmico\Simulações\Python\NoisyGL\predictor\Base_Predictor.py:114: UserWarning: expandable_segments not supported on this platform (Triggered internally at ..\c10/cuda/CUDAAllocatorConfig.h:28.)
    self.edge_index = self._cpu_edge_index.to(self.device)
    C:\Users\fbrev\Documents\Acadêmico\Simulações\Python\NoisyGL\predictor\Base_Predictor.py:144: UserWarning: Sparse CSR tensor support is in beta state. If you miss a functionality in the sparse tensor support, please submit a feature request to https://github.com/pytorch/pytorch/issues. (Triggered internally at ..\aten\src\ATen\SparseCsrTensorImpl.cpp:55.)
    self.adj_csr = self.adj.to_sparse_csr().to(self.device)
