[I 2026-05-07 20:24:17,530] Trial 23 finished with value: 0.483 and parameters: {'lr': 0.01, 'weight_decay': 0.05, 'n_hidden': 128, 'n_layer': 2, 'dropout': 0.596778262523707, 'knn_mode': 'd', 'k': 43, 'dexp': 6.095567388450924, 'p_grd': 0.8709563342980186, 'unc_rem': 0.38684128324039, 'unc_rel': 0.6324349769452373}. Best is trial 9 with value: 0.503.
    [CPU] Loading citeseer...
    DEBUG 3.1: Dataset init start
    DEBUG 3.2: prepare_data start citeseer
    ----Data statistics------'
    Name: citeseer
    #Nodes 3327
    #Edges 4552
    #Classes 6
    #Ave_degree 2.74
    ----Split statistics------'
    #Train samples 120 (default)
    #Val samples 500 (default)
    #Test samples 1000 (default)
    ----label noise information:------
    Instance dependent noise
    #Actual noise rate 0.41
    [cuda:0] LNPCC waiting for GPU slot...
    [cuda:0] Slot acquired (waited 327.8s). Starting GCN...
    FINAL_RESULT: {'acc': {'train': 0.95, 'valid': 0.378, 'test': 0.485}, 'wall_s': 28.02, 'cpu_s': 26.15, 'gpu_s': 1.84, 'wait_s': 327.75}
    [Time] wall=28.0s | cpu=26.2s | gpu=1.8s
    C:\Users\fbrev\Documents\Acadêmico\Simulações\Python\NoisyGL\predictor\Base_Predictor.py:114: UserWarning: expandable_segments not supported on this platform (Triggered internally at ..\c10/cuda/CUDAAllocatorConfig.h:28.)
    self.edge_index = self._cpu_edge_index.to(self.device)
    C:\Users\fbrev\Documents\Acadêmico\Simulações\Python\NoisyGL\predictor\Base_Predictor.py:144: UserWarning: Sparse CSR tensor support is in beta state. If you miss a functionality in the sparse tensor support, please submit a feature request to https://github.com/pytorch/pytorch/issues. (Triggered internally at ..\aten\src\ATen\SparseCsrTensorImpl.cpp:55.)
    self.adj_csr = self.adj.to_sparse_csr().to(self.device)
[I 2026-05-07 20:30:18,789] Trial 24 finished with value: 0.485 and parameters: {'lr': 0.01, 'weight_decay': 0.05, 'n_hidden': 128, 'n_layer': 2, 'dropout': 0.5668974161880973, 'knn_mode': 'd', 'k': 37, 'dexp': 5.734264205166192, 'p_grd': 0.7637604339859985, 'unc_rem': 0.38391977513701625, 'unc_rel': 0.6092708955774511}. Best is trial 9 with value: 0.503.
    [CPU] Loading citeseer...
    DEBUG 3.1: Dataset init start
    DEBUG 3.2: prepare_data start citeseer
    ----Data statistics------'
    Name: citeseer
    #Nodes 3327
    #Edges 4552
    #Classes 6
    #Ave_degree 2.74
    ----Split statistics------'
    #Train samples 120 (default)
    #Val samples 500 (default)
    #Test samples 1000 (default)
    ----label noise information:------
    Instance dependent noise
    #Actual noise rate 0.41
    [cuda:0] LNPCC waiting for GPU slot...
    [cuda:0] Slot acquired (waited 512.0s). Starting GCN...
    FINAL_RESULT: {'acc': {'train': 0.95, 'valid': 0.378, 'test': 0.496}, 'wall_s': 26.63, 'cpu_s': 24.91, 'gpu_s': 1.7, 'wait_s': 512.02}
    [Time] wall=26.6s | cpu=24.9s | gpu=1.7s
    C:\Users\fbrev\Documents\Acadêmico\Simulações\Python\NoisyGL\predictor\Base_Predictor.py:114: UserWarning: expandable_segments not supported on this platform (Triggered internally at ..\c10/cuda/CUDAAllocatorConfig.h:28.)
    self.edge_index = self._cpu_edge_index.to(self.device)
    C:\Users\fbrev\Documents\Acadêmico\Simulações\Python\NoisyGL\predictor\Base_Predictor.py:144: UserWarning: Sparse CSR tensor support is in beta state. If you miss a functionality in the sparse tensor support, please submit a feature request to https://github.com/pytorch/pytorch/issues. (Triggered internally at ..\aten\src\ATen\SparseCsrTensorImpl.cpp:55.)
    self.adj_csr = self.adj.to_sparse_csr().to(self.device)
[I 2026-05-07 20:39:23,404] Trial 25 finished with value: 0.496 and parameters: {'lr': 0.005, 'weight_decay': 0.05, 'n_hidden': 128, 'n_layer': 2, 'dropout': 0.5920322924305091, 'knn_mode': 'd', 'k': 37, 'dexp': 5.509230987477418, 'p_grd': 0.7618105881943948, 'unc_rem': 0.3850856475991409, 'unc_rel': 0.47027050925745784}. Best is trial 9 with value: 0.503.
    [CPU] Loading citeseer...
    DEBUG 3.1: Dataset init start
    DEBUG 3.2: prepare_data start citeseer
    ----Data statistics------'
    Name: citeseer
    #Nodes 3327
    #Edges 4552
    #Classes 6
    #Ave_degree 2.74
    ----Split statistics------'
    #Train samples 120 (default)
    #Val samples 500 (default)
    #Test samples 1000 (default)
    ----label noise information:------
    Instance dependent noise
    #Actual noise rate 0.41
    [cuda:0] LNPCC waiting for GPU slot...
    [cuda:0] Slot acquired (waited 159.9s). Starting GCN...
    FINAL_RESULT: {'acc': {'train': 0.9166666666666666, 'valid': 0.376, 'test': 0.497}, 'wall_s': 20.36, 'cpu_s': 18.8, 'gpu_s': 1.53, 'wait_s': 159.86}
    [Time] wall=20.4s | cpu=18.8s | gpu=1.5s
    C:\Users\fbrev\Documents\Acadêmico\Simulações\Python\NoisyGL\predictor\Base_Predictor.py:114: UserWarning: expandable_segments not supported on this platform (Triggered internally at ..\c10/cuda/CUDAAllocatorConfig.h:28.)
    self.edge_index = self._cpu_edge_index.to(self.device)
    C:\Users\fbrev\Documents\Acadêmico\Simulações\Python\NoisyGL\predictor\Base_Predictor.py:144: UserWarning: Sparse CSR tensor support is in beta state. If you miss a functionality in the sparse tensor support, please submit a feature request to https://github.com/pytorch/pytorch/issues. (Triggered internally at ..\aten\src\ATen\SparseCsrTensorImpl.cpp:55.)
    self.adj_csr = self.adj.to_sparse_csr().to(self.device)
[I 2026-05-07 20:42:29,392] Trial 26 finished with value: 0.497 and parameters: {'lr': 0.005, 'weight_decay': 0.05, 'n_hidden': 128, 'n_layer': 2, 'dropout': 0.5750723756971018, 'knn_mode': 'd', 'k': 35, 'dexp': 5.263712351819156, 'p_grd': 0.5745115360679827, 'unc_rem': 0.5626277065722622, 'unc_rel': 0.4828015414070721}. Best is trial 9 with value: 0.503.
    [CPU] Loading citeseer...
    DEBUG 3.1: Dataset init start
    DEBUG 3.2: prepare_data start citeseer
    ----Data statistics------'
    Name: citeseer
    #Nodes 3327
    #Edges 4552
    #Classes 6
    #Ave_degree 2.74
    ----Split statistics------'
    #Train samples 120 (default)
    #Val samples 500 (default)
    #Test samples 1000 (default)
    ----label noise information:------
    Instance dependent noise
    #Actual noise rate 0.41
    [cuda:0] LNPCC waiting for GPU slot...
    [cuda:0] Slot acquired (waited 162.9s). Starting GCN...
[I 2026-05-07 20:45:43,604] Trial 27 finished with value: 0.0 and parameters: {'lr': 0.005, 'weight_decay': 0.05, 'n_hidden': 128, 'n_layer': 2, 'dropout': 0.7918514851405309, 'knn_mode': 'd', 'k': 33, 'dexp': 5.104502838083267, 'p_grd': 0.6008607496880576, 'unc_rem': 0.5553976200881479, 'unc_rel': 0.4879977481525256}. Best is trial 9 with value: 0.503.
    [CPU] Loading citeseer...
    DEBUG 3.1: Dataset init start
    DEBUG 3.2: prepare_data start citeseer
    ----Data statistics------'
    Name: citeseer
    #Nodes 3327
    #Edges 4552
    #Classes 6
    #Ave_degree 2.74
    ----Split statistics------'
    #Train samples 120 (default)
    #Val samples 500 (default)
    #Test samples 1000 (default)
    ----label noise information:------
    Instance dependent noise
    #Actual noise rate 0.41
    [cuda:0] LNPCC waiting for GPU slot...
    [cuda:0] Slot acquired (waited 558.6s). Starting GCN...
    FINAL_RESULT: {'acc': {'train': 0.8545454545454545, 'valid': 0.22, 'test': 0.186}, 'wall_s': 11.03, 'cpu_s': 8.95, 'gpu_s': 2.04, 'wait_s': 558.65}
    [Time] wall=11.0s | cpu=8.9s | gpu=2.0s
    C:\Users\fbrev\Documents\Acadêmico\Simulações\Python\NoisyGL\predictor\Base_Predictor.py:114: UserWarning: expandable_segments not supported on this platform (Triggered internally at ..\c10/cuda/CUDAAllocatorConfig.h:28.)
    self.edge_index = self._cpu_edge_index.to(self.device)
    C:\Users\fbrev\Documents\Acadêmico\Simulações\Python\NoisyGL\predictor\Base_Predictor.py:144: UserWarning: Sparse CSR tensor support is in beta state. If you miss a functionality in the sparse tensor support, please submit a feature request to https://github.com/pytorch/pytorch/issues. (Triggered internally at ..\aten\src\ATen\SparseCsrTensorImpl.cpp:55.)
    self.adj_csr = self.adj.to_sparse_csr().to(self.device)
[I 2026-05-07 20:55:19,545] Trial 28 finished with value: 0.186 and parameters: {'lr': 0.005, 'weight_decay': 0.05, 'n_hidden': 128, 'n_layer': 2, 'dropout': 0.44421628598975743, 'knn_mode': 'd', 'k': 27, 'dexp': 4.983079111590956, 'p_grd': 0.1285589335753296, 'unc_rem': 0.21888817099730254, 'unc_rel': 0.45340975794352184}. Best is trial 9 with value: 0.503.
    [CPU] Loading citeseer...
    DEBUG 3.1: Dataset init start
    DEBUG 3.2: prepare_data start citeseer
    ----Data statistics------'
    Name: citeseer
    #Nodes 3327
    #Edges 4552
    #Classes 6
    #Ave_degree 2.74
    ----Split statistics------'
    #Train samples 120 (default)
    #Val samples 500 (default)
    #Test samples 1000 (default)
    ----label noise information:------
    Instance dependent noise
    #Actual noise rate 0.41
    [cuda:0] LNPCC waiting for GPU slot...
    [cuda:0] Slot acquired (waited 163.5s). Starting GCN...
    FINAL_RESULT: {'acc': {'train': 0.9826086956521739, 'valid': 0.37, 'test': 0.458}, 'wall_s': 18.72, 'cpu_s': 16.66, 'gpu_s': 2.02, 'wait_s': 163.54}
    [Time] wall=18.7s | cpu=16.7s | gpu=2.0s
    C:\Users\fbrev\Documents\Acadêmico\Simulações\Python\NoisyGL\predictor\Base_Predictor.py:114: UserWarning: expandable_segments not supported on this platform (Triggered internally at ..\c10/cuda/CUDAAllocatorConfig.h:28.)
    self.edge_index = self._cpu_edge_index.to(self.device)
    C:\Users\fbrev\Documents\Acadêmico\Simulações\Python\NoisyGL\predictor\Base_Predictor.py:144: UserWarning: Sparse CSR tensor support is in beta state. If you miss a functionality in the sparse tensor support, please submit a feature request to https://github.com/pytorch/pytorch/issues. (Triggered internally at ..\aten\src\ATen\SparseCsrTensorImpl.cpp:55.)
    self.adj_csr = self.adj.to_sparse_csr().to(self.device)
[I 2026-05-07 20:58:27,946] Trial 29 finished with value: 0.458 and parameters: {'lr': 0.005, 'weight_decay': 0.05, 'n_hidden': 128, 'n_layer': 2, 'dropout': 0.7131634922239651, 'knn_mode': 'd', 'k': 16, 'dexp': 6.568608363980706, 'p_grd': 0.5684858535950066, 'unc_rem': 0.025027439885451253, 'unc_rel': 0.5189986257662375}. Best is trial 9 with value: 0.503.
    [CPU] Loading citeseer...
    DEBUG 3.1: Dataset init start
    DEBUG 3.2: prepare_data start citeseer
    ----Data statistics------'
    Name: citeseer
    #Nodes 3327
    #Edges 4552
    #Classes 6
    #Ave_degree 2.74
    ----Split statistics------'
    #Train samples 120 (default)
    #Val samples 500 (default)
    #Test samples 1000 (default)
    ----label noise information:------
    Instance dependent noise
    #Actual noise rate 0.41
    [cuda:0] LNPCC waiting for GPU slot...
    [cuda:0] Slot acquired (waited 1071.2s). Starting GCN...
    FINAL_RESULT: {'acc': {'train': 0.9159663865546218, 'valid': 0.364, 'test': 0.487}, 'wall_s': 15.18, 'cpu_s': 13.44, 'gpu_s': 1.71, 'wait_s': 1071.15}
    [Time] wall=15.2s | cpu=13.4s | gpu=1.7s
    C:\Users\fbrev\Documents\Acadêmico\Simulações\Python\NoisyGL\predictor\Base_Predictor.py:114: UserWarning: expandable_segments not supported on this platform (Triggered internally at ..\c10/cuda/CUDAAllocatorConfig.h:28.)
    self.edge_index = self._cpu_edge_index.to(self.device)
    C:\Users\fbrev\Documents\Acadêmico\Simulações\Python\NoisyGL\predictor\Base_Predictor.py:144: UserWarning: Sparse CSR tensor support is in beta state. If you miss a functionality in the sparse tensor support, please submit a feature request to https://github.com/pytorch/pytorch/issues. (Triggered internally at ..\aten\src\ATen\SparseCsrTensorImpl.cpp:55.)
    self.adj_csr = self.adj.to_sparse_csr().to(self.device)
[I 2026-05-07 21:16:39,978] Trial 30 finished with value: 0.487 and parameters: {'lr': 0.005, 'weight_decay': 0.05, 'n_hidden': 128, 'n_layer': 2, 'dropout': 0.553998616759939, 'knn_mode': 'd', 'k': 36, 'dexp': 7.057726219272572, 'p_grd': 0.715072715404985, 'unc_rem': 0.5038003022006251, 'unc_rel': 0.5514169432782525}. Best is trial 9 with value: 0.503.
    [CPU] Loading citeseer...
    DEBUG 3.1: Dataset init start
    DEBUG 3.2: prepare_data start citeseer
    ----Data statistics------'
    Name: citeseer
    #Nodes 3327
    #Edges 4552
    #Classes 6
    #Ave_degree 2.74
    ----Split statistics------'
    #Train samples 120 (default)
    #Val samples 500 (default)
    #Test samples 1000 (default)
    ----label noise information:------
    Instance dependent noise
    #Actual noise rate 0.41
    [cuda:0] LNPCC waiting for GPU slot...
    [cuda:0] Slot acquired (waited 332.9s). Starting GCN...
    FINAL_RESULT: {'acc': {'train': 0.9166666666666666, 'valid': 0.378, 'test': 0.5}, 'wall_s': 20.65, 'cpu_s': 18.87, 'gpu_s': 1.75, 'wait_s': 332.88}
    [Time] wall=20.7s | cpu=18.9s | gpu=1.8s
    C:\Users\fbrev\Documents\Acadêmico\Simulações\Python\NoisyGL\predictor\Base_Predictor.py:114: UserWarning: expandable_segments not supported on this platform (Triggered internally at ..\c10/cuda/CUDAAllocatorConfig.h:28.)
    self.edge_index = self._cpu_edge_index.to(self.device)
    C:\Users\fbrev\Documents\Acadêmico\Simulações\Python\NoisyGL\predictor\Base_Predictor.py:144: UserWarning: Sparse CSR tensor support is in beta state. If you miss a functionality in the sparse tensor support, please submit a feature request to https://github.com/pytorch/pytorch/issues. (Triggered internally at ..\aten\src\ATen\SparseCsrTensorImpl.cpp:55.)
    self.adj_csr = self.adj.to_sparse_csr().to(self.device)
[I 2026-05-07 21:22:38,965] Trial 31 finished with value: 0.5 and parameters: {'lr': 0.005, 'weight_decay': 0.05, 'n_hidden': 128, 'n_layer': 2, 'dropout': 0.5338578259193886, 'knn_mode': 'd', 'k': 36, 'dexp': 7.007001918636617, 'p_grd': 0.715473501218562, 'unc_rem': 0.4910298888222995, 'unc_rel': 0.5456002575933928}. Best is trial 9 with value: 0.503.
    [CPU] Loading citeseer...
    DEBUG 3.1: Dataset init start
    DEBUG 3.2: prepare_data start citeseer
    ----Data statistics------'
    Name: citeseer
    #Nodes 3327
    #Edges 4552
    #Classes 6
    #Ave_degree 2.74
    ----Split statistics------'
    #Train samples 120 (default)
    #Val samples 500 (default)
    #Test samples 1000 (default)
    ----label noise information:------
    Instance dependent noise
    #Actual noise rate 0.41
    [cuda:0] LNPCC waiting for GPU slot...
    [cuda:0] Slot acquired (waited 327.8s). Starting GCN...
    FINAL_RESULT: {'acc': {'train': 0.95, 'valid': 0.378, 'test': 0.475}, 'wall_s': 22.06, 'cpu_s': 20.44, 'gpu_s': 1.59, 'wait_s': 327.8}
    [Time] wall=22.1s | cpu=20.4s | gpu=1.6s
    C:\Users\fbrev\Documents\Acadêmico\Simulações\Python\NoisyGL\predictor\Base_Predictor.py:114: UserWarning: expandable_segments not supported on this platform (Triggered internally at ..\c10/cuda/CUDAAllocatorConfig.h:28.)
    self.edge_index = self._cpu_edge_index.to(self.device)
    C:\Users\fbrev\Documents\Acadêmico\Simulações\Python\NoisyGL\predictor\Base_Predictor.py:144: UserWarning: Sparse CSR tensor support is in beta state. If you miss a functionality in the sparse tensor support, please submit a feature request to https://github.com/pytorch/pytorch/issues. (Triggered internally at ..\aten\src\ATen\SparseCsrTensorImpl.cpp:55.)
    self.adj_csr = self.adj.to_sparse_csr().to(self.device)
[I 2026-05-07 21:28:34,249] Trial 32 finished with value: 0.475 and parameters: {'lr': 0.005, 'weight_decay': 0.05, 'n_hidden': 128, 'n_layer': 2, 'dropout': 0.6634148291378318, 'knn_mode': 'd', 'k': 29, 'dexp': 6.304318726765304, 'p_grd': 0.6699827818352972, 'unc_rem': 0.4565362430741669, 'unc_rel': 0.39596546307212616}. Best is trial 9 with value: 0.503.
    [CPU] Loading citeseer...
    DEBUG 3.1: Dataset init start
    DEBUG 3.2: prepare_data start citeseer
    ----Data statistics------'
    Name: citeseer
    #Nodes 3327
    #Edges 4552
    #Classes 6
    #Ave_degree 2.74
    ----Split statistics------'
    #Train samples 120 (default)
    #Val samples 500 (default)
    #Test samples 1000 (default)
    ----label noise information:------
    Instance dependent noise
    #Actual noise rate 0.41
    [cuda:0] LNPCC waiting for GPU slot...
    [cuda:0] Slot acquired (waited 158.8s). Starting GCN...
    FINAL_RESULT: {'acc': {'train': 0.9166666666666666, 'valid': 0.378, 'test': 0.499}, 'wall_s': 18.4, 'cpu_s': 16.48, 'gpu_s': 1.89, 'wait_s': 158.85}
    [Time] wall=18.4s | cpu=16.5s | gpu=1.9s
    C:\Users\fbrev\Documents\Acadêmico\Simulações\Python\NoisyGL\predictor\Base_Predictor.py:114: UserWarning: expandable_segments not supported on this platform (Triggered internally at ..\c10/cuda/CUDAAllocatorConfig.h:28.)
    self.edge_index = self._cpu_edge_index.to(self.device)
    C:\Users\fbrev\Documents\Acadêmico\Simulações\Python\NoisyGL\predictor\Base_Predictor.py:144: UserWarning: Sparse CSR tensor support is in beta state. If you miss a functionality in the sparse tensor support, please submit a feature request to https://github.com/pytorch/pytorch/issues. (Triggered internally at ..\aten\src\ATen\SparseCsrTensorImpl.cpp:55.)
    self.adj_csr = self.adj.to_sparse_csr().to(self.device)
[I 2026-05-07 21:31:37,050] Trial 33 finished with value: 0.499 and parameters: {'lr': 0.005, 'weight_decay': 0.05, 'n_hidden': 128, 'n_layer': 2, 'dropout': 0.5442347690789171, 'knn_mode': 'd', 'k': 39, 'dexp': 4.91126054863768, 'p_grd': 0.5227697470333484, 'unc_rem': 0.5431560377080047, 'unc_rel': 0.6851336034512144}. Best is trial 9 with value: 0.503.
    [CPU] Loading citeseer...
    DEBUG 3.1: Dataset init start
    DEBUG 3.2: prepare_data start citeseer
    ----Data statistics------'
    Name: citeseer
    #Nodes 3327
    #Edges 4552
    #Classes 6
    #Ave_degree 2.74
    ----Split statistics------'
    #Train samples 120 (default)
    #Val samples 500 (default)
    #Test samples 1000 (default)
    ----label noise information:------
    Instance dependent noise
    #Actual noise rate 0.41
    [cuda:0] LNPCC waiting for GPU slot...
    [cuda:0] Slot acquired (waited 333.2s). Starting GCN...
    FINAL_RESULT: {'acc': {'train': 0.9416666666666667, 'valid': 0.384, 'test': 0.5}, 'wall_s': 13.86, 'cpu_s': 12.24, 'gpu_s': 1.59, 'wait_s': 333.23}
    [Time] wall=13.9s | cpu=12.2s | gpu=1.6s
    C:\Users\fbrev\Documents\Acadêmico\Simulações\Python\NoisyGL\predictor\Base_Predictor.py:114: UserWarning: expandable_segments not supported on this platform (Triggered internally at ..\c10/cuda/CUDAAllocatorConfig.h:28.)
    self.edge_index = self._cpu_edge_index.to(self.device)
    C:\Users\fbrev\Documents\Acadêmico\Simulações\Python\NoisyGL\predictor\Base_Predictor.py:144: UserWarning: Sparse CSR tensor support is in beta state. If you miss a functionality in the sparse tensor support, please submit a feature request to https://github.com/pytorch/pytorch/issues. (Triggered internally at ..\aten\src\ATen\SparseCsrTensorImpl.cpp:55.)
    self.adj_csr = self.adj.to_sparse_csr().to(self.device)
[I 2026-05-07 21:37:29,660] Trial 34 finished with value: 0.5 and parameters: {'lr': 0.005, 'weight_decay': 0.05, 'n_hidden': 128, 'n_layer': 2, 'dropout': 0.4603261503717191, 'knn_mode': 'd', 'k': 40, 'dexp': 6.877717452325776, 'p_grd': 0.5745031117582604, 'unc_rem': 0.6357935922444791, 'unc_rel': 0.6896415919791087}. Best is trial 9 with value: 0.503.
    [CPU] Loading citeseer...
    DEBUG 3.1: Dataset init start
    DEBUG 3.2: prepare_data start citeseer
    ----Data statistics------'
    Name: citeseer
    #Nodes 3327
    #Edges 4552
    #Classes 6
    #Ave_degree 2.74
    ----Split statistics------'
    #Train samples 120 (default)
    #Val samples 500 (default)
    #Test samples 1000 (default)
    ----label noise information:------
    Instance dependent noise
    #Actual noise rate 0.41
    [cuda:0] LNPCC waiting for GPU slot...
    [cuda:0] Slot acquired (waited 2515.9s). Starting GCN...
    FINAL_RESULT: {'acc': {'train': 0.925, 'valid': 0.34, 'test': 0.425}, 'wall_s': 14.51, 'cpu_s': 12.3, 'gpu_s': 2.19, 'wait_s': 2515.93}
    [Time] wall=14.5s | cpu=12.3s | gpu=2.2s
    C:\Users\fbrev\Documents\Acadêmico\Simulações\Python\NoisyGL\predictor\Base_Predictor.py:114: UserWarning: expandable_segments not supported on this platform (Triggered internally at ..\c10/cuda/CUDAAllocatorConfig.h:28.)
    self.edge_index = self._cpu_edge_index.to(self.device)
    C:\Users\fbrev\Documents\Acadêmico\Simulações\Python\NoisyGL\predictor\Base_Predictor.py:144: UserWarning: Sparse CSR tensor support is in beta state. If you miss a functionality in the sparse tensor support, please submit a feature request to https://github.com/pytorch/pytorch/issues. (Triggered internally at ..\aten\src\ATen\SparseCsrTensorImpl.cpp:55.)
    self.adj_csr = self.adj.to_sparse_csr().to(self.device)
