[I 2026-05-03 02:58:10,051] Trial 49 finished with value: 0.5185612935159215 and parameters: {'lr': 0.001, 'weight_decay': 0.0001, 'n_hidden': 256, 'n_layer': 2, 'dropout': 0.4179449302426331, 'knn_mode': 'd', 'k': 46, 'dexp': 4.7608966068728815, 'p_grd': 0.2946114657953558, 'unc_rem': 0.6630800729118838, 'unc_rel': 0.24122829134811702}. Best is trial 30 with value: 0.5302755320904141.

[Retest] Phase 1 Finished. Validating Top 3 (10 runs each)...

  [Retest] Candidate 1/3 (Trial 30, HPO_acc=0.5303)
    [CPU] Loading flickr...
    DEBUG 3.1: Dataset init start
    DEBUG 3.2: prepare_data start flickr
    ----Data statistics------'
    Name: flickr
    #Nodes 7575
    #Edges 239738
    #Classes 9
    #Ave_degree 63.30
    ----Split statistics------'
    #Train samples 378 (5.0 % of nodes)
    #Val samples 1136 (15.0 % of nodes)
    #Test samples 6061 (remaining)
    ----label noise information:------
    Instance dependent noise
    #Actual noise rate 0.30
    [cuda:1] LNPCC waiting for GPU slot...
    [cuda:1] Slot acquired (waited 271.0s). Starting GCN...
    FINAL_RESULT: {'acc': {'train': 0.8766756032171582, 'valid': 0.37059859154929575, 'test': 0.5353901996370236}, 'wall_s': 134.63, 'cpu_s': 130.65, 'gpu_s': 3.74, 'wait_s': 271.01}
    [Time] wall=134.6s | cpu=130.6s | gpu=3.7s
    C:\Users\fbrev\anaconda3\envs\noisygl\Lib\site-packages\torch\_utils.py:315: UserWarning: Sparse CSR tensor support is in beta state. If you miss a functionality in the sparse tensor support, please submit a feature request to https://github.com/pytorch/pytorch/issues. (Triggered internally at ..\aten\src\ATen\SparseCsrTensorImpl.cpp:55.)
    result = torch.sparse_compressed_tensor(
    C:\Users\fbrev\Documents\Acadêmico\Simulações\Python\NoisyGL\predictor\Base_Predictor.py:114: UserWarning: expandable_segments not supported on this platform (Triggered internally at ..\c10/cuda/CUDAAllocatorConfig.h:28.)
    self.edge_index = self._cpu_edge_index.to(self.device)
    [CPU] Loading flickr...
    DEBUG 3.1: Dataset init start
    DEBUG 3.2: prepare_data start flickr
    ----Data statistics------'
    Name: flickr
    #Nodes 7575
    #Edges 239738
    #Classes 9
    #Ave_degree 63.30
    ----Split statistics------'
    #Train samples 378 (5.0 % of nodes)
    #Val samples 1136 (15.0 % of nodes)
    #Test samples 6061 (remaining)
    ----label noise information:------
    Instance dependent noise
    #Actual noise rate 0.30
    [cuda:1] LNPCC waiting for GPU slot...
    [cuda:1] Slot acquired (waited 5.7s). Starting GCN...
    FINAL_RESULT: {'acc': {'train': 0.739247311827957, 'valid': 0.4163732394366197, 'test': 0.4971126876753011}, 'wall_s': 122.94, 'cpu_s': 119.06, 'gpu_s': 3.64, 'wait_s': 5.68}
    [Time] wall=122.9s | cpu=119.1s | gpu=3.6s
    C:\Users\fbrev\anaconda3\envs\noisygl\Lib\site-packages\torch\_utils.py:315: UserWarning: Sparse CSR tensor support is in beta state. If you miss a functionality in the sparse tensor support, please submit a feature request to https://github.com/pytorch/pytorch/issues. (Triggered internally at ..\aten\src\ATen\SparseCsrTensorImpl.cpp:55.)
    result = torch.sparse_compressed_tensor(
    C:\Users\fbrev\Documents\Acadêmico\Simulações\Python\NoisyGL\predictor\Base_Predictor.py:114: UserWarning: expandable_segments not supported on this platform (Triggered internally at ..\c10/cuda/CUDAAllocatorConfig.h:28.)
    self.edge_index = self._cpu_edge_index.to(self.device)
    [CPU] Loading flickr...
    DEBUG 3.1: Dataset init start
    DEBUG 3.2: prepare_data start flickr
    ----Data statistics------'
    Name: flickr
    #Nodes 7575
    #Edges 239738
    #Classes 9
    #Ave_degree 63.30
    ----Split statistics------'
    #Train samples 378 (5.0 % of nodes)
    #Val samples 1136 (15.0 % of nodes)
    #Test samples 6061 (remaining)
    ----label noise information:------
    Instance dependent noise
    #Actual noise rate 0.30
    [cuda:1] LNPCC waiting for GPU slot...
    [cuda:1] Slot acquired (waited 7.2s). Starting GCN...
    FINAL_RESULT: {'acc': {'train': 0.768, 'valid': 0.38116197183098594, 'test': 0.5243359181653192}, 'wall_s': 127.94, 'cpu_s': 124.01, 'gpu_s': 3.69, 'wait_s': 7.19}
    [Time] wall=127.9s | cpu=124.0s | gpu=3.7s
    C:\Users\fbrev\anaconda3\envs\noisygl\Lib\site-packages\torch\_utils.py:315: UserWarning: Sparse CSR tensor support is in beta state. If you miss a functionality in the sparse tensor support, please submit a feature request to https://github.com/pytorch/pytorch/issues. (Triggered internally at ..\aten\src\ATen\SparseCsrTensorImpl.cpp:55.)
    result = torch.sparse_compressed_tensor(
    C:\Users\fbrev\Documents\Acadêmico\Simulações\Python\NoisyGL\predictor\Base_Predictor.py:114: UserWarning: expandable_segments not supported on this platform (Triggered internally at ..\c10/cuda/CUDAAllocatorConfig.h:28.)
    self.edge_index = self._cpu_edge_index.to(self.device)
    [CPU] Loading flickr...
    DEBUG 3.1: Dataset init start
    DEBUG 3.2: prepare_data start flickr
    ----Data statistics------'
    Name: flickr
    #Nodes 7575
    #Edges 239738
    #Classes 9
    #Ave_degree 63.30
    ----Split statistics------'
    #Train samples 378 (5.0 % of nodes)
    #Val samples 1136 (15.0 % of nodes)
    #Test samples 6061 (remaining)
    ----label noise information:------
    Instance dependent noise
    #Actual noise rate 0.30
    [cuda:1] LNPCC waiting for GPU slot...
    [cuda:1] Slot acquired (waited 0.7s). Starting GCN...
    FINAL_RESULT: {'acc': {'train': 0.8010610079575596, 'valid': 0.4014084507042254, 'test': 0.5353901996370236}, 'wall_s': 148.76, 'cpu_s': 144.86, 'gpu_s': 3.66, 'wait_s': 0.66}
    [Time] wall=148.8s | cpu=144.9s | gpu=3.7s
    C:\Users\fbrev\anaconda3\envs\noisygl\Lib\site-packages\torch\_utils.py:315: UserWarning: Sparse CSR tensor support is in beta state. If you miss a functionality in the sparse tensor support, please submit a feature request to https://github.com/pytorch/pytorch/issues. (Triggered internally at ..\aten\src\ATen\SparseCsrTensorImpl.cpp:55.)
    result = torch.sparse_compressed_tensor(
    C:\Users\fbrev\Documents\Acadêmico\Simulações\Python\NoisyGL\predictor\Base_Predictor.py:114: UserWarning: expandable_segments not supported on this platform (Triggered internally at ..\c10/cuda/CUDAAllocatorConfig.h:28.)
    self.edge_index = self._cpu_edge_index.to(self.device)
    [CPU] Loading flickr...
    DEBUG 3.1: Dataset init start
    DEBUG 3.2: prepare_data start flickr
    ----Data statistics------'
    Name: flickr
    #Nodes 7575
    #Edges 239738
    #Classes 9
    #Ave_degree 63.30
    ----Split statistics------'
    #Train samples 378 (5.0 % of nodes)
    #Val samples 1136 (15.0 % of nodes)
    #Test samples 6061 (remaining)
    ----label noise information:------
    Instance dependent noise
    #Actual noise rate 0.30
    [cuda:1] LNPCC waiting for GPU slot...
    [cuda:1] Slot acquired (waited 11.1s). Starting GCN...
    FINAL_RESULT: {'acc': {'train': 0.9105691056910569, 'valid': 0.3855633802816901, 'test': 0.5023923444976076}, 'wall_s': 118.27, 'cpu_s': 114.32, 'gpu_s': 3.7, 'wait_s': 11.1}
    [Time] wall=118.3s | cpu=114.3s | gpu=3.7s
    C:\Users\fbrev\anaconda3\envs\noisygl\Lib\site-packages\torch\_utils.py:315: UserWarning: Sparse CSR tensor support is in beta state. If you miss a functionality in the sparse tensor support, please submit a feature request to https://github.com/pytorch/pytorch/issues. (Triggered internally at ..\aten\src\ATen\SparseCsrTensorImpl.cpp:55.)
    result = torch.sparse_compressed_tensor(
    C:\Users\fbrev\Documents\Acadêmico\Simulações\Python\NoisyGL\predictor\Base_Predictor.py:114: UserWarning: expandable_segments not supported on this platform (Triggered internally at ..\c10/cuda/CUDAAllocatorConfig.h:28.)
    self.edge_index = self._cpu_edge_index.to(self.device)
    [CPU] Loading flickr...
    DEBUG 3.1: Dataset init start
    DEBUG 3.2: prepare_data start flickr
    ----Data statistics------'
    Name: flickr
    #Nodes 7575
    #Edges 239738
    #Classes 9
    #Ave_degree 63.30
    ----Split statistics------'
    #Train samples 378 (5.0 % of nodes)
    #Val samples 1136 (15.0 % of nodes)
    #Test samples 6061 (remaining)
    ----label noise information:------
    Instance dependent noise
    #Actual noise rate 0.30
    [cuda:1] LNPCC waiting for GPU slot...
    [cuda:1] Slot acquired (waited 148.3s). Starting GCN...
    FINAL_RESULT: {'acc': {'train': 0.9090909090909091, 'valid': 0.3926056338028169, 'test': 0.49661771984820985}, 'wall_s': 130.78, 'cpu_s': 126.64, 'gpu_s': 3.9, 'wait_s': 148.3}
    [Time] wall=130.8s | cpu=126.6s | gpu=3.9s
    C:\Users\fbrev\anaconda3\envs\noisygl\Lib\site-packages\torch\_utils.py:315: UserWarning: Sparse CSR tensor support is in beta state. If you miss a functionality in the sparse tensor support, please submit a feature request to https://github.com/pytorch/pytorch/issues. (Triggered internally at ..\aten\src\ATen\SparseCsrTensorImpl.cpp:55.)
    result = torch.sparse_compressed_tensor(
    C:\Users\fbrev\Documents\Acadêmico\Simulações\Python\NoisyGL\predictor\Base_Predictor.py:114: UserWarning: expandable_segments not supported on this platform (Triggered internally at ..\c10/cuda/CUDAAllocatorConfig.h:28.)
    self.edge_index = self._cpu_edge_index.to(self.device)
    [CPU] Loading flickr...
    DEBUG 3.1: Dataset init start
    DEBUG 3.2: prepare_data start flickr
    ----Data statistics------'
    Name: flickr
    #Nodes 7575
    #Edges 239738
    #Classes 9
    #Ave_degree 63.30
    ----Split statistics------'
    #Train samples 378 (5.0 % of nodes)
    #Val samples 1136 (15.0 % of nodes)
    #Test samples 6061 (remaining)
    ----label noise information:------
    Instance dependent noise
    #Actual noise rate 0.30
    [cuda:1] LNPCC waiting for GPU slot...
    [cuda:1] Slot acquired (waited 139.9s). Starting GCN...
    FINAL_RESULT: {'acc': {'train': 0.8288770053475936, 'valid': 0.4102112676056338, 'test': 0.5056921300115492}, 'wall_s': 143.61, 'cpu_s': 139.46, 'gpu_s': 3.84, 'wait_s': 139.87}
    [Time] wall=143.6s | cpu=139.5s | gpu=3.8s
    C:\Users\fbrev\anaconda3\envs\noisygl\Lib\site-packages\torch\_utils.py:315: UserWarning: Sparse CSR tensor support is in beta state. If you miss a functionality in the sparse tensor support, please submit a feature request to https://github.com/pytorch/pytorch/issues. (Triggered internally at ..\aten\src\ATen\SparseCsrTensorImpl.cpp:55.)
    result = torch.sparse_compressed_tensor(
    C:\Users\fbrev\Documents\Acadêmico\Simulações\Python\NoisyGL\predictor\Base_Predictor.py:114: UserWarning: expandable_segments not supported on this platform (Triggered internally at ..\c10/cuda/CUDAAllocatorConfig.h:28.)
    self.edge_index = self._cpu_edge_index.to(self.device)
    [CPU] Loading flickr...
    DEBUG 3.1: Dataset init start
    DEBUG 3.2: prepare_data start flickr
    ----Data statistics------'
    Name: flickr
    #Nodes 7575
    #Edges 239738
    #Classes 9
    #Ave_degree 63.30
    ----Split statistics------'
    #Train samples 378 (5.0 % of nodes)
    #Val samples 1136 (15.0 % of nodes)
    #Test samples 6061 (remaining)
    ----label noise information:------
    Instance dependent noise
    #Actual noise rate 0.31
    [cuda:1] LNPCC waiting for GPU slot...
    [cuda:1] Slot acquired (waited 6.0s). Starting GCN...
    FINAL_RESULT: {'acc': {'train': 0.8315508021390374, 'valid': 0.4102112676056338, 'test': 0.5373700709453886}, 'wall_s': 129.01, 'cpu_s': 125.03, 'gpu_s': 3.71, 'wait_s': 5.99}
    [Time] wall=129.0s | cpu=125.0s | gpu=3.7s
    C:\Users\fbrev\anaconda3\envs\noisygl\Lib\site-packages\torch\_utils.py:315: UserWarning: Sparse CSR tensor support is in beta state. If you miss a functionality in the sparse tensor support, please submit a feature request to https://github.com/pytorch/pytorch/issues. (Triggered internally at ..\aten\src\ATen\SparseCsrTensorImpl.cpp:55.)
    result = torch.sparse_compressed_tensor(
    C:\Users\fbrev\Documents\Acadêmico\Simulações\Python\NoisyGL\predictor\Base_Predictor.py:114: UserWarning: expandable_segments not supported on this platform (Triggered internally at ..\c10/cuda/CUDAAllocatorConfig.h:28.)
    self.edge_index = self._cpu_edge_index.to(self.device)
    [CPU] Loading flickr...
    DEBUG 3.1: Dataset init start
    DEBUG 3.2: prepare_data start flickr
    ----Data statistics------'
    Name: flickr
    #Nodes 7575
    #Edges 239738
    #Classes 9
    #Ave_degree 63.30
    ----Split statistics------'
    #Train samples 378 (5.0 % of nodes)
    #Val samples 1136 (15.0 % of nodes)
    #Test samples 6061 (remaining)
    ----label noise information:------
    Instance dependent noise
    #Actual noise rate 0.29
    [cuda:1] LNPCC waiting for GPU slot...
    [cuda:1] Slot acquired (waited 28.2s). Starting GCN...
    FINAL_RESULT: {'acc': {'train': 0.8386243386243386, 'valid': 0.3882042253521127, 'test': 0.5236759610625309}, 'wall_s': 102.54, 'cpu_s': 98.64, 'gpu_s': 3.67, 'wait_s': 28.24}
    [Time] wall=102.5s | cpu=98.6s | gpu=3.7s
    C:\Users\fbrev\anaconda3\envs\noisygl\Lib\site-packages\torch\_utils.py:315: UserWarning: Sparse CSR tensor support is in beta state. If you miss a functionality in the sparse tensor support, please submit a feature request to https://github.com/pytorch/pytorch/issues. (Triggered internally at ..\aten\src\ATen\SparseCsrTensorImpl.cpp:55.)
    result = torch.sparse_compressed_tensor(
    C:\Users\fbrev\Documents\Acadêmico\Simulações\Python\NoisyGL\predictor\Base_Predictor.py:114: UserWarning: expandable_segments not supported on this platform (Triggered internally at ..\c10/cuda/CUDAAllocatorConfig.h:28.)
    self.edge_index = self._cpu_edge_index.to(self.device)
    [CPU] Loading flickr...
    DEBUG 3.1: Dataset init start
    DEBUG 3.2: prepare_data start flickr
    ----Data statistics------'
    Name: flickr
    #Nodes 7575
    #Edges 239738
    #Classes 9
    #Ave_degree 63.30
    ----Split statistics------'
    #Train samples 378 (5.0 % of nodes)
    #Val samples 1136 (15.0 % of nodes)
    #Test samples 6061 (remaining)
    ----label noise information:------
    Instance dependent noise
    #Actual noise rate 0.30
    [cuda:1] LNPCC waiting for GPU slot...
    [cuda:1] Slot acquired (waited 3.2s). Starting GCN...
    FINAL_RESULT: {'acc': {'train': 0.739946380697051, 'valid': 0.40933098591549294, 'test': 0.5017323873948193}, 'wall_s': 132.59, 'cpu_s': 128.66, 'gpu_s': 3.7, 'wait_s': 3.24}
    [Time] wall=132.6s | cpu=128.7s | gpu=3.7s
    C:\Users\fbrev\anaconda3\envs\noisygl\Lib\site-packages\torch\_utils.py:315: UserWarning: Sparse CSR tensor support is in beta state. If you miss a functionality in the sparse tensor support, please submit a feature request to https://github.com/pytorch/pytorch/issues. (Triggered internally at ..\aten\src\ATen\SparseCsrTensorImpl.cpp:55.)
    result = torch.sparse_compressed_tensor(
    C:\Users\fbrev\Documents\Acadêmico\Simulações\Python\NoisyGL\predictor\Base_Predictor.py:114: UserWarning: expandable_segments not supported on this platform (Triggered internally at ..\c10/cuda/CUDAAllocatorConfig.h:28.)
    self.edge_index = self._cpu_edge_index.to(self.device)
  [Retest] Candidate 1 Avg: 0.5160

  [Retest] Candidate 2/3 (Trial 31, HPO_acc=0.5295)
    [CPU] Loading flickr...
    DEBUG 3.1: Dataset init start
    DEBUG 3.2: prepare_data start flickr
    ----Data statistics------'
    Name: flickr
    #Nodes 7575
    #Edges 239738
    #Classes 9
    #Ave_degree 63.30
    ----Split statistics------'
    #Train samples 378 (5.0 % of nodes)
    #Val samples 1136 (15.0 % of nodes)
    #Test samples 6061 (remaining)
    ----label noise information:------
    Instance dependent noise
    #Actual noise rate 0.30
    [cuda:1] LNPCC waiting for GPU slot...
    [cuda:1] Slot acquired (waited 150.6s). Starting GCN...
    FINAL_RESULT: {'acc': {'train': 0.9098143236074271, 'valid': 0.37940140845070425, 'test': 0.5479293845900016}, 'wall_s': 109.4, 'cpu_s': 105.55, 'gpu_s': 3.61, 'wait_s': 150.61}
    [Time] wall=109.4s | cpu=105.6s | gpu=3.6s
    C:\Users\fbrev\anaconda3\envs\noisygl\Lib\site-packages\torch\_utils.py:315: UserWarning: Sparse CSR tensor support is in beta state. If you miss a functionality in the sparse tensor support, please submit a feature request to https://github.com/pytorch/pytorch/issues. (Triggered internally at ..\aten\src\ATen\SparseCsrTensorImpl.cpp:55.)
    result = torch.sparse_compressed_tensor(
    C:\Users\fbrev\Documents\Acadêmico\Simulações\Python\NoisyGL\predictor\Base_Predictor.py:114: UserWarning: expandable_segments not supported on this platform (Triggered internally at ..\c10/cuda/CUDAAllocatorConfig.h:28.)
    self.edge_index = self._cpu_edge_index.to(self.device)
    [CPU] Loading flickr...
    DEBUG 3.1: Dataset init start
    DEBUG 3.2: prepare_data start flickr
    ----Data statistics------'
    Name: flickr
    #Nodes 7575
    #Edges 239738
    #Classes 9
    #Ave_degree 63.30
    ----Split statistics------'
    #Train samples 378 (5.0 % of nodes)
    #Val samples 1136 (15.0 % of nodes)
    #Test samples 6061 (remaining)
    ----label noise information:------
    Instance dependent noise
    #Actual noise rate 0.30
    [cuda:1] LNPCC waiting for GPU slot...
    [cuda:1] Slot acquired (waited 233.6s). Starting GCN...
    FINAL_RESULT: {'acc': {'train': 0.8252688172043011, 'valid': 0.4225352112676056, 'test': 0.5122917010394324}, 'wall_s': 136.13, 'cpu_s': 132.29, 'gpu_s': 3.6, 'wait_s': 233.65}
    [Time] wall=136.1s | cpu=132.3s | gpu=3.6s
    C:\Users\fbrev\anaconda3\envs\noisygl\Lib\site-packages\torch\_utils.py:315: UserWarning: Sparse CSR tensor support is in beta state. If you miss a functionality in the sparse tensor support, please submit a feature request to https://github.com/pytorch/pytorch/issues. (Triggered internally at ..\aten\src\ATen\SparseCsrTensorImpl.cpp:55.)
    result = torch.sparse_compressed_tensor(
    C:\Users\fbrev\Documents\Acadêmico\Simulações\Python\NoisyGL\predictor\Base_Predictor.py:114: UserWarning: expandable_segments not supported on this platform (Triggered internally at ..\c10/cuda/CUDAAllocatorConfig.h:28.)
    self.edge_index = self._cpu_edge_index.to(self.device)
    [CPU] Loading flickr...
    DEBUG 3.1: Dataset init start
    DEBUG 3.2: prepare_data start flickr
    ----Data statistics------'
    Name: flickr
    #Nodes 7575
    #Edges 239738
    #Classes 9
    #Ave_degree 63.30
    ----Split statistics------'
    #Train samples 378 (5.0 % of nodes)
    #Val samples 1136 (15.0 % of nodes)
    #Test samples 6061 (remaining)
    ----label noise information:------
    Instance dependent noise
    #Actual noise rate 0.30
    [cuda:1] LNPCC waiting for GPU slot...
    [cuda:1] Slot acquired (waited 10.2s). Starting GCN...
    FINAL_RESULT: {'acc': {'train': 0.8198924731182796, 'valid': 0.3785211267605634, 'test': 0.5162514436561624}, 'wall_s': 129.41, 'cpu_s': 125.35, 'gpu_s': 3.81, 'wait_s': 10.17}
    [Time] wall=129.4s | cpu=125.4s | gpu=3.8s
    C:\Users\fbrev\anaconda3\envs\noisygl\Lib\site-packages\torch\_utils.py:315: UserWarning: Sparse CSR tensor support is in beta state. If you miss a functionality in the sparse tensor support, please submit a feature request to https://github.com/pytorch/pytorch/issues. (Triggered internally at ..\aten\src\ATen\SparseCsrTensorImpl.cpp:55.)
    result = torch.sparse_compressed_tensor(
    C:\Users\fbrev\Documents\Acadêmico\Simulações\Python\NoisyGL\predictor\Base_Predictor.py:114: UserWarning: expandable_segments not supported on this platform (Triggered internally at ..\c10/cuda/CUDAAllocatorConfig.h:28.)
    self.edge_index = self._cpu_edge_index.to(self.device)
    [CPU] Loading flickr...
    DEBUG 3.1: Dataset init start
    DEBUG 3.2: prepare_data start flickr
    ----Data statistics------'
    Name: flickr
    #Nodes 7575
    #Edges 239738
    #Classes 9
    #Ave_degree 63.30
    ----Split statistics------'
    #Train samples 378 (5.0 % of nodes)
    #Val samples 1136 (15.0 % of nodes)
    #Test samples 6061 (remaining)
    ----label noise information:------
    Instance dependent noise
    #Actual noise rate 0.30
    [cuda:1] LNPCC waiting for GPU slot...
    [cuda:1] Slot acquired (waited 137.6s). Starting GCN...
    FINAL_RESULT: {'acc': {'train': 0.8031914893617021, 'valid': 0.40669014084507044, 'test': 0.5386899851509652}, 'wall_s': 105.71, 'cpu_s': 101.61, 'gpu_s': 3.82, 'wait_s': 137.63}
    [Time] wall=105.7s | cpu=101.6s | gpu=3.8s
    C:\Users\fbrev\anaconda3\envs\noisygl\Lib\site-packages\torch\_utils.py:315: UserWarning: Sparse CSR tensor support is in beta state. If you miss a functionality in the sparse tensor support, please submit a feature request to https://github.com/pytorch/pytorch/issues. (Triggered internally at ..\aten\src\ATen\SparseCsrTensorImpl.cpp:55.)
    result = torch.sparse_compressed_tensor(
    C:\Users\fbrev\Documents\Acadêmico\Simulações\Python\NoisyGL\predictor\Base_Predictor.py:114: UserWarning: expandable_segments not supported on this platform (Triggered internally at ..\c10/cuda/CUDAAllocatorConfig.h:28.)
    self.edge_index = self._cpu_edge_index.to(self.device)
    [CPU] Loading flickr...
    DEBUG 3.1: Dataset init start
    DEBUG 3.2: prepare_data start flickr
    ----Data statistics------'
    Name: flickr
    #Nodes 7575
    #Edges 239738
    #Classes 9
    #Ave_degree 63.30
    ----Split statistics------'
    #Train samples 378 (5.0 % of nodes)
    #Val samples 1136 (15.0 % of nodes)
    #Test samples 6061 (remaining)
    ----label noise information:------
    Instance dependent noise
    #Actual noise rate 0.30
    [cuda:1] LNPCC waiting for GPU slot...
    [cuda:1] Slot acquired (waited 8.2s). Starting GCN...
    FINAL_RESULT: {'acc': {'train': 0.9249329758713136, 'valid': 0.3908450704225352, 'test': 0.5030523016003959}, 'wall_s': 114.38, 'cpu_s': 110.29, 'gpu_s': 3.84, 'wait_s': 8.17}
    [Time] wall=114.4s | cpu=110.3s | gpu=3.8s
    C:\Users\fbrev\anaconda3\envs\noisygl\Lib\site