[I 2026-05-03 20:54:56,129] Trial 21 finished with value: 0.3965848965848966 and parameters: {'lr': 0.005, 'weight_decay': 0.001, 'n_hidden': 64, 'n_layer': 2, 'dropout': 0.6190390920920961, 'knn_mode': 'd', 'k': 33, 'dexp': 5.84893420904292, 'p_grd': 0.03391898055034277, 'unc_rem': 0.027873114592523812, 'unc_rel': 0.04342516401129001}. Best is trial 20 with value: 0.7205387205387206.
    [CPU] Loading blogcatalog...
    DEBUG 3.1: Dataset init start
    DEBUG 3.2: prepare_data start blogcatalog
    ----Data statistics------'
    Name: blogcatalog
    #Nodes 5196
    #Edges 171743
    #Classes 6
    #Ave_degree 66.11
    ----Split statistics------'
    #Train samples 259 (5.0 % of nodes)
    #Val samples 779 (15.0 % of nodes)
    #Test samples 4158 (remaining)
    ----label noise information:------
    Instance dependent noise
    #Actual noise rate 0.20
    [cuda:1] LNPCC waiting for GPU slot...
    [cuda:1] Slot acquired (waited 63.4s). Starting GCN...
    FINAL_RESULT: {'acc': {'train': 0.7590361445783133, 'valid': 0.6059050064184852, 'test': 0.7190957190957191}, 'wall_s': 20.24, 'cpu_s': 17.16, 'gpu_s': 3.0, 'wait_s': 63.37}
    [Time] wall=20.2s | cpu=17.2s | gpu=3.0s
    C:\Users\fbrev\Documents\Acadêmico\Simulações\Python\NoisyGL\predictor\Base_Predictor.py:114: UserWarning: expandable_segments not supported on this platform (Triggered internally at ..\c10/cuda/CUDAAllocatorConfig.h:28.)
    self.edge_index = self._cpu_edge_index.to(self.device)
    C:\Users\fbrev\Documents\Acadêmico\Simulações\Python\NoisyGL\predictor\Base_Predictor.py:144: UserWarning: Sparse CSR tensor support is in beta state. If you miss a functionality in the sparse tensor support, please submit a feature request to https://github.com/pytorch/pytorch/issues. (Triggered internally at ..\aten\src\ATen\SparseCsrTensorImpl.cpp:55.)
    self.adj_csr = self.adj.to_sparse_csr().to(self.device)
[I 2026-05-03 20:56:24,413] Trial 22 finished with value: 0.7190957190957191 and parameters: {'lr': 0.005, 'weight_decay': 0.001, 'n_hidden': 64, 'n_layer': 2, 'dropout': 0.5952208080744661, 'knn_mode': 'd', 'k': 37, 'dexp': 6.856780440221188, 'p_grd': 0.10420589630225528, 'unc_rem': 0.582770587582198, 'unc_rel': 0.12304840502068276}. Best is trial 20 with value: 0.7205387205387206.
    [CPU] Loading blogcatalog...
    DEBUG 3.1: Dataset init start
    DEBUG 3.2: prepare_data start blogcatalog
    ----Data statistics------'
    Name: blogcatalog
    #Nodes 5196
    #Edges 171743
    #Classes 6
    #Ave_degree 66.11
    ----Split statistics------'
    #Train samples 259 (5.0 % of nodes)
    #Val samples 779 (15.0 % of nodes)
    #Test samples 4158 (remaining)
    ----label noise information:------
    Instance dependent noise
    #Actual noise rate 0.20
    [cuda:1] LNPCC waiting for GPU slot...
    [cuda:1] Slot acquired (waited 206.9s). Starting GCN...
    FINAL_RESULT: {'acc': {'train': 0.7322834645669292, 'valid': 0.6148908857509627, 'test': 0.7251082251082251}, 'wall_s': 20.33, 'cpu_s': 17.24, 'gpu_s': 3.02, 'wait_s': 206.87}
    [Time] wall=20.3s | cpu=17.2s | gpu=3.0s
    C:\Users\fbrev\Documents\Acadêmico\Simulações\Python\NoisyGL\predictor\Base_Predictor.py:114: UserWarning: expandable_segments not supported on this platform (Triggered internally at ..\c10/cuda/CUDAAllocatorConfig.h:28.)
    self.edge_index = self._cpu_edge_index.to(self.device)
    C:\Users\fbrev\Documents\Acadêmico\Simulações\Python\NoisyGL\predictor\Base_Predictor.py:144: UserWarning: Sparse CSR tensor support is in beta state. If you miss a functionality in the sparse tensor support, please submit a feature request to https://github.com/pytorch/pytorch/issues. (Triggered internally at ..\aten\src\ATen\SparseCsrTensorImpl.cpp:55.)
    self.adj_csr = self.adj.to_sparse_csr().to(self.device)
[I 2026-05-03 21:00:16,217] Trial 23 finished with value: 0.7251082251082251 and parameters: {'lr': 0.005, 'weight_decay': 0.001, 'n_hidden': 64, 'n_layer': 2, 'dropout': 0.5832079476417736, 'knn_mode': 'd', 'k': 35, 'dexp': 5.238473355409606, 'p_grd': 0.1133657746365046, 'unc_rem': 0.5852169639539099, 'unc_rel': 0.13034780745403007}. Best is trial 23 with value: 0.7251082251082251.
    [CPU] Loading blogcatalog...
    DEBUG 3.1: Dataset init start
    DEBUG 3.2: prepare_data start blogcatalog
    ----Data statistics------'
    Name: blogcatalog
    #Nodes 5196
    #Edges 171743
    #Classes 6
    #Ave_degree 66.11
    ----Split statistics------'
    #Train samples 259 (5.0 % of nodes)
    #Val samples 779 (15.0 % of nodes)
    #Test samples 4158 (remaining)
    ----label noise information:------
    Instance dependent noise
    #Actual noise rate 0.20
    [cuda:1] LNPCC waiting for GPU slot...
    [cuda:1] Slot acquired (waited 364.8s). Starting GCN...
    FINAL_RESULT: {'acc': {'train': 0.7389558232931727, 'valid': 0.6084724005134788, 'test': 0.7234247234247234}, 'wall_s': 23.73, 'cpu_s': 20.5, 'gpu_s': 3.13, 'wait_s': 364.84}
    [Time] wall=23.7s | cpu=20.5s | gpu=3.1s
    C:\Users\fbrev\Documents\Acadêmico\Simulações\Python\NoisyGL\predictor\Base_Predictor.py:114: UserWarning: expandable_segments not supported on this platform (Triggered internally at ..\c10/cuda/CUDAAllocatorConfig.h:28.)
    self.edge_index = self._cpu_edge_index.to(self.device)
    C:\Users\fbrev\Documents\Acadêmico\Simulações\Python\NoisyGL\predictor\Base_Predictor.py:144: UserWarning: Sparse CSR tensor support is in beta state. If you miss a functionality in the sparse tensor support, please submit a feature request to https://github.com/pytorch/pytorch/issues. (Triggered internally at ..\aten\src\ATen\SparseCsrTensorImpl.cpp:55.)
    self.adj_csr = self.adj.to_sparse_csr().to(self.device)
[I 2026-05-03 21:06:50,338] Trial 24 finished with value: 0.7234247234247234 and parameters: {'lr': 0.005, 'weight_decay': 0.001, 'n_hidden': 64, 'n_layer': 2, 'dropout': 0.5773921374930093, 'knn_mode': 'd', 'k': 36, 'dexp': 5.583024235259637, 'p_grd': 0.10933126738754734, 'unc_rem': 0.5695861103624504, 'unc_rel': 0.10083518218713344}. Best is trial 23 with value: 0.7251082251082251.
    [CPU] Loading blogcatalog...
    DEBUG 3.1: Dataset init start
    DEBUG 3.2: prepare_data start blogcatalog
    ----Data statistics------'
    Name: blogcatalog
    #Nodes 5196
    #Edges 171743
    #Classes 6
    #Ave_degree 66.11
    ----Split statistics------'
    #Train samples 259 (5.0 % of nodes)
    #Val samples 779 (15.0 % of nodes)
    #Test samples 4158 (remaining)
    ----label noise information:------
    Instance dependent noise
    #Actual noise rate 0.20
    [cuda:1] LNPCC waiting for GPU slot...
    [cuda:1] Slot acquired (waited 45.8s). Starting GCN...
    FINAL_RESULT: {'acc': {'train': 0.765625, 'valid': 0.613607188703466, 'test': 0.7243867243867244}, 'wall_s': 24.51, 'cpu_s': 21.46, 'gpu_s': 2.95, 'wait_s': 45.79}
    [Time] wall=24.5s | cpu=21.5s | gpu=3.0s
    C:\Users\fbrev\Documents\Acadêmico\Simulações\Python\NoisyGL\predictor\Base_Predictor.py:114: UserWarning: expandable_segments not supported on this platform (Triggered internally at ..\c10/cuda/CUDAAllocatorConfig.h:28.)
    self.edge_index = self._cpu_edge_index.to(self.device)
    C:\Users\fbrev\Documents\Acadêmico\Simulações\Python\NoisyGL\predictor\Base_Predictor.py:144: UserWarning: Sparse CSR tensor support is in beta state. If you miss a functionality in the sparse tensor support, please submit a feature request to https://github.com/pytorch/pytorch/issues. (Triggered internally at ..\aten\src\ATen\SparseCsrTensorImpl.cpp:55.)
    self.adj_csr = self.adj.to_sparse_csr().to(self.device)
[I 2026-05-03 21:08:06,134] Trial 25 finished with value: 0.7243867243867244 and parameters: {'lr': 0.005, 'weight_decay': 0.001, 'n_hidden': 64, 'n_layer': 2, 'dropout': 0.5632697670078365, 'knn_mode': 'd', 'k': 32, 'dexp': 5.365931676400855, 'p_grd': 0.13097947600697485, 'unc_rem': 0.5949551403800634, 'unc_rel': 0.13983244591225638}. Best is trial 23 with value: 0.7251082251082251.
    [CPU] Loading blogcatalog...
    DEBUG 3.1: Dataset init start
    DEBUG 3.2: prepare_data start blogcatalog
    ----Data statistics------'
    Name: blogcatalog
    #Nodes 5196
    #Edges 171743
    #Classes 6
    #Ave_degree 66.11
    ----Split statistics------'
    #Train samples 259 (5.0 % of nodes)
    #Val samples 779 (15.0 % of nodes)
    #Test samples 4158 (remaining)
    ----label noise information:------
    Instance dependent noise
    #Actual noise rate 0.20
    [cuda:1] LNPCC waiting for GPU slot...
    [cuda:1] Slot acquired (waited 128.7s). Starting GCN...
    FINAL_RESULT: {'acc': {'train': 0.83399209486166, 'valid': 0.6174582798459564, 'test': 0.7243867243867244}, 'wall_s': 21.56, 'cpu_s': 18.41, 'gpu_s': 3.07, 'wait_s': 128.67}
    [Time] wall=21.6s | cpu=18.4s | gpu=3.1s
    C:\Users\fbrev\Documents\Acadêmico\Simulações\Python\NoisyGL\predictor\Base_Predictor.py:114: UserWarning: expandable_segments not supported on this platform (Triggered internally at ..\c10/cuda/CUDAAllocatorConfig.h:28.)
    self.edge_index = self._cpu_edge_index.to(self.device)
    C:\Users\fbrev\Documents\Acadêmico\Simulações\Python\NoisyGL\predictor\Base_Predictor.py:144: UserWarning: Sparse CSR tensor support is in beta state. If you miss a functionality in the sparse tensor support, please submit a feature request to https://github.com/pytorch/pytorch/issues. (Triggered internally at ..\aten\src\ATen\SparseCsrTensorImpl.cpp:55.)
    self.adj_csr = self.adj.to_sparse_csr().to(self.device)
[I 2026-05-03 21:10:41,113] Trial 26 finished with value: 0.7243867243867244 and parameters: {'lr': 0.005, 'weight_decay': 0.001, 'n_hidden': 64, 'n_layer': 2, 'dropout': 0.44299503636909093, 'knn_mode': 'd', 'k': 29, 'dexp': 5.127113414500006, 'p_grd': 0.12072291366390071, 'unc_rem': 0.46296327979883944, 'unc_rel': 0.015731074812758997}. Best is trial 23 with value: 0.7251082251082251.
    [CPU] Loading blogcatalog...
    DEBUG 3.1: Dataset init start
    DEBUG 3.2: prepare_data start blogcatalog
    ----Data statistics------'
    Name: blogcatalog
    #Nodes 5196
    #Edges 171743
    #Classes 6
    #Ave_degree 66.11
    ----Split statistics------'
    #Train samples 259 (5.0 % of nodes)
    #Val samples 779 (15.0 % of nodes)
    #Test samples 4158 (remaining)
    ----label noise information:------
    Instance dependent noise
    #Actual noise rate 0.20
    [cuda:1] LNPCC waiting for GPU slot...
    [cuda:1] Slot acquired (waited 120.3s). Starting GCN...
    FINAL_RESULT: {'acc': {'train': 0.7786561264822134, 'valid': 0.6187419768934531, 'test': 0.7255892255892256}, 'wall_s': 24.23, 'cpu_s': 21.07, 'gpu_s': 3.05, 'wait_s': 120.32}
    [Time] wall=24.2s | cpu=21.1s | gpu=3.0s
    C:\Users\fbrev\Documents\Acadêmico\Simulações\Python\NoisyGL\predictor\Base_Predictor.py:114: UserWarning: expandable_segments not supported on this platform (Triggered internally at ..\c10/cuda/CUDAAllocatorConfig.h:28.)
    self.edge_index = self._cpu_edge_index.to(self.device)
    C:\Users\fbrev\Documents\Acadêmico\Simulações\Python\NoisyGL\predictor\Base_Predictor.py:144: UserWarning: Sparse CSR tensor support is in beta state. If you miss a functionality in the sparse tensor support, please submit a feature request to https://github.com/pytorch/pytorch/issues. (Triggered internally at ..\aten\src\ATen\SparseCsrTensorImpl.cpp:55.)
    self.adj_csr = self.adj.to_sparse_csr().to(self.device)
[I 2026-05-03 21:13:10,613] Trial 27 finished with value: 0.7255892255892256 and parameters: {'lr': 0.005, 'weight_decay': 0.001, 'n_hidden': 64, 'n_layer': 2, 'dropout': 0.4359450630073555, 'knn_mode': 'd', 'k': 28, 'dexp': 4.9781807955727615, 'p_grd': 0.14142236825735646, 'unc_rem': 0.4203773797485134, 'unc_rel': 0.026061185664954897}. Best is trial 27 with value: 0.7255892255892256.
    [CPU] Loading blogcatalog...
    DEBUG 3.1: Dataset init start
    DEBUG 3.2: prepare_data start blogcatalog
    ----Data statistics------'
    Name: blogcatalog
    #Nodes 5196
    #Edges 171743
    #Classes 6
    #Ave_degree 66.11
    ----Split statistics------'
    #Train samples 259 (5.0 % of nodes)
    #Val samples 779 (15.0 % of nodes)
    #Test samples 4158 (remaining)
    ----label noise information:------
    Instance dependent noise
    #Actual noise rate 0.20
    [cuda:1] LNPCC waiting for GPU slot...
    [cuda:1] Slot acquired (waited 57.3s). Starting GCN...
    FINAL_RESULT: {'acc': {'train': 0.8307086614173228, 'valid': 0.6148908857509627, 'test': 0.7251082251082251}, 'wall_s': 24.4, 'cpu_s': 21.1, 'gpu_s': 3.15, 'wait_s': 57.34}
    [Time] wall=24.4s | cpu=21.1s | gpu=3.1s
    C:\Users\fbrev\Documents\Acadêmico\Simulações\Python\NoisyGL\predictor\Base_Predictor.py:114: UserWarning: expandable_segments not supported on this platform (Triggered internally at ..\c10/cuda/CUDAAllocatorConfig.h:28.)
    self.edge_index = self._cpu_edge_index.to(self.device)
    C:\Users\fbrev\Documents\Acadêmico\Simulações\Python\NoisyGL\predictor\Base_Predictor.py:144: UserWarning: Sparse CSR tensor support is in beta state. If you miss a functionality in the sparse tensor support, please submit a feature request to https://github.com/pytorch/pytorch/issues. (Triggered internally at ..\aten\src\ATen\SparseCsrTensorImpl.cpp:55.)
    self.adj_csr = self.adj.to_sparse_csr().to(self.device)
[I 2026-05-03 21:14:37,614] Trial 28 finished with value: 0.7251082251082251 and parameters: {'lr': 0.005, 'weight_decay': 0.001, 'n_hidden': 64, 'n_layer': 2, 'dropout': 0.4568112911373748, 'knn_mode': 'd', 'k': 27, 'dexp': 4.649926736687683, 'p_grd': 0.1599837051488902, 'unc_rem': 0.38770144375334087, 'unc_rel': 0.15447065806389193}. Best is trial 27 with value: 0.7255892255892256.
    [CPU] Loading blogcatalog...
    DEBUG 3.1: Dataset init start
    DEBUG 3.2: prepare_data start blogcatalog
    ----Data statistics------'
    Name: blogcatalog
    #Nodes 5196
    #Edges 171743
    #Classes 6
    #Ave_degree 66.11
    ----Split statistics------'
    #Train samples 259 (5.0 % of nodes)
    #Val samples 779 (15.0 % of nodes)
    #Test samples 4158 (remaining)
    ----label noise information:------
    Instance dependent noise
    #Actual noise rate 0.20
    [cuda:1] LNPCC waiting for GPU slot...
    [cuda:1] Slot acquired (waited 47.3s). Starting GCN...
    FINAL_RESULT: {'acc': {'train': 0.4549019607843137, 'valid': 0.49037227214377405, 'test': 0.5832130832130832}, 'wall_s': 24.24, 'cpu_s': 20.93, 'gpu_s': 3.23, 'wait_s': 47.34}
    [Time] wall=24.2s | cpu=20.9s | gpu=3.2s
    C:\Users\fbrev\Documents\Acadêmico\Simulações\Python\NoisyGL\predictor\Base_Predictor.py:114: UserWarning: expandable_segments not supported on this platform (Triggered internally at ..\c10/cuda/CUDAAllocatorConfig.h:28.)
    self.edge_index = self._cpu_edge_index.to(self.device)
    C:\Users\fbrev\Documents\Acadêmico\Simulações\Python\NoisyGL\predictor\Base_Predictor.py:144: UserWarning: Sparse CSR tensor support is in beta state. If you miss a functionality in the sparse tensor support, please submit a feature request to https://github.com/pytorch/pytorch/issues. (Triggered internally at ..\aten\src\ATen\SparseCsrTensorImpl.cpp:55.)
    self.adj_csr = self.adj.to_sparse_csr().to(self.device)
[I 2026-05-03 21:15:54,381] Trial 29 finished with value: 0.5832130832130832 and parameters: {'lr': 0.1, 'weight_decay': 0.001, 'n_hidden': 64, 'n_layer': 2, 'dropout': 0.39781303248958966, 'knn_mode': 'd', 'k': 26, 'dexp': 4.553681176081027, 'p_grd': 0.16218424515861268, 'unc_rem': 0.45629724889673584, 'unc_rel': 0.17725950717137734}. Best is trial 27 with value: 0.7255892255892256.
    [CPU] Loading blogcatalog...
    DEBUG 3.1: Dataset init start
    DEBUG 3.2: prepare_data start blogcatalog
    ----Data statistics------'
    Name: blogcatalog
    #Nodes 5196
    #Edges 171743
    #Classes 6
    #Ave_degree 66.11
    ----Split statistics------'
    #Train samples 259 (5.0 % of nodes)
    #Val samples 779 (15.0 % of nodes)
    #Test samples 4158 (remaining)
    ----label noise information:------
    Instance dependent noise
    #Actual noise rate 0.20
    [cuda:1] LNPCC waiting for GPU slot...
    [cuda:1] Slot acquired (waited 118.6s). Starting GCN...
    FINAL_RESULT: {'acc': {'train': 0.7857142857142857, 'valid': 0.6213093709884467, 'test': 0.7265512265512265}, 'wall_s': 27.15, 'cpu_s': 24.04, 'gpu_s': 3.02, 'wait_s': 118.63}
    [Time] wall=27.1s | cpu=24.0s | gpu=3.0s
    C:\Users\fbrev\Documents\Acadêmico\Simulações\Python\NoisyGL\predictor\Base_Predictor.py:114: UserWarning: expandable_segments not supported on this platform (Triggered internally at ..\c10/cuda/CUDAAllocatorConfig.h:28.)
    self.edge_index = self._cpu_edge_index.to(self.device)
    C:\Users\fbrev\Documents\Acadêmico\Simulações\Python\NoisyGL\predictor\Base_Predictor.py:144: UserWarning: Sparse CSR tensor support is in beta state. If you miss a functionality in the sparse tensor support, please submit a feature request to https://github.com/pytorch/pytorch/issues. (Triggered internally at ..\aten\src\ATen\SparseCsrTensorImpl.cpp:55.)
    self.adj_csr = self.adj.to_sparse_csr().to(self.device)
[I 2026-05-03 21:18:25,372] Trial 30 finished with value: 0.7265512265512265 and parameters: {'lr': 0.005, 'weight_decay': 0.001, 'n_hidden': 64, 'n_layer': 2, 'dropout': 0.44311696780625703, 'knn_mode': 'd', 'k': 28, 'dexp': 2.1909546048248627, 'p_grd': 0.3194229567163926, 'unc_rem': 0.36207401558644825, 'unc_rel': 0.4685875044354812}. Best is trial 30 with value: 0.7265512265512265.
    [CPU] Loading blogcatalog...
    DEBUG 3.1: Dataset init start
    DEBUG 3.2: prepare_data start blogcatalog
    ----Data statistics------'
    Name: blogcatalog
    #Nodes 5196
    #Edges 171743
    #Classes 6
    #Ave_degree 66.11
    ----Split statistics------'
    #Train samples 259 (5.0 % of nodes)
    #Val samples 779 (15.0 % of nodes)
    #Test samples 4158 (remaining)
    ----label noise information:------
    Instance dependent noise
    #Actual noise rate 0.20
    [cuda:1] LNPCC waiting for GPU slot...
    [cuda:1] Slot acquired (waited 42.9s). Starting GCN...
    FINAL_RESULT: {'acc': {'train': 0.8672199170124482, 'valid': 0.6007702182284981, 'test': 0.708032708032708}, 'wall_s': 29.83, 'cpu_s': 26.57, 'gpu_s': 3.17, 'wait_s': 42.86}
    [Time] wall=29.8s | cpu=26.6s | gpu=3.2s
    C:\Users\fbrev\Documents\Acadêmico\Simulações\Python\NoisyGL\predictor\Base_Predictor.py:114: UserWarning: expandable_segments not supported on this platform (Triggered internally at ..\c10/cuda/CUDAAllocatorConfig.h:28.)
    self.edge_index = self._cpu_edge_index.to(self.device)
    C:\Users\fbrev\Documents\Acadêmico\Simulações\Python\NoisyGL\predictor\Base_Predictor.py:144: UserWarning: Sparse CSR tensor support is in beta state. If you miss a functionality in the sparse tensor support, please submit a feature request to https://github.com/pytorch/pytorch/issues. (Triggered internally at ..\aten\src\ATen\SparseCsrTensorImpl.cpp:55.)
    self.adj_csr = self.adj.to_sparse_csr().to(self.device)
[I 2026-05-03 21:19:43,048] Trial 31 finished with value: 0.708032708032708 and parameters: {'lr': 0.005, 'weight_decay': 0.001, 'n_hidden': 64, 'n_layer': 2, 'dropout': 0.2881123097421611, 'knn_mode': 'd', 'k': 28, 'dexp': 0.8648946457339637, 'p_grd': 0.3559645333839896, 'unc_rem': 0.3789104073224505, 'unc_rel': 0.46878299254556455}. Best is trial 30 with value: 0.7265512265512265.
    [CPU] Loading blogcatalog...
    DEBUG 3.1: Dataset init start
    DEBUG 3.2: prepare_data start blogcatalog
    ----Data statistics------'
    Name: blogcatalog
    #Nodes 5196
    #Edges 171743
    #Classes 6
    #Ave_degree 66.11
    ----Split statistics------'
    #Train samples 259 (5.0 % of nodes)
    #Val samples 779 (15.0 % of nodes)
    #Test samples 4158 (remaining)
    ----label noise information:------
    Instance dependent noise
    #Actual noise rate 0.20
    [cuda:1] LNPCC waiting for GPU slot...
    [cuda:1] Slot acquired (waited 43.4s). Starting GCN...
    FINAL_RESULT: {'acc': {'train': 0.8654708520179372, 'valid': 0.613607188703466, 'test': 0.7147667147667147}, 'wall_s': 29.18, 'cpu_s': 26.05, 'gpu_s': 3.04, 'wait_s': 43.41}
    [Time] wall=29.2s | cpu=26.1s | gpu=3.0s
    C:\Users\fbrev\Documents\Acadêmico\Simulações\Python\NoisyGL\predictor\Base_Predictor.py:114: UserWarning: expandable_segments not supported on this platform (Triggered internally at ..\c10/cuda/CUDAAllocatorConfig.h:28.)
    self.edge_index = self._cpu_edge_index.to(self.device)
    C:\Users\fbrev\Documents\Acadêmico\Simulações\Python\NoisyGL\predictor\Base_Predictor.py:144: UserWarning: Sparse CSR tensor support is in beta state. If you miss a functionality in the sparse tensor support, please submit a feature request to https://github.com/pytorch/pytorch/issues. (Triggered internally at ..\aten\src\ATen\SparseCsrTensorImpl.cpp:55.)
    self.adj_csr = self.adj.to_sparse_csr().to(self.device)
