[I 2026-05-08 03:52:20,177] Trial 35 finished with value: 0.571 and parameters: {'lr': 0.005, 'weight_decay': 0.05, 'n_hidden': 32, 'n_layer': 3, 'dropout': 0.39547942519140444, 'knn_mode': 's', 'k': 45, 'dexp': 4.379705887059955, 'p_grd': 0.7583672084807629, 'unc_rem': 0.2514019202671507, 'unc_rel': 0.911831059023445}. Best is trial 22 with value: 0.791.
    [CPU] Loading cora...
    DEBUG 3.1: Dataset init start
    DEBUG 3.2: prepare_data start cora
    ----Data statistics------'
    Name: cora
    #Nodes 2708
    #Edges 5278
    #Classes 7
    #Ave_degree 3.90
    ----Split statistics------'
    #Train samples 140 (default)
    #Val samples 500 (default)
    #Test samples 1000 (default)
    ----label noise information:------
    Instance dependent noise
    #Actual noise rate 0.31
    [cuda:0] LNPCC waiting for GPU slot...
    [cuda:0] Slot acquired (waited 90.1s). Starting GCN...
    FINAL_RESULT: {'acc': {'train': 0.8071428571428572, 'valid': 0.544, 'test': 0.78}, 'wall_s': 8.24, 'cpu_s': 6.08, 'gpu_s': 2.15, 'wait_s': 90.11}
    [Time] wall=8.2s | cpu=6.1s | gpu=2.1s
    C:\Users\fbrev\Documents\Acadêmico\Simulações\Python\NoisyGL\predictor\Base_Predictor.py:114: UserWarning: expandable_segments not supported on this platform (Triggered internally at ..\c10/cuda/CUDAAllocatorConfig.h:28.)
    self.edge_index = self._cpu_edge_index.to(self.device)
    C:\Users\fbrev\Documents\Acadêmico\Simulações\Python\NoisyGL\predictor\Base_Predictor.py:144: UserWarning: Sparse CSR tensor support is in beta state. If you miss a functionality in the sparse tensor support, please submit a feature request to https://github.com/pytorch/pytorch/issues. (Triggered internally at ..\aten\src\ATen\SparseCsrTensorImpl.cpp:55.)
    self.adj_csr = self.adj.to_sparse_csr().to(self.device)
[I 2026-05-08 03:54:03,423] Trial 36 finished with value: 0.78 and parameters: {'lr': 0.005, 'weight_decay': 0.0001, 'n_hidden': 256, 'n_layer': 3, 'dropout': 0.2719223916790267, 'knn_mode': 's', 'k': 39, 'dexp': 2.7886104882088256, 'p_grd': 0.6825004968377498, 'unc_rem': 0.22618241879146, 'unc_rel': 0.7760974973981559}. Best is trial 22 with value: 0.791.
    [CPU] Loading cora...
    DEBUG 3.1: Dataset init start
    DEBUG 3.2: prepare_data start cora
    ----Data statistics------'
    Name: cora
    #Nodes 2708
    #Edges 5278
    #Classes 7
    #Ave_degree 3.90
    ----Split statistics------'
    #Train samples 140 (default)
    #Val samples 500 (default)
    #Test samples 1000 (default)
    ----label noise information:------
    Instance dependent noise
    #Actual noise rate 0.31
    [cuda:0] LNPCC waiting for GPU slot...
    [cuda:0] Slot acquired (waited 47.3s). Starting GCN...
    FINAL_RESULT: {'acc': {'train': 0.8260869565217391, 'valid': 0.51, 'test': 0.762}, 'wall_s': 33.05, 'cpu_s': 30.9, 'gpu_s': 2.13, 'wait_s': 47.27}
    [Time] wall=33.0s | cpu=30.9s | gpu=2.1s
    C:\Users\fbrev\Documents\Acadêmico\Simulações\Python\NoisyGL\predictor\Base_Predictor.py:114: UserWarning: expandable_segments not supported on this platform (Triggered internally at ..\c10/cuda/CUDAAllocatorConfig.h:28.)
    self.edge_index = self._cpu_edge_index.to(self.device)
    C:\Users\fbrev\Documents\Acadêmico\Simulações\Python\NoisyGL\predictor\Base_Predictor.py:144: UserWarning: Sparse CSR tensor support is in beta state. If you miss a functionality in the sparse tensor support, please submit a feature request to https://github.com/pytorch/pytorch/issues. (Triggered internally at ..\aten\src\ATen\SparseCsrTensorImpl.cpp:55.)
    self.adj_csr = self.adj.to_sparse_csr().to(self.device)
[I 2026-05-08 03:55:29,103] Trial 37 finished with value: 0.762 and parameters: {'lr': 0.005, 'weight_decay': 0.01, 'n_hidden': 128, 'n_layer': 3, 'dropout': 0.524809162840392, 'knn_mode': 'd', 'k': 36, 'dexp': 4.030445657722623, 'p_grd': 0.9565550866420992, 'unc_rem': 0.3598886468998594, 'unc_rel': 0.6795378750317199}. Best is trial 22 with value: 0.791.
    [CPU] Loading cora...
    DEBUG 3.1: Dataset init start
    DEBUG 3.2: prepare_data start cora
    ----Data statistics------'
    Name: cora
    #Nodes 2708
    #Edges 5278
    #Classes 7
    #Ave_degree 3.90
    ----Split statistics------'
    #Train samples 140 (default)
    #Val samples 500 (default)
    #Test samples 1000 (default)
    ----label noise information:------
    Instance dependent noise
    #Actual noise rate 0.31
    [cuda:0] LNPCC waiting for GPU slot...
    [cuda:0] Slot acquired (waited 20.2s). Starting GCN...
    FINAL_RESULT: {'acc': {'train': 0.8260869565217391, 'valid': 0.54, 'test': 0.786}, 'wall_s': 9.1, 'cpu_s': 6.91, 'gpu_s': 2.17, 'wait_s': 20.17}
    [Time] wall=9.1s | cpu=6.9s | gpu=2.2s
    C:\Users\fbrev\Documents\Acadêmico\Simulações\Python\NoisyGL\predictor\Base_Predictor.py:114: UserWarning: expandable_segments not supported on this platform (Triggered internally at ..\c10/cuda/CUDAAllocatorConfig.h:28.)
    self.edge_index = self._cpu_edge_index.to(self.device)
    C:\Users\fbrev\Documents\Acadêmico\Simulações\Python\NoisyGL\predictor\Base_Predictor.py:144: UserWarning: Sparse CSR tensor support is in beta state. If you miss a functionality in the sparse tensor support, please submit a feature request to https://github.com/pytorch/pytorch/issues. (Triggered internally at ..\aten\src\ATen\SparseCsrTensorImpl.cpp:55.)
    self.adj_csr = self.adj.to_sparse_csr().to(self.device)
[I 2026-05-08 03:56:04,183] Trial 38 finished with value: 0.786 and parameters: {'lr': 0.005, 'weight_decay': 0.0001, 'n_hidden': 256, 'n_layer': 3, 'dropout': 0.46243006721566, 'knn_mode': 's', 'k': 43, 'dexp': 1.8946944166897635, 'p_grd': 0.5653694022304386, 'unc_rem': 0.4216476478620624, 'unc_rel': 0.9480839984511631}. Best is trial 22 with value: 0.791.
    [CPU] Loading cora...
    DEBUG 3.1: Dataset init start
    DEBUG 3.2: prepare_data start cora
    ----Data statistics------'
    Name: cora
    #Nodes 2708
    #Edges 5278
    #Classes 7
    #Ave_degree 3.90
    ----Split statistics------'
    #Train samples 140 (default)
    #Val samples 500 (default)
    #Test samples 1000 (default)
    ----label noise information:------
    Instance dependent noise
    #Actual noise rate 0.31
    [cuda:0] LNPCC waiting for GPU slot...
    [cuda:0] Slot acquired (waited 11.4s). Starting GCN...
    FINAL_RESULT: {'acc': {'train': 0.7428571428571429, 'valid': 0.488, 'test': 0.703}, 'wall_s': 9.23, 'cpu_s': 7.07, 'gpu_s': 2.13, 'wait_s': 11.4}
    [Time] wall=9.2s | cpu=7.1s | gpu=2.1s
    C:\Users\fbrev\Documents\Acadêmico\Simulações\Python\NoisyGL\predictor\Base_Predictor.py:114: UserWarning: expandable_segments not supported on this platform (Triggered internally at ..\c10/cuda/CUDAAllocatorConfig.h:28.)
    self.edge_index = self._cpu_edge_index.to(self.device)
    C:\Users\fbrev\Documents\Acadêmico\Simulações\Python\NoisyGL\predictor\Base_Predictor.py:144: UserWarning: Sparse CSR tensor support is in beta state. If you miss a functionality in the sparse tensor support, please submit a feature request to https://github.com/pytorch/pytorch/issues. (Triggered internally at ..\aten\src\ATen\SparseCsrTensorImpl.cpp:55.)
    self.adj_csr = self.adj.to_sparse_csr().to(self.device)
[I 2026-05-08 03:56:30,637] Trial 39 finished with value: 0.703 and parameters: {'lr': 0.05, 'weight_decay': 0.0, 'n_hidden': 256, 'n_layer': 3, 'dropout': 0.6866663715500121, 'knn_mode': 's', 'k': 39, 'dexp': 5.773696363281689, 'p_grd': 0.44076978604407885, 'unc_rem': 0.18505241022097335, 'unc_rel': 0.6023081654658029}. Best is trial 22 with value: 0.791.
    [CPU] Loading cora...
    DEBUG 3.1: Dataset init start
    DEBUG 3.2: prepare_data start cora
    ----Data statistics------'
    Name: cora
    #Nodes 2708
    #Edges 5278
    #Classes 7
    #Ave_degree 3.90
    ----Split statistics------'
    #Train samples 140 (default)
    #Val samples 500 (default)
    #Test samples 1000 (default)
    ----label noise information:------
    Instance dependent noise
    #Actual noise rate 0.31
    [cuda:0] LNPCC waiting for GPU slot...
    [cuda:0] Slot acquired (waited 10.9s). Starting GCN...
    FINAL_RESULT: {'acc': {'train': 0.6857142857142857, 'valid': 0.5, 'test': 0.744}, 'wall_s': 24.53, 'cpu_s': 22.2, 'gpu_s': 2.31, 'wait_s': 10.9}
    [Time] wall=24.5s | cpu=22.2s | gpu=2.3s
    C:\Users\fbrev\Documents\Acadêmico\Simulações\Python\NoisyGL\predictor\Base_Predictor.py:114: UserWarning: expandable_segments not supported on this platform (Triggered internally at ..\c10/cuda/CUDAAllocatorConfig.h:28.)
    self.edge_index = self._cpu_edge_index.to(self.device)
    C:\Users\fbrev\Documents\Acadêmico\Simulações\Python\NoisyGL\predictor\Base_Predictor.py:144: UserWarning: Sparse CSR tensor support is in beta state. If you miss a functionality in the sparse tensor support, please submit a feature request to https://github.com/pytorch/pytorch/issues. (Triggered internally at ..\aten\src\ATen\SparseCsrTensorImpl.cpp:55.)
    self.adj_csr = self.adj.to_sparse_csr().to(self.device)
[I 2026-05-08 03:57:11,887] Trial 40 finished with value: 0.744 and parameters: {'lr': 0.005, 'weight_decay': 0.0001, 'n_hidden': 32, 'n_layer': 3, 'dropout': 0.7278444404643589, 'knn_mode': 'd', 'k': 35, 'dexp': 4.831962967680606, 'p_grd': 0.7698007302655272, 'unc_rem': 0.6322066822971479, 'unc_rel': 0.468662417652342}. Best is trial 22 with value: 0.791.
    [CPU] Loading cora...
    DEBUG 3.1: Dataset init start
    DEBUG 3.2: prepare_data start cora
    ----Data statistics------'
    Name: cora
    #Nodes 2708
    #Edges 5278
    #Classes 7
    #Ave_degree 3.90
    ----Split statistics------'
    #Train samples 140 (default)
    #Val samples 500 (default)
    #Test samples 1000 (default)
    ----label noise information:------
    Instance dependent noise
    #Actual noise rate 0.31
    [cuda:0] LNPCC waiting for GPU slot...
    [cuda:0] Slot acquired (waited 23.6s). Starting GCN...
    FINAL_RESULT: {'acc': {'train': 0.8, 'valid': 0.542, 'test': 0.782}, 'wall_s': 9.2, 'cpu_s': 6.94, 'gpu_s': 2.25, 'wait_s': 23.62}
    [Time] wall=9.2s | cpu=6.9s | gpu=2.2s
    C:\Users\fbrev\Documents\Acadêmico\Simulações\Python\NoisyGL\predictor\Base_Predictor.py:114: UserWarning: expandable_segments not supported on this platform (Triggered internally at ..\c10/cuda/CUDAAllocatorConfig.h:28.)
    self.edge_index = self._cpu_edge_index.to(self.device)
    C:\Users\fbrev\Documents\Acadêmico\Simulações\Python\NoisyGL\predictor\Base_Predictor.py:144: UserWarning: Sparse CSR tensor support is in beta state. If you miss a functionality in the sparse tensor support, please submit a feature request to https://github.com/pytorch/pytorch/issues. (Triggered internally at ..\aten\src\ATen\SparseCsrTensorImpl.cpp:55.)
    self.adj_csr = self.adj.to_sparse_csr().to(self.device)
[I 2026-05-08 03:57:49,995] Trial 41 finished with value: 0.782 and parameters: {'lr': 0.005, 'weight_decay': 0.0001, 'n_hidden': 256, 'n_layer': 3, 'dropout': 0.5536996802642374, 'knn_mode': 's', 'k': 31, 'dexp': 6.398431266656542, 'p_grd': 0.6517251712537644, 'unc_rem': 0.5096051318244949, 'unc_rel': 0.8810019490012824}. Best is trial 22 with value: 0.791.
    [CPU] Loading cora...
    DEBUG 3.1: Dataset init start
    DEBUG 3.2: prepare_data start cora
    ----Data statistics------'
    Name: cora
    #Nodes 2708
    #Edges 5278
    #Classes 7
    #Ave_degree 3.90
    ----Split statistics------'
    #Train samples 140 (default)
    #Val samples 500 (default)
    #Test samples 1000 (default)
    ----label noise information:------
    Instance dependent noise
    #Actual noise rate 0.31
    [cuda:0] LNPCC waiting for GPU slot...
    [cuda:0] Slot acquired (waited 47.6s). Starting GCN...
    FINAL_RESULT: {'acc': {'train': 0.8071428571428572, 'valid': 0.556, 'test': 0.783}, 'wall_s': 8.87, 'cpu_s': 6.82, 'gpu_s': 2.03, 'wait_s': 47.56}
    [Time] wall=8.9s | cpu=6.8s | gpu=2.0s
    C:\Users\fbrev\Documents\Acadêmico\Simulações\Python\NoisyGL\predictor\Base_Predictor.py:114: UserWarning: expandable_segments not supported on this platform (Triggered internally at ..\c10/cuda/CUDAAllocatorConfig.h:28.)
    self.edge_index = self._cpu_edge_index.to(self.device)
    C:\Users\fbrev\Documents\Acadêmico\Simulações\Python\NoisyGL\predictor\Base_Predictor.py:144: UserWarning: Sparse CSR tensor support is in beta state. If you miss a functionality in the sparse tensor support, please submit a feature request to https://github.com/pytorch/pytorch/issues. (Triggered internally at ..\aten\src\ATen\SparseCsrTensorImpl.cpp:55.)
    self.adj_csr = self.adj.to_sparse_csr().to(self.device)
[I 2026-05-08 03:58:52,313] Trial 42 finished with value: 0.783 and parameters: {'lr': 0.005, 'weight_decay': 0.0001, 'n_hidden': 256, 'n_layer': 3, 'dropout': 0.6164638226972069, 'knn_mode': 's', 'k': 29, 'dexp': 7.373584646682035, 'p_grd': 0.6199986906239972, 'unc_rem': 0.5096666297509577, 'unc_rel': 0.806068439434289}. Best is trial 22 with value: 0.791.
    [CPU] Loading cora...
    DEBUG 3.1: Dataset init start
    DEBUG 3.2: prepare_data start cora
    ----Data statistics------'
    Name: cora
    #Nodes 2708
    #Edges 5278
    #Classes 7
    #Ave_degree 3.90
    ----Split statistics------'
    #Train samples 140 (default)
    #Val samples 500 (default)
    #Test samples 1000 (default)
    ----label noise information:------
    Instance dependent noise
    #Actual noise rate 0.31
    [cuda:0] LNPCC waiting for GPU slot...
    [cuda:0] Slot acquired (waited 14.9s). Starting GCN...
    FINAL_RESULT: {'acc': {'train': 0.7928571428571428, 'valid': 0.54, 'test': 0.785}, 'wall_s': 8.28, 'cpu_s': 6.13, 'gpu_s': 2.14, 'wait_s': 14.9}
    [Time] wall=8.3s | cpu=6.1s | gpu=2.1s
    C:\Users\fbrev\Documents\Acadêmico\Simulações\Python\NoisyGL\predictor\Base_Predictor.py:114: UserWarning: expandable_segments not supported on this platform (Triggered internally at ..\c10/cuda/CUDAAllocatorConfig.h:28.)
    self.edge_index = self._cpu_edge_index.to(self.device)
    C:\Users\fbrev\Documents\Acadêmico\Simulações\Python\NoisyGL\predictor\Base_Predictor.py:144: UserWarning: Sparse CSR tensor support is in beta state. If you miss a functionality in the sparse tensor support, please submit a feature request to https://github.com/pytorch/pytorch/issues. (Triggered internally at ..\aten\src\ATen\SparseCsrTensorImpl.cpp:55.)
    self.adj_csr = self.adj.to_sparse_csr().to(self.device)
[I 2026-05-08 03:59:20,859] Trial 43 finished with value: 0.785 and parameters: {'lr': 0.005, 'weight_decay': 0.0001, 'n_hidden': 256, 'n_layer': 3, 'dropout': 0.5722624357238549, 'knn_mode': 's', 'k': 47, 'dexp': 6.735264926146492, 'p_grd': 0.5358824766913631, 'unc_rem': 0.3248857614105472, 'unc_rel': 0.7164802373602539}. Best is trial 22 with value: 0.791.
    [CPU] Loading cora...
    DEBUG 3.1: Dataset init start
    DEBUG 3.2: prepare_data start cora
    ----Data statistics------'
    Name: cora
    #Nodes 2708
    #Edges 5278
    #Classes 7
    #Ave_degree 3.90
    ----Split statistics------'
    #Train samples 140 (default)
    #Val samples 500 (default)
    #Test samples 1000 (default)
    ----label noise information:------
    Instance dependent noise
    #Actual noise rate 0.31
    [cuda:0] LNPCC waiting for GPU slot...
    [cuda:0] Slot acquired (waited 51.3s). Starting GCN...
    FINAL_RESULT: {'acc': {'train': 0.8071428571428572, 'valid': 0.542, 'test': 0.79}, 'wall_s': 9.54, 'cpu_s': 7.26, 'gpu_s': 2.26, 'wait_s': 51.28}
    [Time] wall=9.5s | cpu=7.3s | gpu=2.3s
    C:\Users\fbrev\Documents\Acadêmico\Simulações\Python\NoisyGL\predictor\Base_Predictor.py:114: UserWarning: expandable_segments not supported on this platform (Triggered internally at ..\c10/cuda/CUDAAllocatorConfig.h:28.)
    self.edge_index = self._cpu_edge_index.to(self.device)
    C:\Users\fbrev\Documents\Acadêmico\Simulações\Python\NoisyGL\predictor\Base_Predictor.py:144: UserWarning: Sparse CSR tensor support is in beta state. If you miss a functionality in the sparse tensor support, please submit a feature request to https://github.com/pytorch/pytorch/issues. (Triggered internally at ..\aten\src\ATen\SparseCsrTensorImpl.cpp:55.)
    self.adj_csr = self.adj.to_sparse_csr().to(self.device)
[I 2026-05-08 04:00:27,568] Trial 44 finished with value: 0.79 and parameters: {'lr': 0.005, 'weight_decay': 0.0001, 'n_hidden': 256, 'n_layer': 3, 'dropout': 0.4952466923155131, 'knn_mode': 's', 'k': 39, 'dexp': 5.4066239878468645, 'p_grd': 0.703099917237491, 'unc_rem': 0.43633935024209153, 'unc_rel': 0.031186314169099005}. Best is trial 22 with value: 0.791.
    [CPU] Loading cora...
    DEBUG 3.1: Dataset init start
    DEBUG 3.2: prepare_data start cora
    ----Data statistics------'
    Name: cora
    #Nodes 2708
    #Edges 5278
    #Classes 7
    #Ave_degree 3.90
    ----Split statistics------'
    #Train samples 140 (default)
    #Val samples 500 (default)
    #Test samples 1000 (default)
    ----label noise information:------
    Instance dependent noise
    #Actual noise rate 0.31
    [cuda:0] LNPCC waiting for GPU slot...
    [cuda:0] Slot acquired (waited 17.7s). Starting GCN...
    FINAL_RESULT: {'acc': {'train': 0.7214285714285714, 'valid': 0.452, 'test': 0.584}, 'wall_s': 9.37, 'cpu_s': 7.37, 'gpu_s': 1.99, 'wait_s': 17.73}
    [Time] wall=9.4s | cpu=7.4s | gpu=2.0s
    C:\Users\fbrev\Documents\Acadêmico\Simulações\Python\NoisyGL\predictor\Base_Predictor.py:114: UserWarning: expandable_segments not supported on this platform (Triggered internally at ..\c10/cuda/CUDAAllocatorConfig.h:28.)
    self.edge_index = self._cpu_edge_index.to(self.device)
    C:\Users\fbrev\Documents\Acadêmico\Simulações\Python\NoisyGL\predictor\Base_Predictor.py:144: UserWarning: Sparse CSR tensor support is in beta state. If you miss a functionality in the sparse tensor support, please submit a feature request to https://github.com/pytorch/pytorch/issues. (Triggered internally at ..\aten\src\ATen\SparseCsrTensorImpl.cpp:55.)
    self.adj_csr = self.adj.to_sparse_csr().to(self.device)
[I 2026-05-08 04:01:00,519] Trial 45 finished with value: 0.584 and parameters: {'lr': 0.01, 'weight_decay': 0.05, 'n_hidden': 128, 'n_layer': 3, 'dropout': 0.49166675694456324, 'knn_mode': 's', 'k': 40, 'dexp': 5.291958402669803, 'p_grd': 0.8581864554013777, 'unc_rem': 0.4566414606434598, 'unc_rel': 0.14485214462977852}. Best is trial 22 with value: 0.791.
    [CPU] Loading cora...
    DEBUG 3.1: Dataset init start
    DEBUG 3.2: prepare_data start cora
    ----Data statistics------'
    Name: cora
    #Nodes 2708
    #Edges 5278
    #Classes 7
    #Ave_degree 3.90
    ----Split statistics------'
    #Train samples 140 (default)
    #Val samples 500 (default)
    #Test samples 1000 (default)
    ----label noise information:------
    Instance dependent noise
    #Actual noise rate 0.31
    [cuda:0] LNPCC waiting for GPU slot...
    [cuda:0] Slot acquired (waited 18.0s). Starting GCN...
    FINAL_RESULT: {'acc': {'train': 0.9928571428571429, 'valid': 0.45, 'test': 0.657}, 'wall_s': 8.56, 'cpu_s': 6.6, 'gpu_s': 1.94, 'wait_s': 18.0}
    [Time] wall=8.6s | cpu=6.6s | gpu=1.9s
    C:\Users\fbrev\Documents\Acadêmico\Simulações\Python\NoisyGL\predictor\Base_Predictor.py:114: UserWarning: expandable_segments not supported on this platform (Triggered internally at ..\c10/cuda/CUDAAllocatorConfig.h:28.)
    self.edge_index = self._cpu_edge_index.to(self.device)
    C:\Users\fbrev\Documents\Acadêmico\Simulações\Python\NoisyGL\predictor\Base_Predictor.py:144: UserWarning: Sparse CSR tensor support is in beta state. If you miss a functionality in the sparse tensor support, please submit a feature request to https://github.com/pytorch/pytorch/issues. (Triggered internally at ..\aten\src\ATen\SparseCsrTensorImpl.cpp:55.)
    self.adj_csr = self.adj.to_sparse_csr().to(self.device)
[I 2026-05-08 04:01:32,657] Trial 46 finished with value: 0.657 and parameters: {'lr': 0.1, 'weight_decay': 0.0001, 'n_hidden': 256, 'n_layer': 2, 'dropout': 0.42260391452840057, 'knn_mode': 's', 'k': 43, 'dexp': 3.174739770321192, 'p_grd': 0.7280700711951417, 'unc_rem': 0.3898960129911061, 'unc_rel': 0.029843956888596097}. Best is trial 22 with value: 0.791.
    [CPU] Loading cora...
    DEBUG 3.1: Dataset init start
    DEBUG 3.2: prepare_data start cora
    ----Data statistics------'
    Name: cora
    #Nodes 2708
    #Edges 5278
    #Classes 7
    #Ave_degree 3.90
    ----Split statistics------'
    #Train samples 140 (default)
    #Val samples 500 (default)
    #Test samples 1000 (default)
    ----label noise information:------
    Instance dependent noise
    #Actual noise rate 0.31
    [cuda:0] LNPCC waiting for GPU slot...
    [cuda:0] Slot acquired (waited 15.2s). Starting GCN...
    FINAL_RESULT: {'acc': {'train': 0.8976377952755905, 'valid': 0.552, 'test': 0.778}, 'wall_s': 8.24, 'cpu_s': 5.93, 'gpu_s': 2.29, 'wait_s': 15.2}
    [Time] wall=8.2s | cpu=5.9s | gpu=2.3s
    C:\Users\fbrev\Documents\Acadêmico\Simulações\Python\NoisyGL\predictor\Base_Predictor.py:114: UserWarning: expandable_segments not supported on this platform (Triggered internally at ..\c10/cuda/CUDAAllocatorConfig.h:28.)
    self.edge_index = self._cpu_edge_index.to(self.device)
    C:\Users\fbrev\Documents\Acadêmico\Simulações\Python\NoisyGL\predictor\Base_Predictor.py:144: UserWarning: Sparse CSR tensor support is in beta state. If you miss a functionality in the sparse tensor support, please submit a feature request to https://github.com/pytorch/pytorch/issues. (Triggered internally at ..\aten\src\ATen\SparseCsrTensorImpl.cpp:55.)
    self.adj_csr = self.adj.to_sparse_csr().to(self.device)
