[I 2026-05-06 21:41:04,604] Trial 47 finished with value: 0.597 and parameters: {'lr': 0.05, 'weight_decay': 0.01, 'n_hidden': 64, 'n_layer': 3, 'dropout': 0.5311807048787133, 'knn_mode': 'd', 'k': 33, 'dexp': 8.601174719090517, 'p_grd': 0.39085176677845646, 'unc_rem': 0.69933281008469, 'unc_rel': 0.27100049101690155}. Best is trial 18 with value: 0.625.
    [CPU] Loading pubmed...
    DEBUG 3.1: Dataset init start
    DEBUG 3.2: prepare_data start pubmed
    ----Data statistics------'
    Name: pubmed
    #Nodes 19717
    #Edges 44324
    #Classes 3
    #Ave_degree 4.50
    ----Split statistics------'
    #Train samples 60 (default)
    #Val samples 500 (default)
    #Test samples 1000 (default)
    ----label noise information:------
    Instance dependent noise
    #Actual noise rate 0.40
    [cuda:1] LNPCC waiting for GPU slot...
    [cuda:1] Slot acquired (waited 153.1s). Starting GCN...
    FINAL_RESULT: {'acc': {'train': 0.6140350877192983, 'valid': 0.404, 'test': 0.602}, 'wall_s': 31.46, 'cpu_s': 27.53, 'gpu_s': 3.87, 'wait_s': 153.06}
    [Time] wall=31.5s | cpu=27.5s | gpu=3.9s
    C:\Users\fbrev\Documents\Acadêmico\Simulações\Python\NoisyGL\predictor\Base_Predictor.py:114: UserWarning: expandable_segments not supported on this platform (Triggered internally at ..\c10/cuda/CUDAAllocatorConfig.h:28.)
    self.edge_index = self._cpu_edge_index.to(self.device)
    C:\Users\fbrev\Documents\Acadêmico\Simulações\Python\NoisyGL\predictor\Base_Predictor.py:144: UserWarning: Sparse CSR tensor support is in beta state. If you miss a functionality in the sparse tensor support, please submit a feature request to https://github.com/pytorch/pytorch/issues. (Triggered internally at ..\aten\src\ATen\SparseCsrTensorImpl.cpp:55.)
    self.adj_csr = self.adj.to_sparse_csr().to(self.device)
[I 2026-05-06 21:44:14,904] Trial 48 finished with value: 0.602 and parameters: {'lr': 0.05, 'weight_decay': 0.01, 'n_hidden': 256, 'n_layer': 2, 'dropout': 0.24300708289709794, 'knn_mode': 's', 'k': 16, 'dexp': 3.100872820413614, 'p_grd': 0.34538466336979806, 'unc_rem': 0.6400393091227005, 'unc_rel': 0.15764393048167244}. Best is trial 18 with value: 0.625.
    [CPU] Loading pubmed...
    DEBUG 3.1: Dataset init start
    DEBUG 3.2: prepare_data start pubmed
    ----Data statistics------'
    Name: pubmed
    #Nodes 19717
    #Edges 44324
    #Classes 3
    #Ave_degree 4.50
    ----Split statistics------'
    #Train samples 60 (default)
    #Val samples 500 (default)
    #Test samples 1000 (default)
    ----label noise information:------
    Instance dependent noise
    #Actual noise rate 0.40
    [cuda:1] LNPCC waiting for GPU slot...
    [cuda:1] Slot acquired (waited 163.8s). Starting GCN...
    FINAL_RESULT: {'acc': {'train': 0.288135593220339, 'valid': 0.324, 'test': 0.413}, 'wall_s': 24.28, 'cpu_s': 21.33, 'gpu_s': 2.91, 'wait_s': 163.83}
    [Time] wall=24.3s | cpu=21.3s | gpu=2.9s
    C:\Users\fbrev\Documents\Acadêmico\Simulações\Python\NoisyGL\predictor\Base_Predictor.py:114: UserWarning: expandable_segments not supported on this platform (Triggered internally at ..\c10/cuda/CUDAAllocatorConfig.h:28.)
    self.edge_index = self._cpu_edge_index.to(self.device)
    C:\Users\fbrev\Documents\Acadêmico\Simulações\Python\NoisyGL\predictor\Base_Predictor.py:144: UserWarning: Sparse CSR tensor support is in beta state. If you miss a functionality in the sparse tensor support, please submit a feature request to https://github.com/pytorch/pytorch/issues. (Triggered internally at ..\aten\src\ATen\SparseCsrTensorImpl.cpp:55.)
    self.adj_csr = self.adj.to_sparse_csr().to(self.device)
