[worker] START lnpcc_amazon-ratings_0.4 gpu=1
[HPO] Starting Phase 1 (Optuna) for lnpcc_amazon-ratings_instance_0.4...
[I 2026-04-27 01:35:31,026] Using an existing study with name 'lnpcc_amazon-ratings_instance_0.4' instead of creating a new one.
    [CPU] Loading amazon-ratings...
    DEBUG 3.1: Dataset init start
    DEBUG 3.2: prepare_data start amazon-ratings
    ----Data statistics------'
    Name: amazon-ratings
    #Nodes 24492
    #Edges 93050
    #Classes 5
    #Ave_degree 7.60
    ----Split statistics------'
    #Train samples 1224 (5.0 % of nodes)
    #Val samples 3673 (15.0 % of nodes)
    #Test samples 19595 (remaining)
    ----label noise information:------
    Instance dependent noise
    #Actual noise rate 0.40
    [cuda:1] LNPCC waiting for GPU slot...
    [cuda:1] Slot acquired (waited 0.0s). Starting GCN...
    FINAL_RESULT: {'acc': {'train': 0.17892156862745098, 'valid': 0.26218350122515655, 'test': 0.36851237560602196}, 'wall_s': 91.52, 'cpu_s': 87.55, 'gpu_s': 3.93, 'wait_s': 0.0}
    [Time] wall=91.5s | cpu=87.5s | gpu=3.9s
    C:\Users\fbrev\Documents\Acadêmico\Simulações\Python\NoisyGL\predictor\Base_Predictor.py:144: UserWarning: Sparse CSR tensor support is in beta state. If you miss a functionality in the sparse tensor support, please submit a feature request to https://github.com/pytorch/pytorch/issues. (Triggered internally at ..\aten\src\ATen\SparseCsrTensorImpl.cpp:55.)
    self.adj_csr = self.adj.to_sparse_csr().to(self.device)
[I 2026-04-27 01:37:09,031] Trial 36 finished with value: 0.36851237560602196 and parameters: {'lr': 0.1, 'weight_decay': 0.01, 'n_hidden': 64, 'n_layer': 3, 'dropout': 0.22777583729818274, 'knn_mode': 's', 'k': 30, 'dexp': 9.98982889706969, 'p_grd': 0.9274791320931934, 'unc_rem': 0.3647953253895734, 'unc_rel': 0.6500442368020756}. Best is trial 18 with value: 0.39081398315896915.
    [CPU] Loading amazon-ratings...
    DEBUG 3.1: Dataset init start
    DEBUG 3.2: prepare_data start amazon-ratings
    ----Data statistics------'
    Name: amazon-ratings
    #Nodes 24492
    #Edges 93050
    #Classes 5
    #Ave_degree 7.60
    ----Split statistics------'
    #Train samples 1224 (5.0 % of nodes)
    #Val samples 3673 (15.0 % of nodes)
    #Test samples 19595 (remaining)
    ----label noise information:------
    Instance dependent noise
    #Actual noise rate 0.40
    [cuda:1] LNPCC waiting for GPU slot...
    [cuda:1] Slot acquired (waited 4.2s). Starting GCN...
    FINAL_RESULT: {'acc': {'train': 0.27941176470588236, 'valid': 0.28314729104274433, 'test': 0.3438121969890278}, 'wall_s': 67.99, 'cpu_s': 64.99, 'gpu_s': 2.94, 'wait_s': 4.22}
    [Time] wall=68.0s | cpu=65.0s | gpu=2.9s
    C:\Users\fbrev\Documents\Acadêmico\Simulações\Python\NoisyGL\predictor\Base_Predictor.py:144: UserWarning: Sparse CSR tensor support is in beta state. If you miss a functionality in the sparse tensor support, please submit a feature request to https://github.com/pytorch/pytorch/issues. (Triggered internally at ..\aten\src\ATen\SparseCsrTensorImpl.cpp:55.)
    self.adj_csr = self.adj.to_sparse_csr().to(self.device)
[I 2026-04-27 01:38:28,919] Trial 37 finished with value: 0.3438121969890278 and parameters: {'lr': 0.05, 'weight_decay': 0.001, 'n_hidden': 32, 'n_layer': 3, 'dropout': 0.43004574284910135, 'knn_mode': 's', 'k': 44, 'dexp': 4.311887254780575, 'p_grd': 0.5107389564547818, 'unc_rem': 0.6549301941262446, 'unc_rel': 0.9303423119003881}. Best is trial 18 with value: 0.39081398315896915.
    [CPU] Loading amazon-ratings...
    DEBUG 3.1: Dataset init start
    DEBUG 3.2: prepare_data start amazon-ratings
    ----Data statistics------'
    Name: amazon-ratings
    #Nodes 24492
    #Edges 93050
    #Classes 5
    #Ave_degree 7.60
    ----Split statistics------'
    #Train samples 1224 (5.0 % of nodes)
    #Val samples 3673 (15.0 % of nodes)
    #Test samples 19595 (remaining)
    ----label noise information:------
    Instance dependent noise
    #Actual noise rate 0.40
    [cuda:1] LNPCC waiting for GPU slot...
    [cuda:1] Slot acquired (waited 0.1s). Starting GCN...
    FINAL_RESULT: {'acc': {'train': 0.3488562091503268, 'valid': 0.2681731554587531, 'test': 0.34774177085991326}, 'wall_s': 110.67, 'cpu_s': 105.29, 'gpu_s': 5.33, 'wait_s': 0.1}
    [Time] wall=110.7s | cpu=105.3s | gpu=5.3s
    C:\Users\fbrev\Documents\Acadêmico\Simulações\Python\NoisyGL\predictor\Base_Predictor.py:144: UserWarning: Sparse CSR tensor support is in beta state. If you miss a functionality in the sparse tensor support, please submit a feature request to https://github.com/pytorch/pytorch/issues. (Triggered internally at ..\aten\src\ATen\SparseCsrTensorImpl.cpp:55.)
    self.adj_csr = self.adj.to_sparse_csr().to(self.device)
[I 2026-04-27 01:40:26,616] Trial 38 finished with value: 0.34774177085991326 and parameters: {'lr': 0.1, 'weight_decay': 0.0, 'n_hidden': 128, 'n_layer': 3, 'dropout': 0.5718818646916131, 'knn_mode': 'd', 'k': 38, 'dexp': 5.419302081313462, 'p_grd': 0.6962384752207459, 'unc_rem': 0.566069877467629, 'unc_rel': 0.8230197050740622}. Best is trial 18 with value: 0.39081398315896915.
    [CPU] Loading amazon-ratings...
    DEBUG 3.1: Dataset init start
    DEBUG 3.2: prepare_data start amazon-ratings
    ----Data statistics------'
    Name: amazon-ratings
    #Nodes 24492
    #Edges 93050
    #Classes 5
    #Ave_degree 7.60
    ----Split statistics------'
    #Train samples 1224 (5.0 % of nodes)
    #Val samples 3673 (15.0 % of nodes)
    #Test samples 19595 (remaining)
    ----label noise information:------
    Instance dependent noise
    #Actual noise rate 0.40
    [cuda:1] LNPCC waiting for GPU slot...
    [cuda:1] Slot acquired (waited 2.4s). Starting GCN...
    FINAL_RESULT: {'acc': {'train': 0.3611111111111111, 'valid': 0.28777566022325074, 'test': 0.39377392191885685}, 'wall_s': 65.67, 'cpu_s': 61.53, 'gpu_s': 4.07, 'wait_s': 2.39}
    [Time] wall=65.7s | cpu=61.5s | gpu=4.1s
    C:\Users\fbrev\Documents\Acadêmico\Simulações\Python\NoisyGL\predictor\Base_Predictor.py:144: UserWarning: Sparse CSR tensor support is in beta state. If you miss a functionality in the sparse tensor support, please submit a feature request to https://github.com/pytorch/pytorch/issues. (Triggered internally at ..\aten\src\ATen\SparseCsrTensorImpl.cpp:55.)
    self.adj_csr = self.adj.to_sparse_csr().to(self.device)
[I 2026-04-27 01:41:41,582] Trial 39 finished with value: 0.39377392191885685 and parameters: {'lr': 0.005, 'weight_decay': 0.001, 'n_hidden': 64, 'n_layer': 3, 'dropout': 0.18925622735778852, 'knn_mode': 's', 'k': 33, 'dexp': 8.719814114730752, 'p_grd': 0.4608629049270189, 'unc_rem': 0.9306994806096183, 'unc_rel': 0.7395014974337973}. Best is trial 39 with value: 0.39377392191885685.
    [CPU] Loading amazon-ratings...
    DEBUG 3.1: Dataset init start
    DEBUG 3.2: prepare_data start amazon-ratings
    ----Data statistics------'
    Name: amazon-ratings
    #Nodes 24492
    #Edges 93050
    #Classes 5
    #Ave_degree 7.60
    ----Split statistics------'
    #Train samples 1224 (5.0 % of nodes)
    #Val samples 3673 (15.0 % of nodes)
    #Test samples 19595 (remaining)
    ----label noise information:------
    Instance dependent noise
    #Actual noise rate 0.40
    [cuda:1] LNPCC waiting for GPU slot...
    [cuda:1] Slot acquired (waited 1.2s). Starting GCN...
    FINAL_RESULT: {'acc': {'train': 0.5098846787479407, 'valid': 0.2801524639259461, 'test': 0.36524623628476655}, 'wall_s': 31.54, 'cpu_s': 27.74, 'gpu_s': 3.73, 'wait_s': 1.22}
    [Time] wall=31.5s | cpu=27.7s | gpu=3.7s
    C:\Users\fbrev\Documents\Acadêmico\Simulações\Python\NoisyGL\predictor\Base_Predictor.py:144: UserWarning: Sparse CSR tensor support is in beta state. If you miss a functionality in the sparse tensor support, please submit a feature request to https://github.com/pytorch/pytorch/issues. (Triggered internally at ..\aten\src\ATen\SparseCsrTensorImpl.cpp:55.)
    self.adj_csr = self.adj.to_sparse_csr().to(self.device)
[I 2026-04-27 01:42:21,740] Trial 40 finished with value: 0.36524623628476655 and parameters: {'lr': 0.005, 'weight_decay': 0.0001, 'n_hidden': 64, 'n_layer': 3, 'dropout': 0.1613170036768091, 'knn_mode': 's', 'k': 24, 'dexp': 8.539930431308793, 'p_grd': 0.13185070163288254, 'unc_rem': 0.9419542422795741, 'unc_rel': 0.7451835085845512}. Best is trial 39 with value: 0.39377392191885685.
    [CPU] Loading amazon-ratings...
    DEBUG 3.1: Dataset init start
    DEBUG 3.2: prepare_data start amazon-ratings
    ----Data statistics------'
    Name: amazon-ratings
    #Nodes 24492
    #Edges 93050
    #Classes 5
    #Ave_degree 7.60
    ----Split statistics------'
    #Train samples 1224 (5.0 % of nodes)
    #Val samples 3673 (15.0 % of nodes)
    #Test samples 19595 (remaining)
    ----label noise information:------
    Instance dependent noise
    #Actual noise rate 0.40
    [cuda:1] LNPCC waiting for GPU slot...
    [cuda:1] Slot acquired (waited 1.7s). Starting GCN...
    FINAL_RESULT: {'acc': {'train': 0.2769607843137255, 'valid': 0.2632725292676286, 'test': 0.3690227098749681}, 'wall_s': 59.67, 'cpu_s': 56.61, 'gpu_s': 2.99, 'wait_s': 1.67}
    [Time] wall=59.7s | cpu=56.6s | gpu=3.0s
    C:\Users\fbrev\Documents\Acadêmico\Simulações\Python\NoisyGL\predictor\Base_Predictor.py:144: UserWarning: Sparse CSR tensor support is in beta state. If you miss a functionality in the sparse tensor support, please submit a feature request to https://github.com/pytorch/pytorch/issues. (Triggered internally at ..\aten\src\ATen\SparseCsrTensorImpl.cpp:55.)
    self.adj_csr = self.adj.to_sparse_csr().to(self.device)
[I 2026-04-27 01:43:30,169] Trial 41 finished with value: 0.3690227098749681 and parameters: {'lr': 0.005, 'weight_decay': 0.05, 'n_hidden': 32, 'n_layer': 3, 'dropout': 0.0908962309368629, 'knn_mode': 'd', 'k': 17, 'dexp': 8.976567016728044, 'p_grd': 0.4405977622508708, 'unc_rem': 0.8706108346323039, 'unc_rel': 0.8290444755049405}. Best is trial 39 with value: 0.39377392191885685.
    [CPU] Loading amazon-ratings...
    DEBUG 3.1: Dataset init start
    DEBUG 3.2: prepare_data start amazon-ratings
    ----Data statistics------'
    Name: amazon-ratings
    #Nodes 24492
    #Edges 93050
    #Classes 5
    #Ave_degree 7.60
    ----Split statistics------'
    #Train samples 1224 (5.0 % of nodes)
    #Val samples 3673 (15.0 % of nodes)
    #Test samples 19595 (remaining)
    ----label noise information:------
    Instance dependent noise
    #Actual noise rate 0.40
    [cuda:1] LNPCC waiting for GPU slot...
    [cuda:1] Slot acquired (waited 6.9s). Starting GCN...
    FINAL_RESULT: {'acc': {'train': 0.3660130718954248, 'valid': 0.2828750340321263, 'test': 0.3914774177085991}, 'wall_s': 67.18, 'cpu_s': 63.39, 'gpu_s': 3.73, 'wait_s': 6.86}
    [Time] wall=67.2s | cpu=63.4s | gpu=3.7s
    C:\Users\fbrev\Documents\Acadêmico\Simulações\Python\NoisyGL\predictor\Base_Predictor.py:144: UserWarning: Sparse CSR tensor support is in beta state. If you miss a functionality in the sparse tensor support, please submit a feature request to https://github.com/pytorch/pytorch/issues. (Triggered internally at ..\aten\src\ATen\SparseCsrTensorImpl.cpp:55.)
    self.adj_csr = self.adj.to_sparse_csr().to(self.device)
[I 2026-04-27 01:44:51,294] Trial 42 finished with value: 0.3914774177085991 and parameters: {'lr': 0.005, 'weight_decay': 0.001, 'n_hidden': 64, 'n_layer': 3, 'dropout': 0.22145970972300003, 'knn_mode': 's', 'k': 33, 'dexp': 7.835154771412902, 'p_grd': 0.6041434198715534, 'unc_rem': 0.7796847096153293, 'unc_rel': 0.6341945598704204}. Best is trial 39 with value: 0.39377392191885685.
    [CPU] Loading amazon-ratings...
    DEBUG 3.1: Dataset init start
    DEBUG 3.2: prepare_data start amazon-ratings
    ----Data statistics------'
    Name: amazon-ratings
    #Nodes 24492
    #Edges 93050
    #Classes 5
    #Ave_degree 7.60
    ----Split statistics------'
    #Train samples 1224 (5.0 % of nodes)
    #Val samples 3673 (15.0 % of nodes)
    #Test samples 19595 (remaining)
    ----label noise information:------
    Instance dependent noise
    #Actual noise rate 0.40
    [cuda:1] LNPCC waiting for GPU slot...
    [cuda:1] Slot acquired (waited 10.4s). Starting GCN...
    FINAL_RESULT: {'acc': {'train': 0.3802125919869174, 'valid': 0.28532534712768853, 'test': 0.39438632304159227}, 'wall_s': 51.78, 'cpu_s': 47.85, 'gpu_s': 3.86, 'wait_s': 10.38}
    [Time] wall=51.8s | cpu=47.8s | gpu=3.9s
    C:\Users\fbrev\Documents\Acadêmico\Simulações\Python\NoisyGL\predictor\Base_Predictor.py:144: UserWarning: Sparse CSR tensor support is in beta state. If you miss a functionality in the sparse tensor support, please submit a feature request to https://github.com/pytorch/pytorch/issues. (Triggered internally at ..\aten\src\ATen\SparseCsrTensorImpl.cpp:55.)
    self.adj_csr = self.adj.to_sparse_csr().to(self.device)
[I 2026-04-27 01:46:00,434] Trial 43 finished with value: 0.39438632304159227 and parameters: {'lr': 0.005, 'weight_decay': 0.001, 'n_hidden': 64, 'n_layer': 3, 'dropout': 0.22633167691758801, 'knn_mode': 's', 'k': 32, 'dexp': 7.820340601400009, 'p_grd': 0.34731282984397904, 'unc_rem': 0.7935163897315285, 'unc_rel': 0.7306454134961252}. Best is trial 43 with value: 0.39438632304159227.
    [CPU] Loading amazon-ratings...
    DEBUG 3.1: Dataset init start
    DEBUG 3.2: prepare_data start amazon-ratings
    ----Data statistics------'
    Name: amazon-ratings
    #Nodes 24492
    #Edges 93050
    #Classes 5
    #Ave_degree 7.60
    ----Split statistics------'
    #Train samples 1224 (5.0 % of nodes)
    #Val samples 3673 (15.0 % of nodes)
    #Test samples 19595 (remaining)
    ----label noise information:------
    Instance dependent noise
    #Actual noise rate 0.40
    [cuda:1] LNPCC waiting for GPU slot...
    [cuda:1] Slot acquired (waited 3.7s). Starting GCN...
    FINAL_RESULT: {'acc': {'train': 0.35866013071895425, 'valid': 0.28559760413830654, 'test': 0.3977034957897423}, 'wall_s': 43.93, 'cpu_s': 40.01, 'gpu_s': 3.85, 'wait_s': 3.71}
    [Time] wall=43.9s | cpu=40.0s | gpu=3.9s
    C:\Users\fbrev\Documents\Acadêmico\Simulações\Python\NoisyGL\predictor\Base_Predictor.py:144: UserWarning: Sparse CSR tensor support is in beta state. If you miss a functionality in the sparse tensor support, please submit a feature request to https://github.com/pytorch/pytorch/issues. (Triggered internally at ..\aten\src\ATen\SparseCsrTensorImpl.cpp:55.)
    self.adj_csr = self.adj.to_sparse_csr().to(self.device)
[I 2026-04-27 01:46:54,925] Trial 44 finished with value: 0.3977034957897423 and parameters: {'lr': 0.005, 'weight_decay': 0.001, 'n_hidden': 64, 'n_layer': 3, 'dropout': 0.20163024157888068, 'knn_mode': 's', 'k': 33, 'dexp': 7.544411413834467, 'p_grd': 0.3399089368826562, 'unc_rem': 0.7798600590046403, 'unc_rel': 0.7205832130696188}. Best is trial 44 with value: 0.3977034957897423.
    [CPU] Loading amazon-ratings...
    DEBUG 3.1: Dataset init start
    DEBUG 3.2: prepare_data start amazon-ratings
    ----Data statistics------'
    Name: amazon-ratings
    #Nodes 24492
    #Edges 93050
    #Classes 5
    #Ave_degree 7.60
    ----Split statistics------'
    #Train samples 1224 (5.0 % of nodes)
    #Val samples 3673 (15.0 % of nodes)
    #Test samples 19595 (remaining)
    ----label noise information:------
    Instance dependent noise
    #Actual noise rate 0.40
    [cuda:1] LNPCC waiting for GPU slot...
    [cuda:1] Slot acquired (waited 0.3s). Starting GCN...
    FINAL_RESULT: {'acc': {'train': 0.3759213759213759, 'valid': 0.28695888919139667, 'test': 0.39719316152079615}, 'wall_s': 47.05, 'cpu_s': 43.13, 'gpu_s': 3.86, 'wait_s': 0.31}
    [Time] wall=47.1s | cpu=43.1s | gpu=3.9s
    C:\Users\fbrev\Documents\Acadêmico\Simulações\Python\NoisyGL\predictor\Base_Predictor.py:144: UserWarning: Sparse CSR tensor support is in beta state. If you miss a functionality in the sparse tensor support, please submit a feature request to https://github.com/pytorch/pytorch/issues. (Triggered internally at ..\aten\src\ATen\SparseCsrTensorImpl.cpp:55.)
    self.adj_csr = self.adj.to_sparse_csr().to(self.device)
[I 2026-04-27 01:47:49,389] Trial 45 finished with value: 0.39719316152079615 and parameters: {'lr': 0.005, 'weight_decay': 0.001, 'n_hidden': 64, 'n_layer': 3, 'dropout': 0.19699105827839325, 'knn_mode': 's', 'k': 28, 'dexp': 7.881220251762133, 'p_grd': 0.32310269555961457, 'unc_rem': 0.775558046400109, 'unc_rel': 0.7084364260068154}. Best is trial 44 with value: 0.3977034957897423.
    [CPU] Loading amazon-ratings...
    DEBUG 3.1: Dataset init start
    DEBUG 3.2: prepare_data start amazon-ratings
    ----Data statistics------'
    Name: amazon-ratings
    #Nodes 24492
    #Edges 93050
    #Classes 5
    #Ave_degree 7.60
    ----Split statistics------'
    #Train samples 1224 (5.0 % of nodes)
    #Val samples 3673 (15.0 % of nodes)
    #Test samples 19595 (remaining)
    ----label noise information:------
    Instance dependent noise
    #Actual noise rate 0.40
    [cuda:1] LNPCC waiting for GPU slot...
    [cuda:1] Slot acquired (waited 0.9s). Starting GCN...
    FINAL_RESULT: {'acc': {'train': 0.37131147540983606, 'valid': 0.2834195480533624, 'test': 0.3911201837203368}, 'wall_s': 44.22, 'cpu_s': 38.87, 'gpu_s': 5.27, 'wait_s': 0.87}
    [Time] wall=44.2s | cpu=38.9s | gpu=5.3s
    C:\Users\fbrev\Documents\Acadêmico\Simulações\Python\NoisyGL\predictor\Base_Predictor.py:144: UserWarning: Sparse CSR tensor support is in beta state. If you miss a functionality in the sparse tensor support, please submit a feature request to https://github.com/pytorch/pytorch/issues. (Triggered internally at ..\aten\src\ATen\SparseCsrTensorImpl.cpp:55.)
    self.adj_csr = self.adj.to_sparse_csr().to(self.device)
[I 2026-04-27 01:48:41,585] Trial 46 finished with value: 0.3911201837203368 and parameters: {'lr': 0.005, 'weight_decay': 0.001, 'n_hidden': 128, 'n_layer': 3, 'dropout': 0.1995691682696546, 'knn_mode': 's', 'k': 28, 'dexp': 7.60580494818866, 'p_grd': 0.33495992236690586, 'unc_rem': 0.778577839498233, 'unc_rel': 0.5514169432782525}. Best is trial 44 with value: 0.3977034957897423.
    [CPU] Loading amazon-ratings...
    DEBUG 3.1: Dataset init start
    DEBUG 3.2: prepare_data start amazon-ratings
    ----Data statistics------'
    Name: amazon-ratings
    #Nodes 24492
    #Edges 93050
    #Classes 5
    #Ave_degree 7.60
    ----Split statistics------'
    #Train samples 1224 (5.0 % of nodes)
    #Val samples 3673 (15.0 % of nodes)
    #Test samples 19595 (remaining)
    ----label noise information:------
    Instance dependent noise
    #Actual noise rate 0.40
    [cuda:1] LNPCC waiting for GPU slot...
    [cuda:1] Slot acquired (waited 17.9s). Starting GCN...
    FINAL_RESULT: {'acc': {'train': 0.4207516339869281, 'valid': 0.27960794990471005, 'test': 0.372492982903802}, 'wall_s': 41.64, 'cpu_s': 38.9, 'gpu_s': 2.68, 'wait_s': 17.88}
    [Time] wall=41.6s | cpu=38.9s | gpu=2.7s
    C:\Users\fbrev\Documents\Acadêmico\Simulações\Python\NoisyGL\predictor\Base_Predictor.py:144: UserWarning: Sparse CSR tensor support is in beta state. If you miss a functionality in the sparse tensor support, please submit a feature request to https://github.com/pytorch/pytorch/issues. (Triggered internally at ..\aten\src\ATen\SparseCsrTensorImpl.cpp:55.)
    self.adj_csr = self.adj.to_sparse_csr().to(self.device)
[I 2026-04-27 01:49:48,223] Trial 47 finished with value: 0.372492982903802 and parameters: {'lr': 0.005, 'weight_decay': 0.001, 'n_hidden': 64, 'n_layer': 2, 'dropout': 0.05660678308404618, 'knn_mode': 's', 'k': 33, 'dexp': 7.824569110574684, 'p_grd': 0.3720025752269247, 'unc_rem': 0.7800116974400054, 'unc_rel': 0.7363634779417633}. Best is trial 44 with value: 0.3977034957897423.
    [CPU] Loading amazon-ratings...
    DEBUG 3.1: Dataset init start
    DEBUG 3.2: prepare_data start amazon-ratings
    ----Data statistics------'
    Name: amazon-ratings
    #Nodes 24492
    #Edges 93050
    #Classes 5
    #Ave_degree 7.60
    ----Split statistics------'
    #Train samples 1224 (5.0 % of nodes)
    #Val samples 3673 (15.0 % of nodes)
    #Test samples 19595 (remaining)
    ----label noise information:------
    Instance dependent noise
    #Actual noise rate 0.40
    [cuda:1] LNPCC waiting for GPU slot...
    [cuda:1] Slot acquired (waited 0.0s). Starting GCN...
    FINAL_RESULT: {'acc': {'train': 0.4763877381938691, 'valid': 0.2757963517560577, 'test': 0.36157182954835415}, 'wall_s': 34.6, 'cpu_s': 30.73, 'gpu_s': 3.8, 'wait_s': 0.0}
    [Time] wall=34.6s | cpu=30.7s | gpu=3.8s
    C:\Users\fbrev\Documents\Acadêmico\Simulações\Python\NoisyGL\predictor\Base_Predictor.py:144: UserWarning: Sparse CSR tensor support is in beta state. If you miss a functionality in the sparse tensor support, please submit a feature request to https://github.com/pytorch/pytorch/issues. (Triggered internally at ..\aten\src\ATen\SparseCsrTensorImpl.cpp:55.)
    self.adj_csr = self.adj.to_sparse_csr().to(self.device)
