[I 2026-04-30 09:43:21,408] Trial 27 finished with value: 0.817 and parameters: {'lr': 0.005, 'weight_decay': 0.001, 'n_hidden': 64, 'n_layer': 2, 'dropout': 0.6535298225577262, 'knn_mode': 'd', 'k': 28, 'dexp': 6.118905604391342, 'p_grd': 0.5422455950949151, 'unc_rem': 0.528819231237862, 'unc_rel': 0.4624892267033806}. Best is trial 7 with value: 0.825.
    [CPU] Loading amazoncom...
    DEBUG 3.1: Dataset init start
    DEBUG 3.2: prepare_data start amazoncom
    ----Data statistics------'
    Name: amazoncom
    #Nodes 13752
    #Edges 245861
    #Classes 10
    #Ave_degree 35.76
    ----Split statistics------'
    #Train samples 200 (20 nodes per class)
    #Val samples 500 (specified)
    #Test samples 1000 (specified)
    ----label noise information:------
    Instance dependent noise
    #Actual noise rate 0.13
    [cuda:0] LNPCC waiting for GPU slot...
    [cuda:0] Slot acquired (waited 296.6s). Starting GCN...
    FINAL_RESULT: {'acc': {'train': 0.835, 'valid': 0.714, 'test': 0.82}, 'wall_s': 45.4, 'cpu_s': 42.11, 'gpu_s': 3.23, 'wait_s': 296.57}
    [Time] wall=45.4s | cpu=42.1s | gpu=3.2s
    C:\Users\fbrev\Documents\Acadêmico\Simulações\Python\NoisyGL\predictor\Base_Predictor.py:144: UserWarning: Sparse CSR tensor support is in beta state. If you miss a functionality in the sparse tensor support, please submit a feature request to https://github.com/pytorch/pytorch/issues. (Triggered internally at ..\aten\src\ATen\SparseCsrTensorImpl.cpp:55.)
    self.adj_csr = self.adj.to_sparse_csr().to(self.device)
[I 2026-04-30 09:49:09,403] Trial 28 finished with value: 0.82 and parameters: {'lr': 0.005, 'weight_decay': 0.001, 'n_hidden': 64, 'n_layer': 2, 'dropout': 0.45161585276281635, 'knn_mode': 'd', 'k': 36, 'dexp': 5.2425070554203606, 'p_grd': 0.38628891290850076, 'unc_rem': 0.6228871939748085, 'unc_rel': 0.2696207009332082}. Best is trial 7 with value: 0.825.
    [CPU] Loading amazoncom...
    DEBUG 3.1: Dataset init start
    DEBUG 3.2: prepare_data start amazoncom
    ----Data statistics------'
    Name: amazoncom
    #Nodes 13752
    #Edges 245861
    #Classes 10
    #Ave_degree 35.76
    ----Split statistics------'
    #Train samples 200 (20 nodes per class)
    #Val samples 500 (specified)
    #Test samples 1000 (specified)
    ----label noise information:------
    Instance dependent noise
    #Actual noise rate 0.13
    [cuda:0] LNPCC waiting for GPU slot...
    [cuda:0] Slot acquired (waited 294.5s). Starting GCN...
    FINAL_RESULT: {'acc': {'train': 0.105, 'valid': 0.344, 'test': 0.382}, 'wall_s': 44.99, 'cpu_s': 41.85, 'gpu_s': 3.07, 'wait_s': 294.5}
    [Time] wall=45.0s | cpu=41.9s | gpu=3.1s
    C:\Users\fbrev\Documents\Acadêmico\Simulações\Python\NoisyGL\predictor\Base_Predictor.py:144: UserWarning: Sparse CSR tensor support is in beta state. If you miss a functionality in the sparse tensor support, please submit a feature request to https://github.com/pytorch/pytorch/issues. (Triggered internally at ..\aten\src\ATen\SparseCsrTensorImpl.cpp:55.)
    self.adj_csr = self.adj.to_sparse_csr().to(self.device)
[I 2026-04-30 09:54:54,294] Trial 29 finished with value: 0.382 and parameters: {'lr': 0.1, 'weight_decay': 0.001, 'n_hidden': 64, 'n_layer': 2, 'dropout': 0.42360084155896804, 'knn_mode': 'd', 'k': 35, 'dexp': 4.792301569669112, 'p_grd': 0.3583369973724726, 'unc_rem': 0.6359467730560091, 'unc_rel': 0.5507178174132826}. Best is trial 7 with value: 0.825.
    [CPU] Loading amazoncom...
    DEBUG 3.1: Dataset init start
    DEBUG 3.2: prepare_data start amazoncom
    ----Data statistics------'
    Name: amazoncom
    #Nodes 13752
    #Edges 245861
    #Classes 10
    #Ave_degree 35.76
    ----Split statistics------'
    #Train samples 200 (20 nodes per class)
    #Val samples 500 (specified)
    #Test samples 1000 (specified)
    ----label noise information:------
    Instance dependent noise
    #Actual noise rate 0.13
    [cuda:0] LNPCC waiting for GPU slot...
    [cuda:0] Slot acquired (waited 1752.6s). Starting GCN...
    FINAL_RESULT: {'acc': {'train': 0.785, 'valid': 0.702, 'test': 0.814}, 'wall_s': 46.5, 'cpu_s': 41.65, 'gpu_s': 4.78, 'wait_s': 1752.63}
    [Time] wall=46.5s | cpu=41.6s | gpu=4.8s
    C:\Users\fbrev\Documents\Acadêmico\Simulações\Python\NoisyGL\predictor\Base_Predictor.py:144: UserWarning: Sparse CSR tensor support is in beta state. If you miss a functionality in the sparse tensor support, please submit a feature request to https://github.com/pytorch/pytorch/issues. (Triggered internally at ..\aten\src\ATen\SparseCsrTensorImpl.cpp:55.)
    self.adj_csr = self.adj.to_sparse_csr().to(self.device)
[I 2026-04-30 10:24:59,489] Trial 30 finished with value: 0.814 and parameters: {'lr': 0.005, 'weight_decay': 0.001, 'n_hidden': 64, 'n_layer': 2, 'dropout': 0.5640790111994424, 'knn_mode': 'd', 'k': 41, 'dexp': 7.403835535029185, 'p_grd': 0.4474919122011418, 'unc_rem': 0.47501312396211043, 'unc_rel': 0.4685875044354812}. Best is trial 7 with value: 0.825.
    [CPU] Loading amazoncom...
    DEBUG 3.1: Dataset init start
    DEBUG 3.2: prepare_data start amazoncom
    ----Data statistics------'
    Name: amazoncom
    #Nodes 13752
    #Edges 245861
    #Classes 10
    #Ave_degree 35.76
    ----Split statistics------'
    #Train samples 200 (20 nodes per class)
    #Val samples 500 (specified)
    #Test samples 1000 (specified)
    ----label noise information:------
    Instance dependent noise
    #Actual noise rate 0.13
    [cuda:0] LNPCC waiting for GPU slot...
    [cuda:0] Slot acquired (waited 121.1s). Starting GCN...
    FINAL_RESULT: {'acc': {'train': 0.815, 'valid': 0.718, 'test': 0.827}, 'wall_s': 63.0, 'cpu_s': 58.72, 'gpu_s': 4.19, 'wait_s': 121.11}
    [Time] wall=63.0s | cpu=58.7s | gpu=4.2s
    C:\Users\fbrev\Documents\Acadêmico\Simulações\Python\NoisyGL\predictor\Base_Predictor.py:144: UserWarning: Sparse CSR tensor support is in beta state. If you miss a functionality in the sparse tensor support, please submit a feature request to https://github.com/pytorch/pytorch/issues. (Triggered internally at ..\aten\src\ATen\SparseCsrTensorImpl.cpp:55.)
    self.adj_csr = self.adj.to_sparse_csr().to(self.device)
[I 2026-04-30 10:28:11,798] Trial 31 finished with value: 0.827 and parameters: {'lr': 0.005, 'weight_decay': 0.001, 'n_hidden': 64, 'n_layer': 2, 'dropout': 0.6883920257480795, 'knn_mode': 'd', 'k': 28, 'dexp': 6.612509683187963, 'p_grd': 0.6345514247217746, 'unc_rem': 0.6341937400919501, 'unc_rel': 0.31329827524335363}. Best is trial 31 with value: 0.827.
    [CPU] Loading amazoncom...
    DEBUG 3.1: Dataset init start
    DEBUG 3.2: prepare_data start amazoncom
    ----Data statistics------'
    Name: amazoncom
    #Nodes 13752
    #Edges 245861
    #Classes 10
    #Ave_degree 35.76
    ----Split statistics------'
    #Train samples 200 (20 nodes per class)
    #Val samples 500 (specified)
    #Test samples 1000 (specified)
    ----label noise information:------
    Instance dependent noise
    #Actual noise rate 0.13
    [cuda:0] LNPCC waiting for GPU slot...
    [cuda:0] Slot acquired (waited 181.3s). Starting GCN...
    FINAL_RESULT: {'acc': {'train': 0.825, 'valid': 0.714, 'test': 0.825}, 'wall_s': 79.51, 'cpu_s': 74.68, 'gpu_s': 4.75, 'wait_s': 181.3}
    [Time] wall=79.5s | cpu=74.7s | gpu=4.8s
    C:\Users\fbrev\Documents\Acadêmico\Simulações\Python\NoisyGL\predictor\Base_Predictor.py:144: UserWarning: Sparse CSR tensor support is in beta state. If you miss a functionality in the sparse tensor support, please submit a feature request to https://github.com/pytorch/pytorch/issues. (Triggered internally at ..\aten\src\ATen\SparseCsrTensorImpl.cpp:55.)
    self.adj_csr = self.adj.to_sparse_csr().to(self.device)
[I 2026-04-30 10:32:39,519] Trial 32 finished with value: 0.825 and parameters: {'lr': 0.005, 'weight_decay': 0.001, 'n_hidden': 64, 'n_layer': 2, 'dropout': 0.6966722908351024, 'knn_mode': 'd', 'k': 25, 'dexp': 5.337106094138024, 'p_grd': 0.6906571920033445, 'unc_rem': 0.6322216447364575, 'unc_rel': 0.30471037448473515}. Best is trial 31 with value: 0.827.
    [CPU] Loading amazoncom...
    DEBUG 3.1: Dataset init start
    DEBUG 3.2: prepare_data start amazoncom
    ----Data statistics------'
    Name: amazoncom
    #Nodes 13752
    #Edges 245861
    #Classes 10
    #Ave_degree 35.76
    ----Split statistics------'
    #Train samples 200 (20 nodes per class)
    #Val samples 500 (specified)
    #Test samples 1000 (specified)
    ----label noise information:------
    Instance dependent noise
    #Actual noise rate 0.13
    [cuda:0] LNPCC waiting for GPU slot...
    [cuda:0] Slot acquired (waited 719.4s). Starting GCN...
    FINAL_RESULT: {'acc': {'train': 0.725, 'valid': 0.688, 'test': 0.786}, 'wall_s': 63.21, 'cpu_s': 58.24, 'gpu_s': 4.86, 'wait_s': 719.38}
    [Time] wall=63.2s | cpu=58.2s | gpu=4.9s
    C:\Users\fbrev\Documents\Acadêmico\Simulações\Python\NoisyGL\predictor\Base_Predictor.py:144: UserWarning: Sparse CSR tensor support is in beta state. If you miss a functionality in the sparse tensor support, please submit a feature request to https://github.com/pytorch/pytorch/issues. (Triggered internally at ..\aten\src\ATen\SparseCsrTensorImpl.cpp:55.)
    self.adj_csr = self.adj.to_sparse_csr().to(self.device)
[I 2026-04-30 10:45:50,110] Trial 33 finished with value: 0.786 and parameters: {'lr': 0.005, 'weight_decay': 0.05, 'n_hidden': 64, 'n_layer': 2, 'dropout': 0.7080183466763315, 'knn_mode': 'd', 'k': 25, 'dexp': 6.687903460006469, 'p_grd': 0.6879876430740849, 'unc_rem': 0.4781805155374484, 'unc_rel': 0.4219679240768183}. Best is trial 31 with value: 0.827.
    [CPU] Loading amazoncom...
    DEBUG 3.1: Dataset init start
    DEBUG 3.2: prepare_data start amazoncom
    ----Data statistics------'
    Name: amazoncom
    #Nodes 13752
    #Edges 245861
    #Classes 10
    #Ave_degree 35.76
    ----Split statistics------'
    #Train samples 200 (20 nodes per class)
    #Val samples 500 (specified)
    #Test samples 1000 (specified)
    ----label noise information:------
    Instance dependent noise
    #Actual noise rate 0.13
    [cuda:0] LNPCC waiting for GPU slot...
    [cuda:0] Slot acquired (waited 428.6s). Starting GCN...
    FINAL_RESULT: {'acc': {'train': 0.77, 'valid': 0.718, 'test': 0.825}, 'wall_s': 60.59, 'cpu_s': 55.63, 'gpu_s': 4.85, 'wait_s': 428.6}
    [Time] wall=60.6s | cpu=55.6s | gpu=4.9s
    C:\Users\fbrev\Documents\Acadêmico\Simulações\Python\NoisyGL\predictor\Base_Predictor.py:144: UserWarning: Sparse CSR tensor support is in beta state. If you miss a functionality in the sparse tensor support, please submit a feature request to https://github.com/pytorch/pytorch/issues. (Triggered internally at ..\aten\src\ATen\SparseCsrTensorImpl.cpp:55.)
    self.adj_csr = self.adj.to_sparse_csr().to(self.device)
[I 2026-04-30 10:54:07,651] Trial 34 finished with value: 0.825 and parameters: {'lr': 0.005, 'weight_decay': 0.001, 'n_hidden': 64, 'n_layer': 2, 'dropout': 0.794542187081604, 'knn_mode': 'd', 'k': 19, 'dexp': 7.589971214466748, 'p_grd': 0.7481929403948899, 'unc_rem': 0.8021606222259546, 'unc_rel': 0.31013752903262504}. Best is trial 31 with value: 0.827.
    [CPU] Loading amazoncom...
    DEBUG 3.1: Dataset init start
    DEBUG 3.2: prepare_data start amazoncom
    ----Data statistics------'
    Name: amazoncom
    #Nodes 13752
    #Edges 245861
    #Classes 10
    #Ave_degree 35.76
    ----Split statistics------'
    #Train samples 200 (20 nodes per class)
    #Val samples 500 (specified)
    #Test samples 1000 (specified)
    ----label noise information:------
    Instance dependent noise
    #Actual noise rate 0.13
    [cuda:0] LNPCC waiting for GPU slot...
    [cuda:0] Slot acquired (waited 985.0s). Starting GCN...
    FINAL_RESULT: {'acc': {'train': 0.825, 'valid': 0.724, 'test': 0.812}, 'wall_s': 79.32, 'cpu_s': 75.61, 'gpu_s': 3.59, 'wait_s': 985.03}
    [Time] wall=79.3s | cpu=75.6s | gpu=3.6s
    C:\Users\fbrev\Documents\Acadêmico\Simulações\Python\NoisyGL\predictor\Base_Predictor.py:144: UserWarning: Sparse CSR tensor support is in beta state. If you miss a functionality in the sparse tensor support, please submit a feature request to https://github.com/pytorch/pytorch/issues. (Triggered internally at ..\aten\src\ATen\SparseCsrTensorImpl.cpp:55.)
    self.adj_csr = self.adj.to_sparse_csr().to(self.device)
[I 2026-04-30 11:12:00,095] Trial 35 finished with value: 0.812 and parameters: {'lr': 0.005, 'weight_decay': 0.01, 'n_hidden': 64, 'n_layer': 2, 'dropout': 0.7870833842339466, 'knn_mode': 'd', 'k': 18, 'dexp': 6.406452528177152, 'p_grd': 0.7510675190986151, 'unc_rem': 0.8019072166659946, 'unc_rel': 0.31069876978179256}. Best is trial 31 with value: 0.827.
    [CPU] Loading amazoncom...
    DEBUG 3.1: Dataset init start
    DEBUG 3.2: prepare_data start amazoncom
    ----Data statistics------'
    Name: amazoncom
    #Nodes 13752
    #Edges 245861
    #Classes 10
    #Ave_degree 35.76
    ----Split statistics------'
    #Train samples 200 (20 nodes per class)
    #Val samples 500 (specified)
    #Test samples 1000 (specified)
    ----label noise information:------
    Instance dependent noise
    #Actual noise rate 0.13
    [cuda:0] LNPCC waiting for GPU slot...
    [cuda:0] Slot acquired (waited 104.8s). Starting GCN...
    FINAL_RESULT: {'acc': {'train': 0.77, 'valid': 0.712, 'test': 0.814}, 'wall_s': 47.61, 'cpu_s': 44.91, 'gpu_s': 2.61, 'wait_s': 104.76}
    [Time] wall=47.6s | cpu=44.9s | gpu=2.6s
    C:\Users\fbrev\Documents\Acadêmico\Simulações\Python\NoisyGL\predictor\Base_Predictor.py:144: UserWarning: Sparse CSR tensor support is in beta state. If you miss a functionality in the sparse tensor support, please submit a feature request to https://github.com/pytorch/pytorch/issues. (Triggered internally at ..\aten\src\ATen\SparseCsrTensorImpl.cpp:55.)
    self.adj_csr = self.adj.to_sparse_csr().to(self.device)
[I 2026-04-30 11:14:38,584] Trial 36 finished with value: 0.814 and parameters: {'lr': 0.005, 'weight_decay': 0.001, 'n_hidden': 32, 'n_layer': 2, 'dropout': 0.72827057828872, 'knn_mode': 'd', 'k': 13, 'dexp': 7.698049632156018, 'p_grd': 0.7721138425128696, 'unc_rem': 0.20613903989919619, 'unc_rel': 0.3171466570075839}. Best is trial 31 with value: 0.827.
    [CPU] Loading amazoncom...
    DEBUG 3.1: Dataset init start
    DEBUG 3.2: prepare_data start amazoncom
    ----Data statistics------'
    Name: amazoncom
    #Nodes 13752
    #Edges 245861
    #Classes 10
    #Ave_degree 35.76
    ----Split statistics------'
    #Train samples 200 (20 nodes per class)
    #Val samples 500 (specified)
    #Test samples 1000 (specified)
    ----label noise information:------
    Instance dependent noise
    #Actual noise rate 0.13
    [cuda:0] LNPCC waiting for GPU slot...
    [cuda:0] Slot acquired (waited 171.5s). Starting GCN...
    FINAL_RESULT: {'acc': {'train': 0.7614213197969543, 'valid': 0.702, 'test': 0.799}, 'wall_s': 38.32, 'cpu_s': 33.44, 'gpu_s': 4.81, 'wait_s': 171.54}
    [Time] wall=38.3s | cpu=33.4s | gpu=4.8s
    C:\Users\fbrev\Documents\Acadêmico\Simulações\Python\NoisyGL\predictor\Base_Predictor.py:144: UserWarning: Sparse CSR tensor support is in beta state. If you miss a functionality in the sparse tensor support, please submit a feature request to https://github.com/pytorch/pytorch/issues. (Triggered internally at ..\aten\src\ATen\SparseCsrTensorImpl.cpp:55.)
    self.adj_csr = self.adj.to_sparse_csr().to(self.device)
[I 2026-04-30 11:18:14,450] Trial 37 finished with value: 0.799 and parameters: {'lr': 0.005, 'weight_decay': 0.0, 'n_hidden': 128, 'n_layer': 2, 'dropout': 0.6654419215334088, 'knn_mode': 's', 'k': 18, 'dexp': 4.2274690161373725, 'p_grd': 0.6367446988150204, 'unc_rem': 0.6625815878557513, 'unc_rel': 0.3890365180079174}. Best is trial 31 with value: 0.827.
    [CPU] Loading amazoncom...
    DEBUG 3.1: Dataset init start
    DEBUG 3.2: prepare_data start amazoncom
    ----Data statistics------'
    Name: amazoncom
    #Nodes 13752
    #Edges 245861
    #Classes 10
    #Ave_degree 35.76
    ----Split statistics------'
    #Train samples 200 (20 nodes per class)
    #Val samples 500 (specified)
    #Test samples 1000 (specified)
    ----label noise information:------
    Instance dependent noise
    #Actual noise rate 0.13
    [cuda:0] LNPCC waiting for GPU slot...
    [cuda:0] Slot acquired (waited 77.8s). Starting GCN...
    FINAL_RESULT: {'acc': {'train': 0.775, 'valid': 0.72, 'test': 0.828}, 'wall_s': 70.86, 'cpu_s': 67.61, 'gpu_s': 3.19, 'wait_s': 77.81}
    [Time] wall=70.9s | cpu=67.6s | gpu=3.2s
    C:\Users\fbrev\Documents\Acadêmico\Simulações\Python\NoisyGL\predictor\Base_Predictor.py:144: UserWarning: Sparse CSR tensor support is in beta state. If you miss a functionality in the sparse tensor support, please submit a feature request to https://github.com/pytorch/pytorch/issues. (Triggered internally at ..\aten\src\ATen\SparseCsrTensorImpl.cpp:55.)
    self.adj_csr = self.adj.to_sparse_csr().to(self.device)
[I 2026-04-30 11:20:48,494] Trial 38 finished with value: 0.828 and parameters: {'lr': 0.005, 'weight_decay': 0.001, 'n_hidden': 64, 'n_layer': 2, 'dropout': 0.7451878943928956, 'knn_mode': 'd', 'k': 25, 'dexp': 5.4196658026084545, 'p_grd': 0.9497637809369044, 'unc_rem': 0.9614352272844416, 'unc_rel': 0.2846795129372057}. Best is trial 38 with value: 0.828.
    [CPU] Loading amazoncom...
    DEBUG 3.1: Dataset init start
    DEBUG 3.2: prepare_data start amazoncom
    ----Data statistics------'
    Name: amazoncom
    #Nodes 13752
    #Edges 245861
    #Classes 10
    #Ave_degree 35.76
    ----Split statistics------'
    #Train samples 200 (20 nodes per class)
    #Val samples 500 (specified)
    #Test samples 1000 (specified)
    ----label noise information:------
    Instance dependent noise
    #Actual noise rate 0.13
    [cuda:0] LNPCC waiting for GPU slot...
    [cuda:0] Slot acquired (waited 697.7s). Starting GCN...
    FINAL_RESULT: {'acc': {'train': 0.4517766497461929, 'valid': 0.554, 'test': 0.648}, 'wall_s': 57.92, 'cpu_s': 54.91, 'gpu_s': 2.94, 'wait_s': 697.7}
    [Time] wall=57.9s | cpu=54.9s | gpu=2.9s
    C:\Users\fbrev\Documents\Acadêmico\Simulações\Python\NoisyGL\predictor\Base_Predictor.py:144: UserWarning: Sparse CSR tensor support is in beta state. If you miss a functionality in the sparse tensor support, please submit a feature request to https://github.com/pytorch/pytorch/issues. (Triggered internally at ..\aten\src\ATen\SparseCsrTensorImpl.cpp:55.)
    self.adj_csr = self.adj.to_sparse_csr().to(self.device)
[I 2026-04-30 11:33:29,300] Trial 39 finished with value: 0.648 and parameters: {'lr': 0.05, 'weight_decay': 0.05, 'n_hidden': 64, 'n_layer': 2, 'dropout': 0.6781064549686726, 'knn_mode': 's', 'k': 26, 'dexp': 1.2160652684997086, 'p_grd': 0.9750020633974323, 'unc_rem': 0.9667014904304154, 'unc_rel': 0.17555258456683343}. Best is trial 38 with value: 0.828.
    [CPU] Loading amazoncom...
    DEBUG 3.1: Dataset init start
    DEBUG 3.2: prepare_data start amazoncom
    ----Data statistics------'
    Name: amazoncom
    #Nodes 13752
    #Edges 245861
    #Classes 10
    #Ave_degree 35.76
    ----Split statistics------'
    #Train samples 200 (20 nodes per class)
    #Val samples 500 (specified)
    #Test samples 1000 (specified)
    ----label noise information:------
    Instance dependent noise
    #Actual noise rate 0.13
    [cuda:0] LNPCC waiting for GPU slot...
    [cuda:0] Slot acquired (waited 141.0s). Starting GCN...
    FINAL_RESULT: {'acc': {'train': 0.7772020725388601, 'valid': 0.714, 'test': 0.802}, 'wall_s': 60.99, 'cpu_s': 58.55, 'gpu_s': 2.38, 'wait_s': 141.01}
    [Time] wall=61.0s | cpu=58.5s | gpu=2.4s
    C:\Users\fbrev\Documents\Acadêmico\Simulações\Python\NoisyGL\predictor\Base_Predictor.py:144: UserWarning: Sparse CSR tensor support is in beta state. If you miss a functionality in the sparse tensor support, please submit a feature request to https://github.com/pytorch/pytorch/issues. (Triggered internally at ..\aten\src\ATen\SparseCsrTensorImpl.cpp:55.)
    self.adj_csr = self.adj.to_sparse_csr().to(self.device)
[I 2026-04-30 11:36:56,319] Trial 40 finished with value: 0.802 and parameters: {'lr': 0.005, 'weight_decay': 0.0001, 'n_hidden': 32, 'n_layer': 2, 'dropout': 0.7453981128730448, 'knn_mode': 'd', 'k': 15, 'dexp': 5.412275568548519, 'p_grd': 0.9225600960441973, 'unc_rem': 0.022841820086480724, 'unc_rel': 0.26957803388178136}. Best is trial 38 with value: 0.828.
    [CPU] Loading amazoncom...
    DEBUG 3.1: Dataset init start
    DEBUG 3.2: prepare_data start amazoncom
    ----Data statistics------'
    Name: amazoncom
    #Nodes 13752
    #Edges 245861
    #Classes 10
    #Ave_degree 35.76
    ----Split statistics------'
    #Train samples 200 (20 nodes per class)
    #Val samples 500 (specified)
    #Test samples 1000 (specified)
    ----label noise information:------
    Instance dependent noise
    #Actual noise rate 0.13
    [cuda:0] LNPCC waiting for GPU slot...
    [cuda:0] Slot acquired (waited 107.0s). Starting GCN...
    FINAL_RESULT: {'acc': {'train': 0.81, 'valid': 0.732, 'test': 0.825}, 'wall_s': 47.71, 'cpu_s': 44.59, 'gpu_s': 3.06, 'wait_s': 106.97}
    [Time] wall=47.7s | cpu=44.6s | gpu=3.1s
    C:\Users\fbrev\Documents\Acadêmico\Simulações\Python\NoisyGL\predictor\Base_Predictor.py:144: UserWarning: Sparse CSR tensor support is in beta state. If you miss a functionality in the sparse tensor support, please submit a feature request to https://github.com/pytorch/pytorch/issues. (Triggered internally at ..\aten\src\ATen\SparseCsrTensorImpl.cpp:55.)
    self.adj_csr = self.adj.to_sparse_csr().to(self.device)
