[I 2026-05-03 02:45:32,462] Trial 43 finished with value: 0.5233459825111367 and parameters: {'lr': 0.01, 'weight_decay': 0.0001, 'n_hidden': 32, 'n_layer': 2, 'dropout': 0.4835193301129497, 'knn_mode': 'd', 'k': 38, 'dexp': 5.274132874548064, 'p_grd': 0.2813733428095204, 'unc_rem': 0.477775168044809, 'unc_rel': 0.09964532872329808}. Best is trial 30 with value: 0.5302755320904141.
    [CPU] Loading flickr...
    DEBUG 3.1: Dataset init start
    DEBUG 3.2: prepare_data start flickr
    ----Data statistics------'
    Name: flickr
    #Nodes 7575
    #Edges 239738
    #Classes 9
    #Ave_degree 63.30
    ----Split statistics------'
    #Train samples 378 (5.0 % of nodes)
    #Val samples 1136 (15.0 % of nodes)
    #Test samples 6061 (remaining)
    ----label noise information:------
    Instance dependent noise
    #Actual noise rate 0.30
    [cuda:1] LNPCC waiting for GPU slot...
    [cuda:1] Slot acquired (waited 0.0s). Starting GCN...
    FINAL_RESULT: {'acc': {'train': 0.6349206349206349, 'valid': 0.3653169014084507, 'test': 0.5084969476983996}, 'wall_s': 129.12, 'cpu_s': 124.82, 'gpu_s': 4.04, 'wait_s': 0.0}
    [Time] wall=129.1s | cpu=124.8s | gpu=4.0s
    C:\Users\fbrev\anaconda3\envs\noisygl\Lib\site-packages\torch\_utils.py:315: UserWarning: Sparse CSR tensor support is in beta state. If you miss a functionality in the sparse tensor support, please submit a feature request to https://github.com/pytorch/pytorch/issues. (Triggered internally at ..\aten\src\ATen\SparseCsrTensorImpl.cpp:55.)
    result = torch.sparse_compressed_tensor(
    C:\Users\fbrev\Documents\Acadêmico\Simulações\Python\NoisyGL\predictor\Base_Predictor.py:114: UserWarning: expandable_segments not supported on this platform (Triggered internally at ..\c10/cuda/CUDAAllocatorConfig.h:28.)
    self.edge_index = self._cpu_edge_index.to(self.device)
[I 2026-05-03 02:47:47,396] Trial 44 finished with value: 0.5084969476983996 and parameters: {'lr': 0.005, 'weight_decay': 0.0001, 'n_hidden': 32, 'n_layer': 2, 'dropout': 0.5816620799866983, 'knn_mode': 'd', 'k': 34, 'dexp': 3.3922944210175126, 'p_grd': 0.3708305536902715, 'unc_rem': 0.33713017665723455, 'unc_rel': 0.031376051084461926}. Best is trial 30 with value: 0.5302755320904141.
    [CPU] Loading flickr...
    DEBUG 3.1: Dataset init start
    DEBUG 3.2: prepare_data start flickr
    ----Data statistics------'
    Name: flickr
    #Nodes 7575
    #Edges 239738
    #Classes 9
    #Ave_degree 63.30
    ----Split statistics------'
    #Train samples 378 (5.0 % of nodes)
    #Val samples 1136 (15.0 % of nodes)
    #Test samples 6061 (remaining)
    ----label noise information:------
    Instance dependent noise
    #Actual noise rate 0.30
    [cuda:1] LNPCC waiting for GPU slot...
    [cuda:1] Slot acquired (waited 6.8s). Starting GCN...
    FINAL_RESULT: {'acc': {'train': 0.1246684350132626, 'valid': 0.1443661971830986, 'test': 0.15195512291701038}, 'wall_s': 94.63, 'cpu_s': 87.78, 'gpu_s': 6.57, 'wait_s': 6.8}
    [Time] wall=94.6s | cpu=87.8s | gpu=6.6s
    C:\Users\fbrev\anaconda3\envs\noisygl\Lib\site-packages\torch\_utils.py:315: UserWarning: Sparse CSR tensor support is in beta state. If you miss a functionality in the sparse tensor support, please submit a feature request to https://github.com/pytorch/pytorch/issues. (Triggered internally at ..\aten\src\ATen\SparseCsrTensorImpl.cpp:55.)
    result = torch.sparse_compressed_tensor(
    C:\Users\fbrev\Documents\Acadêmico\Simulações\Python\NoisyGL\predictor\Base_Predictor.py:114: UserWarning: expandable_segments not supported on this platform (Triggered internally at ..\c10/cuda/CUDAAllocatorConfig.h:28.)
    self.edge_index = self._cpu_edge_index.to(self.device)
[I 2026-05-03 02:49:34,884] Trial 45 finished with value: 0.15195512291701038 and parameters: {'lr': 0.01, 'weight_decay': 0.05, 'n_hidden': 128, 'n_layer': 2, 'dropout': 0.5151852774899572, 'knn_mode': 'd', 'k': 41, 'dexp': 6.60244669548384, 'p_grd': 0.17129168949162094, 'unc_rem': 0.43065557503944885, 'unc_rel': 0.10569569360354215}. Best is trial 30 with value: 0.5302755320904141.
    [CPU] Loading flickr...
    DEBUG 3.1: Dataset init start
    DEBUG 3.2: prepare_data start flickr
    ----Data statistics------'
    Name: flickr
    #Nodes 7575
    #Edges 239738
    #Classes 9
    #Ave_degree 63.30
    ----Split statistics------'
    #Train samples 378 (5.0 % of nodes)
    #Val samples 1136 (15.0 % of nodes)
    #Test samples 6061 (remaining)
    ----label noise information:------
    Instance dependent noise
    #Actual noise rate 0.30
    [cuda:1] LNPCC waiting for GPU slot...
    [cuda:1] Slot acquired (waited 3.4s). Starting GCN...
    FINAL_RESULT: {'acc': {'train': 0.7027972027972028, 'valid': 0.23151408450704225, 'test': 0.29219600725952816}, 'wall_s': 50.39, 'cpu_s': 46.13, 'gpu_s': 3.91, 'wait_s': 3.4}
    [Time] wall=50.4s | cpu=46.1s | gpu=3.9s
    C:\Users\fbrev\anaconda3\envs\noisygl\Lib\site-packages\torch\_utils.py:315: UserWarning: Sparse CSR tensor support is in beta state. If you miss a functionality in the sparse tensor support, please submit a feature request to https://github.com/pytorch/pytorch/issues. (Triggered internally at ..\aten\src\ATen\SparseCsrTensorImpl.cpp:55.)
    result = torch.sparse_compressed_tensor(
    C:\Users\fbrev\Documents\Acadêmico\Simulações\Python\NoisyGL\predictor\Base_Predictor.py:114: UserWarning: expandable_segments not supported on this platform (Triggered internally at ..\c10/cuda/CUDAAllocatorConfig.h:28.)
    self.edge_index = self._cpu_edge_index.to(self.device)
[I 2026-05-03 02:50:34,821] Trial 46 finished with value: 0.29219600725952816 and parameters: {'lr': 0.1, 'weight_decay': 0.0001, 'n_hidden': 32, 'n_layer': 2, 'dropout': 0.6715960434057187, 'knn_mode': 'd', 'k': 43, 'dexp': 0.8764350335499599, 'p_grd': 0.054201390772192215, 'unc_rem': 0.6165543862639316, 'unc_rel': 0.2878112390575366}. Best is trial 30 with value: 0.5302755320904141.
    [CPU] Loading flickr...
    DEBUG 3.1: Dataset init start
    DEBUG 3.2: prepare_data start flickr
    ----Data statistics------'
    Name: flickr
    #Nodes 7575
    #Edges 239738
    #Classes 9
    #Ave_degree 63.30
    ----Split statistics------'
    #Train samples 378 (5.0 % of nodes)
    #Val samples 1136 (15.0 % of nodes)
    #Test samples 6061 (remaining)
    ----label noise information:------
    Instance dependent noise
    #Actual noise rate 0.30
    [cuda:1] LNPCC waiting for GPU slot...
    [cuda:1] Slot acquired (waited 0.0s). Starting GCN...
    FINAL_RESULT: {'acc': {'train': 0.6402116402116402, 'valid': 0.3670774647887324, 'test': 0.4979376340537865}, 'wall_s': 102.54, 'cpu_s': 98.32, 'gpu_s': 3.94, 'wait_s': 0.0}
    [Time] wall=102.5s | cpu=98.3s | gpu=3.9s
    C:\Users\fbrev\anaconda3\envs\noisygl\Lib\site-packages\torch\_utils.py:315: UserWarning: Sparse CSR tensor support is in beta state. If you miss a functionality in the sparse tensor support, please submit a feature request to https://github.com/pytorch/pytorch/issues. (Triggered internally at ..\aten\src\ATen\SparseCsrTensorImpl.cpp:55.)
    result = torch.sparse_compressed_tensor(
    C:\Users\fbrev\Documents\Acadêmico\Simulações\Python\NoisyGL\predictor\Base_Predictor.py:114: UserWarning: expandable_segments not supported on this platform (Triggered internally at ..\c10/cuda/CUDAAllocatorConfig.h:28.)
    self.edge_index = self._cpu_edge_index.to(self.device)
[I 2026-05-03 02:52:23,269] Trial 47 finished with value: 0.4979376340537865 and parameters: {'lr': 0.01, 'weight_decay': 0.0, 'n_hidden': 32, 'n_layer': 2, 'dropout': 0.35041774836527495, 'knn_mode': 'd', 'k': 37, 'dexp': 4.055370159281646, 'p_grd': 0.2812800161549403, 'unc_rem': 0.2573002004916225, 'unc_rel': 0.0803221120268574}. Best is trial 30 with value: 0.5302755320904141.
    [CPU] Loading flickr...
    DEBUG 3.1: Dataset init start
    DEBUG 3.2: prepare_data start flickr
    ----Data statistics------'
    Name: flickr
    #Nodes 7575
    #Edges 239738
    #Classes 9
    #Ave_degree 63.30
    ----Split statistics------'
    #Train samples 378 (5.0 % of nodes)
    #Val samples 1136 (15.0 % of nodes)
    #Test samples 6061 (remaining)
    ----label noise information:------
    Instance dependent noise
    #Actual noise rate 0.30
    [cuda:1] LNPCC waiting for GPU slot...
    [cuda:1] Slot acquired (waited 0.0s). Starting GCN...
    FINAL_RESULT: {'acc': {'train': 0.14627659574468085, 'valid': 0.1522887323943662, 'test': 0.16284441511301764}, 'wall_s': 134.78, 'cpu_s': 129.73, 'gpu_s': 4.82, 'wait_s': 0.0}
    [Time] wall=134.8s | cpu=129.7s | gpu=4.8s
    C:\Users\fbrev\anaconda3\envs\noisygl\Lib\site-packages\torch\_utils.py:315: UserWarning: Sparse CSR tensor support is in beta state. If you miss a functionality in the sparse tensor support, please submit a feature request to https://github.com/pytorch/pytorch/issues. (Triggered internally at ..\aten\src\ATen\SparseCsrTensorImpl.cpp:55.)
    result = torch.sparse_compressed_tensor(
    C:\Users\fbrev\Documents\Acadêmico\Simulações\Python\NoisyGL\predictor\Base_Predictor.py:114: UserWarning: expandable_segments not supported on this platform (Triggered internally at ..\c10/cuda/CUDAAllocatorConfig.h:28.)
    self.edge_index = self._cpu_edge_index.to(self.device)
[I 2026-05-03 02:54:43,802] Trial 48 finished with value: 0.16284441511301764 and parameters: {'lr': 0.01, 'weight_decay': 0.01, 'n_hidden': 64, 'n_layer': 2, 'dropout': 0.5113055836095902, 'knn_mode': 'd', 'k': 29, 'dexp': 1.8823320575586502, 'p_grd': 0.4793204410150765, 'unc_rem': 0.5411160744036083, 'unc_rel': 0.005303578484869821}. Best is trial 30 with value: 0.5302755320904141.
    [CPU] Loading flickr...
    DEBUG 3.1: Dataset init start
    DEBUG 3.2: prepare_data start flickr
    ----Data statistics------'
    Name: flickr
    #Nodes 7575
    #Edges 239738
    #Classes 9
    #Ave_degree 63.30
    ----Split statistics------'
    #Train samples 378 (5.0 % of nodes)
    #Val samples 1136 (15.0 % of nodes)
    #Test samples 6061 (remaining)
    ----label noise information:------
    Instance dependent noise
    #Actual noise rate 0.30
    [cuda:1] LNPCC waiting for GPU slot...
    [cuda:1] Slot acquired (waited 67.8s). Starting GCN...
    FINAL_RESULT: {'acc': {'train': 0.8518518518518519, 'valid': 0.35651408450704225, 'test': 0.5185612935159215}, 'wall_s': 132.63, 'cpu_s': 121.19, 'gpu_s': 11.15, 'wait_s': 67.83}
    [Time] wall=132.6s | cpu=121.2s | gpu=11.2s
    C:\Users\fbrev\anaconda3\envs\noisygl\Lib\site-packages\torch\_utils.py:315: UserWarning: Sparse CSR tensor support is in beta state. If you miss a functionality in the sparse tensor support, please submit a feature request to https://github.com/pytorch/pytorch/issues. (Triggered internally at ..\aten\src\ATen\SparseCsrTensorImpl.cpp:55.)
    result = torch.sparse_compressed_tensor(
    C:\Users\fbrev\Documents\Acadêmico\Simulações\Python\NoisyGL\predictor\Base_Predictor.py:114: UserWarning: expandable_segments not supported on this platform (Triggered internally at ..\c10/cuda/CUDAAllocatorConfig.h:28.)
    self.edge_index = self._cpu_edge_index.to(self.device)
