[I 2026-05-07 22:19:45,502] Trial 35 finished with value: 0.425 and parameters: {'lr': 0.005, 'weight_decay': 0.05, 'n_hidden': 128, 'n_layer': 3, 'dropout': 0.471515348096257, 'knn_mode': 'd', 'k': 40, 'dexp': 7.413128740054013, 'p_grd': 0.5242194660456975, 'unc_rem': 0.660520760802981, 'unc_rel': 0.7046982692605144}. Best is trial 9 with value: 0.503.
    [CPU] Loading citeseer...
    DEBUG 3.1: Dataset init start
    DEBUG 3.2: prepare_data start citeseer
    ----Data statistics------'
    Name: citeseer
    #Nodes 3327
    #Edges 4552
    #Classes 6
    #Ave_degree 2.74
    ----Split statistics------'
    #Train samples 120 (default)
    #Val samples 500 (default)
    #Test samples 1000 (default)
    ----label noise information:------
    Instance dependent noise
    #Actual noise rate 0.41
    [cuda:0] LNPCC waiting for GPU slot...
    [cuda:0] Slot acquired (waited 930.9s). Starting GCN...
    FINAL_RESULT: {'acc': {'train': 0.9333333333333333, 'valid': 0.354, 'test': 0.428}, 'wall_s': 14.0, 'cpu_s': 12.01, 'gpu_s': 1.96, 'wait_s': 930.94}
    [Time] wall=14.0s | cpu=12.0s | gpu=2.0s
    C:\Users\fbrev\Documents\Acadêmico\Simulações\Python\NoisyGL\predictor\Base_Predictor.py:114: UserWarning: expandable_segments not supported on this platform (Triggered internally at ..\c10/cuda/CUDAAllocatorConfig.h:28.)
    self.edge_index = self._cpu_edge_index.to(self.device)
    C:\Users\fbrev\Documents\Acadêmico\Simulações\Python\NoisyGL\predictor\Base_Predictor.py:144: UserWarning: Sparse CSR tensor support is in beta state. If you miss a functionality in the sparse tensor support, please submit a feature request to https://github.com/pytorch/pytorch/issues. (Triggered internally at ..\aten\src\ATen\SparseCsrTensorImpl.cpp:55.)
    self.adj_csr = self.adj.to_sparse_csr().to(self.device)
[I 2026-05-07 22:35:35,917] Trial 36 finished with value: 0.428 and parameters: {'lr': 0.005, 'weight_decay': 0.05, 'n_hidden': 128, 'n_layer': 3, 'dropout': 0.398137551108841, 'knn_mode': 'd', 'k': 45, 'dexp': 6.709254359510985, 'p_grd': 0.4307098318174307, 'unc_rem': 0.49818243976902105, 'unc_rel': 0.8446324305562554}. Best is trial 9 with value: 0.503.
    [CPU] Loading citeseer...
    DEBUG 3.1: Dataset init start
    DEBUG 3.2: prepare_data start citeseer
    ----Data statistics------'
    Name: citeseer
    #Nodes 3327
    #Edges 4552
    #Classes 6
    #Ave_degree 2.74
    ----Split statistics------'
    #Train samples 120 (default)
    #Val samples 500 (default)
    #Test samples 1000 (default)
    ----label noise information:------
    Instance dependent noise
    #Actual noise rate 0.41
    [cuda:0] LNPCC waiting for GPU slot...
    [cuda:0] Slot acquired (waited 20.5s). Starting GCN...
    FINAL_RESULT: {'acc': {'train': 0.9583333333333334, 'valid': 0.342, 'test': 0.464}, 'wall_s': 8.67, 'cpu_s': 6.97, 'gpu_s': 1.67, 'wait_s': 20.5}
    [Time] wall=8.7s | cpu=7.0s | gpu=1.7s
    C:\Users\fbrev\Documents\Acadêmico\Simulações\Python\NoisyGL\predictor\Base_Predictor.py:114: UserWarning: expandable_segments not supported on this platform (Triggered internally at ..\c10/cuda/CUDAAllocatorConfig.h:28.)
    self.edge_index = self._cpu_edge_index.to(self.device)
    C:\Users\fbrev\Documents\Acadêmico\Simulações\Python\NoisyGL\predictor\Base_Predictor.py:144: UserWarning: Sparse CSR tensor support is in beta state. If you miss a functionality in the sparse tensor support, please submit a feature request to https://github.com/pytorch/pytorch/issues. (Triggered internally at ..\aten\src\ATen\SparseCsrTensorImpl.cpp:55.)
    self.adj_csr = self.adj.to_sparse_csr().to(self.device)
[I 2026-05-07 22:36:10,246] Trial 37 finished with value: 0.464 and parameters: {'lr': 0.005, 'weight_decay': 0.01, 'n_hidden': 128, 'n_layer': 2, 'dropout': 0.5222898244964032, 'knn_mode': 's', 'k': 18, 'dexp': 4.2274690161373725, 'p_grd': 0.6744647035344566, 'unc_rem': 0.6059185566488294, 'unc_rel': 0.7506876929226634}. Best is trial 9 with value: 0.503.
    [CPU] Loading citeseer...
    DEBUG 3.1: Dataset init start
    DEBUG 3.2: prepare_data start citeseer
    ----Data statistics------'
    Name: citeseer
    #Nodes 3327
    #Edges 4552
    #Classes 6
    #Ave_degree 2.74
    ----Split statistics------'
    #Train samples 120 (default)
    #Val samples 500 (default)
    #Test samples 1000 (default)
    ----label noise information:------
    Instance dependent noise
    #Actual noise rate 0.41
    [cuda:0] LNPCC waiting for GPU slot...
    [cuda:0] Slot acquired (waited 152.7s). Starting GCN...
    FINAL_RESULT: {'acc': {'train': 0.725, 'valid': 0.266, 'test': 0.271}, 'wall_s': 14.11, 'cpu_s': 12.26, 'gpu_s': 1.83, 'wait_s': 152.68}
    [Time] wall=14.1s | cpu=12.3s | gpu=1.8s
    C:\Users\fbrev\Documents\Acadêmico\Simulações\Python\NoisyGL\predictor\Base_Predictor.py:114: UserWarning: expandable_segments not supported on this platform (Triggered internally at ..\c10/cuda/CUDAAllocatorConfig.h:28.)
    self.edge_index = self._cpu_edge_index.to(self.device)
    C:\Users\fbrev\Documents\Acadêmico\Simulações\Python\NoisyGL\predictor\Base_Predictor.py:144: UserWarning: Sparse CSR tensor support is in beta state. If you miss a functionality in the sparse tensor support, please submit a feature request to https://github.com/pytorch/pytorch/issues. (Triggered internally at ..\aten\src\ATen\SparseCsrTensorImpl.cpp:55.)
    self.adj_csr = self.adj.to_sparse_csr().to(self.device)
[I 2026-05-07 22:39:01,931] Trial 38 finished with value: 0.271 and parameters: {'lr': 0.1, 'weight_decay': 0.0, 'n_hidden': 128, 'n_layer': 3, 'dropout': 0.7471130198513478, 'knn_mode': 'd', 'k': 34, 'dexp': 7.813141154252294, 'p_grd': 0.3399630978510553, 'unc_rem': 0.6391196244179044, 'unc_rel': 0.9029194956207278}. Best is trial 9 with value: 0.503.
    [CPU] Loading citeseer...
    DEBUG 3.1: Dataset init start
    DEBUG 3.2: prepare_data start citeseer
    ----Data statistics------'
    Name: citeseer
    #Nodes 3327
    #Edges 4552
    #Classes 6
    #Ave_degree 2.74
    ----Split statistics------'
    #Train samples 120 (default)
    #Val samples 500 (default)
    #Test samples 1000 (default)
    ----label noise information:------
    Instance dependent noise
    #Actual noise rate 0.41
    [cuda:0] LNPCC waiting for GPU slot...
    [cuda:0] Slot acquired (waited 412.0s). Starting GCN...
    FINAL_RESULT: {'acc': {'train': 0.9416666666666667, 'valid': 0.372, 'test': 0.478}, 'wall_s': 7.87, 'cpu_s': 6.31, 'gpu_s': 1.53, 'wait_s': 412.0}
    [Time] wall=7.9s | cpu=6.3s | gpu=1.5s
    C:\Users\fbrev\Documents\Acadêmico\Simulações\Python\NoisyGL\predictor\Base_Predictor.py:114: UserWarning: expandable_segments not supported on this platform (Triggered internally at ..\c10/cuda/CUDAAllocatorConfig.h:28.)
    self.edge_index = self._cpu_edge_index.to(self.device)
    C:\Users\fbrev\Documents\Acadêmico\Simulações\Python\NoisyGL\predictor\Base_Predictor.py:144: UserWarning: Sparse CSR tensor support is in beta state. If you miss a functionality in the sparse tensor support, please submit a feature request to https://github.com/pytorch/pytorch/issues. (Triggered internally at ..\aten\src\ATen\SparseCsrTensorImpl.cpp:55.)
    self.adj_csr = self.adj.to_sparse_csr().to(self.device)
[I 2026-05-07 22:46:06,617] Trial 39 finished with value: 0.478 and parameters: {'lr': 0.005, 'weight_decay': 0.05, 'n_hidden': 128, 'n_layer': 2, 'dropout': 0.6500247292825518, 'knn_mode': 's', 'k': 29, 'dexp': 1.2160652684997086, 'p_grd': 0.45654967244350697, 'unc_rem': 0.4330364810865258, 'unc_rel': 0.7024533048707577}. Best is trial 9 with value: 0.503.
    [CPU] Loading citeseer...
    DEBUG 3.1: Dataset init start
    DEBUG 3.2: prepare_data start citeseer
    ----Data statistics------'
    Name: citeseer
    #Nodes 3327
    #Edges 4552
    #Classes 6
    #Ave_degree 2.74
    ----Split statistics------'
    #Train samples 120 (default)
    #Val samples 500 (default)
    #Test samples 1000 (default)
    ----label noise information:------
    Instance dependent noise
    #Actual noise rate 0.41
    [cuda:0] LNPCC waiting for GPU slot...
    [cuda:0] Slot acquired (waited 169.6s). Starting GCN...
    FINAL_RESULT: {'acc': {'train': 0.9416666666666667, 'valid': 0.344, 'test': 0.427}, 'wall_s': 12.46, 'cpu_s': 10.12, 'gpu_s': 2.32, 'wait_s': 169.59}
    [Time] wall=12.5s | cpu=10.1s | gpu=2.3s
    C:\Users\fbrev\Documents\Acadêmico\Simulações\Python\NoisyGL\predictor\Base_Predictor.py:114: UserWarning: expandable_segments not supported on this platform (Triggered internally at ..\c10/cuda/CUDAAllocatorConfig.h:28.)
    self.edge_index = self._cpu_edge_index.to(self.device)
    C:\Users\fbrev\Documents\Acadêmico\Simulações\Python\NoisyGL\predictor\Base_Predictor.py:144: UserWarning: Sparse CSR tensor support is in beta state. If you miss a functionality in the sparse tensor support, please submit a feature request to https://github.com/pytorch/pytorch/issues. (Triggered internally at ..\aten\src\ATen\SparseCsrTensorImpl.cpp:55.)
    self.adj_csr = self.adj.to_sparse_csr().to(self.device)
[I 2026-05-07 22:49:13,589] Trial 40 finished with value: 0.427 and parameters: {'lr': 0.005, 'weight_decay': 0.05, 'n_hidden': 128, 'n_layer': 3, 'dropout': 0.4677474729035973, 'knn_mode': 'd', 'k': 46, 'dexp': 8.477369042577934, 'p_grd': 0.5256181136039224, 'unc_rem': 0.5305004349885197, 'unc_rel': 0.793356490849626}. Best is trial 9 with value: 0.503.
    [CPU] Loading citeseer...
    DEBUG 3.1: Dataset init start
    DEBUG 3.2: prepare_data start citeseer
    ----Data statistics------'
    Name: citeseer
    #Nodes 3327
    #Edges 4552
    #Classes 6
    #Ave_degree 2.74
    ----Split statistics------'
    #Train samples 120 (default)
    #Val samples 500 (default)
    #Test samples 1000 (default)
    ----label noise information:------
    Instance dependent noise
    #Actual noise rate 0.41
    [cuda:0] LNPCC waiting for GPU slot...
    [cuda:0] Slot acquired (waited 170.6s). Starting GCN...
    FINAL_RESULT: {'acc': {'train': 0.925, 'valid': 0.378, 'test': 0.501}, 'wall_s': 21.35, 'cpu_s': 18.83, 'gpu_s': 2.49, 'wait_s': 170.62}
    [Time] wall=21.3s | cpu=18.8s | gpu=2.5s
    C:\Users\fbrev\Documents\Acadêmico\Simulações\Python\NoisyGL\predictor\Base_Predictor.py:114: UserWarning: expandable_segments not supported on this platform (Triggered internally at ..\c10/cuda/CUDAAllocatorConfig.h:28.)
    self.edge_index = self._cpu_edge_index.to(self.device)
    C:\Users\fbrev\Documents\Acadêmico\Simulações\Python\NoisyGL\predictor\Base_Predictor.py:144: UserWarning: Sparse CSR tensor support is in beta state. If you miss a functionality in the sparse tensor support, please submit a feature request to https://github.com/pytorch/pytorch/issues. (Triggered internally at ..\aten\src\ATen\SparseCsrTensorImpl.cpp:55.)
    self.adj_csr = self.adj.to_sparse_csr().to(self.device)
[I 2026-05-07 22:52:31,049] Trial 41 finished with value: 0.501 and parameters: {'lr': 0.005, 'weight_decay': 0.05, 'n_hidden': 128, 'n_layer': 2, 'dropout': 0.5483181495941696, 'knn_mode': 'd', 'k': 39, 'dexp': 5.20653605529639, 'p_grd': 0.5767196952763279, 'unc_rem': 0.5626426962821895, 'unc_rel': 0.5773418430835967}. Best is trial 9 with value: 0.503.
    [CPU] Loading citeseer...
    DEBUG 3.1: Dataset init start
    DEBUG 3.2: prepare_data start citeseer
    ----Data statistics------'
    Name: citeseer
    #Nodes 3327
    #Edges 4552
    #Classes 6
    #Ave_degree 2.74
    ----Split statistics------'
    #Train samples 120 (default)
    #Val samples 500 (default)
    #Test samples 1000 (default)
    ----label noise information:------
    Instance dependent noise
    #Actual noise rate 0.41
    [cuda:0] LNPCC waiting for GPU slot...
    [cuda:0] Slot acquired (waited 214.0s). Starting GCN...
    FINAL_RESULT: {'acc': {'train': 0.9166666666666666, 'valid': 0.378, 'test': 0.5}, 'wall_s': 29.4, 'cpu_s': 27.81, 'gpu_s': 1.55, 'wait_s': 213.99}
    [Time] wall=29.4s | cpu=27.8s | gpu=1.6s
    C:\Users\fbrev\Documents\Acadêmico\Simulações\Python\NoisyGL\predictor\Base_Predictor.py:114: UserWarning: expandable_segments not supported on this platform (Triggered internally at ..\c10/cuda/CUDAAllocatorConfig.h:28.)
    self.edge_index = self._cpu_edge_index.to(self.device)
    C:\Users\fbrev\Documents\Acadêmico\Simulações\Python\NoisyGL\predictor\Base_Predictor.py:144: UserWarning: Sparse CSR tensor support is in beta state. If you miss a functionality in the sparse tensor support, please submit a feature request to https://github.com/pytorch/pytorch/issues. (Triggered internally at ..\aten\src\ATen\SparseCsrTensorImpl.cpp:55.)
    self.adj_csr = self.adj.to_sparse_csr().to(self.device)
[I 2026-05-07 22:56:41,792] Trial 42 finished with value: 0.5 and parameters: {'lr': 0.005, 'weight_decay': 0.05, 'n_hidden': 128, 'n_layer': 2, 'dropout': 0.537082302261809, 'knn_mode': 'd', 'k': 40, 'dexp': 4.440456313214195, 'p_grd': 0.6208618476625484, 'unc_rem': 0.3413501646078164, 'unc_rel': 0.6679175613260445}. Best is trial 9 with value: 0.503.
    [CPU] Loading citeseer...
    DEBUG 3.1: Dataset init start
    DEBUG 3.2: prepare_data start citeseer
    ----Data statistics------'
    Name: citeseer
    #Nodes 3327
    #Edges 4552
    #Classes 6
    #Ave_degree 2.74
    ----Split statistics------'
    #Train samples 120 (default)
    #Val samples 500 (default)
    #Test samples 1000 (default)
    ----label noise information:------
    Instance dependent noise
    #Actual noise rate 0.41
    [cuda:0] LNPCC waiting for GPU slot...
    [cuda:0] Slot acquired (waited 0.1s). Starting GCN...
    FINAL_RESULT: {'acc': {'train': 0.9333333333333333, 'valid': 0.378, 'test': 0.488}, 'wall_s': 22.67, 'cpu_s': 20.8, 'gpu_s': 1.84, 'wait_s': 0.1}
    [Time] wall=22.7s | cpu=20.8s | gpu=1.8s
    C:\Users\fbrev\Documents\Acadêmico\Simulações\Python\NoisyGL\predictor\Base_Predictor.py:114: UserWarning: expandable_segments not supported on this platform (Triggered internally at ..\c10/cuda/CUDAAllocatorConfig.h:28.)
    self.edge_index = self._cpu_edge_index.to(self.device)
    C:\Users\fbrev\Documents\Acadêmico\Simulações\Python\NoisyGL\predictor\Base_Predictor.py:144: UserWarning: Sparse CSR tensor support is in beta state. If you miss a functionality in the sparse tensor support, please submit a feature request to https://github.com/pytorch/pytorch/issues. (Triggered internally at ..\aten\src\ATen\SparseCsrTensorImpl.cpp:55.)
    self.adj_csr = self.adj.to_sparse_csr().to(self.device)
[I 2026-05-07 22:57:16,721] Trial 43 finished with value: 0.488 and parameters: {'lr': 0.005, 'weight_decay': 0.05, 'n_hidden': 128, 'n_layer': 2, 'dropout': 0.40012817630177666, 'knn_mode': 'd', 'k': 40, 'dexp': 2.9087881850163857, 'p_grd': 0.6332580165481645, 'unc_rem': 0.30768819291935345, 'unc_rel': 0.5825199716455909}. Best is trial 9 with value: 0.503.
    [CPU] Loading citeseer...
    DEBUG 3.1: Dataset init start
    DEBUG 3.2: prepare_data start citeseer
    ----Data statistics------'
    Name: citeseer
    #Nodes 3327
    #Edges 4552
    #Classes 6
    #Ave_degree 2.74
    ----Split statistics------'
    #Train samples 120 (default)
    #Val samples 500 (default)
    #Test samples 1000 (default)
    ----label noise information:------
    Instance dependent noise
    #Actual noise rate 0.41
    [cuda:0] LNPCC waiting for GPU slot...
    [cuda:0] Slot acquired (waited 164.1s). Starting GCN...
    FINAL_RESULT: {'acc': {'train': 1.0, 'valid': 0.33, 'test': 0.41}, 'wall_s': 15.54, 'cpu_s': 13.89, 'gpu_s': 1.63, 'wait_s': 164.1}
    [Time] wall=15.5s | cpu=13.9s | gpu=1.6s
    C:\Users\fbrev\Documents\Acadêmico\Simulações\Python\NoisyGL\predictor\Base_Predictor.py:114: UserWarning: expandable_segments not supported on this platform (Triggered internally at ..\c10/cuda/CUDAAllocatorConfig.h:28.)
    self.edge_index = self._cpu_edge_index.to(self.device)
    C:\Users\fbrev\Documents\Acadêmico\Simulações\Python\NoisyGL\predictor\Base_Predictor.py:144: UserWarning: Sparse CSR tensor support is in beta state. If you miss a functionality in the sparse tensor support, please submit a feature request to https://github.com/pytorch/pytorch/issues. (Triggered internally at ..\aten\src\ATen\SparseCsrTensorImpl.cpp:55.)
    self.adj_csr = self.adj.to_sparse_csr().to(self.device)
[I 2026-05-07 23:00:21,763] Trial 44 finished with value: 0.41 and parameters: {'lr': 0.005, 'weight_decay': 0.0001, 'n_hidden': 128, 'n_layer': 2, 'dropout': 0.6233064532705161, 'knn_mode': 'd', 'k': 39, 'dexp': 7.583496407291848, 'p_grd': 0.7237596894227342, 'unc_rem': 0.327943651289541, 'unc_rel': 0.031186314169099005}. Best is trial 9 with value: 0.503.
    [CPU] Loading citeseer...
    DEBUG 3.1: Dataset init start
    DEBUG 3.2: prepare_data start citeseer
    ----Data statistics------'
    Name: citeseer
    #Nodes 3327
    #Edges 4552
    #Classes 6
    #Ave_degree 2.74
    ----Split statistics------'
    #Train samples 120 (default)
    #Val samples 500 (default)
    #Test samples 1000 (default)
    ----label noise information:------
    Instance dependent noise
    #Actual noise rate 0.41
    [cuda:0] LNPCC waiting for GPU slot...
    [cuda:0] Slot acquired (waited 166.3s). Starting GCN...
    FINAL_RESULT: {'acc': {'train': 0.9333333333333333, 'valid': 0.374, 'test': 0.488}, 'wall_s': 16.82, 'cpu_s': 15.27, 'gpu_s': 1.53, 'wait_s': 166.3}
    [Time] wall=16.8s | cpu=15.3s | gpu=1.5s
    C:\Users\fbrev\Documents\Acadêmico\Simulações\Python\NoisyGL\predictor\Base_Predictor.py:114: UserWarning: expandable_segments not supported on this platform (Triggered internally at ..\c10/cuda/CUDAAllocatorConfig.h:28.)
    self.edge_index = self._cpu_edge_index.to(self.device)
    C:\Users\fbrev\Documents\Acadêmico\Simulações\Python\NoisyGL\predictor\Base_Predictor.py:144: UserWarning: Sparse CSR tensor support is in beta state. If you miss a functionality in the sparse tensor support, please submit a feature request to https://github.com/pytorch/pytorch/issues. (Triggered internally at ..\aten\src\ATen\SparseCsrTensorImpl.cpp:55.)
    self.adj_csr = self.adj.to_sparse_csr().to(self.device)
[I 2026-05-07 23:03:30,700] Trial 45 finished with value: 0.488 and parameters: {'lr': 0.005, 'weight_decay': 0.05, 'n_hidden': 32, 'n_layer': 2, 'dropout': 0.5216377893430688, 'knn_mode': 'd', 'k': 47, 'dexp': 6.952154237103958, 'p_grd': 0.5895792034993145, 'unc_rem': 0.22743409780180546, 'unc_rel': 0.6287310639513863}. Best is trial 9 with value: 0.503.
    [CPU] Loading citeseer...
    DEBUG 3.1: Dataset init start
    DEBUG 3.2: prepare_data start citeseer
    ----Data statistics------'
    Name: citeseer
    #Nodes 3327
    #Edges 4552
    #Classes 6
    #Ave_degree 2.74
    ----Split statistics------'
    #Train samples 120 (default)
    #Val samples 500 (default)
    #Test samples 1000 (default)
    ----label noise information:------
    Instance dependent noise
    #Actual noise rate 0.41
    [cuda:0] LNPCC waiting for GPU slot...
    [cuda:0] Slot acquired (waited 969.5s). Starting GCN...
    FINAL_RESULT: {'acc': {'train': 0.975, 'valid': 0.38, 'test': 0.476}, 'wall_s': 10.73, 'cpu_s': 9.2, 'gpu_s': 1.5, 'wait_s': 969.48}
    [Time] wall=10.7s | cpu=9.2s | gpu=1.5s
    C:\Users\fbrev\Documents\Acadêmico\Simulações\Python\NoisyGL\predictor\Base_Predictor.py:114: UserWarning: expandable_segments not supported on this platform (Triggered internally at ..\c10/cuda/CUDAAllocatorConfig.h:28.)
    self.edge_index = self._cpu_edge_index.to(self.device)
    C:\Users\fbrev\Documents\Acadêmico\Simulações\Python\NoisyGL\predictor\Base_Predictor.py:144: UserWarning: Sparse CSR tensor support is in beta state. If you miss a functionality in the sparse tensor support, please submit a feature request to https://github.com/pytorch/pytorch/issues. (Triggered internally at ..\aten\src\ATen\SparseCsrTensorImpl.cpp:55.)
    self.adj_csr = self.adj.to_sparse_csr().to(self.device)
[I 2026-05-07 23:19:57,387] Trial 46 finished with value: 0.476 and parameters: {'lr': 0.05, 'weight_decay': 0.05, 'n_hidden': 128, 'n_layer': 2, 'dropout': 0.2732073552365665, 'knn_mode': 's', 'k': 42, 'dexp': 4.384229228454895, 'p_grd': 0.6456680878321538, 'unc_rem': 0.8005921940276886, 'unc_rel': 0.5435769584144615}. Best is trial 9 with value: 0.503.
    [CPU] Loading citeseer...
    DEBUG 3.1: Dataset init start
    DEBUG 3.2: prepare_data start citeseer
    ----Data statistics------'
    Name: citeseer
    #Nodes 3327
    #Edges 4552
    #Classes 6
    #Ave_degree 2.74
    ----Split statistics------'
    #Train samples 120 (default)
    #Val samples 500 (default)
    #Test samples 1000 (default)
    ----label noise information:------
    Instance dependent noise
    #Actual noise rate 0.41
    [cuda:0] LNPCC waiting for GPU slot...
    [cuda:0] Slot acquired (waited 223.0s). Starting GCN...
    FINAL_RESULT: {'acc': {'train': 0.9166666666666666, 'valid': 0.324, 'test': 0.418}, 'wall_s': 15.89, 'cpu_s': 13.63, 'gpu_s': 2.23, 'wait_s': 223.01}
    [Time] wall=15.9s | cpu=13.6s | gpu=2.2s
    C:\Users\fbrev\Documents\Acadêmico\Simulações\Python\NoisyGL\predictor\Base_Predictor.py:114: UserWarning: expandable_segments not supported on this platform (Triggered internally at ..\c10/cuda/CUDAAllocatorConfig.h:28.)
    self.edge_index = self._cpu_edge_index.to(self.device)
    C:\Users\fbrev\Documents\Acadêmico\Simulações\Python\NoisyGL\predictor\Base_Predictor.py:144: UserWarning: Sparse CSR tensor support is in beta state. If you miss a functionality in the sparse tensor support, please submit a feature request to https://github.com/pytorch/pytorch/issues. (Triggered internally at ..\aten\src\ATen\SparseCsrTensorImpl.cpp:55.)
    self.adj_csr = self.adj.to_sparse_csr().to(self.device)
