[I 2026-05-01 02:53:44,487] Trial 83 finished with value: 0.785 and parameters: {'lr': 0.001, 'weight_decay': 0.01, 'n_hidden': 32, 'n_layer': 2, 'dropout': 0.6154844363561, 'knn_mode': 's', 'k': 43, 'dexp': 6.106283600260228, 'p_grd': 0.9446108359427912, 'unc_rem': 0.7660008690253258, 'unc_rel': 0.7450127722055347}. Best is trial 74 with value: 0.797.
    [CPU] Loading amazoncom...
    DEBUG 3.1: Dataset init start
    DEBUG 3.2: prepare_data start amazoncom
    ----Data statistics------'
    Name: amazoncom
    #Nodes 13752
    #Edges 245861
    #Classes 10
    #Ave_degree 35.76
    ----Split statistics------'
    #Train samples 200 (20 nodes per class)
    #Val samples 500 (specified)
    #Test samples 1000 (specified)
    ----label noise information:------
    Instance dependent noise
    #Actual noise rate 0.40
    [cuda:1] LNPCC waiting for GPU slot...
    [cuda:1] Slot acquired (waited 635.9s). Starting GCN...
    FINAL_RESULT: {'acc': {'train': 0.6262626262626263, 'valid': 0.49, 'test': 0.757}, 'wall_s': 49.86, 'cpu_s': 46.76, 'gpu_s': 3.02, 'wait_s': 635.94}
    [Time] wall=49.9s | cpu=46.8s | gpu=3.0s
    C:\Users\fbrev\Documents\Acadêmico\Simulações\Python\NoisyGL\predictor\Base_Predictor.py:144: UserWarning: Sparse CSR tensor support is in beta state. If you miss a functionality in the sparse tensor support, please submit a feature request to https://github.com/pytorch/pytorch/issues. (Triggered internally at ..\aten\src\ATen\SparseCsrTensorImpl.cpp:55.)
    self.adj_csr = self.adj.to_sparse_csr().to(self.device)
[I 2026-05-01 03:05:16,090] Trial 84 finished with value: 0.757 and parameters: {'lr': 0.001, 'weight_decay': 0.01, 'n_hidden': 32, 'n_layer': 2, 'dropout': 0.717484212065381, 'knn_mode': 's', 'k': 43, 'dexp': 5.804192413363933, 'p_grd': 0.9331520632886047, 'unc_rem': 0.7299864629947563, 'unc_rel': 0.7562590530026354}. Best is trial 74 with value: 0.797.
    [CPU] Loading amazoncom...
    DEBUG 3.1: Dataset init start
    DEBUG 3.2: prepare_data start amazoncom
    ----Data statistics------'
    Name: amazoncom
    #Nodes 13752
    #Edges 245861
    #Classes 10
    #Ave_degree 35.76
    ----Split statistics------'
    #Train samples 200 (20 nodes per class)
    #Val samples 500 (specified)
    #Test samples 1000 (specified)
    ----label noise information:------
    Instance dependent noise
    #Actual noise rate 0.40
    [cuda:1] LNPCC waiting for GPU slot...
    [cuda:1] Slot acquired (waited 76.7s). Starting GCN...
    FINAL_RESULT: {'acc': {'train': 0.6363636363636364, 'valid': 0.492, 'test': 0.777}, 'wall_s': 54.72, 'cpu_s': 51.69, 'gpu_s': 2.95, 'wait_s': 76.68}
    [Time] wall=54.7s | cpu=51.7s | gpu=3.0s
    C:\Users\fbrev\Documents\Acadêmico\Simulações\Python\NoisyGL\predictor\Base_Predictor.py:144: UserWarning: Sparse CSR tensor support is in beta state. If you miss a functionality in the sparse tensor support, please submit a feature request to https://github.com/pytorch/pytorch/issues. (Triggered internally at ..\aten\src\ATen\SparseCsrTensorImpl.cpp:55.)
    self.adj_csr = self.adj.to_sparse_csr().to(self.device)
[I 2026-05-01 03:07:33,105] Trial 85 finished with value: 0.777 and parameters: {'lr': 0.001, 'weight_decay': 0.01, 'n_hidden': 32, 'n_layer': 2, 'dropout': 0.6182061799752163, 'knn_mode': 's', 'k': 45, 'dexp': 6.132029814416905, 'p_grd': 0.8984759646413589, 'unc_rem': 0.664264727083902, 'unc_rel': 0.7289983266202865}. Best is trial 74 with value: 0.797.
    [CPU] Loading amazoncom...
    DEBUG 3.1: Dataset init start
    DEBUG 3.2: prepare_data start amazoncom
    ----Data statistics------'
    Name: amazoncom
    #Nodes 13752
    #Edges 245861
    #Classes 10
    #Ave_degree 35.76
    ----Split statistics------'
    #Train samples 200 (20 nodes per class)
    #Val samples 500 (specified)
    #Test samples 1000 (specified)
    ----label noise information:------
    Instance dependent noise
    #Actual noise rate 0.40
    [cuda:1] LNPCC waiting for GPU slot...
    [cuda:1] Slot acquired (waited 637.2s). Starting GCN...
    FINAL_RESULT: {'acc': {'train': 0.5909090909090909, 'valid': 0.496, 'test': 0.787}, 'wall_s': 53.31, 'cpu_s': 50.37, 'gpu_s': 2.86, 'wait_s': 637.24}
    [Time] wall=53.3s | cpu=50.4s | gpu=2.9s
    C:\Users\fbrev\Documents\Acadêmico\Simulações\Python\NoisyGL\predictor\Base_Predictor.py:144: UserWarning: Sparse CSR tensor support is in beta state. If you miss a functionality in the sparse tensor support, please submit a feature request to https://github.com/pytorch/pytorch/issues. (Triggered internally at ..\aten\src\ATen\SparseCsrTensorImpl.cpp:55.)
    self.adj_csr = self.adj.to_sparse_csr().to(self.device)
[I 2026-05-01 03:19:08,858] Trial 86 finished with value: 0.787 and parameters: {'lr': 0.001, 'weight_decay': 0.01, 'n_hidden': 32, 'n_layer': 2, 'dropout': 0.6165843994671615, 'knn_mode': 's', 'k': 44, 'dexp': 4.626050217830509, 'p_grd': 0.9583545345834704, 'unc_rem': 0.7702634166073912, 'unc_rel': 0.8617328850326534}. Best is trial 74 with value: 0.797.
    [CPU] Loading amazoncom...
    DEBUG 3.1: Dataset init start
    DEBUG 3.2: prepare_data start amazoncom
    ----Data statistics------'
    Name: amazoncom
    #Nodes 13752
    #Edges 245861
    #Classes 10
    #Ave_degree 35.76
    ----Split statistics------'
    #Train samples 200 (20 nodes per class)
    #Val samples 500 (specified)
    #Test samples 1000 (specified)
    ----label noise information:------
    Instance dependent noise
    #Actual noise rate 0.40
    [cuda:1] LNPCC waiting for GPU slot...
    [cuda:1] Slot acquired (waited 251.3s). Starting GCN...
    FINAL_RESULT: {'acc': {'train': 0.6565656565656566, 'valid': 0.494, 'test': 0.777}, 'wall_s': 51.13, 'cpu_s': 48.16, 'gpu_s': 2.88, 'wait_s': 251.33}
    [Time] wall=51.1s | cpu=48.2s | gpu=2.9s
    C:\Users\fbrev\Documents\Acadêmico\Simulações\Python\NoisyGL\predictor\Base_Predictor.py:144: UserWarning: Sparse CSR tensor support is in beta state. If you miss a functionality in the sparse tensor support, please submit a feature request to https://github.com/pytorch/pytorch/issues. (Triggered internally at ..\aten\src\ATen\SparseCsrTensorImpl.cpp:55.)
    self.adj_csr = self.adj.to_sparse_csr().to(self.device)
[I 2026-05-01 03:24:16,808] Trial 87 finished with value: 0.777 and parameters: {'lr': 0.001, 'weight_decay': 0.01, 'n_hidden': 32, 'n_layer': 2, 'dropout': 0.6680587386134773, 'knn_mode': 's', 'k': 44, 'dexp': 4.661028193802339, 'p_grd': 0.953935357059887, 'unc_rem': 0.6659822912695545, 'unc_rel': 0.9301517555509333}. Best is trial 74 with value: 0.797.
    [CPU] Loading amazoncom...
    DEBUG 3.1: Dataset init start
    DEBUG 3.2: prepare_data start amazoncom
    ----Data statistics------'
    Name: amazoncom
    #Nodes 13752
    #Edges 245861
    #Classes 10
    #Ave_degree 35.76
    ----Split statistics------'
    #Train samples 200 (20 nodes per class)
    #Val samples 500 (specified)
    #Test samples 1000 (specified)
    ----label noise information:------
    Instance dependent noise
    #Actual noise rate 0.40
    [cuda:1] LNPCC waiting for GPU slot...
    [cuda:1] Slot acquired (waited 371.2s). Starting GCN...
    FINAL_RESULT: {'acc': {'train': 0.6616161616161617, 'valid': 0.496, 'test': 0.792}, 'wall_s': 55.55, 'cpu_s': 52.72, 'gpu_s': 2.73, 'wait_s': 371.21}
    [Time] wall=55.5s | cpu=52.7s | gpu=2.7s
    C:\Users\fbrev\Documents\Acadêmico\Simulações\Python\NoisyGL\predictor\Base_Predictor.py:144: UserWarning: Sparse CSR tensor support is in beta state. If you miss a functionality in the sparse tensor support, please submit a feature request to https://github.com/pytorch/pytorch/issues. (Triggered internally at ..\aten\src\ATen\SparseCsrTensorImpl.cpp:55.)
    self.adj_csr = self.adj.to_sparse_csr().to(self.device)
[I 2026-05-01 03:31:29,067] Trial 88 finished with value: 0.792 and parameters: {'lr': 0.001, 'weight_decay': 0.01, 'n_hidden': 32, 'n_layer': 2, 'dropout': 0.655301921698624, 'knn_mode': 's', 'k': 44, 'dexp': 4.572337651589363, 'p_grd': 0.9622985860618494, 'unc_rem': 0.76882536053134, 'unc_rel': 0.9051371024703578}. Best is trial 74 with value: 0.797.
    [CPU] Loading amazoncom...
    DEBUG 3.1: Dataset init start
    DEBUG 3.2: prepare_data start amazoncom
    ----Data statistics------'
    Name: amazoncom
    #Nodes 13752
    #Edges 245861
    #Classes 10
    #Ave_degree 35.76
    ----Split statistics------'
    #Train samples 200 (20 nodes per class)
    #Val samples 500 (specified)
    #Test samples 1000 (specified)
    ----label noise information:------
    Instance dependent noise
    #Actual noise rate 0.40
    [cuda:1] LNPCC waiting for GPU slot...
    [cuda:1] Slot acquired (waited 75.4s). Starting GCN...
    FINAL_RESULT: {'acc': {'train': 0.5757575757575758, 'valid': 0.488, 'test': 0.785}, 'wall_s': 51.76, 'cpu_s': 48.76, 'gpu_s': 2.89, 'wait_s': 75.37}
    [Time] wall=51.8s | cpu=48.8s | gpu=2.9s
    C:\Users\fbrev\Documents\Acadêmico\Simulações\Python\NoisyGL\predictor\Base_Predictor.py:144: UserWarning: Sparse CSR tensor support is in beta state. If you miss a functionality in the sparse tensor support, please submit a feature request to https://github.com/pytorch/pytorch/issues. (Triggered internally at ..\aten\src\ATen\SparseCsrTensorImpl.cpp:55.)
    self.adj_csr = self.adj.to_sparse_csr().to(self.device)
[I 2026-05-01 03:33:41,850] Trial 89 finished with value: 0.785 and parameters: {'lr': 0.001, 'weight_decay': 0.01, 'n_hidden': 32, 'n_layer': 2, 'dropout': 0.6485783109478553, 'knn_mode': 's', 'k': 40, 'dexp': 5.0893059609680575, 'p_grd': 0.8960970847953815, 'unc_rem': 0.7619515717792351, 'unc_rel': 0.8899947570344677}. Best is trial 74 with value: 0.797.
    [CPU] Loading amazoncom...
    DEBUG 3.1: Dataset init start
    DEBUG 3.2: prepare_data start amazoncom
    ----Data statistics------'
    Name: amazoncom
    #Nodes 13752
    #Edges 245861
    #Classes 10
    #Ave_degree 35.76
    ----Split statistics------'
    #Train samples 200 (20 nodes per class)
    #Val samples 500 (specified)
    #Test samples 1000 (specified)
    ----label noise information:------
    Instance dependent noise
    #Actual noise rate 0.40
    [cuda:1] LNPCC waiting for GPU slot...
    [cuda:1] Slot acquired (waited 361.7s). Starting GCN...
    FINAL_RESULT: {'acc': {'train': 0.6363636363636364, 'valid': 0.492, 'test': 0.783}, 'wall_s': 52.7, 'cpu_s': 49.71, 'gpu_s': 2.89, 'wait_s': 361.7}
    [Time] wall=52.7s | cpu=49.7s | gpu=2.9s
    C:\Users\fbrev\Documents\Acadêmico\Simulações\Python\NoisyGL\predictor\Base_Predictor.py:144: UserWarning: Sparse CSR tensor support is in beta state. If you miss a functionality in the sparse tensor support, please submit a feature request to https://github.com/pytorch/pytorch/issues. (Triggered internally at ..\aten\src\ATen\SparseCsrTensorImpl.cpp:55.)
    self.adj_csr = self.adj.to_sparse_csr().to(self.device)
[I 2026-05-01 03:40:41,387] Trial 90 finished with value: 0.783 and parameters: {'lr': 0.001, 'weight_decay': 0.01, 'n_hidden': 32, 'n_layer': 2, 'dropout': 0.7042849760154458, 'knn_mode': 's', 'k': 38, 'dexp': 5.098816063212514, 'p_grd': 0.9231447855034305, 'unc_rem': 0.7693447111842042, 'unc_rel': 0.8795748559770973}. Best is trial 74 with value: 0.797.
    [CPU] Loading amazoncom...
    DEBUG 3.1: Dataset init start
    DEBUG 3.2: prepare_data start amazoncom
    ----Data statistics------'
    Name: amazoncom
    #Nodes 13752
    #Edges 245861
    #Classes 10
    #Ave_degree 35.76
    ----Split statistics------'
    #Train samples 200 (20 nodes per class)
    #Val samples 500 (specified)
    #Test samples 1000 (specified)
    ----label noise information:------
    Instance dependent noise
    #Actual noise rate 0.40
    [cuda:1] LNPCC waiting for GPU slot...
    [cuda:1] Slot acquired (waited 212.2s). Starting GCN...
    FINAL_RESULT: {'acc': {'train': 0.5606060606060606, 'valid': 0.49, 'test': 0.771}, 'wall_s': 44.93, 'cpu_s': 42.0, 'gpu_s': 2.83, 'wait_s': 212.16}
    [Time] wall=44.9s | cpu=42.0s | gpu=2.8s
    C:\Users\fbrev\Documents\Acadêmico\Simulações\Python\NoisyGL\predictor\Base_Predictor.py:144: UserWarning: Sparse CSR tensor support is in beta state. If you miss a functionality in the sparse tensor support, please submit a feature request to https://github.com/pytorch/pytorch/issues. (Triggered internally at ..\aten\src\ATen\SparseCsrTensorImpl.cpp:55.)
    self.adj_csr = self.adj.to_sparse_csr().to(self.device)
