[I 2026-05-06 16:01:07,974] Trial 35 finished with value: 0.559 and parameters: {'lr': 0.05, 'weight_decay': 0.0, 'n_hidden': 32, 'n_layer': 3, 'dropout': 0.3583435969671002, 'knn_mode': 'd', 'k': 46, 'dexp': 3.0288371526204383, 'p_grd': 0.6929209644627523, 'unc_rem': 0.33411980219744064, 'unc_rel': 0.7604436912782908}. Best is trial 32 with value: 0.561.
    [CPU] Loading pubmed...
    DEBUG 3.1: Dataset init start
    DEBUG 3.2: prepare_data start pubmed
    ----Data statistics------'
    Name: pubmed
    #Nodes 19717
    #Edges 44324
    #Classes 3
    #Ave_degree 4.50
    ----Split statistics------'
    #Train samples 60 (default)
    #Val samples 500 (default)
    #Test samples 1000 (default)
    ----label noise information:------
    Instance dependent noise
    #Actual noise rate 0.50
    [cuda:0] LNPCC waiting for GPU slot...
    [cuda:0] Slot acquired (waited 1.2s). Starting GCN...
    FINAL_RESULT: {'acc': {'train': 0.6666666666666666, 'valid': 0.354, 'test': 0.55}, 'wall_s': 39.94, 'cpu_s': 37.37, 'gpu_s': 2.54, 'wait_s': 1.22}
    [Time] wall=39.9s | cpu=37.4s | gpu=2.5s
    C:\Users\fbrev\Documents\Acadêmico\Simulações\Python\NoisyGL\predictor\Base_Predictor.py:114: UserWarning: expandable_segments not supported on this platform (Triggered internally at ..\c10/cuda/CUDAAllocatorConfig.h:28.)
    self.edge_index = self._cpu_edge_index.to(self.device)
    C:\Users\fbrev\Documents\Acadêmico\Simulações\Python\NoisyGL\predictor\Base_Predictor.py:144: UserWarning: Sparse CSR tensor support is in beta state. If you miss a functionality in the sparse tensor support, please submit a feature request to https://github.com/pytorch/pytorch/issues. (Triggered internally at ..\aten\src\ATen\SparseCsrTensorImpl.cpp:55.)
    self.adj_csr = self.adj.to_sparse_csr().to(self.device)
[I 2026-05-06 16:01:55,014] Trial 36 finished with value: 0.55 and parameters: {'lr': 0.05, 'weight_decay': 0.0, 'n_hidden': 32, 'n_layer': 3, 'dropout': 0.3711012160115696, 'knn_mode': 'd', 'k': 45, 'dexp': 3.0453732397764885, 'p_grd': 0.7017947345239566, 'unc_rem': 0.24524651852888213, 'unc_rel': 0.7757289967263861}. Best is trial 32 with value: 0.561.
    [CPU] Loading pubmed...
    DEBUG 3.1: Dataset init start
    DEBUG 3.2: prepare_data start pubmed
    ----Data statistics------'
    Name: pubmed
    #Nodes 19717
    #Edges 44324
    #Classes 3
    #Ave_degree 4.50
    ----Split statistics------'
    #Train samples 60 (default)
    #Val samples 500 (default)
    #Test samples 1000 (default)
    ----label noise information:------
    Instance dependent noise
    #Actual noise rate 0.50
    [cuda:0] LNPCC waiting for GPU slot...
    [cuda:0] Slot acquired (waited 0.0s). Starting GCN...
    FINAL_RESULT: {'acc': {'train': 0.3, 'valid': 0.3, 'test': 0.413}, 'wall_s': 41.98, 'cpu_s': 38.94, 'gpu_s': 3.01, 'wait_s': 0.0}
    [Time] wall=42.0s | cpu=38.9s | gpu=3.0s
    C:\Users\fbrev\Documents\Acadêmico\Simulações\Python\NoisyGL\predictor\Base_Predictor.py:114: UserWarning: expandable_segments not supported on this platform (Triggered internally at ..\c10/cuda/CUDAAllocatorConfig.h:28.)
    self.edge_index = self._cpu_edge_index.to(self.device)
    C:\Users\fbrev\Documents\Acadêmico\Simulações\Python\NoisyGL\predictor\Base_Predictor.py:144: UserWarning: Sparse CSR tensor support is in beta state. If you miss a functionality in the sparse tensor support, please submit a feature request to https://github.com/pytorch/pytorch/issues. (Triggered internally at ..\aten\src\ATen\SparseCsrTensorImpl.cpp:55.)
    self.adj_csr = self.adj.to_sparse_csr().to(self.device)
[I 2026-05-06 16:02:42,813] Trial 37 finished with value: 0.413 and parameters: {'lr': 0.05, 'weight_decay': 0.05, 'n_hidden': 32, 'n_layer': 3, 'dropout': 0.5550742123842686, 'knn_mode': 'd', 'k': 47, 'dexp': 1.688996309776851, 'p_grd': 0.8169679093283377, 'unc_rem': 0.3363645030512473, 'unc_rel': 0.9196487916639479}. Best is trial 32 with value: 0.561.
    [CPU] Loading pubmed...
    DEBUG 3.1: Dataset init start
    DEBUG 3.2: prepare_data start pubmed
    ----Data statistics------'
    Name: pubmed
    #Nodes 19717
    #Edges 44324
    #Classes 3
    #Ave_degree 4.50
    ----Split statistics------'
    #Train samples 60 (default)
    #Val samples 500 (default)
    #Test samples 1000 (default)
    ----label noise information:------
    Instance dependent noise
    #Actual noise rate 0.50
    [cuda:0] LNPCC waiting for GPU slot...
    [cuda:0] Slot acquired (waited 0.0s). Starting GCN...
    FINAL_RESULT: {'acc': {'train': 0.6166666666666667, 'valid': 0.352, 'test': 0.561}, 'wall_s': 35.91, 'cpu_s': 33.25, 'gpu_s': 2.62, 'wait_s': 0.0}
    [Time] wall=35.9s | cpu=33.2s | gpu=2.6s
    C:\Users\fbrev\Documents\Acadêmico\Simulações\Python\NoisyGL\predictor\Base_Predictor.py:114: UserWarning: expandable_segments not supported on this platform (Triggered internally at ..\c10/cuda/CUDAAllocatorConfig.h:28.)
    self.edge_index = self._cpu_edge_index.to(self.device)
    C:\Users\fbrev\Documents\Acadêmico\Simulações\Python\NoisyGL\predictor\Base_Predictor.py:144: UserWarning: Sparse CSR tensor support is in beta state. If you miss a functionality in the sparse tensor support, please submit a feature request to https://github.com/pytorch/pytorch/issues. (Triggered internally at ..\aten\src\ATen\SparseCsrTensorImpl.cpp:55.)
    self.adj_csr = self.adj.to_sparse_csr().to(self.device)
[I 2026-05-06 16:03:25,380] Trial 38 finished with value: 0.561 and parameters: {'lr': 0.05, 'weight_decay': 0.0, 'n_hidden': 32, 'n_layer': 3, 'dropout': 0.45701619704287466, 'knn_mode': 'd', 'k': 50, 'dexp': 5.736026302094246, 'p_grd': 0.7639744062543169, 'unc_rem': 0.20294443099629994, 'unc_rel': 0.6871213287164591}. Best is trial 32 with value: 0.561.
    [CPU] Loading pubmed...
    DEBUG 3.1: Dataset init start
    DEBUG 3.2: prepare_data start pubmed
    ----Data statistics------'
    Name: pubmed
    #Nodes 19717
    #Edges 44324
    #Classes 3
    #Ave_degree 4.50
    ----Split statistics------'
    #Train samples 60 (default)
    #Val samples 500 (default)
    #Test samples 1000 (default)
    ----label noise information:------
    Instance dependent noise
    #Actual noise rate 0.50
    [cuda:0] LNPCC waiting for GPU slot...
    [cuda:0] Slot acquired (waited 5.9s). Starting GCN...
    FINAL_RESULT: {'acc': {'train': 0.6333333333333333, 'valid': 0.358, 'test': 0.54}, 'wall_s': 37.31, 'cpu_s': 34.51, 'gpu_s': 2.75, 'wait_s': 5.9}
    [Time] wall=37.3s | cpu=34.5s | gpu=2.8s
    C:\Users\fbrev\Documents\Acadêmico\Simulações\Python\NoisyGL\predictor\Base_Predictor.py:114: UserWarning: expandable_segments not supported on this platform (Triggered internally at ..\c10/cuda/CUDAAllocatorConfig.h:28.)
    self.edge_index = self._cpu_edge_index.to(self.device)
    C:\Users\fbrev\Documents\Acadêmico\Simulações\Python\NoisyGL\predictor\Base_Predictor.py:144: UserWarning: Sparse CSR tensor support is in beta state. If you miss a functionality in the sparse tensor support, please submit a feature request to https://github.com/pytorch/pytorch/issues. (Triggered internally at ..\aten\src\ATen\SparseCsrTensorImpl.cpp:55.)
    self.adj_csr = self.adj.to_sparse_csr().to(self.device)
[I 2026-05-06 16:04:14,730] Trial 39 finished with value: 0.54 and parameters: {'lr': 0.05, 'weight_decay': 0.0, 'n_hidden': 32, 'n_layer': 3, 'dropout': 0.456097257164789, 'knn_mode': 'd', 'k': 40, 'dexp': 7.092906163874039, 'p_grd': 0.7637271023672924, 'unc_rem': 0.22243209924005364, 'unc_rel': 0.6992561039552425}. Best is trial 32 with value: 0.561.
    [CPU] Loading pubmed...
    DEBUG 3.1: Dataset init start
    DEBUG 3.2: prepare_data start pubmed
    ----Data statistics------'
    Name: pubmed
    #Nodes 19717
    #Edges 44324
    #Classes 3
    #Ave_degree 4.50
    ----Split statistics------'
    #Train samples 60 (default)
    #Val samples 500 (default)
    #Test samples 1000 (default)
    ----label noise information:------
    Instance dependent noise
    #Actual noise rate 0.50
    [cuda:0] LNPCC waiting for GPU slot...
    [cuda:0] Slot acquired (waited 0.0s). Starting GCN...
    FINAL_RESULT: {'acc': {'train': 0.9830508474576272, 'valid': 0.376, 'test': 0.468}, 'wall_s': 36.24, 'cpu_s': 33.52, 'gpu_s': 2.68, 'wait_s': 0.0}
    [Time] wall=36.2s | cpu=33.5s | gpu=2.7s
    C:\Users\fbrev\Documents\Acadêmico\Simulações\Python\NoisyGL\predictor\Base_Predictor.py:114: UserWarning: expandable_segments not supported on this platform (Triggered internally at ..\c10/cuda/CUDAAllocatorConfig.h:28.)
    self.edge_index = self._cpu_edge_index.to(self.device)
    C:\Users\fbrev\Documents\Acadêmico\Simulações\Python\NoisyGL\predictor\Base_Predictor.py:144: UserWarning: Sparse CSR tensor support is in beta state. If you miss a functionality in the sparse tensor support, please submit a feature request to https://github.com/pytorch/pytorch/issues. (Triggered internally at ..\aten\src\ATen\SparseCsrTensorImpl.cpp:55.)
    self.adj_csr = self.adj.to_sparse_csr().to(self.device)
[I 2026-05-06 16:04:57,167] Trial 40 finished with value: 0.468 and parameters: {'lr': 0.05, 'weight_decay': 0.0, 'n_hidden': 32, 'n_layer': 3, 'dropout': 0.4660277942336638, 'knn_mode': 'd', 'k': 50, 'dexp': 5.426555736343396, 'p_grd': 0.5509284076755662, 'unc_rem': 0.022841820086480724, 'unc_rel': 0.600517465989584}. Best is trial 32 with value: 0.561.
    [CPU] Loading pubmed...
    DEBUG 3.1: Dataset init start
    DEBUG 3.2: prepare_data start pubmed
    ----Data statistics------'
    Name: pubmed
    #Nodes 19717
    #Edges 44324
    #Classes 3
    #Ave_degree 4.50
    ----Split statistics------'
    #Train samples 60 (default)
    #Val samples 500 (default)
    #Test samples 1000 (default)
    ----label noise information:------
    Instance dependent noise
    #Actual noise rate 0.50
    [cuda:0] LNPCC waiting for GPU slot...
    [cuda:0] Slot acquired (waited 0.0s). Starting GCN...
    FINAL_RESULT: {'acc': {'train': 0.9833333333333333, 'valid': 0.368, 'test': 0.432}, 'wall_s': 37.8, 'cpu_s': 35.21, 'gpu_s': 2.55, 'wait_s': 0.0}
    [Time] wall=37.8s | cpu=35.2s | gpu=2.6s
    C:\Users\fbrev\Documents\Acadêmico\Simulações\Python\NoisyGL\predictor\Base_Predictor.py:114: UserWarning: expandable_segments not supported on this platform (Triggered internally at ..\c10/cuda/CUDAAllocatorConfig.h:28.)
    self.edge_index = self._cpu_edge_index.to(self.device)
    C:\Users\fbrev\Documents\Acadêmico\Simulações\Python\NoisyGL\predictor\Base_Predictor.py:144: UserWarning: Sparse CSR tensor support is in beta state. If you miss a functionality in the sparse tensor support, please submit a feature request to https://github.com/pytorch/pytorch/issues. (Triggered internally at ..\aten\src\ATen\SparseCsrTensorImpl.cpp:55.)
    self.adj_csr = self.adj.to_sparse_csr().to(self.device)
[I 2026-05-06 16:05:41,565] Trial 41 finished with value: 0.432 and parameters: {'lr': 0.05, 'weight_decay': 0.0, 'n_hidden': 32, 'n_layer': 3, 'dropout': 0.38104606404143865, 'knn_mode': 'd', 'k': 48, 'dexp': 4.468559627756613, 'p_grd': 0.6698236860130624, 'unc_rem': 0.33339687316933786, 'unc_rel': 0.7531560629775076}. Best is trial 32 with value: 0.561.
    [CPU] Loading pubmed...
    DEBUG 3.1: Dataset init start
    DEBUG 3.2: prepare_data start pubmed
    ----Data statistics------'
    Name: pubmed
    #Nodes 19717
    #Edges 44324
    #Classes 3
    #Ave_degree 4.50
    ----Split statistics------'
    #Train samples 60 (default)
    #Val samples 500 (default)
    #Test samples 1000 (default)
    ----label noise information:------
    Instance dependent noise
    #Actual noise rate 0.50
    [cuda:0] LNPCC waiting for GPU slot...
    [cuda:0] Slot acquired (waited 0.0s). Starting GCN...
    FINAL_RESULT: {'acc': {'train': 0.6166666666666667, 'valid': 0.37, 'test': 0.558}, 'wall_s': 36.49, 'cpu_s': 33.76, 'gpu_s': 2.69, 'wait_s': 0.0}
    [Time] wall=36.5s | cpu=33.8s | gpu=2.7s
    C:\Users\fbrev\Documents\Acadêmico\Simulações\Python\NoisyGL\predictor\Base_Predictor.py:114: UserWarning: expandable_segments not supported on this platform (Triggered internally at ..\c10/cuda/CUDAAllocatorConfig.h:28.)
    self.edge_index = self._cpu_edge_index.to(self.device)
    C:\Users\fbrev\Documents\Acadêmico\Simulações\Python\NoisyGL\predictor\Base_Predictor.py:144: UserWarning: Sparse CSR tensor support is in beta state. If you miss a functionality in the sparse tensor support, please submit a feature request to https://github.com/pytorch/pytorch/issues. (Triggered internally at ..\aten\src\ATen\SparseCsrTensorImpl.cpp:55.)
    self.adj_csr = self.adj.to_sparse_csr().to(self.device)
[I 2026-05-06 16:06:24,377] Trial 42 finished with value: 0.558 and parameters: {'lr': 0.05, 'weight_decay': 0.0, 'n_hidden': 32, 'n_layer': 3, 'dropout': 0.5383800689047806, 'knn_mode': 'd', 'k': 44, 'dexp': 5.627900740773204, 'p_grd': 0.7470543227345773, 'unc_rem': 0.1824829886136577, 'unc_rel': 0.48595714046801397}. Best is trial 32 with value: 0.561.
    [CPU] Loading pubmed...
    DEBUG 3.1: Dataset init start
    DEBUG 3.2: prepare_data start pubmed
    ----Data statistics------'
    Name: pubmed
    #Nodes 19717
    #Edges 44324
    #Classes 3
    #Ave_degree 4.50
    ----Split statistics------'
    #Train samples 60 (default)
    #Val samples 500 (default)
    #Test samples 1000 (default)
    ----label noise information:------
    Instance dependent noise
    #Actual noise rate 0.50
    [cuda:0] LNPCC waiting for GPU slot...
    [cuda:0] Slot acquired (waited 0.0s). Starting GCN...
    FINAL_RESULT: {'acc': {'train': 0.6833333333333333, 'valid': 0.352, 'test': 0.52}, 'wall_s': 37.53, 'cpu_s': 34.96, 'gpu_s': 2.53, 'wait_s': 0.0}
    [Time] wall=37.5s | cpu=35.0s | gpu=2.5s
    C:\Users\fbrev\Documents\Acadêmico\Simulações\Python\NoisyGL\predictor\Base_Predictor.py:114: UserWarning: expandable_segments not supported on this platform (Triggered internally at ..\c10/cuda/CUDAAllocatorConfig.h:28.)
    self.edge_index = self._cpu_edge_index.to(self.device)
    C:\Users\fbrev\Documents\Acadêmico\Simulações\Python\NoisyGL\predictor\Base_Predictor.py:144: UserWarning: Sparse CSR tensor support is in beta state. If you miss a functionality in the sparse tensor support, please submit a feature request to https://github.com/pytorch/pytorch/issues. (Triggered internally at ..\aten\src\ATen\SparseCsrTensorImpl.cpp:55.)
    self.adj_csr = self.adj.to_sparse_csr().to(self.device)
[I 2026-05-06 16:07:07,764] Trial 43 finished with value: 0.52 and parameters: {'lr': 0.005, 'weight_decay': 0.0, 'n_hidden': 32, 'n_layer': 3, 'dropout': 0.27723546778863073, 'knn_mode': 'd', 'k': 46, 'dexp': 4.919189395161111, 'p_grd': 0.672135948369285, 'unc_rem': 0.34965330181104615, 'unc_rel': 0.7331445427153862}. Best is trial 32 with value: 0.561.
    [CPU] Loading pubmed...
    DEBUG 3.1: Dataset init start
    DEBUG 3.2: prepare_data start pubmed
    ----Data statistics------'
    Name: pubmed
    #Nodes 19717
    #Edges 44324
    #Classes 3
    #Ave_degree 4.50
    ----Split statistics------'
    #Train samples 60 (default)
    #Val samples 500 (default)
    #Test samples 1000 (default)
    ----label noise information:------
    Instance dependent noise
    #Actual noise rate 0.50
    [cuda:0] LNPCC waiting for GPU slot...
    [cuda:0] Slot acquired (waited 0.0s). Starting GCN...
    FINAL_RESULT: {'acc': {'train': 0.6666666666666666, 'valid': 0.362, 'test': 0.558}, 'wall_s': 31.4, 'cpu_s': 28.85, 'gpu_s': 2.51, 'wait_s': 0.0}
    [Time] wall=31.4s | cpu=28.9s | gpu=2.5s
    C:\Users\fbrev\Documents\Acadêmico\Simulações\Python\NoisyGL\predictor\Base_Predictor.py:114: UserWarning: expandable_segments not supported on this platform (Triggered internally at ..\c10/cuda/CUDAAllocatorConfig.h:28.)
    self.edge_index = self._cpu_edge_index.to(self.device)
    C:\Users\fbrev\Documents\Acadêmico\Simulações\Python\NoisyGL\predictor\Base_Predictor.py:144: UserWarning: Sparse CSR tensor support is in beta state. If you miss a functionality in the sparse tensor support, please submit a feature request to https://github.com/pytorch/pytorch/issues. (Triggered internally at ..\aten\src\ATen\SparseCsrTensorImpl.cpp:55.)
    self.adj_csr = self.adj.to_sparse_csr().to(self.device)
[I 2026-05-06 16:07:45,487] Trial 44 finished with value: 0.558 and parameters: {'lr': 0.05, 'weight_decay': 0.0, 'n_hidden': 32, 'n_layer': 3, 'dropout': 0.3522193886960644, 'knn_mode': 'd', 'k': 50, 'dexp': 3.337810918358326, 'p_grd': 0.4395829988905487, 'unc_rem': 0.4524787036558232, 'unc_rel': 0.8950503680323127}. Best is trial 32 with value: 0.561.
    [CPU] Loading pubmed...
    DEBUG 3.1: Dataset init start
    DEBUG 3.2: prepare_data start pubmed
    ----Data statistics------'
    Name: pubmed
    #Nodes 19717
    #Edges 44324
    #Classes 3
    #Ave_degree 4.50
    ----Split statistics------'
    #Train samples 60 (default)
    #Val samples 500 (default)
    #Test samples 1000 (default)
    ----label noise information:------
    Instance dependent noise
    #Actual noise rate 0.50
    [cuda:0] LNPCC waiting for GPU slot...
    [cuda:0] Slot acquired (waited 1.6s). Starting GCN...
    FINAL_RESULT: {'acc': {'train': 1.0, 'valid': 0.392, 'test': 0.393}, 'wall_s': 36.31, 'cpu_s': 33.74, 'gpu_s': 2.53, 'wait_s': 1.58}
    [Time] wall=36.3s | cpu=33.7s | gpu=2.5s
    C:\Users\fbrev\Documents\Acadêmico\Simulações\Python\NoisyGL\predictor\Base_Predictor.py:114: UserWarning: expandable_segments not supported on this platform (Triggered internally at ..\c10/cuda/CUDAAllocatorConfig.h:28.)
    self.edge_index = self._cpu_edge_index.to(self.device)
    C:\Users\fbrev\Documents\Acadêmico\Simulações\Python\NoisyGL\predictor\Base_Predictor.py:144: UserWarning: Sparse CSR tensor support is in beta state. If you miss a functionality in the sparse tensor support, please submit a feature request to https://github.com/pytorch/pytorch/issues. (Triggered internally at ..\aten\src\ATen\SparseCsrTensorImpl.cpp:55.)
    self.adj_csr = self.adj.to_sparse_csr().to(self.device)
[I 2026-05-06 16:08:28,966] Trial 45 finished with value: 0.393 and parameters: {'lr': 0.05, 'weight_decay': 0.0001, 'n_hidden': 32, 'n_layer': 3, 'dropout': 0.22721020097853464, 'knn_mode': 'd', 'k': 43, 'dexp': 6.986385149499201, 'p_grd': 0.7995180142835971, 'unc_rem': 0.5333067114275736, 'unc_rel': 0.7957501321002762}. Best is trial 32 with value: 0.561.
    [CPU] Loading pubmed...
    DEBUG 3.1: Dataset init start
    DEBUG 3.2: prepare_data start pubmed
    ----Data statistics------'
    Name: pubmed
    #Nodes 19717
    #Edges 44324
    #Classes 3
    #Ave_degree 4.50
    ----Split statistics------'
    #Train samples 60 (default)
    #Val samples 500 (default)
    #Test samples 1000 (default)
    ----label noise information:------
    Instance dependent noise
    #Actual noise rate 0.50
    [cuda:0] LNPCC waiting for GPU slot...
    [cuda:0] Slot acquired (waited 0.0s). Starting GCN...
    FINAL_RESULT: {'acc': {'train': 0.2222222222222222, 'valid': 0.3, 'test': 0.413}, 'wall_s': 36.09, 'cpu_s': 33.92, 'gpu_s': 2.13, 'wait_s': 0.0}
    [Time] wall=36.1s | cpu=33.9s | gpu=2.1s
    C:\Users\fbrev\Documents\Acadêmico\Simulações\Python\NoisyGL\predictor\Base_Predictor.py:114: UserWarning: expandable_segments not supported on this platform (Triggered internally at ..\c10/cuda/CUDAAllocatorConfig.h:28.)
    self.edge_index = self._cpu_edge_index.to(self.device)
    C:\Users\fbrev\Documents\Acadêmico\Simulações\Python\NoisyGL\predictor\Base_Predictor.py:144: UserWarning: Sparse CSR tensor support is in beta state. If you miss a functionality in the sparse tensor support, please submit a feature request to https://github.com/pytorch/pytorch/issues. (Triggered internally at ..\aten\src\ATen\SparseCsrTensorImpl.cpp:55.)
    self.adj_csr = self.adj.to_sparse_csr().to(self.device)
[I 2026-05-06 16:09:10,766] Trial 46 finished with value: 0.413 and parameters: {'lr': 0.05, 'weight_decay': 0.05, 'n_hidden': 32, 'n_layer': 2, 'dropout': 0.4842500542778392, 'knn_mode': 'd', 'k': 47, 'dexp': 0.30168301608069026, 'p_grd': 0.862758531890313, 'unc_rem': 0.2030549487038072, 'unc_rel': 0.9332597731148201}. Best is trial 32 with value: 0.561.
    [CPU] Loading pubmed...
    DEBUG 3.1: Dataset init start
    DEBUG 3.2: prepare_data start pubmed
    ----Data statistics------'
    Name: pubmed
    #Nodes 19717
    #Edges 44324
    #Classes 3
    #Ave_degree 4.50
    ----Split statistics------'
    #Train samples 60 (default)
    #Val samples 500 (default)
    #Test samples 1000 (default)
    ----label noise information:------
    Instance dependent noise
    #Actual noise rate 0.50
    [cuda:0] LNPCC waiting for GPU slot...
    [cuda:0] Slot acquired (waited 0.0s). Starting GCN...
    FINAL_RESULT: {'acc': {'train': 0.6666666666666666, 'valid': 0.344, 'test': 0.519}, 'wall_s': 29.09, 'cpu_s': 26.76, 'gpu_s': 2.3, 'wait_s': 0.0}
    [Time] wall=29.1s | cpu=26.8s | gpu=2.3s
    C:\Users\fbrev\Documents\Acadêmico\Simulações\Python\NoisyGL\predictor\Base_Predictor.py:114: UserWarning: expandable_segments not supported on this platform (Triggered internally at ..\c10/cuda/CUDAAllocatorConfig.h:28.)
    self.edge_index = self._cpu_edge_index.to(self.device)
    C:\Users\fbrev\Documents\Acadêmico\Simulações\Python\NoisyGL\predictor\Base_Predictor.py:144: UserWarning: Sparse CSR tensor support is in beta state. If you miss a functionality in the sparse tensor support, please submit a feature request to https://github.com/pytorch/pytorch/issues. (Triggered internally at ..\aten\src\ATen\SparseCsrTensorImpl.cpp:55.)
    self.adj_csr = self.adj.to_sparse_csr().to(self.device)
