[I 2026-05-01 00:41:22,950] Trial 70 finished with value: 0.827 and parameters: {'lr': 0.005, 'weight_decay': 0.01, 'n_hidden': 256, 'n_layer': 2, 'dropout': 0.5784704750038703, 'knn_mode': 's', 'k': 48, 'dexp': 8.35744574893879, 'p_grd': 0.5947629003046403, 'unc_rem': 0.8659914450640209, 'unc_rel': 0.3020264466194047}. Best is trial 63 with value: 0.832.
    [CPU] Loading amazoncom...
    DEBUG 3.1: Dataset init start
    DEBUG 3.2: prepare_data start amazoncom
    ----Data statistics------'
    Name: amazoncom
    #Nodes 13752
    #Edges 245861
    #Classes 10
    #Ave_degree 35.76
    ----Split statistics------'
    #Train samples 200 (20 nodes per class)
    #Val samples 500 (specified)
    #Test samples 1000 (specified)
    ----label noise information:------
    Instance dependent noise
    #Actual noise rate 0.20
    [cuda:0] LNPCC waiting for GPU slot...
    [cuda:0] Slot acquired (waited 251.1s). Starting GCN...
    FINAL_RESULT: {'acc': {'train': 0.7817258883248731, 'valid': 0.662, 'test': 0.82}, 'wall_s': 44.85, 'cpu_s': 36.52, 'gpu_s': 8.25, 'wait_s': 251.08}
    [Time] wall=44.8s | cpu=36.5s | gpu=8.2s
    C:\Users\fbrev\Documents\Acadêmico\Simulações\Python\NoisyGL\predictor\Base_Predictor.py:144: UserWarning: Sparse CSR tensor support is in beta state. If you miss a functionality in the sparse tensor support, please submit a feature request to https://github.com/pytorch/pytorch/issues. (Triggered internally at ..\aten\src\ATen\SparseCsrTensorImpl.cpp:55.)
    self.adj_csr = self.adj.to_sparse_csr().to(self.device)
[I 2026-05-01 00:46:24,597] Trial 71 finished with value: 0.82 and parameters: {'lr': 0.005, 'weight_decay': 0.01, 'n_hidden': 256, 'n_layer': 2, 'dropout': 0.5765519188559945, 'knn_mode': 's', 'k': 48, 'dexp': 2.6848687755062346, 'p_grd': 0.6048423017415402, 'unc_rem': 0.6680362469070156, 'unc_rel': 0.20757405694716508}. Best is trial 63 with value: 0.832.
    [CPU] Loading amazoncom...
    DEBUG 3.1: Dataset init start
    DEBUG 3.2: prepare_data start amazoncom
    ----Data statistics------'
    Name: amazoncom
    #Nodes 13752
    #Edges 245861
    #Classes 10
    #Ave_degree 35.76
    ----Split statistics------'
    #Train samples 200 (20 nodes per class)
    #Val samples 500 (specified)
    #Test samples 1000 (specified)
    ----label noise information:------
    Instance dependent noise
    #Actual noise rate 0.20
    [cuda:0] LNPCC waiting for GPU slot...
    [cuda:0] Slot acquired (waited 109.1s). Starting GCN...
    FINAL_RESULT: {'acc': {'train': 0.7676767676767676, 'valid': 0.658, 'test': 0.814}, 'wall_s': 42.26, 'cpu_s': 33.93, 'gpu_s': 8.26, 'wait_s': 109.09}
    [Time] wall=42.3s | cpu=33.9s | gpu=8.3s
    C:\Users\fbrev\Documents\Acadêmico\Simulações\Python\NoisyGL\predictor\Base_Predictor.py:144: UserWarning: Sparse CSR tensor support is in beta state. If you miss a functionality in the sparse tensor support, please submit a feature request to https://github.com/pytorch/pytorch/issues. (Triggered internally at ..\aten\src\ATen\SparseCsrTensorImpl.cpp:55.)
    self.adj_csr = self.adj.to_sparse_csr().to(self.device)
[I 2026-05-01 00:49:01,441] Trial 72 finished with value: 0.814 and parameters: {'lr': 0.005, 'weight_decay': 0.01, 'n_hidden': 256, 'n_layer': 2, 'dropout': 0.6207031451243197, 'knn_mode': 's', 'k': 50, 'dexp': 8.323603176747978, 'p_grd': 0.46267816692918334, 'unc_rem': 0.8647615728538043, 'unc_rel': 0.3100685826951707}. Best is trial 63 with value: 0.832.
    [CPU] Loading amazoncom...
    DEBUG 3.1: Dataset init start
    DEBUG 3.2: prepare_data start amazoncom
    ----Data statistics------'
    Name: amazoncom
    #Nodes 13752
    #Edges 245861
    #Classes 10
    #Ave_degree 35.76
    ----Split statistics------'
    #Train samples 200 (20 nodes per class)
    #Val samples 500 (specified)
    #Test samples 1000 (specified)
    ----label noise information:------
    Instance dependent noise
    #Actual noise rate 0.20
    [cuda:0] LNPCC waiting for GPU slot...
    [cuda:0] Slot acquired (waited 105.7s). Starting GCN...
    FINAL_RESULT: {'acc': {'train': 0.803030303030303, 'valid': 0.668, 'test': 0.83}, 'wall_s': 43.61, 'cpu_s': 35.35, 'gpu_s': 8.18, 'wait_s': 105.7}
    [Time] wall=43.6s | cpu=35.4s | gpu=8.2s
    C:\Users\fbrev\Documents\Acadêmico\Simulações\Python\NoisyGL\predictor\Base_Predictor.py:144: UserWarning: Sparse CSR tensor support is in beta state. If you miss a functionality in the sparse tensor support, please submit a feature request to https://github.com/pytorch/pytorch/issues. (Triggered internally at ..\aten\src\ATen\SparseCsrTensorImpl.cpp:55.)
    self.adj_csr = self.adj.to_sparse_csr().to(self.device)
[I 2026-05-01 00:51:37,130] Trial 73 finished with value: 0.83 and parameters: {'lr': 0.005, 'weight_decay': 0.01, 'n_hidden': 256, 'n_layer': 2, 'dropout': 0.5240230495180646, 'knn_mode': 's', 'k': 44, 'dexp': 8.781187533371773, 'p_grd': 0.573736454169239, 'unc_rem': 0.9250967907608963, 'unc_rel': 0.4126739895092025}. Best is trial 63 with value: 0.832.
    [CPU] Loading amazoncom...
    DEBUG 3.1: Dataset init start
    DEBUG 3.2: prepare_data start amazoncom
    ----Data statistics------'
    Name: amazoncom
    #Nodes 13752
    #Edges 245861
    #Classes 10
    #Ave_degree 35.76
    ----Split statistics------'
    #Train samples 200 (20 nodes per class)
    #Val samples 500 (specified)
    #Test samples 1000 (specified)
    ----label noise information:------
    Instance dependent noise
    #Actual noise rate 0.20
    [cuda:0] LNPCC waiting for GPU slot...
    [cuda:0] Slot acquired (waited 110.2s). Starting GCN...
    FINAL_RESULT: {'acc': {'train': 0.7626262626262627, 'valid': 0.662, 'test': 0.838}, 'wall_s': 43.47, 'cpu_s': 35.3, 'gpu_s': 8.08, 'wait_s': 110.21}
    [Time] wall=43.5s | cpu=35.3s | gpu=8.1s
    C:\Users\fbrev\Documents\Acadêmico\Simulações\Python\NoisyGL\predictor\Base_Predictor.py:144: UserWarning: Sparse CSR tensor support is in beta state. If you miss a functionality in the sparse tensor support, please submit a feature request to https://github.com/pytorch/pytorch/issues. (Triggered internally at ..\aten\src\ATen\SparseCsrTensorImpl.cpp:55.)
    self.adj_csr = self.adj.to_sparse_csr().to(self.device)
[I 2026-05-01 00:54:16,530] Trial 74 finished with value: 0.838 and parameters: {'lr': 0.005, 'weight_decay': 0.01, 'n_hidden': 256, 'n_layer': 2, 'dropout': 0.6667634177537245, 'knn_mode': 's', 'k': 44, 'dexp': 6.7226675523231085, 'p_grd': 0.5751855667502769, 'unc_rem': 0.9213095095286081, 'unc_rel': 0.4104199285877417}. Best is trial 74 with value: 0.838.
    [CPU] Loading amazoncom...
    DEBUG 3.1: Dataset init start
    DEBUG 3.2: prepare_data start amazoncom
    ----Data statistics------'
    Name: amazoncom
    #Nodes 13752
    #Edges 245861
    #Classes 10
    #Ave_degree 35.76
    ----Split statistics------'
    #Train samples 200 (20 nodes per class)
    #Val samples 500 (specified)
    #Test samples 1000 (specified)
    ----label noise information:------
    Instance dependent noise
    #Actual noise rate 0.20
    [cuda:0] LNPCC waiting for GPU slot...
    [cuda:0] Slot acquired (waited 245.1s). Starting GCN...
    FINAL_RESULT: {'acc': {'train': 0.7373737373737373, 'valid': 0.66, 'test': 0.833}, 'wall_s': 44.38, 'cpu_s': 36.04, 'gpu_s': 8.25, 'wait_s': 245.09}
    [Time] wall=44.4s | cpu=36.0s | gpu=8.3s
    C:\Users\fbrev\Documents\Acadêmico\Simulações\Python\NoisyGL\predictor\Base_Predictor.py:144: UserWarning: Sparse CSR tensor support is in beta state. If you miss a functionality in the sparse tensor support, please submit a feature request to https://github.com/pytorch/pytorch/issues. (Triggered internally at ..\aten\src\ATen\SparseCsrTensorImpl.cpp:55.)
    self.adj_csr = self.adj.to_sparse_csr().to(self.device)
[I 2026-05-01 00:59:11,694] Trial 75 finished with value: 0.833 and parameters: {'lr': 0.005, 'weight_decay': 0.01, 'n_hidden': 256, 'n_layer': 2, 'dropout': 0.6687376063688816, 'knn_mode': 's', 'k': 43, 'dexp': 6.777670995087492, 'p_grd': 0.5530298355360247, 'unc_rem': 0.9155613131024783, 'unc_rel': 0.3391195124858203}. Best is trial 74 with value: 0.838.
    [CPU] Loading amazoncom...
    DEBUG 3.1: Dataset init start
    DEBUG 3.2: prepare_data start amazoncom
    ----Data statistics------'
    Name: amazoncom
    #Nodes 13752
    #Edges 245861
    #Classes 10
    #Ave_degree 35.76
    ----Split statistics------'
    #Train samples 200 (20 nodes per class)
    #Val samples 500 (specified)
    #Test samples 1000 (specified)
    ----label noise information:------
    Instance dependent noise
    #Actual noise rate 0.20
    [cuda:0] LNPCC waiting for GPU slot...
    [cuda:0] Slot acquired (waited 87.7s). Starting GCN...
    FINAL_RESULT: {'acc': {'train': 0.71, 'valid': 0.662, 'test': 0.819}, 'wall_s': 56.35, 'cpu_s': 48.2, 'gpu_s': 8.06, 'wait_s': 87.74}
    [Time] wall=56.4s | cpu=48.2s | gpu=8.1s
    C:\Users\fbrev\Documents\Acadêmico\Simulações\Python\NoisyGL\predictor\Base_Predictor.py:144: UserWarning: Sparse CSR tensor support is in beta state. If you miss a functionality in the sparse tensor support, please submit a feature request to https://github.com/pytorch/pytorch/issues. (Triggered internally at ..\aten\src\ATen\SparseCsrTensorImpl.cpp:55.)
    self.adj_csr = self.adj.to_sparse_csr().to(self.device)
[I 2026-05-01 01:01:41,197] Trial 76 finished with value: 0.819 and parameters: {'lr': 0.005, 'weight_decay': 0.01, 'n_hidden': 256, 'n_layer': 2, 'dropout': 0.6754647999692588, 'knn_mode': 'd', 'k': 44, 'dexp': 6.713914116416255, 'p_grd': 0.5344798371121703, 'unc_rem': 0.8211097957613748, 'unc_rel': 0.28760528704922983}. Best is trial 74 with value: 0.838.
    [CPU] Loading amazoncom...
    DEBUG 3.1: Dataset init start
    DEBUG 3.2: prepare_data start amazoncom
    ----Data statistics------'
    Name: amazoncom
    #Nodes 13752
    #Edges 245861
    #Classes 10
    #Ave_degree 35.76
    ----Split statistics------'
    #Train samples 200 (20 nodes per class)
    #Val samples 500 (specified)
    #Test samples 1000 (specified)
    ----label noise information:------
    Instance dependent noise
    #Actual noise rate 0.20
    [cuda:0] LNPCC waiting for GPU slot...
    [cuda:0] Slot acquired (waited 101.3s). Starting GCN...
    FINAL_RESULT: {'acc': {'train': 0.1919191919191919, 'valid': 0.366, 'test': 0.419}, 'wall_s': 44.14, 'cpu_s': 35.6, 'gpu_s': 8.47, 'wait_s': 101.32}
    [Time] wall=44.1s | cpu=35.6s | gpu=8.5s
    C:\Users\fbrev\Documents\Acadêmico\Simulações\Python\NoisyGL\predictor\Base_Predictor.py:144: UserWarning: Sparse CSR tensor support is in beta state. If you miss a functionality in the sparse tensor support, please submit a feature request to https://github.com/pytorch/pytorch/issues. (Triggered internally at ..\aten\src\ATen\SparseCsrTensorImpl.cpp:55.)
    self.adj_csr = self.adj.to_sparse_csr().to(self.device)
[I 2026-05-01 01:04:12,128] Trial 77 finished with value: 0.419 and parameters: {'lr': 0.1, 'weight_decay': 0.0, 'n_hidden': 256, 'n_layer': 2, 'dropout': 0.7144971162442219, 'knn_mode': 's', 'k': 40, 'dexp': 6.081160201857096, 'p_grd': 0.5821789799246427, 'unc_rem': 0.7235152449756505, 'unc_rel': 0.34613963083455}. Best is trial 74 with value: 0.838.
    [CPU] Loading amazoncom...
    DEBUG 3.1: Dataset init start
    DEBUG 3.2: prepare_data start amazoncom
    ----Data statistics------'
    Name: amazoncom
    #Nodes 13752
    #Edges 245861
    #Classes 10
    #Ave_degree 35.76
    ----Split statistics------'
    #Train samples 200 (20 nodes per class)
    #Val samples 500 (specified)
    #Test samples 1000 (specified)
    ----label noise information:------
    Instance dependent noise
    #Actual noise rate 0.20
    [cuda:0] LNPCC waiting for GPU slot...
    [cuda:0] Slot acquired (waited 108.2s). Starting GCN...
    FINAL_RESULT: {'acc': {'train': 0.7373737373737373, 'valid': 0.656, 'test': 0.833}, 'wall_s': 47.73, 'cpu_s': 39.44, 'gpu_s': 8.22, 'wait_s': 108.19}
    [Time] wall=47.7s | cpu=39.4s | gpu=8.2s
    C:\Users\fbrev\Documents\Acadêmico\Simulações\Python\NoisyGL\predictor\Base_Predictor.py:144: UserWarning: Sparse CSR tensor support is in beta state. If you miss a functionality in the sparse tensor support, please submit a feature request to https://github.com/pytorch/pytorch/issues. (Triggered internally at ..\aten\src\ATen\SparseCsrTensorImpl.cpp:55.)
    self.adj_csr = self.adj.to_sparse_csr().to(self.device)
[I 2026-05-01 01:06:53,887] Trial 78 finished with value: 0.833 and parameters: {'lr': 0.005, 'weight_decay': 0.01, 'n_hidden': 256, 'n_layer': 2, 'dropout': 0.6553370711171715, 'knn_mode': 's', 'k': 49, 'dexp': 5.286721502512041, 'p_grd': 0.6498009048490587, 'unc_rem': 0.7634507075260135, 'unc_rel': 0.4018061086139843}. Best is trial 74 with value: 0.838.
    [CPU] Loading amazoncom...
    DEBUG 3.1: Dataset init start
    DEBUG 3.2: prepare_data start amazoncom
    ----Data statistics------'
    Name: amazoncom
    #Nodes 13752
    #Edges 245861
    #Classes 10
    #Ave_degree 35.76
    ----Split statistics------'
    #Train samples 200 (20 nodes per class)
    #Val samples 500 (specified)
    #Test samples 1000 (specified)
    ----label noise information:------
    Instance dependent noise
    #Actual noise rate 0.20
    [cuda:0] LNPCC waiting for GPU slot...
    [cuda:0] Slot acquired (waited 101.9s). Starting GCN...
    FINAL_RESULT: {'acc': {'train': 0.7070707070707071, 'valid': 0.64, 'test': 0.81}, 'wall_s': 49.21, 'cpu_s': 34.39, 'gpu_s': 14.74, 'wait_s': 101.88}
    [Time] wall=49.2s | cpu=34.4s | gpu=14.7s
    C:\Users\fbrev\Documents\Acadêmico\Simulações\Python\NoisyGL\predictor\Base_Predictor.py:144: UserWarning: Sparse CSR tensor support is in beta state. If you miss a functionality in the sparse tensor support, please submit a feature request to https://github.com/pytorch/pytorch/issues. (Triggered internally at ..\aten\src\ATen\SparseCsrTensorImpl.cpp:55.)
    self.adj_csr = self.adj.to_sparse_csr().to(self.device)
[I 2026-05-01 01:09:30,646] Trial 79 finished with value: 0.81 and parameters: {'lr': 0.005, 'weight_decay': 0.01, 'n_hidden': 256, 'n_layer': 3, 'dropout': 0.6617698508266596, 'knn_mode': 's', 'k': 48, 'dexp': 5.151871723101354, 'p_grd': 0.6291700657709801, 'unc_rem': 0.8642525231208369, 'unc_rel': 0.23612845997631493}. Best is trial 74 with value: 0.838.
    [CPU] Loading amazoncom...
    DEBUG 3.1: Dataset init start
    DEBUG 3.2: prepare_data start amazoncom
    ----Data statistics------'
    Name: amazoncom
    #Nodes 13752
    #Edges 245861
    #Classes 10
    #Ave_degree 35.76
    ----Split statistics------'
    #Train samples 200 (20 nodes per class)
    #Val samples 500 (specified)
    #Test samples 1000 (specified)
    ----label noise information:------
    Instance dependent noise
    #Actual noise rate 0.20
    [cuda:0] LNPCC waiting for GPU slot...
    [cuda:0] Slot acquired (waited 118.2s). Starting GCN...
    FINAL_RESULT: {'acc': {'train': 0.7309644670050761, 'valid': 0.666, 'test': 0.804}, 'wall_s': 34.41, 'cpu_s': 31.27, 'gpu_s': 3.07, 'wait_s': 118.22}
    [Time] wall=34.4s | cpu=31.3s | gpu=3.1s
    C:\Users\fbrev\Documents\Acadêmico\Simulações\Python\NoisyGL\predictor\Base_Predictor.py:144: UserWarning: Sparse CSR tensor support is in beta state. If you miss a functionality in the sparse tensor support, please submit a feature request to https://github.com/pytorch/pytorch/issues. (Triggered internally at ..\aten\src\ATen\SparseCsrTensorImpl.cpp:55.)
    self.adj_csr = self.adj.to_sparse_csr().to(self.device)
[I 2026-05-01 01:12:09,253] Trial 80 finished with value: 0.804 and parameters: {'lr': 0.005, 'weight_decay': 0.01, 'n_hidden': 32, 'n_layer': 2, 'dropout': 0.637917542471699, 'knn_mode': 's', 'k': 43, 'dexp': 5.810138274469176, 'p_grd': 0.4612583232901116, 'unc_rem': 0.792099760263674, 'unc_rel': 0.3925159787014119}. Best is trial 74 with value: 0.838.
    [CPU] Loading amazoncom...
    DEBUG 3.1: Dataset init start
    DEBUG 3.2: prepare_data start amazoncom
    ----Data statistics------'
    Name: amazoncom
    #Nodes 13752
    #Edges 245861
    #Classes 10
    #Ave_degree 35.76
    ----Split statistics------'
    #Train samples 200 (20 nodes per class)
    #Val samples 500 (specified)
    #Test samples 1000 (specified)
    ----label noise information:------
    Instance dependent noise
    #Actual noise rate 0.20
    [cuda:0] LNPCC waiting for GPU slot...
    [cuda:0] Slot acquired (waited 104.0s). Starting GCN...
    FINAL_RESULT: {'acc': {'train': 0.7828282828282829, 'valid': 0.656, 'test': 0.805}, 'wall_s': 39.01, 'cpu_s': 33.71, 'gpu_s': 5.21, 'wait_s': 103.99}
    [Time] wall=39.0s | cpu=33.7s | gpu=5.2s
    C:\Users\fbrev\Documents\Acadêmico\Simulações\Python\NoisyGL\predictor\Base_Predictor.py:144: UserWarning: Sparse CSR tensor support is in beta state. If you miss a functionality in the sparse tensor support, please submit a feature request to https://github.com/pytorch/pytorch/issues. (Triggered internally at ..\aten\src\ATen\SparseCsrTensorImpl.cpp:55.)
    self.adj_csr = self.adj.to_sparse_csr().to(self.device)
[I 2026-05-01 01:14:38,363] Trial 81 finished with value: 0.805 and parameters: {'lr': 0.001, 'weight_decay': 0.01, 'n_hidden': 128, 'n_layer': 2, 'dropout': 0.7278432122515084, 'knn_mode': 's', 'k': 41, 'dexp': 6.253732368324039, 'p_grd': 0.5558622738797797, 'unc_rem': 0.7593766960774873, 'unc_rel': 0.2692129157308666}. Best is trial 74 with value: 0.838.
    [CPU] Loading amazoncom...
    DEBUG 3.1: Dataset init start
    DEBUG 3.2: prepare_data start amazoncom
    ----Data statistics------'
    Name: amazoncom
    #Nodes 13752
    #Edges 245861
    #Classes 10
    #Ave_degree 35.76
    ----Split statistics------'
    #Train samples 200 (20 nodes per class)
    #Val samples 500 (specified)
    #Test samples 1000 (specified)
    ----label noise information:------
    Instance dependent noise
    #Actual noise rate 0.20
    [cuda:0] LNPCC waiting for GPU slot...
    [cuda:0] Slot acquired (waited 104.1s). Starting GCN...
    FINAL_RESULT: {'acc': {'train': 0.8080808080808081, 'valid': 0.664, 'test': 0.825}, 'wall_s': 47.51, 'cpu_s': 39.2, 'gpu_s': 8.24, 'wait_s': 104.12}
    [Time] wall=47.5s | cpu=39.2s | gpu=8.2s
    C:\Users\fbrev\Documents\Acadêmico\Simulações\Python\NoisyGL\predictor\Base_Predictor.py:144: UserWarning: Sparse CSR tensor support is in beta state. If you miss a functionality in the sparse tensor support, please submit a feature request to https://github.com/pytorch/pytorch/issues. (Triggered internally at ..\aten\src\ATen\SparseCsrTensorImpl.cpp:55.)
    self.adj_csr = self.adj.to_sparse_csr().to(self.device)
[I 2026-05-01 01:17:15,759] Trial 82 finished with value: 0.825 and parameters: {'lr': 0.005, 'weight_decay': 0.01, 'n_hidden': 256, 'n_layer': 2, 'dropout': 0.5943473104921229, 'knn_mode': 's', 'k': 49, 'dexp': 7.348222118372096, 'p_grd': 0.6840314150664565, 'unc_rem': 0.9177109141557094, 'unc_rel': 0.4140016589297974}. Best is trial 74 with value: 0.838.
    [CPU] Loading amazoncom...
    DEBUG 3.1: Dataset init start
    DEBUG 3.2: prepare_data start amazoncom
    ----Data statistics------'
    Name: amazoncom
    #Nodes 13752
    #Edges 245861
    #Classes 10
    #Ave_degree 35.76
    ----Split statistics------'
    #Train samples 200 (20 nodes per class)
    #Val samples 500 (specified)
    #Test samples 1000 (specified)
    ----label noise information:------
    Instance dependent noise
    #Actual noise rate 0.20
    [cuda:0] LNPCC waiting for GPU slot...
    [cuda:0] Slot acquired (waited 114.6s). Starting GCN...
    FINAL_RESULT: {'acc': {'train': 0.7727272727272727, 'valid': 0.666, 'test': 0.825}, 'wall_s': 45.5, 'cpu_s': 37.09, 'gpu_s': 8.33, 'wait_s': 114.58}
    [Time] wall=45.5s | cpu=37.1s | gpu=8.3s
    C:\Users\fbrev\Documents\Acadêmico\Simulações\Python\NoisyGL\predictor\Base_Predictor.py:144: UserWarning: Sparse CSR tensor support is in beta state. If you miss a functionality in the sparse tensor support, please submit a feature request to https://github.com/pytorch/pytorch/issues. (Triggered internally at ..\aten\src\ATen\SparseCsrTensorImpl.cpp:55.)
    self.adj_csr = self.adj.to_sparse_csr().to(self.device)
[I 2026-05-01 01:20:01,589] Trial 83 finished with value: 0.825 and parameters: {'lr': 0.005, 'weight_decay': 0.01, 'n_hidden': 256, 'n_layer': 2, 'dropout': 0.6921666695663428, 'knn_mode': 's', 'k': 46, 'dexp': 7.740985441962771, 'p_grd': 0.6561628303001422, 'unc_rem': 0.5403674011275037, 'unc_rel': 0.31908723384957133}. Best is trial 74 with value: 0.838.
    [CPU] Loading amazoncom...
    DEBUG 3.1: Dataset init start
    DEBUG 3.2: prepare_data start amazoncom
    ----Data statistics------'
    Name: amazoncom
    #Nodes 13752
    #Edges 245861
    #Classes 10
    #Ave_degree 35.76
    ----Split statistics------'
    #Train samples 200 (20 nodes per class)
    #Val samples 500 (specified)
    #Test samples 1000 (specified)
    ----label noise information:------
    Instance dependent noise
    #Actual noise rate 0.20
    [cuda:0] LNPCC waiting for GPU slot...
    [cuda:0] Slot acquired (waited 119.9s). Starting GCN...
    FINAL_RESULT: {'acc': {'train': 0.7157360406091371, 'valid': 0.658, 'test': 0.826}, 'wall_s': 37.12, 'cpu_s': 28.72, 'gpu_s': 8.32, 'wait_s': 119.94}
    [Time] wall=37.1s | cpu=28.7s | gpu=8.3s
    C:\Users\fbrev\Documents\Acadêmico\Simulações\Python\NoisyGL\predictor\Base_Predictor.py:144: UserWarning: Sparse CSR tensor support is in beta state. If you miss a functionality in the sparse tensor support, please submit a feature request to https://github.com/pytorch/pytorch/issues. (Triggered internally at ..\aten\src\ATen\SparseCsrTensorImpl.cpp:55.)
    self.adj_csr = self.adj.to_sparse_csr().to(self.device)
