[I 2026-04-30 16:23:14,319] Trial 27 finished with value: 0.382 and parameters: {'lr': 0.1, 'weight_decay': 0.0001, 'n_hidden': 256, 'n_layer': 2, 'dropout': 0.43014593012178237, 'knn_mode': 's', 'k': 11, 'dexp': 6.3400539919486585, 'p_grd': 0.9951604391622473, 'unc_rem': 0.6039718903859499, 'unc_rel': 0.742971781083387}. Best is trial 5 with value: 0.648.
    [CPU] Loading amazoncom...
    DEBUG 3.1: Dataset init start
    DEBUG 3.2: prepare_data start amazoncom
    ----Data statistics------'
    Name: amazoncom
    #Nodes 13752
    #Edges 245861
    #Classes 10
    #Ave_degree 35.76
    ----Split statistics------'
    #Train samples 200 (20 nodes per class)
    #Val samples 500 (specified)
    #Test samples 1000 (specified)
    ----label noise information:------
    Instance dependent noise
    #Actual noise rate 0.50
    [cuda:0] LNPCC waiting for GPU slot...
    [cuda:0] Slot acquired (waited 0.3s). Starting GCN...
    FINAL_RESULT: {'acc': {'train': 0.5939086294416244, 'valid': 0.4, 'test': 0.583}, 'wall_s': 51.58, 'cpu_s': 43.78, 'gpu_s': 7.73, 'wait_s': 0.3}
    [Time] wall=51.6s | cpu=43.8s | gpu=7.7s
    C:\Users\fbrev\Documents\Acadêmico\Simulações\Python\NoisyGL\predictor\Base_Predictor.py:144: UserWarning: Sparse CSR tensor support is in beta state. If you miss a functionality in the sparse tensor support, please submit a feature request to https://github.com/pytorch/pytorch/issues. (Triggered internally at ..\aten\src\ATen\SparseCsrTensorImpl.cpp:55.)
    self.adj_csr = self.adj.to_sparse_csr().to(self.device)
[I 2026-04-30 16:24:12,023] Trial 28 finished with value: 0.583 and parameters: {'lr': 0.01, 'weight_decay': 0.0001, 'n_hidden': 256, 'n_layer': 2, 'dropout': 0.5207456555046343, 'knn_mode': 's', 'k': 18, 'dexp': 3.77582761547269, 'p_grd': 0.8236403643551782, 'unc_rem': 0.5295287562432829, 'unc_rel': 0.43985192487082714}. Best is trial 5 with value: 0.648.
    [CPU] Loading amazoncom...
    DEBUG 3.1: Dataset init start
    DEBUG 3.2: prepare_data start amazoncom
    ----Data statistics------'
    Name: amazoncom
    #Nodes 13752
    #Edges 245861
    #Classes 10
    #Ave_degree 35.76
    ----Split statistics------'
    #Train samples 200 (20 nodes per class)
    #Val samples 500 (specified)
    #Test samples 1000 (specified)
    ----label noise information:------
    Instance dependent noise
    #Actual noise rate 0.50
    [cuda:0] LNPCC waiting for GPU slot...
    [cuda:0] Slot acquired (waited 0.0s). Starting GCN...
    FINAL_RESULT: {'acc': {'train': 0.6294416243654822, 'valid': 0.386, 'test': 0.645}, 'wall_s': 48.08, 'cpu_s': 40.09, 'gpu_s': 7.92, 'wait_s': 0.0}
    [Time] wall=48.1s | cpu=40.1s | gpu=7.9s
    C:\Users\fbrev\Documents\Acadêmico\Simulações\Python\NoisyGL\predictor\Base_Predictor.py:144: UserWarning: Sparse CSR tensor support is in beta state. If you miss a functionality in the sparse tensor support, please submit a feature request to https://github.com/pytorch/pytorch/issues. (Triggered internally at ..\aten\src\ATen\SparseCsrTensorImpl.cpp:55.)
    self.adj_csr = self.adj.to_sparse_csr().to(self.device)
[I 2026-04-30 16:25:06,118] Trial 29 finished with value: 0.645 and parameters: {'lr': 0.01, 'weight_decay': 0.0001, 'n_hidden': 256, 'n_layer': 2, 'dropout': 0.5656819134708136, 'knn_mode': 's', 'k': 18, 'dexp': 4.597925564516931, 'p_grd': 0.5930551552932956, 'unc_rem': 0.39049910721583386, 'unc_rel': 0.583720312358473}. Best is trial 5 with value: 0.648.
    [CPU] Loading amazoncom...
    DEBUG 3.1: Dataset init start
    DEBUG 3.2: prepare_data start amazoncom
    ----Data statistics------'
    Name: amazoncom
    #Nodes 13752
    #Edges 245861
    #Classes 10
    #Ave_degree 35.76
    ----Split statistics------'
    #Train samples 200 (20 nodes per class)
    #Val samples 500 (specified)
    #Test samples 1000 (specified)
    ----label noise information:------
    Instance dependent noise
    #Actual noise rate 0.50
    [cuda:0] LNPCC waiting for GPU slot...
    [cuda:0] Slot acquired (waited 5.5s). Starting GCN...
    FINAL_RESULT: {'acc': {'train': 0.6223404255319149, 'valid': 0.384, 'test': 0.638}, 'wall_s': 48.01, 'cpu_s': 40.02, 'gpu_s': 7.9, 'wait_s': 5.54}
    [Time] wall=48.0s | cpu=40.0s | gpu=7.9s
    C:\Users\fbrev\Documents\Acadêmico\Simulações\Python\NoisyGL\predictor\Base_Predictor.py:144: UserWarning: Sparse CSR tensor support is in beta state. If you miss a functionality in the sparse tensor support, please submit a feature request to https://github.com/pytorch/pytorch/issues. (Triggered internally at ..\aten\src\ATen\SparseCsrTensorImpl.cpp:55.)
    self.adj_csr = self.adj.to_sparse_csr().to(self.device)
[I 2026-04-30 16:26:06,280] Trial 30 finished with value: 0.638 and parameters: {'lr': 0.01, 'weight_decay': 0.0001, 'n_hidden': 256, 'n_layer': 2, 'dropout': 0.24397148010428993, 'knn_mode': 's', 'k': 29, 'dexp': 2.7832774738102017, 'p_grd': 0.46643279572500174, 'unc_rem': 0.42696214140361793, 'unc_rel': 0.5514169432782525}. Best is trial 5 with value: 0.648.
    [CPU] Loading amazoncom...
    DEBUG 3.1: Dataset init start
    DEBUG 3.2: prepare_data start amazoncom
    ----Data statistics------'
    Name: amazoncom
    #Nodes 13752
    #Edges 245861
    #Classes 10
    #Ave_degree 35.76
    ----Split statistics------'
    #Train samples 200 (20 nodes per class)
    #Val samples 500 (specified)
    #Test samples 1000 (specified)
    ----label noise information:------
    Instance dependent noise
    #Actual noise rate 0.50
    [cuda:0] LNPCC waiting for GPU slot...
    [cuda:0] Slot acquired (waited 0.0s). Starting GCN...
    FINAL_RESULT: {'acc': {'train': 0.7486910994764397, 'valid': 0.378, 'test': 0.57}, 'wall_s': 40.3, 'cpu_s': 32.37, 'gpu_s': 7.86, 'wait_s': 0.0}
    [Time] wall=40.3s | cpu=32.4s | gpu=7.9s
    C:\Users\fbrev\Documents\Acadêmico\Simulações\Python\NoisyGL\predictor\Base_Predictor.py:144: UserWarning: Sparse CSR tensor support is in beta state. If you miss a functionality in the sparse tensor support, please submit a feature request to https://github.com/pytorch/pytorch/issues. (Triggered internally at ..\aten\src\ATen\SparseCsrTensorImpl.cpp:55.)
    self.adj_csr = self.adj.to_sparse_csr().to(self.device)
[I 2026-04-30 16:26:52,719] Trial 31 finished with value: 0.57 and parameters: {'lr': 0.01, 'weight_decay': 0.0001, 'n_hidden': 256, 'n_layer': 2, 'dropout': 0.26349553998199393, 'knn_mode': 's', 'k': 28, 'dexp': 2.7630130089568063, 'p_grd': 0.49174027178790436, 'unc_rem': 0.43644637220523075, 'unc_rel': 0.5456002575933928}. Best is trial 5 with value: 0.648.
    [CPU] Loading amazoncom...
    DEBUG 3.1: Dataset init start
    DEBUG 3.2: prepare_data start amazoncom
    ----Data statistics------'
    Name: amazoncom
    #Nodes 13752
    #Edges 245861
    #Classes 10
    #Ave_degree 35.76
    ----Split statistics------'
    #Train samples 200 (20 nodes per class)
    #Val samples 500 (specified)
    #Test samples 1000 (specified)
    ----label noise information:------
    Instance dependent noise
    #Actual noise rate 0.50
    [cuda:0] LNPCC waiting for GPU slot...
    [cuda:0] Slot acquired (waited 0.0s). Starting GCN...
    FINAL_RESULT: {'acc': {'train': 0.8153846153846154, 'valid': 0.36, 'test': 0.541}, 'wall_s': 41.19, 'cpu_s': 33.41, 'gpu_s': 7.72, 'wait_s': 0.0}
    [Time] wall=41.2s | cpu=33.4s | gpu=7.7s
    C:\Users\fbrev\Documents\Acadêmico\Simulações\Python\NoisyGL\predictor\Base_Predictor.py:144: UserWarning: Sparse CSR tensor support is in beta state. If you miss a functionality in the sparse tensor support, please submit a feature request to https://github.com/pytorch/pytorch/issues. (Triggered internally at ..\aten\src\ATen\SparseCsrTensorImpl.cpp:55.)
    self.adj_csr = self.adj.to_sparse_csr().to(self.device)
[I 2026-04-30 16:27:39,494] Trial 32 finished with value: 0.541 and parameters: {'lr': 0.01, 'weight_decay': 0.0001, 'n_hidden': 256, 'n_layer': 2, 'dropout': 0.08222436539590755, 'knn_mode': 's', 'k': 34, 'dexp': 1.6864164905946422, 'p_grd': 0.5658256844764779, 'unc_rem': 0.4998575355383494, 'unc_rel': 0.6180993464158726}. Best is trial 5 with value: 0.648.
    [CPU] Loading amazoncom...
    DEBUG 3.1: Dataset init start
    DEBUG 3.2: prepare_data start amazoncom
    ----Data statistics------'
    Name: amazoncom
    #Nodes 13752
    #Edges 245861
    #Classes 10
    #Ave_degree 35.76
    ----Split statistics------'
    #Train samples 200 (20 nodes per class)
    #Val samples 500 (specified)
    #Test samples 1000 (specified)
    ----label noise information:------
    Instance dependent noise
    #Actual noise rate 0.50
    [cuda:0] LNPCC waiting for GPU slot...
    [cuda:0] Slot acquired (waited 0.0s). Starting GCN...
    FINAL_RESULT: {'acc': {'train': 0.6345177664974619, 'valid': 0.366, 'test': 0.561}, 'wall_s': 37.8, 'cpu_s': 30.05, 'gpu_s': 7.68, 'wait_s': 0.0}
    [Time] wall=37.8s | cpu=30.1s | gpu=7.7s
    C:\Users\fbrev\Documents\Acadêmico\Simulações\Python\NoisyGL\predictor\Base_Predictor.py:144: UserWarning: Sparse CSR tensor support is in beta state. If you miss a functionality in the sparse tensor support, please submit a feature request to https://github.com/pytorch/pytorch/issues. (Triggered internally at ..\aten\src\ATen\SparseCsrTensorImpl.cpp:55.)
    self.adj_csr = self.adj.to_sparse_csr().to(self.device)
[I 2026-04-30 16:28:23,170] Trial 33 finished with value: 0.561 and parameters: {'lr': 0.01, 'weight_decay': 0.0001, 'n_hidden': 256, 'n_layer': 2, 'dropout': 0.24511303080650523, 'knn_mode': 's', 'k': 36, 'dexp': 4.443751937651787, 'p_grd': 0.4170304128876329, 'unc_rem': 0.35040020171826786, 'unc_rel': 0.5107542671629882}. Best is trial 5 with value: 0.648.
    [CPU] Loading amazoncom...
    DEBUG 3.1: Dataset init start
    DEBUG 3.2: prepare_data start amazoncom
    ----Data statistics------'
    Name: amazoncom
    #Nodes 13752
    #Edges 245861
    #Classes 10
    #Ave_degree 35.76
    ----Split statistics------'
    #Train samples 200 (20 nodes per class)
    #Val samples 500 (specified)
    #Test samples 1000 (specified)
    ----label noise information:------
    Instance dependent noise
    #Actual noise rate 0.50
    [cuda:0] LNPCC waiting for GPU slot...
    [cuda:0] Slot acquired (waited 6.6s). Starting GCN...
    FINAL_RESULT: {'acc': {'train': 0.5663265306122449, 'valid': 0.38, 'test': 0.566}, 'wall_s': 52.35, 'cpu_s': 43.9, 'gpu_s': 8.36, 'wait_s': 6.59}
    [Time] wall=52.4s | cpu=43.9s | gpu=8.4s
    C:\Users\fbrev\Documents\Acadêmico\Simulações\Python\NoisyGL\predictor\Base_Predictor.py:144: UserWarning: Sparse CSR tensor support is in beta state. If you miss a functionality in the sparse tensor support, please submit a feature request to https://github.com/pytorch/pytorch/issues. (Triggered internally at ..\aten\src\ATen\SparseCsrTensorImpl.cpp:55.)
    self.adj_csr = self.adj.to_sparse_csr().to(self.device)
[I 2026-04-30 16:29:28,360] Trial 34 finished with value: 0.566 and parameters: {'lr': 0.01, 'weight_decay': 0.0001, 'n_hidden': 256, 'n_layer': 2, 'dropout': 0.3553932527986174, 'knn_mode': 's', 'k': 29, 'dexp': 3.030828835889196, 'p_grd': 0.6645929566538936, 'unc_rem': 0.6772691242130822, 'unc_rel': 0.002688191501131282}. Best is trial 5 with value: 0.648.
    [CPU] Loading amazoncom...
    DEBUG 3.1: Dataset init start
    DEBUG 3.2: prepare_data start amazoncom
    ----Data statistics------'
    Name: amazoncom
    #Nodes 13752
    #Edges 245861
    #Classes 10
    #Ave_degree 35.76
    ----Split statistics------'
    #Train samples 200 (20 nodes per class)
    #Val samples 500 (specified)
    #Test samples 1000 (specified)
    ----label noise information:------
    Instance dependent noise
    #Actual noise rate 0.50
    [cuda:0] LNPCC waiting for GPU slot...
    [cuda:0] Slot acquired (waited 0.0s). Starting GCN...
    FINAL_RESULT: {'acc': {'train': 0.2578947368421053, 'valid': 0.242, 'test': 0.134}, 'wall_s': 52.67, 'cpu_s': 38.07, 'gpu_s': 14.52, 'wait_s': 0.0}
    [Time] wall=52.7s | cpu=38.1s | gpu=14.5s
    C:\Users\fbrev\Documents\Acadêmico\Simulações\Python\NoisyGL\predictor\Base_Predictor.py:144: UserWarning: Sparse CSR tensor support is in beta state. If you miss a functionality in the sparse tensor support, please submit a feature request to https://github.com/pytorch/pytorch/issues. (Triggered internally at ..\aten\src\ATen\SparseCsrTensorImpl.cpp:55.)
    self.adj_csr = self.adj.to_sparse_csr().to(self.device)
[I 2026-04-30 16:30:27,459] Trial 35 finished with value: 0.134 and parameters: {'lr': 0.01, 'weight_decay': 0.05, 'n_hidden': 256, 'n_layer': 3, 'dropout': 0.170237410253515, 'knn_mode': 's', 'k': 25, 'dexp': 1.7600778386717784, 'p_grd': 0.4692095415979688, 'unc_rem': 0.4560257181551815, 'unc_rel': 0.43201716142119445}. Best is trial 5 with value: 0.648.
    [CPU] Loading amazoncom...
    DEBUG 3.1: Dataset init start
    DEBUG 3.2: prepare_data start amazoncom
    ----Data statistics------'
    Name: amazoncom
    #Nodes 13752
    #Edges 245861
    #Classes 10
    #Ave_degree 35.76
    ----Split statistics------'
    #Train samples 200 (20 nodes per class)
    #Val samples 500 (specified)
    #Test samples 1000 (specified)
    ----label noise information:------
    Instance dependent noise
    #Actual noise rate 0.50
    [cuda:0] LNPCC waiting for GPU slot...
    [cuda:0] Slot acquired (waited 0.0s). Starting GCN...
    FINAL_RESULT: {'acc': {'train': 0.5076142131979695, 'valid': 0.366, 'test': 0.597}, 'wall_s': 40.93, 'cpu_s': 36.97, 'gpu_s': 3.86, 'wait_s': 0.0}
    [Time] wall=40.9s | cpu=37.0s | gpu=3.9s
    C:\Users\fbrev\Documents\Acadêmico\Simulações\Python\NoisyGL\predictor\Base_Predictor.py:144: UserWarning: Sparse CSR tensor support is in beta state. If you miss a functionality in the sparse tensor support, please submit a feature request to https://github.com/pytorch/pytorch/issues. (Triggered internally at ..\aten\src\ATen\SparseCsrTensorImpl.cpp:55.)
    self.adj_csr = self.adj.to_sparse_csr().to(self.device)
[I 2026-04-30 16:31:14,723] Trial 36 finished with value: 0.597 and parameters: {'lr': 0.01, 'weight_decay': 0.0001, 'n_hidden': 32, 'n_layer': 3, 'dropout': 0.45999821766105176, 'knn_mode': 's', 'k': 19, 'dexp': 3.2910625793759514, 'p_grd': 0.6145675353033628, 'unc_rem': 0.33671816233066904, 'unc_rel': 0.6822430888829366}. Best is trial 5 with value: 0.648.
    [CPU] Loading amazoncom...
    DEBUG 3.1: Dataset init start
    DEBUG 3.2: prepare_data start amazoncom
    ----Data statistics------'
    Name: amazoncom
    #Nodes 13752
    #Edges 245861
    #Classes 10
    #Ave_degree 35.76
    ----Split statistics------'
    #Train samples 200 (20 nodes per class)
    #Val samples 500 (specified)
    #Test samples 1000 (specified)
    ----label noise information:------
    Instance dependent noise
    #Actual noise rate 0.50
    [cuda:0] LNPCC waiting for GPU slot...
    [cuda:0] Slot acquired (waited 0.0s). Starting GCN...
    FINAL_RESULT: {'acc': {'train': 0.7540106951871658, 'valid': 0.304, 'test': 0.322}, 'wall_s': 37.24, 'cpu_s': 29.39, 'gpu_s': 7.76, 'wait_s': 0.0}
    [Time] wall=37.2s | cpu=29.4s | gpu=7.8s
    C:\Users\fbrev\Documents\Acadêmico\Simulações\Python\NoisyGL\predictor\Base_Predictor.py:144: UserWarning: Sparse CSR tensor support is in beta state. If you miss a functionality in the sparse tensor support, please submit a feature request to https://github.com/pytorch/pytorch/issues. (Triggered internally at ..\aten\src\ATen\SparseCsrTensorImpl.cpp:55.)
    self.adj_csr = self.adj.to_sparse_csr().to(self.device)
[I 2026-04-30 16:31:58,582] Trial 37 finished with value: 0.322 and parameters: {'lr': 0.01, 'weight_decay': 0.01, 'n_hidden': 256, 'n_layer': 2, 'dropout': 0.2892626414743646, 'knn_mode': 'd', 'k': 7, 'dexp': 0.6433493121947018, 'p_grd': 0.11765985926775197, 'unc_rem': 0.24445117654421933, 'unc_rel': 0.5692726236993408}. Best is trial 5 with value: 0.648.
    [CPU] Loading amazoncom...
    DEBUG 3.1: Dataset init start
    DEBUG 3.2: prepare_data start amazoncom
    ----Data statistics------'
    Name: amazoncom
    #Nodes 13752
    #Edges 245861
    #Classes 10
    #Ave_degree 35.76
    ----Split statistics------'
    #Train samples 200 (20 nodes per class)
    #Val samples 500 (specified)
    #Test samples 1000 (specified)
    ----label noise information:------
    Instance dependent noise
    #Actual noise rate 0.50
    [cuda:0] LNPCC waiting for GPU slot...
    [cuda:0] Slot acquired (waited 0.0s). Starting GCN...
    FINAL_RESULT: {'acc': {'train': 0.5707070707070707, 'valid': 0.378, 'test': 0.567}, 'wall_s': 38.44, 'cpu_s': 30.67, 'gpu_s': 7.69, 'wait_s': 0.0}
    [Time] wall=38.4s | cpu=30.7s | gpu=7.7s
    C:\Users\fbrev\Documents\Acadêmico\Simulações\Python\NoisyGL\predictor\Base_Predictor.py:144: UserWarning: Sparse CSR tensor support is in beta state. If you miss a functionality in the sparse tensor support, please submit a feature request to https://github.com/pytorch/pytorch/issues. (Triggered internally at ..\aten\src\ATen\SparseCsrTensorImpl.cpp:55.)
    self.adj_csr = self.adj.to_sparse_csr().to(self.device)
[I 2026-04-30 16:32:42,946] Trial 38 finished with value: 0.567 and parameters: {'lr': 0.01, 'weight_decay': 0.0, 'n_hidden': 128, 'n_layer': 3, 'dropout': 0.21610303137818337, 'knn_mode': 's', 'k': 39, 'dexp': 5.148639825751442, 'p_grd': 0.5096784743176164, 'unc_rem': 0.08169140347399911, 'unc_rel': 0.6047389408588252}. Best is trial 5 with value: 0.648.
    [CPU] Loading amazoncom...
    DEBUG 3.1: Dataset init start
    DEBUG 3.2: prepare_data start amazoncom
    ----Data statistics------'
    Name: amazoncom
    #Nodes 13752
    #Edges 245861
    #Classes 10
    #Ave_degree 35.76
    ----Split statistics------'
    #Train samples 200 (20 nodes per class)
    #Val samples 500 (specified)
    #Test samples 1000 (specified)
    ----label noise information:------
    Instance dependent noise
    #Actual noise rate 0.50
    [cuda:0] LNPCC waiting for GPU slot...
    [cuda:0] Slot acquired (waited 0.0s). Starting GCN...
    FINAL_RESULT: {'acc': {'train': 0.6237113402061856, 'valid': 0.374, 'test': 0.666}, 'wall_s': 37.46, 'cpu_s': 29.38, 'gpu_s': 8.01, 'wait_s': 0.0}
    [Time] wall=37.5s | cpu=29.4s | gpu=8.0s
    C:\Users\fbrev\Documents\Acadêmico\Simulações\Python\NoisyGL\predictor\Base_Predictor.py:144: UserWarning: Sparse CSR tensor support is in beta state. If you miss a functionality in the sparse tensor support, please submit a feature request to https://github.com/pytorch/pytorch/issues. (Triggered internally at ..\aten\src\ATen\SparseCsrTensorImpl.cpp:55.)
    self.adj_csr = self.adj.to_sparse_csr().to(self.device)
[I 2026-04-30 16:33:25,921] Trial 39 finished with value: 0.666 and parameters: {'lr': 0.01, 'weight_decay': 0.0001, 'n_hidden': 256, 'n_layer': 2, 'dropout': 0.726310990465952, 'knn_mode': 's', 'k': 16, 'dexp': 4.409291791882954, 'p_grd': 0.33777913239865814, 'unc_rem': 0.18543063989719344, 'unc_rel': 0.5019746282152808}. Best is trial 39 with value: 0.666.
    [CPU] Loading amazoncom...
    DEBUG 3.1: Dataset init start
    DEBUG 3.2: prepare_data start amazoncom
    ----Data statistics------'
    Name: amazoncom
    #Nodes 13752
    #Edges 245861
    #Classes 10
    #Ave_degree 35.76
    ----Split statistics------'
    #Train samples 200 (20 nodes per class)
    #Val samples 500 (specified)
    #Test samples 1000 (specified)
    ----label noise information:------
    Instance dependent noise
    #Actual noise rate 0.50
    [cuda:0] LNPCC waiting for GPU slot...
    [cuda:0] Slot acquired (waited 0.0s). Starting GCN...
    FINAL_RESULT: {'acc': {'train': 0.13131313131313133, 'valid': 0.228, 'test': 0.379}, 'wall_s': 48.9, 'cpu_s': 44.99, 'gpu_s': 3.82, 'wait_s': 0.0}
    [Time] wall=48.9s | cpu=45.0s | gpu=3.8s
    C:\Users\fbrev\Documents\Acadêmico\Simulações\Python\NoisyGL\predictor\Base_Predictor.py:144: UserWarning: Sparse CSR tensor support is in beta state. If you miss a functionality in the sparse tensor support, please submit a feature request to https://github.com/pytorch/pytorch/issues. (Triggered internally at ..\aten\src\ATen\SparseCsrTensorImpl.cpp:55.)
    self.adj_csr = self.adj.to_sparse_csr().to(self.device)
[I 2026-04-30 16:34:21,437] Trial 40 finished with value: 0.379 and parameters: {'lr': 0.05, 'weight_decay': 0.05, 'n_hidden': 32, 'n_layer': 3, 'dropout': 0.6784238772088569, 'knn_mode': 'd', 'k': 8, 'dexp': 4.467248839599361, 'p_grd': 0.37300942593694947, 'unc_rem': 0.19159366024299612, 'unc_rel': 0.468662417652342}. Best is trial 39 with value: 0.666.
    [CPU] Loading amazoncom...
    DEBUG 3.1: Dataset init start
    DEBUG 3.2: prepare_data start amazoncom
    ----Data statistics------'
    Name: amazoncom
    #Nodes 13752
    #Edges 245861
    #Classes 10
    #Ave_degree 35.76
    ----Split statistics------'
    #Train samples 200 (20 nodes per class)
    #Val samples 500 (specified)
    #Test samples 1000 (specified)
    ----label noise information:------
    Instance dependent noise
    #Actual noise rate 0.50
    [cuda:0] LNPCC waiting for GPU slot...
    [cuda:0] Slot acquired (waited 0.0s). Starting GCN...
    FINAL_RESULT: {'acc': {'train': 0.5519125683060109, 'valid': 0.382, 'test': 0.637}, 'wall_s': 47.39, 'cpu_s': 39.06, 'gpu_s': 8.25, 'wait_s': 0.0}
    [Time] wall=47.4s | cpu=39.1s | gpu=8.3s
    C:\Users\fbrev\Documents\Acadêmico\Simulações\Python\NoisyGL\predictor\Base_Predictor.py:144: UserWarning: Sparse CSR tensor support is in beta state. If you miss a functionality in the sparse tensor support, please submit a feature request to https://github.com/pytorch/pytorch/issues. (Triggered internally at ..\aten\src\ATen\SparseCsrTensorImpl.cpp:55.)
    self.adj_csr = self.adj.to_sparse_csr().to(self.device)
